title,contentid,cat1,cat2,cat3,firstimage,region,mapx,mapy,overview,homepage
리움 미술관,130525,인문(문화/예술/역사),문화시설,미술관/화랑,,서울특별시,126.9987921858,37.5385800812,"삼성문화재단은 1965년 설립 이래로 한국문화예술 발전을 위해 기여해 왔다. 삼성그룹의 창립자 고(故) 호암 이병철 회장께서 각별한 애정을 가지고 수집한 한국의 문화재와 미술품을 기반으로 호암미술관과 호암갤러리, 로댕갤러리를 운영해 왔다. 이후 창립자의 뜻을 이어 이건희 회장께서도 한국미술사를 기록할 수 있는 중요한 유물들을 수집·보강하고, 한국의 근·현대작가뿐만 아니라 세계적인 현대미술가들의 작품을 수집하는 일에 노력을 기울여 왔다. 리움 미술관은 우리나라 고미술품 전시를 위한 ‘MUSEUM 1’과 한국과 외국의 근·현대미술품 전시를 위한 ‘MUSEUM 2’로 이루어져 있다. 또한 이 미술관들은 미래의 주역들을 위한 또 다른 가능성으로 기여하게 될 삼성아동교육문화센터와 더불어 복합문화단지를 이루게 된다. 이렇듯, 과거와 현재, 그리고 미래의 예술과 문화를 아우르게 될 삼성미술관 리움(Leeum)의 건축은 세계적인 건축가 마리오 보타, 장 누벨, 렘 쿨하스의 작품으로, 한 대지 안에 세 작가의 개성이 조화롭게 표현된 예술작품으로서의 미술관 건축물을 감상할 수 있다. 도심 속 자연을 느낄 수 있는 남산 자락에 세워진 리움 미술관은 국립중앙박물관, 국립극장과 더불어 서울 도심의 핵심문화시설을 이어주는 새로운 문화지형을 구축, 서울을 세계적인 문화도시로 부상시키고 나아가서는, 문화 글로벌 시대를 맞이하여 동양과 서양을 잇는 새로운 개념의 미술관으로서 아시아 미술의 구심점이 되어 세계를 향해 열린 예술과 문화의 발신지로서 새로운 미래를 이끌어 나가고자 한다.","<a href=""https://www.leeumhoam.org/leeum"" target=""_blank"" title=""새창 : 홈페이지로 이동"">https://www.leeumhoam.org/leeum</a>"
리원,1925335,음식,음식점,중식,http://tong.visitkorea.or.kr/cms/resource/31/3062931_image2_1.JPG,대전광역시,127.4008757533,36.4227742938,"리원은 30년 이상 경력의 대표가 직접 요리하는 중화요리 전문점이다. 대표 메뉴는 가족세트로, 2인 기준 세트와 3~4인 기준으로 구성된 세트 중 택하여 즐길 수 있다. 이 외에도 중식 코스 요리부터 각종 단일 메뉴까지 다양한 메뉴를 제공하고 있다. 지역 주민뿐만 아니라 외국인들도 즐겨 찾는 곳이다. 깨끗하고 넓은 연회석을 갖추고 있어 각종 모임 장소로도 적합하며, 예약은 전화 문의를 통해 가능하다.
주변에는 동화울수변공원, 청벽산근린공원, 여진불교미술관, 송강전통시장 등이 있다.",
리인목포게스트하우스 [한국관광 품질인증/Korea Quality],2707232,숙박,숙박시설,게스트하우스,http://tong.visitkorea.or.kr/cms/resource/09/2707009_image2_1.jpg,전라남도,126.3820053792,34.7906228047,"리인목포게스트하우스는 목포역에서 도보 6분 거리이자 유달산에 오르는 초입에 위치해있다. 객실은 총 3개로, 1호실은 안방과 너른 거실, 침대가 있는 다락방을 갖췄고 취사가 가능한 펜션형 객실이다. 2호실과 3호실은 다락방이 있는 개인실과 복층에 침대가 있는 개인실로 구성되어 있다. 숙소 곳곳에서 목표 1세대 서양화가 김수호의 그림 등 귀한 작품을 감상할 수 있다. 목포와 인근 섬의 생태문화 안내가 가능하다.",https://blog.naver.com/wetanth
리재,3103188,숙박,숙박시설,펜션,,서울특별시,127.0097710247,37.5638912266,"리재는 서울 동대문역사문화공원역 앞 한양도성이 집 앞에 펼쳐진 곳에 위치한 단독주택이다. 오래된 목조주택을 고치고 또 고쳐 현대 스타일에 맞춰 편리하게 리모델링하였다. 조용하고 편안한 분위기로 머무는 동안 도시의 번잡함은 사라진다. 원목으로 마감된 벽면 덕분에 집 전체적으로 나무향이 은은히 나고, 집 앞의 탁트인 조망과 뷰가 시원함을 자아낸다. 호텔 하우스키핑 매니저가 클리닝을 관리해 매 순간 쾌적하게 머물 수 있다.","<a href=""https://www.leejae.kr/"" target=""_blank"" title=""리재(으)로 이동"">https://www.leejae.kr//</a>"
리젠시모텔,3044558,숙박,숙박시설,모텔,http://tong.visitkorea.or.kr/cms/resource/40/3054440_image2_1.jpg,광주광역시,126.9186937888,35.141408843,"리젠시 모텔은 광주 충장로에 위치한 숙소다. 객실은 30여 개로 온실과 침실로 구성되어 취향에 따라 선택할 수 있고, 깨끗하고 쾌적하게 관리된다. 주차장이 넓어 주차에 편리하다. 차로 2분 거리에 양동시장이 있어 도보 15분 이내에 국립아시아문화전당, 광주 예술의 거리가 있어 관광을 즐기기에 좋다.",
리젠트모텔,626875,숙박,숙박시설,모텔,http://tong.visitkorea.or.kr/cms/resource/72/588472_image2_1.jpg,강원특별자치도,127.7157477565,37.8733403893,춘천시 근화동에 위치한 리젠트모텔은 지상 5층 규모의 22개의 객실을 갖춘 아늑한 모텔이다. 공지천유원지가 가까운 거리에 위치하였고 소양강댐이 차량으로 20분 거리에 위치하여 이동이 편리하고 주변의 다양한 먹거리와 다양한 체험을 즐기기에 용이하다.,
리조 세계재봉틀박물관,3060343,인문(문화/예술/역사),문화시설,박물관,http://tong.visitkorea.or.kr/cms/resource/93/3051993_image2_1.JPG,경상남도,128.0847342806,35.1915234104,"이일승, 조경련 관장이 수십 년간 세계 곳곳에서 수집한 재봉틀과 관련 부속품을 한데 모은 세계재봉틀박물관&공방이다.
전국 최초로 전 세계에서 수집한 앤틱 재봉틀 400여 점 중 250점과 반짇고리 등 관련 부속품 200여 점 등을 먼저 선보이고 있으며, 전시된 제품들은 재봉틀이 발명된 1800년도 초부터 현대까지 유럽, 미국, 일본 등 여러 나라에서 생산된 것으로 그 기능과 용도에 따라 다양하게 갖추어져 있다. 오래된 재봉틀도 많고, 1800년대 후반기 영국에서 만들어진 ‘타비타(Tabitha)’라는 제품도 있고, ‘싱거 2번(Singer No2)’이라는 제품은 뉴욕에서 1852~1878년 사이에 만들어졌으며 일련번호(362494)가 적혀 있다.
1920~1940년 사이에 만들어진 어린이용 재봉틀도 있고, 일반 의류용, 카페트용, 말안장용, 신발용, 가죽제품용, 어린이용 등의 각종 재봉틀은 물론, 반짇고리, 바늘, 다리미, 실패, 가위, 골무, 오일 캔, 의류 패턴, 홍보 포스트, 매매 계약서, 제품설명서 등 재봉틀과 관련한 부속품 200여 점도 함께 선보인다.
우리나라 제품으로는 1962년도 농림부 장관상으로 마을에 증정한 ‘드레스 미싱’이 자리하고 있어 눈길을 끈다. 리조 세계재봉틀박물관은 진주성, 촉석루, 진주박물관, 창렬사, 경남문화예술회관, 진주유등체험관과 인접한 도심에 위치하고 있어 함께 관광하면 좋은 곳이다.","<a href=""https://leejosm.modoo.at/"" target=""_blank"" title=""새창 : 홈페이지로 이동"">https://leejosm.modoo.at</a>"
리조트 스파밸리,2661074,인문(문화/예술/역사),휴양관광지,관광단지,,대구광역시,128.6353392148,35.7881605357,"대구 달성군 주암산 자락에 위치한 리조트 스파밸리는 지친 일상을 떠나 힐링을 마주하는 곳이다. 리조트는 어트랙션부터 온천까지 365일 즐거운 워터파크, 꽃과 동물이 함께하는 교감형 생태동물원 네이처파크, 편백나무 향 그윽한 숲속의 집 호텔 드 포레로 꾸며져 있다. 모든 시설에 공급되는 물은 음용 가능한 육각 온천수이며, 이 온천수는 화학적 구조가 육각형 고리 구조를 이루는 온천수로 지속적으로 섭취하면 아토피 개선과 당뇨, 고혈압 등 각종 성인병 예방에 도움이 된다고 알려졌다. 

(출처 : 리조트 스파밸리 홈페이지)","<a href=""http://www.spavalley.co.kr/""target=""_blank"" title=""새창: 리조트 스파밸리"">http://www.spavalley.co.kr/</a>"
리조트 스파밸리 네이처파크,2756646,인문(문화/예술/역사),휴양관광지,테마공원,http://tong.visitkorea.or.kr/cms/resource/12/2756812_image2_1.JPG,대구광역시,128.6353392148,35.7881605357,"리조트 스파밸리 네이처파크는 대구시 달성군 가창면에 자리 잡은 실내, 외 동물원이다. 400,000㎡의 넓은 한 부지에 대형 글라스하우스 동물원과 방사형 야외 동물원으로 구성돼 있다. 동물원에는 앵무새, 파충류, 사막여우, 미어캣, 말, 사자 호랑이와 같은 50여 종의 동물, 300마리 이상이 있고 350여 종의 수목, 100여 종 이상의 다양한 꽃들을 주변에 잘 배치해 놓았다. 주요 체험 프로그램으로 플레이 팡팡, 정글챌린지, 카약, 승마 등이 있다. 우리에 가둬 두지 않아 입장객을 따라다니면서 교감하는 동물들도 만날 수 있어 아이들에게 인기 있는 곳이다.","<a href=""http://www.spavalley.co.kr/"" target=""_blank"" title=""새창 : 리조트 스파밸리 네이처파크 사이트로 이동"">http://www.spavalley.co.kr/</a>"
리즈다이아,3306422,쇼핑,쇼핑,사후면세점,http://tong.visitkorea.or.kr/cms/resource/07/3314407_image2_1.jpeg,서울특별시,126.8884169673,37.5089148857,-,
리즈리,2929407,음식,음식점,서양식,http://tong.visitkorea.or.kr/cms/resource/98/2929398_image2_1.jpg,전북특별자치도,126.8064500203,35.942132726,"리즈리는 군산 대야면에 있는 정원 레스토랑으로, 유럽풍 정원과 더불어 커피와 요리가 맛있는 집이다. 군산 근교에 있음에도 주차장이 넓어 드라이브도 즐길 겸 식사를 하러 오는 사람들이 많다. 매장 내부는 창고를 개조한 곳으로 층고가 높고, 전체적으로 시야가 탁 트인 개방감을 준다. 음료 종류는 30가지 이상으로, 커피류는 물론이고, 리즈리에서만 판매하는 스페셜 음료들도 다양하게 준비되어 있다. 식사 메뉴 역시 피자, 파스타, 쉬림프,  라이스 등이 있어 브런치를 즐기기에도 좋다. 이 카페의 가장 매력 포인트는 마치 어느 유럽의 대저택에 온 듯 잘 관리된 정원이다. 카페 앞 넓은 마당의 잔디와 정원에 심어진 야생화, 담벼락을 따라 피어있는 핑크 뮬리 등 유명한 조경 정원에서 볼 수 있을 법한 식물들이 조화를 잘 이루고 있다. 
※ 반려동물 동반 불가",
리즈밸리글램핑캠핑장,2747868,레포츠,육상 레포츠,"야영장,오토캠핑장",http://tong.visitkorea.or.kr/cms/resource/03/2747503_image2_1.jpg,경기도,127.5128078053,37.591569372,"리즈밸리 글램핑 캠핑장은 경기도 가평군 설악면에 있다. 캠핑장과 펜션이 모인 전원주택마을 중에서도 계곡이 좋은 곳에 자리하고 있어 호젓하게 시간을 보낼 수 있는 아름다운 캠핑장이다. 캠핑장은 사이트 간에 거리가 넓어서 사생활을 보호하기 좋다. 사이트는 3m×6m의 넉넉한 사이즈  12동, 카라반 1대를 운영한다. 글램핑 입구는 숲이 우거진 계곡으로 나 있어 천연 칸막이 역할을 하며 그늘을 제공한다. 부대시설로 수영장과 공이 밖으로 달아날 염려가 없는 높은 펜스가 쳐진 족구장이 있다. 카라반은  3m×6m 풀사이즈로 내부시설 및 청결도가 부족함이 없다. 잔디가 깔린 단독 사이트여서 더욱 좋다. 관리실은 매점과 같이 운영되고 있고 공용 부대시설도 관리가 잘되어 있다. 세미나를 위한 넓은 홀(사용 예약 유선 문의)이 있으며 반려견 입장이 가능한 캠핑장이다.","<a href=""http://xn--bj0b46pgsba373ahr1as1s.com/"" target=""_blank"" title=""새창 : 리즈밸리글램핑캠핑장 사이트로 이동"">http://xn--bj0b46pgsba373ahr1as1s.com/</a>"
리첼호텔,3089840,숙박,숙박시설,관광호텔,http://tong.visitkorea.or.kr/cms/resource/26/3089826_image2_1.JPG,경상북도,128.7816208125,36.5680802316,"리첼호텔은 경북 안동문화 관광단지 인근에 위치한 호텔로, 유교의 고장 안동답게 전통과 현대가 조화를 이루는 실내 인테리어가 돋보이는 품위 있는 호텔이다. 
2인이 머무를 수 있는 스텐더드룸부터 6인 가족이 머무를 수 있는 스위트룸까지 다양한 객실 형태를 가지고 있다. 각 객실에는 취사가 가능한 주방과 거실, 테라스가 있어 내 집처럼 편안함을 느낄 수 있다. 또한 호텔 내에는 조식을 즐길 수 있는 식당과 카페가 마련되어 있다. 호텔 주변 관광지로는 온뜨레피움, 유교랜드, 안동댐, 월영교 등이 있다.","<a href=""http;//richell-andong.co.kr"" target=""_blank"" title=""새창 : 홈페이지로 이동"">http;//richell-andong.co.kr</a>"
리초야,2988799,음식,음식점,카페/전통찻집,,경상북도,129.2140482492,35.8330718134,"리초야는 경주에 위치한 말차 전문 카페로 기념품 선물도 판매하고 있다. 첨성대 쿠키가 얹어진 아이스크림이 시그니처 메뉴다. 말차맛, 초코맛, 호지차맛 세 가지로 다양하게 맛볼 수 있으며, 말차를 활용한 음료들과 그 외 다양한 음료들이 준비되어 있다. 말차 전문점이기 때문에 말차라떼 경우 두 가지 타입에 따라 당도 조절이 가능하고 말차향이 조절 가능하며 리초야만의 기술로 숙성시켜 만들어진 말차원액으로 제조한 찐한 라떼를 맛볼 수 있다. 기념품 세트로는 첨성대 등 경주를 떠올릴 수 있는 문화재 모양의 쿠키 세트가 대표적이다.",
리츠모텔,138191,숙박,숙박시설,모텔,http://tong.visitkorea.or.kr/cms/resource/40/1869240_image2_1.jpg,경기도,127.2174099983,37.2865493486,리츠모텔은 용인 에버랜드 주차장 맞은편에 위치하여 도심생활에서 지친 심신을 에버랜드와 더불어 이곳 리츠에서의 편안한 휴식으로 새로운 활기를 채울 수 있다. 2003년 12월에 리모델링을 하여 고급 인테리어와 설비는 고객 여러분에게 집보다 편한 만족을 드릴 것이다.,
리츠모텔,725491,숙박,숙박시설,모텔,http://tong.visitkorea.or.kr/cms/resource/29/726929_image2_1.jpg,전라남도,127.6650044016,34.7612893522,"우유 빛깔의 고급스러운 벽돌로 지어진 리츠모텔은 고급스러운 오피스텔 같은 느낌이다. 방안에 들어서면 큰 창문으로 들어오는 햇살이 방안을 환하게 비춰 기분을 좋게 한다. 커튼이 있어 낮잠을 자는데도 전혀 문제가 없다. 창가 곁에 놓인 티 테이블은 간식을 먹거나 책을 보기에 편리하다. 넓은 화장대가 있으며 미니 냉장고와 텔레비전, 에어컨 등 생활에 필요한 것들이 잘 갖춰져 있어 오랜 시간 출장이나 여행을 하는데 전혀 문제가 없다. 침대는 쿠션이 좋아 오랜 시간 숙면할 수 있어 좋다. 화장실은 세면대가 넓고 환기가 잘 되어 습기가 차지 않아 좋다.",
리츠모텔,1964059,숙박,숙박시설,모텔,,인천광역시,126.6694203241,37.507038991,"2014 아시안게임의 개최도시 인천에 위치한 리츠모텔은 저렴한 객실요금으로 손님들을 맞이한다. 도심에서 조금은 벗어난 주택에 자리하고 있어 조용하게 머물고 싶은 여행자에게 추천하고 싶은 공간이다. 구석구석 놀라움이 가득 찬 인천에서 여행자 분들에게 추천할 만한 곳은 무의도를 비롯한 강화도, 실미도, 석모도 등의 섬여행을 안내하고 싶다. 다양하고 신선한 먹거리의 천국인 소래포구와 인천개항지에서의 근대 유적지도 둘러보길 권한다.","<a href=""http://ritzmotel.modoo.at/"" target=""_blank"" title=""새창: 리츠모텔 홈페이지로 이동"">http://ritzmotel.modoo.at/</a>"
리츠모텔,2577101,숙박,숙박시설,게스트하우스,,경상남도,128.6760400592,35.2216917699,"리츠모텔은 늘 가깝고 평안한 공간으로 방문객을 초대한다. 청결, 친절 그리고 믿음으로 정성을 다하고 있다. 고객을 최우선으로 생각하며 고객만족을 위해 최선의 노력을 다하고 있다.
(정보제공자: 창원시청)",
리츠캐슬 리조트,2775576,인문(문화/예술/역사),휴양관광지,관광단지,http://tong.visitkorea.or.kr/cms/resource/98/2775598_image2_1.jpg,충청남도,126.1311719988,36.685094315,"리츠캐슬 리조트는 충남 태안군 근흥면 신진도리에 자리 잡고 있다. 리조트에는 호텔형 객실과 콘도형 객실 46개가 마련되어 있다. 모든 객실에서 태안 앞바다를 조망할 수 있다. 부대시설로는 120석 규모의 대연회장을 비롯해 중회의실, 소회의실, 노래방 등이 갖추어져 있다.","<a href=""http://ritzcastle.com/"" target=""_blank"" title=""새창 : 리츠캐슬리조트 사이트로 이동"">http://ritzcastle.com/</a>"
리츠프라자호텔,143116,숙박,숙박시설,관광호텔,http://tong.visitkorea.or.kr/cms/resource/75/1603775_image2_1.jpg,전북특별자치도,126.6928347529,35.9585094692,"명승지 선유도와 서해안시대의 관문 군산시를 대표하는 리츠프라자 관광호텔은 품위있는 시설에 여유있는 레저, 웰빙, 휴양공간이 어우러진 관광호텔이다.
수려한 은파호수를 조망할 수 있는 최고급 객실과 한식, 양식, 뷔페 등 각종 식사, 웨딩홀, 대 연회실, 중 연회실, 카페&바 등은 각계각층의 고객들을 위한 고급스러운 숙박업소 일뿐 아니라 군산시민과 국내외 관광객이 대중적으로 간편하게 이용할 수 있는 사교시설이다. 
아늑한 서해바다처럼 넓고 따스한 정성이 깃든 리츠프라자 호텔의 평화로운 분위기와 고객서비스는 호텔을 찾는 모든 고객들의 마음을 즐겁고 편안하게 해 줄 것이다.","<a href=""http://www.ritzplaza.co.kr"" target=""_blank"" title=""새창 : 리츠프라자호텔 홈페이지로 이동"">http://www.ritzplaza.co.kr</a>"
리치다이아몬드호텔,1990929,숙박,숙박시설,관광호텔,http://tong.visitkorea.or.kr/cms/resource/13/1990913_image2_1.jpg,서울특별시,127.0156236669,37.6476399283,"리치다이아몬드호텔은 서울의 중심에 위치한 비즈니스 전문 호텔로 편안하고 깔끔한 객실, 다양한 부대시설을 갖추고 있다. 전 객실 3D TV설치, WiFi 사용가능, 삼성정품 올인원 PC와 초고속 인터넷, 욕실 대형월풀과 일체형 비데(아메리칸 스탠다드), LED 샤워기, 발코니 룸 설치, 무료 셀프 세탁실 운영 등의 서비스로 고객에게 편의를 제공하고 있다.","<a href=""http://www.richdiamondhotel.com"" target=""_blank"" title=""리치다이아몬드호텔로 이동"">http://www.richdiamondhotel.com</a>"
리치문펜션,2626883,숙박,숙박시설,펜션,,강원특별자치도,128.8758521976,37.8330588607,리치문 펜션은 창가에서 동해의 앞 바다가 보이고 뒤로는 푸르른 솔숲이 펼쳐져 있다. 리치문 펜션은 어떠한 방해나 소음 간섭 없이 편안하고 조용하게 휴식을 취할 수 있으며 시원한 바다를 바라보며 소중한 사람들과 즐거운 시간을 보낼 수 있다.,"<a href=""http://spacej.co.kr/"">http://spacej.co.kr/</a>"
리치빌,912896,숙박,숙박시설,펜션,http://tong.visitkorea.or.kr/cms/resource/59/1893359_image2_1.jpg,경기도,127.3897720877,37.5802767621,산과 계곡이 함께 있어 자연의 선물을 그대로 간직하고 있는 리치빌펜션이다. 서울에서 비교적 가까운 위치에 있어 오기에 편리한 곳에 위치하고 있다. 또한 객실이 총 3개가 있어 조용히 쉼을 누리기에 좋으며 객실 테라스에서 바베큐가 가능해 편의를 더하고있다. 펜션 앞으로 흐르는 작은 계곡 사이에서 발을 담그며 시원함을 느낄 수 있고 숲의 푸르름을 그대로 느낄 수 있는 산책로 또한 펜션 주변으로 있다.<br>,"<a href=""http://www.richville.co.kr/"" target=""_blank"" title=""새창 : 리치빌 홈페이지로 이동"">http://www.richville.co.kr</a>"
리치스테이호텔,2865958,숙박,숙박시설,관광호텔,,경기도,127.0450712173,37.0458768688,"리치스테이호텔은 삼성전자 평택캠퍼스 차로 5분 거리, 평택 LG전자 차로 20분 거리에 있는 비즈니스호텔로서 평택의 산업단지와 기업체를 방문하는 고객들과 평택을 방문하는 관광객들의 여행과 숙박을 위하여 고덕 신도시에 지어진 신축 호텔이다. 리치스테이호텔은 고덕 리치타워 5~6층에 있으며 주차는 호텔 전용 주차장인 리치타워 주차장을 이용하면 된다. 프런트 옆으로는 무인 체크인/아웃 할 수 있는 기계가 설치되어 있으며 간단한 음료바도 마련되어 있다. 객실 안은 모던 심플하며 차분한 디자인으로 꾸며져 있고 평일엔 6층 스낵바에서 조식이 제공된다. 성수기 요금은 별도 문의.",
리치웰호텔,3075205,숙박,숙박시설,모텔,,서울특별시,127.0398394545,37.5030238367,"리치웰호텔은 강남 역삼역 근처에 위치한 관광호텔이다. 리치웰호텔은 내외국인 관광객과 기업인들을 위한 최적의 호텔로 서비스를 제공하는 것을 목표로 하고 있다. 객실은 스탠더드, 디럭스, 슈페리어 등으로 구성되어 있다. 객실은 미래지향적이고 감각적인 인테리어로 되어 있으며, 전 객실에 반신욕을 할 수 있는 욕조, 비데가 비치되어 있다. 
리치웰호텔에 숙박할 때는 미성년자 입실이 불가하며, 반려동물 동반 입실 또한 불가능하니 유의해야 한다.","<a href=""http://richwellhotel.co.kr/"" target=""_blank"" title=""새창 : 홈페이지로 이동"">http://richwellhotel.co.kr/</a>"
리치호텔,1747999,숙박,숙박시설,모텔,http://tong.visitkorea.or.kr/cms/resource/07/1745607_image2_1.jpg,인천광역시,126.6432834219,37.421348488,"리치호텔은 동북아의 중심도시 경제수도 인천에 위치하고 있으며 인천은 맑고 깨끗한 천혜자원이 가득한 곳으로 150여 개의 섬과 근대와 현대가 공존하는 도시이기도 하다. 인천의 관광지로는 월미도 공원, 인천 개항지, 유람선과 낭만의 연안부두, 신선한 해산물이 넘쳐나는 소래포구와 무의도와 송도 등을 손꼽을 수 있다. 또한 살아 있는 교과서라 불리는 강화도는 자녀들과 함께 여행하기에 적합한 곳이다.",
리치호텔,3084957,숙박,숙박시설,관광호텔,http://tong.visitkorea.or.kr/cms/resource/26/3084826_image2_1.jpg,제주특별자치도,126.3489500598,33.472097309,"제주도 북쪽에 자리 잡은 리치호텔은 제주공항에 근접하여 있는 5층 건물의 호텔이다. 노을빛이 아름다운 애월 해안도로에 자리하고 있는 가성비 좋은 호텔로 넓은 야외 주차장이 있다.
객실은 리치 더블, 슈페리어 더블, 슈페리어 패밀리, 슈페리어 트윈, 디럭스 트윈, 로양 스위트, 리치 스위트 8가지 타입의 룸이 있다. 모든 객실이 바다 전망으로 테라스와 주방 시설도 갖추어져 있다. 1층에 공용 테라스가 있고 소규모 회의를 위한 세미나실도 갖추어져 있다.
애월에는 바다를 조망할 수 있는 카페가 많이 있으며 인근에는 연화지, 애월 돌고래 전망대, 애월항 등이 있어 연계하여 관광할 수 있다.","b<a href=""http://www.richhotel.net/"" target=""_blank"" title=""새창 : 홈페이지로 이동"">http://www.richhotel.net</a>"
리커버리커피바,2895210,음식,음식점,카페/전통찻집,http://tong.visitkorea.or.kr/cms/resource/95/2895195_image2_1.jpg,서울특별시,127.0448709877,37.5503906482,"리커버리커피바는 호주 스타일의 스페셜티 커피를 다루는 곳이다. 빈티지하면서 클래식한 분위기의 건물로, 1층과 2층을 모두 카페로 사용한다. 2층으로 연결된 루프트 바가 있고, 2층의 창가 자리는 서울숲이 한눈에 들어온다. 메뉴로는 아메리카노, 카페라떼, 바닐라라떼, 플랫화이트 등의 커피가 있으며, 클래식 커스터드 푸딩과 크로플, 베이글도 있다.",
리케리케,2866865,음식,음식점,카페/전통찻집,http://tong.visitkorea.or.kr/cms/resource/49/2866849_image2_1.jpg,대전광역시,127.346568465,36.3587056628,"리케리케는 대전광역시 유성구 봉명동에 있다. 대표 메뉴는 아메리카노다. 이 밖에 콜드브루 아메리카노, 브라운슈가 버블티, 플랫화이트 등 여러 가지 음료가 준비되어 있다. 아울러 피자, 파스타 등 각종 음식도 맛볼 수 있다. 유성 IC와 대전 지하철 1호선 유성온천역에서 가깝다. 주변에는 유성온천, 대전시민천문대가 있다.
※ 반려동물 동반 가능(목줄, 배변봉투 지참)",
