title,contentid,cat1,cat2,cat3,firstimage,region,mapx,mapy,overview,homepage
여미온 황리단길점,2904241,음식,음식점,한식,http://tong.visitkorea.or.kr/cms/resource/21/2904221_image2_1.jpg,경상북도,129.2124122269,35.8349576811,"여미온 황리단길점은 경상북도 경주시 황남동에 위치하고 있다. 
한옥으로 지어진 덕분에 외관에서 고풍스러운 멋이 풍긴다. 깔끔한 분위기를 연출하는 인테리어도 눈에 띈다. 대표 메뉴는 경주한우를 얇게 잘라 부쳐낸 고소한 육전과 육회비빔밥이다. 이 밖에 육회, 육회물비빔냉면, 양념 소갈비 비빔밥 등도 있다.","<a href=""https://www.instagram.com/yeomi_on""target=""_blank"" title=""새창 : 여미온 사이트로 이동"">https://www.instagram.com/yeomi_on</a>"
여미지식물원,126464,자연,자연관광지,수목원,http://tong.visitkorea.or.kr/cms/resource/18/3011818_image2_1.jpg,제주특별자치도,126.4142854128,33.2526059401,"여미지식물원은 중문 관광 단지 북쪽에 위치하며 1132로를 타면 쉽게 갈 수 있다. 아름다운 땅이란 뜻을 지닌 여미지식물원은 커다란의 온실을 지니고 있으며, 대지 11만 2200㎡의 외부 정원과 1만 1361㎡의 실내 식물원으로 구성되어 있다.
외부 정원은 야자수와 같은 커다란 나무가 숲을 이루며, 한국, 일본, 이탈리아, 프랑스식 정원을 만들어 놓아 동, 서양의 정원을 감상할 수 있다. 총 2,300여 종의 식물이 살고 있으며, 온실 안에서는 약 절반인 1,300여 종의 식물이 살고 있다.
실내 식물원은 중앙홀과 높이가 38m인 중앙 전망탑이 있어 중문관광단지, 천제연폭포가 한눈에 들어오며 한라산과 인근 해안선 일대를 조망할 수 있음은 물론 쾌청한 날에는 국토 최남단 마라도까지 선명하게 바라볼 수 있다. 
또한 다양한 테마로 꾸며진 정원을 볼 수 있는데, 신비의 정원, 꽃의 정원, 물의 정원, 선인장 정원, 열대 정원, 열대 과수원으로 이루어져 있다.신비의 정원은 화산 암반석과 양치식물, 자생 식물들로 이루어져 있으며, 꽃의 정원은 열대 및 아열대 식물들로 조성되어있다.
물의 정원은 연못과 습지로 조성되어 있으며, 열대 정원과 열대 과수원은 열대 과수와 식물들로 조성되어있다. 선인장 정원은 어린 왕자에도 나오는 바오밥나무를 볼 수 있다.",
여민뜰,2858855,음식,음식점,한식,http://tong.visitkorea.or.kr/cms/resource/50/2858850_image2_1.jpg,충청남도,126.9516322261,36.8515504127,"여민뜰은 충청남도 아산시 영인면 아산리에 있는 한옥 음식점이다. 예스러운 멋을 풍기는 외관과 인테리어가 돋보인다. 내부에는 단체석이 마련되어 있어 각종 모임을 하기 좋다. 대표 메뉴는 보리굴비, 더덕구이, 떡갈비 등이 상에 오르는 법성포 보리굴비 한상이다. 강원도산 생곤드레를 맛볼 수 있는 영월 곤드레솥밥, 다섯 가지 과일청으로 맛을 낸 제육쌈밥과 보리된장도 별미다. 이 밖에 한우떡갈비, 한방토종백숙 등도 판다.","<a href=""http://instagram.com/yeomintteul""target=""_blank"" title=""새창 : 여민뜰 사이트로 이동"">http://instagram.com/yeomintteul</a>"
여민락 문화교류축제 통:로,3351652,인문(문화/예술/역사),축제,일반축제,http://tong.visitkorea.or.kr/cms/resource/80/3351580_image2_1.jpg,서울특별시,126.9232409242,37.5319183907,"전통문화예술 전승과 발전의 기반을 마련하고자 대한민국전통예술전승원이 주최하는 축제로, 전통을 기반으로 한 다양한 음악, 복식, 미술 공연과 플리마켓, 체험 부스 등을 시민들과 함께 나누며 새로운 경험의 장을 제공한다.","<a href=""https://www.ktaia.or.kr/child/sub/news/participate?ptype=view&_idx=668a014062eae73"" target=""_blank"" title=""새창 : 여민락 문화교류축제 통:로 축제 페이지"">/www.ktaia.or.kr</a>"
여민루,126981,인문(문화/예술/역사),역사관광지,유적지/사적지,http://tong.visitkorea.or.kr/cms/resource/64/2522164_image2_1.jpg,충청남도,126.9531459081,36.8541306975,"조선 시대의 아산군 관아 입구에 세워졌던 문루인데, 동향한 낮은 기단 위에 4각형의 주형 초석을 배열하고 그 위에 둥근 기둥을 세워서 루마루를 설치하였다. 하층은 정면 3칸에 각각 문을 달아 통로로 사용하였으며, 좌우 협간의 문미[門楣] 상부에는 홍살을 설치하였고 측면의 2칸은 판벽으로 막았다. 공포는 2익공인데 외출목은 없으며 처마 밑의 기둥 사이에는 간략화된 화반형의 초화반을 중앙문에 3개, 그 이외의 문에는 모두 2개식을 배치하였다. 지붕 가구는 앞 뒤 기둥 위에 대들보를 걸었는데 대들보 위에 소로를 두고 그 위에 뜬 창방을, 다시 이 뜬 창방 위에 주두를 놓아 종량을 받치도록 하였다. 종량 위에 있는 대공은 파연대공[波蓮臺工]의 형태를 이루고 있는데, 이대공과 결구된 뜬 창방은 그 위에 있는 마루 도리와의 사이에 간단하게 장식된 초각반 3개를 배치하여 중간부분을 보강하고 있다. 천장은 연등 천장이며 모도 단청으로 채색되어 있고 이칸 정면이 ""여민루""란 현판이 걸려 있다.","<a href=""https://www.heritage.go.kr/heri/cul/culSelectDetail.do?pageNo=1_1_1_1&sngl=Y&ccbaCpno=2113400170000"" target=""_blank"" title=""새창: 국가유산청 홈페이지로 이동"">www.heritage.go.kr</a>"
여백과 낙엽 향 가득한 하룻밤,2037263,추천코스,캠핑코스,캠핑코스,http://tong.visitkorea.or.kr/cms/resource/88/2036088_image2_1.JPG,Unknown,127.9781991785,37.0117060575,충주의 캠핑장들은 가을 캠핑의 묘미인 ‘여백의 미’가 도드라진다. 서울에서도 가깝고 주말에 많이 북적이지 않는다. 반딧불오토캠핑장은 옛 초등학교터에 캠핑장을 조성한 곳으로 초입에는 수십미터 솟은 플라타너스가 반긴다. 주변의 충주댐과 탄금대 온천까지 즐길 수 있는 꿀 코스다.,
여보게웃게 본점,2911745,음식,음식점,한식,http://tong.visitkorea.or.kr/cms/resource/06/2911706_image2_1.jpg,대전광역시,127.3510638928,36.3075004884,"여보게웃게 본점은 대전광역시 서구 도안동에 있다. 깔끔한 분위기를 연출하는 외관과 내부는 차분한 느낌의 인테리어에 단체석이 마련되어 있어 각종 모임을 하기 좋다. 대표 메뉴는 간장게장과 양념게장 중 한 가지를 선택할 수 있는 게장 정식이다. 이 밖에 간장게장+양념게장 무한리필, 청국장 SET, 꽃게탕 SET 등을 판다. 서대전IC에서 가깝고, 주변에 대전오월드와 장태산자연휴양림이 있다.","<a href=""http://www.여보게웃게.com""target=""_blank"" title=""새창 : 여보게웃게 본점 사이트로 이동"">http://www.여보게웃게.com</a>"
여사울성지,2771833,인문(문화/예술/역사),역사관광지,종교성지,,충청남도,126.8236463513,36.7568924052,"여사울 성지는 충청남도 예산군 신암면 신종리에 자리했다. 천주교 대전교구 소속의 천주교 성지로 1890년대부터는 내포 지역 천주교 전통 신앙의 모범이 된 공소였다. 여사울 성지에는 충청도 지역교회 창설을 위해 헌신한 ＂충청도의 사도＂로 불리는 이존창의 생가 터가 있다. 이곳은 충청남도 기념물 제177호로 지정되어 있다. 성당 내부는 작지 않은 규모의 아늑하다. 또한 직접 만든 나무 작품을 판매하는 모습을 볼 수 있고, 여사울 성지의 역사가 담긴 오래된 책이 전시되어 있는 것을 볼 수 있다. 이곳은 예산 수덕사 IC와 가까운 거리에 위치해 있고 주변에는 도고 온천, 국립 예산 치유의 숲 등이 있다.",
여산 숲정이 순교성지,1316395,인문(문화/예술/역사),역사관광지,종교성지,,전북특별자치도,127.0819944985,36.0618293853,"전북 익산시 여산면 여산리에 있는 천주교 순교 성지이다. 이곳은 호남의 관문으로 일찍이 천주교가 전래되어 수많은 신앙 공동체와 순교자들을 배출하였다. 병인박해가 일어났을 당시에 금산, 진산, 고산에서 잡혀 온 신자들이 순교한 곳이며 기록상으로만 22명이 순교했다. ‘여산 순교 성지’라고 쓰인 대형 돌판이 있으며 그 안쪽으로 백지사 기념비가 서 있다. 순교자들의 무덤은 천호산 기슭 천호 공소 부근에 자리하고 있다.

(출처 : 익산시 문화관광 홈페이지)","<a href=""https://www.iksan.go.kr/tour/board/view.iksan?boardId=BBS_TOUR_NTOUR&menuCd=DOM_000005901001000000&startPage=1&dataSid=533453"" target=""_blank"" title=""새창 : 익산 문화관광 홈페이지로 이동"">http://www.iksan.go.kr/tour</a>"
여산동헌,1316476,인문(문화/예술/역사),역사관광지,고궁,,전북특별자치도,127.0857220117,36.0592519663,"이 건물은 3단의 계단식 건물 터 제일 상단부에 들어서 있는데, 조선시대 말기에 건축한 것으로 보인다. 벽과 방의 구조는 근래 일부 개조하여 본 모습은 잃었지만, 비교적 원형이 잘 보존되어 있다. 특히 추녀와 대청마루에서 한식 목조 건물의 전형적인 아름다움이 잘 드러난다. 여산 동헌은 전국적으로 그리 많이 남아있지 않은, 옛 모습을 간직한 조선시대 지방관청 건물의 하나이다. 『여산 동헌 느티나무』전라북도 기념물 (2002.08.02)이 느티나무의 유래에 대한 기록이 남아 있지 않아 정확한 내용은 알 수 없다. 다만 여산 동헌과 주변에 7주의 대형 느티나무가 집중 분포되어 있음에 따라 동헌의 설치와 어느 정도 연관이 있을 것으로 추정할 뿐이다. 여산은 전주에 속해 있다가 공양왕 3년(1391) 감무를 두고 낭산과 공촌, 파제 두 부곡의 권농사까지 겸임하였고, 조선 태종 2년(1402)에 여산현이라 하고, 세종 18년(1436)에는 원경왕후의 외향이라 하여 군으로 승격되었다고 함으로 조선 태종대에서 세종대에 동헌이 설치되는 과정에서 식재되었을 것으로 보여 수령은 600년 정도로 추정된다. 나무의 휴고 둘레는 4.5m, 높이는 22m이다.","<a href=""http://www.iksan.go.kr/tour/"" target=""_blank"" title=""새창 : 익산 문화관광 홈페이지로 이동"">http://www.iksan.go.kr/tour/</a><br />
<a href=""http://www.cha.go.kr/"" target=""_blank"" title=""새창 : 문화재청 홈페이지로 이동"" >http://www.cha.go.kr</a>"
"여산장 (1, 6일)",132295,쇼핑,쇼핑,5일장,http://tong.visitkorea.or.kr/cms/resource/32/1976632_image2_1.jpg,전북특별자치도,127.0833694578,36.0587214304,"여산시장의 유래에 대해서는 정확하게 전해지지 않고 있다. 하지만 옛날부터 여산시장은 생필품의 보고와도 같은 장이었다. 여산장에서는 강경에서 유입된 생선류, 건어물류, 포목상, 일상잡화류 등과 연료용 화목장작 등 나무시장이 열렸다고 전해지고 있다. 하지만 현재에는 채소류, 의류, 생활용품 기타 잡화 등으로 장이 형성되고 있으며 계절에 따라 마늘, 고추 등이 주상품을 이루고 있다. 

1970년 이후 일일생활권이 대도시에 편중되면서 장세가 극히 약화되었으며, 유통산업의 개방과 농촌인구의 격감이 이루어진 1980년대 이르러 서서히 퇴조하게 되었다. 지금도 전통을 이어 5일장이 운영되고 있지만 겨우 명맥만 유지되고 있는 상태이다. 전통시장의 맛을 느꼈다면 인근 관광지를 거쳐 여행의 재미를 더하는 것도 좋다. 특히 익산시는 백제문화의 정취가 살아있는 관광지가 많기 때문에 아이와 함께 하는 역사 체험 여행으로 좋은 장소이다. 여산장 인근에는 보기 드문 평지 사찰인 남원사가 있으며, 농촌 체험을 할 수 있는 두여마을 관광농원이 있다. 남원사와 함께 두여마을을 거친다면 역사와 농촌 체험의 일거양득의 효과를 얻을 수 있을 것이다.","<a href=""http://www.iksan.go.kr/tour/index.iksan"" target=""_blank"" title=""새창: 익산 문화관광 홈페이지로 이동"">http://www.iksan.go.kr/tour/index.iksan</a>"
여산척화비,1582979,인문(문화/예술/역사),건축/조형물,기념탑/기념비/전망대,,전북특별자치도,127.0857220117,36.0592519663,"여산척화비는 전라북도 익산시 여산면 여산동헌 뜰에 있다. 1866년 병인양요 이후 서양 제국이 개항을 요구하는 가운데 1871년 신미양요가 일어나자, 흥선대원군이 서양 제국에 대한 항전 의식을 고양하기 위하여 전국 여러 곳에 세운 석비 중 하나이다. 1882년 임오군란 이후 흥선대원군이 실각하자 일본공사관의 요구로 철거되었다가 1915년 여산초등학교 운동장에서 발굴되어 여산동헌으로 옮겨 세워졌다. 여산척화비의 뒤에는 여산군에서 선정을 베푼 역대 관리들의 선정비 8기가 서 있다. 
여산척화비는 화강암의 단면 석비로, 규모는 높이 114㎝, 너비 46㎝, 두께 9㎝이며 정면에 비제를 겸한 비문이 있다. 서양 오랑캐가 침범하는데 싸우지 않으면 화해하는 것이니, 화해를 주장하는 것은 나라를 파는 것이라고 새겨져 있다. 척화비는 전국 각지에 건립되었으나 남아 있는 척화비는 여산척화비를 비롯해 10여 기로 문화재로서 가치가 있다.","<a href=""https://www.iksan.go.kr/tour/board/view.iksan?boardId=BBS_TOUR_NTOUR&menuCd=DOM_000005901001000000&startPage=1&dataSid=533468""target=""_blank"" title=""새창: 익산시 문화관광 홈페이지로 이동"">https://www.iksan.go.kr/</a>"
여산향교,1954820,인문(문화/예술/역사),역사관광지,유적지/사적지,http://tong.visitkorea.or.kr/cms/resource/59/3369759_image2_1.JPG,전북특별자치도,127.0904717063,36.0547358979,"여신향교는 조선 태종 3년(1403)에 창건되었다. 그 후 선조 때 일어난 임진왜란 당시에 불에 타 버렸으나 이곳 유림들에 의해 후에 다시 중건되었다. 여산향교와 같은 중설위(中設位)로 대성전에는 중국의 다섯 성인과 10명의 철인, 그리고 6명의 현인을 배향하고 우리나라의 18현인을 역시 배향하고 있다.
향교의 가장 윗부분에는 3칸으로 된 대성전이 있으며, 그 아래 왼편으로 서무가 있고, 오른편으로는 동무가 각각 3칸의 건물로 되어 있다. 내삼문 아래에는 정면 5칸의 명륜당이 있으며, 오른쪽에 동재, 왼편에는 서재가 각각 정면 3칸을 이루고 있다. 또 이들 건물 아래로 사마재와 양사재 그리고 전사청(典祀廳)이 각각 정면 3칸을 이루고 있다.
여산향교 대성전은 1984년 4월 1일에 전북특별자치도 문화유산자료 제83호로 지정되었다. 대성전의 규모는 앞면 3칸 반이다. 지붕은 옆면에서 볼 때 사람 인(人)자 모양을 한 맞배지붕이다. 지붕 옆면에는 바람막이 방풍판을 달았다. 대성전 안쪽에는 공자를 비롯한 그 제자와 우리나라 성현들의 위패를 모시고 있다. 조선시대 때는 나라에서 토지와 노비·책 등을 지원받아 학생들을 가르쳤으나, 현재는 교육 기능이 없어지고 제사 기능만 남아 있다.",
여산향교대성전,1316776,인문(문화/예술/역사),역사관광지,유적지/사적지,http://tong.visitkorea.or.kr/cms/resource/50/1308250_image2_1.jpg,전북특별자치도,127.09041615,36.0549469839,이 향교는 조선 태종 3년(1403)에 창건되었다고 전해지며 그 후 여러 차례 중수를 거처 오늘에 이르고 있다. 경내에는 대성전 명륜당 동. 서무등이 남아 있다. 대성전은 정면 3칸 측면 2칸 반의 맞배지붕 건물이며 겹처마에 주초는 고주와 평주가 함께 사용되었다. 이 향교에는 공자를 비롯한 중국의 5성 10 철 송조 6현과 우리나라의 18현이 배향된 중설위이다.,"<a href=""https://www.iksan.go.kr/tour/board/view.iksan?boardId=BBS_TOUR_NTOUR&menuCd=DOM_000005901001000000&startPage=1&dataSid=533458""target=""_blank"" title=""새창 : 지자체홈페이지 이동"">https://www.iksan.go.kr/tour</a><br><a href=""https://www.heritage.go.kr/heri/cul/culSelectDetail.do?ccbaCpno=3413500830000&pageNo=1_1_1_1&sngl=Y""target=""_blank"" title=""새창 : 국가유산청 이동"">https://www.heritage.go.kr/</a>"
여서도(완도),2548267,자연,자연관광지,섬,,전라남도,126.9231687364,33.9866161191,여서도라는 명칭은 조선왕조실록에 섬의 모양이 쥐가 쪼그리고 앉아 있는 모습과 닮은 데서 유래하였다고 기록되어 있으며 완도와 제주도의 중간에 위치하고 있다. 하루에 배가 두 번 닿는 섬이라 자연 그대로의 모습을 보존하고 있으며 특히 2m 높이가 넘는 돌담은 전국 어디에서도 찾아볼 수 없는 희귀한 자원이자 섬에서 살아가기 위해 노력했던 선조들의 자산이다. 하루에 2번 배 운항을 하지만 기상이 수시로 바뀌어 일주일에 한 번 배가 운항할 때도 있을 만큼 가기 힘든 섬이지만 전국 최고의 돌담과 다양한 어종이 있는 낚시 천국의 섬이다.<br>,"<a href=""http://www.wando.go.kr/tour"" target=""_blank"" title=""새창 : 완도 문화관광 사이트로 이동"">http://www.wando.go.kr/tour</a>"
여성게장백반,1351642,음식,음식점,한식,,전라남도,127.7223251066,34.7329435182,"여수 돌산대교 아래쪽 봉산동 게장백반 거리에 있는 음식점이다. 임행숙 사장은 이 동네에서 24시간 해장국집을 20년 동안 운영했다. 이때 밑반찬으로 돌게장을 내놓았더니 손님들이 자꾸만 더 달라고 하더란다. 그러던 중 몇몇 손님들이 해장국집은 피곤하니 게장백반집을 하라고 권했다. 때마침 게장백반집이 하나 둘 들어서면서 게장골목이란 말까지 나오자 아예 임행숙 사장도 게장 전문점으로 간판을 바꿨다.

이 집에는 게장 3종 세트가 있다. 간장게장과 양념게장, 된장게장이 그것이다. 임 사장은 아마 전국에서 가장 먼저 된장게장을 시작했을 거라고 말한다. 된장게장은 말 그대로 된장에다 돌게를 숙성시킨 것이다. 간장게장과 다른 독특한 맛이 난다. 돌게 다리까지 씹어 먹으면 적당히 간이 밴 게살이 입 안에 쏙쏙 내려앉는다. 돌산갓김치도 판매하고 있다. 단골손님들의 아침 식사를 위해 북어국이나 우거지국, 뼈다귀해장국을 준비한다.","<a href=""http://womangejang.modoo.at/"" target=""_blank"" title=""새창 : 여성게장백반 홈페이지로 이동"">http://womangejang.modoo.at/</a>"
여성문화회관 수영장(실내),131362,레포츠,수상 레포츠,수영,http://tong.visitkorea.or.kr/cms/resource/04/1868304_image2_1.jpg,인천광역시,126.7219543949,37.5079148192,"인천광역시 부평구 길주로에 위치한 인천여성문화회관은 1994년도에 개관하였다. 
인천여성문화회관 지하 1층에 있는 수영장은 인천 유일의 여성 전용 수영장이며, 25m 6레인의 규모를 갖추고 있다.
수영 강습, 자유수영, 아쿠아로빅 프로그램은 매월 등록 접수 후에 이용하는 방식이다.","<a href=""https://www.ifwf.or.kr/incheon/index.do"" target=""_blank"" title=""새창 : 인천여성문화회관 홈페이지로 이동"">https://www.ifwf.or.kr/incheon/index.do</a>"
여성생활사박물관,130724,인문(문화/예술/역사),문화시설,박물관,http://tong.visitkorea.or.kr/cms/resource/89/1591389_image2_1.jpg,경기도,127.7082029441,37.2433716017,"강천섬유원지 부근에 있는 여성생활사박물관은 우리 선조들이 실생활에 사용하던 생활용품 및 장신구들이 전시되어 있는 여성 전문 박물관이다. 천연염색가 이민정 씨의 정성과 집념으로 세워진 사립박물관으로 30여 년 동안 수집한 여성 생활과 관련된 유물 3,000여 점을 바탕으로 2001년 6월 개관하였다. 젊은 시절 외국 친구가 다 기운 옷을 들고 할머니와 엄마가 입던 건데 엄마가 주기로 했다며 뛸 듯이 기뻐하는 것을 보고 우리의 전통문화를 다음 세대에 오롯이 전달해 주고 싶어 수집하기 시작한 것이 박물관의 시작이었다. 처음부터 여성을 생각한 것은 아니었지만, 모으다 보니 어느 하나 여성들의 손을 타지 않은 것이 없어 국내 유일의 여성생활사박물관이 되었다. 
여성생활사박물관은 2층 규모로 1층에는 기획전시실 1, 2와 전통 염색, 염색 재료 전시실, 교육실, 다도 교실 등이 있고 2층은 일반 유물 및 복식, 가구 및 생활용품, 주방용품 등을 전시하는 상설전시실로 구성되어 있다. 야외 운동장에는 아이들이 마음껏 뛰놀 수 있는 놀이터가 있다. 여성생활사박물관에서 휴식과 함께하는 문화누리기를 주제로 1박2일 체험 캠프와 천연염색 체험, 다도예절 교육, 오색빛깔 자개 그립톡 만들기, 전통서예교육 등 다양한 체험 및 교육프로그램을 운영하고 있으며, 매년 다양한 기획전이 개최되고 있다. 매년 1월 1일부터 31일까지는 동절기 정기휴관을 한다. 박물관은 폐교한 옛 강천초등학교 강남분교 터에 자리 잡고 있으며, 채현천연염색연구소도 겸하고 있다.
여주IC에서 차량으로 약 13분 이내의 거리에 있다. 인근에 신륵사, 영녕릉(세종대왕 영릉/효종대왕 영릉), 파사성, 목아박물관, 여주곤충박물관, 황포돛배, 강천섬유원지 등이 있다.","<a href=""https://womanlife.kr/
"" target=""_blank"" title=""새창 : 홈페이지로 이동"">https://womanlife.kr/
</a>"
여성의류타임,2923983,쇼핑,쇼핑,사후면세점,,경기도,126.7383981191,37.3801938341,-,
여송정(餘松亭),2715382,인문(문화/예술/역사),역사관광지,고택,,강원특별자치도,128.7245267204,37.4774720255,"정선읍으로부터 승용차로 약 30분 거리에 거리에 아우라지에 정자각인 여송정이 있다. 소나무와 어우러진 정자 여송정에는 아우라지 처녀상이 있다. 정선아리랑 ‘애정편’을 기리고자 정선군에서 처녀상을 세웠다고 한다. 아우라지 처녀와 애절한 사랑을 나눈 총각은 강 건너 정선아리랑전수관 근처에서 여송정을 향해 세워져 있다. 아우라지 강변에 얽힌 송천의 처녀와 여량의 총각의 애절한 사랑 이야기를 전하기 위하여 송천과 여량, 두 마을의 이름을 따 여송정이라 붙였다고 한다. 주민들이 성금을 모아 여송정을 세웠다. 여송정 옆으로 조성된 옛길 산책로를 거닐며 풍경을 즐길 수도 있다. 

(출처 : 강원도청)",
여수 가사리 생태공원,2661447,자연,자연관광지,자연생태관광지,,전라남도,127.5944942342,34.748339587,"여수 가사리 생태공원은 습지 410,000㎡의 규모로 여수시 소라면 가사리에 위치해 있다. 나무데크 산책로가 양쪽으로 펼쳐져 있어 산책코스로 좋으며 자전거 코스도 마련되어 있다.
자전거는 가사리 갈대밭 근처 여수 YMCA 생태교육관에서 유료로 대여할 수 있다. 가사리 생태공원은 고즈넉한 어촌마을과 드넓은 갯벌 쪽빛 바다에 떠있는 다도해의 섬들을 조망할 수 있다.
가사리 갈대밭은 바다와 하천이 만나는 지역으로 넓은 습지가 이루어져 있고 주변 경관과 잘 어우러져 일몰시간에는 환상적인 경치를 볼 수 있다.
가사리 습지는 국립습지센터의 조사에서 생물다양성, 자연성, 식생 건강성, 규모와 경관가치 등 평가 기준을 조합해 1등급 판정을 받은 천혜의 자연환경을 가지고 있다.
여수의 대표 관광지와는 거리가 멀어 관광객들이 잘 찾지 않고 여수 사람들도 아는 사람이 적은 곳이지만 드라이브 코스, 산책 코스, 자전거 코스 등 다양한 매력을 가지고 있다.","여수관광문화 <a href=""http://www.yeosu.go.kr/tour"" target=""_blank"" title=""새창: 여수관광문화 홈페이지로 이동"">http://www.yeosu.go.kr/tour </a>"
