title,contentid,cat1,cat2,cat3,firstimage,region,mapx,mapy,overview,homepage
리스트 모다아울렛 천안아산,3307072,쇼핑,쇼핑,사후면세점,http://tong.visitkorea.or.kr/cms/resource/47/3313747_image2_1.jpg,충청남도,127.101445162,36.7984758421,-,
리스트 현대가든파이브,2924578,쇼핑,쇼핑,사후면세점,,서울특별시,127.1249768726,37.4776672007,-,Idfmail.co.kr
리슬한복,2946229,쇼핑,쇼핑,전문매장/상가,http://tong.visitkorea.or.kr/cms/resource/73/2947573_image2_1.jpg,서울특별시,126.9256205862,37.5558934247,"‘리슬한복’은 BTS 지민의 무대의상과 청하가 2022 시즌 그리팅 화보에서 입었던 한복 등을 제작한 한복 브랜드다. 샤이니 태민이 착용한 ‘소창의 맥시코트’가 폭발적 반응을 얻어 더욱 알려지게 됐다. 리슬 x 스파오의 콜라보 파자마는 셀럽뿐 아니라 대중들에게 큰 인기를 얻기도 했다. 선명한 색상을 담은 한국적인 아름다움을 유니크한 패션 아이템으로 선보이며, 2022년에는 한복 최초로 밀라노 패션위크에 데뷔하기도 했다. 전통의 매력과 현대패션의 트렌디함을 적절하게 조합하여 일상에서도 착용할 수 있도록 하였으며 결혼하객룩, 파티, 허니문, 바캉스룩, 데이트룩, 가족모임룩으로 안성맞춤이다.","<a href=""https://www.leesle.com/""target=""_blank"" title=""새창 : 업체 홈페이지 이동"">https://www.leesle.com/</a><br><a href=""https://blog.naver.com/ys871220""target=""_blank"" title=""새창 : 업체 블로 이동"">https://blog.naver.com/ys871220</a><br><a href=""https://www.instagram.com/leesle_hongdae/""target=""_blank"" title=""새창 : 업체 인스타 이동"">https://www.instagram.com/leesle_hongdae/</a>"
리썸카라반 (마농왓 노을),2798778,레포츠,육상 레포츠,"야영장,오토캠핑장",http://tong.visitkorea.or.kr/cms/resource/81/2799581_image2_1.jpg,제주특별자치도,126.2301766861,33.2393822902,"리썸카라반은 제주 서귀포시 대정읍에 자리한 소규모 카라반 캠핑장이다. 제주도 서쪽 일몰이 아름다운 조용한 바닷가 마을에 있으며, 도보로 1분 거리에는 제주의 광활한 바다를 누비는 남방 돌고래를 볼 수도 있다. 바닷가 근처의 평화로운 캠핑을 즐기고 싶은 여행객들에게 안성맞춤이다. 리썸 카라반 캠핑장에서 운영하는 카라반은 1호부터 5호까지 개별 데크가 있는 카라반이 있다. 내부에는 감성 콘셉트에 맞게 감성을 더하는 아기자기한 소품으로 꾸며져 있어 안락하고 기분 좋은 느낌을 더해준다. 내부에는 냉장고와 인덕션, 취사도구를 완비하고 있어 따로 번거로운 캠핑 준비물들을 챙길 필요 없다. 화장실과 샤워실 역시 카라반 내에 있어 프라이빗하게 캠핑을 즐길 수 있다. 넓은 앞마당처럼 펼쳐진 잔디밭과 개별 데크에서 편안하게 바비큐를 즐기며 휴식할 수 있다. 낮은 돌담과 정겨운 제주 시골 마을의 정취를 느껴보고 싶다면 이색 숙소로 추천하는 장소다.","<a href=""http://www.resomecaravan.com/"" target=""_blank"" title=""새창 : 리썸카라반 (마농왓 노을) 사이트로 이동"">http://www.resomecaravan.com/</a>"
리안,2766887,음식,음식점,중식,,대구광역시,128.6503971306,35.8553809876,"대구 수성구 만촌동에 위치한 리안은 수성대학교와 인접해 있어 특히 학생들에게 큰 사랑을 받고 있는 중식당이다. 이곳의 시그니처는 두툼하고 쫀득한 탕수육과 야끼우동이다. 고구마 전분을 사용해 쫀득하고 고소한 맛이 일품인 탕수육은 큼지막한 고기를 사용해 푸짐한 것이 특징이며, 밀가루를 사용하지 않는 것이 특징. 특제 소스로 해산물과 야채를 볶은 야끼우동은 우동면을 쓰는 다른 우동과는 달리 짬뽕 면이 들어가 있는 것이 특징이다. 오징어, 칵테일 새우, 양파, 목이버섯, 양배추가 함께 들어간 리안의 야끼우동은 특유의 매콤달콤한 맛으로 미각을 자극한다. 저렴한 가격의 짜장면, 짬뽕, 짬짜면 등도 학생들의 인기 메뉴. 주변에 프로야구팀 삼성라이온즈의 홈 경기장인 대구삼성라이온즈파크가 있어 경기 전후에 식사하기 좋으며, 지역에서 이름난 중식당이기에 대기가 있을 수 있다.",
리안갤러리 대구,3375301,인문(문화/예술/역사),문화시설,전시관,http://tong.visitkorea.or.kr/cms/resource/78/3375478_image2_1.jpg,대구광역시,128.5991987886,35.8579991909,"리안갤러리는 컬렉터 출신 안혜령 대표가 2007년 1월과 2013년 1월에 각각 리안 대구와 서울을 설립함으로써 현재 2개의 갤러리로 운영되고 있다. 한국의 대표적 문화지구인 서울 종로구 서촌에 자리한 리안 서울과 근대미술의 요람으로 불리는 도시 대구에서 특색 있는 전시를 개최하고 있다. 리안갤러리는 백남준, 이강소, 이건용, 남춘모 등과 같은 한국을 대표하는 작가들의 전시를 선보이며 한국 현대미술의 흐름을 충실히 소개하고 있을 뿐만 아니라 앤디워홀, 알렉스카츠, 프랭크스텔라, 데미안허스트, 엘리자베스페이튼, 이미 크뇌벨과 같은 저명한 해외 작가들의 개인전을 개최함으로써 중요한 전시 관람의 기회를 제공하고 있다. 대구 본점의 확장을 시작으로 리안갤러리는 단순히 관람객들에게 전시를 소개하는 역할을 넘어 앞으로의 세대에게 예술을 향유하고 미술품을 소장하는 문화를 권장하고 교육하는 종합 문화 시설로의 역할을 모색한다.","<a title=""새창: 리안갤러리 대구 홈페이지로 이동"" href=""http://www.leeahngallery.com"" target=""_blank"">http://www.leeahngallery.com</a>"
리안뉴욕,3306598,쇼핑,쇼핑,사후면세점,http://tong.visitkorea.or.kr/cms/resource/95/3314695_image2_1.jpeg,서울특별시,126.9249974851,37.4905482278,-,
리안중화요리,2841151,음식,음식점,중식,http://tong.visitkorea.or.kr/cms/resource/41/2841141_image2_1.jpg,경상북도,128.4264823412,36.0979632416,"리안 중화요리는 경상북도 구미시 진평동에 있는 중식당이다. 세련된 외관과 깔끔한 인테리어가 돋보이는 곳으로 가족 단위로 외식하기 좋고 단체석이 마련되어 있어 가족 모임이나 단체 회식도 할 수 있다. 주차장이 식당 앞에 있어 편리하다. 대표 메뉴는 삼선 간짜장과 리안짬뽕이고 이 외에 찹쌀 탕수육, 해물중화비빔밥 등 다양한 요리류도 맛볼 수 있다. 면 반죽에 클로렐라를 섞어 초록색 빛을 띤다.",
리앙스펜션,2609912,숙박,숙박시설,펜션,,경상북도,128.1315182971,36.7372265214,리앙스는 경상북도 문경읍에 위치한 펜션으로 스파와 호텔식 침구가 마련되어 있다.,www.re-ance.com
리애,2869105,음식,음식점,일식,http://tong.visitkorea.or.kr/cms/resource/06/2869106_image2_1.JPG,서울특별시,127.0601075967,37.4838569819,"리애는 수인분당선 구룡역 5번 출구 개포고등학교 부근에 있다. 매장이 있는 상가 건물에 자체 주차장이 있으나 협소하다. 방문 시 대중교통을 이용하는 게 편리하다. 이곳은 돈가스 전문점이다. 프리미엄급 한돈을 이곳만의 비법으로 240시간 숙성시켜 사용한다. 매장 내부는 넓은 홀에 인원별 다양한 테이블 구성과 개별 룸까지 있어 단체 행사나 가족 모임에도 적당하다. 아기자기한 아기용 식기가 따로 준비되어 있다. 대표 메뉴는 로스(등심)까스(200g~230g), 히레(안심)까스(200g~), 로스(등심)까스+ 히레(안심), 프리미엄 로스(등심)까스가 있다. 이외 메뉴로 씨푸드카츠, 생선 까스, 샐러드, 새우튀김 등이 있다. 식당 주변에 달터공원과 양재천 가을단풍길, 개포 까치공원이 있어 식사 후 가벼운 산책하기에 좋다.",
리앤리CC,2759826,레포츠,육상 레포츠,골프,http://tong.visitkorea.or.kr/cms/resource/27/2932227_image2_1.jpg,경기도,127.3623855266,37.8730644398,"청정지역 가평의 자연과 함께 남녀노소가 모두 즐길 수 있는 대중제 퍼블릭  골프장이다. 운악산 구름 위로 솟은 기암괴석의 절경이 병풍처럼 골프장을 감싸고 있다. 그린 주변 곳곳에 야생화가 피어 있는 자연 친화적인 골프장이다. 대중제 골프 코스와 휴양시설의 성격을 고려한 특색 있는 조경 및 경관이 특징이다.  레이크코스와 하이랜드코스, 스카이코스로 나누어져 각 9홀씩 총 27홀 골프장이다. 코스마다 자연과 어우러진 특색이 있고 난이도에 따라 누구나 흥미로운 라운딩을 즐길 수 있다.","<a href=""http://www.leenleecc.co.kr/"" target=""_blank"" title=""새창 : 리앤리CC 사이트로 이동"">http://www.leenleecc.co.kr/</a>"
리앤파크,2748254,레포츠,육상 레포츠,"야영장,오토캠핑장",http://tong.visitkorea.or.kr/cms/resource/83/2747683_image2_1.jpg,충청북도,127.8603254194,36.2560293648,"리앤파크는 충북 영동군 황간면에 있다. 영동군청을 기점으로 약 15㎞가량 떨어졌으며, 자동차를 타고 기골로, 대학로, 심원회로포를 차례로 거치면 닿는다. 도착까지 걸리는 시간은 25분 안팎이다. 이곳은 폐교를 리모델링해 감성적인 캠핑장으로 꾸몄다. 캠핑장 여기저기를 거닐다 보면 어른은 옛 추억에 잠기고, 어린이는 신기함에 들뜬다. 캠핑장에는 일반야영장 30면과 글램핑 10개 동을 마련했다. 일반야영장은 파쇄석으로 이뤄졌으며, 사이트 크기는 가로 10m 세로 10m로 널찍하다. 웬만한 대형 텐트도 거뜬히 설치할 수 있다. 개인 트레일러와 개인 카라반 동반 입장이 가능하며, 반려견은 소형견만 출입할 수 있다. 사계절 내내 운영하며, 주말에만 문을 연다.","<a href=""http://www.leenpark.co.kr/niabbs5/"" target=""_blank"" title=""새창 : 리앤파크 사이트로 이동"">http://www.leenpark.co.kr/niabbs5/</a>"
리얼 이스케이프 챌린지,2946527,인문(문화/예술/역사),체험관광지,이색체험,http://tong.visitkorea.or.kr/cms/resource/75/2945575_image2_1.jpg,서울특별시,126.9271149424,37.5542047587,"‘리얼 이스케이프 챌린지’는 스릴 넘치는 게임, 신선한 테마, 놀라운 스토리가 가득하며 테마에 따라 제한 시간 안에 방에서 탈출해야 하는 방탈출카페이다. 이곳은 러블리즈 멤버 ‘미주’ 등 연예인들도 즐겨 찾는 곳이다. 주기적으로 테마가 교체되며 방마다 영어로 표기되어 있는 외국인을 위한 안내서비스가 제공되고 있다. 그리고 100% 예약제로 운영되기 때문에 네이버 예약 또는 홈페이지로 예약 후 방문을 해야 한다. 게임 시작 전 휴대폰과 스마트워치 등의 전자기기는 사물함에 보관해야 하며 사전 동의서 작성 후 게임을 시작하게 된다. 게임이 진행되는 60분간 타당한 이유가 없는 한 퇴장이 불가하다. 빨리 탈출하게 된다면 방탈출 랭킹에도 올라갈 수 있다.","<a href=""https://www.rec-escape.com/""target=""_blank"" title=""새창 : 업체홈페이지 이동"">https://www.rec-escape.com/</a><br><a href=""https://www.instagram.com/rec_escape""target=""_blank"" title=""새창 : 업체인스타그램 이동"">https://www.instagram.com/rec_escape</a>"
리얼 트레저 페스티벌,3026189,인문(문화/예술/역사),축제,일반축제,http://tong.visitkorea.or.kr/cms/resource/09/3370709_image2_1.jpg,경기도,127.0096292,37.2738832007,"세계 최대 규모의 보물찾기 대회인 <리얼 트레저 페스티벌>이 10월 12일부터 10월 16일까지 개최된다.
스마트폰만 있다면 즐길 수 있는 이번 행사는 경기도청 옛청사에서 진행되며 참가자는 첨단 기술을 활용한 가상 보물을 획득할 수 있다. 보물을 획득한 수, 랭킹에 따라 다양한 선물도 받아갈 수 있다.
이번 축제는 개막식을 시작으로, 메인 프로그램인 리얼 트레저, 부대 프로그램인 던전 트레저, 미스터리 테마파크, 보물 도둑을 찾아라!, 외계인 포획 대작전, 포토존 등이 함께 이루어진다. 본 축제는 무료로 참여 가능하며 사전 예약 등 자세한 사항은 홈페이지를 참고하면 된다.","<a href=""https://2024.treasure-festival.realworld.to/"" target=""_blank"" title=""새창 :리얼 트레저 페스티벌 홈페이지"">https://2024.treasure-festival.realworld.to/</a>"
리얼스페인 판교점,2867847,음식,음식점,서양식,http://tong.visitkorea.or.kr/cms/resource/35/2867835_image2_1.JPG,경기도,127.1120945581,37.3848360691,"경기도 성남시 백현동 카페문화거리에 위치한 리얼스페인은 정열과 태양의 나라 스페인 음식이 있는 레스토랑이다. 메뉴는 크게 파스타, 스테이크, 샤프란과 육수, 쌀을 넣어 만든 스페인 전통 요리인 빠에야, 식사 전에 술과 곁들여 간단히 먹는 타파스 등이 있다. 또 스페인 대표 와인 칵테일 상그리아도 있다. 내부 좌석뿐만 아니라 테라스 좌석도 마련되어 있지만 날씨에 따라 좌석 오픈 여부가 정해지며, 재료 소진 시 조기 마감을 할 수 있으니 방문 전에 전화 후 방문하는 것이 좋다.","<a href=""https://www.instagram.com/realspain1/"" target=""_blank"" title=""새창 : 리얼스페인 인스타그램으로 이동"">https://www.instagram.com/realspain1/</a>"
리얼월드 성수,2850356,인문(문화/예술/역사),체험관광지,이색체험,,서울특별시,127.0584227632,37.5422307285,"놀이와 문화가 공존하는 도심 속 신개념 놀이 문화 공간이다. 미스터리 호텔 컨셉의 공간을 돌아다니면서 이색 체험을 할 수 있고 카페와 게임을 동시에 즐길 수 있다. 몽환적인 호텔을 배경으로 다양한 인터렉티브 게임을 경험하며 스토리 속 진짜 주인공이 되어볼 수 있다. 1층 매장에서 다양한 음료를 즐기는 것은 물론, 다양한 인터렉티브 게임을 구매할 수 있다. 그리고 포토존도 준비되어 있어 인생샷도 찍을 수 있다.","<a href=""http://seongsu.realworld.to/"" target=""_blank"" title=""새창 : 홈페이지로 이동"">http://seongsu.realworld.to/</a>"
리엔차이,2738667,음식,음식점,중식,http://tong.visitkorea.or.kr/cms/resource/27/2740727_image2_1.jpg,대전광역시,127.3248087246,36.3799833972,"리엔차이 내부는 분위기 좋은 호텔 중식당을 연상시킨다. 뿐만 아니라 국내 특급호텔 출신의 요리사가 수준 높은 요리를 선보이기로 유명하다. 점심 특선은 느낌, 사랑, 행복의 세 가지 코스가 준비되어 있다. 이 가운데 행복 코스의 경우, 게살 누룽지 스프, 팔진 모듬 해물 볶음, 특선요리, 칠리소스 중새우, 표고버섯 소고기 고추잡채, 꽃빵, 식사류를 제공한다. 스페셜 메뉴 가운데 가장 상위에 있는 골드 코스를 선택하면 리엔차이 특선 냉채, 특품 통상어 지느러미찜, 일품해삼, 불도장, 발채전복, 바닷가재 요리, 자연송이 야채볶음, 꽃빵, 식사, 후식을 맛볼 수 있다.","<a href=""http://www.leenchai.co.kr/"" target=""_blank"" title=""새창 : 리엔차이 사이트로 이동"">http://www.leenchai.co.kr/</a>"
리엔춘,2580799,음식,음식점,중식,,대전광역시,127.4399183145,36.3636539768,"대전 대덕구 송촌동에 위치한 리엔춘은 주택가와 동춘당 사이에 위치한 중화요리 전문점이다.
이 음식점은 프라이빗하고 넓은 룸을 많이 갖추어 가족 식사 등의 모임을 하기 좋다. 먹자골목에서 오랫동안 운영되고 있어 지역 맛집으로 인정받고 있다. 특히 탕수육은 일반 탕수육 외에 눈꽃탕수육, 숙주탕수육, 사천탕수육 등 여러 종류로 특화되어 있다.
리엔춘은 경부고속도로 대전IC와 가까우며 동춘당로와 계족산로를 통해 접근할 수 있다. 대중교통은 대전 시내버스 311번, 314번, 617번, 620번을 이용할 수 있다. 주변에는 동춘당 외에 송촌정수장 등이 있다.",
리엔호이스,2837413,음식,음식점,카페/전통찻집,http://tong.visitkorea.or.kr/cms/resource/96/2837396_image2_1.jpg,경기도,127.1936116372,37.1070335673,"용인시 처인구 이동저수지 근처에 있는 전망 좋은 독립건물 카페이다. 이동저수지 바로 옆에 있어 이동저수지에서 수상 스포츠를 즐기는 모습도 조망할 수 있다. 대형 베이커리 카페로 커피와 다양한 베이커리를 판매한다. 특히 2층에서는 통창으로 저수지 조망을 제대로 즐길 수 있고 3층에서는 저수지와 주변 자연경관을 감상할 수 있다. 단, 3층은 루프탑이라 어린이들의 출입이 제한된다. 야외에도 좌석이 있는데 날씨가 좋은 날에는 야외 좌석이 먼저 채워진다.
※ 반려동물 동반 불가",
리옌,2876610,음식,음식점,중식,http://tong.visitkorea.or.kr/cms/resource/00/2876600_image2_1.jpg,충청북도,127.5771022149,36.3008080529,"리옌은 다양한 중화요리를 맛볼 수 있는 중식당이다. 이곳은 식사의 질을 높이고자 포장과 배달이 불가하다. 대표 메뉴는 리옌짜장이며, 리옌짬뽕, 리옌짬뽕밥, 해물크림짬뽕 등도 인기가 많다. 이외에도 탕수육, 깐풍기, 양장피 등도 있다.",
리오네,2868609,음식,음식점,서양식,http://tong.visitkorea.or.kr/cms/resource/71/2868571_image2_1.jpg,부산광역시,129.1200610561,35.1716333124,"부산 수영구에 위치한 리오네는 캐주얼 레스토랑이다. 오픈 이후 3년 연속 블루리본 서베이에 수록되었다. 해외 현지에서 오랜 기간 근무하며 요리를 배운 셰프와 호텔리어 출신인 서버들이 최고의 요리와 서비스로 식대를 대접한다. 리오네는 차별화된 메뉴와 계절에 맞는 엄선된 재료들을 사용하여 요리를 만든다. 건물이 1층과 2층으로 나뉘어 있어 1인 식사부터 가족행사와 신년, 연말행사를 위한 단체석까지 마련되어 있다.","<a href=""https://www.instagram.com/rione_busan/"" target=""_blank"" title=""새창 : 리오네 인스타그램으로 이동"">https://www.instagram.com/rione_busan/</a>"
리오리코,2875566,음식,음식점,카페/전통찻집,http://tong.visitkorea.or.kr/cms/resource/59/2875559_image2_1.jpg,경기도,126.8166264606,37.6016389359,"고양시 덕양구 행주산성로에 있는 카페다. 행주산성에서 한강뷰가 좋아 사람들이 많이 찾는다. 건물 전체가 카페로, 큰 규모다. 지하와 1층은 주차장으로 사용하고 있으며 카페 앞에 도착하면 직원이 주차를 안내해 준다. 2층은 카페 입구로 메뉴를 고르고 주문하고 계산하는 곳이다. 3층은 카페 매장으로 사용하는데 통유리로 된 창밖으로 자연풍경이 보여 개방감이 느껴진다. P층으로 루프탑이 있는데 탁 트인 장소에서 한강과 노을 뷰를 볼 수 있다. 내부에는 테이블 사이마다 식물을 인테리어로 하여 편안한 느낌을 주며 유리창으로 들어오는 채광이 좋아 카페 내부는 따뜻하고 밝다. 메뉴는 커피 등 음료와 다양한 브런치, 크로플, 베이커리 등을 판매한다.","<a href=""https://www.instagram.com/caferiorico_/""target=""_blank"" title=""새창 : 리오리코 사이트로 이동"">https://www.instagram.com/caferiorico_/</a>"
리오카라반,2909615,레포츠,육상 레포츠,"야영장,오토캠핑장",http://tong.visitkorea.or.kr/cms/resource/98/2909598_image2_1.JPG,경기도,127.3629743106,37.7795531136,"가평 잣향기 푸른숲 가는길에 위치한 아기자기한 감성 카라반 캠핑장이다. 대형 수영장이 두 개 있어, 영유아부터 성인들까지 물놀이를 할 수 있다. 야외 놀이터는 물론 트램펄린, 전통놀이, 달고나 체험 등 놀 거리가 다양하여, 아이들과 함께 온 가족단위 방문객이 많다. 핑크, 민트, 블루, 옐로, 레드 총 5개의 글램핑장이 있는데, 외관은 물론 내부도 이름에 걸맞은 색깔로 꾸며져 있어, 사진 찍기도 좋다. 가평 버스터미널에서 픽업도 가능해서 대중교통을 이용해서 방문도 가능하다.
※ 반려동물 동반불가","<a href=""http://www.riocaravan.com""target=""_blank"" title=""새창 : 리오카라반 사이트로 이동"">http://www.riocaravan.com</a><br><a href=""https://www.instagram.com/riocaravan""target=""_blank"" title=""새창 : 업체인스타그램 이동"">https://www.instagram.com/riocaravan</a>"
리오텔,724526,숙박,숙박시설,모텔,http://tong.visitkorea.or.kr/cms/resource/24/725924_image2_1.jpg,경기도,126.6856222889,37.7802491315,"강렬한 레드 색깔이 인상적인 7층 건물이 멀리서도 한눈에 알아볼 수 있는 모텔이다. 신비하고 시원한 블루톤의 로비를 지나 객실로 들어서면 외부와 마찬가지로 레드 톤의 강렬함이 인상적이다. 플라워 패턴의 벽지와 안락한 침대가 조화롭게 배치되어 있고, 화장대, TV, 정수기 등의 생활 편의 및 최신형 컴퓨터 등이 잘 갖춰져 있다. 나무 창틀이 있어 객실이 이국적으로 보인다. 샤워 시설이 갖춰져 있고 욕실의 상태도 매우 청결하게 되어 있다.",
리옹 동탄본점,2756772,음식,음식점,이색음식점,http://tong.visitkorea.or.kr/cms/resource/13/2756913_image2_1.jpg,경기도,127.1219237653,37.2033989218,"동탄 2신도시 치동천 인근에 있는 리옹 본점이다. 2014년 봉담에서 시작하여 동탄으로 이전하였다. 예약 우선 매장으로 당일 1시간 전까지 예약 가능하다.  식사와 와인, 커피, 맥주 등을 즐길 수 있는 공간이다. 신대륙, 구대륙 구분 짓지 않고 매일 와인을 테이스팅하고 연구한 리옹 대표의 와인 일기를 작성 중이다.",
리옹봉담,2853409,음식,음식점,서양식,,경기도,126.9546912192,37.2208439191,"제대로 된 뇨끼를 맛볼 수 있는 환상적인 레스토랑인 곳이다. 뇨끼뿐만 아니라 각각의 메뉴들의 설명이 필요 없을 정도로 맛을 사로잡는다. 쫀득한 뇨끼와 매콤한 크림의 조합이 일품이며 은은한 조명을 비추는 분위기가 매력적이다. 또한 취향을 저격할 다양한 와인과 콜키지까지 운행하고 있는 레스토랑이다. 방문 시에는 주문 즉시 요리를 하기 때문에 예약을 필수로 해야 한다. 대표메뉴로는 런치세트 (A/B/C)가 있고 그 외에 여러 파스타와 샐러드, 스테이크, 음료 등이 준비되어 있다.",
리우오션 레지던스,3075639,숙박,숙박시설,관광호텔,,경상남도,128.7193323283,34.8514534601,"리우오션 레지던스는 휴식에 대한 새로운 가치를 추구하고 비즈니스와 휴양이 공존하는 공간을 지향하는 서비스 레지던스다. 계단형 건물 배치로 전 세대가 남해와 옥려봉이 조화롭게 어우러진 거제도의 풍경을 볼 수 있는 조망권을 갖추고 있다.
넓고 독립된 주거 공간, 바다와 숲이 바로 접한 최상의 위치에서 휴양과 힐링이 가능하다. 외국인 렌탈 및 숙박, 기업 휴양소, 동호회 장소로도 대관하며 최고급 호텔 수준의 서비스와 함께 다양한 부대 시설이 완비되어 있어 생활의 활력을 얻을 수 있다. 천혜의 자연환경을 갖춘 단지 인근에는 장승포 선착장과 외도가 위치하며 거제 주요 관광지와의 접근성이 우수하고 거가대교가 있어 내륙지역과의 이동도 편하다.
야외바비큐장, 휘트니스센터, 야외수영장, 어린이 놀이시설 등의 부대 시설을 보유하고 있다.","<a href=""https://riwoo-ocean.com/"" target=""_blank"" title=""새창 : 홈페이지로 이동"">https://riwoo-ocean.com</a>"
