title,contentid,cat1,cat2,cat3,firstimage,region,mapx,mapy,overview,homepage
온누리약국 종로,2924145,쇼핑,쇼핑,사후면세점,http://tong.visitkorea.or.kr/cms/resource/89/2878189_image2_1.jpg,서울특별시,127.0105123957,37.5719180845,-,www.phampay.co.kr
온누리육식당,2864137,음식,음식점,한식,http://tong.visitkorea.or.kr/cms/resource/35/2864135_image2_1.jpg,경기도,126.8786963211,36.9835477873,"온누리육식당은 평택시 포승읍에 있는 생삼겹살 맛집이다. 주문하면 두툼한 육질의 고기를 직원이 직접 구워준다. 밑반찬으로 명이나물, 파채 무침, 겉절이, 비지찌개가 나온다. 소금에 찍어서 한 입, 고추냉이를 올려서 한 입, 쌈장을 찍어서 명이나물에 싸서 한 입, 온누리육식당에서 추천해 주는 고기 먹는 방법이다. 삼겹살의 고소함과 잘 어울리는 얼음 동동 띄운 비빔밀면도 이 집의 인기 메뉴다. 식사 메뉴로 바지락 듬뿍 들어있는 된장찌개와 밥이 있다. 주차는 식당 앞에 하면 된다.",
온누리장작구이 팔당본점,2830403,음식,음식점,한식,,경기도,127.2358450394,37.5585792575,"경기도 남양주시 와부읍 팔당리에 있는 장작구이 전문 음식점이다. 이곳이 본점이고 경기도에 9개, 대구에 1개 지점이 있다. 건물 앞에 주차장이 있다. 주메뉴는 돼지고기와 오리고기로 오리 장작구이, 삼겹살 장작구이, 모둠 장작구이 등이 있다. 고기를 주문하면 잔치국수는 무료다. 셀프바에서 추가 반찬을 가져다 먹을 수 있다. 인접하여 같은 상호를 사용하는 누룽지백숙과 진흙구이 전문식당이 있다. 일부 메뉴는 포장이 가능하다. 주말이나 휴일은 방문객이 많아 입구에 긴 차량 줄이 서기도 한다. 강 건너편이 미사리 조정 경기장이다. 팔당역에서 승용차로 약 5분 거리에 있다.",
온누리쭈꾸미 팔당본점,2860429,음식,음식점,한식,http://tong.visitkorea.or.kr/cms/resource/15/2860415_image2_1.JPG,경기도,127.2358450394,37.5585792575,"경기도 남양주시 와부읍에 있는 주꾸미 요리 전문점이다. 탁 트인 멋진 한강뷰를 보면서 식사할 수 있는 곳이다. 주문할 때 매운맛 조절이 가능하여 매운맛 또는 덜 매운맛을 선택할 수 있다. 푸짐하고 다양한 세트메뉴를 비롯하여 주꾸미볶음, 철판주꾸미, 직화불고기 등의 여러 가지 단품메뉴도 있다. 매장 앞 주차장이 있어 주차하기에 편리하다.",
온누리쭈꾸미부평본점,2873886,음식,음식점,한식,http://tong.visitkorea.or.kr/cms/resource/73/2873873_image2_1.jpg,인천광역시,126.7081315209,37.4768904023,"온누리쭈꾸미 부평본점은 인천지하철 1호선 부평삼거리역 3번 출구에서 약 100미터 거리에 위치해 있다. 지하철역 가까이에 있어 대중교통 이용도 편리하고 넓은 주차장이 갖추어져 있어 자차 이용도 편리하다. 이곳은 단독 2층 건물로 내부는 통창으로 밝고 매장이 넓어 단체 및 가족 모임 하기에도 좋다.  TV 프로그램에 소개된 맛집으로  주메뉴는 주꾸미세트, 철판주꾸미세트, 철판쭈삼겹세트, 직화불고기 등이 있다. 그 외 크림 왕새우, 치즈퐁듀, 도토리전도 있다 추가 반찬은 셀프 바를 이용해 덜어다 먹을 수 있다.",
온달과평강농원,3375765,인문(문화/예술/역사),체험관광지,농.산.어촌 체험,http://tong.visitkorea.or.kr/cms/resource/57/3375757_image2_1.jpg,인천광역시,126.410381064,37.7727562469,"온달과평강농원은 인천 강화군에 위치한 포도 재배 농원이다. 주로 샤인머스캣을 재배하며, 그 외에도 거봉,  루비스위트, 블랙사파이어, 충랑, MBA포도 등 다양한 포도를 재배한다. 현재는 샤인머스캣을 직접 또는 스마트 스토어로 구매할 수 있다. 
온달과평강농원은 포도 따기 체험을 운영하고 있어서 직접 포도를 따보는 경험을 할 수 있다.","홈페이지 <a href=""https://ganghwa2014.modoo.at/"" target=""_blank"" title=""새창 : 온달과평강농원 홈페이지로 이동"">https://ganghwa2014.modoo.at/</a><br />네이버 블로그 <a href=""https://blog.naver.com/ganghwa2014/"" target=""_blank"" title=""새창 : 온달과평강농원 네이버 블로그로 이동"">https://blog.naver.com/ganghwa2014/</a>"
온달관광지,2616453,인문(문화/예술/역사),휴양관광지,테마공원,,충청북도,128.4915183165,37.0632486092,"온달관광지는 고구려의 명장 온달장군과 평강공주의 전설을 테마로 한 온달전시관을 비롯하여 온달산성, 온달동굴 등 명승지를 모아놓은 곳이다. 입구에 들어서면 가장 먼저 떡 벌어진 풍채를 자랑하는 드라마세트장이 눈길을 끈다. 이곳에서는 SBS 드라마 ‘연개소문’과 KBS의 ‘천추태후’, ‘태종이방원’, ‘고려거란전쟁’ MBC ‘태왕사신기’, ‘연인’ 까지 드라마 대작들이 연이어 탄생하기도 했다. 가이드라인을 따라 안으로 들어서면 드라마 촬영 당시 사용된 의상과 소품들을 감상하는 재미도 쏠쏠하다. 중국풍의 건축물과 정원도 다른 곳에서 보기 어려운 이국적인 볼거리를 제공한다. 온달산성이 있는 성산 기슭 지하에서 약 4억 5,000만년 전부터 생성되어 온 것을 추정되는 온달동굴은 길이 약 800m 주굴과 5개의 지굴로 구성된 석회암 천연동굴이다. 동굴 안으로 들어서면 오랫동안 동굴 안을 오가던 원시의 바람이 상쾌하게 몸 안으로 밀려들고 신비로운 자태의 종유석들은 동굴 밖에서는 볼 수 없는 별천지를 보여줄 것이다.","<a href=""https://www.dytc.or.kr/main/33"" target=""_blank"" title=""새창 : 단양관광공사 홈페이지로 이동"">https://www.dytc.or.kr/main/33</a>"
온달떡볶이 당산1호점,2682878,음식,음식점,한식,http://tong.visitkorea.or.kr/cms/resource/09/2682709_image2_1.jpg,서울특별시,126.9001903407,37.5285878096,떡볶이는 한국인이 즐기는 매운 대중 음식이다. 서울특별시 영등포구에 있는 기타전문점이다. 대표메뉴는 떡볶이다.,
온달문화축제,234235,인문(문화/예술/역사),축제,일반축제,http://tong.visitkorea.or.kr/cms/resource/93/3370393_image2_1.JPG,충청북도,128.492343254,37.0628736682,"단양군 온달문화축제는 10월 초에 개최되는 지역축제이며, 유일무이한 고구려 축제이다. 고구려 테마존 운영, 고구려 복식체험 등 기존의 고구려 전통적인 프로그램과 더불어 고구려 저잣거리 재현, 온달산성 탐방 이벤트 등 신규 프로그램을 도입하여 고구려 콘텐츠를 강화하였다.","<a href=""https://danyang.kccf.or.kr:444/"" target=""_blank"" title=""새창 : 온달문화축제 홈페이지 이동"">https://danyang.kccf.or.kr:444/</a>"
온달해물국,2859762,음식,음식점,한식,http://tong.visitkorea.or.kr/cms/resource/47/2859747_image2_1.jpg,경기도,127.0884285536,37.0406004715,"온달해물국은 평택시 고덕신도시 근처에 있는 대구탕 맛집이다. 식당 내부는 원형 테이블이 많이 있고 오픈형 주방이다. 메뉴는 맑은 대구탕 한 가지인데 생선 살만 발라져 있어서 먹기 편하다. 밑반찬은 깍두기, 오이무침, 마늘장아찌가 나오고 셀프바에서 리필해서 먹을 수 있다. 대구 순살과 통통한 굴, 곤이, 콩나물이 뚝배기 가득 들어있다. 그 위에 다진 청양고추를 듬뿍 얹고 새우젓으로 간을 맞춰 먹는다. 후식으로 수정과를 준다. 식사 후 차로 10분 거리에 고덕 수변공원에서 산책하면 좋다.",
온담,2809103,음식,음식점,한식,,전북특별자치도,127.1398930395,35.8151751619,"온담은 전주에서 유명한 고깃집들 중 한 곳이다. 이곳은 고기의 퀄리티가 높고 깔끔하고 맛이 좋아 평일에도 웨이팅이 있는 맛집이다. 직각목살, 온백살, 꼬들살 3가지 고기 메뉴가 있으며 처음 주문은 2인분부터 가능하다. 이곳은 고기의 중요한 요소를 크게 3가지 고기, 불, 그릴링을 온담만의 방식으로 지켜낸다. 좋은 원육을 선별하여 숙성을 한 고기에 100% 직화구이를 하고 고기 본연의 맛과 숯향을 입혀 최상의 맛을 내는 최적화된 불판을 사용한다. 그리고 마지막으로 좋은 원육과 숯, 불판이 준비되었다면 그릴링으로 맛을 완성시킨다.","<a href=""https://www.instagram.com/our_ondam/"" target=""_blank"" title=""새창 : 온담홈페이지로 이동"">https://www.instagram.com/our_ondam/</a>"
온더가든,2839719,음식,음식점,한식,http://tong.visitkorea.or.kr/cms/resource/08/2839708_image2_1.JPG,강원특별자치도,127.7121379967,37.7447858213,"춘천 닭갈비의 대표적 형태인 철판에 볶아먹는 양념 닭갈비와 더불어 숯불에 구워 먹는 닭갈비를 함께 맛볼 수 있는 곳이다. 특히 숯불 닭갈비가 인기인데 적당히 시즈닝이 잘 되어 있는 소금닭갈비는 담백하고, 양념닭갈비도 젊은 입맛을 자극한다. 숯불에 굽기 때문에 불향이 입혀진 닭갈비를 즐길 수 있지만, 신경 쓰지 않으면 금세 탈 수 있으니 주의해야 한다. 어린이용 식사로 닭곰탕, 치킨마요 같은 메뉴도 있고 닭갈비파스타 등 이색 메뉴도 있어 가족들이 이용하기에도 좋다. 음식은 테이블에 있는 터치 패드로 주문하고, 자리까지 서빙은 로봇이 가져다준다. 또한 캠핑장처럼 차려진 야외 테이블은 반려동물도 함께 이용할 수 있다.		
※반려동물 동반 야외테이블 가능(목줄, 배변봉투 지참)","<a href=""http://www.onthegarden.kr/""target=""_blank"" title=""새창 : 온더가든 사이트로 이동"">http://www.onthegarden.kr/</a>"
온더기와,2877055,음식,음식점,카페/전통찻집,http://tong.visitkorea.or.kr/cms/resource/46/2877046_image2_1.jpg,충청남도,127.2467584396,36.3406670729,"온더기와는 충청남도 공주시 반포면 학봉리 있는 한옥 카페다. 고풍스러운 멋을 풍기는 외관과 예스럽고 고급스러운 분위기를 연출하는 인테리어가 눈에 띈다. 내부에는 단체석이 마련되어 있어 각종 모임을 하기 좋다. 기계를 사용하지 않고 12시간 가량 손수 끓인 대추차가 맛있기로 유명하다. 설탕을 넣지 않고 유기농 원당을 이용해 직접 담근 청으로 맛을 낸 자몽차도 인기가 많다. 이 밖에 아메리카노, 카페라테, 카푸치노, 헤이즐넛, 바닐라라테 등 여러 가지 음료가 준비되어 있으며 다양한 종류의 브런치, 파스타, 피자 메뉴도 맛볼 수 있다.",
온더락캠핑장,2740062,레포츠,육상 레포츠,"야영장,오토캠핑장",http://tong.visitkorea.or.kr/cms/resource/00/2740200_image2_1.JPG,경기도,127.3585169443,37.7602691648,"경기도 가평군 상면에 위치한 온더락캠핑장은 아침고요수목원 가는 길목에 있는 숲 깊고 전망 좋은 호텔식 글램핑으로 아침에 조식이 제공되는 전원 속 캠핑장이다. 캠핑장은 공기 좋은 산속에 위치해 차를 이용해 산속을 오르고 내리막길을 내려가야 하는 불편이 있으나 도로는 포장되어 염려할 필요가 없다. 전망이 워낙 좋은 곳이라 주위에 많은 별장이 자리 잡고 있다. 전나무 숲속에 멋진 글램핑 7동이 자리하는데 모양도 예쁘지만, 내부 인테리어가 이용객의 마음을 사로잡을 만하다. 캠핑장으로 접근하는 길은 잣나무 잎이 떨어져 폭신하고 햇살이 반짝거려 야외 테이블에 한참 머물게 한다. 맑은 숲속 공기와 멋진 풍경을 감상하며 행복한 시간을 보낼 수 있는 진정한 힐링을 추구하는 캠핑장이다. 관리실 건물에는 카페를 운영하며 이용객들의 조식으로 빵을 제공하는데 고급스러운 세팅이 너무나 맘에 든다. 가족 중심 운영으로 따스하고 정감이 가는 캠핑장이다.","<a href=""http://www.ontherock.kr"" target=""_blank"" title=""새창 : 온더락캠핑장  사이트로 이동"">http://www.ontherock.kr</a>"
온더레일,2846062,음식,음식점,카페/전통찻집,http://tong.visitkorea.or.kr/cms/resource/60/2846060_image2_1.jpg,대구광역시,128.6431977662,35.7554116051,"온더레일은 대구광역시 달성군 가창면에 위치한 로스터리 카페이다. 이곳은 기차와 자연과 함께 즐기는 휴식을 슬로건으로 한 카페로, 이러한 슬로건에 맞게 카페 내부 곳곳에는 기차 모형으로 장식을 해두었다. 또한, 통유리창으로 전층에서 시원한 뷰를 만끽할 수 있으며, 루프탑도 운영을 하고 있다. 단, 루프탑은 안전상의 이유로 노키즈존으로 운영을 하고 있다. 
매일 아침 수제로 구운 빵과 케이크, 로스팅한 원두로 만든 고소한 커피와 여러 종류의 음료가 준비되어 있다. 자연 속에서 향미 가득한 커피와 어디에서도 받아볼 수 없는 기차가 해주는 서빙을 경험해보고 싶다면 방문하는 것을 추천한다.",
온더버튼,2839753,음식,음식점,카페/전통찻집,http://tong.visitkorea.or.kr/cms/resource/47/2839747_image2_1.JPG,강원특별자치도,128.5478952388,38.2963597631,"고성 문암해변에 있는 뷰 맛집 카페이다. 카페 정면은 커다란 통창으로 문암해변이 한눈에 내려다보인다. 카페 뒤쪽에 주차장이 있어 주차된 차로 해변 뷰를 가리는 일은 없다. 분위기 있는 인테리어와 공간 구성으로 카페 곳곳은 인생샷 찍는 포토존으로 유명하다. 카페에서 음료는 다회용컵(리유저블컵)에 제공되고, 테이크아웃이나 실내에서 마시다가 밖으로 나갈 경우 요청하면 컵 뚜껑을 받아서 이용할 수 있다. 카페 2층은 루프탑으로 아이들은 안전상의 이유로 이용을 제한하고 있다. 라떼베르데, 썸머라떼, 마롱라데, 아메리카노, 라떼, 아인슈페너 등 다양한 메뉴를 갖추고 있고 인근에 천학정, 백도해수욕장, 교암리해수욕장 등이 있다.",
온더선셋,2857087,음식,음식점,카페/전통찻집,http://tong.visitkorea.or.kr/cms/resource/58/2857058_image2_1.jpg,경상남도,128.5197757519,34.9162065132,"온더선셋은 경남 거제시 사등면에 있다. 시그니처인 선셋 브릿지와 야자수에서 느껴지는 푸른 바다의 청량함과 선셋 무렵에는 감성적이고 로맨틱한 분위기가 나는 카페이다. 해변에 바로 붙어있는 지리적 특성으로 마치 바다 위에 떠 있는 듯한 크루즈 카페 느낌이 난다. 루프탑이 있는 4층 규모의 대형 카페로 창가 좌석에 앉는 것을 추천한다. 시그니처 메뉴로는 선셋 커피, 유자에이드, 선셋 주스, 선셋 에이드, 그린 티 퐁당 등이 있다. 카페 내에서 파는 모든 음료는 캔으로도 판매하고 있다. 브런치는 두 종류를 판매하는데, 오후 2시까지만 주문할 수 있다. 이름 그대로 선셋이 유명한 카페이기 때문에 늦은 오후에 방문하는 것이 더 좋다. 인근에는 수협효시공원, 수협효시기념관, 양달석미술관 등이 있다.
※ 반려동물 동반불가","<a href=""http://www.instagram.com/onthesunset""target=""_blank"" title=""새창 : 온더선셋 사이트로 이동"">http://www.instagram.com/onthesunset</a>"
온더스톤브런치카페 제주성산점,3030250,음식,음식점,서양식,http://tong.visitkorea.or.kr/cms/resource/04/3030204_image2_1.jpg,제주특별자치도,126.9182256717,33.4702982825,"성산읍에 2016년에 오픈한 오조리 바다를 바라보며 브런치를 제대로 즐길 수 있는 카페이다. 흑돼지버거가 대표메뉴로 딱새우 오일파스타와 오픈 샌드위치 등 브런치 카페답게 다양한 메뉴를 갖추고 있고, 푸짐한 양과 질 좋은 재료로 정성을 다하는 맛으로 고객들의 만족도가 매우 높은 편이다. 커피, 스무디, 맥주 등 다양한 음료를 즐길 수 있는 음료 라인업도 매력 포인트이다. 매장 이용 고객들은 음료나 식사메뉴 중 1인 1 메뉴 필수이며 1층에서 주문한 후 2층에서 진동벨이 울리면 주문한 음식을 픽업하여 식사하도록 되어 있고, 물과 식기류는 셀프서비스이다. 매장 내부도 우드 테이블과 조명이 아늑한 분위기로 넓고 예쁘게 꾸며져 있고, 2층 통유리창가 일자테이블의 오션뷰 자리를 사수 못해도 창문너머의 탁 트인 전망을 즐길 수 있으니 단체, 가족, 연인들의 취향껏 테이블을 고를 수 있다. 
성산일출봉 가는 길목에 위치하여 성산일출봉 갔다가 혹은 가기 전에 잠시 들려 휴식을 취하기 좋으며, 아기 의자도 마련되어 있고 애견동반(소형견)이 가능한 카페여서 어린아이와 애견동반 여행객들에게 더욱 매력적인 카페이다. 또한 카페 옆에 바비큐가 가능한 온더스톤 펜션이 있는데 펜션 투숙객들에겐 할인가격으로 조식메뉴를 제공한다고 하니 제주 성산방향으로 여행계획을 세울 때 참고하면 좋겠다.","<a href=""https://blog.naver.com/rvex93"" target=""_blank"" title=""새창 : 경복궁 홈페이지로 이동"">https://blog.naver.com/rvex93</a>"
온더스팟,2927266,쇼핑,쇼핑,사후면세점,http://tong.visitkorea.or.kr/cms/resource/25/2879725_image2_1.jpg,서울특별시,127.0224294367,37.5203909516,-,www.onthespot.co.kr
온더스팟,2928676,쇼핑,쇼핑,사후면세점,http://tong.visitkorea.or.kr/cms/resource/13/2891113_image2_1.jpg,서울특별시,127.0000338108,37.5360581737,-,
온더스팟 명동점,2924801,쇼핑,쇼핑,사후면세점,http://tong.visitkorea.or.kr/cms/resource/42/2878642_image2_1.jpg,서울특별시,126.985176097,37.5619910058,-,www.onthespot.co.kr
온도호텔,2552570,숙박,숙박시설,모텔,http://tong.visitkorea.or.kr/cms/resource/43/2552543_image2_1.JPG,대구광역시,128.5578441912,35.8546626954,"낡은 여관을 부티크 호텔로 리뉴얼 한 ONDO는 도심 속 Staycation을 하기에 더할나위 없는 공간으로 새롭게 탄생했다. 미니갤러리 같은 디자인으로 노멀함의 기준을 높이며, 프라이빗한 공간으로 여유와 일상의 풍요로움을 만끽할 수 있도록 디자인된 부티크 공간이다.",
온동마을,2792630,인문(문화/예술/역사),체험관광지,농.산.어촌 체험,http://tong.visitkorea.or.kr/cms/resource/41/2795841_image2_1.jpg,전라남도,127.4397664717,35.2802409803,"온동마을은 옛날에 온수가 난다고 해서 ‘온수골’이라고 부르면서 붙여진 이름이다. 지리 산맥의 대간인 차일봉 종석대가 우측으로 뻗어와 갈미봉(간미봉)으로 이어지고, 그 갈미봉이 다시 구례재로 이어지면서 당동 마을과 난동 마을 들을 형성하였는데 그 지리산맥이 입수되어 이룬 터에 자리 잡고 있는 마을이다. 조선 말기에 전주 이씨가 이주하여 마을을 형성한 뒤 많은 주민들이 모여들어 큰 마을이 형성되었다. 마을 사람들은 단감과 고추 재배를 통해 농가 수익을 올리고 있다. 이 마을은 주변이 산으로 둘러져 있는 분지 형태로 골짜기마다 농경지가 형성되어 있다.",
온동물체험농장,2747797,인문(문화/예술/역사),체험관광지,농.산.어촌 체험,,경기도,126.7618561414,37.4144569387,"온동물체험농장은 경기도 시흥시 방산동에 있다. 농장으로 가는 길 양쪽 편에는 40여 종에 이르는 야생화들이 심겨 있어 주변에서 쉽게 볼 수 없는 식물들을 만나볼 수 있다. 실외에서는 오리와 닭, 칠면조와 공작새, 부엉이와 매를 비롯한 여러 조류를 볼 수 있다. 실내에는 시원한 연못이 있어 물고기 먹이를 줄 수 있고 간단한 음료수를 마실 수 있는 휴식공간이 되기도 한다. 또 토끼와 미니돼지, 염소 같은 동물들과 햄스터, 고슴도치, 기니피그, 사막 다람쥐 같은 애완동물도 만날 수 있다. 아이들이 보호자의 지도 아래 동물들을 만져보기도 하고 입장할 때 바구니에 담아준 먹이를 마음에 드는 동물에게 나눠줄 수도 있다. 또한 앵무새 마을에 있는 앵무새를 손 위나 어깨에 올려서 같이 사진을 찍고 인화하여 기념으로 가져갈 수 있다.","<a href=""http://instagram.com/on_animalfarm"" target=""_blank"" title=""새창 : 온동물체험농장 사이트로 이동"">http://instagram.com/on_animalfarm</a>"
온든해,2855623,음식,음식점,카페/전통찻집,,부산광역시,128.9419360073,35.1307346091,"온든해는 해가 많이 드는 곳이라는 순한글 이름의 디저트 카페이다. 쌀 구움 과자와 쌀 에그타르트 등 모든 디저트는 쌀을 베이스로 만들며, 다양한 시그니처 크림 라떼와 시원한 에이드를 맛볼 수 있는 공간이다. 들어서는 입구에 초록 초록한 잔디밭과 감각적인 외관 인테리어로 사진을 찍는 방문객들도 많으나, 카페 방문 기념사진이 아닌 상업적인 촬영을 금하고 있으니 유의해야 한다.","<a href=""http://instagram.com/on_deunhae"" target=""_blank"" title=""새창 : 홈페이지로 이동"">http://instagram.com/on_deunhae</a>"
온량,2894934,음식,음식점,서양식,http://tong.visitkorea.or.kr/cms/resource/26/2894926_image2_1.JPG,서울특별시,127.0434517687,37.5469937952,"서울숲에 위치한 온량은 특급호텔 출신 요리사들이 운영하는 작은 양식당이다. 따뜻한 색감을 가진 조명 아래 목제 가구들이 조화를 이루고, 벽면에 빈티지하고 개성 있는 엽서나 포스터 사이즈의 이미지들이 붙여져 있다. 당일 준비되는 재료로만 음식을 만들며, 모든 소스와 음식은 홈메이드 스타일로 매장에서 직접 만들고 있다. 
온량의 대표메뉴는 토마호크 포크 커틀렛이다. 최상급 국내산 돼지고기를 튀겨낸 시그니쳐 메뉴이다. 이외에도 고소하고 담백한 크림소스에 직접 끓인 토마토소스로 맛을 낸 스파이시 로제 파스타, 세 가지 버섯과 다진 소고기 안심, 네 가지 치즈로 맛을 낸 정통적인 콰트로 크림 리소토, 질 좋은 쇠고기와 양송이버섯으로 담백하게 맛을 낸 만조 크림 파스타, 동남아식 삼발소스로 맛을 낸 매콤한 나시고렝 쉬림프 필라프 등도 인기가 많은 메뉴이다.","<a href=""http://www.instagram.com/onryang_restaurant""target=""_blank"" title=""새창 : 온량 사이트로 이동"">http://www.instagram.com/onryang_restaurant</a>"
온리쭈꾸미,2830970,음식,음식점,한식,http://tong.visitkorea.or.kr/cms/resource/64/2830964_image2_1.jpg,경기도,126.922943756,37.332969254,"온리쭈꾸미는 경기도 군포시 대야미동에 있는 주꾸미 전문점이다. 대표메뉴는 주꾸미 세트이다. 주꾸미 세트를 시키면 주꾸미볶음, 샐러드, 도토리전, 도토리묵사발, 공깃밥이 함께 나온다. 매콤한 주꾸미볶음과, 고소한 도토리전, 상큼한 샐러드와 묵사발이 잘 어우러진다. 주꾸미세트 외에도 치즈 돈가스 같은 다양한 단품메뉴가 있다. 식사 후에는 아메리카노, 라테, 차 등 다양한 후식 음료 중 선택해 마실 수 있다. 식사동은 1, 2층으로 되어 있다. 식사 후 테라스, 별관에서 여유롭게 후식을 즐길 수 있다. 매장 앞에 넓은 주차장이 있어서 편하게 이용할 수 있다. 
※단품 메뉴만 포장 가능, 주꾸미볶음 2인분 이상부터 포장 가능",
온마루,2570563,숙박,숙박시설,한옥,http://tong.visitkorea.or.kr/cms/resource/74/2568374_image2_1.jpg,경상북도,129.3158347544,35.798838712,개별 온수 수영장이 있는 한옥 펜션이다.,www.onmaru.co.kr
온마을,402998,음식,음식점,한식,http://tong.visitkorea.or.kr/cms/resource/08/399208_image2_1.jpg,서울특별시,126.9815507265,37.5867297317,"온마을 두부전문점은 삼청동 금융연수원에서 삼청터널 방면으로 50m쯤 가다 감사원 삼거리 나오면 왼쪽 대로변에 위치한다. 내부에 들어서면 온통 나무와 황토를 이용한 인테리어에 마음을 빼앗기게 되는데, 인테리어만큼 토속적인 이 집의 메뉴는 손으로 만든 두부요리다. 이 집의 특이한 점은 메뉴를 적은 주걱을 볼 수 있는데, 그 모습에 오는 손님들마다 웃음을 자아낸다. 온마을 두부전문점이 있는 이 길은 맛있는 집으로 소문난 곳이 많은 지역이다. 하지만 주변의 쟁쟁한 음식점들과 비교하여도 전혀 밀리지 않는 맛과 전문성을 자랑한다.","<a href=""https://027384231.modoo.at/"" target=""_blank"" title=""온마을 홈페이지로 이동"">https://027384231.modoo.at/</a>"
온몸으로 즐기는 대구 2박 3일 코스 여행!,2778427,추천코스,가족코스,가족코스,http://tong.visitkorea.or.kr/cms/resource/88/2681588_image2_1.jpg,대구광역시,128.5823637094,35.8742137114,먹거리 뿐만 아니라 취향따라 골라보는 다양한 액티비티가 있는 두근두근 대구 여행,
