title,contentid,cat1,cat2,cat3,firstimage,region,mapx,mapy,overview,homepage
조리샘농원가든,2855853,음식,음식점,한식,http://tong.visitkorea.or.kr/cms/resource/51/2855851_image2_1.JPG,경기도,126.8255684948,37.7561933226,"조리샘농원가든은 경기도 파주시 조리읍에 있는 오리요리 전문점이다. 누룽지가 올라간 오리누룽지백숙이 인기가 많으며, 오리로스는 잡내가 나지 않고 담백한 맛이다. 능이백숙과 볶음탕은 오리와 닭 중에서 선택을 하여 먹을 수 있다. 누룽지백숙은 3~4인이 함께 먹기에 적당한 양이다. 식사 후 제공되는 죽도 별미다.",
조림명가,2834311,음식,음식점,한식,http://tong.visitkorea.or.kr/cms/resource/06/2834306_image2_1.jpg,경상북도,129.4035581631,35.973690085,"조림명가는 경상북도 포항시 남구 오천읍에 위치해 있다. 여러 가지 조림 요리를 만들어 손님상에 내는데, 모든 요리가 별미라서 많은 사람의 발길이 모인다. 모든 음식은 정수기 물로 요리한다. 아울러 모든 식재료는 국산이며, 직접 담근 김치를 제공한다. 대표 메뉴는 두부조림이다. 이 밖에 고등어구이, 고등어조림, 갈치조림, 무고등어조림, 가자미조림, 고갈비 등도 맛볼 수 있다.",
조만간식당,2893938,음식,음식점,한식,http://tong.visitkorea.or.kr/cms/resource/15/2893915_image2_1.jpg,경기도,126.5600894262,37.2769137928,"조만간식당은 경기도 안산시 단원구 대부북동에 있는 한식당이다. 꼬막 한판, 육회 한판, 꼬막 비빔 막국수, 육회 비빔막국수를 판매한다. 꼬막 한판은 꼬막 비빔밥과 돼지불고기가 함께 나오며 사이드로 소고기뭇국이 제공된다. 대기를 해야 할 경우 테이블 링 앱에서 대기목록 작성 후 핸드폰으로 입장 연락을 받은 후에 입장하면 된다. 매장 내부는 넓고 쾌적하다. 창가 바 자리는 2인만 앉을 수 있다. 3인 이상은 다른 테이블에 앉아야 한다. 창가 자리에서는 바로 앞의 넓은 바다를 보며 식사할 수 있다. 넓은 주차장이 있어 편하게 이용할 수 있다. 식사 전·후로 대부도를 둘러볼 수 있다.",
조만영의벌떡순대국,2899867,음식,음식점,한식,http://tong.visitkorea.or.kr/cms/resource/56/2899856_image2_1.jpg,전북특별자치도,126.8856939059,35.7978644138,"조만영의벌떡순대국은 김제에서 맛집으로 소문난 순댓국 전문점이다. 점심시간에는 웨이팅이 필수일 정도로 많은 손님이 찾는 곳이다. 회전율이 높은 식당인 만큼 자리에 앉자마자 밑반찬이 세팅된다. 부추무침, 깍두기, 새우젓, 고추, 양념장 등이 차려진다. 셀프바도 마련되어 있어 부족한 반찬은 리필해서 먹을 수 있다. 음식은 포장해 갈 수도 있다.",
조말론런던 롯데월드몰,2925506,쇼핑,쇼핑,사후면세점,http://tong.visitkorea.or.kr/cms/resource/74/2879174_image2_1.jpg,서울특별시,127.1040749597,37.5141653654,-,www.jomalone.co.kr
조명군총,2623673,인문(문화/예술/역사),역사관광지,유적지/사적지,,경상남도,128.0477970108,35.041525723,"조명군총은 조선조 선조 30년(1597) 정유재란 당시 선진리성(당시는 신채라고 함)에 포진하고 있던 왜적을 몰아내기 위해 조명연합군이 최후의 결전을 벌였다가 산화한 희생자의 넋이 잠들고 있는 곳이다.무덤의 형태는 사방 36㎡의 방형분묘(네모반듯한 무덤)로서 흔히 ‘당병무덤’이라 일컬었으며, 속칭 ‘댕강무데기’라고도 한다. 해방 전까지는 무덤 위에 [당병공양탑]이라 쓰인 높이 1m 가량의 표석이 서 있었으나 해방 후에 없어졌다. 그러나 이 무덤만은 약 400년 동안 원형을 그대로 유지한 채 잘 보존되어 왔으며, 지금은 조·명연합군전몰위령비가 무덤 앞에 세워져 있다.",
조명박물관,130742,인문(문화/예술/역사),문화시설,박물관,,경기도,126.9674976777,37.836072673,"조명박물관은 2004년에 설립, 2005년 등록(제05-박-05호)한 대한민국 유일의 조명 전문 박물관으로 다음과 같은 설립 목표를 갖고 있다.<br>
<br>
* 사라진 고유한 조명문화를 복원하고 재생시킨다.<br>
* 빛의 과거, 현재, 미래를 제시하여 인류 조명문화를 재발견한다.<br>
* 미래지향적인 융복합 조명문화를 창조한다.<br>
* 자연과 인간이 공존하고 발전하는 건강한 빛의 문화를 정립한다.","조명박물관 <a href=""http://www.lighting-museum.com/"" target=""_blank"" title=""새창 : 조명박물관 홈페이지로 이동"">http://www.lighting-museum.com</a>"
조무락,1208274,음식,음식점,한식,,경기도,127.4519712195,37.9871694597,"조무락골은 ‘깊은 계곡의 맑은 물소리와 함께 새들이 즐겁게 춤을 추며 노는 곳’이란 뜻으로 경기도 가평군과 강원도를 경계로 하는 화악산과 석룡산 사이에서 시작되어 7km이르는 계곡이 자연의 모습 그대로를 간직한 곳이다. <br  /> 조무락은 펜션과 식당, 농장을 함께 운영하고 있으며, 조무락폭포가 조무락농장의 중심부에 자리하고 있다. 천장이 높은 식당의 규모는 200평방미터로 각종 중소모임에 적합하며, 농약과 화학비료를 사용하지 아니하고 자연농법에 의한 안전한 먹거리를 재배하여 제공하고 있다. 자연 그대로 보존된 곳에서 오염요소 없이 생산되는 각종 쌈거리의 독특한 맛과 향이 도시에서는 느낄 수 없는 원래 쌈맛을 기억하게 한다. 특히, 주메뉴인 허브삼겹살은 조무락만의 독특한 맛과 향이 있다.<br>","<a href=""http://www.kapyong.co.kr"" target=""_blank"" title=""새창 : 조무락 홈페이지로 이동"">http://www.kapyong.co.kr</a>"
조무락계곡,1059024,자연,자연관광지,계곡,http://tong.visitkorea.or.kr/cms/resource/46/3381846_image2_1.JPG,경기도,127.4604648792,37.9874695817,"조무락계곡은 석룡산(1,120m) 자락을 흐르는 가평천의 최상류에 있는 험난한 계곡으로 6㎞에 걸쳐 폭포와 담(潭)·소(沼)가 이어진다. 산수가 빼어나 새가 춤추며 즐겼다 하여 조무락이라는 이름이 생겼다고도 하고 산새들이 재잘(조무락) 거려 붙여진 이름이라고도 한다. 넓은 물줄기가 좁아지며 폭포수가 돌아흐르는 골뱅이소와 중방소, 가래나무소, 칡소 등이 이어지는데, 복호등 폭포에 이르러 물줄기가 바위에 부딪쳐 부챗살처럼 퍼지는 모습이 아름다움의 절정을 느끼게 한다. 소마다 암석과 수목에 둘러싸여 있으며 바위 틈새에서는 한여름에도 한기를 느끼게 하는 찬바람이 나온다.
가평 물놀이하기 좋은 계곡으로 알려져 있으며 여름이면 많은 피서객들이 머무는 곳이다. 삼팔교 바로 아래에 계곡으로 내려갈 수 있는 계단이 있다. 물이 많이 흐르고 물속이 훤히 보일 정도로 맑으며 수심이 조금씩 달라, 깊은 곳은 3~4m 정도 되어 어른들도 물놀이하기 좋다. 산책로가 잘 조성되어 있어서 자연을 느끼며 조용히 산책을 즐겨도 좋다. 계곡 아래로는 나무그늘이 많아 시원하며 크고 작은 폭포물을 맞으며 상쾌함도 느낄 수 있다. 계곡 앞에서는 구명조끼를 무료 대여하고 있고 안전한 물놀이에 신경 써야 한다. 단지 주차장이 없어 길가에 적당히 주차해야 하는 것은 단점일 듯하다.","<a href=""https://blog.naver.com/ecopiagp/130111636146"" target=""_blank"" title=""새창 : 조무락계곡 홈페이지로 이동"">https://blog.naver.com/ecopiagp/130111636146</a>"
조무락닭갈비,2765436,음식,음식점,한식,http://tong.visitkorea.or.kr/cms/resource/63/2766263_image2_1.png,경기도,127.525005938,37.8080361141,"경기도 가평군 가평읍에 위치한 닭갈비 전문 음식점이다. 1층은 주차장, 2층이 홀이다. 매장이 넓다. 닭갈비가 주 메뉴인데 소금 닭갈비, 간장 닭갈비, 고추장 닭갈비 등을 숯불에 구워 먹는다. 후식으로는 비빔막국수가 있다. 각 테이블에 주문 단말기가 설치되어 이곳에서 주문을 한다. 비트쌈무, 갓절임, 백김치, 도라지 등이 있는 셀프 바가 있어 추가 반찬을 가져다 먹을 수 있다. 손님이 많을 때를 대비한 대기 장소가 있다. 온라인으로 닭갈비 밀키트를 판매한다. 자라섬에서 차량으로 5분 거리에 있다.",
조밀,2809326,음식,음식점,서양식,,대구광역시,128.595218372,35.8655871474,"대구 동성로에 위치한 레스토랑 ‘조밀’은 반월당역 11번 출구에서 멀지 않다. 스테이크 및 파스타를 맛볼 수 있는 양식 전문점이다. 시그니처 메뉴는 조밀 스테이크다. 스테이크 접시에는 빈 공간이 있는데 음식이 서빙된 후 자리에서 감자치즈를 폭포처럼 부어준다. 이러한 퍼포먼스로 눈과 입이 함께 즐거워진다. 이 외에도 마늘종 오일파스타, 토마토 치킨 오븐파스타 등 다양한 파스타 메뉴가 준비되어 있다.",
조바우가마솥추어탕,2574559,음식,음식점,한식,,경상남도,128.4201269208,34.885174867,"경상남도 통영시 광도면에 위치한 조바우가마솥추어탕은 가마솥에 푹 끓여낸 전통 추어탕 전문점이다. 잡내 없는 깔끔한 추어탕은 남녀노소 좋아하며, 추어탕을 못먹는 이들을 위해 돈까스와 만두도 판매하고 있다.<br>",
조박사소머리국밥 청라본점,2844603,음식,음식점,한식,http://tong.visitkorea.or.kr/cms/resource/93/2844593_image2_1.jpg,인천광역시,126.6606674555,37.5389406819,"조박사소머리국밥 청라본점은 인천 청라고등학교 인근 음식점 거리에 위치해 있다. 대표메뉴는 전통의 비법으로 고아낸 보약 같은 진한 육수의 맛을 느낄 수 있는 설렁탕과 한우 소머리국밥이 있으며, 이외에도 왕갈비탕과 무릎도가니탕, 한우 소머리수육 등이 있다. 메뉴를 주문하면 당일 도정한 쌀로 지은 누룽지 가마솥 밥이 함께 나온다. 여름 메뉴로 맷돌 콩국수를 판매하고 있는데 100% 국내산 우리 콩을 맷돌로 갈아서 만든다.","<a href=""https://xn--3e0by1zob020a7tl.com/"" target=""_blank"" title=""새창 : 조박사국밥 홈페이지로 이동"">https://www.조박사국밥.com</a>"
조발도,2752409,자연,자연관광지,섬,,전라남도,127.5542616176,34.6391094609,"조발도는 여수시 화정면에 딸린 섬이다. ‘말의 등처럼 평지 없이 얕은 구릉이 이어져 있으며 아침 해가 일찍 떠서 밝게 비춘다’는 뜻을 담아 조발도가 되었다. 둔병도와 육지로 이어지는 화양대교, 둔병대교가 생기면서 조발도를 방문이 더욱 편리해졌다. 조발도에 위치한 전망공원에 오르면 여수와 고흥 사이 5개 해상교량을 한눈에 볼 수 있고 조발 섬 둘레길도 산책하기 좋게 조성되어 있다.
조발도의 주민들은 주로 밭농사와 어업, 양식업에 종사하고 있다. 주요 농산물로는 주로 맥주보리와 고구마를 생산하며, 그밖에 쌀, 마늘, 무 등이 생산된다. 연근해에서는 멸치, 장어, 농어, 볼락, 피조개, 새꼬막, 굴 등이 주로 잡힌다.","<a href=""https://www.yeosu.go.kr/tour/travel/info_each_area?mode=view&idx=4680"" target=""_blank"" title=""새창 : 여수시 문화관광 홈페이지로 이동"">https://www.yeosu.go.kr/tour/</a>"
조방낙지,2574566,음식,음식점,한식,,경상남도,128.4259937244,34.8605527259,"조방낙지 통영점은 통영 무전동 낙지요리 전문점답게 낙지볶음, 낙새볶음, 낙곱새볶음이 대표 메뉴이다. ‘낙’은 낙지, ‘곱’은 곱창, ‘새’는 새우를 말한다. 세 가지 재료가 한데 어우러져 먹음직스럽고 그 맛 또한 일품이다. 조리시간도 짧아서 간단한 한 끼 식사 메뉴로 추천한다.",
조방제일한우,2853231,음식,음식점,한식,http://tong.visitkorea.or.kr/cms/resource/29/2853229_image2_1.jpg,부산광역시,129.0620308373,35.1408051364,"부산 범일역 인근에 위치한 조방방제일한우는 소고기구이 전문점이다. 범일동 맛집으로 소문난 조방제일한우는 넓은 내부 공간과 전용 주차장이 마련되어 있어 각종 회식과 모임 등을 하기 좋다. 이곳은 한우구이 전문점으로 등심, 갈빗살, 채끝등심, 안심, 꽃살 등 다양한 부위의 소고기를 맛볼 수 있다. 특히 오전 11시 30분부터 14시까지 한우 숯불 불고기와 함께 냉면 또는 된장찌개가 나오는 점심특선이 인기다. 불고기 외에도 한우국밥, 차돌박이 된장찌개, 냉면도 점심에 먹을 수 있다.",
조방해수탕,662756,인문(문화/예술/역사),휴양관광지,온천/욕장/스파,,부산광역시,129.0625724285,35.1418522515,"조방해수탕은 대형 찜질방 11개에서 다양한 찜질 체험을 할 수 있고, 사우나에는 발 마사지탕, 전신 맛사지탕, 고급 옥사우나 등을 체험할 수 있다.  도심 속에 자리 잡고 있는 조방해수탕의 해수에는 마그네슘, 브롬, 요드, 이온 등이 많이 함유되어 자율신경성 균형장애, 심장 혈관 계통 기능장애에 효과가 있으며, 항산화제들이 풍부하여 부신피질기능을 높여준다. 황토 찜질방의 황토 속에 있는 다양한 효소들은 독소 제거, 분해, 정화작용을 하며, 황토에서 발생하는 원적외선은 세포의 생리작용을 확장하고, 혈액순환을 활성화시켜서 신진대사를 강화하는 효과가 있다고 한다.",
조병수 가옥,1619375,인문(문화/예술/역사),역사관광지,고택,http://tong.visitkorea.or.kr/cms/resource/83/3353083_image2_1.jpg,인천광역시,126.4044377299,37.45122416,"인천광역시 중구 남북동에 있는 조선 말기의 고가이다. 1997년 7월 14일 인천광역시문화재자료로 지정되었다. 1890년 건립된 전형적인 중부형 주택으로서 경기도, 충청도 지방에 많은 주거 형식이다. 일반적 중류 주택으로 ‘ㄱ’자형의 대문채와 안채로 이루어져 있으며, 한 변이 터진 ‘ㅁ’자형 구조이다. 전체적으로 비교적 큰 양재를 사용해서 정교하게 가공, 건축한 건물이다.","<a href=""http://www.icjg.go.kr/tour"" target=""_blank"" title=""인천 중구 문화관광 사이트로 이동"">http://www.icjg.go.kr/tour</a>"
조병옥박사 생가지,1626846,인문(문화/예술/역사),역사관광지,생가,http://tong.visitkorea.or.kr/cms/resource/92/2601492_image2_1.jpg,충청남도,127.3146411403,36.7517016834,"유석 조병옥박사는 독립운동가이며 정치가로서 이곳은 그의 생가이다. 1894년 3월 21일 천안시 병천면 용두리에서 태어났으며 서울에서 배재학당을 거쳐 평양숭실전문학교를 나와 미국 콜롬비아대학 졸업 후 귀국 1927년 신간회 조직에 참여하여 광범한 항일 민족전선을 형성하는 운동에 나섰으며, 1929년 광주학생운동 배후조정혐의로 3년간 옥고를 겪었다. 정부 수립후 1951년 내무부 장관을 지내고 1960년에 민주당 대통령 후보로 출마 유세 중 신병으로 미국에서 사망, 1962년 3월 1일 대한민국 건국훈장 단장을 추서하였다. 이곳에 1995년 4월 20일 생가를 복원하였다. 조병옥 박사의 부친(조인원)은 아우내만세운동 당시 유관순 열사와 함께 주도적인 역할을 하였다.<br>","<a href=""https://www.cheonan.go.kr/prog/tursmCn/tour/sub01_01/view.do?cntno=56"" target=""_blank"" title=""새창 : 천안시 문화관광 홈페이지로 이동"">http://www.cheonan.go.kr/tour.do</a>"
조병화문학관,130565,인문(문화/예술/역사),문화시설,기념관,,경기도,127.2215950764,37.1120668213,"조병화문학관은 편운 조병화 시인의 유품 및 창작 저작물, 그림을 상설 전시하는 문학기념관으로 난실리 편운 동산 안에 예쁜 전원주택처럼 자리 잡고 있다.
조 시인이 전 생애의 창작활동을 통해 추구해 온 꿈과 사랑의 시정신이 오롯이 담겨 있으며, 한국 현대문학의 한 발자취가 보존된 곳이다. 조병화문학관은 1993년 조 시인이 대지를 제공하고 국고의 지원을 받아 문화사랑방으로 지어진 연건평 85평 규모의 2층 건물이며 8평의 부속 건물을 두고 있다. 1층에 전시실 2실, 2층에 세미나실을 갖추고 있다. 문학관에는 기획전시물과 조병화 시인이 남긴 53권의 창작시집, 수필집, 화집 등 160여 권의 서적, 시인의 유물 등이 있다.
편운 동산에는 문학관 외에도 넓은 잔디밭을 중심으로 1963년 시인이 어머니 묘소 옆에 세운 묘막인 편운재와, 교직 은퇴 후 시인이 집필 또는 휴식을 취하던 시골집인 청와헌, 또 조병화 시인의 묘소가 있다.
쉽게 읽히면서도 또한 깊은 감동을 전하는 시인의 시와 어울리게, 이 편운 동산에서 은은하고 그윽한 풍경을 느낄 수 있다. 또한 매년 5월 문학관에서 꿈과 사랑의 시 축제를 개최해 많은 사람에게 문학의 울림을 전달하는 좋은 기회를 제공하고 있다.","▪ <a href=""http://www.poetcho.com/"" target=""_blank"" title=""새창 : 홈페이지로 이동"">http://www.poetcho.com</a>"
조봉야영장,2792320,레포츠,육상 레포츠,"야영장,오토캠핑장",http://tong.visitkorea.or.kr/cms/resource/05/2793405_image2_1.jpg,강원특별자치도,128.5036127945,37.9497353358,"조봉야영장은 미천골계곡 중간 미천골 자연휴양림 입구 쪽에 있다. 서양양 나들목에서 구룡령으로 가면 어렵지 않게 찾을 수 있다. 민박을 겸하고 있는 이곳은 밖에서 보는 것과는 완전히 다른 매력을 지니고 있다. 민박 마당에 차를 세우고 세척장 뒤쪽으로 내려가면 별천지 같은 곳에 캠핑 사이트들이 조성되어 있다. 빼곡히 들어선 소나무들 사이로 계단을 조성하고 데크를 놓았다. 또한, 밖에서는 잘 보이지 않던 미천골계곡이 바로 앞으로 흐르고 물놀이도 할 수 있다.",
조부장 바다낚시터,2762711,레포츠,수상 레포츠,바다낚시,http://tong.visitkorea.or.kr/cms/resource/60/2763560_image2_1.jpg,경기도,126.5629754515,37.270450704,"조부장바다낚시터는 경기도 안산시 단원구에 있다. 다양한 바다 어종을 방류하여 바다낚시의 손맛을 느낄 수 있다. 매점과 식당, 휴게공간이 잘 갖추어져 있고 유아를 위한 놀이방이 있어 가족 단위로 낚시하기에도 좋다. 또한 회센터와 자가 손질 공간이 있어 잡은 고기를 즉석에서 맛볼 수 있다. 개인 사물함이 구비되어 있어 쾌적하고 편안하게 낚시를 즐길 수 있다.","<a href=""http://www.fishingcho.kr/index"" target=""_blank"" title=""새창:조부장바다낚시터홈페이지로 이동"">http://www.fishingcho.kr/index</a>"
조사리간이해수욕장,2756533,자연,자연관광지,해수욕장,,경상북도,129.3809750017,36.227341502,"조사리간이해수욕정은 경북 포항시 북구 송라면에 있다. 모래사장과 가까운 곳까지 자동차가 들어갈 수 있어 포항 앞바다를 조망하며 차박을 하는 사람이 많다. 백사장에서 미끼를 던지면 성대 등이 잡히기도 한다. 해수욕장에서 북쪽으로 가면 화진해수욕장이 있고, 남쪽 방향에는 월포해수욕장과 이가리항이 차례로 나온다.

(출처: 포항시 문화관광홈페이지)","<a href=""https://www.pohang.go.kr/phtour/index.do"" target=""_blank"" title=""새창 :포항시문화관광홈페이지로 이동"">https://www.pohang.go.kr/phtour/index.do</a>"
조산공원,1688386,자연,자연관광지,자연생태관광지,http://tong.visitkorea.or.kr/cms/resource/60/3349760_image2_1.JPG,충청북도,127.9919833522,36.8420563665,"수안보 온천지구에 있는 곳으로 근처의 아름다운 자연환경과 어우러진 쉼터이다. 한국전력공사가 수안보연수원을 신축하면서 부대시설로 만든 곳이다. 주민과 관광객, 연수원생들의 체력훈련과 볼거리 제공을 위해 1989년 조성되었으며 이용은 무료이다. 수안보온천이 한눈에 들어오는 곳에 자리하고 있으며 팔각정등산로와 식물원, 동물원, 체육관, 수족관, 박제관 등 다양한 시설로 구성되어 있다. 특히 조산공원 입구에서 정상까지 800미터에 이르는 등산로는 누구나 쉽게 오를 수 있는 길로 숲이 우거져 있어서 산림욕장으로 많은 사람들이 찾고 있다. 정상에 오르면 수안보온천 전경을 한눈에 볼 수 있는 팔각정이 있다. 
<출처: 충주문화관광 홈페이지>","<a href=""https://tour.chungbuk.go.kr/www/selectTourCntnts.do?key=60&searchMainSe=ATTR&tourNo=505"" target=""_blank"" title=""새창 : 홈페이지로 이동"">https://tour.chungbuk.go.kr/</a>"
조샌집,2843765,음식,음식점,한식,http://tong.visitkorea.or.kr/cms/resource/54/2843754_image2_1.JPG,경상남도,127.7245517576,35.5197077949,"조샌집은 경상남도 함양군 함양읍 운림리에 있는 어탕 전문점이다. 조샌집은 ‘조생원의 집’이란 뜻의 방언이다. 식당 내부는 모두 좌식으로 되어 있다. 어탕에 들어가는 꺽지, 동지개, 피라미, 메기는 특유의 비린내가 있지만 조샌집의 어탕은 비린내가 없어 어린아이부터 어르신들까지 모두 부담 없이 즐길 수 있다. 진한 육수에 면발이 들어간 어탕국수와 어탕밥을 선택할 수 있다. 기본 찬은 어묵볶음, 콩나물무침, 김치, 깍두기 등이 나오고 탕에 추가로 넣을 수 있는 방아잎, 다진 청양고추가 나온다. 또 좀 더 진하게 어탕을 즐기고 싶다면 산초가루를 넣어 먹기도 한다. 양이 푸짐하고 맛이 좋아 식객으로 알려진 허영만의 백반 기행에 소개되었다. 가까운 곳에 상림공원, 칠선계곡, 벽송사, 황석산, 오도재, 서암정사가 있어 연계 관광도 가능하다.
※ 반려동물 동반 불가",
