title,contentid,cat1,cat2,cat3,firstimage,region,mapx,mapy,overview,homepage
신광사(광주),319722,인문(문화/예술/역사),역사관광지,사찰,http://tong.visitkorea.or.kr/cms/resource/97/3367697_image2_1.jpg,광주광역시,126.9402606368,35.168922767,"신광사는 근현대 광주 지역 최초의 비구니 수행 도량으로 지금은 국가 지정 전통 사찰이다. 원래는 광주시 동구 지산동 조선대학교 교내에 있었는데, 1993년  북구 두암동 현재의 위치로 옮겼으며 송광사의 말사이다.  일주문, 대웅전 1동, 삼성각 1동, ㄷ자형 반야당 1동, 종각 1동, 무설당 요사채 1동으로 구성되어 있다. 1933년 광주 시내 최동열의 모친 김청재월 보살의 시주금으로 선암사 광주시 서방포교당으로 지산동에 창건되었다. 그 뒤 안혜운 스님이 인수하였다. 1964년 법당이 협소하여 법당과 선방을 중창하였고, 1974년 요사가 낡아 헐어지게 되자 요사와 강당을 중창하였다. 근래에는 선암사에서 송광사로 본사를 옮기고 비구니 스님들의 수행처로 국태민안을 기원하는 전법도량으로서 절을 이끌어왔다. 그러던 중 1990년 조선대 교내에 있던 사찰 부지를 팔고 현재의 위치로 옮겼다. 그 뒤 최경주 스님이 절의 살림을 맡아 1992년 대웅전에 불상과 보살상을 봉안하였고, 요사채, 삼성각, 지하실 등의 대대적인 불사를 하였다. 2016년 제3대 주지인 동현이 주석하면서 불교 수행과 포교, 비구니 후학 양성에 주력하고 있다.","<a href=""http://aks.ai/GC60003249"" target=""_blank"" title=""새창 : 디지털광주문화대전 홈페이지로 이동"">http://aks.ai/GC60003249</a>"
신광사(세종),319721,인문(문화/예술/역사),역사관광지,사찰,,세종특별자치시,127.2892524995,36.6235770632,"신광사는 세종특별자치시 조치원읍에 있는 노적산에 자리한 사찰이다. 창건연대는 약 160여 년 전으로 추측되며, 1920년 이경직 주지가 복원하였다는 기록이 남아있다. 창건 당시 토골절, 수양사(修養寺) 등으로 불리었으며, 혜원스님이 1980년 신광사로 개칭하였다. 젊음의 활기가 넘쳐흐르는 사찰. 누구나 신광사를 찾게 되면 느끼게 될 첫인상이다. 사찰의 역사가 길지 않음에도 불구하고 젊은 대학생들이 살고 있는 홍익대학교 세종캠퍼스가 근처에 있으며, 이들에게 적극적으로 부처님의 가르침을 전하고 있기 때문이다. 신광사는 참배객이 접근하기 좋은 곳에 위치해 있으면서 한편으로 그렇게 인연을 맺은 이들을 소홀히 하지 않고 품어 안으면서 불법을 전파하려고 노력하는 곳이다. 이러한 노력은 사찰 곳곳에 배치된 석물 하나하나에도 배어 나오고, 법당 안에 봉안된 불상에서도 느낄 수 있다.","<a href=""http://www.sejong.go.kr/tour/index.do"" target=""_blank"" title=""새창: 세종 행복나들이 홈페이지로 이동"">http://www.sejong.go.kr/tour/index.do</a>"
신광사(장수),127123,인문(문화/예술/역사),역사관광지,사찰,http://tong.visitkorea.or.kr/cms/resource/78/1605378_image2_1.jpg,전북특별자치도,127.4949032902,35.7050660889,"신광사는 830년(신라 흥덕왕 5년)에 충남 보령 성주사에서 구산선문의 하나인 성주산문을 세워 학도들을 지도하던 무염대사가 이 지방에는 그럴만한 절이 없는 것을 안타깝게 여기고 새로운 인재가 항상 자라 나라는 뜻의 신광사를 짓게 되었다. 
신광사가 창건된 지 733년이 되는 정유재란 때 화재로 소실되었으나 51년이 지난 1549년(인조 27)에 전해선사에 의하여 중건되었다. 다시 헌종 15년(1849) 당시 장수현감 조능하의 시주에 의해 중창되었다.
신광사 대웅전은 지방유형문화재로 전면 3칸, 측면 2칸 목조 맞배집으로 지붕은 너새라는 돌로 이어져 있으며 싸리나무 기둥으로 만든 명주전, 성수당, 요사채, 산령각, 객사 등으로 이루어져 있다. 현재는 비구니 스님의 도량이다. 
바로 앞에는 와룡호가 있고 인근에는 와룡자연휴양림이 자리하고 있다.","<a href=""https://www.jangsu.go.kr/tour/index.jangsu"" target=""_blank"" title=""새창 : 장수군 문화관광 홈페이지로 이동"">https://www.jangsu.go.kr/tour</a>"
신광수 다원,822721,인문(문화/예술/역사),산업관광지,기타,http://tong.visitkorea.or.kr/cms/resource/80/2516280_image2_1.jpg,전라남도,127.349729008,34.9913330962,"명인 신광수 차 다원은 명인 신광수 씨가 직접 운영하는 다원으로 순천 조계산 기슭에 있다. 수려한 주변 경관을 즐기면서 명인의 차를 맛볼 수 있을 뿐만 아니라 낙안읍성과 선암사가 위치하고 있어 관광하기에 좋은 곳이다. 명인 신광수 차밭은 고산지대에 자리하고 있으며 국내 최대 규모를 자랑하는 야생 죽로차 밭 3만여 평 (차 나무 수령 300여 년)도 보유하고 있다. 명인 신광수 수제차는 오염원이 없는 청정지역 십 오만여 평의 다원에서, 차나무 생육 이래 단 한 번도 비료나 농약을 사용하지 않고 자연농법으로 재배 관리하여 국립농산물 품질 관리원으로부터 유기농산물 품질인증을 받은 찻잎만을 채취하여 40여 년의 수제차 법제 경력 속에서 터득한 노하우와 온갖 정성을 다하여 가공 생산한다.<br /><br />잘 알려져 있듯이 전라남도 순천지역은 산과 물이 기이하고 고와서 세상에서 작은 강남이라고 일컫는 구절이 '동국여지승람' 순천도호부편 형승조에 나와 있고 토산조와 세종실록지리지에도 기후풍토가 좋아 양질의 차가 생산된다고 수록되어 있다. 또한, 허균(조선 선조 때 문신, 소설가 1569~1618)이 쓴 성소부부고 전지 26 도문대작(전국 8도의 식품과 명산지에 관하여 적은 책으로 조선시대 식품재료와 가공품을 한눈에 볼 수 있는 우리나라 최고의 식품 전문지)에는 '작설차는 순천산이 제일 좋고 다음이 변산이다'라는 내용도 볼 수 있다.<br>",
신교령사골순대국 본점,2873396,음식,음식점,한식,http://tong.visitkorea.or.kr/cms/resource/80/2873380_image2_1.jpg,인천광역시,126.7812385668,37.5823544376,"신교령사골순대국 본점은 인천광역시 계양구 벌말로 경인아라뱃길 하야소공원 맞은편에 있다. 이곳은 도심지 외곽이고 주차장이 넓은 주차장이 있어 대중교통보다는 자가용을 이용하여 방문하는 것이 좀 더 편리하다. 신교령사골순대국 본점은 사골로 우려낸 깔끔한 순댓국으로 사랑받고 있는 순댓국 동네 맛집이다. 매장은 1층 단독 건물로 내부는 넓고 쾌적한 모습이다. 대표 메뉴로는 순댓국, 술국, 소머리국밥 등이 있다. 특식인 수제족발, 순대전골이 손님들에게 인기가 많다. 농림축산식품부 제공 안심식당으로 인증받은 음식점이다.",
신구대학교식물원,128167,자연,자연관광지,수목원,http://tong.visitkorea.or.kr/cms/resource/37/3020837_image2_1.jpg,경기도,127.0809904354,37.4341881202,"성남시 수정구 적푸리로에 위치한 신구대학교식물원은 식물자원을 개발하고 연구할 목적으로 2003년 5월 개원하여, 국내외 식물을 체계적으로 수집, 보존, 전시하고 있다. 식물연구 외에도 관련학과 실습교육장 역할은 물론 가드닝 관련교육과 일반 시민과 함께 자연을 관찰하고 직접 체험할 수 있는 다양한 교육프로그램을 진행하고 있다. 
입구에 위치한 가든카페에서는 아름다운 숲 전시관의 중앙광장이 바로 보이며, 화사한 꽃들과 어우러져 여유로운 분위기를 연출한다. 국내외 식물을 체계적으로 수집, 보존, 전시하여  식물자원을 발굴하고 연구하는 곳으로 국가(산림청)가 인정한 수목원 전문가(가드너)를 양성하고 있다.
또한 식물 관련 직업교육, 청소년 및 일반 시민을 위한 환경교육을 진행함으로써 자연을 관찰하고 직접 체험할 수 있는 장을 제공하여 식물문화발전에 기여하고 있다.","<a href=""https://www.sbg.or.kr/main/index.html"" target=""_blank"" title=""새창: 신구대학교식물원 홈페이지로 이동"">https://www.sbg.or.kr/main/index.html</a>"
신기계곡산장식당,2904893,음식,음식점,한식,http://tong.visitkorea.or.kr/cms/resource/87/2904887_image2_1.jpg,전북특별자치도,126.7174776778,35.3868249082,"고창군 고수면에 있는 신기계곡 산장식당은 장작 삼겹살로 유명한 인기 맛집으로 한때는 여름에만 영업했지만, 지금은 4계절 내내 운영하고 있다. 식당 옆으로 계곡물이 흘러 음식을 먹으면서 주변 풍광을 즐길 수 있는 자연 친화적인 식당이기도 하다. 이곳에서는 사장님이 장작 위 대형 돌판에 두툼한 먹음직스러운 삼겹살과 버섯, 콩나물을 올려 불을 조절하며 직접 맛깔스럽게 구워준다. 또한 뚝배기에 국물을 한가득 담아서 올려주고, 맛있게 구워진 삼겹살은 장아찌와 김치에 곁들여 먹으면 조화가 좋다. 여름 휴가철에는 예약을 안 하면 자리가 없을 정도로 유명하고, 백숙이나, 오리백숙 등은 여름철 대표 메뉴로 예약 시에만 맛볼 수 있다. 
※ 반려동물 동반 가능",
신기마을,2794614,인문(문화/예술/역사),역사관광지,민속마을,http://tong.visitkorea.or.kr/cms/resource/53/3343853_image2_1.jpg,전북특별자치도,127.542975123,35.4521400229,"신기마을은 선조 28년(1595) 임진왜란 후 인동 장씨 장덕복이 이곳에 터를 잡아 마을이 형성되었다. 전란에 고통을 받다가 지리산의 기운이 이어지는 명당자리로 새 삶을 시작하는 터전이란 뜻으로 ‘새터(신기,新基)’라 하였다. 신기마을은 지형학적으로 와우형, 즉 소가 누워 있는 평화로운 정경이라고 한다. 초봉에는 운봉의 갑부 박희옥이 만든 별장이 있었다. 이곳에서 많은 명창 소리꾼들을 불러 판소리를 감상하고, 또 그들을 적극적으로 후원하여 판소리 발전에 크게 기여하였다고 한다.",
신기숲,2836405,음식,음식점,카페/전통찻집,http://tong.visitkorea.or.kr/cms/resource/98/2836398_image2_1.jpg,부산광역시,129.0603019046,35.0868889171,"부산 영도에 있는 신기카페에서 더 여유로운 공간으로 보여주고자 가까운 위치에 신기숲을 오픈했다. 작은 건물에 지어진 신기숲은 산새소리유치원을 개조하여 만든 카페다. 대나무 숲 속에서 자연을 훼손하지 않고 산새 소리와 바람 소리 그리고 따뜻한 햇살을 느낄 수 있는 곳이다. 내부는 자연 친화적 디자인의 인테리어와 우드 테이블이 감성을 더한다. 그리고 직접 만들어 나오는 신선한 빵과 이곳만의 색다른 시그니처 음료가 준비되어 있다. 허브티 종류도 카페인, 디카페인으로 준비되어 카페인에 민감한 사람들에게는 메뉴 선택의 폭이 넓다. 13세 이하 출입 불가인 노키즈 존으로 운영하며 무료 와이파이 제공이 없어 차분하게 커피를 마실 수 있는 곳이다.","<a href=""http://sinki.co.kr/?folder=brand&page=forest""target=""_blank"" title=""새창 : 신기숲 사이트로 이동"">http://sinki.co.kr/</a>"
신기아꾸,2923655,음식,음식점,한식,http://tong.visitkorea.or.kr/cms/resource/34/2923634_image2_1.jpg,전라남도,127.6727370471,34.7617338806,"여수 현지인들이 즐겨 찾는 아귀찜 전문점 신기아꾸는 4인 테이블, 8인 테이블 그리고 안쪽 벽 쪽 자리도 있어 여럿이 함께 와도 식사하기 편한 곳이다. 아귀는 남해안에서 많이 잡히는데 현지인들의 억양이 세서 아꾸라고 부르기 때문에 '신기아꾸'가 되었다고 한다. 신기동에서 30년 넘은 아주 오래된 식당으로 최근에는 입식으로 앉아서 먹을 수 있게 인테리어 공사를 해서 신발을 벗지 않고도 그대로 편하게 앉아서 먹을 수 있다. 깔끔하고 깨끗한 실내에 메뉴는 아귀찜, 아귀탕, 서대회, 대창 찜으로 단출하다. 밑반찬으로는 노각무침, 고사리, 멸치볶음, 계란찜 등이 나온다. 주차장은 따로 없어 근처 골목이나 뒤쪽 주택가에 주차해야 한다. 단, 도로변은 주차단속 구역이니 주의해야 한다. 주변에 신기공원, 시모공원 등이 있어 연계 관광하기 수월하다.",
신기여울,2869477,음식,음식점,카페/전통찻집,http://tong.visitkorea.or.kr/cms/resource/65/2869465_image2_1.jpg,부산광역시,129.0443951556,35.0794950074,"부산 영도구에 있는 신기여울은 해안가 앞에 있어 바다 전망을 볼 수 있는 카페이다. 순백색의 건물과 테라스가 있는 신기여울은 이국적인 분위기로 많은 사람이 찾는 곳이다. 특히 테라스에 앉으면 파노라마 뷰로 바다를 한눈에 담을 수 있고, 천장에 하얀 천이 햇빛을 막아주어 편하게 커피를 마실 수 있다. 신기여울은 1층, 2층 카페, 지하 1층은 부산을 소재로 한 물건들과 다양한 액세서리를 판매하는 신기잡화점을 운영하고 있다. 볼거리가 있는 신기여울은 부산 영도에 오면 한 번쯤 들러봐야 하는 카페이다. 근처 지역 명소로 알려진 흰여울문화마을도 가까이 있어 함께 둘러보기 좋다.",
신기한놀이터 떼굴떼굴,2783484,인문(문화/예술/역사),체험관광지,이색체험,http://tong.visitkorea.or.kr/cms/resource/89/2787789_image2_1.jpg,서울특별시,126.9384796907,37.5854041134,"홍제 1동 주택가 산 아래 탁 트인 야외 공간에 조성된 ‘신기한 놀이터 떼굴떼굴’은 아이들이 신나고 안전하게 놀 수 있는 자연 모래 놀이터다. 서대문구가 어린이가 바라고 꿈꾸는 놀이터를 만들어보자는 취지로, 2019년 11월에 개장한 놀이터는 모래 놀이터 3곳, 세족장, 음수대, 공중화장실이 조성되어 있다. 놀이터는 세 개의 원형 놀이터로 구성하고, 촉감놀이에 적합한 동해안 모래를 깊이 50cm 이상으로 조성했다. 원목 놀이 기구, 천연목재 산책로, 황토 포장 등 놀이공간의 다양한 시설도 천연재료를 사용하였고, 자연 지형과 지물을 최대한 활용하여 다른 놀이터와 확실한 차이를 두었다. 다양한 놀이시설들 가운데 롱미끄럼틀과 집라인은 아이들의 호기심을 유발한다. 관리사무실 앞에 비치되어 있는 어린이 자전거와 모래놀이 도구들은 대여해서 사용할 수 있다. 놀이터 개장은 오전 9시이며, 마감은 4월~10월 중에는 오후 6시,  11월~3월 중에는 오후 4시 40분이다.",
신길동매운짬뽕,2852644,음식,음식점,중식,http://tong.visitkorea.or.kr/cms/resource/31/2852631_image2_1.jpg,서울특별시,126.916536445,37.5153979682,"신길동매운짬뽕은 지하철 1호선, 5호선 신길역 1번 출구 부근에 있다. 매장은 골목길 상가 건물에 있고 별도의 주차장은 없다. 식당 인근에 영등포여자고등학교 공영주차장을 이용하면 편리하다. 이곳은 TV 맛집 프로그램에 매운 짬뽕집으로 여러 차례 소개되었다. 매장 안에는 1인용 바형 테이블이 많다. 대표 메뉴는 홍합 매운 짬뽕이다. 그 외 얼큰 차돌 짬뽕, 옛날짜장, 백 짬뽕, 김밥, 기계우동 등이 있다. 메뉴는 배달 주문을 할 수 있다. 주변에 영등포공원, 중마루공원, 여의도 샛강생태공원이 있어 식사 전후에 둘러보기 좋다.",
신길양꼬치,2682811,음식,음식점,중식,http://tong.visitkorea.or.kr/cms/resource/59/2682659_image2_1.jpg,서울특별시,126.9127424566,37.5114900206,양고기 요리뿐만 아니라 다양한 중식 요리를 맛볼 수 있는 곳이다. 서울특별시 영등포구에 있는 중식전문점이다. 대표메뉴는 양꼬치다.,
신길역사유적공원,2757183,인문(문화/예술/역사),휴양관광지,공원,http://tong.visitkorea.or.kr/cms/resource/99/2761399_image2_1.jpg,경기도,126.7844479394,37.3357414734,"신길역사유적공원은 경기도 안산시 단원구에 있는 공원으로, 2002년 신석기 수혈주거지 23기가 확인되어 유적의 영구 보존을 위하여 역사유적 공원화가 결정되어 조성되었다. 수혈주거지를 비롯해 다양한 선사시대 유물도 출토되었고 이를 기반으로 역사 학습장, 선사 주제마당, 선사 놀이마당 등으로 알차게 꾸며져 있다. 공원을 산책하며 둘러보기 좋아 여유롭게 휴식을 취하거나 신석기시대를 체험해 볼 수 있다.",
신꼬가,3305818,쇼핑,쇼핑,사후면세점,http://tong.visitkorea.or.kr/cms/resource/90/3313290_image2_1.jpg,강원특별자치도,127.9508307441,37.349736023,-,
신나개 애견펜션,2913773,숙박,숙박시설,펜션,http://tong.visitkorea.or.kr/cms/resource/00/2920900_image2_1.jpg,강원특별자치도,129.2432470395,37.3818736659,"신나개 애견펜션에 오신 것을 환영한다. 펜션 지기 태봉, 태순이가 친구들을 반갑게 맞이 할 거다! 신나개애견펜션에서 사랑하는 반려견과 잊지 못 할 추억, 그리고 행복한 시간 만드시길 바란다! 우리 댕댕이들과 삼척 신나개애견펜션에서 만나길 바란다!",
신나는 과학 체험 놀이터,2568567,추천코스,힐링코스,힐링코스,http://tong.visitkorea.or.kr/cms/resource/00/2546200_image2_1.jpg,Unknown,127.1421679785,37.9265458453,"과학이 놀이를 만나 재미있고 즐거워지는 과학 체험 놀이 공간 어메이징파크. 숲에 둘러싸여 있어 평화로운 휴식의 시간도 제공한다. 아이들은 물론 어른들까지 온몸으로 과학을 체험하며 재미있게 놀 수 있다. 연천 DMZ 여행지와 연계하기 좋고, 사계절 허브향이 가득한 허브아일랜드, 블루베리 수확과 요리체험을 하는 푸른언덕블루베리 등 주변 여행지도 매력적이다.",
신나라분식김밥,2688098,음식,음식점,한식,http://tong.visitkorea.or.kr/cms/resource/56/2684456_image2_1.jpg,경상북도,128.722312228,36.5667237117,김에 밥과 여러가지 재료를 넣고 말아서 만든 음식이다. 경상북도 안동시에 있는 한식전문점이다. 대표메뉴는 김밥이다.,
신난다 글램핑,2747488,레포츠,육상 레포츠,"야영장,오토캠핑장",http://tong.visitkorea.or.kr/cms/resource/66/2747966_image2_1.jpg,경상북도,128.5732715659,35.7198393392,"신난다 글램핑은 경북 청도군 각북면에 자리 잡고 있다. 캠핑장에는 반려견과 함께 이용할 수 있는 글램핑 15개 동을 마련했다. 객실 간 거리가 넓어 프라이빗 한 캠핑을 즐길 수 있다는 점이 매력적이다. 객실 내부에는 침대, 소파, 선반, 에어컨, 전기밥솥, 커피포트, TV 등을 비치했다. 외부 전용 데크에는 개수대, 테이블, 의자를 배치해 바비큐를 즐길 수 있다. 사계절 내내 평일 주말 쉬지 않고 운영한다. 예약은 온라인 실시간으로 가능하다. 캠핑장 주변에 비슬산 자연휴양림, 화원 자연휴양림, 그레이스 CC 등이 있어 연계 관광이 용이하다. 가까운 거리에 청국장으로 유명한 식당 등 여러 음식점이 성업 중이다.",
신남불고기,1986641,음식,음식점,한식,http://tong.visitkorea.or.kr/cms/resource/90/1986190_image2_1.jpg,강원특별자치도,127.7165965149,37.8188661842,신남불고기는 정육점과 함께 운영하는 식당으로 불고기가 대표 메뉴이며 그 외에도 육개장과 제육 백반이 맛이 좋다.,
신남서원,1959867,인문(문화/예술/역사),역사관광지,유적지/사적지,,경상남도,128.6662027641,35.5008490866,"무안면 정곡리에 있는 신남서원은 고려 말기 대마도정벌과, 조선 태조 이성계를 도와 위화도 회군에 공을 세운 정국군 박위와 조선 초기 문신인 소총재 박기 부자를 향사하는 서원이다. 밀성 박씨 정국군파 종중 소유로 종중에서 관리한다.
신남서원은 순조 22년(1822)에 후손인 박성기의 주청으로 밀양 사림의 공론을 모아 창건 하였다. 서원내 사당을 상모사, 강당을 경보당이라 하며, 당시 봉안문과 상향축문은 응교 강세백이 지었다. 이 서원의 주향으로 모셔져 있는 박위장군은 고려 우왕 때 김해부사로서 여러 번 왜구를 격파했고, 우왕 14년에는 경상도도순문사의 직책으로 전선 100여 척을 인솔하여 이종무 이후 대대적으로 대마도를 쳐서 300여 척의 왜선을 불태우는 등 대승을 거두었다. 1994년 우리 손으로 네 번째 건조된 잠수함에 이 박위장군의 이름을 빌어 ‘박위함’으로 명명하기도 했다.
고종 5년(1868)에 내려진 서원 철폐령에 따라 사당은 철거되었으나, 후손들은 서원 강당의 당호를 경보당으로 바꾸고 재실로 삼아 이곳에서 박위 장군을 주향, 박기를 배향으로 향사를 올렸다. 1981년에는 후손들의 발의와 고을 유림들의 호응으로 상모사를 이전대로 중건하였다. 
서원의 배치는 사당인 상모사를 중심으로 전면에 신문을 설치하여 신역을 구분하였으며, 사당 밖에는 강당인 경보당이 있다. 경보당은 견치석으로 쌓은 높은 기단 위에 지은 정면 5칸, 측면 2칸 규모 홑처마 팔작지붕의 건물이다. 평면은 가운데 삼 칸 대청을 두고 그 좌우에 온돌방을 들인 형식이며, 대청 앞은 개방하고, 온돌 앞에는 두 짝의 띠살창이 달려 있다.","<a href=""https://www.grandculture.net/miryang/toc/GC08701064"" target=""_blank"" title=""새창 : 홈페이지로 이동"">https://www.grandculture.net/miryang/toc/GC08701064</a>"
신남큰집,2893912,음식,음식점,한식,http://tong.visitkorea.or.kr/cms/resource/02/2893902_image2_1.jpg,강원특별자치도,127.7154911066,37.8172885692,"신남큰집은 강원도 춘천시에 있는 삼계탕 전문점이다. 오래된 한옥을 리모델링해서 식당으로 사용하고 있다. 내부는 가정집 분위기에 노포 같은 느낌이다. 식당 테이블은 입식과 좌식으로 나뉘어 있다. 방 쪽 자리는 좌식이고 마루 자리는 입식이다. 식당 한편에 엄청나게 많은 담금주가 전시되어 있다. 삼계탕을 주문하면 밑반찬으로 백김치, 깍두기, 생양파, 마늘종, 고추가 나온다. 부족하면 추가할 수 있다. 누룽지 삼계탕을 1인분씩 판매한다. 주차는 매장 앞에 넓은 전용 주차장이 있어 이용이 편리하다.",
신남항,2716754,자연,자연관광지,항구/포구,http://tong.visitkorea.or.kr/cms/resource/86/3345486_image2_1.jpg,강원특별자치도,129.3279235618,37.2671246236,"신남항은 삼척시 원덕읍에 있으며 주위에는 해신당 공원과 어촌민속전시관이 있다. 신남항은 바닷가의 슬픈 전설이 내려오는 곳이라 작지만 유명하다. 신남항은 등대가 가장 예쁜 곳이다. 산책코스로 좋은 해신당공원 내려오는 길에 있어 공원 산책 후 바다를 둘러보는 것도 좋다. 신남항은 등대가 아름다운 곳이다.

(출처 : 강원도청)",
신남해변,127730,자연,자연관광지,해수욕장,http://tong.visitkorea.or.kr/cms/resource/85/3070885_image2_1.jpg,강원특별자치도,129.3269348035,37.2657303197,"삼척에서 남쪽으로 30km 거리의 7번 국도에 접해 있는 작은 해수욕장이다. 해수욕장의 길이는 약 100m로 규모가 작고 아담하며, 모래밭이 100m 가량이고 그 너머로는 갯바위들이 많다. 수심이 얕고 파도가 잔잔하여 아이들을 데리고 가기 좋은 해변으로 가족 단위의 관광객들이 많이 찾는 곳이다. 스노클링 명소로 알려져 있고 방파제 낚시를 즐길 수 있는 곳이다.
삼척에는 동해안에서 유일하게 남근숭배 민속마을이 있는 지역인데 해신당이 있는 신남마을이 그곳이다. 신남해변 인근에 있는 해신당공원에는 해신당, 어촌민속전시관 및 공원산책로, 해학적인 웃음을 자아내는 남근 조각공원 등이 조성되어 피서와 자연관광을 함께 즐길 수 있다. 해신당은 처녀총각의 애절한 사연과 함께 남근 전설이 있는 고장이다.","▪ <a href=""http://www.samcheok.go.kr/tour.web"" target=""_blank"" title=""새창: 삼척 문화관광 홈페이지로 이동"">http://www.samcheok.go.kr/tour.web</a>"
