title,contentid,cat1,cat2,cat3,firstimage,region,mapx,mapy,overview,homepage
사빈서원,1958871,인문(문화/예술/역사),역사관광지,유적지/사적지,,경상북도,128.8751416859,36.5201985718,"이 서원은 조선 중기 학자 청계 김진(1500~1580) 선생과 그의 아들 5형제의 유덕을 추모하고 후학을 양성할 목적으로 1709년 사림과 자손들의 공의에 의하여 세워졌다. 1871년 서원철폐령에 의하여 훼철되어, 중건과 이전을 거듭하여 현재의 모습인 강당과 주사만 남아 있다. 당초에는 임하면 사의동에 위치하였으나 임하댐 건설로 인해 1987년 현 위치로 옮겨졌다. 
강당은 정면 6칸, 측면 2칸의 제법 규모가 큰 편에 속한다. 자연석 기단 위에 자연석 주초를 놓고 그 위에 원주와 각주를 혼용해서 세웠는데 중앙 대청은 정면 4칸으로 매우 넓게 하였다. 대청을 중심으로 해서 좌우에 통칸 온돌방이 드리워져 있어 일반적인 강당 평면형식이다. 우물마루 상부는 5량가로 구성되어 있으며 박공지붕이다. 건물 정면에는 ′경덕사′라는 편액이 있는데 이것은 묘우의 현판을 강당에 옮긴 것으로 보인다. 
현재 교육 기능은 사라지고 매년 3월과 9월 중정에 향사를 지낸다. 사빈서원 입구 경원루 앞에는 널리 배우고 독실하게 실천하자라는 뜻의 [박학독행] 비석이 새겨져 있으며, 옆에는 유교 문화를 계승하고 선비 양성을 위해 지은 금장각 도서관이 있다.","▪ <a href=""http://www.tourandong.com"" target=""_blank"" title=""안동시 문화관광 사이트로 이동"">http://www.tourandong.com</a><br>▪ <a href=""http://www.cha.go.kr/"" target=""_blank"" title=""국가유산청 사이트로 이동"">http://www.cha.go.kr</a>"
사뿐_가로수길점,2899722,쇼핑,쇼핑,사후면세점,,서울특별시,127.0224544375,37.5202826313,-,www.sappun.co.kr
사뿐_홍대점,2903119,쇼핑,쇼핑,사후면세점,http://tong.visitkorea.or.kr/cms/resource/88/2887888_image2_1.jpg,서울특별시,126.9271065635,37.5558212374,-,
사산사,1957421,인문(문화/예술/역사),역사관광지,유적지/사적지,http://tong.visitkorea.or.kr/cms/resource/97/3381997_image2_1.JPG,전라남도,126.6029468552,35.1362541251,"사산사는 1670년(현종 9년)에 서원으로 창건하였다. 1700년(숙종 26년)에 사우로 중건하고, 함평이씨 시조 함풍군 언, 전라좌수사 춘수, 효우당 접의 삼위를 초향 했다. 1778년(정조 2년)에 함성군 장양공 종생, 기성군 긍 이위를 추가 배향하고 향사우로 봉향하였다. 1868년(고종 5년)에 국령으로 사우를 훼철하였고, 1872년(고종 9년)에 사당 내 유허비와 제단을 세우고 제사를 지냈다. 1902년(광무 6년)에 영풍문회에서 1906년에 단문과 담장을 축조하고 제전을 마련했으며, 1910년에 사우를 복원했다. 1936년에 현재 사우로 중건하여 참판공 종수와 현령공 주 이위를 추가로 배향했다. 1988년에 신실 단청과 내외삼문 및 담장 일부를 준공하였고, 1990년 경행당(강당)을 준공했다. 매년 양력 3월 마지막 토요일에 제향을 올린다.",
사상강변축제,2032436,인문(문화/예술/역사),축제,일반축제,http://tong.visitkorea.or.kr/cms/resource/33/3375033_image2_1.JPG,부산광역시,128.9735266606,35.168939243,"부산 사상구 대표 축제인 사상강변축제는 도심 속 천혜의 자연을 배경으로 누구나 즐길 수 있는 로컬 문화예술 콘텐츠로 구민을 찾아간다. 올해 제21회를 맞는 사상강변축제의 슬로건은 “대한민국의 미래정원을 품다!”로, 생태환경도시 사상구의 역량과 미래를 널리 알린다. 사상강변음악회, 사상강변가요제, 정원 매직 페스티벌, 사상 청소년 예술제, 사상 다문화 박람회 등 다양한 프로그램이 마련되어 있으며, 축제장소인 삼락생태공원은 부산 제1호 지방정원으로 지정되었다.","<a href=""https://xn--21-cu1is46cnpevdv68cga227juzv.kr/"" target=""_blank"" title=""새창 : 사상구청 사상강변축제 안내 페이지로 이동"">https://xn--21-cu1is46cnpevdv68cga227juzv.kr/</a>"
사상근린공원,2785762,인문(문화/예술/역사),휴양관광지,공원,http://tong.visitkorea.or.kr/cms/resource/07/3370707_image2_1.jpg,부산광역시,128.9768740479,35.1521995132,"사상 근린공원은 다양한 테마공간이 마련되어 있어 아이들과 야외 활동을 하기 좋은 놀이공간이다. 동화 이상한 나라의 앨리스를 주제로 한 시계 광장을 시작으로 유아 숲 체험장인 작은 숲 속 나라, 어린이 놀이터인 신비의 숲, 모험심을 기를 수 있는 모험의 성 등이 있다. 놀이장 상단부 숲 속 쉼터에는 동화에 등장하는 동물들을 실제로 만나볼 수 있는 소규모 체험장도 마련되어 있어,  동화 속에 와있는 듯한 행복감을 준다.  그 외에도 바운스 돔, 짚 라인, 바닥분수대, 사상 정원, 솔밭쉼터 등 아이들이 재밌고 즐겁게 뛰어놀면서 모험심도 기르고, 꿈도 키울 수 있는 공원이다. 어른들을 위한 산책로도 있다.","<a href=""https://www.sasang.go.kr/tour/index.sasang"" target=""_blank"" title=""새창 : 홈페이지로 이동"">https://www.sasang.go.kr/tour/index.sasang</a>"
사상문화원,130382,인문(문화/예술/역사),문화시설,문화원,,부산광역시,128.994858718,35.1476309123,"1999년 개원한 사상문화원은 사상 주민들의 수준 높은 문화 향유 기회 제공과 삶의 질 향상을 목표로 설립된 문화원이다. 주된 사업은 문화 예술 진흥사업, 교육사업, 지역 문화 활성화 사업이다. 문화예술 진흥사업의 경우 다누림홀 기획공연, 문화가 있는 날, 사상강변축제 등을 통해 진행하고 있다. 문화 예술 교육의 경우엔 민요, 노래교실, 한국무용, 필라테스 등 폭넓은 교육 프로그램을 운영 중이다. 또한 사상문화지 발간, 사상향토사 연구 사업 등을 통해 지역의 문화를 연구, 보존에 힘쓰고 전통문화에 대한 올바른 이해를 돕기 위해 노력하고 있다.","<a href=""http://www.sasangculture.or.kr/"" title=""새창 : 사상문화원 홈페이지로 이동"" target=""_blank"">http://www.sasangculture.or.kr</a>"
사상생활사박물관,3017191,인문(문화/예술/역사),문화시설,박물관,http://tong.visitkorea.or.kr/cms/resource/63/3017163_image2_1.JPG,부산광역시,128.9787455646,35.1720612119,"사상생활사박물관은 2016년 5월 개관하여 사상의 자연과 함께 살아온 사람들의 생활사 변천 과정을 전시하고, 지역에 산재해 있는 관광자원을 소개하는 곳이며, 주민들이 주도적으로 운영에 참여하고 전문가와 행정이 협업하여 지역의 문화를 발전시키는 주민들의 소통 공간이다. 
사상지역은 1970년대 대한민국 근대화에 있어 중추적인 역할을 해왔으나, 공업화의 악영향으로 회색도시, 문화의 불모지라는 오명과 함께 날로 낙후되어 가고 있는 사상공업지역에 문화와 소통의 향기를 전하는 문화 네트워크형 박물관을 건립하여, 잊혀져가는 사상 주민들의 생활사와 추억들을 수집하여 역사를 조명하고 미래를 준비하기 위하여 사상생활사박물관을 건립하게 되었다.
제1전시실은 강, 사상 삶의 젖줄을 테마로, 제2전시실은 모래톱에 불어온 근대화 바람으로, 제3전시실은 사상의 오늘과 미래를 테마로 전시하고 있으며, 특별 전시와 기획 전시를 운영하고 있다.","<a href=""http://www.sasang.go.kr/lmuseum/"" target=""_blank"" title=""새창 : 홈페이지로 이동"">http://www.sasang.go.kr/lmuseum/</a>"
사색연희,3068053,음식,음식점,이색음식점,http://tong.visitkorea.or.kr/cms/resource/32/3067132_image2_1.jpg,서울특별시,126.9295420958,37.5684559235,"연희동의 주택을 감각적인 인테리어로 개조한 프리미엄 타이 음식점이다. 대지 120평, 실내면적 60평 규모의 단독주택을 개조하고 불멍이 가능한 넓은 정원이 있다. 1층에는 윤잇팜(yunit farm)의 스마트 재배기를 통해 친환경 작물을 재배 후 바로 조리할 수 있어 전문 셰프의 레시피로 선보이는 태국 현지의 맛을 신선하게 느낄 수 있다. 감각적인 인테리어와 어울리는 하이엔드 빈티지 가구들과 유명 작가들의 작품들이 곳곳에 걸려있어 갤러리를 연상시킨다. 2층 카페에서는 다양한 작품과 책을 볼 수 있으며, 예술의 중심 연희동에 어울리는 다양한 문화 콘텐츠들도 펼쳐진다. 여러 아티스트들의 공연과 다양한 분야의 강연 및 클래스, 연희동을 애정 하는 사람들이 모여 이야기하는 <연희동 반상회>등 사색연희에서는 식사와 차를 마시며 새로운 사람과 만나 교류하고, 전시도 관람하고, 공연과 강연도 들을 수 있는 복합문화공간이다.",
사생활,2807250,음식,음식점,이색음식점,,충청남도,127.1045168317,36.8085330717,"삶을 가치 있게 할 프라이빗한 만남의 공간이라는 슬로건 아래 개업한 사생활은 동서양의 식재료가 어우러진 메뉴들로 구성되어 있다. 시골오일 파스타, 스카치에그 바질크림 파스타가 시그니처 메뉴이며, 감동카체 4종 플레터 역시 인기 메뉴이다. 5인 이상 예약 시, 사생활 룸과 애견동반 룸도 예약 가능하다.",
사석한우촌,2903691,음식,음식점,한식,http://tong.visitkorea.or.kr/cms/resource/56/2903656_image2_1.jpg,충청북도,127.4094639063,36.8252504794,"사석한우촌은 충청북도 진천군 진천읍 사석리에 있다. 세월의 흔적이 엿보이는 외관과 고풍스러운 분위기를 연출하는 인테리어가 눈에 띈다. 내부에는 단체석이 마련되어 있어 각종 모임을 가지기 좋다. 대표 메뉴는 한우암소 꼭지살, 한우암소살치살, 한우암소 안창살 등 각종 구이용 한우다. 이 밖에 한우암소갈비탕, 한우암소설렁탕, 한우암소육개장, 한우암소불고기백반 등 식사류도 준비되어 있다. 진천IC에서 가깝고, 주변에 생거진천자연휴양림, 만뢰산자연생태공원이 있다.",
사선대관광지&조각공원,126315,인문(문화/예술/역사),휴양관광지,공원,,전북특별자치도,127.2745375809,35.6724242759,"사선대관광지는 섬진강 상류 오원천 기슭 사선대 주변에 조성되어 1985년 국민관광지로 지정됐다. 사선대에는 진안군 마이산의 두 신선과 임실면 운수산의 두 신선이 관촌의 강변이 아름답다는 소문을 듣고 찾아와 노는 것을 하늘의 네 선녀가 보고 내려와 함께 놀았다는 전설이 전한다.
예로부터 소나무와 벚나무가 울창하여 봄에는 벚꽃이 만발하고 여름에는 물놀이를 즐기는 사람들로 붐빈다. 가을에는 단풍이 절경을 이루며 겨울에는 하류에 얼음이 두껍게 얼어 썰매나 스케이트를 타기에 좋다. 사선대 위 깎아지른 절벽 위에는 전라북도 유형문화재로 지정된 정자 운서정이 있다. 1928년부터 6년에 걸쳐 지었으며 전통적인 조선시대 건축 양식에 따라 정각과 동서재, 가정문으로 이루어져 있다. 일제강점기에는 이곳에서 나라의 우국지사들이 모여 망국의 한을 나누며 앞날을 토론했다고 한다.
사선대조각공원은 전 세계 10여 개국 작가들의 조각작품과 인근 오궁리미술촌에서 향토 조각가들이 직접 제작한 조각작품을 감상할 수 있는 곳이다. 잘 가꾸어진 산책로를 따라 걸으며 아름다운 풍경 속에서 멋스러운 조각작품을 감상할 수 있다. 높이 3m, 길이 20m에 이르는 콘크리트 벽에 네 명의 신선과 네 명의 선녀가 등장하는 사선대 전설을 그린 벽화도 눈길을 끈다. 또, 공원 내에 장미원과 장미터널을 만들어 꽃이 만발하는 시기가 되면 향긋한 장미향을 맡으며 길을 거닐 수 있다.","<a href=""http://tour.imsil.go.kr/"" target=""_blank"" title=""새창 : 임실군 문화관광 홈페이지로 이동"">http://tour.imsil.go.kr/</a>"
사성암(구례),317559,인문(문화/예술/역사),역사관광지,사찰,,전라남도,127.4806237802,35.1801668652,"사성암은 구례읍에서 약 2km 남쪽인 죽마리 오산 꼭대기에 위치해 있다. 이곳은 원래 오산암이라 불렀는데, 성왕 22년 (544) 연기조사가 처음 건립하였다고 전해지고 있다. 원효대사, 도선국사, 진각국사, 의상대사 4명의 고승이 수도하였다고 하여 사성암이라 부르고 있다. 사성암은 높이 20m의 바위 사이에 박혀 있는 듯한 약사전과 바위와 계단으로 이어지는 건물들이 산과 하나 되어 독특한 풍경을 만들어 내고 있다. 약사전 아래로 보이는 섬진강과 구례읍, 지리산 능선들이 한눈에 들어온다. 마애여래입상이 약사전(유리광전) 건물 내 암벽에 새겨져 있으며 원효 대사가 손톱으로 새겼다는 전설이 전해지고 있다. 사성암까지 차로 이동이 가능하지만 주차장이 협소하여 주차가 제한적이다. 사성암을 가는 방법은 걸어 올라가는 것과 마을버스를 타고 올라가는 것이다. 마을버스 가격은 왕복 기준 3,400원 (13세 이하 2,800원)이다. 사성암 주차장 마을버스 매표소나 안전 운수사를 검색하여 찾아가면 된다.","<a title=""새창 : 사성암 홈페이지로 이동"" href=""https://www.gurye.go.kr/tour/detail.do?tourId=TOUR_0000000048&menuNo=101001009000"" target=""_blank"">https://www.gurye.go.kr/tour</a>"
사세충렬문,128063,인문(문화/예술/역사),역사관광지,유적지/사적지,,경기도,126.8305714755,37.3374004317,사세충렬문은 임진왜란 때 순국한 김여물(1548~1592) 장군의 애국충정과 병자호란 때 청나라 군사가 침입하자 스스로 목숨을 던진 김여물 집안 4대에 걸친 고부의 열녀정신을 기리기 위하여 조정에서 하사한 충신 정문과 열녀 정문이다. 사세충렬문은 목조건물로서 사각기둥의 주심포 양식 팔자지붕이 특징이다. 가운데 칸에는 민가의 대문 형식을 따라 문을 달아 ‘사세충렬문’ 현판을 걸었으며 건물 주위에는 담장이 둘려 쳐져 있다. 건물 안쪽은 2칸으로 나누어져 있으며 마룻바닥의 오른쪽방에는 김여물의 충신정문이 있고 왼쪽방에는 4대 열녀의 정문이 세워져 있다. 현재 건물은 1971년 고쳐 지은 것으로 1983년 보수했다.,"<a href=""http://www.cha.go.kr/"" target=""_blank"" title=""문화재청 사이트로 이동"">http://www.cha.go.kr</a>"
사송,2911135,음식,음식점,카페/전통찻집,http://tong.visitkorea.or.kr/cms/resource/31/2911131_image2_1.jpg,경기도,127.1141019913,37.4102470479,"경기도 성남시 수정구에 있는 한옥 카페다. 외관은 흔히 볼 수 있는 한옥인데 통유리로 되어 있으며, 내부로 들어서면 협탁에 가까운 아담한 테이블과 의자가 보인다. 고즈넉한 분위기와 아름다운 우리나라 옛 전통의 멋을 함께 감상할 수 있다. 창고형 대형 카페와 대비될 정도로 아기자기한 공간이라서 아늑한 분위기를 느낄 수 있다. 에스프레소, 아메리카노, 카페라떼, 바닐라라떼, 스노우모카, 피치우롱, 자스민, 루이보스, 말차라떼, 사과에이드, 오디에이드, 레몬에이드 등을 맛볼 수 있다. 전용 주차장이 있어 주차하기에 편리하다.","<a href=""https://www.instagram.com/sasong.coffee""target=""_blank"" title=""새창 : 업체인스타그램 이동"">https://www.instagram.com/sasong.coffee</a>"
사수항,2794667,자연,자연관광지,항구/포구,http://tong.visitkorea.or.kr/cms/resource/29/2800129_image2_1.jpg,제주특별자치도,126.4795267435,33.5096285563,"사수항은 제주 국제공항 바로 뒤편에 있는 작은 항이다. 항구의 역할보다는 아름다운 일몰과 카페거리 등 인근 관광지로 더 유명하다. 사수항을 지나는 해안도로를 따라가다 보면 말 모양의 등대가 있는 이호테우 등대와 무지개 해안도로를 만날 수 있다. 근처에는 제주만의 독특한 감성이 묻어나는 카페들이 즐비한 카페거리가 있어 함께 들러보기 좋다. 특히 일몰이 매우 아름다우며, 로맨틱한 분위기를 연출한다.",
사슴마을,128303,인문(문화/예술/역사),체험관광지,농.산.어촌 체험,http://tong.visitkorea.or.kr/cms/resource/63/3382163_image2_1.jpg,경기도,127.4734537141,37.3754853622,여주시와 광주시의 경계에 솟은 천덕봉(635m) 북동쪽에 들어선 산골마을이다. 총면적의 86.4%가 산림으로 둘러싸인 주록[走鹿] 마을은 지명에서도 알 수 있듯이 깊은 산과 깨끗한 물에 사슴이 뛰어노는 듯 아름다운 풍경을 지녔다. 마을의 실개천은 가재가 살고 있을 정도로 청정 지역이다.,"<a href=""https://ldf.modoo.at"" target=""_blank"" title=""사슴마을 사이트로 이동"">https://ldf.modoo.at</a>"
사슴이랑배랑농원,2621282,숙박,숙박시설,한옥,http://tong.visitkorea.or.kr/cms/resource/00/2681200_image2_1.jpg,전라남도,126.5913549443,35.1876981153,"전남 함평군의 ‘사슴이랑배랑농원 한옥펜션’은 같은 이름의 농원에서 운영한다. 농원 가운데 황토를 바른 전통 한랑 배랑 농원은 사슴농장 33만580㎡(10만 평), 배밭 4만9600㎡(1만5000평) 규모로 사슴뿐만 아니라 말, 닭, 염소, 거위 등을 키우고 있어 자연스럽게 동물과 교감할 수 있다. 마당에 매어놓은 아기 사슴을 만나보는 것도 이곳에서는 예삿일이다. 농장을 산책하다 만난 사슴과 말에게 먹이를 주는 경험도 해볼 수 있다. 특히 이곳은 농촌 교육 농옥이 자리해 온전한 팜스테이를 경험할 수 있다.

한옥 주변으로 옛 시골 생활을 느껴볼 수 있는 생활소품이 많다. 가마솥이 걸린 아궁이에서는 군불 때는 체험이 가능하고 화로와 맷돌 등도 직접 만져보고 사용할 수 있다. 한옥펜션은 객실 3개와 주방, 화장실을 두루 갖춘 원룸 구조라 이용하는 데 편리하며 하루 한 팀만 머물 수 있다. 사슴이장을 겸하고 있어 사계절 다양한 체험 프로그램을 운영한다. 투호, 제기차기, 윷놀이 등 전통놀이와 동물 먹이주기는 무료로 할 수 있다. 제철 과일로 만드는 아이스크림과 배를 이용한 요리 체험, 도자기 만들기 체험 등은 1인 1만 원의 비용으로 가능하다. 계절별 체험으로 봄 배꽃 솎기, 여름 매실과 킹베리 따기, 가을 배와 감 따기, 겨울 눈썰매 체험이 있어 아이와 체험학습 삼아 방문하기 좋다. 별도의 예약 시스템이 없고, 전화 예약(010-3642-7069)만 받는다.","<a href=""http://www.snbmarket.co.kr"" target=""_blank"" title=""새창 :사슴이랑배랑농원 홈페이지로 이동"">http://www.snbmarket.co.kr</a>"
사시사철,1369555,음식,음식점,한식,,전라남도,127.7342683332,34.7397846259,여수시 연안여객선터미널 맞은편이 교동이다. 교동에는 40여 년 전부터 하나둘 음식점이 들어서기 시작하여 이제는 여수의 유명한 먹을거리 골목으로 자리잡았다. 이곳의 음식점들은 규모가 크지도 않고 인테리어가 화려하지도 않지만 최소 20~30년 역사를 자랑한다. '사시사철'도 바로 그 식당 중 하나이다.<br>,
사암리선돌,2673451,인문(문화/예술/역사),역사관광지,유적지/사적지,http://tong.visitkorea.or.kr/cms/resource/27/3060427_image2_1.jpg,경기도,127.3007638076,37.1792660364,"용담저수지와 용담생태습지원 인근에 위치한 사암리선돌은 선사시대 유적이다. 원삼면 사암리 안골 마을 입구 서쪽 밭 가장자리에 거대한 바위 3개가 나란히 서 있는데, 마치 반타원형의 돌을 세로로 절반 쪼개어 놓은 모습이다. 선돌은 신석기 시대부터 청동기 시대에 걸쳐 나타나는 일종의 토속 신앙 유적으로 조선시대까지도 마을의 수호신 격으로 신성시되었다. 사암리 일대는 선사시대 때부터 주거 부락이 있었을 것으로 짐작되며, 현재 이 지역에서는 서돌뱅이로 불리고 있는데 이는 선돌이 박혀 있는 곳이라는 뜻에서 연유했다고 한다. 
돌의 크기는 남쪽의 1호는 높이 220cm, 너비 103cm, 두께 60cm이고 중간의 2호는 높이 210cm, 너비 101cm, 두께 35cm, 북쪽의 3호는 높이 222cm, 너비 102cm, 두께 35cm로 모두 정동향을 바라보고 있다. 본래 맞은편 밭(753-2번지) 가장자리에 있던 것을 2011~2012년 현재의 자리로 이동하였고 최초 발견 당시 넘어져 있던 것을 복원하는 과정에서 일률적으로 맞춘 것이라 원래 상태는 어떠했는지 확언하기 어렵다. 바위가 3개 이상 나란히 배치된 예는 드문 편으로 마을의 안녕을 기원하는 민간신앙의 숭배 대상물로 역사적, 문화적 가치가 높다.","<a href=""https://www.yongin.go.kr/tour/index.do""target=""_blank"" title=""새창: 용인문화관광 "">https://www.yongin.go.kr/tour/index.do
</a>"
사암오리구이,2749620,음식,음식점,한식,http://tong.visitkorea.or.kr/cms/resource/10/2749610_image2_1.jpg,경기도,127.3063465651,37.1817936234,"시골집 분위기 비닐하우스에서 커다란 돌판에 구워 먹는다. 익은 고기는 계란 노른자 같은 겨자 소스에 찍어 먹는다.  오리고기와 감자, 양파 등 야채를 넣고 볶아먹는다. 고기를 다 먹고 나서 불판에 밥을 볶아먹을 수 있다. 준비 시간이 걸리므로 예약이 필수이다. 쌈, 부추, 김치 등은 부족하면 셀프바를 이용한다. 식당 앞에 용담저수지가 있어 식사 후 경치를 즐기며 산책할 수 있다.",
사야카츠,2844231,음식,음식점,일식,http://tong.visitkorea.or.kr/cms/resource/20/2844220_image2_1.JPG,경상남도,128.6127971519,35.163472154,"귀산에 있는 사야카츠는 초밥, 돈가스 맛집이다. 오픈 전부터 사람들이 방문하여 가게 입구에 마련된 기기에 번호 등록 후 순서대로 대기해야 한다. 주말과 휴가철에는 1시간 이상 대기 시간이 발생할 수 있고 주말 및 공휴일은 영업시간이 변동될 수 있다. 카츠 종류가 다양한 사야카츠 추천 메뉴는 안심, 치즈, 특등심, 등심, 치킨 카츠 등이 나오는 모둠카츠이다. 대표 메뉴는 광어, 방어, 도미, 농어, 차돌박이, 민물장어, 새우장 등 계절에 따라 구성이 달라지는 사야 초밥이다. 평일에는 가성비 좋은 구성으로 런치 초밥도 판매하고 있다. 한 건물에 카페와 베이커리가 함께 있어 식사 후 영수증을 지참하면 할인을 받을 수 있다. 진해내수면환경생태공원이 인근에 있어 함께 가볼만하다.
※ 반려동물 동반 불가",
사양도,579169,자연,자연관광지,섬,http://tong.visitkorea.or.kr/cms/resource/62/874562_image2_1.jpg,전라남도,127.4449668922,34.4765341077,"다도해해상국립공원으로 동북쪽에 있는 내나로도와 동남쪽에 있는 외나로도 사이의 좁은 수로를 끼고 있으며 서쪽에는 사양도가 남쪽에는 애도가 있다. 섬 이름은 이곳에 우뢰가 떨어져 뇌도라 하였고 앞바다가 사방에서 물이 흐른다고 하여 사양이라고도 불린다. 인근 해양이 청정해역으로 많은 어족이 서식하고 있으며, 동백나무, 후박나무, 약초 등이 풍부하게 자생하고 있다.
사양도 봉화산 일원에서 조선시대 요망유적(높은 곳에서 주변을 살피거나 신호를 보내는 유적)이 발견되었다. 요망유적은 장방형의 모습으로 봉화산의 남쪽 정상부에 위치하고 있으며, 사변 시 연기(거연시설)와 불(거화시설)을 피우는 시설로 확인됐다. 요망대 사이의 거리는 20m 정도 떨어져 있고 특히 거연시설의 요망대에서는 불을 지필 수 있는 화구의 구조와 형태가 완형으로 보존된 최초 사례인 것으로 드러나 학계의 주목을 받고 있다.
주민들은 육지로 가려면 하루 5차례 운행하는 도선을 이용해야 했지만, 사양교 개통으로 주민의 생활환경 개선과 함께 볼거리가 많은 사양도의 관광 활성화에도 도움이 되고 있다.",
