title,contentid,cat1,cat2,cat3,firstimage,region,mapx,mapy,overview,homepage
태평염전,228896,자연,자연관광지,강,http://tong.visitkorea.or.kr/cms/resource/73/2612373_image2_1.jpg,전라남도,126.17699912,34.9968045298,"우리나라 최대의 소금 생산지, 전국 단일염전으로는 최대의 크기, 전라남도 신안군 증도면에 위치한 국내 최대 규모(462만㎡) 단일염전으로써 국내 최대의 생산량을 자랑하며 특히 청정무공해지역에서 청정해수로 깨끗하고, 건강한 미네랄이 풍부한 상태 그대로 천일염을 생산하는 천연 염전이다.","<a href=""www.taepyungsalt.com"" target=""_blank"" title=""새창 : 태평염전 홈페이지로 이동"">www.taepyungsalt.com</a>"
태평염전 해양힐링스파,2660744,인문(문화/예술/역사),휴양관광지,온천/욕장/스파,,전라남도,126.1753882189,34.9940242621,"2010년부터 운영되던 소금동물힐링센터는 2015년 확장 공사를 거쳐 해양힐링스파로 거듭났다. 천일염으로 만든 소금동굴힐링룸,사해와 유사한 경험을 할 수 있는 미네랄 부양욕 테라피 등 새로은 개념의 소금 테라피를 통해 심신의 건강과 안정을 얻을 수 있는 곳이다.<br>","<a href=""http://www.taepyungsalt.com/areas-of-business/tertiary-industry/ocean-healing-spa/""target=""_blank"" title=""새창: 태평염전 해양힐링스파"">http://www.taepyungsalt.com/</a>"
태평집,2870448,음식,음식점,한식,http://tong.visitkorea.or.kr/cms/resource/32/2870432_image2_1.jpg,전북특별자치도,127.1360845063,35.8357644203,"전주 덕진공원 근처에 있는 태평집은 주상복합 빌라 1층을 식당으로 쓰고 있어 가정집 느낌의 외관을 볼 수 있다. 메밀국수 전문점인 태평집은 매장의 규모가 크고 넓으며, 식당 내부의 주방은 오픈형으로 요리가 깔끔하게 만들어져 나온다. 태평집은 소바, 비빔소바, 콩국수, 콩물의 단일 메뉴를 판매하고 겨울에는 한시적으로 시래기국밥도 판매하고 있다. 붐비는 손님들로 항시 만석을 이루며, 재료들은 국내산 쌀, 콩, 배추, 고춧가루를 사용하고 있다. 살얼음이 동동 떠 있는 담백한 육수에 메밀 면이 가득 나오는 소바와 새콤달콤한 감칠맛이 인상적인 비빔소바, 걸쭉한 콩물과 메밀면의 조화가 좋은 콩국수 등이 유명하다.
※ 반려동물 동반 불가",
태풍전망대,127162,인문(문화/예술/역사),건축/조형물,유명건물,,경기도,126.9743664745,38.1251223767,"태풍전망대는 천하무적 태풍부대에서 1991년 12월 3일 건립한 것으로, 서울에서 약 65km, 평양에서 약 140km 떨어진 중면 비끼산의 가장 높은 수리봉에 위치한다. 처음에는 군사분계선을 기점으로 2km 지점에 남방 한계선과 북방 한계선이 설정되었으나, 1968년 북한이 휴전선 가까이 철책을 설치함에 따라 우리나라도 1978년에 부분적으로 철책을 설치하였다. 태풍전망대는 휴전선까지 800m, 북한 초소까지는 1,600m의 거리에 떨어져 위치하고 155마일 휴전선상 북한과 가장 가까운 전망대로 유명하다. 태풍전망대에는 국군 장병들이 종교 집회를 가질 수 있는 교회·성당·성모상·법당·종각 등이 있고, 북녘에 고향을 두고 떠나온 실향민의 망향비와 한국전쟁의 전적비, 6.25 참전 소년전차병기념비가 세워져 있다. 전시관에는 이곳으로부터 2km 떨어진 임진강 필승교에서 수습한 북한의 생활필수품과 일용품, 그리고 휴전 이후 수십 회에 걸쳐 침투한 무장간첩들이 이용한 침투 장비  일부가 전시되어 있다.","<a href=""https://www.yeoncheon.go.kr/tour/index.do""target=""_blank"" title=""연천 문화관광"">https://www.yeoncheon.go.kr/tour/index.do</a>"
"태하 해안산책로 및 대풍감 (울릉도, 독도 국가지질공원)",2614692,자연,자연관광지,자연생태관광지,http://tong.visitkorea.or.kr/cms/resource/77/2752377_image2_1.jpg,경상북도,130.8039039436,37.5187311739,"태하 해안산책로는 황토굴 옆 교량을 올라가면 만날 수 있으며, 교량 벽면에는 태하 마을 이야기 및 포토존으로 꾸며져 있다. 태하 해안산책로는 조면암과 집괴암으로 이루어져 있고, 해풍에 의해 특이하게 침식된 지형이 발달하여 수려한 해안절경을 자랑한다. 특히 이곳에는 타포니가 발달해 있는데, 해풍에 포함된 소금이 암석 틈으로 들어가 화학적 풍화작용으로 만들어진 벌집처럼 구멍이 생긴 지형을 말한다.
한편 태하향목관광모노레일을 6분 정도 타고 올라간 후 산책로를 20분 정도 가면 울릉도 등대(태하등대) 및 향목지질스카이워크가 있다. 향목지질스카이워크에서 바라본 북면 해안은 월간지 ‘산’에서 우리나라의 10대 비경으로 꼽은 곳이다. 대풍감에 자생하는 향나무들은 주상절리, 즉 암석 틈이 풍화되어 만들어진 소량의 토양에 뿌리를 내려 자라면서 오랫동안 육지와 격리되어 독특한 생태환경을 이루었으며, 그 가치가 높아 천연기념물로 지정되었다.","<a href=""https://www.ulleung.go.kr/geo/kr/main.do"" target=""_blank"" title=""새창 : 울릉도독도지질공원 홈페이지로 이동"">https://www.ulleung.go.kr/geo/kr</a>"
태하마을,129056,숙박,숙박시설,민박,http://tong.visitkorea.or.kr/cms/resource/10/1435410_image2_1.jpg,경상북도,130.7985963014,37.5119707261,"마을 구석에 위치한 황토굴에 많은 양의 황토가 있어 ‘황토구미’라고도 하고, 조선시대에는 이곳의 황토와 향나무를 상납하기도 했다. 울릉군 개척 당시 제일 먼저 사람의 발길이 닿은 동남동녀의 전설이 서린 곳이기도 하다.  또 천혜의 절경을 자랑하는 대풍령, 만물상, 기타 천연기념물 등이 입지 해 있는 곳으로  연평균 20만 명 이상의 관광객이 내방하고 있으며 마을 주위가 대물이 많이 나오는 낚시터로 전국적으로 유명하다.",
태하향목 관광모노레일,778402,인문(문화/예술/역사),체험관광지,이색체험,,경상북도,130.7975630164,37.513284443,"울릉도의 비경을 한 눈에 감상할 수 있는 관광 모노레일은 태하향목의 정상을 편안하게 감상할 수 있다. 관광모노레일 모노레일 재원은 총연장 304m의 레일에 20인승 카2대가 동시 운행하며 분당 50m의 속도로 산정까지는 약 6분 정도가 소요되고 최대 등판각도가 39도나 되지만 언제나 자동으로 수평을 유지하여 주기 때문에 안심하고 이용할 수 있다. 산정에서 하차 도보로 이동하여야 하는 울릉도항로표지관리소(태하등대)까지는 약 500m 정도의 거리로 아주 완만한 경사면으로 성인기준 10분 정도 걸어가면 된다. <br>이 길가로는 동백나무, 후박나무 등이 빼곡히 자리잡고 있으므로 시원한 그늘을 만들어 주고 있고 또한,  잠깐의 트래킹은 상쾌한 기분을 만들어 주어 눈앞에 펼쳐질 자연풍광이  더 없이 아름다울 수 밖에 없도록 사전 분위기 연출을 멋지게 해주고 있다. 특히 여름철이 지나고 본격적인 오징어 조업철이 다가오면 야간의 웅포해안과 천연기념물 울릉 대풍감향나무 자생지 앞에 펼쳐지는 오징어잡이 어선들의 어화(漁火) 풍경 또한 놓칠 수 없는 울릉도의 밤 볼거리다.","<a href=""https://www.ulleung.go.kr/tour/page.do?mnu_uid=1626&""새창 : 울릉 문화관광 사이트로 이동"">https://www.ulleung.go.kr/tour</a>"
태학산 치유의 숲,3065040,자연,자연관광지,산,http://tong.visitkorea.or.kr/cms/resource/33/3065033_image2_1.jpg,충청남도,127.0919590376,36.7286559313,"천안 태학산은 학이 춤을 추는 형태로 생겼다고 하여 이름 붙여진 곳이다. 태학산 치유의 숲은 사이좋은 길, 새소리 명상터, 치유 광장, 향기치유원, 풍욕장, 족욕탕 등으로 조성되어 있다. 또 치유센터 안에는 건강측정실, 치유체험실, 강의실, 관리실, 휴게실이 마련되어 있다. 
이곳의 산림치유 프로그램은 태학산 내에 꾸며진 치유의 숲에서 다양한 산림 요소를 활용하여 제공되며 치유뿐 아니라 다양한 이색 체험을 무료로 체험 가능하다. 프로그램은 일반인(성인) 대상 상시프로그램과 가족, 직장인, 노인 등 대상별로 나눈 특별 프로그램 10개 등을 운영한다. [태학숲 안(安)]은 일반인 대상 프로그램이며 맞춤형 프로그램으로 노인 대상 [아리아리 숲], 출산 예정 부부 대상인 [이토의 숲], 가족 대상인 [올리사랑 숲], 전 국민 대상 매월 세 번째 주 토요일에 체험할 수 있는 [태학숲의 하루] 등이다. 또한, 힐링 프로그램인 [태학산 가족 에코티어링]은 지도를 보고 숲 곳곳에 숨어있는 퀴즈를 맞히고 숲속 보물을 찾는 미션이다.",
태학산오토캠핑장,2730137,레포츠,육상 레포츠,"야영장,오토캠핑장",http://tong.visitkorea.or.kr/cms/resource/22/2730522_image2_1.JPG,충청남도,127.0938976702,36.7316445102,"태학산 자연휴양림 오토캠핑장은 천안시청을 기점으로 약 14km 떨어진 동남구에 위치해 있다. 숲으로 조성돼 있어 자연 캠핑을 즐길 수 있다. 캠핑장은 일반 야영장 21면, 자동차 야영장 12면을 갖췄으며 사이트 크기는 가로 5m 세로 4m의 데크가 21면, 가로 5m 세로 9m의 맨흙이 12면이다. 사이트 간 간격이 넓고 화로대와 전기 이용이 가능하다. 매점을 따로 운영하지 않지만, 가까운 거리에 편의점이 있어 캠핑에 필요한 물품을 구입할 수 있고 연중무휴를 원칙으로 하지만 상황에 따라 1월에서 2월은 휴장 하기도 한다. 캠핑장 주변에는 독립기념관, 병천 순대거리 등의 관광지가 있고 먹거리가 풍부한 음식점도 즐비하다.","<a href=""https://www.foresttrip.go.kr/indvz/main.do?hmpgId=ID02030040"" target=""_blank"" title=""새창 : 태학산오토캠핑장 사이트로 이동"">https://www.foresttrip.go.kr</a>"
태학산자연휴양림,128917,자연,자연관광지,자연휴양림,http://tong.visitkorea.or.kr/cms/resource/38/3337538_image2_1.JPG,충청남도,127.0938893393,36.7315945157,"풍세면 삼태리와 광덕면 매당리, 아산시 배방읍 수철리의 경계 태학산(해발 450m)에 위치한 자연휴양림이다. 학이 춤을 추는 형태로 생겼다 하여 태학산이라고 이름 붙여진 곳으로 많은 종류의 자생화와 수목이 분포되어 있고 정상에는 고려시대 불상 양식을 단적으로 보여주는 거대한 천안 삼태리 마애여래입상이 있다.
소나무가 집단으로 자라고 있어 가족 단위 휴양에 적당하다. 주요 시설로는 숙박시설인 숲 속의 집, 휴양관과 야영시설인 오토캠핑장 그리고 가족바비큐장이 있으며, 어린이 놀이시설, 유아숲 체험원, 등산로 등이 있다.","<a href=""https://www.foresttrip.go.kr/indvz/main.do?hmpgId=ID02030040"" target=""_blank"" title=""새창: 태학산자연휴양림 페이지로 이동"">https://www.foresttrip.go.kr</a>"
태향,2836432,음식,음식점,중식,,서울특별시,126.974655081,37.5532557207,태향은 서울역 근처에 위치한 중화요리 전문점이다. 모든 메뉴의 가격이 저렴하고 양이 많아 점심시간에 손님들로 북적북적하다. 양꼬치 메뉴도 있어 저녁에는 회식하는 회사원들도 많다.,
태현공원,2907381,인문(문화/예술/역사),휴양관광지,공원,http://tong.visitkorea.or.kr/cms/resource/77/2907377_image2_1.jpg,경기도,127.1436893439,37.369507858,"경기도 성남시 분당동에 있는 공원이다. 여러 시설을 갖추고 있어 주민들이 편리하게 이용하는 시설이다. 입구에서 계단을 따라 올라가면 소규모 공연이 가능한 광장이 있고, 광장 좌우로는 물놀이장을 비롯하여 게이트볼장, 농구장, 족구장, 물놀이장 등 다양한 체육 시설을 갖추고 있다. 여름철에는 바닥 분수를 가동한다. 공원 주변으로는 울창한 숲길을 따라 조용한 산책로가 있다. 물놀이장은 매년 여름에만 운영한다. 수심이 30~40cm 정도로 깊지 않아 어린이들이 놀기에 적합한 시설이다. 6월에서 8월 사이에 이용할 수 있으며 운영 시간은 오전 10시부터 오후 5시까지이다. 정확한 운영 일정은 성남시 공원과에 문의하면 확인할 수 있다.
※ 반려동물 동반 가능 (목줄, 배변 봉투 지참)",
태화강,128201,자연,자연관광지,강,http://tong.visitkorea.or.kr/cms/resource/21/3008621_image2_1.jpg,울산광역시,129.2873637765,35.5486691244,"울산시 울주군 두서면 백운산 탑골샘에서 발원하여 울산시 매암동 부근의 동해안으로 유입되는 길이 47.54㎞, 유역면적이 643.96㎢에 달하는 강으로, 울산지역민들과 역사를 같이하는 울산의 젖줄과 같은 소중한 하천이다. 태화강에서는 십리대숲과 더불어 연어, 은어 등 토종 어종 및 백로, 고니, 수달, 너구리 등 700여 종의 다양한 동·식물들이 서식하고 있다. 또한 하구의 태화강 철새공원은 국내 도심 속 최대 철새 도래지로써, 백로(8천여 마리)와 까마귀 떼(5만여 마리)의 화려한 군무가 장관을 이루며, 계절별 철새 학교 등 다양한 생태체험도 가능하다. 가을철 태화강 하구 억새단지의 석양과 어우러진 은빛 억새물결 또한 환상적인 배경을 연출한다.","<a href=""https://www.ulsan.go.kr/s/garden/main.ulsan"" target=""_blank"" title=""새창 : 태화강 홈페이지로 이동"">https://www.ulsan.go.kr/</a>"
태화강 SUP,2948546,레포츠,레포츠소개,수상레포츠,http://tong.visitkorea.or.kr/cms/resource/42/2948542_image2_1.jpg,울산광역시,129.3075286337,35.5504415269,"태화강은 울산 도심을 가로지르는 국가 하천으로 다년간 주변환경과 수질 개선 사업을 진행하여 현재 다양한 어종과 동물들이 서식하는 아름다운 강이다. 
패들보드는 태화강의 생태환경을 관찰하고 즐기기에 더 없이 좋은 기구로 이용과 관련한 간단한 교육과 주의사항만 숙지 한다면 누구나 쉽게, 특별하게 태화강을 누릴 수 있다.
바다와는 다르게 잔잔히 흐르는 강물은 편안함과 함께 여유를 가져다 주고 물위를 떠다니는 오리와 튀어오르는 물고기, 저 멀리 떨어지는 노을과 함께 울산, 태화강에서의 새로운 경험과 추억을 만들 수 있다. 또 태화강 십리대밭길, 동굴피아, 태화강 전망대 등 패들보드 이용과 동시에 트레킹, 관람을 함께 할 수도 있어 단순 레저활동과는 또 다른 재미를 느낄 수 있다.","<a href=""http://worldraon.com/webuser/page/main.html"" target=""_blank"" title=""새창: 월드라온 홈페이지로 이동"">http://worldraon.com/webuser/page/main.html</a>"
태화강 국가정원,128202,자연,자연관광지,수목원,http://tong.visitkorea.or.kr/cms/resource/64/2653664_image2_1.jpg,울산광역시,129.2913162043,35.5488636215,"태화강 국가정원은 1 급수 생태하천 태화강을 끼고 있는 친환경 생태 정원으로 시간제한 없이 이용할 수 있는 도심 한가운데 위치한 울산 관광의 요지이다. 단, 국가정원 홍보 및 전시, 정원해설 등의 편의를 제공하는 안내센터는 9시부터 18시까지, 태화강 국가정원의 명소 중 하나인 은하수길은 매일 일몰 시간부터 23시까지로 운영시간이 정해져 있다. 울산광역시 중구와 남구에 걸쳐 위치하고 있는 총면적 835,452m 2의 하천부지에 조성되어 있으며 생태, 대나무, 계절, 수생, 참여, 무궁화 총 6개의 공간이 있다. 특히, 이곳의 십리대숲은 바람에 부딪히는 대나무의 맑은 소리와 한적하고 아름다은 길로 유명하다. 또한, 유아를 위한 정원 가꾸기, 가족 단위 정원 체험 프로그램 등을 운영 중이다. 주위에 태화루, 동굴피아, 철새 홍보관을 비롯하여 울산 12경에 속하는 대왕암공원, 동해에서 가장 먼저 해가 떠오르는 간절곶, 선사시대의 역사와 문화를 간직한 반구대 암각화, 신불산 억새평원, 강동·주전의 몽돌해변, 울산대공원 그리고 울산대교 등 자연과 도심이 어우러진 다채로운 관광지가 있다.

◎ 한류의 매력을 만나는 여행 정보 - 드라마 <이재, 곧 죽습니다>
엄마로 환생한 이재가 엄마를 추억하며 방문한 곳이다. 태화강을 따라 여섯 가지 테마로 조성된 정원은 하나같이 아름다운 풍경을 자랑한다. 드라마 속에서는 풍경과 대비되는 이재의 슬픈 표정이 시청자들을 눈물짓게 했다.","태화강 국가정원 <a href=""https://www.ulsan.go.kr/s/garden/main.ulsan""target=""_blank"" title=""새창: 태화강 국가정원 홈페이지로 이동"">https://www.ulsan.go.kr/s/garden</a><br>울산 문화관광<a href=""https://tour.ulsan.go.kr/kor/unit/attrctn/view.ulsan?mId=001002001000000000&unqId=28""target=""_blank"" title=""새창: 울산 문화관광 홈페이지로 이동"">https://tour.ulsan.go.kr</a>"
태화강 국가정원 십리대숲 (은하수길),2605817,레포츠,육상 레포츠,트래킹,http://tong.visitkorea.or.kr/cms/resource/88/2613688_image2_1.jpg,울산광역시,129.2934327441,35.5468000044,"태화강은 울산의 중심을 가르며 흐르는 강으로, 황룡연(용금소)을 굽이돌아 학성을 지나면서 이수삼산의 이름을 남기고 울산만에서 동해로 들어간다. 동서로 약 36㎢, 남북 28㎢의 유역은 그 대부분이 산악지대를 형성하나 강의 양쪽과 하류에는 기름진 평야가 펼쳐져 있으며, 오늘날에는 울산시민의 중요한 식수원이 되어주고 있다. 태화강은 울산의 생명을 유지시켜 주는 혈관이기도 하다.

십리대 숲은 태화강을 따라 십리(약 4km)에 걸쳐 펼쳐진 대나무 숲으로 오랜 세월 자생해 온대나무를 활용한 자연정원이다. 약 50만 본의 대나무 사이로 불어오는 강바람과 댓잎의 속삭임이 귀를 간질인다. 밤이면 색색 불빛이 대나무와 만나 밤하늘의 은하수와 같은 분위기를 연출하는 은하수길은 몽환적이고 이색적인 필수 관람코스가 되었다. 낮과 밤의 색다른 매력들이 넘치는 대나무 숲을 걸으며 도심 속 힐링의 시간을 가져보는 것을 추천한다.","<a href=""https://www.ulsan.go.kr/s/garden/main.ulsan"" target=""_blank"" title=""새창: 태화강 홈페이지로 이동 "">https://www.ulsan.go.kr/s/garden</a>"
태화강 마두희 축제,3104107,인문(문화/예술/역사),축제,문화관광축제,http://tong.visitkorea.or.kr/cms/resource/93/3303193_image2_1.jpg,울산광역시,129.3158389761,35.5519831764,"여름의 시작, 우리의 고유 명절 단오와 함께 대한민국에서 가장 먼저 열리는 여름 축제로 태화강마두희축제가 울산 중구 성남동과, 태화강 체육공원 일대에서 열린다. 320여년의 역사를 자랑하는 울산마두희 큰 줄 당기기부터 새롭게 선보이는 태화강 수상 프로그램까지 이색적인 볼거리와 즐길거리가 넘치는 태화강마두희축제에는 특별함이 있다.","<a href=""http://ulsanmaduhee.co.kr/pages/index.html"" target=""_blank"" title=""새창 : 태화강 마두희 축제 홈페이지 이동"">ulsanmaduhee.co.kr</a>"
태화강 빛축제,3395127,인문(문화/예술/역사),축제,일반축제,http://tong.visitkorea.or.kr/cms/resource/19/3395119_image2_1.jpg,울산광역시,129.2809253914,35.5507493255,"2024 태화강 가을빛 축제가 10월 24일 목요일부터 26일 토요일까지 울산 남구 삼호철새공원 일원에서 개최될 예정이다. 이번 축제는 화려한 드론쇼와 함께 시작될 예정이며, 유명 가수 김희재가 개막 축하공연을 펼쳐 많은 이들의 기대를 모으고 있다. 드론쇼는 개막식이 열리는 24일 오후 7시 25분을 시작으로, 25일 금요일 오후 7시, 26일 토요일 오후 7시에 각각 진행될 계획이다.

축제 프로그램으로는 체험 행사, 다양한 공연, 플리마켓, 푸드존 등이 준비되어 있어 방문객들이 풍성한 가을의 즐거움을 만끽할 수 있을 것이다. 플리마켓은 매일 오후 5시부터 9시까지 운영되며, 먹거리와 다양한 제품을 구매할 수 있는 기회를 제공할 예정이다.

이번 태화강 가을빛 축제는 태화강의 아름다운 자연 경관을 배경으로 울산의 가을밤을 빛으로 물들이며, 방문객들에게 잊지 못할 추억을 선사할 것이다.",
태화강 은하수 다리,3014975,인문(문화/예술/역사),건축/조형물,다리/대교,http://tong.visitkorea.or.kr/cms/resource/72/3014972_image2_1.jpg,울산광역시,129.2834751892,35.5500133446,"태화강을 가로질러 중구와 남구 삼호동을 이어주는 은하수다리는 옥동~농소 1구간 도로를 개설하며 건립된 인도교로, 태화강 국가정원 안내센터 뒤편에 있으며 2020년 6월 개통한 국가정원교 하부에 설치되었고 태화강 국가정원 태화지구와 삼호지구를 잇는 국가정원의 중심부에 위치하고 있다. 이 다리는 태화강 국가정원의 대자연과 잘 어우러져 울산 시민은 물론 국가정원을 찾는 관광객들에게 사랑받는  대표 명소이다. 
이예로와 붙어있어 이예교라 불리다 2020년 공모를 통해 지어진 은하수다리 명칭은  은하수길로 이어진다는 의미를 가지고 있다고 한다. 태화강국가정원 은하수다리 아래는 시민들이 이용할 수 있는 운동공간이, 위로는 차도인 국가정원교가 있다. 은하수다리 전체가 보행자 전용길로 이동 시 자전거, 킥보드 등은 내려서 끌고 갈 순 있지만 탑승 불가한 점을 유의하여야 하고 은하수다리 중간쯤 나오는 강화유리 바닥을 훼손할 경우 형사처벌 대상이 된다고 하니 주의해야 한다. 
낮에는 햇빛에 반짝이는 태화강의 물결과 대숲을 감상하고, 밤에는 색색의 조명이 자아내는 아름다운 경관을 만끽할 수 있으며 시간별 찬란하게 빛나는 조명 칼라가 걷는 동안 신비로운 느낌은 물론 사진 찍는 재미까지 있어 울산의 명소로 손꼽히고 있다.","<a href=""http://www.ulsan.go.kr/s/garden/bbs/view.ulsan?bbsId=BBS_0000000000000167&mId=001002003000000000&dataId=27110"" target=""_blank"" title=""새창 : 홈페이지로 이동"">http://www.ulsan.go.kr/</a>"
태화강 전망대,1393773,인문(문화/예술/역사),건축/조형물,유명건물,http://tong.visitkorea.or.kr/cms/resource/12/3341812_image2_1.jpg,울산광역시,129.2939660784,35.5450918732,"태화강 전망대는 울산 남구 무거동에 위치한 전망대이다. 1963년 만들어졌으나 1995년 이후 가동하지 않았던 태화취수장 및 취수탑을 울산시와 한국수자원공사에서 현대적 감각에 맞게 태화강 전망대로 리모델링하였다. 지상 4층 (높이 28m), 연면적 514㎡로 간물 내부에는 야외 전망대, 홍보관, 휴게실이 있다. 전망대에서 태화강과 국가정원교를 망원경을 이용해 한눈에 볼 수 있고 무료이다. 또한 시민들이 휴식할 수 있는 공간을 제공한다.","<a href=""http://tour.ulsan.go.kr/index.ulsan""target=""_blank"" title=""새창: 울산관광"">http://tour.ulsan.go.kr/index.ulsan</a>"
태화강국가정원 봄꽃축제,1809293,인문(문화/예술/역사),축제,일반축제,http://tong.visitkorea.or.kr/cms/resource/27/2987427_image2_1.jpg,울산광역시,129.2911995498,35.5487747405,"태화강 국가정원의 자연경관과 정원시설을 만끽할 수 있도록 매년 5월경 태화강 국가정원 봄꽃축제를 개최하고 있다. 28,000㎡에 달하는 초화단지에 봄의 정취를 느낄 수 있는 꽃양귀비, 수레국화, 금영화, 안개초 등 다양한 초화류를 식재하고 각종 행사, 포토존 등을 마련하여 방문객에게 다채로운 볼거리를 제공하고 있다.  특히 올해 봄꽃축제는 2028 울산국제정원박람회 유치 기원과 함께 산림청과 합동으로 이동형 반려식물 클리닉 운영과 감자캐기 체험 등 다양한 정원체험 프로그램을 준비하였으며 국가정원 내 봄꽃 향기와 대숲의 바람을 함께 느낄수 있는 지역의 대표적인 축제로 매년 많은 방문객들이 국가정원을 찾고 있다.","<a href=""https://www.ulsan.go.kr/s/garden/main.ulsan"" target=""_blank"" title=""새창 : 태화강국가정원 봄꽃축제 페이지"">www.ulsan.go.kr</a>"
