title,contentid,cat1,cat2,cat3,firstimage,region,mapx,mapy,overview,homepage
본점원조뼈다귀구리본점,2855066,음식,음식점,한식,http://tong.visitkorea.or.kr/cms/resource/52/2855052_image2_1.jpg,경기도,127.1442633478,37.598361867,"﻿본점원조뼈다귀구리본점은 구리시 수택동 사거리에서 검배근린공원으로 가는 길에 있는 24시간 연중무휴의 감자탕 맛집이다. 주차장이 없지만, 건너편 유료주차장에 주차한 뒤 만 원 이상 식사하면, 1시간 무료 주차가 가능하다. 메뉴는 감자탕 전문집답게 감자탕과 원조 뚝배기 두 가지다. 맛이 깊고 진한 국물에 부드럽게 손질된 우거지와 감자 뼈가 산처럼 쌓여 나온다. 뼈, 우거지와 감자는 추가 주문도 가능하다. 탕을 다 먹고 난 후 볶아주는 밥도 별미다. 감자뼈를 산처럼 쌓아주는 집으로 맛집 프로그램에 소개되기도 했다. 주변 가 볼 만한 곳으로는 검배근린공원, 구리시립체육공원과 원촌공원 등이 있다.",
본정,1902808,음식,음식점,카페/전통찻집,,충청북도,127.4568982639,36.6344149236,"청주시 서원구 사창동에 위치한 ‘본정’은 1999년부터 시작한 초콜릿, 케이크 전문점이다. 자체 개발한 디저트와 다양한 종류의 초콜릿, 쿠키, 케이크를 1층 카페에서 제공하고 있으며 2층은 케이크와 디저트를 만들어내는 곳이다. 초코마숑 조각케이크, 인삼초콜릿, 홍삼초콜릿 등 다양한 초콜릿과 케이크를 맛볼 수 있으며 다양한 커피와 음료도 준비되어 있어 취향껏 메뉴선택이 가능하다.","<a href=""http://www.bonjung.com"" target=""_blank"" title=""새창 : 본정 홈페이지로 이동"">http://www.bonjung.com</a>"
본조르노,2912077,음식,음식점,서양식,http://tong.visitkorea.or.kr/cms/resource/64/2912064_image2_1.jpg,대전광역시,127.3437303919,36.3379413213,"본조르노는 대전광역시 유성구 원신흥동에 있다. 현대적인 감각이 돋보이는 외관과 세련된 분위기를 연출하는 인테리어가 눈에 띈다. 내부에는 단체석이 마련되어 있어 각종 모임을 하기 좋다. 대표 메뉴는 매콤한 토마토소스에 홍합을 듬뿍 넣어 만든 꼬제 뚝배기 파스타다. 이 밖에 키조개&봉골레 파스타, 브루기뇽&풍기 리조또, 오징어 먹물 리조또 등 여러 가지 이탈리아 요리가 준비되어 있다. 유성 IC에서 가깝고, 주변에 대전시립박물관과 국립대전숲체원이 있다.",
본지르르,2893243,음식,음식점,카페/전통찻집,http://tong.visitkorea.or.kr/cms/resource/28/2893228_image2_1.jpg,경기도,127.0167144167,37.2828711753,"본지르르는 화성행궁 앞 수원시립 아이파크 미술관 맞은편에 있는 카페이다. 별도의 주차장이 없어 차량 이용 시 근처 공영주차장을 이용해야 한다. 1층에 거문고라고 크게 적힌 건물 2층에 있는 이 카페는 넓은 내부에 천장이 노출되어 개방감이 좋고 심플한 인테리어에 소파 자리, 테이블 자리 등 다양한 크기의 좌석들이 여유롭게 배치되어 있다. 이곳은 에스프레소, 에스프레소 콘파냐, 아메리카노 등의 커피 메뉴와 스파클링, 티, 맥주, 하이볼 등의 음료들과 바스크 치즈케이크, 본지르르 머핀 밤 타르트 몽블랑 등의 디저트를 맛볼 수 있다. 본지르르는 주문한 음료를 직원이 자리에 직접 가져다주며 반려동물을 동반할 수 있는 곳이다.
※반려동물 동반 가능",
본참치,2836437,음식,음식점,일식,http://tong.visitkorea.or.kr/cms/resource/33/2836433_image2_1.jpg,부산광역시,129.0352730173,35.1055141495,"부산광역시 중구에 있는 본참치는 대한민국 조리 기능장인 오너 셰프가 매일 아침 최상급 참치를 공수하여 당일 소진하는 것을 원칙으로 한다. 2007년 작은 공간에서 시작하여 세 번이나 확장 이전을 거칠 정도로 인기 있는 맛집으로 오너 셰프만의 과학적인 해동과 숙성을 통해 신선하고 풍미 가득한 참치 맛을 느낄 수 있는 곳이다. 청결과 위생으로 농림축산식품부 제공 안심식당으로 인증받았다. 저녁에는 무한리필이 가능한 참치 회 정식을 판매하고, 오전 11시 30분부터 오후 2시 30분까지는 솥 밥, 롤, 참치 회덮밥, 새우튀김 덮밥, 모둠초밥, 특초밥 등 다양한 종류의 런치 메뉴를 즐길 수 있다. 주변에 드라마 <쌈마이웨이> 촬영지와 영주동오름길모노레일, 40 계단기념관 등이 있다.",
본초다담,2900897,인문(문화/예술/역사),휴양관광지,헬스투어,,충청북도,128.2191559605,37.1809216161,"약초의 본고장 제천시의 생산품을 사용하여 운영하는 한방족욕체험 카페 본초다담은 일상생활과 여행중 쌓인 피로를 풀 수 있는 장소이다. 한방 족욕 외에도 한방약초, 새싹 나물 체험 및 판매, 카페테리아 또한 운영하고 있다. 족욕 수조에 물을 채운 후, 한방 티백을 물에 넣으면 약재가 물이 풀어지며 건강한 족욕을 즐길 수 있다.","<a href=""https://blog.naver.com/parkhs2337"" target=""_blank"" title=""새창 : 본초다담 홈페이지로 이동"">https://blog.naver.com/parkhs2337</a><br><a href=""https://www.ok114.co.kr"" target=""_blank"" title=""새창 : 본초다담 랜딩페이지로 이동"">https://www.ok114.co.kr</a><br><a href=""https://www.instagram.com/boncho_dadam"" target=""_blank"" title=""새창 : 본초다담 인스타그램 페이지로 이동"">https://www.instagram.com/boncho_dadam</a>"
본추어탕,2837288,음식,음식점,한식,http://tong.visitkorea.or.kr/cms/resource/83/2837283_image2_1.JPG,경기도,127.1133568514,37.6326128829,"﻿본추어탕은 구리시 갈매동에 있는 추어탕 전문점으로 경춘선 갈매역에서 5분 거리에 있다. 2022년 2월에 이곳으로 이전하여 주차장도 넓고 실내도 깔끔하다. 추어탕 전문점으로 갈아 넣은 추어탕과 통추어탕, 우렁이를 추가로 넣어 시원한 맛을 더한 우렁 추어탕이 있으며 바삭한 추어튀김을 곁들여 먹을 수도 있다. 어린이를 위한 돈가스도 준비되어 있고 식당 인근에 두어 군데 키즈카페가 있어 어린이 동반 가족들이 식사 후에 이용하기 좋다. 자동차로 2km 거리에 화랑대 철도공원이 있어 근교 나들이 코스로도 좋다.",
본치즈어리 유진목장,2822757,음식,음식점,카페/전통찻집,http://tong.visitkorea.or.kr/cms/resource/54/2822754_image2_1.jpg,울산광역시,129.1252727244,35.6353174427,"유진목장은 36년째 2대 가업으로 이어온 6차 산업(농촌융복합산업) 형 목장으로, 직접 생산된 원유를 이용한 유제품을 가공/판매/체험 서비스 제공하고 있는 로컬밀크브랜드이다. 가장 신선한 원유를 첨가물 없이 바르게 정성껏 만들고 있으며, 친환경, 무항생제 인증 및 가축사육업과 축산물제조가공업 모두 HACCP인증을 획득한 기업이다.","<a href=""https://eugenefarm.modoo.at"" target=""_blank"" title=""새창 : 본치즈어리 유진목장 홈페이지로 이동"">https://eugenefarm.modoo.at</a>"
본카페,3065203,음식,음식점,카페/전통찻집,http://tong.visitkorea.or.kr/cms/resource/78/3065178_image2_1.jpg,제주특별자치도,126.3320877343,33.4678141833,"애월항 인근 애월해안로에 있는 본 카페는 바다가 보이는 자리에서 커피를 마시며 여유를 즐길 수 있는 카페이다. 반려동물과 함께 바다를 배경으로 사진을 찍을 수 있는 포토존이 있다. 2층 건물의 내부는 편안한 좌석과 인테리어로 구성되어 있고, 주전부리와 기념품, 장난감 등을 진열하여 판매하고 있다. 대표메뉴는 눈과 입을 즐겁게 해주는 더블망고스무디이고 우도땅콩라떼와 청귤에이드도 인기 있다. 또, 다쿠아즈, 스콘 조각 케이크 등 다양한 디저트가 준비되어 있다. 
카페 주변에는 애월항, 애월방파제, 애월한담공원, 한담해변, 곽지해수욕장, 제주올레길16코스 등 많은 관광지가 있다.","<a href=""https://www.visitjeju.net/kr/detail/view?contentsid=CNTS_200000000014298#"" target=""_blank"" title=""새창 : 홈페이지로 이동"">https://www.visitjeju.net/</a>"
본태박물관,1798082,인문(문화/예술/역사),문화시설,박물관,http://tong.visitkorea.or.kr/cms/resource/23/2873323_image2_1.jpg,제주특별자치도,126.3919251089,33.303341652,"본태박물관은 ‘本態, 본래의 모습’이라는 의미를 담고 있다. 이름의 뜻 그대로 오랜 세월의 흔적에 가려져 있던 문화 본연의 모습을 탐색하는 아름다운 문화 공간이 되고자 설립되었다. 건축계의 노벨상인 프리츠커상(1995)을 수상한 건축가 안도 다다오(1941~)가 설계한 본태박물관은 그의 트레이드마크인 노출콘크리트에 빛과 물을 건축 요소로 끌어들여 건축과 주변과의 조화를 고려하는 안도 다다오의 건축 철학이 담겨 있다. ‘제주도 대지에 순응하는 전통과 현대’를 컨셉으로 설계를 진행하였으며, 박물관을 두 개의 공간으로 나누어 전통공예품과 현대 미술품을 위한 전시 공간으로 구성했다.
또한, 본태박물관은 아름다운 우리의 전통 공예품과 피카소, 쿠사마 야요이, 백남준, 로버트 인디애나 등 세계적인 작가들의 현대 미술품을 통해 새로운 미래가치를 탐색하고자 하며, 전시뿐 아니라 자선사업, 교육, 세미나, 강연 등 다양한 활동을 펼치고 있는 복합문화공간이다. 사람과 사람, 자연과 건축, 전통과 현대, 세계와 한국이 서로 만나 아름다움으로 한국문화 정체성을 정립하고 세계인의 감성을 움직여, 보다 윤택하고 풍요로운 우리의 미래를 가꾸어 보고자 한다.","홈페이지 <a href=""http://www.bontemuseum.com/"" target=""_blank"" title=""새창: 본태박물관 홈페이지로 이동"">http://www.bontemuseum.com</a><br>
인스타그램 <a href=""https://www.instagram.com/bontemuseum/"" target=""_blank"" title=""새창: 본태박물관 인스타그램으로 이동"">https://www.instagram.com/bontemuseum/</a>"
본토,2892407,음식,음식점,한식,http://tong.visitkorea.or.kr/cms/resource/95/2892395_image2_1.jpeg,강원특별자치도,127.6964304182,37.6731577359,"본토는 강원도 홍천군에 있는 화로구이 전문점이다. 숯불닭갈비, 화로구이 등이 주요 메뉴이다. 비발디파크. 소노펠리체 CC, 오션월드 등이 근처에 있어 라운딩을 나온 골퍼들, 가족 나들이 나온 손님들이 많이 방문하는 식당이다. 숯불에 양념한 닭갈비와 국내산 고추장 삼겹살 구이를 맛볼 수 있고, 안주로는 숯불 닭발도 준비되어 있다. 곁들임으로 치즈퐁뒤를 시켜 같이 즐길 수도 있고 덜 매운 어린이 닭갈비도 준비되어 있다. 고기를 충분히 즐긴 후에는 물 막국수나 닭 초밥을 먹을 수 있다. 닭 초밥은 손님이 스스로 만들어 먹는 메뉴이다. 방문객이 많아 대기가 있는 식당이니 감안하고 방문해야 한다. 전용 주차장이 있어 주차하기 편리하다.",
