title,contentid,cat1,cat2,cat3,firstimage,region,mapx,mapy,overview,homepage
얼레꼴레만두,2768131,음식,음식점,한식,http://tong.visitkorea.or.kr/cms/resource/13/2788113_image2_1.jpg,인천광역시,126.6659973694,37.4447183959,남동공단 공단 떡볶이라는 별칭과 인천 3대 떡볶이집으로 유명세를 치르는 곳이다. 얼레꼴레만두는 떡볶이와 만두를 섞어서 먹는 이 집의 대표 개발 메뉴이다. 떡볶이와 만두는 걸쭉한 국물이 많이 들어간 것이 특징으로 국물 떡볶이에 만두를 담가 떡볶이 국물 맛으로 매콤하게 먹는다. 원래는 학익동 인천지방법원 인근 골목에 있었지만 일대가 재개발 지구로 묶이면서 인근 월드타워 1층으로 이전했다. 허름한 분식집 대신 세련된 업소로 바뀌면서 옛 분위기는 추억이 되어 버렸다.,
얼로우 비건 베이커리,2893532,음식,음식점,카페/전통찻집,http://tong.visitkorea.or.kr/cms/resource/23/2893423_image2_1.jpg,경기도,127.0568828588,37.2876907794,"얼로우 비건 베이커리는 경기도청 근처에 있는 비건 베이커리 카페이다. 상가건물 지하 2층에 있는 이곳은 차량 이용 시 상가 주차장을 이용하여 주차할 수 있다. 깔끔한 내부에는 베이커리 진열대와 2~3개의 테이블이 배치되어 있다. 당일 제조 당일 판매를 원칙으로 식물성 재료를 사용하여 건강한 빵을 굽는 이곳은 쿠키, 스콘, 머핀, 타르트, 케이크 등의 비건 베이커리와 에스프레소, 아메리카노, 카페 두유 라테, 스파클링 음료, 허브티 등의 음료 메뉴가 준비되어 있다. 반려동물을 동반할 수 있는 곳이며 준비한 베이커리가 조기 품절 시 일찍 마감한다. 근처에 신분당선 광교중앙역이 있어 대중교통으로 이용이 편리하다.
※ 반려동물 동반 가능",
얼바인 현대송도,2915787,쇼핑,쇼핑,사후면세점,http://tong.visitkorea.or.kr/cms/resource/64/2882564_image2_1.jpg,인천광역시,126.6579998144,37.3828032236,-,
얼스어스,2784016,음식,음식점,카페/전통찻집,http://tong.visitkorea.or.kr/cms/resource/11/2796311_image2_1.jpg,서울특별시,126.9232816761,37.5641951955,"서울 마포구에 자리한 무포장 가게다. 이름에서 짐작하듯 지구를 먼저 생각하는 카페 얼스어스(Earth Us)는 일회용 용기를 전혀 사용하지 않는다. 그 때문에 개인 용기와 텀블러가 없다면 포장이 불가하다. 누군가에겐 불편할 수 있지만, 플라스틱 쓰레기를 줄이기 위해 다회용 용기와 텀블러를 챙기는 문화를 만들기 위한 첫걸음으로 그 의미가 남다르다. 다른 카페들에서 흔하게 사용하는 휴지도 손수건으로 대신한다. 그야말로 환경을 생각하는 마음이 카페 곳곳에 녹아있다. 커피와 차, 에이드 외에 시그니처 케이크인 딸기크림치즈케이크가 인기 메뉴다. 상큼한 딸기가 동째로 들어간 데다 진한 치즈의 풍미를 함께 즐길 수 있어 커피와도 잘 어울린다.",
얼스오브제,2989004,쇼핑,쇼핑,공예/공방,,서울특별시,127.0347110147,37.6406244212,얼스오브제는 서울시 도봉구 창동에 위치한 소품샵이다. 얼스오브제는 earth와 objet를 합쳐 만든 상호명으로 지구에 무해한 제품을 만드는 것을 의미한다. 친환경 제로웨이스트 상품과 제스모나이트 소품을 만드는데 제로웨이스트는 쓰레기 배출량을 줄이는 친환경적인 가치관을 말하며 제스모나이트는 인체에 무해한 소재이다. 즉 얼스오브제는 친환경적인 소재를 활용하고 최대한 쓰레기 배출량을 줄이며 소품을 제작하고 판매한다. 얼스오브제는 인테리어용 소품을 판매하며 원데이 클래스를 진행하고 있다. 원데이 클래스는 친환경 소재를 이용하여 나만의 오브제를 만드는 이색적인 체험을 제공한다. 연령에 상관없이 아이들과 함께 참여할 수 있다.,"<a href=""https://www.instagram.com/earth_objet"" target=""_blank"" title=""새창 :얼스오브제홈페이지로 이동"">https://www.instagram.com/earth_objet</a>"
"얼씨구 어깨가 들썩, 덩더꿍 흥이 절로",2048808,추천코스,힐링코스,힐링코스,http://tong.visitkorea.or.kr/cms/resource/65/1938165_image2_1.JPG,Unknown,127.1926760732,36.9906858701,"일제강점기와 한국전쟁 때 수많은 놀이패가 뿔뿔이 흩어졌지만, 안성남사당놀이패는 오늘까지 맥이 이어져 주말마다 상설공연을 펼친다. 안성남사당 바우덕이풍물단 공연이 그것이다. 공연마다 700여 객석이 꽉 찰 정도로 관객의 호응도 뜨겁다. 남사당놀이는 풍물, 버나(접시돌리기), 살판(땅재주), 덧보기(탈놀음), 어름(줄타기) 등 여섯 마당과 10여 가지 세부 기예로 구성된다.",
얼음골가든,2901704,음식,음식점,한식,http://tong.visitkorea.or.kr/cms/resource/96/2901696_image2_1.JPG,경상남도,127.7321815857,35.6266291629,"육십령로를 따라서 쭉 가다가 옆의 샛길로 들어가면 나오는 숨겨진 맛집, 얼음골가든이 나온다. 바로 앞에 낮은 수위의 계곡물이 있어 물놀이하기 좋고 평상들 있어 맛있는 음식 먹으면서 즐기기에 좋다. 보통 계곡 식당으로 가면 닭백숙 같은 메뉴가 대부분인데, 계곡에서 회를 먹을 수 있다는 게 신선하고 특별한 곳이다. 식당에서 송어, 향어 양식장이 있을 정도로 전문으로 하는 곳이다. 송어회는 비리지 않고 두껍게 썰어 적당히 쫄깃하고, 부드러운 식감도 훌륭하다. 넓은 전용 주차장이 있어 편리하다. 황석산성, 동호정이 인접해 있어 함께 둘러보기 좋다.","<a href=""http://seahas1.modoo.at/""target=""_blank"" title=""새창 : 얼음골가든 사이트로 이동"">http://seahas1.modoo.at/</a>"
얼음골까투리오토캠핑장,2729958,레포츠,육상 레포츠,"야영장,오토캠핑장",http://tong.visitkorea.or.kr/cms/resource/35/2730135_image2_1.jpg,경상남도,128.9784926789,35.5797015241,"얼음골 까투리캠핑장은 얼음골에 위치해 있는 캠핑장으로 캠핑장 바로 아래로 계곡이 흐르고 있어 물놀이 장소로서는 최적의 캠핑장이다. 사이트는 숲속의 빈터와 산새소리 사이트 두 곳이 있으며 파쇄석으로 되어 있어 배수도 잘된다. <br>사이트마다 배전함이 설치되어 있어 전기 사용이 편리하며 무료 와이파이도 가능하다. 반려견과의 동시 입장이 가능하다보니 많은 반려견 캠퍼들이 이용한다. 모든 편의시설이 잘 정리되어 있으며, 개수대는 온수겸용으로 사용하기 좋고 화장실과 샤워실 모두 실내화를 이용하여 더욱 깨끗하게 관리되고 있다.<br>어린이들의 놀이공간인 트램펄린이 있어 뛰어 놀기에 좋고 족구장과 꿩사육장이 있어 체험학습장으로도 좋다. 주변관광지로는 밀양 얼음골, 가지산도립공원, 시례 호박소가 있다.","<a href=""http://cafe.daum.net/gaturi2832/"" target=""_blank"" title=""새창 : 얼음골까투리오토캠핑장 사이트로 이동"">http://cafe.daum.net/gaturi2832/</a>"
얼음골사람들,3060333,인문(문화/예술/역사),체험관광지,농.산.어촌 체험,http://tong.visitkorea.or.kr/cms/resource/72/3051572_image2_1.JPG,경상남도,128.8765239735,35.5744946639,"밀양 얼음골은 여름에도 얼음이 언다고 하는 관광지로, 일조량이 풍부한데다 맑은 물이 흐르는 지역이라 맛있는 사과가 열리는 지역으로 알려져 있다. 얼음골사과는 높은 기온차로 인해 사과가 단단하고 단맛이 풍부하여 전국적으로 유명한 특산물이다.
얼음골사람들은 농장주 박병창, 이윤희가 사과를 재배하면서 체험 프로그램을 운영하는 체험 농장이다. 농장주는 햇살과 물이 좋은 밀양으로 귀농하여 자연과 함께 농장을 가꾸며, 사과 따기 체험활동을 통해 도시와 농촌이 공존하며 더불어 살아가고자 하며, 내 가족이 먹는다는 생각으로 껍질째 먹을 수 있는 안전한 먹거리, 바른 먹거리를 생산하고 있으며, 생산자와 소비자가 함께 더불어 살아가는 세상을 만들고자 하는 신념으로 얼음골사람들 농장을 가꾸고 있다.
건강하고 행복 담은 내 몸애(愛) 사과, 껍질째 먹을 수 사과, 안전한 먹거리, 하늘, 바람, 땅, 물과 함께 만물의 소중함을 몸소 느끼며 체험하는 농장이다.","<a href=""https://apple4914.modoo.at/?link=7jhrjwi8"" target=""_blank"" title=""새창 : 홈페이지로 이동"">https://apple4914.modoo.at</a>"
얼음골식당,1909391,음식,음식점,한식,,충청북도,127.9020304205,36.8379524067," 얼음골봄은 주변 자연경관이 훌륭하며 박달산과 지역 대표 관광지인 산막이옛길이 가까이 있어 등산객이나 관광객들이 즐겨 찾고 있다. 이른봄 박달산 주변 및 지천에 나는 '지칭개'라는 산야초를 이용한 '지칭개 오리백숙'이 대표메뉴이다. 주요 밑반찬은 산야초 초절임이며, 농장에서 생산한 사과로 농축액을 만들어 모든 밑반찬의 양념으로 활용하고 있다. 또한 사과와 20여종의 산야초를 혼합하여 만든 건강음료를 후식으로 드리며, 특히 농가에서 직접 담근 사과고추장은 도시민 관광객들에게 인기품목이다.<br>",
얼음골야영장,2744380,레포츠,육상 레포츠,"야영장,오토캠핑장",http://tong.visitkorea.or.kr/cms/resource/81/2744081_image2_1.jpg,경상남도,128.178059358,34.9833901086,"경상남도 고성에 위치한 얼음골야영장은 33,000㎡가 넘는 넓은 부지의 펜션과 야영장 그리고 식당, 방갈로, 계곡을 따라 놓인 평상들과 자연 그대로의 계곡형 수영장까지 고루 갖춘 캠핑장이다. 산책길을 따라 걷다 보면 나무 그네들이 눈에 들어온다. 나무 그네에 앉아 시원한 바람을 맞으며 하늘로 날아오른다. 넓은 족구장이 있어 족구 등 아이들이 뛰어놀기에 좋으며, 여름이면 시원한 계곡으로 내려가 물고기를 잡으며 자연학습체험도 하며, 물놀이로 여름을 보낼 수 있다. 또한 무료로 체험해 볼 수 있는 얼음골의 바람도 느껴볼 수 있다. 100명 정도 사용 가능한 토굴 펜션은 모임이나 단체에서 많이 사용하고 있다. 캠핑장에서 운영하는 식당에는 오리주물럭, 닭백숙, 흑염소 요리 등이 있다. 사랑하는 반려견과 동반 입장이 가능한 캠핑장이다.","<a href=""https://eoreumgol.campingt.me/3373/home/index"" target=""_blank"" title=""새창 : 얼음골야영장 사이트로 이동"">https://eoreumgol.campingt.me/3373/home/index</a>"
얼음골축음기소리박물관(밀양),2552568,인문(문화/예술/역사),문화시설,박물관,http://tong.visitkorea.or.kr/cms/resource/82/2988482_image2_1.jpg,경상남도,128.9351626245,35.5981819708,"얼음골축음기소리박물관은 주변에 영남의 알프스라 불릴만큼 산세가 아름답고 맑은 계곡과 명품 얼음골 사과의 주산지이며 밀양의 대표적인 관광명소인 밀양 얼음골 입구 대로변에 자리 잡고 있다. 1층에는 기획전시실, 제1전시실이 있으며. 2층에는 2, 3, 4 전시실과 교육실이 갖추어져 있다. 초기 소리 과학 유물인 태엽식 축음기, 진공관 전축, 진공관 라디오, 초기 전화기 등 소리 과학기술을 주제로 한 유물을 보존 전시하고 있다.<br>","<a title=""새창 : 얼음골축음기소리박물관 홈페이지로 이동"" href=""http://epsmuseum.co.kr/"" target=""_blank"">http://epsmuseum.co.kr/</a>"
얼음골캠핑장,2740983,레포츠,육상 레포츠,"야영장,오토캠핑장",http://tong.visitkorea.or.kr/cms/resource/94/2741194_image2_1.JPG,경상남도,128.952874953,35.5985155958,"풍광 좋은 영남알프스에서도 최고의 경관을 자랑하는 얼음골에 있다. 해발 400m의 가지산 자락 산 중턱에 있어 전망이 아주 뛰어나다. 영남알프스 얼음골 케이블카로 가는 길을 따라가다가 남명삼거리에서 산내남명초등학교를 지나쳐 끼고 하양지길을 따라 산속 마을 길을 올라가면 된다. 하얀복지회관 앞에서 좌회전해 조금만 더 오르면 멋진 산봉우리 아래 대궐 같은 한옥이 나타난다. 여기가 얼음골한옥펜션이다. 한옥 펜션 마당에는 수영장이 있는데, 마치 구름 속에서 수영을 하는 듯 주변 풍광과 어우러진 모습이 정말 장관이다. 캠핑장은 한옥 펜션 뒤쪽에 따로 마련되어 있다. 21개의 사이트와 캠핑 포드 3대, 방갈로형 1개가 갖춰져 있고, 이곳에도 별도의 수영장이 전망 좋은 곳에 배치되어 있다. 사이트마다 칸막이로 구획이 나누어져 있어 호젓하고 프라이빗한 캠핑을 즐기기에 좋은 곳이다.","<a href=""https://www.instagram.com/eoreumgol_camp/"" target=""_blank"" title=""새창 : 얼음골 캠핑장 인스타그램으로 이동"">https://www.instagram.com/eoreumgol_camp/</a>"
얼음골폭포관광농원,2865338,레포츠,육상 레포츠,"야영장,오토캠핑장",http://tong.visitkorea.or.kr/cms/resource/20/2865320_image2_1.JPG,경상남도,128.956480488,35.5879140793,"영남 알프스자락 밀양 얼음골에 위치한 얼음골폭포관광농원은 농림출산식품부 선정 우수관광농원으로 가족과 함께 사계절 레저와 농촌체험을 즐길 수 있는 농촌 교육 농장이다. 가지산, 운문산, 천황산 3대 명산에서 합쳐진 자연수가 일일 4,000톤 이상 용출되고 있어 ‘물의 고향’이라고 불린다. 가족 단위의 평상공간인 몽골천막, 그늘막 하우스 등이 있어 가정에서 준비해 온 음식으로 가족 야외 파티를 즐길 수 있는 유니크한 공간이다.
봄에는 방울토마토 화분심기, 뜰채로 민물고기 잡기 등의 농촌체험과 대나무활쏘기, 네모딱지치기, 구슬치기 등의 전래놀이를 하며 봄나들이를 만끽할 수 있다. 여름에는 1 급수로 조성된 유수풀에서 워터파크처럼 대형 미끄럼틀도 타고 물놀이를 즐길 수 있다. 맨손은어 잡기 체험과 어린이 버들치 잡기 체험 등으로 여름 바캉스를 즐길 수 있다. 가을에는 사과 따기와 버들치 잡기, 투명카누 등을 체험하며 가을 소풍을 할 수 있으며, 겨울에는 눈썰매와 빙어 잡기 및 빙어튀김 맛보기 체험으로 겨울 축제를 즐길 수 있다.","<a href=""http://폭포관광농원.kr/""target=""_blank"" title=""새창 : 얼음골폭포관광농원 사이트로 이동"">http://폭포관광농원.kr/</a>"
얼음골한옥펜션&캠핑장[한국관광 품질인증/Korea Quality],1882210,숙박,숙박시설,한옥,http://tong.visitkorea.or.kr/cms/resource/04/2691004_image2_1.jpg,경상남도,128.9532971446,35.5982934067,"얼음골한옥펜션은 경남 가지산 도립공원과 운문산 군립공원 사이에 자리한 한옥 펜션으로, 해발고도 400m에 위치해 굽이굽이 물결치는 능선의 영남 알프스의 장관을 즐길 수 있다. 객실은 총 3개, 황토, 참숯 가루, 황토 삼베로 지어 건강과 힐링을 선사한다. 주방과 화장실은 현대식으로 편의성을 높였고, 부대시설로 야외수영장, 야외 바비큐장, 굴렁쇠, 투호 등 전통놀이 시설이 있다. 계절마다 사과 따기 체험, 밤 줍기, 야외 캠핑 등을 운영한다.",http://hanokpension.com
얼음나라화천 산천어축제,507599,인문(문화/예술/역사),축제,문화관광축제,http://tong.visitkorea.or.kr/cms/resource/00/3064900_image2_1.png,강원특별자치도,127.7099022603,38.1126818434," *하기 행사 내용은 이전(2024년) 행사 내용으로, 2025년도 행사 내용은 업데이트 중에 있습니다.*<br><br>강원특별자치도 화천에서 열리는 얼음나라화천 산천어축제는 2011년 미국 CNN이 선정한 '겨울의 7대 불가사의' 중 하나로 꼽힌 이색 겨울축제다. 물 맑기로 유명한 화천천이 꽁꽁 얼어붙는 매년 1월에 축제가 열리며 얼음낚시, 맨손잡기 등으로 계곡의 여왕이라고 불리는 산천어를 잡는 체험을 할 수 있다. 산천어 얼음낚시의 손맛은 물론 바로 회나 구이로 맛있게 먹을 수 있고 낚시 외에도 얼음썰매, 눈썰매, 봅슬레이 등의 다양한 겨울놀이가 펼쳐져 매년 100만명 이상이 방문하고 있다.<br><br> 
[산천어란?]<br>
연어과에 속하는 어종으로 물이 맑고 수온이 연중 20℃를 넘지 않는 1급수 맑은 계곡에서 서식한다. 아미노산, 필수지방산, 비타민 등이 풍부해 몸에도 좋고 맛도 좋은 물고기다.","<a href=""https://www.narafestival.com/01_icenara/"" target=""_blank"" title=""새창: 산천어 축제 홈페이지로 이동"">www.narafestival.com</a>"
얼큰수제비,2689357,음식,음식점,한식,http://tong.visitkorea.or.kr/cms/resource/64/2685064_image2_1.jpg,서울특별시,127.0058619153,37.5057340231,다양한 한식을 맛볼 수 있는 매장이다. 대표메뉴는 얼큰수제비다. 서울특별시 서초구에 있는 한식전문점이다.,
엄가네곰탕,2877390,음식,음식점,한식,http://tong.visitkorea.or.kr/cms/resource/84/2877384_image2_1.jpg,충청남도,126.9101762043,36.2845953771,"엄가네곰탕은 충청남도 부여군 구아리에 있는 곰탕과 갈비찜 맛집이다. 대표 메뉴는 한우 사골과 잡뼈, 우족 등을 손질해 우려내는 육수로 맛을 내는 갈비곰탕이다. 오징어, 대하, 문어 등을 넣어 요리한 매운용궁해물갈비찜도 많이 찾는다. 이 밖에 매운갈비찜, 도가니탕, 엄가네곰탕 등을 맛볼 수 있다. 곰탕 고기는 부드럽고, 갈비탕 고기는 달달하고 쫄깃하다. 밑반찬은 정갈하고 김치맛이 좋다. 부여IC에서 가깝고, 주변에 낙화암과 백제문화단지가 있다.",
엄가네본가시골집,2778479,음식,음식점,한식,,충청남도,127.1512329469,36.8774398536,"‘엄가네본가시골집’은 충남 천안시 서북구 직산읍에 있다. 지역 택시 기사들이 추천하는 음식점이다. 대표 메뉴는 구수한 사골 육수에 실한 뼈다귀가 어우러진 뼈다귀해장국이다. 이 밖에 뼈다귀전골, 묵은지뼈해장국, 고사리뼈해장국 등이 다양한 메뉴가 준비되어 있어 취향껏 선택이 가능하다. 음식점은 수도권 지하철 1호선 직산역에서 가깝다. 주변에는 직산향교, 구억마을이 있다.",
엄가네시골집24시얼큰한뼈해장국,2870875,음식,음식점,한식,http://tong.visitkorea.or.kr/cms/resource/59/2870859_image2_1.jpg,전북특별자치도,127.1301516239,35.8387084264,"전주 종합경기장 사거리에서 30m 거리에 있는 엄가네시골집 24시 얼큰한 뼈해장국은 전주의 현지인 맛집답게 이른 시간부터 찾는 이가 많다. 메뉴는 뼈해장국과 뼈전골 두 가지로 구성되어 있다. 뼈해장국은 순한 맛, 보통 맛, 얼큰한 맛 3가지가 있고, 넓고 쾌적한 내부는 입식 테이블 석과 좌식 테이블 석이 모두 있다. 가게 앞 공터가 넓어 주차 걱정이 없다. 24시간 영업이라 저녁에는 술을 마시기 위해 찾는 손님도 많다. 뼈해장국 속 고기는 부드럽고 푸짐해 한 끼 식사로 충분하다.",
엄니추어탕,2685474,음식,음식점,한식,http://tong.visitkorea.or.kr/cms/resource/63/2702463_image2_1.jpg,경기도,127.113486039,36.9894234918,한국식 생선탕 요리를 맛볼 수 있는 매장이다. 대표메뉴는 추어탕이다. 경기도 평택시에 있는 한식전문점이다.,
엄둔가자화이트펜션,899898,숙박,숙박시설,펜션,http://tong.visitkorea.or.kr/cms/resource/38/1843038_image2_1.jpg,강원특별자치도,128.2304336171,37.3396174204,엄둔가자화이트 펜션은 강원도 영월 치악산 자락에 엄둔계곡 최상류에 위치한 청정지역에 자리한 펜션으로 맑은 물과 공기 속에서 즐겁고 편안한 휴가를 보낼 수 있는 곳이다.,"<a href=""http://jaws55.wixsite.com/gajawhite"" target=""_blank"" title=""새창 : 가자화이트펜션 홈페이지로 이동"">http://jaws55.wixsite.com/gajawhite</a>"
엄둔계곡,2785628,자연,자연관광지,계곡,,강원특별자치도,128.2773110527,37.3023753765,"영월군 무릉도원면 무릉리에 위치한 계곡으로 폭이 넓고 계곡 중간에 계단식으로 물길을 막아 물놀이하기 좋은 여름 피서지로 유명하다. 마치 넓은 풀장과 같은 장소들이 여러 군데 있으며 수심이 다양해 어린아이, 어른 모두 물놀이를 즐길 수 있다. 양옆으로 높게 자란 울창한 숲이 그늘을 만들어 줘 여름이면 피서를 즐길 수 있고, 가을에는 울긋불긋 새로운 옷을 입는 계곡의 모습을 볼 수 있다. 계곡에서는 야영과 취사가 금지되어 있다.",
엄둔밸리 계곡펜션캠핑장,3072226,레포츠,육상 레포츠,"야영장,오토캠핑장",http://tong.visitkorea.or.kr/cms/resource/26/3051526_image2_1.jpg,강원특별자치도,128.2349007553,37.3099820345,"엄둔밸리 계곡펜션캠핑장은 1급수인 엄둔계곡과 위아래로 연결되어 있어, 시원하고 맑은 공기와 아늑하고 조용한 환경을 제공하는 캠핑장이다. 2,500평 규모에 50동 이상의 텐트를 칠 수 있는 캠프장에는 매점, 야외 바비큐를 위한 테라스, 개수대, 화장실, 샤워실 등이 구비되어 있어 편안하고 쾌적한 캠핑을 할 수 있다. 
펜션 앞 엄둔계곡은 아주 맑고 깨끗하며, 계곡물이 깊지 않아 어린아이들을 동반한 가족 물놀이에 아주 적당한 곳이다. 또한 양옆으로 높게 자란 울창한 숲이 그늘을 만들어 주기 때문에 여름에 피서를 즐길 수 있다. 
주변 관광지로는 요선정, 비산체험학교, 구룡산 등이 있다.","<a href=""http://xn--lu1bj5h48bjyp.com/html/sub0301.php"" target=""_blank"" title=""새창 : 홈페이지로 이동"">http://엄둔밸리.com</a>"
엄둔솔밭빌리지,2757993,레포츠,육상 레포츠,"야영장,오토캠핑장",http://tong.visitkorea.or.kr/cms/resource/56/2758756_image2_1.JPG,강원특별자치도,128.2336233855,37.3000414901,"엄둔솔밭빌리지는 강원도 영월에 위치한 펜션 겸 캠핑장이다. 캠핑장 바로 앞에 엄둔계곡이 있어 아이들이 물놀이하기 좋고, 주변 울창한 숲 덕분에 그늘이 많고 산책과 산림욕을 즐길 수 있다. 캠핑장 옆으로는 운학천과 서만이강이 만나는 주천강이 있어, 낚시를 할 수 있다. 기차나 버스로 올 경우 주천에 도착하면 픽업 서비스를 받을 수 있다. 사이트는 전화로 예약 가능하며 위치는 선착순으로 배정된다.","<a href=""http://www.solbatvillage.co.kr/"" target=""_blank"" title=""새창 : 엄둔솔밭빌리지 사이트로 이동"">http://www.solbatvillage.co.kr/</a>"
엄마는돌짜장,2904122,음식,음식점,중식,http://tong.visitkorea.or.kr/cms/resource/08/2904108_image2_1.jpg,경상북도,128.5916508054,36.0085708808,"엄마는돌짜장은 경상북도 칠곡군 동명면 기성리에 있다. 현대적인 외관과 세련된 분위기를 연출하는 인테리어가 눈에 띈다. 대표 메뉴는 여러 가지 해물, 불고기 등을 넣어 요리한 불고기 돌짜장이다. 함께 상에 오르는 매운 김치에 싸서 먹으면 별미다. 이 밖에 매운 돼지갈비찜도 많은 사람이 찾는다. 다부IC에서 가깝고, 주변에 국립칠곡숲체원과 다부동전적기념관이 있다.",
엄마밥상,2841589,음식,음식점,한식,http://tong.visitkorea.or.kr/cms/resource/83/2841583_image2_1.jpg,경상북도,128.606313653,35.999547176,"엄마밥상은 경상북도 칠곡군 동명면 기성리에 있다. 가정식 백반 전문점으로 유명하다. 깔끔한 외관과 인테리어가 눈에 띈다. 
대표 메뉴는 찰진 솥밥, 미니 굴전, 각종 밑반찬 등이 상에 오르는 엄마상차림이다. 이 밖에 굴밥상차림, 엄마밥상, 생굴전, 간고등어, 불고기, 부추전 등도 맛볼 수 있다. 내부에는 단체석이 마련되어 있어 모임 하기 좋고, 어린이 손님을 위한 놀이방이 갖추어져 있다. 다부IC에서 가깝고, 인근에 팔공산도립공원이 있어 연계 여행에 나서기 좋다.",
엄마밥상 세천점,2846054,음식,음식점,한식,http://tong.visitkorea.or.kr/cms/resource/47/2846047_image2_1.jpg,대구광역시,128.4772312243,35.877303094,"엄마밥상 세천점은 대구광역시 달성군 다사읍 세천리에 있다. 세련된 느낌의 외관과 고급스러운 분위기를 연출하는 인테리어가 눈에 띈다. 내부에는 어린이를 위한 놀이방이 있고 그 옆에는 놀이방에 있는 어린이를 관찰하며 식사할 수 있는 룸이 있어서 가족들이 식사하기에 좋다. 단체석도 마련되어 있어 각종 모임을 하기 좋다. 대표 메뉴는 평일 오전 11시 30분부터 오후 3시 30분까지 맛볼 수 있는 점심특선 엄마밥상이다. 솥 밥과 굴전 등이 나오는 엄마상차림도 인기다. 이 밖에 굴전, 고등어, 게장 등이 상에 오르는 곤드레정식 등도 맛볼 수 있다. 북다사IC에서 가깝고, 인근에 마천산산림욕장, 대한불교조계종 불은사가 있다.",
