title,contentid,cat1,cat2,cat3,firstimage,region,mapx,mapy,overview,homepage
카페미담,2687671,음식,음식점,카페/전통찻집,http://tong.visitkorea.or.kr/cms/resource/53/2684953_image2_1.jpg,강원특별자치도,128.8825350167,37.7404613731,다양한 커피와 디저트를 맛볼 수 있는 곳이다. 강원도 강릉시에 있는 카페다. 대표메뉴는 아메리카노다.,
카페미드슬로프,2877514,음식,음식점,카페/전통찻집,http://tong.visitkorea.or.kr/cms/resource/85/2877485_image2_1.jpg,전북특별자치도,127.3342220482,35.4252894267,"넓은 마당에 소나무 한 그루, 산 중턱이라 자연 그대로의 푸릇푸릇함을 눈에 담을 수 있는 카페이다. 주차 공간도 넓다. 자연 속에 있기 때문에 지정된 흡연구역 이외에는 금연이다. 넓은 잔디밭에 야외석도 있고, 카페 내부도 자리 간 간격이 넓어서 여유롭게 숨 고르며 차 한 잔과 휴식을 즐길 수 있는 곳이다. 2층 루프탑도 이용이 가능하나 8세 미만의 아이들은 부모님 동행 하에만 출입이 가능하다. 안쪽으로 길게 이어지는 직사각형의 내부 공간 가운데에는 디저트류가 진열되어 있고 테이블들이 뒤쪽으로 있어 편안한 자리에서 자연을 감상하기 좋다.",
카페미우,2853672,음식,음식점,카페/전통찻집,,서울특별시,126.9585347238,37.5392348387,"카페미우는 서울 효창공원역을 지나 경의선 공원 인근에 위치한 핸드드립전문 카페이다.
카페의 이름은 사장님의 반려견 미우의 이름을 따서 지어졌다. 핸드드립 커피 외에도 다양한 음료와 수제간식을 판매한다.","<a title=""새창 : 카페미우 인스타그램 페이지로 이동"" href=""http://www.instagram.com/cafe.miwo0"" target=""_blank"">http://www.instagram.com/cafe.miwo0</a>"
카페민트,2915299,음식,음식점,카페/전통찻집,http://tong.visitkorea.or.kr/cms/resource/82/2915282_image2_1.jpg,대전광역시,127.3440742761,36.357514088,"카페민트는 대전광역시 유성구 봉명동, 유성온천역 인근에 있다. 24시간 영업하는 카페로 대표 메뉴는 에스프레소와 굴뚝빵이다. 이 밖에 아메리카노, 카레라떼, 카페모카 등 여러 가지 음료가 준비되어 있다. 당근케이크, 치즈케이크, 수제다쿠아즈 등 각종 디저트도 있다. 유성IC에서 가깝고, 주변에 유성온천공원, 엑스포다리와 가수원교를 잇는 갑천누리길1코스가 있다.
※ 반려동물 동반 가능(목줄, 배변봉투 지참)",
카페밀크레페,2783323,음식,음식점,카페/전통찻집,,전라남도,126.9679152267,35.3304605325,"카페 밀크레페는 크레페 전문점으로, 천연잔디에 텐트가 꾸며져 있어 마치 야외 피크닉이나 캠핑 분위기를 느낄 수 있다. 1층과 지하 1층으로 나누어진 공간은 깔끔하고 감각적인 인테리어로 감성을 더하며, 탁 트인 야외 테이블은 반려견과 함께 여유를 즐길 수 있는 공간이다.  단, 5kg 미만의 소형견에 한해 입장이 가능하다
주차장이 넓고 야외공간도 넓다. 크레페 메뉴로는 뉴욕치즈 크레페, 커스터드 망고 크레페, 뉴텔라 바나나 크레페, 복숭아 요구르트 크레페 등이 있고, 그 밖에 커피를 포함한 다양한 음료와 디저트가 준비돼 있다.","<a href=""https://www.instagram.com/cafe_meal_crepe""target=""_blank"" title=""새창: 카페밀크레페 인스타그램 홈페이지로 이동"">https://www.instagram.com/cafe_meal_crepe</a>"
카페바림,2924895,음식,음식점,카페/전통찻집,http://tong.visitkorea.or.kr/cms/resource/83/2924883_image2_1.jpg,전라남도,127.6778063609,34.7494020165,"주택가에 있는 카페바림은 브런치 맛집으로 소문이 나 이른 아침부터도 브런치를 찾는 손님이 많다. 층고가 높은 1층이라 자연채광이 카페 내부를 아늑하게 감싸는 분위기로 소파 자리, 6명이 앉을 수 있는 직사각형 테이블, 라탄 의자 등이 다양하게 준비되어 있어 골라 앉을 수 있다. 반려동물도 동반할 수 있는 카페라 목줄과 배변봉투를 지참하면 된다. 크랜베리치킨샌드위치 외에도 감바스, 에그인헬, 파니니 등 다양한 메뉴가 있다. 화이트 벽지와 우드 제품이나 라탄 소품을 많이 써 따뜻한 분위기로 동네 모임이나 간단하게 브런치를 하면서 이야기 나누기 최적의 카페이다. 이순신공원, 웅천친수공원 등이 주변에 있어 연계 관광하기 수월하다.
※ 반려동물 동반가능 (목줄, 배변봉투 지참)","<a href=""https://www.instagram.com/cafe_barim""target=""_blank"" title=""새창 : 카페바림 사이트로 이동"">https://www.instagram.com/cafe_barim</a>"
카페바틈,3044095,음식,음식점,카페/전통찻집,http://tong.visitkorea.or.kr/cms/resource/75/3044075_image2_1.jpg,서울특별시,127.0099841419,37.5904131477,"소설원 서가는 [작은 눈이 내리는 정원]이라는 뜻을 가진 한성대입구역에서 가까운 카페이다. 
1층부터 5층까지 한 건물이 카페 건물로, 동양적인 느낌과 모던한 인테리어가 돋보이는 2층에는 입식 테이블이 준비되어 있으며 통창으로 밖의 햇빛이 실내를 환하게 비춘다. 3층은 오픈된 칸막이 룸으로 좌식으로 앉을 수 있으며 각 룸에는 벽마다 CD 플레이어와 헤드폰이 구비되어 있어 노래를 감상할 수 있다. 4층은 다인실 테이블이 놓여 있는 룸이 있어 주변의 시선을 의식하지 않고 편안하게 모임을 가질 수 있다. 5층 공간을 지나 건물 옥상으로 나가는 문을 열고 나가면 테이블이 준비되어 있어, 봄이나 가을의 따스한 햇볕을 받으며 차 한 잔을 즐길 수 있다.
대표 메뉴로는 흑당 아인슈페너, 흑임자 아인슈페너가 있으며, 말차 페이스트리 호떡, 밀크티 푸딩 등 다양한 디저트도 함께 즐길 수 있다.",
카페반월,2753347,음식,음식점,카페/전통찻집,http://tong.visitkorea.or.kr/cms/resource/60/2753860_image2_1.jpg,경기도,127.0551375316,37.2256034916,화성 반월 고등학교 입구에 정원이 잘 가꾸어진 브런치 카페이다. 캠핑장 느낌이 드는 뒤뜰 마당엔 트램펄린이 있어 어린 자녀들과 함께 방문하기 좋다. 키오스크로 주문하는 수제버거는 오픈 주방에서 만드는 과정을 직접 볼 수 있다.  별도의 공간에 빔프로젝트가 설치된 단체석이 있다. 카페 한쪽에 텀블러 등 소품을 판매한다.,
카페배양장,2930099,음식,음식점,카페/전통찻집,http://tong.visitkorea.or.kr/cms/resource/82/2930082_image2_1.jpg,경상남도,128.3418322541,34.8361095145,"카페 배양장은 수년간 멍게를 양식하는 공간을 모던한 카페로 탈바꿈해 운영하는 곳이다. 현재까지도 일부 공간은 멍게가 자라고 있다. 바다와 작은 포구를 바라보고 있는 커다란 통창과 높은 층고, 좁지 않은 테이블 간격으로 시원한 개방감과 여유가 느껴지는 공간이다. 가장 사진 찍기 좋은 곳은 카페 앞 야외 선착장에 바다를 향해 놓여있는 벤치 의자와 파라솔이다. 바닷바람을 맞으며 고즈넉한 어촌 마을을 감상할 수 있다. 메뉴는 아메리카노를 비롯한 커피류와 밀크티, 녹차 라테, 스무디, 에이드, 티 등 일반 카페에서 볼 수 있는 메뉴들과 간단한 종류의 베이커리가 있다. 또한, 필름 카메라도 판매하고 있어 아날로그적인 감성을 즐기기 좋다.
※ 반려동물 동반 가능",
카페버치,2766523,음식,음식점,카페/전통찻집,http://tong.visitkorea.or.kr/cms/resource/59/2765459_image2_1.jpg,경기도,127.1112287204,37.6517578408,"카페 버치는 별내동에 있는 브런치 카페이다. 세련된 인테리어가 인상적인 곳이다. 통창의 유리로 되어 있으며, 자리마다 아크릴 칸막이를 설치했다. 영업시간은 10시 30분~22시이며, 브런치는 오후 8시 마감된다. 매일 3시 20분~4시 30분은 브레이크타임이 있다. 음료는 가능하다. 불암산 방향 마을 입구에 버치 전용 주차장이 있다.",
카페베네치아,2894359,음식,음식점,카페/전통찻집,http://tong.visitkorea.or.kr/cms/resource/44/2894344_image2_1.jpg,경기도,127.2917248123,37.4081282771,"카페베네치아는 경기도 광주시 초월읍 곤지암천 앞에 있는 브런치 카페이다. 차량 이용 시 건물 앞에 주차장이 있어 편하게 주차할 수 있다. 2층 단독건물로 통창으로 개방감이 좋고 다양한 크기의 테이블이 여유롭게 배치되어 있다. 1, 2층 테라스와 3층 옥상에도 좌석이 있어 많은 인원을 수용할 수 있다. 이곳은 커피, 콜드브루, 라떼, 허브티, 주스, 에이드 등의 다양한 음료와 리코타치즈 샐러드, 베네치아 브런치, 마늘빵 샐러드 등의 샐러드&브런치 메뉴가 준비되어 있다. 또한 연유 공룡알, 제주 한라봉 쉬폰, 몽블랑 등 오너 쉐프가 직접 만드는 베이커리도 맛볼 수 있다. 카페베네치아는 야외 테라스 자리에 반려동물을 동반할 수 있고 펫티켓은 필수이다.
※반려동물 동반 가능(야외 테라스)","<a href=""https://www.instagram.com/venezia_.cafe/""target=""_blank"" title=""새창 : 카페베네치아 사이트로 이동"">https://www.instagram.com/venezia_.cafe/</a>"
카페베이스,3060265,음식,음식점,카페/전통찻집,http://tong.visitkorea.or.kr/cms/resource/56/3060256_image2_1.JPG,부산광역시,129.2239980395,35.2151859193,"연화해변 서암 방파제 앞에 있는 카페 베이스는 동해안 푸른 바다 풍경을 조망할 수 있는 힐링 카페이다. 1층부터 4층까지 카페로 운영하며, 각 층마다 제각각 다른 인테리어로 꾸며 놓아 색다른 분위기를 연출한다. 5층의 루프탑은 바닷바람을 맞으며 휴식할 수 있는 공간이다. 카페에는 음료와 베이커리 등이 다양하게 구비되어 있고, 3층과 5층에 야외 테라스가 있어 인생 사진을 찍을 수 있는 포토존이 있다.
카페가 있는 연화리 해변은 해물, 전복죽 등 다양한 해산물로 유명한 해변이다. 연화리 해변에서 해산물도 맛보고, 멋진 풍경이 있는 카페에서 힐링하는 여유를 즐겨보면 좋은 곳이다.",
카페벼리,2832510,음식,음식점,카페/전통찻집,http://tong.visitkorea.or.kr/cms/resource/99/2832499_image2_1.jpg,울산광역시,129.4577932253,35.5533329266,"주전 해안가에 있는 카페벼리는 오션뷰에 루프탑까지 갖춘 베이커리 카페이다. 건물 뒤에 전용 주차장이 구비되어 편하게 주차할 수 있으며 편안한 분위기의 카페벼리는 디저트 맛집으로 유명하다. 시그니처 메뉴인 크루아상은 플레인, 요플레 망고, 블루베리, 인절미 등 다양한 종류가 구비되어 있다. 또한 카페벼리만의 특제 크림으로 만든 아인슈페너, 아몬드 크림라테도 대표 메뉴라고 하니 한번 맛보길 추천한다. 건물은 총 3층으로 통유리를 통해 오션뷰를 만끽할 수 있도록 쇼파와 빈백 등이 마련되어 아이들과 함께 오기 좋으며 1층 야외 테라스는 반려동물 출입도 가능하다. 
※ 반려동물 1층 야외 테라스만 출입 가능","<a href=""https://www.instagram.com/cafe_byoly_official""target=""_blank"" title=""새창 : 카페벼리 사이트로 이동"">https://www.instagram.com/cafe_byoly_official</a>"
카페보니비,2785875,음식,음식점,카페/전통찻집,http://tong.visitkorea.or.kr/cms/resource/42/2792142_image2_1.jpg,충청남도,127.2259252968,36.4027512636,"공주에 자리한 카페 보니비는 정성껏 가꾼 아름다운 정원으로 유명하다. 다양한 종류의 수목과 계절마다 피고 지는 꽃들, 유럽풍의 건물이 어우러져 이국적인 분위기를 즐기기에도 좋다. 정원 곳곳에도 테이블이 놓여 있어 맑은 날에는 야외에서 따스한 햇볕과 시원한 바람을 즐겨봐도 좋겠다. 카페 내부도 온통 초록빛이다. 마치 온실에 들어온 것처럼 싱그러운 분위기가 눈과 마음을 사로잡는다. 개와 고양이도 자유롭게 돌아다니며 손님들에게 살갑게 군다. 이곳에선 커피와 차, 에이드 등을 맛볼 수 있는데 특히 정원의 매력을 듬뿍 담은 장미꽃차와 토종박하차, 메리골드차 등이 인기다.",
카페보롬왓,2910815,음식,음식점,카페/전통찻집,http://tong.visitkorea.or.kr/cms/resource/96/2910796_image2_1.JPG,제주특별자치도,126.7525080052,33.4135241052,"카페보롬왓은 보롬왓 농장 안에 있다. 계절마다 메밀꽃, 유채꽃, 수국, 라벤더 등을 볼 수 있는 넓은 꽃밭과 다양한 공기정화 식물이 있는 온실, 동물농장을 함께 둘러볼 수 있으며 농장을 달리는 깡통기차도 인기이다. 넓은 농장의 풍광을 감상할 수 있는 곳에 카페가 있고 음료와 함께 다양한 베이커리류가 있으며 당일 생산, 판매하며 조기 품절 될 수 있다. 주변 여행지로 성읍민속마을, 영주산 등이 있다.",
카페보리,2836039,음식,음식점,카페/전통찻집,http://tong.visitkorea.or.kr/cms/resource/32/2836032_image2_1.jpg,경기도,127.1245455884,37.699330326,"경기도 남양주시 별내동에 있는 한옥 카페이다. 목조 한옥을 개조해 과거와 현대가 공존하는 공간을 만들었다. 입구에는 주문하는 곳과 주방이 있다. 1층은 작은 방 3개와 홀에 난로가 있다. 계단으로 2층을 오르면 긴 복도 따라 방이 있다. 방 이용 시간은 2시간으로 제한이 있다. 뒤뜰로 가면 몽골 텐트 옆에 야외 테이블이 있다. 드립 커피, 쑥 라테 같은 음료와 소금 빵 등의 베이커리를 판매한다. 옛날 방식으로 만든 팥빙수도 별미다. 겨울에는 난로에서 구운 밤과 고구마도 판매한다. 매장 앞에 주차 공간이 있다.","<a href=""https://www.instagram.com/cafebori/""target=""_blank"" title=""새창 : 카페보리 사이트로 이동"">https://www.instagram.com/cafebori/</a>"
카페부엌,2893906,음식,음식점,카페/전통찻집,http://tong.visitkorea.or.kr/cms/resource/94/2893894_image2_1.jpg,경상남도,128.6398746553,34.7726441608,"학동 몽돌해수욕장 바로 앞에 있는 카페부엌은 식사와 디저트를 함께 즐길 수 있는 곳이다. 1층, 2층으로 이루어진 이곳은 어느 곳에서나 탁 트인 거제 바다 풍경을 볼 수 있다. 테이블 간 거리도 여유 있어 편하게 이용할 수 있고, 통창으로 개방감이 좋다. 바싹하게 튀긴 눈꽃 치즈 등심 돈가스와 통오징어, 전복, 돌문어가 들어간 해물라면이 이곳 대표 메뉴이다. 카페부엌은 해변 근처에 있어 바구니, 접이식 테이블, 방수 매트, 블루투스 스피커가 들어있는 피크닉 세트도 대여해 주고 있다.",
카페북촌,2841819,음식,음식점,카페/전통찻집,http://tong.visitkorea.or.kr/cms/resource/97/2841797_image2_1.JPG,경상남도,128.4210034529,35.2429097641,"함안 카페 북촌의 외관은 알록달록 다채로운 색감의 이국적인 느낌이 물씬 나는 카페다. 야외 테라스에는 파라솔이 있는 테이블과 캠핑에 온 듯한 느낌의 캠핑 부스 테이블 등 재밌는 공간들이 있다. 그래서 카페 내부로 들어가기 전 사진 찍는 방문객들을 흔히 볼 수 있다. 빨간 벽돌로 꾸며진 카페 입구로 들어가면 깔끔하고 넓은 내부를 볼 수 있다. 1층과 2층으로 이루어진 카페 북촌은 음료와 디저트뿐 아니라 브런치, 샐러드도 함께 즐길 수 있다. 2층은 1층의 규모보다는 작지만, 노키즈존으로 운영되며, 조용히 커피와 음료를 마실 수 있는 공간이다.","<a href=""https://www.instagram.com/cafe_bukchon""target=""_blank"" title=""새창 : 카페북촌 사이트로 이동"">https://www.instagram.com/cafe_bukchon</a>"
카페브리드,2858653,음식,음식점,카페/전통찻집,http://tong.visitkorea.or.kr/cms/resource/38/2858638_image2_1.jpg,충청남도,126.9740298257,36.7635276148,"카페브리드는 충청남도 아산시 기산동에 있다. 현대적인 외관과 세련된 분위기를 연출하는 인테리어가 눈에 띈다. 내부에는 단체석이 마련되어 있어 각종 모임을 하기 좋다. 대표 메뉴는 화이트엔젤이며, 사막소금라떼도 인기다. 디저트로는 크로와상, 앙버터베이글 등을 맛볼 수 있다. 트러플크림파스타, 불고기파니니 등 식사류도 판다. 남풍세 IC에서 가깝고, 인근에 신정호국민관광지, 온양온천랜드, 외암민속마을이 있어 연계 여행에 나서기 수월하다.",
카페브리프,2852187,음식,음식점,카페/전통찻집,http://tong.visitkorea.or.kr/cms/resource/79/2852179_image2_1.jpg,제주특별자치도,126.4156862313,33.4583721062,"카페 브리프는 제주시 애월읍 고성리에 있는 디저트 카페다. '경험과 취향을 판매하고 분위기를 제공한다'는 모토로 비주얼 좋은 음료와 베이커리 키트를 판매한다. 대표 메뉴는 접시 대신 나무 박스에 선물처럼 나오는 브리프 디저트 박스인데 하루 40세트만 판매한다. 그 외에도 앙버터 키트, 브리프 모닝이 있어 취향에 따라 직접 만들어 먹는 재미가 있다. 매장 한편에는 다양한 굿즈를 전시 판매하고 일정 요금을 지불하면 4컷 사진도 매장 안에서 찍고 출력할 수 있다. 푸른 잔디가 깔린 정원과 귤나무 앞도 좋은 포토존이다, 근처 여행지로 항파두리항몽유적지가 있다.","<a href=""https://www.instagram.com/brief_official/""target=""_blank"" title=""새창 : 카페브리프 사이트로 이동"">https://www.instagram.com/brief_official/</a>"
카페브릭,2835370,음식,음식점,카페/전통찻집,http://tong.visitkorea.or.kr/cms/resource/54/2835354_image2_1.jpg,충청남도,127.0933790445,36.8049693956,"카페브릭은 충청남도 아산시 탕정면 매곡리에 있다. 건물 1층은 이탈리아 레스토랑이고, 2층과 3층이 카페브릭이다. 세련된 외관과 더불어 차분한 느낌의 인테리어가 눈에 띄는 곳이다. 통유리 밖으로는 소박한 시골 풍경이 펼쳐진다. 대표 메뉴는 솔트 캐러멜 마키아토가 있다. 이 밖에 카페라테, 아인슈페너, 아메리카노, 시저샐러드, 큐브 프렌치토스트 등도 맛볼 수 있다. 내부에는 단체석이 마련되어 있어 각종 모임 하기에 적당하다. 천안IC에서 가깝고, 인근에 아산 지중해마을, 불당동 유적공원 유아숲체험장이 있다.","<a href=""http://instagram.com/cafe_brick_maegok/""target=""_blank"" title=""새창 : 카페브릭 사이트로 이동"">http://instagram.com/cafe_brick_maegok/</a>"
카페브릭,2836194,음식,음식점,카페/전통찻집,http://tong.visitkorea.or.kr/cms/resource/90/2836190_image2_1.jpg,서울특별시,127.1086354797,37.6178978416,"카페브릭은 중랑구 신내동에 있는 카페다. 6호선, 경춘선 신내역 2번 출구 서울새솔초등학교 인근에 있다. 주차장은 카페 언덕 좌측에 있다. 카페 입구에는 카페 이름이 있는 포토존이 마련되어 있다. 야외에는 테이블과 의자가 마련되어 있고 내부 인테리어는 화이트, 우드, 브라운 계열로 인테리어로 외부 건물 디자인과 일치하게 되어있다. 대표 메뉴는 그릴 클럽 샌드위치와 아인슈페너다. 그릴 클럽 샌드위치에는 샐러드와 함께 햄, 치즈, 계란, 야채가 들어있다. 그 외 디저트는 마들렌, 에그스콘 등 베이커리류가 있다. 카페 인근에는 캠핑장, 봉화산, 서울어린이대공원이 있어 연계 관광이 가능하다.",
카페블랙,2685397,음식,음식점,카페/전통찻집,http://tong.visitkorea.or.kr/cms/resource/78/2682778_image2_1.jpg,서울특별시,126.8918301452,37.5231355163,직접내린 커피를 맛볼 수 있는 곳이다. 대표메뉴는 아메리카노다. 서울특별시 영등포구에 있는 카페다.,
카페블룸,2869441,음식,음식점,카페/전통찻집,http://tong.visitkorea.or.kr/cms/resource/28/2869428_image2_1.jpg,경기도,127.0559770509,37.6920882628,"경기도 의정부시에 있는 카페다. 음악이 흐르는 로맨틱한 정원에서 맛있는 커피 한 잔을 여유롭게 즐길 수 있는 곳이다. 외부와 내부 모두 좌석이 마련되어 있어 원하는 자리에 앉을 수 있다. 블룸브런치, 알리오올리오, 카르보나라, 매콤포모도로, 카페라테, 카페모카 등 브런치를 비롯해 파스타와 음료가 준비되어 있으며 그 외에 샌드위치, 샐러드, 케이크 등도 맛볼 수 있다. 매장 앞에 주차장이 있어 주차하기에 편리하다. 대중교통을 이용하는 경우, 수락리버시티 버스 정류장에서 도보 5분 정도 거리에 있다.",
카페비슬,2856338,음식,음식점,카페/전통찻집,http://tong.visitkorea.or.kr/cms/resource/28/2856328_image2_1.jpg,대구광역시,128.4939734615,35.7025648387,"카페비슬은 대구광역시 달성군 유가읍 양리에 있다. 모던한 멋을 풍기는 외관과 고급스러운 인테리어가 눈에 띈다. 1층, 2층, 루프탑으로 이루어져 있으며, 내부에는 포토존, 단체석 등이 있다. 외부 정원에는 파라솔, 분수대, 수영장, 캠핑 바비큐 시설 등이 설치되어 있다.
대표 메뉴는 비슬 야외 바비큐다. 이 밖에 브런치 플레이트, 각종 베이커리, 아메리카노 등 여러 가지 음료를 맛볼 수 있다. 북현풍 IC에서 가깝고, 인근에 비슬산자연휴양림, 비슬산치유의숲이 있다.
※반려동물 동반 가능(목줄, 배변봉투 지참)",
카페비아조,3066825,음식,음식점,카페/전통찻집,http://tong.visitkorea.or.kr/cms/resource/03/3066803_image2_1.JPG,부산광역시,128.9091839635,35.2085280671,"부산 강서구 식만마을회관 인근 낙동강변에 자리 잡고 있는 카페 비아조는 낙동강을 조망하면서 음료를 마실 수 있는 분위기 좋은 대형 카페이다. 원두막과 조각상, 조경수 등 이국적인 야외정원이 잘 꾸며져 있으며, 강변 바로 옆에 좌석이 배치되어 있어서 한 폭의 풍경화를 보는 것 같은 분위기를 느낄 수 있다. 카페는 3층 건물로 각 층마다 낙동강 뷰를 볼 수 있고, 창밖을 바라볼 수 있도록 좌석이 배치되어 있다. [비아조]는 이탈리아어로 [여행하다]라는 뜻을 가지고 있으며, 낙동강변의 시원한 카페에서 바람의 쐬며 잠시 쉬어가라는 뜻에서 이름을 지었다고 한다.",
카페쁠레노,2946648,음식,음식점,카페/전통찻집,http://tong.visitkorea.or.kr/cms/resource/10/2947410_image2_1.jpg,서울특별시,127.0408194587,37.5193525139,"‘카페쁠레노’는 아시아 프린스로 불리는 배우 ‘장근석’이 운영하는 카페이다. 화이트 풍 인테리어와 식물 장식으로 산뜻하면서 고급스러운 분위기를 자아내고 마치 식물원에 방문한 것 같은 기분을 느낄 수 있다. 또한 카페 내에 훌륭한 채광으로 창가자리는 항상 인기 있는 자리이다. 매장 내 꽃 장식은 계절마다 달라지며 그 계절을 만끽할 수 있는 꽃들로 구성된다. 대표메뉴로는 고소한 우유와 에스프레소의 조합이 좋은 카페라떼이며 그 외에 메뉴로 음료와 디저트, 브런치가 풍부하게 구성되어 있다. 그리고 배우 ‘장근석’을 보기 위해 해외 관광객들이 많이 찾아 3개 국어가 적힌 메뉴판이 준비되어 있다.","<a href=""https://www.cafepleno.com/""target=""_blank"" title=""새창 : 업체홈페이지 이동"">https://www.cafepleno.com/</a><br><a href=""https://www.instagram.com/cafepleno""target=""_blank"" title=""새창 : 업체인스타그램 이동"">https://www.instagram.com/cafepleno</a>"
카페사월,2865518,음식,음식점,카페/전통찻집,,충청북도,127.5833844248,36.3214391409,"카페사월은 옥천 교동저수지 초입 벚꽃길에 있는 카페이다. 벚꽃길 호수뷰와 디저트 맛집으로 인기있다. 주차가 편리하고 교동저수지 근처를 산책하기에도 좋다. 1층은 모던하고 심플한 분위기로 꾸며져 있고, 2충은 넓은 통유리로 되어 있어 탁 트인 뷰를 볼 수 있다. 루프탑 공간에도 의자와 테이블 조명이 있어 더 높은 곳에서 호수를 보며 카피를 마실 수 있다.","<a href=""https://www.instagram.com/cafe.sawol/"" title=""새창 : 카페사월 인스타그램으로 이동"">https://www.instagram.com/cafe.sawol/</a>"
