title,contentid,cat1,cat2,cat3,firstimage,region,mapx,mapy,overview,homepage
영성식당(영성횟집),1349053,음식,음식점,한식,,전라남도,127.1370148879,34.5237347356,"가족끼리 운영하는 횟집으로 아들이 건져낸 도미를 도마에 올려 익숙한 솜씨로 회를 뜨는 사람은 어머니, 손님들에게 반찬을 챙겨주는 사람은 또 아버지다. 봄, 여름에는 농어회가 좋고, 가을과 겨울에는 돔이 횟감으로 좋다고 한다. 이 집의 통장어탕도 별미 중의 별미다. 뼈를 발라 살집이 씹히는 식감과 국물 맛이 좋은 건 살아 있는 장어를 바로잡아 요리하기 때문이란다. 반찬으로는 갯고둥, 어리굴젓, 시금치 오징어무침, 파래무침, 마른 장어 무침 등이 있다.<br>",
영성횟집,2574086,음식,음식점,한식,,경상남도,128.4294577439,34.8440824078,"통영 동호동에 위치한 영성횟집은 회 전문점이다. 항상 싱싱한 활어회를 사용하고 있으며 제철 회를 즐기는 재미가 있다. 봄에는 도다리회, 여름에는 하모회(갯장어), 가을에는 전어회, 겨울에는 감성돔 등이 있다. 그 외 전복 물회, 멍게비빔밥, 매운탕, 회덮밥 등 다양한 식사류도 준비되어 있다.",
영수사(진천),125920,인문(문화/예술/역사),역사관광지,사찰,http://tong.visitkorea.or.kr/cms/resource/79/3355379_image2_1.JPG,충청북도,127.5513619838,36.8350519097,"충청북도 진천군 초평면 영구리에 있는 대한불교조계종 소속 사찰이다. 영수사 경내에는 조선 후기에 지은 정면 3칸, 측면 2칸 규모의 겹처마 맞배지붕의 관음보전과 관음보전에 봉안된 목조관음보살좌상(木造觀音菩薩坐像), 그리고 충청북도 유형문화재 제44호인 「영수사 괘불(靈水寺掛佛)」과 조선 말기에 그려진 「후불탱화」와 「칠성탱화」 등이 남아 있다. 이 밖에 근래에 신축한 정면 3칸, 측면 3칸 규모의 대웅전, 그리고 대웅전 앞마당 좌우측에 콘크리트조의 승방 건물과 삼성각이 있다. 영수사는 두타산 서쪽 기슭에 자리한다.","<a href=""http://www.grandculture.net/jincheon/toc/GC02701066"" target=""_blank"" title=""새창 : 홈페이지로 이동"">http://www.grandculture.net/</a>"
영수암(서천),337522,인문(문화/예술/역사),역사관광지,사찰,http://tong.visitkorea.or.kr/cms/resource/03/3339903_image2_1.jpg,충청남도,126.6643366472,36.091138275,"영수암은 대한불교조계종 제6교구본사인 마곡사의 말사이다. 이 사찰은 약 500여 년 전부터 퇴매산 봉우리에 있던 영수암이 있었으며, 100여 년 전에 지금의 위치로 옮겨왔다고 한다. 사찰에는 대웅전, 설법전, 산신각, 요사채가 있으며, 대웅전 안에 봉안된 삼존불을 모시고 있다. 이 삼존불 가운데 목조보살좌상은 2007년 9월 20일 충청남도 문화유산자료로 지정되었다. 
대웅전을 중심으로 산신각과 요사채로 이루어져 있다. 대웅전은 ‘ㄱ’ 자 구조로 정면은 4칸, 측면의 한쪽은 2칸, 다른 쪽은 3칸인데, 예전에 민가였던 것을 고쳐서 사용하고 있다. 대웅전 뒤편에 있는 산신각은 정면과 측면 각각 1칸인 맞배지붕 구조이며, 안에는 독성탱화, 산신탱화, 칠성탱화가 봉안되어 있다.",
영수테이블,2858083,음식,음식점,한식,http://tong.visitkorea.or.kr/cms/resource/55/2858055_image2_1.png,충청남도,127.1040390952,36.8085886121,"영수테이블은 충청남도 천안시 서북구 불당동에 있는 브런치 전문점이다. 현대적인 외관과 세련된 분위기를 연출하는 인테리어가 눈에 띈다. 대표 메뉴는 수란, 버섯, 수제 베이컨, 소시지, 아보카도 등이 어우러진 빅블랙퍼스트다. 이 밖에 에그베네딕트, 연어베네딕트, 프렌치토스트, 치즈오믈렛 등 여러 가지 브런치 메뉴를 즐길 수 있다. 천안 IC에서 가깝고, 인근에 에어 바이킹 포시즌 파크, 천안박물관이 있어 연계 여행에 나서기 수월하다.","<a href=""http://instagram.com/youngsootable""target=""_blank"" title=""새창 : 영수테이블 사이트로 이동"">http://instagram.com/youngsootable</a>"
영순네횟집,2774691,음식,음식점,한식,,강원특별자치도,128.5676310156,38.2497016937,"봉포 해수욕장과 봉포항 근처에 위치한 횟집으로 자연산 활어회와 해산물이 푸짐하게 들어간 물회를 맛볼 수 있다. 회와 대게, 매운탕, 물회를 세트로 구성한 회랑게랑 세트가 대표메뉴이다. 물회, 특물회는 ‘오색 빛깔 물회’라는 별명이 있을 정도로 다채로운 해산물이 푸짐하게 들어가는 메뉴로 인기가 많다. 그 외에도 대게, 킹크랩, 회덮밥, 전복죽, 성게알 비빔밥, 멍게 비빔밥, 오징어순대, 매운탕, 우럭 지리, 오징어, 해삼 등 여러 가지 해산물 메뉴를 판매하고 있다.",
영스낵,2689385,음식,음식점,한식,http://tong.visitkorea.or.kr/cms/resource/29/2685129_image2_1.jpg,서울특별시,127.0763958467,37.6495907971,20년 전통의 분식전문점이다. 대표메뉴는 떡볶이다. 서울특별시 노원구에 있는 한식전문점이다.,
영식이네순대국밥,2892088,음식,음식점,한식,http://tong.visitkorea.or.kr/cms/resource/77/2892077_image2_1.jpg,강원특별자치도,128.595910104,38.2144424606,"영식이네순대국밥은 강원도 속초시에 있는 순대국밥 전문점이다. 순대의 모든 것이라고 할 수 있을 만큼 다양한 순댓국을 팔고 있다. 일반 순댓국 외에 아바이순대국밥, 김치순대국밥, 모듬순대국밥, 소머리국밥, 돼지뽈살순대국밥, 돼지뽈살모듬순대국밥, 돼지뽈살김치순대국밥 등 순댓국의 종류가 다양하다. 어느 것을 주문하든 순대와 머리 고기가 푸짐하게 들어있고 국물은 진하면서도 시원하다. 속초를 여행한다면 한 끼는 꼭 먹어야 하는 음식이다. 반찬은 배추김치와 깍두기인데 순댓국과 어울리고 맛도 좋다. 부족한 것은 셀프바를 이용해서 추가하면 된다. 번화가에 있어 주차는 불가능하다. 주변 공영주차장을 이용하거나 유료 주차장에 차를 대고 방문해야 한다. 대기가 많은 식당이라 도착하면 제일 먼저 테이블 링에 예약하고 순서를 기다려야 한다.",
영식이네순대국밥,3301220,음식,음식점,한식,http://tong.visitkorea.or.kr/cms/resource/77/2892077_image2_1.jpg,강원특별자치도,128.595910104,38.2144424606,"영식이네순대국밥은 강원도 속초시에 있는 순대국밥 전문점이다. 순대의 모든 것이라고 할 수 있을 만큼 다양한 순댓국을 팔고 있다. 일반 순댓국 외에 아바이순대국밥, 김치순대국밥, 모듬순대국밥, 소머리국밥, 돼지뽈살순대국밥, 돼지뽈살모듬순대국밥, 돼지뽈살김치순대국밥 등 순댓국의 종류가 다양하다. 어느 것을 주문하든 순대와 머리 고기가 푸짐하게 들어있고 국물은 진하면서도 시원하다. 속초를 여행한다면 한 끼는 꼭 먹어야 하는 음식이다. 반찬은 배추김치와 깍두기인데 순댓국과 어울리고 맛도 좋다. 부족한 것은 셀프바를 이용해서 추가하면 된다. 번화가에 있어 주차는 불가능하다. 주변 공영주차장을 이용하거나 유료 주차장에 차를 대고 방문해야 한다. 대기가 많은 식당이라 도착하면 제일 먼저 테이블 링에 예약하고 순서를 기다려야 한다.",
영신공원,3061204,인문(문화/예술/역사),휴양관광지,공원,http://tong.visitkorea.or.kr/cms/resource/09/3001209_image2_1.jpg,인천광역시,126.7205371226,37.5342172918,"인천 계양구에 있는 영신공원은 전주 이씨 영신군파 이이묘가 있어 유명하다. 효령대군의 손자인 이이가 나라에 공을 세워 영신군에 봉해졌고 여기에 그를 비롯한 가족들의 묘가 조성되어 있다. 지방문화재 기념물 제43호인 영신군 이이묘에는 해다마 음력 10월 8일 전국에서 후손들과 문화 관련 인사들이 참여하여 성대한 제례가 거행되는데 전통적인 의식으로 펼쳐져 볼거리를 제공한다. 
영신공원은 소나무가 숲을 이루고 주변이 잘 조성되어 있어 근린공원으로서의 역할을 하고 있으며, 이이의 묘역에는 묘갈(죽은 이의 이름을 새긴 표지석)과 석물들이 배치되어 있어 조선시대 왕실제사나 문화연구에 귀중한 자료이다.","<a href=""https://www.heritage.go.kr/heri/cul/culSelectDetail.do?ccbaCpno=2332300430000&pageNo=1_1_1_1&sngl=Y""target=""_blank"" title=""새창 : 국가유산청 이동"">https://www.heritage.go.kr/</a>"
영실국수,2774868,음식,음식점,한식,http://tong.visitkorea.or.kr/cms/resource/38/2774938_image2_1.jpg,제주특별자치도,126.4583815477,33.2544508767,"3대째 주방장이 매일 직접 뽑아내는 생면 100%를 사용한 고기국수 전문점 영실국수는 쫄깃하고 탱탱한 식감으로 유명하다. 고기국수, 짬뽕, 회국수, 돌문어 비빔밥 등 다양한 메뉴가 준비되어 있다. 스포츠투데이 주관 2017년 고객 만족 부분 대상을 차지한 업체로 고기국수, 비빔국수, 짬뽕, 돔베고기, 수육, 고기만두 등으로 구성된 가성비 좋은 영실상차림 세트가 유명하다. 또한, 4세 미만의 아이에게는 국수가 무료로 제공된다.","<a href=""http://instagram.com/yeongsilnoodle"" target=""_blank"" title=""새창 : 영실국수 사이트로 이동"">http://instagram.com/yeongsilnoodle</a>"
영심(Osim),2674666,음식,음식점,카페/전통찻집,http://tong.visitkorea.or.kr/cms/resource/17/2674617_image2_1.jpg,경기도,127.0577083662,36.9669695348,가벼운 식사와 음료를 마실 수 있는 주차장 넓고 야외 테라스가 있는 분위기 좋은 카페이다. 대표메뉴는 파스타다. 경기도 평택시에 있는 양식전문점이다.,
영안반점,132878,음식,음식점,중식,http://tong.visitkorea.or.kr/cms/resource/55/1892655_image2_1.jpg,광주광역시,126.9135856725,35.150757701,영안반점은 광주 시내 번화가에 위치한 전통 있는 중화요리 전문점이다. 이곳은 위생적이고 친절한 업소로 광주시 지정 모범업소로 선정된 음식점이다. 메뉴를 보면 알 수 있듯 오직 정통 중화요리만을 고집한다. 약 60여 년 동안 이어온 전통의 맛을 느낄 수 있어 현지인들은 물론 광주를 방문하는 관광객들 또한 즐겨 찾는 곳이다.,
영안수련원,1199526,레포츠,육상 레포츠,수련시설,http://tong.visitkorea.or.kr/cms/resource/78/3386078_image2_1.JPG,경기도,127.4229523318,37.9639577407,"영안수련원은 2006년 5월에 개원하여 국내 최고의 자연환경과 깨끗하고 쾌적한 시설로 문화, 체육, 수련, 여가활동의 전당을 마련한다. 생활관 본동을 비롯하여 생활관 A,B,C동이 있으며, 대강당과 세미나실, 잔디운동장과 대운동장 등의 체육시설과 식당, 원두막과 바베큐장, 산책로 등 다양한 부대시설이 마련되어 있다. 특히 대강당은 400명을 한번에 수용할수 있으며 빔프로젝트, 대형스크린, 음향시설 등 각종 악기가 구비되어 있어 기업 연수나 대규모 단체 모임 등도 가능하다.","<a href=""https://www.gptour.go.kr/tour/tour_view.jsp?menu=assets&submenu=&paramidx=TL0000072"" target=""_blank"" title=""새창 : 가평 문화관광 홈페이지로 이동"">https://www.gptour.go.kr/tour/tour</a>"
영암 부춘정,3078023,인문(문화/예술/역사),역사관광지,유적지/사적지,http://tong.visitkorea.or.kr/cms/resource/66/3055166_image2_1.jpg,전라남도,126.6849724313,34.8175081049,"조선후기 청암 강한종(1549~1622)이 교류 및 학문 연마를 위해 지은 정자로 전라남도의 8대 정자 중 하나이다. 기록에 의하면 부춘정의 건립 연도는 광해군 10년(1618)이다.
강한종은 무과에 급제한 후 평양 판관 겸 병마절제사를 지내고 임진왜란에도 참전하였다. 광해군 때에 난정을 상소하다가 뜻을 이루지 못하자 귀향하여 지금의 위치에 부춘정을 마련하고 학문의 장으로 삼았다. 안쪽이 전부 방으로 구성된 구조로 보아 단순한 정자로서의 기능보다는 서재와 학습과 숙식의 기능도 함께 하였을 것으로 보인다. 
야트막한 배날리길 연정산 자락에 터를 잡아 전면으로는 월출산이 마주 보이고, 주변 풍광도 뛰어나 관련 시문이 다수 전하고 있다. 부춘정을 오르는 돌계단과 주위로 오래된 나무숲과 입구의 팽나무가 아름드리 서 있어 시원한 느낌을 준다.","<a href=""https://www.heritage.go.kr/heri/cul/culSelectDetail.do?pageNo=1_1_1_1&sngl=Y&ccbaCpno=2113602840000"" target=""_blank"" title=""새창 : 홈페이지로 이동"">https://www.heritage.go.kr/</a>"
영암 수성사,3078022,인문(문화/예술/역사),역사관광지,사찰,http://tong.visitkorea.or.kr/cms/resource/83/3055183_image2_1.jpg,전라남도,126.700441044,34.7956941492,"60세 이상의 전직 관리와 학자들의 수양처로 인의예지신의 구현을 목적으로 하는 수양처로 일종의 경로당과 같은 기능을 한다. 조선 시대부터 일제 강점기까지 영암 원로들의 고견을 모으는 장소로 이용되었다. 수성사라는 액호는 1655년 향토 주민의 귀감이 되는 장소라 하여 조정으로부터 하사 받은 것이라고 전해지고 있고, 원래 성안에 있다가 성밖의 성황사 쪽으로 이전했다고 하나 모두 확실하지는 않다. 현재의 장소는 원래 조선시대 때 단군과 영암을 수호하는 신령을 모시는 부군당으로 보이는데 1953년에 이곳에 세워졌다. 2005년 4월 낡은 건물을 헐고 다시 지었다. 수성사 뒤로는 단군성전이 있어 매년 개천절에 단군제를 봉행하며, 부군당에 지내는 제사도 조선시대 때는 이곳에서 주관했던 것으로 보인다. 
수성사에는 팽나무 5본, 은행나무 2본 등 모두 7본이 보호수로 지정되었는데 수령은 300살이 넘는다. 수성사 사장은 영암 사포계장을  겸임하는 전통이 있다.",
영암 영보마을,128428,인문(문화/예술/역사),체험관광지,농.산.어촌 체험,http://tong.visitkorea.or.kr/cms/resource/67/2516467_image2_1.jpg,전라남도,126.7316097085,34.8288520477,"영보마을은 전형적인 남도 전통가옥 마을이다. 마을 뒤편으로 형제봉이 병풍처럼 서 있고, 제2의 금강산으로 일컬어지는 월출산을 마주하고 있다. 형제봉과 월출산 중간에 놓인 벌판의 모습은 마치 전쟁을 치루기 위해 산들이 양편으로 갈라져 대치하고 있는 듯한 느낌을 준다. 월출산의 화살 바람이 불어오면 응수라도 하듯 맞바람이 불어 한여름에도 서늘하다. 이러한 지형적 특색으로 인해 주변 경관이 아름답다. 영보마을에는 19세기 말에 지어진 전형적인 남도 지방의 전통가옥이 즐비하다. 안채, 사랑채, 헛간채, 문간채와 사랑 마당까지 고스란히 보존되고 있는 최성호 가옥 물론 보물 최덕지 영정 및 유지 초본과 보물 영보정 등 민속자료들이 살아 숨쉬는 곳이다.",
영암 왕인박사마을,894204,인문(문화/예술/역사),역사관광지,민속마을,http://tong.visitkorea.or.kr/cms/resource/45/3028245_image2_1.jpg,전라남도,126.625562308,34.7638964859,"남한의 금강 국립공원 월출산 자락에 위치한 영암왕인박사 권역은 2200년의 역사를 가진 마을로 일본에 한자와 유학을 전한 왕인박사와 풍수지리설의 시조인 도선 국사 탄생지이며 전통기와집과 오래된 정자들, 정겨운 흙담 등 마을 전체가 살아있는 박물관과도 같다. 
권역 내 구림마을에는 450여 년 동안 구림대동계가 존속되어 오고 있고 마을중심에 자리한 시유도기의 발상지 영암도기문화센터에는 다양한 전시관광 체험공방이 있어 관광객이 직접 교육을 병행한 도예체험을 할 수 있다. 
남도관광의 명소인 이곳 영암 왕인박사 권역에서는 주민들(왕인촌)이 다양한 체험프로그램들을 운영하고 있으며 100여 채의 한옥 민박집마다 독특한 개별체험프로그램이 있어 여느 체험마을과는 사뭇 다르다. 월출산국립공원과 왕인박사유적지, 도기문화센터 등 주변관광지와 왕인촌 주민자치회가 네트워크화되어 전통 및 향토문화 웰빙 체험프로그램을 제공하는 것이 이 마을의 가장 큰 특징이며 우리나라 체험관광 문화를 선도해 나가는 마을로 손꼽을 만하다.
<출처 : 영암 왕인박사마을 홈페이지>","<a href=""http://www.xn--hz2b35bz4ft7gi8a2i.com/"" target=""_blank"" title=""새창: 영암 왕인박사마을 "">www.왕인박사마을.com</a>"
영암 장천리 선사주거지,250280,인문(문화/예술/역사),역사관광지,유적지/사적지,http://tong.visitkorea.or.kr/cms/resource/65/2516765_image2_1.jpg,전라남도,126.5837246379,34.7512027782,"청동기시대의 집자리 유적으로, 서호면 면소재지에서 동남쪽으로 약 500m 떨어진 장천리 괴음마을 앞 도로변에 자리하고 있다. 청동기 시대 이곳 사람들은 지름이 4∼5m 크기의 원형 움집을 짓고 살았다. 움집은 땅을 30∼50m정도 파고 내부바닥은 진흙으로 다졌으며 벽을 따라 기둥을 세우고 풀이나 갈대로 지붕을 만들었다. 집의 면적은 약 12∼20㎡로 4명에서 5명 정도의 가족이 모여 생활했을 것으로 추정된다. 형태는 원형 내지 타원형을 이루고 있다. 중앙에 얕은 구덩이가 있고, 바닥면 가장자리에 기둥구멍이 마련되어 있는데, 화로터나 출입구가 없는 것이 특색이다. 출토된 유물로는 항아리형·사발형의 무늬없는토기, 화살촉·가락바퀴·삼각형 돌칼 등 석기류가 있다. 현재 이곳에는 원형 움집 1채와 사각형의 움집 1채를 복원해 놓았다. 원형은 원래 이곳에 있던 형태의 것이고 사각형은 중부나 북부지방에서 발견되는 움집을 비교할 수 있게 만들어 놓았다. 유적지 옆에는 발굴유물을 전시하는 전시관이 있는데 집안의 생활모습, 돌칼, 돌화살촉 복제품이 전시되어 있으며 고인돌이나 토기 만드는 방법이 그림으로 소개되어 있어. 선사시대 사람들의 생활모습을 한 눈에 볼 수 있다. 1984년 목포대학 박물관에서 발굴조사한 것으로, 한반도 서남부지역에서만 볼 수 있는 독특한 문화권의 유적이다.

(출처 : 영암군 문화관광 홈페이지)","<a href=""https://www.yeongam.go.kr/home/historicalsite/prehistoric/prehistoric_01/yeongam.go"" target=""_blank"" title=""새창 : 영암군 문화관광 홈페이지로 이동"">www.yeongam.go.kr</a><br /><a href=""https://www.heritage.go.kr/heri/cul/culSelectDetail.do?pageNo=1_1_1_1&sngl=Y&ccbaCpno=2333600980000"" target=""_blank"" title=""새창 : 국가유산 홈페이지로 이동"">www.heritage.go.kr</a>"
영암 집영재,3056873,인문(문화/예술/역사),역사관광지,고택,http://tong.visitkorea.or.kr/cms/resource/64/3056864_image2_1.jpg,전라남도,126.5337759866,34.7627312131,"서당으로 사용되었던 건물로 집영재의 상량문에 기록된 바에 의하면 헌종 5년(1839)에 지은 것으로 조선 후기 인근의 세 성씨 문중이 연합하여 세운 서당이다. 당시 참여한 문중은 해주 오씨, 제주 양씨, 순천 김씨였다. 영암 지역에서는 단독으로 서당을 세운 사례로는 장흥의 위씨 문중이 세운 장천재, 화순 양씨 문중이 세운 삼지재 등이 있다.
집영재는 H자형 단층 팔작집이다. 앞면 3칸·옆면 2칸의 몸체에, 앞면 1칸·측면 3칸 반의 날개채가 몸채보다 1칸 내밀어져 H자형을 이루고 있다. 특히 누마루는 규모가 작으면서 위풍을 간직하고 있는 건물이다. 전체적으로 정대칭 구조의 단순한 평면이지만 공부하는 대청, 휴식하는 누, 잠자는 온돌방이 다 갖춰진 학사로 볼 수 있다. 서원이나 향교와 달리 온전한 형태의 서당이 남아 전하는 예가 매우 드물어 집영재는 조선 후기 서당 건축을 알 수 있는 귀중한 자료이다.","<a href=""https://www.heritage.go.kr/heri/cul/culSelectDetail.do?pageNo=1_1_1_1&sngl=Y&ccbaCpno=2443600160000"" target=""_blank"" title=""새창 : 홈페이지로 이동"">https://www.heritage.go.kr</a>"
영암 학계리석불입상,129658,인문(문화/예술/역사),역사관광지,유적지/사적지,http://tong.visitkorea.or.kr/cms/resource/04/219404_image2_1.jpg,전라남도,126.6181672655,34.7008423425,"영암군 학산면 학계리에 있는 높이 4m의 석불 입상이다. 화강암에 돋을새김을 한 직사각형 모양으로 민머리 위에 상투 모양의 머리묶음은 불분명하고 4각형의 얼굴은 몸에 바짝 붙어있다.머리에 비해 어깨가 좁아 양감이 있다. 손모양은 왼손을 들어서 배에 대고 오른손은 길게 내리고 있는데 신체에 비해 너무 작게 표현되었다. 서 있는 자세의 하체 부분은 형체만을 나타내는 등 전체적으로 단순하게 표현되었다. 가슴 앞의 옷주름도 전통적인 ‘U자형’이 아닌 ‘凹형’ 무늬를 새겼고, 왼쪽 팔에 걸쳐 내린 4가닥의 옷자락만 간략하게 표현하였다. 얼굴과 몸 아랫부분에 금이 갔다. 커다란 바위에 불상의 형태만 그렸을 뿐 수법이 단순하고 양식을 형식화한 것으로 보아 조선 초기 전후의 불상 양식으로 추정된다.","<a href=""https://www.yeongam.go.kr/home/tour/enjoy/enjoy_06/enjoy_06_01/enjoy_06_01_15"" target=""_blank"" title=""새창 : 영암군 문화관광 홈페이지로 이동"">www.yeongam.go.kr</a><br><a href=""https://www.heritage.go.kr/heri/cul/culSelectDetail.do?pageNo=1_1_1_1&sngl=Y&ccbaCpno=2113600660000"" target=""_blank"" title=""새창 : 문화재청 홈페이지로 이동"">www.cha.go.kr</a>"
영암곤충박물관,2779301,인문(문화/예술/역사),문화시설,박물관,http://tong.visitkorea.or.kr/cms/resource/35/2781135_image2_1.jpg,전라남도,126.6851369678,34.7903583844,"영암곤충박물관은 전남 영암군 영암읍 회문리에 있는 영암 기찬랜드 안에 있다. 어린이들이 곤충과 파충류를 직접 보고 체험할 수 있는 박물관이다. 친절한 해설과 다양한 체험으로 교육과 놀이를 함께 하는 어린이들의 행복한 놀이터다. 박물관에는 700여 점이 넘는 세계 각국의 곤충들의 다양한 표본들이 전시되어 있다. 해설가 선생님의 설명을 곁들여 우리가 몰랐던 곤충들의 이야기를 재밌게 접할 수 있다. 박물관 앞마당 잔디밭에는 투호놀이, 고리 던지기, 캐치볼 등 어린이들이 가지고 놀 수 있는 도구들이 있어 가족 단위로 여행하기에도 적합하다.",
영암군국민여가캠핑장,2739357,레포츠,육상 레포츠,"야영장,오토캠핑장",http://tong.visitkorea.or.kr/cms/resource/31/2739531_image2_1.JPG,전라남도,126.6918502828,34.7896224673,"국립공원 월출산 자락인 영암읍 회문리 산 1번지에 있는 캠핑장으로 국립공원 월출산 천황봉을 5시간 내 등반할 수 있다. 자연 풀장으로 이름 높은 최고의 여름 휴가지 기찬랜드가 기찬묏길을 통하여 도보로 10분 거리에 있어 다양한 여가 활동을 할 수 있는 공간이다. 또한, 캠핑장은 크기가 다양한 텐트 사이트가 33면, 화장실, 샤워장이 각각 2개소, 주차장, 전기, 수도 등 편의 시설을 갖추고 있다. 텐트 속에서 바람 소리, 물 소리, 새소리, 빗방울 떨어지는 소리 등 자연이 속삭이는 소리를 선명히 느낄 수 있어 자연 속에서 사색과 힐링을 누릴 수 있는 곳이다. 야간에는 영암읍 시가지 야경을 한눈에 조망할 수 있는 풍광 좋은 캠핑장이다.
(출처: 영암군국민여가캠핑장)","<a href=""https://www.yeongam.go.kr/home/ok/camping/info"" target=""_blank"" title=""새창 : 영암군 국민여가 캠핑장 사이트로 이동"">https://www.yeongam.go.kr/home/ok/camping/info</a>"
