title,contentid,cat1,cat2,cat3,firstimage,region,mapx,mapy,overview,homepage
달서천 자전거 광장,3399442,레포츠,육상 레포츠,자전거하이킹,,대구광역시,128.5562130057,35.8824956255,"평리교에서 금호강 합류점까지 2.2km 구간으로 자전거를 빌려 타고 신천과 강정보로 이동할 수 있는 친환경 생태하천이다. 만남의 관장에는 교목, 관목, 초화류(사철채송화 등 3천230그루) 등을 볼 수 있으며, 달서천 언덕에 산책로 및 자전거도로가 조성되어 있고, 수질정화생태학습장과 징검다리, 의자, 운동시설 등이 있다. 쾌적한 친수공간으로 자리매김하고 있는 달서천과 자전거 만남의 광장에서는 삶의 질 향상뿐만 아니라 자전거 이용 활성화에 이바지하고 있다.

(출처 : 대구서구 문화관광)","<a href=""https://www.dgs.go.kr/tour/page.php?mnu_uid=12655""target=""_blank"" title=""새창 : 업체카페 이동"">https://www.dgs.go.kr/tour/</a>"
달성 100대 피아노,1846905,인문(문화/예술/역사),축제,일반축제,http://tong.visitkorea.or.kr/cms/resource/33/3330933_image2_1.jpg,대구광역시,128.4760693326,35.8087913858,"지역을 대표하는 문화콘텐츠이자 전국 유일무이 콘텐츠로 자리잡고 있는 '달성 100대 피아노'. '달성 100대 피아노'는 1900년 3월 26일 우리나라 최초로 사문진 나루터에 피아노가 유입되었다는 역사적 사실을 바탕으로 스토리텔링하여 매년 개최되고 있는 축제이다. 지역민의 문화 향유 기회 확대를 위해 클래식, 재즈, 대중음악 등 다양한 장르로 구성하며 공연 뿐만 아니라 부대프로그램도 함께 진행하여 볼거리, 즐길거리를 제공하고 있다.","<a href=""https://www.dsart.or.kr/content/02culture/01_01.php"" target=""_blank"" title=""새창 : 달성 100대 피아노 축제 페이지"">https://www.dsart.or.kr/content/02culture/01_01.php</a>"
달성 대구현대미술제,2392105,인문(문화/예술/역사),축제,일반축제,http://tong.visitkorea.or.kr/cms/resource/46/3009846_image2_1.jpg,대구광역시,128.4679803509,35.8379573803,"1970년대 젊은작가들이 기성미술계의 경직성에 도전하며 다양한 미술실험을 펼쳤던 ‘대구현대미술제’의 정신을 계승하여 강정보 일원에서 열리는 현대미술축제이다. 달성 대구현대미술제가 개최되는 장소 강정은 1977년 ‘제3회 대구현대미술제’ 당시, 역대 최대규모인 200여명의 작가가 참여한 한국최초의 집단적 이벤트가 펼쳐진 장소로 그 의의를 가진다. 오늘날의 강정은 금호강과 낙동강이 만나는 지정학적 위치와 ‘동양 최대 수문’ 이라 불리는 강정보, 세계적인 건축가 하니 라시드가 디자인한 기하학적 디자인의 디아크 등 다양한 지역적 사회적 요소들이 갖추어져 있다.","<a href=""http://www.dalseongart.com/intro.html"" target=""_blank"" title=""새창 : 달성 대구현대미술제 홈페이지 이동"">www.dalseongart.com</a>"
달성 삼가헌 고택,1614564,인문(문화/예술/역사),역사관광지,고택,http://tong.visitkorea.or.kr/cms/resource/05/1574105_image2_1.jpg,대구광역시,128.41268888,35.9067402418,"달성 삼가헌은 사육신의 한 분인 충정공 박팽년의 자손들이 정착하여 살고 있는 박씨마을 묘골과 낮은 산 하나를 경계로 하여 자리 잡은 조선시대의 주택이다. 
넓은 터에 대문간채, 사랑채, 안채, 별당, 연못이 배치되어 있다. 박팽년의 11대 손인 성수가 1769년에 이곳에 초가를 짓고 자신의 호를 현판으로 걸어 삼가헌이라 이름 지었으며 그 뒤 그의 아들 광석이 1783년 이웃하고 있는 묘골에서 현재 위치로 분가한 다음 1826년 초가를 헐고 안채와 사랑채를 지었다.
대문을 들어서면 바로 보이는 건물이 사랑채이며, 안채는 사랑채를 거쳐야 출입을 할 수 있다. 안채와 사랑채는 대략 트인 'ㅁ자형'의 구조를 하고 있으며 안채로 드나드는 중문채와 곳간으로 연결이 되어있다. 사랑채는 'ㄱ자형' 평면으로 넓은 대청과 골방이 딸린 온돌방 2칸, 마루방, 청지기방을 두었다. 안채는 'ㄷ자형'으로 부엌, 안방, 대청, 건넌방, 개방된 툇마루 등으로 꾸몄다. 사랑채와 안채 사이의 서쪽으로 장독대, 곳간채, 안변소가 자리 잡고 있다. 
삼가헌의 백미, 별당인 하엽정은 연꽃잎의 정자라는 뜻으로 1826년 집을 지을 당시 많은 흙을 파낸 자리에 박광석의 손자 규현이 1874년에 연못으로 꾸며 연을 심고 파산서당을 앞으로 옮겨 지으면서 원래 4칸 규모의 'ㅡ자형'이었던 건물을 누마루를 한 칸을 늘여 현재의 모습으로 건축하였다. 원래 서당으로 쓰던 곳이라 하엽정이라는 현판과 함께 방앞 처마에는 파산서당 편액을 같이 볼 수 있다. 연못은 앞쪽으로 길게 뻗은 직사각형이고 가운데 원형 섬을 두고 섬까지는 외나무다리가 있다. 여름철 연못에 연꽃이 피고 주변 배롱나무에 꽃이 피기 시작하면  아름다운 풍광이 삼가헌을 더욱 돋보이게 한다. 전체적으로 조선 중기에 건축된 지방 양반가의 특징을 잘 남긴 대표적인 주택이다.","<a href=""https://www.heritage.go.kr/heri/cul/culSelectDetail.do?ccbaCpno=1482201040000&pageNo=1_1_1_1&sngl=Y"" target=""_blank"" title=""새창 : 국가유산청 홈페이지로 이동"">https://www.heritage.go.kr</a>"
달성 조길방가옥,1610542,인문(문화/예술/역사),역사관광지,고택,http://tong.visitkorea.or.kr/cms/resource/04/1574004_image2_1.jpg,대구광역시,128.5817753783,35.7558520917,"원래 대구 동촌 비행장 근처에 살던 현 소유자의 10대조가 조선 중기 난리를 피하여 달성군 가창면 정대리로 들어와 정착하면서 지은 초가집이다. 해발 고도 450m 경사가 급한 산기슭에 자리한 한덤마을에 있다. 1784년(정조 8)에 건립한 함안 조씨가 살았던 집으로 안채는 정착 당시 건립한 건물이며, 사랑채와 아래채, 부속채는 후에 다시 지은 건물이다. 안채 종도리 하부에 [성상 재위 구년 갑진 이월 십구 일 묘시 견주 미시 상량]이라는 묵서명이 있어 정확한 건립 연대를 알 수 있다. 안채를 중심으로 좌·우측에 사랑채와 아래채가 위치하여 전체적으로 [ㄷ]자 형태이다. 달성 조길방 고택은 삼량 구조로 결구 된 초가로, 초가에서는 보기 드물게 안채의 마루 정면에 원기둥을 사용하여 대량과 원초적인 상투걸이 수법으로 결구 되었으며, 특히 안채의 창호 규모와 성격은 주택 발달사 연구에 중요한 자료이다.","<a href=""http://dalseong.grandculture.net/dalseong/toc/GC40800488?search=C1/2"" target=""_blank"" title=""새창 : 홈페이지로 이동"">http://dalseong.grandculture.net</a>"
달성 태고정,231936,인문(문화/예술/역사),역사관광지,고택,,대구광역시,128.4166106288,35.911350902,"달성태고정은 조선 성종 10년(1479) 박팽년의 손자인 박일산이 세운 별당건축이다. 지금 있는 건물은 선조 25년(1592) 임진왜란 때 불타서 일부만 남았던 것을 광해군 6년(1614)에 다시 지은 것이다. 항상 바르고 올곧게 살자는 뜻에서 일시루라고도 한다. 대청에는  윤두수의 한시를 새긴 현판과 정유재란 후 이곳에 온 명나라 선무관이 남긴 현판 등이 걸려 있다 
네모난 모양의 단 위에 서 있으며 앞면 4칸 ·옆면 2칸 크기로, 동쪽 2칸은 대청마루이고, 서쪽 2칸은 방으로 꾸몄다. 대청 앞면은 개방되어 있는데 옆면과 뒷면에는 문을 달았을 것으로 추정한다. 대청 앞 기둥 사이에는 2층으로 된 난간을 설치하였다. 
규모는 그리 크지 않은 건물이지만 가구나 세부 가공이 정교할 뿐만 아니라 초익공계의 정교한 가구 구성을 갖추었기에, 건축사적 가치를 지닌 건물로 평가되고 있다.
태고정 주변으로 도곡재와 육신사, 충효당이 있으며 사육신기념관을 방문하여 사육신과 박팽년에 대한 전시 및 영상 자료를 관람할 수 있다.","<a href=""https://tour.daegu.go.kr/index.do?menu_id=00002942&menu_link=/front/tour/tourMapsView.do?tourId=KOATTR_152"" target=""_blank"" title=""새창 : 대구 문화관광 홈페이지로 이동"">https://tour.daegu.go.kr</a>"
달성 하목정,1611768,인문(문화/예술/역사),역사관광지,유적지/사적지,,대구광역시,128.3977575538,35.8818316802,"달성 하목정은 임진왜란 때 의병장이었던 낙포(洛浦) 이종문(李宗文)이 1604년(선조 37)에 세운 것이다. ‘하목정’이라는 정호(亭號)는 인조가 왕위에 오르기 전에 이곳에 머문 적이 있어 그 인연으로 이종문의 장남인 이지영에게 직접 써 준 것이다. 당나라 왕발(王勃 : 649-676)이 지은 등왕각기(騰王閣記) 서(序)에 ‘지는 노을은 외로운 따오기와 가지런히 날아가고(落霞與孤鶩齊飛) 가을 물은 먼 하늘색과 한 빛이네(秋水共長天一色)’라고 쓴 것에서 따왔다. 또한 일반 백성들의 주택에는 서까래 위에 덧서까래인 부연(附椽)을 달지 않은 것이 관례였으나, 인조의 명으로 부연을 달았다고 한다. 
달성 하목정은 정면 3칸, 측면 2칸의 대청과 정면 1칸, 측면 4칸의 방들이 서로 붙어서 전체적으로 ‘정자형(丁字形)’의 독특한 평면으로 구성되어 있는 정자형 별당 건물이다. 지붕의 양쪽 추녀를 조금씩 잘라 처마끝을 둥그스름하게 만든 방구매기 수법을 사용한 것이 특징적이다. 건물 내부에는 김명석, 남용익 등 명인들이 남긴 시액(詩額)이 걸려 있다.","대구 달성군 문화관광 <a href=""https://www.dalseong.daegu.kr/culture/index.do"" target=""_blank"" title=""새창 : 대구 달성군 문화관광 홈페이지로 이동"">https://www.dalseong.daegu.kr/culture/</a><br>국가유산청 <a href=""https://www.heritage.go.kr/heri/cul/culSelectDetail.do?pageNo=1_1_1_1&sngl=Y&ccbaCpno=1122220530000"" target=""_blank"" title=""새창 : 국가유산청 홈페이지로 이동"">https://www.khs.go.kr/</a>"
달성 한일우호관,1761643,인문(문화/예술/역사),문화시설,전시관,,대구광역시,128.6471510842,35.7233680767,"김충선(사야가) 장군을 모시고 있는 녹동서원 옆에 자리한 한, 일 화합의 공간으로 청소년들을 위한 살아있는 역사 공부와 체험 학습장으로 좋은 곳이다. 한, 일 교류 역사를 볼 수 있는 전시관을 비롯해 3D 영상실, 예절교실은 한일우호관을 찾는 국내 관광객과 일본인 관광객을 위한 한, 일 문화교류와 화합의 장으로 활용되고 있다. 이외에도 일본식 정원, 전통놀이 등 다양한 볼거리를 제공하고 있다","<a href=""http://www.dskjfriend.kr/"" target=""_blank"" title=""새창 : 달성 한일우호관 홈페이지로 이동"">http://www.dskjfriend.kr/</a>"
달성(현풍)사직단,1614360,인문(문화/예술/역사),역사관광지,종교성지,http://tong.visitkorea.or.kr/cms/resource/02/3377502_image2_1.jpg,대구광역시,128.4513134543,35.6979145842,"사직은 토지를 관장하는 사신과 곡식을 주관하는 직신을 가리키며, 두 신을 제사 지내는 단을 만들어 모신 곳이 사직단이다. 토지를 주관하는 사신과 오곡을 주관하는 직신에게 고을의 백성이 편안하게 살 수 있도록 풍요를 기원하는 제사를 지내는 제단으로, 매년 중춘과 중추에 사직제를 지내고 나라의 큰일이나 가뭄이 있을 때에는 기우제를 지내기도 하였다.

현재의 사직단은 옛 현풍 사직단 터에 충혼탑이 세워져 원래 자리에 복원하지 못하고 현재의 자리에 1996년~1997년 2년에 걸쳐 복원하였다. 이때의 사직단은 500㎡의 대지 위에 가로, 세로 각 5m, 높이 1m의 방형 단을 5m 거리를 두고 2기가 동서로 서로 마주 보고 있다. 사단은 서쪽에, 직단은 동쪽에 배치하여 북쪽을 제외한 3면에 계단을 쌓았다. 이후 1998년 한 개의 단으로 새롭게 복원하였고, 2010년 개축 복원하여 오늘에 이르고 있다. 현재의 사직단은 사면의 방형 담장 안에 남쪽으로 치우쳐 1기의 사직단이 설치되어 있으며, 담장의 각 중앙에는 홍살문이 있다. 사직단은 3단이며, 각 방향의 중앙에는 3단의 계단이 있는 형태이다. 현풍사직단은 달성군의 전통문화유산을 계승함과 동시에 후세들에게 산 교육장으로 널리 활용될 수 있을 것이다.",
달성노을공원,2742203,인문(문화/예술/역사),휴양관광지,공원,http://tong.visitkorea.or.kr/cms/resource/00/2742200_image2_1.jpg,대구광역시,128.4157405048,35.7373039257,"달성노을공원은 낙동강 자전거길 코스 중간에 있다. 이 덕분에 자전거 레포츠를 즐기는 사람들 사이에서 유명한 공간이다. 잠시 쉬어가기 좋고, 해 질 녘 노을이 내려앉는 풍경이 멋진 덕분이다. 주말이면 대구나 근교 지역에 사는 사람들이 많이 찾는다. 텐트를 설치하고 잠시 휴식을 취하기 좋다. 단, 야영이나 취사는 금지다. 간혹 낚시하는 사람들도 있는데, 달성노을공원은 원칙상 낚시를 금지하고 있다. 달성노을공원과 가까운 거리에는 달성보가 있다. 밤이 되면 경관 조명을 밝혀 화려한 야경을 선사한다. 공원 내에서 야영, 취사, 낚시는 금지한다.",
달성문화원,130010,인문(문화/예술/역사),문화시설,문화원,,대구광역시,128.4520133654,35.6989033745,"1985년 11월에 설립되었으며 향토문화예술 진흥을 목적으로 설립된 공익단체이다. 지역 문화를 기반으로 다양한 향토문화를 발굴 계승하는 것이 달성문화원의 주된 사업의 목표이다. 이에 여러 예술 활동과 문화 사업 각종 체험 프로그램 등을 매개체로 활용하여 문화혜택의 기회를 군민들에게 누릴 수 있도록 노력한다.
문화원의 주요 사업으로는 정월대보름날 달맞이 문화제, 청소년들의 건전한 성장을 도울 수 있도록 달성충효청소년문화학교, 지역차문화발전과 환경조성을 위한 달빛차회, 전통제례의식 보존과 군민의 안녕을 기원하는 사직제 등이 있으며 이 밖에 다양한 지식 습득을 위한 각종 교육사업인 문화학교를 개설하여 운영하고 있다.","<a href=""http://dgdscc.kr"" target=""_blank"" title=""새창 : 달성문화원 홈페이지로 이동"">http://dgdscc.kr</a>"
