title,contentid,cat1,cat2,cat3,firstimage,region,mapx,mapy,overview,homepage
태양커피,2847224,음식,음식점,카페/전통찻집,http://tong.visitkorea.or.kr/cms/resource/15/2847215_image2_1.jpg,서울특별시,126.9928329833,37.4902466989,"태양커피는 7호선 내방역 7번 출구에서 함지박 사거리 방향 300m 인근 주택가에 있다. 매장에 주차장은 따로 마련되어 있지 않다. 베이지색 2층 단독 건물 1층에 매장이 있다. 이곳은 최근 젊은이들 사이에서 인생 아인슈페너 맛집으로 알려져 대기하는 경우가 종종 있다. 매장 안은 주방과 홀로 구성되어 있는데 2인용 협탁 서너 개 정도로 대부분 테이크아웃으로 커피를 즐긴다. 롱블랙, 카페라테, 바닐라라테, 캐러멜라테, 시나몬 드라이 카푸치노, 아인슈페너, 콜드브루, 콜드브루 라테 등의 커피 메뉴가 있고 그중 아인슈페너가 가장 인기 있다. 인근에 예술의 전당, 양재시민의 숲, 몽마르뜨 공원, 반포한강공원(세빛섬)이 있어 연계 관광이 가능하다.",
태양힐링숲,3081654,레포츠,육상 레포츠,"야영장,오토캠핑장",http://tong.visitkorea.or.kr/cms/resource/47/3081647_image2_1.JPG,경기도,126.9417246226,37.9471314734,"영국군 설마리전투 추모공원 부근에 위치한 태양힐링숲은 시원한 계곡 옆에 글램핑과 오토캠핑을 모두 즐길 수 있는 캠핑장이다. 청량한 숲과 맑은 계곡을 끼고 쾌적한 시설과 예쁜 카페 온오프도 함께 있어 방문하기 좋은 캠핑장으로 추천이 많은 곳이다. 
글램핑 7동과 오토캠핑 27개 사이트의 숙박시설 및 매점, 24시간 온수가 나오는 개수대와 샤워장, 트램펄린 등의 시설을 갖추고 있으며 여름에는 수영장도 운영한다. 글램핑은 깨끗하고 쾌적한 관리로 입소문이 났고, 오토캠핑장은 파쇄석이 깔려있어 쾌적한 이용이 가능하나 캠핑카, 카라반, 트레일러 반입은 불가하다. 캠핑장 내 방문객과 반려동물은 입장 불가능하며 폭죽사용은 제한된다. 매점은 있으나 판매 물품이 다양하지 않으므로 필요한 물품은 미리 준비해 가는 것이 좋다.
태양힐링숲은 바닥이 훤히 들여다 보일 정도로 맑은 계곡을 끼고 있어 발을 담그며 여름의 무더위를 식히기 그만이다. 밤에는 조명을 달아 분위기 좋은 감성 캠핑장으로 변신한다. 예약제가 원칙이며, 홈페이지에서 예약 후 입금이 확인되면 예약확정문자를 보내준다. 
당동IC에서 차량으로 약 25분 소요된다. 인근에 영국군 설마리전투 추모공원, 연천고랑포구역사공원, 연천호로고루, 율곡이이유적지와 화석정, 임진각(평화누리공원), 파주출판도시, 헤이리 예술마을, 세계문화유산 파주삼릉 등이 있다.","<a href=""http://www.xn--9y2bk8m6xcn4pg9h.kr/"" target=""_blank"" title=""새창 : 홈페이지로 이동"">www.태양힐링숲.kr</a>"
태영민속박물관,615547,인문(문화/예술/역사),문화시설,박물관,http://tong.visitkorea.or.kr/cms/resource/85/3338685_image2_1.jpg,충청남도,127.4366159196,36.0516895373,"태영민속박물관은 지역 사회에 문화의 씨앗이 되고자 2000년에 개관했다. 삼국시대의 토기부터 조선시대 및 근대의 옹기가 전시되어 있다. 토기는 삼국시대 토기를 중심으로 통일신라시대 토기 및 고려시대 토기가 전시되어 있으며, 옹기는 조선시대의 것부터 근대에 사용되었던 것이다. 그리고 옛 생활을 체험해 볼 수 있는 전통 초가가 있으며, 야외전시장에서는 옹기의 기원과 발전, 옹기의 특성, 생활 속의 옹기들을 새롭게 설치된 설명 패널과 함께 종류별로 살펴볼 수 있다. 이 박물관은 시즌별 특별전은 물론 소장 유물을 상시 교체하여 가까이에서 우리 민속 문화를 느낄 수 있고 휴식공간으로도 활용된다. 또한 민속 문화를 유물을 통해 입체적으로 배우고 전통공예를 체험하면서 즐겁게 시간을 보낼 수 있는 여러 교육프로그램을 제공하여 학교 교육과 가정, 지역을 연결하는 평생학습의 실천자로서 역할을 담당하고 있다.","<a href=""http://www.tfmuseum.org/"" target=""_blank"" title=""새창: 태영민속박물관 홈페이지로 이동"">http://www.tfmuseum.org</a>"
태영사,482216,인문(문화/예술/역사),역사관광지,사찰,http://tong.visitkorea.or.kr/cms/resource/89/3381389_image2_1.JPG,전라남도,126.6158574973,34.4221402415,"태영사(台迎寺)는 북평면 남창리 1228번지 신기마을 뒤 천태산(天台山)에 있는 대흥사의 말사이다. 이곳 사람들은 칠성암이라고도 부른다. 절은 그리 높지 않은 천태산 정상아래 부분의 아늑한 곳에 자리 잡고 있으며 앞쪽으로는 남창항과 완도가 한눈에 내려다 보여 전망이 매우 좋다. 절의 바로 뒤쪽에는 7개의 바위가 병풍처럼 둘러쳐져 있어 칠성바위로 불리며 절은 신기마을에서 북두칠성이 바로 올려다 보이는 곳에 자리 잡고 있다고 한다. 대웅전으로 올라가는 길은 백팔 개의 계단으로 만들어 대숲사이로 난 계단을 오르면 백팔번뇌의 의미를 느끼게 한다. 태영사는 1552년(명종 7년)에 창건되었다고 하나 확실한 문헌기록이 없어 창건 년대는 분명치 않다. 그리고 창건 당시는 칠성암(七星庵)이었다가 임진왜란 때 폐허화 되었으며 이후 중건을 거듭하다 1976년 현재의 이름인 태영사로 고쳐졌다. 이 절은 원래 이곳 남창항의 선주(船主)와 주민들이 출항 시에 해난방지를 위해 정월 보름에 칠성기도와 제사를 지내려고 칠성각(七星閣)을 세웠다. 이때의 제각(祭閣)인 칠성각이 칠성암으로 고쳐졌다고 한다. 그 뒤 어느 해인지 알 수 없지만 경술년에 박붕명 스님이 제자 이도문 스님과 함께 중창했다고 하며 1971년 춘담 스님이 법당과 관월당을 새로 짓고 범종을 조성했다. 1985년 7월에 갑자기 불어 닥친 폭풍우로 건물이 붕괴되었으나 1989년 인근 남창항 일대주민들이 뜻을 모아 절을 다시 지었다. 이때 중건에 참여한 신도들의 이름이 사찰로 올라가는 입구의 중수석비에 새겨져 있다.
(출처 : 해남군 문화관광)","<a href=""https://www.haenam.go.kr/tour/index.9is?contentUid=18e3368f67449f460167499b57e703a1&startPage=1&cmsSearchType=CMS_GROUP_ID00000122&tCimUniqId=TCIM_000000000000263&searchSortCode=&searchTypeCode=CUI_0000002000000047&tCcdSortCode=&tCcdTypeCode=&searchType=tCimTitle&searchKeyword=%ED%83%9C%EC%98%81%EC%82%AC"" target=""_blank"" title=""새창: 해남 문화관광 홈페이지로 이동"">http://www.haenam.go.kr/tour/</a>"
태영생막창,2662513,음식,음식점,한식,http://tong.visitkorea.or.kr/cms/resource/07/2662507_image2_1.jpg,강원특별자치도,128.3218430131,37.5872488691,상차림은 직접 농사지어 정성들여 만든 음식들이다. 횡성한우 소곱창을 직접 손질하며 소곱창전골 소내장 전부 직접 손질하여 신선하고 맛이 좋다. 구이는 오대산 참숯을 사용한다.,
태영한우,2814774,음식,음식점,한식,,경상남도,128.1233194495,35.4134018877,합천군에 위치한 소고기구이집이다. 내부 인테리어가 깔끔하며 가격이 저렴한 편이다.,
태왕가든,2671867,음식,음식점,한식,http://tong.visitkorea.or.kr/cms/resource/43/2671843_image2_1.jpg,경상북도,128.4662995756,36.5421494971,다양한 한식을 맛볼 수 있는 곳이다. 경상북도 안동시에 있는 한식 전문점이다. 대표메뉴는 한방 오리 백숙이다.,
태왕리조트,3076619,숙박,숙박시설,콘도미니엄,,전북특별자치도,126.466127819,35.6079372456,"태왕 리조트&호텔은 에메랄드빛 바다가 보이는 변산면에 자리하고 있다. 전 객실 오션뷰로 발코니에서 온수제트스파도 프라이빗하게 즐길 수 있다. 조리 도구, 냉장고, 밥솥, 커피포트 등이 있어 간단한 취사가 가능하다. 
루프탑에는 5월에서 10월까지 이용이 가능한 야외 온수 인피니티 풀이 있으며 이용 시 수영복이나 래시가드 착용은 필수이다. 또한 사우나를 이용할 수 있는 찜질방이 있어 황토방에서 여행의 피로를 풀거나, 드라마펜션 1층의 공용 바비큐존에서 바비큐를 즐기는 것도 좋다. 1층에는 무인매점, 루프 마리나 카페가 있고, 넓은 루프트 탑 가든에서 아름다운 서해바다를 감상하며 힐링을 만끽할 수 있다. 
태왕 리조트의 모든 침대는 에이스침대이며 시트와 커버등을 매일 교체하기 때문에 항상 쾌적한 기분을 느낄 수 있다. 또한, 전 객실 실내 금역구역이며 객실 내에서는 해산물 및 고기 요리와 튀김류 조리는 최대한 삼가야 한다. 
주변으로 채석강, 직소폭포, 누에타운 등 서해안의 관광지들이 많이 있어 같이 둘러볼 수 있다.","<a href=""http://xn--oy2bn5uisblvpdmc.com/index.html"" target=""_blank"" title=""새창 : 홈페이지로 이동"">태왕리조트.com</a>"
태용래프팅,131929,레포츠,수상 레포츠,래프팅,http://tong.visitkorea.or.kr/cms/resource/31/1822131_image2_1.jpg,강원특별자치도,128.5119919334,37.235995795,"다양한 프로그램 개발로 재미를 배가하는 태용래프팅
태용래프팅은 일반인과 학생을 위한 폭넓은 레저스포츠를 제공하고자 다양한 프로그램을 개발하여 서비스를 제공해 주고 있다. 영월동강 주위 영월지역의 문화를 직접 체험하고 학습이 가능하도록 하여 레저스포츠와 교육적인 면을 부가하여 가족적이며, 보다 조직력을 강화시킬 수 있도록 프로그램에 중점을 두었다.
동강은 중국의 비경지대인 구이린에 비견할 정도로 풍광이 뛰어난 곳으로 유명하다. 전형적인 석회암 지대의 감입 곡류형 하천으로 조양강이 동남천을 만나는 서강(평창강)과 영월군까지의 강을 동강이라 부른다.

동강 래프팅이 유명한 이유는?
동강은 유속이 느리고 하천 폭이 비교적 넓은 편이라서 가족단위, 연인들의 데이트코스로 많은 각광을 받고 있다. 문산나루에서 섭새강변까지 10km, 진탄나루에서 섭새강변까지 15km의 코스가 상류코스이며 고씨굴에서 북벽까지가 하류코스이다.
주위 경관으로는 국내 10대 경승지로 손꼽히는 둥글바위, 만지, 된꼬까리, 어라연, 황새여울, 나래소, 파랑새절벽, 백룡동굴 등이 있으며 래프팅과 함께 고씨동굴, 고수동굴 등 동굴탐사를 겸하면 더욱 즐거운 여행이 될것이다. 

대표적인 수상 레포츠, 래프팅이란
래프팅이란 급류 타기로 많이 알려진 수상레포츠로 한배에 6~8명이 한개 조를 이루어 호흡을 맞추어 거친 물살을 헤쳐나가며 자연 경관을 직접 볼 수 있는 대표적인 모험 레포츠이다. 래프팅은 수상훈련을 통해 상황변화에 대처하는 판단력과 단결심, 협동심 등을 기를 수 있으며 스트레스 해소 및 단체 기업연수나 극기훈련 등에도 많이 애용되고 있다.","태용래프팅 <a href=""http://www.taeyong.co.kr"" target=""_blank"" title=""새창 : 태용래프팅홈페이지로 이동"">http://www.taeyong.co.kr</a>"
태웃개,3015651,자연,자연관광지,항구/포구,http://tong.visitkorea.or.kr/cms/resource/45/3015645_image2_1.jpg,제주특별자치도,126.6909082546,33.2706722216,"태웃개는 남원읍 위미리에 있는 곳으로 올레 5코스에 속해있다. 태우(떼배)를 매어두던 포구라고 하여 붙여진 명칭으로, 종정포구라고도 불리며, 용천수 담수장으로 많은 이들이 찾는다. 산에서 내려오는 지하수가 구멍마다 용천수가 나오는데, 무더운 여름철에 이러한 특성을 알고 찾아오는 인파와 올레 코스를 걷는 방문객들이 함께 즐기는 곳이다. 바로 바다를 접하고 있어 깨끗한 수질을 자랑하여 용천수 풀장이 따로 마련되어 물놀이 장소로 이용되기도 하며, 물이 맑아 스노클링 장소로도 좋은 곳이다. 방문객을 위해 성수기에는 계절음식점을 운영하기도 한다. 샤워 시설이나 편의 시설은 전무하고 방파제 입구에 공중화장실이 있긴 하다. 

태웃개는 원래 파도가 꽤 있는 해변인데 방파제 역할을 해주는 포구와 돌들로 둘러싸여 있는 곳이라 밖에서 아무리 큰 파도가 쳐도 잔잔한 물결이 들어와서 수영하는 사람들이 여유롭게 물놀이를 즐기며 해안절경을 감상할 수 있다. 민물과 바닷물이 공존하는 곳인데다가, 용천수가 사시사철 흘러나와서 물이 매우 차갑다. 파도가 세게 들어오면 물이 좀 따뜻한 느낌이 들긴 하지만 말이다. 바닷물과 섞이는 곳은 조금 깊이가 있어서 어린아이들이 놀기에는 힘들고 반드시 구명조끼나 튜브 등을 착용해야 한다. 바닥에는 날카로운 돌들이 많아 아쿠아슈즈나 물에 젖어도 되는 신발은 필수이다. 

태웃개가 요즘 더 핫하게 떠오른 이유는 바로 다이빙 명소가 되었기 때문인데 물때에 따라 수심이 차이가 나서 얕을 때는 다이빙을 삼가야 한다. 특히 조심해야 할 점은 다이빙하는 위쪽이 이끼로 인해 매우 미끄럽다. 잘못했다가는 미끄러져 크게 다칠 수도 있고 바다로 추락할 수 있는 사고의 위험 때문에 바다지킴이가 상주해 있다. 또한 태웃개에는 캠핑을 할 수 있는 잔디 사이트도 있다. 

방파제에서 섬 쪽을 바라보면 정말 멋있는 일몰을 볼 수 있다. 배경 풍경이 아름다워 지나가는 관광객들이 무조건 사진을 찍는 명소이기도 하다.",
태웅이네 막국수,2736694,음식,음식점,한식,http://tong.visitkorea.or.kr/cms/resource/63/2750463_image2_1.png,경기도,127.2465457055,37.1082288231,농사가 좋아 농사를 짓는다는 소년농부로 매스컴에서 회자가 됐던 학생 농사꾼 태웅이네 가족이 운영하는 막국수 집이다. 당연히 막국수가 주 메뉴이며 백반 메뉴로는 온묵밥이 있다. 그 외 수육과 메밀전병 등 다양한 요리를 맛볼 수 있다. 식후엔 바로 옆에 있는 ‘태웅이네 촌다방’에 가서 ‘태웅이네 막국수’의 영수증을 보여주면 아메리카노를 천 원 할인받을 수 있다.,
태원,600316,음식,음식점,중식,http://tong.visitkorea.or.kr/cms/resource/35/1884835_image2_1.jpg,인천광역시,126.6650809232,37.4397883969,다양한 해산물과 싱싱한 재료들의 특유의 맛을 그대로 살려 깔끔하고 담백한 맛이 일품이다. 격조 높고 다양한 중국요리의 진수를 제대로 맛볼 수 있는 곳으로 유명하다. 중국에 온 듯한 실내 장식으로 먹는 즐거움을 더한다.,
태을암(태안),482243,인문(문화/예술/역사),역사관광지,사찰,,충청남도,126.2982324871,36.7670265931,"태을암은 국보로 지정된 태안마애삼존불로 유명한 사찰이다. 태안은 서해안에 위치해 있어 중국의 앞선 문물이 들어오던 길목에 있을 뿐만 아니라, 동시에 항상 왜구가 출몰하여 근심이 많았던 지역이었다. 이러한 지역적 조건 때문에 다른 지역보다 빨리 태을암, 태안마애삼존불과 같은 우수한 불교문화를 조성할 수 있었다. 아울러 왜구를 방어하기 위해 원래 경상북도 의성현에 있던 단군의 영정을 모신 태일전을 옮겨와 이곳에 봉안함으로써, 단군의 가호를 받아 민생 안정을 도모하려는 상징적인 의미도 부여하였다. 태을암을 둘러보고 백화산 정산을 향해 가다 보면 백화산 구름다리를 만날 수 있다. 태을암과 함께 방문하기 좋은 코스이다.",
태인동헌,1626331,인문(문화/예술/역사),역사관광지,고궁,http://tong.visitkorea.or.kr/cms/resource/42/1606442_image2_1.jpg,전북특별자치도,126.946050585,35.6535763021,"동헌은 조선 시대 고을 수령이 업무를 보던 관청이다. 태인동헌은 조선 중종 때 태인 현감 신잠이 처음 세웠으며, 현재 건물은 순조 16년(1816)에 다시 세운 것이다. 건물 정면에는 고을을 맑고 편안하게 다스리겠다는 뜻의 청령헌을 새긴 현판이 걸려있다. 현판은 안동김씨 세도가이자 문장가로 유명한 김조순이 쓴 글씨다. 
우리나라에 남아있는 동헌 건물 중에서 규모가 큰 편은 아니지만, 원형이 가장 잘 보존된 곳으로, 건물 내부의 공간구성이 다양하다. 남쪽 전면에는 툇간이 일자로 있고, 그 뒤에 오른쪽으로 대청이 있으며, 왼쪽에는 온돌이 있다. 그 위에 다시 북쪽으로 툇간이 있는데, 이 툇간의 오른쪽 2칸은 대청보다 바닥이 높은 마루이며 나머지는 흙바닥으로 되어 있는 구조이다. 
처음 동헌을 지을 때 목수가 현감에게 천냥이면 다 지을 수 있다고 시작을 한 뒤 일천냥이 부족하다고 하였다. 그 뒤 또 천냥이 부족하다고 하여 결국 삼천냥이 들었다 한다. 그 이유를 물으니 도편수 말하기를 처음으로 삼천냥이 든다고 하면, 그 동헌을 짓지 않을 것이므로, 목수가 자신의 절묘한 기술을 발휘할 기회를 얻기 위하여, 거짓말을 했다고 전해지고 있다. 태인현 지도에 의하면, 동헌 앞에 연못이 있었다는데 지금도 조그마한 연못이 남아 있다.
주변 관광지는 피향정, 태인향교, 서현사지, 신잠비가 있다.","<a href=""https://www.jeongeup.go.kr/culture/board/view.jeongeup?menuCd=DOM_000000601004002000&boardId=BBS_0000004&dataSid=252"" target=""_blank"" title=""새창 : 홈페이지로 이동"">https://www.jeongeup.go.kr</a>"
태인향교,1626254,인문(문화/예술/역사),역사관광지,유적지/사적지,http://tong.visitkorea.or.kr/cms/resource/30/1605730_image2_1.jpg,전북특별자치도,126.9407288251,35.6540011627,"향교는 훌륭한 유학자의 제사를 지내고 지역민을 교육하기 위하여 설립한 고려·조선시대의 국립 지방 교육기관이다. 조선시대에는 국가로부터 토지와 노비 등을 지급받아 교관이 교생을 가르쳤으나, 1894년 갑오개혁으로 근대 교육이 본격화되면서 교육적 기능은 폐지되었다.
태인향교는 세종 3년(1421)에 세워졌다. 현재 남아 있는 건물로는 대성전과 명륜당, 만화루, 장수재 등이 있다. 대성전은 공자를 비롯하여 여러 성현의 위패를 모셔 놓고 제사를 지내는 곳이다. 앞면 3칸, 옆면 3칸의 규모로 지은 대성전의 맞배지붕은 책을 뒤집어서 엎어 놓은 듯한 모습을 하고 있다. 
이 향교의 특징은 외삼문 대신 무루인 만화루가 세워진 것인데, 그 어원은 공자지도(孔子之道) 만화화생(萬化化生)에서 이름 지어졌으며, 공자의 도로 만물이 교화된다는 뜻이다.
태인향교는 최익현 의병장이 이끄는 태인 의병이 머무르면서 전력을 강화하던 역사적인 곳이다. 현재는 선비문화 체험을 할 수 있으며 봄, 가을로 석전대제를 지낸다. 주변 관광지는 태인동헌, 다천사, 명봉 도서관, 정읍 피향정이 있다.","<a href=""https://www.jeongeup.go.kr/culture/board/view.jeongeup?boardId=BBS_0000004&menuCd=DOM_000000601004004000&startPage=1&categoryCode1=AC01&categoryCode3=AC02&dataSid=421"" target=""_blank"" title=""새창 : 홈페이지로 이동"">https://www.jeongeup.go.kr</a>"
태장동왕녀복란태실비,2702534,인문(문화/예술/역사),건축/조형물,기념탑/기념비/전망대,,강원특별자치도,127.9484328151,37.3813489921,"1982년 11월 3일 강원도유형문화재로 지정되었다. 조선시대에는 왕자나 공주를 낳으면 오래 살기를 비는 뜻으로 이름난 산을 찾아 명당을 잡고 그곳에 태를 묻었다. 태가 묻힌 곳을 태봉이라 불렀다. 태장동 왕녀 복란태실비는 태장2동 우성 제2차 아파트단지 안에 있다. 아파트 신축 공사를 하면서 해체하였다가 다시 복원하였다. 이때 토기·백자기·돌함 등 24점의 유물이 함께 출토되었는데, 태호와 태지는 동국대학교 박물관에 옮겨 보관하고 있다.","<a href=""https://www.heritage.go.kr/heri/cul/culSelectDetail.do?pageNo=1_1_1_0&ccbaKdcd=21&ccbaAsno=00660000&ccbaCtcd=32&ccbaCpno=2113200660000""target=""_blank"" title=""원주 문화관광"">https://www.heritage.go.kr</a>"
태장삼겹살,2670568,음식,음식점,한식,http://tong.visitkorea.or.kr/cms/resource/90/2670790_image2_1.jpg,강원특별자치도,127.9521546033,37.3847070067,한국식 BBQ 문화를 즐길 수 있는 곳이다. 강원도 원주시에 있는 BBQ 전문점이다. 대표메뉴는 생삼겹살이다.,
태재고개,3082250,자연,자연관광지,자연생태관광지,http://tong.visitkorea.or.kr/cms/resource/44/3082244_image2_1.JPG,경기도,127.1474448183,37.3603117689,"경기도 성남시 분당구 분당동에서 광주시 신현동으로 넘어가는 고개이다. 해발 180m로, 성남시에서 광주시로 넘어가는 고개들 가운데 가장 험준한 축에 속한다. 조선 중기부터 한양(漢陽)으로 통하는 큰 고개라는 뜻으로 태현이라 부르게 되었으며, 중정남한지에 [태재는 군사 요새지로 남한산성을 방어하는데 큰 몫을 하게 되었다]라고 기록되어 있다. 현재는 성남 누비길 3길과 4길의 분기점이 되는 고개로, 성남누비길은 7개 구간으로 조성된 성남시의 4대 명산을 종주할 수 있는 둘레길이다. 도심과 가까워 접근하기 쉽고 등산로가 잘 정비되어 있어 남녀노소 누구나 산행을 즐기기에 좋다. 
인근에 율동공원이 있으며 자차를 이용할 경우 율동공원 주차장을 이용하면 된다. 태재고개와 가장 가까운 전철역은 서현역이며 내려서 다시 버스를 이용하거나 도보로 트레킹을 시작할 수도 있다. 율동공원과 태재고개 주변으로 맛집이 조성되어 있어 등산을 즐긴 후 여유롭게 식사를 하기에 좋다.","<a href=""https://www.seongnam.go.kr/tour/1002004/11325/contents.do"" target=""_blank"" title=""새창 : 홈페이지로 이동"">https://www.seongnam.go.kr/tour/1002004/11325/contents.do</a>"
"태조 이성계, 조선을 건국하고 종묘와 사직을 세우다",2383723,추천코스,나홀로코스,나홀로코스,http://tong.visitkorea.or.kr/cms/resource/68/2005768_image2_1.jpg,Unknown,126.9673551116,37.5756752063,"조선시대에 ‘종묘사직’을 버린다는 것은 곧 나라가 망하도록 방치해 둔다는 의미를 담고 있다. 종묘는 역대 왕과 왕비의 신주를 봉안한 사당을, 사직은 땅과 곡식의 신에게 풍년을 비는 제단을 말한다. 종묘와 사직은 나라를 지탱하는 근간이자 안녕과 번영을 비는 가장 신성한 공간이다. 태조 이성계는 한양을 새로운 도읍지로 결정하고, 경복궁보다 종묘를 먼저 세웠다. 경복궁 왼쪽에 종묘, 오른쪽에 사직을 세웠으니, 이들 장소를 돌아보면 조선왕조의 시작을 돌아본다.",
태조대림감자국,712673,음식,음식점,한식,http://tong.visitkorea.or.kr/cms/resource/16/712816_image2_1.jpg,서울특별시,126.9166871824,37.5872146236,태조대림감자국은 서울시 은평구 응암동에 자리한 감자탕 전문점으로 응암동 감자국거리에서 가장 오래된 전통을 자랑한다. 대표 메뉴는 감자탕과 양념뼈구이를 취급한다. 이곳의 감자탕은 국내산 돼지뼈와 4시간 이상 우려낸 육수로 조리하며 부드러운 고기와 싱싱한 우거지가 만나 환상의 맛을 낸다.,
태조대왕 태실,126867,인문(문화/예술/역사),역사관광지,고궁,,충청남도,127.4532326993,36.198989697,"태조대왕 태실은 조선 태조 이성계의 태(胎)를 봉안한 석실이며 조선 최고의 풍수지리학적 명당인 금산 만인산에 자리 잡고 있다. 처음에는 함경도 함흥에 안치하였다가 무학대사의 지시로 금산 만인산으로 옮기고 태실비를 세웠다. 왕실에서 태를 안치하는 것은 나라의 대사일 뿐 아니라 그 행렬을 맞이하는 지방에서도 큰 영예로, 왕의 태실지가 안치된 현이나 군을 승격시킨 예를 종종 볼 수 있다. 태조의 태를 봉안한 진산군도 주로 승격됐다.
928년 조선총독부에서 태 항아리를 서울 창경궁으로 옮겨간 후 석비와 석조물만이 남아 원형을 찾아보기 어려울 정도로 파손되었으나, 1993년 현 위치에 복원하였다. 태실은 팔각형으로 돌 난간을 둘렀고, 태실비에는 태조대왕 태실이라는 비문이 음각되어 있다. 태실이 옮겨온 후에는 만인산을 태봉산이라고도 부르게 되었다. 1989년에는 충청남도 유형문화재로 지정되었고, 2001년에 산책로와 쉼터를 만들어 아름다운 자생식물원으로 거듭나고 있다.","▪  <a href=""https://www.geumsan.go.kr/tour/html/sub02/020311.html"" target=""_blank"" title=""새창 : 홈페이지로 이동"">https://www.geumsan.go.kr</a>"
