title,contentid,cat1,cat2,cat3,firstimage,region,mapx,mapy,overview,homepage
영암군립하정웅미술관,2732538,인문(문화/예술/역사),문화시설,미술관/화랑,http://tong.visitkorea.or.kr/cms/resource/56/3380256_image2_1.JPG,전라남도,126.6217821635,34.7606856731,"영암군립 하정웅미술관은 국립공원 월출산이 병풍처럼 펼쳐진 구림마을에 위치한 공립미술관으로, 영암군 홍보대사이자, 재일교포인 동강 하정웅 선생님께서 메세나 정신으로 평생을 수집해 온 미술작품을 기증한 것을 계기로 건립한 제1종 미술관이다. 명예홍보대사인 동강(東江) 하정웅(河正雄)이 평생 수집한 그림, 조각, 판화, 공예, 사진, 도자 등 4,572건 미술품을 기증하였다. 또한 동강 하정웅의 고향에 대한 사랑과 인류 공헌의 메세나정신(문예지원활동)을 기리고 있다. 미술관은 상설전시실과 기획전시실로 구분되어 있고 야외전시실을 운영한다. 전시정보는 홈페이지를 통해 확인할 수 있다.","<a href=""https://www.yeongam.go.kr/home/haart"" target=""_blank"" title=""새창 : 영암군립하정웅미술관 홈페이지로 이동"">https://www.yeongam.go.kr/home/haart</a>"
영암글램핑,2744422,레포츠,육상 레포츠,"야영장,오토캠핑장",http://tong.visitkorea.or.kr/cms/resource/82/2744682_image2_1.JPG,전라남도,126.5906165362,34.8310633486,"영암글램핑은 영암천 신금대교 옆 옛 신학분교를 개조해 만든 자연 친화적 분위기의 키즈 글램핑이다. 광주에서 1시간, 목포에서 30분 이내면 닿을 수 있는 거리다. 이곳 캠핑장은 옛 관사를 숙박시설로 운동장에 25동의 글램핑 텐트를 들여놓았다. 숙박시설, 남녀노소 함께 즐길 수 있는 대형 수영장, 레일 썰매, 물고기 잡기, 페달 보트, 트램펄린, 족구장, 찜질방 등의 놀이 시설, 장난감 놀이터, 키즈카페 등을 갖추고 있다.","<a href=""https://blog.naver.com/0amglam"" target=""_blank"" title=""새창 : 영암글램핑 사이트로 이동"">https://blog.naver.com/0amglam</a>"
영암금호방조제,3014405,자연,자연관광지,자연생태관광지,http://tong.visitkorea.or.kr/cms/resource/91/3014391_image2_1.jpg,전라남도,126.3850540497,34.7190725762,"영암금호방조제는 해남군 화원면과 영암군 삼호읍을 연결하는 방조제로 대규모 농경지와 수자원 확보를 위해 완성된 길이 4.3km의 방조제이다. 1996년 영암금호방조제가 준공되면서 해남에서 영암을 거쳐 목포로 가는 시간이 단축되었으며, 멀리는 진도~해남군 화원면~산이면~영암군 삼호읍~목포시가 하루 생활권이 되었다. 
현재 영암금호방조제 배수갑문 옆 방조제에는 가을철 갈치낚시 명소로 인근 시민들과 낚시꾼에게 인기가 많으며, 해수어와 담수어를 동시에 낚을 수 있는 매력적인 낚시터이다. 또한 이곳은 겨울철 금호호로 찾아오는 철새들의 장관을 볼 수 있다. 방조제 둑 위에 서면 한쪽은 파란 바다가 펼쳐지고 뒤로 돌아보면 인공 호수인 영암호가 평화롭게 펼쳐진다. 
한국농어촌공사 건물이 있는 문가도 해남광장은 산책하면서 영암호를 둘러보고 바닷바람을 쐬며 나들이하기 좋은 한적한 공간이다. 또한 이곳은 방조제의 일출과 일몰, 야경의 관람 포인트로 선박제조회사인 현대삼호중공업의 야경등을 넓은 공간에서 호젓하게 조망할 수 있는 숨겨진 명소이다. 영암금호방조제는 서해랑길 15코스이기도 하다.","<a href=""https://www.namdokorea.com/tour/info/area/areaList.do?menuCd=T002001014&area=AREA_HAENAM&infoId=0000009124"" target=""_blank"" title=""새창 : 홈페이지로 이동"">https://www.namdokorea.com/</a>"
영암내동리쌍무덤,319575,인문(문화/예술/역사),역사관광지,유적지/사적지,,전라남도,126.606422534,34.8696981486,"내동리쌍무덤은 영산강 하류에 있는 내동리 서쪽의 구릉 중간부에 있다. 발굴 조사가 이루어지지 않았으며 지표상에 드러난 고분의 외형과 규모를 통해 유적의 존재 가능성이 높은 지점으로 확인되었다. 1호분과 2호분은 봉토가 거의 맞닿아 있는데 그 사이에 오솔길이 나 있다. 1호분은 가장 큰 분구를 가지고 있는데 봉분의 규모가 56m나 되는 긴 타원형을 이루고, 2호분은 방형 또는 원형이다. 3호분은 1호분과 동쪽으로 인접해 있는데 1호분과 2호분에 비해 규모가 작다. 이 고분군은 본래 4기였으나, 4호분은 민묘(民墓) 조성으로 훼손되고 3기만 남아 있다. 쌍무덤은 1호분과 2호분을 통칭하는 것으로 구릉 끝부분에 자리 잡고 있는 쌍무덤을 마을주민들은 풍수지리적인 면에서 [매화낙지(梅花落地)]라고도 부른다.
내동리쌍무덤에 대한 성격과 구조는 정식 학술조사가 이루어지지 않아 확실히 밝혀지지 않았다. 다만 인근에 있는 초분골고분의 발굴 조사로 봉토 내에 독무덤이 묻혀 있었던 것으로 보아, 마한 시기의 지배 계급 무덤으로 생각되며 내동리쌍무덤도 같은 시기에 만들어진 것으로 추정하고 있다.","<a href=""http://tour.yeongam.go.kr"" target=""_blank"" title=""영암군 문화관광 사이트로 이동"">http://tour.yeongam.go.kr</a><br />
<a href=""http://www.cha.go.kr"" target=""_blank"" title=""문화재청 사이트로 이동"">http://www.cha.go.kr</a>"
영암도기박물관,130422,인문(문화/예술/역사),문화시설,박물관,http://tong.visitkorea.or.kr/cms/resource/48/2705748_image2_1.jpg,전라남도,126.6193323841,34.7604995424,"국내 최초의 고화도의 유약도기를 입힌 '구림도기'를 제작했던 대규모의 도기제작장인 국가사적 제338호 구림도기가마터의 역사성을 토대로 전시와, 교육 및 체험을 운영하며 영암의 황토를 이용한 영암도기 상품을 생산하여 판매한다. 오랜역사와 전통을 간직한 구림마을과 왕인박사유적지, 하정웅미술관과 어우러져 다양한 볼거리를 제공한다.","<a href=""https://www.yeongam.go.kr/home/smartdogi"" target=""_blank"" title=""새창 : 영암도기박물관 홈페이지로 이동"">https://www.yeongam.go.kr/home/smartdogi</a>"
영암매력한우삼호직매장명품관,2892984,음식,음식점,한식,http://tong.visitkorea.or.kr/cms/resource/83/2892983_image2_1.JPG,전라남도,126.4526827494,34.7790502661,"영암매력한우삼호직매장명품관은 천혜의 자연 영암 월출산 자락에서 매실과 청정수를 먹고 자란 소고기를 사용하여 육질과 풍미가 뛰어나다. 친환경 무항생제 축산물 인증 획득하여 믿고 먹을 수 있다. 주차장이 넓고 개별 룸도 마련되어 있어, 각종 모임 장소로도 적합하다. 매장 안쪽에 고기를 판매하는 정육코너가 마련되어 있어, 부위별로 골라 주문한 후 테이블에서 구워 먹을 수 있다. 정육 식당인 만큼 기본 상차림 비용은 지불해야 한다. 대표 메뉴는 꽃등심, 갈빗살, 살치살, 치마살 등이 있다. 나불도유원지, 영암호 등이 주변에 있어 연계 관광하기 수월하다.",
영암문화원,129710,인문(문화/예술/역사),문화시설,문화원,http://tong.visitkorea.or.kr/cms/resource/16/1007916_image2_1.jpg,전라남도,126.6911807185,34.7969632971,"사단법인 영암문화원은 1964년 10월 13일 설립하였다. 지방자치시대를 맞이하여 지역 고유문화의 개발, 보급, 보존, 전승과 향토사의 조사연구 및 보존, 지역문화를 육성, 발전시킴으로써 균형 있는 지역문화 진흥에 이바지하기 위해 건립되었다.
주요 시설로는 도서관과 전시실, 관광센터, 공연장 등이 있다. 이러한 시설을 기반으로 향토사, 문화유적, 민속 및 설화집 발간, 각종 문화인물에 대한 세미나 개최, 영암학 작은 도서관을 운영하는 등의 사업을 진행하고 있다. 또한, 영암문화원은 지역 주민의 문화생활 향상을 위해 다양한 문화 프로그램을 개발, 운영하고 있다. 민족의 문화를 알리기 위한 일환으로 세시풍속 경연대회를 개최하고 있으며, 영암어린이날 큰 잔치, 문예전시회 및 월출학생 예술제 등 학생 대상 행사도 진행하고 있다. 그 외에 군민예술제, 낭주골 음악회와 같은 행사와 출향인 향토작가초대전 등의 전시회를 개최하고 있다.","영암문화원 <a href=""http://yaculture.org"" target=""_blank"" title=""새창 : 영암문화원 홈페이지로 이동"">http://yaculture.org</a>"
영암어촌계 체험장,2782227,인문(문화/예술/역사),체험관광지,농.산.어촌 체험,http://tong.visitkorea.or.kr/cms/resource/27/3395927_image2_1.JPG,인천광역시,126.457409737,37.2825085725,"영흥도 북쪽에 자리 잡은 영흥면 내리의 어촌계 체험장은 십리포해수욕장과 장경리해수욕장 사이의 작은 해변인 수해해변에 위치해 있다. 갯벌 체험은 혼합갯벌로 이루어진 수해해변과 농어바위 근처에서만 가능하다. 외부인은 출입할 수 없고 영암어촌계 체험객과 주변 캠핑장이나 펜션 이용객들만 이용할 수 있다. 질퍽한 갯벌이 아니기 때문에 체험 시 장화는 필요 없다. 한 사람당 1만 원의 체험비를 지불하면 호미와 물통을 포함한 갯벌 체험 장비를 준다. 농어바위 근처는 갯바위가 발달해 경관이 뛰어나며 농어가 잘 잡히는 포인트로 물이 빠지면 길이 생겨서 농어바위까지 걸어 들어갈 수 있다. 농어바위 오른편의 수해해변은 잘 알려지지 않은 아담한 바닷가로 호젓하게 해수욕을 즐길 수 있다. 만조 때는 망둥이나 우럭, 놀래미 낚시를 할 수 있고 간조가 되면 바지락이나 굴, 박하지, 고둥 등을 잡는 갯벌 체험이 이루어진다. 이곳 역시 어촌계에서 바지락 종패를 뿌려 아쉽지 않게 바지락을 캘 수 있는 곳. 체험장 입구에 펜션이나 민박 같은 숙박시설과 식당, 매점 등 편의시설이 모여 있다.","<a href=""http://www.xn--049au7lzyhv7jdnifjojtc.kr/"" title=""새창 : 홈페이지로 이동"">www.xn--049au7lzyhv7jdnifjojtc.kr</a>"
영암왕인문화축제,525445,인문(문화/예술/역사),축제,문화관광축제,http://tong.visitkorea.or.kr/cms/resource/21/3017821_image2_1.jpg,전라남도,126.6282150035,34.7576444552,"왕인문화축제는 왕인박사의 학문과 업적을 기리고 계승하기 위해 매년 봄 개최된다. '시공초월(時空超越), 왕인의 문화 빛이 되다!'라는 주제로 3월 28일부터 3월 31일까지 4일간 왕인박사유적지 일원에서 펼쳐지며 왕인의 인문학적 가치를 현대적으로 재해석한 문자, 활자를 활용한 주요 콘텐츠와 왕인과 함께 일본 아스카 문화를 꽃피운 도공(陶工), 와공(瓦工), 불공(佛工) 등 다양한 분야의 기술과 왕인 일본 방문을 기점으로 일본의 사회적, 정치적, 경제적인 변화를 축제 콘텐츠를 통해 선보이는 대한민국 대표 인문축제이다.","<a href=""https://xn--z92bx8p2oarkp2cf2ag4z0sr.kr/"" target=""_blank"" title=""새창 : 영암왕인문화축제 홈페이지 이동"">영암왕인문화축제.kr</a>"
영암읍성,3078024,인문(문화/예술/역사),역사관광지,성,http://tong.visitkorea.or.kr/cms/resource/05/3054305_image2_1.jpg,전라남도,126.6997132659,34.7983382842,"영암성은 왜구를 대비하기 위한 목적으로 고려 말에 짓기 시작했는데 1427년부터 기존의 성곽을 늘려 축성하였으며 옹성과 해자를 제외하고 1451년 완공하였다.  2009년 발굴조사 결과 조선시대 읍성의 축조 방법에 따라 성의 외벽은 구릉을 깎아내어 석축을 쌓아 올리고, 내벽은 깎아낸 흙을 가져다가 경사지게 다진 내탁 방식의 석성이다. 전체 길이가 2,010m이며, 영암읍 동무리, 서남리, 남풍리, 역리에 걸쳐 있다. 병영성의 두 배나 되는 큰 규모의 성으로 현재 무등아파트 뒤편과 성당 뒤편에 400여 미터가 남아 있다. 
1555년 을묘왜변으로 전라도 10여 개 성을 함락한 왜구가 영암성을 포위하였을 때 5월 25일 조선 최초 의병장 양달사 장군과 영암군민들이 왜구를 물리친 영암성 대첩의 현장이다. 군청 앞에는 당시 양달사 의병장이 갈증에 허덕이던 성안의 백성들을 위하여 파게 했다는 장독샘이 남아 있으며, 양달사 의병장의 시묘공원과 함께 2019년 영암군향토문화유산 제8호로 지정되었다. 현재 영암군에서는 군수 공약사업으로 영암성 복원 및 보존에 힘을 기울이고 있다.",
영암의 명물 기찬랜드와 낙지요리 코스,2393478,추천코스,가족코스,가족코스,http://tong.visitkorea.or.kr/cms/resource/91/1073391_image2_1.jpg,Unknown,126.6852119282,34.7917082337,"월출산 자락의 기찬랜드는 자연풀장, 삼림욕장 등 웰빙시설이 되어 있어 자연에서 즐기려는 가족단위 여행에 각광받고 있다. 특히 가야금테마파크가 조성되어 있어 자녀들이 민족문화체험을 함께 할 수 있다. 월출산의 정기가 살아있는 소나무 숲 쉼터에서 자연을 마음껏 즐길 수 있는 코스니 영암에서 이 여름의 뜨거움을 식혀보자.",
"영암장 (5, 10일)",132077,쇼핑,쇼핑,5일장,http://tong.visitkorea.or.kr/cms/resource/44/1972044_image2_1.jpg,전라남도,126.7007936539,34.8013074122,"1964년 10월 1일 개설된 재래시장으로서 대지면적 5,291㎡, 매장면적 1,125m², 점포 수 142동의 규모를 가지고 있다. 이 규모는 재래시장으로서는 큰 편으로 주변의 25여 상가 또한 성업 중이다. 1998년 장옥을 새롭게 단장하여 시골 사람들의 정보교환 장소로 애용되고 있다. 또한 5, 10일마다 한 번씩 정기적으로 열리는 장날이면 아침 일찍부터 오후 6시경까지 장이 서며 인근의 주민들이 많이 찾는다. 주로 일상생활에 필요한 각종 생활용품 및 주변에서 생산된 농산물 등이 거래되고 있고 수산물의 경우 세 발 낙지가, 젓갈류로는 토하젓이 유명하다.",
영암최성호가옥,252606,인문(문화/예술/역사),역사관광지,고택,http://tong.visitkorea.or.kr/cms/resource/96/2516396_image2_1.jpg,전라남도,126.7330928898,34.8297186413,"조선 후기 전형적인 남도 부농의 집으로 19세기 말에 지은 것으로 보이며, 20세기 중반에 고친 것으로 추정된다. 문간채의 상량문에 ‘숭정기원사회갑이십팔년무신구월초칠일청축 상량’이라 기록되어 있어 1848년에 건립된 것으로 추정된다. 그러나 안채와 사랑채는 문간채보다 이전에 건축된 듯하다. 

가옥의 구조와 배치를 살펴보면 안채와 사랑채, 문간채 그리고 헛간채가 사방에 배치되어 작은 규모이지만 짜임새 있는 공간을 연출하고 있다. 안동의 ㅁ자 형식과는 다른 각각의 독립된 집 네 채가 정사각형을 이루고 있다. 문간채 서쪽 끝에 대문이 있고, 대문을 들어서면 정면으로 사랑채가 보이고 우측으로 헛간채가 이어지며, 마당을 지나 안채가 자리 잡고 있다. 안채는 아담한 규모의 一자형 집으로 서쪽부터 부엌·큰 방·대청·작은 방이 있으며, 부엌을 제외하고 앞쪽에 툇마루가 있다. 작은방 뒤쪽에는 아궁이가 있으며, 안방과 부엌 전면에 각각 계단을 설치하였다. 사랑채는 남도식으로 서쪽부터 아랫방과 옆으로 앞은 부엌방, 뒤는 사랑 부엌이 있으며, 사랑 아랫방·사랑 윗방·대청 순서로 배치하였다. 여기서는 대청을 광으로 이용한다. 대문채는 왼쪽부터 대문간·문간방·대청으로 구성되어 있다. 문간채에 대청 공간을 둔 것이 민가 형식에서는 특이한 것이다. 헛간채는 한쪽에 광이 있고 다른 한쪽에 화장실이 있으며 중심부에 헛간채가 있다. 후원과 주변에 자란 나무들이 시원한 분위기를 만들고 있으며, 부엌 뒤의 장독대가 대나무 숲 바로 앞에 자리를 잡아 청결한 감을 주고 있다.","<a href=""http://tour.yeongam.go.kr/"" target=""_blank"" title=""영암군 문화관광 사이트로 이동"">http://tour.yeongam.go.kr</a><br /><a href=""http://www.cha.go.kr/"" target=""_blank"" title=""문화재청 사이트로 이동"">http://www.cha.go.kr</a>"
영암향교,1214029,인문(문화/예술/역사),역사관광지,유적지/사적지,http://tong.visitkorea.or.kr/cms/resource/76/3382076_image2_1.JPG,전라남도,126.6930305573,34.7968855591,"영암향교는 조선 세종 2년(1420)에 처음 지어졌다. 이후 임진왜란과 1918년 화재로 불타 없어진 것을 다시 세웠지만 한국전쟁으로 또 한 번 모두 불에 타서 없어지는 수난을 겪었다. 지금 있는 건물들은 1951년에 대성전, 1963년에 학생들의 기숙사인 동재와 서재, 1969년에 명륜당을 다시 세웠고, 나머지 건물들은 이후에 차례로 지은 것이다.
건물의 구조는 교육 공간과 제사 공간을 동·서로 나란히 배치한 특이한 구조를 보이고 있다. 학생들이 모여 공부하는 강당인 명륜당은 앞면 4칸, 옆면 2칸 규모로 지었다. 공자를 비롯하여 중국과 우리나라 성현의 위패를 모신 대성전은 소박하게 단장하였다. 그 외에 두 공간을 구분 짓는 내삼문이 있고 네모반듯한 연못을 볼 수 있다.","<a href=""https://www.yeongam.go.kr/home/tour/spectacle/spectacle_03/show/90?page=1"" target=""_blank"" title=""새창 : 영암군 문화관광 홈페이지로 이동"">https://www.yeongam.go.kr/home/tour</a>"
영암호(철새도래지),126741,자연,자연관광지,호수,http://tong.visitkorea.or.kr/cms/resource/23/3379523_image2_1.JPG,전라남도,126.4738683183,34.723923484,"영암호는 영암 금호방조제가 준공되면서 만들어진 대규모 호수이다. 영암, 금호방조제는 전남 영암군 삼호읍과 해남군 화원면, 산이면을 잇는 방조제로 1985년에 공사를 시작해 1996년에 준공되었다. 영암호는 먹이가 풍부한 개펄과 넓은 수면, 따뜻한 기온 때문에 철새들의 이동통로이자 중간 기착지이다. 영암호 철새 도래지에 도래하는 철새 중 겨울 철새인 오리, 기러기류는 시베리아에서 번식을 마치고 10월부터 우리나라 서해안의 천수만, 금강 하구 등을 거쳐 서남해안 간척지로 남하하여 3월이 되면 다시 북상한다. 여름 철새인 백로류는 동남아시아에서 월동하고 4월이 되면 우리나라로 이동해 번식하고 9월경 다시 남하 이동한다. 환경부에서 1996년 10월부터 실시한 생태조사에서 34종의 겨울철새가 서식하고 있는 철새도래지로 보고되어 이 지역의 새로운 관광명소로 탈바꿈하고 있다. 주변으로 월출산국립공원, 도갑사, 왕인박사 유적지, 전라남도 농업박물관 등 많은 관광지가 있다.","<a href=""https://www.yeongam.go.kr/home/tour/spectacle/spectacle_01/spectacle_01_08"" target=""_blank"" title=""새창 : 홈페이지로 이동"">https://www.yeongam.go.kr</a>"
영애네북카페,2820330,음식,음식점,카페/전통찻집,http://tong.visitkorea.or.kr/cms/resource/26/2820326_image2_1.jpg,강원특별자치도,128.7055814809,37.6509988422,"영애네북카페는 용평리조트 대자연과 함께 50평 규모의 카페이다. 직접담은 수제청을 이용한 수제차 및 수제 에이드와 직접 선별한 스페셜 커피를 제공한다. 매일 강릉에서 직접 공수하여 커피콩을 직접 볶아 최고의 커피맛을 선사한다. 스페셜투샷커피, 다양한 수제음료 및 수제디저트와 함께 2만권의 책을 즐길 수 있는 북카페이다.","<a href=""https://blog.naver.com/planlife1015"" target=""_blank"" title=""새창 : 영애네북카페 블로그 페이지로 이동"">https://blog.naver.com/planlife1015</a>"
영양 구 용화광산 선광장,3038693,자연,자연관광지,자연생태관광지,http://tong.visitkorea.or.kr/cms/resource/76/3038676_image2_1.JPG,경상북도,129.1354405934,36.8109981306,"일월산 자생화공원 뒤에는 콘크리트가 풍화되어 흙빛을 내는 15층 높이의 계단식 사다리꼴 모양 콘크리트 구조물이 산에 파묻힌 듯 산의 일부로 남아 있다. 이 시설물은 1939년 일본 광업 주식회사에서 광물 수탈을 목적으로 건설한 광산 시설이다. 일월산에서 채굴한 광석을 이곳 선광장으로 운반하여 유용 광물인 금, 은, 동, 아연 등을 생산하였다. 부지 전체에 유기적인 시설물이 잘 보존되어 있으며 각 시설물이 일월산 자락을 따라 계단식으로 배치되어 있다. 근대기의 산업 시설로 광산 시설 중 흔치 않으며 당시 선광장의 공정 과정과 근대 광업 발달사의 일면을 보여 주는 자료로 가치가 있어 국가등록문화재로 지정되었다. 
영양군에서는 2001년도에 폐광 지역 토양오염 방지사업의 일환으로 오염원을 완전히 밀봉하고 매립한 후 이 일대를 공원 부지로 조성하였다. 또한 2004년도에는 각종 편의 시설을 설치하고 일월산에서 자생하는 야생화 113,000본 (64종), 수생 식물 6,000본 (11종)을 식재하여 전국 최대 규모의 야생화 공원을 조성하여 관광자원으로 관리하고 있다. 주변 환경이 정비되고 일월산 자생화공원이 조성되어 있어 이곳 문화재 답사를 위한 학생들과 관광객들에게 쾌적한 공간을 제공하고 있다.","<a href=""https://www.heritage.go.kr/heri/cul/culSelectDetail.do?ccbaKdcd=79&ccbaAsno=02550000&ccbaCtcd=37&pageNo=1_1_1_0"" target=""_blank"" title=""새창 : 홈페이지로 이동"">https://www.heritage.go.kr</a>"
영양 국제밤하늘보호공원,2704122,인문(문화/예술/역사),휴양관광지,공원,,경상북도,129.2694528784,36.8384448049,"영양군 수비면 수하계곡 왕피천 유역 자연경관보존지구 일부 지역을 포함하여 반딧불이 생태공원 일대를 국제밤하늘협회가 아시아 최초로 세계에서 별빛이 밝은 밤하늘을 갖고 있는 지역을 국제밤하늘보호공원을 지었다. 2007년 미국의 내추럴 브리지스 국립 천연기념물이 보호공원으로 처음 지정된 이후 미국,독일,헝가리,스코틀랜드 등 전 세계 30개 지역이 국제 밤하늘 보호공원 으로 지정됬다. 국제밤하늘협회는 품질에 따라 골드, 실버, 브론즈 등급으로 나누며 영양군의 반딧불이 생태공원은 실버 등급을 부여했다.","<a href=""https://www.yyg.go.kr/tour/attractions/nightsky_park/nightsky""target=""_blank"" title=""영양 문화관광"">https://www.yyg.go.kr/tour</a>"
영양 두들마을,547873,인문(문화/예술/역사),역사관광지,민속마을,http://tong.visitkorea.or.kr/cms/resource/66/1979166_image2_1.jpg,경상북도,129.1284986995,36.557912986,"행정구역상으로는 경북 영양군 석보면 원리리, 이곳 두들마을은 '언덕 위에 있는 마을'이라는 뜻이다. 1640년 석계 이시명 선생이 병자호란을 피해서 들어와 개척한 이후, 그의 후손인 재령 이씨들이 집성촌을 이루며 살아왔다. 조선시대 1899년에는 이곳에 국립 병원격인 광제원이 있었다 하여, '원두들, 원리'라 부르기도 한다. 마을에는 석계 선생이 살았던 석계고택과 석계 선생이 학생들을 가르쳤던 석천서당을 포함하여 전통가옥 30여 채를 비롯하여 한글 최초의 조리서 '음식디미방'을 쓴 정부인 장씨를 기리는 안동 장씨 유적비, 이문열이 세운 광산문학연구소 등이 있다. 마을 앞을 흐르는 화매천을 둘러친 절벽 바위에는 석계 선생의 넷째 아들인 이숭일이 새겨 놓은 동대, 서대, 낙기대, 세심대 등 유묵도 뚜렷하게 보인다. 1994년 정부로부터 문화마을로 지정되었다.<br>","<a href=""http://www.dudle.co.kr/www"" target=""_blank"" title=""새창: 두들마을 홈페이지로 이동"">http://www.dudle.co.kr/www</a>"
