title,contentid,cat1,cat2,cat3,firstimage,region,mapx,mapy,overview,homepage
낙원동 아구찜 거리,699222,인문(문화/예술/역사),체험관광지,이색거리,http://tong.visitkorea.or.kr/cms/resource/02/2526402_image2_1.jpg,서울특별시,126.9883060491,37.5732314221,1972년 낙원동 거리에 서울에서 처음으로 아구찜을 하는 식당이 등장했다. 당시만 해도 아구를 찜으로 해 먹는 것은 저 먼 마산에서만 듣던 소리다. 서울에서 가장 가까운 바다인 인천에서도 아구를 찜으로 해 먹지는 안았다고 한다. 아구찜 거리에 처음으로 문을 연 식당은 그래서 아구찜을 만드는 데 온갖 정성을 다 들였다. 물에 끓으면 흐물흐물해지는 아구의 살을 꼬들꼬들하게 만드는 게 최우선 과제였다. 산에서 말려도 보고 인천 앞바다 섬에 들어가 모래사장에서 말려보기도 했으나 파리가 꼬이는 등 위생상 문제가 심했다. 갖은 방법을 동원했지만 그때마다 아구의 살을 유지하기 어려웠다. 결국 터득한 방법은 찬얼음물과 끓는 물을 번갈아 가며 끓이고 식히는 식이었다. 서울에서 아구찜을 맛볼 수 있다는 말에 소문은 퍼져나갔고 소문 따라 주변에 아구찜을 하는 식당도 늘어났다. 한때 십여 집을 넘던 아구찜 식당이 어떤 이유에서인지 몰라도 문을 닫고 다른 곳으로 떠나는 시기가 있었다. 한 번 그렇게 시련을 겪고 난 뒤 다시 아구찜 거리에 아구찜 식당이 들어차게 됐고 그 결과 지금의 거리 모습을 갖추게 된 것이다. 지금 이 거리에는 불과 3~4년 전에 문을 연 집부터 30년을 훌쩍 넘긴 집까지 사이좋게 식당문을 열고 성업 중이다.,"<a href=""https://tour.jongno.go.kr/tour/tour/indvdlz/view.do?nttId=34057&menuNo=2226"" target=""_blank"" title=""종로구 문화관광 사이트로 이동"">http://tour.jongno.go.kr</a>"
낙원동 포장마차거리,3056376,인문(문화/예술/역사),체험관광지,이색거리,http://tong.visitkorea.or.kr/cms/resource/57/3056357_image2_1.jpg,서울특별시,126.989114324,37.5726898327,"낙원동 포장마차 거리는 밤이 되면 열리는 낙원상가 앞 포장마차 거리이다. 야외 테이블이 식당 밖에 주르륵 늘어서 있는데 어둑해지기 시작하면 자리들이 하나둘씩 채워진다. 주변에 익선동, 인사동 등 관광지가 많고 광화문, 종각, 시청 근처의 회사들이 많이 모여 있어서 이른 저녁 시간에도 만석이 되는 곳들이 많으니 서둘러 자리를 잡는 것이 좋다. 
대부분 음식의 가격이 저렴하지만 현금으로만 결제할 수 있다. 여러 가지 꼬치구이. 산낙지, 멍게, 해삼 등 해산물과 탕, 볶음 종류까지 다양한 메뉴가 있으며, 포차마다 메뉴가 다르기 때문에 취향이나 인원에 따라 원하는 곳을 선택할 수 있다.",
낙원빈대떡,2653723,음식,음식점,한식,http://tong.visitkorea.or.kr/cms/resource/22/2655222_image2_1.jpg,서울특별시,126.989564324,37.5712344544,낙원상가 근처에 있는 오래된 식당이다. 대표메뉴는 녹두빈대떡이다. 서울특별시 종로에 있는 한식당이다.,
낙원역사공원,125524,인문(문화/예술/역사),휴양관광지,공원,http://tong.visitkorea.or.kr/cms/resource/76/3393776_image2_1.jpg,경기도,127.2732572764,37.0054133917,"안성낙원역사공원에는 모두 46기의 공덕비 선정비, 문인석, 송덕비가 있고, 소설가 이봉구님의 문학비가 있다. 고려시대의 삼층석탑, 흩어져 있던 좌대 불상 광배들을 모아 만든 석불좌상, 석남사에서 출토되었다는 광배와 좌대 등이 남아 있어 많은 볼거리와 이야기거리를 전해준다. 그 중 특히 유념해서 볼 것이 오명항선생(1673-1728) 토적송공비라 할 것인데 이는 원래 동본동에 있던 것으로 1969년에 이곳으로 이전 복원하였는데 선생은 영조 4년(1728)에 이인좌의 난을 평정한 사로 도순무사로 분무1등공신이 되었으며 송공비는 이를 기리기 위하여 1744년(영조20년)에 만들어진 것이다. 소설가 이봉구님은 안성출신으로 일제하에서는 농촌계몽운동을 펼치기도 하였으며 작품으로는 실명소설<명동 에레지><방가로>등이 있으며, 안성을 무대로 한 <안성장날>이 있다.

(출처 : 안성시 문화관광 홈페이지)","<a href=""https://www.anseong.go.kr/tour/themeTourist/view.do?mId=0102010000&idx=15"" target=""_blank"" title=""새창 : 안성 문화관광 홈페이지로 이동"">www.anseong.go.kr</a>"
낙원우드[한국관광 품질인증/Korea Quality],2950466,숙박,숙박시설,한옥,http://tong.visitkorea.or.kr/cms/resource/95/3021395_image2_1.jpg,경상북도,128.7156657704,36.5606992744,"경상북도 안동에 위치한 낙원우드(KNOCK ON WOOD)는 기존 한옥에 현대적인 편안함을 더한, 감성 가득한  독채 한옥스테이다. 고급호텔에서 사용되는 구스 침구, 넓고 쾌적한 화장실, 한옥과 잘 어우러지면서도 편리하고 다양한 가전 및 비품들을 비치하여 만족스러운 휴식을 제공한다. 마당 한켠에 노천탕이 있어 바람, 공기, 햇빛을 느끼며 여행이 피로를 녹일 수 있다.",http://stay-knockonwood.com/#thirdPage
낙원타코 강남역점,2903776,음식,음식점,서양식,,서울특별시,127.0252436924,37.4983602268,"낙원타코는 남녀 노소 누구나 즐길 수 있는 맛있는 멕시칸 패밀리 레스토랑이다. 멕시코 고유의 맛도 느낄 수 있지만 한우대창파히타, 한우대창 할라피뇨 파스타 처럼 한국인의 입맛을 사로잡는 퓨전음식도 있어 타코를 시작하기에 안성맞춤이다. 소스와 채소도 많이 준비되어 있어 취향에 따라 골라먹을 수 있다는 장점이 있다.","<a href=""https://www.instagram.com/nakwongroup/"" target=""_blank"" title=""새창 : 낙원타코 인스타그램 페이지로 이동"">https://www.instagram.com/nakwongroup/</a>"
낙원테산도 용산아이파크몰점,2910282,음식,음식점,일식,http://tong.visitkorea.or.kr/cms/resource/66/2910266_image2_1.jpg,서울특별시,126.9647566449,37.5298249324,"낙원테산도 용산아이파크몰점은 경의중앙선, 서울지하철 1호선 용산역 1번 출구에서 테이스트파크 6층에 있다. 건물 내 주차장이 있어서 자가용을 이용할 수 있고 버스나 지하철 등 대중교통을 이용할 수도 있다. 매장은 깔끔하고 아늑한 분위기이다. 메뉴로는 낙원오믈렛, 김치오믈렛, 낙원모둠카츠, 카츠산도(히레), 카츠산도(로스) 등이 있다. 이외 다마고산도, 다시마끼산도, 나폴리탄, 슈림프 투움바 등 다양한 일본식 메뉴를 맛볼 수 있다. 식사 후에는 인근에 국립중앙박물관, 용산공원, 남산서울타워, 이촌한강공원 등이 있어 연계 관광을 할 수 있다.","<a href=""http://www.instagram.com/nakwongroup""target=""_blank"" title=""새창 : 낙원테산도 사이트로 이동"">http://www.instagram.com/nakwongroup</a>"
낙원하우스,3103193,숙박,숙박시설,펜션,,서울특별시,126.9447606873,37.5495556152,"서울 마포구 대흥동에 위치한 낙원하우스는 2023년 8월 전체 리모델링을 하며 깨끗하고 아늑한 공간을 제공한다. 방 2개, 욕실 1개, 주방, 거실로 구성되어 있고, 빔프로젝터, 세탁기, 스팀다리미가 비치되어 있어 장기 숙박을 하기에도 좋다. 조용한 주택가에 위치해 일상에서 벗어나 충분한 쉼을 누릴 수 있고, 인근에 편의점, 세탁소, 감성카페 등도 있다. 지하철을 타고 광화문, 서울역, 홍대 등 주요지역으로 편리하게 이동할 수 있다.","<a href=""https://maponakwonhause.modoo.at/"" target=""_blank"" title=""낙원하우스(으)로 이동"">https://maponakwonhause.modoo.at//</a>"
낙월도,577708,자연,자연관광지,섬,,전라남도,126.1437720739,35.203480601,"상낙월도와 하낙월도 2개의 섬을 일컫는 낙월도는 진달이 섬이라고도 불렀는데,  옛 전설에 따르면 백제가 나당연합군에 의해 망하자 백제의 왕족이 배를 타고 바다로 피난하다가 항로를 잃고 헤매던 중 섬 뒤로 달이 져버렸고 결국 섬에 정착하게 되어 그때부터 진달이 섬으로 부르게 되었다고 하며 한자어로 표기하면서 낙월도가 되었다. 1895년 지도군에 편입되면서 위쪽에 있는 섬을 상낙월도, 아래쪽에 있는 섬을 하낙월도라 부르게 되었다. 
낙월도에는 모래사장으로 이루어진 큰갈맛골해변, 작은갈맛골 해변이 있고 몽돌로 이루어진 재계미해변이 자리 잡고 있어 해수욕이나 갯벌체험이 할 수 있다. 또한, 상낙월 선창에서 하낙월 선창까지 연결한 8.1km의 진달이 둘레길이 조성되어 있는데 경사가 심하지 않아 노약자나 어린이도 트래킹이 가능하다. 이 지역에서 잡히는 새우와 꽃게는 맛이 좋기로 유명하며 특히 새우젓은 한때 전국 생산량의 70%를 점유했었다.    
염산면 향화도에서 상낙월도까지는 하루 3차례 여객선이 운항하며, 약 1시간 정도 소요된다.","<a href=""https://tour.yeonggwang.go.kr/tour2?site=tour_2019&mn=7405&type=view&t_idx=4293"" target=""_blank"" title=""새창 : 홈페이지로 이동"">https://tour.yeonggwang.go.kr</a>"
낙조대,595016,음식,음식점,카페/전통찻집,http://tong.visitkorea.or.kr/cms/resource/58/1924458_image2_1.jpg,인천광역시,126.369363203,37.4495570756,"낙조대는 인천 영종도 인근에 위치한 카페이다.
한눈에 들어오는 탁 트인 전망이 아주 환상적이다. 별장 같은 건물 외관도 멋들어진다. 
수려한 전망과 더불어 각종 음료 및 디저트류, 칵테일까지 즐길 수 있는 곳이다.",
낙조정,3027444,인문(문화/예술/역사),건축/조형물,유명건물,http://tong.visitkorea.or.kr/cms/resource/23/3027423_image2_1.JPG,부산광역시,128.9394840158,35.1096647018,"낙조정은 부산광역시 사하구 을숙도에 있는 철새 관찰 전망대이다. 낙조정은 철새보호구역에서 철새의 활동에 지장을 주지 않으면서 철새의 형상(건물 형태)으로 새와 함께 즐긴다는 의미로 붙여진 이름이다. 낙조정은 2층으로 운영되며 2층에 전망대가 있고, 철새를 관찰할 수 있는 망원경이 비치되어 있어 철새의 이동을 관찰할 수 있는 곳이다.
낙조정에는 경사로 올라가는 특이한 엘리베이터가 설치되어 있어 노약자도 전망대에서 철새를 조망할 수 있도록 운영하고 있다. 낙조정 옆에는 어도관람실(길이 91m, 폭 9m, 물고기 길)도 함께 운영하고 있으며, 지하 2층(수심 45M)에 내려가면 물고기를 직접 관찰할 수 있도록 투명 유리창으로 된 어도(물고기의 생태계를 유지할 수 있도록 물고기에게 길을 만들어 준 곳)를 만날 수 있다.","<a href=""https://cafe.naver.com/nakdongculture""target=""_blank"" title=""새창 : 업체 카 이동"">https://cafe.naver.com/nakdongculture</a><br><a href=""https://blog.naver.com/kweco""target=""_blank"" title=""새창 : 업체 블로그 이동"">https://blog.naver.com/kweco</a>"
낙죽장도 전시관,2616195,인문(문화/예술/역사),문화시설,전시관,,전라남도,127.2639609458,35.1250971166,"낙죽장도 대가인 '중요무형문화재 제60호' 한병문 장도장은 목사동면 공북리에서 낙죽장도 전수교육관을 운영하고 있다. 이곳은 예로부터 대나무를 이용한 장도(粧刀)를 만드는 곳으로 유명하다. 낙죽장도는 삼국시대부터 호신용, 충절도로 지니고 다녔던 칼이다. 낙죽장도는 일곱 마디 이상의 대나무, 먹감나무, 소머리뼈, 송진, 자개 등을 사용하여 만들며 대나무 표면에는 인두로 글씨를 새기고, 무늬는 구름, 산수, 매화, 포토넝쿨 등의 그림을 새긴다. 한병문 장도장은 13세부터 증조부로부터 장도 기법을 배워 낙죽장도의 명맥을 잇고 있다. 낙죽장도 전수관은 두 군데가 있는 곡성군 목사동면에 있는 제1전수교육관은 전문작업이 주로 이루어지는 곳이고, 섬진강기차마을 내에 있는 제2전수관은 체험 프로그램이 주가 되는 곳이다.<br>","<a href=""http://www.nakjugjangdo.kr/""target=""_blank"" title=""새창: 낙죽장도 홈페이지로 이동"">http://www.nakjugjangdo.kr/</a>"
낙지마실,2736662,음식,음식점,한식,http://tong.visitkorea.or.kr/cms/resource/10/2736910_image2_1.jpg,경상북도,129.2630073183,35.8516234226,"낙지마실은 경주 보문단지에 있다. <br>대표 메뉴는 낙곱새다. 이 밖에 낙지볶음, 낙지해물전 등을 판다. 모든 메뉴는 포장해갈 수 있다.<br>2층 건물의 대형업소로 200명이 이용할 수 있다. 단체 회식 장소로 적합하다. 예약도 가능하다. <br>이곳 주변에는 첨성대, 경주교촌한옥마을, 국립경주박물관 등 경주의 유명 관광지가 많다.",
낙지보감,2844465,음식,음식점,한식,http://tong.visitkorea.or.kr/cms/resource/62/2844462_image2_1.jpg,경기도,127.1528715044,37.2830152632,"낙지보감은 경기도 용인시 기흥구 동백동에 있는 낙지 전문점이다. 낙지의 모든 요리는 자체 개발한 숙성한 볶음 장을 베이스로 해서 만든다. 불맛을 배어들게 하여 조리시간을 줄이고 낙지에 부드러운 맛을 살렸다. 낙지 보쌈, 낙지전골, 낙지곱창전골, 낙지불고기전골, 낙지누룽지볶음 등 메뉴가 다양하다.","<a href=""https://blog.naver.com/hyunny23""target=""_blank"" title=""새창 : 낙지보감 사이트로 이동"">https://blog.naver.com/hyunny23</a>"
낙지섬,2864507,음식,음식점,한식,http://tong.visitkorea.or.kr/cms/resource/04/2864504_image2_1.jpg,경기도,126.9118727805,37.423694644,"낙지섬은 경기도 안양시 석수동에 있는 낙지요리 전문점이다. 낙지섬에서는 국내산 산낙지의 부드러움을 위해 별도의 연육 작용을 하지 않으며 자연산 그대로의 쫄깃함과 살아 있을 때의 신선한 맛을 유지하고 있다. 대표 메뉴인 낙지정식은 낙지볶음과 제주도 황게 간장게장, 굴비를 모두 맛볼 수 있다. 낙지가 통통하고 많이 맵지 않으며 불향을 입혀 볶아서 맛이 좋다. 낙지의 양도 많고 부드러운 식감도 좋다. 철판에 담아 나오므로 오래 따뜻하게 먹을 수 있다. 제주도 황게로 담근 간장게장은 비리지 않고 단맛과 짠맛의 적당한 조화로 감칠맛이 난다. 게살도 쫀득쫀득하여 식감도 좋다. 밑반찬은 유기에 정갈하게 나오며 기본 상차림에는 없는 김치 및 그 외 반찬들은 셀프 코너에서 이용하면 된다. 가성비와 맛이 모두 좋은 식당이다.",
낙지왕국,2642679,음식,음식점,한식,http://tong.visitkorea.or.kr/cms/resource/24/2663624_image2_1.jpg,서울특별시,126.9913085821,37.572206595,종로의 회사원들이 자주 방문하는 매장으로 유명한 곳이다. 서울특별시 종로구에 있는 해물 전문점이다. 대표메뉴는 낙지볶음이다.,
낙지왕궁 본점,2864268,음식,음식점,한식,http://tong.visitkorea.or.kr/cms/resource/52/2864252_image2_1.JPG,경기도,127.1107704715,37.6502885586,"낙지왕궁은 경기도 남양주시 별내동에 위치한 낙지요리 전문점이다. 낙지왕궁만의 비법 레시피로 낙지에 불맛과 매콤한 양념이 더해져 맛을 더한다. 메뉴로는 쫄깃한 낙지 덮밥과 시원한 산낙지 연포탕, 낙지 해물파전 등이 있다. 또 이곳은 코다리 조림도 전문으로 하는 곳이기 때문에 매콤 코다리 조림도 인기가 많다.",
낙지한마당,2663457,음식,음식점,한식,http://tong.visitkorea.or.kr/cms/resource/62/2663462_image2_1.jpg,서울특별시,126.9266297904,37.5217779627,"힘이 불끈! 여의도 낙지 맛집 <낙지한마당>은 육질이 부드럽고 영양가도 풍부해 보양식으로 그만인 낙지요리를 즐길 수 있는 곳이다. 낙지가 통으로 나오는 산낙지초무침이 메인 메뉴. 가위로 싹둑싹둑 잘라 곁들여진 미나리와 함께 먹으면 기분 좋은 감칠맛이 입안에 퍼진다. 또 다른 인기 메뉴인 연포탕은 깔끔하고 시원한 국물이 매력적이며, 매콤한 산낙지볶음도 훌륭하다. 전라도식 손맛으로 음식을 직접 준비하여 맛깔나고 주꾸미, 갑오징어, 전복, 병어, 민어, 전어, 참꼬막 등 제철 식재료를 이용한 건강한 밥상을 즐길 수 있어 직장인 회식 및 단체모임 장소로도 추천한다.<br>",
낙지한마당,2782916,음식,음식점,한식,http://tong.visitkorea.or.kr/cms/resource/04/2786204_image2_1.jpg,충청남도,126.3830550841,36.881834235,"가정집 모습을 한 편안한 식당인 낙지한마당은 충청도 향토음식 명인이 운영하는 곳으로 박속낙지탕이 유명한 서산의 맛집이다. 낙지 요리만 전문적으로 내놓는 낙지 전문 음식점으로 바로 앞에 서해가 펼쳐져 있어 바다를 보며 요리를 즐길 수 있다. 메뉴는 박속낙지탕, 산 낙지, 낙지볶음 세 가지로 가격은 따로 적혀 있지 않다. 바로 앞 갯벌에서 잡은 낙지를 이용해 요리를 아흐모 언제 가도 싱싱한 산 낙지를 맛볼 수 있다. 낙지는 한입에 쏙 들어가는 작은 세발낙지와 큰 낙지 두 종류가 있다. 세발낙지는 젓가락에 돌돌 말아 산 낙지로 먹고 큰 낙지는 박속낙지탕으로 먹는다. 박 속과 양파, 감자, 대파 등을 넣어 시원하게 끓여낸 박속낙지탕에 산 낙지를 통째로 넣으면 샤부샤부가 되는데 먹기 좋게 잘라 초장을 찍어 먹는다. 탱탱하고 쫄깃한 낙지를 먹고 나면 낙지와 함께 우러난 육수에 직접 밀어서 만든 칼국수를 넣어 만든 박속낙지 칼국수로 마무리한다. 싱싱한 재료의 맛 그대로를 살린 낙지한마당의 낙지요리는 명인의 솜씨를 고스란히 보여준다.",
낙천탕,2755943,인문(문화/예술/역사),휴양관광지,온천/욕장/스파,,충청북도,127.9880030171,36.8468362997,"낙천탕은 충북 충주시 수안보 온천지구에 위치한 온천목욕탕이다. 건물 전체가 목욕탕으로 1층은 가족탕, 2층은 여탕, 3층은 남탕으로 되어 있다. 낙천탕의 온천수는 지하 250m 분지에서 용출되는 천연 온천수다. 무색, 무취, 무미의 온천으로 물이 매끄럽다. 가격도 저렴한 편이라 인근에 사는 시민들이 많이 이용하는 곳이다. 내부는 따뜻한 나무색 인테리어로 아늑고 정겨운 분위기를 풍기며, 원룸 형식으로 가족들과 따로 예약하여 편하게 시간을 보낼 수 있다. 또한 매점에서 다양한 음료를 사서 마실 수 있다.",
낙천회관,133782,음식,음식점,한식,,강원특별자치도,128.5829033554,38.2015409314,전통 속초냉면집이다. 쫄깃한 면발에 명태회와 함께 먹으면 정말 맛있는 속초냉면이다. 고구마전분으로 만들어진 쫄깃한 면에 명태회를 올려먹는 속초식 명태회냉면으로 유명허다. 돼지고기 삶은 편육이나 소고기 아롱사태로 삶은 수육도 함께 곁들이면 좋다.,
낙타날다,2810109,음식,음식점,카페/전통찻집,,서울특별시,126.9807206195,37.475262111,"사당역에서 데이트하기 좋은 분위기 있는 베이커리 카페로 인기있다. 1층은 카라반, 2층은 메인카페, 11층은 루프탑으로 되어 있다. 직접 개발한 크림치즈는 낙타날다에 오면 꼭 먹어보아야 하는 메뉴이다.",
낙타트레킹,2516416,인문(문화/예술/역사),체험관광지,농.산.어촌 체험,,제주특별자치도,126.7786837609,33.4026812788,제주도에서 낙타와 가까이서 교감할 수 있는 이색 체험을 할 수 있는 곳이다. 호주 청정지역의 낙타를 국내 최초로 수입하여 제주도의 아름다운 자연경관과 더불어 낙타 트레킹 체험을 할 수 있다. 안전요원이 동행하기 때문에 누구나 쉽고 안전하게 체험이 가능하다. 예약은 패키지 관광 혹은 단체일 때만 가능하다.,"<a href=""https://cameltrekking.modoo.at/""새창 : 낙타트레킹 홈페이지로 이동"">https://cameltrekking.modoo.at/</a>"
낙화암,127794,인문(문화/예술/역사),역사관광지,유적지/사적지,http://tong.visitkorea.or.kr/cms/resource/72/3335172_image2_1.jpg,충청남도,126.9154673523,36.2862619449,"낙화암은 부여군 부소산 북쪽 백마강(금강) 변에 서 있는 바위 절벽이다. 백제 사비성이 나당연합군에게 점령될 때 수많은 백제 여인들이 꽃잎처럼 백마강에 몸을 던지는 모습이 꽃이 떨어지는 것과 같아 낙화암이라는 이름을 얻었다는 전설이 있지만, 실제 역사적 사실과는 거리가 멀다. 절벽에는 조선 후기 학자인 우암 송시열이 쓴 [낙화암] 글씨가 선명하게 남아있다. 낙화암의 기암절벽은 부소산성을 통해 직접 올라가 정자에서 백마강을 바라보는 것도 좋고, 백마강에서 유람선을 타고 올려다보는 것도 좋다. 낙화암 아래에는 고란사와 고란사 선착장이 있다. 인근 관광지로는 부소산성, 고란사 외에 부여 관북리유적, 정림사지 5층석탑, 부여 구아리유적, 부여 쌍북리 요지, 부여향교, 궁남지, 국립부여박물관 등이 있다.","<a href=""https://www.buyeo.go.kr/html/tour/info/info_010101.html"" target=""_blank"" title=""새창 : 홈페이지로 이동"">https://www.buyeo.go.kr</a>"
낙희,2810710,음식,음식점,서양식,,대구광역시,128.6470221819,35.8642049268,‘즐기며 논다’라는 뜻의 낙희는 각 계절의 오감을 한껏 담은 신선한 재료로 구성되는 코스 요리를 맛볼 수 있는 파인 다이닝이다. 와인과 잘 어울리는 코스 요리는 비주얼도 아름다워 눈과 입 모두가 황홀하다.,"<a href=""https://www.instagram.com/nak__hee/"" target=""_blank"" title=""새창 : 낙희 인스타그램으로 이동"">https://www.instagram.com/nak__hee/</a>"
난계 박연선생 생가,252583,인문(문화/예술/역사),역사관광지,생가,http://tong.visitkorea.or.kr/cms/resource/45/764645_image2_1.jpg,충청북도,127.702432189,36.2179947504,"국악의 거리에서 외길을 따라 고당리 방면으로 가다 보면 난계 박연 선생이 태어난 가옥이 있다. 난계 박연은 고구려의 왕산악, 신라의 우륵과 함께 우리나라 3대 악성으로 손꼽힌다. 조선 초기의 문신이자 음악가로 충북 영동에서 태어나 타계했다. 박연은 악보와 악기를 정리한 악서를 편찬하고 대고와 석경 등 아악기를 제작했다. 또, 궁중악을 완성하고 악기를 조율하는 편경을 만드는 등 국악을 발전시키고 완성한 국악의 아버지다. 
세조 2년(1456년)에 삼남 계우가 단종 복위 사건에 연루되어 화를 당할뻔하였으나, 세 임금에 봉직한 공으로 화를 면하고 관직에서 물러나 이곳으로 돌아와 살다가 세조 4년(1458년) 3월 23일 81세를 일기로 타계하였다. 박연이 낙향할 때 강을 건너며 배 위에서 피리를 불었는데 그 피리 소리에 가던 배도 멈추고 쓸쓸한 느낌에 눈물을 흘리지 않은 이가 없었다는 일화가 있다. 한 시대를 풍미했던 걸출한 인물의 비애를 단적으로 나타내며 기쁠 때나 슬플 때나 음악과 함께한 국악의 거성 난계의 면모를 엿볼 수 있는 이야기일 것이다.
선생의 업적을 기리기 위해 2000년 5월 안채와 사랑채를 복원하였다. 생가의 평면은 정면 3칸, 측면 3칸으로 측면 1칸은 퇴칸 구조이며 정면 2칸만큼 우물마루를 설치하고 한쪽에는 부엌과 곡식창고를 부설한 고미 반자에 우진각의 기와지붕으로 되어있다. 우진각지붕은 용마루와 추녀마루만 있고 내림마루는 없으며 전·후면은 사다리꼴이며 양쪽 측면은 삼각형 모양을 하고 있다. 용마루가 짧고 내림마루가 길게 늘어진 모습이 특이하다. 부속 채는 1동으로 외양간, 광과 방 1칸인 초가지붕으로 되어있다.","<a href=""https://www.yd21.go.kr/tour/html/sub02/020804.html"" target=""_blank"" title=""새창 : 홈페이지로 이동"">https://www.yd21.go.kr/</a>"
