title,contentid,cat1,cat2,cat3,firstimage,region,mapx,mapy,overview,homepage
안산해피승마클럽,1750058,레포츠,육상 레포츠,승마,,경기도,126.8816202955,37.3128319646,"안산해피승마클럽은 안산 시내에서 5~10분 정도의 근거리 접근 용이성과 전망 좋고 공기 맑은 안산시 수리산 줄기에 위치에 있다.
넓은 부지에 조성된 클럽 하우스와 고요하고 한적한 산악코스 승마장, 초보자용 원형 마장, 넓은 대마장, 깔끔하게 관리된 마방까지 초보에서 상급 코스에 이르기까지 완벽한 시설을 갖추고 있다. 또한 토끼, 관상용 닭과 칠면조, 새끼 염소, 도롱뇽 서식지 등의 동물농장도 갖추고 있어 승마 체험뿐만 아니라 동물 체험까지 할 수 있다.
말과 함께 호흡하고 즐길 수 있는 최상의 승마클럽인 해피승마클럽은 승마 문화의 저변 확대를 위해 의욕적으로 조성되었으며, 소음과 공해에 찌든 현대인에게 깨끗하고 고요한 환경으로 심신을 정화하는 데 도움을 준다. 주변의 먹거리가 풍부한 반월저수지와 유니스의 정원, 수리산 올레길과 정상 등반을 겸한 다양한 외승코스와 가족 단위로 관광할 수 있는 습지 공원과 노적봉 공원이 근거리에 있다.","<a href=""http://ahhc.co.kr"" target=""_blank"" title=""새창 : 안산해피승마클럽 홈페이지로 이동"">http://ahhc.co.kr</a><br><a href=""https://www.instagram.com/ansanhappyhorse/"" target=""_blank"" title=""새창 : 안산해피승마클럽 인스타그램으로로 이동"">https://www.instagram.com/ansanhappyhorse</a>"
안산향토사박물관,3351854,인문(문화/예술/역사),문화시설,박물관,http://tong.visitkorea.or.kr/cms/resource/31/3408831_image2_1.jpg,경기도,126.8488819948,37.2987968985,"안산은 바다와 인접해있고 넓은 토지가 있어 농업과 어업이 성행했다. 특히 영·정조 시대 문예부흥기의 중심지로 많은 역사적 인물을 배출했는데 이러한 역사적 사실을 안산시민 뿐만 아니라 관외 지역민에게도 알리기 위하여 향토사박물관을 설립했다. 박물관 내에는 안산지역 문화유적지에서 발견된 유물자료와 고문서, 근현대 민속품에 이르기까지 2천여점의 유물을 수집하여 소장하고 있다.",https://www.ansanculture.or.kr/sub/museum/introduce.php?code=30
안산호수공원,2761624,인문(문화/예술/역사),휴양관광지,공원,http://tong.visitkorea.or.kr/cms/resource/19/2761619_image2_1.JPG,경기도,126.8235648,37.3006712325,"안산 호수 공원은 경기도 안산시 단원구 고잔동 고잔 신도시 안에 조성된 면적 약 66만 ㎡ 크기의 근린공원이다. 고잔 신도시가 건설되기 전부터 있던 고잔 저수지를 보존하고 주변에 다양한 체육시설과 공연장, 광장, 갈대습지, 산책로 등을 꾸미는 방식으로 조성되었다. 공원을 둘러싸고 안산천과 화정천이 흐르고, 두 하천이 모이는 곳에는 여러 종류의 물고기와 철새들을 관찰할 수 있다. 공원 둘레에 3.6㎞ 길이의 자전거 도로를 만들어 자전거를 타거나 달리기를 할 수 있게 했다. 생태환경을 고려하여 설계된 공원은 8차선 도로를 경계로 하여 사동 3 공원과 4 공원 등 2개의 공원으로 나뉘고 두 공원은 보행용 육교로 연결해 놓았다. 산책길과 둘레길 코스가 연계되어 있어 걷기 좋고 매년 무궁화 축제를 개최하는 무궁화동산도 유명하다. 실내 수영장, 농구장, 족구장, 축구장 사이로 다양한 조형물을 설치해 놓아 가족단위나 연인들의 쉼터로 이용되고 있다.",
안산호수공원 무궁화동산,2762692,자연,자연관광지,자연생태관광지,,경기도,126.8259063423,37.2974883099,"경기도 안산시 상록구에 위치한 안산호수공원 내에 조성된 이곳은 총면적 66,000여 m²로 전국 최대 규모의 무궁화동산이다. 이곳에는 200여 품종의 희귀종 무궁화 묘목이 보존, 육성되고 있으며 1만여 그루의 무궁화나무가 심겨 있다. 2007년에 조성되어 무궁화 특성에 맞는 수형 관리와 무궁화 애호가들로 구성된 자원봉사자의 높은 참여로 2017년에는 전국 최고의 나라 꽃 무궁화 명소로 선정되었다. 곳곳에 꽃 피운 아름다운 무궁화를 보며 여유롭게 산책을 즐길 수 있다.","<a href=""https://tourinfo.ansan.go.kr/main.do""target=""_blank"" title=""새창: 안산 문화관광"">https://tourinfo.ansan.go.kr</a>"
안산호수공원 실내수영장,3074611,레포츠,육상 레포츠,수련시설,http://tong.visitkorea.or.kr/cms/resource/00/3074600_image2_1.jpg,경기도,126.8300919431,37.3021600647,"안산도시공사에서 운영하는 안산호수공원 실내수영장은 호수공원 초입에 위치하고 있어서 쉽게 찾을 수 있다.
깊이 1.3M 성인풀 25M 6레인과 깊이 0.6M의 유아풀 14M 2레인이 있다. 이외에도 남/여 라커룸 과 샤워실, 장애인(가족) 라커룸과 샤워실, 체온 조절실, 전망대, 어린이 쉼터, 파우더룸, 분실물 보관함, 의무실, 지도자실 등의 부대 시설이 있다.
어린이 풀장 1개는 안전관리 요원 2명이 항시 대기하며, 물에 소독약 냄새도 거의 없고 물 온도도 적당하게 유지되고 있다. 50분 수영 10분 휴식으로 로테이션 운영되고 있으며, 2층은 수영장을 내려다볼 수 있는 전망대가 있지만 사진 촬영은 금지되어 있다. 평일에는 강습이 있어서 강습에 사용되지 않는 레인을 이용해야해서 확인을 한 후 입장하는 것이 좋다. 토요일엔 강습이 없어 모든 레인을 이용할 수 있다. 
예약은 매월 6일부터 21일까지 인터넷과 모바일로 접수 가능하다. 주차장과 자전거보관소도 넓으며, 주차장 자리가 부족하면 육교 건너편 호수공원 주차장을 이용할 수 있다.","<a href=""https://www.ansanuc.net/homenew/12072/40314/contents.do"" target=""_blank"" title=""새창 : 홈페이지로 이동"">https://www.ansanuc.net/</a>"
안산화랑오토캠핑장,2729945,레포츠,육상 레포츠,"야영장,오토캠핑장",http://tong.visitkorea.or.kr/cms/resource/74/2730474_image2_1.jpg,경기도,126.8139121978,37.3259570189,"안산 화랑 오토캠핑장은 경기도 안산시 단원구에 위치하고 있는데, 시흥대로를 타고 지하철 4호선 초지역 방면으로 달리면 도착한다. 도심 속에 있지만 내부로 들어서면 숲 한가운데 있는 듯한 기분이 드는데, 캠핑장을 둘러싼 화랑유원지와 화랑저수지 덕분이다. 오토캠핑장은 A~K 구역에 81면이 있고 전기 사용이 가능하지만 별도의 이용료를 내야 한다. 카라반은 6대가 있다. 매점이 없지만, 오토캠핑장에서 자동차로 5분여 거리에 대형마트가 있다. 관리소가 자리한 건물에는 샤워장, 화장실, 개수대가 함께 있는데, 샤워장은 관리소에 상주 사이트를 이야기한 후 비밀번호를 부여받아 이용할 수 있다.","<a href=""https://hwarangcamp.ansanuc.net/index.do"" target=""_blank"" title=""새창 : 안산화랑오토캠핑장 사이트로 이동"">https://hwarangcamp.ansanuc.net/index.do</a>"
안석낚시터,2747235,레포츠,수상 레포츠,민물낚시,http://tong.visitkorea.or.kr/cms/resource/19/2747219_image2_1.jpg,경기도,126.8339677149,37.1611597985,"약 66,000㎡의 평지형 저수지이며 수초가 많은 낚시터이다. 수심은 80cm에서 잔교 중앙은 1m 50cm까지 된다. 토종 붕어를 기본으로 하며 매주 중국 붕어를 방류한다. 미리 전화로 예약하면 캠핑 데크에서 캠 낚시도 가능하다. 다대 편성 가능하고 잔교나 수초대 2편성이 기본이다. 저수지 제방을 제외한 전 구역이 갈대와 수초로 둘러져 있고 도심 낚시지만 운치를 느낄 수 있다. 노을이 아름다운 일몰 명소이며 취사는 관리실 앞 취사장을 이용할 수 있다. 꾸준한 입질로 가족과 함께 즐길 수 있고 안석 하우스 낚시도 운영하고 있다.",
안섬포구,2746178,자연,자연관광지,항구/포구,,충청남도,126.7398338284,36.9859534015,"현대 제철에 둘러싸인 한적한 포구다. 안섬 풍어제와 함께 가을철 갯벌 낙지로 유명하며, 매년 충청남도 무형문화재인 안섬 풍어 당굿이 열린다. 안섬 바로 앞에는 쌍바위가 있는데, 밀물과 썰물에 따라 사라졌다 나타났다 하는 것으로 유명하다.
안섬포구에는 빨간 무인 등대가 해안 제방에 설치되어 있다. 대금 형상을 한 8ｍ 높이의 원형 콘크리트 구조다. 넓게 탁 트인 서해의 풍경이 시원함을 더하는 안섬의 빨간 등대는 여행객들의 포토존이다. 등대는 관광객들에게 새빨간 대금 등대, 안섬 포구 등대, 빨간 안섬 등대 등 여러 이름으로 불리고 있다.",
안성 3.1운동기념관,130439,인문(문화/예술/역사),문화시설,기념관,http://tong.visitkorea.or.kr/cms/resource/29/1589729_image2_1.jpg,경기도,127.1752784178,37.0627716844,"안성 만세로에 있는 안성3·1운동 기념관은 안성지역의 만세운동과 관련한 유물과 기록들이 전시되어 있는 곳이다. 1919년 3·1운동 당시 전국 3대 실력 항쟁지로 가장 격렬한 만세운동을 펼쳐 일제 식민통치기관을 완전히 몰아내고, 2일간의 해방을 이룩한 안성 4·1만세운동의 역사를 널리 알리며, 선열들의 숭고한 자주독립 정신을 계승 발전시켜 후세들에게 나라사랑의 산 교육장으로 활용하기 위해 세워진 곳이다. 
기념관은 상설전시실과 기획전시실, 기획전시실, 야외 체험으로 구성되어 있다. 전시관에서는 독립운동의 역사적인 자료를 실물 전시, 모형, 영상물과 함께 관람할 수 있다. 이 밖에도 기념관 내에는 안성지역 독립운동가 선열들의 넋을 위로하고 그 뜻을 기리기 위한 사당인 광복사, 안성3·1운동의 가치와 역사적 항쟁사를 표현한 기념탑인 안성3·1운동 기념탑 등이 있다. 
교육 프로그램으로는 안성 독립운동 이야기를 들려주는 창작 인형극과 직접 무궁화를 관찰하고 재밌는 체험을 해볼 수 있는 나라사랑꽃 무궁화 등이 준비되어 있다.","<a href=""https://www.anseong.go.kr/tourPortal/41/main.do"" target=""_blank"" title=""새창 : 안성 3.1운동기념관 홈페이지로 이동"">https://www.anseong.go.kr</a>"
안성 건강나라,127380,인문(문화/예술/역사),휴양관광지,이색찜질방,http://tong.visitkorea.or.kr/cms/resource/54/757254_image2_1.jpg,경기도,127.4368900462,37.0931117784,"안성 건강나라는 안성 내츄럴 리조트 안에 자리한 리조트형 찜질방이다. 자연 속에서 편안하고 따뜻한 마음가짐을 가지고, 여유롭고 차분하게 휴식을 취할 수 있는 공간이자 건강한 몸과 마음을 챙길 수 있는 문화 공간이다. 
안성 건강나라는 하늘이 시원하게 보이는 약수 피아와 야외 노천탕으로 이루어진 스파사우나와 세계 최고의 시설을 자랑하는 한증막 체험실인 전통 한증막, 옥으로 둘러싸인 피라미드 구조의 형태를 가진 찜질방인 피라미드 체험실 등으로 구성되어 있다. 
이 밖에도 신선한 과일과 간식을 맛볼 수 있는 시나브로 차방과 스트레스 해소와 피로회복에 효과가 뛰어난 스포츠 마사지를 받을 수 있는 마사지 연구소가 갖추어져 있다.","<a href=""http://naturalresort.co.kr/"" target=""_blank"" title=""새창: 안성내츄럴리조트 홈페이지로 이동"">http://naturalresort.co.kr</a>"
안성 구메농사마을,604854,인문(문화/예술/역사),체험관광지,농.산.어촌 체험,http://tong.visitkorea.or.kr/cms/resource/28/604528_image2_1.jpg,경기도,127.4082306751,37.0244552911,"안성 구메농사마을은 칠현산 칠장사 바로 앞에 자리한 고즈넉한 농촌 마을로, 복조리 마을로 알려져 있다. 구메란 구멍을 뜻하는 옛말로 구메농사란 작은 지역의 조그마한 농사를 뜻하는 말이다.
구메농사마을은 사계절 다양한 모습으로 다가오는 칠장사, 칠현산과 400년의 전통을 간직한 복조리 제작과 농사체험, 음식 체험 등 남녀노소 모두가 즐겁게 즐길 수 있는 다양한 체험행사를 진행하고 있다. 
대표적인 체험 프로그램으로는 봄나물 캐기, 옥수수 따기, 김장 담그기, 목장체험 그리고 복을 불러오고 액을 막아준다는 복조리 만들기 등이 있다. 이 밖에도 다양한 체험 프로그램이 계절별로 준비되어 있다.","<a href=""https://www.anseong.go.kr/tour/themeTourist/view.do?mId=0102010000&idx=50"" target=""_blank"" title=""새창 : 홈페이지로 이동"">https://www.anseong.go.kr</a>"
안성 구포동성당,128273,인문(문화/예술/역사),역사관광지,종교성지,,경기도,127.2745458965,37.0108738963,"안성 구포동 성당은 경기도 기념물 제82호로 지정된 문화재이다. 1901년, 프랑스 공베르 신부에 의해 처음 건립되었는데, 동서양의 건축양식을 동시에 갖춘 형태로 정면에서 볼 때는 뾰족한 탑과 둥근 아치형 입구 등이 중세 유럽의 전형적 건축양식을 닮아있지만, 측면에서 보면 전통 한옥 양식이 그대로 묻어난다. 공베르 신부는 미사용 포도주 제조를 위해 성당 마당에 포도를 심었는데, 이것이 바로 안성포도의 기원이다.","<a href=""http://www.anseong.go.kr/tour/"" target=""_blank"" title=""새창 : 안성 문화관광 홈페이지로 이동"">http://www.anseong.go.kr/tour/ </a>"
안성 남사당 공연장,130547,인문(문화/예술/역사),문화시설,공연장,http://tong.visitkorea.or.kr/cms/resource/81/1781881_image2_1.jpg,경기도,127.3101448759,37.0318221187,"안성 남사당 공연장은 원형 공연장으로 남사당놀이를 비롯한 전통놀이 공연을 특성화하기 위하여 건립된 곳이다. 남사당 공연장은 700석 이상의 객석과 20m의 원형무대, 13m의 승강식 무대를 갖춘 곳으로 남사당놀이를 위한 최고의 공연장이다.","<a href=""https://www.anseong.go.kr/tourPortal/namsadang/main.do"" target=""_blank"" title=""새창 : 홈페이지로 이동"">https://www.anseong.go.kr</a>"
안성 동막골 빙어축제,1765272,인문(문화/예술/역사),축제,일반축제,http://tong.visitkorea.or.kr/cms/resource/48/2932748_image2_1.JPG,경기도,127.4225243072,37.0074602862,겨울철 얼음판 위에서 펼쳐지는 빙어낚시 겨울 레포츠를 체험할 수 있다. 안성빙어축제가 열리는 광혜원저수지는 차련산맥 물줄기의 전형적인 계곡형 1급수 저수지로서 총면적 18만평의 경기도 안성시를 대표 하는 대형급 저수지다. 상수원 지역에 오염원 이 없어 1급수를 자랑한다.,"<a href=""http://dmfestival.co.kr"" target=""_blank"" title=""새창:안성빙어축제 홈페이지로 이동"">http://dmfestival.co.kr</a>"
안성 미리내마을,128302,인문(문화/예술/역사),체험관광지,농.산.어촌 체험,http://tong.visitkorea.or.kr/cms/resource/16/3393816_image2_1.jpg,경기도,127.2586715396,37.1384561053,"짚공예 체험하고 쌍령산 등산에 허브향기 목욕까지 미리내성지 입구에 위치한 마을로, 쌍령산(502m)의 깊은 골짜기에 자리잡고 있다. 신유박해와 기해박해때 천주교 신자들이 모진 종교탄압 속에서도 신앙심을 지키기 위해 이곳으로 모여들면서 교우촌이 형성됐다. 그들은 밭을 일구고 그릇을 구워 팔며 살았다. 그 때 천주교 신자들이 피운 불빛이 깊은 밤중에 보면 은하수처럼 보인다고 해서  마을이름이 미리내 마을이다.100년의 역사를 가진 성당 등 천주교의 역사를 찾아볼 수 있는  성지가 마을 안에 있고 주민의 95%가 천주교 신자이다. 체험 프로그램이 다양할 뿐더러 마을 앞에는 저수지가 있어 붕어, 잉어, 향어 등을 낚시하면서 명상하기에 좋다. 아담한 쌍령산도 등산하기에 알맞다. 허브의일종인 라벤더를 키우는 라벤더온실에 들어가면 그윽한 향에 도취된다.",
안성 봉업사지,126552,인문(문화/예술/역사),역사관광지,유적지/사적지,,경기도,127.4307660116,37.0784633578,"비봉산 자락의 죽산면 죽산리에 있는 봉업사지는 1966년 경지정리 작업을 하다가 출토된 향완과 반자에서 이곳이 봉업사였음을 말해주는 명문이 발견되어 비로소 봉업사지로 알려지게 되었다.
이 절의 명칭이 중요한 이유는 신증동국여지승람에서 말하는 [고려 태조의 진영을 모셨던 비봉산 아래의 봉업사]가 바로 이곳임을 밝혀주는 것으로, 사찰의 중요성이 증명되는 일이기 때문이다.
태조의 진영을 모셨다는 것은 이곳이 진전 사원이었다는 의미인데 진전 사원이란 왕실의 의지에 따라 죽은 왕의 진영을 모시고 위업을 기리며 명복을 비는 사찰로 태조의 진전 사원은 전국의 이름난 사찰(개성의 봉은사, 논산 개태사 등)에 두었다.
지금은 그 터만 남아있어 황량하지만 봉업사가 결코 만만한 사찰이 아님을 밝혀주는 것이다.
봉업사지 5층 석탑은 고려 시대 초기 탑의 특징을 잘 보여주고 있으며 경기도 내의 탑들 중에 가장 조형미가 뛰어난 것으로 인정되고 있다. 특히 1968년 복원공사 때는 사리 장치와 유물이 발견되었다.
사지의 석불입상은 죽주산성 아래 쓰러져 있던 것을 봉업사지로 옮겨와 세웠다고 하는데 고려 초기에 유행했던 지방 불상 양식의 특징을 살펴볼 수 있는 귀중한 자료로 몸체를 약간 뒤로 젖히고 가슴을 내밀어 꼿꼿하게 서 있는 모습이 매우 당당하다.
봉업사지 삼층석탑은 밭 한가운데 서 있는데 기단 면석 아래는 땅에 묻혀 온전한 모습을 알기 어렵고, 혜소 국사와 연관이 있다고 전하나 확실하지는 않다.
마을 사람들은 석불과 삼층석탑을 기자 신앙의 대상으로 삼았던 같고 가까운 곳의 태평미륵과 함께 곳곳이 기자 신앙의 흔적인 것으로 추측된다. 2023년 7월까지도 봉업사지는 사적 지정을 위한 문화재 조사가 한창 진행되고 있다.","<a title=""안성문화관광 사이트로 이동"" href=""http://www.anseong.go.kr/tour"" target=""_blank"">http://www.anseong.go.kr/tour</a><br />
<a title=""문화재청 사이트로 이동"" href=""http://www.cha.go.kr/"" target=""_blank"">http://www.cha.go.kr</a>"
안성 봉업사지 오층석탑,128531,인문(문화/예술/역사),건축/조형물,기념탑/기념비/전망대,,경기도,127.4310493261,37.078227279,"안성 봉업사지 오층석탑은 안성시 죽산면 봉업사 터에 있는 고려시대에 조성된 석조 불탑이다. 봉업사는 남한에서 처음으로 발견된 고려 태조의 진전사원 (왕이나 왕비를 위한 사당)으로 우리나라에서 단일 유적으로는 가장 많은 유물이 출토된 곳이다. 봉업사란 말 그대로 나라를 창업하면서 받들던 절이란 뜻이며, 고려 창업을 기념한 국사찰이었으며 왕건의 영정이 봉안되어 고려가 망하기 전 475년 동안 고려 왕실에서 한 해도 빠짐없이 선왕에 대한 예를 올렸던 기록이 있다. 
석탑은 단층 기단 위에 5층의 탑신부가 형성되고, 정상에 상륜부를 장식한 일반형 석탑이다. 기단은 하나로 짠 두툼한 널돌 위에 올려 완성하였는데, 석재가 두툼한 탓에 전체적으로 둔중한 느낌을 준다. 기단 위 탑신은 1층 몸돌만 4장으로 이루어졌고 나머지는 한 돌로 구성했다. 각 층의 네 모서리에는 폭이 좁은 기둥을 새겼다. 탑의 전체적인 체감도 적당하지 못하고, 각 부의 조각도 형식에 그치고 있다. 신라의 양식을 계승하고 있는 까닭에 석재의 조합 방식은 우수하지만 기단에 새긴 조각이 형식화되는 점 등에서 약화되고 둔중해진 고려석탑 특유의 모습이 나타난다.","<a href=""https://www.anseong.go.kr/tour/themeTourist/view.do?mId=0102010000&idx=31"" target=""_blank"" title=""새창 : 안성봉업사지오층석탑 홈페이지로 이동"">https://www.anseong.go.kr/tour</a>"
안성 서일농원,128517,인문(문화/예술/역사),산업관광지,기타,,경기도,127.4762478986,37.0827081358,"서일농원은 우리 전통의 친환경적인 방법으로 정성스레 키워낸 건강한 식재료를 이용해 청국장을 만드는 곳이다. 100% 우리 땅에서 자란 콩으로 쑨 메주, 간수를 뺀 천일염과 농원의 암반수에서 길어 올린 깨끗한 물 그리고 햇살과 바람을 다스려 온습도를 저절로 조절하는 옹기들이 모두 어우러져 장맛을 만들어낸다. 모든 제품은 국내에서 유일한 청국장 명인인 서분례 명인이 만들며 자연이 주는 건강함을 그대로 담은 먹거리를 선보이고 있다. 된장 만드는 농원인 만큼 햇볕이 잘 드는 깔끔한 농원이다. 3만 평의 농원에는 콩과 고추를 심는 밭, 배 과수원, 매실원뿐만 아니라 장류연구소, 황토발효숙성실, 저온 보관시설 등이 자리하고 있다. 또한 2,000여 개의 장독대 항아리들이 즐비하게 늘어서 있다. 특히 서일농원의 맛깔스러움을 누릴 수 있는 전통음식점인 레스토랑 솔리에서는 잠시 잊고 있었던 우리의 옛 맛을 느낄 수 있다. 구수한 청국장과 된장찌개를 중심으로 더덕, 가죽, 깻잎, 감, 달래, 미역, 무말랭이, 무, 파래 등의 장아찌와 쌈을 싸먹을 수 있는 고추장, 쌈장과 싱싱한 야채를 마련하여 소박하고 정갈한 어머니의 손맛을 느낄 수 있다. 서일농원의 체험 프로그램으로는 사전 예약 후 진행되는 슬로푸드 체험 프로그램이 있다. 우리 조상들의 먹거리에 대한 지혜를 고스란히 전해 들으며 배울 수 있는 체험으로, 가마솥에 콩 삶기와 장 담그기, 두부 만들기, 청국장 만들기 등을 통해 건강한 우리 전통음식을 직접 만들어보고 맛볼 수 있는 서일농원만의 차별화된 프로그램이다.","<a href=""http://www.seoilfarm.com/"" target=""_blank"" title=""새창 : 서일농원 사이트로 이동"">http://www.seoilfarm.com/</a>"
안성 유별난마을,802618,인문(문화/예술/역사),체험관광지,농.산.어촌 체험,http://tong.visitkorea.or.kr/cms/resource/00/3404700_image2_1.jpg,경기도,127.2335265338,37.0411779973,"마을뒤에 있는 해발 227.8m의 낮은 구릉성 산지로 내곡마을 주민들의 생활과 밀접한 연관이 있는 산으로 예전에 망월산에서 망월놀이를 했던전통이 있고, 연도가 밝혀지지 않은 옛 절터가 있으며, 장수바위의 전설이 내려오고 있다. 또한 석굴, 토굴을 하였던 금광과 약수터가 3군데가 있으며 마을사람들의 산책로로도 이용이 되고 있다. 수령 300년 이상 된 쌍자형의 향나무가 마을 중심에 위치하고 있으며, 나무 아래로는 대동 우물이 자리하고 있다. 전해지는 이야기에 의하면 이 우물물을 마시는 사람은 득남을 하며, 무병장수 한다고 알려져 있다.","<a href=""https://ubntown2.modoo.at/""target=""_blank"" title=""새창: 유별난마을"">ubntown2.modoo.at</a>"
안성 정무공 오정방 고택,128542,인문(문화/예술/역사),역사관광지,고택,,경기도,127.1858446008,37.0458516041,"이 한옥 민가는 안채와 사랑채를 붙여서 한 채로 건립한 것으로 형태는 곱은 자형에 1고주 5량 집이다. 사랑채 뒤에는 2칸 사당이 있고, 본래의 사랑채는 없어졌다고 한다. 건립 연대는 약 2백 년 전까지로 올라갈 수 있으나 그동안 수차례에 걸쳐 전면적인 보수가 있었던 것으로 보이며 현재는 안채만이 비교적 원형을 유지하고 있다. 본래 이 집은 중종 5년(1510)에 처음 세운 이후 정무공 오정방(1588~1634) 천파고오상에서 충정공 오두인(1624~1689)에 이르기까지 해주 오 씨 명인들을 배출한  유서 깊은 곳으로 전해내려온다. 특히 충정공은 이 집에서 성장하여 나라에 크게 공훈을 떨친 바 있어  우암 송시열이 편액을 써서 보내오기도 했다고 한다. 당초에는 덕봉리 252번지에 세워졌던 것이나 효종 1년(1650)에 현 위치로 이전해 왔다고 하며 건물은 1935년에 중수한 것이다. 현재의 건물은  대지 740.49m²(224평)에 사당 18.57m²(5.62평), 안채 102.87m²(31.12평), 사랑 102.87m²(6.52평) 규모의 3동이 자리 잡고 있다. 전체적으로 볼 때, 치목수법, 건물의 배치 및 구성 수법이 우수하여 조선 중·후기의 주택 면모를 잘 보여주고 있다.","<a href=""https://www.heritage.go.kr/heri/cul/culSelectDetail.do?ccbaCpno=2113101750000&pageNo=1_1_1_1&sngl=Y""문화재청 사이트로 이동"">http://www.cha.go.kr</a>"
