title,contentid,cat1,cat2,cat3,firstimage,region,mapx,mapy,overview,homepage
도리돌 캠핑장,2745721,레포츠,육상 레포츠,"야영장,오토캠핑장",http://tong.visitkorea.or.kr/cms/resource/51/2746051_image2_1.jpg,경기도,127.3868360941,38.0613873766,도리돌 캠핑장은 이름처럼 도리돌 마을에 있다. 백운산에 둘러싸여 있어 멋진 경관을 한눈에 볼 수 있다. 캠핑장 좌우에 넓고 얕은 계곡이 있어 어린이들이 놀기 안전하고 극심한 가뭄에도 물이 마르지 않는 것이 장점이다. 청정계곡이라 수질도 좋고 물놀이 외에도 다슬기와 물고기를 잡을 수 있다. <br>이곳은 계곡 외에도 주위에서 자연을 볼 수 있는데 중간중간 황새도 보여 천연 자연을 느낄 수 있다.  캠핑장 내에  어린나무들이 많은데  나무가 아직 어려 해먹을 걸면 안된다. 해먹을 가져오면 거치대를 빌려준다. 캠핑장 근처에는 딴산 유원지가 있다.  인공 폭포가 있어 보기만 해도 시원함을 느끼게 한다. 산책 겸 잠시 나가서 보고 올 것을 추천한다.<br>도리돌캠핑장은 겨울철에는 휴장하는 때도 있으니 동계에 접어드는 시기라면 꼭 전화 문의 후 방문하도록 하자.,"<a href=""http://doridol.campingt.me"" target=""_blank"" title=""새창 : 도리돌 캠핑장 사이트로 이동"">http://doridol.campingt.me</a>"
도리마을은행나무숲,2756640,자연,자연관광지,자연생태관광지,http://tong.visitkorea.or.kr/cms/resource/06/3099906_image2_1.jpg,경상북도,129.0908288474,35.918543169,"도리마을 은행나무숲은 경북 경주시 서면에 자리 잡고 있다. 묘목 판매를 목적으로 심은 수많은 은행나무가 숲을 이루게 됐다. 열 맞춰 빽빽하게 나무를 심은 덕에 자작나무처럼 위로만 쭉 뻗은 늘씬한 은행나무가 이국적인 정취를 뽐낸다. 사진작가들이 매해 이곳을 찾고, 웨딩 촬영 성지로도 불린다. 마을 주민들이 먹거리 장터, 특산물 장터를 운영해 즐길 거리를 더하고 있다.

◎ 한류의 매력을 만나는 여행 정보 - 드라마 <나쁜엄마>
빽빽하게 심은 은행나무가 위로 쭉 뻗어 풍성한 숲을 이룬 곳으로 가을이면 노란 은행잎이 숲을 물들이며, 웨딩 촬영 성지로 불릴 만큼 절경을 드러낸다. 강호가 쌍둥이의 탱탱볼을 찾은 장소로, 마을을 거닐며 길 담벼락에 적힌 예쁜 문장도 읽어보고 은행나무숲에서는 인생 샷을 남겨 보길 추천한다.","<a href=""https://www.gyeongju.go.kr/tour/page.do?cmd=2&mnu_uid=2296&area_uid=134""target=""_blank"" title=""새창 : 경주문화관광 이동"">https://www.gyeongju.go.kr/</a>"
도리미오름,1899959,자연,자연관광지,산,,제주특별자치도,126.7697172117,33.4315668324,"도리미오름은 비치미오름과 자락을 맞대어 이어진 오름이다. 말굽형 화구로 완만한 등성이로 이루어진 대형의 원형 분화구였으나 이차적인 용암 유출에 의해 화구가 동북 방향으로 터진 형태를 하고 있다. 화구 안에는 북측으로 치우쳐 미끄러짐에 의해 만들어진 원추형의 알오름이 낮게 솟아 있으며, 문헌상에는 민오름 알오름으로 표기되어 있으나 이는 민오름과는 관계가 없다고 한다. 오름의 정상에는 용암 유출의 흔적으로 생긴 커다란 용암바위들이 박혀 있으며, 그 외의 지역은 풀밭오름이고 화구 내에는 인공 초지가 조성되어 있다. 오름 능선은 완만하고 오르는데 힘들지 않아서 주변의 오름들을 조망하며 오르기 좋다. 정상에 오르면 한라산과 교래리 오름군을 볼 수 있다.","제주 문화관광 <a href=""https://www.visitjeju.net/kr/detail/view?contentsid=CONT_000000000500144"" target=""_blank"" title=""새창 : 제주 문화관광 사이트로 이동"">http://www.visitjeju.net/</a>"
도리사(구미),126156,인문(문화/예술/역사),역사관광지,사찰,http://tong.visitkorea.or.kr/cms/resource/31/3041831_image2_1.jpg,경상북도,128.3997080718,36.2554642817,"도리사는 신라 제19대 눌지왕(417년) 때 고구려의 승려 아도화상이 불교가 없었던 신라에 포교를 위해 처음 세운 해동불교의 발상지이자, 신라 최초의 가람으로 알려져 있다. 아도화상이 수행처를 찾기위해 다니던 중 겨울인데도 이 곳에 복숭아 꽃과 오얏꽃이 활짝 핀 모습을 보고 좋은 터임을 알고 이 곳에 모례장자의 시주로 절을 짓고 이름을 복숭아(挑도)와 오얏(李리)에서 이름을 따 [도리사]라 하였다. 
신라불교 초전법륜지로 불교의 성지인 이곳에서 아도화상이 신라에 불교를 전하러 올 때에 모셔온 세존 진신사리가 1976년 세존 사리탑 보수 공사 중 금동육각사리함에 봉안되어 발견되었다. 도리사 세존사리탑 금동 사리기는 8세기 중엽에 만들어진 것으로 추정이 되며, 국보 제208호로 지정되어 현재 직지사 성보박물관에 위탁 소장되어 있다.
신라가 불교를 공인한 것이 514년(법흥왕 14)으로 이보다 보다 70여년이나 앞서 창건 된 도리사는 그 역사만큼이나 유형문화재로 보물인 화엄석탑이 있고, 아도화상 동상(2002년 새로 건립조성), 세존사리탑, 아도화상 사적비, 조선후기 탱화가 있으며 지정된 불교의 교리와 불교 문화 전파를 위한 템플스테이를 운영하고 있다.","도리사 <a href=""http://www.dorisa.or.kr"" target=""_blank"" title=""새창 : 도리사 홈페이지로 이동"">http://www.dorisa.or.kr</a><br /><a href="" https://www.templestay.com/temple_info.asp?t_id=dorisa "" target=""_blank"" >☞ 템플스테이 보러가기 </a>"
도리산전망대,588738,인문(문화/예술/역사),건축/조형물,유명건물,http://tong.visitkorea.or.kr/cms/resource/47/195547_image2_1.jpg,전라남도,126.0050523086,34.3282658999,"새 떼처럼 섬이 많아 새 조(鳥) 자를 써서 조도라고 한다. 조도 여행의 대표적인 관광지인 도리산 전망대는 도리산 정상에 위치해 360도로 다도해의 섬을 감상할 수 있다. 도리산은 해발 210m의 나지막한 산으로 정상까지 약 3.5km를 걸어야 하는데, 중간중간에서 약수터, 쉼터, 정자 등을 만날 수 있다. 정상에 이르러 나무데크 전망대에 서면 말 그대로 새 떼처럼 바다 여기저기에 둥지를 튼 다도해의 장관이 눈앞에 넓게 펼쳐진다. 
조도군도 전체와 진도 서쪽, 멀리 신안군의 섬들도 볼 수 있다. 상조도 북쪽으로 진도까지 비췻빛 바다에 마치 징검다리처럼 띄엄띄엄 놓인 섬들은 이국적인 풍광을 선사한다. 조도가 아니면 경험할 수 없는 장관이다. 이 도리산 전망대에서 바라보는 다도해의 장관이 조도 여행의 하이라이트다. 눈길을 돌리면 그 자체가 한 폭의 산수화처럼 다가오는 곳곳의 바다 풍경은 보너스다. 진도항 연안여객터미널에서 조도 창유항 배편을 이용하여 입도할 수 있다. 
※ 운항 시간 등 문의는 서진도농협 061-542-5383~5","<a href=""https://www.jindo.go.kr/tour/tour/info/nature/002.cs?act=view&infoId=8"" target=""_blank"" title=""새창 : 진도군 문화관광 홈페이지로 이동"">https://www.jindo.go.kr/tour</a>"
도리수상레저,2781732,레포츠,수상 레포츠,윈드서핑/제트스키,http://tong.visitkorea.or.kr/cms/resource/88/2781888_image2_1.jpeg,경기도,127.7107892697,37.2277540083,경기도 여주시 점동면에 소재하고 있는 수상레저시설이다. 도리수상레저에서는 수상레저임에도 저렴한 가격으로 즐길 수 있다. 수상스키나 웨이크보드 등의 수상레저를 처음 접하는 초보들도 즐겁게 탈 수 있도록 지상과 강에서 교육을 받고 탑승하기 때문에 재밌고 신나는 이색 경험을 할 수 있다. 도리수상레저는 수도권에서도 멀지 않기 때문에 주말 하루를 잡아 나들이 나와 일상에서 벗어나 시원하고 맑은 강물에서 즐겁고 건강한 체험을 할 수 있다.,
도리원,134557,음식,음식점,한식,http://tong.visitkorea.or.kr/cms/resource/91/1892891_image2_1.jpg,경상남도,128.5389348535,35.4463084605,"도리원은 창녕 지방을 대표할 만한 음식점이라고 할 수 있다. 내외부 시설, 친절함, 음식의 수준 등 모든 면에서 부족함이 없다. 해마다 가을 문화행사를 하고 있으며 100여 가지 약초 장아찌를 전시, 판매하고 있다. 도리원 주인은 전통음식 보존에 사명감과 자부심을 가지고 있다. 2003년 서울 세계 음식박람회에서 대나무통술로 전통음식 부문 금상을 수상하기도 했던 주인의 전통 음식에 대한 사랑과 열정은 도리원을 찾는 사람들을 실망시키지 않을 것이다. 이 집의 자랑은 맛뿐만이 아니다. 깨끗하고 단정하게 개량 한복을 입고 서빙하는 직원들의 서비스 자세는 다시 한번 이 집을 찾고 싶은 마음을 불러일으킨다. 화장실과 주방 등의 청결상태도 좋다. 또한 주건물과 별채 등은 한국의 전통미를 충분히 살리도록 설계되어 그 자체만으로도 훌륭한 볼거리를 제공한다. 단골손님이 많아 주말에는 예약을 먼저 하고 찾는 것이 좋다.","<a href=""http://www.doriwon365.co.kr"" target=""_blank"" title=""도리원 홈페이지로 이동"">http://www.doriwon365.co.kr</a>"
도리포,126617,자연,자연관광지,항구/포구,http://tong.visitkorea.or.kr/cms/resource/91/824691_image2_1.jpg,전라남도,126.3464690952,35.1566586763,"도리포는 함평, 영광으로 이어지는 칠산바다의 남쪽 끄트머리, 해제반도 끝에 있는 포구로 해넘이와 해돋이를 볼 수 있는 곳으로 한국관광공사가 선정한 [한국의 아름다운 어촌 100곳]에도 선정된 곳이다. 영광군 염광면과 무안군 해제면 도리포를 잇는 칠산대교는 드라이브 코스로 인기가 좋다.
해제반도와 육지 쪽의 무안, 함평, 영광군이 감싸는 [함해만] 바다는 서남해안 물고기들의 최대 산란장이다. 숭어나 도미, 민어, 가오리 등 다양한 어종이 이곳에서 알을 낳고, 새끼를 부화시키고 어린 물고기들은 큰 바다로 나갔다가 어미가 되면 알을 부화하기 위해 이곳을 찾아온다. 또한 함해만 바다에는 김 양식장과 굴 양식장이 있고, 살이 통통 오르고 부드러운 무안 뻘낙지가 많이 잡힌다. 무안군 방파제 끝에는 무안갯벌 낙지를 기리고 풍요로운 바다의 기원과 어촌 어항의 경관을 위해 문어를 형상화한 등대가 있다.
송석리 도리포 앞바다에 청자 대접 등 유물이 발견된 이후 고려시대 상감청자도 발굴되어 국가 사적지로 지정되었다.","<a href=""https://tour.muan.go.kr/tour/travel/island_beach?mode=view&idx=212"" target=""_blank"" title=""무주군 문화관광 사이트로 이동"">http://tour.muju.go.kr</a>"
도림,133831,음식,음식점,중식,,부산광역시,129.0564308853,35.156864346,"롯데호텔 부산 중식당 ‘도림’은 호텔의 최고층인 43층에 위치해 부산시민공원이 펼쳐진 도시뷰와 바다가 어우러진 부산항대교를 즐길 수 있고, 현대적이고 세련된 감각의 실내 인테리어와 중국의 향취를 느낄 수 있는 소품과 절묘한 조화를 이루며 도림만의 독특한 분위기를 자아낸다. 도림은 8개의 별실을 보유하여 상견례 등 다양한 규모의 프라이빗한 식사 모임을 즐기기에도 적합하다.","<a href=""https://www.lottehotel.com/busan-hotel/ko/dining/restaurant-toh-lim.html"" target=""_blank"" title=""새창 : 도림 안내 페이지로 이동"">http://www.lottehotel.com/busan</a>"
도림사 계곡,128083,자연,자연관광지,계곡,http://tong.visitkorea.or.kr/cms/resource/93/1606693_image2_1.jpg,전라남도,127.2618631226,35.2649174154,"해발 748.5m의 동악산 남쪽 골짜기를 흘러내리는 동악계곡과 성출계곡이 하나가 되어 아홉 구비마다 펼쳐진 반석 위로 맑은 물줄기가 마치 비단을 펼쳐 놓은 듯이 흐르고, 노송, 폭포 등과 어우러져 절경을 이루고 있는 도림사계곡은 지방기념물로 지정되어 있다. 주변의 경치를 감상할 수 있는 반석들이 있어 예로부터 풍류객들의 발길이 잦았으며 이곳 9개의 반석에는 선현들의 문구가 음각되어 있어 그들의 풍류를 엿볼 수 있고 한 아름 반석 위로 흐르는 계곡 물에 몸을 담그는 맛이 색다르다. 그리고, 이 계곡 정상 부근에는 전망이 좋아 신선이 쉬어 간다고 하는 높이 4m에 넓이 30평에 달하는 신선바위가 있으며, 이 계곡을 따라 오르는 동악산 줄기의 형제봉은 등산코스로 널리 알려져 있다.",
도림사(곡성),126348,인문(문화/예술/역사),역사관광지,사찰,,전라남도,127.257557892,35.2670754311,"곡성읍에서 서남쪽으로 4km 떨어진 월봉리, 동악산 줄기인 성출봉 중턱에 자리 잡은 도림사는 신라 무열왕 7년(660)에 원효대사가 세웠다고 한다. 현재는 보광전, 약사전, 응진당, 명부전 등이 있고 절 입구에는 허백련 화백이 쓴 도림사라는 현판이 걸려 있다. 

풍악의 음률이 온산을 진동하였다 하여 동악산이라 하고, 도인이 숲같이 많이 모여들었다 하여 도림사라 하는데, 인근에는 동악산 남쪽 골짜기에서 시작된 도림계곡(청류계곡)이 흐르고 있다. 계곡물이 연중 그치지 않을 뿐만 아니라 노송, 계곡, 폭포들이 어울려 절경을 이루고 있다. 주변의 경치를 감상할 수 있는 커다란 반석들이 있어 예부터 풍류객들의 발길이 잦았다고 한다. 관광객들에게 좋은 휴식처를 제공하고 있는 도림사에는 도 유형문화재 제119호 괘불이 소장되어 있다. 도림사계곡을 따라 1km 이내에 도림사 국민관광단지와 오토캠핑리조트가 있으며 곡성읍까지는 4km 남짓이다.","<a href=""https://www.gokseong.go.kr/tour/tourist/9tour/dongak_mountain"" target=""_blank"" title=""새창: 곡성문화관광 홈페이지로 이동"">https://www.gokseong.go.kr/</a>"
도림사(광주),1620893,인문(문화/예술/역사),역사관광지,사찰,http://tong.visitkorea.or.kr/cms/resource/40/3366540_image2_1.jpg,광주광역시,126.7007374404,35.1666995405,"도림사는 광주광역시 광산구 도림마을 입구에 있으며 노사 기정진(1798~1879), 난와 오계수(1843~1915), 후석 오준선(1851~1931)을 모신 사우이다. 기정진은 고종 3년(1866) 병인양요가 일어나자 병인소를 올려 외적을 방비하는 대책을 건의하였고, 위정척사사상의 기초를 마련하였다. 오계수는 기정진의 제자로 을미사변 후 일어난 을미의병에 참여하였다. 1910년 한일병합 이후 가마마을 뒤쪽 산에 있는 영사재에서 은거하면서 학문을 연구하였다. 오준선도 기정진의 제자로, 한일병합 이후 용진산에 들어가 용진정사를 세우고 성리학을 연구하면서 후진을 양성하였다. 
1934년 나주오씨 문중과 오계수, 오준선의 후학들이 오계수, 오준선과 기정진을 기리기 위하여 도림사를 세웠다. 도림마을은 오계수와 오준선이 태어난 곳이며, 나주오씨 문중의 집성촌이다.","<a href=""https://www.grandculture.net/gwangju/toc/GC60001435"" target=""_blank"" title=""새창 : 홈페이지로 이동"">https://www.grandculture.net/gwangju</a>"
도림사(대구),2756634,인문(문화/예술/역사),역사관광지,사찰,http://tong.visitkorea.or.kr/cms/resource/05/2756805_image2_1.jpg,대구광역시,128.7299069484,35.9491496222,"도림사는 대한불교 조계종 제12교구 본사 해인사의 말사로서 대구지역의 포교를 목적으로 세워진 대표적인 사찰이다. 이 사찰은 대구의 팔공산 동남쪽 감투봉 아래 위치하고 있으며, 편에는 갓바위 약사여래부처님과 동화사, 파계사 등이 줄지어 서있는 팔공산맥을 마주하고 있다. 1997년 2월 3일 대구시 동구 진인동 팔공산 감투봉 아래 선종가람 서광사로 대한불교조계종에 등록하였으며, 2004년 12월 15일 창건주인 도림 법전스님의 호를 사명으로 개칭하여 도림사로 불리게 되었다.
도림사에서는 당일형, 체험형, 휴식형의 템플스테이를 진행하고 있다.","<a href=""http://www.dorimsa.co.kr/?asdf=home"" target=""_blank"" title=""새창 : 도림사 홈페이지로 이동"">http://www.dorimsa.co.kr</a>"
도림사스토리(도림산장식당),2784740,음식,음식점,한식,http://tong.visitkorea.or.kr/cms/resource/01/2789601_image2_1.jpg,전라남도,127.2638046505,35.2636148175,"도림사 스토리(도림 산장식당)는 닭백숙을 전문으로 하는 식당이며 커피숍도 겸하고 있다. 황칠 백숙과 능이 백숙, 옻닭 등 한방 재료와 함께 닭을 고아 상에 올린다. 오리도 취급하는데 오리주물럭도 인기 있는 메뉴이다. 잘 조성된 야외 테이블에서 식사를 하는 맛이 있다. 여름철 성수기인 7~8월을 제외한 계절은 휴무일이 일정치 않아 사전 문의가 필요하다. 바로 옆은 함께 운영하는 깔끔한 인테리어의 커피숍이다. 주차장이 넓어 주차 걱정이 없다. 매장 내에 자판기 판매시설도 겸하고 있다.",
도림사오토캠핑리조트,2729316,레포츠,육상 레포츠,"야영장,오토캠핑장",http://tong.visitkorea.or.kr/cms/resource/26/2729826_image2_1.JPG,전라남도,127.2668710843,35.2621428145,"도림사오토캠핑장은 전남 곡성군 곡성읍 도림로에 위치한 곳으로 자연과 벗 삼아 놀기 좋은 장소다. 도림사는 신라시대 원효가 세운 절로 현재는 자연 속의 힐링 안식처로 인식되고 있다. 절 바로 앞에  계곡이 있는데 계곡을 중심으로 늙은 소나무와 폭포가 어우러져 절경을 이룬다. 너른 반석으로 명경지수 폭포수가 치맛자락처럼 펼쳐지며 계곡 위쪽에는 전망이 좋고 신선이 놀고 간다는 신선바위가 있다.  캠핑장에서 차로 1분 정도 소요되는 이 계곡은 누구나 즐길 수 있는데 물도 깨끗하고 자외선을 피할 수 있는 그늘막이 설치되어 있어 어린이들이 물놀이하기 안성맞춤이다. 계곡 상류는 물살이 세기 때문에 어린이들과 함께 이용할 경우 하류 쪽에서 물놀이하는 것을 권한다. 이곳은 캠핑장 40면, 카라반 10동, 캐빈 14동으로 구성되어 있고 취사장, 샤워장과 화장실 등의 시설이 마련되어 있다. 캠핑장 인근에는 아름다운 섬진강, 보성강과 기차마을, 압록유원지, 도림사, 태안사, 천문대, 명품등산로(동악산) 등이 있어 캠핑과 더불어 즐길 수 있다.","<a href=""http://dorimsacamping.com/main/"" target=""_blank"" title=""새창 : 도림사오토캠핑리조트 사이트로 이동"">http://dorimsacamping.com/main/</a>"
도마 유즈라멘,2808942,음식,음식점,일식,,서울특별시,126.9864810819,37.5779280656,도마 유즈라멘은 서울시 종로구 안국역 인근에 위치한 음식점이다. 2009년 홍대에서 소고기전문점으로 시작한 도마는 네 번째 걸음으로 도마 유즈라멘 안국점을 개업하였다. 이곳은 일반적인 라멘뿐만 아니라 라멘에 유자액이 첨가된 특색 있는 라멘을 판매한다. 특별히 라멘 면과 육수는 무한으로 제공된다.,"<a href=""http://instagram.com/yuzu_ramen"" target=""_blank"" title=""새창 : 도마 유즈라멘 인스타그램 페이지로 이동"">http://instagram.com/yuzu_ramen</a>"
도마령,756447,인문(문화/예술/역사),역사관광지,유적지/사적지,http://tong.visitkorea.or.kr/cms/resource/24/3335724_image2_1.JPG,충청북도,127.8115183942,36.0623949935,"도마령은 영동군 황간에서 전북 무주로 넘어가는 고갯길이다. 영동 최고봉 민주지산(해발 1,241m) 자락에 있는 해발 800m의 높은 고갯길로 칼을 든 장수가 말을 타고 이곳을 넘었다고 해서 도마령이라 이름 지었고, 답마령이라는 옛 이름도 전해진다.
도마령에 가면 고갯마루 위에 정자 상용정이 있다. 2002년과 2003년 태풍으로 영동군 곳곳이 재해를 입었는데 이때 복구 사업을 하면서 상용정을 세웠다. 상용정은 전통한식의 목조구조의 와가팔각정으로 이익공식 공포로 시공하여 그 웅장함을 더하였다. 목재는 우리나라 소나무를 사용하였으며 화강암 암장 초석에는 우리나라 대표적 국악기인 대금을 형상화하였는데 국악의 고장 영동의 명소임을 암시하는 대목이다. 전통양식의 멋스러운 이 팔각정의 풍광은 이루 말할 수 없이 시원하고 고개를 오르내리는 도마령 길은 구절양장 춤을 추며 상촌으로 용화로 뻗어 가는데 그 풍경이 조화롭다.
또한 구불구불 굽이진 도로가 드라이브 코스로 최근 유명세를 타고 있다. 영화 <집으로>의 촬영지로 시골 풍경과 정겨운 인심이 가득한 영화의 한 장면이 떠오르는 곳이다. 비포장도로를 포장해서 2차선 도로가 되었고 구불거리는 도로 주변으로 민주지산의 수려한 풍광이 펼쳐져 눈이 즐겁고 마음이 편안해진다. 민주지산의 숲길에서 라이딩을 즐기는 사람들도 많다.","<a href=""https://www.yd21.go.kr/tour/html/sub01/01040223.html"" target=""_blank"" title=""영동군 문화관광 사이트로 이동"">http://tour.yd21.go.kr</a>"
도마치계곡,1288166,자연,자연관광지,계곡,http://tong.visitkorea.or.kr/cms/resource/61/3386161_image2_1.JPG,경기도,127.4446037739,38.0363524765,경기도 최북단의 도마치계곡이라 일컫는 곳으로 가평 적목리 방향 시내버스 종점인 용수동 마을에서 3·8교 다리를 지나 무인의 계곡을 한없이 거슬러 오르노라면 노변을 따라 이어진 계곡의 진경에 넋을 잃게 된다. 이곳은 환경청이 고시한 도내 유일의 청정 지역으로 천연기념물인 열목어가 서식하고 있다. 3·8교에서 상류로 3km지점에는 용소라는 소가 있는데 물이 깊고 청명하며 용이 승천하던 것을 임신한 여인이 발견하여 용이 낙상하여 소를 이루었다는 전설이 있는 곳이다. 용소를 지나 1시간 정도 계속 거슬러 올라가면 크고 작은 폭포와 소가 즐비하여 마침내 거대한 폭포에 이르는데 옛날 무관들이 나물을 안주 삼아 술 마시고 춤을 추며 즐겼다는 전설이 있는 무주채폭포로서 경관이 수려하고 한여름에도 추위를 느낄 만한 곳이다.,"<a href=""https://www.gptour.go.kr/tour/tour_view.jsp?menu=tour&submenu=valley&l_code=&paramidx=TL0000055&page=10&pageBlock=1"" target=""_blank"" title=""새창 : 가평군 문화관광 홈페이지로 이동"">www.gptour.go.kr</a>"
도마치캠프장,2729323,레포츠,육상 레포츠,"야영장,오토캠핑장",http://tong.visitkorea.or.kr/cms/resource/29/2729629_image2_1.jpg,경기도,127.3823618395,38.0499997342,"도마치캠핑장은 경기도 포천시 도마치 계곡 옆에 있는 캠핑장으로 민박과 겸업하고 있다. 민박은 선풍기, 침구류, 냉장고, 실외 나무 테이블이 있으며 취사도구는 준비해 와야 한다. 개수대는 모두 공용으로 쓰며 방은 작은방, 큰 방으로 나뉘는데 작은방은 화장실, 샤워장이 객실에 개별적으로 있고 큰 방은 공동 편의시설을 이용해야 한다는 차이점이 있다. 캠핑장은 카라반, 텐트를 이용한 캠핑이 모두 가능하며 몇몇 캠핑 용품은 대여가 가능하다. 사이트는 구역별로 다른데 계곡 가까운 사이트, 연못 가까운 사이트, 가족형 사이트 등이 있는데 홈페이지에서 확인할 수 있고 선착순으로 예약접수를 받는다. 캠핑장 안에 있는 연못에서는 분수와 함께 여러 종류의 물고기를 볼 수 있다. 연못의 물은 도마치 계곡의 계곡물이 유입되는 것으로 깨끗한 수질을 자랑한다. 캠핑장 바로 앞에 있는 계곡은 바닥이 보이는 깨끗한 물에 여름에도 시원한 온도로 캠핑장 이용객들의 전용 계곡으로 쓰인다.","홈페이지 <a href=""https://domachicamping.modoo.at/?link=q8y6dh73"" target=""_blank"" title=""새창 : 도마치캠프장 사이트로 이동"">https://domachicamping.modoo.at</a><br>블로그 <a href=""https://blog.naver.com/domachicamping"" target=""_blank"" title=""새창 : 도마치캠프장 블로그로 이동"">https://blog.naver.com/domachicamping</a><br>인스타그램 <a href=""https://www.instagram.com/domachicamping_official/"" target=""_blank"" title=""새창 : 도마치캠프장 인스타그램으로 이동"">https://www.instagram.com/domachicamping_official/</a>"
