title,contentid,cat1,cat2,cat3,firstimage,region,mapx,mapy,overview,homepage
업성동커피집,2858014,음식,음식점,카페/전통찻집,http://tong.visitkorea.or.kr/cms/resource/86/2857986_image2_1.png,충청남도,127.141345448,36.859361205,"업성동커피집은 충청남도 천안시 서북구 업성동에 있는 카페다. 내부에는 단체석이 마련되어 있어 각종 모임을 가지기 좋고 외부에는 모래놀이터, 수영장, 놀이방 등 어린이를 위한 부대시설이 알차게 갖춰져 있다. 대표 메뉴는 아메리카노이며, 흑임자슈페너, 단호박라테, 복숭아에이드 등의 다양한 음료 메뉴와 베이커리류를 맛볼 수 있다. 이 외에 즉석밥과 컵라면, 핫바 등의 간식 메뉴도 구매가 가능하다.","<a href=""http://www.instagram.com/usdcoffee""target=""_blank"" title=""새창 : 업성동커피집 사이트로 이동"">http://www.instagram.com/usdcoffee</a>"
업스테어 키친,2862146,음식,음식점,한식,http://tong.visitkorea.or.kr/cms/resource/35/2862135_image2_1.JPG,경기도,126.7361413314,37.7291115476,"경기도 파주시 목동동에 있는 이탈리아음식 전문점이다. 예능 프로그램 '맛있는녀석들'에 소개된 맛집이며, 미운우리새끼에도 방영된 바 있다. 오픈형 키친이라 조리하는 과정을 볼 수 있다. 주문과 동시에 조리를 시작하기 때문에 음식이 나오기까지 시간이 소요된다. 좌석이 많지 않아 예약하고 가는 것을 추천한다. 살치살스테이크, 가자미나리파스타, 부르스케타, 구아카몰리샐러드, 버섯크림파스타, 라구비앙코, 새우토마토파스타, 바케리라자냐, 전복리조또 등 여러 가지 메뉴가 있다. 건물 주차 공간이 협소하지만, 가까운 공영주차장을 이용할 수 있다.","<a href=""https://www.instagram.com/upstairkitchen_official/""target=""_blank"" title=""새창 : 업스테어 키친 사이트로 이동"">https://www.instagram.com/upstairkitchen_official/</a>"
업플로 호스텔,2700928,숙박,숙박시설,게스트하우스,,서울특별시,127.0170584559,37.4937911663,업플로 호스텔은 서울 서초구에 위치하고 있다.,"<a href=""http://www.upflohostel.com""_blank"">http://www.upflohostel.com</a>"
엉덩물계곡,2662743,자연,자연관광지,계곡,,제주특별자치도,126.4190129892,33.2432598241,"중문관광단지의 롯데호텔 동편으로 자리한 계곡이다. 큰 바위가 많고 지형이 험준하여 물을 찾는 짐승들조차 접근은 못하고 엉덩이를 들이밀고 볼일만 보고 돌아갔다고 해서 엉덩물계곡이라는 이름이 붙었다고 한다.
봄이면 계곡 경사면을 따라 유채꽃이 만발하여 장관이다. 입장료를 받는 다른 유채꽃 단지와는 달리 무료로 입장할 수 있으며, 평지보다 유채꽃 풍경이 입체적인 특징이 있다. 올레 8코스에 포함되어 있으며, 중문달빛걷기공원으로도 불린다. 중문해수욕장 주차장에 주차 후 접근 할 수 있다.
유채꽃길을 따라 걷다보면, 미라지 연못이 나오며 좌측으로 올라가면 롯데호텔 산책로와 이어져있다.

(출처 : 비짓제주)","<a href=""https://www.visitjeju.net/kr/detail/view?contentsid=CNTS_000000000021844""target=""_blank"" title=""새창: 비짓제주 엉덩물계곡 홈페이지로 이동"">https://www.visitjeju.net/kr</a>"
엉또돌다카페앤농원,3071718,인문(문화/예술/역사),체험관광지,농.산.어촌 체험,http://tong.visitkorea.or.kr/cms/resource/87/3071687_image2_1.jpg,제주특별자치도,126.494353229,33.2633393524,"엉또돌다카페&농원은 제주 서귀포 엉또폭포 근처에 위치한 감귤따기 체험 농장 겸 카페이다. [돌다]는 맛있다라는 제주도 방언이다.  감귤농원은 지대가 높은 곳에 위치해 제주 서귀포가 한눈에 보이고 전망이 좋다. 
넓은 농원 안에는 다양한 포토존이 있어 귤따기 체험을 하며 귤밭에서의 추억을 남길 수 있다. 감귤따기 체험시 귀여운 감귤모자와 감귤컨셉의 소품들을 무료로 대여해준다. 포토존은 체험객이 아니더라도 무료로 이용가능하다. 카페에서는 커피와 귤을 이용한 음료 등을 판매하며 귤과 제주특산품 등을 판매하고 있다. 
제주올레길 7 -1코스와도 가까워 올레길을 걷다가 잠시 들려도 좋다.  귤 수확시기인 10월말부터 1월말까지 유동적으로 운영하므로 사전에 운영 여부를 확인하고 방문하는 것이 좋겠다.","<a href=""https://www.instagram.com/eongtto_dolda/"" target=""_blank"" title=""새창 : 홈페이지로 이동"">https://www.instagram.com/eongtto_dolda/</a>"
엉또폭포,127052,자연,자연관광지,폭포,http://tong.visitkorea.or.kr/cms/resource/96/1954196_image2_1.jpg,제주특별자치도,126.4984055673,33.2672723157,"엉또는 엉의 입구라 하여 붙여진 이름이다. 엉은 작은 바위 그늘집보다 작은 굴을 의미하며 도는 입구를 표현하는 제주어이다. 엉또폭포는 보일 듯 말 듯 숲속에 숨어 지내다 한바탕 비가 쏟아질 때면 위용스러운 자태를 드러내는 폭포로 높이 50m에 이르며 주변의 기암절벽과 조화를 이루어 독특한 매력을 발산한다. 폭포 주변의 계곡에는 천연난대림이 넓은 지역에 걸쳐 형성되어 있어 사시사철 상록의 풍치가 남국의 독특한 아름다움을 자아낸다. 평소에는 건천으로 있으며 산간 지역에 70mm 이상 비가 온 후 풍성한 폭포를 감상할 수 있다. 
엉또폭포 주차장에 주차를 하고 잘 가꾸어진 데크길을 따라 편히 접근이 가능하고 데크길 중간중간 포토존도 잘 꾸며져 있으며, 엉또폭포 무인카페도 운영하고 있다. 엉또폭포는 제주 올레 7-1코스이기도 하며 서귀포 70경 중의 하나이다.","<a href=""https://www.visitjeju.net/kr/detail/view?contentsid=CONT_000000000500434"" target=""_blank"" title=""새창 : 제주 문화관광 사이트로 이동"">http://www.visitjeju.net/</a>"
엉알해안,1898906,자연,자연관광지,해안절경,,제주특별자치도,126.1676196819,33.2994219009,"제주시 한경면 고산리에 있는 엉알해안은 제주시 숨은 비경 31곳에 선정된 곳이다. 수월봉 밑에서부터 해안선을 따라 2km가량 이어져 있다. 이 해안지대에는 원래 이 지역 일대 어민들의 어장이 있었으나 현재는 주로 산책로로 이용되고 있다. 
해안절벽이 퇴적층으로 이루어져 있으며, 낙조가 아름다운 곳이다. 유네스코에서 등재한 세계지질공원으로서 올레 12코스에 해당하며 아름다운 해안 풍경을 감상하면서 여유롭게 산책을 즐길 수 있어 많은 사람이 찾는 관광명소이다. 해안을 따라 형성된 해식애를 온통 뒤덮으며 지천으로 피어있는 구절초가 볼거리이다.
주변 관광지로는 차귀도잠수함관공, 절부암, 고산리선사유적 등이 있다.","▪ <a href=""https://blog.naver.com/wowjejusi/221656736433?trackingCode=blog_bloghome_searchlist""target=""_blank"" title=""새창 : 제주시청 공식블로그로 이동"">https://blog.naver.com/wowjejusi</a>"
엉알해안산책로,3056663,자연,자연관광지,해안절경,http://tong.visitkorea.or.kr/cms/resource/26/3056626_image2_1.jpg,제주특별자치도,126.1641309043,33.3080820007,"제주 사투리로 [엉]은 벼랑과 절벽을 뜻하고, [알]은 아래쪽이라는 의미를 가지고 있다. 엉알해안산책로는 절벽 아래에 자리 잡은 해안 산책로를 뜻한다. 제주시 숨은 비경 31곳에 선정된 엉알해안은 화산재가 쌓여 이루어진 지층이 바다와 어우러져 아름다운 절경을 자랑하며, 해안을 따라 한적한 엉알해안 산책로가 예쁘게 조성되어 있다. 엉알해안 산책로는 수월봉에서 자구내 포구까지 이어지는 약 1km의 해안 산책로로, 올레길 12코스와 연결된다.
산책로의 시작점에 있는 수월봉은 화산재가 겹겹이 쌓여 생긴 오름이다. 산책로 코스에는 수월봉이 포함되지 않지만, 수월봉 정상에 올라서면 엉알해변이 한눈에 들어오고, 차귀도와 산방산, 한라산까지 조망할 수 있다. 엉알해안산책로를 걷는 동안 해안 절벽 곳곳에 있는 다양한 화산암괴와 지층이 휘어진 탄낭구조를 볼 수 있으며, 엉알해안과 고산리 선사유적을 지나면 자구내 포구에 도착하는데, 자구내 포구는 낙조가 아름답기로 유명하다.","<a href=""https://www.visitjeju.net/kr/detail/view?contentsid=CNTS_000000000021531"" target=""_blank"" title=""새창 : 홈페이지로 이동"">https://www.visitjeju.net/kr/</a>"
