title,contentid,cat1,cat2,cat3,firstimage,region,mapx,mapy,overview,homepage
"연의근린공원(에코스페이스 연의, 북카페)",2611679,인문(문화/예술/역사),휴양관광지,공원,http://tong.visitkorea.or.kr/cms/resource/77/2611677_image2_1.bmp,서울특별시,126.8342218274,37.511749701,"연의근린공원은 국내 유일의 생태환경 저류지 공원으로 환경부 신기술인 생태적 수질정화 비오톱 특허시스템을 도입해 조성하였다. 연의공원에는 전시공간부터 교육, 힐링장소까지 두루 갖춘 공간인 에코스페이스 연의가 있다. 1층에는 전시공간, 2층에는 교육공간이 조성되어 있다. 또한 3층에는 옥상정원을 조성해 놓아 또 다른 볼거리를 선사한다. 이곳 에코스페이스 연의에서는 매주 주말마다 가족생태프로그램을 월별 다양한 주제로 실시하고 있다.
연의근린공원에 데크길과 황토길이 조성되어 있으며, 공원사면에는 다양한 야생화가 심어져 있고, 4대의 분수가 설치되어 밤에 운동하러 나온 주민들은 야간분수도 즐길 수 있다. 산책길을 걸으며 공원 내 식생과 곤충에 대하여 알아보고, 쉽고 재미있게 생태계를 이해할 수 있는 생태체험 프로그램을 통해 어린이들에게 다양한 자연학습기회를 제공한다.",
연이네식당,2916080,음식,음식점,한식,http://tong.visitkorea.or.kr/cms/resource/74/2916074_image2_1.jpg,전라남도,127.751978363,34.7214092125,"아침 6시부터 손님들을 맞이하는 연이네식당은 주인이 직접 담근 장으로 조리한다. 동네 주민, 버스 기사, 낚시꾼뿐만 아니라 관광객들도 많이 찾는 식당이다. 여수에서 인정한 모범업소, 안심식당이고 입식으로 된 기사 식당 분위기로, 약 80여 명 정도 수용할 수 있다. 대표 메뉴는 장어구이, 서대회, 생선구이, 게장백반이며 모든 메뉴는 2인 이상 주문해야 한다. 양념/간장 게장, 갓김치, 낙지 젓갈, 갓 물김치, 갈치속젓도 포장 판매 및 택배 주문을 받고 있다. 펜션도 같이 운영하며, 주차장은 없지만, 식당 앞 도로에 주차할 수 있다.",
연인들의 일출 순례지 영덕 해맞이공원,1948676,추천코스,힐링코스,힐링코스,http://tong.visitkorea.or.kr/cms/resource/31/1230631_image2_1.jpg,Unknown,129.4468581507,36.5080970062,"영덕의 해맞이 공원 창포등대가 연인과 가족들의 해맞이 코스로 매년 인기를 모으고 있다. 다양한 야생화와 꽃나무, 언덕 절벽 길을 따라 난 나무 산책로, 뒤편 언덕 풍력발전소의 풍차가 그림 같은 풍광을 자랑한다.",
연인산다목적캠핑장,2734125,레포츠,육상 레포츠,"야영장,오토캠핑장",http://tong.visitkorea.or.kr/cms/resource/99/2797299_image2_1.jpg,경기도,127.4602952007,37.9016295811,"연인산다목적캠핑장은 해발 1,068m의 연인산을 비롯하여 명지산, 화악산 등 광주산맥의 정맥 속에 자리 잡아 산세가 수려하며 청정 가평천의 상류지역으로 계곡이 발달되어 산과 물의 조화가 빼어난 경관을 자랑한다. 편백하우스와 캐빈하우스, 오토캠핑장으로 구성되어 있다. 사이트는 데크와 파쇄석 사이트로 나눠져 있다. 슬기로운 의사생활 드라마 촬영지로도 알려져 있다.","<a href=""http://www.gpyeonin.co.kr/"" target=""_blank"" title=""새창 : 연인산다목적캠핑장 사이트로 이동"">http://www.gpyeonin.co.kr/</a>"
연인산도립공원,126859,자연,자연관광지,도립공원,http://tong.visitkorea.or.kr/cms/resource/74/1591274_image2_1.jpg,경기도,127.4145411335,37.8985068799,"연인산 도립공원은 경기도 가평군 가평읍 승안리, 조종면 마일리, 북면 백둔리 3개에 읍면에 걸쳐져 있는 자연공원이다. 동으로 장수봉, 서로는 우정봉, 남으로 매봉·칼봉이 연인산에서 시작한 용추계곡을 감싸고 있다.
이곳은 연중 강수량이 풍부하고 토양이 비옥해 여러 종의 고산식물과 얼레지, 은방울, 투구꽃 등 많은 야생화들이 자생하고 있으며 각 능선마다 원시림과 함께 잣나무, 참나무가 모여서 자라고 있다.
연인산 곳곳에 아름드리 푸른 잣나무가 숲을 이루고 있는 곳은 대부분 옛 화전터였다. 지금도 용추구곡이나 연인 능선, 우정 능선 등 등산로를 따라가다 보면 옛 집터의 흔적을 곳곳에서 발견할 수 있다.
연인산은 불타는 듯 아름다운 철쭉으로도 유명한 곳이다. 이곳 철쭉은 산철쭉으로 해발 700m 이상 능선에 무리 지어 자라고, 고지대로 올라갈수록 나무가 굵고 꽃의 색깔이 고우며 5월 중순이나 하순에 활짝 핀다.
연인, 우정, 장수, 청풍 능선에서는 철쭉이 모여서 피어있고 매봉, 노적봉 능선에도 참나무 그늘 속에 많은 철쭉이 피어난다. 계곡의 골이 깊고 능선의 경사가 완만하여 남녀노소 누구나 산행길에 오를 수 있다.",
연일물회,2912872,음식,음식점,한식,http://tong.visitkorea.or.kr/cms/resource/51/2912851_image2_1.jpg,경상북도,129.3451265026,35.9970307778,"연일물회는 경상북도 포항시 남구 연일읍 생지리에 위치하고 있다. KBS 1TV 시사 교양 프로그램 6시 내 고향 등 여러 방송에 소개된 바 있다. 세월의 흔적이 엿보이는 외관과 예스러운 분위기를 연출하는 인테리어가 눈에 띈다. 내부에는 단체석이 마련되어 있어 각종 모임을 하기 좋다. 대표 메뉴는 물회며, 회덮밥과 해삼 물회도 판다. 각종 해산물을 종류별로 넣어 만든 옹가지 물회도 인기가 많다. 물회에 들어가는 모든 해산물은 자연산만을 취급한다.",
연일시장,1608657,쇼핑,쇼핑,상설시장,,부산광역시,129.0844554357,35.185653306,"‘연일 시장’은 부산 연제구에 위치한 골목 시장으로 지역주민들이 자주 찾는다. 시장 내부는 채소, 과일, 건어물, 옷 등 다양한 상점들이 있으며 부산의 지역적 특성상 특히 생선이 신선하며 가격이 매우 저렴하다. 넉넉한 인심과 푸근한 친절함에 절로 기분이 좋아지고 시장의 분위기가 활기차며 사람들로 북적여 현지의 정취를 느낄 수 있다. 이곳은 연산역에 인접해 있어 접근성 또한 좋다.",
연일중명자연생태공원,2610500,자연,자연관광지,자연생태관광지,http://tong.visitkorea.or.kr/cms/resource/05/3409805_image2_1.jpg,경상북도,129.3143963275,35.9809764514,"2013년 12월 완공된 연일중명자연생태공원은 95,000㎡ 규모로, 접근성이 좋아 지역 주민들이 산림욕을 즐기기 위해 많이 찾는 곳이다. 야생화관찰원, 약용식물원, 소생물관찰원, 암석원 등 다양한 생태학습 체험 시설을 갖추고 있으며, 옥녀봉 전망대, 휴게소, 상징관장 등 다양한 편의시설을 제공하고 있다. 이 공원은 길이 잘 닦여있어 산책하기에 좋다. 곳곳에 수달, 다람쥐, 호랑이, 반달곰 등 귀여운 동물 인형들을 전시해 재미를 더한다. 팻말을 들춰보면 식물의 이름과 간략한 설명이 나와 있는 ‘나의 이름은 뭘까요?’라는 문구가 있어 아이들이 호기심을 갖고 자연을 배우기에 좋다. 숲 속교실에서는 학생들이 자연공부를 하고, 넓은 잔디 광장에서는 나들이를 나온 가족들이 쉴 수 있다. 특히 높이 18m로 UFO 형상을 한 전망대에서는 포항시와 아름다운 바다를 한눈에 볼 수 있어 많은 사람이 찾는 곳이다.","<a href=""https://www.pohang.go.kr/phtour/wmap/tourInformation/view.do?menu_idx=104&tour_info_idx=127"" target=""_blank"" title=""새창 : 홈페이지로 이동"">https://www.pohang.go.kr/phtour/index.do</a>"
연일향교,127236,인문(문화/예술/역사),역사관광지,유적지/사적지,,경상북도,129.3235781166,36.0066015074,"조선 태조[太祖] 7년(1398)에 현재 포항시 남구 대송면에 창건하였다고 하나 연혁에 관한 자료는 남아있지 않아 창건 연대는 정확하게 알 수 없고 임진왜란으로 전소되어 숙종 때 대송면 성좌동에 중창[重創] 하여 고종 8년(1871) 현감 원우상[元禹常]에 의하여 현 위치로 이건 되었다. 일제강점기 때 명륜 학교로 사용된 바 있고 1983년 2월 행정구역 개편에 따라 포항시에 편입되어 보존되고 있다. 대성전(大成殿)에는 중국의 5성현[五聖賢]과 송조의 2성현 우리나라 현철[賢哲] 18분의 위패[位牌]를 봉안[奉安] 하고 있으며, 매년 가을 상정일[上丁日]에 향제[享祭]를 올리고 있다. 특히 대성전은 정면 3칸, 측면 2칸의 맞배지붕·겹처마의 집으로 주심포계[柱心包系] 외일출목[外一出目]의 조선 후기 특징을 잘 나타내고 있는 건물이다. 부속건물로 내삼문, 외삼문 및 명륜당, 중문, 포사 등이 있다.","<a href=""https://www.pohang.go.kr/phtour/wmap/tourInformation/view.do?menu_idx=20&tour_info_idx=233 "" target=""_blank"" title=""포항시 문화관 사이트로 이동"">www.pohang.go.kr</a>"
연잎향,2670422,음식,음식점,한식,http://tong.visitkorea.or.kr/cms/resource/98/2666598_image2_1.jpg,전라남도,126.3815333274,34.7852650673,현지인이 추천하는 모범음식점이다. 대표메뉴는 쌈밥이다. 전라남도 목포시에 있는 한식 전문점이다.,
연자봉,650224,자연,자연관광지,산,,전북특별자치도,126.8993897134,35.4805534759,"연자봉은 정읍 내장산의 봉우리 중의 하나이다. 이곳에 제비 명당이 있다고 하여 연자봉이라고 하였다. 풍수지리상 연자봉을 중심으로 장군봉과 신선봉이 있는 모습이 마치 날개를 펼친  제비모습과 흡사하여 붙여졌다고 전해진다.
장군봉과 1.8㎞거리에 팔각정의 2층 전망대가 세워져 있고, 그곳에서 바라본 내장산은 벽련암을 기준으로 그 위로 서래봉, 왼쪽으로 원적암, 불출봉, 망해봉이 있고 오른쪽에는 월영봉이 있다. 연자봉과 전망대를 쉽게 오르려면 내장산 탐방안내소 인근의 내장산 케이블카를 타고 오르면 된다.
연자봉에서  1.1㎞ 정도 더 가면 내장산 최고봉인 신선봉에 이른다.","<a href=""https://www.knps.or.kr/front/portal/visit/visitCourseMain.do?parkId=120600&menuNo=7020087"" target=""_blank"" title=""새창 : 홈페이지로 이동"">https://www.knps.or.kr</a>"
연정식당,2854121,음식,음식점,한식,http://tong.visitkorea.or.kr/cms/resource/13/2854113_image2_1.jpg,제주특별자치도,126.4867766981,33.4838148633,"제주연정식당은 제주시 연동에 위치하고 있다. 돼지 한 마리당 200g만 나온다는 가브리살이 맛있기로 소문난 곳으로, 맛집 소개 프로그램 식신로드에 소개된 바 있다. 깻잎 절임과 멸치젓, 청국장이 이 집만의 비법으로, 밥에 청국장을 얹은 후 멜젓과 함께 비벼 먹는 조합을 추천한다. 가브리살 외에도 목살, 오겹살, 삼겹살, 소등심 등의 구이류와 김치찌개, 곱창전골 등의 식사메뉴를 맛볼 수 있다.",
연제 안승갑 고가,1393351,인문(문화/예술/역사),역사관광지,고택,http://tong.visitkorea.or.kr/cms/resource/21/3336321_image2_1.JPG,충청북도,127.3533461527,36.8462109489,"연제 안승갑(1887~1951) 고가는 진천군 만뢰산 아래 보련마을의 중심자리에 위치하고 있다. 연제 안승갑 선생은 1934년부터 1942년까지 현 화랑문화학교 자리에 안중근의사의 재종질 등 민족혼이 투철한 선생을 초빙하여 한글, 우리 역사, 민족사상등을 교육하던 만뢰학원을 사비로 설립·운영하였다.
이 고가는 조선시대 전통 가옥구조를 계승하여 1900년대 초에 건축한 ‘ㄱ’ 자형 돌기와 팔작지붕으로 정면 6칸, 측면 2칸 반으로 부분적인 겹집형태로 본채의 구조는 좌측(서쪽)으로부터 반 칸의 뒤주가 부엌에 이어져 있고 안방과 윗방, 대청이 있다. 대청마루는 널찍하고 매 칸마다 여닫이문을 설치하여 상당히 개방적이며, 부엌은 정면 2칸, 측면 2칸의 크기로 전면 앞마당과는 쌍여닫이 판문으로 연결되어있다. 대문과 광은 본채와 직각으로 배치되어 정면 3칸, 측면 1칸 크기로 각 칸을 사이벽으로 구획하고 간략한 토벽구조로 축조되었으며, 본채와 아래채 사이에는 좌로부터 외양간, 변소, 잿간, 헛간으로 구성된 건물 1동이 자리 잡고 있다.",
연제오방맛길 빛 축제,3393256,인문(문화/예술/역사),축제,일반축제,http://tong.visitkorea.or.kr/cms/resource/69/3393169_image2_1.jpg,부산광역시,129.0845137227,35.1871559163,"2025 꿈을 여는 오방 빛 축제’를 주제로 열리는 이번 행사는 연제오방맛길의 특징을 담은 빛 조형물로 연말연시 오방맛길을 찾는 모든 주민에게 선물 같은 추억을 선사할 계획이다. 빛 거리는 연산동 오방맛길 일원(고분로 13번길, 고분로 31번길, 반송로 일원)에 조성되며 점등 시간은 17시부터 24시까지다. 빛 축제의 시작을 알리는 점등식은 10월 25일(금) 18시 20분 한창타워 앞 특설무대에서 개최된다.",
연종 캠핑장,2908798,레포츠,육상 레포츠,"야영장,오토캠핑장",http://tong.visitkorea.or.kr/cms/resource/84/2908784_image2_1.jpg,충청남도,127.0022595,36.5997969432,"연종 캠핑장은 충남 공주시 유구읍 연종리에 자리 잡고 있다. 공주시청을 기점으로 30km가량 떨어졌다. 자동차를 타고 유구마곡사로와 구계연종길을 번갈아 달리면 닿는다. 도착까지 걸리는 시간은 40분 안팎이다. 폐교를 리모델링해 감성적인 공간으로 다시 태어난 캠핑장에는 파쇄석으로 이뤄진 일반캠핑 사이트 20면이 마련돼 있다. 사이트 크기는 가로 6.5m 세로 7m다. 물놀이장, 트렘펄린, 매점 등 부대시설이 알차고, 인근에 계곡이 있어 한여름 무더위를 날리기 그만이다. 주변에는 유구 색동수국정원, 마곡사가 있다. 
※ 반려견 동반 불가능",
연주암,127024,인문(문화/예술/역사),역사관광지,사찰,,경기도,126.9655729183,37.4425906321,"연주암이 위치하고 있는 관악산은 예로부터 개성의 송악산, 파주의 감악산, 포천의 운악산, 가평의 화악산과 더불어 경기 5악의 하나로 불리었다. 서울의 남쪽 경계를 이루고 있는 이 산은 줄기가 과천 청계산을 거쳐 수원의 광교산에 닿아있다. 곳곳에 드러난 암봉들이 깊은 골짜기와 어울려 험준한 산세를 이루고 있으나 산의 규모가 그다지 크지 않고 도심에서 가까워 가족을 동반한 당일 산행 대상지로서 많은 이들이 찾는다. 연주암을 비롯하여 크고 작은 사찰과 암자가 있는데 아슬아슬한 벼랑 위에 자리 잡고 있는 연주암은 관악산의 모든 등산로가 집결하는 곳이다. 연주암은 관악산의 최고봉인 연주봉에 자리 잡고 있는 연주대 남쪽 지점에 있다.
연주암은 관악산의 모든 등산로가 집결하는 곳인데 남쪽 능선을 계속 따라가면 장군바위에 다다르게 되고, 북쪽 능선을 따라가면 마당바위를 만나게 된다. 또 왼편으로는 무너미 고개를 지나 삼성산에 닿게 되며, 오른쪽으로는 자하동천이 펼쳐져 있다. 연주암에서 자하동천 계곡을 따라 과천시로 내려가기까지 1시간 정도 걸린다. 연주암은 본래 신라 문무왕 17년(677년) 의상대사가 창건했다고 전해진다. 당시 관악사로 불리던 오늘날의 연주암은 조선 태종 11년(1411년) 태종의 첫째, 둘째 왕자인 양녕대군과 효령대군이 현재의 자리로 옮겨 놓았다 한다. 정상에 이웃한 연주대는 관악산의 대명사처럼 되어 있는 절경으로 이곳에 오르면, 서울 시가지가 한눈에 내려다보인다.","<a href=""http://www.yeonjuam.or.kr/"" target=""_blank"" title=""새창 : 연주암 사이트로 이동"">http://www.yeonjuam.or.kr</a>"
연중반점,2901294,음식,음식점,중식,http://tong.visitkorea.or.kr/cms/resource/92/2901292_image2_1.jpg,인천광역시,126.6908919635,37.457600672,"연중반점은 3대에 걸쳐 운영하고 있는 화교 중식당이다. 실내는 중국 전통 소품으로 깔끔하게 장식해 두었다. 각종 연회를 위한 단체석도 마련되어 있다. 연중반점의 메뉴로는 짜장면, 사천짜장면, 삼선짬뽕, 등심탕수육, 고기튀김 등이 있으며, 이외에도 다양한 중식 요리를 판매하고 있다. 또, 시즌 메뉴로 겨울에만 판매하는 굴짬뽕도 인기가 많은데, 생강을 통째로 넣어 잡내를 없앤 굴과 채소, 버섯, 청양고추 등을 넣고 끓여 담백하고 칼칼한 맛이 일품이다.",
연지곤지,2840606,음식,음식점,한식,http://tong.visitkorea.or.kr/cms/resource/97/2840597_image2_1.jpg,경상북도,128.7593611908,35.8043415542,"연지곤지는 경상북도 경산시 사동에 있다. 깔끔한 외관과 널찍하고 청결한 느낌의 내부가 눈에 띄는 곳이다. 대표 메뉴는 보리밥이다. 이 밖에 영양돌솥밥, 곤드레돌솥밥, 더덕돌솥밥, 고등어구이, 갈치구이, 코다리찜 등을 맛볼 수 있다. 메뉴 중 각종 생선구이와 코다리찜은 포장해갈 수 있다. 경산IC에서 가깝고, 인근에 경산자인의계정숲, 인터불고CC가 있다.",
연지곤지캠핑장,2739404,레포츠,육상 레포츠,"야영장,오토캠핑장",http://tong.visitkorea.or.kr/cms/resource/10/2739910_image2_1.jpg,경상북도,128.9995743245,35.6734941255,"연지곤지 캠핑장은 청도군청을 기점으로 41㎞가량 떨어진 곳에 있으며 자동차에 몸을 싣고 청려로와 운문로를 차례로 달리면 닿는다. 도착까지 소요되는 시간은 1시간 안팎이다. 이곳은 청도의 대표 관광지인 삼계리 계곡이 관통한다. 이 덕택에 한여름이면 계곡 물놀이와 캠핑을 함께 즐기고자 이곳을 찾는 이가 많다. 캠핑장에는 일반 야영장 12면을 마련했다. 바닥은 모두 파쇄석으로 가로 7m 세로 7.5m 사이트 4면과 가로 5m 세로 7.8m 사이트 4면, 그리고 차박이 가능한 가로 7.5m 세로 8m 사이트 4면이 있다. 개인 트레일러뿐만 아니라 카라반 입장도 가능하다. 관리소에서는 텐트, 릴선, 화로대 등 캠핑 장비도 빌려준다. 캠핑장 규모가 작아 관리인이 한 명이지만, 모든 시설을 수시로 관리하고 있어 더없이 깔끔하다. 매년 12월부터 이듬해 3월까지 휴장 한다. 캠핑장 주변에 운문사, 운문산군립공원, 가지산도립공원 등이 있다. 인근에 여러 음식점이 있어 식도락의 즐거움을 누리기에도 좋다.","<a href=""http://cafe.daum.net/ygcamping"" target=""_blank"" title=""새창 : 연지곤지캠핑장 사이트로 이동"">http://cafe.daum.net/ygcamping</a>"
연지곤지팜캠핑장,2744418,레포츠,육상 레포츠,"야영장,오토캠핑장",http://tong.visitkorea.or.kr/cms/resource/07/2744207_image2_1.JPG,경기도,127.1694034278,37.7673898861,"연지곤지팜캠핑장은 국립광릉수목원 근처에 있다. 직동낚시터 지나서 오른쪽 언덕 위에 자리 잡고 있는데, 광릉숲 이야기 캠핑장과 나란히 위치하고 있다. 연지곤지팜캠핑장은 계단식으로 조성되어 있는데, 맨 아래쪽에 관리사무소와 편의시설이 있고 중간단에는 타프텐트동이 맨 위쪽에는 글램핑동이 나열되어 있다. 해먹을 설치하는 시설도 있고 위치가 높아 내다보이는 뷰도 좋다. 또한 글램핑 내부에는 테이블과 의자, 식기들이 갖춰진 주방시설이 있고 안쪽으로 텐트가 하나 있다는 게 특징. 안쪽 텐트가 침실인데 에어매트와 소파베드가 구비되어 있다.","<a href=""https://cafe.naver.com/farmcampingjang"" target=""_blank"" title=""새창 : 연지곤지팜캠핑장 사이트로 이동"">https://cafe.naver.com/farmcampingjang</a>"
연지공원,2779065,인문(문화/예술/역사),휴양관광지,공원,http://tong.visitkorea.or.kr/cms/resource/96/3355596_image2_1.jpg,경상남도,128.8676949168,35.2451093132,"공원 곳곳에 호수가 있는 연지공원은 김해시의 대표적 도심 공원이다. 공원 호수 가까이 맞닿은 산책로는 사계절 변화하는 꽃을 볼 수 있어 공원을 방문하는 사람들에게 즐거운 볼거리를 제공해 준다. 공원을 걷기 전, 해충이 걱정된다면 입구에서 주차장으로 가는 길에 해충 퇴치 기피제 분사기가 구비되어 있으니 이용해 보는 것도 좋다. 연지공원 호수에는 연꽃, 어리연 등이 심겨 있어 계절에 따라 방문객들에게 색다른 재미를 제공한다. 연지공원의 하이라이트는 야간에 볼 수 있는 분수쇼이다. 공원 호수에 레이저와 조명, 음악을 이용하여 분수쇼를 연출하는 데 이곳을 방문하는 이들에게 특별한 추억을 만들어 줄 수 있는 곳이다.","<a href=""https://www.gimhae.go.kr/00204/03101/03102.web?amode=view&idx=326"" title=""새창: 김해 관광포털 홈페이지로 이동"" target=""_blank"">https://www.gimhae.go.kr</a>"
연지동순두부,2642820,음식,음식점,한식,http://tong.visitkorea.or.kr/cms/resource/39/2664139_image2_1.jpg,서울특별시,127.0013382419,37.5715596281,다양한 순두부 요리를 판매하고 있는 곳이다. 서울특별시 종로구에 있는 한식 전문점이다. 대표메뉴는 해물 순두부다.,
연지못,2785613,자연,자연관광지,호수,http://tong.visitkorea.or.kr/cms/resource/57/3339557_image2_1.jpg,경상남도,128.5281772356,35.4546684338,"창녕의 연지못은 선조들이 영산 고을의 화재를 예방하고 농사에도 이롭게 하기 위해 만든 저수지이다. 그 모양이 벼루 모양을 닮았다 해서 연지(硯池)라 불렸으며 영산 호국공원과 인접하여 있다. 연못 가운데 다섯 개의 섬들이 떠 있어 아름답고 그중 가장 큰 섬 두 개는 다리로 연결돼 있어 산책로를 따라 들어가 볼 수 있다. 연못을 공원화하여 해마다 유등제가 열리고 있으며 놀이터와 운동기구, 건강 지압시설 등 다양한 부대시설이 마련되어 있어 사시사철 산책이나 나들이하기 좋다. 특히 수양벚꽃이 개화하는 시기엔 관광객이 붐빌 만큼 아름다운 풍경을 연출한다. 또한 반영 샷 한 장으로 핫플레이스가 된 영산만년교가 바로 앞에 있어 연지못을 한 바퀴 돌고 만년교로 이동하는 발길이 많은 곳이다.",
연지아트홀,3066651,인문(문화/예술/역사),문화시설,공연장,http://tong.visitkorea.or.kr/cms/resource/35/3066635_image2_1.jpg,전북특별자치도,126.8489141294,35.570442418,"연지아트홀은 주민 밀착형 문화예술 공간으로 시립예술단 및 지역 예술단체 참여 공연과 대관 공연도 병행 운영하고 있다. 
규모는 지하 1층 지상 2층으로, 객석은 203석이며, 클래식과 연극, 합창, 국악 등 다양한 장르의 공연이 가능한 곳이다. 부대시설로 피아노와 프로젝터, 조명, 음향시설이 있어 다채로운 공연이 만들어지는 곳이며, 아트홀 옆 휴식 공간에는 야외공연장도 있다. 그리고, 이곳에서 진행하는 공연 및 행사에 관한 정보는 홈페이지에 포스터와 함께 간략한 설명이 나와 있어 확인이 가능하다.
일반 문화예술행사의 경우는 사용 예정일 3개월 이내에만 예약할 수 있고, 대관 정보에 대해 정확한 상담은 직접 방문하는 것이 가장 좋다.","<a href=""https://www.jeongeup.go.kr/culture/index.jeongeup?menuCd=DOM_000000608004000000""target=""_blank"" title=""새창 : 지자체 홈페이지 이동"">https://www.jeongeup.go.kr/</a>"
