title,contentid,cat1,cat2,cat3,firstimage,region,mapx,mapy,overview,homepage
사명대사 생가지,128889,인문(문화/예술/역사),역사관광지,생가,,경상남도,128.6052943237,35.496859532,"* 의승장 사명대사를 만날 수 있는 곳, 사명대사 생가지 *
조선 후기의 승려 유정(사명대사)이 태어난 곳이다. 사명대사가 1544년(중종 30)에 진사 임수성의 둘째 아들로 태어나 13세 때 가출하여 직지사 신묵에게 가서 승려가 될 때까지 어린 시절을 보낸 곳이다. 사당인 숙청사와 사명대사가 태어나서 자란 곳인 육영당, 사명대사가 거처하던 사랑채인 사명당 등이 남아있다. 1992년에 경상남도 기념물로 지정되었다. 사명대사는 어린 시절을 여기서 보냈으며, 많은 일화가 전해오고 있다. 사명대사가 가끔 고향으로 방문할 때 쉬었다는 바위가 아직 그대로 남아 있어, 그의 발자취를 엿볼 수 있고, 마을 뒷산 서쪽 기슭에는 사명대사의 조모와 부모의 묘소가 있다.

* 임진왜란 당시 의승병의 핵심, 사명대사 *
사명대사는 13세의 나이에 유촌 황여헌 선생에게 글을 배우다가 [세속 학문은 천하고 비루하여 시끄러운 세상 인연에 얽매여 있으니 어찌 번뇌 없는 학문을 배우는 것과 같을 것인가?] 하고, 그 해 가을 황악산 직지사로 가서 신묵화상에게 머리를 깍고 선문에 들어가게 되었다. 
금강산에 들어가 수도하던 중 선조 25년(1592) 임진왜란이 일어나자 의승병을 모아 의병장으로서 활약하였으며, 1593년 명나라 구원군이 주축이 되었던 평양성 탈환전투에 참가하여 공을 세웠다. 선조는 그의 공을 크게 인정하여 가선대부동지중추부사의 벼슬을 내렸으며, 일본과 강화를 위한 사신으로 임명하기도 했다. 그 뒤, 병을 얻어 해인사에서 요양하다가, 광해군 2년(1610) 설법을 마치고 세상을 떴다. 저서로 『사명당대사집』,7권과 『분충서난록』,1권 등이 있다.","<a href=""https://www.miryang.go.kr/tur/EgovTourDetail.do?nmtIdx=49&mnNo=10302090000"" target=""_blank"" title=""새창 : 밀양 문화관광 홈페이지로 이동"">https://www.miryang.go.kr/</a>"
사명대사 유적지,2792831,인문(문화/예술/역사),역사관광지,유적지/사적지,http://tong.visitkorea.or.kr/cms/resource/20/2795020_image2_1.jpg,경상남도,128.6037055552,35.4975594243,"밀양출신인 사명대사의 호국정신과 애민애족의 숭고한 얼을 기리기 위해 지난 1999~2006년까지 부지면적 49,146㎡에 사명대사 동상과 사명대사 기념관, 추모공원, 기념비 등을 조성하여 역사의 산 교육장으로 활용하고 있다. 
유적지로는 응규마당, 유정마당, 사명마당, 추모광장, 송운마당, 종봉마당, 야생화원, 외삼문, 선친묘로 구성되어 있다. 이외에도 사명대사와 관련된 역사 이야기를 담아낸 기념관, 아이들이 뛰어놀기 좋은 연꽃타워 놀이터도 있다. 기념관 뒤편으로는 사명대사 동상이 세워져 있다. 동상 앞에는 향을 태울 수 있도록 제단이 조성되어 있으며, 제단에 새겨진 시를 통해 당시 풍전등화였던 나라를 구할 생각에만 젖어 있던 사명대사의 절절한 마음을 읽을 수 있다.
특히 분수대와 조형물, 포토존, 사명대사의 일대기를 그린 벽화 등이 잘 배치된 상징광장은 찾는 이들이 많은 곳이다. 화는 의병을 일으켜 전쟁에서 승리하고, 일본에 사신으로 건너가 협상을 맺고 온 그의 활약상을 잘 담아내고 있으며,","<a href=""https://www.miryang.go.kr/tur/EgovTourDetail.do?nmtIdx=50&mnNo=10302080000"" target=""_blank"" title=""새창 : 밀양시 문화관광 홈페이지로 이동"">https://www.miryang.go.kr/tur/</a>"
사명산,127580,자연,자연관광지,산,,강원특별자치도,127.906199306,38.0772424438,"사명산은 해발이 1,198m이다. 양구, 화천, 춘천 일대와 멀리 인제군 4개 고을을 조망할 수 있다는 데서 사명산이란 이름이 연유한다. 춘천에서 배후령을 넘어 추곡 약수를 지나면 사명산 산행기점인 선정사가 반긴다. 계곡의 등로를 따라 2시간 정도 오르면 파로호가 보이는 주능선에 닿고 거기서 계속 올라가면 널찍한 평지를 이룬 정상이다. 정상에서의 전망은 파로호와 멀리 설악산, 점봉산 등이 보인다. 소양호 물줄기와 청평사가 있는 오봉산도 보인다. 봄에는 진달래와 철쭉이, 가을에는 단풍이 절경이다. 설경 또한 아름다워 겨울산행도 적합하다.

이 산의 정상에는 두 개의 커다란 돌이 대문같이 서 있는 문바위가 있고, 여기서 더 올라가면 여러 겹의 바위가 겹쳐 있는 첩바위가 있다. 이 산은 임진왜란 당시 이 고장 사람들이 침략해 온 왜군에 대항해 싸운 전장이기도 하다. 하산은 추곡 약수로 잡는다. 추곡 약수는 약 1백여년 전에 발견된 것으로 위장병과 빈혈, 신경통과 고혈압에 좋다고 한다.","<a href=""https://www.ygtour.kr/Home/H20000/H20200/placeDetail?place_no=615&viewType=gallery&viewClass=tour&curationGroup=2&page=1&pageSize=12&search_column=1&search_keyword=%EC%82%AC%EB%AA%85%EC%82%B0&order_column=1&place_class=P001"" target=""_blank"" title=""양구 문화관광 사이트로 이동"">http://www.ygtour.kr</a>"
사모님짬뽕,2849301,음식,음식점,중식,http://tong.visitkorea.or.kr/cms/resource/95/2849295_image2_1.jpg,서울특별시,126.8122776038,37.575130831,"사모님짬뽕은 서울 방화동 짬뽕 맛집으로 유명한 곳이다. 불향이 가득하고 진한 짬뽕의 국물맛 덕분에 늘 웨이팅이 있는 곳이다. 매장 앞에는 기다리는 손님들을 위한 의자가 준비되어 있다. 
사모님짬뽕의 대표메뉴는 불향을 입은 야채와 탱글한 면발, 그리고 닭 육수와 사골 육수를 함께 우려내 깊은 맛이 나는 백짬뽕과 매콤하면서 칼칼한 국물에 불향을 입힌 해물이 잔뜩 들어간 홍짬뽕이다. 또, 이곳의 바삭한 튀김의 식감이 살아있는 수제만두튀김도 인기가 많지만 한정수량으로 판매하고 있다.",
사목공원캠핑장,2731141,레포츠,육상 레포츠,"야영장,오토캠핑장",http://tong.visitkorea.or.kr/cms/resource/77/2731177_image2_1.jpg,충청남도,126.2929455794,36.9199116191,"사목공원캠핑장은 충남 태안군 이원면에 자리했는데, 태안군청을 기점으로 23Km가량 떨어져 있어 자동차를 타고 후곡로, 동백로, 원이로를 차례로 거치면 45분 안팎에 도착한다. 캠핑장은 태안의 관광지 가운데 하나인 사목해수욕장 코앞에 위치해서, 어느 사이트에 자리를 잡든 서해의 수려한 풍광이 시각적인 즐거움을 선사하고 한여름 무더위를 날리기 위한 해수욕도 즐길 수 있다. 캠핑장에는 데크로 이뤄진 자동차 야영장 35면을 마련했는데, 평일 주말 가리지 않고 문을 열지만 겨울에는 매년 1월부터 2월까지 휴장에 돌입한다. 화장실과 샤워실은 남녀를 구분해 총 2개소며, 개수대는 1개소인데, 수시로 관리하는 덕분에 항상 깔끔하다. 매점에서는 장작을 비롯해 식품, 음료 등을 판매한다. 개인 카라반과 트레일러는 출입할 수 없고, 반려동물은 소형견에 한해 동반 입장이 가능하다.","<a href=""https://samokcamping.modoo.at/"" target=""_blank"" title=""새창 : 오토캠핑사목공원 사이트로 이동"">https://samokcamping.modoo.at/</a>"
사목해수욕장,1532423,자연,자연관광지,해수욕장,http://tong.visitkorea.or.kr/cms/resource/99/2519899_image2_1.jpg,충청남도,126.2924067266,36.9204059972,"충남 태안에 있는 사목해수욕장은 백사장 길이 1km, 너비 200m, 면적 20㏊, 경사 6˚, 안정 수면 거리 150m로, 태안반도 북쪽의 이원 반도에 있는 아담하고 조용한 해수욕장이다. 예로부터 바다에서 모래가 많이 밀려와 모래층이 두껍고 고우며 해변 경관이 빼어나지만, 이원 반도에서도 북부권에 있어 잘 알려지지 않은 곳이다. 사람이 많은 것보다 아이들이 놀기 쉽고 바닷물이 깊지 않아 안심 된다. 해변 바로 뒤로는 아름드리 소나무가 울창하게 숲을 이루고, 해수욕장에는 가톨릭의 살레시오 수련관이 자리 잡고 있다. 기반 시설과 편의시설이 부족하여 마을에서 민박 하거나 야영해야 한다. 주변에 만대포구·그누굴해변·꾸지나무골해수욕장·후망산·고파도 등의 관광지가 있다. 그리 넓지 않은 해수욕장이기 때문에 한여름에 오붓하게 물놀이하기에도 안성맞춤이다. 태안읍 로터리에서 603번 도로를 타고 북쪽으로 30분 정도 올라가다가 음포해수욕장에서 2.7km 정도 더 올라가면 해수욕장이 나온다.",
사문진 주막촌,1970821,인문(문화/예술/역사),역사관광지,민속마을,,대구광역시,128.4786968148,35.8111411678,"과거 사문진은 낙동강변에 있는 나루터였다. 현재는 대구광역시 달성군에 위치하며 일제강점기 때는 화원유원지로 불리면서 유원지에 많은 행락객들이 붐비던 곳이었다. 현재는 500년 된 팽나무와 함께 대형 피아노 장승, 오리솟대, 피아노 유입 기념비, 임자 없는 나룻배 촬영지 기념비, 시비, 세족대, 부유식 계류장, 피아노 광장 등의 사문진 나루터 공원의 볼거리와 함께 옛 주막의 정취를 느낄 수 있는 곳이다. 막걸리를 비롯해 잔치국수, 국밥, 부추전, 두부 등 다양한 먹거리를 판매하고 있어 옛 정취와 함께 사문진 낙조의 풍경을 감상하면서 식사를 즐길 수 있다.","<a href=""https://dalseong.daegu.kr/culture/index.do?menu_id=00001956&menu_link=front/tour/tourMapsViewFromMain.do&tourId=76"" target=""_blank"" title=""새창 : 홈페이지로 이동"">https://dalseong.daegu.kr</a>"
사문진나루터,2999148,인문(문화/예술/역사),체험관광지,이색체험,http://tong.visitkorea.or.kr/cms/resource/97/3030097_image2_1.JPG,대구광역시,128.478630154,35.8111245019,"사문진 나루터는 옛날 보부상들이 부산에서 낙동강을 거슬러 대구로 오는 뱃길로 이용되었다.
사문이라는 이름의 유래는 ‘화원읍 본리리(인흥마을)에 있었던 인흥사[仁興寺]라는 큰절로 가는 관문이기 때문에 절사[寺]를 써 사문진[寺門津]으로 불렀다.’는 설과 ‘강가의 모래가 있어서 사[沙]자를 쓰고 포구를 통해서 배가 소금 등을 싣고 들어오고,이 지역의 물건이 다른 지방으로 가는 문이라 해서 사문진[沙門津]으로 불렀다.’는 설 2가지로 전해 오고 있다.
사문진 나루터는 조선 세종 28년에 설치돼 성종때까지 40년간 무역 창고(화원창)지로 활용되었으며, 이 곳에는 대일무역의 중심지 역할을 한 왜물고가 있었으며, 낙동강 물자 수송의 중심지 역활을 하였다.
1900년 3월 26일 미국인 선교사 사이드 보텀 부부가 피아노를 한국 최초로 이곳을 통해 대구로 가져 왔으며, 일제강점기 이규환 감독의 ‘임자없는 나룻배’ 촬영지였다.
현재의 모습은 1993년 화원읍과 고령군 다산면을 잇는 사문진교가 개통되면서 사문진 나루터는 역사 속으로 사라질 뻔했으나, 피아노 광장을 조성하고, 전통 주막촌 3동을 복원하는 등 사문진 나루터 일원에 역사 공원을 조성했다.
주막촌에는 초가 지붕을 얹어 옛 나루터의 분위기를 자아내고 사문진 나루터 주막촌 중심부에 팽나무, 솟대와 장승이 서 있으며, 피아노 유입지임을 알리는 각종 조형물이 공원 곳곳에 자리해 있다.
사문진나루터에서 출발해 달성습지, 강정보 디아크, 달성보 일원까지 운항하는 1시간 코스의 유람선도 운항 중이다.","<a href=""https://www.dssiseol.or.kr/pages/sisul/page.html?mc=1058"" target=""_blank"" title=""새창 : 홈페이지로 이동"">https://www.dssiseol.or.kr</a>"
사문진역사공원,3112058,인문(문화/예술/역사),휴양관광지,공원,,대구광역시,128.478630154,35.8111245019,"화원읍 본리리(인흥마을)에 있었던 인흥사(仁興寺)라는 큰절로 가는 관문이기 때문에 절사(寺)를 써 사문진(寺門津)으로 불렀다.""는 설과 ""강가의 모래가 있어서 사(沙)자를 쓰고 포구를 통해서 배가 소금 등을 싣고 들어오고, 이 지역의 물건이 다른 지방으로 가는 문이라 해서 사문진(沙門津)으로 불렀다.""는 설로 전해 오고 있다.",https://www.dssiseol.or.kr/pages/main/index_real.html
사문진피크닉장,3023208,자연,자연관광지,자연생태관광지,,대구광역시,128.4770248005,35.8089441636,"사문진피크닉장은 화원유원지와 인접한 숲속 피크닉장이다. 대구 도심과 가깝고 넓은 잔디밭과 놀이터가 있어 아이와 반려견이 뛰어놀기에도 안성맞춤이다.
야영 및 취사가 되지 않는 오롯이 일일 피크닉을 즐길 수 있는 곳으로 휴대용 가스버너 등의 사용도 시설 관리자에게 신고 후 사용하여야 한다. 달성군 시설관리공단 통합예약시스템에서 온라인 예약 후 이용가능하며 이용료는 당일 현장에서 결제한다.","<a href=""https://www.dssiseol.or.kr/pages/sisul/page.html?mc=1105""target=""_blank"" title=""새창 : 달성군시설관리공단 홈페이지로 이동"">https://www.dssiseol.or.kr/</a>"
사미정계곡,126817,자연,자연관광지,계곡,http://tong.visitkorea.or.kr/cms/resource/40/3047340_image2_1.jpg,경상북도,128.9363136649,36.9107690043,"봉화군 법전면 소천리에 위치한 사미정 계곡은 우리나라에서 몇 군데 남지 않은 청정 지역 가운데 하나이다. 낙동강 발원지인 태백산과 소백산 사이 y자형 계곡으로, 맑고 시원한 물줄기와 함께 울창한 송림, 기암괴석이 있는 아름다운 계곡이다. 계곡 입구에는 조선 영조 때 우부승지를 지낸 옥천 조덕린이 1727년에 산수 좋은 명승 경관지에 정자를 세웠으며 이 정자를 사미정이라고 불렀고 그때부터 계곡도 사미정 계곡이라 불렀다. 운곡천의 물줄기가 기암괴석을 감돌아 흐르는 아름다운 절경을 지닌 운치 있는 계곡으로 여름이면 많은 피서객이 찾아 봉화군청은 피서객들의 안전과 수질관리를 위해 물놀이 시기인 6월 초부터 8월 말까지 안전요원을 배치하고 있다.","<a href=""https://www.bonghwa.go.kr/open.content/tour/main.tour/valley/?id=190&hash=36.88767185853499,128.7355743253562,10"" target=""_blank"" title=""봉화 문화관광 사이트로 이동"">http://www.bonghwa.go.kr</a>"
사미헌,841730,음식,음식점,한식,http://tong.visitkorea.or.kr/cms/resource/71/1866471_image2_1.jpg,부산광역시,129.0566863597,35.158997445,"한우 숯불구이, 갈비탕 등을 판매하는 한식 전문점이다.","<a href=""http://samihunmall.com"" target=""_blank"" title=""새창: 사미헌 홈페이지로 이동"">http://samihunmall.com</a>"
사발소캠핑장,2909535,레포츠,육상 레포츠,"야영장,오토캠핑장",http://tong.visitkorea.or.kr/cms/resource/20/2909520_image2_1.JPG,강원특별자치도,128.0410356003,37.5688262571,"물 좋기로 소문난 병지방계곡 중류에 위치하고 있다. 물놀이 명소로 알려져 있는 사발소가 인접해 있어 여름철 물놀이를 겸한 야영장소로 인기가 높다. 캠핑장은 전역이 나지막한 소나무로 조경되어 있고, 사이트마다 개별 화장실이 제공된다. 들어가는 입구가 좁아 조심할 필요가 있지만 막상 캠핑장에 들어서면 넓은 공간에 간격 넓게 캠핑을 즐길 수 있다.
※ 반려동물 동반가능 (소형견만 가능)",
사방기념공원,2406101,인문(문화/예술/역사),휴양관광지,공원,,경상북도,129.3966673612,36.1562804096,"포항시 북구 흥해읍 오도리 일대에 있는 공원으로 한국 사방 100주년을 기념해 2007년 문을 열었다. 박정희 전 대통령의 지시로 1975년부터 5년간 연인원 360만 명이 투입되어 총면적 4,500ha를 단기간에 녹지화한 전국 최대 규모의 사업 성공지를 보여주는 외부공원과 사방사업 기술 변천과 각종 자료를 모아 전시한 실내 전시실로 나누어져 있다. 
사방기념공원은 옛날 60~70년대 보릿고개 시절에 춘궁기를 넘기기 위하여 사방사업에 종사하며 국토 녹화에 이바지한 사방기술인들의 혼과 땀이 깃든 자료를 한 곳에 모아 전시하고 있다. 또한 사방사업에 필요한 각종 사업 종류를 기념관 뒤편 야산에 실제 시공하여 산림복구 기술을 한눈에 파악할 수 있도록 했다.","▪ <a href=""https://www.pohang.go.kr/phtour/wmap/tourInformation/view.do?menu_idx=104&tour_info_idx=140"" target=""_blank"" title=""새창 : 포항시 퐝퐝여행 홈페이지로 이동"">https://www.pohang.go.kr/phtour</a>"
사북 탄광문화관광촌,2465477,인문(문화/예술/역사),산업관광지,기타,,강원특별자치도,128.815570762,37.2200978629,"1962년부터 2004년까지 석탄을 캐던 동양 최대의 민영탄광인 동원탄좌가 폐광된 이후 관광객에게 공개되고 있는 곳으로 당시의 샤워실, 채탄 장비실, 세화실 및 광산 장비 등 폐광된 흔적이 그대로 남아있어 현장감과 사실감을 느낄 수 있다.  강원랜드와 탄광에서 일하던 광부들이 포함된 사북읍 번영회가 공동으로 탄광문화관광촌을 지속적으로 조성중에 있으며 현재는 1차로 사북석탄유물보존관 및 탄광역사체험장(갱도 열차체험) 등을 관광객들에게 무료로 개방하고 있다.","정선여행 <a href=""https://www.jeongseon.go.kr/tour/jeongseontour/attractions
"" target=""_blank"" title=""정선여행 사이트로 이동"">https://www.jeongseon.go.kr/tour</a>"
사북시장,2777889,쇼핑,쇼핑,상설시장,http://tong.visitkorea.or.kr/cms/resource/51/2785651_image2_1.jpg,강원특별자치도,128.8168370999,37.2272803946,"강원도 정선군 사북역 앞에 위치한 전통시장으로, 50여 개의 점포로 구성되어 있으며, 농산물, 과일, 육가공, 건어물, 분식, 의류, 방앗간, 식당 등이 모여 있는 상설 종합 시장이다. 곤드레와 고사리 등 나물이 좋기로 알려져 있으며, 더덕, 황기 등 약이 되는 임산물이 많다. 매주 금, 토요일에는 오후 6시에부터 10시까지 별꼴 야시장이 열린다. 시장 내에 있는 청년몰은 이름처럼 젊은 감각의 카페, 식당들이 모여 있는 곳으로 다양한 경험을 할 수 있어 핫플레이스로 떠오르고 있다.",
사비나미술관,130416,인문(문화/예술/역사),문화시설,미술관/화랑,,서울특별시,126.9292903725,37.630182075,"1996년 3월 개관한 사비나미술관은 융합, 변화, 도전, 혁신, 실험정신을 창조성의 원천으로 활용하며 예술의 의미와 가치를 이끌어내고 사회 전반에 확산시키는 역할을 수행하고 있다. 시각예술과 타 분야와 융복합을 시도한 기획전으로 융합과 창의성을 중시하는 시대적 요구와 사회 변화상을 제시한 모범사례로 많은 화제와 관심을 불러일으키고 있으며, 한국 현대 미술을 다양하고 깊이 있는 시각으로 보여주는 역동적인 공간이다. 전시와 교육, 출판, 소장품 수집 활동을 활발히 하고 있다. 또한 관객과 함께 숨 쉬는 살아있는 공간으로 거듭나고 있으며, 회화와 조각, 사진, 미디어 아트를 포괄하는 작가들을 육성하고, 새로운 예술적 흐름을 제시하고 있다.

서울 은평구 내 최초의 현대미술관으로서 융복합 전시, 예술교육 프로그램, 아카데미, 문화행사 등 다양한 문화 예술 활동을 통해 시민들의 예술적 소양과 심미안, 창의성을 길러주는 평생학교의 역할을 충실히 수행해 나갈 것이며, 지역주민을 위한 미술관이면서 국제적인 미술관으로 발전시켜 나갈 예정이다.","<a href=""http://www.savinamuseum.com/kor/index.action"" target=""_blank"" title=""새창: 사비나미술관 홈페이지로 이동"">http://www.savinamuseum.com/</a>"
사비도성 가상체험관,2648984,인문(문화/예술/역사),문화시설,전시관,http://tong.visitkorea.or.kr/cms/resource/47/3348847_image2_1.jpg,충청남도,126.9133647824,36.2855314361,"2015년 유네스코 세계유산으로 등재된 백제역사 유적지구 중 부여 지역의 문화재를 접할 수 있는 역사 문화체험 전시장이다. VR(가상현실)과 AR(증강현실), 홀로그램 등 다채로운 최첨단 기술을 활용한 전시콘텐츠를 관람할 수 있다. 1층에서는 백제문양을 채색하는 코너와 사비도성 전체를 볼 수있는 모션인식 코너가 있으며, 2층에서는 부여전체의 모습을 VR로 체험할 수 있는 공간과 정림사로 시간여행을 떠나는 체험을 즐길 수 있다.","<a href=""https://blog.naver.com/sabiexperience""새창: 홈페이지로 이동"">https://blog.naver.com/sabiexperience</a>"
사비면옥,2877377,음식,음식점,한식,http://tong.visitkorea.or.kr/cms/resource/70/2877370_image2_1.jpg,충청남도,126.9129650779,36.2757436615,"사비면옥은 충청남도 부여군 동남리에 있는 냉면 전문점이다. 대표 메뉴는 직접 우려낸 한우 육수와 동치미로 국물을 낸 물냉면이고 수제 양념과 과일로 맛을 낸 비빔냉면과 명태회의 쫄깃한 식감을 느낄 수 있는 회냉면도 많이 찾는다. 냉면 외에 소갈비찜, 소고기탕, 뚝배기 떡국 등이 준비되어 있다. 문을 열기 무섭게 사람들이 몰릴 만큼 소문난 맛집으로 부여나 공주 부근을 여행 중이라면 궁남지 근처를 찾아 꼭 맛봐도 좋을 만큼 맛있다. 부여 IC에서 가깝고, 주변에 낙화암과 백제문화단지가 있다.","<a href=""https://blog.naver.com/dorazegang""target=""_blank"" title=""새창 : 사비면옥 사이트로 이동"">https://blog.naver.com/dorazegang</a>"
사비성 (동학산장호텔 한식당),133943,음식,음식점,한식,http://tong.visitkorea.or.kr/cms/resource/10/3060510_image2_1.JPG,충청남도,127.2381753654,36.3595814233,"사비성은 계룡산 동쪽 자락에 있는 동학산장호텔에서 운영하는 한식당이다. 사골우거지국, 황태콩나물국, 육개장, 산채비빔밥, 불고기정식 등의 식사류와 삼겹살, 오리훈제 등 구이류를 즐길 수 있다. 현대식 건물로 신축한 호텔 안에 위치해 있어, 홀과 룸을 모두 갖췄으며 편안한 환경에서 식사할 수 있다. 동학산장호텔의 세미나&워크샵 패키지를 이용할 경우 별도의 메뉴도 즐길 수 있다.
호텔 주변에는 계룡산국립공원, 동학사, 한국자연사박물관 등이 있다.","<a href=""http://www.dhsanjang.co.kr/menu04/menu04_01.php"" target=""_blank"" title=""새창 : 홈페이지로 이동"">http://www.dhsanjang.co.kr</a>"
사비아,2787109,음식,음식점,서양식,http://tong.visitkorea.or.kr/cms/resource/18/2798218_image2_1.JPG,부산광역시,129.1827141976,35.1623021845,"파스타, 리소토, 스테이크를 맛있게 하는 사비아는 해운대 달맞이 길에 자리 잡은 이탈리안 레스토랑으로 건물 1층에 간판 없이 통유리로 인테리어 된 트렌디 한 감각의 식당이다. 솜씨가 뛰어난 셰프가 만들어 내는 깔끔한 음식이 예쁜 접시에 먹음직스럽게 플레이팅 되어 나오는데, 세 가지 버섯을 곁들인 감자 뇨키와 레몬크림소스 새우 리가토니, 채끝등심 스테이크가 인기 많다. 오픈 된 키친에서 정성스레 만드는 음식을 직접 눈으로 볼 수 있는 사비아는 행복한 분위기와 맛있는 음식이 함께하는 레스토랑으로, 평일에도 웨이팅이 있는 핫 플레이스라 예약을 해야 헛걸음을 하지 않을 수 있다.","<a href=""https://www.instagram.com/sabbia.kitchen/"" target=""_blank"" title=""새창 : 사비아 사이트로 이동"">https://www.instagram.com/sabbia.kitchen/</a>"
사비향,2379161,음식,음식점,한식,http://tong.visitkorea.or.kr/cms/resource/39/2379139_image2_1.jpg,충청남도,126.913034589,36.2729911999,"‘사비향’은 연잎밥만을 판매하는 연잎밥 전문식당이다. 메뉴는 연잎밥정식 단일메뉴이며 우렁무침, 제육볶음, 묵무침, 연근전, 잡채, 미역국 등 다양하고 푸짐하게 한식을 맛볼 수 있다. 이곳에서는 직접 농사지은 정직한 식재료를 사용하여 서비스를 제공하고 있으며 수많은 국내 고객들 뿐만 아니라 일본, 중국, 미국 등 한해 천여 명의 외국인 고객들이 방문하고 있다. 식당 내부는 단체고객을 위한 132석의 넉넉한 좌석수를 갖추고 있다.",
