title,contentid,cat1,cat2,cat3,firstimage,region,mapx,mapy,overview,homepage
방우산장,3043977,인문(문화/예술/역사),역사관광지,유적지/사적지,http://tong.visitkorea.or.kr/cms/resource/68/3043968_image2_1.jpg,서울특별시,127.00147928,37.5932682184,"방우산장은 조지훈 기념 건축 조형물이다. 방우산장은 성북동에서 활동하던 시인 조지훈이 자신이 살던 집에 붙인 이름으로 [마음속에 소 한 마리를 키우면 직접 소를 키우지 않아도 소를 키우는 것과 다름없다]는 [방우즉목우]의 사상을 담은 것이라고 한다. 
이 조형물은 시인 조지훈의 집터 근처에 [시인의 방]이라는 콘셉트으로 조성된 것으로, 조지훈 시인의 삶과 흔적을 만날 수 있는 공간이다. 전통 한옥의 처마와 마루를 모티브로 삼아 벽과 바닥을 만들었다. 현무암을 써서 독특한 느낌을 풍기며, 열린 공간에는 잔디를 깔고 청동주물로 만든 의자를 들여놨다. 의자는 정해진 방향 없이 자유롭게 배치하였다. 그리고 시인의 집터 방향으로 문을 내고 바깥벽에는 시인이 가장 아끼던 작품 [낙화]가 새겨졌다.",
방이동 고분공원,2758054,인문(문화/예술/역사),휴양관광지,공원,,서울특별시,127.1178822057,37.5082190824,"사적 제270호로 지정된 서울 송파구 방이동 일대에 있는 백제 초기(4C 초∼475)의 무덤군(31,154㎡)이다. 방이동 유적은 백제의 수도가 한성에 있을 때 만들어진 전기무덤으로 가락동·석촌동 무덤과 함께 한성백제의 문화를 알 수 있는 유적이다. 1971년 조사에 의해 고분 8기가 발견되었고, 1975년 잠실 일대를 개발하는 과정에서도 발굴되었다. 서울시는 1983년 복원 공사를 하여 오늘날의 고분 공원으로 조성하였다. 방이동 백제고분군 인접한 곳에 올림픽공원이 있다. 방이동 백제고분군에서 역사도 되짚어보고 올림픽공원에 있는 미술관이나 기타 시설들을 연계해서 즐기는 것도 좋다. 3개 지하철이 인접해 있어 대중교통을 이용하는 것도 편리하다.",
방이동 생태경관 보전지역,814203,자연,자연관광지,자연생태관광지,,서울특별시,127.1403911599,37.5120857057,"방이동 생태보전지역은 면적 58,909㎡ 연못형태의 습지이다. 원래 논농사로 이용되었던 곳이였는데 이 곳 토사가 충적토라 벽돌채취를 위하여 채취하다 보니 웅덩이와 함께 습지가 자연스럽게 만들어졌다고 한다. 찾아오는 사람들이 적어서 자연 속 동식물들이 모이게 되었는데 특히 습지 식물들이 번성하여 습지지역이 형성되면서 희소성과 보전가치를 인정받은 방이습지가 되었다. 
습지를 찾아오는 다양한 새들도 있어서 물억새, 애기부들 등의 습지식물과 청둥오리, 물총새 등의 야생조류가 관찰된다. 풀벌레소리와 새소리가 들리는 한적한 숲길을 걸으며 곳곳에 적혀있는 동식물에 대한 설명을 읽다보면 유익한 산책시간이 된다. 보전지역이기 때문에 동식물 보호를 위해 채취행위는 엄격히 금지되며 반려동물 동반도 불가하다.
방이습지에 대한 해설을 원한다면 서울시공공서비스나 현장접수를 통해 해설을 동반하여 관람할 수 있으며, 수도권 지하철 5호선 천호역 6번 출구에서 3316번 버스를 타고 효죽동 입구에서 하차하면 된다.",
방이샤브샤브칼국수 방이본점,2839421,음식,음식점,한식,http://tong.visitkorea.or.kr/cms/resource/05/2839405_image2_1.jpg,서울특별시,127.1233677863,37.5093384955,"방이샤브샤브칼국수 방이본점은 5호선 방이역 3번 출구 방산중학교 인근에 있다. 주차는 가게 앞부분에만 할 수 있고 자리가 협소해 유료주차장 이용해야 한다. 가게 외부에도 테이블이 마련되어 있고 내부 홀은 넓다. 대표 메뉴로는 버섯칼국수로 야채, 국수, 볶음밥으로 구성되어 있고 소고기는 별도로 주문해야 한다. 국물은 일반 육수, 얼큰 육수를 선택할 수 있고 기본 반찬 김치, 동치미 국물, 간장소스가 나온다. 주류는 판매하지 않는다. 다른 메뉴로는 전주비빔밥과 돌솥비빔밥이 있다. 식당 근처에 솔밭어린이공원, 서울방이동고분, 올림픽공원이 있어 식사 후 가벼운 산책을 할 수 있다.",
방이시장,2704559,쇼핑,쇼핑,상설시장,,서울특별시,127.1175821709,37.5104077116,방이시장은 1980년대 말부터 형성된 골목형 종합시장이다. 의류 채소 생선 과일 잡화 등을 취급하는 240여 개 점포가 형성되어 있으며 상인의 70%가 동네 터줏대감들이다. 시대의 흐름에 발맞춰 친절하고 청결한 시장으로 거듭나면서 방이시장은 외국인들의 관광 필수 코스로 자리 잡았다.<br>,"<a href=""https://www.songpa.go.kr/culture/detailInfo.do?resrceCd=TR0179-1002541&sc1=TR0179&rcpp=6&key=5115""target=""_blank"" title=""송파구 문화관광"">https://www.songpa.go.kr/culture/index.do</a>"
방자네바지락칼국수,2859543,음식,음식점,한식,http://tong.visitkorea.or.kr/cms/resource/37/2859537_image2_1.png,경기도,127.1444113873,37.2749354916,"경기도 용인시 기흥구 상하동에 있는 방자네바지락칼국수는 어정역 바로 앞에 있는 맛있고 시원한 칼국숫집이다. 대표 메뉴는 감태바지락칼국수이다. 바지락칼국수는 많지만, 감태를 넣어 면을 만든 집은 흔하지 않다. 시원한 국물과 쫄깃쫄깃한 바지락이 넉넉히 들어가 감칠맛을 높인다. 여름에는 서리태 콩국수와 코다리 냉면도 계절 메뉴로 하고, 그 외 왕만두, 물냉면이 있다. 김치는 매일 만드는 겉절이와 열무김치로 더 먹고 싶으면 셀프 코너에서 무제한으로 가져다 먹을 수 있다. 막걸리를 한 잔씩 무료로 제공한다. 주차장이 넓어 이용이 편리하다. 에피타이저로 보리밥을 열무에 비벼 먹을 수 있게 제공한다. 인근에 동백호수공원, 용인시박물관, 석성산 등이 있다.   
※반려동물 동반 불가",
방장산,717051,자연,자연관광지,산,,전북특별자치도,126.7471482953,35.4562064319,"방장산은 고창 지역에서 가장 높은(734m) 산으로 지리산·무등산과 함께 호남의 삼신산으로 추앙받아 왔다. 4개의 봉우리로 이루어진 방장산은 중국 삼신산의 하나에서 빌려온 이름으로 [산이 넓고 커서 백성을 감싸준다]는 뜻이다. 예전에는 이 산을 방등산 또는 반등산으로 불렀다. 반등산은 산이 높고 장엄해서 절반 밖에 오르지 못한다는 의미다. 그러나 조선 인조 때 청나라에게 멸망한 명나라를 숭상하던 조선 사대부들이 중국 삼신산의 하나인 방장산을 닮았다는 이유로 이름을 방장산으로 고쳤다.
방장산을 둘러볼 수 있는 산행 코스는 두 가지이다. 1코스는 양고살재-방장사-579봉-벽오봉-고창고개-방장산-문바위재-봉수대-서래봉-장성 갈재의 구간으로 거리는 12.8㎞이며, 5시간 30분 정도 소요된다. 2코스는 장성갈재-734봉-725봉-방장산-고창고개-벽오봉-고창수월공설운동장으로 5시간 정도 소요된다.
방장산에는 상원사와 방장산자연휴양림이 자리 잡고 있다.","<a href=""http://gochang.grandculture.net/gochang/toc/GC02800060"" target=""_blank"" title=""새창 : 홈페이지로 이동"">http://gochang.grandculture.net</a>"
방주교회,2663244,인문(문화/예술/역사),역사관광지,종교성지,,제주특별자치도,126.3877920933,33.3051886051,"재일 교포 건축가로 일본과 한국에서 주로 활동하면서 건축물이 세워질 장소의 고유한 풍토, 지역성을 살려 인간의 삶에 어우러지는 건축을 추구하는 이타미 준(유동룡)이 노아의 방주를 모티브로 설계한 교회로, 아름다운 건축물로 유명하다. 
나무와 징크 소재의 메탈로 2009년 3월 16일 건립되었다. 인공 수조를 조성해 건물이 물 위에 떠 있는 듯한 느낌을 주며, 그 모습이 푸른 잔디밭, 파란 하늘과 잘 어울려 건축물과 자연의 조화로움을 뽐낸다. 2010년에 건축물 대상을 수상하였고 사진 촬영 명소로 알려져 많은 사람들이 찾고 있다. 예배를 드리는 교회이고 종교적인 장소인 만큼 예배 시간 관람은 허용하지 않으니 관람 시 주의가 필요하다.","<a href=""http://www.bangjuchurch.org/pages.php?p=4_1_1_1"" target=""_blank"" title=""새창 : 홈페이지로 이동"">http://www.bangjuchurch.org</a>"
방죽공원,2781847,인문(문화/예술/역사),휴양관광지,공원,http://tong.visitkorea.or.kr/cms/resource/50/2781950_image2_1.jpg,경기도,127.0514956599,37.244753988,"방죽공원은 수원시 영통구에 위치한 도심 공원이다.
여름에는 어린이들을 위한 물놀이 시설을 이용할 수 있다.
산책로와 아이들이 뛰어놀 수 있는 곳곳의 어린이 놀이시설이 있으며, 팔각정도 있어 주민들이 편하게 쉴 수 있는 공간이다.",
방죽포해변,126282,자연,자연관광지,해수욕장,,전라남도,127.7927326622,34.6306200749,"방죽포해변은 돌산도의 동쪽 해안에 항아리 속처럼 오목하게 자리 잡은 길이 150m, 폭 30m의 작은 해변이다. 이곳은 조선시대에 간척지를 만들기 위해 둑으로 둘러막고 방풍림을 조성하게 되면서 모래가 쌓인 것이 해수욕장이 된 곳이다. 파도가 세지 않고 수심과 경사도가 낮아 가족 단위 이용에 좋다. 또한 해수욕장 주변은 바다낚시의 포인트로 잘 알려져 있는 곳으로 장어, 돔, 노래미 등을 낚을 수 있다. 해변 주변으로는 200여 년생 해송 150여 그루가 울창한 숲을 이루고 있어 그늘에서 휴식을 취할 수 있으며, 대형 주차장과 화장실 등 편의 시설도 잘 갖추어져 있다.","<a href=""https://www.yeosu.go.kr/tour/travel/island_beach?mode=view&idx=283"" target=""_blank"" title=""새창 : 여수시 문화관광 홈페이지로 이동"">https://www.yeosu.go.kr/tour/</a>"
방진관,3025397,인문(문화/예술/역사),문화시설,기념관,http://tong.visitkorea.or.kr/cms/resource/90/3025390_image2_1.jpg,전라남도,127.0806997836,34.7735446681,"방진[方震]은 충무공 이순신의 장인이자 선조 초에 보성군수를 역임하였고 활을 잘 쏘기로 이름이 높아 역대 명궁으로 이름을 날렸다. 특별히 조선 선조대에 명궁사들이 많아 충무공 이순신과 함께 이름을 남겼다. 그에게는 부인 황 씨와 딸, 아들 숙주가 있었다. 어린 시절을 보성에서 보낸 방진의 딸은 두 살 위의 이순신과 1565년에 혼인하였고, 부인 방 씨는 영특하기가 남달랐으며 전쟁에 나간 이순신을 내조하여 집안을 돌보았다. 이순신이 전사한 후 방 씨 부인은 정경부인의 품계를 받아 80세를 누렸다. 
2015년 보성군은 한국 여성상의 표상인 방씨 부인과 그의 아버지 방진의 뜻을 기리며 보성군민의 자긍심과 지역의 정체성을 드높이고자 역사교육 방진관을 개관하였다. 방진관 입구 옆 담에는 충무공 이순신의 보성에서의 10일간 행적을 벽화로 조성하였으며, 방진관에도 보성과 연관 있는 난중일기 등 이순신 장군과 관련된 기록들이 전시되어 있다. 
문화관광 해설사 신청은 관람일 3일 전까지 전화로 예약 시에만 이용이 가능하다.","<a href=""https://www.boseong.go.kr/tour/theme/coursetour?mode=view&idx=83"" target=""_blank"" title=""새창 : 홈페이지로 이동"">https://www.boseong.go.kr/tour</a>"
방천가족족발&보쌈,2840766,음식,음식점,한식,http://tong.visitkorea.or.kr/cms/resource/51/2840751_image2_1.jpg,대구광역시,128.6060258571,35.8618766554,"방천 가족 족발&보쌈은 대구광역시 중구 대봉동 경대병원역 인근에 위치해 있다. 이곳은 족발과 보쌈 전문점으로,  족발을 만들 때 캐러멜 대신 100% 한약재만 사용한다. 대표 메뉴는 반반 족발 세트다. 이 밖에 가족족발 쟁반세트, 가족 족발, 쟁반국수 등을 맛볼 수 있으며, 포장과 배달 모두 가능하다.",
방천시장,2650890,쇼핑,쇼핑,상설시장,http://tong.visitkorea.or.kr/cms/resource/03/2668203_image2_1.jpg,대구광역시,128.6060480689,35.8621793994,"대구 도심을 남북으로 통과하는 신천(新川)에 놓인 12개의 다리 중 하나인 수성교 옆에 자리 잡고 있는 재래시장이다. 1945년 광복 후 일본과 만주 등지에서 돌아온 전재민(戰災民)들이 호구지책으로 장사를 시작하면서 생긴 시장으로, 신천제방을 따라 터를 잡았다 하여 방천시장이라 불리기 시작했다. 당시 수성교에서 남쪽으로 방천을 따라 약 500m에 걸쳐 형성되었으며, 상인들이 새끼줄을 이용해 ‘井’자 모양으로 시장을 구획하여 복잡한 시장을 정리하였다 한다. 주로 채소·과일·곡물 등의 식품류와 잡화를 취급한다.","<a href=""https://www.jung.daegu.kr/new/culture/pages/main/"" target=""_blank"" title=""새창 : 대구 중구 문화관광 홈페이지로 이동"">https://www.jung.daegu.kr/new/culture/</a>"
방촌유물전시관,705088,인문(문화/예술/역사),문화시설,전시관,http://tong.visitkorea.or.kr/cms/resource/09/1374109_image2_1.jpg,전라남도,126.9432867618,34.5509784424,"호남 실학의 대가 존재 위백규 선생의 유물과 장흥 위씨 집성촌으로 고려 말 고읍지였던 방촌 마을의 유물을 보존 관리 하기 위하여 방촌유물전시관을 설립하였다. 방촌유물전시관에는 농경과 주거, 음식과 복식문화, 놀이문화, 세시풍속 등의 유물이 전시되어 있다.","장흥문화관광 <a href=""https://www.jangheung.go.kr/tour/attractions/nature?mode=view&idx=467"" target=""_blank"" title=""새창 : 장흥 문화관광 홈페이지로 이동"">http://www.jangheung.go.kr/tour</a>"
방촌종합시장,2745614,쇼핑,쇼핑,상설시장,http://tong.visitkorea.or.kr/cms/resource/81/2746281_image2_1.jpg,대구광역시,128.664428503,35.8813671952,"방촌 종합시장은 상가건물형 시장이다. 시장 천장에는 아케이드를 설치해 날씨에 관계없이 연중 장보기에 나설 수 있다. 시장에는 각종 먹거리를 비롯해 채소류, 생선류, 육류, 의류, 생활용품 등을 파는 상점이 들어찼다. 특히 이곳의 명물은 떡볶이로, 시장 내부에 떡볶이 골목이 자리 잡고 있다.<br>*사진 출처: 대구시 동구청",
방축도,126296,자연,자연관광지,섬,,전북특별자치도,126.3753048086,35.8506858425,"고군산군도의 북서쪽에 위치하여 방파제 역할을 한다고 하여 방축도라 불린다. 섬 주변은 암석이 많고, 수심이 얕아 조류가 거세고 파도가 강한 편이지만 바다 낚시하기에는 좋은 여건을 가지고 있기 때문에 낚시꾼들의 발길이 끊이지 않으며, 특히 농어가 많이 잡힌다. 섬의 뱃길은 멀지만 바다낚시터를 찾아 사람이 몰려든다. 독립문바위와 시루떡바위 등 기암괴석을 구경할 수 있다. 방축도 마을 뒷산에서 1기와 7기의 고인돌(지석묘)이 발견되어 고고학적인 가치가 있는 섬이다. 이웃하고 있는 횡경도의 경치 또한 아름답다.

(출처 : 군산시 문화관광 홈페이지)","<a href=""https://www.gunsan.go.kr/tour/m2212""target=""_blank"" title=""새창 : 군산 문화관광"">https://www.gunsan.go.kr/tour</a>"
방축도 출렁 다리,3026405,인문(문화/예술/역사),건축/조형물,다리/대교,,전북특별자치도,126.37253565,35.8491720807,"방축도 출렁다리는 방축도와 광대도를 잇는 길이 83M의 인도교이다. 고군산군도의 선유도 서쪽 끝자락에 위치한 5개섬 방축도-명동-보농도-말도를 잇는 4개의 인도교 중의 하나이다. 무인섬인 광대도와 유인섬인 방축도를 연결한 출렁다리는 동백숲길과 곳곳의 작은 해변 산책로와 어우러져 트레킹하기 좋은 여건을 갖추고 있으며, 다리 위에서는 고군산군도의 명물인 독립문바위를 조망할 수 있다. 
방축도는 고군산군도의 북서쪽에 위치하여 방파제 역할을 한다고 하여 방축도라 불린다. 섬 주변은 암석이 많고, 수심이 얕아 조류가 거세고 파도가 강한 편이지만 바다 낚시하기에는 좋은 여건을 가지고 있기 때문에 낚시꾼들의 발길이 끊이지 않으며, 특히 농어가 많이 잡힌다.",
방축천 음악분수,2758638,인문(문화/예술/역사),건축/조형물,분수,,세종특별자치시,127.2572170971,36.4993463039,"방축전 음악 분수는 세종시 어진동 방축천 수변공원 내에 있다. 신나는 노래와 아름다운 조명이 함께 어우러져 어두운 밤을 화려하게 밝힌다. 아이들과 함께 또는 연인과 데이트 장소로도 손색이 없다. 음악 분수가 있는 방축천 수변공원에는 수변식물 테마공원, 세종광장, 자연 생태학습장 등의 시설이 갖춰져 있다.",
방코,2840921,음식,음식점,서양식,http://tong.visitkorea.or.kr/cms/resource/13/2840913_image2_1.jpg,부산광역시,128.922240915,35.1154581808,"부산광역시 강서구 명지동 화덕피자 맛집 방코는 낙동강 하굿둑을 지나서 명지에 들어오자마자 초입에 있다. 빨간 벽돌의 둥근 외벽이 마치 화덕을 닮은 듯한 독특한 구조의 건축물과 갤러리를 연상시키는 깔끔하고 모던한 실내 공간에서 재즈 클래식을 들으며 특별한 식사를 즐길 수 있다. 화덕피자와 함께 와인, 맥주를 즐길 수 있는 피자집이며 내부에 건물 모양과 닮은 화덕이 있다. 중앙 정원이 통유리로 보이고 그 주위로 테이블이 배치되어 있다. 이태리식 다양한 피자와 파스타를 맛볼 수 있는 방코는 실내 인테리어 특성상 위험 요소가 있어 노키즈 존이며 브레이크 타임도 긴 편이어서 미리 확인하고 방문하길 권한다.",
방태산,127499,자연,자연관광지,산,http://tong.visitkorea.or.kr/cms/resource/79/3357579_image2_1.jpg,강원특별자치도,128.3962310388,37.9438728399,"방태산은 강원도 인제군 기린면 방동리에 위치하고 있으며, 인제군과 홍천군의 경계를 이루는 산이다. 북쪽으로 설악산, 점봉산, 남쪽으로 개인산과 접하고 있다. 사방이 긴 능선과 깊은 골짜기를 뻗고 있는 풍광이 뛰어나 ‘정감록’이라는 책에도 이 산의 오묘한 산세에 대해 여러 번 언급되어 있다. 교통이 불편한 관계로 아직도 오염되지 않은 깨끗한 계곡을 간직하고 있으며, 아침가리골의 짙푸른 물은 암반 위를 구슬처럼 굴러떨어지고, 적가리 골은 펼쳐진 부채 같은 독특한 땅 모양을 가지고 있다.

멀리서 보기에 주걱처럼 생겼다고 하여 이름 붙여진 주걱봉(1,443m)과 구룡덕봉(1,338m)을 근원지로 하고 있으며, 또한 방태산에는 방태산자연휴양림이 조성되어 있으며 수량이 풍부하고 특히 마당바위와 2단 폭포는 절경이다. 피나무, 박달, 소나무, 참나무류 등 수종이 다양하여 계절에 따른 자연경관이 수려하고 뿐만 아니라 열목어, 메기, 등의 물고기와 멧돼지, 토끼, 꿩, 노루, 다람쥐 등의 많은 야생동물도 서식하고 있다.

정상인 주걱봉 서남쪽 아래엔, 청정한 자연림 사이로 개인약수가 자리 잡고 있다. 톡 쏘는 물맛으로 유명한 개인약수는 1891년 지덕삼(함북인)이 수도 생활을 하던 중 발견하였다고 전해진다. 방태산은 여름철에는 하늘이 보이지 않을 정도로 울창한 수림과 차가운 계곡물 때문에 계곡 피서지로 적격이고 가을이면 방태산의 비경인 적가리골과 골안골, 용늪골, 개인동계곡은 단풍이 만발한다. 정상에 서면 구룡덕봉(1388), 연석산(1321), 응복산(1156), 가칠봉(1240) 등이 한눈에 들어온다.","<a href=""http://tour.inje.go.kr/"" target=""_blank"" title=""인제 관광문화 사이트로 이동"">http://tour.inje.go.kr</a>"
방태산 솔마루 오토캠핑장,2761869,레포츠,육상 레포츠,"야영장,오토캠핑장",http://tong.visitkorea.or.kr/cms/resource/05/2762305_image2_1.JPG,강원특별자치도,128.3814075191,37.9393980753,"방태산자연휴양림 입구 마을에 위치한 펜션 & 오토캠핑장이다. 양양 낙산, 속초, 주문진 등 동해안이 인접해 30~40분대 소요시간으로 접할 수 있어 낮에는 시원한 동해바다에서 즐기고, 밤에는 방태산의 신선한 계곡의 울창한 산림에서 산림욕을 접할 수 있는 곳이다. 입실시간은 오후 2시부터 10시까지 가능하고 10시 이후 입실은 불가하다. 퇴실시간은 다음날 11시까지인데 당일 해당 객실 및 사이트 예약자가 없을 경우 시간당 10,000원의 추가비용 납부 하면 사용할 수 있다. 매너타임은 오후 10시부터 오전 8시까지 이며 주변 이용객의 민원 발생 시 강제퇴출 조치 또는 불이익을 받을 수 있으므로 주의해야 한다.",
방태산 자연휴양림 캠핑장,2761876,레포츠,육상 레포츠,"야영장,오토캠핑장",http://tong.visitkorea.or.kr/cms/resource/22/2762322_image2_1.JPG,강원특별자치도,128.3997036058,37.9222976343,방태산자연휴양림은 인제와 홍천의 경계를 이루는 해발 1433m의 방태산에 있는데 주변에 1000m가 넘는 고봉들이 즐비해 진입하는 길이 만만치 않다. 그만큼 아름다운 계곡과 능선을 자랑한다. 오토캠프장엔 아름드리나무 사이로 야영데크까지 갖추고 있다. 50개의 야영데크가 있고 별도 야영장이 2곳 있다. 야외화장실과 음수대 야외 샤워장 등을 갖추고 있으며 생태관찰로와 10.2km의 등산로도 있다.,"<a href=""https://www.foresttrip.go.kr/indvz/main.do?hmpgId=0109""target=""_blank"" title=""새창:  방태산자연휴양림 홈페이지로 이동"">https://www.foresttrip.go.kr/</a>"
방태산황토펜션,138713,숙박,숙박시설,펜션,http://tong.visitkorea.or.kr/cms/resource/78/2490378_image2_1.JPG,강원특별자치도,128.3828657341,37.938945378,"산과 계곡으로 둘러싸인 최고의 청정지역 강원 인제군에 황토로 지은 집으로 여름엔 시원하고 겨울엔 따뜻하다. 벽돌로 지은 일반 원룸형 단독콘도도 있다.
일자형 구조로, 지붕은 항아리로 만들고 내부는 천정이 높으며 욕실, 싱크대, 옷걸이 등과 TV, 냉장고, 선풍기, 식기 등을 갖추고 있다.
나무 정자 3개, 철판 고기구이 시설 4개, 수돗가 3곳, 식당 등이 있으며 산에서 직접 호수로 연결한 2개의 물과 지하 100m에서 끌어올린 물 2곳이 있어 시원한 식수를 맛볼 수 있다. 또한  바로 앞 계곡물이어서 시원한 여름을 보낼 수 있다. 주변 볼거리로는 방태산자연휴양림, 내린천래프팅, 아침가리트레킹, 방동약수터, 곰배령 등이 있다.","<a href=""http://www.bangtaesan.com/"" target=""_blank"" title=""새창 : 방태산황토펜션 홈페이지로 이동"">http://www.bangtaesan.com/</a>"
방태산황토펜션식당,135113,음식,음식점,한식,http://tong.visitkorea.or.kr/cms/resource/84/2489984_image2_1.jpg,강원특별자치도,128.3829157278,37.9390009283,"방태산황토펜션식당은 한국에서 가장 큰 자연림이라고 할 정도로 나무들이 울창한 방태산의 품에 안겨 있다. 주변에 방동약수터와 진동계곡, 곰배령, 방태산자연휴양림 등 관광지가 있어 복잡한 도시를 벗어나 자연 그대로의 향기를 느낄 수 있는 곳이다. 직접 재배한 재료만을 사용하는 신토불이 식당으로 ""싱싱일요일"", ""무한지대큐""에 방송된 토속적인 음식점으로 민물매운탕, 엄나무황기백숙, 곤드레밥, 산채비빔밥, 감자전이 유명하다.","<a href=""http://www.bangtaesan.com"" target=""_blank"" title=""새창 : 방태산황토펜션식당으로 이동"">http://www.bangtaesan.com</a>"
방파제회센터,2776856,쇼핑,쇼핑,전문매장/상가,,강원특별자치도,128.8340485083,37.8944592667,"비슷한 규모의 28개 횟집이 모여있는 곳으로, 회를 주문하면 별도 상차림 비용 없이 해산물 등이 제공된다. 원하는 횟감이 있는지 둘러보고 자유롭게 가격과 서비스를 흥정한 후 선택할 수 있다. 가게별로 수족관이 늘어서 있고, 수족관 안쪽으로는 바다를 바라보며 음식을 먹을 수 있는 좌식 테이블이 마련되어 있다. 어느 가게라도 창가 자리에서 보는 바다 전망은 같다. 생선회뿐만 아니라 대게와 조개 등 여러 가지 해산물도 함께 즐길 수 있다.",
