title,contentid,cat1,cat2,cat3,firstimage,region,mapx,mapy,overview,homepage
쿠촐로 테라짜,2903386,음식,음식점,서양식,http://tong.visitkorea.or.kr/cms/resource/74/2903374_image2_1.jpg,서울특별시,127.0423219507,37.5246102637,"쿠촐로 테라짜는 지하철 수인분당선 압구정로데오역 4번 출구 부근에 있다. 매장이 있는 상가건물에 자체 주차장(발레파킹 서비스 가능)이 있어 방문 시 자동차로 이용하기 편리하다. 이곳은 김지운 셰프가 운영하는 이탈리안 포차(마렘마, 볼피노)이다. 매장 내부는 넓은 홀에 인원별 다양한 테이블 구성과 개별 룸까지 있어 단체 행사나 가족 모임에도 적당하다. 대표 메뉴는 오리지날 비프 카르파치오, 산지직송 광어 카르파치오, 쥬키니 후라이가 있다. 이외 메뉴로 시금치 리조또 마란치니, 프리토 미스트, 미니피자가 많이 나간다. 주변에 청담동명품거리, 청담동거리,압구정 로데오 거리가 있어 연계 관광을 할 수 있다.",
쿠치나13Y,2876513,음식,음식점,서양식,,경상북도,128.1655225756,36.5776176457,"쿠치나13Y는 경북 상주에 있는 파스타 전문점이다. 뛰놀거나 걷기에도 좋은 넓은 외부공간이 있고, 건물 내부도 룸 공간과 테이블공간으로 넓게 구성되어있어서 가족단위로 방문하기에도 좋다. 정성스럽게 만들어진 요리 또한도 정갈하고 맛있다.",
쿠캔비어,2642732,음식,음식점,한식,http://tong.visitkorea.or.kr/cms/resource/62/2663662_image2_1.jpg,서울특별시,126.9895421117,37.5709539311,다양한 닭 요리와 한국식 안주 요리를 맛볼 수 있는 곳이다. 대표메뉴는 치킨이다. 서울특별시 종로구에 있는 한식 전문점이다.,
쿠켄,2687672,음식,음식점,서양식,,강원특별자치도,128.885417836,37.7487021433,"쿠켄은 커피와 와인까지 즐길 수 있는 바비큐 전문 레스토랑이다. 복층 구조로 된 실내 공간은 마치 휴양지의 별장에 찾아온 듯한 이국적인 느낌을 준다. 소고기 안심과 폭립, 대하 등의 재료를 바비큐로 즐길 수 있으며, 한식 메뉴인 비빔밥, 양식 메뉴인 돈가스와 그라탕 등의 메뉴도 만나볼 수 있다.",
쿠쿠펫,2951584,음식,음식점,카페/전통찻집,http://tong.visitkorea.or.kr/cms/resource/76/2951576_image2_1.jpg,대전광역시,127.34271925,36.3424269014,"프리미엄 반려동물 복합문화공간으로 4층 애견 동반 카페, 5층 루프탑/애견 수영장, 3층 애견 호텔/애견 유치원/애견 미용실, 2층 동물병원이 한 건물에서 이용이 가능하다. 4층 카페는 고급스럽고 통창으로 된 인테리어로 하천 뷰를 보며 강아지와 커피를 마시는 여유를 즐길 수 있다. 카페 이용 시 5층 루프탑도 함께 이용이 가능해 강아지들이 뛰어 놀기 좋다. 대표 메뉴는 아인슈페너이며 커피는 세계 3위, 국내 1위 로스터의 원두를 사용해 신선하고 밸런스가 좋은 커피를 마실 수 있다. 커피 외에도 에이드, 스무디, 샌드위치, 케이크 등 다양한 메뉴가 있다.","인스타그램<a href=""http://instagram.com/kookoopet_"" target=""_blank"" title=""새창: 쿠쿠펫 인스타그램 홈페이지로 이동"">http://instagram.com/kookoopet_</a><br />쿠쿠펫 <a href=""https://www.dhkookoopet.com/"" target=""_blank"" title=""새창: 쿠쿠펫   홈페이지로 이동"">https://www.dhkookoopet.com/</a>"
쿠키멍스터,2913226,음식,음식점,카페/전통찻집,http://tong.visitkorea.or.kr/cms/resource/04/2919004_image2_1.jpg,강원특별자치도,127.7340487358,37.8778041001,"춘천반려동물문화복합공간강아지 수제 음식을 파는 반려견 동반 카페 쿠키멍스터입니다.반려견을 동반하지 않아도, 반려인이 아니라도모두 환영합니다.편하게 방문해주세요.",
쿠폴라,2807386,음식,음식점,카페/전통찻집,,강원특별자치도,127.7767943925,37.8930531248,"강원도 춘천에 위치한 카페 쿠폴라는 경치 좋은 자연과 앤틱한 분위기가 조화를 이루는 특별한 공간이다. 이 카페는 춘천의 명소 중 하나인 구봉산 전망대 카페거리에 자리 잡고 있어, 탁 트인 풍경을 바라보며 마음의 여유를 찾을 수 있는 힐링 장소로 인기를 끌고 있다.
내부는 고풍스러운 앤틱 인테리어로 꾸며져 있어 방문객들에게 마치 유럽의 작은 카페에 온 듯한 느낌을 준다. 섬세하게 배치된 소품과 우아한 분위기는 커피 한 잔의 여유를 한층 더 특별하게 만들어준다.
카페 쿠폴라에서는 유기농 재료로 만든 베이커리를 다양하게 제공하고 있어 건강한 디저트를 맛볼 수 있다. 신선한 원두로 내린 커피와 함께 즐길 수 있는 빵과 케이크는 단순한 간식이 아닌 정성과 품질을 담은 별미다. 특히, 고소한 크루아상과 촉촉한 타르트는 방문객들에게 꾸준히 사랑받는 인기 메뉴이다.
카페 주변에는 계절마다 다채로운 풍경이 펼쳐져, 봄에는 푸른 산, 가을에는 단풍, 겨울에는 눈 덮인 설경을 감상할 수 있어 사계절 내내 방문할 이유가 충분하다. 조용히 여유를 만끽하거나 소중한 사람과 추억을 쌓기에 더없이 좋은 곳이다.
춘천의 아름다운 자연 속에서 여유롭고 품격 있는 시간을 보내고 싶다면, 카페 쿠폴라에서 특별한 하루를 계획해 보시길.",
쿤스트라운지,2891586,음식,음식점,카페/전통찻집,http://tong.visitkorea.or.kr/cms/resource/11/2877911_image2_1.jpg,경상남도,128.0430259796,34.7978474001,"쿤스트라운지는 남해 독일 마을에 있는 브런치 카페다. 주차장이 넓고, 1층과 2층, 야외 테라스 좌석이 있을 정도로 매장이 넓어 여행객에게 인기가 좋다. 특히 2층 테라스에는 빈백 의자가 파노라마처럼 펼쳐진 남해의 풍경을 바라보며 놓여있어, 바다를 감상하며 휴식 취하기에 좋다. 이곳은 카페 겸 레스토랑으로 커피와 음료 외에도 식사메뉴를 맛볼 수 있다. 대표적인 메뉴는 슈바인 학센으로 맥주에 졸인 돼지다리 살을 오븐에 구워 겉은 바삭하고 속은 부드러운 독일식 족발 요리이다. 다른 메뉴로는 구운 소시지라는 뜻의 튀링어 브랏부어스트가 있는데, 식감과 육즙이 살아있는 대표적인 독일식 소시지 요리다. 이외에도 돼지고기를 얇게 펴 튀겨낸 수제 슈니첼과 이탈리아식 통돼지 바비큐 요리인 포르케타, 유럽에서 대중적인 음식인 미트파이 등 독일과 유럽의 다양한 요리를 맛볼 수 있다.",
쿤하우스,3102115,숙박,숙박시설,게스트하우스,,서울특별시,126.9746328707,37.5528890963,"서울 후암동에 위치한 쿤하우스는 서울역 11번 출구에서 도보 3분 거리에 있어 교통 접근성이 좋다. 숙소는 3개의 방과 화장실로 구성되어 있고, 집안 마당도 있어 상쾌함을 더해준다. 고급 호텔 침구류는 편안함과 아늑한 잠자리를 제공한다. 장기 숙박을 위한 생활 장비도 준비되어 있다. 도보 10분 거리에 남산타워, 롯데마트, 남대문 시장 등이 있어 이동이 편리하다.","<a href=""https://linktr.ee/insul._"" target=""_blank"" title=""쿤하우스(으)로 이동"">https://linktr.ee/insul._/</a>"
쿰다 패스티벌,3377099,인문(문화/예술/역사),축제,일반축제,http://tong.visitkorea.or.kr/cms/resource/98/3377098_image2_1.jpg,제주특별자치도,126.3849664041,33.470631374,"제주시 애월읍 수산리 마을 지역 기반으로 열리는 쿰다 패스티벌 애월 수산봉은 수산봉, 수산저수지, 수산트레킹, 수산올레길의 아름다움을 널리 알리는 제주 도민과 관광객 모두 함께 할 수 있는 지역 기반 축제이다. 제주 관광 기업 드르쿰다에서 후원하고 주최하여 다양한 행사 프로그램과, 축하공연, 사은품 등을 기획했으며, 이번 행사를 통해 애월읍 수산리의 아름다운 자연 경관을 널리 알릴 수 있는 지역 대표 축제가 될 수 있도록 준비했다. 메인 행사인 러닝&트레킹과 상금이 걸린 가요제, 수산봉과 수산저수지를 배경으로 하는 가을 운동회와 직접 참여 할 수 있는 체험 부스 등 적극적인 참가를 도모하는 프로그램들로 구성했다.",
쿵쿵소 캠핑장,2761899,레포츠,육상 레포츠,"야영장,오토캠핑장",http://tong.visitkorea.or.kr/cms/resource/36/2762436_image2_1.JPG,강원특별자치도,128.4215650285,37.6641696435,"쿵쿵소 캠핑장은 강원도 평창군 봉평면에 있다. 흥정계곡 허브나라 근처에 자리 잡고 있으며 휘닉스 파크와 블루캐니언도 그리 멀지 않은 곳에 있다. 조금 더 이동하면 양떼목장과 삼양목장 방문이 가능하다. 숨겨진 명소 쿵쿵소 폭포가 있으며 50개의 각 사이트 옆으로 계곡물이 흐르고 있고, 생체 리듬에 좋다는 해발 700고지에 있다.","<a href=""https://kungkungso.modoo.at/"" target=""_blank"" title=""새창 : 쿵쿵소 캠핑장 사이트로 이동"">https://kungkungso.modoo.at/</a>"
쿼크밸리 캠프,2729935,레포츠,육상 레포츠,"야영장,오토캠핑장",http://tong.visitkorea.or.kr/cms/resource/52/2730152_image2_1.JPG,경기도,127.2941525811,37.691373223,"경기도 남양주 화도읍의 쿼크밸리캠프 캠핑장은 수도권 어디서나 접근성이 좋다는 장점이 있다. 캠핑장 내에 수영장, 계곡, 트램펄린, 어린이 놀이방을 갖추고 있어 어린이 동반 캠핑을 즐기기에 좋다. 플리마켓, 핼러윈, 크리스마스 등 시즌에 맞는 축제와 이벤트가 많아 가족이나 연인의 캠핑장으로 안성맞춤이다. 캠핑장은 위치에 따라서 A캠핑장과 B캠핑장으로 구분되며, A캠핑장은 대부분 파쇄석으로 이뤄져 있지만 별도로 2개의 데크 사이트도 마련돼 있다. 데크는 다른 캠핑장에서 흔히 볼 수 없는 발코니형 테크로 계곡과 가깝고 그늘사이트로 명당이다. 캠핑장 내에 계곡과 어린이 수영장이 있어 여름철 물놀이에도 좋다. 유아나 어린이를 위한 놀이방과 작은 도서관이 갖춰져 있으며 매주 토요일 어린이 영화도 상영한다.","홈페이지 <a href=""https://quarkvalley.camp"" target=""_blank"" title=""새창 : 쿼크밸리캠프 홈페이지로 이동"">https://quarkvalley.camp</a><br>예약사이트 <a href=""https://camfit.co.kr/camp/652f72cebf8111001f21fb68"" target=""_blank"" title=""새창 : 쿼크밸리캠프 예약사이트로 이동"">https://camfit.co.kr/</a>"
쿼크커피바,2932703,음식,음식점,카페/전통찻집,,경상남도,128.8239312957,35.171361227,"김해  아울렛 근처에 위치한 쿼크커피바는 1층에서 에스프레소 바를 운영하고 2층은 따로 카페로 쓰이고 있다. 쿼크커피바라는 이름답게 에스프레소 종류가 많다. 에스프레소 바 맞은편에는 로스팅룸이 있어 로스팅 하는 모습을 볼 수 있으며 1,2층 모두 낮은 조도의 모던한 분위기를 띄고 있다.  2층 커피바에서는 더 다양한 음료를 즐길 수 있다. 시그리너라떼, 전통 차등 익숙하지 않지만 모두 좋아할만한 메뉴들이 준비되어 있다. 또한 소파자리가 마련되어 있는데 그 가운데에는 작은 분수가 있어 물소리를 들으며 커피 한잔을 여유롭게 즐길 수 있다.",
쿼피집,2853132,음식,음식점,카페/전통찻집,http://tong.visitkorea.or.kr/cms/resource/27/2853127_image2_1.jpg,부산광역시,128.9855365256,35.1762664211,"부산 사상구 덕포역 4번 출구에 있는 디저트 카페 쿼피집은 아메리칸 그로서리를 연상케 한다. 2층 작업실에서 직접 만든 다양한 수제 쿠키가 인기 메뉴이며 공장을 리모델링한 곳이어서 인테리어 포인트로 살린 컨베이어벨트 좌석도 유명하다. 오렌지 컬러 아이덴티티가 돋보이는 야외정원엔 캠핑 벤치가 여기저기 놓여 있다. 쿼피집 마스코트인 쿼카 캐릭터가 그려진 머그잔, 접시, 노트, 마스킹테이프 등 귀여운 굿즈들도 판매하고 있다. 소품이 다채롭게 진열되어 있어 사진 찍기에도 좋다. 전용 주차장이 없어 인근 공영 주차장을 이용해야 한다.",
퀴버 서울숲,2894997,음식,음식점,서양식,http://tong.visitkorea.or.kr/cms/resource/88/2894988_image2_1.jpg,서울특별시,127.0443655899,37.5464549847,"퀴버 서울숲은 통유리와 높은 천장으로 개방감이 좋은 다이닝 공간이다. 퀴버만의 시그니처 메뉴는 수비드 목살로 만든 퀴버 스테이크, 퀴버만의 라구소스와 버섯, 부드러운 밀떡으로 재해석한 라구떡볶이 등이 있다. 또, 고소한 피스타치오가 올라간 새우 크림리조또, 구운 관자를 올린 풍미 가득한 오일파스타 등도 인기가 많은 메뉴이다.","<a href=""https://www.instagram.com/quiver_seoul""target=""_blank"" title=""새창 : 퀴버 서울숲 사이트로 이동"">https://www.instagram.com/quiver_seoul</a>"
퀸벨호텔,2377774,숙박,숙박시설,관광호텔,http://tong.visitkorea.or.kr/cms/resource/65/2377765_image2_1.jpg,대구광역시,128.6621675604,35.8824698056,"대구 동구에 위치한 퀸벨호텔은 동대구권의 랜드마크로서의 면모를 갖추고 있으며 또한 품격 높은 호텔웨딩의 명소로 자리잡고 있다. 기존의 일반 호텔과는 차별화된 우아하면서도 격조 높은 객실들로 이루어져 있으며, 컨벤션 및 연회장은 결혼식, 돌잔치, 기업행사 등 대형 행사부터 소규모 가족모임까지 다양하게 할 수 있다. 앞으로도 퀸벨호텔은 품격을 갖추면서도 고객들에게 감동을 선사하기 위해 늘 변화하는 최고의 호텔이 될 것이다.","<a href=""http://www.queenvell.com"" target=""_blank"" title=""새창 : 퀸벨호텔 홈페이지로 이동"">http://www.queenvell.com"
퀸스가든펜션,2760679,숙박,숙박시설,펜션,http://tong.visitkorea.or.kr/cms/resource/85/3422685_image2_1.jpg,강원특별자치도,128.7243650179,37.6798264276,"대관령 해발 770m 정상에 위치한 퀸스가든펜션은 자연의 아름다움과 편안한 휴식을 위해 호텔식 침구관리로 더욱 깨끗한 아침과 함께 내 집 같은 편안함과 그림 같은 정원에서의 쉼과 추억을 제공한다. 드립커피, 오븐, 전자레인지, 토스트기, 유아용 의자 등이 배치된 카페동에서는 간단한 유료차와 투숙객을 위한 무료 조식 서비스가 제공되며 음악 감상과 독서를 할 수 있다. 공방체험 또한 가능하다. 펜션 근처에 계곡이 흐르며 양떼목장, 하늘목장 등 평창 유명 관광지 접근성이 좋다.","<a href=""http://queensgarden.co.kr/"" target=""_blank"" title=""새창 : 퀸스가든펜션 홈페이지로 이동"">http://queensgarden.co.kr/</a>"
퀸스로드,2366429,인문(문화/예술/역사),체험관광지,이색거리,http://tong.visitkorea.or.kr/cms/resource/33/2366433_image2_1.jpg,대구광역시,128.545056233,35.8617144394,"구 대구 도축장 자리에 2003년 스트리트형 패션 아울렛 단지로 개점하여, 현재 100여 개의 유명 브랜드 업소가 입주해 있다. 쇼핑 뿐 만 아니라 문화생활을 동시에 즐길 수 있는 복합문화공간으로 유럽풍의 건물과 5천여 평에 이르는 부지에 지하 2층, 지상 3층의 11개 건물로 군집해 있다.",
퀸스비치,2575850,숙박,숙박시설,펜션,http://tong.visitkorea.or.kr/cms/resource/65/2575665_image2_1.jpg,인천광역시,126.5183104175,37.2579069336,퀸스비치에서는 펜션의 편리함과 글램핑의 낭만을 동시에 즐길 수 있다. 수려한 풍광속에 자리잡은 럭셔리한 시설과 친절한 운영은 방문객들을 감동시킬 수 있을 것이다.,"<a href=""http://www.queensbeach.co.kr/fhtml/""target=""_blank"">http://www.queensbeach.co.kr/fhtml/<a/>"
퀸스타운,2753810,음식,음식점,서양식,http://tong.visitkorea.or.kr/cms/resource/23/2753823_image2_1.jpg,경기도,127.0943761832,37.2062147699,동탄역 인근 브런치 카페이다. 뉴질랜드 및 호주 스타일의 브런치와 파스타를 판매한다. 이탈리아산 '킴보'원두를 사용하며 호주 'T2' 차를 제공한다. 생커피콩 껍질 허스크로 만들어진 친환경 디자인컵 '허스키컵'을 사용한다.  뉴질랜드 파넬에서 2011년 'RHYTHM COFFEE LTD'로 카페를 시작하여 2020년 동탄에 퀸스타운을 오픈했다.,
퀸승마클럽 (구. 호스랜드 운악승마클럽),131870,레포츠,육상 레포츠,승마,http://tong.visitkorea.or.kr/cms/resource/72/1900072_image2_1.jpg,경기도,126.9256102373,37.2312005368,퀸승마클럽은 넓고 쾌적한 자연환경과 더불어 살아 숨쉬는 동물과 호흡하는 최고의 마장과 아름다운 외승코스를 갖추고 있다.<br>,"<a href=""https://cafe.naver.com/queenhorseriding/155"" target=""_blank"" title=""새창 : 퀸승마클럽 카페 페이지로 이동"">https://cafe.naver.com/queenhorseriding/155</a>"
퀸즈크라운베이커리카페,2766485,음식,음식점,카페/전통찻집,http://tong.visitkorea.or.kr/cms/resource/28/2766728_image2_1.jpg,대구광역시,128.5556412216,35.8685499711,"퀸즈크라운베이커리카페는 대구시 서구 평리4동에 자리 잡고 있다. 대표 메뉴는 마늘 바케트와 페스츄리앙버터 등 각종 베이커리다. 이곳의 빵은 유기농 밀가루를 천연 발효 시켜 만들며, 당일 생산과 당일 판매를 원칙으로 하고 있다. 베이커리 종류 이외에 각종 음료도 판다. 내부에는 단체석이 마련되어 있어 각종 모임을 하기 좋다.",
퀸크루즈 리조텔 콘도,138941,숙박,숙박시설,콘도미니엄,http://tong.visitkorea.or.kr/cms/resource/20/1981420_image2_1.jpg,경상남도,128.6425743124,34.7767576394,"거제도의 명소, 학동 몽돌해변에 위치한 퀸크루즈 리조텔은 건물의 외형을 바다를 향해 달리는 배의 형상으로 건축하였다. 학동 몽돌해변과 이웃해 있는  퀸크루즈 리조텔은  정면으로는 학동 몽돌해변을 뒤로는 노자산을 배경으로 자리하여 탁월한 전망을 자랑하고 있으며 깨끗한 시설과 건축미학의 아름다움을 간직한 리조텔이다.
외도, 거제도 여행에 있어  전국적인 명소 학동 몽돌해변, 노자산 자연 휴양림, 갯바위 섬에서의 낚시, MBC 드라마 ‘로망스’, ‘물의 나라’, ‘회전목마’, SK주유소 CF의 촬영 장소였던 신선대에 인접하고 있다.",
퀸타운호텔,3075075,숙박,숙박시설,관광호텔,,경기도,126.7730816437,37.6574122248,"일산 퀸타운호텔은 3호선 정발산역에서 도보 2분 거리에 위치하고 있다. 보통의 경우 건물 전체를 호텔로 쓰는 반면 이곳은 건물 8층에서 10층까지가 호텔로 쓰이고 있다. 호텔 안에는 카페테리아가 있어서 커피나 음료를 마실 수 있다.
또한 스낵바가 있어서 마실 것과 간식거리도 챙겨갈 수 있고 술과 안주를 판매하는 곳도 있어 객실에 들어갈 때 사갈 수 있다. 근처에 도로망과 교통편이 다양하여 자가용 및 대중교통으로 오기에 매우 편리한 곳이다.
이곳은 일산 킨텍스와 인접하고 있어 일반인은 물론 비즈니스 업무로 온 사람들이 이용하고 있다. 건물의 일부만 사용한 호텔인데도 룸 컨디션이 기대 이상이라는 평이 많다.
욕실에는 욕조뿐 아니라 샤워부스와 변기도 구분되어 있고 일회용품도 넉넉히 있어서 준비 없이 투숙하여도 지장이 없다. 객실에 컴퓨터가 있어서 못다 한 업무나 게임을 할 수도 있다. 충전기 등 이것저것 서비스로 비치해 놓은 것들이 많아 편안하게 묵을 수 있다.
근처 관광지나 명소로는 킨텍스, 일산 호수공원, 웨스턴 돔, 북한산국립공원, 장항습지, 일산 차병원, 국립 암센터 등이 있어서 업무나 투숙 후 둘러보면 좋다.","<a href=""http://queentownhotel.com/index.php"" target=""_blank"" title=""새창 : 홈페이지로 이동"">http://queentownhotel.com</a>"
퀸프라자,1013415,쇼핑,쇼핑,전문매장/상가,http://tong.visitkorea.or.kr/cms/resource/63/1015063_image2_1.jpg,서울특별시,126.9781046023,37.5590467765,퀸프라자는 모든 연령대의 남녀노소 누구나 취향에 맞는 의류를 구입하기 좋은 곳이다. 수많은 매장들로 이루어져 있는 퀸프라자에는 가족단위로 쇼핑을 즐기는 관광객들이 많다. 더욱이 3층에 위치한 명품점에서는 각종 명품 의류와 액세서리 등을 만나 볼 수 있다.,
퀸호텔,2582751,숙박,숙박시설,모텔,,전라남도,126.4333479044,34.7973423339,"목포 퀸모텔은 목포의 관광지 평화광장에 위치한 가족호텔이다. 위생과 청결을 우선시하여 쾌적하게 머무를 수 있다. 전객실 65인치 스마트티비, PC가 설치되어 있어 편안하게 묵어가기 좋다. 
(정보제공자: 목포시청)",
큐(Q)호텔,1156542,숙박,숙박시설,모텔,http://tong.visitkorea.or.kr/cms/resource/56/1159856_image2_1.jpg,경기도,127.2160295547,37.2870131589,"경기도 용인 큐(Q)호텔은 에버랜드 정문 주차장 200M 앞에 위치하고 있으며 모텔의 편리함과 펜션의 아늑함을 동시에 느낄수 있는 퓨전호텔이다.
각각의 객실은 서로 다른 테마로 인테리어 되어있으며 최신 집기와 시설이 편리성을 더한다. 특히 전 객실에 인터넷이 연결된 PC가 설치되어 있어 웹서핑 및 최신 VOD로 영화를 감상할 수 있다. 또 룸서비스와 스낵 서비스가 제공된다.
에버랜드가 인접해 있어 테마파크 구경과 캐리비안베이를 이용하기 용이하며 지리산 리조트, 곤지암리조트 등의 스키장과 한국민속촌, 호암미술관이 가까운 편이다.",
큐리키즈카페 송산신도시점,3017576,음식,음식점,카페/전통찻집,http://tong.visitkorea.or.kr/cms/resource/94/3004194_image2_1.jpg,경기도,126.8185462998,37.2830759614,"송산 신도시에 위치한 큐리키즈카페는 8세 이하의 아동들만 사용하는 시설로 키 130cm 이상의 어린이들은 입장에 제한이 있는 영유아들을 위한 키즈카페이다. 키즈카페는 복층 형식으로 이루져있으며, 24개월 미만 아이들만 사용할 수 있는 베이비존이 있다.
베이비존 내에는 어린이들을 위한 볼풀장과 침대, 소서, 졸리점퍼, 장난감 등이 있어 큰 아이들과 분리되어 안전하게 놀 수 있다. 큰 미끄럼트과 넓은 볼풀존, 벌집정글짐, 트램펄린이 있고, 작은 트램필린 옆에는 작은 암벽등반도 할 수 있는 공간이 있다.
아이들이 좋아하는 주방놀이가 가득한 키친 존, 알록달록 큼지막한 블럭들이 있는 블럭존, 편백나무존, 메이크업존, 동물병원존, 몬스터존 등 다양한 테마의 놀이공간이 분리되어 꾸며져 있다. 복층으로 올라가면 큰 텐트가 있어 캠핑 놀이가 가능한 캠핑존, 낚시놀이, 블록과 공룡 탈것들을 마음껏 이용할 수 있다. 키즈카페 한쪽으로는 식당이 있는데 아기의자와 셀프 바가 있어 이용하기 편하며, 만화책과 안마의자, 레트로 오락기가 있어 어른들도 충분히 즐길 수 있다. 
수노을중앙공원과 인접해있어 건물 내 주차가 어려울 경우 수노을중앙공원 주차장을 이용하면 좋다.","<a href=""https://www.instagram.com/qrikids/"" target=""_blank"" title=""새창 : 홈페이지로 이동"">https://www.instagram.com/qrikids</a>"
큐모텔,627320,숙박,숙박시설,모텔,http://tong.visitkorea.or.kr/cms/resource/92/588892_image2_1.jpg,강원특별자치도,127.7345904121,37.8758265627,"모텔 큐는 춘천시 팔호광장 인근에 위치한 지상 5층의 모텔이다. 춘천시내 중심가에 위치하여 이동이 편리하고 고급스러운 객실 내부와 품격 있는 서비스를 제공한다. 도청, 시청 등 주요 관공서와 극장, 먹을거리 등이 인접해있어 비즈니스 목적으로 춘천을 찾는 여행객들이 숙박하기 좋은 곳이다.",
큐브 게스트하우스,2572829,숙박,숙박시설,게스트하우스,http://tong.visitkorea.or.kr/cms/resource/55/2571555_image2_1.jpg,서울특별시,126.9920595457,37.5357636211,"#본 업소는 외국인관광 도시민박업으로 외국인만 이용이 가능하며 내국인은 이용할 수 없습니다.

큐브 게스트하우스는 이태원역에서 도보로 5분 거리에 위치하고 있다. 그리고 도시 중심이기 때문에 대중교통을 이용하기 매우 편리하며, 서울을 둘러보기에도 안성맞춤이다.",http://www.icecube.land/
