title,contentid,cat1,cat2,cat3,firstimage,region,mapx,mapy,overview,homepage
여수 앞바다에 펼쳐진 크고 작은 섬들,1968524,추천코스,나홀로코스,나홀로코스,http://tong.visitkorea.or.kr/cms/resource/96/678896_image2_1.jpg,Unknown,127.8040048886,34.5916329613,여수 앞바다에는 크고 작은 섬들이 그림처럼 펼쳐져 있다. 백제 때 지어진 고찰 향일암을 돌아 봉황의 전설이 깃든 오동도 등대를 거친다. 무엇보다 여수는 충무공의 흔적이 그대로 남아있는 임진란의 요충지라 할 수 있겠다. 이충무공의 흔적을 찾아 돌아본다.,
여수 앞바다와 이순신 유적지를 찾아 떠나는 여행,2371903,추천코스,가족코스,가족코스,http://tong.visitkorea.or.kr/cms/resource/67/1607867_image2_1.jpg,Unknown,127.7670431134,34.7449679469,여수의 앞바다는 밤바다로 유명하다. 그리고 우리가 너무도 잘 알고 사랑하는 이순신 장군의 행적지를 따라가 볼 수 있는 역사적인 여행으로도 의의가 있을 것이다. 아이에게 바다를 공부하게 할 수 있는 좋은 코스다.,
여수 야경불꽃크루즈,2494465,인문(문화/예술/역사),공연/행사,기타행사,http://tong.visitkorea.or.kr/cms/resource/78/3084378_image2_1.jpg,전라남도,127.7369794626,34.7297302429,"여수밤바다의 아름다운 야경과 함께 즐기는 로맨틱 불꽃축제.<br>음악이 흐르고 밤하늘은 형형색색 눈부신 불꽃으로 물드는, 사랑하는 사람에게 꼭 한번 보여주고 싶은 감동적인 불꽃쇼이다.","<a href=""http://cruisestory.co.kr"" target=""_blank"" title=""새창: 크루즈스토리 홈페이지로 이동"">http://cruisestory.co.kr</a>"
여수 연안여객선터미널,2752379,인문(문화/예술/역사),휴양관광지,유람선/잠수함관광,,전라남도,127.7325935121,34.7385041848,"1982년에 건립된 여수 연안여객선 터미널은 9개 해운사의 여객선 17척이  백야도, 금오도, 고흥 외나로도, 거문도로 가는 배편을 운항하고 있다.  여수를 대표하는 여객 터미널인 만큼 주차공간도 넉넉하고, 수용 가능 인원도 약 1,000명에 이를 만큼 실내 공간도 넓다. 또 터미널 내에 무인민원발급기도 있어 신분증을 소지하지 않아 승선 못하는 상황을 막을 수 있다.  여수의 아름다운 다리로 꼽히는 거북선대교, 돌산대교를 볼 수 있으며 가까이에 여수 수산시장이 있다.",
여수 유월드 루지 테마파크,2662524,레포츠,육상 레포츠,트래킹,http://tong.visitkorea.or.kr/cms/resource/83/3350883_image2_1.jpg,전라남도,127.6416234554,34.7478349006,"친구, 연인, 가족 모두가 가슴이 뻥 뚫리는 스릴을 경험할 수 있는 레이싱의 장, 여수 유월드 테마파크는 루지, 놀이공원, 실내 키즈파크, 테디베어 뮤지엄, 비비탄 사격장, 레이저 아레나를 모두 한 곳에서 즐길 수 있는 멀티플렉스 테마파크이다. 이곳에 위치한 루지 테마파크는 국내 최초로 지상 7m 높이에서 길이 1.3km에 달하는 하늘을 달리는 스카이 트랙에서 스피드와 스릴을 만끽할 수 있다. 내면의 질주 본능을 깨우는 루지 체험은 리프트를 타고 더욱 높은 기분을 선사한다. 전혀 뻔하지 않은 'FUN'한 데이트로 텐션을 올리기에 완벽한 여행 코스로도 인기있는 곳이다.","<a href=""http://u-world.kr/
""target=""_blank"" title=""새창: 여수 U월드 루지 테마파크"">http://u-world.kr/
</a>"
여수 유탑 마리나 호텔&리조트,2823571,숙박,숙박시설,서비스드레지던스,http://tong.visitkorea.or.kr/cms/resource/25/2823725_image2_1.jpg,전라남도,127.7506417828,34.744451054,"[여수 바다를 품다!]
여수 엑스포 유탑 마리나 호텔 & 리조트는 대한민국 대표 관광도시 여수의 눈부신 바다와 마주하고 있다. 전 객실 테라스를 통해 아름다운 여수 바다의 낮과 밤을 누릴 수 있으며 어느 곳에서도 느낄 수 없었던 최상의 서비스와 품질로 여행의 의미를 더하였다.

[자연에서 영감을 얻다!]
해양 도시 여수 바다의 파도 물결과 요트에서 영감을 받아 설계된 여수 엑스포 유탑 마리나 호텔 & 리조트는 세련된 입면 디자인을 자랑한다. 여수를 상징하는 입면 디자인과 유선형의 포디움 디자인으로 개관 전부터 2019 미래건축대상 호텔부분 단독수상의 영예를 안으며 그 가치를 다시 한 번 재조명 받았다.","<a href=""https://www.utopmarina.com/"" target=""_blank"" title=""새창: 여수 유탑 마리나 호텔&리조트 홈페이지로 이동"">https://www.utopmarina.com/</a>"
여수 장도근린공원 / 장도전시관,3351485,인문(문화/예술/역사),휴양관광지,공원,http://tong.visitkorea.or.kr/cms/resource/35/3381035_image2_1.jpg,전라남도,127.6639160892,34.7422914618,"여수 장도근린공원은 2017년 GS칼텍스가 지역사회 공헌사업으로 착공하고 2019년 개방한 섬이다. 섬에는 하루에 두번 물에 잠기는 진섬다리, 창의적 작품활동이 이루어지는 창작스튜디오, 그리고 장도도서관이 있다.",
여수 진남관,126386,인문(문화/예술/역사),역사관광지,고궁,,전라남도,127.7367486187,34.7418705464,"국보 진남관은 이순신이 작전 계획을 세우고 군령을 내린 곳으로, 호국역사의 성지로 일컫는 곳이다. 임진왜란 당시 이순신이 전라좌수영 겸 삼도수군통제영의 본영으로 사용했던 이곳은 원래 진해루라는 누각이 있었다. 이후 1599년 이순신 후임인 통제사 겸 전라좌수사 이시언이 정유재란 때 불타버린 진해루 터에 75칸의 대규모 객사를 세우고, 진남관(鎭南館)이라 이름 지었다. 1716년 화마를 입은 진남관은 2년 후 전라좌수사 이제면에 의해 중건돼 지금까지 이어지고 있다. 

진남관은 정면 15칸, 측면 5칸, 건평 748.39㎡의 단층 팔작지붕으로 된 거대하고 웅장한 건물로 현존하는 단층 지방관아 건물 중 가장 크다. 부대시설로 진남관의 역사와 임진왜란에 대해 한눈에 볼 수 있는 유물 전시관이 있다. 경내에 전남 유형문화유산 여수 석인상과 일제강점기에 철거된 것을 1991년 4월 중건한 2층 누각 망해루가 있다. 이곳은 여수 앞바다까지 보이는 풍경이 아름다운 명승지이며, 주변에 자산공원, 오동도, 돌산대교, 충민사, 만성리해수욕장 등 관광지가 있다.","<a href=""http://www.yeosu.go.kr/tour/travel/10tour/jinnamgwan#noner"" target=""_blank"" title=""새창: 여수 관광문화 홈페이지로 이동"">http://tour.yeosu.go.kr</a>"
여수 챌린지파크 바다 루지,2994754,레포츠,육상 레포츠,트래킹,http://tong.visitkorea.or.kr/cms/resource/48/2994748_image2_1.png,전라남도,127.6272179728,34.6849361401,"여수 챌린지파크 바다 루지는 국내 최대 규모의 체험형 관광단지로의 그 발걸음을 내딛고 있는 여수 챌린지파크의 첫 대규모 프로젝트로써 천혜의 자연경관과 함께하는 루지 액티비티 테마파크이다. 바다 루지는 푸른빛으로 빛나는 여수 바다와 끝없이 펼쳐진 수평선 사이를 질주하는 짜릿한 쾌감을 온몸으로 느낄 수 있으며, 챌린지 코스, 하늘 코스, 바람 코스, 바다 코스로 총 4개 코스이며, 전체 길이 2.4km로 이루어져 있어 서로 다른 트랙 코스를 골라서 이용할 수 있는 색다른 경험을 제공한다. 또한 기존의 리프트 시스템이 아닌 최신 캐빈형 케이블카 시스템을 사용하여 여수의 바다를 한눈에 내려다보며 조망할 수 있는 추억에 남을 고급스러운 경험을 선사한다. 짜릿한 액티비티와 벅차오르는 경관을 감상하며 여유롭게 시간을 보낼 수 있는 이곳은 남녀노소 온 가족 모두가 함께 즐길 수 있는 관광지이다.

* 루지 탑승기준 
36개월 미만의 유아 : 탑승 불가
10세 미만, 신장 120cm 미만의 어린이 : 성인과 동반 탑승 가능 
10세 이상, 신장 120cm 이상 : 단독 탑승 가능","<a href=""http://www.challengeparkluge.kr/"" target=""_blank"" title=""새창: 여수 챌린지파크 바다 루지 홈페이지로 이동"">http://www.challengeparkluge.kr/</a><br /><a href=""https://litt.ly/challengepark_luge"" target=""_blank"" title=""새창: 여수 챌린지파크 바다 루지 SNS 홈페이지로 이동"">https://litt.ly/challengepark_luge</a>"
여수 충민사,127255,인문(문화/예술/역사),역사관광지,유적지/사적지,http://tong.visitkorea.or.kr/cms/resource/97/3027397_image2_1.jpg,전라남도,127.7348233723,34.758182575,"충민사는 마래산(385.2m) 기슭에 위치하고 있는데, 선조 34년(1601) 체찰사 이항복(1556~1618)이 왕명을 받아 임진왜란이 끝난 뒤의 민심을 살펴본 후 통제사 이시언에게 명하여 건립한 것이다. 충민사를 세우자 우부승지 김상용이 임금께 이 사우의 이름을 지어달라고 간청하여 선조가 직접 이름을 짓고 그것을 새긴 현판을 받음으로써 이충무공과 관련된 최초의 사당이 되었는데, 함께 충무공을 기리는 통영의 충열사보다는 62년, 숙종 30년(1704)에 세워진 아산의 현충사보다는 103년 전의 일이다.
충무공 이순신 장군을 여러 사람들 가운데 가장 먼저 제사를 모시는 분으로 하고 의민공 이덕기, 충현공 안홍국이 좌우로 배향되었다. 그 후 숙종 35년 충민공 이봉상을 신묘로 모시고 석천제를 창설하였으며, 영조 8년(1732)에 사우를 중수하였다. 고종 5년(1868) 대원군의 서원 철폐령에 따라 충민단만 남기고 모두 철거되었으나, 고종 10년(1873) 지역 유림들의 진정으로 건물을 다시 세우고 판서 윤용술이 쓴 충민사 현판을 걸었다. 1919년에 일제에 의해 강제 철거된 후, 1947년 2칸 집으로 명맥을 유지해 오다가 지역 주민의 노력으로 다시 세워 1993년 6월 1일 국가 사적으로 지정되었다.
바로 옆에 수호사찰 석천사가 있으니 함께 둘러보면 좋다.","▪ <a href=""https://www.yeosu.go.kr/tour/travel/info_each_area?mode=view&idx=260"" target=""_blank"" title=""새창 : 홈페이지로 이동"">https://www.yeosu.go.kr</a>"
여수 타루비,231922,인문(문화/예술/역사),역사관광지,유적지/사적지,http://tong.visitkorea.or.kr/cms/resource/71/3027571_image2_1.jpg,전라남도,127.7388818104,34.7401068922,"조선의 명장인 이순신의 덕을 기리기 위하여 이순신 장군의 타계 후 6년 후인 1603년, 장군의 부하들이 장군의 덕을 추모하여 세웠다. ‘타루(墮淚) ’란 눈물을 흘린다는 뜻으로, 중국의 양양 사람들이 양호(羊祜)를 생각하면서 비석을 바라보면, 반드시 눈물을 흘리게 된다는 고사성어에서 인용하였다. 비문은 ‘타루비’라는 비의 명칭을 앞면에 크게 새기고, 그 아래로 명칭을 붙이게 된 연유와 비를 세운 시기 등을 적고 있다. 타루비와 나란히 세워져 있는 통제이공수군대첩비와 동령소갈비가 함께 어딘가로 버려졌는데 해방이 되자 해남의 유지들이 서울로 사람을 보내 비석들의 행방을 수소문하여 경복궁 근정전 앞뜰 땅속에 묻혀 있었던 것을 찾아와 원래의 위치에 옮겨놓았다고 한다. 통제이공수군대첩비와 함께 보물 제571호로 일괄 지정되었던 타루비는 여수 시민들이 유물의 성격이나 건립 연대 등의 차이점을 들어 분리하여 보물로 지정해 줄 것을 정부에 건의하였고, 이것이 받아들여져 1998년 11월 27일 보물로 지정되었다.","<a href=""https://www.yeosu.go.kr/tour/travel/info_each_area?mode=view&idx=306"" target=""_blank"" title=""새창: 여수시 문화관광 홈페이지로 이동"">http://tour.yeosu.go.kr</a>"
여수 테디베어뮤지엄,3007161,인문(문화/예술/역사),문화시설,박물관,http://tong.visitkorea.or.kr/cms/resource/14/3008114_image2_1.jpg,전라남도,127.6419373099,34.7481182078,"여수 테디베어뮤지엄은 테디베어를 여러가지 테마와 접목시켜 만든 전시관으로 여수 유월드 내에 위치하고 있어 루지와 놀이 기구, 키즈파크까지 함께 즐길 수 있다. 뮤지엄 내 다양한 스토리가 담겨 있는 빅 테디베어 포토존은 신장 150cm 이상의 빅 테디베어를 활용해 다양한 컨셉의 옷차림과 행동을 연출하여 수준 높은 볼거리를 제공한다. 
철저한 고증을 통해 경이로운 관광지를 그대로 재현한 테디베어 디오라마는 뉴욕 거리의 테디베어들, 농구하는 테디베어들, 인디언 테디베어, 러시모어 산의 테디베어 등이 디테일하고 귀엽게 연출되어 있을 뿐만 아니라 영상 자료를 활용한 유익한 해설로 남녀노소 재미있게 전시를 즐길 수 있다. 이순신 장군, 토마스 에디슨과 같은 유명한 위인들의 모습을 표현한 전시관도 있다. 이 외에도 트렌디하고 인스타그래머블한 공간의 포토 스튜디오가 추가적으로 준비되어 있어 다양한 사람들의 취향까지 배려한 구성이 되어 있다. 
테디베어 뮤지엄 기념품샵에는 여수 테디베어 뮤지엄에서만 만나볼 수 있는 각종 테디베어 굿즈와 관광 도시 여수를 표현한 머그컵, 그릇, 가방 등을 구매할 수 있다.","<a href=""http://www.yeosuteddybear.co.kr/ysteddy/homepage/"" target=""_blank"" title=""새창 : 홈페이지로 이동"">http://www.yeosuteddybear.co.kr/ysteddy/homepage/</a>"
여수 특산품전시판매장,1343398,쇼핑,쇼핑,특산물판매점,http://tong.visitkorea.or.kr/cms/resource/22/3027322_image2_1.jpg,전라남도,127.7280246657,34.7306883141,"여수시가 수년을 준비하여 개장한 여수시특산품전시판매장은 여수의 주요 특산품을 한곳에서 만날 수 있는 곳이다. 봉산동 어항단지 내에 있고, 대지면적 1,575㎡에 연면적 929.9㎡의 한옥 2층 건물이다. 1층은 전시판매장으로, 2층은 전통음식점으로 운영 중이다. 전시판매장에선 김치, 젓갈, 액젓, 게장, 멸치, 생선, 건어물 등 농수산물을 주로 판매하며 가장 인기 있는 상품은 바로 김치다. 여수의 음식문화를 주도해 온 전통음식점 한일관에서 20년 노하우를 살려 만들었다. 종류도 배추김치, 파김치, 돌산갓김치, 고들빼기김치 등 다양하고, 국내산 양념만을 사용하여 조미료를 넣지 않아 맛이 담백하다. 
여러 상품을 선택해 세트로 구입하면 가격이 더 저렴하다. 무엇보다 정찰제이기 때문에 더욱 믿음이 간다.","<a href=""http://xn--9p4b13e3tbh1s.com/"" target=""_blank"" title=""새창 : 홈페이지로 이동"">http://xn--9p4b13e3tbh1s.com/</a>"
여수 해상케이블카,1997202,인문(문화/예술/역사),체험관광지,이색체험,http://tong.visitkorea.or.kr/cms/resource/64/3422964_image2_1.png,전라남도,127.7393264527,34.7307968308,"여수해상케이블카는 바다 위를 통과하여 돌산(섬)과 자산(육지)을 연결하는 해상케이블카이다. 아시아에서는 홍콩, 싱가포르, 베트남에 이어 네 번째로 바다 위를 통과하는 해상케이블카이다. 도심하고 가까운 거리에서 시간에 따라 도시 풍경과 야경, 노을, 그리고 밤바다를 볼 수 있다. 크리스털 캐빈 15대와 일반 캐빈 35대, 총 50대의 케이블카를 운영 중이다. 크리스털 캐빈은 바닥을 강화유리로 만들어 투명한 바닥으로 발 밑의 바다를 관망할 수 있다. 또 아름다운 바다를 발 밑에 두고 즐길 수 있는 특별한 캐빈으로, 탁 트인 시각적인 즐거움과 짜릿한 스릴감을 느낄 수 있다.

◎ 한류의 매력을 만나는 여행 정보
웹 예능 <팔짱즈그램>에서 ‘워너원’ 재환이 지성과 함께 여수 여행 차 방문한 곳이다. 두 사람은 캐빈 안에서 블루투스로 음악을 듣고, 서로의 초상화를 그리며 즐거운 시간을 보냈는데, 여행에 초대받은 지성이 “데려와 줘서 고맙고 평생 잊지 못할 추억이 될 것 같다”며 고마운 마음을 드러내기도 했다.","<a href=""http://www.yeosucablecar.com"" target=""_blank"" title=""새창 : 여수해상케이블카 홈페이지로 이동"">http://www.yeosucablecar.com</a>"
여수 해양레일바이크,1997322,레포츠,육상 레포츠,트래킹,,전라남도,127.7467580825,34.772211766,"여수 해양레일바이크는 총길이 3.5km에 이르는 탁 트인 해안 철길 위에 설치되었으며, 터널 구간 및 전 구간 해안가 코스로 이용객들의 눈까지 즐거운 체험 프로그램이다.
50여 대의 레일바이크는 아름답고 고운 디자인으로 안정성과 편안함까지 고려하여 제작되었다. 또한 많은 인원을 동시에 수용할 수 있어 개별여행, 가족여행뿐만 아니라 기업체, 수학여행, 체험학습 등 다양한 행사를 진행하는데 부족함이 없다.","<a href=""https://www.xn--om2b27e7rg8led7blb465i.com:444/"" target=""_blank"" title=""새창 : 여수레일바이크 홈페이지로 이동"">https://www.여수레일바이크.com/</a>"
여수 흥국사 홍교,1624496,인문(문화/예술/역사),역사관광지,유적지/사적지,,전라남도,127.7008080857,34.8208805152,"흥국사 홍교는 조선 시대 인조 17년(1639) 흥국사 주지인 계특 대사가 쌓은 무지개 형태의 석교이다. 흥국사 일주문 왼쪽 계곡을 가로질러 아래쪽 50m 지점에 위치한 흥국사 홍교는 다리 높이 5.5m, 길이 40m, 너비 3.45m, 홍예 지름 11.3m 부채꼴 모양의 화강석 86개를 맞추어 틀어 올린 홍예로, 완전한 반원을 이룬다. 단아하고 시원스러운 홍예의 양옆에는 학이 날개를 펼친 듯 둥글둥글한 잡석으로 쌓아 올린 벽이 길게 뻗쳐 조화를 이룬다. 흥국사에는 본래 일주문이 없었으므로, 홍교는 세속과 불국토의 갈림길이며 흥국사의 불이문이라 할 수 있다.
홍예 좌우의 주변 다리 측면 벽체의 석축은 축조 수법과 석재가 다양한 점으로 보아 여러 차례 다리가 수리되었음을 보여 준다.
홍예의 중심 머릿돌은 용머리를 새겨 돌출시켜 다리의 격을 높이고 있으며, 홍예 중심 머릿돌에서 양 홍예 난간 부분에 귀면상을 조각함으로써 잡귀를 막아 다리를 건너는 사람들의 안녕을 기원했다. 
순천 선암사 승선교와 함께 빼어난 작품으로 널리 알려져 있는 흥국사 홍교는 주변의 자연과 어우러져 한국 곡선미의 극치를 보여준다.",
여수夜호스텔,2697818,숙박,숙박시설,게스트하우스,,전라남도,127.7458034548,34.7390515747,여수야호스텔펜션은 전남 여수시 종화동에 위치한 신축 호텔형 펜션으로 관광지와 가까워 이동하기 편하며 주차장이 많아서 차량 방문도 편리하다.,"<a href=""http://www.psinys.co.kr/""target=""_blank"">http://www.psinys.co.kr/</a>"
여수구항,2783150,자연,자연관광지,항구/포구,http://tong.visitkorea.or.kr/cms/resource/62/2790262_image2_1.jpg,전라남도,127.7361904089,34.7389264222,"여수는 한국 제2의 수산항으로 많은 섬이 천연 방파제를 이루고 있으며 수심이 깊고 항만이 넓어 훌륭한 자연조건을 갖춘 곳이다. 한려수도와 뱃길로 이어지며, 오동도를 비롯해 돌산도·금오도·남해도 등에 연결되는 관광 항구이기도 하다. 여수항은 자산공원을 중심으로, 북쪽 수정동 일대에는 북항이라고 하는 신항이 있고 남서쪽 교동과 중앙동 일대에는 남항이라고 하는 구항이 있다. 여수 구항에 있는 여객선 터미널은 9개 선사에서 17척의 여객선을 운항한다. 또한, 수산물의 집산 및 유통의 중심지라 다양한 수산물을 즐길 수 있다. 연안여객선 터미널 앞에는 여수수산시장과 여수수산물 특화시장이 있어 싱싱한 바다 먹거리를 맛볼 수 있다.",
여수구항 해양공원,2612858,인문(문화/예술/역사),휴양관광지,공원,http://tong.visitkorea.or.kr/cms/resource/23/3372723_image2_1.JPG,전라남도,127.7400845568,34.7372016827,"여수구항 해양공원은 2001년부터 여수항만청에서 여수구항 해안을 정비하여 시민에게 휴식 공간으로 조성한 공원이다. 장군도와 돌산대교, 남해도와 아기섬이 마주 보이며 하멜등대가 이웃하고 있는 이곳은 대형 공연장, 낚시터, 쉼터 등을 갖추었다. 열대풍의 워싱턴 야자수와 조명 등이 조화를 이루며, 밤이면 휘황찬란한 돌산대교의 야경이 아름다워 시민과 관광객들로부터 큰 인기를 끌고 있다. 해양공원의 명소는 방파제 끝단에 조선을 유럽에 최초로 소개한 네덜란드인 하멜을 기념하여 세운 하멜등대이다. 하멜은 1653년 제주도에 표류해 1663년 7월 여수의 전라좌수영으로 배치된 후 잡역에 종사하면서 억류 생활을 이어가다 1666년 일본으로 탈출했다. 하멜등대의 위치가 바로 하멜이 우리나라를 떠난 곳이다. 2005년 3월 국제 로터리 클럽 창립 100주년을 맞아 여수지역 로터리인들이 뜻을 모아 세웠다.","<a href=""http://www.yeosu.go.kr/tour"" target=""_blank"" title=""새창: 여수관광문화 "">http://www.yeosu.go.kr/tour</a>"
여수국가대표패러글라이딩,2720591,레포츠,항공 레포츠,헹글라이딩/패러글라이딩,http://tong.visitkorea.or.kr/cms/resource/97/2720597_image2_1.jpg,전라남도,127.7446443211,34.7744614774,"여수국가대표패러글라이딩은 전남 여수에 위치한 패러글라이딩체험비행업체이다. 현직 국가대표 선수가 직접 운영 및 지도하며, 전 현직 국가대표선수강사진들로 구성되어 있다.  여수바다를 전경으로 체험이 진행되며 체험자 개인의 취향에 맞는 코스를 선택할 수 있다.","<a href=""http://www.sbpara.com/index.php"" target=""_blank"" title=""새창: 여수국가대표패러글라이딩 홈페이지로 이동"">http://www.sbpara.com/index.php</a>"
여수국가산단전망대,2778034,인문(문화/예술/역사),건축/조형물,유명건물,http://tong.visitkorea.or.kr/cms/resource/80/2795980_image2_1.jpg,전라남도,127.6484492972,34.8006013271,"1976년 조성된 우리나라 최대의 석유화학산업의 핵심 단지인 여수국가산업단지는 비가 오나 눈이 오나 쉴 새 없이 돌아가는 웅장한 기계들, 그리고 안전을 위해 설치된 수많은 조명이 형형색색의 아름다운 야경을 만들어내는 곳이다. 어둠이 내리고 여수국가산업단지에 역동적이고 화려한 조명이 켜지면 현란한 불빛이 장관을 연출한다. 2009년 3월 50㎡ 규모의 전망대와 100m 길이의 보행 데크 등이 설치된 여수국가산업단지 전망대는 야경 뷰포인트가 되었다. 전망대에서 내려다보는 야경은 여수의 화려한 밤을 한층 빛나게 해준다. 이곳에 주차장과 벤치도 설치되어 관람하기 편하고, 국도 17호선과 접해있어 많은 관광객이 찾고 있다.",
여수냉면,2923442,음식,음식점,한식,http://tong.visitkorea.or.kr/cms/resource/27/2923427_image2_1.jpg,전라남도,127.6332202701,34.7929213689,"소라면사무소에서 도보 1분 거리의 여수냉면은 냉면, 해물칼국수 맛집이다. 여수 갓김치가 들어간 여수 갓 냉면은 직접 반죽한 면과 한우 사골육수로 여수에서만 맛볼 수 있는 특별한 음식이다. 깔끔한 외관과 내부에 모든 재료를 국내산만 사용한다. 냉면은 사계절, 콩국수는 3월에서 10월 사이, 해물칼국수는 9월에서 4월까지, 굴 떡국은 10월에서 3월까지 즐길 수 있다. 숟가락, 젓가락이 개별 포장되어 있고 음식 먹을 때 필요한 조미료들이 테이블마다 구비되어 있다. 4명이 앉을 수 있는 테이블이 약 10개 정도 있다. 주차는 매장 뒤에 있는 주차장에 하면 된다. 유월드 루지 테마파크, 여수 갯벌 노을 마을 등이 가까이 있어 연계 관광하기 수월하다.",
