title,contentid,cat1,cat2,cat3,firstimage,region,mapx,mapy,overview,homepage
모스트417,2758008,음식,음식점,카페/전통찻집,http://tong.visitkorea.or.kr/cms/resource/46/2786946_image2_1.png,경기도,127.1693680056,37.0568722594,"경기도 안성시 원곡면에 있는 에펠탑과 야외 수영장이 있는 사진 찍기 좋은 카페이다. 야외 수영장은 오로지 사진 찍기를 위한 장소로만 사용한다. 야외의 에펠탑 위로 파란 하늘과 흰 구름을 배경으로 의자에 앉아 사진을 찍으면 예쁜 사진이 나온다. 사진 촬영만을 위한 수영장 안에 사각의 징검다리를 거닐며 찍은 사진은 SNS용으로 제격이다. 약 3,800㎡의 규모로 주차 공간이 여유롭다. 서안성 IC에서 차로 5분 거리에 있다.",
모슬포중앙시장,2755023,쇼핑,쇼핑,상설시장,http://tong.visitkorea.or.kr/cms/resource/52/2755152_image2_1.jpg,제주특별자치도,126.2545860621,33.2220012575,"모슬포 중앙시장은 서귀포시 대정읍에 위치해 있으며 최근 TV 프로그램 ‘바퀴 달린 집’ 제주 편에서 출연진이 방문한 곳으로 유명하다. 규모가 크지 않아 작은 시골 시장 모습 그대로이다. 주로 동네 주민들이 많이 이용하고 지역 경제 활성화를 위해 깔끔하게 정비되어 이용하기 편리하다. 바닷가 동네에 위치한 만큼 신선한 수산물과 각종 생활용품을 판매하는 상점들이 골고루 분포되어 있으며, 녹두빈대떡은 물론 성게 김밥을 판매하는 식당도 인기다. 하모리 오거리를 지나 모슬포항과 인접해 있어 해안 가 산책도 추천한다.",
모습,2869381,음식,음식점,카페/전통찻집,http://tong.visitkorea.or.kr/cms/resource/68/2869368_image2_1.png,대전광역시,127.4132887434,36.3127648784,"모습은 대전광역시 중구 문화동에 위치하고 있다. 현대적인 감각이 돋보이는 외관과 고급스러운 분위기를 연출하는 인테리어가 눈에 띈다. 14세 이상부터 출입할 수 있는 어린이 제한 구역으로 운영된다. 대표 메뉴는 커피맛이 진한 라테에 헤이즐넛 크림을 올린 모습 라테이다. 이 밖에 아메리카노, 카페라테, 플랫 화이트, 수제 바닐라빈 라테, 티 등 여러 가지 음료가 준비되어 있다. 또한 다양한 디저트도 맛볼 수 있다.","<a href=""http://instagram.com/cafe_mosp""target=""_blank"" title=""새창 : 모습 사이트로 이동"">http://instagram.com/cafe_mosp</a>"
모시울,2871245,음식,음식점,카페/전통찻집,http://tong.visitkorea.or.kr/cms/resource/33/2871233_image2_1.jpg,세종특별자치시,127.3018993621,36.5952249867,"모시울은 세종특별자치시 조치원읍 남리에 있다. 현대적인 감각이 돋보이는 외관과 고급스러운 분위기를 연출하는 인테리어가 눈에 띈다. 내부에는 단체석이 마련되어 있어 각종 모임을 하기 좋다. 대표 메뉴는 아메리카노다. 이 밖에 카페라테, 돌체라테, 모시울 알밤라테 등 여러 가지 음료가 준비되어 있다. 디저트로는 오색 가래떡 세트, 인절미 크로플, 인절미 소금빵 등과 같은 퓨전 디저트가 있다.","<a href=""http://www.instagram.com/mosiul_1""target=""_blank"" title=""새창 : 모시울 사이트로 이동"">http://www.instagram.com/mosiul_1</a>"
모아냉면,2782721,음식,음식점,한식,,경기도,126.7773255209,37.8597776014,"경기도 파주시 문산읍에 위치한 냉면 전문점이다. 식당에서 직접 준비한 육수와 기계로 수시로 뽑아내는 메밀면으로 만든 물냉면과 비빔냉면이 주 메뉴이다. 꽃등심과 돼지 주물럭, 삼겹살은 인근 축협에서 직접 공급받는다. 국물에 담겨 나오는 아롱사태 수육은 다른 곳에서 먹기 힘든 이 집만의 별식이다.  문산지역은 픽업도 가능하다. 주차가 편하고 자유로 내포 IC에서 차량으로 5분 거리에 있다.",
모아니,2830670,음식,음식점,카페/전통찻집,http://tong.visitkorea.or.kr/cms/resource/65/2830665_image2_1.jpg,경기도,127.0890444414,37.3647240976,"모아니(MOANI)는 바람에 실려 오는 향기란 뜻으로, 두 번째 자연이라는 이름 아래 운영되고 있는 자연 친화적 카페다. 뒤에는 진재산이 있고, 옆으로는 쇳골천이 흐르고 있다. 서울 근교에서 자연을 느낄 수 있는 카페로 앞마당 정원, 지붕들판 정원, 폭낭 정원, 뒷뜰로 공간이 구성되어 있다. 빵, 브런치, 디저트 외에 1인 1 음료를 주문해야 하고, 카드 결제만 가능하다. 내부, 외부 모두 노키즈 존으로 운영되고 중학생 이상부터 입장 가능하며, 포장 구매 시에는 어린이도 입장 가능하다. 또한 반려동물은 동반할 수 없다.","<a href=""http://www.moani.co.kr""target=""_blank"" title=""새창 : 모아니 사이트로 이동"">http://www.moani.co.kr</a>"
모아레벤트,1922424,레포츠,수상 레포츠,래프팅,,경상남도,128.0803557687,35.5468943839,모아레벤트는 1995년 랩소디클럽에서 1997년 모아레벤트로 개칭하고 2000년부터 수상레저사업을 하고 있다. 2001년에는 대구 모아레벤트를 개설하고 송정 레포츠 매장을 오픈했다. 황강래프팅 외에도 각종 공동체베이스 체험활동과 서바이벌 등의 레포츠사업을 하고 있다.,"<a href=""http://www.moalevent.co.kr"" target=""_blank"" title=""새창 : 모아레벤트 홈페이지로 이동"">http://www.moalevent.co.kr</a>"
모아모텔,609935,숙박,숙박시설,모텔,http://tong.visitkorea.or.kr/cms/resource/00/1972200_image2_1.jpg,전라남도,126.5256109668,35.0669078975,"함평읍 기각리에 위치한 모아모텔은 모두 28개의 객실로 운영된다. 외관처럼 실내도 깔끔하여 손님들의 마음을 편하게 해준다. 근처에는 해수 유황성분이 많은 돌을 불에 달구어 바닷물 속에 넣고 찜질을 하는 함평해수찜이 있어, 이곳에서 색다른 즐거움을 찾을 수 있다.",
모아모텔,620219,숙박,숙박시설,모텔,http://tong.visitkorea.or.kr/cms/resource/62/3071462_image2_1.jpg,강원특별자치도,128.5989487641,38.2129315849,"영금정 입구에 위치한 모아모텔은 세련된 현대식 건물 구조로 가족형 휴식공간으로 적당하다.  속초 시내에서 가까운 동명항 근처에 위치하고 있어 청초호와 속초등대전망대, 속초 해수욕장 등을 조망할 수 있다. 객실 크기에 따라 특실과 일반실로 나뉘며 특실의 경우에는 거실이 있어 여러 명이 사용하기에 적합하다. 취사가 가능하도록 주방시설이 갖춰져 있으며, 일반실은 온돌방과 일반 침대가 있는 방 중 선택할 수 있다.
주차시설이 갖춰져있어 주차가 편리하며 속초 시내나 마트가 가까워 이동하기가 편리하다. 주변에 이름난 맛집과 영랑호 관광단지와 장사항 등 관광지가 많아 함께 둘러보면 좋다.",
모아베리교육농장,2966354,인문(문화/예술/역사),체험관광지,농.산.어촌 체험,http://tong.visitkorea.or.kr/cms/resource/01/2966301_image2_1.jpg,경기도,127.0416935808,38.0313151209,"친환경농법으로 재배한 딸기가 주작목으로 딸기 외에도 블루베리, 패션후르프(백향과), 꽃 등을 재배하고 있으며, 모아베리 교육농장에서는 학교 교과와 연계한 다양한 교육 프로그램을 운영하고 있다. 유치원부터 성인까지 다양한 계층으로 진행되는 교육농장으로 인증을 받은 곳으로, 화원과 모아베리 교육농장을 함께 운영하고 있다.","<a href=""https://blog.naver.com/okyounghi"" target=""_blank"" title=""새창 : 모아베리교육농장  홈페이지로 이동"">https://blog.naver.com/okyounghi</a>"
모아음식점,2662253,음식,음식점,한식,http://tong.visitkorea.or.kr/cms/resource/11/2662411_image2_1.jpg,전라남도,126.3869077975,34.7875704509,20년 이상의 경력을 가진 음식점이다. 전라남도 목포시에 있는 한식 전문점이다. 대표메뉴는 가정식 백반이다.,
모아이카페,2851648,음식,음식점,카페/전통찻집,http://tong.visitkorea.or.kr/cms/resource/37/2851637_image2_1.jpg,경기도,127.3613555384,37.7615246264,"모아이카페는 도심에서 벗어나 탁 트인 풍경을 바라보며 커피 한잔의 여유를 갖게 하는 공간이다. 축령산을 병풍처럼 두른 모아이카페의 독특하면서도 자연과 조화롭게 어우러지는 건축물의 아름다움도 느낄 수 있다. 외부 좌석에는 빈백과 파라솔, 테라스 공간이 있어 날씨에 따라 골라 앉아 힐링을 할 수 있는 곳이다. 
모아이카페의 대표메뉴는 우유베이스를 직접 제조하여 일반 라떼보다 더 묵직하고 고소한 카페라떼이다. 가평 명물 잣으로 만든 달달하고 고소한 잣 갈레트와 상큼한 애플티와 달콤한 유자의 조합, 애플유자도 인기가 많다. 반려동물은 테라스만 동반 입장이 가능하고 실내 동반은 불가능하다.","<a href=""https://www.instagram.com/moai___cafe/"" target=""_blank"" title=""새창 : 모아이카페 인스타그램으로 이동"">https://www.instagram.com/moai___cafe/</a>"
