title,contentid,cat1,cat2,cat3,firstimage,region,mapx,mapy,overview,homepage
옥천향교,1954386,인문(문화/예술/역사),역사관광지,유적지/사적지,http://tong.visitkorea.or.kr/cms/resource/41/3336241_image2_1.jpg,충청북도,127.5861842674,36.318042357,"옥천향교는 훌륭한 유학자의 위패를 모시고 제사를 지내며 지방민의 교육과 교화를 위해 설립된 고려·조선시대의 국립 교육기관이다. 임진왜란 중에 소실되었으나 1954년에 향교 재건을 결의하고 1961년에 복원하였다. 현존하는 건물로는 대성전, 명륜당, 동재, 서재, 내삼문, 외삼문 등이 있으며, 대성전에는 5성, 10철, 송조 6현의 위패가, 동무, 서무에는 우리나라 18현의 위패가 봉안되어 있다.
조선시대에는 국가로부터 토지와 전적, 노비 등을 지급받아 교관 1명이 정원 30명의 교생을 가르쳤으나, 갑오경장 이후 신학제 실시에 따라 교육적 기능은 없어지고 봄과 가을에 석전을 봉행하며 초하루와 보름에 분향하고 있으며 충청북도 유형문화유산으로 지정되어 있다. 소장 도서는 판본 15종 58책, 사본 11종 26책이 있으며, 이 중 유안, 청금록, 청금속록, 선안, 교안, 향교의 중수 사실 등은 조선 후기 향교 연구와 이 고장 향토사 연구에 귀중한 자료이다.","<a href=""https://www.heritage.go.kr/heri/cul/culSelectDetail.do?ccbaCpno=2113300970000&pageNo=1_1_1_1&sngl=Y"" target=""_blank"" title=""새창 : 홈페이지로 이동"">https://www.heritage.go.kr</a>"
옥천향수시네마,2989894,인문(문화/예술/역사),문화시설,영화관,http://tong.visitkorea.or.kr/cms/resource/93/2989893_image2_1.JPG,충청북도,127.5755911499,36.304074319,"옥천향수시네마는 규모가 그리 크진 않지만 있을 건 다 있는 알찬 영화관이다. 주차장이 넓고 지상 1층에 총 96석을 보유한 상영관 2관이 있으며, 3D영화도 지원하고 있다.  매점과 같은 편의 시설이 있어 팝콘을 사 들고 영화를 볼 수 있다. 로비에는 방문객들이 쉴 수 있는 의자와 테이블이 마련되어 있고 영화 예매를 할 수 있는 키오스크가 있다. 키오스크는 카드 결제만 가능하며 현장 매표소에서도 예매가 가능하다.","<a href=""https://okcheon.scinema.kr/"" target=""_blank"" title=""새창: 옥천 향수시네마 홈페이지로 이동"">https://okcheon.scinema.kr/</a>"
옥탑방,2659244,음식,음식점,카페/전통찻집,http://tong.visitkorea.or.kr/cms/resource/48/2659248_image2_1.jpg,부산광역시,129.224256818,35.1982517091,"옥탑방 베이커리카페는 모든 고객이 즐길 수 있는 디저트와 음료를 선보이기 위해 늘 고민한다. 좋은 재료로 건강하게 만든 디저트, 바리스타의 손길이 담긴 신선한 커피, 기장 앞바다가 한눈에 내려다보이는 뷰, 세 가지 즐거움을 한곳에서 느낄 수 있다.<br>","<a href=""http://theast.co.kr/sub.php?menu_number=475""target=""_blank"" title=""새창 : 홈페이지로이동"">http://theast.co.kr/sub.php?menu_number=475/a>"
옥토끼우주센터,1039170,인문(문화/예술/역사),체험관광지,이색체험,,인천광역시,126.4871684382,37.6742551985,"옥토끼우주센터는 국내 최초의 항공우주과학 테마파크이다. 항공우주 관련 자료를 수집, 보존하여 일반 대중들의 항공우주과학에 대한 이해를 돕기 위한 전시 및 교육을 실시하고 있다. 특히 어린이들의 체험교육에 중점을 두어 항공우주 관련 체험기구와 체험교육 프로그램을 개발, 운영하고 있다. 또한 과학, 예술, 탐험, 놀이가 결합된 복합문화공간으로 사계절 내내 방문할 수 있는 곳이다. 

옥토끼우주센터는 우주공항과 공룡의 몸통이라는 두 가지의 콘셉트를 가지고 노출콘크리트와 스테인리스 그물망으로 지어진 나선형태의 건축물이다. 건물은 내부와 외부공간으로 구분되는데, 내부공간은 관람 동선을 따라 과학전시물 체험을 하며 우주센터를 관람하게 되어 있다. 외부공간은 넓은 옥토끼우주센터 전체를 한눈에 조망할 수 있는 전망 탑을 중심으로 공룡의 숲, 물대포 공원, 로봇 공원, 천체영상관, 사계절 썰매장, 로고스 가든 등으로 구성되어 있다. 건물의 뛰어난 조형성을 보여주는 상층부와 공룡의 뼈대를 형상화한 주차장을 잇는 경관 램프는 아이들에게 공룡 뱃속을 탐험하는 느낌을 줄 것이다.","<a href=""http://www.oktokki.com/"" target=""_blank"" title=""새창 : 옥토끼우주센터 사이트로 이동"">http://www.oktokki.com</a>"
옥포공원 / 옥포중앙공원,2774854,인문(문화/예술/역사),휴양관광지,공원,http://tong.visitkorea.or.kr/cms/resource/70/2774870_image2_1.jpg,경상남도,128.7020326902,34.8943566864,"경남 거제시 옥포공원은 2006년 도로 선형 개량공사에서 발생한 10,349㎡ 규모의 잔여부지에 조경수를 식재하고 정자와 체육시설을 설치하여 대한민국 조경 대상 평가에서 특별상을 수상한 이력이 있는 아름다운 공원이다. 거제 앞바다의 자연경관 선을 살린 이 공원은 현재 거제도 주민들의 체력단련과 휴식공간으로 자리매김하고 있다. 특히 옥포공원에서 출발하는 옥포대첩로에는 벚꽃, 꽃치자, 조팝나무 등 봄부터 여름까지 다양한 꽃길로 멋진 풍경을 자아낸다. 최근 우리 동네 소확행이라는 주제로 여러 곳에 만들어진 꽃밭은 어려운 시기지만 화사한 꽃으로 시민과 관광객들이 작은 행복을 느끼도록 조성하였다.",
옥포국제시장 / 옥포시장,2758174,쇼핑,쇼핑,상설시장,,경상남도,128.6905281449,34.8940148495,"옥포 국제시장은 매일 열리며, 2017년 전통시장 활성화 사업에 선정되어 깔끔하게 정비된 시장으로, 가운데 길을 따라 시장이 조성되어 있다. 위로는 돔 형태의 천장도 있어 궂은 날씨에도 불편함 없이 방문할 수 있다. 옥포 국제시장에는 신선한 해산물을  바로 손질해서 사 가거나 회를 떠서 먹을 수도 있다. 그 외에도 떡집, 야채 가게, 옷가게, 분식집 등이 줄지어 있어 시장 주변 주민들이 자주 이용한다. 또한, 시장에서 도보로 5분 거리에 주차장도 마련되어 있으며 가까이에 버스정류장도 있어 접근성이 좋다.",
옥포대첩기념공원,127258,인문(문화/예술/역사),휴양관광지,공원,,경상남도,128.7112317286,34.9004089538,"1592년 옥포승첩을 기념하고 충무공 정신을 후세에 길이 계승하기 위해 유서 깊은 옥포만에서 1991년 12월에 기공식을 가지고 높이 30m의 기념탑과, 참배단, 옥포루, 팔각정, 전시관 등을 건립하여 1996년 6월에 옥포대첩기념공원을 준공하였다. 이중 ‘충(忠)’ 자를 형상화한 참배단에는 이순신 장군의 영정이 있다. 전시관은 옥포해전 당시의 해전도 등 이순신 장군과 관련된 유물을 전시하고 있으며, 옥포루는 전망대를 겸하고 있는 팔각 정자이다. 공원에서는 매년 이순신 장군의 제례행사가 열리며, 6월 16일을 전후하여 약 3일간 옥포대첩기념제전이 열린다.","<a href=""https://www.gmdc.co.kr/_okpo/"" target=""_blank"" title=""새창 : 거제해양관광개발공사 홈페이지로 이동"">https://www.gmdc.co.kr/_okpo/</a>"
옥포로&두류공원,2044530,추천코스,도보코스,도보코스,http://tong.visitkorea.or.kr/cms/resource/48/1644448_image2_1.jpg,Unknown,128.5204171033,35.7480907321,"대구역시 4월이 오면 벚꽃이 차오른다. 팔공산 순환도로, 수성유원지, 앞산공원, 옥포로, 두류공원로 등 도심과 산속 어디나 벚꽃이 가득하다. 이중 벚꽃 가로수가 남다른 자태를 뽐내는 옥포로와 대구 시민과 여행자의 쉼터인 두류공원 벚꽃길이 손꼽힌다. 하늘이 보이지 않을 만큼 빼곡하게 꽃이 핀 벚나무 아래를 걷다 바람을 만나면 그림처럼 꽃비가 내리는 길을 걷게 된다. 이 벚꽃 터널을 중앙에 두고 양옆으로 도보전용 논길과 우회 도로변 꽃길이 나란히 이어진다. 조명으로 도드라진 이월드의 83타워와 색색의 조명이 어우러진 야간벚꽃축제도 장관이다.",
옥포비지니스호텔,3044624,숙박,숙박시설,관광호텔,http://tong.visitkorea.or.kr/cms/resource/25/3054925_image2_1.jpg,경상남도,128.6940418263,34.890304217,"옥포비즈니스호텔은 거제도 한화오션 하모니센터 근처에 위치한 비즈니스 호텔이다. 객실은 스탠다드룸과 디럭스룸으로 구성되어 있고, 넓은 방에 침대, 큰TV, 책상, 소파, 옷장, 의자 등을 갖추었다. 무료 짐 보관 서비스 및 유료 조식을 제공하고, 출장객은 드라이클리닝 및 세탁 서비스를 이용할 수 있다. 주변에 김영삼 대통령 생가, 거제 포로 수용소, 거제 옥포대첩 기념공원, 덕포해수용장 등 관광지가 있어 여행을 즐기기에 좋다.",
옥포수변공원,2755675,인문(문화/예술/역사),휴양관광지,공원,http://tong.visitkorea.or.kr/cms/resource/42/2758442_image2_1.jpg,경상남도,128.6965082797,34.8902681545,"옥포 수변공원은 대우조선 오션플라자와 옥포동 주민센터 근처에 있다. 데크가 깔린 쾌적한 환경에서 시원한 바닷바람과 잔잔한 파도 소리를 들으며 운동을 하거나 산책을 즐기는 사람들이 많은 공원이다. 임진왜란 해전 승전지 기념비가 세워져 있으며 오페라하우스를 닮은 조형물이 있어 공연이나 그늘막으로 활용된다. 낚시를 즐기는 어른들과 자전거를 타는 아이들이 어우러지는 풍경에서 여유가 느껴진다. 근처에 옥포항, 옥포 중앙공원, 옥포대첩기념공원이 있어 주민들은 물론 관광객도 느는 추세다. 덕분에 골목 곳곳에 예쁜 카페와 맛집도 많다.",
옥포항,2778435,자연,자연관광지,항구/포구,http://tong.visitkorea.or.kr/cms/resource/51/2794851_image2_1.jpg,경상남도,128.6992108031,34.8909958998,"경남 거제시에 있는 항구다.  장승포 양지암 두툽바위 끝에서 외포 망월산 끝까지 6.2㎞의 거리다.  옥녀봉과 국사봉 사이에 있는 항구다. 거제는 왜적을 방어하는 전초기지 역할을 했고, 옥포는 군사적으로 요충지였기 때문에 옥포진과 조라진이 있었다. 항구를 벗어나면 거제와 부산 뱃길의 관문이며, 대마도가 나타난다. 일본과 가까운 곳으로 내륙으로 쉽게 접근이 용이한 곳이므로 일본의 침입이 먼저 있었던 곳이다. 임진왜란 때는 이순신 장군이 1592년 임진년 5월 7일 왜적을 최초로 무찔렀던 전투를 벌인 장소이기도 하다.",
옥포항 해안둘레길,2720046,레포츠,육상 레포츠,트래킹,,경상남도,128.6989024824,34.8915263904,"경상남도 거제시 옥포항은 일본과 가까워 예전부터 왜적의 침입이 많았기 때문에 군사적인 요충지로 옥포진과 조라진이 있었으며, 옥포대첩의 배경이 되었던 장소이기도 하다. 
옥포대첩이 열린 옥포만을 그대로 조망하며 걸을 수 있는 둘레길은 걷기 편한 나무 데크길로 팔랑포 마을까지 이어져 있으며, 아름다운 기암 절벽까지 한눈에 조망할 수 있다. 해질녘에는 데크길에 조명이 들어와 저녁 시간에 산책하기에도 적절하며, 거제 동쪽 해변을 조망 할 수 있는 쉼터와 전망대가 있어 걷기 여행을 즐길 수 있는 최적의 장소이다.","<a href=""https://tour.geoje.go.kr/index.geoje""target=""_blank"" title=""새창 : 거제 문화관광 홈페이지로 이동"">https://tour.geoje.go.kr</a>"
옥향식당,135238,음식,음식점,한식,http://tong.visitkorea.or.kr/cms/resource/48/1973648_image2_1.jpg,전라남도,126.262237118,34.4845774884,"옥향식당은 전라남도 진도에 위치하고 있는 한식 전문점이다.<br>설렁탕, 꼬리곰탕, 애호박국밥 등을 비롯해 백반, 김치찌개까지 든든히 한 끼를 채울 수 있는 다양한 요리를 선보이고 있다. 이 외에도 진도에서 채취한 해초와 갈비를 넣고 끓인 남토 향토음식 뜸북국을 맛볼 수 있다.<br>",
옥화1경 청석굴,2766539,자연,자연관광지,동굴,,충청북도,127.6860199811,36.613240922,"상당산성(上黨山城)과 구라산성(謳羅山城) 방면에서 흘러내리는 미원천(米院川)이 낭성산성(琅城山城) 옆을 끼고돌아 옥화구경(玉花九景)의 박대천(博大川)으로 합류하기 직전의 운암리 청석마을 동쪽 덤바위 언덕에 있는 자연동굴 유적이다. 동굴 앞에는 내가 흐르고 양지바른 남향으로 되어 있어 선사시대 살림터로서 좋은 입지조건을 갖추었으며 굴의 입구가 높고 넓어 출입에 편리하다. 이 동굴에서 찍개-망치, 긁개-주먹대패-찌르개 등의 뗀석기가 발견되어 구석기유적으로 확인되었다. 실로 스톤 자갈돌로 만든 찍개-망치는 크기 101.4 ×78.8 ×34.4mm에 무게 332g이다. 원석(原石) 돌에 엇갈림 떼기 수법으로 쌍날의 옆찍개를 만들어 썼으나, 날이 무디어지자 다시 인접한 능선에 같은 방법으로 쌍날의 긴 찍개를 만들어 사용한 것이다. 그러나 이 암질의 성격상 찍개로는 적당하지 못하여, 주로 망치로 사용되었음을 알 수 있으며 여기에 깊이 파인 자국만도 68개나 되어 상당히 많이 쓰인 것으로 짐작된다. 전체적으로 먼저 간접 떼기의 모룻돌로 사용한 것으로 보아 후기 구석기시대의 연모 제작용이었다고 추정되었다. 
(출처: 청주시 문화관광)","<a href=""https://www.cheongju.go.kr/ktour/selectClturCntnts2019View.do?key=20397&clturCntntsNo=1835&clturCode=102&pageUnit=8"" target=""_blank"" title=""새창 : 청주시 문화관광 홈페이지로 이동"">https://www.cheongju.go.kr/ktour</a>"
옥화9경,127648,자연,자연관광지,계곡,http://tong.visitkorea.or.kr/cms/resource/24/1983824_image2_1.jpg,충청북도,127.691277968,36.608774863,"청주 옥화9경은 좌구산(657m)에서 발원하여 청주 미원면 옥화리, 운암리, 월용리, 금관리, 어암리, 계원리를 흐르는 달천(박대천) 주변의 청석굴, 영소, 천경대, 옥화대, 금봉, 금관숲, 가마소뿔, 신선봉 그리고 박대소 아홉 곳을 이르는 말이다. 청주에서 그다지 멀리 떨어져 있지 않은 이곳은 명소마다 용과 신선이 살았다는 다양한 전설이 있을 정도로 아름다운 절벽과 산, 동굴을 가진 달천 유역에 형성되어 있는 9개소의 명승지이다. 달천천을 따라 상류의 1경부터 하류의 9경까지 펼쳐지는 푸른 계곡과 신비한 전설이 여행의 즐거움을 더해준다. 중간중간 벤치와 포토존, 화장실, 매점, 버스 정류장 등의 시설이 잘 되어 있고 스탬프 투어도 준비되어 있어 더욱 즐겁게 거닐 수 있다.

* 제1경 청석굴(미원면 운암리 : 청주-보은 간 19번 국도변)
구석기 시대의 유물인 찍개와 볼록날, 긁개가 발견된 이곳은 옛날 우리의 선조가 생활했던 그대로를 간직한 동굴로서 더운 여름철에도 동굴 속에서는 한기가 느껴질 정도인데 이 굴 안에서 용이 나왔다고 전해지는 곳이다. 동굴 바깥에는 깎아지른 절벽이라 암벽 타기 선수들이 많이 찾아오는 곳이다.

* 제2경 용소(미원면 옥화리 : 19번 국도에서 금관리쪽 2km)
달천천 중에 수심이 가장 깊은 곳으로 위에서 내려다보아도 바닥을 헤아릴 수 없어 가슴이 서늘해지는 곳이다. 이 용소에는 용이 살았었는데 신비한 날에 승천을 하는 것을 지나가던 여자가 보게 되어 영험에 부정을 타서 승천하던 용이 그대로 떨어져서 이무기가 되었다는 전설이 전해져 온다.

* 제3경 천경대(미원면 옥화리 : 19번 국도에서 금관리쪽 2.5km)
이곳은 수직으로 이루어진 절벽과 함께 달빛이 맑은 물에 투영되어 마치 하늘을 비추는 거울 같다고 하여 천경대로 이름 지어진 곳으로 산수가 아름다워 피서객이 많이 모여드는 곳이다.

* 제4경 옥화대(미원면 옥화리 : 19번 국도에서 금관리쪽 2.5km)
천경대에서 약 300m 하류인 이곳은 옛날 조선시대 선비인 석애 이규소 등 유학자들이 청명한 가을 달을 닮은 추월정, 세상 모든 경치를 볼 수 있다는 만경정, 마음을 닦고 씻는다는 세심정 정자를 지어 후학을 양성했다는 곳이다. 옥화리 개울가 절벽 위에 고목이 무성한 동산인 이곳은 들판에 옥처럼 떨어져 있다 하여 옥화대라 이름 지었으며 지조 있는 선비들이 아끼던 장소로 옥화 9경 중에서도 대표적인 절경으로 꼽히고 있는 곳이다.

* 제5경 금봉(미원면 월용리 : 19번 국도에서 금관리쪽 4km)
비단 같은 봉우리란 뜻의 금봉은 아름다운 숲으로 수목이 울창한 동산을 맑은 개울이 휘돌아 흐르기 때문에 깨끗한 백사장이 형성되어 있어 어린아이가 있는 가족단위 피서지로 그만이다.

* 제6경 금관숲(미원면 금관리 : 19번 국도에서 금관리쪽 6km)
미원면 금관리의 개울가에 있는 7,934m²(2천4백여 평)의 숲으로 수목이 울창하여 한여름에도 햇빛이 들지 않으며 바로 옆으로 개울이 흐르고 있고 음수대 등 유원지 편의시설이 갖추어져 있어 학생 야영이나 가족 단위 피서지로 각광을 받고 있는 곳이다.

* 제7경 가마소뿔(미원면 어암리 : 19번 국도에서 금관리쪽 7km)
가마소뿔은 이름과 얽힌 애잔한 전설 때문에 더욱 유명하다. 옛날에 막 혼례를 마친 신랑과 신부가 이곳을 지나다가 신부의 가마가 흔들리다 그만 물속에 빠져 죽었는데 이를 애통해하던 신랑도 함께 뛰어 들었다는 전설을 가진 곳으로 전설에서 유래한 이름인 가마소뿔은 절벽 밑에 위치해 있다.

* 제8경 신선봉(미원면 계원리 : 19번국도에서 금관리쪽 8km)
이곳은 계원리 쪽에서 바라보는 경치로서 해발 630m인 이 봉우리에서 옛날 신선이 놀았다 하여 신선봉으로 불린다. 계곡이 큰 바위로 이루어져 가만히 있으면 바위 밑으로 흐르는 물소리 때문에 그곳을 찾는 누구라도 절로 신선이 되는 듯한 곳이다.

* 제9경 박대소(미원면 어암리 : 19번 국도에서 금관리쪽 9km)
달천천의 마지막 절경으로 푸른색의 청석이 병풍처럼 둘러싸여 있고 깊은 못이 있어 박대소라 일컬어지는 이곳은 신선봉에서 서북쪽으로 약 1km 떨어진 곳으로 미원면 어암리에 위치해 있다.","<a href=""https://www.cheongju.go.kr/sangdang/contents.do?key=20209"" target=""_blank"" title=""청주시 문화관광 사이트로 이동"">https://www.cheongju.go.kr/</a>"
옥화식당,2875431,음식,음식점,한식,http://tong.visitkorea.or.kr/cms/resource/20/2875420_image2_1.jpg,경기도,127.146299333,37.5962982546,"옥화식당은 경기도 구리시 수택동에 있는 남도식 한돈·한우구이 전문점이다. 식당 건물 바로 앞에 주차장이 있어 편리하게 이용할 수 있다. 실내는 깔끔한 테이블에 구리색 연기 흡입 통이 있어 쾌적하게 고기를 구울 수 있다. 대표 메뉴는 14일간 숙성되어 식감이 부드럽고 쫄깃한 한돈과 한우구이이다. 다양한 쌈 채소에 고추냉이, 젓갈을 얹어 잘 구워진 고기랑 싸 먹는 재미가 있다. 또한 당일 도축한 한우로만 만 만든 한우육회도 한정 수량으로 맛볼 수 있다.","<a href=""https://okhwasikdang.modoo.at/""target=""_blank"" title=""새창 :  옥화식당사이트로 이동"">https://okhwasikdang.modoo.at/</a>"
옥화자연휴양림,127080,자연,자연관광지,자연휴양림,http://tong.visitkorea.or.kr/cms/resource/46/608246_image2_1.jpg,충청북도,127.6958861872,36.5980511753,"청주시에서 속리산국립공원으로 가는 도로 인근에 있는 옥화자연휴양림은 1999년 8월 2일 개장했다. 울창한 숲속에 오솔길과 숲속 도서관, 등산로 등이 잘 꾸며져 있어 삼림욕을 즐기기 좋다. 휴양림 내에는 숙박시설 31개동과 야영장 31사이트가 있고, 물놀이장, 족구장, 숲속 놀이터, 다목적실 등 각종 부대시설을 갖추고 있어 가족 휴양지로 인기가 많다.
숲길은 걷기 편하게 야자 매트가 깔려있고 나무그늘이 많아 시원한 바람과 자연의 소리를 들으며 산책하기 좋다. 이곳 등산로를 따라 오르면 보은군과 경계를 이루는 정상부에 일출을 볼 수 있는 전망대가 나온다. 주변에 청석굴·용소·천경대·옥화대·금봉·금관숲·가마소뿔·신선봉·박대소 등 옥화9경과 속리산 국립공원·대청호·화양동 계곡 등 관광지가 많다.
휴양림을 이용하려면 관리 사무소에 들려 관람안내를 받거나 예약 내역을 확인해야 한다. 휴양림 내 차량 진입은 숙박을 예약한 사람만 가능하다.","<a href=""https://www.foresttrip.go.kr/indvz/main.do?hmpgId=ID02030054""target=""_blank"" title=""새창: 옥화자연휴양림 "">https://www.foresttrip.go.kr/indvz/main.do?hmpgId=ID02030054</a>"
옥희와인 게스트하우스,3101944,숙박,숙박시설,게스트하우스,,경기도,126.9754927097,37.3981431886,"옥희와인 게스트하우스는 경기도 인덕원 학의천 강변 산책로에 위치한 숙소로, 은은한 음악과 향기, 온기가 반겨주는 공간이다. 객실은 1인실부터 5인실까지 다양하고, 객실에 따라 강변뷰, 숲뷰를 즐길 수 있다. 옥희와인 게스트하우스의 가장 큰 장점은 와인을 컨셉으로 한 홈바 인테리어다. 은행나무 가로수가 파노라마처럼 펼쳐진 학의천을 산책해보고, 인근의 평촌로데오와 범계로데오를 즐기기도 하며 즐거운 시간을 보내기에 좋다.","<a href=""https://okheewine2.modoo.at/"" target=""_blank"" title=""옥희와인 게스트하우스(으)로 이동"">https://okheewine2.modoo.at//</a>"
온 가족이 행복한 진주&산청 여행 코스,2619919,추천코스,가족코스,가족코스,http://tong.visitkorea.or.kr/cms/resource/17/2594917_image2_1.jpg,경상남도,127.8278613869,35.4411434995,"온 가족이 만족할 만 한 여행지는 없을까? 한방으로 우리 가족 건강도 챙기고, 다채로운 볼거리로 재미도 챙기는 일석이조 진주&산청 코스로 떠나보자.",
온가족이 함께 떠나는 제주 중문단지여행,2372025,추천코스,가족코스,가족코스,http://tong.visitkorea.or.kr/cms/resource/52/1618752_image2_1.jpg,Unknown,126.393844726,33.4121657625,"제주도는 휴양의 도시고 가족이 함께 떠나 즐기기 좋은 체험지이기도 하다. 어린 아이를 데리고도 여행이 가능한 중문단지의 볼기리, 체험거리, 맛볼거리를 두루섭렵해 보자. 여기만 보아도 아쉬울 것이 없다.",
온계종택 삼백당[한국관광 품질인증/Korea Quality],2595862,숙박,숙박시설,한옥,http://tong.visitkorea.or.kr/cms/resource/75/3021675_image2_1.jpg,경상북도,128.8304056259,36.7495632059,"온계종택 삼백당은 퇴계 이황 선생의 형인 온계 이해 선생이 살던 옛터에 복원한 한옥이다. 마을의 역사를 상징하는 500년 밤나무가 방문객을 맞이한다. 객실에 따라 화장실 겸용 욕실이나 에어컨이 설치되어 있다. 공용샤워장과 세탁실, 부엌, 창고, 대청마루는 공동으로 사용한다. 10명 이상시 방문시 사전 문의하면 야외 바비큐 시설 이용이 가능하고, 사전예약시 다기주머니만들기나 한지공예 등 유료 체험을 할 수 있다.",http://www.온계종택.한국
온계종택(삼백당),2598978,숙박,숙박시설,한옥,,경상북도,128.8278168774,36.752626695,"온계종택은 퇴계선생의 형님 집으로 독립운동으로 방화, 소실된 종택을 115년만인 2011년에 복원한 유서 깊은 종택이다.",http://온계종택.한국
온고당,2891330,음식,음식점,한식,http://tong.visitkorea.or.kr/cms/resource/21/2891321_image2_1.jpg,광주광역시,126.8451648589,35.1141245719,"따뜻하고 고집스러운 집이라는 의미의 온고당은 한정식 전문점이다. 제1주차장, 제2주차장 총 2개의 주차장을 갖추고 있어 편하게 주차할 수 있다. 가정집을 리모델링해서 만든 듯한 외관에 넓은 앞마당까지 갖추고 있어 한정식집의 분위기를 느낄 수 있다. 어르신들을 모시고 오는 가족 단위 손님들이 즐겨 찾는 곳으로, 음식 맛이 전체적으로 정갈하고 깔끔하여 부담 없이 즐길 수 있다. 당일 예약은 할 수 없고, 하루 전 사전 예약만 진행한다. 사전 예약 이외 모든 대기, 예약은 워크인&테이블링 방식으로 진행된다.","<a href=""https://www.instagram.com/ongodang_kr/""target=""_blank"" title=""새창 : 업체인스타그램 이동"">https://www.instagram.com/ongodang_kr/</a>"
