title,contentid,cat1,cat2,cat3,firstimage,region,mapx,mapy,overview,homepage
카페아를,2829378,음식,음식점,카페/전통찻집,http://tong.visitkorea.or.kr/cms/resource/68/2829368_image2_1.jpg,경기도,127.0583402929,37.707153219,"경기도 의정부시 동일로에 있는 유럽풍 베이커리 카페다. 농림축산식품부 안심식당으로 선정된 곳으로, 프랑스 도시 ‘아를’을 모티브로 했기 때문에 이국적인 유럽 스타일을 즐길 수 있다. 야외 분수를 중심으로 아름드리나무가 많고 유럽의 작은 마을을 통째 옮겨 놓은 것처럼 아기자기하게 꾸며져 있어 포토존을 찾아 이동할 필요 없이 앉은 좌석이 모두 포토존이다. 내부도 넓고 깔끔하게 꾸며져 있어 편하게 식사나 커피를 즐길 수 있지만 대기 손님이 많을 경우 자리를 먼저 잡고 주문해야 한다.",
카페아리,2854993,음식,음식점,카페/전통찻집,http://tong.visitkorea.or.kr/cms/resource/89/2854989_image2_1.jpg,경기도,127.1555169416,37.8243052279,"카페 아리는 포천시 소흘읍에 있는 브런치 카페이다. 16가지의 브런치 메뉴가 준비되어 있어 취향에 맞게 골라 먹을 수 있다. 오후 5시 전까지는 브런치 메뉴를 시키면 아메리카노가 무료로 제공된다. 나무와 꽃이 많은 정원 카페로 실내에도 많은 꽃과 화분을 배치해서 쾌적함을 느낄 수 있다. 테라스와 정원에 있는 야외 테이블, 실내 테이블, 소파 존과 텐트 존이 있어 각기 다른 분위기를 느낄 수 있다. 주말과 공휴일에는 유기농 건강 빵을 판매한다. 테라스와 정원에서는 반려동물과 함께 브런치를 즐길 수 있다. 매장 앞에 전용 주차장이 있어 편하게 이용할 수 있고 도심에서 멀지 않아 대중교통을 이용할 수도 있다.
※반려동물 동반 가능",
카페아스타나,2753798,음식,음식점,카페/전통찻집,http://tong.visitkorea.or.kr/cms/resource/01/2753901_image2_1.jpg,경기도,127.0544183698,37.2178182684,"어린이들은 마음껏 뛰어놀고 어른들은 편안히 쉴 수 있는 키즈 카페 스타일 베이커리 카페이다. 곳곳에 예쁘게 꾸며놓은 포토존이 있어 데이트 장소로도 많이 찾는다. 1층은 주차장이고 2층은 포토존, 아스타나 키즈존, 전 연령 낚시 체험가능한 미니 바이칼호수, 노키즈존, 카페 등이 있다.  대형 정글짐이 있는 아스타나 키즈존은 미리 예약하고 가야 한다.",
카페아일,2766789,음식,음식점,카페/전통찻집,http://tong.visitkorea.or.kr/cms/resource/10/2767110_image2_1.jpg,충청남도,126.3367500871,36.4930727032,"카페아일은 충남 태안군 안면읍 승언리에 있다. 카페에서 태안 앞바다를 조망할 수 있어 많은 사람이 찾는다. 대표 메뉴는 아메리카노이며 카페라테, 카푸치노, 아포가토, 고구마라테, 복숭아 아이스티 등 다양한 메뉴가 있다. 카페 주변에는 아일랜드리솜, 꽃지해수욕장이 위치해 있어 연계 관광에 나서기 수월하다.",
카페아치,2792710,음식,음식점,카페/전통찻집,http://tong.visitkorea.or.kr/cms/resource/88/2794788_image2_1.jpg,경기도,127.4627255782,37.421890904,"‘카페 아치’는 수제 구움 과자와 디저트 수제 청을 대표로 하는 카페이다.  2층 단독 건물로 이루어진 건물로 밝은 채광을 최대한 살려서 환한 분위기를 보여준다. 카페 이름처럼 실내 공간이 아치형으로 꾸며져 있다. 아치의 둥근 형태가 전체적으로 밝고 부드러운 분위기를 연출한다. 1층 커피 바는 외벽과 커피 바,  커피머신 등을 전체적으로 화이트 톤으로 하여 통창을 통한 자연 채광과 조화를 이루고 있다.  1층 안쪽은 창이 없는 대신 구석구석 아기자기한 조명과 소품들로 현대식 감각의 인테리어 분위기를 보여준다. 2층은 옹기종기 모일 수 있는 여러 테이블이 있다. 3면이 통유리로 되어 있어 채광이 좋고 카페 주변의 풍경을 두루두루 구경할 수 있다.","<a href=""https://www.instagram.com/cafe_arch_""target=""_blank"" title=""새창 : 인스타그램 이동"">https://www.instagram.com/cafe_arch_</a>"
카페언트,2770788,음식,음식점,카페/전통찻집,http://tong.visitkorea.or.kr/cms/resource/60/2771560_image2_1.jpeg,경기도,126.9915174537,37.4541925277,"카페언트는 경기도 과천시 과천동 주택가에 위치한 수제 치즈케이크가 맛있는 카페이다. 대표 메뉴인 수제 치즈케이크 외에도 스콘, 바질 샌드위치, 잠봉뵈르, 수프를 판매하고, 같이 먹을 수 있는 커피, 라떼, 티, 에이드 종류를 판매한다. 1층 창가 자리에서 우거진 숲이 창문 너머로 그림같이 보여 마치 갤러리에 온 것 같은 느낌을 준다. 지하 1층에도 층고가 높고 넓은 공간이 있어 커피를 마시며 편안하게 휴식을 취할 수 있다.",
카페얼씨,2873259,음식,음식점,카페/전통찻집,http://tong.visitkorea.or.kr/cms/resource/50/2873250_image2_1.jpg,광주광역시,126.9831569868,35.1632935748,"광주광역시 금곡동에 있는 얼씨는 '자연과 함께 힐링함'을 모토로 운영하는 디저트 카페다. 유리 하우스 안에서 무등산의 경치와 얼씨만의 커피 맛을 즐길 수 있어 연인들의 데이트 코스로도 유명하다. 내부와 외부 모두 포토존이 많아 사진 남기기 좋고 잘 손질된 정원을 바라보며 편안한 휴식과 차 한 잔의 여유를 즐길 수 있다. 반려동물 동반 입장이 가능하기 때문에 인근 주민들이 즐겨 찾는 곳이고 무등산이 가까이 하산하는 등산객들도 들러가는 코스이다. 밤이면 조명을 밝혀 아름답고 날씨가 좋은 날엔 야외 테이블도 이용할 수 있다.
※ 반려동물 동반 가능 (단, 개목줄 착용, 배설물 처리를 위한 비닐봉지 등을 구비한 이용객에 한하여 허용)","<a href=""https://www.instagram.com/cafe__earthy_""target=""_blank"" title=""새창 : 카페얼씨 사이트로 이동"">https://www.instagram.com/cafe__earthy_</a>"
카페에바다,3035852,음식,음식점,카페/전통찻집,http://tong.visitkorea.or.kr/cms/resource/41/3002641_image2_1.jpg,경기도,126.5683441098,37.2813189815,"대부도 동춘서커스 건너편 회센터 안쪽으로 1분 거리에 있는 대부도 카페에바다는 겉으로는 상가 건물이 가리고 있지만 안쪽으로는 바로 바다가 펼쳐지는 뷰맛집 카페이다. 실내 인테리어도 직접, 로스팅도 직접, 커피콩빵도 직접 구워 판매하는 이곳은 구석구석 감성 돋는 인테리어뿐만 아니라 바로 카페테라스에서 서해안 낙조를 볼 수 있는 낙조 명소 카페이다.
시그니쳐 메뉴인 대부도 라떼는 비주얼은 다소 평범해 보이지만 커피의 진한 맛과 부드럽고 고소한 맛이 느껴지면서 달콤한 맛도 살아있으며, 아메리카노는 주문하면 예가체프, 브라질, 블랜딩, 케냐 중 원하는 원두로 내려준다. 대부도의 특산물인 대부도 포도즙의 원액만을 사용하여 깊은 맛을 내는 대부도 포도차와 식용 꽃 가득한 레몬에이드에 파란 버터플라이 꽃차가 떨어지며 보라색으로 변하는 플라워에이드도 별미다. 
테라스에서 일몰을 감상하는 사람들을 위해 포근한 담요들과 방석도 넉넉하게 준비되어 있으며 오션뷰와 함께 음료와 디저트까지 즐길 수 있다.",
카페에벤에셀,3401751,음식,음식점,카페/전통찻집,,제주특별자치도,126.4858242484,33.4729771585,"카페 에벤에셀은 제주 시내 위치한 도심속의 숲, 견주들과 강아지들의 힐링 공간이라는 주제를 가지고 있는 카페이다. 규제 샌드박스를 통해 애견 동반 허가를 받아 함께 동반 식사가 가능하며, 바깥으로는 펜스가 쳐져있어 숲속 공간을 그대로 느낄 수 있다. 봄, 여름에는 숲속 그늘에서 시원한 바람을 즐길 수 있고, 가을은 높은 하늘과 어우러진 소나무를 바라보며 제주의 가을을 만끽할 수 있으며, 겨울에는 눈내리는 제주의 멋진 겨울을 느낄 수 있다.","<a href=""https://www.instagram.com/cafe_ebenezerjeju/"" target=""_blank"" title=""카페에벤에셀 사이트로 이동""https://www.instagram.com/cafe_ebenezerjeju/</a>"
카페엘빈,2689486,음식,음식점,카페/전통찻집,http://tong.visitkorea.or.kr/cms/resource/97/2684697_image2_1.jpg,서울특별시,127.0006156869,37.5856218693,테라스 좌석이 있는 곳이다. 서울특별시 종로구에 있는 카페다. 대표메뉴는 아메리카노다.,
카페엘토브,2770974,음식,음식점,카페/전통찻집,http://tong.visitkorea.or.kr/cms/resource/07/2771107_image2_1.jpeg,경기도,127.0594270972,37.1874107651,"카페 엘토브는 경기도 오산시 외삼미동에 위치한 베이커리 카페이다. 대표메뉴인 소금빵을 비롯하여 다양한 빵과 음료를 판매하고 있다. 4층 건물 전체가 카페로 1층은 주문과 테라스, 1.5층과 2층은 카페 좌석, 3층은 카페 좌석과 제빵실, 발코니 4층은 카페 좌석과 미팅룸으로 운영된다. 1.5층과 3층은 난간과 테라스가 있어 안전을 위해 노키즈존으로 운영된다. 높은 층고의 넓은 내부에는 통유리창이 있어 야외의 푸른 자연을 즐기며 휴식을 취할 수 있다. 또한 카페 밖으로 산책로가 조성되어 있으며 이곳에서 핑크 뮬리를 볼 수 있다.",
카페엠(Cafe M),1891064,음식,음식점,카페/전통찻집,http://tong.visitkorea.or.kr/cms/resource/78/2826378_image2_1.jpg,서울특별시,127.0518796383,37.51669191,"카페엠은 플랜테리어 카페로 밝은 햇살과 푸르른 식물이 어우러진 도심 속 청량한 공간이다. 대치동에 있던 카페엠이 삼성동으로 이전하면서 재즈바는 청담나인으로, 카페엠은 카페로 운영된다.","<a href=""https://www.instagram.com/cafe.m_chungdam/"" target=""_blank"" title=""새창 : 카페엠 홈페이지로 이동"">https://www.instagram.com/cafe.m_chungdam/</a>"
카페영글다,2741568,음식,음식점,카페/전통찻집,http://tong.visitkorea.or.kr/cms/resource/79/2750779_image2_1.png,경기도,127.0795201093,37.0736576062,"카페 영글다는 경기도 평택시 숲속에 있는 갤러리 카페다. 작품 전시 및 대관이 가능하다.
야외의 공간이 넓고 잔디관리가 잘 되어 있어 반려견과 마음껏 뛰어놀며 즐길 수 있다. 야외에 흔들의자와 둥근 모양의 반달 의자가 있고, 실내는 1층과 2층으로 구분되어 있다. 실내에서는 반려견을 안고 있어야 한다.",
카페옐롱,2932169,음식,음식점,카페/전통찻집,,경상북도,128.312918835,35.945770102,"카페옐롱은 성주의 청년들이 모여 관광기념품을 개발하여 판매하는 주민사업체이다. ‘지역주민이 가장 보여주고 싶은 성주의 아름다운 풍경’을 담아 성주를 방문하는 여행객들이 집으로 돌아가서 성주 여행을 리마인드 할 수 있도록 한다.
전국에서 가장 유명한 참외 산지인 성주의 장점을 담아 참외로 만든 먹거리 기념품(참외잼, 참외빵, 참외청, 참외말랭이 등) 과 성주의 풍경, 성주의 귀여운 마스코트 참별이를 이용한 기념품들을 구매할 수 있다. 상품에 이용되는 참외는 직접 생산한 참외를 사용하고 있으며, 6차 융복합인증을 받은 상품들로 구성되어 있다.
이외에도 성주의 매력을 느낄 수 있는 여러 가지 체험과 참외 음료를 맛볼 수 있다.
(일부 상품과 체험 프로그램은 예약제로 운영)","<a href=""https://blog.naver.com/charm28028""target=""_blank"" title=""새창 : 업체블로그 이동"">https://blog.naver.com/charm28028</a>"
카페오놀,2902757,음식,음식점,카페/전통찻집,http://tong.visitkorea.or.kr/cms/resource/49/2902749_image2_1.jpg,제주특별자치도,126.4394502024,33.2389272912,"카페오놀은 서귀포시 대포 포구에 있는 디저트 카페이다. 한라산 초지에서 자연 방목된 젖소로부터 당일 착유한 동물복지 우유를 사용하여 다양한 우유 음료를 제공한다. 여기에 제주에서 자라는 감귤, 애플망고, 블루베리, 레드키위, 우도 땅콩, 청귤 등 제철 과일을 활용하여 디저트를 만든다. 카페에서는 대포항이 보이고, 돌담과 곶자왈을 표현한 정원이 있으며 카페 곳곳에 제주를 표현하고 있다. 주변 여행지로 대포 주상절리, 중문 관광단지 등이 있다.","<a href=""http://cafeonol.com/""target=""_blank"" title=""새창 : 카페오놀 사이트로 이동"">http://cafeonol.com/</a>"
카페오늘,2905251,음식,음식점,카페/전통찻집,http://tong.visitkorea.or.kr/cms/resource/34/2905234_image2_1.jpg,전북특별자치도,127.1364047855,35.3728919438,"앞마당에 분수와 잔디를 갖춘 강천산과 가까운 곳에 있는 카페다. 야외 정원을 잘 꾸며놓아 날씨가 좋은 날에는 야외에서 차 한자의 여유를 즐기기 좋으며, 어린이들과 함께 방문하기에도 안성맞춤이다. 그레이 톤의 건물 외벽과 세련된 실내 인테리어로 젊은 연인들의 발길을 이끈다. 커피 맛이 좋은 카페로 알려져 있고, 커피와 잘 어울리는 조각 케이크도 준비되어 있다. 1층은 그레이톤, 2층은 화이트톤으로 같은 카페 다른 느낌을 연출한다. 순창 전통고추장 민속마을, 일품공원 등이 주변에 있어 연계 관광하기 수월하다.",
카페오도재,2906575,음식,음식점,카페/전통찻집,http://tong.visitkorea.or.kr/cms/resource/69/2906569_image2_1.jpg,경상남도,127.693109364,35.4417410545,"카페오도재는 지리산 열세 봉우리가 내려다보이는 뷰 맛집으로 오도재 너머 지리산 조망공원 안에 있다. 카페오도재에 빵은 모카 쌀빵, 크랜베리 스콘, 브라우니, 크림치즈 쌀빵, 치아바타, 팥빵, 견과 통밀빵 등 모두 우리 밀과 쌀을 사용한 빵이다. 카페오도재는 지리산 청년 농부들의 농산물과 청년 사장들의 제품으로 카페 메뉴를 만들어 믿고 먹을 수 있다. 아메리카노는 캐냐AA 마사이, 코스타리카 따라주, 과테말라 안티구아, 라오스 카티모르, 에티오피아 시다모 총 5가지 원두를 블렌딩하여 사용하며 라테는 코스타리카 따라주, 라오스 티피카, 베트남 로브스타 폴리쉬드 총 3가지 원두를 블렌딩하여 사용한다. 전용 주차장이 있다. 지리산 조망공원, 지리산조망공원휴게소 등 인접해 있어 함께 둘러보기 좋다.",
카페오라,2824975,음식,음식점,카페/전통찻집,,인천광역시,126.3735099767,37.4520790762,"카페오라는 인천광역시 중구 을왕동에 있다. 카페오라의 뜻은 커피라는 이탈리아어 카페와 해안가라는 라틴어 오라의 합성어다. 이곳은 테라스에서 바다가 한눈에 보이는 전망을 지니고 있다. 을왕리해수욕장과 가까워서 카페 외부에는 모래를 털고 들어갈 수 있는 에어건이 설치되어 있다. 내부는 1층과 2층으로 나뉘며 2층에는 테라스가 마련되어 있다. 대표 메뉴는 아메리카노, 카페라떼, 딸기 라떼, 오라특선 추억의 팬 피자, 해산물 특선 토마토 파스타, 해산물 토마토 리조또, 안심과 바닷가재 등이다. 베이커리류는 모카 번, 어니언스 빵 등이 있다. 카페 인근에는 을왕리해수욕장, 선녀바위해수욕장, 용유하늘전망대 등이 있어 연계 관광이 가능하다.
※ 반려동물 야외 테라스만 이용가능","<a href=""https://www.instagram.com/caffeora_/"" target=""_blank"" title=""새창 : 카페오라 인스타그램 페이지로 이동"">https://www.instagram.com/caffeora_/</a>"
카페오션스 강릉수제버거 경포대점,2929995,음식,음식점,서양식,http://tong.visitkorea.or.kr/cms/resource/61/2929961_image2_1.jpg,강원특별자치도,128.9142582572,37.794739046,"오션스는 경포호 인근에 있는 수제버거 카페이다. 하루 500개만 파는 수제버거집으로, 오션스 500 수제버거와 3~4인용의 씨롱버거가 인기 많은 시그니처 메뉴이다. 패티만이 아니라 번까지 직접 만드는 수제버거 전문점으로, 다양한 버거류와 수제 맥주들 그리고 순두부 젤라또까지 있어, 완벽한 한 끼를 즐길 수 있다. 대형 주차장이 준비되어 있고 단독 통유리 2층 건물로 뷰도 실내도 시원스럽다. 판매량이 정해져 있어서 일찍 마감될 수 있어, 방문 전에 문의하는 것이 좋다.",
카페오숑,2834270,음식,음식점,카페/전통찻집,http://tong.visitkorea.or.kr/cms/resource/66/2834266_image2_1.jpg,인천광역시,126.6284084412,37.469587065,"카페오숑은 수인선 신포 역 5번 출구 인근에 있는 디저트 카페다. 인천광역시 답동, 신흥초등학교 맞은편에 있으며 반려동물과 동반 입장할 수 있다. 메뉴가 다양하고 가격도 저렴해서 손님들이 많이 찾는 곳으로 버블티와 시카고피자, 크로플의 인기가 대단하다. 신포지하상가 34번 출구를 이용해도 가깝고 카페 주변으로 주변에 답동성당, 자유공원이 있어 산책 삼아 둘러보기에도 좋다.",
카페오순,2862632,음식,음식점,카페/전통찻집,http://tong.visitkorea.or.kr/cms/resource/16/2862616_image2_1.JPG,경상남도,128.9873437637,35.3118345842,"경상남도 양산시에 위치한 카페오순은 사장님이 어릴 때 살던 주택을 개조하여 만든 카페이다. 작은 마당과 본관, 별관으로 나누어진 이곳은 아늑한 분위기와 빈티지 가구로 꾸며놓아 따뜻한 감성이 느껴지는 공간이다. 처마 아래 테이블과 마당 중간중간 테이블이 놓여 있어 아이들과 함께 방문하기도 좋다. 단, 본채는 노키즈존이다. 커피류부터 에이드, 생과일주스 등 다양한 음료가 있으며, 시그니처 메뉴인 크로플은 바삭한 와플 위에 아이스크림과 브라운 치즈를 곁들여 인기가 좋다.",
카페오시오,2844710,음식,음식점,카페/전통찻집,http://tong.visitkorea.or.kr/cms/resource/06/2844706_image2_1.jpg,부산광역시,129.2509302385,35.2719106213,"부산광역시 기장군 일광면 이천리에 있는 카페오시오는 오션뷰 브런치 카페다. 지하 1층부터 2층까지 실내 좌석과 빈백, 야외 파라솔 좌석까지 많은 좌석이 있고, 전문 바리스타가 음료를 제조하여 제공한다. 브런치는 주문과 동시에 현장에서 만든다. 메뉴는 토마토 파스타, 로제 파스타, 크림 파스타, 아메리칸 브런치, 에그베네딕트, 불고기 샌드위치 등이 있다. 주차장은 가게 앞 왼쪽 공터까지 넓은 전용 주차장이 있다. 인근에 일광이천생태공원, 해동성취사, 해파랑길3코스, 임랑해수욕장 등이 있다.","<a href=""https://blog.naver.com/arasl000822""target=""_blank"" title=""새창 : 카페오시오 사이트로 이동"">https://blog.naver.com/arasl000822</a>"
카페온,2905132,음식,음식점,카페/전통찻집,http://tong.visitkorea.or.kr/cms/resource/23/2905123_image2_1.jpg,제주특별자치도,126.4794160788,33.4903751309,"카페온은 월랑초등학교 근처 주택가에 위치하고 있다. 붉은 벽돌 외관에 내부는 화이트톤과 로맨틱한 패브릭으로 꾸미고 전면에 금색, 흰색 타일이 인상적인 브런치카페이다. 브런치세트는 메인 메뉴와 아메리카노 또는 허브티를 즐길 수 있다. 대표메뉴는 미트볼, 아보카도명란덮밥이, 명란파스타가 있으며, 프렌치토스트, 샌드위치도 추천한다. 제주공항에서 가깝고 아침 일찍 영업을 시작해, 아침에 도착하는 여행자들이 브런치를 먹고 여행지로 이동하기 좋다.",
카페온담,2839090,음식,음식점,카페/전통찻집,http://tong.visitkorea.or.kr/cms/resource/78/2839078_image2_1.jpg,충청남도,127.1211218518,36.7734540708,"카페온담은 충청남도 천안시 동남구 신방동에 있다. 도심과 가까운 고즈넉한 시골에 있어서 자연친화적인 느낌이다. 세련된 외관과 차분한 인테리어가 눈에 띄는 곳이다. 대표 메뉴는 온담시그니처다. 이 밖에 솔티드 캐러멜 라테, 핑크밤, 아메리카노, 카페라테 등의 다양한 음료 메뉴를 판매하고 있다. 각종 베이커리도 맛있기로 유명해서 많은 사람이 찾는다.","<a href=""https://www.instagram.com/cafe_ondam/?igsh=OWFvbXJ1aXkwZXpk&utm_source=qr""target=""_blank"" title=""새창 : 카페온담 사이트로 이동"">https://www.instagram.com/cafe_ondam/</a>"
카페온더데스크,2911230,음식,음식점,카페/전통찻집,http://tong.visitkorea.or.kr/cms/resource/26/2911226_image2_1.jpg,경기도,127.1281819646,37.3856084907,"경기도 성남시 분당구에 있는 브런치 카페다. 독서실 및 스터디카페 브랜드인 '온더데스크'의 아자디자인 그룹에서 카페 사업에 진출하여 운영하는 곳이다. 외관과 내부 모두 모던하고 깔끔한 분위기로 잘 꾸며져 있다. 야외 테이블도 있어 날씨가 좋을 때는 밖에서 음료와 디저트를 즐길 수 있다. 시금치 연어 리소토, 아메리카노, 아이스 카푸치노, 비프 버섯 샐러드, 악마 버거, 명란 크림 파스타, 누룽지 국물 파스타, 해산물 토마토 파스타, 갈릭 통새우 피자, 바닐라 카페라테 등 여러 가지 메뉴가 준비되어 있다. 서현역 2번 출구에서 약 540m 거리에 있어 대중교통을 이용해도 좋다.",
카페와온,2876334,음식,음식점,카페/전통찻집,http://tong.visitkorea.or.kr/cms/resource/20/2876320_image2_1.JPG,전라남도,127.5248866864,34.8485465956,"순천의 와온 해변 근처 언덕에 있는 아담한 카페이다. 넓은 창과 흰색 페인트가 칠해져 있고 저녁이면 3층 건물 전체를 밝게 비추는 노란 조명과 카페로 이어지는 계단이 와온 해변과 잘 어우러진 풍경을 자아낸다. 메뉴는 커피류와 라테류, 복숭아 아이스티, 피치 블로섬 등 논 커피류 등도 다양하게 준비되어 있다. 시그니처 메뉴로는 오렌지와 파인애플 히비스커스로 만들어 와온의 노을을 표현한 와온 선셋, 콜드브루 베이스로 만든 와온_밤 아인슈페너, 크루저와 연유를 섞어 만든 돌체_밤 아인슈페너 등이 있다. 간단한 베이커리도 있어 음료와 곁들여 먹기 좋다. 3층은 어린이 제한 구역으로 운영되고 있다.","<a href=""http://instagram.com/waon_walkonair""target=""_blank"" title=""새창 : 카페와온 사이트로 이동"">http://instagram.com/waon_walkonair</a>"
카페용담,2869673,음식,음식점,카페/전통찻집,http://tong.visitkorea.or.kr/cms/resource/69/2869669_image2_1.jpg,세종특별자치시,127.2841223229,36.4226389039,"카페용담은 세종특별자치시 금남면 용담리에 있다. KBS 2TV 시사 교양 프로그램 생생정보, MBC 시사 교양 프로그램 생방송 오늘 저녁에 소개된 바 있다. 웰시코기카페로 유명하다. 이국적인 멋을 풍기는 외관과 감성적인 분위기를 연출하는 인테리어가 눈에 띈다. 내부에는 단체석이 마련되어 있어 각종 모임을 가지기 좋다. 가든이라는 별관도 있다. 대표 메뉴는 용담밀크티이며, 흑당밀크티, 초코우유, 자몽에이드, 복숭아아이스티 등 여러 가지 음료를 판다. 가래떡츄러스, 티라미수, 당근케이크 등 각종 디저트도 준비되어 있다. 신선로전통빙수로 유명하다. 남세종IC에서 가깝고, 주변에 금강수목원과 세종어린이천문대가 있다.
※ 반려동물 동반 가능(목줄, 배변봉투 지참)","<a href=""https://blog.naver.com/jsm89771""target=""_blank"" title=""새창 : 카페용담 사이트로 이동"">https://blog.naver.com/jsm89771</a>"
카페우디,3041652,음식,음식점,카페/전통찻집,http://tong.visitkorea.or.kr/cms/resource/27/3041627_image2_1.jpg,강원특별자치도,128.5952878685,38.216661635,"속초시 영랑해안길에 있는 카페 우디는 아름다운 바다 전망과 함께 커피와 디저트를 즐길 수 있는 곳이다. 다른 카페들이 현대적인 외관을 갖추는데 비해 카페우디는 산장 느낌이 나는 나무 목재를 사용하여 인테리어를 꾸몄다는 점이 인상적이다. 1, 2층 건물 모두 카페이며 각층에 테라스도 있어 야외에 나가서 시원한 동해를 볼 수 있다.
대표 메뉴로는 흑임자라떼, 아몬드 크림라떼, 솔티드 아인슈페너가 있으며, 그 밖에 차나 다양한 음료를 주문할 수 있다. 반려동물 동반 출입이 가능하다.
카페를 나가면 바로 앞에 속초등대해수욕장이 자리하고 있다. 방파제를 끼고 넓은 백사장이 있어 여름 휴가철에 많은 사람이 물놀이를 즐기는 모습을 볼 수 있다. 테라스에서 보는 해수욕장과 바다 풍경은 보는 것만으로도 편안한 휴식과 여유를 느끼게 한다.",
