title,contentid,cat1,cat2,cat3,firstimage,region,mapx,mapy,overview,homepage
천은사(구례),126366,인문(문화/예술/역사),역사관광지,사찰,,전라남도,127.4763273198,35.2731340834,"천은사는 구례읍 북쪽 9km 지점, 지리산 일주 도로 입구에 위치하고 있으며, 신라 흥덕왕 3년 (828년)에 덕운조사와 인도의 승려 ‘스루’가 터를 닦고 지은 절로서 화천양사라 하여 화엄사와 함께 지리산 3대 사찰로 손꼽힌다. 임진왜란 때 불타 없어진 것을 조선 광해군 2년(1610년)에 혜정 선사가 다시 지었으나 숙종 2년(1676년)에 불에 타버려 그 이듬해 절을 지었다가 영조 49년(1773)에 화재를 당해, 영조 51년 (1775년)에 혜암 선사가 다시 지어 오늘에 이르렀다.

천은사의 본래 이름은 828년 인도 승려와 덕운 조사가 창건할 당시 경내에 이슬처럼 맑은 차가운 샘이 있어 감로사라 했는데, 이 물을 마시면 흐렸던 정신이 맑아진다 하여 많은 스님들이 몰려들어 한때는 천명이 넘는 스님이 지내기도 했으며 고려 충렬왕 때는  남방 제일 사찰로 승격되기도 했다. 그러나 임진왜란으로 불탄 뒤 중건할 때 샘가에 큰 구렁이가 자주 나타나기에 잡아 죽였더니 샘이 솟아나지 않았다고 한다. 그래서 샘이 숨었다 하여 조선 숙종 4년(1677년)부터 천은사라 이름을 바꾸었는데, 이상하게도 이름을 바꾼 후부터  원인 모를 화재가 잦고 재화가  끊이지 않았다. 주민들도 절의 수기를 지켜주는 구렁이를 죽였기 때문이라며 두려워하였다. 이 소식을 전해 들은 조선 4대 명필의 한 사람인 원교 이광사가 지리산 천은사라는 글씨를 물 흐르는 듯한 서체로 써서 걸었더니 이후로는 화재가  일어나지 않았다고 한다. 지금도 새벽녘 고요한 시간에는 일주문 현판 글씨에서 물 흐르는 소리가 은은하게 들린다고 한다.","천은사 <a href=""http://www.choneunsa.org/"" target=""_blank"" title=""천은사 사이트로 이동"">http://www.choneunsa.org</a><br/>구례군 문화관광 <a href=""https://www.gurye.go.kr/tour/detail.do?tourId=TOUR_0000000047&menuNo=101001008000"" target=""_blank"" title=""새창 : 구례여군 문화관광 홈페이지로 이동"">https://www.gurye.go.kr/</a>"
천은사(삼척),125753,인문(문화/예술/역사),역사관광지,사찰,http://tong.visitkorea.or.kr/cms/resource/69/3039369_image2_1.jpg,강원특별자치도,129.0423936468,37.4445347532,"삼척 천은사는 강원도 삼척시 미로면 내미로리에 있는 대한불교조계종 제4교구 월정사의 말사이다. 천은사의 역사는 경덕왕 17년(738년) 인도에서 두타의 세 신선이 흰 연꽃을 가지고 와서 창건했다는 백련대까지 거슬러 올라간다. 고려 충렬왕 때 이승휴가 <제왕운기>를 저술한 곳으로, 현재 천은사 주변 일대가 사적 [이승휴 유적지]로 지정되었다. 이승휴는 용안당을 짓고 삼화사에서 불경을 빌려다 읽었다고 한다. 후에 용안당을 절에 희사하고 절의 이름을 간장암으로 바꾸었다. 광무 3년(1899)에는 이성계 4대조의 묘인 목조릉을 미로면 활기리에 만들면서, 이 절을 원당사찰로 삼아 임금의 은혜를 입었다라는 의미의 천은사로 이름을 바꾸었다. 한국전쟁 때 화재로 완전 폐허가 되다시피 하였는데 1983년 문일봉 스님이 중건하였다. 천은사 경내에는 이승휴를 기리는 사당 동안사가 있다. 봄에는 자갈이 밟히는 오솔길을 따라 걷다보면 만개한 벚꽃나무를 볼 수 있다.","<a href=""http://cafe.daum.net/cheoneunsa/"" target=""_blank"" title=""새창: 삼척 천은사 홈페이지로 이동"">http://cafe.daum.net/cheoneunsa</a>"
천은사계곡(원주),125643,자연,자연관광지,계곡,http://tong.visitkorea.or.kr/cms/resource/24/3046024_image2_1.jpg,강원특별자치도,127.9022747053,37.2302989116,"천은사계곡은 강원도 원주시 귀래면 운남리에 위치하고 있으며, 백운산 정상으로 가는 등산로 초입에 자리한 계곡이다. 전에는 명주굴로 불리었다. 계곡 아래쪽 20여 가구 마을 사람들이 옹기종기 모여살면서 비가 안 오면 제사를 지냈던 곳이 바로 명주굴이다. 명주굴은 명주실 한 타래를 풀어 연못에 넣으면 모두 들어간다고 해서 붙여진 이름으로 천은사계곡이 개발되고 난 후엔 모습을 감췄다고 한다. 
입구를 지나 계곡을 따라 올라가면 소나무를 비롯한 다양한 수종이 계곡과 함께 빽빽이 어우러져 산림욕을 즐기기에도 안성맞춤인 곳으로, 입구부터 천은사까지 500m 가량 구간에는 대부분 넓은 바위에 맑고 청아한 물이 흘러 가족단위의 휴식공간으로도 매우 적합하다.","원주 문화관광 <a href=""https://www.wonju.go.kr/tour/viewTnResrceDataT.do?resrceNo=4031&tc10=Y&sc1=20&rcpp=12&si1=50&si2=53&key=5533"" target=""_blank"" title=""원주시 문화관광 사이트로 이동""> https://www.wonju.go.kr/</a>"
천은정사,2760792,인문(문화/예술/역사),역사관광지,사찰,,경기도,127.1435556947,37.3811259536,"천은정사(天恩精舍)는 경기도 성남시 분당구 서현동 천왕산 자락에 자리를 잡고 있다. 1980년 2월 27일 혜보당 우향대종사에 의해 창건된 절로 대한불교 조계종 선학원 사찰이다. 천은정사가 있는 자리는 본래 유명한 약수터로 많은 사람이 치병과 기원을 위해 찾던 곳이라는 유래가 있다. 이 도량은 천막 법당으로 시작하여 현재 주지이신 현우 스님의 중창 불사로 대법당(극락전)과 삼성각을 건립하였고, 그 외에도 현재 천불전과 설법전등을 불사 중이다. 천은정사는 매월 초하루 법회, 보름 법회, 지장 재일, 관음재일에 기도가 행해지고 있으며, 일요일에는 가족 법회와 어린이 법회가 열리고 있다. 주지 스님께서는 경내에 있는 상락원과 보리회합창단, 만덕당에서 모이는 기금으로 미얀마 학교설립 후원을 하며 매년 성남시 노인 경로잔치와 점심 무료급식 등 나눔 봉사를 실천하고 도심 포교에 힘쓰고 있다.","<a href=""https://cheoneuntemple.modoo.at/"" target=""_blank"" title=""새창 : 천은정사 사이트로 이동"">https://cheoneuntemple.modoo.at/</a>"
천일식당,133481,음식,음식점,한식,,전라남도,126.5993165084,34.5706122138,"남도 한정식의 대가로 손꼽히는 식당. 향토음식이라는 이름으로 맛있는 집을 골라내게 한 원조집이기도 하며, 한 곳에서 3대째 80여 년을 이어내려 오고 있는 가치 있는 음식점이기도 하다. 각 도시마다 한두 곳의 이름난 한정식이 있지만 이곳 천일식당처럼 특징적인 메뉴 한두 개를 가지고 있는 곳은 드물다. 천일식당은 떡갈비 하나로 국내 최고의 명성을 얻었다. 질 좋은 소갈비를 고기만 발라낸 다음 잘게 다지고 양념을 해 하루 정도 숙성을 시켰다가 굽는다. 그러고는 함께 구운 갈비뼈 위에 얹어낸다. 고기를 구울 때는 참 숯 만을 사용하여 바삭바삭하면서도 은은한 나무 향이 베여있다. 한정식에  나오는 요리는 토하젓, 어리굴젓, 창란젓 등 젓갈과 호박전, 창포묵, 생선구이, 고추김치 그리고 계절에 따른 나물 찬 등이 다양하고 정갈하게 담겨 나온다. 천일식당에서는 오로지 떡갈비 한정식과 불고기 한정식 두 가지만 해 맛이 변치 않도록 한다고 한다.","<a href=""http://www.해남천일식당.kr"" target=""_blank"" title=""새창 : 천일식당 홈페이지로 이동"">http://www.해남천일식당.kr</a>"
천일염전,129214,자연,자연관광지,강,http://tong.visitkorea.or.kr/cms/resource/59/194959_image2_1.jpg,전라남도,126.3412224375,35.2659573244,"전라남도 영광의 무공해 천일염은 매년 3만 2천 톤(594ha)이 생산되어 전국 생산량의 10%를 차지하고 있다. 영광군의 염전 총면적은 7,240,825㎡이며 백수읍과 염산면에서만 생산된다. 바둑판처럼 반듯하게 나눠진 천일염전은 태양 아래 은빛으로 빛나는 새하얀 소금 알갱이에 눈이 부시는 장관이 연출된다.","영광 문화관광 <a href=""https://tour.yeonggwang.go.kr/main/"" target=""_blank"" title=""영광군 문화관광 사이트로 이동"">https://tour.yeonggwang.go.kr/main/</a>"
천일폭포,1580917,자연,자연관광지,폭포,,전북특별자치도,127.6911847092,35.957165925,"천일폭포는 적상산 북창마을을 지나 정상으로 가는 드라이브길 중간지점에 수십 길의 암벽을 타고 내리는 길이 약 30m의 천연 폭포다. 한 줄기의 폭포는 심산유곡의 정적을 깨고, 병풍처럼 둘러싸인 주변의 암벽은 천 길이나 높아 쏟아지는 물줄기는 마치 하늘에서 떨어지는 기분이다. 하늘 아래 단 하나뿐인 폭포라 하여 붙여진 이름이며 적상산성 북문에서 동남쪽으로 보인다.
천일폭포 주차장으로 검색해서 그곳에 차를 세우고 산길을 걸어서 10분 정도 가면 천일폭포 아래에 도착할 수 있다. 다만 이곳은 낙석이나 기타 위험 때문에 출입이 제한되고 있다. 아니면 승용차로 적상산 상부댐으로 가는 도중에 잠깐 들러 구경하기 좋다.","<a href=""https://tour.muju.go.kr/tour/selectTourCntntsDetail.do?key=506&ctgryNo=10&tourNo=137&sortTy=&searchCnd=all&searchKrwd=&pageIndex=1"" target=""_blank"" title=""새창 : 홈페이지로 이동"">https://tour.muju.go.kr</a>"
"천장굴 (울릉도, 독도 국가지질공원)",2614681,자연,자연관광지,동굴,http://tong.visitkorea.or.kr/cms/resource/78/2614678_image2_1.bmp,경상북도,131.86968908,37.2385079043,천장굴은 독도 동도의 중앙에 위치한 해식동굴로 우물과 같이 뻥 뚫려있다. 다양한 방향으로 발달한 단층들로 인해 함몰된 지형이 풍화·침식 작용을 받아 형성된 침식와지(웅덩이처럼 움푹 패인 땅)로 본다. 천장굴 급경사 지역 좌측 끝부분에 자라는 독도 사철나무는 천연기념물로 지정되었다.<br>,"울릉도·독도 지질공원 <a href=""http://ulleung.go.kr/geo"" target=""_blank"" title=""새창:울릉도·독도 지질공원"">http://ulleung.go.kr/geo</a>"
천장사(서산),482103,인문(문화/예술/역사),역사관광지,사찰,http://tong.visitkorea.or.kr/cms/resource/32/2538032_image2_1.JPG,충청남도,126.5716881018,36.6698897132,"천장사는 연암산(燕岩山)에 숨어있는 작은 절집이다. ‘천장(天藏)’이란 ‘하늘 속에 감춘다’는 뜻으로서 장자가 물가에 매어둔 배를 온전히 숨기려면 산이나 들이 아닌 배 그곳에 숨겨야 했던 말과 통하고 있다. 이처럼 천장사는 제비바위가 있는 산 중턱에 너무도 깊이 숨어 있어 하늘도 땅도 감추어진 곳이라 불리는 곳에 자리 잡고 있다. 제비바위의 가파른 봉오리로 둘러싸인 좁은 골짜기에 조성된 천장사는 이러한 산 계곡 간에 세워진 너무도 작은 절집이지만 이 집을 거쳐 간 큰 스님들로 인하여 그 어느 곳보다 큰 사찰이다. 이 천장사에는 근세에 이 땅에 선풍(禪風)을 새롭게 불러일으킨 경허스님이 일 년 석 달 동안 보림수행을 한 곳이다. 이후 송만공 대사가 이곳에서 불법을 계승한 사찰로도 널리 알려져 있다.
몇 해전 큰 산불로 인해 주위에 울창한 송림이 다 불타버려 제비바위에서 사찰 쪽을 바라보면 죽은 나무들이 둘러싼 가운데 오로지 천장사만이 푸르름을 간직하고 있어 불법의 오묘함에 옷깃을 여미게 한다. 다시 제비바위에서 눈을 돌려 남쪽을 바라보면 멀리 고북저수지가 눈에 들어오고 날씨 맑은 날에는 서해 앞바다까지 한눈에 들어온다. 산과 바다가 한눈에 들어오는 곳에 위치한 천장사는 이처럼 그 규모는 매우 작지만 선사들의 높은 뜻을 간직하고 있는 참선도량으로서, 오늘도 햇빛 잘 드는 사찰 앞마당에 서면 큰 스님들의 독경소리가 바람 소리를 헤치고 들리는 듯하다.

* 연혁 *
천장사의 연혁을 알려 줄 문헌 기록이 남아 있지 않은 형편에서, 새로운 자료의 발견 없이 정확한 연혁을 알 수가 없다. 다만 서산시청 자료인 사찰 현황을 토대로 그 역사를 재음미해 볼 필요는 있다. 즉 위 자료에서 천장사는 “서기 633년에 백제의 담화(曇和) 선사가 수도하기 위하여 창건하였다고 전하며 조선말에는 경허선사가 수도하고 송만공대사가 이곳에서 득도한 고찰이다”라고 기록되어 있다. 먼저 창건주인 담화선사가 누구인지 밝히기가 어렵다. 참고로 삼국사기에서 거의 같은 시대의 신라에 담화라는 스님이 있었으며, 그는 620년(신라 진평왕 42년)에 안흥법사가 황룡사에서 머물면서 번역한 경전인 『전단향화성광묘녀경』을 받아 썼다고 한다. 또 한가지 천장사가 창건되었다고 한 633년의 다음 해인 634년(백제 무왕 35년) 2월에는 백제 흥왕사가 낙성 되었고, 신라에서는 분황사가 낙성되었음을 기억해 둘 필요가 있을 것 이다. 한편 현재의 법당 앞에 있는 7층석탑(문화재자료)이 고려시대 석탑의 양식적 특징을 어느 정도 보여 주고 있어서 고려시대 것으로 추정되고 있다는 점을 감안하면, 단언할 수는 없지만 천장사가 조그만 암자로서 석탑을 갖춘 채 고려시대 언제인가부터는 현재의 자리에 창건되었으리라고 짐작해 볼 수 있다. 그러나 이후 오랜 세월 동안의 연혁에 대해서는 유물이나 문헌기록이 남아 있지 않아 밝히기 어렵다. 다만 조선말기 이래로 선풍을 널리 떨친 고승인 경허 성우(鏡虛 惺牛, 1849-1912) 스님이 천장사에 머물면서 수도하는 한편 후학을 지도했다. 또 이곳에서는 만공 월면(滿空 月面, 1871-1946) 스님이 경허 스님의 제자로 이 절에서 출가하여 불법을 계승했다는 사실이 알려져 있을 뿐이다. 이 시기의 유물로는 1896년(건양원년) 5월에 조성된 신중탱이 남아 있다. 한편 이 절의 연혁과는 직접 연관이 없지만 관음사후불탱으로 조성된 1788년(정조12년)작 불화가 법당 불단 뒤 후불탱으로 걸려 있는 것은 주목할 만하다.","<a href=""http://cafe.daum.net/amjaesa/"" target=""_blank"" title=""천장사 사이트로 이동"">http://cafe.daum.net/amjaesa</a>"
천장호,127563,자연,자연관광지,호수,,충청남도,126.9166054894,36.4151666378,"깨끗한 물과 수려한 경관을 자랑하는 천장호는 칠갑산 동쪽 기슭의 36번 국도변에 위치하고 있다. 1,200㏊의 농경지 관개용 저수지로 1972년 12월부터 약 7년에 걸쳐 축조한 것이다. 칠갑산자연휴양림에서 11㎞ 떨어진 칠갑산 산등성이에 자리잡고 있으며, 깨끗한 수면과 빼어난 주변 경관이 어우러져 청양명승 10선 가운데 하나로 꼽힌다. 천장호의 아름다운 경관인 안개와 구름이 내려 덮이고 걷히는 모습은 칠갑산의 경관과 어우러져 장관을 이룬다. 특히 청양과 대전을 잇는 국도변에 있는 인공호반으로서 많은 사람들의 눈길을 머물게 한다. 맑고 푸른 물은 호수면이 고요하고 호수 안으로 뻗어 들어간 산자락이 더욱 그 경치를 돋우고 있다. 이른 봄에 잡히는 빙어는 천장호의 새로운 먹을거리로 떠오르고 있어 해마다 관광객과 낚시꾼이 증가하고 있다. 고요한 호수면을 바라보며 낚시를 즐기는 강태공의 모습은 보는 이로 하여금, 일상을 떠나 한가로움을 느끼게 한다.

특히, 황룡정 입구에서  천장호를 가로지르는 출렁다리인 네트를 소재로 한 에코워크 시설은 네트 워크 코스, 네트 브릿지 코스, 네트 타워 코스, 네트 어드벤처브릿지 코스 등 4가지 테마로 전체 길이 177m 구간에 23개의 체험요소로 형성되어 천장호를 찾는 관광객에게 색다른 체험을 제공한다. 별도의 안전장비 없이 체험하는 에코워크는 안전요원이 배치되지 않아도 되는 국내최초 독창적인 어드벤쳐 시설물로 수상에서 최대 10m 높이 위의 네트 브릿지에서 스릴을 체험할 수 있으며 아름다운 천장호 자연경관도 함께 즐길 수 있다. 또한 2,000㎡ 규모의 생태체험원이 천장호 수변에 설치되어 가족단위 관광객이 머루며 쉬어갈 수 있는 공간을 제공한다.","<a href=""https://www.cheongyang.go.kr/tour/sub01_01_12.do"" target=""_blank"" title=""새창 : 홈페이지로 이동"">https://www.cheongyang.go.kr/</a>"
천장호 출렁다리,1937712,인문(문화/예술/역사),건축/조형물,다리/대교,,충청남도,126.9218244804,36.4145862397,"천장호 출렁다리는 청양의 명물이다. 2009년에 만들어졌으며 총길이 207m로 우리나라에서 가장 긴 출렁다리다. 다리 중간 부분에 청양의 특산물 구기자와 고추를 형상화한 높이 16m의 주탑이 시선을 끈다. 그 아래를 지나 폭 1.5m의 출렁다리가 시작되는데 20m쯤 걸어가면 상하 좌우로 출렁이며 은근한 스릴을 선사한다. 출렁다리는 30~40cm 흔들리게 설계됐다. 다리를 건너면 전망대와 칠갑산으로 향하는 등산로가 이어진다. 산행이 버거운 이들은 황룡정(黃龍亭)까지 천장호변을 산책해도 좋다. 천장호 출렁다리가 있는 천장호는 동쪽으로 뻗어 내린 칠갑산 자락 끝에 위치하고 있다. 청양명승 중에 하나로 꼽힐 만큼 빼어난 절경을 자랑하는데 칠갑산 정상으로 연결된 등산로가 개설되어 있어 천장호와 출렁다리, 우거진 숲과 아기자기한 계곡들을 감상하는 또 다른 매력을 만끽할 수 있다. 특히, 야간개장과 함께 천장호 출렁다리의 색다른 매력을 느껴보자.","<a href=""https://www.cheongyang.go.kr/tour.do"" target=""_blank"" title=""새창 : 청양문화관광홈페이지로 이동"">https://www.cheongyang.go.kr/tour.do</a>"
천적생태과학관,1798541,인문(문화/예술/역사),문화시설,전시관,,경상남도,127.9233745229,35.6745576914,"천적생태과학관은 거창 사과테마파크 부지내에 있으며, 곤충과 관련된 천적에 관한 자료의 발굴, 수집 보존, 관리 및 전시하며, 천적에 대한 전문적, 학술적인 조사와 연구, 천적을 이용한 체험, 탐구, 교육프로그램 운영하고 있으며, 2011년 10월 개관 하였다.                                                           
천적의 자연생태계와 농림생태계에서의 역할에 대해 설명하고 천적의 이용, 대량생산, 제품화 등의 과정을 체험한다. 농업에서 천적의 이용 방법에 대해 체험하고 중요성에 대해 배우며, 천적도 우리와 밀접한 관계를 갖고 있음을 보고, 듣고, 체험하고 느끼는 기회를 가질 수 있다.","<a href=""http://www.천적생태과학관.net"" target=""_blank"" title=""새창 : 천적생태과학관으로 이동"">http://www.천적생태과학관.net</a>"
천전리 지석묘군,2713413,인문(문화/예술/역사),역사관광지,유적지/사적지,http://tong.visitkorea.or.kr/cms/resource/17/3382717_image2_1.JPG,강원특별자치도,127.7758128264,37.9299488134,"지석묘는 청동기시대의 대표적인 무덤으로 고인돌이라고도 부르며, 주로 경제력이 있거나 정치권력을 가진 지배층의 무덤으로 알려져 있다. 우리나라의 고인돌은 4개의 받침돌을 세워 지상에 무덤방을 만들고 그 위에 거대하고 평평한 덮개돌을 올려놓은 탁자식과, 땅 속에 무덤방을 만들고 작은 받침돌을 세운 뒤 그 위에 덮개돌을 올린 바둑판식으로 구분된다. 강원특별자치도 춘천 천전리에 있는 이 고인돌은 탁자식으로 발굴조사 때 10기가 무리 지어 있었으나 현재는 5기가 남아있다. 덮개돌의 길이는 2.6∼2.2m 정도이고, 받침돌의 높이는 1.12m이며 돌화살촉 3개, 대롱구슬, 민무늬토기 조각 등이 다량으로 출토되었다. 춘천 천전리 지역에서 고인돌이 무리 지어 발견된다는 점은 이미 춘천분지에서 부족사회가 형성되었음을 의미한다. 또한 민무늬토기를 사용하면서 소양강변에서 농경생활을 하였다는 것을 짐작할 수 있어 우리나라 선사시대 연구에 중요한 유적으로 평가된다.
(출처 : 국가유산청)","<a href=""https://www.heritage.go.kr/heri/cul/culSelectDetail.do?culPageNo=1&region=1&searchCondition=%EC%B2%9C%EC%A0%84%EB%A6%AC+%EC%A7%80%EC%84%9D%EB%AC%98%EA%B5%B0&searchCondition2=&ccbaKdcd=23&ccbaAsno=00040000&ccbaCtcd=32&ccbaCpno=2333200040000&ccbaCndt=&ccbaLcto=&stCcbaAsdt=&endCcbaAsdt=&header=view&returnUrl=%2Fheri%2Fcul%2FculSelectViewList.do&pageNo=1_1_1_0&p=multiSch&sortType=&sortOrd=&sngl=Y&s_kdcdArr=00&s_ctcdArr=00&ccbaPcd1Arr=99&ccbaGcodeArr=00"" title=""홈페이지로 이동"">https://www.khs.go.kr/main.html</a>"
천전리각석계곡(울산),126068,자연,자연관광지,계곡,http://tong.visitkorea.or.kr/cms/resource/72/2364272_image2_1.jpg,울산광역시,129.1695751274,35.6096544965,"천전리각석 계곡은 주변의 빼어난 경관을 자랑하는 계곡으로, 이곳을 흐르는 물은 맑고 깨끗하며, 사철 수량이 풍부하다. 특히, 울산시에서 소장하고 있는 2점의 국보 중에서 하나인, 국보 울주 천전리각석이 위치하고 있다. 가까운 곳에는 신라 공신 박제상의 유적지인 치산서원, 망부석, 은을암 등이 예로부터 내려오는 전설을 간직한 채 찾아오는 이들을 기다리고 있다. 또, 수령 500여 년의 높이 223m, 가슴 높이의 둘레가 12m에 이르는 거목인, 두서면 은행나무가 천연기념물로 지정되어 있다. 천전리 앞 계곡은 한국수자원공사에서 나와서 수질관리를 하는 곳으로 물에 발을 담글 수 있는 곳이 아니므로 주의하여야 한다.","울주 문화관광 <a href=""http://tour.ulju.ulsan.kr"" target=""_blank"" title=""울주 문화관광 사이트로 이동"">http://tour.ulju.ulsan.kr</a>"
천전리공룡발자국화석,128192,자연,관광자원,기암괴석,http://tong.visitkorea.or.kr/cms/resource/42/3049142_image2_1.JPG,울산광역시,129.1773798662,35.614440215,"천전리의 공룡발자국 화석은 약 1억 년 전 백악기 시대에 살았던 중대형 공룡들의 것으로 귀중한 자연사 자료이다. 천전리 공룡발자국 화석은 천전리 각석 맞은편, 대곡천 하천의 경상 누층군 대구층에 해당하는 암석 위에 드러나 있으며, 바위 위에 남아 있는 것은 대형 초식공룡인 한외룡(울트라사우루스)을 비롯한 용각룡 열 마리의 발자국과, 중형 초식공룡인 조각류 이구아나룡에 속하는 고성룡(고성고사우루스) 한 마리의 발자국 등 2백여 개가 확인되고 있다. 
나타난 발자국들의 흔적으로 보아 공룡들이 일정한 방향으로 이동한 것이 아니고 자유롭게 돌아다닌 것으로 보아, 이 일대가 공룡의 생활공간이었음을 알 수 있다. 공룡들이 아열대 기후의 대평원이나 하천, 평야에 살았던 것으로 알려져 있어, 이곳 일대가 먼 과거에는 열대 무역풍의 영향을 받는 사바나 지역이었음을 말해주고 있다.
공룡발자국 화석 AR 앱을 다운로드하여 이곳을 방문하면 백악기 공룡들의 모습을 증강현실로 만나 볼 수 있으며 공룡과 함께 사진촬영도 하고 공룡 수집도 하는 등의 특별한 체험이 가능하다.","울주 문화관광<a href=""https://www.ulju.ulsan.kr/tour/tursm/view.do?category=history&mId=0103000000&idx=82"" target=""_blank"" title=""새창 : 울주 문화관광 홈페이지로 이동"">https://www.ulju.ulsan.kr/tour</a>문화재청 <a href=""https://www.heritage.go.kr/heri/cul/culSelectDetail.do?pageNo=1_1_1_1&sngl=Y&ccbaCpno=3412600060000"" target=""_blank"" title=""새창 : 문화재청 홈페이지로 이동"">https://www.cha.go.kr</a"
