title,contentid,cat1,cat2,cat3,firstimage,region,mapx,mapy,overview,homepage
환벽당 ·조대,127401,인문(문화/예술/역사),역사관광지,유적지/사적지,http://tong.visitkorea.or.kr/cms/resource/47/3350747_image2_1.jpg,광주광역시,127.0028269101,35.1855608382,"송강 정철의 설화가 있는 곳, 환벽당 ·조대 *<br /><br />담양 가사문화권역에 있는 환벽당은 광주호 상류 충효 동쪽 높다란 언덕위에 자리하고 있다. 나주목사(羅州牧使)를 지낸 김윤제(金允悌:1501∼1572)가 낙향하여 창건하고 육영(育英)에 힘쓰던 곳이다. 당호(堂號)는 영천자 신잠(靈川子 申潛)이 지었으며, 벽간당(碧澗堂)이라고도 불렀음이 고경명(高敬命)의 유서석록(遺書石綠)에 기록되어 있다. 환벽당은 홍문관 교리, 나주 목사 등 13개 고을의 성주를 역임한 후 고향으로 돌아온 사촌 김윤제(1501~1572)가 창건하고 육영에 힘쓰던 곳인데, 송강 정철, 사하당 김성원 등이 대표적인 제자다.<br /><br />* 환벽당 및 용소에 얽힌 송강 정철의 전설과 조대 *<br /><br />환벽당 인근에 위치한 용소는 창계천의 깊은 물 웅덩이를 말한다. 이곳은 송강 정철에 대한 전설이 얽힌 곳이기도 하다. 전설에 의하면 환벽당에서 사촌이 낮잠을 자는데 꿈에 환벽 당 앞 용소에서 청룡이 하늘로 승천하는 것이었다. 꿈에서 깨어나 이를 괴이히 여겨 하인을 시켜 살펴보라 하였는데 어린 동자가 목욕을 하고 있었다. 이 동자가 바로 집안이 역적으로 몰려 피신하는 길에 잠시 쉬고 있던 송강 정철이다. 사촌이 송강을 불러 문답하는 중에 그 영특함에 놀라 자기 슬하에 두고 학문을 닦게 하여 송 강 나이 17세에 그를 외손녀 사위로 삼고 정철의 뒷바라지를 했다. 용소 옆에는 송강이 이곳에서 낚싯대를 드리우고 고기를 잡았다는 조대가 있다.","<a href=""http://culture.bukgu.gwangju.kr"" target=""_blank"" title=""새창: 광주시 북구청 문화관광 홈페이지로 이동"">http://culture.bukgu.gwangju.kr</a><br />
<a href=""http://www.cha.go.kr"" target=""_blank"" title=""새창: 문화재청 홈페이지로 이동"">http://www.cha.go.kr</a>"
환봉서원,1957326,인문(문화/예술/역사),역사관광지,유적지/사적지,http://tong.visitkorea.or.kr/cms/resource/76/3358776_image2_1.JPG,전북특별자치도,127.2844481101,35.33927607,"서원은 훌륭한 유학자의 제사를 지내고 지역민을 교육하기 위하여 설립한 조선시대 지방의 사립 교육기관이다. 환봉서원은 임진왜란, 정유왜란을 진압하기 위해 명나라의 구원군 철기 2만을 거느리고 원정하여 혁혁한 전공을 세운 총독장 천만리를 주향하고, 함께 원정 온 상과 희의 두 아들을 아울러 배향하고 있다. 천만리 장군은 조선 선조 때 우리나라에 귀화한 중국인으로, 아호는 사암이고 일찍이 무예에 능하여 특히 활쏘기의 명수였다. 오늘날 천씨들은 이곳을 본관으로 삼는다.","<a href=""http://www.namwon.go.kr/tour/index.do"" target=""_blank"" title=""새창: 남원 문화관광 홈페이지로 이동"">http://www.namwon.go.kr/tour/index.do</a>"
환산정(環山亭),127346,인문(문화/예술/역사),역사관광지,유적지/사적지,http://tong.visitkorea.or.kr/cms/resource/72/2706272_image2_1.jpg,전라남도,127.0358245258,35.0539679121,"환산정은 화순군 서성저수지 안에 위치해 있어 물 위에 떠 있는 것처럼 보인다. 주변 풍경이 산수가 뛰어나고, 앞쪽에 펼쳐진 서암산의 적벽이 장관을 이루고 있다. 1965년 서성저수지가 축조되면서 상류 한가운데 섬처럼 자리 잡게 된 것이다. 서성저수지가 만조에 가까울수록 환산정의 비경은 빛을 발한다고 한다. 

환산정은 백천 류함이 17세 전반에 축조한 누정이다. 병자호란이 발생하자 류함은 1637년 의병을 일으켜 청주까지 진격해 갔다. 그런데 인조가 강화를 체결했다는 소식을 듣고, 의병을 해산한 후, 이곳으로 내려와 환산정을 짓고 은거하였다고 한다. 17세기 처음 정자가 지어질 때는 방 한 칸의 초가였다. 이후 퇴락한 것을 1896년 후손들이 중건하였다. 또한, 원래 서성저수지가 만들어지기 전에는 담장을 치고 솟을대문도 있었다고 한다. 그러나 서성서수지로 물이 잠기면서 담장을 없어지고 솟을대문도 현재의 위치로 옮겨졌다. 환산정 현판이 안쪽 창방에 걸려 있으며, 원운 15개의 편액도 함께 걸려 있다. 조선시대 이 지역 정자의 전형을 충실하게 보여주는 건물이다.","<a href=""https://www.hwasun.go.kr/gallery.do?S=S05&M=010206000000&b_code=0000000100&v_type=CU1&b_list=16&act=view&list_no=27&nPage=4&vlist_no_npage=12&keyField=&keyWord="" target=""_blank"" title=""새창 : 화순군 문화관광 홈페이지로 이동"">https://www.hwasun.go.kr/culture/</a>"
환상숲곶자왈공원,2946628,자연,자연관광지,자연휴양림,http://tong.visitkorea.or.kr/cms/resource/67/2947167_image2_1.jpg,제주특별자치도,126.262930332,33.322431959,곶자왈은 제주도에 위치한 특정한 숲 지대를 일컫는 말로 용암이 분출되어 흐르며 남긴 현무암 사이로 식물이 함께 살면서 형성해 놓은 원시림이다. 용암이 형성해 놓은 공기통로와 요철형의 지형적 특성 때문에 같은 곶자왈 내에서도 다른 기후 환경이 형성되어 남방계 식물과 북방계 식물이 함께 관찰되는 독특한 생태계를 자랑한다. 흙이 아닌 용암 지형 위에 다양한 동식물이 자생하는 이곳은 제주만의 독특한 원시 생태를 잘 보여준다. 양치식물과 거대한 나무의 뿌리가 얽힌 풍경 안으로 들어서면 시간과 공간이 바뀌는 듯한 경험을 하게 된다. ‘환상숲 곶자왈공원’은 1시간마다 숲 해설 투어가 진행되며 사전 예약이 필요하다. 그리고 이곳은 신비로운 분위기로 여러 뮤직비디오 촬영지로 활용된 곳으로 대표적으로 2015년도에 발매된 에프엑스 4 walls 뮤직비디오 촬영지의 배경이 된 곳이다.,"<a href=""https://hwansangforest.modoo.at/""target=""_blank"" title=""새창 : 업체홈페이지 이동"">https://hwansangforest.modoo.at/</a>"
환상의바다 리조트(환상의바다),2770540,인문(문화/예술/역사),휴양관광지,관광단지,http://tong.visitkorea.or.kr/cms/resource/34/2772134_image2_1.jpg,충청남도,126.507264139,36.3237811683,"환상의바다 리조트는 충남 보령시 신흑동 대천해수욕장 인근에 자리 잡고 있다. 리조트에는 호텔동 객실과 취사가 가능한 A동, B동, C동, D동 객실이 마련되어 있다. 총 객실 수는 40개다. 리조트 뒤에는 대천 앞바다를 조망할 수 있는 전망대가 설치되어 있어 산책 삼아 둘러보기 좋다.","<a href=""http://www.oceanoffantasy.com/"" target=""_blank"" title=""새창 : 환상의바다 리조트(환상의바다) 사이트로 이동"">http://www.oceanoffantasy.com/</a>"
환상의성,397687,숙박,숙박시설,펜션,http://tong.visitkorea.or.kr/cms/resource/58/1815658_image2_1.jpg,강원특별자치도,128.6727285764,37.9324267267,"어성전 계곡에서 남대천으로 흘러가는 물줄기를 따라 산 중턱쯤 위치한 환상의성은 나무가 많아 시원한 그늘이 있는 곳, 물이 맑아 마음까지 상쾌해지는 곳이다.","<a href=""http://www.hwansang.co.kr"" target=""_blank"" title=""새창 : 환상의성 홈페이지로 이동"">http://www.hwansang.co.kr</a>"
환상의정원(팽나무10리길),3008072,자연,자연관광지,자연생태관광지,,전라남도,125.9320554501,34.708677531,"도초도의 관문인 화도 선착장에서 시작한 수로 둑에 팽나무가 늘어섰는데, 10리가 좀 못 되지만 ‘팽나무 10리길’이라 하며 수국공원까지 이어지는 3.2km의 길이다. 수령 70~100년 된 팽나무 700여 그루가 터널을 이루고 팽나무 아래에 심어져 있는 수국이 어우러진 환상의 정원은 걷기만 해도 힐링이 되는 느낌이다. 수국뿐만 아니라 수레국화와 패랭이, 니포피아 등도 함께 꽃을 피어 아름다움을 뽐낸다. 
환상의정원에 있는 팽나무의 일부는 충청도와 경상도에서, 대개는 고흥과 해남, 장흥 등 전남 해안 지역에서 기증받아 옮겨 심었다. 멀리 타향에서 환상의정원으로 온 팽나무는 저마다 출신 지역을 표시한 이름표를 달고 있다. 조성 초기 주민들의 반응은 처음에는 그리 좋지 않았지만, 팽나무길 조성 취지에 마음을 돌린 주민들이 함께 힘을 보태면서 완성한 환상의 정원은 2021년 산림청이 주관하는 ‘녹색 도시 우수 사례 공모전’ 가로수 부문에서 우수상을 수상했다. 팽나무 10리길과 나란히 흐르는 월포천은 농업용 수로지만 강처럼 널찍해 제법 운치가 있으며 산등성이 아래 탁 트인 논이 시원하게 펼쳐진다. 
환상의정원(팽나무 10리길) 끝자락에 자리 잡은 수국공원은 넓은 부지에 다양한 수국을 테마로 조성했다. 여기에 산수국, 나무수국, 불두화 등 수국 15종 3만여 그루, 애기동백나무와 향나무 등을 심었다. 해마다 6월이면 형형색색 수백만 송이의 수국이 피어 장관이다.","<a href=""https://tour.shinan.go.kr/home/tour/island_tour/docho/place/place_06/page.wscms"" target=""_blank"" title=""새창 : 홈페이지로 이동"">https://tour.shinan.go.kr/</a>"
환선굴 (대이리 동굴지대),126729,자연,자연관광지,동굴,,강원특별자치도,129.0212519227,37.3264090504,"환선굴은 약 5억 3천만 년 전에 생성된 석회암 동굴로, 동양최대의 크기이다. 동굴내부에는 미인상, 거북이, 항아리 등 여러 모양의 종유석, 석순, 석주가 웅장하게 잘 발달되어 있다. 환선굴에서 발견된 동물은 모두 47종이며, 이 중에서 환선장님좀딱정벌레 등 4종이 환선굴에서만 발견되거나 환선굴이 모식산지로 기록되어 있다. 2010년 4월부터 환선굴 모노레일 운행을 시작하여 좀 더 쉽게 환선굴을 관람할 수 있게 되었다.  

[출처: 삼척문화관광]","<a href=""https://www.samcheok.go.kr/tour/01456/01464/02195.web"" target=""_blank"" title=""새창: 삼척 문화관광 홈페이지로 이동"">http://www.samcheok.go.kr/tour.web</a>"
환선밥상,2806198,음식,음식점,한식,,강원특별자치도,129.0401112205,37.3305283876,"환선밥상은 환선굴, 대금굴 가는 길에 있는 식당으로 다양한 한식 메뉴를 맛 볼 수 있다.",
환성정,1614390,인문(문화/예술/역사),역사관광지,유적지/사적지,http://tong.visitkorea.or.kr/cms/resource/14/3349014_image2_1.jpg,대구광역시,128.5934474273,35.9250303832,"환성정은 1582년(선조 15) 이주가 27세에 금호강 변에 건립하였다. 임진왜란때 대구지방에서 의병장으로 활약한 이주는 조선의 학자이며 성리학을 연구했다. 선조 25년 임진왜란이 일어나자 서사원과 함께 창의하여 의병을 모집, 군량을 조달하고 초유사 김성일의 소모관으로 있었으며 뒤이어 체찰사 이덕형의 추천으로 조정의 부름을 받았으나 사양하고 향리에 묻혀 학문에 전념하다 서계서원에 배향되었다. 
환성정은 이주가 타계한 후 없어졌다가 1902년 이주의 9세 손인 수헌 이억상이 지금의 자리에 중수했다. 정자는 6칸이었고 동쪽에 건 편액이 경의재, 서쪽은 체인재다. 1971년에는 11세손 회연 이순희가 다시 중수했다. 
조선 후기에 연재 송병선, 심석재, 송변순 형제와 면암 최익현 등 많은 우국지사들이 이 곳에 방문하여 교유하고 강학을 하며, 대구지역 최고의 정자 중 하나로 자리매김 했다. 
환성정은 서계서원의 경내에 있으며, 인천 이씨 서계서원 보존회에서 관리하고  환성정 현판은 대원군의 친필이다.
경내의 배롱나무는 2018년 보호수로 지정되었고 수령 270년, 높이 10m, 가슴높이 나무둘레는 115㎝이며 가지가 갈라진 쌍간 나무이다. 이 보호수 외에도 총 10그루의 배롱나무가 꽃등처럼 경내를 환하게 밝혀  탐방객들을 반갑게 맞이 하고 있다.","<a href=""https://www.grandculture.net/daegu/bukgu/dir/GC40004467"" target=""_blank"" title=""새창 : 대구역사문화대전 홈페이지로 이동"">https://www.grandculture.net/daegu</a>"
환스닭갈비,2915651,음식,음식점,한식,http://tong.visitkorea.or.kr/cms/resource/40/2915640_image2_1.jpg,대전광역시,127.392690365,36.4231546602,"환스닭갈비는 대전광역시 유성구 관평동에 위치하고 있는 닭갈비 맛집이다. 
대표 메뉴는 30년 전통의 춘천식 양념을 더한 닭갈비며, 치즈닭갈비와 주꾸미닭갈비도 인기가 많다. 순한 맛, 중간맛, 매운맛 중에서 선택할 수 있고 후식 메뉴로 막국수, 치즈볶음밥, 날치알볶음밥, 어린이주먹밥 등이 준비되어 있다.",
환여횟집,403868,음식,음식점,한식,http://tong.visitkorea.or.kr/cms/resource/88/3063888_image2_1.jpg,경상북도,129.3840766907,36.0644627836,"포항 환여횟집은 방송에도 소개된 적 있는 물회 맛집이다. 1층은 물회, 2층은 회를 먹을 수 있도록 자리를 구분해 놓은 것이 특징이다. 
대표 메뉴는 살얼음이 떠 있는 고추장 양념에 회, 야채를 부어 버무린 뒤 국수사리를 말아먹는 물회 국수이다. 물회를 주문하면 함께 나오는 매운탕 역시 얼큰하고 시원하다. 이 밖에도 맛볼 수 있는 메뉴로는 회덮밥, 전복죽, 모둠회 등이 있다.",
환영식당,2923959,음식,음식점,한식,http://tong.visitkorea.or.kr/cms/resource/52/2923952_image2_1.jpg,전라남도,127.6319841367,34.7980652155,"덕양곱창거리 안에 있는 여수 현지 주민들이 즐겨 찾는 곱창전골 전문점이다. 곱창을 즐겨 먹는 사람들 사이에서는 소문난 맛집으로 통한다. 가게 앞에 넓은 주차장이 마련되어 있어, 주차 걱정 없이 편하게 방문할 수 있다. 가성비 좋은 곳으로도 알려져, 부담 없이 즐길 수 있다. 소곱창전골, 돼지곱창전골을 모두 취급하고 있어, 입맛에 맞게 골라 먹을 수 있다. 구이 메뉴는 초벌로 익혀 나오는 만큼 다소 시간이 소요되는 점은 감안해야 한다. 당면과 깻잎이 무한으로 제공된다. 가족 외식 장소로도 추천할 만하다. 여수공항과 여천역 사이에 있어 접근성이 좋다.",
환영키친,2877950,음식,음식점,서양식,http://tong.visitkorea.or.kr/cms/resource/47/2877947_image2_1.jpg,제주특별자치도,126.7818624665,33.4714903929,"환영키친은 작은 마을 송당리에 제주 돌집의 고즈넉한 분위기의 양식집이다. 오너셰프가 혼자 운영하는 식당으로, 해물짬뽕파스타가 유명한 곳이다. 딱새우와 갖가지 해물들이 들어가며, 매콤한 짬뽕의 맛과 토마토 파스타 맛이 어우러졌다. 수제로 만든 함박패티와 소스로 정성껏 요리한 함박스테이크, 새우를 올리브유에 튀겨 빵과 같이 찍어먹는 감바스 알 아히요 등 다양한 양식을 맛볼 수 있다. 또, 환영키친의 시그니처 칵테일인 제주마티니, 새콤달콤의 절정인 매실토닉 등 환영키친에서만 마실 수 있는 술도 준비되어 있다. 이곳은 소형견 출입이 가능하며, 예스 키즈존으로 아이가 있는 가족들도 외식하기 좋은 식당이다.",
환이네 이태리식당,2847702,음식,음식점,서양식,http://tong.visitkorea.or.kr/cms/resource/91/2847691_image2_1.jpg,제주특별자치도,126.2969016396,33.2307648414,"환이네 이태리식당은 제주특별자치도 서귀포시 안덕면 사계리에 있다. 외관은 피코크 블루와 화이트 칼라로 심플하고, 내부는 자개장과 플랜테리어, 빈티지한 소품들로 다채롭다. 메뉴는 그란치오 로제 파스타, 명란 오일 파스타, 카프레제 샐러드, 뇨끼 등이고, 정성스러운 이탈리아 음식으로 인기가 많다. 특히 트러플 뇨끼가 유명하고, 별도로 치아바타 등 직접 만든 빵도 판매한다. 근처 여행지로 사계해안, 황우치해안, 송악산 등이 있다.",
환장라멘,2848974,음식,음식점,일식,http://tong.visitkorea.or.kr/cms/resource/84/2848584_image2_1.jpg,울산광역시,129.3635639256,35.6030144481,"울산광역시 북구 송정동 한양수자인 아파트 단지 내에 있는 환장라멘은 라멘 맛집이다. 돼지 사골과 닭발로 우려낸 한국식 돈코츠라멘인 환장라멘과 특제소스가 들어간 매운 더환장라멘, 방아잎과 산초가루가 들어간 어탕 맛 라멘인 해장라멘이 대표 메뉴다. 가게 내부는 일본 가정집처럼 아담하게 꾸며 놓았다. 매일 하루 100그릇 한정 수량만 판매하고, 주차는 한양수자인 상가주차장 또는 아파트 주차장에 무료로 가능하다. 박상진의사송정역사공원이 인접해 있어 함께 둘러보기 좋다.","<a href=""https://www.instagram.com/__h.z_ramen/""target=""_blank"" title=""새창 : 환장라멘 사이트로 이동"">https://www.instagram.com/__h.z_ramen/</a>"
환타지콜라보리조트,3078069,숙박,숙박시설,콘도미니엄,,경기도,127.4944221384,37.8242475528,"가평에 있는 환타지콜라보리조트는 피톤치드 가득한 잣나무 숲으로 둘러싸여 있으며 밤하늘의 별들을 바라볼 수 있는 곳이다. 판타지동에는 실내 온수풀이 있고, 콜라보동에는 5월부터 9월까지 야외 온수 수영장을 운영하여 남녀노소 누구나 휴식과 함께 즐거운 물놀이를 할 수 있다. 북유럽풍의 인테리어와 호텔식 침구로 편안하게 쉬면서 힐링 할 수 있는 곳이다.
3층 독채 풀빌라와 복층 독채 빌라, 독채 스파 글램핑장 등이 있어 가족 또는 친구들과 오붓하게 쉴 수 있고, 자연 속에서 휴식을 취할 수 있는 곳이다. 특히 스파 글램핑장은 실내에 에어컨은 물론 스파를 할 수 있는 작은 풀이 있고, 밖에서는 바비큐까지 할 수 있어 아이들에게 좋은 추억을 만들어 줄 수 있을 것이다. 편의점, 영화관, 조식카페 등의 편의시설이 잘 갖춰져 있고, 10월부터 3월까지는 페달보트를 타고 송어낚시를 하고 송어 숯불구이도 먹어볼 수 있다. 가평역이나 가평터미널 앞 마트에서 픽업도 가능하며 근처 가볼 만한 곳으로는 남이섬, 자라섬, 아침고요수목원, 쁘띠프랑스 등이 있다.","<a href=""http://fantasycollabo.com/"" target=""_blank"" title=""새창 : 홈페이지로 이동"">http://fantasycollabo.com</a>"
환타피아,506241,레포츠,육상 레포츠,스키(보드) 렌탈샵,http://tong.visitkorea.or.kr/cms/resource/21/693021_image2_1.jpg,강원특별자치도,128.7045228121,37.6650944142,"환타피아는 용평리조트에 위치하고 있는 레포츠 샵으로서 여유로운 레져 문화의 선두주자가 되고자 노력하고 있다.<br /><br />* 개업일 - 2000년 11월 01일<br />* 용평리조트와 3km 거리, 약4분 소요<br>",
환호공원,129142,인문(문화/예술/역사),휴양관광지,공원,http://tong.visitkorea.or.kr/cms/resource/38/3009838_image2_1.jpg,경상북도,129.3930424759,36.0677292517,"영일대해수욕장 끝 해안마을 뒷동산에 위치한 환호공원은 시민들의 문화와 여가, 휴식을 즐길 수 있는 포항 최대 규모의 공원이다. 해안 절벽과 수목들의 자연 속에 현대적 미를 조화롭게 가미한 광활한 공간에는 포항시립미술관과 야외공연장, 어린이도서관, 간이동물원, 어린이모험 놀이터, 환호전통놀이공원, 바닥분수, 전망대가 있다. 무엇보다 우주 위를 걷는 듯한 아찔한 높이의 스페이스워크는 포항제철과 포항 앞 바다를 전망할 수 있는 곳으로 포항의 새로운 랜드마크로 떠오른다. 포항제철에서 사회 환원의 취지로 기증한 스페이스워크의 총길이는 333m이며 717개의 계단으로 구성된 조형물로 날씨에 따라 이용시간의 제한이 있다. 연중 품격높은 전시와 공연, 다채로운 문화행사와 어린자녀를 동반한 놀거리, 즐길거리, 소나무 숲으로 이어지는 산책로와 자전거코스 등은 포항시민을 여유롭게 한다. 새벽 영일만에 스며드는 일출을 조망하기에 최적격지이며, 포항의 랜드마크인 스페이스워크 방문을 위한 포항 관광객의 필수 코스이다.","<a href=""https://www.pohang.go.kr/phtour/wmap/tourInformation/view.do?menu_idx=104&tour_info_idx=117"" target=""_blank"" title=""새창 : 환호공원 홈페이지로 이동"">https://www.pohang.go.kr</a>"
환희체험목장,3076291,인문(문화/예술/역사),체험관광지,농.산.어촌 체험,,울산광역시,129.1852986799,35.5132406384,"환희목장은 아이들을 위한 다양한 체험 프로그램이 있는 목장이다. 목장 입구 전봇대에 귀여운 우유갑 표지판이 설치되어 있어 찾기 쉽다. 100% 네이버 예약제로 체험 진행하고 있으며 주중에는 유치원과 초등학교 연계 체험프로그램으로 진행되고 주말에는 가족체험으로 진행된다. 체험은 피자 만들기, 송아지 우유주기, 젖소 건초주기, 모형 젖소 젖 짜기 체험 등이 있다. 목장 야외 잔디밭은 아이들이 뛰어놀기 좋으며 잔디밭 한켠에 모래놀이장과 물놀이가 가능한 탄산수 물놀이장이 마련되어 있다.","<a href=""http://hoosarang.com/"" target=""_blank"" title=""새창 : 홈페이지로 이동"">http://hoosarang.com/</a>"
환희컵박물관,2550106,인문(문화/예술/역사),문화시설,박물관,,강원특별자치도,128.9431257278,37.7745308366,"환희컵박물관은 전 세계 전시물을 볼 수 있는 아시아 유일의 컵 박물관이다. 환희컵박물관은 세계 3대 컵 박물관으로 중국 강희년제 Chinese Export 청화백자 커피잔, 일본 사츠마야끼 ‘불멸의 용’, 일본 Japanese Export 은 세공 도자 커피잔 등 세계 각국의 명품 커피잔들이 전시되어 있고, 큐레이터 ‘도슨트’ 선생과 함께 아름답고 진귀하며 다양한 스토리텔링을 가진 특유한 컵들의 해설을 들을 수 있다.
박물관에서는 AR 유물 가이드가 가능하다. 휴대전화를 꺼내 박물관 안에 설치한 AR 증강현실 앱을 대면 유물설명과 전시유물 컵이 튀어나온다. 휴대전화에 전시된 컵을 늘이거나 줄이고, 또는 하늘로 떠올려 자신이나 친구, 가족 등을 컵 속에 쏙 넣어 컵 속에 들어가는 기념사진을 촬영할 수 있다. 체험 행사로는 나만의 컵 만들기, 부채 만들기, 에코백 만들기, 나만의 시계 만들기 등 다양해서 아이들과 함께 즐거운 체험을 즐길 수 있다.","<a href=""http://www.cupmuseum.org/"" target=""_blank"" title=""새창: 환희컵박물관 홈페이지로 이동"">http://www.cupmuseum.org</a>"
활기가 넘치면서도 치열한 가슴을 품어 아름다운 광주 속으로!,2666784,추천코스,힐링코스,힐링코스,http://tong.visitkorea.or.kr/cms/resource/94/2563694_image2_1.jpg,광주광역시,126.9491103443,35.1494112311,"무등산부터 5.18민주화운동기록관까지! 무등산 지산유원지, 펭귄마을, 전일빌딩, 5.18민주화 운동기록관에 발걸음하는 일정으로 하루를 보내고, 다음날 무각사, 김대중컨벤션센터에 방문하며 광주의 푸근하고도 즐거운 자연에 품에 안겨 광주의 치열했던 눈물을 느껴보자!",
활기찬예천 활체험센터,2606387,인문(문화/예술/역사),체험관광지,전통체험,http://tong.visitkorea.or.kr/cms/resource/87/3405087_image2_1.jpg,경상북도,128.4684133992,36.6346778526,"활체험센터는 실내 70평과 야외 300평 이상의 국내 최대 활 체험복합공간이다. 이곳에서는 연령에 상관없이 활과 관련된 모든 체험이 가능하다. 활쏘기가 처음이거나 어린아이들도 안전하게 체험해 볼 수 있는 흡착 활부터 양궁(리커브), 국궁, 호버볼체험, 활서바이벌, AR무빙타겟, VR스크린양궁체험 등 개인에서부터 단체프로그램까지 다양한 활체험이 가능하며, 10m 높이의 대형 과녁과 3D과녁 등 다양한 목표를 향해 맞출 수 있는 활쏘기 과녁 및 공간이 완비되어 있다. 또한, 세계 각국의 활과 화살을 만나볼 수 있는 전시관까지 준비되어 있다.","<a href=""http://www.ycarchery.com/"" target=""_blank"" title=""새창: 활체험센터 홈페이지로 이동"">http://www.ycarchery.com/</a>"
