title,contentid,cat1,cat2,cat3,firstimage,region,mapx,mapy,overview,homepage
신항 바다쉼터,2767879,자연,자연관광지,해안절경,http://tong.visitkorea.or.kr/cms/resource/11/2781411_image2_1.png,인천광역시,126.6147770099,37.345323481,"인천해양수산청이 송도 1동 988-3 일원에 신항 바다쉼터를 조성하여 2011년 6월부터 현재까지 시민들에게 개방하고 있다. 군사보호 구역임에도 인천 신항 건설과 함께 개장한 바다쉼터는 시민들이 인천항의 발전 모습과 서해의 아름다움을 보고 휴식을 취할 수 있도록 제공한 것이다. 방파제와 그 위로 조성된 산책로와 전망대가 있으며 쉼터가 마련되어 있고, 해안가 주변으로 지압판이 깔린 산책길이 조성되어 있다. 방파제 해안 산책로 하단에서는 낚시하는 사람들이 많으나 이곳은 낚시가 금지된 곳이다. 출입통제구역이라 오전 9시부터 오후 6시까지 이용할 수 있으며, 5시 10분부터는 10분 간격으로 이용을 종료하라는 방송이 나온다.",
신항대반점,2854371,음식,음식점,중식,http://tong.visitkorea.or.kr/cms/resource/63/2854363_image2_1.JPG,경상남도,128.8153644427,35.1032325945,"신항대반점은 경상남도 창원시 용원동에 있는 중식당이다. 신항대반점에서 사용하는 모든 면은 메밀가루와 흑미, 콩가루, 밀가루 등을 혼합하여 만들어 면의 색이 짙고 곡물의 고소한 맛이 있다. 신항 해물짬뽕, 소고기 왕짬뽕, 신항 문어짬뽕 등의 여러 짬뽕 메뉴를 맛볼 수 있다. 특히 가족 코스로 3인, 4인, 6인, 8인 세트 구성이 있으며, 짜장세트, 짬뽕세트, 볶음밥세트도 준비되어 있어 다양한 메뉴를 즐길 수 있다.",
신항만횟집,2899222,음식,음식점,한식,,경상북도,129.3870652068,36.3536828419,"신항만횟집은 경상북도 영덕군 강구면 오포리에 있다. 세월의 흔적이 엿보이는 외관과 깔끔한 분위기를 연출하는 인테리어가 눈에 띈다. 내부에는 단체석이 마련되어 있어 각종 모임을 하기 좋다. 대표 메뉴는 전복물회며, 소라물회, 스폐셜물회 등 여러 가지 물회가 준비되어 있다. 이 밖에 영덕대게, 영덕홍게, 생선회 등도 맛볼 수 있다. 영덕IC에서 가깝고, 주변에 삼사해상공원과 강구항이 있다.",
신항서원,125910,인문(문화/예술/역사),역사관광지,유적지/사적지,http://tong.visitkorea.or.kr/cms/resource/85/3357685_image2_1.jpg,충청북도,127.5262919886,36.6362604023,"신항서원은 청주를 대표하는 서원이다. 1570년 창건한 이후 여러 차례 추향과 사액, 위차 시비를 거쳐 아홉 분의 성현을 모신 서원으로 훼철과 복원을 거쳐 오늘에 이르고 있다. 신항서원이라 편액 된 삼문을 들어서면 앞쪽에 묘정비가 있다. 묘정비 뒤로 앞면 5칸, 측면 2칸 크기의 강당인 계개당이 있다. 강당 뒤로 다시 삼문을 지나 앞면 3칸, 측면 1칸 크기의 사당인 구현사가 위계를 이루며 자리한다. 처음 지역의 사림과 명망가를 모신 서원으로 출발하여 점차 노론계 서원으로 자리 잡았다. 추향과 위차 시비를 통해 노론계 서원으로 전환하는 과정을 살펴볼 수 있는 역사의 현장이기도 하다.","<a href=""https://www.heritage.go.kr/heri/cul/culSelectDetail.do?pageNo=1_1_1_1&sngl=Y&ccbaCpno=2333300420000"" target=""_blank"" title=""새창 : 국가유산청 홈페이지로 이동"">https://www.khs.go.kr/main.html</a>"
신해바라기,2854102,음식,음식점,한식,http://tong.visitkorea.or.kr/cms/resource/99/2854099_image2_1.jpg,제주특별자치도,126.5259503799,33.5142426737,"신해바라기는 제주 원도심 북수구광장 근처에 있다. 대표 메뉴는 매운맛 순두부이고, 곱게 으깬 순두부와 다진 고기가 듬뿍 들어가 있어 국물양은 적은 찌개이다. 맵기 조절이 가능하며 하얀 순두부도 판매한다. 반찬으로 나오는 오징어젓갈도 직접 무쳐 제공한다. 중독성 강한 순두부 맛집으로 도민들 사이에 유명하며 제주도 내 총 3개점이 있다. 주변 여행지로는 제주 원도심, 관덕정, 탑동광장 등이 있다.",
신해철거리(성남),2650828,인문(문화/예술/역사),체험관광지,이색거리,http://tong.visitkorea.or.kr/cms/resource/15/3350115_image2_1.jpg,경기도,127.1269493023,37.3657774332,경기도 성남시 분당에 신해철 작업실 주변으로 신해철거리가 조성됐다. 신해철거리는 성남시와 팬들이 그를 추억할 수 있는 흔적과 마음을 모아 만든 곳으로 마이크를 잡고 앉은 신해철 동상을 중심으로 160m 정도 이어진다. 거리 바닥에 각계각층 사람들이 생전의 그를 추모하는 글이 있으며 신해철이 쓴 노랫말도 나무 푯말에 새겨져 있다.,"<a href=""http://cromst.seongnam.go.kr/""target=""_blank"" title=""새창: 신해철거리"">http://cromst.seongnam.go.kr/</a>"
신호공원,2788828,인문(문화/예술/역사),휴양관광지,공원,,부산광역시,128.8707796382,35.0819137723,"바다갈맷길 주변으로 울창한 소나무 숲을 이루고 있어 산책과 쉬어가기에 좋은 공원들이 끝이 보이지 않을 정도로 넓게 조성되어 있다. 신호공원은 갯벌 체험으로 유명한 근린공원이다. 물이 빠지면 갯벌 체험도 할 수 있는 곳으로 유명하다. 공원 내에는 운동시설과 편의시설, 놀이시설 등이 조성되어 있다. 산책길도 있어 가족들과 함께 야외 활동을 즐기기 좋다.",
신호등장작구이서오릉본점,2782694,음식,음식점,한식,http://tong.visitkorea.or.kr/cms/resource/72/2782972_image2_1.jpg,경기도,126.8971795357,37.6258708894,"신호등 장작구이는 서오릉에 본점이 있다. 줄서서 먹는 맛집으로 방송이나 유튜브 등에 자주 소개되는 유명 맛집이다. 닭의 기름기를 제거하여 장작불에 훈연한 담백한 맛이 특징이다. 국내산 닭을 사용하여 닭 뱃속에는 찹쌀, 인삼 대추, 마늘, 은행, 잣 등이 들어가 있어 영양 만점의 보양식이다. 닭 장작구이에 맥주와 곁들여 식사를 하면 더욱 맛있는 구이를 즐길 수 있다. 후식으로 칼칼한 잔치국수나 막국수가 닭고기의 느끼한 속을 달래준다. 입구 쪽 주방은 안을 들여다 볼 수 있어 직접 장작구이를 만드는 모습을 볼 수도 있다. 서오릉이 가까우므로 수도권 북부 지역 나들이 길에 빠질 수 없는 맛집이다.",
신호등회관,2778502,음식,음식점,한식,http://tong.visitkorea.or.kr/cms/resource/00/2797100_image2_1.jpg,전라남도,126.2654036016,34.4805057743,"신호등회관은 청정바다인 전라남도 진도 앞바다에서 직접 채집, 가공한 해산물을 천연 그대로의 맛과 향, 영양분까지 고객이 직접 느낄 수 있도록 조리하여 제공한다. 다양한 종류의 해산물인 꽃게, 성게, 전복, 계절 생선 등에서 육류까지 다양하게 준비되어 있어, 취향에 맞는 맛있는 메뉴를 골라 먹을 수 있다. 풍경 좋은 곳에서, 좋은 식자재와 오랜 노하우가 깃든 조리법으로 만들어진 음식을 먹을 때 최고의 만족감을 느낄 수 있다. 대표 메뉴는 간장게장정식, 양념게장, 꽃게살비빔밥, 전복비빔밥 등이 있다.","<a href=""http://www.xn--hq1bn9ictptb.kr/"" target=""_blank"" title=""새창 : 신호등회관 사이트로 이동"">http://www.xn--hq1bn9ictptb.kr/</a>"
신화게판 서면,2652891,음식,음식점,한식,http://tong.visitkorea.or.kr/cms/resource/19/2654719_image2_1.jpg,부산광역시,129.0568225535,35.1555589439,부산의 대표 음식인 게와 새우요리를 맛볼 수 있다. 대표메뉴는 간장새우장이다. 부산광역시 부산진구에 위치한 한식당이다.,
신화곰장어,2511331,음식,음식점,한식,,울산광역시,129.3231965963,35.5545080314,"입안에서 오도독 씹히는 고소한 맛이 일품인 곰장어 구이는 주문과 함께 싱싱한 곰장어를 손질해 내온다. 먹고 난 양념에 김가루 솔솔 뿌리고 신 김치 쫑쫑 썰어 참기름 넣고 볶아주는 볶음밥도 별미이다. 문화의 거리, 큰애기 야시장 등에 인접한 전통시장 내에 위치하여 주변에 즐길 거리, 볼거리도 풍부하다.<br>",
신화목장,2743356,음식,음식점,한식,,경기도,126.8135911057,37.1858343603,"시골길을 한참 달려야 도착하는 신화목장은 한우 맛집이다. 대형 주차장이 있어 주차로 인한 스트레스가 없고 목장이란 상호답게 한우 목장을 직영으로 운영하고 있어 고기의 신선도와 맛도 좋다. 200명이 동시에 식사할 수 있을 만큼 내부가 넓고 다양한 크기의 룸도 갖췄다. 정육 식당답게 고기를 마음껏 고를 수 있고 반찬 종류도 다양하다. 식사 후 산책할 수 있는 휴게시설엔 분수, 물레방아, 정자와 함께 동양식 정원을 잘 가꿔 놓았다.","<a href=""http://shhanwoo.tistory.com/"" target=""_blank"" title=""새창 : 신화목장 사이트로 이동"">http://shhanwoo.tistory.com/</a>"
신화수산활어회타운,2906603,음식,음식점,한식,http://tong.visitkorea.or.kr/cms/resource/98/2906598_image2_1.jpg,대전광역시,127.3826891588,36.2958440484,"신화수산활어회타운은 대전광역시 중구 사정동에 있다. 외관과 인테리어는 깔끔한 분위기다. 내부에는 단체석이 마련되어 있어 각종 모임을 하기 좋다. 대표 메뉴는 각종 생선회다. 수족관에서 마음에 드는 생선을 골라 식당으로 간 다음 상차림 비용을 지불하면 정성껏 손질해준다. 이 밖에 매운탕, 잡탕, 계란탕, 생선구이, 튀김 등이 준비되어 있다. 안영 IC에서 가깝고, 인근에 대전오월드와 뿌리 공원이 있다.",
신화워터파크,2562239,인문(문화/예술/역사),산업관광지,기타,http://tong.visitkorea.or.kr/cms/resource/15/2562215_image2_1.jpg,제주특별자치도,126.3197479556,33.3072595277,"파도풀, 유수풀을 포함한 18개의 풀과 슬라이드, 6개의 식음 매장, 찜질방까지 갖춘 제주 최대 실내외 워터파크로 3,000명까지 동시 수용할 수 있다. 시아에 최초로 도입된 슬라이드 ''슈퍼 크리퍼코일''과 ''자이언트 더블리프''와 함께 신화워터파크에서만 즐길 수 있는 짜릿한 즐거움과 수유실과 어린이 전용 풀장, 아시아 최초로 도입된 2개의 워터 슬라이드, 프라이빗한 휴식을 제공하는 카바나, 소금방·황토방·불가마를 갖춘 찜질방, 햄버거와 생맥주를 즐길 수 있는 식음료 매장까지 만끽할 수 있다.","<a href=""https://www.shinhwaworld.com/article.aspx?lang=KR&type=903""신화워터파크"">https://www.shinhwaworld.com</a>"
신화장어,2899141,음식,음식점,한식,http://tong.visitkorea.or.kr/cms/resource/40/2899140_image2_1.jpg,인천광역시,126.7358863598,37.4117456831,"신화장어는 몸보신으로 좋은 장어구이 전문점이다. 대표메뉴는 장어구이이며, 장어는 시세 따라 가격이 변동된다. 이외에도 장어탕이 있고, 장어구이와 함께 먹을 수 있는 국수도 있다. 국수는 여름에는 열무국수를, 겨울에는 잔치국수로 맛볼 수 있다.",
신화정,1348695,음식,음식점,한식,,전라남도,127.5134685381,34.9463437486,"조피장아찌, 산뽕잎김치, 세작나물 등 낯선 이름의 반찬이 맛깔스러운 한정식집으로 모두 제철에 거둬 손수 만들고 있다.","<a href=""https://shinhwajung4300.modoo.at"" target=""_blank"" title=""새창 : 신화정 한정식 홈페이지로 이동"">https://shinhwajung4300.modoo.at</a>"
신화쭈꾸미,2685664,음식,음식점,한식,http://tong.visitkorea.or.kr/cms/resource/95/2684695_image2_1.jpg,서울특별시,127.0612860998,37.650084911,쭈꾸미와 삼겹살을 맛볼 수 있는 곳이다. 대표메뉴는 쭈꾸미다. 서울특별시 노원구에 있는 한식전문점이다.,
신화테마파크,2562214,인문(문화/예술/역사),산업관광지,기타,http://tong.visitkorea.or.kr/cms/resource/95/2562195_image2_1.jpg,제주특별자치도,126.3076045827,33.3065177523,"인기 캐릭터 '라바'를 탄생시킨 글로벌 3D 애니메이션 제작사, 투바앤(TUBAn)의 다양한 캐릭터와 스토리가 가득한 신화테마파크는 방문객들에게 흥미롭고 환상적인 하루를 선사한다. 환상적인 여행으로 안내하는 '로터리 파크'를 지나, 정글 속 신비한 고대 도시 '오스카 뉴월드'를 거쳐, 귀여운 캐릭터와 볼거리 가득한 '라바 어드벤처 빌리지'에 다다르는 여정, 15가지 짜릿한 놀이기구와 어트랙션, VR체험, 신나는 퍼레이드까지 즐길수 있다.","<a href=""https://shinhwaworld.com/article.aspx?lang=KR&type=897"" title=""새창: 신화테마파크"">https://shinhwaworld.com</a>"
신화횟집,626098,음식,음식점,한식,http://tong.visitkorea.or.kr/cms/resource/28/590828_image2_1.jpg,강원특별자치도,129.1887612655,37.4390104691,"삼척시 정하동 새천년도로쪽에 위치하였으며 인근 연안에서 잡아올린 신선한 재료의 횟감을 사용하고 있다. 오징어물회가 맛있기로 유명하다. 연계 관광지로 나릿골 감성마을, 항구전망대 등이 있다.<br>",
신흑마을,129039,숙박,숙박시설,민박,http://tong.visitkorea.or.kr/cms/resource/33/3348633_image2_1.JPG,충청남도,126.5173801035,36.3158155882,"신흑마을은 보령시 대천해수욕장 인근에 위치한 마을이다. 이 마을은 서해 제일의 해수욕장을 품은 마을답게 풍요롭고 아름다운 어촌이다. 인근 도서의 출입항 역할을 하는 대천항이 인접하여 각종 어패류가 집산되는 어업의 전진기지로 서해안 관광과 해운교통의 요충지이기도 하다. 그리하여 수많은 여행객과 신선한 해산물, 어판장 상인들이 한데 어우러져 활기 넘치는 곳이기도 하다. 신흑마을은 국도 40호선, 77호선 등을 통해 접근할 수 있으며, 고속도로는 서해안고속도로 대천IC가 가깝다. 주변에는 대천해수욕장, 대천항 외에 보령해저터널, 보령해저터널홍보관, 짚스카이라운지 등이 있다.","<a href=""https://www.brcn.go.kr/kor/sub08_16_02_02.do"" target=""_blank"" title=""새창: 보령 문화관광 홈페이지로 이동"">http://www.brcn.go.kr</a>"
신흥계곡,129556,자연,자연관광지,계곡,http://tong.visitkorea.or.kr/cms/resource/77/215377_image2_1.jpg,전북특별자치도,127.2915961018,36.0294061902,"신흥계곡은 봉동, 고산을 지나 경천소재지를 영유하여 운주방면으로 약 2㎞쯤 가다 보면 용복주유소가 나타난다. 이 주유소를 끼고 돌아 2㎞쯤 가면 구제마을이 나타난다. 이 마을을 지나 남동쪽으로 2㎞쯤 가면 첩첩이 쌓인 짙푸른 산봉우리와 맑은 계곡이 눈앞에 펼쳐진다. 물이 차지 않아 아이들과 함께 물놀이하기에 좋은 환경이며 3km 정도 되는 계곡은 생태계가 특이하고 우수한 숲과 하천으로 이뤄져 있고, '나비골'이라 불릴 만큼 멸종위기종 나비와 반딧불이, 가재, 다슬기, 새우 등 수서생물이 풍부한 곳이다.","완주 문화관광 <a href=""http://www.wanju.go.kr/tour/"" target=""_blank"" title=""새창 : 완주 문화관광 홈페이지로 이동"">http://www.wanju.go.kr/tour/ </a>"
신흥근린공원,3026041,인문(문화/예술/역사),휴양관광지,공원,http://tong.visitkorea.or.kr/cms/resource/19/3026019_image2_1.JPG,전북특별자치도,126.9904918287,35.9457188199,"신흥근린공원은 익산시 장자산 옆 신흥저수지를 중심으로 2.1KM의 순환형  둘레길로 조성된 공원으로 계절별 색다른 매력을 발산하는 도심 속 대표 힐링공간이다.
봄엔 매화와 철쭉이 예쁘게 피어 따듯한 봄햇살을 받으며 아이들과 나들이 하기에 좋은 곳이다. 특히 가을철엔 아름다운 핑크뮬리정원이 있어 익산시민들의 사랑을 받고 있다. 핑크뮬리도 유명하지만 매년 국화축제가 열릴만큼 꽃바람정원의 국화꽃도 아름답다.
곳곳에 마련된 포토존에서 인생샷도 건져보고 아름다운 자연속에서 마음껏 힐링의 기분을 만끽할 수 있는 장소이다.",
신흥레저타운,125510,인문(문화/예술/역사),휴양관광지,공원,,경기도,126.9484361336,37.7178249963,"신흥레저타운은 장흥관광지 부근에 있는 복합레저타운이다. 계절에 따라 피크닉월드와 워터월드, 스노우월드를 운영하고 있는데, 유아와 청소년 단체 소풍과 물놀이, 눈썰매를 즐기는 가족 나들이 장소이다. 취사 가능한 수영장&썰매장으로 고기를 구워 먹으며 물놀이와 눈썰매를 즐길 수 있다.
워터월드에는 다양한 종류의 카바나를 대여하고 스노우월드에는 평상과 파라솔 타입의 자리를 대여하는데 파라솔을 제외한 카바나와 평상은 자리마다 콘센트가 있다. 
여름 시즌에만 운영하는 워터월드는 물이 깨끗하기로 소문난 곳이다. 특히 카바나는 약 400석에 이른다. 겨울시즌에만 운영하는 스노우월드는 눈썰매와 빙판 얼음 썰매, 빙어 체험 등을 할 수 있으며 실내에 위치한 평상과 파라솔에 짐을 풀고 몸을 녹이며 겨울을 만끽할 수 있다.
송추IC에서 차량으로 약 6분 소요된다. 인근에 장흥유원지, 세계문화유산 온릉, 가나아트파크, 필룩스조명박물관, 회암사지, 북한산국립공원, 국립아세안자연휴양림 등이 있다.","<a href=""http://신흥레저.com/?page_id=901"" target=""_blank"" title=""신흥레저타운 사이트로 이동"">http://신흥레저.com/?page_id=901</a>"
신흥바다낚시공원,2798709,레포츠,수상 레포츠,바다낚시,http://tong.visitkorea.or.kr/cms/resource/04/2800004_image2_1.jpg,제주특별자치도,126.6469556842,33.551293284,"제주시 조천읍 신흥바다낚시공원은 함덕해수욕장에서 제주시 방향으로 5분 이내 거리에 위치하여 접근성이 편리하다. 이곳은 기상 상황에 관계없이 사계절 언제든 안전하게 남녀노소, 초보자도 안전하게 낚시를 즐길 수 있는 제주 유일의 바다낚시 공원이다. 직접 고기도 낚고 생선회도 즐길 수 있어 제주 바다에서 낚시체험과 싱싱한 활어를 동시에 즐길 수 있으며 10명 이하 인원의 경우 예약제를 운용하지 않고, 낚시터 수용 인원이 초과할 경우엔 매표 대기 순으로 입장 가능하다. 뱃멀미 없이 안전하게 바다낚시를 즐길 수 있는 전국적으로도 손꼽히는 시설을 자랑하며, 1인 기준이 아닌 낚싯대 사용 기준으로 입장료를 적용함으로써 가족 단위 및 단체로 가도 부담 없이 즐길 수 있다.","<a href=""http://nakgorakgo.kr/"" target=""_blank"" title=""새창 : 신흥바다낚시공원 사이트로 이동"">http://nakgorakgo.kr/</a>"
신흥사(군위),322993,인문(문화/예술/역사),역사관광지,사찰,http://tong.visitkorea.or.kr/cms/resource/09/3338409_image2_1.jpg,대구광역시,128.6284519058,36.1500805032,"신흥사는 군위군 우보면 도봉산에 자리 잡은 사찰로 신라 선덕여왕 때(재위 632~647년) 자장율사(590~658년)가 창건한 사찰로 알려져 있다. 창건 당시 큰 규모의 사찰로 크게 흥할 것이라고 해 ‘신흥사’라 이름 지었으며 당초에는 현 사찰 뒤 서북쪽 0.5km 지점에 있었으나 임진왜란 당시 소실되고 조선 숙종 4년(1678년) 이곳에 재건하였다. 이후 영조 7년(1731년)년 불상과 탱화를 조성하고 2010년 대웅전을 중건했다. 현재 건물로는 대웅전과 산신각·누각·요사채 등이 있다.

<출처: 군위군 문화관광 홈페이지>","<a href=""https://www.gunwi.go.kr/tour/page.do?cmd=2&mnu_uid=819&conts_uid=238"" target=""_blank"" title=""새창 : 홈페이지로 이동"">https://www.gunwi.go.kr</a>"
신흥사(삼척),125754,인문(문화/예술/역사),역사관광지,사찰,http://tong.visitkorea.or.kr/cms/resource/58/3040358_image2_1.jpg,강원특별자치도,129.204977253,37.3234601892,"삼척 신흥사는 신라 민애왕 원년(838년)에 범일국사가 지흥사라 하여 북평읍 지흥리(현 동해시 소재)에서 창건했다. 현종 15년(1674년) 현 위치로 이전하여 광운사라 하였고 순조 21년 (1821년) 부사 이헌규가 신흥사라 개명했다. 철종 14년(1863년) 7월에 중수하였다. 경내에는  설선당과 심검당이라는 문화재자료들이 있다. 현종15년에 지어진 설선당은 불제자들을 가르쳤던 곳이며 영조47년에 지어진 심검당은 지혜의 칼을 찾는 집이라 하여 주지스님이 머물던 곳이다. 덕망높은 승려들의 초상화가 보관되어있었다 하여 진영각이라고도 부른다. 이 두 건물은 단청이 입혀지지 않고 소박하고 검소하게 지어졌다. 문화재자료  제108호로 지정되었다. 신흥사는 인적이 드물고 고즈넉하여 <봄날은 간다>(2001년)의 영화촬영장소로도 활용되었는데 설선당은 영화에서 두 주인공이 묵었던 곳이다. 보호수 삼척-51호로 지정된 배롱, 소나무가 있다. 신흥사는 규모가 크지 않지만, 푸르른 자연과 어우러진 고요하고 고즈넉한 분위기를 느낄 수 있는 곳이다. 대웅전을 중심으로 신흥사의 가람들이 한눈에 펼쳐지며, 신흥사 뒤편의 소나무 숲, 마당 잔디밭 그리고 가운데 돌길이 아름다운 조화를 이룬다.
신흥사에서 차량으로 15분 거리에 대나무숲과 맹방해수욕장이 있어 같이 둘러보기 좋다.","<a href=""https://www.samcheok.go.kr/tour/01457/01496/02240.web?amode=view&idx=176&"" title=""삼척문화관광 홈페이지로 이동"">https://www.samcheok.go.kr/tour.web</a>"
신흥사(상주),322832,인문(문화/예술/역사),역사관광지,사찰,http://tong.visitkorea.or.kr/cms/resource/06/1958806_image2_1.jpg,경상북도,127.8331932123,36.6028336734,"경상북도 상주시 신흥사는 안락행 김교순 보살에 의하여 1925년에 건립되었다. 경내에는 신흥사의 내력을 기록한 ‘김교순여사사리급신흥사창건비’(1970년)와 부도가 있다. 이 비문에 의하면 김교순은 1881년(고종 18) 경북 예천 출생으로, 21세 되던 해인 1901년 보은 속리산에서 용허선사로부터 보살계를 받고 불명을 안락행(安樂行)이라 하였다. 

그 뒤 신흥사를 창건하여 사천왕문을 비롯하여 칠성각과 약사전, 대웅전 등의 불사를 이루었다. 또한, 김씨는 법당 건립 후 1926년 1월에 이른바 ‘국화문사건’에 연루되었는데 일제시기 일본 천왕만 사용할수 있는 국화문양을 문살에 넣은 사건으로 대구재판소에 수감 중 20일간 단식 염불을 해 일본인 경사들을 놀라게 하였다는 기록이 있다. 이듬해 석방된 뒤 중생구제와 염불 및 참선으로 일관하였다고 한다. 신흥사에는 약사여래좌상과 탱화, 민화 2점이 있으며 단청의 모습이 여느 절과 다른 특이한 문양의 소박함이 있는 절이다. 인근에 속리산 국립공원과 사담관광농원이 있다.",
신흥사(설악산),127671,인문(문화/예술/역사),역사관광지,사찰,,강원특별자치도,128.4841603469,38.1759336634,"신흥사는 신라 진덕여왕 때 자장율사가 창건했으며 초기에는 향성사라고 불렸다. 처음에는 켄싱턴호텔 자리에 세워졌으나 몇 차례 화재로 소실된 것을 조선 인조 때 지금의 자리에 중창했다. 중창 당시 영서, 혜원, 연옥 세 명의 스님들이 백발신인이 나타나 절 터를 점지해 준 똑같은 꿈을 꾸고 옛 터의 아래쪽에 다시 절을 세우고 신흥사라 이름 지었다는 일화가 전해 내려온다. 원래 신흥사(神興寺)는 신이 점지해 주어 흥하게 되었다는 뜻을 담고 있었으나 1995년 영동 지역 불교를 새로 부흥시킨다는 염원을 담아 한자를 새 신(新) 자로 바꾸었다. 신흥사 내에 보존된 문화재로 극락보전과 캔싱턴스타호텔 건너편에 위치한 향성사지삼층석탑이 보물로 지정되어 있다. 신흥사는 불교의 전통과 문화를 느끼고 배우는 템플스테이도 운영한다.","<a href=""http://www.sokcho.go.kr/ct/tour/attraction/culture?contentSeq=43"" target=""_blank"" title=""새창 : 홈페이지로 이동"">https://www.sokcho.go.kr/ct/tour</a>"
