title,contentid,cat1,cat2,cat3,firstimage,region,mapx,mapy,overview,homepage
섬진강문화학교 캠핑장,2750783,레포츠,육상 레포츠,"야영장,오토캠핑장",http://tong.visitkorea.or.kr/cms/resource/31/2750731_image2_1.jpg,전라남도,127.3603824129,35.1482544963,"섬진강 문화학교 캠핑장은 전남 곡성군 죽곡면 동계리에 위치하고 있다. 2,500㎡의 규모에 30개에 가까운 잔디 사이트로 이루어져 있다. 전기, 온수, 화장실, 샤워실, 취사장 등의 편의시설을 이용할 수 있으며 인근에 가볼 만한 관광지로는 태안사, 보성강, 용산재가 있다. 이곳은 어린이의, 어린이를 위한 캠핑장이라고 해도 과언이 아닐 만큼 모든 것이 어린이 위주로 철저히 구성되어 있다. 일단 어린이들이 뛰어놀다 넘어져도 다칠 염려 없는 잔디밭이 대표적이다. 자유롭게 뒹굴고 놀 수 있어 배드민턴, 족구, 축구, 줄넘기 등 다양한 스포츠 활동을 즐길 수 있다. 또한 어린이 놀이터에는 미끄럼틀과 그네가 있어 부담 없이 이용하기 좋다. 섬진강 문화학교 캠핑장은 어린이들을 위한 시설뿐만 아니라 프로그램도 갖추고 있는데 근처에 독도 사진 박물관이 있어 독도 공부와 계곡에서 물놀이 체험, 초벌구이 도자기에 그림을 그리는 도자기 체험 등을 할 수 있다.","<a href=""http://www.dokdocamping.com/"" target=""_blank"" title=""새창 : 섬진강문화학교 캠핑장 사이트로 이동"">http://www.dokdocamping.com/</a>"
섬진강민물장어,2865027,음식,음식점,한식,http://tong.visitkorea.or.kr/cms/resource/25/2865025_image2_1.jpg,전라남도,127.1369794696,35.2743975346,"섬진강민물장어는 옥과 119 안전센터 인근에 위치한 민물장어구이 전문점이다. 광주에서도 멀지 않아 광주 근교 맛집으로도 알려진 곳이다. 장어를 구입하고 상차림비를 별도로 지불하면 기본 찬과 연탄불, 그리고 손질된 장어가 세팅된다. 장어는 직원이 직접 구워주기 때문에 편안하게 식사를 할 수 있다. 쌈 채소에 장어와 생강, 마늘 등을 함께 싸 먹으면 장어의 느끼한 맛을 잡아 깔끔한 맛을 느낄 수 있다.",
섬진강변 유원지,756323,인문(문화/예술/역사),휴양관광지,공원,http://tong.visitkorea.or.kr/cms/resource/51/758351_image2_1.jpg,전라남도,127.3710098002,35.2354392914,"가정리 옛 곡성역을 오가는 증기기관차를 탈 수 있는 가정역이 있고 역 주변에는 빨간 ‘현수교’가 여행자의 마음을 끈다. 현수교를 건너면 자전거 대여소가 있는데 자전거를 빌려 섬진강 따라 이어지는 자전거 도로를 달릴 수 있다. 
가정리에서 두계마을까지는 원래 자전거 도로로 대부분 사람들이 두계마을까지 오고 간다. 자전거를 타고 호곡나루터까지 왕복 10여km 정도 되는 길을 달릴 수도 있다. 다만 비포장길과 고갯길이 있어 자전거를 타기에는 무리지만 어려운 구간에서 자전거를 끌고 간다면 다녀올 만하다. 
관광용으로 만든 가정역은 섬진강 기차마을에서 증기 기관차를 타면 도착하게 된다. 가정역에서 섬진강 건너편으로 이어지는 섬진강 출렁다리가 있고, 주변에는 출렁다리 끝까지 이어지는 짚라인 체험장이 있다. 섬진강 출렁다리를 건너면 캠핑 사이트가 있으므로 강바람을 맞으며 야영을 할 수 있다. 
섬진강변은 자동차 드라이브 코스와 레일바이크, 증기 기관차 체험도 가능하다. 강변에 섬진강천문대도 있어 밤하늘을 올려다볼 수 있다.","<a href=""http://www.gokseong.go.kr/tour/"" target=""_blank"" title=""곡성 문화관광 사이트로 이동"">http://www.gokseong.go.kr/tour/</a>"
섬진강변 철쭉길,3001055,자연,자연관광지,자연생태관광지,,전라남도,127.3492527816,35.2590084774,"곡성 섬진강변을 따라 17번 국도 5km 길이의 붉은 철쭉길은 일년 중 봄에만 단 2주 가량 즐길 수 있다. 곡성 철쭉길은 곡성 9경 중 한곳으로 짧은 2주간 섬진강의 푸른 물결과 붉은 철쭉이 보색 대비를 이루면 관광객들은 여러 방법으로 즐기기 위해 이곳을 찾는다. 
섬진강변 철쭉길은 도보 외에도 자전거, 레일바이크, 증기기관차, 자동차드라이브 등 다양한 방법으로 즐길 수 있다. 강을 따라 조성된 길은 강쪽으로 자전거길, 중간은 드라이브길, 가장 바깥쪽으로는 기찻길이 나란히 있는데 서로 단차가 있어서 각각의 드라이브를 즐겨도 색다른 경치를 감상할 수 있다. 증기기관차나 레일 바이크를 경험하고 싶다면 운행 시간을 미리 알아보는 것을 추천한다.
주변에 섬진강 둘레길이 조성되어 있고 철쭉꽃 사이로 나 있는 오솔길을 따라가면 섬진강변 철쭉길과 섬진강이 한눈에 내려다 보이는 전망대가 있다. 도보는 편도 약 1시간 소요된다.
섬진강 철쭉길에서 곡성역 방면으로 뚝방마켓과 기차마을, 곡성기차마을 전통시장이 차량 이동 10분, 약 3.2km 거리에 있고, 반대 방향으로는 침곡역과 가정역까지 연결되어 섬진강변 유원지를 함께 둘러볼 수 있다. 철쭉길이 시작되는 지점에 침실습지도 있다.","<a href=""https://www.gokseong.go.kr/tour/tourist/9tour/azalea_way"" target=""_blank"" title=""새창 : 홈페이지로 이동"">https://www.gokseong.go.kr/tour/tourist/9tour/azalea_way</a>"
섬진강별빛야영장,2907891,레포츠,육상 레포츠,"야영장,오토캠핑장",http://tong.visitkorea.or.kr/cms/resource/46/2907846_image2_1.JPG,전라남도,127.7818822091,35.0112911118,"전남 광양에 있는 섬진강별빛야영장은 마을에서 운영하는 곳이다. 섬진강 끝들마을에 있던 중학교가 폐교된 후 입지조건이 좋아 많은 관심을 받게 된 이곳을 마을 주민들이 광양시에 건의해서 처음엔 체험시설이 있는 펜션으로 운영하다 2021년에 데크 사이트를 설치하면서 캠핑장도 함께 운영하게 되었다. 캠핑장 규모에 비해 벤치나 정자들이 군데군데 많이 설치되어 있으며 MTB체험장과 목재를 주재료로 만든 공룡 멀티 놀이시설 등 아이들을 위한 시설이 다양하다. 근처에 섬진강 대나무 숲길과 순창장박물관 등이 있어 함께 둘러보기 좋다. 예약은 홈페이지가 아닌 전화로 해야 한다. 
※ 반려동물 동반 가능","<a href=""https://ggeutdeul.modoo.at/""target=""_blank"" title=""새창 : 섬진강별빛야영장 사이트로 이동"">https://ggeutdeul.modoo.at/</a>"
섬진강식당,2784765,음식,음식점,한식,http://tong.visitkorea.or.kr/cms/resource/33/2787933_image2_1.jpg,경상남도,127.6418388569,35.2298890657,"경상남도 하동군 화개면에 있는 향토음식 전문식당으로 불일폭포 근처에 있다. 지리산에서 채취한 식자재를 사용한 산채비빔밥이 맛있기로 소문난 식당이다. 계절에 따라 참게탕, 메기탕, 벚굴, 은어회, 빙어회 같은 별미를 맛볼 수 있다.",
섬진강어류생태관,2787957,자연,자연관광지,자연생태관광지,http://tong.visitkorea.or.kr/cms/resource/34/2791534_image2_1.jpg,전라남도,127.5465400094,35.1874921836,"섬진강어류생태관은 섬진강의 민물고기 자원에 대한 체계적인 보전과 생태전시를 위한 섬진강 어류생태관이 2008년 3월에 개관하였다. 우리나라 5대 강 중 하나인 섬진강은 유일하게 1 급수를 유지하며, 깨끗한 자연환경과 강 본래의 모습을 간직하고 있다. 청소년들에게 아름답고 깨끗한 섬진강의 환경과 생태보전의 중요성, 생물자원의 보존 및 회복에 대한 연구·교육을 담당하고 있다. 
섬진강어류생태관의 전시관은 제1전시장인 풍요로운 삶의 공간과 제2전시장 물과 생명의 공간, 제3전시장 땅과 환경의 공간으로 구성되어 있다. 제1전시관에서는 섬진강의 풍요롭고 조화로운 삶의 모습을 애니메이션 영상과 디오라마로 연출하여 자연의 소중함을 일깨워 준다. 제2전시관은 섬진강이 환경적, 생태적, 생물자원적으로 보존가치가 높은 강임을 설명하고, 섬진강의 각수계별 특징적인 생태환경을 수조관에 재현함으로써 자연유삽 보존의 이유를 깨닫게 하는 공간이다. 제3전시관은 섬진강의 환경이 파괴되면 어떤 일들이 일어나게 되는지를 소개하여 환경파괴에 대한 경각심을 전달하고, 섬진강의 환경을 지키기 위해 사람들은 어떠한 노력들을 하고 있는지에 대해 소개하고 있다.","<a href=""https://sjfish.jeonnam.go.kr/"" target=""_blank"" title=""새창 : 섬진강어류생태관 홈페이지로 이동"">https://sjfish.jeonnam.go.kr/</a>"
섬진강은어마을,2787329,인문(문화/예술/역사),체험관광지,농.산.어촌 체험,http://tong.visitkorea.or.kr/cms/resource/98/2791598_image2_1.jpg,전라남도,127.6014177638,35.2164398758,"섬진강 은어마을은 전남 구례군 토지면 외곡리에 있다. 
이곳은 지리산 피아골로 향하다 보면 만나는 펜션 단지로 유명한 마을이다. 마을의 여러 펜션은 대부분 나무로 지어졌다. 
마을 앞에는 연곡천이 흐르고 있으며, 송림이 울창하여 여름이면 송림 그늘과 섬진강 변의 맑은 물을 찾아 각처에서 많은 피서객이 찾아온다.",
섬진강을 따라 칙칙폭폭 달려보자!,1856948,추천코스,가족코스,가족코스,http://tong.visitkorea.or.kr/cms/resource/07/575207_image2_1.jpg,Unknown,127.3870554839,35.1317790351,"곡성은 섬진강이 흐르는 고장이다. 섬진강기차마을은 섬진강을 따라 이어진 전라선 복선화 공사로 폐선 된 옛 전라선(곡성역-가정역) 구간을 이용해 증기기관차와 레일바이크를 탈 수 있는 테마공원이다. 증기기관차는 왕복 20KM를 운행하며, 레일바이크는 가정역부터 침곡역까지 5.1KM를 운행해 철길 위에서 다양한 즐거움을 누릴 수 있다.",
섬진강자전거길인증센터,2777970,레포츠,육상 레포츠,자전거하이킹,http://tong.visitkorea.or.kr/cms/resource/75/2784575_image2_1.png,전북특별자치도,127.1496220412,35.5207198758,"섬진강 자전거길 인증센터는 공중전화 부스를 이용한 국토종주 인증센터 중 하나이다. 여권처럼 생긴 인증 수첩에 주요 지점의 스탬프를 모두 찍으면, 자전거길 종주 사실을 공식적으로 인정해 준다. 섬진강 자전거길은 전북 임실 섬진강 생활체육공원부터 전남 광양 배알도 수변공원까지 149km 구간은 자연 그대로의 모습을 간직한 섬진강의 아름다움을 그대로 살린 명품 자전거 길이다. 잔잔한 섬진강 물결을 따라 각양각색의 야생화가 흐드러져 전국 자전거길 가운데 자연미를 가장 잘 살린 코스로 유명하다. 아름다운 우리 산과 강을 가까이서 만끽할 수 있다.","<a href=""https://www.bike.go.kr/bbs/road.do?key=2006176976562&bbsCtgrySn=8&bbsCtgrySubSn=52"" target=""_blank"" title=""새창 : 섬진강자전거길 사이트로 이동"">https://www.bike.go.kr/b</a>"
섬진강재첩국수,2748759,음식,음식점,한식,,전라남도,127.603690209,35.2000834257,섬진강 재첩국수는 구례 피아골 입구의 섬진강 변에 자리해 있다. 도로 건너편으로는 벚나무가 그늘을 드리우고 사람들은 2층에서 섬진강을 보면서 재첩국수를 먹는다. 섬진강 하류에서 잡아 온 재첩을 그 어머니 같은 강물을 내려다보며 먹을 수 있는 곳이다. 벚꽃이 흐드러진 봄날에 이곳을 방문하면 환상적인 풍경은 가늠이 안된다. 내 앞에 맛있는 재첩 무침과 국수가 있고 고개를 들면 흐드러진 벚꽃을 상상하면 선경이 먼 곳에 있지 않다.,
섬진강천적곤충관 (섬진강기차마을생태학습관),2784717,인문(문화/예술/역사),문화시설,전시관,http://tong.visitkorea.or.kr/cms/resource/30/2789630_image2_1.jpg,전라남도,127.3082114814,35.2776556637,"섬진강 기차마을 내에 있는 천적 곤충관은 681㎡의 공간에 5종의 육상 곤충, 3종의 수상 곤충, 해충(害蟲) 및 익충(益蟲)의 먹이사슬을 통한 농작물과 곤충, 친환경 농업과 자연 생태계의 상호 관계를 잘 보여주는 천적 곤충실, 무당벌레 모형 등이 있는 체험실 등을 갖추고 있다. 이곳은 특히 천적 관계인 곤충을 소개하는 것에 집중하고 있는데 천적 곤충실에는 무당벌레-진딧물, 칠레이리응애-응애, 잎굴파리-잎굴파리고치벌 등 8종의 곤충들이 천적 관계로 각각 짝지어져 전시되어 있다.",
섬진강캠핑장,2741537,레포츠,육상 레포츠,"야영장,오토캠핑장",http://tong.visitkorea.or.kr/cms/resource/92/2741792_image2_1.JPG,전북특별자치도,127.0397208134,35.6234396657,"전주에서 순창 쪽으로 가면 정읍 내장산 산외마을로 가는 길이 있다. 이 도로를 따라가다 보면 산외한우마을 건너편에 유럽식 건물로 지어진 팔롬비니 카페가 웅장하게 보인다. 섬진강 캠핑장은 이곳 팔롬비니 카페와 함께 있다. 카페에서 함께 운영하는 카라반 전용 캠핑장으로 카페 왼쪽에 위치하고 있다. 캠핑장 바로 앞으로 섬진강의 지류인 동진강이 흐르고, 카페 옆에는 멋진 잔디마당도 조성되어 있다.","<a href=""http://sjrcamp.co.kr/default/"" target=""_blank"" title=""섬진강캠핑장 사이트로 이동"">http://sjrcamp.co.kr/</a>"
섬진강향가오토캠핑장,2351092,레포츠,육상 레포츠,"야영장,오토캠핑장",http://tong.visitkorea.or.kr/cms/resource/53/2024553_image2_1.jpg,전북특별자치도,127.1927423271,35.3392967109,"섬진강향가오토캠핑장은 고요함과 넉넉함으로 힘들고 지친 현대인들의 마음을 치유한다.
힘들게 지내온 시간을 멈추고 주변의 울창한 숲과 넓은 잔디마당이 주는 싱그러운 공기와 향긋한 내음을 맡으며 행복한 여유를 즐긴다.

※ 본 캠핑장은(관광진흥법에 의거) 관광사업 등록 캠핑장이다.<br>","<a title=""새창 : 섬진강향가오토캠핑장 홈페이지로 이동"" href=""http://섬진강향가오토캠핑장.com/?r=home"" target=""_blank"">http://섬진강향가오토캠핑장.com/?r=home</a>"
섬진레저스쿨래프팅,2787129,레포츠,수상 레포츠,래프팅,http://tong.visitkorea.or.kr/cms/resource/02/2790402_image2_1.jpg,전라남도,127.5883970845,35.2011024884,"섬진레저스쿨래프팅은 피아골 입구인 외곡마을에 있다. 천혜의 관광지인 지리산을 중심으로 섬진강에서 래프팅, 서바이벌, 제프팅, 카약 등의 레저를 즐길 수 있는 곳이다. 래프팅 구간과 물놀이 탑승 구간은 겹치지 않게 운영하고 있다. 대부분 래프팅을 먼저 하고 물놀이 기구를 탑승하는 순서로 진행한다. 당일 코스는 물론 주변 펜션 및 리조트와 연계해 1박 2일 패키지 코스도 운영 중이다.","<a href=""http://www.sjls.co.kr/"" target=""_blank"" title=""새창 : 섬진레저스쿨래프팅 사이트로 이동"">http://www.sjls.co.kr/</a>"
섬향기,2558084,음식,음식점,한식,http://tong.visitkorea.or.kr/cms/resource/73/2919973_image2_1.jpg,강원특별자치도,127.5261035858,37.7901159965,"‘섬향기’는 정통 장작구이 닭갈비를 맛볼 수 있는 자연 속 바비큐 레스토랑이다. 상쾌한 공간에서 바비큐, 철판 닭갈비, 막국수 등 다양한 메뉴를 즐길 수 있어 연인, 가족뿐만 아니라 단체 식사 장소로도 안성맞춤인 곳이다. 메인 메뉴인 닭갈비 외에 버섯불고기전골과 막국수, 메밀전병 등 다양한 메뉴가 준비되어 있다. 매장 내부 테이블마다 키오스크가 설치되어 있어 편리하게 메뉴주문이 가능하다는 장점이 있다.",
섭섭이네,2840487,음식,음식점,서양식,http://tong.visitkorea.or.kr/cms/resource/73/2840473_image2_1.jpg,제주특별자치도,126.7843928004,33.4715876451,섭섭이네는 제주 송당사거리에 위치한 정갈한 고기국수와 맛깔난 퓨전카레가 일품인 맛집이다. 아들이 만든 음식 커리와 어멍이 만든 음식 고기국수 등을 제주 로컬음식과 함께 판매하고 있다. 제주 돌집을 그대로 식당으로 사용하며 밖거리(제주 전통가옥의 바깥채) 대기공간에는 셀프 음료대와 무인 판매 음료수가 있다.,"<a href=""https://www.instagram.com/subsub_7979/""target=""_blank"" title=""새창 : 섭섭이네 인스타그램으로 이동"">https://www.instagram.com/subsub_7979/</a>"
섭장손수제비,2917254,음식,음식점,한식,http://tong.visitkorea.or.kr/cms/resource/48/2917248_image2_1.jpg,경상남도,128.7308613836,34.8701710216,"섭장손수제비는 거제 시립 장승포 도서관 근처에 있다. 섭장손수제비의 섭은 강원도 말로 홍합을 뜻하고, 장은 칼칼하고 얼큰한 고추장 양념을 말한다. 뚝배기에 끓여서 먹는 섭장수제비는 칼국수 면과 수제비가 함께 나온다. 다 먹은 후 국물에 볶음밥을 비벼 먹을 수 있다. 매운 음식을 먹지 못하는 사람이라면 맑은 국물의 수제비와 칼국수, 들깨 칼국수를 선택하면 된다. 저녁에는 돼지 두루치기, 오징어볶음, 감자전 등 안주류도 판매하여 술 한 잔 곁들이기 좋은 곳이다. 섭장손수제비에서 차로 5분 거리에 양지암 장미공원과 조각공원이 가까이 있어 함께 둘러보기 좋다.",
섭죽마을 / 허허바다섭(홍합)죽마을,2782129,음식,음식점,한식,http://tong.visitkorea.or.kr/cms/resource/27/2786327_image2_1.jpg,강원특별자치도,128.5405186132,38.1920467691,"섭죽마을은 동해안의 명물인 자연산 참 홍합으로 만든 섭죽과 섭 해장국, 홍게 살을 넣은 홍게 죽과 홍게 해장국을 판매하는 속초 맛집이다. 조양동에서 영업하다가 인기에 힘입어 노학동으로 확장 이전하였다. 깔끔한 외관이 눈에 띄는 섭죽마을은 펜션을 연상케 한다. 섭죽마을의 ‘섭’은 강원도에서 자연산 홍합을 칭하는 말이다. 섭죽이나 섭 해장국에 들어간 홍합은 우리가 흔히 알고 있는 홍합보다 두세 배 정도 더 크다. 메뉴는 홍합죽과 홍게죽 외에도 홍합 해장국과 홍게 해장국, 황태해장국, 곰치탕이 있다. 전에는 동해안에서만 잡히는 민들조개로 만든 째복죽이 제법 유명했는데, 요즘은 민들조개가 많이 잡히질 않아 안타깝게도 메뉴에서 뺐다고 한다. 섭죽은 매운맛과 보통맛 중 입맛대로 선택할 수 있다. 강원도 식당에서 흔하게 볼 수 있는 오징어 젓갈이 곁가지 반찬과 함께 나오며 여러 매체에 소개될 만큼 맛이 좋기로 유명하다.",
섭지코지,127813,자연,자연관광지,해안절경,,제주특별자치도,126.9280674087,33.430250088,"섭지코지는 코지(코지곶을 의미하는 제주 방언)라는 지명에서 알 수 있듯 코의 끄트리 모양 비죽 튀어나온 지형이다. 위치상으로는 서귀포시 성산읍 신양리 해안에 돌출되어 있다. 외지인들에게는 찾아가기가 그리 쉽지는 않은데 대개의 경우 신양리 해안 국도변에서 마을로 진입하여 이정표를 보고 콘크리트로 포장된 길을 따라가면 코지 끝에까지 이를 수 있다. 또는 서귀포 방면에서 찾아온다면, 표선 시내를 지나 약 7km쯤 가서 우측으로 해안 도로 표지판이 나오면 여기서 우회전하여 줄곧 바다를 끼고 정면으로 섭지코지 전경을 바라보며 달리다가 이내 신양해수욕장 백사장이 보이고 마을 앞에 이르러 우회전, 마찬가지로 콘크리트 도로를 따라가면 된다.

특히 이곳의 유채꽃은 밝은 햇살과 푸른 바다 빛과 어울려 그 어느 곳에서보다 더욱 선명하고 고운 빛깔을 띠고 있다. 넓고 평평한 코지 언덕 위에는 옛날 봉화 불을 지피던 협자연대라는 돌로 만든 봉수대가 세워져 있는데 높이 약 4m, 가로세로 9m의 정방형으로 비교적 원형대로 보존되어 있다. 연대에서 동북 방향으로 솟아있는 봉우리는 일명 붉은오름으로, 제주말로 송이라고 하는 붉은색 화산재로 이루어진 오름인데, 정상에 서있는 하얀 등대의 모습이 노란 유채꽃밭과 오름의 붉은 흙빛, 그리고 파란 하늘빛, 바다 빛과 대비되는 또 다른 이국적인 정취를 불러일으킨다. 등대까지는 철계단이 마련되어 있어 쉽게 올라갈 수 있으며 등대 난간에 올라서면 과연 기가 막힌 섭지코지의 해안절경이 바로 코앞에 펼쳐진다.","<a href=""https://www.visitjeju.net/kr"" target=""_blank"" title=""새창 : 제주 문화관광 홈페이지로 이동"">https://www.visitjeju.net/kr</a>"
섭지코지로,2755454,음식,음식점,한식,http://tong.visitkorea.or.kr/cms/resource/93/2755593_image2_1.jpg,제주특별자치도,126.921348356,33.4385046231,서귀포시 성산읍 신양리 해안에 돌출된 섭지코지는 한적함과 낭만적인 멋이 풍기니 소풍 나온 기분으로 산책하기 좋은 관광지이다. 제주 섭지코지로 43에 위치한 섭지코지로는 딱새우 맛집으로 유명하다. 아담한 공간이라 자리는 협소하나 별채가 있어 피크타임만 피한다면 웨이팅 없이 식사가 가능하고 대표 메뉴는 딱새우회와 고등어회 세트 메뉴이며 싱싱한 회에 노릇한 옥돔구이와 감칠맛 나는 새우머리 라면까지 포함되어 있어 푸짐한 한 상이 나온다. 모든 메뉴는 포장이 가능하고 근처에 코지 펍을 함께 운영 중이다. 아울러 섭지코지 인근의 제주민속촌과 우도 등도 함께 둘러보면 좋다.,"<a href=""https://www.instagram.com/it_g_ma3/"" target=""_blank"" title=""새창 : 섭지코지로 사이트로 이동"">https://www.instagram.com/it_g_ma3/</a>"
섯알오름,2715651,자연,자연관광지,산,http://tong.visitkorea.or.kr/cms/resource/62/3383862_image2_1.jpg,제주특별자치도,126.2815563372,33.2042091988,"섯알오름은 송 오름의 세 알 오름 중 서쪽에 있는 것이다. 서귀포시 대정읍 상모리에 위치해 있으며 서란봉, 알오름, 난봉으로도 불린다. 섯알오름의 총면적은 약 29,094㎡이며, 둘레 704m, 높이 21m이다.
섯알오름 꼭대기에는 일제 강점기에 설치한 고사포 진지가 있고, 그 남쪽 기슭에는 제주 4·3 사건의 아픔을 간직한 학살터가 있다. 섯알오름 서쪽에는 일제 강점기에 일본군이 이용했던 알뜨르비행장 터와 벙커(bunker)가 있다.
일반인과 관광객이 역사 교육을 목적으로 자주 찾는 곳 중 하나이다.","<a href=""https://www.visitjeju.net/kr/detail/view?contentsid=CONT_000000000500344"" target=""_blank"" title=""홈페이지로 이동"">http://www.visitjeju.net</a>"
성가리 백로마을,127578,자연,관광자원,희귀동.식물,http://tong.visitkorea.or.kr/cms/resource/38/2514238_image2_1.jpg,전북특별자치도,127.2775166523,35.6126811062,"임실읍 서쪽으로 순창 가는 길목인 성가리 뒷산에 해마다 백로 천여 마리가 날아들어 장관을 이루고 있다. 백로들은 매년 경칩 때가 되면 떼 지어 이곳에 날아들어 서식하다가 백로 때 남쪽으로 되돌아가고 있다. 이때 16,529m² 되는 소나무 숲에 둥지를 틀고 내려앉은 모습이 마치 선경(仙境)을 방불케 하고 있다.

각양 각지에서 내국인은 물론 외국인들까지도 이 장관을 카메라에 담기 위해 찾아오기도 한다. 이곳에 백로들이 날아들기 시작한 것은 구한말, 이 지방의 거부 진재황이 여기에 별장을 짓고 백송 42주와 느티나무를 심어 숲을 이루면서부터이다. 지금은 별장은 없어지고 마을이 형성되어 있는데 10여 년 전만 해도 4 천수에 달하던 백로가 해마다 그 수가 줄어 근래에는 5백여 마리에 이르는 철새의 도래지가 된 것이다.

임실~순창 간 도로에서 50여 m 밖에 떨어지지 않은 이곳에 이처럼 알뜰하게 보호를 받고 있는 것은 30여 년 전 이 마을에 이사 와서 가족과 같이 새들을 돌보아 온 이금철 씨와 고인이 된 이순임 부부의 지극한 정성이 있었기 때문이다. 이씨 부부는 집 뒷산을 오르내리며, 밀렵꾼들을 감시하고 둥지에서 떨어진 새끼들을 보살피는 등 노력을 다하고 있다.","<a href=""http://tour.imsil.go.kr/"" target=""_blank"" title=""새창 : 임실군 문화관광 홈페이지로 이동"">http://tour.imsil.go.kr/</a>"
