title,contentid,cat1,cat2,cat3,firstimage,region,mapx,mapy,overview,homepage
자연밥상,2865205,음식,음식점,한식,http://tong.visitkorea.or.kr/cms/resource/99/2865199_image2_1.jpg,경기도,127.3970892471,37.2485069968,"자연밥상은 경기도 이천시 마장면에 있는 한정식집이다. 외진 곳에 있어서 자동차를 이용하여 가야 한다. 식당 앞의 뜰에는 장독들이 많이 늘어서 있다. 식당 내부는 카페 같은 분위기로 꾸며져 있다. 메뉴는 단순하다. 기본 1인 메뉴인 자연밥상이 있고, 단품 메뉴인 보리굴비, 자반 고등어, 제육볶음, 꼬막무침, 돼지고기 김치찜을 추가로 주문할 수 있다. 기본 밑반찬 12가지에 청국장, 우렁쌈장, 상추가 함께 나온다. 반찬의 간이 강하지 않고 정갈하다. 특히 겉이 바삭하고 속이 촉촉하게 튀겨진 가지튀김은 손님들에게 가장 인기가 많은 반찬이다. 단품 메뉴 중에 인기 메뉴인 보리굴비는 먹기 좋게 살을 발라서 제공한다. 고추장과 참기름을 섞은 소스에 녹차물에 말은 밥과 함께 먹으면 건강 별미이다. 이천쌀로 지은 밥은 무료로 리필할 수 있다. 또한 자연 밥상에서 나온 반찬들은 따로 구입할 수 있다. 자연밥상에서 1km 이내에 별빛 정원 우주 테마파크와 이천 롯데프리미엄아울렛이 있고, 4km 거리에 설봉공원이, 6km 거리에 복하천 수변공원이 있다. 10 km 거리에는 용담저수지도 있다.",
자연보다 더 아름다운 공원산책 코스,1921208,추천코스,도보코스,도보코스,http://tong.visitkorea.or.kr/cms/resource/09/760009_image2_1.jpg,Unknown,126.7919145381,37.5130210232,"걷기 좋은 길이다. 자연숲보다 더 잘 가꾸어진 도당공원과 한적한 석왕사, 부천의 자랑거리인 영상문화단지 아인스월드, 만화박물관과 호수 공원은 도심 속에서 느낄 수 있는 자연이다.",
자연사랑미술관,2606611,인문(문화/예술/역사),문화시설,미술관/화랑,http://tong.visitkorea.or.kr/cms/resource/57/2355457_image2_1.jpg,제주특별자치도,126.771952084,33.3556696951,"서귀포시에 위치한 사진갤러리이다. 폐교된 가시초등학교를 활용해 90평 규모의 넓은 전시 공간을 가진 것이 특징이다. 제주는 천혜의 자연경관으로 이루어진 화산섬으로, 섬 곳곳에 독특한 경관과 문화가 서려 있다. 이런 제주의 자연과 민속을 담은 사진가 서재철의 작품을 한눈에 볼 수 있도록 전시했다. 자연사랑미술관은 가시초등학교의 옛 모습을 담은 사진 전시실, 사진과 책을 판매하는 공간과 쉼터로 구성되어 있다. 땅 할아버지라는 의미의 따라비전시장에서는 제주오름(기생화산)의 다양한 모습을 만날 수 있고, 바람이 머무는 곳이라는 뜻의 바람자리전시장에서는 한라산과 바다를 통해 제주의 비경과 사계절을 느낄 수 있다. 그 외에 화산탄을 전시한 야외 화산탄 갤러리가 있다.","자연사랑미술관 <a href=""http://hallaphoto.com/default/"" target=""_blank"" title=""새창: 자연사랑미술관"">http://hallaphoto.com/default/</a>"
자연석돌구이,2869929,음식,음식점,한식,http://tong.visitkorea.or.kr/cms/resource/19/2869919_image2_1.jpg,서울특별시,127.0353532516,37.5206939264,"자연석돌구이집은 지하철 7호선 학동역 10번 출구 도산공원사거리 부근에 있다. 매장이 있는 상가건물에 자체 주차장이 있으나 협소하다. 방문 시 대중교통을 이용하는 게 편리하다. 이곳은 방송사 TV 맛집 프로그램에 자연석 돌판 위에 삼겹살과 대패삼겹살을 구워 먹는 맛집으로 소개되었다. 매장 내부는 넓은 홀에 인원별 다양한 테이블 구성이 가능해 단체 행사나 각종 모임에도 적당하다. 대표 메뉴는 대패삼겹살, 차돌박이, 칼국수, 오징어불고기가 있다.",
자연속으로,397790,숙박,숙박시설,펜션,http://tong.visitkorea.or.kr/cms/resource/32/1871632_image2_1.jpg,충청남도,127.1621652448,36.3693206352,"자연속으로 펜션은 싱그러운 햇살과 상쾌한 바람이 있는 곳으로 계룡산 갑사 입구에 위치한 독채형 펜션이다. 편안하고 아늑한 분위기, 청결한 객실, 언제든지 즐길 수 있는 주변 환경 등 언제든지 방문해서 쉴 수 있도록 방문하는 고객들에게 자부한다. 일상적인 삶에 찌들어 있거나 피곤을 느끼는 사람들에게 편안한 휴식을 취할 수 있도록 즐거운 공간을 제공하고 있다.","<a href=""http://010-3104-3854.zeep.kr/frame.php"" target=""_blank"" title=""새창 : 자연속으로 홈페이지로 이동"">http://www.010-3104-3854.bestbz.com</a>"
자연속캠핑장,2730789,레포츠,육상 레포츠,"야영장,오토캠핑장",http://tong.visitkorea.or.kr/cms/resource/17/2730917_image2_1.jpg,경상남도,128.8623563883,35.5521524735,"자연속 캠핑장은 언양에서 밀양 가는 국도를 타고 가다 볼 수 있는 맑은 하천 주변에 위치해 있다. 펜션과 야영장이 함께 있는 구성으로 30여 개의 파쇄석 사이트로 구성돼 있고, 사이트 사이의 공간이 넓어 여유롭게 텐트를 칠 수 있다. 사이트 마다 전기 배전함과 소화기가 설치되어 있어 편리하게 이용할 수 있다.  캠핑장 내에는 수영장과 어린이들의 놀이기구인 트램펄린이 있어 즐겁게 뛰어놀 수 있으며, 모든 편의시설이 깨끗하고 정리정돈이 잘 되어 있다. 샤워장에는 사물함이 따로 마련돼 있어 편리하고 안전하게 이용할 수 있다.",
자연쉼터,912224,숙박,숙박시설,펜션,http://tong.visitkorea.or.kr/cms/resource/72/1942872_image2_1.jpg,경기도,127.3936682884,37.6034130368,"자연쉼터는 도시에서 가장 가까우면서 오지에 속하는 자연환경을 벗 삼고 있으며, 환상적인 산이 병풍처럼 사방으로 둘러싸여 있고 커플룸, 가족룸, 단체룸이 완비되어 있다. 또한 도보 1분 이내 도장계곡이 있고 펜션자체에서 식당과 슈퍼를 운영하고 있어 이용이 편리하다. 펜션 앞의 청정수에는 물고기가 노닐며 족구장, 나무그늘 등의 편의시설이 겸비되어 있는 자연발상 유원지이다.","<a href=""http://page.yapen.co.kr/19984"" target=""_blank"" title=""새창 : 자연쉼터 홈페이지로 이동"">http://page.yapen.co.kr/19984</a>"
자연스러운식당,2851146,음식,음식점,서양식,http://tong.visitkorea.or.kr/cms/resource/22/2851122_image2_1.jpg,제주특별자치도,126.5328058954,33.2435310361,"자연스러운식당은 서귀포여자고등학교 뒤편 오렌지블루 펜션 내에 있다. 제주 식재료를 이용해 수블라키, 차지키, 사가나키, 빠삐요트 등 지중해식 음식을 선보인다. 메뉴는 한라봉과 유채꽃 꿀을 가미한 그릭문어샐러드, 제주 수블라키와 차지키, 제주 보말 라이스, 치킨 새우 사가나키, 비스크 링귀니 스파게티, 제주 갈치필렛 빠삐요트 등이고, 1인 셰프 식당으로 우선 예약제이다. 2인 이상 메뉴를 예약하면 원활한 식사를 할 수 있다. 근처 여행지로 외돌개, 황우지해안 등이 있다.
※ 반려동물 동반 가능(반려견 실외 동반)",
자연스토리,2621263,숙박,숙박시설,한옥,,전라남도,126.60551466,34.5091247685,"전남 해남군 자연스토리는 무선동 한옥마을 내에 위치한 한옥 민박집이다. 무선동 한옥마을은 해남읍에서 5km 정도 떨어진 두륜산 끝자락에 안겨 있다. 마을이 조성된 지 30여 년 되었고 현재 10여 가구가 한옥 민박업을 운영하며 우리나라의 전통을 소개한다.

그중 자연스토리는 문화체육관광부가 주관한 2020년 전통한옥 브랜드화공모사업에 2년 연속 선정된 바 있다. 2년 연속 꼽힌 이유는 자연스토리만의 독특한 체험 프로그램 때문이다. 자연스토리는 자연과 역사를 접목한 특별한 체험 프로그램을 운영하는데, 자연 요리와 역사 요리 만들기, 음식 명상 등이다. 이 외에도 고무신을 가지고 꾸며보는 아트 체험과 다도 체험을 운영 중이다. 숙박 예약 시 전화문의하면 된다. 자연스토리의 객실은 동백꽃, 수성동, 비자림, 왕벚나무, 공룡발자국, 해오름터 등 모두 6개다. 전체를 단독으로 대관할 수도 있다. 방마다 샤워 가능한 화장실이 있지만, 별도로 조리가 가능한 주방이 딸린 방은 공룡발자국과 왕벚나무 두 객실뿐이다. 공용주방이 따로 있어 이용할 수 있다. 2만 원을 내면 고기를 구울 수 있는 그릴과 숯을 준비해준다. 조식은 영양죽이나 한식 중 선택해서 주문할 수 있는데 1인당 1만 원을 받는다. 두륜산 끝자락에 위치해 마을 경치가 좋고, 인근의 대흥사, 윤선도 관광지 등이 연계 관광지로 각광 받는다.",
자연식당,1763006,음식,음식점,한식,,경상북도,128.5588075856,36.844927707,"※ 영업시간 11:00~21:00

안정면에서 오래전부터 잡고기와 메기매운탕 2종으로 30여 년간 2대에 걸쳐 음식점을 운영해 오고 있다. 자연산 민물고기만 사용하고 있으며 무엇보다 매운탕으로 좋다는 텅거리, 꺽지, 빠가사리, 꾸구리 등을 넣어 만든 잡고기 매운탕은 많은 사람들로부터 입맛을 인정받아 가장 많이 찾고 있으며 매운탕에 넣는 수제비는 직접 만들어 하루 정도 숙성시킨 후 사용하여 쫀득한 맛이 좋다. 이 밖에 매운탕에 넣어 먹는 라면 사리는 아이들이 특히 좋아한다.",
자연식당,2678868,음식,음식점,한식,http://tong.visitkorea.or.kr/cms/resource/00/2675200_image2_1.jpg,제주특별자치도,126.9525853309,33.524456743,살아있는 해산물과 방부제가 없는 면을 사용하는 곳이다. 대표메뉴는 문어라면이다. 제주특별자치도 제주시에 있는 한식전문점이다.,
자연아놀자 체험학습박물관,2990291,인문(문화/예술/역사),문화시설,박물관,,강원특별자치도,128.9038289338,37.7852954912,"‘자연아놀자체험학습박물관’은 강릉시 포남동에 위치하고 있으며, 다양한 생물들을 보고, 듣고, 느끼며 생태 체험을 할 수 있어 아이들에게 특별한 추억을 만들어 줄 수 있는 박물관이다. 이 박물관에서는 다양한 생물들의 전시프로그램을 제공하며 곤충, 파충류, 포유류, 갑각류 등의 체험학습을 할 수 있다. (출처 : 강원도청)","<a href=""https://blog.naver.com/mobaone"" title=""새창: 자연아놀자 체험학습박물관 홈페이지로 이동"" target=""_blank"">https://blog.naver.com/mobaone</a>"
자연애 쭈꾸미,2027561,음식,음식점,한식,,경기도,127.1162971825,37.3767593026,"성남시 모범 음식점이며 의왕시 '의왕세상' 맛집으로 소개되었다. 분당의 맛집들이 즐비한 '금호상가'에 위치한 쭈꾸미 볶음 전문점으로, 이미 의왕의 백운호수에서 유명했던 곳이다. 분당의 '금호상가' 전체가 작은 백화점처럼 원스톱 서비스(재래시장·옷가게·음식점)가 가능한 장점이 있는 곳이다. '자연애 쭈꾸미'는 건강을 생각한 엄선된 재료로, 매일매일 준비하여 주문이 들어오면 즉석요리를 통해 고객분들과 만나고 있으며, 쌀·김치·고추가루·고기에 국내산만을 사용하여, 안심 먹거리를 제공하고 있다.<br>","<a href=""http://ghzzooggumi.modoo.at"" target=""_blank"" title=""새창 : 자연애 쭈꾸미 모바일 홈페이지로 이동"">http://ghzzooggumi.modoo.at</a>"
자연애곤드레,2904456,음식,음식점,한식,http://tong.visitkorea.or.kr/cms/resource/50/2904450_image2_1.jpg,경상북도,129.3130239292,35.7974582586,"자연애곤드레는 경상북도 경주시 하동에 있다. 한옥으로 지어진 덕분에 외관에서 고풍스러운 멋이 풍긴다. 깔끔한 분위기를 연출하는 인테리어도 눈에 띈다. 내부에는 단체석이 마련되어 있어 각종 모임을 하기 좋다. 대표 메뉴는 곤드레돌솥밥과 생선구이 등이 상에 오르는 명품상이다. 곤드레솥밥과 제육볶음이 나오는 일품상도 인기가 많다. 이 밖에 곤드레돌솥밥과 곤드레고등어조림을 맛볼 수 있는 진품상 등이 준비되어 있다. 동경주IC에서 가깝고, 주변에 석굴암, 불국사, 추억의 달동네가 있다.",
자연애스토리,2741556,레포츠,육상 레포츠,"야영장,오토캠핑장",http://tong.visitkorea.or.kr/cms/resource/85/2741785_image2_1.JPG,전라남도,126.6617342858,35.0970345372,"자연애 스토리는 전라남도 나주시 문평면 학교평전길에 위치해 있다. 옹기종기 장독을 쌓아두어 입구에서부터 마치 고향 집을 찾은 듯한 착각이 이는 곳이다. 캠핑장 앞으로 편백나무 숲이 있어 맑은 공기를 마실 수 있고 가까운 곳에 등산로가 있어 등산과 캠핑을 함께 즐길 수 있다. 7,590㎡의 규모의 캠핑장 입구에는 저수지가 있어 낚시가 가능하고 캠핑장 주변으로 대나무가 심어져 있어 바람이 불 때마다 대나무 소리를 들을 수 있고 자갈길도 볼거리이다. 캠핑장 내에는 매점, 샤워장, 남녀 화장실, 개수대가 있으며 잘 가꾸어진 텃밭이 있어 고추와 양파 등의 농작물을 관찰할 수 있다. 또 진돗개, 시베리안 허스키, 고양이, 흑염소, 칠면조 등 동물 친구가 있어 어린이들에게 인기 많은 캠핑장이다.","<a href=""https://cafe.naver.com/jayeonaelove"" target=""_blank"" title=""새창 : 자연애스토리 사이트로 이동"">https://cafe.naver.com/jayeonaelove</a>"
자연애품캠핑장,2730797,레포츠,육상 레포츠,"야영장,오토캠핑장",http://tong.visitkorea.or.kr/cms/resource/49/2730949_image2_1.JPG,전라남도,127.1443031053,35.3025472561,자연애품 캠핑장은 단체는 물론 가족과 연인이 자연과 야경을 즐기며 캠핑할 수 있는 힐링의 공간이다. 위치는 산으로 둘러싸여 다람쥐를 쉽게 발견할 정도로 공기 좋은 곡성 옥과면 주산리에 있다. 입구에는 잘 조성된 공원이 있어 경치가 아름답다. 자갈이 깔려 있고 캠핑장 안은 천연잔디와 데크로 꾸며져 있고 넓은 공터가 있어 어린이들이 뛰어놀기 좋다. 나무가 많아 더운 여름에도 그늘의 휴식을 즐길 수 있고 주변엔 분위기 있는 레스토랑 겸 카페가 있어 식사나 차를 마실 수 있다. 자연애품 캠핑장의 마스코트인 하트 레일은 포토존으로 사랑받는 곳이다. 참고로 밤이면 조명을 밝혀 화려한 야경을 즐길 수 있으니 저녁에 올 것을 추천한다. 연인들의 데이트 코스로도 안성맞춤이다.,"<a href=""https://bosomofnature.modoo.at/"" target=""_blank"" title=""새창 : 자연애품캠핑장 사이트로 이동"">https://bosomofnature.modoo.at/</a>"
자연에 머물다,2744429,레포츠,육상 레포츠,"야영장,오토캠핑장",http://tong.visitkorea.or.kr/cms/resource/19/2763219_image2_1.jpg,강원특별자치도,127.5854844755,37.9721403519,자연에 머물다 캠핑장은 화악산 기슭에 자리 잡은 글램핑장이다. 바로 앞으로 화악산 청수담 계곡이 흘러 여름에는 계곡 물놀이가 가능하다. 가을에는 형형색색의 오색단풍과 낙엽 쌓인 산책길을 이용할 수 있고 겨울에는 춘천호 인근에서 빙어낚시와 화천 산천어 축제를 즐길 수 있어 사계절 가족 휴양으로 손색없는 캠핑장이다.,"<a href=""http://stayinnature.co.kr/"" target=""_blank"" title=""새창 : 자연에 머물다 사이트로 이동"">http://stayinnature.co.kr/</a>"
자연에서 뛰노는 시간 충주에서 체험하기 코스,1959213,추천코스,가족코스,가족코스,,Unknown,127.8640536492,37.0197558048,"산 좋고 물 좋아 그 땅에서 자란 먹거리 또한 넉넉하고, 정겹게 자리한 마을에 마음 고운 사람들이 살아가는 곳. 충주의 체험 학교와 마을에서는 자연이 주는 여유와 사람 사는 정을 느낄 수 있다. 돈으로 그 값을 논할 수 없는 진심 어린 만남, 소박한 미소와 정성으로 반기는 체험 마을로 떠나보자.<br /><br />[출처]충주여행 30선 중에서",
자연에서온추어탕,2846756,음식,음식점,한식,http://tong.visitkorea.or.kr/cms/resource/42/2846742_image2_1.jpg,경기도,127.1144726265,37.5629459994,"자연에서온추어탕은 경기도 구리시 아천동에 있는 추어탕 전문점이다, 아차산에서 구리 쪽으로 내려가는 아차산 대교 부근으로 그랜드 워커힐 호텔과도 가깝다. 가정집을 개조한 단독 건물로 식당 내부는 거실과 방들로 나누어져 있다. 주차는 식당 주변 공터에 할 수 있다. 대표 메뉴는 추어탕, 추어물만두, 수제비추어탕이 있고 세트 메뉴로 추어탕과 추어물만두, 추어 튀김을 한꺼번에 맛볼 수 있는 ‘온 세트메뉴’가 있다. 어린이들을 위한 수제 단호박 치즈돈가스도 맛있다. 근처에 가볼 만한 곳으로는 고구려 대장간 마을이 있다.",
자연염색박물관,1248810,인문(문화/예술/역사),문화시설,박물관,http://tong.visitkorea.or.kr/cms/resource/25/1240825_image2_1.jpg,대구광역시,128.6364782252,35.9793444686,"자연 염색 박물관은 섬유, 염색, 민속에 관련된 유물을 수집‧보존해 우리 전통색의 원류를 찾고 한국 자연 염색의 우수성을 세계에 알리기 위해 문을 열었다. 박물관 견학은 세계 공예예술실에서 시작한다. 아트숍으로 운영되는 이곳에서는 우리나라뿐 아니라 아시아와 유럽 등 세계 각국에서 제작된 다양한 공예작품이 전시돼 있다. 1층 전시실의 중심 공간인 갤러리 아원은 자연 염색, 전통공예, 섬유예술 등 다양한 장르의 작품을 만나볼 수 있는 공간이다. 2층 유물실은 자연 염색으로 제작된 전통 유물을 만날 수 있다. 민속 염직 도구실은 자연 염색 과정에서 필요한 도구들을 모아 놓은 곳. 물독, 술독, 시루, 소쿠리 같은 전통도구와 함께 침염기와 발효기, 증열기 같은 현대적 도구들도 전시돼 있다.","<a href=""http://www.naturaldyeing.net/"" target=""_blank"" title=""새창 : 자연염색박물관 홈페이지로 이동"">http://www.naturaldyeing.net</a>"
자연용천수에 몸을 담그며 여행의 추억을 떠올리다,1871192,추천코스,힐링코스,힐링코스,http://tong.visitkorea.or.kr/cms/resource/77/202177_image2_1.jpg,Unknown,129.4033648045,36.9699545982,"울진은 백암온천, 덕구온천 등이 있어 온천휴양지지로 적격이다. 특히 덕구온천은 보양온천으로 지정되어 있어 온천에 스파시설까지 갖추고 있다. 온천에 몸을 담그며 휴식도 즐기고, 덕구온천 원탕까지 세계의 유명한 다리를 축소해 놓은 덕구계곡을 따라 트래킹도 즐겨보자. 울진엑스포공원, 죽변항, 폭풍속으로 세트장 등 바다를 만끽하고 나면, 절로 온천의 뜨끈한 기운이 떠오른다.",
자연을 닮은 사람들,1798107,음식,음식점,한식,,전북특별자치도,127.4271227532,35.4027741402,"‘자연을 닮은 사람들’은 전북 남원시에 위치해 있는 식당이다. 푸짐한 양과 고급스러운 맛의 찜닭을 맛볼 수 있다. 이외에 낙지볶음밥, 낙지소면, 두부김치, 김치전 등 다양한 메뉴가 준비되어 있어 취향에 맞게 메뉴선택이 가능하다. 매장 내에 단체석이 있어 모임이나 회식장소로 안성맞춤이며 주차는 매장 전용 주차장이 있어 편안하게 식사를 할 수 있다.",
자연을 벗삼아 즐기는 체험여행,1997055,추천코스,가족코스,가족코스,http://tong.visitkorea.or.kr/cms/resource/70/1589970_image2_1.jpg,Unknown,127.4069621402,37.0949499135,"민속촌과 놀이공원, 식물원 등 다양한 관광지가 있는 용인에서 가족이 함께 즐길 수 있는 체험여행을 떠나보자! 아이들과 함께 떠나는 체험여행, 경기도 용인에서 자연을 느끼고 각종 체험을 즐길 수 있는 체험여행 코스이다.",
자연을 품은 가을밤의 서정,2037261,추천코스,캠핑코스,캠핑코스,http://tong.visitkorea.or.kr/cms/resource/99/1830399_image2_1.jpg,Unknown,128.397246664,35.0545027118,"고성당항포해수욕장은 공룡엑스포가 열린 공룡박물관 근처에 있다. 캠핑장을 이용하면 관광지 입장이 무료라 일석이조 여행이다. 관광지내의 체험들을 즐기고 거제로 이동하여 학동몽돌해변과 바람의 언덕, 신선전망대에서 내려다 보이는 바다를 해금강유람선을 타고 누비며 보는 절경은 잊지 못할 추억이 될 것이다.",
"자연을 품은 곳, 창녕 우포늪과 의령 한우산",1966900,추천코스,가족코스,가족코스,http://tong.visitkorea.or.kr/cms/resource/97/1803897_image2_1.jpg,Unknown,128.4160843757,35.5539107612,"우리나라의 대표적인 생태관광지인 우포늪과 자동차드라이브 코스로 일품인 의령 한우산을 함께 돌아보는 코스다. 우포늪에서 원시 자연의 아름다움을 마음에 담은 뒤, 의령의 봉화대와 일붕사에서 바위절벽과 동굴법당의 매력에 흠뻑 빠질 수 있다. 늪에서 출발하여 기암절벽과 산으로 이어지는 자연친화적인 코스이며, 가족이나 연인과 함께 하는 여행코스로 추천할 만하다",
자연을닮은사람들,2902224,음식,음식점,한식,http://tong.visitkorea.or.kr/cms/resource/08/2902208_image2_1.jpg,전북특별자치도,127.2373804548,35.8583469458,"TV 프로그램 식객 허영만의 백반기행에 소개된 곳으로 완주의 갈비 맛집으로 유명한 곳이다. 숯불 돼지갈비 구이와 들깨 수제비가 대표 메뉴이며 자연 숙성 방식으로 만든 발효 소스를 이용해 만든 샐러드와 반찬을 내어준다. 찜질방의 황토방 느낌의 실내가 독특하며, 원목으로 된 테이블은 옛날 민속 주점 분위기를 자아낸다. 전용 주차장이 마련되어 있고 야외에도 테이블이 설치되어 있어, 단체 모임이나 가족 외식 장소로도 적합하다. 오성 한옥마을, 위봉폭포, 대승한지마을 등이 주변에 있어 연계 관광이 수월하다.",
자연의 길,1894806,음식,음식점,카페/전통찻집,,서울특별시,126.9713491212,37.5781638779, ‘자연의 길’은 현대인이 즐겨 찾는 고급 커피 음료 외에 천연건강음료를 만들어 제공하고 있다. 또한 고려삼과 녹용 제품 등 다양한 건강 제품도 소개되고 있다.<br>,
자연의 밥 로송,2739447,음식,음식점,한식,http://tong.visitkorea.or.kr/cms/resource/90/2775390_image2_1.jpg,경기도,127.2346807743,37.1836782252,주변이 산과 자연으로 둘러싸여 있어 나들이하기 좋은 용인 처인구의 한정식 맛집이다. 깔끔한 실내에 칸막이식 좌석이 마련되어 있어 코로나 시국에도 편안하게 식사를 즐길 수 있다. 식전 샐러드 반찬은 무료로 이용 가능하다. 식당 옆에 식당과 연계된 커피전문점이 있어 식사 후에 할인된 가격으로 차 한 잔의 여유를 즐길 수도 있다.,
자연의 향기를 즐길 수 있는 포천 가을 여행 1박2일 코스,2899221,추천코스,힐링코스,힐링코스,http://tong.visitkorea.or.kr/cms/resource/24/2846124_image2_1.jpg,경기도,127.1694149861,37.7518472513,"숲과 물의 도시, 포천에서 즐기는 가을 자연의 향기! 국립수목원에서 시작해 향긋한 허브아일랜드까지! 마음이 움직이는 여행을 떠나보자! 국립수목원에서는 수채화처럼 물든 단풍나무들을, 산사원에선 풍류 가득하고, 느림의 미학을 배울 수 있는 향긋한 분위기를 느낄 수 있다. 정취 가득한 여유로움을 느껴보자.",
자연의꿈,2761987,레포츠,육상 레포츠,"야영장,오토캠핑장",http://tong.visitkorea.or.kr/cms/resource/25/2761825_image2_1.JPG,경기도,126.8942732487,37.856091242,"산내음 가득하고 등산로가 있는 자연의 꿈 캠핑장은 경기 파주시 법원읍에 위치하고 있다. 캠핑장 옆에 계곡을 끼고 있어 여름 물놀이를 하기에 좋다. 트레일러, 캠핑카 진입 가능하다. 파쇄석 오토캠핑장으로 운영하고 있다.",
"자연이 준 선물, 백련지와 청정 갯벌",1874188,추천코스,가족코스,가족코스,http://tong.visitkorea.or.kr/cms/resource/54/1606954_image2_1.jpg,Unknown,126.4161202728,34.85435785,"동양 최대의 백련 자생지로 알려진 무안 회산 백련지와 전국 최초 습지보호지역으로 지정된 무안 갯벌 지역을 함께 둘러본다. 여행코스는 우리나라 다도를 정립한 인물인 초의선사 유적지부터 시작해 백련지, 품바 발상지를 지나 청정 갯벌들로 이어진다. 이중 무안 생태갯벌센터는 아이들 학습 공간으로 활용하면 좋다. 이동 거리가 상당한 코스이기 때문에 중간 중간 적절히 쉬어가기를 권한다.",
