title,contentid,cat1,cat2,cat3,firstimage,region,mapx,mapy,overview,homepage
"조선 팰리스 서울 강남, 럭셔리 컬렉션 호텔 (Josun Palace, a Luxury Collection Hotel, Seoul Gangnam)",2783723,숙박,숙박시설,관광호텔,http://tong.visitkorea.or.kr/cms/resource/05/2786805_image2_1.jpg,서울특별시,127.0413726514,37.5029349856,"조선 팰리스 서울 강남, 럭셔리 컬렉션 호텔(이하 조선 팰리스)은 한국 최고의 럭셔리 호텔이었던 초기 조선호텔의 장인정신을 바탕으로 지난 100여 년동안 지녀온 헤리티지를 계승해 조선호텔앤리조트가 첫 선을 보이는 최상급 독자 브랜드 호텔이다.  또한 한국 최초로 메리어트 인터내셔널의 유니크하면서도 역사적인 럭셔리 호텔 브랜드인 ‘럭셔리 컬렉션’(The Luxury Collection)과 소프트 브랜드 제휴를 맺어 대한민국 첫 번째로 오픈한 럭셔리 컬렉션 호텔이다.<br>지하 6층, 지상 36층 규모에 총 254 객실을 보유하고 있으며 파노라마 뷰, 도심 속의 스카이라인 뷰를 느낄 수 있다. 객실 타입은 총 9개로, 전 객실에 스웨덴 명품 브랜드 바이레도 제품 어메니티가 제공되며, 에어 드레서, 캡슐 커피 머신이 비치되어 있다. 전 객실 그랜드 리셉션에서 커피 및 쿠키가 제공되고, 객실 타입에 따라 다양한 혜택이 포함되어 있어 조선 팰리스만의 럭셔리한 라이프를 즐길 수 있다. 고객 한 분 한 분에게 맞춤형 서비스를 선보일 그리팅 장소인 그랜드 리셉션, 최상의 컨디션 속에서 서울의 시티뷰를 조망할 수 있는 총 254개의 객실, 콘스탄스(Constans), 이타닉 가든(Eatanic Garden), 더 그레이트 홍연(The Great Hong Yuan), 1914 라운지 & 바, 조선델리 더 부티크 등 총 5개로 구성된 독보적인 고메 컬렉션, 최대 300 명이 한번에 이용할 수 있는 더 그레이트 홀을 비롯한 3개의 연회장, 럭셔리 웰니스를 완성해줄 수영장 및 피트니스 시설로 구성되어 있다.<br>조선 팰리스는 호스피탈리티 업계의 신진 디자이너로 명성을 떨치며 전세계적으로 주목받고 있는 움베르트&포예(Humbert&Poyet)가 디자인 설계를 맡았다. 두 디자이너는 럭셔리에 대한 정의를 통해 최상위 호텔 브랜드의 다층적인 미를 완성시켰다. 미적 완성도뿐 아니라 조선 팰리스는 시그니처 향인 라스팅 임프레션(Lasting Impression)을 개발해 오감의 다각적인 요소를 채웠다. 긴 시간 동안 겹겹이 쌓인 조선의 스토리를 향을 통해 다층적으로 느낄 수 있도록 고안했으며 그윽하게 농축되어 신비롭고 우아한 조선 팰리스의 향은 호텔 로비에 들어선 순간부터 배웅의 시간까지 고객의 여정을 함께해나가고 있다. 한편 조선 팰리스는 ‘위드 코로나’ 시대에 고객들을 위한 객실 내 서비스들을 다각적으로 도입했다. 전 객실 내 자동 UVC 살균장치를 도입해 객실 정비 후 자동으로 자외선 살균시스템이 작동된다. 공기청정, 가습기능 역시 객실 내부 필터로 장착되어 객실 컨디션을 쾌적한 상태로 유지하며, 전 객실에 공기청정기를 추가로 설치해 놓았다. 더불어 전 객실 설치된 에어드레서를 통해 고객들의 의류 컨디션까지 최상으로 보장해 나가고 있다. 또한, 문자나 IT 기기들에 친숙한 MZ 세대들의 눈높이에 맞춰 체크아웃 절차에서부터 객실 내에서의 모든 서비스 부분을 객실 내 스마트 TV와 Tablet PC를 통한 컨시어지 기능으로 구현해 비대면 서비스 옵션을 강화했다.","<a href=""https://jpg.josunhotel.com/"" target=""_blank"" title=""새창 : 조선팰리스 사이트로 이동"">https://jpg.josunhotel.com/</a>"
조선갈비,2849475,음식,음식점,한식,http://tong.visitkorea.or.kr/cms/resource/70/2849470_image2_1.jpg,서울특별시,126.8455444911,37.5581500648,"조선갈비는 지하철 5호선 발산역 4번 출구 부근에 있다. 매장은 단독 건물로 1층에 주차장이 넓어 방문 시 자동차로 이용하기 편리하고 발레파킹 서비스도 받을 수 있다. 건물 외형은 고급스럽고 내부 인테리어 또한 잘되어 있다. 테이블이 많고 프라이빗한 대형 룸, 개별 룸도 있어 각종 모임 행사나 상견례 등 가족모임에도 적합하다. 유아시설(놀이방)과 장애인 편의시설도 갖추고 있어 손님들이 편리하게 사용할 수 있다. 대표 메뉴는 한우 생갈비, 한우마늘 양념갈비, 한돈 양념갈비, 전복낙지 왕갈비탕이 있다. 그 외 메뉴로 한우육회비빔밥, 함흥냉면, 왕갈비탕, 한정식이 많이 나간다. 농림축산식품부 제공 안심식당이다. 식당 주변에 가양동 문화공원, 코끼리공원, 어울림공원이 있어 식사 전후에 둘러보기 좋다.","<a href=""https://blog.naver.com/chosungalbi""target=""_blank"" title=""새창 : 조선갈비 사이트로 이동"">https://blog.naver.com/chosungalbi</a>"
조선김밥,1912553,음식,음식점,한식,,서울특별시,126.9822370048,37.5786223527,"‘조선김밥’은 서울특별시 종로구 안국동에 있는 김밥 전문점이다. 메뉴에는 조선 김밥, 어묵 김밥, 조선 국시가 제공되며, 1인 식사 가능한 입식테이블과 단체 식사 가능한 좌식 테이블이 마련되어 있다. 식사메뉴 주문 시 밑반찬은 김치, 멸치볶음, 김자반, 장아찌가 나온다. 조선 김밥(나물 김밥)에는 시래기가 들어가는데 김밥 맛이 짜지 않고 담백하여 건강한 맛이 느껴진다.",
조선대학교 미술관,3401583,인문(문화/예술/역사),문화시설,미술관/화랑,http://tong.visitkorea.or.kr/cms/resource/04/3401604_image2_1.jpeg,광주광역시,126.93031492,35.1439393089,"조선대학교 미술관은 국내외 미술사조의 흐름을 전달하는 창구 역할과 사장되는 지역 미술 문화의 자료 발굴, 정보 수집 및 보관, 작가들의 발표의 장으로 활용하고 이를 활성화하여 시민과 미술인 모두에게 문화적 욕구를 충족시킬 수 있도록 하기 위해 설립되었다. 1989년 <광주·전남 미술 50년전>이라는 대규모 개관전을 시작으로 남도 미술의 전통의 획을 긋는데 크게 이바지하였고 매년 특별 기획전을 통하여 청년 작가를 발굴하고 지역 문화의 예술적 정체성을 학생들에게 교육하고 홍보하고 있다. 또한 예술 문화 공간으로서 일익을 담당하여 예향, 광주, 전남 지역사회에 크게 이바지하고 있다. 학생들에게 전시 경험을 제공하기 위해 미술 대학 학생들의 작품 전시회를 개최하기도 한다.","<a href=""https://artmuseum.chosun.ac.kr"" target=""_blank"" title=""새창: 조선대학교 미술관 홈페이지으로이동"">https://artmuseum.chosun.ac.kr<a><br>
<a href=""https://www.instagram.com/cuma7832"" target=""_blank"" title=""새창: 조선대학교 미술관 인스타그램으로이동"">https://www.instagram.com/cuma7832<a><br>
<a href=""https://blog.naver.com/cuma7832"" target=""_blank"" title=""새창: 조선대학교 미술관 블로그로이동"">https://blog.naver.com/cuma7832<a>"
조선대학교 장미원,2687877,인문(문화/예술/역사),휴양관광지,테마공원,http://tong.visitkorea.or.kr/cms/resource/40/3368240_image2_1.jpg,광주광역시,126.934736781,35.1427811811,"조선대학교 장미원은 2001년 5월, 동문들의 모교사랑에서 출발했다. 장미원의 꽃송이에는 전공 공부에 지친 학생들이 감성과 인격을 수양하여 실력은 물론 사회의 아픔을 돌아보는 따뜻한 마음을 가진 전문인이 되기를 바라는 후배사랑의 마음이 담겨있다. 1946년, 광주/전남을 중심으로 7만 2천여 설립동지회 회원들의 자발적인 출연과 참여로 설립된 조선대학교는 이제 지역을 대표하는 대학으로 성장했다. 장미원의 꽃송이에는 대학설립의 기틀을 마련해주신 지역민의 사랑에 대한 보은의 마음이 담겨있다. 봄부터 가을까지 세계 각국의 장미가 연달아 피어나는 조선대학교 장미원은 장미를 통해 선배와 후배, 대학과 지역이 함께 만나는 사랑의 공간이다. 

(출처 : 조선대학교 홈페이지)","<a href=""http://www3.chosun.ac.kr/chosun/323/subview.do"" target=""_blank"" title=""새창: 조선대학교 장미원 홈페이지로 이동"">http://www3.chosun.ac.kr</a>"
조선면옥,132965,음식,음식점,한식,http://tong.visitkorea.or.kr/cms/resource/20/1983920_image2_1.jpg,충청북도,127.4871066585,36.634657105,천연의 야채 과즙을 사용하여 간을 하기 때문에 개운하고 담백한 육수와 부드러운 육질의 고기가 이곳의 자랑이다.,
조선민화박물관,130309,인문(문화/예술/역사),문화시설,박물관,http://tong.visitkorea.or.kr/cms/resource/86/3336986_image2_1.jpg,강원특별자치도,128.6066042622,37.0963219882,"조선민화박물관은 국내 최초의 민화 전문 박물관으로 2000년 7월에 영월군에 건립되었으며, 전통 민화의 계승 발전을 위해 체계적인 연구와 수집은 물론 전시와 교육, 전문 서적의 출판, 맞춤형 체험학습, 포럼, 공모전 등을 추진하고 있다. 소장하고 있는 5,000여 점의 민화 유물 중 250점을 상시 순환 전시하고 있으며 관람객은 언제나 전문 해설가의 재미있는 민화 이야기를 들을 수 있다. 매년 개최되는 공모전 수상작과 현대 민화 작가들의 작품도 함께 전시하여 민화의 시대적 흐름을 한자리에서 관람할 수 있으며, 아이들과 함께할 수 있는 재미있는 민화체험을 즐길 수 있다. 특히, 성인 전용 춘화 전시실이 2층에 마련되어 있어 큰 인기를 끌고 있다.
제1전시관(상설전시)에서는 국보급 유물 등 진본 민화 200여 점을 전문 해설가의 재미있는 설명과 함께 관람할 수 있으며, 제2전시관(기획 전시)에서는 기증작, 특별전 작품 등의 현대 민화를  관람할 수 있다. 제3전시관(전국민화공모전 수상작 전시)에서는 전국민화공모전 수상작 등 현대 민화를 관람할 수 있으며, 춘화방에서는 성인들을 위해 한국, 중국, 일본의 춘화 50여 점이 전시(만 19세 이상만 입장 가능) 되어 관람할 수 있다.","<a href=""http://www.minhwa.co.kr"" target=""_blank"" title=""새창 : 조선민화박물관 홈페이지로 이동"">http://www.minhwa.co.kr</a>"
조선비 숯불갈비,1377593,음식,음식점,한식,,경상남도,128.0849436633,34.9387795736,"삼천포에는 벌리동이라는 음식점이 밀집한 지역이 있다. 일명 먹자골목으로 불리는 곳인데, 이곳에서 가장 유명한 돼지갈빗집을 찾으면 이구동성으로 조선비숯불갈비를 꼽는다. 손님을 선비처럼 모신다는 뜻으로 2000년에 영업을 시작하였다. 세월이 흐르는 동안 이곳의 변함없는 자랑은 주인이 직접 여러 곳을 찾아다니면서 찾아낸 연하고 육질이 좋은 쇠고기와 돼지고기이다. 그다음으로는 직접 개발해서 만든 갈비양념과 양파소스이다. 비법의 양념이 쏙쏙 배인 돼지갈비를 특제소스에 담겨 나오는 양파와 함께 쌈을 싸 먹으면 연하면서도 감칠맛이 난다. 소갈비와 삼겹살 역시 맛이 좋다.","<a href=""http://joseonbi.modoo.at/"" target=""_blank"" title=""새창 : 조선비 숯불갈비 홈페이지로 이동"">http://joseonbi.modoo.at/</a>"
조선수군재건출정공원,3014552,인문(문화/예술/역사),휴양관광지,공원,http://tong.visitkorea.or.kr/cms/resource/48/3014548_image2_1.jpg,전라남도,127.4645354464,35.2137183589,"하나로마트 구례농협 본점 인근, 손인필의 옛 집터 자리에 난중일기 등 역사자료 고증에 따라 조선수군 재건의 여정이 담긴 벽화, 청동부조 조형물, 정자 등이 있는 조선수군재건출정공원이 조성되었다. 이 공원에 설치된 벽화에는 백의종군하던 이순신장군이 1597년 8월 3일 삼도수군통제사로 재임명된 이후부터 9월 16일까지 전남 일대에서 조선 수군을 재건해 명량대첩을 승리로 이끄는 44일간의 여정이 담겨 있다. 이때 이순신장군 휘하에는 손인필, 황대중을 비롯한 군관 9명과 병사 6명이 전부였다고 한다. 이때 조선수군을 재건하는데 이순신장군이 설치한 통제영 주둔지이자 조선 수군 재건을 결의한 출정소가 손인필의 집이었다고 한다. 군관 손인필은 이순신장군의 휘하에서 수군을 재건하는데 필요한 병참물자 조달과 군사 모집 역할을 수행했으며 그의 아들 손응남도 긴급한 정보를 전달하는 역할을 수행했다. 
한편 손인필 비각 옆에는 큰 바위 하나가 자리하고 있는데 일명 이순신 바위로 불리면서 이순신장군이 구례에 머물렀을 당시 바위에 앉아 구국의 방향을 고뇌했다는 이야기도 담겨있으며 나라를 구하고자 고뇌한 이순신 장군의 뜻을 기리고자 정자를 짓고 구국정이라 이름 붙였다.",
조선시대와 근대사를 두루 만나는 역사기행,1874800,추천코스,힐링코스,힐링코스,http://tong.visitkorea.or.kr/cms/resource/21/1589321_image2_1.jpg,Unknown,127.1884127996,37.4766795706,"서울에 인접한 광주는 15세기 이후 조선백자를 생산하던 중앙관요가 밀집해 있었다. 현재 82개소에 달하는 조선백자 관련 유적이 남아있으며, 선조들의 맥을 잇는 도공들이 지금도 활발히 작업하고 있다. 병자호란의 현장인 남한산성 일대는 수도권 등산로로 인기 있고, 서울에 식수를 공급하는 팔당호는 시원스런 풍광이 일품이다.",
조선옥,133338,음식,음식점,한식,http://tong.visitkorea.or.kr/cms/resource/29/1845629_image2_1.jpg,서울특별시,126.99370573,37.5671294506,"조선옥은 서울시 중구에 위치하고 있는 50년 넘는 전통의 음식점이다. 
엄선한 한우갈비만을 취급하고 값도 저렴하기로 유명하다. 음식 맛이 한결같으며 대구탕(한우+국내산 육우)은 어느 음식점에서도 흉내 낼 수 없는 별미 중의 별미이다. 이 외에도 장국밥, 냉면 등 다양한 식사류도 준비되어 있다.",
조선옥,642948,음식,음식점,한식,,전라남도,127.7243356628,34.9652897195,"광양 제철에서 10여 분 거리에 있는 조선옥은 광양의 명소다. 주인이 직접 새벽시장에서 장을 보는 것에서부터 정성을 다하며 40년 넘는 경력의 찬모가 맛깔스러운 손맛을 발휘한다. 1등급 이상의 쇠고기만을 쓰며 돼지고기 또한 국내산 1등급 이상을 직접 구입한다. 최근에는 외국인 손님들도 많이 찾아 외국인을 위한 테이블을 따로 마련했다. ‘모범음식점’과 ‘남도음식명가’로 선정되었으며 섬진강 하구, 백운산, 수어댐, 청매실농원, 화개 장터가 가까워 들렀다 갈만하다.",
조선옥,1941079,음식,음식점,한식,,광주광역시,126.9073209181,35.096474833,조선옥에서는 굴비정식을 맛볼 수 있다. 영광 법성포 굴비 등 20여 가지의 다양한 반찬으로 구성된 ‘굴비정식’은 남도의 맛을 한자리에서 전부 맛볼 수 있는 특선 메뉴이다. ‘조선옥’에서는 민어회도 제공한다. 민어는 조선시대부터 최고 보양식으로 꼽혀 왔다. 숙성된 민어회의 찰진 육질과 막걸리 식초로 만든 특유 양념장은 깊은 맛을 더해 준다. 민어회는 6월~9월까지가 제철이다. 이외에도 갈비찜 및 정식은 단체 및 가족 손님들이 즐겨 찾는 메뉴이다.<br>,"<a href=""https://www.instagram.com/gj_chosunok"" target=""_blank"" title=""새창 : 조선옥 홈페이지로이동"">https://www.instagram.com/gj_chosunok</a>"
조선왕가,1171915,숙박,숙박시설,한옥,http://tong.visitkorea.or.kr/cms/resource/49/2482749_image2_1.jpg,경기도,127.1014732707,38.063642988,"1800년대에 창건되고 1935년에 99칸으로 중수[重修]된 황실가[皇室家]의 전통 한옥으로 현재 연천에 염근당과 자은정이 이건[移建] 되어 있다. 조선왕가에 흐르는 기운을 받으며 전통한옥 체험을 할 수 있는 국내 유일한 왕가체험 시설이다. 왕가로 밝혀지는 과정의 스토리와 전통한옥에 대한 스토리텔링이 잘 이루어져 있는 조선왕가 전통한옥체험시설에서는 계절별 전통음악회, 연잎밥만들기, 약선요리, 한방훈육테라피, 전통한옥숙박체험 등 고품격 체험을 즐길 수 있다.

(출처 : 연천군 문화관광 홈페이지)",
조선왕가 로얄 카바나,2757986,레포츠,육상 레포츠,"야영장,오토캠핑장",http://tong.visitkorea.or.kr/cms/resource/94/2758494_image2_1.JPG,경기도,127.1014732707,38.063642988,"조선왕가 로얄 카바나는 연천에 있는 이색 숙소로 글램핑장과 한옥을 함께 운영하는 곳이다. 조선왕가의 염근당과 상량문을 연천으로 이건하여 한옥 숙소와 함께 럭셔리한 카바나 15개가 있다. 카바나는 호텔 수준의 어메니티를 갖추고, 개별 욕실 화장실을 갖추고 있어 편리한데, 다만 동절기에는 동파 위험으로 공용 욕실 화장실을 이용해야 한다. 한옥 숙소가 비용 면에서는 부담스러운 경우 정취를 보는 것으로 달래 볼만한 이색 글램핑장이다. 안전상 위험 때문에 바비큐는 업체에서 제공하는 것만 대여 이용 가능하다.","<a href=""http://chosun1807.com/default/"" target=""_blank"" title=""새창 : 조선왕가 로얄 카바나 사이트로 이동"">http://chosun1807.com/default/</a>"
조선왕가(농업회사법인 조선왕가 주식회사)[한국관광 품질인증/Korea Quality],2595800,숙박,숙박시설,한옥,http://tong.visitkorea.or.kr/cms/resource/86/2595086_image2_1.jpg,경기도,127.1014927143,38.0636068823,"조선왕가는 서울 종로구 명륜동에 있던 고종황제의 영손 이근의 고택을 경기도 연천으로 이건하여 만든 호텔이다. 한국 전통 왕실 한옥에서 숙박하며 왕실 문화를 체험해볼 수 있다. 한옥 객실은 총 15개로, 각 객실마다 욕실을 갖췄고 다도세트를 무료로 제공한다. 훈욕테라피와 한방비누 만들기 등 체험프로그램을 운영하고, 사전 예약시 유료 조식을 제공한다. 전통혼례나 워크숍 등을 위해 장소 대여가 가능하다. 글램핑장 이용시 바비큐장 사용이 가능하고, 단체워크샵 행사시 캠프파이어 이용이 가능하다.",http://www.chosun1807.com
조선의 왕들이 지극히 아끼던 공간,2037723,추천코스,가족코스,가족코스,http://tong.visitkorea.or.kr/cms/resource/55/1568355_image2_1.jpg,Unknown,126.9919888278,37.5809583673,"우리나라를 대표하는 궁궐은 경복궁을 꼽는다. 그러나 유네스코에 등재된 것은 창덕궁이다. 창덕궁은 태종부터 왕들이 경복궁보다 자주, 오래 머문 궁전이다. 이곳을 시작으로 민속박물관 등 서울 요지의 문화유산을 모두 볼 수 있는 좋은 코스다.",
조선일보 뉴지엄,2553942,인문(문화/예술/역사),산업관광지,기타,,서울특별시,126.9671293186,37.5061749444,"조선일보 뉴지엄은 뉴스(News)와 박물관(Museum)의 개념을 함께 아우른 공간으로 조선일보 역사기념관과 미디어 체험관으로 구성되어 있다. 역사기념관은 창간호를 비롯한 수많은 유물과 자료를 통해 조선일보의 역사를 보여준다. 미디어 체험관에서는 미디어 아쿠리움, 기자연수실, AR 활용 취재현장, 방송 스튜디오, VR 뉴스센터, 뉴스갤러리 등의 코너로 구성되어 있어 체험을 통해 청소년들이 신문, 방송의 제작 현장을 체험해 보며 미디어에 대한 이해를 높일 기회를 갖게 한다. 국내 최초로 신문과 방송, 스마트폰과 3D 입체영상 등 첨단 정보기술을 접목시킨 복합 미디어 체험관은 청소년들이 신문, 방송의 제작 현장을 체험해 보며 미디어에 대한 이해를 높일 기회를 마련했다. 또한 1일 기자체험, 금요기자체험, NIE 특강 등의 체험도 가능하다. 수도권 지하철 9호선 흑석역 3번 출구에서 345m에 위치하고 있다.","<a href=""https://newseum.chosun.com/index.jsp"" target=""_blank"" title=""새창 : 홈페이지로 이동"">newseum.chosun.com</a>"
조선일보미술관,129768,인문(문화/예술/역사),문화시설,미술관/화랑,http://tong.visitkorea.or.kr/cms/resource/53/696953_image2_1.jpg,서울특별시,126.9754657039,37.5678762583,"조선일보미술관은 수준 높은 전시와 새로운 미술 문화의 영역을 확대하는 곳이다. 
1988년 4월에 개관한 조선일보미술관은 해마다 수십 건의 기획전과 초대전, 그리고 대관전을 유치함으로써 작가들의 작품발표 기회를 부여함과 동시에 일반인들의 문화적 욕구를 충족시켰다. [샤갈전], [올해의 젊은 작가전], [고야 판화전], [백남준 비디오아트전], [운보 김기창 초대전], [헬무트 뉴턴 사진전] 등 굵직한 기획 초대전을 개최함으로써 새로운 미술 문화의 영역을 확대 및 재생산해 왔다. 끊임없는 기획전과 수준 높은 대관 전시를 유치함으로써 늘 주목받는 전시장으로 자리 잡고 있다. 또한 자신의 예술 세계를 끊임없이 실험하고 발전하는 이들에게 주어지는 이중섭미술상을 후원하면서 한국 현대미술계에 이름을 남길 실험적인 작가들을 많이 길러냈다. 
150평에 이르는 넓은 전시 공간과 깨끗한 시설, 조용하고 아늑한 분위기, 순백의 전시 공간은 관객들을 향해 늘 개방되어 있다. 위치는 수도권 지하철 5호선 광화문역 6번 출구에서 270m에 있다.",
조선쫄복탕,2876212,음식,음식점,한식,http://tong.visitkorea.or.kr/cms/resource/06/2876206_image2_1.JPG,전라남도,126.3771310441,34.7808738228,"'조선쫄복탕'은 목포항 국제 여객 터미널에서 약 1km에 자리한 복어 요리 전문점이다. 아침 8시부터 저녁 8시까지 운영해 아침 식사도 가능하다. 여객선을 이용하는 관광객은 물론 현지인들의 발길이 끊이지 않는 곳이다. 이곳의 대표 메뉴는 100% 자연산 복어를 요리한 쫄복탕이다. 다른 식당에서 판매하는 복국과 다르게 이곳의 탕 요리는 복어를 오래 끓여 걸쭉하게 국물을 우려낸 것이 특징이다. 또한, 미나리가 향긋하게 올라가 있어 시원하면서도 미나리 특유의 향을 느낄 수 있다. 쫄복탕을 더 맛있게 즐기고 싶다면 참기름 향이 배어있는 부추무침을 함께 먹으면 된다. 만약 개운함을 느끼고 싶다면 식초를 넣어 먹어도 된다. 전국 택배 배송도 하고 있다.  
※ 반려동물 동반 불가",
조선초밥,2918772,음식,음식점,일식,,경기도,126.7306852647,37.3682367524,"조선초밥은 경기 시흥시에 위치한 초밥 전문점이다.
조선의 맛을 담은 조선초밥만의 대표메뉴 누룽지 초밥을 필두로 한국적인 맛과 스타일을 담은 프리미엄 감성 초밥이다. 우드톤의 인테리어로 꾸며져 있어 감성 초밥이라는 간판과 퍽 잘 어울리는 느낌이다. 친절한 서비스와 푸짐한 양이 한번 더 방문을 이끈다. 모둠초밥, 활어초밥, 연어초밥, 스페셜초밥 등 다양한 구성의 초밥을 맛볼 수 있다.",
조선통신사 축제,141274,인문(문화/예술/역사),축제,일반축제,,부산광역시,129.0604783319,35.1357834483,"1607년부터 1811년까지 12회에 걸쳐 조선과 일본 사이를 오갔던 조선통신사와 조선통신사의 행렬을 되살려 진행되는 축제로, 당시 조선 통신사의 문화 교류적인 면모를 강조하고, 한국과 일본의 우호를 증진하기 위하여 시작된 축제이다. 10년이 넘게 지속되고 있는 부산의 대표적인 축제이며, 부산문화재단에서 주관하는 축제이다. 주요 프로그램으로는 '조선통신사 행렬', '조선통신사선 뱃길탐방' 등이 있다.","<a href=""http://www.tongsinsa.com"" target=""_blank"" title=""새창:조선통신사축제 홈페이지로 이동"">http://www.tongsinsa.com</a>"
조선통신사역사관,1756065,인문(문화/예술/역사),문화시설,박물관,,부산광역시,129.0621226334,35.1357584814,"조선에서 일본 막부에 파견한 외교사절을 조선통신사라고 한다. ‘통신(通信)’이란 ‘신의를 나눈다’는 의미이다. 조선통신사를 통한 교류는 신뢰를 기반으로 한 조선과 일본의 평화와 선린우호를 상징한다고 할 수 있다. 
조선통신사역사관은 임진왜란 이후 1607년부터 1811년까지 12차례 일본으로 파견된 통신사에 대하여 누구나 쉽고 재미있게 이해할 수 있도록 하기 위한 역사교육의 현장이다. 최첨단 멀티미디어 기술을 활용한 다양한 전시 콘텐츠, 알찬 프로그램 등으로 역사와 소통할 수 있는 기회를 제공한다.","<a href=""http://www.tongsinsa.com/"" target=""_blank"" title=""새창 : 조선통신사역사관 홈페이지로 이동"">http://www.tongsinsa.com/</a>"
