title,contentid,cat1,cat2,cat3,firstimage,region,mapx,mapy,overview,homepage
태화강국가정원 삼호지구,2755768,자연,자연관광지,자연생태관광지,http://tong.visitkorea.or.kr/cms/resource/41/2755741_image2_1.jpg,울산광역시,129.2832363186,35.5501022189,"2019년 7월에 국가정원으로 지정된 태화강 국가정원 삼호지구는 여름이면 백로, 겨울이면 떼 까마귀의 서식지이자 계절마다 돌아오는 철새들의 휴식공간으로, 울산 남구 도심 속에서 습지 상태가 잘 유지되고 있어 아이들이나 학생들이 생태학습하기에 좋은 곳이다. 철새 광장, 은행나무 정원, 보라정원, 조류 생태원, 숲 속 정원 등으로 이루어져 있으며, 삼호대숲은 '철새쉼터'로 삼호대숲을 끼고 산책할 수 있는 멋진 길이 조성되어 있다. 울창한 소나무 숲길과 바로 옆의 대나무 숲을 끼고 산책하면서 여러 나무들과 풀들이 함께 공존하는 것을 볼 수 있는 정원이다. 낮이면 은하수 다리에서 햇빛 아래 반짝이는 태화강의 물결과 대숲을 감상하고, 해가 진 밤이면 조명이 빚어내는 아름다운 경관을 즐길 수 있는 특별하고 가치 있는 곳이다.","<a href=""http://www.ulsan.go.kr/s/garden/main.ulsan"" target=""_blank"" title=""새창 : 태화강국가정원 삼호지구 사이트로 이동"">http://www.ulsan.go.kr/s/garden/main.ulsan</a>"
태화강동굴피아,2605809,인문(문화/예술/역사),체험관광지,이색체험,,울산광역시,129.3024681091,35.5452836784,"태화강동굴피아는 일제강점기 강제 노역 등 아픈 역사를 지닌 곳을 체험공간으로 탈바꿈하였다. 원래 이곳은 일제강점기 때 만들어진 인공 동굴이었다. 일본군은 태평양전쟁 중이었던 1942년 전시 상황에 대비하여 울산비행장을 군용 비행장으로 개조하였다. 울산비행장 운영과 관련하여 군량미, 항공유 등 각종 군수 물자를 보관하기 위해 울산 신정동의 남산, 여천천 주변 대현동에 있는 산 등에 여러 개의 인공 동굴을 만들었다. 

울산광역시 남구 신정동 크로바아파트 입구에서 남산사에 이르는 지점에 약 500m 간격으로 4기의 남산 동굴이 있다. 모두 산을 관통하지 않고 중간에서 돌아 나오는 구조로, 3기는 출구와 입구가 다르고, 나머지 하나는 출구와 입구가 하나이다. 규모는 너비 1.5m~5.5m, 높이는 1.8m~4.2m, 길이는 16m~62m 정도이다. 

2017년 7월 울산광역시 남구청에서 일제 말 자행된 조선인 강제 노역 등 일제의 만행에 대한 역사적 교훈을 되새김과 동시에 무더위를 식히는 휴식 공간과 울산을 찾아오는 관광객 유치를 위해 남산 동굴을 정비하여 태화강 동굴피아로 개장하였다. 제1동굴은 역사체험 공간으로 일제강점기 울산의 생활상, 강제 노역, 수탈의 역사가 담긴 삼산비행장 등을 소개하는 내용을 담았으며, 제2동굴은 어드벤처 공간, 제3동굴은 스케치 아쿠아리움 공간, 제4동굴은 이벤트 공간으로 4계절의 다른 동굴 모습을 보여주고 있다. 

(출처 : 울산 문화관광)","<a href=""https://www.uncmc.or.kr/portal/index.ulsan?menuCd=DOM_000000101001008000"" target=""_blank"" title=""새창 : 울산 남구 도시관리공단 홈페이지로 이동"">https://www.uncmc.or.kr</a>"
태화강생태관,2606222,인문(문화/예술/역사),문화시설,전시관,http://tong.visitkorea.or.kr/cms/resource/30/2608530_image2_1.jpg,울산광역시,129.2369923376,35.5783953902,"태화강의 생명을 만나고 알아가는 태화강생태관은 태화강 곳곳의 자연환경과 태화강 과거의 기억을 담고 있는 공간이다. 태화강생태관은 물길을 따라 흐르는 시간 속에서 강과 사람이 만나 달라지는 모습과 태화강 속에서 흐르는 생태계의 다양성과 풍부함을 보여주는 생태교육장이다. 단순한 여행의 기록이 아니라 곳곳의 자연환경, 거리, 방향, 생활상, 존재하는 동식물의 이야기를 샅샅이 기록한 마르코 폴로의 동방견문록처럼 태화강 생태관은 물길을 따라 흐르는 시간 속에서 강과 사람이 만나 달라지는 모습과 태화강 속에서 흐르는 생태계의 다양성과 풍부함을 보여주는 훌륭한 태화견문록이 될 것이다.","<a href=""http://taehwaeco.ulju.ulsan.kr"" target=""_blank"" title=""새창: 태화강생태관 홈페이지로 이동"">http://taehwaeco.ulju.ulsan.kr</a>"
태화강억새군락지,3079931,자연,자연관광지,자연생태관광지,http://tong.visitkorea.or.kr/cms/resource/08/3079908_image2_1.jpg,울산광역시,129.3619878897,35.546251357,"태화강을 따라 울산 남구, 북구, 중구에 걸쳐 조성된 태화강 억새군락지는 가을이면 온통 은빛 물결이 출렁이는 가을 산책코스로 변모한다. 특히, 북구 명촌교 아래에서 아산로 양정1교 부근의 억새밭은 12만 6,055㎡로 가장 넓은 면적을 자랑한다.
보통 억새군락지들은 산에 올라 볼 수 있는데, 태화강 억새군락지는 자전거도로와 산책로를 따라 평지를 걸으며 즐길 수 있다. 산 위의 억새군락지는 해가 지기 전에 하산을 서둘러야 해서 그 진가를 보기 어렵지만, 이곳에서는 강변의 넓게 펼쳐진 은빛 억새가 황금색으로 물들어 반짝이는 광경을 눈앞에서 감상할 수 있다. 도심에 위치해 있어서 접근성이 좋으며 억새군락지 데크길 곳곳에 조형물과 벤치가 있어 편리하다.",
태화루,2502631,인문(문화/예술/역사),역사관광지,유적지/사적지,http://tong.visitkorea.or.kr/cms/resource/26/3341926_image2_1.jpg,울산광역시,129.3076757594,35.5533995305,"태화루는 진주의 촉석루, 밀양의 영남루와 함께 영남을 대표하는 누각으로 울산의 전통성과 정체성을 고스란히 담은 대표적 유적이다. 643년(신라 선덕여왕 12년), 당나라에서 불법을 구하고 돌아온 자장대사가 울산에 도착하여 태화사를 세울 때 함께 건립했다. 태화강변 황룡연 절벽 위에 위치했으며 임진왜란 때 소실되었다가 ‘역사와 미래가 있는 태화강 만들기’ 프로젝트의 일환으로 복원되어 현재의 모습으로 재탄생했다. 태화강대공원, 십리대숲과 산책로로 이어지며 태화강이 한눈에 내려다보이는 멋진 조망으로 많은 사람들의 사랑을 받고 있다.","<a title=""새창 : 울산 중구 문화관광 사이트로 이동"" href=""http://www.junggu.ulsan.kr/tour/index.do"" target=""_blank"">http://www.junggu.ulsan.kr/tour/index.do</a><br>"
태화루,2671269,음식,음식점,중식,http://tong.visitkorea.or.kr/cms/resource/35/2671335_image2_1.jpg,경기도,127.0762202197,37.0804262102,1963년부터 운영한 곳이다. 경기도 평택시에 있는 중식 전문점이다. 대표메뉴는 고기 짬뽕이다.,
태화루,2912451,음식,음식점,중식,http://tong.visitkorea.or.kr/cms/resource/44/2912444_image2_1.jpg,충청북도,127.8200879419,36.4352276168,"태화루는 충청북도 보은군 마로면 관기리에 위치하고 있다. 
TV조선 시사 교양 프로그램 ‘식객 허영만의 백반기행’, SBS 시사 교양 프로그램 ‘생방송 투데이’에 소개된 바 있다. 깔끔한 분위기를 연출하는 외관과 차분한 느낌의 인테리어로 이루어졌다. 대표 메뉴는 신선한 재료를 넣고 요리한 덕분에 깔끔한 맛이 일품인 짬뽕이다. 짬뽕밥과 짜장도 많은 사람이 찾는 인기 메뉴다.",
태화복합문화공간 만디,3410708,인문(문화/예술/역사),문화시설,전시관,http://tong.visitkorea.or.kr/cms/resource/81/3410681_image2_1.jpg,울산광역시,129.3126997469,35.5737612241,태화복합문화공간 만디는 함월산 자락에 앉아 동해바다를 내려다보는 울산 최고의 위치에 천년고찰 백양사의 역사와 울산의 자부심을 담은 울산 시민의 문화공간이다. 건물명 ‘만디’는 마루의 경상도 방언으로 등성이를 이루는 지붕이나 산 따위의 꼭대기를 의미한다. 경상도 방언을 건물명으로 삼아 중앙 편중과 중앙 지향의 흐름 속에서 지역성이 사라지고 낡고 촌스러운 것으로 치부되는 현상을 극복하고 가장 ‘울산다운’ 자신감으로 새로운 문화판을 만들어 간다는 의미이다. 단순하면서 힘이 있는 어감으로 로컬리티의 자부심을 동시에 담았다.,"<a href=""https://www.instagram.com/ulsan.mandi/"" target=""_blank"" title=""새창 : 태화복합문화공간 만디 인스타그램으로 이동"">https://www.instagram.com/ulsan.mandi/</a>"
태화산(강원),127297,자연,자연관광지,산,http://tong.visitkorea.or.kr/cms/resource/01/1841601_image2_1.jpg,강원특별자치도,128.4794816062,37.1202418309,"해발 1027m의 산으로 강원도 영월군 남면과 하동면, 충청북도 단양군과 영춘면의 경계에 위치한 산이다. 강원도와 충청북도의 경계를 이루는 산으로 산세는 대체로 완만한 편이며, 정상에서 북서쪽으로 뻗은 능선 끝에는 남한강이 Ｕ자형으로 곡류한다. 4억 년의 신비를 간직한 고씨동굴이 있으며 사계절 변화무쌍한 부드러운 능선길은 아름다운 비경을 자랑한다. 주봉인 태화봉을 중심으로, 서쪽에 의상봉, 동쪽에 오봉산이 솟아 있고 산세가 웅장하고 수려하여, 조선시대에는 왕실의 사냥터로 사용되기도 했다.
산의 기슭에는 문짝처럼 생겼다 하여 문바위라 부르는 큰 바위가 있고 그 뒤에는 둥글고 넓은 너럭바위가 있다. 이 바위는 대여섯 사람이 비를 피할 수 있는 방 모양으로 되어 있어서 잘바우라 한다. 태화산은 등산 코스가 잘 정비되어 있어 초보자부터 전문가까지 누구나 쉽게 등산을 즐길 수 있다.
태화산 등산코스는 다음의 세 가지가 있다. 태화산 정상 코스는 영월읍에서 출발하여 의상봉을 거쳐 태화봉 정상으로 이어지는 코스로 총 거리는 약 8km, 소요 시간은 약 3시간이다. 오봉산 코스는 영월읍에서 출발하여 오봉산을 거쳐 태화봉 정상으로 이어지는 코스로 총거리는 약 10km, 소요 시간은 약 4시간이다. 의상봉 코스는 영월읍에서 출발하여 의상봉 정상으로 이어지는 코스로 총거리는 약 5km, 소요 시간은 약 2시간 정도이다.
태화산을 오르다 보면 기암괴석과 폭포 등 다양한 자연경관을 감상할 수 있다.","<a href=""https://www.yw.go.kr/tour/selectTourCntntsWebView.do?pageUnit=9&pageIndex=1&searchCnd=all&key=1086&ctgry=7&tourNo=29"" target=""_blank"" title=""새창 : 홈페이지로 이동"">https://www.yw.go.kr</a>"
태화산(경기),125456,자연,자연관광지,산,,경기도,127.2936171458,37.280751394,"곤지암에서 양지면으로 이어지는 지방도로 옆에 위치한 태화산(641m)은 규모가 작아 어느 방향에서 산행을 시작해도 3시간 이내에 끝낼 수 있는 산이다. 정상 부근의 소나무 숲을 빼고는 대부분 참나무로 덮여 있고, 참나무 숲 아래쪽 능선과 기슭에는 진달래와 철쭉이 많이 자란다. 정상에서 남쪽 방향 산자락에는 고려 충속왕12년에 일연선사가 창건하였다는 백련암이 자리 잡고 있다. 특히 대웅전 아래에는 전설이 깃든 '장군수'가 있어 등산 시 식수로 이용할 수 있다.
산행은 바우산골에서 시작한다. 은곡사를 지나 숲이 울창한 계곡 길을 따라가다 주능선 안부와 613m 봉을 지나 정상에 오른 뒤 백연암을 거쳐 사찰 입구 도로로 하산하는 길과 정상에서 추곡리로 하산하는 길이 있다.","<a href=""https://www.gjcity.go.kr/tour/contents.do?mId=0101060000"" target=""_blank"" title=""새창 : 광주 문화관광 홈페이지로 이동"">http://www.gjcity.go.kr/tour/main.do</a>"
태화산명가,2876941,음식,음식점,한식,http://tong.visitkorea.or.kr/cms/resource/37/2876937_image2_1.jpg,경기도,127.3336589043,37.3454557414,"태화산명가는 경기도 광주시 곤지암 도자공원 근처에 있는 숯불 닭갈비 전문점이다. 단독 건물로 매장 앞에 주차할 수 있다. 넓고 깔끔한 매장 안에는 테이블이 많이 있고 여유롭게 배치되어 있다. 이곳은 농림축산식품부 제공 안심식당으로 숯불닭갈비와 비빔막국수 전문점이다. HACCP 인증 냉장 닭을 사용하여 초벌 되어 나오는 닭갈비는 소금구이와 양념구이가 있고 직원이 직접 구워줘서 편하게 식사할 수 있다. 비빔막국수는 조미료가 첨가되지 않은 이곳만의 비법 양념과 함께 나온다. 이 밖에 냉모밀, 메밀전병, 사골메밀만둣국이 있다. 정갈하고 깔끔한 기본 반찬이 제공되고 추가 반찬은 매장 한쪽에 준비된 셀프 바를 이용하면 된다. 닭갈비를 추가하거나 포장을 원한다면 초벌 시간을 감안해서 미리 주문해야 한다.",
태화서원,1955838,인문(문화/예술/역사),역사관광지,유적지/사적지,http://tong.visitkorea.or.kr/cms/resource/89/3049489_image2_1.jpg,울산광역시,129.3379591783,35.5551749011,"일본왜성 인근의 태화서원은 2019년 4월에 현재의 위치로 이전한 월성 이씨 종중의 서원이다. 태화서원은 이전 전 중구 문화의 거리에 위치한 울산도호부 도총소 건물을 태화서원으로 사용하였었다. 도총소는 무관들이 회의를 하던 곳이다. 울산도호부 도총소는 정조 21년(1797년)에 세워졌으며 구한말과 일제강점기를 거치면서 울산 행정체계가 바뀔 때마다 상부 면사무소, 울산 면사무소로 바뀌었다. 
당초 1951년 태화서원 창립 당시에는 배향 선조가 시조 휘 이알평, 중시조 휘 이거명, 열헌공 휘 이핵, 동암공 휘 이진, 익재공 휘 이제현, 백사공 휘 이항복 6현(賢)이었으나 감실이 좁고, 울산의 또다른 경주이씨 사당인 운강사(雲岡祀)에 모신 열헌공 휘 이핵, 동암공 휘 이진, 익재공 휘 이제현 3현(賢)과 중첩되어 오랜기간 공론을 거쳐 2016년도에 3현(賢)은 철향하고 현재에는 시조이신 은열왕 휘 이알평, 중시조 휘 이거명, 백사공 휘 이항복 3현(賢)을 배향하고 제향하고 있다. 옛 태화서원의 도총소 건물은 공연과 전시, 문화강좌가 열리는 복합문화공간 [태화어울마당]으로 사용되고 있다.","<a href=""http://www.junggu.ulsan.kr/tour/index.do"" target=""_blank"" title=""새창: 울산중구 문화관광"">http://www.junggu.ulsan.kr/tour/index.do</a>"
태화식당,1305113,음식,음식점,한식,,충청남도,127.0198590873,36.5564633406,"공주시 사곡면 운암리에 위치한 태화식당은 산채정식, 더덕정식, 자연산 능이버섯전골 전문으로 하는 한식당이다. 더덕정식은 씹히는 질감이 뛰어나고 특유의 향이 입맛을 돋구어 이 식당의 가장 인기있는 메뉴 중 하나이다. 산채정식과 산채비빔밥은 각종 산나물과 각종 버섯 때문에 고기의 질감을 그대로 느낄 수 있으며, 깔끔한 반찬이 20여가지도 함께 나와 푸짐하다. 불교조개종 제6사인 마곡사내에 위치한다.<br>",
태화연오토캠핑장,2730148,레포츠,육상 레포츠,"야영장,오토캠핑장",http://tong.visitkorea.or.kr/cms/resource/33/2730533_image2_1.jpg,울산광역시,129.2855552089,35.562595303,"태화연 캠핑장은 울산광역시 중구 태화 저수지에 위치해 있다. 태화강 십리대 밭과 먹거리 단지, 척과천 야외 물놀이장이 인접해 있어 관광시설 견학과 문화시설 체험을 연계하여 캠핑을 즐길 수 있다. 울산 혁신도시와 인접해 있어 주위 편의시설 이용이 가능하고 외부 음식이 캠핑장 안까지 배달된다는 장점이 있다. 캠핑장은 40여 개의 파쇄석 사이트로 되어 있으며 사이트 간 간격이 넓어 여유롭게 텐트를 설치할 수 있다. 각 사이트마다 전기 분전함이 설치되어 있어 전기 사용이 편리하며, 화장실, 개수대, 샤워장도 잘 관리돼 있다. 캠핑장 입구에는 넓은 잔디광장이 있어, 어린이들이 마음껏 뛰어놀 수 있다.","<a href=""https://camping.junggu.ulsan.kr/camping/pageCont.do?menuNo=1030100"" target=""_blank"" title=""새창 : 태화연오토캠핑장 사이트로 이동"">https://camping.junggu.ulsan.kr/</a>"
태화원,135193,음식,음식점,중식,,인천광역시,126.6185731027,37.4740752591,"일제강점기부터 3대째 명맥을 이어오고 있는 중화요리 전문점이다. 인천 차이나타운 중국집 초기 멤버 중 하나로, 여전히 옛 맛을 고수하고 있는 집으로 유명하다. 제철 식재료를 함께 볶아 만드는 인천향토짜장은 인천 토박이들이 가장 좋아하는 요리 중 하나다.","<a href=""https://www.icjg.go.kr/tour/ctsh0101a/view?seq=92"" target=""_blank"" title=""새창 : 홈페이지로 이동"">https://www.icjg.go.kr</a>"
태화육개장,2807806,음식,음식점,한식,,부산광역시,129.0570057697,35.1592557554,"태화육개장은 50년  전통을  간직한  맑은  얼큰하지 않고 담백한 육개장을 맛볼 수 있는 곳이며, 육개장과 함께 수육을 전문으로 하고 있다.",
태화장,1807586,음식,음식점,중식,http://tong.visitkorea.or.kr/cms/resource/25/1914225_image2_1.jpg,대전광역시,127.4293534026,36.333834977,"1954년에 개업하여 60년 넘는 전통을 가진 중식당 태화장은 닭고기 육수에 해물을 넣고 끓인 삼선짬뽕, 각종 해물과 야채를 넣고 볶은 삼선볶음밥, 춘장의 맛을 살린 옛날식 자장면 등을 메뉴로 하고 있다. 송강호 주연의 영화 <변호인>에도 등장한 곳이다.",
태흥갈비,1602119,음식,음식점,한식,,전북특별자치도,126.7088522479,35.4343693734,"태흥갈비의 대표메뉴인 양념 돼지갈비는 양념이 깊게 잘 배어 있으며 달달한 간장소스의 맛이 별미이다. 양념돼지갈비와 생갈비구이는 숯불로 구워 먹는 방식이라 숯불의 향과 어우러져 더욱 풍미 있는 고기의 맛을 느낄 수 있다. 그리고 태흥갈비집이 자랑하는 특별한 메뉴는 육사시미와 복분자즙을 넣어 반죽한 냉면이다. 복분자냉면은 고창군 향토음식발굴에서 당당히 대상을 수상한 음식이다. 살얼음이 들어간 육수에 복분자면, 오이와 쌈무, 계란 반 개가 들어가 있다. 기본 면발보다 쫄깃한 맛을 느낄 수 있다.",
택슐랭,2438928,인문(문화/예술/역사),축제,일반축제,http://tong.visitkorea.or.kr/cms/resource/67/3116067_image2_1.jpg,부산광역시,129.040861156,35.1151853926,"택슐랭'은 '택시 + 미슐랭'의 합성어로 10년 이상 경력의 배테랑 택시 기사님들이 추천한 현지 찐 맛집과 함께하는 축제이다. 올해는 한국전쟁 이후 다양한 지역에서 몰려온 피란민들이 정착해 대한민국 팔도의 다양한 미식 콘텐츠가 자리잡고 있는 부산 원도심만의 미식세계를 방문할 수 있다. 제9회 부산원도심활성화축제 택슐랭은 부산의 원도심 권역 중구, 서구, 동구, 영도구 일대에서 만나볼 수 있다.","<a href=""http://www.bfo.or.kr/main/index.asp"" target=""_blank"" title=""새창 : 부산원도심활성화축제 택슐랭 홈페이지 이동"">www.bfo.or.kr</a>"
택승정,2795938,인문(문화/예술/역사),역사관광지,유적지/사적지,http://tong.visitkorea.or.kr/cms/resource/72/3340372_image2_1.jpg,경기도,127.6347184285,37.5143888977,"이 정자는 남원양씨들이 궁술을 연마하던 도장으로 부근의 봉황정에서 정자 앞 광장 끝에 과녁을 세우고 활을 쏘아 무술을 익힘으로써 문무겸전한 인재를 길러내어 이 고장을 빛냈다고 한다. 『택승』의 뜻은 못가에서 활을 익히는 것은 선왕의 법도를 ＂택＂이라 하고, 예절을 지켜 정자에 오르고 내리는 군자의 도리를 ＂승＂이라 한다는 데서 비롯됐다. 건물은 팔작지붕에 한식 골기를 얹었으며 자연 초석 위에 원주를 세운 굴도리집이다.",
택이네조개전골,2674665,음식,음식점,한식,http://tong.visitkorea.or.kr/cms/resource/16/2674616_image2_1.jpg,경기도,127.0965231657,37.0081182547,"인천 연안부두에서 직접 공수해오는 신선한 조개, 매장에서 직접 제조하는 시원한 육수, 남녀노소 좋아하는 친근한 조개전골과 조개칼국수를 맛볼 수 있다.",
택이네조개전골 포승공단,2680001,음식,음식점,한식,http://tong.visitkorea.or.kr/cms/resource/04/2680004_image2_1.jpg,경기도,126.8447798297,36.9878105864,쾌적한 외식 공간과 신선한 조개를 선별하여 조개의 시원한 맛을 살려 국물이 일품인 조개 전골과 조개 칼국수가 대표메뉴이다.,
택지골수제생갈비,2874093,음식,음식점,한식,http://tong.visitkorea.or.kr/cms/resource/85/2874085_image2_1.jpg,강원특별자치도,128.8761735453,37.7706827534,"택지골수제생갈비는 강릉시 교동에 있는 고기 전문 식당이다. 한돈을 사용해서 만드는 돼지갈비와 지리산 흑돼지 오겹살, 수제 소갈비가 주 메뉴이다. 고기를 굽는 불은 화력이 좋은 비장탄 숯을 사용하고 있어 기름을 쪽 빼가며 맛있게 구워진다. 해산물 식당이 많은 강릉에서 빠지지 않는 고기 식당이다. 고기를 다 먹은 후에는 시원한 물냉면과 비빔냉면을 즐길 수 있다. 항상 대기가 있는 편이어서 방문할 때는 브레이크 타임이 없는 식당이므로 피크타임을 피하는 것이 좋다. 주차는 매장의 전용 주차장이 있지만 빈자리가 없으면 주변에 공영 주차장이 있어 편하게 이용할 수 있다.",
택지뚱보냉면,2687675,음식,음식점,한식,http://tong.visitkorea.or.kr/cms/resource/60/2684960_image2_1.jpg,강원특별자치도,128.8729768486,37.7629808048,다양한 면요리를 맛볼 수 있는 곳이다. 대표메뉴는 회냉면이다. 강원도 강릉시에 있는 한식전문점이다.,
택지물회,2874112,음식,음식점,한식,http://tong.visitkorea.or.kr/cms/resource/99/2874099_image2_1.jpg,강원특별자치도,128.8768124217,37.7692162684,"택지물회 강릉시 교동에 있는 물회 전문집이다. 강릉 현지인들이 추천하는 물회 맛집이기도 하다. 매일 신선한 해산물과 비법 육수로 물회를 만들어 현지인이나 여행객이나 모두 좋아하는 맛이다. 실내는 좌식과 입식이 어우러져 있으니 편한 곳을 선택하면 된다. 가장 인기 메뉴는 명품대접물회이다. 물회만 시켜도 미역국, 소면, 튀김, 생선구이, 밑반찬이 한 상 가득 차려진다. 주인공 물회는 신선한 활어회와 전복, 문어가 가득 큰 대접에 담겨 나온다. 보기에도 신선함이 느껴진다. 이곳에 별도로 나온 얼음 동동 육수를 넣어 먹으면 된다. 새콤달콤하면서도 오독오독, 쫀득쫀득한 식감이 특징이다. 주차는 매장 정문과 후문에 있는 전용 주차장을 이용하면 된다.","<a href=""https://gn1991.modoo.at/""target=""_blank"" title=""새창 : POI 사이트로 이동"">https://gn1991.modoo.at/</a>"
탠디,2911413,쇼핑,쇼핑,사후면세점,http://tong.visitkorea.or.kr/cms/resource/14/2883514_image2_1.jpg,충청남도,126.9019791164,36.307259306,-,
탠디,2923226,쇼핑,쇼핑,사후면세점,http://tong.visitkorea.or.kr/cms/resource/25/2880725_image2_1.jpg,경기도,126.7896749719,37.6432308377,-,
탠디,3306313,쇼핑,쇼핑,사후면세점,http://tong.visitkorea.or.kr/cms/resource/95/3314195_image2_1.jpeg,서울특별시,126.8884169673,37.5089148857,-,
탠디,3306442,쇼핑,쇼핑,사후면세점,http://tong.visitkorea.or.kr/cms/resource/18/3314418_image2_1.jpg,서울특별시,126.9358252045,37.5561435782,-,
탠디,3307155,쇼핑,쇼핑,사후면세점,http://tong.visitkorea.or.kr/cms/resource/10/3313910_image2_1.jpeg,서울특별시,127.0305315802,37.6146468109,-,
탠디 2001아울렛 중계,3306061,쇼핑,쇼핑,사후면세점,http://tong.visitkorea.or.kr/cms/resource/08/3313808_image2_1.jpg,서울특별시,127.0679274101,37.6413416033,-,
탠디 nc신구로,3305457,쇼핑,쇼핑,사후면세점,http://tong.visitkorea.or.kr/cms/resource/92/3312892_image2_1.jpg,서울특별시,126.8827871414,37.5012129024,-,
탠디 뉴코아 평촌,3306284,쇼핑,쇼핑,사후면세점,http://tong.visitkorea.or.kr/cms/resource/73/3314173_image2_1.jpg,경기도,126.9516812325,37.3893465617,-,
탠디 롯데광명,2925878,쇼핑,쇼핑,사후면세점,http://tong.visitkorea.or.kr/cms/resource/67/2881867_image2_1.jpg,경기도,126.8839475563,37.4232469761,-,
