title,contentid,cat1,cat2,cat3,firstimage,region,mapx,mapy,overview,homepage
샤브왕,2682759,음식,음식점,한식,http://tong.visitkorea.or.kr/cms/resource/28/2682628_image2_1.jpg,서울특별시,126.9107622048,37.5070988288,매운 음식을 좋아하는 한국인들 사이에서 유행하는 마라 음식을 판매하는 곳이다. 서울특별시 영등포구에 있는 한식전문점이다. 대표메뉴는 마라탕이다.,
샤브홀리 일산본점,2844365,음식,음식점,일식,http://tong.visitkorea.or.kr/cms/resource/60/2844360_image2_1.JPG,경기도,126.7903520111,37.6672252785,"샤브홀리는 일산풍동 애니골 먹자골목에 있다. 직접 우려낸 육수와 샤부샤부에 들어가는 야채가 무한으로 제공된다. 30여 가지가 제공되는 풍성한 샐러드 바와 월남쌈은 물론 원두커피, 팥빙수와 아이스크림 후식까지 알차다. 처음 이용료만 지불하면 추가 금액 없이 와인과 생맥주가 무한 제공이라 모임 장소로도 인기가 많다. 주변에 가볼 만한 곳은 김대중 대통령 사저, 정발산 공원, 일산밤가시초가 전시관, 고양아람누리 아람미술관 등이 있다.","<a href=""https://blog.naver.com/okkumdo1""target=""_blank"" title=""새창 : 샤브홀리 일산본점 사이트로 이동"">https://blog.naver.com/okkumdo1</a>"
샤블리,2867731,음식,음식점,이색음식점,http://tong.visitkorea.or.kr/cms/resource/17/2867717_image2_1.jpg,서울특별시,127.0222128537,37.518141209,"샤블리는 서울지하철 3호선, 신분당선 신사역 8번 출구 부근에 있다. 매장이 있는 상가건물에 자체 주차장(발레파킹 서비스 가능)이 있어 방문 시 자동차로 이용하기 편리하다. 이곳은 방송사 맛집 TV 프로그램에 샤부샤부 맛집으로 소개되었다. 매장 내부는 넓은 홀에 인원별 다양한 테이블 구성과 개별 룸까지 있어 단체 행사나 가족 모임에도 적당하다. 대표 메뉴는 샤블리 정식, 차돌박이 구이 & 샤브 정식, 한우소고기 샤브 정식, 대패삼겹살 with 샤부샤부가 있다. 이외 메뉴로 훈제오리구이& 샤브정식, 샹그리아 Red가 인기가 많다. 주변에 가로수길이 있어 식사 전후로 둘러보기 좋다.","<a href=""http://instagram.com/shabuly_official""target=""_blank"" title=""새창 : 샤블리 사이트로 이동"">http://instagram.com/shabuly_official</a>"
샤샤의놀이터,2756717,음식,음식점,카페/전통찻집,http://tong.visitkorea.or.kr/cms/resource/19/2757019_image2_1.jpg,경상남도,128.6672122738,35.2504661567,"‘오늘은 아기랑 뭐 하면서 놀까?’ 엄마, 아빠의 고민을 해결해 줄 키즈카페 샤샤의놀이터는 볼풀장, 낚시 놀이, 소꿉놀이, 촉감 놀이, 캠핑 놀이, 편백 큐브 놀이, 트램펄린, 원목 놀이교구, 그리고 바운서, 에듀 테이블 등 즐길 거리가 다양하다. 36개월 이하 유아도 이용 가능하며 초등학생 1학년 남아, 초등학생 2학년 여아까지 연령 제한을 두고 있다. 수저 사용 가능한 식사류 반입이 가능해서 간단한 도시락이나 이유식을 아이에게 먹일 수 있다. 직원들이 수시로 정리 정돈과 청결 및 소독을 해서 아이들이 안전하고 깨끗한 곳에서 즐거운 시간을 보낼 수 있다. 입장료의 경우 어린이는 7,000원, 어른은 3,000원으로 즐길 수 있다.",
샤샤하우스 (SHA SHA House),2610944,숙박,숙박시설,게스트하우스,,서울특별시,127.0259962314,37.5044067609,"#본 업소는 외국인관광 도시민박업으로 외국인만 이용이 가능하며 내국인은 이용할 수 없습니다.


신논현역  2분거리에 있는 게스트하우스 이다",
샤오바오우육면 종로본점,3094138,음식,음식점,한식,http://tong.visitkorea.or.kr/cms/resource/36/3094136_image2_1.jpg,서울특별시,126.9866396503,37.5691374236,"종각역 인근의 우육면 전문점이다. 중국 란주 지방 50년 경력의 비법 육수를 직접 전수받은 란주 정통방식의 우육면이다. 
우육면은 쫄깃한 식감의 수타면, 12시간 이상 고온에서 고은 사골 육수, 최상급의 소고기 장조림, 란주 정통 고추기름, 20가지 한약재가 들어간다. 직접 육수를 끓이고 소고기를 삶아 담백한 맛과 얼큰한 맛을 느낄 수 있다. 모든 면은 수타로 직접 즉석에서 만들어서 요리하며 우육면은 8가지 종류의 수타면 중에 선택하여서 주문하면 된다. 
우육면 외에도 중국 사천지방의 마라양념으로 만든 마라수육, 마라오이 등 마라요리 등 다양한 중식 요리가 있다. 또한, 가지만두, 가지탕수, 꿔바로우, 마파두무, 깐풍닭날개 등의 메뉴가 있다.
종각역 4번 출구에서 350m 거리에 있으며 주변에는 청계천, 탑골공원 등이 있으며 여러 맛집이 있다.",
샤오츠,2876515,음식,음식점,중식,http://tong.visitkorea.or.kr/cms/resource/11/2876511_image2_1.JPG,제주특별자치도,126.9295137967,33.4610022701,"샤오츠는 성산일출봉으로 가는 섭지코지로에 있다. 샤오츠는 가벼운 식사나 간식을 의미하는 중국어로 플레이스 캠프 제주에 입점하여 광둥식 우육탕면 맛집으로 소문이 났고, 현재 위치로 이전하였다. 매장에서 수제로 조리하며, 주요 메뉴인 우육면 이외에 마라곱창면, 페이창펀, 데기야끼 소스 가지 딤섬 등 이곳에서만 맛볼 수 있는 메뉴가 있으며 면은 생면과 쌀국수 중 선택할 수 있다. 주면 여행지로 광치기해변, 성산일출봉, 섭지코지 등이 있다.",
샤우칭,2873353,음식,음식점,중식,http://tong.visitkorea.or.kr/cms/resource/43/2873343_image2_1.jpg,경기도,126.9721789185,37.4053950661,"샤우칭은 경기도 안양시 동안구 관양동에 있는 중식당이다. 매장은 좌석 사이에 칸막이가 있어 분리된 공간에서 식사를 할 수 있다. 매장 안쪽에는 넓은 테이블들이 있어서 단체 회식 자리로도 이용된다. 열린 주방으로 운영하고 있다. 대표 메뉴인 중화비빔밥은 갖가지 채소와 다양한 해산물들이 푸짐하게 들어있어 양도 많고 맛이 있다. 짜장면은 면발이 쫄깃하고 면과 소스가 따로 제공되며 소스에서 불향을 맛볼 수 있다. 짬뽕은 해산물과 야채가 푸짐하고 국물이 얼큰하고 시원하다. 찹쌀 탕수육이 인기인데 육질이 부드러운 고기에 쫀득한 찹쌀옷을 입혀 바싹하게 튀겨내어 식감이 좋고 새콤달콤한 소스까지 맛이 좋다. 점심에는 가성비 좋은 코스요리를 먹을 수 있는 점심정식이 있다. 샤우칭은 식전에 게살스프가 전채요리로 나와 입맛을 돋워 준다. 후식으로 나오는 샤베트도 식사를 마무리하기에 좋다. 동편마을 카페거리에서 차 한잔과 산책하기 좋고, 2km 거리에 평촌중앙공원, 4km 거리에 백운호수가 있다.",
