title,contentid,cat1,cat2,cat3,firstimage,region,mapx,mapy,overview,homepage
도동등대(행남등대),129175,자연,자연관광지,등대,,경상북도,130.9189559357,37.4869233254,"1954년 울릉도 동쪽 행남마을에 설치된 등대이다. 울릉군이 인근 해역과 독도어장에 조업 선박이 증가하고, 우리나라 동해안 연안에서 일본 스쿠바 해역을 운항하는 선박의 수가 증가하여 안전을 위한 연안 표지 시설로 설치하였다. 1954년 12월 19일에 무인등대로 운영을 시작하였으며, 1979년 유인등대로 전환하고, 2007년 사무실과 숙소, 홍보관, 야외 전망대 등의 새로운 건물들이 준공되었다. 
청명한 날에는 등탑에서 정동 쪽으로 독도를 볼 수 있으며, 북쪽으로는 저동항의 아름다운 모습과 촛대바위를 한눈에 바라다 볼 수 있고, 울릉도의 상징인 성인봉의 정상을 볼 수도 있다. 무엇보다 수평선 너머 떠오르는 일출이 아름다워 관광객들의 발길이 끊이지 않는 곳이다.","<a href=""http://www.ulleung.go.kr/tour/"" target=""_blank"" title=""새창: 울릉군청 문화관광 홈페이지로 이동"">http://www.ulleung.go.kr/tour/</a>"
도동산방,820724,음식,음식점,한식,,울산광역시,129.0964705668,35.6040315391,"넓은 대지 위에 자리 잡은 도동산방은 전통한옥 5채로 이루어져 있다. 격조 높은 한정식을 즐길 수 있으며 다실(차실)이 별도로 마련되어 있어 식사 후에 차를 즐길 수도 있다. 가격대, 이용 가능한 요일에 따라 다양한 코스가 준비되어 있다. 넓고 아름다운 공간이라 돌잔치, 칠순, 팔순 연회 행사도 예약 가능하여 많은 사람들이 방문하고 있다.","<a href=""http://dodongsanbang.com"" target=""_blank"" title=""새창 : 도동산방 홈페이지로 이동"">http://dodongsanbang.com</a>"
도동서원 [유네스코 세계유산],129679,인문(문화/예술/역사),역사관광지,유적지/사적지,http://tong.visitkorea.or.kr/cms/resource/35/2620835_image2_1.jpg,대구광역시,128.3719203522,35.7012294283,"한훤당 김굉필 선생을 배향한 서원이며, ‘도동(道東)’의 의미는 ‘성리학의 도가 동쪽으로 왔다’라는 의미라고 한다. 1865년 흥선대원군의 서원 철폐령에도 훼철되지 않은 47개 서원 가운데 하나로 우리나라 5대 서원으로 꼽힌다. 2019년에 ‘한국의 서원’ 유네스코 세계문화유산으로 등재되었다. 전국 최초로 담장이 보물로 지정된 곳으로 400년 된 은행나무와 서원 옆을 흐르는 낙동강의 풍경은 옛 선비정신과 함께 한 폭의 동양화를 연상하게 한다.","대구 문화관광 <a href=""https://www.dalseong.daegu.kr/culture/index.do?menu_id=00001956&menu_link=front/tour/tourMapsViewFromMain.do&tourId=7"" target=""_blank"" title=""새창 : 대구 문화관광으로 이동"">https://www.dalseong.daegu.kr/culture</a><br>문화재청 <a href=""http://www.heritage.go.kr/heri/cul/culSelectDetail.do?pageNo=1_1_1_1&ccbaCpno=1332204880000"" target=""_blank"" title=""새창 : 문화재청으로 이동"">http://www.heritage.go.kr</a>"
도동서원(고창),1956969,인문(문화/예술/역사),역사관광지,유적지/사적지,http://tong.visitkorea.or.kr/cms/resource/30/3341730_image2_1.jpg,전북특별자치도,126.7419148771,35.4779705412,"도동서원은 전북특별자치도 고창군 신림면에 위치해 있다. 도동서원은 도동사라고도 불리며, 고창군의 향토유산으로 지정되어 있다. 도동서원은 1928년에 지역의 유림들이 나라에 충성을 하고 절의를 도모하고자 방호정사 안쪽에 지은 사당이다. 방호정사는 한말의 수남 고석진(1856~1924)이 후학을 가르치던 곳이다. 
도동서원(도동사)에는 조선의 독립을 위해 순절한 의병 대장 면암 최익현(1833~1906)과 수남 고석진(1856~1924), 송천 고예진, 송제 고용진 등이 위패가 안치되어 있다. 이들은 최익현을 따라 항일 의병에 참여했을 뿐만 아니라, 1919년에 한국의 독립 청원서를 파리 강화 회의에 보냈으며, 이로 말미암아 일제의 탄압을 받은 분들이다.",
도동서원(김천),1958202,인문(문화/예술/역사),역사관광지,유적지/사적지,http://tong.visitkorea.or.kr/cms/resource/35/2620835_image2_1.jpg,경상북도,128.0332853034,36.0448509866,"도동서원은 충간공 이숭원을 제향하기 위해 조선 인조 26년(1648) 건립됐으며 이후 이숙기, 이호민, 이숙함, 이후백을 배향한 연안이씨의 문중서원이다.
이후 고종 8년(1871) 서원철폐령으로 훼철되었는데 1918년 도동서원 옛 강당터에 명례당을 재건하여 현재까지 이르고 있다. 현재는 강당인 명례당 한 채와 외문만 남아있다.
충간공 이숭원은 병조판서, 이숙기는 호조판서, 이호민은 이조좌랑을 거쳐 예조판서와 좌찬성, 이숙함은 이조참판, 이후백은 양관 대제학과 호조판서를 지냈다.","<a href=""http://gimcheon.grandculture.net/gimcheon/search?keyword=%EB%8F%84%EB%8F%99%EC%84%9C%EC%9B%90"" target=""_blank"" title=""새창 : 홈페이지로 이동"">http://gimcheon.grandculture.net</a>"
도동약수공원,126116,자연,자연관광지,약수터,http://tong.visitkorea.or.kr/cms/resource/49/169649_image2_1.jpg,경상북도,130.9004271646,37.4824151202,"도동약수공원은 경상북도 울릉군의 관문인 도동항에서 300m 떨어진 산기슭에 있는 곳으로, 주민들에게는 편안한 휴식처를 제공하고 섬을 찾은 관광객에게는 다양한 관광지를 제공할 목적으로 설립되었다. 옛날에 왜인과 싸우던 장군이 전장에서 죽은 후에 장군의 갑옷을 도동 약수터 근처에 묻었다고 한다. 그 후 땅에 묻힌 장군의 갑옷이 삭아서 흘러내린 쇳물이 도동약수가 되었다는 전설이 전해지고 있다. 
도동약수공원에는 도동 약수터, 향토사료관, 독도박물관, 독도 전망대 케이블카, 안용복 추모비, 인공암벽장, 김하우 옹의 송덕비, 전망광장, 체육시설 등이 있고, 관광 편의 시설로 휴게실, 매점, 대합실, 플랫폼, 선물코너 등이 갖추어져 있다.",
도동항,128768,자연,자연관광지,항구/포구,http://tong.visitkorea.or.kr/cms/resource/74/2547574_image2_1.jpg,경상북도,130.9079098592,37.4817542417,"포항에서 북동쪽 188km 해상에 위치하는 울릉도의 문호항인 2종항이다. 항내수역 20,000㎡ 이며, 항만시설로는 선적 시설인 안벽(岸壁) 80m, 물량장 133m 외에 외곽시설로  방파제 184.6m, 방사제(防砂堤) 79m가 있다. 안벽은 정부의 울릉도 관광개발계획에 따라 1973년 착공하여 1977년 완공되었는데, 최대 선적 선박은 1,000t급 1척이다. 한편 연간 하역능력은 2만 t으로, 취급 화물은 주민의 생활필수품과 울릉도산 오징어가 대부분이다. 만남의 설레임과 이별의 아쉬움이 파도처럼 밀려드는 곳으로 왼쪽에는 개척민들의  망향가를 대신 불러주던 망향봉, 오른쪽에는 2,500년의 울릉도 지킴이 향나무가 서있는 행남등대가 오가는 이를 맞는다.<br>","<a href=""http://www.ulleung.go.kr/tour/"" target=""_blank"" title=""울릉 문화관광 사이트로 이동"">http://www.ulleung.go.kr/tour</a>"
도동해변,2929834,자연,자연관광지,해수욕장,http://tong.visitkorea.or.kr/cms/resource/12/2929812_image2_1.jpg,경상남도,128.2351160242,34.642554251,"통영시 욕지면 서산리 도동마을에 있는 도동 해변은 규모는 작지만 까만 몽돌이 깔려 있어 독특한 매력이 있는 해변이다. 넓은 몽돌밭과 해안 절벽을 비롯해 소나무 숲이 어우러져 수영과 휴식을 동시에 즐길 수 있다. 물 속이 훤히 보일 정도로 맑고 깨끗한 수질과 바다 위에 떠 있는 형형색색의 기암괴석이 절경을 이룬다. 이 때문에 스노클링 하기 좋은 곳으로 이름을 알리게 되어 매년 여름이면 관광객들이 즐겨 찾는다. 그늘막과 튜브, 갓 잡은 해산물을 판매하며, 물이 깨끗해 바다에서 직접 소라 등을 채집할 수도 있다. 주차장은 넓은 편이며, 바닷가 바로 근처에는 따로 샤워장과 화장실이 없어 걸어서 5분 거리에 있는 마을 공용 화장실을 이용해야 한다.
※ 반려동물 동반 불가",
도두반점 제주사수점,2850048,음식,음식점,중식,http://tong.visitkorea.or.kr/cms/resource/44/2850044_image2_1.JPG,제주특별자치도,126.4791906626,33.5095952211,"도두반점은 제주시 용담해안도로 사수항에 있다. 제주 모자반(몸)을 넣은 흑돼지몸짬뽕이 대표메뉴이며 사골육수의 구수함과 몸의 식감이 어우러진 맛이다. 두툼한 등심에 쫀득한 식감으로 튀김옷을 입힌 흑돼지탕수육과 고기가 많이 들어간 도두볶음밥도 인기이다. 근처 여행지로 무지개해안도로와 도두봉이 있으며, 공항 근처에 있어 도착과 출발 여행자들이 많이 찾는다.",
도두봉,2738665,자연,자연관광지,산,http://tong.visitkorea.or.kr/cms/resource/13/2740613_image2_1.jpg,제주특별자치도,126.4672362102,33.5067925638,"도두봉은 제주공항 북쪽 도두동 해안가에 있는 오름으로 경사가 완만하며 오르기 쉽다. 남사면은 풀밭을 이루면서 듬성듬성 해송이 있고, 북사면은 삼나무와 낙엽수 등이 어우러져 숲을 이룬다. 봉우리는 2개이며, 동쪽 봉우리가 높다. 주변에는 국수나무, 팥배나무, 덜꿩나무, 예덕나무 외에 여러 종류의 새우란, 바람꽃 등의 자생식물이 자라고 있다. 오르는 길과 정상에서 제주 국제공항에 비행기가 뜨고 내리는 것도 볼 수 있는데 바다 전망과 어우러져 장관을 이룬다. 오름이라고 하기에는 규모가 작지만, 멋진 풍경을 보여준다.","<a href=""https://www.visitjeju.net/u/EuX"" target=""_blank"" title=""새창 : 도두봉 사이트로 이동"">www.visitjeju.net</a>"
도두봉전망대,3056754,인문(문화/예술/역사),건축/조형물,유명건물,http://tong.visitkorea.or.kr/cms/resource/11/3056711_image2_1.jpg,제주특별자치도,126.4687471529,33.5084201852,"제주공항 바로 옆 해안가에 있는 도두봉오름은 높이 61.8m에 경사가 완만하여 약 10분이면 정상에 오를 수 있다. 오름 정상에 있는 도두봉전망대는 도두봉 전망대에서는 제주공항의 비행기 이착륙 광경을 조망하며 사진을 촬영할 수 있고, 제주 앞바다의 일몰과 한라산을 바라볼 수 있다. 도두봉 전망대는 데크로 만든 2층의 낮은 전망대로 크기는 작지만, 탁 트인 시야가 바다 전망과 어우러져 장관을 이룬다. 주변에는 도두봉 체력단련장, 도두항 등대, 도두항 유람선, 도두동 무지개 해안도로 등 많은 관광지가 있어 같이 둘러보기 좋다.","<a href=""https://www.visitjeju.net/kr/detail/view?contentsid=CONT_000000000500143"" target=""_blank"" title=""새창 : 홈페이지로 이동"">https://www.visitjeju.net/kr/</a>"
도두항,2794659,자연,자연관광지,항구/포구,http://tong.visitkorea.or.kr/cms/resource/52/2800152_image2_1.jpg,제주특별자치도,126.4650003076,33.5061675974,"도두항은 용두암 해안도로와 이호테우 사이에 있는 방파제로, 관탈도와 추자도행 낚시 배들이 출항하는 곳으로 유명하다. 제주 국제공항에서 차로 15분 거리에 있고, 발판도 비교적 좋아 낚시꾼들이 즐겨 찾는다. 제주 시내에서 가깝고, 신선한 해산물이 있는 유명 맛집, 낚시점들이 있어 관광객과 현지인 모두 편리하게 이용할 수 있다. 또한, 유람선과 요트 등 해양 레저 시설도 있어 많은 관광객이 찾는 곳이다.","<a href=""http://www.visitjeju.net/"" target=""_blank"" title=""새창 : 도두항  사이트로 이동"">http://www.visitjeju.net/</a>"
도두해녀의집,2758939,음식,음식점,한식,http://tong.visitkorea.or.kr/cms/resource/27/2758927_image2_1.jpg,제주특별자치도,126.4666334976,33.5062203952,"도두해녀의집은 제주 국제공항에서 10분 거리에 있어 제주를 오갈 때 들르기 좋다. 특 물회, 전복물회, 한치물회 등 다양한 물회 메뉴가 있으며 계절별로 신선한 재료가 준비되니 방문하기 전에 주문 가능한 메뉴를 확인 후 방문하면 좋다. 성게비빔밥의 경우 하루 한정 수량이 있어 점심시간 전에도 매진된다고 하니 너무 늦지 않게 방문하는 게 좋다. 도두해녀의집은 물회 맛집으로 알려졌지만 전복죽 맛집으로도 유명하다. 전복 내장 특유의 고소한 맛과 진한 맛이 있어 이곳을 방문한 고객들은 인생 전복죽이라고 평가하기도 한다.",
도두후레쉬,2870596,음식,음식점,서양식,http://tong.visitkorea.or.kr/cms/resource/95/2870595_image2_1.jpg,제주특별자치도,126.4658975168,33.503298485,"도두후레쉬는 제주공항 인근, 이호테우 해수욕장, 무지개 해안 도로에 인접한 수제 햄버거 테이크 아웃 전문점이다. 신선하고 두툼한 패티를 위해 냉동이나 해동 과정을 거치지 않고 매일 새롭게 만들어 제공한다. 소스와 버거 시즈닝을 직접 배합하여 만들고 햄버거 경쾌하여 사진을 남기기에도 좋다. 매장에 테이블은 없으며 테이크아웃 전문점이다. 메뉴는 베이컨에그버거, 빅더블스파이시버거, 싱글버거, 불고기버거등이 있고 다양한 음료도 있다. 주변 여행지로 이호테우해면, 알작지해변, 도두봉, 무지개해안도로 등이 있다.","<a href=""http://www.instagram.com/dodufresh""target=""_blank"" title=""새창 : 도두후레쉬 사이트로 이동"">http://www.instagram.com/dodufresh</a>"
도둑게장 예봉산점,2767526,음식,음식점,한식,http://tong.visitkorea.or.kr/cms/resource/65/2768265_image2_1.jpg,경기도,127.247008305,37.5448671627,"도둑게장 예봉산점은  남양주시 와부읍 팔당로에 있다. 넓은 주차장을 가지고 있으며 간장게장과 양념게장은 무한 리필이 된다. 한상차림 메뉴가 인기가 좋다. 한상차림에는 꽃게간장게장, 양념게장, 꽃게탕, 간장새우, 새우튀김, 가마솥 밥이 나온다. 얼큰한 꽃게탕의 국물과 가마솥 밥의 누룽지 숭늉도 맛볼 수 있다. 인근에 팔당로 드라이브 코스를 관광할 수 있다.",
도둑골캠핑장,2734231,레포츠,육상 레포츠,"야영장,오토캠핑장",http://tong.visitkorea.or.kr/cms/resource/34/2799634_image2_1.jpg,경상남도,127.8596233408,35.1969604835,"경남 하동군에 위치한 도둑골캠핑장은 가족단위 이용객이 많은 캠핑장이다. 무한 체력 아이들이 좋아하는 물놀이장과 사계절 썰매장, 트램펄린 등 놀이시설을 운영하고 있으며, 수시로 자체 행사나 이벤트를 마련하여 캠퍼들에게 즐길 거리를 제공한다. 해당 공지는 홈페이지를 통해 확인 가능하다. 캠핑장 내 반려견은 출입 금지다.","<a href=""http://cafe.naver.com/ddgol/"" target=""_blank"" title=""새창 : 도둑골캠핑장 사이트로 이동"">http://cafe.naver.com/ddgol/</a>"
도드람산(저명산),125465,자연,자연관광지,산,http://tong.visitkorea.or.kr/cms/resource/40/3060440_image2_1.jpg,경기도,127.3925641313,37.2670047754,"중부고속도로 이천휴게소 인근에 있는 도드람산(저명산)은 높이 약 349m로 그리 높지 않으나 정상의 3개 봉우리가 이루는 기암괴석이 절묘한 경관을 이루고 있어 많은 등산객이 찾아드는 이천의 명산이다. 주능선이 바위로 이루어져 있고, 전체 흙길로 등산의 묘미를 느낄 수 있으면서도 군데군데 데크가 깔려있어 어렵지 않게 등반할 수 있다.
도드람산은 저명산(猪鳴山)으로도 불리며 2개의 설화가 전해온다. 옛날 한 효자(또는 고승)가 홀어머니의 병환에 특효가 있다는 석이버섯을 따기 위해 절벽에 밧줄을 매고 석이를 뜯는데 산돼지가 울어 올라와 보니 밧줄이 거의 끊어져 가고 있었다. 이때부터 산신령이 목숨을 구해주었다 하여 돝울음산(돼지울음)으로 불리다가 도드람산으로 변했다는 것이다. 또 전국 명산의 신령들이 모여 한양을 만들 때 마고할미에게 삼각산의 한 봉우리를 채우도록 했는데, 공주 계룡산의 한 봉우리를 옮기다가 이천에서 쉬던 중 삼각산의 봉우리를 다 채웠다는 소식을 듣고 옮기던 봉우리를 이천에 버려두었다는 이야기다.
도드람산은 코스가 1개로 단출하다. 주차장→영보사→제1봉, 제2봉, 제3봉→정상→돼지굴→약수터→주차장을 거치는 코스로 약 2~3시간 정도 소요된다. 약 2.5km의 가벼운 산행을 즐길 수 있는 곳으로 주차장에서 정상까지의 거리는 불과 1.08km지만 평지 없이 경사 구간만 있어 중간중간 뷰포인트가 있어 조망하며 오르다 보면 1시간 정도 소요된다. 정상부는 탁 트여있어 조망이 좋다. 도드람산은 동쪽으로 이어진 설봉산과 함께 등산하는 사람이 많으며, 산행을 마치고 인근의 시내의 안흥유원지 들러 온천욕을 하며 피로를 풀 수 있다.","* <a href=""https://blog.naver.com/2000happy_/223050833158"" target=""_blank"" title=""새창: 공식블로그로 이동"">https://blog.naver.com/2000happy_</a>"
도드람테마파크,2763821,인문(문화/예술/역사),휴양관광지,테마공원,http://tong.visitkorea.or.kr/cms/resource/51/2763951_image2_1.png,경기도,127.5025410276,37.2412430862,"경기도 이천시 부발읍에 있는 돼지복합문화 공간이다. “돼지”를 테마로 돼지의 일생과 다양한 정보를 이해하고 직접 수제 햄을 만들 수 있는 체험스쿨과 키즈랜드, 신선한 농축산물을 구매할 수 있는 하나로마트, 맛과 품질의 도드람 한돈을 숯불과 함께 즐길 수 있는 도드람 바베큐하우스로 구성된 공간이다. 건물 층별로 1층에에 하나로마트와 바베큐하우스가, 2층과 3층에는 키즈랜드가, 4층에는 체험스쿨이 있다.",
도드람펜션,2576005,숙박,숙박시설,펜션,,경상남도,128.2362603872,34.6418599043,"도드람 펜션은 욕지도의 하늘과 바다에 반해 욕지도 바닷가로 내려와 펜션을 지은 한 부부가 운영하는 펜션이다.
푸른 바다의 파도 소리를 더 가까이에서 느낄 수 있는 도동마을 바닷가의 도동항과 도동해변과 걸어서 1분 만에 갈 수 있는 위치에 펜션을 자리하고 있다. 욕지도 도드람 펜션의 전 객실 바다 전망으로 탁 트인 푸른 바다가 한눈에 바라다보인다. 도드람 펜션은 욕지도의 푸른 하늘과 넓고 깨끗한 바다를 볼 수 있는 숙소다.","<a href=""http://yokjidododram.modoo.at/"" target=""_blank"" title=""새창: 도드람펜션 홈페이지로 이동"">http://yokjidododram.modoo.at/ </a>"
도라미 휴양펜션(도라미 관광 휴양펜션),2622935,숙박,숙박시설,펜션,,제주특별자치도,126.6095210938,33.2602804051,"도라미펜션은 서귀포 시내 중심가에 위치해 있어 각종 유명 관광지와 맛집이 자리하고 있다. 제주의 푸른 밤 하늘과 반짝이는 별들을 품고 단꿈을 꿀 수 있는 곳, 사랑하는 사람들과 소중한 추억, 편안한 휴식을 가질 수 있도록 최선을 다하고 있다.","<a href=""http://dorame.kr/""target=""_blank"">http://dorame.kr/</a>"
도라산 평화공원,2569507,인문(문화/예술/역사),역사관광지,안보관광,http://tong.visitkorea.or.kr/cms/resource/27/2567427_image2_1.jpg,경기도,126.7048279898,37.9089594521,"도라산 평화공원은 DMZ 투어에서 빠질 수 없는 곳이다. 2002년 도라산역 개방 시부터 구상하기 시작해 2006년 5월 12일 착공, 2008년 6월 13일 완공하였으며 2008년 9월 10일 시민들에게 개방했다. 특히 ""통일의 숲""은 평화를 사랑하는 경기도민의 헌금, 헌수로 조성되었으며 앞으로 도라산 평화공원은 청소년들에게 DMZ의 역사를 통한 평화와 생태의 소중함을 일깨우는 교육장 뿐만 아니라 ""평화를 사랑하는 만남의 장""으로 자리매김해 나갈 것이다.
평화공원은 7246㎡ 규모의 한반도 모형 생태연못과 627㎡의 관찰데크가 
마련돼 있어 DMZ 자연상태를 체험할 수 있다. 공원 내 352㎡ 전시관에서는 도라산의 역사와 DMZ 자연상태 자료 등을 최신 입체영상을 통해 볼 수 있다.","파주 문화관광 <a href=""https://tour.paju.go.kr/user/tour/place/BD_tourPlaceInfoView.do?q_gubunCode=1004&menuCode=1&cntntsSn=406"" target=""_blank"" title=""새창: 파주 문화관광 홈페이지로 이동"">http://tour.paju.go.kr/user/tour/main/index.do</a>"
도라산역,127519,인문(문화/예술/역사),역사관광지,안보관광,,경기도,126.7096417227,37.898907934,"도라산은 신라가 패망한 후 고려에 항복한 경순왕이 산마루에 올라 신라의 도읍을 그리며 눈물을 흘렸다 하여 도라(都羅)라 하였다고 한다. 도라산역은 현재는 민통선 안에 있다. 서울과 신의주를 잇는 경의선 철도역 중 하나인 도라산역의 출발은 2000년 남북정상회담을 통한 경의선 복원 사업에 의해서였다. 이렇게 시작된 경의선 복원 사업에 의해 2002년 2월 도라산역이 개설되었고 남쪽의 임진강역까지 4km 구간을 연결하는 공사가 완료되었다. 이후 정식으로 영업을 개시한 것은 같은 해 4월 11일이다. 
민통선 안에 들어선 역사를 짓는 일은 쉽지 않았다. 지뢰 등의 위험 요소로 간이 역사까지 고려되었을 정도였다고 한다. 또한 군 작전상의 문제로 실제 설계보다 역의 지붕이 낮게 시공되었으며 북한군이 도라산역사를 점거할 경우를 대비하여 남쪽 방향에는 창문이 없는 형태로 설계, 시공되어 일반인들에게 관광코스로 개방되었다. 이곳에서 KBS 평화 음악회가 열리고 김대중 대통령과 미국의 부시 대통령이 방문하여 세계적인 관심을 모았으며 외신에서도 참신한 관광지로 전하기도 하였다.
문산역까지 전철을 이용한 후 문산에서 도라산역행 기차를 이용하는 코레일의 DMZ-train과 경기도 DMZ 평화열차를 이용하여 도라산역과 인근 관광이 가능하였으나, 코로나 사태와 남북 관계 긴장으로 인해 전 역인 임진강역까지 경의·중앙선이 운행되고 있으며 도라산역 방문은 중단된 상태이다.","DMZ <a href=""https://dmz.gg.go.kr/gg_dmz-tour/attention/attention_02""target=""_blank"" title=""새창: 도라산역 홈페이지로 이동"">https://dmz.gg.go.kr</a><br/>파주 문화관광 <a href=""http://tour.paju.go.kr/user/tour/main/index.do"" target=""_blank"" title=""새창: 파주문화관광 홈페이지로 이동"">http://tour.paju.go.kr</a>"
도라전망대,252560,인문(문화/예술/역사),건축/조형물,유명건물,,경기도,126.7047863286,37.9088872381,"서부전선 최북단을 지키고 있는 도라전망대는 군사분계선으로 부터 1.5km 떨어진 해발 167m의 도라산 정상에 위치하고 있으며 1987년 1월 개방 전까지는 비무장지대여서 출입이 불가하였다. 2018년까지 30여 년간 사용되던 옛 도라전망대는 시설 노후화와 공간 협소로 일반인 관람은 중단하고 군장병 안보교육장으로만 활용되고 있으며 일반인 관광객은 신 도라전망대를 이용하여야 한다. 파주시는 2018년 10월 22일 옛 전망대에서 12m 높은 곳에 둥근 외벽 디자인으로 평화와 부드러운 이미지를 강조하여 지상 3층 규모로 신 도라전망대를 건립하였다. 도라전망대에 올라서면 DMZ와 개성공단, 개성시가지 뿐만 아니라 북한선전마을, 송악산이 한눈에 들어온다.","<a title=""새창 :파주 문화관광 사이트로 이동"" href=""https://tour.paju.go.kr/user/tour/place/BD_tourPlaceInfoView.do?menuCode=1&cntntsSn=10&q_gubunCode=1004"" target=""_blank"">http://tour.paju.go.kr</a>"
도라지식당,133258,음식,음식점,한식,,제주특별자치도,126.50594983,33.4927114054,"제주 토속음식 전문점으로 제주가 아니면 맛볼 수 없는 갈치 호박국, 싱싱한 생선에 미역을 곁들인 옥돔국과 갈치구이, 옥돔구이가 일품이다. 여름철엔 물회 역시 일품이다. 30여 년을 함께 한 시청 도라지식당은 더 넓은 주차공간과 좋은 시설, 지리적 조건 등을 고려해 공항 근처로 확장 이전하여 운영하고 있다.","<a href=""http://jejudoraji.modoo.at"" target=""_blank"" title=""새창 : 도라지식당 홈페이지로 이동"">http://jejudoraji.modoo.at</a>"
