title,contentid,cat1,cat2,cat3,firstimage,region,mapx,mapy,overview,homepage
도마큰시장,2758334,쇼핑,쇼핑,상설시장,,대전광역시,127.3819719941,36.3166138828,"도마큰시장은 대전시 서구 도마동에 자리 잡고 있다. 470여 개 상점이 성업 중인 이곳에서는 채소류, 생선류, 육류, 의류, 생활용품 등을 구매할 수 있다. 특히 떡볶이, 족발, 샌드위치 등 즉석에서 맛볼 수 있는 먹거리가 시장 곳곳에 있다. 시장은 서대전 IC와 가까운 거리에 위치했다. 주변에는 뿌리공원, 대전 오월드, 장태산자연휴양림이 있다.",
도명산,127271,자연,자연관광지,산,,충청북도,127.8025771544,36.6788855106,"괴산군에 있는 청천면 화양리에 있으며, 높이는 해발 643m로 속리산 국립공원에 속해있는 천혜의 계곡 화양동을 안고 있는 명산이다. 낙영산에서 북쪽으로 갈라진 산줄기가 화양천에 그 맥을 가라앉히기 전 바위로 불끈 일으켜 세운 산으로 이름처럼 삼체불 부근에서 도를 닦기 위하여 많은 사람들이 지성을  드리고 있는 것을 쉽게 발견할 수 있다. 정상까지는 10분 정도 걸리며, 통나무 계단과 철사다리 등 안전시설이 잘 되어 있어 쉽게 정상까지 오를 수 있다.
정상은 크고 작은 바위 다섯 개가 하나를 이뤄 정상을 형성하고 있다. 그 중 높고 큰 바위에 올라 앉아보면 신선이 따로 없다. 동으로는 백악산에서 뻗은 줄기, 서로는 그 넘어 금단산, 남으로는 낙영산 넘어 톱날같이 늘어선 속리산 연봉들, 북으로는 화양천 너머 군자산의 위엄이 다가선다. 정상주변에는 분재처럼 잘자란 소나무 몇 그루가 무상한 세월을 느끼게 한다.

하산은 서쪽의 바위 사이를 빠져 철사다리를 타고 15분 정도 내려섰다 올라서면 소나무 숲속에 10여m 바위가 길게 누운 끝봉을 마지막으로 급한 경사길을 내려가게 되는데  중간중간 줄을 매어 놓아 5분 정도면 어렵지 않게 내려서  8부 능선으로의 편안한 길이 계속되며, 30분 정도 내려오면 철조망이 처진 삼거리에 도착하게 되고, 화양 5곡인 첨성대로 하산하는 길이며 바위에서 내려다보이는 화양계곡의 운치는 자연의 넉넉함을 느끼게 하는 분위기에 젖게 한다.
오른쪽 길을 택하면 능운대 휴게소 앞의 화양천으로 내려가게 되며 어느쪽으로든 10분 정도면  큰 길에 도착할 수 있다. 능운대휴게소에서는 왔던 길로 화양동 물길을 따라 25분 정도 걸어오면 주차장에서 산행을 마감할 수 있다.","속리산국립공원 <a href=""http://songni.knps.or.kr/"" target=""_blank"" title=""속리산국립공원 사이트로 이동"">http://songni.knps.or.kr</a><br/>
괴산군청 문화관광 <a href=""http://www.goesan.go.kr/tour/index.do"" target=""_blank"" title=""새창: 괴산군 문화관광 홈페이지로 이동"">http://www.goesan.go.kr/tour/index.do</a>"
도명산캠핑장,2792229,레포츠,육상 레포츠,"야영장,오토캠핑장",http://tong.visitkorea.or.kr/cms/resource/90/2793390_image2_1.jpg,충청북도,127.7841821067,36.6600734443,"도명산 캠핑장은 충북 괴산군 청천면에 자리 잡고 있다. 캠핑장은 고즈넉한 농촌에 터를 잡고 있다. 산으로 둘러싸여 있어 자연친화적이며, 계곡이 코앞이라 여름철 피서지로 안성맞춤이다. 캠핑장에는 파쇄석으로 이루어진 오토캠핑 사이트 40면이 마련되어 있다. 사이트 면적이 넓기 때문에 대형 텐트를 설치하기에도 무리가 없다. 특히 캠퍼 3~4팀 만을 위한 독립 사이트도 운영 중이다. 다른 캠퍼들의 방해를 받지 않고 팀원들끼리 자유롭게 캠핑을 즐길 수 있어 인기다. 캠핑장은 카라반과 트레일러 출입이 가능하다. 중소형견에 한해 반려동물 동반 입장도 가능하며, 이 경우 목줄 착용과 배변 봉투 지참은 필수다. 캠핑장에는 여름철 개장하는 수영장, 각종 문화 행사가 열리는 문화광장, 복층형 방갈로와 펜션 등의 숙박시설, 먹을거리와 장작 등을 구입할 수 있는 매점 등 캠핑에 즐거움을 더해줄 시설이 갖추어져 있다. 캠핑장 인근에는 속리산 국립공원과 법주사가 위치하고 있어 연계 여행에 나서기 좋다.","<a href=""http://www.도명산캠핑.com"" target=""_blank"" title=""새창 : 도명산캠핑장 사이트로 이동"">http://www.도명산캠핑.com</a>"
도모헌,3416331,인문(문화/예술/역사),문화시설,문화전수시설,http://tong.visitkorea.or.kr/cms/resource/19/3416319_image2_1.jpg,부산광역시,129.1077767106,35.1462164864,"도모헌은 부산 수영구 남천동에 위치한 복합문화공간으로 과거 부산시장 관사와 대통령 숙소로 사용되던 건물을 리모델링하여 2024년 9월 24일 시민에게 개방된 곳이다. '무엇이든 자유롭게 도모하는 공간'이라는 의미를 담은 이름으로 1984년 건축가 김중업이 설계한 건물을 현대 건축가 최욱이 재해석하여 새롭게 단장한 것이다. 도모헌의 내부는 다목적 문화공간, 공유 오피스, 카페, 강연장, 회의실 등 다양한 시설로 구성되어 있다. 특히 야외에는 소소풍 정원이라 명명된 생활 정원이 조성되어 부산시 제1호 생활 정원으로 지정된 곳이다. 도모헌은 과거 '지방 청와대'로 불리며 권위적인 이미지를 가졌으나, 이제는 시민을 위한 공간으로 재탄생한 곳으로 시민들에게 휴식과 문화 체험의 기회를 제공하는 열린 공간으로 탈바꿈한 것이다.","<a href=""https://www.busan.go.kr/domoheon/index""target=""_blank"" title=""새창: 홈페이지로 이동"">https://www.busan.go.kr/domoheon</a>"
도미,2838980,음식,음식점,서양식,http://tong.visitkorea.or.kr/cms/resource/69/2838969_image2_1.jpg,경상북도,129.2118093357,35.8408153418,"도미는 경상북도 경주시 노동동에 있는 이탈리아 요리 전문점이다. 요리할 때 제절 재료를 사용하며, 지중해풍으로 만들어 속이 편안한 식사를 즐길 수 있다. 대표 메뉴는 샥슈카이다. 굴라쉬, 피자, 감바스 알 하이요 등도 맛볼 수 있다. 주차장이 마련되지 않았지만, 인근에 있는 해동주차장을 1시간 무료로 이용할 수 있다. 경주 IC에서 가깝고, 인근에 첨성대를 비롯해 경주교촌한옥마을, 동궁과 월지 등 경주의 유명 관광지가 있다.","<a href=""https://www.instagram.com/domi_community/""target=""_blank"" title=""새창 : 도미 사이트로 이동"">https://www.instagram.com/domi_community/</a>"
도미닉커피랩,2893042,음식,음식점,카페/전통찻집,http://tong.visitkorea.or.kr/cms/resource/28/2893028_image2_1.jpg,경기도,127.0539940309,37.2948537869,"도미닉커피랩은 광교 카페거리에 있는 카페이다. 차량 이용 시 건물 앞에 주차를 할 수 있지만 협소하여 근처 공영주차장 이용을 추천한다. 층고가 높고 깔끔한 매장에는 테이블이 여유롭게 배치되어 있다. 이곳은 코코넛 라떼, 아메리카노 외에 병 음료와 에이드, 필터 커피 등의 음료가 있고 바스크 치즈케이크, 스모어쿠키, 얼그레이 스콘 등의 디저트도 맛볼 수 있다. 2021년 기술평가 우수 인증기업으로 선정된 이곳은 직접 원두를 로스팅하여 납품 및 판매하고 있다. 근처 신분당선 광교중앙역이 있어 대중교통으로 이용할 수 있고 반려동물을 동반할 수 있다.
※반려동물 동반 가능",
도보로 즐기는 신라의 여름밤,2049286,추천코스,도보코스,도보코스,http://tong.visitkorea.or.kr/cms/resource/58/1613358_image2_1.jpg,Unknown,129.2190922049,35.8346939478,"경주 야경의 백미는 유네스코가 경주역사유적지구로 지정한 곳 중 하나인 월성 지구다. 월성지구는 신라 궁궐이 있던 월성, 경주 김씨의 시조 김알지가 태어난 계림, 내물왕릉, 첨성대, 신라 왕궁의 별궁 터인 동궁과 월지를 아우르는 지역이다. 모두 걸어서 둘러볼 수 있을 만큼 서로 가깝고, 복원 중인 월정교와 교촌마을도 지척에 있으니 함께 둘러보는 것이 좋다.",
도봉문화원,130211,인문(문화/예술/역사),문화시설,문화원,,서울특별시,127.0384297363,37.6540895888,"도봉문화원은 1994년에 설립되어 도봉 지역의 역사와 다양한 문화 정보를 지역주민들에게 제공한다. 매달 온라인 문화학교와 문화원 문화학교 프로그램을 진행하고 영화를 상영하여 지역 주민의 문화적 삶의 질을 향상하고, 문화가 있는 날 공연과 전시를 열어 문화생활을 즐길 수 있도록 한다. 또, 도봉구 문화자원봉사지원센터로서 봉사시간 인증과 다양한 봉사활동 프로그램을 열고 있다.
매년 청명절에는 방학동 연산군 묘역서 조선 10대 임금 연산군에게 올리는 전통 제향인 연산군 청명제향을 올린다.","도봉문화원 <a href=""http://www.dobong.or.kr"" target=""_blank"" title=""새창 : 도봉문화원 홈페이지로 이동"">http://www.dobong.or.kr</a>"
도봉사,2782489,인문(문화/예술/역사),역사관광지,사찰,http://tong.visitkorea.or.kr/cms/resource/24/2795424_image2_1.jpg,경상북도,128.4835281863,36.0661734591,"비구니들만 거주하는 사찰로, 경상북도 칠곡 유학산 쉰질바위 아래에 자리해 있다. 쉰 질 바위는 절벽의 높이가 어른 키의 50배 정도 된다고 하여 붙은 이름으로 웅장한 절벽과 소박한 절집이 그림처럼 어우러진다. 쉰질바위는 산악인들의 암벽등반 훈련장으로도 유명하다. 임진왜란 때 소실된 신라시대 고찰인 천수사가 있던 자리에 건립됐으며, 비구니 사찰답게 정갈하고 아기자기한 분위기가 느껴진다. 곳곳에 천진한 표정의 동자승 조각품이 평화로운 분위기를 더한다. 유학산 정상의 팔각정에서 다부동 전적기념관으로 이어지는 6.25 전쟁 격전지 순례 코스에 속해 있으며, 도봉산 진입로에서 15분 정도 걸어 올라가거나 사찰 입구까지 자동차로도 이동도 가능하다. 도봉사 앞마당에서 바라보는 탁 트인 전망도 아름답다.",
도봉산,126481,자연,자연관광지,산,,서울특별시,127.0184192271,37.6969870145,"북한산국립공원 내 동북쪽에 있는 ‘도봉산’은 최고봉인 자운봉(740.2m)을 비롯하여 만장봉, 선인봉, 주봉, 오봉, 우이암 등의 암벽이 아름답기로 이름난 산인데 특히, 선인봉 암벽 등반코스로는 박쥐코스 등 37개 코스가 개척되어 있다. 북한산 및 도봉산 지역의 60여 개 사찰 중 제일 오래된 건축물인 ‘천축사’를 비롯하여 망월사, 회룡사 등의 절과 도봉계곡, 송추계곡, 오봉계곡, 용어천계곡 등 아름다운 계곡을 안고 있으며, 교통이 편리하여 서울시민이나 근교 주민들에게 더없이 인기 있는 하루 등산지이다.","<a href=""https://tour.dobong.go.kr/Contents.asp?code=10001582"" target=""_blank"" title=""새창 : 도봉구 문화관광 사이트로 이동"">https://tour.dobong.go.kr</a>"
도봉산양고기,2832791,음식,음식점,한식,http://tong.visitkorea.or.kr/cms/resource/86/2832786_image2_1.jpg,서울특별시,127.0417561863,37.6899771406,"도봉산양고기는 다사랑요양원 인근에 있는 양고기 맛집이다. 도봉산역 1번 출구에 있다. 입구에 들어서면 나무다리가 나오는데 다리 주변부터 식당 입구까지 온통 초록색 나뭇잎이 가득하다. 마치 초록의 동굴을 지나는 느낌이다. 이곳의 인기 메뉴는 양삼각갈비다. 초벌구이해서 나오기 때문에 오래 기다리지 않고 먹을 수 있다. 양고기를 각종 야채, 나물과 함께 먹으면 양고기의 풍미를 한층 더 진하게 느낄 수 있다. 마무리로는 잔치국수나 막국수가 있다. 야외 좌석에 앉아서 먹으려면 예약은 필수다. 북한산국립공원 근처에 있어 산행 후 들르기 좋다.",
도봉서당,2613254,숙박,숙박시설,한옥,,경상북도,129.1847315323,35.8274885572,"도봉서당은 김유신 장군의 누이 보희, 문희의 꿈 이야기 배경 장소인 선도산 자락에 위치하고 있으며 조선 성종 때 학자였던 황정 선생의 학덕과 효행을 추모하기 위해 세운 추보재라는 재실을 수리하여 사용하고 있는 고택이다.","<a href=""http://www.경주고택.kr""  target=""_blank""> www.경주고택.kr </a>"
도봉서원,1955511,인문(문화/예술/역사),역사관광지,유적지/사적지,,서울특별시,127.0291407181,37.6883382147,"도봉서원은 서울에 소재한 현존하는 유일한 서원으로 도봉산의 옛 영국사 터에 자리 잡고 있다. 1573년(선조 6) 양주목사 남언경과 지방 유림의 뜻으로 조광조의 학문적 사상과 덕행을 추모하기 위해 창건하고 위패를 모셨다. 창건과 동시에 도봉이라는 사액을 받았으며 송시열을 추가 배향하였다. 매년 음력 3월 10일(춘향제)과 9월 10일(추향제)에 전국 유림과 지역 유지가 모여 전통 향사를 지내고 있다.
또, 도봉서원 앞 계곡에는 다양한 형태의 수석이 있는데 이곳에는 이름난 유학자이자 명필가인 한 송시열, 송준길, 권상하, 이재, 김수증 등의 글씨가 새겨진 바위들이 있다. 도봉서원과 각석군은 서울특별시 기념물로 지정되어 관리하고 있다.","<a href=""https://tour.dobong.go.kr/Contents.asp?code=10008364"" target=""_blank"" title=""새창 : 도봉구 문화관광 홈페이지로 이동"">http://tour.dobong.go.kr/</a><br /><a href=""http://www.cha.go.kr/"" target=""_blank"" title=""새창 :  문화재청 홈페이지로 이동"">http://www.cha.go.kr</a>"
도봉서원(창원),1959558,인문(문화/예술/역사),역사관광지,유적지/사적지,http://tong.visitkorea.or.kr/cms/resource/78/3071778_image2_1.jpg,경상남도,128.6592945587,35.3146865744,"도봉서원은 임진왜란 때 공을 세운 김명윤 선생의 학문과 덕행을 추모하기 위해 1713년(숙종 39)에 사당을 짓고 1775년(영조 51) 도봉사를 건립하였으며 1844년(헌종 10) 도봉서원으로 승격하였다. 그러나 흥선대원군의 서원 철폐령으로 철폐되었고 1887년(고종 24)에 다시 별묘와 재실을 중건하여 1974년에 서원으로 복원되었다. 별묘에는 선조의 하사품인 장도(쌍검) 등 동산공 김명윤의 유물을 보관하고 있다. 도봉서원 내에는 충현사·신문·강당·동재·외문 등이 있고, 충현사에는 김명윤의 위패가 안치되어 있으며, 강당은 여러 행사와 화합에 사용된다. 향사는 매년 3월 13일 한 차례만 지내고 있다.","▪ <a href=""http://culture.changwon.go.kr/"" target=""_blank"" title=""새창: 창원 문화관광 홈페이지로 이동"">http://culture.changwon.go.kr</a> <br />▪ <a href=""http://www.cha.go.kr/"" target=""_blank"" title=""새창: 국가유산청 사이트로 이동"">http://www.cha.go.kr</a>"
도봉옛길 문화제,2725188,인문(문화/예술/역사),축제,일반축제,http://tong.visitkorea.or.kr/cms/resource/19/3330719_image2_1.JPG,서울특별시,127.0438567631,37.6630747526,"‘도봉옛길 문화제’는 서울 도봉구의 대표적 문화유산인 ‘도봉옛길’의 역사·문화적 가치를 알리고 지역주민의 일상에서 지역문화예술을 향유할 수 있도록 마련된 지역 문화제다. 도봉옛길은 조선시대 수도 한양과 한반도 각지를 잇는 6개의 큰 대로(大路) 중 두번째인 경흥대로(慶興大路)의 도봉구 구간을 지칭한다. 조선 태종 대 함흥차사, 세종 대 4군 6진으로 출정했던 군대, 북어와 북포를 가득 멘 보부상 등 과거 수많은 사람들이 부푼 꿈을 안고 이 길을 걸었다.
특히 도봉옛길은 수려한 도봉산과 도봉서원, 벚꽃놀이와 하이킹을 가기 위해 이용했던 산수유람로기도 했다. 제4회 도봉옛길 문화제 """"도봉유람""""은 오늘날의 도봉옛길이 지역주민들이 일상을 만들어가는 삶의 터전이자, 도봉사람들을 치유하고 보듬어 줄 수 있는 휴식의 공간이라는 점에 집중하였다.
지역문화예술인으로 구성된 도봉옛길 예술상단의 거리공연, 도봉사람들과 함께 도봉옛길을 걸어보는 ‘도봉옛길 거리행렬’, 지역문화해설사와 함께하는 도봉옛길 도보여행 ‘도봉옛길 문화탐방’, 기획전시 및 체험프로그램 등으로 꾸린 '도봉유람'은 어디론가 훌쩍 유람을 떠나고 싶은 사람이라면 누구나 함께 할 수 있다.","<a href=""https://dobongfesta.modoo.at""_blank"" title=""새창: 홈페이지로 이동"">https://dobongfesta.modoo.at</a>"
도봉집,1595152,음식,음식점,한식,,전북특별자치도,127.2828272453,35.6144921042,"임실의 순대국밥은 시중에서 판매되는 인조순대와 다르게 옛 전통 그대로의 순대국밥이다. 이곳의 전통피순대는 KBS 라디오 프로인 맛자랑 시간에도 소개된 적이 있다.주변의 문화재로는 임실 이도리 미륵불상, 임실향교 대성전을 찾아볼 수 있고 군자정, 동막저수지, 세심자연휴양림 등을 즐길 수 있다.<br>",
도봉한글잔치,2601242,인문(문화/예술/역사),축제,일반축제,http://tong.visitkorea.or.kr/cms/resource/17/3414917_image2_1.jpg,서울특별시,127.0222810312,37.6603441259,"세종의 한글 창제 이후 우리 민족의 언어로 사용되던 한글은 1894년 갑오개혁 이후 정식으로 나랏말이 되었다. 근대화에서 일제강점기 그리고 해방 이후까지 나랏말이 된 한글을 지키고 누리며 회복하는 역사를 담은 도봉한글잔치를 개최한다. 한글 창제에 도움을 준 세종대왕의 따님, 정의공주는 도봉구 방학동에 잠들어 있다. 매년 한글날, 정의공주와 한글을 기념하여 원당샘공원에서 열리는 '도봉한글잔치'는 도봉구의 대표적 지역문화축제로 자리 잡았다. 정의공주와 훈민정음을 지켜낸 전형필, 한글 노래를 작사하고 우리의 민족의 얼을 연구한 정인보 등 한글을 만들고, 지키고, 누리는 도봉구 역사 인물들과 지역 주민이 함께 만들어가는 축제이다.","<a href=""https://30th.dobong.or.kr/"" target=""_blank"" title=""새창 : 도봉한글잔치 홈페이지 이동"">https://30th.dobong.or.kr</a>"
도비 마루길,3045980,자연,자연관광지,자연생태관광지,http://tong.visitkorea.or.kr/cms/resource/74/3045974_image2_1.jpg,충청남도,126.4183318187,36.6962784775,"도비마루길은 서산아라메길 중 하나로 서산시 부석면에 솟은 해발 353m의 도비산에 조성된 트레킹 코스이다. 천년 고찰 부석사 주차장을 중심으로 순환하는 총길이 6.2km, 3시간 코스이다. 주요 경유지는 부석사, 동사, 해돋이 전망대, 패러글라이딩 활공장, 해넘이 전망대 등이다. 정상에서 보이는 서해 바다와 드넓은 간척지가 일품이고 가을에는 황금 들판이 절경이다. 다만 도비산 정상부에 조성되어 등산 난이도가 약간 높은 편이다.
도비마루길은 지방도 649호선에서 부석사길을 통해 접근할 수 있으며, 고속도로는 서해안고속도로 해미IC 및 홍성IC가 가깝다. 주변에는 간월도, 해미읍성 등의 관광지가 있다.","<a href=""https://www.seosan.go.kr/tour/contents.do?key=9170"" target=""_blank"" title=""새창 : 홈페이지로 이동"">https://www.seosan.go.kr</a>"
도비도항,2750341,자연,자연관광지,항구/포구,,충청남도,126.462355262,37.0212444868,"도비도항은 난지도로 향하는 여객선의 선착장이다. 바다, 육지, 민물 습지 등 다양한 자연생태자원이 존재하고 있는 당진의 명소이기도 하다. 이 덕분에 좌대 낚시를 즐기는 사람들의 방문이 잦다. 특히 도비도항 앞바다에서는 썰물 때 갯벌이 바다 쪽으로 길게 갈라져 마치 모세의 기적을 연출하는 무창포의 갯벌과 비슷한 광경을 볼 수 있다. 물 빠진 갯벌을 따라 바다 깊숙이 들어갈 수 있는 것이 도비도 갯벌의 특성이다. 이 때문에 생태 체험을 하면서 조개, 게, 고동, 낙지 등을 직접 잡아볼 수 있다. 인근에는 왜목마을 해수욕장, 장고항 등 연계 여행에 나서기 좋은 관광지가 많다.",
도사곡자연휴양림야영장,2762785,레포츠,육상 레포츠,"야영장,오토캠핑장",http://tong.visitkorea.or.kr/cms/resource/27/2763127_image2_1.JPG,강원특별자치도,128.7956223479,37.2267328283,"도사곡휴양림은 청정지역인 사북 두위봉 산자락에 자리잡고 있는 곳으로, 시원하게 트인 계곡 사이로 아늑한 분위기를 연출하는 독립 별장형 통나무 펜션이다. 1급수의 맑은 물이 흐르는 계곡에서 훼손되지 않은 아름다운 자연을 만끽할 수 있다.","<a href=""http://dosa.jsimc.or.kr/"" target=""_blank"" title=""새창 : 도사곡자연휴양림야영장 사이트로 이동"">http://dosa.jsimc.or.kr/</a>"
도사곡휴양림,789897,자연,자연관광지,자연휴양림,http://tong.visitkorea.or.kr/cms/resource/61/3342261_image2_1.jpg,강원특별자치도,128.7957167855,37.2266800583,"정선 도사곡휴양림은  도사곡 계곡 자락에 있는 휴양림으로, 울창한 산림과 맑은 계곡이 어우러진 아름다운 자연경관을 즐길 수 있는 곳이다. 도사곡휴양림은 총 70만여 평의 면적에 숲속의 집, 산림문화휴양관, 야영장, 오토캠핑장 등 다양한 편의시설이 갖추어져 있다. 또한, 도사곡 계곡을 따라 다양한 산책로가 조성되어 있어, 가벼운 산책이나 트레킹을 즐기기에 좋다. 도사곡 계곡 중간에는 높이 20m의 웅장한 도사곡 폭포를 볼 수 있다. 도사곡 주변에는 화암약수, 화암동굴, 동강, 몰운대, 광대곡, 정암사 등 정선의 여러 관광명소가 인접해 있다. 도사곡휴양림은 5월부터 10월까지가 가장 아름답다. 이 시기에 방문하면 도사곡 계곡의 아름다운 자연을 만끽할 수 있다. 예약은 사용일 한달전부터 홈페이지를 통하여 예약 접수 가능하며  7, 8월 성수기에는 별도 공지하고 있다.","<a href=""https://www.jsimc.or.kr/layout/basic/page/page1/page11.html"" target=""_blank"" title=""새창: 도사곡휴양림 사이트로 이동"">http://dosa.jsimc.or.kr</a>"
도산공원,126486,자연,자연관광지,자연생태관광지,,서울특별시,127.0338117034,37.5214632538,"도산공원은 서울 강남구 신사동에 있는 공원으로 도산 안창호의 애국정신과 교육 정신을 기리고자 조성되었다. 공원 내에는 도산 선생 기념물로 동상 1기, 어록비 1기, 비문해설기 1기 등이 설치되어 있으며, 매년 3월 10일 이곳에서 흥사단 및 도산기념사업회 주관으로 도산 선생 추모 기념행사를 거행한다. 기념관에는 임시정부 사료집과 도산일기 등이 전시되어 있으며 터치스크린을 이용해 도산어록을 볼 수 있다.","<a href=""https://www.gangnam.go.kr/board/B_000733/40498/view.do?mid=FM010407"" target=""_blank"" title=""새창: 강남구청 도산공원 "">http://www.gangnam.go.kr/</a><br>비짓서울 <a href=""https://korean.visitseoul.net/nature/%EB%8F%84%EC%82%B0%EA%B3%B5%EC%9B%90_/1789"" target=""_blank"" title=""비짓서울 사이트로 이동"">https://korean.visitseoul.net/</a>"
도산래프팅,131973,레포츠,수상 레포츠,래프팅,http://tong.visitkorea.or.kr/cms/resource/39/1981539_image2_1.jpg,경상북도,128.8913413968,36.765837505,도산 래프팅은 안동시 도산면 가송리에 위치한 레저업체이다. 가송리는 주변 경관이 아름답기로 유명한 마을이다. 도산 래프팅은 이러한 아름다움을 느낄 수 있는 래프팅 프로그램을 운영하고 있다. 안동시와 봉화군 경계에 위치한 청량산을 휘감고 도는 낙동강의 천혜 풍경을 감상하면서 래프팅을 즐길 수 있다. 무엇보다 깨끗하고 시원한 강줄기를 따라 아름다운 산세와 계곡을 감상하고 고산정과 농암종택 등의 예스러운 정취를 함께 느낄 수 있는 곳이다.,"도산래프팅 <a href=""http://dsrafting.modoo.at"" target=""_blank"" title=""새창 : 도산래프팅 홈페이지로 이동"">http://dsrafting.modoo.at</a>"
