title,contentid,cat1,cat2,cat3,firstimage,region,mapx,mapy,overview,homepage
본가나주곰탕갈비탕찜,2845900,음식,음식점,한식,http://tong.visitkorea.or.kr/cms/resource/90/2845890_image2_1.jpg,경기도,126.9637241701,37.4040061873,"본가나주곰탕갈비탕찜은 경기도 안양시 관양동에 있는 곰탕 전문점이다. 내부는 넓고 테이블도 넉넉하며 단체 손님을 위한 공간도 있다. 이 음식점의 나주곰탕은 2배 비싼 구이용 부위를 사용하여 옛날 비법으로 조리한다. 국물이 깔끔, 담백하면서도 고소하고 깊은 맛이 난다. 고기는 아주 부드럽다. 갈비탕과 찜은 마구리 없이 순수 갈비 부위만 사용하므로 살코기가 실하다. 갈빗살이 쉽게 잘 발라지고 아주 부드럽다. 육전이 매우 인기 있는데, 특수부위인 부챗살을 이용하여 전을 부친다. 고기의 육향과 계란의 고소함이 어우러져 손님들이 꼭 주문하는 특별한 별미다. 식으면 묵이 될 정도로 고농도인 도가니탕도 대표 메뉴다. 반찬으로 나오는 김치와 깍두기도 감칠맛을 내 주메뉴와 잘 어울린다. 근처에 동편마을 카페거리와 공원들이 많이 있고, 5km 이내에 평촌 중앙공원, 백운호수, 삼막사 계곡, 관악산 등이 있다.","<a href=""https://najugomtang6281.modoo.at/""target=""_blank"" title=""새창 : 본가나주곰탕갈비탕찜 사이트로 이동"">https://najugomtang6281.modoo.at/</a>"
본가낙지볶음,850558,음식,음식점,한식,http://tong.visitkorea.or.kr/cms/resource/01/1902201_image2_1.jpg,부산광역시,129.0602976198,35.1420660746,"조방본가낙지는 부산광역시에 위치한 낙지요리 전문점이다. 
싱싱한 낙지와 해산물이 만나 특별한 맛을 내고 있다. 프라이팬에 파, 마늘 등 각종 양념과 낙지를 얹고 라면, 우동 사리를 더해서 먹으면 낙지의 쫀득함과 부드러움, 양념들의 매콤 달콤함을 입안 가득히 느낄 수 있다. 부산의 특별한 낙지볶음을 맛보고 싶다면 조방본가낙지를 방문해 보자.",
본가동해막국수,2870140,음식,음식점,한식,http://tong.visitkorea.or.kr/cms/resource/28/2870128_image2_1.jpg,강원특별자치도,128.8317275864,37.8593077382,"본가 동해 막국수는 강원도 강릉시 연곡면에 있는 막국수 전문점이다. 1978년에 어머니가 창업한 노포를 자금은 셋째 딸이 이어받아 운영하고 있다. 고명으로 명태식해를 올리는데 한번 맛을 보면 그 맛을 잊지 못해 계속 찾게 되는 맛집이다. 막국수는 비빔으로 즐길 수도 있고 물국수로 즐길 수도 있다. 막국수와 함께 하는 곁들임 메뉴로 수육, 메밀전, 메밀 감자만두, 녹두 감자전 등이 있다. 날씨가 좋으면 마당 야외 좌석을 이용할 수 있고 주차는 전용 주차장이 있어 이용이 편리하다. 단, 만차시에는 주변 길가 여유 공간을 찾아 주차를 해야 한다.","<a href=""http://0336612263.tshome.co.kr/""target=""_blank"" title=""새창 : 본가동해막국수 사이트로 이동"">http://0336612263.tshome.co.kr/</a>"
본가두부전문점,2876386,음식,음식점,한식,http://tong.visitkorea.or.kr/cms/resource/69/2876369_image2_1.jpg,충청남도,126.6628069791,36.6950745008,"본가두부전문점은 충청남도 예산군 덕산면 신평리 소재 덕산온천단지 내에 있다. 깔끔한 외관과 차분한 분위기를 연출하는 인테리어가 눈에 띈다. 내부에는 단체석이 마련되어 있어 각종 모임에 적당하다. 대표 메뉴는 국내산 콩으로 손수 만든 두부로 요리한 바지락 순두부다. 매생이 순두부, 버섯고기 순두부도 많은 사람이 찾는다. 이 밖에 명품 수제 왕돈가스, 만두, 두부김치, 부침두부 등 여러 가지 음식이 준비되어 있다.","<a href=""http://본가두부전문점.gajagaja.co.kr""target=""_blank"" title=""새창 : 본가두부전문점 사이트로 이동"">http://본가두부전문점.gajagaja.co.kr</a>"
본가딸부자전복죽집,2845123,음식,음식점,한식,http://tong.visitkorea.or.kr/cms/resource/06/2845106_image2_1.jpg,부산광역시,129.2260450183,35.2175468041,"부산 기장 연화리에 있는 본가딸부자는 가정식 주택을 개조하여 식당으로 운영 중이다. 외관이 파란 기와와 흰색 벽돌로 되어 있어 찾기 쉽다. 내부는 깔끔하고 좌석 간 거리가 넓어 쾌적하다. 대표 메뉴인 전복죽은 큼직한 솥에 전복 내장이 들어가 푸르스름한 색의 밥에 꼬들꼬들 전복이 푸짐하게 나온다. 진한 바다향이 가득 담겨 나오는 전복죽은 해산물 전문점이지만 전복죽 전문점이라 해도 손색없다. 해물 모듬과 낙지, 개불, 해삼, 삶은 고동, 전복 회, 전복구이 등 단품 메뉴 주문도 가능하다. 전복죽과 함께 곁들여 먹기 좋게 맛보기 모둠도 준비되어 있다. 자동차로 10분 거리에 부산 롯데월드가 있다.",
본가만두전골전문점,2751412,음식,음식점,한식,http://tong.visitkorea.or.kr/cms/resource/42/2773342_image2_1.JPG,경기도,126.8385360136,37.3878030594,경기도 시흥시 물왕동에 위치한 '본가만두전골전문점'은 TV에 다수 출연한 물왕저수지 근처의 만두전골 전문점이다. 만두전골에 들어가는 만두피가 없다시피한 굴림만두로 유명하며 피가 얇아 글씨가 비칠 정도다. 식당 근처 물왕호수가 있어 식사 후 산책하기에 좋다.,"<a href=""http://blog.naver.com/bonga0201/"" target=""_blank"" title=""새창 : 본가만두전골전문점 사이트로 이동"">http://blog.naver.com/bonga0201/</a>"
본가박대감,627355,음식,음식점,한식,http://tong.visitkorea.or.kr/cms/resource/60/2370460_image2_1.jpg,강원특별자치도,127.9588335817,37.3229420444,"강원도 원주시에 위치한 본가박대감은 왕갈비 구이 전문점이다. 남들이 흉내 낼 수 없는 소스, 매콤 달콤한 콩나물무침 그리고 시골된장으로 끓인 된장찌개가 기본 세팅 메뉴에 포함되어 있다. 또한 직원들이 직접 고기를 구워주어 더욱 편리한 식사가 가능하다. 돼지 왕갈비 외에도 소 갈빗살도 맛볼 수 있다. 실내 좌석이 넉넉하여 각종 단체 모임을 하기에도 좋다.",
본가설렁탕,2758118,음식,음식점,한식,,서울특별시,127.0999699991,37.5063689742,"잠실동 석촌호수(동호) 길에 대형 건물과 주차장을 보유한 가마솥 설렁탕집이다. 2층 단독 건물로 식당 입구에 있는 커다란 가마솥에서 진한 소고기 육수를 고아내는 장면을 볼 수 있다. 대표메뉴는 가마솥에서 끓여낸 설렁탕이지만, 소고기 내장이 들어가는 본가탕과 선지가 들어가는 해장국, 돌냄비에 나오는 수육도 인기 메뉴다.",
본가양평해장국 양평지점,2853272,음식,음식점,한식,http://tong.visitkorea.or.kr/cms/resource/65/2853265_image2_1.jpg,경기도,127.47145336,37.4908219652,"본가양평해장국 양평지점은 국도변에 있는 해장국 식당이다. 주인이 양평군에서 지정한 한국 토속 음식 명인이다. 주메뉴는 해장국, 육개장, 갈비탕 등이다. 반찬은 섞박지, 배추김치, 고추 간장 장아찌, 양을 찍어 먹을 간장이 나온다. 해장국에는 선지, 양, 콩나물, 우거지가 듬뿍 들어가 있다. 양평해장국의 특징은 고추기름과 양이 많아 다른 곳보다 기름지게 느껴진다. 이외에도 육개장, 갈비탕, 해갈탕 등이 있다. 곁들임 메뉴로는 감자를 갈아 전통 방식으로 부쳐주는 감자전이 있다. 주차는 매장 앞에 할 수 있다. 88번 국도에 있는 식당이어서 찾는 데 어려움이 없다. 강상면에 운동을 하러 오는 아마추어 야구팀들이 즐겨 찾는 맛집이다.",
본가장수촌,2671349,음식,음식점,한식,http://tong.visitkorea.or.kr/cms/resource/43/2671343_image2_1.jpg,경기도,127.063068419,37.0881223087,몸보신으로 좋은 보양 요리를 판매하는 곳이다. 경기도 평택시에 있는 한식 전문점이다. 대표메뉴는 오리 누룽지 백숙이다.,
본가제주밥상,799503,음식,음식점,한식,,경기도,127.1752525166,37.5870331884,"유네스코가 지정한 청정지역 제주의 계절밥상, 경기도가 지정한 음식문화 특화거리인 미음나루 내에 위치한 본가제주밥상은 아름다운 정원과 맛깔스러운 음식으로 고객의 만족을 위해 노력하고 있다. 본가제주밥상은 제주시가 지정하고, 조리기능장 제주 1호 문동일 셰프의 레시피를 토대로 만들어지며, 청정지역 제주의 재료를 매일 공급해 신선함을 유지한다.","<a href=""http://본가제주밥상.com"" target=""_blank"" title=""새창: 본가제주밥상 홈페이지로 이동"">http://본가제주밥상.com</a>"
본가진미간장게장,2847012,음식,음식점,한식,http://tong.visitkorea.or.kr/cms/resource/99/2846999_image2_1.jpg,서울특별시,127.1113272416,37.5083800567,"본가진미간장게장 식당은 9호선 송파나루역 4번 출구 인근에 있다. 이 식당은 직접 경매를 통해 공수해 온 싱싱한 최상품 국내산 꽃게로 요리해 모든 재료가 신선하다. 내부는 바닥이 마루로 되어 있고 테이블 석 역시 나무로 되어 있어 깔끔하고 넓다. 이 집의 대표 메뉴는 암꽃게 간장모듬장 정식으로 새우장, 전복장, 연어장, 소라장까지 다 맛볼 수 있는 인기 메뉴다. 기본 밑반찬으로 과일샐러드, 연어샐러드, 된장찌개 등이 나온다. 게장은 짭조름하면서 살도 많아 밥을 비벼 먹으면 감칠맛이 난다. 주문할 경우 전국 택배 배송이 가능하며, 식당 인근에 송리단길이 있어 가벼운 산책을 할 수 있다.","<a href=""http://www.instagram.com/jinmicrab""target=""_blank"" title=""새창 : 본가진미간장게장 사이트로 이동"">http://www.instagram.com/jinmicrab</a>"
본가참순대본점,2863094,음식,음식점,한식,http://tong.visitkorea.or.kr/cms/resource/60/2863060_image2_1.jpg,경기도,126.8786963211,36.9835477873,"본가참순대는 평택시 포승공단에 있는 순댓국밥집이다. 신발 벗고 편하게 앉는 좌식 자리도 있고 테이블에 앉는 식탁 자리도 있다. 모임을 하기 좋은 룸도 있어서 예약 후 이용할 수 있다. 이 집은 순댓국, 순대정식, 모듬순대가 유명한데 순댓국은 처음부터 양념장을 넣어서 빨갛게 낸다. 주문할 때 얘기하면 뽀얀 국물로 준비해준다. 모듬순대는 일반 순대, 김치 순대, 야채 순대 세 가지 맛이 나오고, 순대 정식에는 순댓국에 세 가지 순대와 수육이 적당한 양으로 한 접시 곁들여 나온다. 앞뒤에 주차 공간이 넓어서 주차하기 편하다.",
본가한우곱창,2573803,음식,음식점,한식,,울산광역시,129.2722816692,35.5518879234,"최고의 맛과 최상의 서비스로 손님들 대접하는 본가한우곱창은 잡내 없는 깔끔한 맛과 고소한 곱이 일품인 곳이다. 청결을 최우선으로 깨끗한 주방에서 위생적으로 조리하여 손님 여러분들이 안심하고 드실 수 있도록 최고의 음식을 제공하고 있고, 엄선된 식재료만을 고집하여 최고의 맛과 최상의 서비스로 고객만족을 위해 노력하고 있다.<br>","<a href=""http://ok114.co.kr/0522241661"" target=""_blank"" title=""새창: 본가한우곱창 홈페이지로 이동"">http://ok114.co.kr/0522241661</a>"
본구이 동탄IC점,2842702,음식,음식점,한식,http://tong.visitkorea.or.kr/cms/resource/99/2842699_image2_1.jpg,경기도,127.0776466135,37.2251983855,"본구이 동탄IC점은 기흥 삼성전자 바로 앞에 위치한 본구이 체인점이다. 주메뉴가 돼지숯불갈비를 중심으로 만들어진 세트메뉴들인데 A,B,C 한상 차림으로 판매한다. 이 집은 삼성전자와 대규모 아파트 단지가 많아서인지 점심에도 항상 붐비는 맛집이다. 점심에는 돼지갈비 정식, 쭈꾸미정식 세트를 즐겨 찾는다. 점심 세트여도 제공되는 돼지갈비나 주꾸미의 양이 적지 않다. 점심 세트는 어느 것을 주문하든지 2인 이상만 가능하고 밥이나 냉면이 같이 제공되는데 냉면의 맛도 일품이다. 식당에 셀프바를 두어 부족한 반찬이나 야채를 무제한으로 제공한다. 쭈꾸미볶음정식의 경우는 무생채와 야채를 넣어 함께 비벼 먹으면 맛있는 주꾸미 비빔밥이 된다. 돼지갈비전문점인데도 이 맛을 즐기러 재방문하는 고객이 많다. 주차장은 넉넉하다.
※반려동물 동반 불가",
본궁석갈비,2753683,음식,음식점,한식,,충청북도,127.4221491243,36.6155192478,"본궁석갈비는 충북 청주시 흥덕구 강서동에 자리 잡고 있다. 대표 메뉴는 돼지석갈비이며, 소석갈비, 물냉면, 비빔냉면, 소면도 판다. 돼지석갈비와 소석갈비는 포장이 가능하다. 연중 쉬는 날 없이 오전 11시부터 오후 9시 30분까지 영업한다. 단 주말에는 오후 9시에 문을 닫는다. 음식점은 남이JC와 가깝고, 주변에 청주시립박물관이 위치해 있다.",
본노엘 성수점,2899886,음식,음식점,카페/전통찻집,http://tong.visitkorea.or.kr/cms/resource/65/2899865_image2_1.JPG,서울특별시,127.0480262726,37.5497991067,"본노엘 성수점은 서울지하철 2호선 뚝섬역 2번 출구 약 300미터 거리에 있다. 이곳은 식빵 전문 베이커리다. 매장에 별도의 주차장이 없어 대중교통을 이용하는 편이 좋다. 외관이 진분홍색으로 되어 있어 눈에 잘 띄고 산뜻하다. 입구에는 여러 방송에 출연한 인증 명패가 걸려있다. 매장이 크진 않지만, 종류가 다양하다. 대표 메뉴로 소금 빵, 앙버터-버터프레첼, 치즈 치아바타 등이 있고 그 외에 밤식빵, 쌀식빵, 치즈식빵, 우유식빵 등이 있다. 인근에 성수동 카페거리, 성수동구두테마공원, 서울숲, 뚝섬유원지 등이 있어 두루 둘러보기 좋다.
※ 반려동물 동반 가능","<a href=""http://instagram.com/bonnoel2020""target=""_blank"" title=""새창 : 본노엘 사이트로 이동"">http://instagram.com/bonnoel2020</a>"
본누벨베이커리,2833847,음식,음식점,카페/전통찻집,http://tong.visitkorea.or.kr/cms/resource/43/2833843_image2_1.jpg,경기도,127.075227933,37.3049141129,"용인 본누벨베이커리는 지하 1층, 지상 3개 층으로 이루어진 대형 베이커리 카페이다. 제품 하나하나에 꿈과 이야기를 살려 조화와 계절감 넘치는 깊은 맛을 선사하는 프리미엄 베이커리와 브런치를 즐길 수 있다. 모토로 삼고 있는 '작은 차이의 미학'을 살리기 위해 항상 제철 재료를 우선하며 방문할 때마다 계절에 맞는 음식을 즐길 수 있다. 
※반려동물 동반 불가",
본다빈치뮤지엄 군산,2789996,인문(문화/예술/역사),문화시설,전시관,,전북특별자치도,126.6898129143,35.9541071421,"본다빈치뮤지엄 군산에서는 빈센트 반 고흐와 관련된 전시를 개최하는 뮤지엄으로 <반 고흐 빌리지 展> 는 후기 인상파 화가, 고흐의 작품을 재해석한 전시를 하고 있다. 컨버전스 아트로 구현된 전시관은 총 10개의 전시관으로 구성되어 있으며, <반고흐 빌리지 展>은 명화가 향유한 아름다움을 오감을 통해 느낄 수 있는 전시로 예술적 감성을 풍요롭게 채워준다.<br>","<a href=""http://salondemonet.co.kr/""target=""_blank"" title=""새창 : 홈페이지로이동"">http://salondemonet.co.kr/</a>"
본동복어,2679339,음식,음식점,한식,http://tong.visitkorea.or.kr/cms/resource/07/2677807_image2_1.jpg,경상북도,128.5020038799,36.571910653,자연의 맛을 느끼고 시원한 복어탕을 맛볼 수 있는 곳이다. 경상북도 안동시에 있는 한식전문점이다. 대표메뉴는 복어탕이다.,
본때감자탕,2686852,음식,음식점,한식,,강원특별자치도,127.2155779259,38.2109139718,"본때 감자탕은 강원도 철원군 금학로에 있는 감자탕 전문 모범음식점이다. 주차시설과 놀이시설이 잘 갖추어져 있어 가족들이 찾기에 좋은 곳이다. 추천 메뉴로는 감자탕, 본때 뼈 찜, 뼈다귀해장국, 해물 뼈 찜이며 뼈다귀해장국의 경우 저렴하면서도 맛있고 푸짐하게 제공되고 있다. 가게 휴무일은 매주 일요일이며 전화를 통한 예약도 가능하므로 참고하는 것이 좋다. (출처 : 강원도청)",
본수원갈비,602854,음식,음식점,한식,,경기도,127.0406068312,37.2779138428,50년이 넘는 역사의 본수원갈비는 수원 3대 갈비 맛집으로 손꼽히는 곳이다. 고기 본연의 맛을 즐길 수 있는 생갈비와 감칠맛이 살아 있는 양념갈비 중 골라서 주문할 수 있다.,
본스테이크,2893795,음식,음식점,서양식,http://tong.visitkorea.or.kr/cms/resource/86/2893786_image2_1.jpg,경기도,127.1916602271,37.5565648019,"본스테이크는 하남시 풍산동에 있는 이태리식 레스토랑이다. 주차는 식당 앞에 할 수 있으나 공간이 넉넉하지 않아 대중교통 이용을 권장한다. 대중교통 이용 시 지하철 5호선 미사역에서 약 800m 거리이다. 내부는 넓고 전선이 노출된 높은 천정의 등이나 분위기가 현대적이고 감각적이다. 대표 메뉴는 스테이크인데 부위별로 스테이크의 맛과 가격이 달라 합리적이다. 분위기 좋은 곳에서 고기 요리를 먹고 싶을 때 추천할 만한 곳으로 스테이크 외에도 각종 파스타와 피자, 샐러드가 있고 다양한 음료와 맥주, 와인도 있다.",
본신계곡,127047,자연,자연관광지,계곡,,경상북도,129.2706660199,36.7670140971,"수하계곡, 울련산을 옆에 두고 있는 본신계곡은 울진군 온정면 백암온천으로 가는 길목에 펼쳐져 있으며 계곡 길이가 6km에 달한다. 울창한 숲과 즐비한 기암괴석, 그 위로 흐르는 옥계수가 한 폭의 산수화를 연상케하고, 사시사철 언제 찾아가도 절경을 맛볼 수 있다. 무더운 여름철이나 눈 쌓인 겨울철에는 그 즐거움을 더해주는 곳으로 경북 내륙지방을 동해로 이어주는 길목 역할도 하고 있어 그대로 차를 몰아 울진으로 가면 푸른 바다가 눈앞에 펼쳐진다.
새싹 돋는 봄엔 막 피어나는 꽃봉오리로, 무더운 여름철엔 땀을 씻어주는 피서지로, 결실의 가을엔 만산호엽 화려한 단풍으로, 눈 내린 겨울철엔 셔터를 누르고 싶은 절경으로, 본신계곡은 일 년 내내 옷을 갈아입으며 동해바다로 가는 사람들의 발걸음을 잡는다.
인근 금강소나무생태경영림과 반딧불이 생태공원, 검마산자연휴양림이 있어 피톤치드가 뿜어져 나오는 울창한 숲 속의 삼림욕과 자연과 하나 되는 생태체험도 즐길 수 있다.","영양 문화관광 <a href=""https://www.yyg.go.kr/tour/attractions/nature_tour/bonsinvalley"" target=""_blank"" title=""새창: 영양 문화관광으로 이동"">https://www.yyg.go.kr/tour</a>"
본심오향족발,2687891,음식,음식점,한식,http://tong.visitkorea.or.kr/cms/resource/29/2701329_image2_1.jpg,강원특별자치도,127.9740350786,37.3198482398,본심오향족발은 원주에 위치한 족발·보쌈 전문점이다. 누린내가 적고 쫄깃하면서도 부드러운 족발을 한번 맛본 사람들은 계속 찾게 된다.,"<a href=""https://bonesim0810.modoo.at"" target=""_blank"" title=""새창 : 본심오향족발 홈페이지로 이동"">https://bonesim0810.modoo.at</a>"
본앤브레드 신관,2843214,음식,음식점,한식,http://tong.visitkorea.or.kr/cms/resource/99/2843199_image2_1.jpg,서울특별시,127.044517775,37.5668442852,"본앤브레드는 한우 오마카세 전문점으로 유명하며, 미쉐린 가이드 서울 2022, 2023에 랭크된 음식점이다. 대한민국 한우 오마카세의 시발점인 본앤브레드는 최상급 한우만을 사용하며, 구이를 비롯한 다채로운 요리를 다양한 방식으로 즐길 수 있다. 세련되고 클래식한 느낌을 주는 본앤브레드는 총 3개의 층으로 구성되어 있는데, 한우 맡김차림은 특별한 공간인 지하 1층에서 진행하고 있며, 2층과 3층에서는 캐주얼 다이닝과 프라이빗 룸 다이닝을 진행하고 있다.","<a href=""http://bandb.co.kr/""target=""_blank"" title=""새창 : 본앤브레드 사이트로 이동"">http://bandb.co.kr/</a>"
본원정사(서울),316294,인문(문화/예술/역사),역사관광지,사찰,http://tong.visitkorea.or.kr/cms/resource/35/2356735_image2_1.jpg,서울특별시,127.0052887931,37.6372881685,"본원정사(本願精舍)는 서울특별시 강북구 수유동 삼각산에 자리한 대한불교조계종 대각회 소속의 사찰이다. 지장보살은 석가모니 부처님과 미륵불 사이인 부처님 없는 시대에 중생들을 교화하는 대비보살이다. 특히 지옥에서 고통 받는 중생들을 구원하기 위해 지옥에 들어가 교화해 제도하는 보살로 널리 알려져 있다. 《지장보살본원경》에는 지장보살이 석가모니 부처님에게 한 서약의 내용이 있다. 즉 “지옥이 텅 비지 않는다면 결코 성불을 서두르지 않겠나이다. 그리하여 육도의 중생이 다 제도되면 깨달음(菩提)을 이루리다.” 이는‘한시바삐 성불하여 부처님과 같은 거룩한 모습을 갖추겠다’는 것이 아니라, 미래의 세상이 다할 때까지 고통 받는 중생을 구제하고 그들을 남김없이 해탈케 한 다음 부처가 되겠다는 것이다.<br />이러한 지장보살의 서원은 서원(誓願) 중의 서원, 가장 근본이 되는 원으로 모든 보살과 부처가 존재할 수 있는 근거가 되는 본원(本願)인 것이다. 삼각산 아래의 본원정사에는 한국전쟁 때 태고사에 불이 나서 옮겨왔다고 전하는 목조지장보살좌상이 봉안되어 있다. 1980년대 초 주지소임을 맡은 원성스님은 이 지장보살상에 감화를 받아 지장보살의 본원을 따르고자 서원을 하였다고 한다. 그래서 절 이름도 본원정사로 바꾸었다. 이후 본원정사를 사바세계 중생들의 몸과 마음의 병을 다스릴 수 있는 도량으로 만들어 가고 있다. 또한 언제나 열려있는 도량으로 서울시민과 불자들에게 번잡한 마음을 쉴 수 있게 하고, 기도할 수 있는 도량으로 본원정사를 장엄하고 있다.<br>",
본적사지3층석탑,2702610,인문(문화/예술/역사),건축/조형물,기념탑/기념비/전망대,,강원특별자치도,128.977129912,37.1744951022,"2000년 강원도 문화재자료로 지정된 ‘본적사지3층석탑’은 신라시대 때 만들어진 3층 규모의 석탑 유적건조물이다. 석탑재들을 태백석탄박물관에 보관하다가 2012년 본적사지 역사공원을 조성하여 ‘본적사지3층석탑’을 복원해 놓았다. 현재 남아있는 부재는 완전하지는 않다. ‘본적사지’는 번적사지라고도 불리는데, 태백시의 서쪽 경계를 이루는 해발 1,573m의 함백산 동쪽 산기슭에 위치한다. 절골 유원지로 들어가는 입구의 다리를 지나 민가들이 들어서 있는 일대가 절터인데, 절골이라는 명칭은 이곳에 절이 많이 있었던 데서 유래한다. 현재에는 황지동에 위치한 본적사지 역사공원에 복원하여 소재하고 있다.","<a href=""https://tour.taebaek.go.kr/tour/go/go_culture?cid=8046&mode=read""target=""_blank"" title=""태백 문화관광"">http://tour.taebaek.go.kr</a>"
본적산 황부자 며느리 친정가는길,2610066,레포츠,육상 레포츠,트래킹,http://tong.visitkorea.or.kr/cms/resource/63/2610063_image2_1.bmp,강원특별자치도,128.9880567883,37.1720067101,"낙동강 1,300리 발원지 황지연못의 전설에 나오는 황부자 며느리 친정집 화전터로서 며느리 친정집은 본적산 아래 연화봉이 바라 보이는 양지바른 곳에 자리 잡고 화전을 일구고, 산약초 등을 캐며 살았다고 전해 내려오고 있으며, 전설 내용을 근거로 옹달샘, 헛간, 곳간, 은동이 집, 나무그네, 나무더미 등 그때 그 시절의 생활상을 복원한 곳이다.태백역을 시작으로 왕복 8km, 약4시간 걸리는 코스로 렛츠코레일에서 '대한민국 2017년 봄 걷기 좋은 길 3선'에 지정될 만큼 많은 관광객들의 사랑을 받는 둘레길이다.","태백시 문화관광 <a href=""http://tour.taebaek.go.kr"" target=""_blank"" title=""새창: 태백시 문화관광 "">http://tour.taebaek.go.kr</a>"
