title,contentid,cat1,cat2,cat3,firstimage,region,mapx,mapy,overview,homepage
단촌서원고택 [한국관광 품질인증/Korea Quality],2594513,숙박,숙박시설,한옥,http://tong.visitkorea.or.kr/cms/resource/61/3021661_image2_1.jpg,충청북도,128.3352223243,36.9295138086,Unknown,Unknown
단편,3014502,음식,음식점,카페/전통찻집,http://tong.visitkorea.or.kr/cms/resource/01/3014501_image2_1.jpg,전라남도,127.3102419132,35.2755059415,"창밖으로 보이는 풍경이 마치 갤러리에 온듯한 느낌을 주는 미니멀한 화이트 톤 인테리어의 카페이다. 하얀 테이블 위에 소담하게 꽂혀있는 생화들이 무심한 듯 예뻐서 자꾸 눈길이 가는 화려하지는 않지만 소박해서 편안한 카페이다. 손질이 잘된 야외 공간에도 음료를 즐길 수 있는 공간이 마련되어 있다. 직접 재배한 무농약 쌀과 재료들을 이용한 떡과 직접 담은 수제청을 이용한 과일차와 에이드를 제공하며 특히 크림치즈 인절미와 소금빵이 유명하다. 맛이 인위적이지 않고 담백한 맛이라 단맛을 싫어하는 사람의 입맛에도 적당하다. 병에 담아 판매하는 밀크티도 호평을 받고 있다. 
프라이빗룸도 있어 가족단위 방문객이 편안하게 이용할 수 있다. 답례떡, 케이크 등은 3일 전 예약 주문도 가능하다.",
단풍나무,2840981,음식,음식점,한식,http://tong.visitkorea.or.kr/cms/resource/73/2840973_image2_1.jpg,인천광역시,126.6447867414,37.5965948044,"단풍나무는 인천 서구 왕길역 인근에 위치한 한식당으로, 개인의 30년 전통 비법으로 육개장을 만들어 판매하고 있다. 메뉴 주문 시 밑반찬으로는 묵무침, 동치미, 짠무, 샐러드, 상추, 소금, 마늘, 쌈장 등이 준비되며 추가 반찬은 셀프바를 이용하여 원하는 만큼 가져다 먹을 수 있다. 육개장은 점심메뉴로 인기가 가장 많다. 파가 가득 들어가져 있어 진하고 칼칼하며 시원한 맛을 느낄 수 있다. 저녁시간에는 오리로스와 오리 주물럭이 인기가 가장 많다. 돌판에 구워진 오리고기는 더욱 부드럽고 맛이 좋다. 오리주물럭을 다 먹고 난 후 먹는 볶음밥이 이 식당의 필수 코스다.",
단풍나무,2859698,음식,음식점,한식,http://tong.visitkorea.or.kr/cms/resource/85/2859685_image2_1.jpg,충청북도,127.4415531581,36.6075732844,"단풍나무는 충청북도 청주시 서원구 죽림동에 있다. 현대적인 감각이 돋보이는 외관과 세련된 분위기를 연출하는 인테리어가 눈에 띈다. 내부에는 단체석이 마련되어 있어 각종 모임을 하기 좋다. 대표 메뉴는 돼지석갈비이며, 돼지 매운 석갈비, 소석갈비, 소 매운 석갈비 등도 판다. 기본 반찬이 푸짐하고 가짓수가 많아 만족도가 높다. 이 외에 냉면과 소면을 식사류로 맛볼 수 있다.",
단풍산,127305,자연,자연관광지,산,,강원특별자치도,128.7195484723,37.1380998941,"단풍산은 강원도 영월군에 있는 해발 1150m의 높이의 산으로 남쪽은 절벽으로 이루어져 있어 조망이 매우 뛰어나고 아름다운 풍광을 간직한 산이다. 단풍이 특히 아름다운 산이지만 봄에는 진달래와 개나리가 피어나고, 여름에는 싱그러운 숲과 계곡을 즐길 수 있으며, 겨울에는 하얀 눈과 얼음 동굴을 볼 수 있는 사계절 내내 다양한 매력을 보여주는 산이기도 하다.
설악산, 주왕산, 오대산 등의 장점을 모두 갖춘 단풍산은 장중함과 기암절벽 그리고 계곡미가 뛰어나다. 단풍산이 있는 산솔면은 전국 최대 조림지로 편백나무와 낙엽송 등이 무성하게 자라고 있다. 
주변 관광지로는 단풍산 정상에서 바라보는 한반도의 모양을 닮은 선암마을, 단풍산 정상에서 내려오는 길에 있는 기암절벽의 선돌, 단종이 유배되었던 청령포와 단종의 유배생활을 알 수 있는 박물관과 유적지 등이 있다.","<a href=""http://www.grandculture.net/yeongwol/search/GC08300120?keyword=%EB%8B%A8%ED%92%8D%EC%82%B0&page=1"" target=""_blank"" title=""새창 : 홈페이지로 이동"">http://www.grandculture.net</a>"
단하,2946235,쇼핑,쇼핑,전문매장/상가,http://tong.visitkorea.or.kr/cms/resource/68/2947568_image2_1.jpg,서울특별시,126.9809508653,37.5837550672,"‘단하’ 매장은 2018년도에 김단하 디자이너가 론칭한 브랜드이며 전통에서 유래한 문양과 소재, 복식을 활용하여 한국적 아이덴티티를 패션으로 전개하는 곳이다. 또한 전통과 현대를 아우르는 디자인으로 특별한 날 뿐만 아니라 일상에서도 누구나 착용할 수 있다. 소재는 친환경 소재의 원단을 사용하는 것을 지향하고 있고  또한 입던 한복이나 폐 웨딩드레스를 해체 및 재가공하여 더욱 가치 있는 옷으로 재탄생시키는 작업도 진행하고 있다. 매장의 한복 구매는 매장방문 또는 온라인 쇼핑몰을 통해서 구입이 가능하며 맞춤제작 한복을 원할 경우 미리 예약 후 방문하면 된다. 그리고 이곳은 2020년도 발매된 블랙핑크의 ‘HOW YOU LIKE THAT’ 뮤직비디오 촬영 의상을 제작한 곳이다. 전통 한복을 개량하였고 특히 ‘봉황문인문보’ 문양을 활용하여 무대의상으로 완벽히 재탄생시킨 곳이다.","<a href=""https://danhaseoul.com/""target=""_blank"" title=""새창 : 업체홈페이지 이동"">https://danhaseoul.com/</a>"
단향해장국,2670658,음식,음식점,한식,http://tong.visitkorea.or.kr/cms/resource/23/2670723_image2_1.jpg,경상북도,128.7329557789,36.564946338,Unknown,Unknown
단호박올리고마을,802241,인문(문화/예술/역사),체험관광지,농.산.어촌 체험,http://tong.visitkorea.or.kr/cms/resource/48/2518348_image2_1.jpg,충청남도,126.7396113552,36.8936890518,충남 북부 해안에 접해있는 단호박올리고마을은 서해안 고속도로 충남의 관문에 위치하고 있다. 장엄한 서해대교를 건너 우측으로 삽교호 관광지를 거쳐 당진 방면으로 가다 보면 신평면 소재지 인근에 자리 잡고 있다. 마을 특산품인 단호박은 토심 깊은 황토에서 해풍을 맞으며 커서 당도가 높으며 국내시장은 물론 해외시장에서도 호평을 받고 있다.,
단호사(충주),299977,인문(문화/예술/역사),역사관광지,사찰,http://tong.visitkorea.or.kr/cms/resource/33/3061833_image2_1.jpg,충청북도,127.9009357544,36.9467593263,"충주 단호사는 한국불교 태고종의 말사로 조선 후기 숙종 때 중건한 사찰이다. 중건 당시 ‘약사’라 하였고, 1954년 단호사로 개칭하여 현재에 이르고 있다. 
현존하는 당우로는 3칸의 맞배집인 대웅전과 약사전, 용왕전, 요사채 등이 있다. 약사전 내에는 1976년 보물로 지정된 철불여래좌상이 봉안되어 있다. 11세기 조성된 것으로 추정되는 불상으로 고려 시대 철불의 귀중한 유품이며, 지역적인 유파성을 연구하는 데 도움이 된다. 이 외에도 충주 단호사 삼층석탑, 충청북도 유형문화재인 관세음보살좌상, 미륵불입상 등 다양한 문화재를 만나 볼 수 있다. 
단호사에서는 매월 첫째와 셋째 일요일, 초하루와 보름 때에 정기 법회가 열리고 있다.","<a href=""https://www.chungju.go.kr/tour/contents.do?key=1195"" target=""_blank"" title=""새창 : 홈페이지로 이동"">https://www.chungju.go.kr/</a>"
단호샌드파크캠핑장,2728589,레포츠,육상 레포츠,"야영장,오토캠핑장",http://tong.visitkorea.or.kr/cms/resource/85/3415885_image2_1.jpeg,경상북도,128.6303151605,36.555745457,"단호샌드파크 캠핑장은 경북 안동시 남후면에 자리하고 있다. 안동 시청을 기점으로 14㎞가량 떨어져 있다. 자동차에 몸을 싣고 강남로, 남 순환로, 남일로, 풍산 단호로를 번갈아 달리면 닿는다. 도착까지 걸리는 시간은 25분 안팎이다. 수려한 경관을 자랑하는 낙동강에 터를 잡고 있어, 사계절을 달리해 변신하는 낙동강의 풍광을 벗 삼아 캠핑을 즐기려는 이들의 발길이 끊이지 않는다. 캠핑장은 일반 야영장 8면, 자동차 야영장 2면, 글램핑 2개 동, 카라반 15대로 구성돼 있다. 일반 야영장 바닥은 모두 데크로 이뤄졌으며, 사이트 크기는 가로 3.6m , 세로 5m이다. 자동차 야영장은 파쇄석으로 되어 있는데, 이 구역만 개인 트레일러와 카라반 동반 입장이 가능하다. 카라반 객실 내부는 일상생활이 가능할 정도의 물품과 시설을 갖췄다. 캠핑장은 연중 문을 연다. 캠핑장 인근에 안동 하회마을, 안동 병산서원 등의 관광지가 있어 연계 여행이 순조롭다. 또한 주변에 음식점도 다양하여 식도락의 즐거움도 누릴 수 있다.","<a href=""https://www.danhosand.or.kr:1002/coding/main.asp"" target=""_blank"" title=""새창 : 단호샌드파크캠핑장 사이트로 이동"">https://www.danhosand.or.kr:1002/coding/main.asp</a>"
달 카페,1018855,음식,음식점,카페/전통찻집,,서울특별시,126.9820479855,37.5838328553,서울 종로구 삼청동에 위치한 카페 ＂달＂은 한옥카페이다. 고즈넉한 한옥 인테리어로 왼쪽 벽면에는 진짜 달이 떠있는 것처럼 조명 처리가 되어 있어 감성적인 사진을 남기기 좋다. 대표 메뉴는 전통 항아리 빙수로 한옥과 어우러지며 빙수를 굵은 얼음으로 제공하여 옛날에 먹던 빙수와 같은 느낌을 받을 수 있다. 한옥의 정취 속에서 항아리 빙수와 함께 이색적인 분위기를 느끼고 싶다면 이곳을 추천한다.,
달(月)달(月)한 남원여행,2786990,추천코스,힐링코스,힐링코스,http://tong.visitkorea.or.kr/cms/resource/03/1604103_image2_1.jpg,전라북도,127.3795324998,35.4033260295,이번 여행은 사랑1번지 남원시에서의 '치유와 힐링' 여행이다. 맵고 달고 짠 우리의 일상 음식이 아닌 허브요리로 시작하 이번 코스는 관광지 내내 아름다움과 향기로움을 머금고 있다. 남원 곳곳 낭만이 가득한 명소를 체험하고 자전거 여행을 통해 감성을 더하는 이름부터 '달(月)달(月)한' 남원여행을 즐겨보자!,
"달,커피",2923906,음식,음식점,카페/전통찻집,http://tong.visitkorea.or.kr/cms/resource/91/2923891_image2_1.jpg,전라남도,127.5636549138,34.7623597069,Unknown,Unknown
달103,2872246,음식,음식점,카페/전통찻집,http://tong.visitkorea.or.kr/cms/resource/41/2872241_image2_1.jpeg,경기도,127.1169917067,37.5676788276,"달103은 구리시 아천동, 구리 시민공원 건너편에 있는 전망 좋은 카페이다. 주차는 건물 앞쪽 세 군데 커다란 주차장이 있어 주차하기 편리하다. 카페만 있는 단독 건물이고 건물 한쪽 벽면에 커다랗게 달 모양이 그려져 있다. 1층에서 주문하고 실내 2층이나 루프탑을 이용할 수 있고 야외에 캠핑 존, 피크닉 존, 데크 존, 윈드월 존, 가든 존 등의 테마별로 구분된 자리와 자연 곳곳의 좌석을 이용할 수 있다. 담요와 캠핑 난로가 준비되어 있어 상시 야외 좌석을 이용할 수 있다. 한강과 아차산을 바라보며 차와 디저트를 즐길 수 있는 전망 좋은 카페이다.
 ※반려동물 동반 가능",
달[한국관광 품질인증/Korea Quality],2652937,숙박,숙박시설,게스트하우스,http://tong.visitkorea.or.kr/cms/resource/35/2652935_image2_1.jpg,전북특별자치도,126.7071910901,35.9860399047,"전북 군산 근대문화유산거리 중심에 자리한 ‘달’은 오래된 주택을 개조한 게스트하우스다. 1인 여행자를 위한 도미토리룸부터 커플, 가족, 단체가 이용하기 좋은 독립룸까지 다양한 객실로 구성되어 있다. 독립룸에는 TV와 욕실이 있다. 1층 카페에서 오전에 샌드위치, 과일, 커피 등을 무료 제공하고, 2층에는 공용 주방이 있다. 도보 2~3분 거리에 군산 신흥동 일본식 가옥, 동국사, 초원사진관 등이 있어 여행에 편리하다.",http://www.gunsandal.kr
달강,1365261,숙박,숙박시설,펜션,,경상남도,127.991212766,35.1596670017,Unknown,Unknown
달개비,2907343,음식,음식점,한식,http://tong.visitkorea.or.kr/cms/resource/37/2907337_image2_1.jpg,경상북도,129.2502587267,35.8414215549,"달개비는 경상북도 경주시 보문동에 있다. 한옥으로 지어진 덕분에 외관에서 고풍스러운 멋이 풍긴다. 예스러운 분위기를 연출하는 인테리어도 눈에 띈다. 내부에는 단체석이 있어 각종 모임을 하기 좋다. 대표 메뉴는 꼬막돌솥정식이며, 매콤짜글눈꽃치즈도 인기가 많다. 이 밖에 곤드레돌솥정식, 전복영양돌솥정식, 홍합돌솥정식 등 여러 돌솥밥 메뉴가 준비되어 있다. 경주 IC에서 가깝고, 주변에 보문관광단지와 경주동궁원이 있다.","<a href=""http://instagram.com/dalgaebi__""target=""_blank"" title=""새창 : 달개비 사이트로 이동"">http://instagram.com/dalgaebi__</a>"
달거니해장국 본점,2850494,음식,음식점,한식,http://tong.visitkorea.or.kr/cms/resource/80/2850480_image2_1.jpg,충청북도,127.6673574571,37.1173770608,"달거니해장국 본점은 충청북도 음성군 감곡면 오궁리에 있다. 외관과 인테리어는 깔끔한 분위기다. 내부에는 단체석이 마련되어 있어 각종 모임을 하기 좋다. 이른 아침부터 영업을 시작하기 때문에 아침 식사를 하기 좋다. 대표 메뉴는 신선한 국내산 선지를 넣어 만든 선지해장국이다. 정성껏 손질한 양과 곱창이 듬뿍 들어간 내장탕도 인기가 많다. 이 밖에 우거지 해장국, 차돌박이 해장국, 갈비 해장국, 곱창 순두부 등도 판다. 감곡 IC에서 가깝고, 인근에 수레의산자연휴양림, 돼지박물관, 철박물관이 있다.",
달고개모시마을,605616,인문(문화/예술/역사),체험관광지,농.산.어촌 체험,http://tong.visitkorea.or.kr/cms/resource/46/3043846_image2_1.jpg,충청남도,126.8213260294,36.0657577589,"서천 한산 지역은 1,500여 년 전 백제시대부터 우리의 전통 옷감인 모시를 재배하여 지역 특산물로 내세워 왔다. 달고개모시마을은 이러한 모시를 주제로 체험 프로그램을 진행하는 농촌 마을이다.
이곳에서는 전통 테마관 건물을 중심으로 체험 프로그램을 진행하고 있다. 마을에는 모시 짜기 기능보유자가 많아 귀중한 우리의 전통 모시를 다양하게 체험할 수 있다. 방문객들은 모시풀을 베는 모시매기, 모시 짜기 등 모시 제작 과정을 체험할 수 있다. 그리고 모시송편, 모시차, 모시빵, 모시한과 등 모시를 넣어 만든 음식도 이 마을의 자랑거리이다. 모시 외에도 금강 변에 넓게 형성된 평야에서 생산된 쌀도 이 마을에서 빼놓을 수 없다.
이 마을 주변에는 한산모시관, 한산소곡주 양조장, 한산향교, 건지산성, 한산 오일장, 신성리 갈대밭 등이 있다.","▪ <a href=""https://tour.seocheon.go.kr/tour/sub03_03.do"" target=""_blank"" title=""새창 : 홈페이지로 이동"">https://tour.seocheon.go.kr</a>"
달곡캠프,2749851,레포츠,육상 레포츠,"야영장,오토캠핑장",http://tong.visitkorea.or.kr/cms/resource/24/2750124_image2_1.jpg,울산광역시,129.4200199249,35.6095564464,"달곡캠프는 울산 북구에 있으며 10개의 사이트를 가지고 있는 작고 아담한 캠핑장이다. 캠핑장은 고즈넉한 야산에 있어 공기 좋고 조용하며 한가롭다. 캠핑장이 잔디로 되어 있어 안전하게 뛰어다니며 놀 수 있다. 캠핑장에는 어린이를 위한 공간이 있는데 장난감과 책들이 비치되어 있고 저녁이면 애니메이션을 상영해 준다. 샤워실과 개수대는 깨끗하게 정리정돈이 잘 되어 있고 24시간 온수가 나와 사용하기 편리하다. 캠핑장 뒤로는 달곡저수지가 있어 낚시체험도 하며, 옆으로 솔숲 산책로가 있어 산책도 즐길 수 있다. 캠핑장 주변에는 매실나무, 앵두나무, 감나무 등 여러 과실수가 있어 어린이들이 직접 손으로 따보는 체험도 할 수 있다. 캠핑장 입실은 오후 1시이며 퇴실은 1시 30분이다. 입실이 없으면 2시 30분까지 연장도 가능하다.","<a href=""http://cafe.naver.com/dgcamp/"" target=""_blank"" title=""새창 : 달곡캠프 사이트로 이동"">http://cafe.naver.com/dgcamp/</a>"
달과별캠핑장,2757196,레포츠,육상 레포츠,"야영장,오토캠핑장",http://tong.visitkorea.or.kr/cms/resource/80/2757480_image2_1.JPG,강원특별자치도,128.8108860297,37.0951954566,"달과 별 캠핑장은 강원도 영월에 있는 캠핑장으로 30여 개의 사이트로 이뤄져 있다. 바닥은 파쇄석으로, 사이트 간격이 넓은 편이고, 사이에 나무가 있다. 바로 옆 계곡에는 가재가 살고 있고, 조금 걸어 올라가면 높이 4미터의 아담한 폭포도 있는 산골 캠핑장이다. 덕분에 조용하고 한적하며, 대신 인근에는 별다른 가게나 편의시설이 없어 미리 장을 봐서 들어오는 것이 좋다. 밤이면 무수한 별을 볼 수 있어 캠핑의 정취를 한껏 느낄 수 있는 숨은 명소이다.","<a href=""http://cafe.naver.com/moonstarcamping"" target=""_blank"" title=""새창 : 달과별캠핑장 사이트로 이동"">http://cafe.naver.com/moonstarcamping</a>"
달구벌뭉티기,2760005,음식,음식점,한식,http://tong.visitkorea.or.kr/cms/resource/13/2760313_image2_1.JPG,경기도,127.1208243021,37.3855167029,Unknown,Unknown
달구벌승마공원,3009817,레포츠,육상 레포츠,승마,http://tong.visitkorea.or.kr/cms/resource/05/3009805_image2_1.jpg,대구광역시,128.4964125449,35.7885357172,"달구벌승마공원은 대구 달성군 화원읍 사문진 나루터 인근에 위치하며 대구에서는 최초의 사설 승마장이다.
실내외 승마 시설을 갖추고 있어 날씨에 크게 구애 받지 않고 승마를 즐길 수 있으며 아동들에게는 먹이체험, 다양한 동물(공작새,오리,염소,닭,토끼)과 교감하기,실외놀이터(미끄럼,나무 그네)에서 뛰면서 놀기가 가능한 가족 나들이 승마체험 공간이다.
이곳 달구벌승마장에서는 승마를 하면서 얻어지는 장점으로 말과 교감을 통해  정서적인 안정감과 감정 인지 능력,감정 조절 능력의 향상,집중력과 판단력 및 균형감각,반사신경의 강화 더 나아가 심폐기능이 강화되며 성장기 아동들에게는 자세교정과 함께 성장판 자극을 통한 신체발달에 크게 기여한다고 안내하고 있다.","<a href=""https://m.blog.naver.com/dghorse"" target=""_blank"" title=""새창 : 홈페이지로 이동"">https://m.blog.naver.com/dghorse</a>"
달궁계곡,126268,자연,자연관광지,계곡,http://tong.visitkorea.or.kr/cms/resource/14/3067914_image2_1.jpg,전북특별자치도,127.5759326655,35.3709025582,"지리산 달궁계곡은 반야봉, 노고단, 만복대, 고리봉, 덕두봉 등의 고산준령에 둘러싸인 달궁마을에서 심원까지 6km에 걸쳐 흐르며, 지리산국립공원에 있는 계곡 가운데 전라북도를 대표하는 계곡 중 하나이다. 반야봉 아래 중봉 조금 못 미친 삼거리에서 오른쪽 길을 따라가면 심원계곡이 나오고 심원계곡을 따라 하산하면 심원마을에서 다시 달궁계곡의 끝부분과 만날 수 있다. 
지리산 달궁계곡에는 하늘을 가릴 만큼 무성한 원시림에 짙은 이끼 내음은 사람의 손길이 미치지 않은 심산의 계곡미를 한껏 보여 준다. 계곡의 물은 차고 맑으며 소와 절벽, 반석 등 각종 경관 등이 어우러지면서 안심소, 칠선대, 청룡소, 쟁반소와 같은 포트홀이나 폭포가 발달해 있다. 가만히 계곡 물소리만 듣고 있어도 온몸으로 시원함을 느낄 수 있고, 민박, 펜션 등이 몰려 있어 관광객들이 주로 찾는 전라북도 대표 여름 휴가지다.","<a href=""https://tour.jb.go.kr/travel/info/view.do?category_top_id=a&menuCd=DOM_000000102003001000&contentsSid=37&ctnt_id=21281"" target=""_blank"" title=""전라북도 문화관광으로 이동"">https://tour.jb.go.kr/index.do</a>"
달궁자동차야영장,2728600,레포츠,육상 레포츠,"야영장,오토캠핑장",http://tong.visitkorea.or.kr/cms/resource/33/2728733_image2_1.JPG,전북특별자치도,127.5578735716,35.3546040835,"달궁 자동차 야영장은 지리산국립공원이 관리하는 야영장 중 대표적인 곳으로 꼽히는 곳이다. 모두 400동 정도 텐트를 수용할 수 있는 규모를 자랑한다. 달궁 마을과 달궁계곡에 위치하고 있어 달궁계곡 오토캠핑장으로 불리기도 한다. 오토캠핑장이니만큼 자동차를 주차하고 바로 옆에 텐트를 칠 수도 있고, 텐트만 칠 수도 있다. 달궁 마을은 삼한시대에 온조왕의 백제 세력과 변한·진한에 쫓긴 마한의 효왕이 지리산으로 들어와 쌓은 피란 도성이 있던 곳으로, 지금도 달궁 마을의 주차장 바로 아래 궁터가 남아 있다. 반야봉 좌우에는 황령(黃嶺)과 정령(鄭嶺)이 있는데, 마한의 왕이 진한과 변한에 쫓겨 지리산으로 들어와 도성을 쌓을 때 황 장군과 정 장군이 왕의 명을 받아 이 일을 진행했고, 성이 완성되자 도성을 에워싼 고개의 이름을 두 장수의 성(姓)을 따서 각각 황령·정령으로 지었다고 한다.","<a href=""https://reservation.knps.or.kr/contents/C/serviceGuide.do?prdDvcd=C&parkId=B01&deptId=B012002"" target=""_blank"" title=""새창 : 달궁자동차야영장 사이트로 이동"">https://reservation.knps.or.kr</a>"
달궁힐링야영장,2749861,레포츠,육상 레포츠,"야영장,오토캠핑장",http://tong.visitkorea.or.kr/cms/resource/29/2750129_image2_1.jpg,전북특별자치도,127.5555488451,35.3519848942,"달궁힐링야영장은 지리산 달궁계곡을 끼고 있는 캠핑장으로 달궁자동차야영장과 도로를 사이에 두고 100m가량 떨어져 있다. 오토캠핑장과 달리 주차장과 야영장이 분리되어 있어 차량 진입이 불가능하고 직접 짐을 날라야 하지만 수레가 비치되어 있어 비교적 수월하게 옮길 수 있다. 이곳은 2017년 7월부터 전면 예약제로 바뀌어 사전에 예약해야만 이용할 수가 있는데 주차 시 주차비를 따로 내야 한다. 캠핑요금은 비수기 5,000원, 성수기 7,000원 이다. 전기는 들어오지 않는다.  북부지리산국립공원  5곳의 야영장 중에 가장 고지대에 위치한 달궁힐링야영장은 해발 560여 m나 되는 고도로 인해 한여름에도 더위를 느끼기 힘들다. 기온이 낮아 모기가 거의 없다는 장점이 있다.","<a href=""https://reservation.knps.or.kr/contents/C/serviceGuide.do?prdDvcd=C&parkId=B01&deptId=B012005"" target=""_blank"" title=""새창 : 국립공원공단 예약시스템 홈페이지로 이동"">https://reservation.knps.or.kr/</a>"
달기약수닭백숙해성,134560,음식,음식점,한식,,경상북도,129.0713932678,36.4416306914,청송의 대표적인 먹거리 중의 하나가 바로 ‘달기약수닭백숙’이다. 철분 함량이 높은 청송 달기약수로 푹 곤 닭백숙은 위장병에 효험이 있다 하여 더 유명한데 그 맛도 일품이다. 지방 성분을 제거하는데 탁월하다는 달기약수 때문인지 육질에서 느껴지는 담백함도 대단하지만 미숫가루를 탄 듯한 연한 갈색의 국물이 아주 담백하고 구수하다. 주왕산을 오르는 여행객들이 ‘달기약수 닭백숙’을 두고 흔히 하는 말이다. ‘주왕산도 식후경’,
달기약수촌,135268,음식,음식점,한식,http://tong.visitkorea.or.kr/cms/resource/20/688120_image2_1.jpg,경상북도,129.08719195,36.4389201899,Unknown,Unknown
달기약수탕 (청송 국가지질공원),126111,자연,자연관광지,약수터,,경상북도,129.0836033947,36.4383590741,"달기약수탕은 지금으로부터 약 130년 전 수로공사를 하던 중 발견되었다. 톡톡 튀는 맛을 내는 탄산을 비롯하여 다양한 물질들이 녹아 있어 예로부터 위장병, 부인병, 안질과 같은 질병 치료에 효과가 있다고 알려져 왔다.
옛 지명이 청송군 부내면 달기동이라 달기약수라 불리게 되었다. 상탕, 중탕 원탕 등 5~6곳에 약수가 나며 인근에 30여 군에 식당가가 형성되어 성업 중이다. 약수가 신비롭다고 해서 매년 음력 3월 말에는 '달기약수령천제'를 올려 약수전에 감사하는 행사가 있다.","<a href=""https://csgeop.cs.go.kr/bbs/board.php?bo_table=myeongso01&wr_id=24""target=""_blank"" title=""새창: 청송 유네스코 세계지질공원 "">https://csgeop.cs.go.kr/</a>"
