title,contentid,cat1,cat2,cat3,firstimage,region,mapx,mapy,overview,homepage
헐스밴드,2891599,음식,음식점,카페/전통찻집,http://tong.visitkorea.or.kr/cms/resource/21/2877921_image2_1.jpg,경상남도,127.8365106037,34.801204523,"헐스밴드는 남해 장항 해수욕장에 있는 오션뷰 카페다. 모던하고 세련된 외관과 초록색 산과 한가로운 논을 바라볼 수 있는 뷰로 유명해졌다. 남해 주요 관광지에서 벗어나 외곽에 자리하고 있어 바다를 따라 드라이브하며 들르기 좋다. 카페 앞의 작은 도로를 건너면 남해가 있어 바닷가를 따라 산책할 수 있다. 가을철이면 따뜻한 색감의 핑크 뮬리가 피어나기도 한다. 매장 안에는 테이블이 4~5개 정도로 작은 편이며, 봄~가을에는 창문을 열고 카페 바깥에도 좌석을 두어 운영한다. 이곳의 커피는 페루 유기농 원두를 직접 로스팅해 향이 진하고 좋아 커피 마니아 사이에서도 유명하다. 또한, 바로 화덕에서 바로 구워낸 피자도 점심 브런치 메뉴로 인기다.","<a href=""https://www.instagram.com/h_e_r_s_b_a_n_d""target=""_blank"" title=""새창 : 헐스밴드 사이트로 이동"">https://www.instagram.com/h_e_r_s_b_a_n_d</a>"
헐티재골,3060357,자연,자연관광지,산,http://tong.visitkorea.or.kr/cms/resource/80/3051980_image2_1.jpg,경상북도,128.5665496938,35.7285771171,"청도군 각북면에서 대구 가창면으로 넘어가는 여섯 개의 고개 중 가장 서쪽에 위치한 해발 535미터 ‘헐티재’는 1980년 자동차 도로가 개통되기 전 청도와 대구를 연결하는 지름길로 이용되었다.
지명 유래는 과거 조선 시대에는 이 일대를 토현[土峴]으로 표기하기도 하였는데, 이는 헐티를 흙으로 표기한 것에서 유래되었다는 이야기가 전해지기도 한다. 다른 하나는 고개가 험준하고 힘들어서 그 고개를 넘으면 숨을 헐떡이며 배가 고파 온다고 하여 헐티재라고 불리기도 한다는 이야기가 전해진다.
헐티재와 고개 일대는 소나무 군락으로 뒤덮여 있으며 봄이면 진달래, 철쭉 또는 고산 식물로 주변경관이 아름답고 포장 도로로 잘 정비되어 있어 많은 사람들이 드라이브 코스로 선호한다. 헐티재 정상은 조형물과 화단을 조성해 방문객들에게 산책과 휴식 공간을 제공한다.",
험준한 산자락에 숨은 천년고찰을 만나다,1855936,추천코스,나홀로코스,나홀로코스,http://tong.visitkorea.or.kr/cms/resource/85/592185_image2_1.jpg,Unknown,128.0045303511,36.1157424022,"김천은 큰 도시이기도 하지만, 해발 1천m가 넘는 험준한 산세를 이루고 있는 고장이다. 황악산 자락에는 아도화상이 창건한 천년고찰 직지사가 남아있고, 수도산에는 인현왕후가 폐위된 뒤 머물렀다 전해지는 청암사와 조망풍경이 아름다운 수도암이 자리 잡고 있다. 직지사 입구에는 산책하기 좋은 직지문화공원과 세계도자기박물관, 백수문학관 등도 함께 둘러보면 좋다.",
헛제사밥(맛50년),134770,음식,음식점,한식,,경상북도,128.7580865145,36.5775842581,"국내에서 크게 유행하는 헛제사밥을 상품화한 사람으로 헛제사밥의 ""원조""라고 할 수 있다. 예전엔 안동댐 민속박물관 내 야외 민속박물관(초가)에서 운영하다 2001년 집을 신축하여 현재의 자리에서 운영하고 있다. 작고하신 시어머님에 이어 현재는 며느리까지 전수받아 3대에 걸쳐 50년 이상을 식당 운영에만 전념하고 있으며, 큰 아들은 무형문화재 69호인 하회별신굿 탈놀이의 기능보유자(인간문화재)로 세계적으로 활동하고 있다.",
헛제사밥까치구멍집,403857,음식,음식점,한식,,경상북도,128.7581392846,36.577709245,"까치구멍집이라는 독특한 이름을 갖고 있는 경북 안동의 헛제사밥까치구멍집은 예전부터 양반촌이라는 이미지를 살려 대청마루가 쭉 둘러져 있어 마치 드라마 세트장이나 안동의 어느 양반집에 들어온 기분을 느낄 수 있다. 헛제사밥의 유래는 안동에선 전통적으로 조상들을 기리는 제사가 많아서인지 제삿밥이 맛있어서 일반 손님들에게 제사 음식으로 손님을 대접하는 경우가 많아 헛제사밥이라 유래된 듯하다. 제사 음식이라 상차림이 화려하진 않지만 밥과 국, 나물, 그리고 전과 구이류 등이 차려져 나오는데, 조미료의 맛을 최소화하고 천연재료를 주로 사용하고 전통적으로 내려오는 음식 제조 방법을 써서 그런지 정갈하고 담백한 맛이 일품이다.",
헤라,2930213,쇼핑,쇼핑,사후면세점,http://tong.visitkorea.or.kr/cms/resource/52/2891252_image2_1.jpg,경기도,126.950436882,37.3900381258,-,
헤라,3305593,쇼핑,쇼핑,사후면세점,http://tong.visitkorea.or.kr/cms/resource/03/3313003_image2_1.jpg,서울특별시,127.0305315802,37.6146468109,-,
헤라,3305621,쇼핑,쇼핑,사후면세점,http://tong.visitkorea.or.kr/cms/resource/23/3313023_image2_1.jpeg,서울특별시,126.8884169673,37.5089148857,-,
헤라,3307074,쇼핑,쇼핑,사후면세점,http://tong.visitkorea.or.kr/cms/resource/50/3313750_image2_1.jpeg,서울특별시,126.9249974851,37.4905482278,-,
헤라,3307631,쇼핑,쇼핑,사후면세점,http://tong.visitkorea.or.kr/cms/resource/37/3314637_image2_1.jpg,서울특별시,126.9055901684,37.5172308925,-,
헤라 롯데안산,2924966,쇼핑,쇼핑,사후면세점,http://tong.visitkorea.or.kr/cms/resource/45/2882045_image2_1.jpg,경기도,126.8345133215,37.3180555223,-,
헤라 월드타워점,2925519,쇼핑,쇼핑,사후면세점,http://tong.visitkorea.or.kr/cms/resource/81/2879181_image2_1.jpg,서울특별시,127.1040749597,37.5141653654,-,www.hera.com
헤라모텔,3044647,숙박,숙박시설,모텔,http://tong.visitkorea.or.kr/cms/resource/25/3054325_image2_1.jpg,경상남도,128.3773196728,35.0904899842,"경상남도 고성군 회화면에 있는 헤라모텔은 무인텔로 시간에 관계없이 편리하게 이용하기에 좋다. 객실은 2인실로 더블베드와 TV, 냉장고, 에어컨 등이 구비되어 있고, 침실과 욕실이 분리되어 있다. 주차장이 있어 주차가 편리하고, 전기차 충전도 가능하다. 가격이 합리적이어서 가성비 있게 이용하기에 좋다.",
헤라유원지(헤라낚시터),3012122,레포츠,수상 레포츠,민물낚시,http://tong.visitkorea.or.kr/cms/resource/46/3005646_image2_1.JPG,경기도,127.1254034604,37.7126843439,"수락산 자락에 위치한 사유지 3,000여 평 규모의 낚시터를 겸한 물놀이장이다. 이곳은 날씨가 좋지 않거나 겨울 방문객을 위한 하우스 낚시터와 야외 낚시터(손맛 낚시터), 물놀이를 위한 야외 수영장으로 구성되었다.
야외 낚시터에서는 낚시 초보나 학생, 어린이를 위한 낚시 체험장을 운영중이며, 낚시대는 무료로 대여가 가능하다. 낚시를 하기 위해 온 방문객은 낚시요금 지불시 이용할 수 있는데, 낚시대를 던지기만 해도 손맛을 볼 수 있기 때문에 이용료가 아깝지 않을 정도이다.
수영장은 이용요금이 없는 대신 음식을 주문해야 이용이 가능하며, 수영장 바로 앞에 조성된 평상, 테이블 좌석에서 주문한 음식을 먹으며 물놀이를 즐길 수 있다. 수심 1.5m~2.5m 깊이로, 어린이는 구명조끼를 입고 물놀이를 즐기는 것이 안전하며, 튜브 대여도 가능하다.
물놀이와 낚시를 한 번에 즐길 수 있는 일석이조의 즐거움이 있는 곳으로, 아이와 함께 가기에도 좋은 장소이다.",
헤레디움,3085034,인문(문화/예술/역사),문화시설,전시관,http://tong.visitkorea.or.kr/cms/resource/58/3084458_image2_1.JPG,대전광역시,127.4354725232,36.3256249136,"헤레디움은 옛 동양척식회사 대전지점 건물에 조성된 전시 및 공연을 개최하는 문화공간이다. 이 건물은 2004년 9월 근대 건축물로 그 가치를 인정받아 국가등록문화재로 지정되어 있다. 재단법인 CNCITY마음에너지재단은 2022년경 2년여에 걸친 보수 및 복원 작업을 통해 현시대의 예술적 영감을 전하는 전시와 수준 높은 클래식 공연을 위한 복합문화공간 [헤레디움]을 만들었다.
[HEREDIUM]은 라틴어로 [유산으로 물려받은 토지]라는 의미로, 역사적 가치가 숨 쉬는 근대문화유산 속에서 공연과 전시를 통해 새로운 미래유산을 만들어간다는 의미가 담겨있다. 공연 시간 및 입장 가능시간은 매 공연마다 상이하며, 전시 및 프로그램은 관람시간 종료 30분 전까지 입장 가능하다. 인근에는 대전역 외에 대전중앙시장, 으능정이 문화의거리 등이 있다.","<a href=""https://heredium.art"" target=""_blank"" title=""새창 : 홈페이지로 이동"">https://heredium.art</a>"
헤르메스호텔,3075556,숙박,숙박시설,모텔,,경기도,126.8646946946,36.987780385,"서평택 IC 바로 옆에 위치한 헤르메스 호텔은 포승공단과 시내중심에서 인접하면서도 깨끗한 공기를 즐길 수 있는 거리에 위치하고 있다.
24시간 운영하는 프론트데스크와 무인텔로 운영하고 있으며, 54개의 객실과 넓은 주차공간을 보유하고 있다. 모든 객실에는 개별 냉난방 시스템과 LED TV가 배치되어 있으며 아늑하고 깨끗한 공간에서 최고의 휴식을 가질 수 있다.
일반객실 포함 전객실 TV와 PC가  완벽 전환되며 전객실 넷플릭스, 디즈니, 티빙, 왓챠를 무료로 시청할 수 있다.
호텔에서 가까운 곳에 수도사와  평택서부문화예술회관 및 서평택국민체육센터가 있으며 평택호 관광단지와 공세리 성당 등 주변에 가볼만한 곳이 많다.","<a href=""https://hermes74421.modoo.at/"" target=""_blank"" title=""새창 : 홈페이지로 이동"">https://hermes74421.modoo.at/</a>"
헤르츠,3025574,음식,음식점,카페/전통찻집,,경기도,127.0458084906,37.300986264,"헤르츠는 낮에는 카페, 저녁엔 LP바로 운영되어 직장인의 사랑을 듬뿍 받는 공간이다. 이곳에서 가장 눈길이 가는 것은 벽면에 달린 커다란 스피커다. 미국을 대표하는 하이파이 오디오 브랜드 매킨토시 사의 앰프에 전통적인 아메리카 사운드를 추구하는 JBL 사의 4344 스피커를 매칭했다. 풍성하고 양감 있는 소리를 내어 어떤 음악과도 잘 어울리는 것이 특징이다. 매주 수요일 밤 8시에는 재즈 공연이 열린다. 예약하거나 일찍 자리를 맡지 않으면 공연을 보기 힘들 정도로 인기가 높다. 공연은 1부, 2부로 나누어 진행되며, 매주 다른 공연팀이 연주를 선보인다.",
헤리베르,2852798,음식,음식점,카페/전통찻집,http://tong.visitkorea.or.kr/cms/resource/84/2852784_image2_1.jpg,경기도,127.3894440837,37.4926258142,"헤리베르는 양평 강하면에 있는 대형 베이커리 카페이다. 카페 바로 옆에는 한강 수변 공원이 있다. 프랑스 제빵사가 정통 프랑스 빵 제조 방식으로 천연재료와 유기농 밀가루로 만든 빵을 판매하고 있다. 카페 이름이 불어로 녹색의 시간이란 뜻인데 이곳을 방문하면 녹색의 정원에 둘러싸인 느낌이 든다. 창을 통해 남한강을 바라볼 수 있고 확 트인 전경에 가슴이 탁 트인다. 양평 쪽으로 드라이브를 하는 사람들 사이에 입소문이 많이 난 카페이다. 건물은 두 개 동 3개 층으로 되어 있고, 3층을 제외하고는 야외 테라스에도 좌석이 있어 시원한 강바람을 맞으며 커피와 베이커리 제품을 즐길 수 있다. 커피도 유명한 집인데, 케냐 스페셜티 원두를 선별해서 직접 로스팅을 한다. 매장에서 판매하는 커피는 로스팅한 지 2주 이내의 신선한 것이다. 주차는 매장 앞에 편리하게 할 수 있다.","<a href=""https://blog.naver.com/heurevert2021""target=""_blank"" title=""새창 : 헤리베르 사이트로 이동"">https://blog.naver.com/heurevert2021</a>"
헤리티지703,2891739,음식,음식점,카페/전통찻집,http://tong.visitkorea.or.kr/cms/resource/38/2891738_image2_1.jpg,경상남도,129.0887994146,35.4902775301,양산 하북면에 있는 대형 카페 헤리티지 703은 깔끔한 외관과 실내 인테리어는 물론 음료와 베이커리 맛도 뛰어나 재방문이 많은 카페이다. 예쁜 잔디 정원에 분수가 있는 연못까지 있어 포토존이 다양하며 모든 자리에서 통유리창을 통해 잘 가꾼 정원을 감상할 수 있다. 또한 곳곳에 소품들이 배치되어 있어 아기자기한 맛이 있다. 2층은 노키즈존으로 운영되고 있다. 헤리티지솔트라테가 시그니처 메뉴이며 베이커리류도 함께 즐길 수 있게 준비했다. 카페 앞마당이 주차장과 바로 연결되어 있어 편리하게 이용할 수 있고 가까운 곳에 양산 관광 명소 통도사가 있어 함께 둘러보기 좋다.,"<a href=""http://www.instagram.com/heritage_703""target=""_blank"" title=""새창 : 헤리티지703 사이트로 이동"">http://www.instagram.com/heritage_703</a>"
헤리티지클럽,2907200,음식,음식점,카페/전통찻집,,서울특별시,126.9924862067,37.5738397597,"여유로운 돌담길과 따듯한 햇살 아래 커피와 차를 마실 수 있는 카페 헤리티지클럽이다 .이 카페만의 매력은 해가 저물면 운치
있는 조명 아래 위스키와 와인을 먹을 수 있는 바로 변신을 한다. 특히 한옥풍의 인테리어가 특징이여서 포토스팟으로도
 활용을 많이 한다. 커피, 음료, 위스키 등 마실 것이 다양하며 분위기 좋은 카페이다.",
헤브론,2712945,음식,음식점,서양식,,세종특별자치시,127.2775162517,36.4634480007,"헤브론은 세종특별자치시 고운동 고운빌딩에 위치한 스테이크 전문점이다. 상호명인 헤브론은 성경 속  85세 갈렙이 얻은 약속의 산지이자, 다윗이 왕의 핍박을 피해서 지내다 첫번째 정착한 곳이며, 팔레스타인 요르당 강 서안에 있는 도시이다. ‘친구·교제·연합’이라는 뜻이 있다. 뜻처럼 가족과 친구, 직장동료들과 좋은 사귐의 시간을 가지기를 바라는 마음이 담겨있다. 
헤브론은 이탈리안 요리법을 기본으로 조리한다. 단 스테이크 조리는 미국식과 이탈리안식을 접목했다.
음식을 먹는 사람의 건강과 삶이 행복하기를 바라는 마음으로 정성을 다하여 준비하고 있다.",
헤븐리파크도그스,2913349,음식,음식점,카페/전통찻집,http://tong.visitkorea.or.kr/cms/resource/91/2919991_image2_1.jpeg,강원특별자치도,127.7785778274,37.8841680801,"어린이, 반려동물과 좋은 사람들을 위한 천국같은 세상 아름다운 자연과 함께하는 힐링스테이 헤븐리파크도그스.",
헤븐온어스,3023045,인문(문화/예술/역사),체험관광지,농.산.어촌 체험,http://tong.visitkorea.or.kr/cms/resource/26/3023026_image2_1.jpg,경기도,127.3084804381,37.1557744458,"헤븐온어스는 겨울과 봄에는 딸기, 초여름에 블루베리, 여름과 가을에는 쌈 채소를 수확할 수 있는 체험 농장이다. 쾌적한 농장과 400평 규모의 대형 실내 놀이공간(키즈존)이 있다. 딸기 체험(겨울~봄), 농터파크(여름), 할로윈(가을) 3개 시즌으로 나누어져 있으며 예약제로 운영한다.
사전 예약제로 운영되며, 입장할 때 테이블과 피크닉 바구니를 제공한다. 농장에서 수확 체험을 하고 키즈존을 이용하여 만들기, 동물 먹이주기, 깡통열차 타기 등 프로그램 이용이 가능하다. 마지막 타임에는 불멍과 불꽃놀이도 즐길 수 있다. 외부 음식 반입이 가능하며 지정된 기간에는 추가요금을 내고 바비큐도 할 수 있어 온 가족이 함께 방문하기 좋다. 수확 시즌은 작물 상황에 따라 실제 운영 기간이 변동될 수 있다. 공식 인스타그램 계정에 공지가 뜬다. 네이버를 통해 사전 예약이 가능하다.","<a href=""https://blog.naver.com/isb5009""target=""_blank"" title=""새창 : 업체 블로그 이동"">https://blog.naver.com/isb5009</a><br><a href=""https://www.instagram.com/a_heaven_on_earth/"" target=""_blank"" title=""새창 : 홈페이지로 이동"">https://www.instagram.com/a_heaven_on_earth/</a>"
헤스티아,2740986,레포츠,육상 레포츠,"야영장,오토캠핑장",http://tong.visitkorea.or.kr/cms/resource/41/2741241_image2_1.jpg,경기도,127.4049001541,37.7147142013,"헤스티아글램핑은 경기도 가평군 청평면 청평댐 인근에 위치한 마이다스 리조트 단지 내에 있다. 호명산과 청평호와 북한강의 지류인 조종천이 인접해 있어 중인 각종 액티비티 체험이 가능한 대단위 캠핑 시설이다. ‘청평자연휴양림’ 입구와 가까워, 대중교통수단으로 접근이 가능하고 특히 진입로는 봄에 벚꽃 터널을 이루어 드라이브 코스로도 제격이다. 청평댐 아래 신청평대교를 통해 진입할 수 있다. 글램핑 객실과 수영장에서는 청평호가 시원하게 조망되며 가을에는 운두산, 오도산의 아름다운 단풍을 감상할 수 있다.
카바나 스타일의 글램핑 5동과 리조트로서 각종 부대시설이 준비되어 있다, 어린이를 위한 키즈 잼 놀이시설, 비움 하우스, 미니 동물원 이용이 가능하다. 사이트 뒤편으로는  넓은 원형 풀장이 있어서 연계 이용이 가능하다.  사이트 내에는 대형 프로젝션 빔과 양질의 스피커를 설치했다.  이용객들이 영화와 음악을 즐기면서 자연 속에서 힐링할 수 있도록 배려했다.","<a href=""https://www.midashotel.co.kr/view/viewLink.do?page=homepage/KOR/facilities/hestia"" target=""_blank"" title=""새창 : 헤스티아 사이트로 이동"">https://www.midashotel.co.kr</a>"
헤아려담다,2685569,음식,음식점,서양식,,강원특별자치도,127.9849235296,37.4908731186,"헤아려담다는 아담한 규모의 커피전문점으로 횡성군청 인근에 위치해 있다. 포근하고 편안한 동네 카페로 자리매김하고 있어 단골손님도 많다. 이곳에서는 착한 가격으로 핸드드립 커피와 각종 음료를 맛볼 수 있으며, 마스터의 아내분이 직접 만든 수제 쿠키와 머핀도 함께 판매하고 있다. 또한, 다양한 종류의 원두도 직접 구입할 수 있다.",
헤이 가로수,2923052,쇼핑,쇼핑,사후면세점,http://tong.visitkorea.or.kr/cms/resource/64/2879664_image2_1.jpg,서울특별시,127.0232487564,37.5221685377,-,
헤이 썬 브런치카페,2844977,음식,음식점,카페/전통찻집,http://tong.visitkorea.or.kr/cms/resource/66/2844966_image2_1.jpg,경기도,127.046227304,37.3221560407,"헤이썬브런치카페는 용인시 수지구 성복동 광교산 끝자락에 있는 카페이다. 산길 끝에 있어 탁 트인 산뷰와 시원한 통창으로 힐링하기에 최적화된 장소이다. 
대표메뉴는 부라타&프로슈토 프렌치토스트와 샥슈카(에그 인 로제)가 있으며, 이외도 살몬 에그 베네딕트, 풀브런치, 잠봉뵈르 베이글 등 다양한 브런치 메뉴가 준비되어 있다. 
저녁 6시부터 8시까지는 저녁 예약제로 운영이 되며, 단체 모임, 프라이빗룸, 행사, 파티 등을 위한 대관도 가능하다.","<a href=""https://www.instagram.com/hey_sun_brunch/"" target=""_blank"" title=""새창 : 헤이썬브런치카페 인스타그램으로 이동"">https://www.instagram.com/hey_sun_brunch/</a>"
"헤이, 서귀포",2918548,숙박,숙박시설,관광호텔,http://tong.visitkorea.or.kr/cms/resource/52/2877352_image2_1.jpg,제주특별자치도,126.560089583,33.2461450683,"헤이, 서귀포는 서귀포항 근처에 있다. 실용성을 강조한 호텔로 작은 객실에 침대, 테이블, TV 등 필요한 것만 타이트하게 갖추고 있다. 플립의 워케이션 프로그램과 협업하여 2층에 공동 사무 공간, 카페, 회의, 요가실을 갖춘 플립 캠프가 있다. 1층에는 북카페 형태로 테이블이 있는 오픈 공간이 있고, 서귀포항 전망과 옛날식 전자오락을 즐길 수 있는 테마 카페인 레트로 보이즈가 있다. 특히 반려견 동반할 수 있는 객실이 있다. 코인 세탁실이 준비되어 있으며, '헤이(heyy)'의 라이프스타일을 담은 굿즈를 판매한다. 주변 여행지로 서귀포 칠십리시공원, 천지연폭포, 하영올레길 등이 있으며 춘천에는 같은 컨셉으로 운영되는 헤이 춘천이 있다.","<a href=""https://heyy.gamsunglab.com/""target=""_blank"" title=""새창 : 헤이, 서귀포 사이트로 이동"">https://heyy.gamsunglab.com/</a>"
헤이그라운드,2782927,음식,음식점,카페/전통찻집,http://tong.visitkorea.or.kr/cms/resource/28/2795428_image2_1.jpg,전북특별자치도,127.0415765757,35.7165152364,"김제 모악산의 금산사 도립공원 입구에 있는 세련된 분위기의 감성 카페이다. 넓은 잔디 마당과 모던한 건물을 갖추고 있으며, 실내외에 넓은 간격을 두고 테이블이 배치되어 있어, 쾌적하게 음료와 디저트를 즐길 수 있다. 탁 트인 전망이 인상적이며, 다양한 종류의 베이커리와 디저트를 건강한 레시피로 제조하여 판매한다. 카페 자체 주차장이 있으며, 도립공원 주차장을 이용해도 된다.",
헤이다이닝,2844809,음식,음식점,서양식,http://tong.visitkorea.or.kr/cms/resource/07/2844807_image2_1.jpg,울산광역시,129.3389816591,35.5428457506,"울산 삼산동 업스퀘어 근처 맥도날드 뒤편에 있는 헤이다이닝은 깔끔하고 모던한 장소에서 식사를 즐길 수 있는 이탈리안 레스토랑이다. 대표 메뉴는 타이거 쉬림프 로제 파스타, 이베리코 온 더 리조또, 블랙앵거스 살치살 스테이크이고 그 외 스퀴드 잉크 파스타, 오징어먹물 아란치니, 자몽에이드 등 다양한 메뉴가 있다. 밤이 되면 조도로 분위기를 조절해서 연인들의 데이트 장소로 인기가 많다. 태화강변이 근처에 있어 함께 둘러보기 좋고, 서점과 미술관, 공원도 있다.","<a href=""https://www.instagram.com/hey_dining/""target=""_blank"" title=""새창 : 헤이다이닝 사이트로 이동"">https://www.instagram.com/hey_dining/</a>"
헤이더그린,2832899,음식,음식점,카페/전통찻집,http://tong.visitkorea.or.kr/cms/resource/83/2832883_image2_1.jpg,서울특별시,126.7942384993,37.5425037478,"헤이더그린은 반려동물과 함께 이용할 수 있는 야외정원 카페이다. 반려견 입장료를 지불하고 입장해야 한다. 반려견 운동장이 따로 마련되어 있지만 이용객 안전을 위해 노키즈 공간으로 운영된다. 도심지와 떨어져 있어 자차를 이용하는 것이 편리하다. 입구에 들어서면 수목이 우거진 사이에 주차를 할 수 있고 넓은 정원을 지나 반려견 운동장, 별장 같은 카페 건물을 만날 수 있다. 내부는 자연 친화적인 원목 소재와 널찍한 자리 배치로 프라이빗 공간을 제공한다.","<a href=""https://www.instagram.com/hey_the_green/?utm_medium=copy_link""target=""_blank"" title=""새창 : 헤이더그린 사이트로 이동"">https://www.instagram.com/hey_the_green/</a>"
헤이든,2832655,음식,음식점,카페/전통찻집,http://tong.visitkorea.or.kr/cms/resource/54/2832654_image2_1.jpg,부산광역시,129.2567155544,35.2824206625,"부산 기장군 일광카페 헤이든은 야자수 나무에 둘러싸여 있고, 카페 입구는 미로처럼 두어 번 꺾어 걸어 들어가야 나온다. 때문에 이곳을 찾는 사람들에게 독특하고 재밌는 인상을 준다. 카페 헤이든은 전체적으로 차분하고 깔끔한 인테리어로, 1층 창가 자리는 바로 바다와 맞닿아 있어 인기가 많다. 2층 공간은 넓게 트여 있어 인원이 많을 때 가면 좋다. 3층에 올라가면 아늑하게 마련된 공간도 있다. 야외 테라스에는 파라솔 의자도 있어 다채로운 각도에서 기장 앞바다를 감상할 수 있다.","<a href=""https://www.instagram.com/haydencoffee_/""target=""_blank"" title=""새창 : 헤이든 사이트로 이동"">https://www.instagram.com/haydencoffee_/</a>"
