title,contentid,cat1,cat2,cat3,firstimage,region,mapx,mapy,overview,homepage
홍성상하리미륵불,250317,인문(문화/예술/역사),역사관광지,유적지/사적지,,충청남도,126.6484015052,36.6366754193,"홍성군 홍북읍 상하리의 용봉산의 서쪽 기슭에 있는 지상 8m에 이르는 거대한 미륵불이다. 절벽 아래 수직으로 솟구친 거대한 자연 암석을 조각하였으며, 고려시대의 토속적인 지방 양식이 잘 드러나 있는 것이 특징이다. 
민머리에 가늘고 긴 눈, 넓적하고 낮은 코, 비교적 작은 입이 평면적으로 표현되었고, 입가의 희미한 미소가 부드러운 인상을 풍긴다. 신체 역시 입체감 없이 평면적인데, 두 손을 아래위로 나란히 대고 있는 것만 표현했을 뿐 다른 것은 거의 생략되었다. 
지방 양식을 잘 드러내고 있는 관촉사 미륵보살입상(보물) 등 충청도 지방에 남아있는 거대한 불상들과 비슷한 계열의 작품으로 보인다.","<a href=""https://www.hongseong.go.kr/prog/cultureAssets/tour/sub01_050202/C2/view.do?pageIndex=1&asset_seq=45"" target=""_blank"" title=""새창 : 홈페이지로 이동"">https://www.hongseong.go.kr</a>"
홍성솔바람테마파크,3300140,자연,자연관광지,수목원,http://tong.visitkorea.or.kr/cms/resource/32/3300132_image2_1.jpg,충청남도,126.7338729461,36.4809225834,"홍성솔바람테마파크는 구절초 테마파크로 숲속 야영장과 글램핑장이 있는 곳이다. 소나무가 멋진 동산에 많은 꽃들을 심어 4계절 내내 아름다운 꽃을 볼 수 있는 관광지이다.
공원 안에는 중간중간 쉼터가 있고 산책로 경사도 심하지 않아 남녀노소 편안하게 산책하기 좋은 곳이다. 또한 공원 곳곳에 판다 가족, 사슴 가족 등 아이들이 좋아할 만한 다양한 포토존이 있어 추억을 남기기에도 좋다.",
홍성원,2844389,음식,음식점,중식,http://tong.visitkorea.or.kr/cms/resource/84/2844384_image2_1.jpg,경기도,126.7937438543,37.6499773474,"홍성원 일산점은 고양시 일산동구 백석동 유니테크빌 1층에 있다. 백석역에서 멀지 않아 대중교통으로도 편리하게 이용할 수가 있다. 건물 1층에 커다란 빨간색 간판이 눈에 잘 보여 찾기가 쉽다. 홍성원은 4대째 가업을 이어오고 있다. 내부는 깔끔하고 6석, 10석, 12석 룸이 있어 단체 모임에 좋다. 예약이 가능하며 최고의 맛을 위해 배달은 하지 않고 포장만 가능하다. 홍성원은 단품과 다양한 코스가 있는 정통 중화요리 전문점이다. 메뉴는 런치코스, 디너코스 외에도 다양한 코스메뉴가 있다. 중화요리 단품들도 종류가 많아 입맛에 따라 골라 먹을 수가 있다. 가장 인기 있는 단품 메뉴는 가지튀김과 마늘탕수육이다. 후식으로 빠스가 나오는데 인기가 있어 판매도 한다. 건물에 주차장이 있다. 근처 가볼 만한 곳은 백석 어린이교통공원, 백석공원, 일산 호수공원 등이 있다.",
"홍성장 (1, 6일)",132640,쇼핑,쇼핑,5일장,,충청남도,126.6704893378,36.601546511,"홍성 전통시장은 1943년 개설된 시장으로 홍성군 홍성읍에 있다. 1일과 6일에 오일장이 열리는 곳으로 각종 먹거리를 비롯해 채소류, 생선류, 육류, 의류, 생활용품 등을 파는 상점이 성업 중이다. 오일장이 열리는 날이면 홍성과 주변 지역의 상인들과 소비자들로 인산인해를 이룬다. 직접 재배한 농산물들을 직거래 형태로 판매가 이루어지기도 하고, 천수만이 위치한 지역의 특성답게 꽃게, 새조개, 주꾸미, 대하, 전어 등 다양한 수산물들이 판매되고 있다. 신선도는 물론 인심도 푸짐해서 단골손님이 많은 시장이다. 
티브이프로그램에 출연한 호떡집과 소머리국밥이 유명하며, 공영주차장과 화장실 등 편의시설이 잘 갖춰져 있어 편리하다. 
홍성시장 내에 있는 홍주성 천년여행길(장터길)은 서해안에 위치해 해상문물과 육산문물이 자연스럽게 만났던 물류중심지 홍성의 위치를 잘 보여주고 있다. 또한 내포천주교 순례길 5코스인 홍주순교성지와도 가까워 시장구경도 하고 순례길도 가볍게 둘러볼 수 있다.",
홍성전통시장 오일장(홍성5일정기시장),2771854,쇼핑,쇼핑,5일장,,충청남도,126.6680367636,36.6021991708,"홍성 전통시장은 1943년 개설된 시장으로 충청남도 홍성군 홍성읍에 위치해 있다. 1일과 6일에 오일장이 열리는 곳으로 각종 먹거리를 비롯해 채소류, 생선류, 육류, 의류, 생활용품 등을 파는 상점이 성업 중이다. 오일장이 열리는 날이면 홍성과 주변 지역의 상인들과 소비자들로 인산인해를 이룬다. 시장은 장항선 홍성역과 홍성 IC에서 가까운 거리에 위치했다.",
홍성한우미당,628558,음식,음식점,한식,,충청남도,126.6346395475,36.6107837163,"홍성한우미당은 충남 내포지역 홍성에 위치한 생갈비 전문점이다. 매주 도축하여 신선한 한우고기만을 판매한다. 매일 한정 수량만 판매하고 있는 생갈비가 대표 메뉴이다. 다양한 기본찬과 암소만의 진한 육향을 함께 즐기면 더욱 맛이 좋다. 쾌적하고 넓은 홀과 주차장, 고급스러운 분위기의 룸 시설을 다량 보유하고 있어 각종 단체 모임을 하기에도 좋다. 주변에 수덕사, 덕산온천, 용봉산이 10분 거리에 있으며, 남당리 안면도가 인접해 있어 식사 후 주변 관광지를 둘러보기에 좋은 음식점이다.",
홍성호,2912719,자연,자연관광지,강,http://tong.visitkorea.or.kr/cms/resource/06/2912706_image2_1.jpg,충청남도,126.4993259153,36.5375870282,"홍성호는 충청남도 홍성군 서부면 신리에 있다. 천수만 바닷가를 막으면서 생긴 저수지다. 홍성호 주변으로 펼쳐지는 풍경이 멋지다. 이 덕분에 홍성이나 주변 여행길에 올랐다가 잠시 들르는 여행객이 많다. 게다가 붕어와 잉어 등이 많아 낚시객의 발길이 이어진다. 겨울철에도 쏠쏠한 손맛을 느낄 수 있다. 광천IC에서 가깝고, 주변에 남당항과 수룡한포구가 있다.","▪ <a href=""https://blog.naver.com/hsgstory/222915607717"" target=""_blank"" title=""새창: 홍성군 공식 블로그로 이동"">https://blog.naver.com/hsgstory</a>"
홍순덕 전포양곱창,2869343,음식,음식점,한식,http://tong.visitkorea.or.kr/cms/resource/29/2869329_image2_1.JPG,부산광역시,129.1099591046,35.1735190256,"홍순덕 전포양곱창은 50년 이상의 전통을 자랑하는 양 곱창구이 전문점이다. 부산에는 곱창 좋아하는 사람이라면 누구나 알만한 유명한 곳으로 맛도 있고, 양도 푸짐하다. 주택가에 위치해 찾아가기가 쉽지 않지만, 소문난 맛집인 홍순덕 전포양곱창은 빨간 양념이 먹음직하고 3인분이 다른 집 5인분은 되어 보일 정도로 양곱창의 양이 많다. 대창이 부드러운데, 고기가 부드러운 이유는 거세우이기 때문이다. 곱창을 먹은 다음에 주문하는 무청을 넣은 된장 국수, 시원한 열무국수가 특별한 맛을 선사한다. 주차도 바로 앞에 공간이 따로 있어서 넓고 편하다.",
홍승인고가,736754,인문(문화/예술/역사),역사관광지,고택,http://tong.visitkorea.or.kr/cms/resource/25/2483125_image2_1.jpg,경기도,126.9593788098,37.152243607,"경기도 문화유산자료로 등재되어 있는 이 가옥은 경기도 지방 부농의 전통적인 주거생활을 잘 보여준다. 전체적으로 안채, 사랑채, 행랑채로 구성되며 형태는 ‘ㅁ’자형을 하고 있다. 안채는 ‘ㄱ’자 모양으로 중앙의 대청마루를 중심으로 동쪽에 안방, 맞은편에 건넌방을 두고 안방 앞쪽에 부엌을 두었다. 부엌의 뒤쪽으로는 우물과 장독대 등이 있는 뒤꼍이 위치한다. 사랑채 역시 ‘ㄱ’자 형태로 중앙의 대청을 중심으로 좌우에 방이 1칸씩 배치되어 있으며 툇마루 바깥쪽에 창호를 달아 방 앞쪽에서 보면 툇마루가 복도처럼 보인다. 한편 사랑채 앞에 있는 행랑채는 일자형(一字形)의 9칸 규모이며 중앙에 솟을 대문이 배치되어 있다. 홍승인 고가의 두드러진 특징은 긴 사랑채의 분합문과 옆면에 있는 정교한 띠살창, 협문 등으로 원형 그대로 보존되어 있다. 건축연대를 확실히 알려주는 자료는 없으나 사랑채에 사용된 부재나 가구의 수법 등으로 미루어 19세기 말로 추정되며 안채는 그보다 앞선 것으로 추정되고 있다.","<a href=""https://www.heritage.go.kr/heri/cul/culSelectDetail.do?ccbaCpno=3413100740000&pageNo=1_1_1_1&sngl=Y""새창: 문화재청 홈페이지로 이동"">http://www.cha.go.kr</a>"
홍시,2900576,음식,음식점,한식,http://tong.visitkorea.or.kr/cms/resource/68/2900568_image2_1.jpg,경상북도,129.2029683158,35.8453174442,"홍시는 재래장류와 발효음식 및 홍시를 테마로 한 식당이다. 주인이 직접 연구 및 조리하며, 조미료를 전혀 사용하지 않아 담백하고 깔끔한 맛이다. 700평의 아름다운 정원과 유럽풍의 테라스 쉼터가 마련되어 있으며, 여름에는 라이브와 곁들여진 식사를 즐길 수 있다. 대표메뉴는 한정식으로, 전식 5가지, 16가지 찬과 정식, 차와 후식이 제공된다. 불고기정식은 전식 7가지, 16가지 찬과 불고기정식, 차와 후식이 제공된다. 정식메뉴 외에도 낙지볶음, 불고기, 족발냉채, 돌파전 등 단품메뉴도 있다.",
홍시,2913207,음식,음식점,카페/전통찻집,http://tong.visitkorea.or.kr/cms/resource/34/2918834_image2_1.jpg,강원특별자치도,127.648633075,37.6357584137,홍시는 반려견 동반 카페&amp;레스토랑 입니다. 반려견과 함께 음료 또는 식사를 즐기실 수 있습니다,
홍시(전주한옥마을 숙박 홍시),2576546,숙박,숙박시설,한옥,http://tong.visitkorea.or.kr/cms/resource/02/2576302_image2_1.jpg,전북특별자치도,127.1530140906,35.8153059305,"전주 한옥마을숙박 홍시는 한옥마을 최고 메인거리 중심에 위치해 있으며 한옥마을뿐만 아니라 풍남문, 남부시장, 야시장, 벽화마을, 오목대, 경기전, 전동성당 등을 도보로 이동 가능하다. 모든 객실에는 tv, 에어컨, wifi, 세면용품, 드라이기, 고데기, 개별 화장실이 설치되어 있다. 
전주한옥마을 공영주차장 50%할인권 스쿠터 5,000원 할인권 한복 할인권과 셀프조식을 제공해 드리고 있습니다",http://www.hongsihanok.kr/
홍쌍리 청매실농원,127040,인문(문화/예술/역사),산업관광지,식음료,http://tong.visitkorea.or.kr/cms/resource/84/1606784_image2_1.jpg,전라남도,127.7166918265,35.0755466394,"청매실농원은 해발 1,217m에 달하는 백운산 기슭에 5만 평의 규모로 자리 잡고 있다. 홍쌍리 씨가 본격적으로 매화밭을 조성해 오늘처럼 매화 명소로 일궈 낸 데에는 지금은 고인이 된 홍 씨의 시아버지 율산 김오천 선생이 산에 밤나무와 매화나무를 심어온 오랜 노력의 시간이 받쳐주고 있다. 김오천 선생이 수십만 평의 땅에 매화 농장의 터를 잡자 며느리인 홍쌍리 씨는 매화나무를 늘리고 종자를 개량해 매화 박사라는 별칭까지 얻게 되었다. 홍쌍리 씨는 정부 지정 명인 14호로 지정될 만큼 매화와 매실에 관해서는 일가를 이루고 있다. 

광양 매화마을은 매화 정보화 마을 혹은 섬진강 매화마을이라고도 하는데, 홍쌍리 청매실농원을 중심으로 크게 한 덩어리라고 보면 된다. 일반적으로 광양 매화마을이라고 하면 홍쌍리 청매실농원을 일컫는다고 보면 된다. 매화가 피는 3월이 되면 청매실농원은 청매화, 홍매화뿐만 아니라 능수매화, 산수유까지 한껏 피어난다. 매년 봄마다 매화꽃이 피면 청매실농원을 중심으로 매화축제가 열린다. 농원 안에는 곳곳에 포토존이 마련되어 있으며, 정자 전망대에서 내려다보는 매화마을, 섬진강, 강 넘어 하동 마을의 풍경을 한눈에 볼 수 있어 방문객들에게 인기가 많다.","<a href=""http://www.maesil.co.kr"" target=""_blank"" title=""새창 : 청매실농원 홈페이지로 이동""> www.maesil.co.kr </a>"
홍아네,2864876,음식,음식점,한식,http://tong.visitkorea.or.kr/cms/resource/67/2864867_image2_1.jpg,광주광역시,126.8525800567,35.1467154613,"광주광역시 치평동에 있는 한정식 전문점이다. 한옥 건물로 된 외관부터 실내까지, 한옥 마을에 온 것 같은 착각을 일으키게 할 만큼 인테리어부터 소품 하나하나까지 디테일하게 구성되어 있다. 제철 식재료를 사용하는 계절 음식만을 선보이기 때문에, 메뉴가 매일 변경된다. 삼합, 얼큰한 생태탕, 조기 매운탕, 매생이, 굴비정식, 전어, 산낙지 등의 메인 요리와 쌈 채소, 나물, 코다리조림, 김구이, 묵은김치 등의 기본 반찬들 모두 별미다. 주차 공간도 넓어 주차 걱정 없이 편하게 방문할 수 있다. 5.18 기념공원, 상무시민공원 등이 주변에 있어 연계 관광을 즐기기 수월하다.",
홍양저수지(빼뽀저수지),131047,레포츠,수상 레포츠,민물낚시,http://tong.visitkorea.or.kr/cms/resource/69/1894269_image2_1.jpg,충청남도,126.7064002816,36.5905483979,"‘홍양저수지’는 1945년에 준공된 홍성군에서 제일 큰 저수지로 금마면에 위치하고 있다. 모양이 고구마처럼 길쭉하고 주변에 수양버들이 우거져 있어 경관도 아름답다. ‘홍양저수지’는 현재도 농업용수 보호구역이며 어종이 풍부하여 낚시터로도 인기가 많다. 저수지 수변을 따라 4.3km의 산책로가 조성되어 있으며 대략 1시간 30분 걷기 코스이다. 큰 나무들과 한적한 농촌풍경, 탁 트인 풍경이 펼쳐져 지루한 줄 모른 채 걷게 된다.","<a href=""https://www.hongseong.go.kr/prog/tursmCn/tour/sub04_030205/view.do?cntNo=51""target=""_blank"" title=""새창 : 홈페이지 이동"">https://www.hongseong.go.kr/</a>"
홍어대가,2674218,음식,음식점,한식,http://tong.visitkorea.or.kr/cms/resource/32/2673732_image2_1.jpg,경기도,127.1045201937,36.9890122684,평택시민의 숨은 맛집이다. 경기도 평택시에 있는 한식 전문점이다. 대표메뉴는 홍어삼합이다.,
홍어명가,738748,음식,음식점,한식,http://tong.visitkorea.or.kr/cms/resource/26/2384426_image2_1.jpg,서울특별시,126.9115453697,37.5105456646,신길동 홍어거리에 위치한 홍어요리 전문점으로 홍어회와 홍어삼합을 즐길 수 있다.,
홍어일번지,643046,음식,음식점,한식,http://tong.visitkorea.or.kr/cms/resource/30/1974330_image2_1.jpg,전라남도,126.7104518225,34.9997768825,"나주 영산포에서 국내 최초로 홍어만을 전문으로 취급하는 홍어 전문점이다. 사단법인 대한 명인 문화예술교류회는 2대째 홍어요리를 이어오고 전통음식 발전과 계승에 기여한 나주 홍어의 안국현 대표를 음식 부문 홍어 명인으로 선정했다. 주인장이 17년 동안 갈고닦은 솜씨로 만든 홍어요리는 10여 가지나 된다. 이 집이 가장 자랑하는 삼합뿐만 아니라 홍어무침, 튀김, 전 등 다양하다. 톡 쏘는 맛이 나도록 삭혀서 막걸리와 곁들여 먹는 홍탁이 가장 유명하며 이른 봄 보리싹과 홍어 내장을 넣어 홍어애국을 끓이기도 하며, 회, 구이, 찜, 포 등으로 먹기도 한다.","<a href=""http://www.nskates.com"" target=""_blank"" title=""새창 : 홍어일번지 홈페이지로 이동"">http://www.nskates.com</a>"
홍연,2624463,음식,음식점,중식,,서울특별시,126.9800598249,37.5645211757,"중국 요리에 대한 선입견을 깼다. 광둥식 요리를 우아한 분위기에서 즐길 수 있는 홍연은 기존 중국 요리의 틀을 깨고 새로운 트렌드를 만들어가고 있다. 이곳은 맛과 영양이 조화를 이루는 요리를 추구한다. 이를 위해 해산물, 두부, 채소 요리를 중심으로 시간과 품이 더 들더라도 건강을 위해 공을 들인다. 대표 메뉴로는 불도장, 전가복, 북경오리, 홍연 탕수육 등이 있다. 전복과 갑오징어, 해삼 등을 채소와 곁들여 먹는 전가복은 깔끔하면서 담백하고, 한국인이 가장 좋아하는 탕수육은 쫄깃한 식감을 제대로 느낄 수 있다.",
홍연폭포,2758652,자연,자연관광지,폭포,http://tong.visitkorea.or.kr/cms/resource/50/3338650_image2_1.jpg,부산광역시,129.1667035724,35.2958702558,"홍연폭포는 기장군의 유일한 폭포로 거문산과 옥녀봉 사이에 흐르는 웅천천 계곡에 있는 2단의 계단상 폭포이다. 홍류 폭포 또는 무지개 폭포로도 불린다. 무지개 폭포는 폭포가 떨어지며 만든 물보라가 햇살을 받아 오색의 무지개를 만든다고 하여 붙은 이름이며, 이 지명을 한자화하여 홍연 또는 홍류 폭포가 되었다. 홍연폭포의 높이는 평상시를 기준으로 하면 상단이 5m, 중단이 20m가량이며, 중단에서 낙하한 물이 수직에 가까운 반석 위를 100m 정도 흘러 홍류동 소류지로 모인다. 기장 8경 중 오경에 해당하는 경승지이다. 철마에서 정관으로 가는 곰내터널 입구에서 내리면 가까운 거리에 홍연폭포가 있어 접근성이 좋으며, 폭포에서 도보로 5분 거리에 수도암이 있고, 아홉산 숲과 곰내연밭도 가까운 거리에 있다.","<a href=""https://www.gijang.go.kr/tour/board/view.gijang?boardId=BBS_0000018&menuCd=DOM_000000301001000000&startPage=1&categoryCode1=B001&categoryCode2=B001002&dataSid=74"" target=""_blank"" title=""새창 : 홈페이지로 이동"">https://www.gijang.go.kr/</a>"
홍영장,2569143,음식,음식점,중식,,전북특별자치도,126.7140376482,35.9880120189,"홍영장은 군산의 짬뽕거리에 위치한 중식당으로 방송에서 인정받은 맛집이다.
평소에 흔히 맛볼 수 없는 메뉴인 물짜장이 유명하다.",
홍영재장수청국장,2871285,음식,음식점,한식,,서울특별시,127.0644843057,37.5075570864,"홍영재장수청국장은 서울지하철 2호선 삼성역(무역센터) 2번 출구 부근에 있다. 매장이 있는 상가건물 자체에 주차장(발레파킹 이용 시 유료) 있어 방문 시 자동차로 이용하기 편리하다. 이곳은 콩을 주제로 한 웰빙을 선도하는 청국장이 가미된 퓨전 한정식이다. 비건 손님들에게도 추천할만하다. 매장 내부는 넓은 홀에 인원별 다양한 테이블 구성과 개별 룸까지 있어 단체 행사나 가족 모임에도 적당하다. 대표 메뉴로는 장수, 자연, 건강, 오색 세트가 있다. 이외 백세 세트도 인기가 많다. 추가로 별미인 팥빙수도 많이 찾는다.",
홍예공원,2912698,인문(문화/예술/역사),휴양관광지,공원,http://tong.visitkorea.or.kr/cms/resource/86/2912686_image2_1.jpg,충청남도,126.6655189265,36.6546097626,"홍예공원은 충청남도 홍성군 홍북읍 신경리에 있다. 홍예공원은 2016년에 만들어졌다. 공원 이름은 내포신도시 행정구역인 홍성군의 홍 과 예산군의 예 자를 따서 지어졌다. 면적은 27만 4650㎡다. 공원에는 2개의 호수가 있고 3개의 산책로가 있다. 산책로의 총길이는 2840m에 달한다. 더불어 자전거 도로와 다목적 운동장도 조성됐다. 화장실, 주차장, 자전거 보관대 등의 편의시설도 갖췄다. 홍예공원은 야경도 아름답기로 소문났다. 밤이 되면 공원 곳곳에 설치된 바닥조명이 은은한 분위기를 연출한다. 조명은 자미원의 둘레길을 도는 산책로에도 설치됐다. 자미원 둘레기엔 초승달 모양의 조형물도 있다. 밤이 되면 노란 조명이 들어오며 호수에 달이 뜬 것 같은 느낌을 준다. 또한 아파트의 불빛에 비치는 풍경도 볼거리 중 하나로 자미원에서 불 켜진 아파트를 보는 것도 색다른 재미다.","▪ <a href=""https://blog.naver.com/hsgstory/223386857364"" target=""_blank"" title=""새창: 홍성군 공식 블로그로 이동"">https://blog.naver.com/hsgstory</a>"
홍예문,944855,인문(문화/예술/역사),역사관광지,문,http://tong.visitkorea.or.kr/cms/resource/54/3395954_image2_1.JPG,인천광역시,126.6263307153,37.4745503404,"무지개처럼 생긴 문이라는 뜻의 홍예문(虹霓門)은 철도 건설을 담당하고 있던 일본 공병대가 1906년 착공하여 1908년에 준공하였다. 응봉산 산허리를 잘라 높이 약 13m, 폭 약 7m의 화강암 석축을 쌓고 터널처럼 만든 석문(石門)으로, 위치는 인천광역시 중구 송학동 3가 20이며, 면적은 1,952.6㎡이다. 건설 당시 인천 중앙동과 관동 등에 거주하던 일본인들의 수가 급격히 늘자 만석동 방면으로 자신들의 영역을 확장하기 위해 이 홍예문(을 뚫었는데 일본인들은 혈문(穴門)이라 불렀다. 공사를 진행할 때 예기치 못한 거대한 암석을 만나 공사 기간이 오래 걸렸다 한다. 당시 일본의 토목공법을 알 수 있는 문화유산으로서 원형이 그대로 보존되어 있다. 홍예문을 통과하면 폭이 좁은 2차선 도로가 지나며, 홍예문 위쪽 길에 서면 인천항이 한눈에 내려다 보인다.
(출처 : 국가유산청)","<a href=""https://www.heritage.go.kr/heri/cul/culSelectDetail.do?culPageNo=1&region=1&searchCondition=%ED%99%8D%EC%98%88%EB%AC%B8&searchCondition2=&ccbaKdcd=21&ccbaAsno=00490000&ccbaCtcd=23&ccbaCpno=2112300490000&ccbaCndt=&ccbaLcto=&stCcbaAsdt=&endCcbaAsdt=&header=view&returnUrl=%2Fheri%2Fcul%2FculSelectViewList.do&pageNo=1_1_1_0&p=multiSch&sortType=&sortOrd=&sngl=Y&s_kdcdArr=00&s_ctcdArr=00&ccbaPcd1Arr=99&ccbaGcodeArr=00"" target=""_blank"" title=""새창 : 홈페이지로 이동"">https://www.khs.go.kr/main.html</a>"
홍용가,2905623,음식,음식점,중식,http://tong.visitkorea.or.kr/cms/resource/99/2905599_image2_1.jpg,강원특별자치도,128.5594948243,38.1869977253,"홍용가는 강릉시 속초시에 있는 중식당이다. 울산바위가 멀리 보이는 곳에 있는 식당이다. 예약제로만 운영하는 식당이라 반드시 전화 예약을 하고 방문해야 한다. 빈자리가 있어도 예약이 아니면 받지 않는다. 일반 중식당의 짜장이나 짬뽕과는 색다르게 해물이 많이 올라가 있다. 짜장면을 시키면 짜장 위에 유산슬이 올라가 있다. 해물짜장 같기도 하고 삼선짜장 같기도 하다. 모든 음식이 양이 충분하고, 재료를 아끼지 않았다는 것을 실물로 보면서 느낀다. 탕수육은 바삭하고 고기는 부드럽다. 가격도 합리적이다. 예약제로 운영하면서 방문한 모든 손님이 편안하게 식사를 할 수 있기를 바라는 주인의 배려이다. 주차는 매장 앞에 전용 주차장이 있어 편하게 이용할 수 있다.",
홍원,681230,음식,음식점,중식,http://tong.visitkorea.or.kr/cms/resource/48/1178848_image2_1.jpg,서울특별시,126.9354447097,37.5552214564,서강대 정문에서 신촌로터리 방향으로 가다 보면 플라자상가(거구장 건물) 지하 1층에 위치한 중국음식점이다. 건물에 엘리베이터가 설치되어 있어서 식당 접근이 편리하다. 테이블 간격이 넓고 실내가 깨끗해서 인근 대학생들도 많이 찾는 곳이다.,
홍원막국수,686189,음식,음식점,한식,http://tong.visitkorea.or.kr/cms/resource/58/1022358_image2_1.jpg,경기도,127.5472351409,37.4026280129,‘홍원막국수’는 1991년 이포 대교가 세워지기 전부터 이포나루를 건너는 사람들과 낚시꾼들을 상대로 생겨난 막국수집으로 근방의 막국수집들 중에 단연 으뜸으로 치는 맛집이다. 기존의 투박한 맛에서 좀 더 발전해 조금 덜 자극적인 맛을 연구해 근래에 와서는 젊은 층에게까지 인기를 끄는 집으로 직접 재배한 유기농 식자재가 그 맛의 근원이라 할 수 있겠다.,
홍원사,2759964,인문(문화/예술/역사),역사관광지,사찰,,서울특별시,126.8404806729,37.5720539135,"불교 신자들을 향한 수행과 포교 활동을 위해 도심에 2005년 새로 건립했다. 사찰 이름의 ‘홍원’이라는 뜻은 ‘크나큰 서원으로 일체중생을 제도하겠다’라는 의미를 담고 있다. 전통과 현대가 어우러진 사찰 건축으로 건물 맨 위의 금동탑이 인상적이다. 9호선 양천향교역 2번 출구를 통해 찾아갈 수 있으며, 인근에 궁산 근린공원과 서울식물원이 있다.",
