title,contentid,cat1,cat2,cat3,firstimage,region,mapx,mapy,overview,homepage
신흥사(양산),127193,인문(문화/예술/역사),역사관광지,사찰,http://tong.visitkorea.or.kr/cms/resource/25/1228325_image2_1.jpg,경상남도,128.9509660036,35.4264404818,"* 영축산 기슭에 있는 사찰, 신흥사(양산) * 

영축산 기슭에 있다. 301년 선사 신본이 창건했다고 하나 이때는 신라에 불교가 들어오기 전이므로 신빙성이 없다. 창건 당시에 건물이 110동이나 되었다고 한다. 중종대까지의 연혁은 알 수 없으며, 1582년(선조 15) 성순(性淳)이 중창하였다. 1592년(선조 25) 임진왜란 때 승군(僧軍)의 거점이 되어 왜군과 격전을 치르면서 대광전(大光殿)을 제외한 대부분의 건물이 불에 탔다. 이후 1757년(영조 33)에서 1765년 사이에 제작된 여지도서(輿地圖書)에 “신흥사는 군의 서쪽 육십 리 이천산에 있다”라고 기록되어 있어 영조대에 존속하고 있었음을 알 수 있다.

1801년(순조 1) 호명(浩溟)이 삼창을 하였고, 그 뒤 쇠락하여 농막 형태로 명맥을 이어오다가 1983년 영규(靈珪)가 주지로 부임하여 화엄전과 지장전, 칠성각, 산신각, 천왕문, 일주문, 국사당(局祠堂)을 새로 짓고, 대광전을 중수하였다.신흥사본전인 대광전은 조선 효종 8년(1657년)에 건립된 건물로서 보물로 지정되어 있다. 대광전 안의 관음삼존벽화에는 관음보살이 물병 대신 물고기를 들고 있는 것이 특이하다. 대부분 17세기 중엽에 그려진 것으로 일부는 18세기에 다시 그려진 것으로 추정된다. 절 주변경관이 뛰어나 많은 관광객과 불자들이 즐겨찾는 곳이다.

* 김수로왕과 관련 있는 신흥사의 창건설화 *

신흥사의 창건설화에 의하면, 만어사(萬魚寺:신흥사의 옛 이름)에서 기도를 하던 가야국 수로왕에게 말하기를 양주 땅에 옥지가 있는데 그곳에 독룡(毒龍)이 살고 있으므로 이를 쫓아내지 않으면 안 될 것이라 하였다. 수로왕이 정성을 다하여 기도를 함에 부처가 육신통의 주술을 발휘하니 만어사에 있던 돌들이 모두 고기로 변하여 옥지에 있는 독룡을 동해로 쫓아버렸다고 한다.지금도 신흥사에 있는 돌들을 두드리면 쇳소리가 나는데 그때 이후부터라고 한다. 그곳에 절을 지으니 지금의 신흥사이다.",
신흥사(영천),322849,인문(문화/예술/역사),역사관광지,사찰,http://tong.visitkorea.or.kr/cms/resource/03/3402703_image2_1.jpg,경상북도,128.8986507487,35.937759612,"신라 진평왕 때 세워진 사찰이라는 설이 전하지만, 신흥사에 대한 기록은 찾을 수 없다. 원래 평지에 있는 사찰이었으나 오래전에 경작지로 변하여 석탑만이 남아있던 것을 1957년 당시 금호 포교당에 있던 장백현이 신흥사로 중창하였다. 사역 내의 석탑으로 보아 통일 신라 시대의 사지일 것은 분명하지만 알려진 바가 없다. 신흥사는 영천 신월리 삼층 석탑을 중심으로 법당과 요사채가 있다. 신흥사에는 영천 신월리 삼층석탑이 보물로 지정되어 관리되고 있다.","<a href=""https://www.yc.go.kr/tour/tourInfo/view.do?mId=0403000000&idx=370"" target=""_blank"" title=""새창 : 영천시 문화관광 홈페이지로 이동"">https://www.yc.go.kr/tour/</a>"
신흥사(완도),322878,인문(문화/예술/역사),역사관광지,사찰,http://tong.visitkorea.or.kr/cms/resource/10/3382710_image2_1.JPG,전라남도,126.7548258228,34.3074720189,"완도읍이 한눈에 내려다보이는 신흥사는 완도군 완도읍 성내리 168번지 남망산(南望山) 중턱에 자리하고 있다. 1932년 김성렬 스님이 불로사(不老寺)라는 절로 창건했으나 중간에 신흥사(新興寺)로 절 이름이 바뀌었다고 한다. 완도읍에서 신흥사는 차를 이용하지 않아도 닿을 수 있는 아주 가까운 곳이다. 도심서 가깝다니 도심 속 혼잡함을 떠올리기 쉬우나, 속세의 혼잡함과 번거로움은 이미 떨쳐버린 곳이 신흥사다. 또한 신흥사에서는 매년 아이들에게 ‘장보고 학교’를 열어주고, 시민들에게 도예 공방을 열어 문화생활을 즐길 수 있게 해주고 있다. 그동안 여럿스님이 신흥사에서 수행을 하셨는데 현재 백양사(白羊寺) 방장이신 수산 지종 큰스님이 대표적이다. 신흥사는 완도의 전망을 한눈에 바라볼 수 있는 좋은 위치에 있다. 완도 전망뿐 아니라 야경도 볼 수 있다. 맑은 날이면 저 멀리 신지나 대둔산의 경치도 볼 수 있고, 어둠 박차고 올라오는 검붉은 태양의 떠오름도 볼 수 있다. 한마디로 도심과 바다가 어우러진 곳이 신흥사이다.","<a href=""https://www.wando.go.kr/tour/sub.cs?m=115"" target=""_blank"" title=""새창 : 완도군 문화관광 홈페이지로 이동"">https://www.wando.go.kr/tour/</a>"
신흥사(울산),322875,인문(문화/예술/역사),역사관광지,사찰,http://tong.visitkorea.or.kr/cms/resource/24/3048924_image2_1.jpg,울산광역시,129.390921002,35.6610639896,"함월산 신흥사는 대한불교조계종 제15교구 본사 통도사의 말사로 신라 선덕여왕 때 건립된 사찰이다. 신흥사는 신라가 삼국통일을 이룬 후 당나라의 공격을 받을 때 문두루비법(文豆婁秘法)으로 나라를 위기에서 구한 명랑조사가 세웠다. 
명랑조사는 신라 호국불교의 지표인 건흥사의 창건주이고, 문무왕 때 신라가 만리성을 쌓는 동안 신흥사에는 승병 백여 명이 머물면서 무술을 닦았다고 하니, 이 절이 초기부터 승병과 관련된 호국도량임을 알 수 있다. 
조선시대의 양란 때는 승병들을 모아 전투에 참가하여 호국의 의지를 불태우고 군량미를 제공하는 등 울산지역 승병 활동의 중심지 역할을 했다. 한국전쟁 때는 남부군 활동지였으며 지리산 자락의 다른 사찰들처럼 수많은 경전과 판각이 사라지고 폐허가 된 아픈 역사를 간직하고 있기도 하다.
신흥사의 문화재로는 국가보물지정 석조아미타여래좌상, 울산광역시 문화재자료 신흥사 구 대웅전, 신흥사 구 대웅전 단청반자가 있으며 주차장 바로 옆에는 400년 된 보호수 회화나무가 있다.","<a href=""http://www.sinheungsa.co.kr/"" target=""_blank"" title=""새창 : 홈페이지로 이동"">http://www.sinheungsa.co.kr/</a>"
신흥사(이천),322842,인문(문화/예술/역사),역사관광지,사찰,http://tong.visitkorea.or.kr/cms/resource/50/3060450_image2_1.jpg,경기도,127.5572721393,37.1455912412,"이천 설성산 중턱에 위치한 신흥사는 오랜 역사를 지닌 사찰이다. 대한불교조계종 제2교구 본사인 용주사의 말사이자 경기도 전통사찰로 지정되었다.
설성산성이 둥글게 에워싼 중간 지점에 있는 신흥사는 신라 내물왕(재위 356~402) 때 창건되었다고 한다. 설성을 쌓은 장군을 위해 세웠다는 전설이 전하나 당시는 신라에 불교가 들어오기 훨씬 전이고, 조선 후기까지는 연혁이 전하지 않아 최초 창건연대 및 절의 자세한 역사는 알 수 없다. 오랫동안 폐사가 된 채 내려오다 1700년대 말에 중창하고 1918년 3창하였으며, 1944년 수해로 유실된 것을 당시의 주지 해송이 중건하여 오늘에 이르고 있다.
경내에는 극락보전과 천불전, 범종각, 산령각과 요사채 등 여러 전각이 있으며 6~7세기 신라가 한강 유역으로 진출하며 쌓은 성인 이천설성산성과 산 아래 선읍리 입상석불이 있다. 특히 선읍리 입상석불은 통일신라 말에서 고려 초에 조성된 것으로 추정되고 있는 석불로 선읍리 마을 앞 냇가와 논바닥에 흩어져 묻혀 있던 것이 1978년 여름에 장마로 드러나 마을 앞 광장에 두었던 것을 당시 신흥사 주지였던 월선 스님이 현재의 위치로 옮겨 봉안한 것이다. 
아기자기하게 꾸며진 사찰을 거닐며 몸과 마음을 힐링하기 좋고, 산 정상에 올라 내려다보는 탁 트인 풍경은 시원한 맛이 있다. 다만 사람이 많이 다니지 않아 수풀이 제법 우거져 있으므로 등산하고자 하는 사람은 긴바지 착용을 권한다.","<a href=""http://www.icheon.go.kr/tour/index.do"" target=""_blank"" title=""새창: 이천 문화관광 홈페이지로 이동"">http://www.icheon.go.kr/tour/index.do</a><br><a href=""https://blog.naver.com/2000happy_/223444570694"" target=""_blank"" title=""새창: 공식로 이동"">https://blog.naver.com/2000happy_</a>"
신흥사(충주),322909,인문(문화/예술/역사),역사관광지,사찰,,충청북도,127.9458297483,37.112316098,"신흥사는 장병산 자락에 자리하고 있는 사찰로 1890년(조선 고종 27) 오영근이 창건했다. 오영근이 약초를 캐러 갔다가 석간수를 발견했는데, 그 물을 마시고 소원을 빌었더니 소원이 이루어졌다고 하며 이후 석간수는 신기한 약효가 있는 샘물로 이름이 났으며 근처에 초가 2칸을 마련하여 절을 창건했다고 전해진다. 건물로는 대웅보전과 삼성각, 용신각, 범종각, 요사채 등이 있다. 이 중 대웅보전은 정면 3칸, 측면 2칸의 팔작지붕 건물로 1924년 세워진 것이다. 내부에 아미타불과 석가모니불, 관세음보살의 삼존불이 있고 불상 뒤로는 극락 후불탱화와 지장 탱화, 십일면 관음 탱화 등이 모셔져 있다. 불상 주위에는 십육 나한상이 놓여 있는데, 이 중 4구는 절 부근에서 출토된 것이다. 그밖에 팔각원당형부도 재료와 고려청자 1점이 발굴된 바 있다.",
신흥사(화성),322847,인문(문화/예술/역사),역사관광지,사찰,,경기도,126.7096253485,37.193095576,"신흥사는 경기도 화성시에 있는 대한불교조계종 제2교구 본사 용주사의 말사로, 서해바다가 내려다보이는 구봉산 당성을 배경으로 자리 잡고 있는 1934년에 창건된 사찰이다. 원래 당성 안에는 절이 있었는데 오랜 세월 흐르면서 절은 없어지고, 무심히 세월만 흘러가 인근에 살고 있던 한영석 거사가 꿈에 부처를 현몽하고 당성 안에서 석불을 발견하여 절을 세웠다. 이후 1973년에 주지로 부임한 오성일스님이 불교의 황무지였던 이곳에 불법홍포의 원력을 세우고 가람을 일구어 오늘날에 이르고 있다. 
신흥사는 종단에서 지정한 전법도량으로 부처님께서 녹야원에서 첫 설법을 하시고 45년간 법을 설하여 수많은 중생을 교화한 것처럼 포교에 열과 성의를 다하고 있는 사찰이다. 그중에서 어린이 청소년 교화에 특히 중점을 두어 어린이 법당, 청소년 수련원 등 따로 만들어 일일출가 수련대회, 어린이 여름불교학교 등 많은 프로그램들을 직접 만들어 포교활동을 펼치고 있다. 신흥사가 어린이 법회로 유명한 곳이니만큼 신흥사 내에 간판이나 내용들이 한자가 아닌 한글로 쓰여있으며, 큰법당(대웅전)까지 오르는 계단은 노약자와 휠체어가 오를 수 있도록 경사로도 함께 만들어져 있다.
신흥사 내에 만들어진 부처님 교화공원은 부처님의 생애와 사상 그리고 중생 교화사 중에 중요한 사례를 형상화하여 중생을 위해 고행하고, 중생에게 삶의 지혜를 주신 부처님의 음성을 직접 듣는 듯 느껴볼 수 있도록 조성하였다. 왕복 20분 정도 소요되며 언덕길이어서 수행을 한다는 마음으로 오르면 어렵지 않다.
부처님 교화공원 내에는 부처님의 생애를 담은 팔상성도 석판 8점을 비롯하여 부모은중경 석판 11점과 30여 명의 교화중생상과 7분의 존자님상, 죽림정사, 기원정사, 그리고 초전법륜야외법당이 조성되어 있다. 부처님 교화공원은 성지순례지로 각광을 받고 있어 전국에서 많은 불자들이 방문하여 부처의 가르침을 본받고 있으며, 근처 구봉상 당성과 함께 둘러보면 좋을 듯하다.","<a href=""http://www.shinheungsa.or.kr/"" target=""_blank"" title=""새창: 신흥사 홈페이지로 이동"">http://www.shinheungsa.or.kr/</a>"
신흥시장,2769502,쇼핑,쇼핑,상설시장,,인천광역시,126.6366550068,37.4661209465,"동인천 신광사거리 인근에 있는 골목형 전통 재래시장이다. 
중구 도원동, 율목동, 신흥동에 인접해 있으며 육류, 수산물, 청과, 건어물, 반찬 등 다양한 품목을 팔고 있어 주민들이 장보기에 편리하다. 
현재 66개 상점이 운영 중이며 매년 10월에는 시장 상인회에서 할인행사 및 다양한 이벤트 행사를 열고 있다. 
공영주차장 시설을 갖추고 있으며 화장실 시설이 잘되어 있다.",
신흥시장,2781668,쇼핑,쇼핑,상설시장,http://tong.visitkorea.or.kr/cms/resource/50/2781850_image2_1.jpg,경기도,126.7710330366,37.5156092401,"경기도 부천시 삼정동에 있는 상설 재래시장. 신흥시장은 25여 년 전에 형성된 전형적인 골목 재래시장이다. 2006년 2월 인정 시장으로 승인받았다. 작은 규모지만 현대화 사업을 통해 소방시설 및 간판 상징 문 주등을 설치되었다, 골목형시장 육성 사업에 선정되어 축산물 음식거리 특화사업으로 상권 활성화를 위해 노력 중이다. 상인회는 매년 사랑의 김장 나무 행사를 진행하고 있다.",
"신흥장(3, 8일)",1960901,쇼핑,쇼핑,5일장,http://tong.visitkorea.or.kr/cms/resource/65/1959665_image2_1.jpg,경상북도,128.2040656893,36.6012684292,"점촌전통시장은 매월 3, 8, 13, 18, 23, 28일에 장이 열린다. 장날 점촌전통시장에는 주흘산 등지에서 채취된 향긋한 나물들이 많이 나오며, 200여 개의 점포들과 200여 명의 노점상들이 손님맞이를 한다. 비가림 아케이드시설, 바닥포장 등의 시장현대화사업이 완료된 상태라 모든 것들이 깨끗하게 단장되어 있고, 오가는데 불편함이 거의 없다. 신흥교회에서 농협하나로마트에 이르는 길과 그 우측 안쪽이 많은 사람들로 붐빈다. 특히 안쪽 땅바닥에는 인근 농촌에서 곡물이나 채소류·나물류 등을 갖고 나온 판매자들이 길게 줄지어 앉아 있다.",
신흥진식당,2682385,음식,음식점,한식,http://tong.visitkorea.or.kr/cms/resource/57/2682457_image2_1.jpg,전라남도,126.4186406959,34.8045718338,한국식 요리를 맛볼 수 있는 곳이다. 전라남도 목포시에 있는 한식전문점이다. 대표메뉴는 백반이다.,
신흥초밥,2912260,음식,음식점,일식,http://tong.visitkorea.or.kr/cms/resource/49/2912249_image2_1.jpg,대전광역시,127.3414333761,36.3378996187,"신흥초밥은 대전광역시 유성구 원신흥동에 위치하고 있다. 
현대적인 감각이 돋보이는 외관과 깔끔한 분위기를 연출하는 인테리어가 눈에 띈다. 대표 메뉴는 여러 가지 초밥을 맛볼 수 있는 특모둠초밥이며, 생연어초밥도 많은 사람이 찾는다. 이 밖에 수제 생등심 돈가스, 생연어회덮밥, 판모밀 등 다양한 음식이 준비되어 있다.","<a href=""https://shinheungsushi.modoo.at/""target=""_blank"" title=""새창 : 신흥초밥 사이트로 이동"">https://shinheungsushi.modoo.at/</a>"
신흥해수욕장,129542,자연,자연관광지,해수욕장,http://tong.visitkorea.or.kr/cms/resource/15/214515_image2_1.jpg,전라남도,126.9076598501,34.1836828016,"신흥해수욕장은 지리청송해변과 함께 청산도를 대표하는 해수욕장이다. 손을 담그면 금세 파랗게 물들어버릴 것 같은 쪽빛바다를 자랑한다. 신흥해수욕장은 지리청송해변과는 청산도 섬 반대편에 위치하고 있으며 백사장이 매우 넓은 해수욕장으로, 지리청송해변에 비해 편의 시설이나, 방풍림은 적으나 물이 깨끗하고 조용하며 주변 바다가 전부 낚시터이다. 
썰물때면 2km에 달하는 모래사장이 모래섬이 되고 물이 차면 마을 앞까지 물이 차는 자연의 신비를 감상할 수 있다. 간조시 드러나는 수만 평의 은빛 모래사장에서 가족이나 연인끼리 백사장에서 체험할 수 있는 조개잡이는 또 다른 추억을 간직할 수 있다.
이곳에서 슬로길 7코스, 들국화길을 이용하여 목섬(항도)까지 갈 수 있는데 목도까지 가는 길은 청산도 비경으로 꼽힐 만큼 아름답다. 가을이면 신흥리에서 항도까지 주변 갓길이 들국화로 조성되어 있어 들국화길이라 부른다.","<a href=""https://www.wando.go.kr/tour/sub.cs?m=162&tCimTitle=%EC%8B%A0%ED%9D%A5%ED%95%B4%EC%88%98%EC%9A%95%EC%9E%A5&tCimUniqId=TCIM_000000000004502&tCfdMenuChoice=tCfdBeach"" target=""_blank"" title=""새창 : 홈페이지로 이동"">https://www.wando.go.kr</a>"
신흥호텔,2622949,숙박,숙박시설,게스트하우스,,경상북도,130.9053266801,37.4839900429,"울릉도 신흥호텔은 바쁜 업무와 일상에서 벗어나, 푸른 바다를 벗삼아 맑고 운치 있는 울릉도의 휴식 공간을 마련하고자 한다. 이곳에서는 울릉도에서 들려주는 산, 계곡, 물, 바다, 나무, 새들의 이야기를 들을 수 있고 우아하면서도 깨끗한 잠자리, 편리하고 럭셔리한 시설을 마음껏 사용할 수 있다.","<a href=""http://www.xn--zv4bi8xkudn8a.com/introduction/introduction01""target=""_blank"">http://www.xn--zv4bi8xkudn8a.com/introduction/introduction01<a/>"
실로암메밀국수,2914325,음식,음식점,한식,http://tong.visitkorea.or.kr/cms/resource/13/2914313_image2_1.jpg,강원특별자치도,128.5902741374,38.1371902295,실로암메밀국수는 양양군 물치항에서 차로 5분여 거리에 있는 장산리에 있다. 양양공항이 있을 때부터 유명했던 곳으로 60년이 훌쩍 넘는 동안 한자리에서 영업을 하고 있다. 예전 건물을 그대로 두고 바로 옆에 새롭게 건물을 지어 영업을 하는 것이 다를 뿐이다. 새로 지은 건물답게 내외부가 현대적이고 깨끗하다. 실로암 메밀국수는 자체 방앗간에서 가공한 메밀을 사용하는 것 뿐 아니라  대부분의 음식 재료들을 재배해서 사용한다. 메밀국수와 함께 나오는 동치미 국물이 별미이고 보쌈이 맛있기로 유명하다.,
실리도,2387080,자연,자연관광지,섬,http://tong.visitkorea.or.kr/cms/resource/18/2387118_image2_1.jpg,경상남도,128.6370449348,35.0637837716,"실리도(實利島)는 창원시 구산면의 남동쪽 끝에서 약 500m 떨어져 있는 섬으로, 면적은 215천㎡이며, 길이 약740m, 해발고도 85m로써 현재 55가구 122명 정도의 주민들이 거주하고 있다. 창원시 구산면 심리 끝에 위치한 원전항(국가어항)에서 도선으로 약 10분정도 거리에 위치한 섬으로,하루 총 7번 운항(필요한 경우 수시로 운항)하는 배편을 이용해서 접근이 가능하다. 실리도는 남해안 도서의 특성이 살아 있는 수려한 해안경관과 갯벌이 잘 발달하여 있으며, 복지회관과 특산물 판매장, 섬을 가로질러 둘러볼 수 있는 둘레길이 설치되어 있다. 러일전쟁 당시에는 러시아 해군의 주둔지로, 러시아가 일본에 패배한 이후에는 일본의 진지로 활용되었던 곳으로, 현재는 우리나라 해군시설 일부가 이 섬 남단부에 위치해 있다.<br /><br />예부터 과실나무가 무성하여 마을 이름을 실리도로 명명하였다고 하며, 특히 매실·딸기·밤 등이 많이 생산되었고, 지금도 매실나무의 고목이 남아있다고 한다. 이 섬의 북동쪽에는 초아도라는 작은 섬이 하나 있는데, 이 지역 사람들의 말에 의하면 섬의 모습이 아득한 옛날에 이 섬에 살았던 어느 과부가 어린 아들을 데리고 그 섬에 조개 캐려고 갔다가 물이 차는 바람에 정신없이 건너오는데 외동아들을 깜빡 잊고 자기만 건너 와, 두 다리를 뻗고 통곡을 하면서 아이를 부르고 있는 모습과 같다고 하여 붙여진 이름이라 한다. 실리도는 오염되지 않은 남해안의 해안전경과 청정한 바닷빛을 볼 수 있는 육지와 가까운 섬이자 볼락과 가자미 등이 잘 잡히는 낚시터로도 유명한 곳이다, 또한 인근 지역에 '저도 둘레길 코스'와 드라마 “김수로” 촬영지로 유명한 해양 드라마 세트장이 설치되어 있어 다양한 체험을 할 수 있는 섬이다.<br>",
실리트,3305836,쇼핑,쇼핑,사후면세점,http://tong.visitkorea.or.kr/cms/resource/54/3313354_image2_1.jpg,서울특별시,127.0076821872,37.5687878415,-,
