title,contentid,cat1,cat2,cat3,firstimage,region,mapx,mapy,overview,homepage
화태도,2704724,자연,자연관광지,섬,http://tong.visitkorea.or.kr/cms/resource/60/2716660_image2_1.jpg,전라남도,127.7328196078,34.5847352803,"화태도는 1580년경 소영길이 돌산에서 이중하여 30여 년 살다가 광주로 이주하여 일시 무인도가 되었다. 1610년경 고흥에서 박경사, 순천에서 김영진, 소라에서 황동주 각각 이주하여 마을이 형성되었다. 임진왜란 당시 왜병이 쳐들어오는 것을 돌산도에서 알렸다 하여 췻대섬이라 부르기도 하였다. 1600년경에는 파태도라고 불렸으며 뽕나무가 자라는 섬이라고『조선왕조실록』에 기록되어 있다. 이후 마을 뒷산의 이름이 노적산인데 군량미 적재 지역으로 위장하였다 하여 벼 이삭 수(穗) 자를 써서 수태섬이라 하였다. 현재는 의미가 없는 벼 화자를 써서 화태도가 되었다. 2015년 12월 22일에 화태 대교가 개통되어 연륙섬이 되었다.
(출처: 전남의 섬)","<a href=""https://islands.jeonnam.go.kr/jnia/ad/si/selectSrchIslaList.do?searchTxt=%ED%99%94%ED%83%9C%EB%8F%84""target=""_blank"" title=""전남의 섬 홈페이지로 이동"">http://islands.jeonnam.go.kr</a><br><a href=""http://www.yeosu.go.kr/tour""target=""_blank"" title=""여수문화관광 홈페이지로 이동"">http://www.yeosu.go.kr/tour</a>"
화톳불양대창,135429,음식,음식점,한식,http://tong.visitkorea.or.kr/cms/resource/05/1873105_image2_1.jpg,인천광역시,126.6553046619,37.4172519531,"양·대창구이를 전문으로 하며, 참숯으로 고기를 구워 고기의 육즙이 살아있고 맛이 좋다.","<a href=""http://htb8592.modoo.at"" target=""_blank"" title=""새창 : 화톳불양대창 홈페이지로 이동"">http://htb8592.modoo.at</a>"
화평,2876309,음식,음식점,중식,http://tong.visitkorea.or.kr/cms/resource/98/2876298_image2_1.jpg,충청남도,127.2463515968,36.2866732428,"화평은 충청남도 계룡시 엄사면 엄사리에 있다. 깔끔한 외관과 차분한 분위기를 연출하는 인테리어가 눈에 띈다. 내부에는 단체석이 있어 각종 모임을 하기 좋다. 대표 메뉴는 등심탕수육이다. 이 밖에 짬뽕, 짜장, 간짜장, 볶음밥 등 여러 가지 식사류가 준비되어 있다. 이 외에 깐쇼새우, 깐풍기, 깐풍육, 깐풍새우, 양장피 등 각종 요리도 많은 사람이 찾는 인기메뉴이다.",
화평대군 식당,2831921,음식,음식점,한식,http://tong.visitkorea.or.kr/cms/resource/16/2831916_image2_1.jpg,경상북도,128.9242922193,35.9631461074,"화평대군 식당은 경상북도 영천시 성내동에 있다. 1975년에 개업한 이후 지금까지 한우만을 사용해 요리를 만든다. 대표 메뉴는 육회비빔밥이며 육회, 소주물럭, 소금구이, 한우소찌개 등도 맛볼 수 있다. 내부에 단체석이 마련되어 있어 각종 모임을 갖기 좋다. 동영천 IC에서 가깝고, 인근에 우로지자연생태공원과 시엘 GC가 있다.",
화폐박물관,2762802,인문(문화/예술/역사),문화시설,박물관,,서울특별시,126.9800071179,37.5622047772,"한국은행 화폐박물관은 우리나라 초기 근대 건축물로서 대한민국 금융의 역사와 함께 해온 유서 깊은 화폐박물관 건물은 1981년 국가중요문화재(사적)로 지정되었다. 1907년 일본 제일은행이 사용하기 위해 공사를 시작했지만 1909년 대한제국의 중앙은행으로 (구)한국은행이 설립되어 준공 이후에는 (구)한국은행 건물로 사용될 예정이었다. 그러나 일제강점기에 (구)한국은행이 조선은행으로 개칭되고, 1912년 건물이 완공된 뒤에는 조선은행 본점 건물로 이용되었다. 1950년 6월 12일 한국은행이 대한민국의 중앙은행으로 창립되면서 한국은행 본점 건물이 되었다. 한국전쟁 때 내부가 거의 파괴되었지만 1958년에 복구하였다. 1987년 이 건물 뒤편에 한국은행 신관(현 본관)이 준공되면서 원형복원 공사를 착수했다. 외벽은 이전과 같이 복원하였으나 내부는 대리석으로 마감하는 등 현대적 건물로서 기능을 수행할 수 있도록 변경하여 1989년 완공했다. 이후 2001년 한국은행 창립 50주년을 맞이하여  2001년 6월 12일에 화폐박물관으로 개관하여 현재에 이르고 있다. 

화폐박물관은 다양한 화폐와 소장 미술품 기획전을 개최하여 국내외 관람객들에게 화폐의 역사와 문화 향유의 기회를 제공하고 있다. 한국은행이 하는 일과 중앙은행 제도에 대해 알아볼 수 있고 화폐의 제조, 순환과정과 위·변조 화폐의 식별법도 설명해 준다. 화폐·금융·경제 관련 자료를 수집, 보존, 연구, 전시함으로써 어린이와 청소년을 비롯한 많은 국민들에게 화폐경제교육의 생생한 체험의 장이 되고 있다. 화폐박물관의 상설전시실은 총 2층과 13개의 전시실로 구성되어 있으며, 전시물은 외부 전시 일정 및 전시품의 보존 상태를 위하여 주기적으로 교체하고 있다. 기획전시실은 일정 별로 화폐에 관한 다양한 주제로 하여 특별기획전을 개최하고 있으며, 체험학습실에서 다양한 체험활동을 통해 화폐를 좀 더 즐겁게 학습할 수 있다.","<a href=""https://www.bok.or.kr/museum/main/main.do"" target=""_blank"" title=""새창 : 화폐박물관 사이트로 이동"">https://www.bok.or.kr/museum/</a>"
화포식당 시청,2653099,음식,음식점,한식,http://tong.visitkorea.or.kr/cms/resource/99/2661399_image2_1.jpg,서울특별시,126.9776545644,37.561843665,서울특별시 북창동에 있는 바비큐 전문점이다. 직원이 직접 구워주는 고기를 맛볼 수 있는 곳이다. 대표메뉴는 숙성 통 삼겹살이다.,
화포해변,2792592,자연,자연관광지,해수욕장,http://tong.visitkorea.or.kr/cms/resource/52/2795952_image2_1.jpg,전라남도,127.4881900405,34.8431715669,"순천 별량면 학산리에 있는 해변이다. 수산자원이 풍부하고, 간조 때 깨끗한 개펄에서 잡히는 세 발 낙지가 유명하며, 겨울이면 흑두루미·저어새·검은 머리갈매기 등 철새들이 몰려와 장관을 이룬다. ‘ㄷ’ 자로 생긴 순천만의 아랫부분에 위치하여 바닷가에서 멋진 해돋이를 맞이할 수 있다. 주변에 대대 포구 갈대숲과 송광사, 선암사, 동화사, 낙안읍성 민속마을, 주암호, 고인돌공원 등 관광지가 많다.",
화풍,2664956,음식,음식점,중식,http://tong.visitkorea.or.kr/cms/resource/57/2664957_image2_1.jpeg,광주광역시,126.9419169742,35.1319047526,"무등산국립공원 증심사지구 입구에 위치한 식당이다. 고속도로 진출입로에 근접하고 내·외국인 고객이 많이 방문한다. 
내부는 쾌적하고 넓으며, 단체석도 분리되어 있어 회식, 모임 장소로 안성맞춤이다. 또한 식당 앞 넓은 주차공간도 마련되어 있다. 매주 월요일은 정기휴무이다.","<a href=""http://www.odr.kr/M8W2Ku"" target=""_blank"" title=""새창 : 화풍 홈페이지로 이동"">http://www.odr.kr/M8W2Ku</a>"
화풍정,132988,음식,음식점,한식,http://tong.visitkorea.or.kr/cms/resource/95/1852095_image2_1.jpg,충청북도,127.8100700157,36.5127546786,화풍정에서는 속리산 청정지역에서 자생하는 산나물을 채취하여 이용하고 있으며 특히 가을철 속리산에서 채취한 송이버섯을 이용하여 요리한 송이버섯찌개는 국내외 관광객들에게까지 선호를 받고 있다. 민박도 가능하다.,
화합공원,2737286,인문(문화/예술/역사),휴양관광지,공원,http://tong.visitkorea.or.kr/cms/resource/78/2737478_image2_1.jpg,경기도,126.9055710802,37.1058757936,"화합공원은 경기 화성시 향남 2 지구 최대 체육공원이다. 
드넓은 축구장과 인라인스케이트장, 게이트볼, 배드민턴장을 갖추고 있다. 생활체육을 할 수 있는 공간으로 남녀노소 다 함께 즐길 수 있는 여러 체육시설이 모여있다. 사전 예약 후 이용가능한 체육 시설들이 있어 문의 후 이용하는 것이 좋다.",
화해당,2850114,음식,음식점,한식,http://tong.visitkorea.or.kr/cms/resource/03/2850103_image2_1.jpg,충청남도,126.2121974948,36.7040685011,"화해당은 충청남도 태안군 근흥면 도황리에 있는 간장게장 전문 음식점이다. 미쉐린 가이드 추천 식당이며, 채널 Olive 예능 프로그램 수요미식회 등 여러 방송에 출연한 바 있다. 외관과 인테리어는 깔끔한 분위기이며, 내부에는 단체석이 마련되어 있어 각종 모임을 하기 좋다. 대표 메뉴는 간장게장이다. 주재료인 꽃게는 봄에 안흥항에서 잡아, 급랭 보관하기 때문에 알이 가득하다. 서산 IC에서 가깝고, 인근에 연포해수욕장, 골든베이 CC가 있다.","<a href=""http://www.hwahaedang.com/""target=""_blank"" title=""새창 : 화해당 사이트로 이동"">http://www.hwahaedang.com/</a>"
화해당 여의도점,2855255,음식,음식점,한식,http://tong.visitkorea.or.kr/cms/resource/48/2855248_image2_1.jpg,서울특별시,126.9169444104,37.5271410552,"화해당 여의도점은 지하철 9호선 국회의사당역 4번 출구 부근에 있다. 매장이 있는 건물에 자체 주차장이 있어 자동차로 방문 이용에 편리하다. 화해당은 간장게장으로 아주 유명한 맛집이다. 미쉐린 가이드 서울에 랭크되기도 하였다. 또한 블루리본에도 선정된 곳이다. 대표 메뉴로는 간장게장과 돌솥밥, 우럭포찜이다. 특히 간장게장은 전국으로 택배 주문도 많이 나간다. 간장게장과 함께 올라오는 감태, 어리굴젓, 계란찜 등 밑반찬도 맛집으로 방문하는 요인이다.","<a href=""http://www.hwahaedang.com""target=""_blank"" title=""새창 : 화해당 사이트로 이동"">http://www.hwahaedang.com</a>"
화홍문(華虹門),264394,인문(문화/예술/역사),역사관광지,문,http://tong.visitkorea.or.kr/cms/resource/50/3407950_image2_1.png,경기도,127.0172364738,37.287076253,"화성에는 수원천이 남북으로 가로질러 흐르는데 성의 연결 부분에는 수문을 설치하여 북쪽에는 북수문, 남쪽에는 남수문을 두었다. 화홍문은 화성의 북수문으로 7개의 무지개 모양의 수문이 설치되어 있다. 특징이라면 7개의 수문의 크기가 다르다는 것이다. 가운데 수문이 좌우의 수문보다 넓고 크게 설치되어 우량[雨量]을 효과적으로 조절할 수 있다. 화홍문 동쪽 언덕에는 화려한 건축미를 자랑하는 방화수류정[訪華隨柳亭]이 있다. 

◎ 한류의 매력을 만나는 여행 정보 - 드라마 <선재 업고 튀어>
화홍문은 수문을 밝히는 조명과 산책길 덕분에 야경 명소로 유명하다. 솔이에게 선재가 마음을 고백했던 화홍문 앞 다리는 지금도 팬들이 찾아와 사진을 찍을 만큼 인기 있는 포토존이다.","<a href=""https://www.suwon.go.kr/web/visitsuwon/hs01/hs01-01/pages.do?seqNo=22"" target=""_blank"" title=""새창: 수원 문화관광 홈페이지로 이동"">www.suwon.go.kr</a>"
화화담 성수,2905346,음식,음식점,서양식,http://tong.visitkorea.or.kr/cms/resource/37/2905337_image2_1.jpg,서울특별시,127.0548702788,37.5432833204,"화화담 성수는 서울지하철 2호선 성수역 4번 출구에서 약 220m 성수동 수제화거리 주택가에 있다. 매장에 별도의 주차장은 마련되어 있지 않다. 방문 시 버스나 지하철 등 대중교통수단을 이용하는 것이 편리하다. 이곳은 수제 쌀국수와 수비드 스테이크 전문점이다. 매장은 화이트톤에 민트색의 의자가 세팅되어 있다. 대표 메뉴로는 바질크림 수비드 스테이크, 화화담 오리지널 쌀국수가 있고, 이 외에 춘천닭갈비 쌀국수, 우곱새, 게살 나시고랭, 화화담 등심돈가스 정식 등 다양한 메뉴가 있다.",
화화일식,2871309,음식,음식점,일식,http://tong.visitkorea.or.kr/cms/resource/96/2871296_image2_1.jpg,서울특별시,127.0352509187,37.5053096,"화화일식은 지하철 9호선 언주역 6번 출구 부근에 있다. 매장이 있는 상가건물에 자체 주차장(발레파킹 서비스 가능)이 있어 방문 시 자동차로 이용하기 편리하다. 이곳은 고급스러운 분위기에 정식 메뉴 구성이 좋아 비즈니스 접대에 최적인 일식집이다. 매장 내부는 넓은 홀에 인원별 다양한 테이블 구성과 개별 룸까지 있어 단체 행사나 가족 모임에도 적당하다. 대표 메뉴는 점심정식, 주말저녁정식, 저녁사시미코스, 화화특선사미미가 있다. 이외 메뉴로 특사시미, 특정식, 스페셜정식이 많이 나간다. 주변에 무궁화공원, 역삼공원, 충현공원이 있어 식사 전후에 둘러보기 좋다.",
화화쿵주마라탕,2905238,음식,음식점,중식,http://tong.visitkorea.or.kr/cms/resource/22/2905222_image2_1.jpg,인천광역시,126.6612634871,37.3798702879,"화화쿵주마라탕은 인천지하철 1호선 테크노파크역 2번 출구 송도트리플스트리트 c동 1층에 있다. 주차는 매장이 있는 건물에 할 수 있다. 이곳은 마라탕, 마라샹궈 맛집으로 유명한 마라탕 전문점이다. 외부부터 중식당 같은 빨간 건물과 인테리어가 눈에 띈다. 내부는 넓고 깨끗하다. 테이블 수가 20개 정도 되어 보인다. 테이블마다 칸막이가 쳐져 있다. 마라탕과 마라샹궈 주문은 셀프 코너에 있는 그릇과 집게를 들고 먹고 싶은 재료를 담아 계산대로 가서 매운맛 0~3단계 선택한 후 저울에 무게를 재서 계산한다. 마라탕은 1인당 최저 칠천 원 이상 마라샹궈는 만 팔천 원 이상 재료로 담아줘야 주문이 가능하다. 메뉴에는 마라탕, 마라샹궈가 있다. 이외 꿔보러우, 바지락볶음, 하얼빈, 칭따오, 연태고량주, 공부가주, 노주탄, 설원이 있다. 식당 인근에 송도센트럴파크, 인천상륙작전기념관, 인천시립박물관이 있어 식사 전후 연계 관광을 할 수 있다.",
화흥포항,2752740,자연,자연관광지,항구/포구,http://tong.visitkorea.or.kr/cms/resource/74/3380974_image2_1.JPG,전라남도,126.6794047025,34.3054460078,"화흥포항은 오래전 해도(海圖) 상에 ‘천지두’라고 명기되어 있었는데, 2001년 11월 연안항으로 지정되면서 화흥포항으로 불리게 되었다. 무역항으로 포화상태인 완도항의 기능을 분담하고 제주도 및 인근 도서 지역의 해상물류, 교통, 관광 요지의 역할 및 기능을 수행할 수 있도록 하기 위해서였다. 화흥포항에서는 항일운동의 3대 성지인 ‘소안도’와 완도의 전복 80%가 생산되는 ‘노화도’, 고산 윤선도의 세연정이 있는 ‘보길도’, 3개의 섬으로 각각 ‘대한호’, ‘민국호’, ‘만세호’를 타고 갈 수 있다. ‘소안농협 운항 시간 안내’ 밴드도 운영하고 있어, 선박 운항 여부와 시간, 정보 등을 미리 확인할 수 있다.",
환경문화전시장,1679930,인문(문화/예술/역사),문화시설,전시관,http://tong.visitkorea.or.kr/cms/resource/46/3334546_image2_1.JPG,충청북도,127.7454829353,36.6550288754,"지난 1985년 문장대 용화지구 온천지구로 지정되면서 인근 청천면 일대의 환경오염과 생활 터전의 파괴에 대한 우려되어 괴산군민과 충청도민이 개발 저지에 동참하면서 사회적인 문제로 부각되었다.  2003년 5월 30일 문장대 온천조성사업 시행 허가 취소라는 대법원 확정 판결이 날 때까지 무려 18년간의 지루한 투쟁으로 이루어낸 값진 승리를 기념하고, 환경 보전의 소중함을 일깨우기 위하여 환경문화전시관이 건립되었다. 천하대장군, 지하여장군 등의 장승 수십 개가 다양한 모습들로 만들어져 있고, 민간신앙 또는 경사가 있을 때 축하의 목적으로 세우는 솟대들이 무리 지어 있다.","<a href=""https://tour.chungbuk.go.kr/www/selectTourCntnts.do?key=60&searchMainSe=ATTR&tourNo=879"" target=""_blank"" title=""새창 : 충북나드리 홈페이지로 이동"">https://tour.chungbuk.go.kr/</a>"
환공어묵 부산역점,1962437,쇼핑,쇼핑,특산물판매점,http://tong.visitkorea.or.kr/cms/resource/51/2509651_image2_1.JPG,부산광역시,129.044827405,35.1178379463,"부평동 16번지 깡통시장에서 1940년 부터 77년의 역사를 이어온 부산어묵 '환공어묵'이다. 77년 전통의 부산어묵 '환공어묵'은 수제어묵, 카츠어묵, 고로케어묵, 봉지어묵 등 다양한 어묵을 만들고 있다. 부산역사에 위치한 환공어묵 베이커리는 부산시민과 타지에서 온 각종 여행 및 비즈니스 고객들이 찾는 곳이다. 간편하게 테이크아웃하여 즐길 수 있는 어묵부터, 여행길 가족 및 친구들에게 선물하기 좋은 선물세트까지 있다. 부산역사 내 2층에 위치해 있으며, 코레일 어플리케이션을 통해 선물세트 구입도 가능하다.<br>","<a title=""새창 : 환공어묵 홈페이지로 이동"" href=""http://www.hwangongfishbakery.com"" target=""_blank"">http://www.hwangongfishbakery.com</a>"
환구단,250299,인문(문화/예술/역사),역사관광지,종교성지,,서울특별시,126.9794848592,37.5651627568,"환구단은 서울특별시 중구에 있는 대한제국시대의 제단으로, 환단이라고도 한다. 유교적인 정치 이념을 수용해 천자가 하늘에 제사를 드리는 제천단을 가리킨다. 환구단의 한자 표기는 [고종실록]에 기록된 것이고, 한글 표기는 [독립신문]을 따라 정하였다. 고종 34년(1897) 고종의 황제 즉위식과 제사를 지내기 위해 당시 황궁인 경운궁(지금의 덕수궁) 맞은편 옛 남별궁터에 단을 만들어 조성했다. 원래는 거대한 규모를 가진 대한제국의 성역으로, 제를 올리는 환구단과 천신의 위패를 모시는 황궁우, 그리고 주변 시설로 어재실, 향대청, 석고각 등을 갖췄었다. 그러나 일제가 1913년 호텔 신축을 이유로 철거하여 환구단 본단은 없어지고 상징물 격인 황궁우와 석고각 안에 있던 돌북만 남아 있다.

환구단 정문은 원래 황궁우 남쪽 지금의 조선호텔 출입구가 있는 소공로변에 있었는데, 1960년 말 철거된 뒤 오랫동안 소재를 알지 못했다. 2007년 강북구 우이동에 있는 그린파크호텔을 재개발하는 과정에서 호텔 정문으로 사용하던 문이 원래 환구단 정문이라는 사실을 확인하고 정문의 이전 복원을 논의했다. 여러 후보지 가운데 더 많은 시민이 환구단의 존재를 인식하고 쉽게 확인하도록 서울광장, 덕수궁과 마주 보는 환구단 시민광장으로 자리를 정해 옮겨왔다. 건물은 정면 3칸 측면 2칸의 평삼문이고, 가운데 칸이 특별히 넓고 양측 칸을 좁게 조정했다. 기둥 위에는 이익공식 공포를 사용하고, 대한제국 황실 문장인 오얏꽃 문양과 봉황문 등을 장식으로 활용해 특별하다.","<a href=""https://www.heritage.go.kr/heri/cul/culSelectDetail.do?pageNo=1_1_1_1&sngl=Y&ccbaCpno=1331101570000"" target=""_blank"" title=""새창 : 홈페이지로 이동"">https://www.heritage.go.kr</a>"
환기미술관,129760,인문(문화/예술/역사),문화시설,미술관/화랑,,서울특별시,126.9661269237,37.5940980426,"환기미술관은 수화 김환기 선생이 작고한 후 작가의 예술이 갖는 귀중한 가치와 그가 생전에 한국 미술계에 미친 영향을 다시 되새기며 한국 현대미술의 풍부한 결실을 실현하기 위해 설립되었다.
김환기 선생의 작품전시를 비롯한 다양하고 활발한 기획전시, 행사, 교육프로그램 등을 운영해 오고 있다. 주요 소장품은 김환기의 작품 300여 점이며 전시는 김환기 작품의 상설 전시와 특별전, 현대미술에 대한 각종 기획전과 행사를 병행하고 있다. 수도권 지하철 3호선 경복궁역 3번 출구나 5호선 광화문역 교보빌딩 앞으로 나와서 연계버스를 이용해 부암동주민센터에 하차하고 미술관 이정표를 따라 걸어가다 보면 미술관이 보인다.","<a href=""http://www.whankimuseum.org"" target=""_blank"" title=""새창 : 환기미술관 홈페이지로 이동"">http://www.whankimuseum.org</a>"
환벽당,127322,인문(문화/예술/역사),역사관광지,유적지/사적지,http://tong.visitkorea.or.kr/cms/resource/80/3028480_image2_1.jpg,광주광역시,127.003104658,35.1857719297,"환벽당은 광주호 상류 창계천가의 충효동 쪽 언덕 위에 있는 정자로, 나주목사를 지낸 김윤제(1501∼1572)가 낙향하여 창건하고 육영에 힘쓰던 곳이다. 환벽(環璧)이란 뜻 그대로 푸르름이 고리를 두르듯 아름다운 자연경관을 이룬다라는 의미이다. 환벽당은 시가문학과 관련된 국문학사적인 인문학적 가치가 매우 큰 곳이며, 별서 원림으로서 가치가 우수한 호남의 대표적인 누정문화를 보여주는 곳이다.  당호(堂號)는 영천자 신잠이 지었으며, 벽간당이라고도 불렀음이 고경명의 유서석록에 기록되어 있다. 

건물은 정면 3칸, 측면 2칸, 팔작지붕이다. 가운데 2칸을 방으로 하여 앞쪽과 오른쪽을 마루로 깐 변형된 형식이다. 원래는 전통적 누정 형식이었으나 후대에 증축하면서 현재의 모습으로 바뀐 것으로 생각된다. 이곳에는 우암 송시열이 쓴 제액이 걸려있고, 석천 임억령과 조자이의 시가 현판으로 걸려 있다. 환벽당에 관한 시는 정철이 지은 2수가 있는데, 송강속집과 광주목지에 실려 있다. 환벽당에는 정철에 얽힌 일화가 전한다. 어느 날 김윤제가 이곳에서 낮잠을 자다가 조대 앞에서 한 마리의 용이 승천하는 꿈을 꾸었다. 꿈에서 깨어난 김윤제가 이상히 여겨 급히 그곳에 내려가보니 미역을 감고 있는 한 소년이 있었다. 그는 그 소년의 비범한 용모에 매혹되어 외손녀를 이 소년에게 시집보냈는데, 이 소년이 뒤에 정치가로서 또한 문호로서 이름을 날린 정철이었다 한다. 환벽당 아래는 김윤제와 정철이 처음 만난 곳이라는 전설이 깃든 조대와 용소가 있다. 창계천 동북쪽으로 250m쯤 떨어진 곳에는 식영정이 있으며, 환벽당 바로 곁에는 취가정이 있다. 인근에는 독수정과 소쇄원이 자리 잡고 있어 바로 이 일대가 조선시대 원림 문화의 중심 지역임을 알 수 있다.

* 사촌 김윤제
김윤제(1501~1572)는 본관이 광산으로, 충효리에서 태어났다. 1528년 진사가 되고, 1532년 문과에 급제하여 승문교리 겸 춘추관으로 벼슬길에 나아간 뒤 홍문관교리, 나주 목사 등 13개 고을의 지방관을 역임하였다. 관직을 떠난 뒤 고향으로 돌아와 환벽당을 짓고 후학 양성에 힘을 썼는데, 송강 정철과 서하당 김서원 등이 대표적인 제자이다. 임진왜란 때의 의병장 김덕령과 김덕보형제는 그의 종손으로 역시 학문의 영향을 받았다.","▪ <a href=""https://tour.gwangju.go.kr/home/tour/info/history/002.cs?act=view&infoId=647"" target=""_blank"" title=""새창 : 홈페이지로 이동"">https://tour.gwangju.go.kr</a>"
