title,contentid,cat1,cat2,cat3,firstimage,region,mapx,mapy,overview,homepage
홍주향교,1954754,인문(문화/예술/역사),역사관광지,유적지/사적지,http://tong.visitkorea.or.kr/cms/resource/60/3340160_image2_1.jpg,충청남도,126.6664200422,36.6097288323,"홍주향교는 고려시대에 건립되었다고 전해지지만, 구체적인 근거가 확인되지는 않아 처음 지은 정확한 연대는 알 수 없다. 홍주향교의 보수내역은 19세기 후반부터 확인 가능하다. 1871년(고종 8년)에 향교의 대성전을 중수하였고, 1880년에는 동서무와 중삼문이 신설되었다. 1893년에는 대성전이 중수되었고, 1914년에는 대성전과 후원이 수선되었으며, 1924년에는 문묘 전부가 보수되었다. 현대에 들어서는 1958년, 1972년, 1995년에 중개수가 있었다.
향교의 건물은 낮은 구릉지에 앞에 명륜당을, 뒤에는 대성전을 정남향으로 배치한 전학후묘식 형식을 따르고 있다. 명륜당 전면 좌우에 있던 동재, 서재는 일제 때 훼철되었고, 전사청만 남아있다. 대성전은 전면 3칸, 측면 3칸인데 전면 1칸은 툇칸으로 개방하였으며, 경내에는 동무, 서무, 제기고 등이 남아있다. 특히 축문을 태우는 망료대, 어둠을 밝히는 청료대, 손을 씻는 관수대 등 유교 건축의 석물이 남아있다. <경국대전>에 의하면 홍주향교에는 조선전기에 종6품의 교수가 파견되었고, 조선중기에 제독관제도가 실시될 때에는 6품의 문관으로 제독관이 파견되었다 한다.","<a href=""https://www.hongseong.go.kr/prog/cultureAssets/tour/sub01_050202/C2/view.do?pageIndex=1&asset_seq=49"" target=""_blank"" title=""새창 : 홍성군 문화관광으로 이동"">https://www.hongseong.go.krtour/</a>"
홍지문 및 탕춘대성,129506,인문(문화/예술/역사),역사관광지,성,,서울특별시,126.9582886241,37.5985196107,"임진왜란 및 병자호란 이후 수도 방위를 위하여 1719년에 완성한 성곽 서울 도성과 북한산성을 연결하기 위해 쌓은 것이다.1715년(숙종 41)에 서울의 도성과 북한산성의 방어시설을 보완하기 위해 홍지문(弘智門), 오간수문(五間水門),  탕춘대성(蕩春臺城)을 건립하였다. 홍지문은 서울의 북서쪽 방어를 위한 탕춘대성의 출입문으로 한북문(漢北門)이라고도하며 홍지문에 연결된 탕춘대성은 서쪽에 있어서 서성(西城)이라고도 한다. 원래 탕춘대성이 있는 세검정 일대는 삼국시대부터 한산주(漢山州)로서 군사상 중요한지역이었다.  탕춘대성은 인왕산 정상의 서울 성곽에서부터 홍지문을 거쳐 수리봉까지 이어진 4km 정도이다.

탕춘대성은 도성·북한산성을 연결하는 성으로, 인왕산 동북쪽에서 시작하여 북쪽을 향해 능선을 따라 내려가다가 모래내를 지나 삼각산 서남쪽 비봉아래까지 연결되어 있었다. 이 성은 완공되지 못한 상태로 남아 있으니,  동쪽부분인 북한산성의 보현봉에서 형제봉을 지나 북악터널 위인 보토현을 거쳐 구준봉 서쪽으로 서울성곽과 이어지는 부분은 성이 이루어지지  않았다. 이 성의 명칭을 탕춘대성이라 한 것은 현재 세검정이 있는 동으로 약 100 여m가 되는 산봉우리에 연산군의 놀이터였던 탕춘대가  있었으므로 그 이름을 딴 것이다. 또한, 도성의 서쪽에 있다 하여 서성이라 하였으며,  겹성으로도 불려졌다. 탕춘대성 능선길은 완만하며 쉽게 오를 수 있는 오솔길로 등산을 겸한  역사탐방로가 된다. 탕춘대성에 오르려면 세검정 상명대학교와 구기터널·홍은동에서 시작하면 성관에 쉽게 접근할 수 있다.  탕춘대성은 홍지문·오간대수문을 경계로 크게 두 지형으로 나눈다. 홍제천을 경계로 남서쪽은 인왕산의 서울성곽에서 북쪽으로 갈려나 온 산줄기를 따라 축조되어 있고, 북동쪽은 북한산국립공원  탕춘대 능선을 따라 해발 527.5m 의 비봉을 향해 뻗어 있다. 인왕산지역은 서울 성곽에서 갈라진 지점으로부터 급경사를 타고 내려오는 지형으로,  솔밭 우거진 능선길에 토루가 형성되어 있다. 토루가 북쪽으로 이어지면서 성 바깥쪽으로 돌출된 암반 능선지대를 만난다.

홍지문은 숙종이 친필로 '弘智門(홍지문)'이라 편액을 써서 문루에 달았는데,1921년에 주저앉아 방치되었던 것을 1977년 7월에 서울특별시 도성복원위원회에서 홍지문과 오간대수문, 그리고 주변 성곽 280m를 포함하여 복원하였다. 이때 홍지문 현판은 박정희 대통령의 글씨로 새겨졌다. 홍지문은 홍예형태의 육축 위에 정면 3칸 측면2칸(9.38m X 4.02m)의 우진각지붕을 한 단층 문루가 있으며, 문루좌우에는 협문을 내고 전돌로 여장을 둘렸다.  육축의 앞뒤로 홍예에 철엽을 씌운 문비를 마련하고, 육축내부 좌우측에 성으로 오를수 있는 계단을 두었다.홍지문은 한성의 북쪽에 있다하여 '한북문'이라고도 하였다. 1999년에 성문의 단청과문비를 비롯하여 문루 좌우  협문을 보수하였다. 상명대 앞에서 내리면 홍지문으로 향하는  진입로로 들어갈 수 있다. 옆으로 흐르는 시내가 걸음을 재촉한다. 맑은 물과 깨끗한 환경이 잘 보존되어 있다면 홍지문과  그  계곡이 더욱 빛을 발할 것이다.  홍지문은 산으로 연결되는 성, 즉 탕춘대성과 이어져있다. 급격히 산으로 오르는 도성은 아직도 고성의 면모를 간직하고 있다.","<a href=""https://www.heritage.go.kr/heri/cul/culSelectDetail.do?ccbaCpno=2111100330000&pageNo=1_1_1_1&sngl=Y""새창: 문화재청 홈페이지로 이동"">http://www.cha.go.kr</a>"
홍차가게 소정,2768822,음식,음식점,카페/전통찻집,,충청북도,127.5993042058,36.3587240531,"탁 트인 창으로 보이는 대청호, 잔잔한 음악, 그리고 향긋한 홍차 한 잔이 눈과 귀, 그리고 입안을 즐겁게 하는 홍차가게 소정은 다양한 홍차의 맛과 아늑한 분위기가 매력적인 카페이다. 문화공간비 8,000원을 내면 홍차와 디저트 메뉴가 제공되며, 그림 같은 경치를 구경할 수 있다.",
홍차이나,2682871,음식,음식점,한식,http://tong.visitkorea.or.kr/cms/resource/86/2682686_image2_1.jpg,서울특별시,126.9073203266,37.5257549332,여러가지 중식요리를 맛볼 수 있는 곳이다. 서울특별시 영등포구에 있는 중식전문점이다. 대표메뉴는 짬뽕이다.,
홍천 ST리조텔,2432993,숙박,숙박시설,모텔,http://tong.visitkorea.or.kr/cms/resource/56/2432856_image2_1.jpg,강원특별자치도,127.6723620177,37.617260999,"홍천 ST리조텔은 강원도 홍천군 서면에 위치하고 있는 리조텔로, 전원도시 양평과 용문에 인접해 있다. 사계절 내내 강원도의 산과 강, 바다를 즐길 수 있는 편안한 쉼터다. 대명 비발디 스키장과 최고의 물놀이장 오션월드가 5분 거리이며 인근에는 홍천군의 절경인 팔봉산을 비롯해 홍천강을 따라 많은 유원지가 자리한다. 
객실은 2~3명이 머물기 좋은 디럭스, 일반실부터 가족이 머물기 좋은 한실 형태의 가족룸까지 다양한 형태의 객실을 비교적 저렴한 가격에 이용할 수 있다. 일부 객실에서는 취사가 가능해 직접 요리를 할 수 있다. 세미나실, 바비큐장, 족구장, 노래방 등의 다양한 부대시설을 완비해 놀거리도 풍부하다.","▪  <a href=""http://홍천리조텔.kr"" target=""_blank"" title=""새창 : 홍천 ST리조텔 홈페이지로 이동"">http://홍천리조텔.kr</a><br>
▪ <a href=""https://hc3339.modoo.at/""target=""_blank"" title=""새창 : 공식로 이동"">https://hc3339.modoo.at/</a>"
홍천 가리산 레포츠파크,2372816,레포츠,복합 레포츠,복합 레포츠,http://tong.visitkorea.or.kr/cms/resource/85/2492185_image2_1.JPG,강원특별자치도,127.9811710711,37.8656906963,국내 최대 규모의 레포츠 종합 테마파크로 홍천 가리산 자연휴양림 내에 위치하고 있다. 대표 체험 프로그램으로는 사계절이 아름다운 가리산을 지그재그로 가로지르는 플라잉짚(짚라인)과 동일 시스템 이용객 1위와 실제 같은 긴장감과 타격감을 느낄 수 있는 GPR 서바이벌 그리고 3m와 9m의 아찔한 높이에서 즐기는 장애물 통과 레포츠인 포레스트 어드벤처가 있다.,"▪ <a href=""https://www.hongcheon.go.kr/tour/contents.do?key=1892"" target=""_blank"" title=""새창 : 홍천 가리산 레포츠파크 페이지로 이동"">https://www.hongcheon.go.kr/</a><br> ▪ <a href=""https://hcleportspark.modoo.at/""target=""_blank"" title=""새창 : 가리산모로 이동"">https://hcleportspark.modoo.at/</a>"
홍천 동창보수로 및 암각명,2702556,인문(문화/예술/역사),역사관광지,유적지/사적지,http://tong.visitkorea.or.kr/cms/resource/98/3385198_image2_1.JPG,강원특별자치도,128.1600797209,37.7771126945,"홍천 동창보수로 및 암각명은 강원도 홍천군 서석면 수하리에 있는 전체면적 2,555㎡, 길이 약 1㎞ 정도의 농경 유적으로 1994년 4월 25일 강원도 기념물로 지정되었는데, 조선 후기의 수리 및 관개 시설의 형태를 비교적 잘 보여주고 있다. 개인이 소유 관리 중이다. 홍천 동창보수로 및 암각명은 면적히 상당하다. 갈 때는 꼭 운동화를 신어줘야 하고 조선시대의 관개시설을 살펴 볼 수 있다 함께 들리면 좋은 곳은 강재구 공원, 기미만세공원, 무궁화 공원인데 풍경도 아름답지만 거기에 담긴 애국심도 꼭 배우고 와야 한다.","<a href=""https://www.heritage.go.kr/heri/cul/culSelectDetail.do?culPageNo=1&region=1&searchCondition=%EB%8F%99%EC%B0%BD%EB%B3%B4%EC%88%98%EB%A1%9C&searchCondition2=&ccbaKdcd=23&ccbaAsno=00650000&ccbaCtcd=32&ccbaCpno=2333200650000&ccbaCndt=&ccbaLcto=&stCcbaAsdt=&endCcbaAsdt=&header=view&returnUrl=%2Fheri%2Fcul%2FculSelectViewList.do&pageNo=1_1_1_0&p=multiSch&sortType=&sortOrd=&sngl=Y&s_kdcdArr=00&s_ctcdArr=00&ccbaPcd1Arr=99&ccbaGcodeArr=00""target=""_blank"" title=""새창 : 국가유산청 홈페이지로 이동"">www.heritage.go.kr</a>"
홍천 무궁화 테마파크,2806196,자연,자연관광지,수목원,,강원특별자치도,127.8686643478,37.6881203157,"홍천군이 대한민국 무궁화 메카도시에 선정됨에 따라 대한민국의 꽃 무궁화의 위상을 높이고 무궁화의 아름다움을 널리 알리고자 2011년 9월에 조성된 공원이다.
2019년 10월 18일 홍천군의 2호 무궁화 명소로 선정된 무궁화 테마파크는 총 면적 19,559㎡에 5,769본의 무궁화가 식재되어 지역주민들을 비롯한 관광객들이 편안한 시간을 보낼 수 있도록 조성한 공원이다. 무궁화를 비롯한 다수의 식물이 식재되어 있으며 연못, 관찰데크, 파고라, 운동기구 등의 편의시설이 설치되어있다.
무장애 체험길, 터미널, 주변 무궁화 관련 시설과 인접하여 무궁화 관광지의 역할을 충실히 수행하고 있으며 연중무휴 개방하여 운영하고 있다.","<a href=""https://www.hongcheon.go.kr/mugunghwa/index.php"" target=""_blank"" title=""새창 : 무궁화수목원 홈페이지 이동"">https://www.hongcheon.go.kr/mugunghwa</a>"
홍천 무궁화공원,125734,인문(문화/예술/역사),휴양관광지,공원,http://tong.visitkorea.or.kr/cms/resource/31/3043031_image2_1.jpg,강원특별자치도,127.8719475656,37.6819627582,"홍천 무궁화공원은 일제강점기에 무궁화를 널리 보급한 한서 남궁억 선생을 기념하여 세운 공원이다. 무궁화공원은 무궁화의 종류와 개화 시기가 다른 1,500여 종의 무궁화가 식재된 무궁화 테마 공원이다. 공원 안에 남궁억의 시비와 군민헌장기념비, 충혼탑, 3·1만세탑, 6·25전쟁 홍천지구전투 전적비, 반공희생자위령탑 등이 있다. 입장료는 없으며 홍천군민과 청소년들을 대상으로 향토애와 나라 사랑을 가르치는 교육장으로 활용되고 있다. 무궁화공원 안에 홍천의 역사와 문화유적을 볼 수 있는 홍천박물관이 있다.
주변에 고려시대 불상으로 추측되는 홍천진리석불, 홍천 괘석리 4사자삼층석탑, 통일신라시대에 세워진 것으로 추측되는 홍천희망리당간지주 등 문화재들이 산재해 있어 함께 둘러보면 홍천의 역사와 문화를 알 수 있다.","홍천 문화관광 <a href=""https://www.hongcheon.go.kr/tour/selectTourCntntsWebView.do?tourNo=11&pageUnit=6&pageIndex=1&searchCnd=all&key=2040&ctgry=11&searchShowAt=Y"" target=""_blank"" title=""새창: 홍천 문화관광 홈페이지로 이동"">http://www.hongcheon.go.kr/tour</a>"
홍천 무궁화마을,1919999,인문(문화/예술/역사),체험관광지,농.산.어촌 체험,,강원특별자치도,127.6009049054,37.7024109046,"굽이쳐 흐르는 홍천강과 수려한 산세가 어우러진 아름다운 자연경관을 자랑하는 무궁화마을은 일제강점기 독립운동가 낙궁억선생이 백성에게 민족정신을 고취하고 애국심을 함양시키기 위해 무궁화를 전국에 보급했던 유서 깊은 고장이다. 홍천에서는 매년 10월에 나라꽃 무궁화 축제를 개최하고 있다.
홍천 무궁화마을에서는 무궁화를 이용한 허브차 다도 체험, 허브 압화 만들기, 짚공예 체험, 보리빵 만들기 등의 전통문화 체험을 즐길 수 있고, 트랙터 관람차로 마을을 둘러볼 수 있다. 또한 독립운동가 남궁억 선생의 기념관, 무궁화동산 관람, 짚공예 체험, 무궁화 차 만들기, 무궁화 압화 만들기 등을 통해 전통문화, 역사 체험도 할 수 있다. 자연 청정지역 홍천강 상류에 있는 무궁화마을은 밤벌유원지에서 물놀이 체험, 민물고기 잡기 체험, 래프팅 체험 등을 즐길 수 있으며, 자녀와 함께 유리봉 산책로, 배바위 산책로를 걸으며 야생화 및 각종 수목에 대해 보고 배울 수 있다.
홍천 무궁화마을은 무궁화체험관과 밤벌유원지 주변의 펜션을 비롯하여 숙박시설과 음식점도 갖추고 있어서 가족여행이나 단체여행을 하기에 좋은 곳이다.",
홍천 무네미농장,2755698,레포츠,육상 레포츠,"야영장,오토캠핑장",http://tong.visitkorea.or.kr/cms/resource/83/2756283_image2_1.JPG,강원특별자치도,128.2254757474,37.8045496408,"홍천 무네미 별마루 관광농원은 강원도 홍천군 내면에 위치하고 있다. 700m 고지에서 맑은 공기를 마시며 편안하고 조용한 캠핑을 할 수 있다. 넓은 잔디밭과 숲이 적절한 조화를 이루고 있으며 봄, 가을에 흐드러지게 피는 꽃밭을 감상할 수 있다. 캠핑장을 방문하는 캠퍼의 공간을 보장하기 위해 하루 총 4동의 텐트만 받는다.","<a href=""https://hcmunemi.modoo.at/"" target=""_blank"" title=""새창 : 홍천 무네미 별마루 관광농원 사이트로 이동"">https://hcmunemi.modoo.at/</a>"
홍천 배바위카누마을,2002445,인문(문화/예술/역사),체험관광지,농.산.어촌 체험,,강원특별자치도,127.5852584345,37.7253385074,"서쪽으로는 장락 산맥이 있고, 동쪽으로는 홍천강이 흐르는 마곡리 배바위 카누마을은 강변을 이용한 수상공원을 만들고 매년 카누대회를 여는 전국 최고의 레저 체험마을을 꿈꾸고 있다. 강변 절벽에 위치한 두 개의 바위가 마치 커다란 범선을 연상케 하고 바위 위에 솟은 소나무는 배의 돛을 세운 것처럼 보인다고 하여 배바위라 부른다. 홍천강변 트래킹과 캠핑도 가능하여 여름철 많은 이들이 찾는 곳이다.","<a href=""https://www.hongcheon.go.kr/tour/selectTourCntntsWebView.do?tourNo=252&key=1856""target=""_blank"" title=""새창: 홍천군 문화관광 포털 홈페이지로 이동"">https://www.hongcheon.go.kr/tour</a>"
홍천 비발디파크 K1 SPEED,2714524,레포츠,육상 레포츠,경기장,http://tong.visitkorea.or.kr/cms/resource/92/2615592_image2_1.jpg,강원특별자치도,127.6873540732,37.6523905338,"K1 SPEED 비발디파크는 아시아 최초, 국내 최대의 실내 레이싱 체험공간이다. 안전하고 친환경적인 전기 카트를 운영하고 있는 K1 SPEED 비발디파크점은 총 925평 규모에 202미터 길이의 트랙을 보유하고 있다. 실내 전기 카트 레이싱의 스릴과 흥분을 체험하고 싶다면 K1 SPEED 비발디파크에 방문하면 좋다.","<a href=""https://www.sonohotelsresorts.com/vp/"" title=""비발디파크 홈페이지로 이동"">https://www.sonohotelsresorts.com/vp/</a>"
홍천 쁘띠힐링카라반,2752067,레포츠,육상 레포츠,"야영장,오토캠핑장",http://tong.visitkorea.or.kr/cms/resource/22/2752222_image2_1.JPG,강원특별자치도,127.7302630766,37.6861429676,"쁘띠힐링카라반 캠핑장은 홍천강에서도 아름답기로 유명한 노일 유원지 언덕에 자리잡았다. 서울에서 50분, 팔봉산 유원지에서 15분 거리다. 앞으로는 홍천강이 내려다보이고, 옆으로는 청정 계곡에 접해 있는 캠핑장으로 강에서의 낚시체험, 다슬기 체험 등을 할 수도 있다. 캠핑장 안에 큰 규모의 수영장이 있고, 카라반마다 개별 데크와 바비큐 그릴을 갖췄다.","<a href=""http://www.쁘띠힐링카라반.com"" target=""_blank"" title=""새창 : 홍천 쁘띠힐링카라반 사이트로 이동"">http://www.쁘띠힐링카라반.com</a>"
홍천 살둔마을,802670,인문(문화/예술/역사),체험관광지,농.산.어촌 체험,http://tong.visitkorea.or.kr/cms/resource/80/3043180_image2_1.jpg,강원특별자치도,128.3765056361,37.8335102714,"살둔마을은 강원도 홍천군 내면에 있는 오지마을로, 사람이 기대어 살만한 둔덕이라는 의미가 있다. 정감록에 삼둔사가리라 하여 환란을 피할 수 있는 7곳 중 현존하고 있는 대표적인 마을이다. 오대산, 방태산, 계방산, 석화산이 사방으로 둘러싸여 맑은 공기와 내린천 발원지에서 내려오는 깨끗한 물 등 청정 자연을 그대로 간직하고 있다.
봄이면 하얀 돌배꽃이 피어나고, 여름이면 시원한 내린천에 견지낚시와 물놀이를 즐길 수 있으며, 가을이면 금송화꽃이 온 동네에 노랗게 물들어 있어 산책하기 좋은 마을이다. 살둔마을은 살둔캠핑장과 통나무펜션을 운영하고 있다. 살둔분교 캠핑장에서는 폐교된 학교를 활용하여 캠핑과 트랙터 관람차를 즐길 수 있으며, 통나무펜션은 한국의 아름다운 집 100선에 선정되기도 했다.
살둔마을에서는 견지낚시, 걷고 싶은 길 산책, 자전거 트래킹등을 즐기며 다양한 체험을 할 수 있다.
주변에 볼거리로는 삼봉휴양림, 은행나무숲, 살둔계곡, 문암골, 쌍문폭포 등 자연 명소가 자리하고 있어서 마을과 함께 둘러보기에 좋고, 때 묻지 않은 비경을 간직한 곳으로, 현대인들의 힐링과 휴식을 위한 최적의 장소이다.","<a href=""https://www.hongcheon.go.kr/tour/index.do"" target=""_blank"" title=""홍천군 문화관광 사이트로 이동"">홍천군 문화관광 https://www.hongcheon.go.kr/tour/index.do</a><br><a href=""https://map.naver.com/p/entry/place/19896630?lng=128.3712875&lat=37.831875&placePath=%2Fhome&entry=plt&searchType=place&c=14.85,0,0,0,dh"" target=""_blank"" title=""살둔마을생둔분교캠핑장 네이버 예약 사이트로 이동"">살둔마을생둔분교캠핑장 예약 https://map.naver.com/p/entry/place</a>"
홍천 삼생마을,786187,인문(문화/예술/역사),체험관광지,농.산.어촌 체험,http://tong.visitkorea.or.kr/cms/resource/88/3382988_image2_1.JPG,강원특별자치도,128.2185073035,37.6999783009,"강원도 홍천의 삼생마을은 군청소재지에서 35km 떨어진 화양강 상류의 청정지역으로 넉넉한 인심과 예의를 숭상하며 정감이 넘치는 사람들이 모여 살아가는 자연경관이 아름다운 고장이다. 동쪽으로는 내면과 평창군 봉평면, 서쪽으로는 화촌면과 내촌면, 남쪽으로는 동면과 횡성군 청일면, 북쪽으로는 인제군 상남면에 접하고 있는 비교적 고산지대이면서도 평야가 많은 곳이다. 삼생마을은 전형적인 농업면으로 수리시설이 발달된 옥토에서 질 좋은 수라쌀과 특산품으로는 매년 열리는 찰옥수수축제와 함께 인지도를 높여가고 있는 찰옥수수, 전국적으로 높은 인지도와 원조격의 전통을 자랑하는 옥수수찐빵, 오랜 작목반 생산으로 우수한 품질로 승부하는 느타리버섯이나 영지버섯, 생산을 시작한지 오래되지 않아 높은 지심의 밭에서 길러낸 6년근인삼, 그리고 옥선주 등이 있다. 주변의 경관이 매우 아름다워 여름철이면 많은 피서인파가 찾아오고 있는 서봉사와 모둘자리 관광농원, 예술촌 등의 휴양시설은 어디에 내놓아도 손색이 없을 정도로 독특하면서도 훌륭한 시설을 갖추고 있으며 특히 서봉사계곡이나 아미산등산로, 생곡저수지 등은 삼생마을 특유의 청정한 자연환경을 자랑하고 있어, 자연관광과 휴양관광을 함께 즐길 수 있는 농촌마을이다.",
홍천 숲속정원 축제,3382126,인문(문화/예술/역사),축제,일반축제,http://tong.visitkorea.or.kr/cms/resource/14/3382114_image2_1.jpg,강원특별자치도,128.1036673086,37.8057027538,"내촌면 도관2리 꽃차마을이 농업법인 자연드림과 함께 특별한 행사를 준비되어있다. 홍천군 내촌면의 맑은 공기와 자연의 기운을 듬북 담아, 몸과 마음을 치유하는 특별한 시간을 제공한다.","<a href=""https://www.xn--p50b7i49w7var22dita35uc3k6b.com/165"" target=""_blank"" title=""새창 : 홍천 숲속정원  축제 페이지"">https://www.xn--p50b7i49w7var22dita35uc3k6b.com/165</a>"
홍천 열목어마을,2714726,인문(문화/예술/역사),체험관광지,농.산.어촌 체험,http://tong.visitkorea.or.kr/cms/resource/83/2388083_image2_1.JPG,강원특별자치도,128.5058295374,37.8501247145,"강원도 홍천에 있는 열목어 마을은 백두대간이 지나는 길목인 해발 700m 구룡령로에 있다. 구룡령은 용이 구불구불 휘저으며 하늘로 올라가는 것처럼 아흔아홉 구비를 넘어간다 하여 이름 붙여졌다. 이곳의 통마람 계곡과 개방천은 맑은 1 급수를 유지해 하천 전체가 멸종 위기종이자 강원도 문화재 제67호인 열목어 서식지로 지정받았다. 마을에는 10미터 이상의 강원도 백두대간 나무를 직접 타보는 트리 클라이밍과 숲 밧줄 놀이 프로그램 등을 비롯해 나무 수액 받기, 김치부침개와 도토리묵 만들기, 곰취나물 채취 등 다양한 체험 프로그램이 마련돼 있어 가족단위 관광객에게 좋은 추억거리를 제공한다.","<a href=""http://www.mgrbest.com/""target=""_blank"" title=""홍천 열목어마을"">http://www.mgrbest.com/</a>"
홍천 은행나무숲,1899635,자연,자연관광지,수목원,,강원특별자치도,128.4707332608,37.8321872306,"해마다 10월이면 한 달 동안 일반인에게 개방되는 홍천 은행나무 숲은 한 개인이 30년 동안 가꾼 숲이다. 홍천지역 가을을 대표하는 최고명소인 은행나무숲은 5m 간격으로 은행나무만 2,000여 그루가 심겨 있다. 10월이 되면 노랗게 물든 은행잎이 장관을 연출한다.
인근에는 홍천 9경 중 한 곳인 삼봉약수가 있고 구룡령도 가까워 최고의 가을 여행지로 손꼽히고 있다. 
홍천 은행나무숲은 한 개인이 30년 동안 가꾼 숲으로, 오대산 광천수인 삼봉약수의 효험을 듣고 남편이 아내의 건강을 위해 한그루 한그루 직접 심었다고 한다. 1985년부터 25년 동안 단 한 번도 개방하지 않다가 2010년 입소문이 나기 시작하면서 관광객들을 위해 1년 중 10월에만 무료로 개방하고 있다.
주변 관광지로 가칠봉과 삼봉약수, 국립삼봉자연휴양림 등이 있어 편안한 휴식을 위한 여행을 계획한다면 꼭 들러볼 만하다.","<a href=""https://www.hongcheon.go.kr/tour/selectTourCntntsWebView.do?tourNo=2125&pageUnit=6&pageIndex=1&searchCnd=all&key=2038&ctgry=9&searchShowAt=Y"" target=""_blank"" title=""홍천 은행나무숲 사이트로 이동"">https://www.hongcheon.go.kr/tour</a>"
