title,contentid,cat1,cat2,cat3,firstimage,region,mapx,mapy,overview,homepage
안성 프로방스 펜션,719305,숙박,숙박시설,펜션,http://tong.visitkorea.or.kr/cms/resource/67/1786767_image2_1.jpg,경기도,127.4514481486,37.0546831416,레스토랑을 함께 운영하는 안성 프로방스 펜션은 유럽의 이름 모를 작은 마을 마냥 아기자기하고 목가적인 풍경을 만날 수 있다. 서울하고 가까워 교통편이 편리하다. 또한 단체 손님이 와도 넉넉한 바베큐장과 족구장이 마련돼있으며 특히 봄에는 야외결혼식을 할 수 있게 예약도 받고 있다.,"<a href=""http://www.asprovence.com"" target=""_blank"" title=""새창 : 안성 프로방스 펜션 홈페이지로 이동"">http://www.asprovence.com</a>"
안성객사,128541,인문(문화/예술/역사),역사관광지,유적지/사적지,,경기도,127.3240552243,37.0141771822,"안성 객사는 1363년 이전에 건립된 객사이다. 현존하는 객사 중 유일하게 고려 시대에 건축된 것으로 가장 오래된 객사 건축물이다. 객사는 고려시대, 조선시대에 각 고을에 설치하였던 관사 또는 객관인데, 사신이 여기저기 오고 갈 때 묵던 숙소였다. 조선시대에 와서는 그 형태가 표준화되어 전국에 360여 개에 달하는 객사를 두었고 구조는 중앙에 정청을 중심으로 동익사와 서익사를 두고 누각을 두는 것이 일반적이었다. 
안성객사는 고려시대 건축인 주심포 양식(처마 끝의 무게를 받치기 위해 기둥머리에 짜 맞추어 댄 나무인 공포를 기둥 위에만 배열한 것)의 객사 건물로 주건물 좌우에 붙어 뻗어 나온 부속건물로 구성되어 있다. 주가 되는 건물이 중앙에 있고 양옆으로 부속사가 있는 날개집이다. 이러한 건물 양식은 수덕사 대웅전과 강릉 객사문에서도 볼 수 있다.","▪ <a href=""https://www.anseong.go.kr/tour/themeTourist/view.do?mId=0102010000&idx=39"" target=""_blank"" title=""새창 : 홈페이지로 이동"">https://www.anseong.go.kr</a>"
안성대농리석불입상,128522,인문(문화/예술/역사),역사관광지,유적지/사적지,http://tong.visitkorea.or.kr/cms/resource/30/3382930_image2_1.jpg,경기도,127.2719251415,37.0662785673,"고려시대에 유행한 불상 양식의 석불입상이다. 대농리 석불입상은 마을 소나무 숲 옆으로 소나무 몇 그루와 함께 도로 한편에 조용히 서 있다. 
신체에 비해 큰 머리에는 원나라 귀족들이 쓰던 모자였으나 원 간섭기 이후 고려의 관리와 승려들이 착용 원 정모 형식의 갓이 얹혀 있다. 양감이 없는 얼굴에는 가로로 긴 눈과 도톰한 코, 다물고 있는 작은 입이 표현되었고 두 귀는 어깨까지 늘어져 있다.
양어깨를 덮고 내려오는 법의는 양쪽 팔뚝에서 굵은 띠 모양의 주름을 형성하고 있다. 오른손에 정병을 들고 왼손으로 이를 받치고 있는 특이한 자세를 보이고 있다. 법의 아래 드러난 왼손에는 팔찌를 하고 있어, 여래상이 아닌 보살상일 가능성도 생각해 볼 수 있다.
게다가 정병은 여래상이 아니라 보살상의 지물이라는 점도 참고할 만하다.돌기둥 같은 신체에 양감이 드러나지 않는 밋밋한 표현, 몸에 비해 큰 머리와 이목구비의 표현, 머리에 쓴 갓, 한 손에 들고 있는 정병의 표현 등이 용인 미평리 약사여래입상과 매우 유사한 표현 기법을 보이고 있어 주목된다. 이러한 표현은 특히 고려 전기에 충청도와 경기 남부를 중심으로 유행한 불상 양식의 계보를 보여주며 양감 없는 얼굴과 신체, 가로로 긴 눈과 두툼한 코, 일자로 다문 입, 크기에 비해 빈약하게 처리된 두 팔과 손의 표현 등에서 고려 후기 불상의 지방 양식도 반영하고 있는 작품이라 할 수 있다.","<a href=""http://www.anseong.go.kr/tour
"" target=""_blank"" title=""안성 문화관광 사이트로 이동"">http://www.anseong.go.kr/tour
</a><br />
<a href=""http://www.cha.go.kr/"" target=""_blank"" title=""문화재청 사이트로 이동"">http://www.cha.go.kr</a>"
안성도기동삼층석탑,128536,인문(문화/예술/역사),건축/조형물,기념탑/기념비/전망대,http://tong.visitkorea.or.kr/cms/resource/93/190893_image2_1.jpg,경기도,127.2641054586,37.0006026717,"옛 안성 읍내가 내려다보이는 도기동 입구에서 돌계단을 오르면 작은 언덕 위에 놓인 석탑이다.  단층 기단과 3층의 탑신으로 구성되어 있다. 원래 이곳에 있었던 것으로 추측되지만 법당지는 찾아보기 어렵다.
석탑은 높이가 5.4m로 전체적인 양식으로 보아 백제계 석탑에 이은 고려시대 석탑이다. 평면 사각형의 기단 위에 3층 탑신을 올렸다. 기단·탑신·옥개 등 중요한 재료 모두 화강암으로 만들어 쌓았으며 석탑의 형태는 일반형을 이루고 있다.
이 탑의 탑신부 아래 단은 여러 장의 넓고 평평하게 다듬어진 판석을 서로 맞대어 세워 기둥 역할을 하며 지지하고 있고 안쪽은 비어있는 상태로, 조립된 지대석 위에 모서리 기둥만이 조각된 기단을 놓았다.
갑석은 1장의 얇은 돌로 만들었는데 아래에는 1단의 부연이 있다. 탑신부 1층 몸돌 부분은 넓은 돌판을 여러 장 돌려가며 세워 몸통을 이루었고 몸돌은 한 장의 돌로 다듬어져 있다. 옥개 받침이 있는 옥개석은 없으며, 현재 2층에 해당하는 옥개석만 하부에 2단의 받침을 두었을 뿐이다. 지붕돌은 편평한 석재를 놓아 다른 석탑에서와 같은 조형미를 찾을 수 없다. 전체적인 양식으로 보아 고려 후기에 조성된 것으로 생각되며 생긴 모양의 특이성 때문에 5층 옥개석이 소실된 오층 석탑으로 보는 견해도 있다.","▪ <a href=""https://www.heritage.go.kr/heri/cul/culSelectDetail.do?pageNo=1_1_1_1&sngl=Y&ccbaCpno=3413100760000"" target=""_blank"" title=""새창 : 홈페이지로 이동"">https://www.heritage.go.kr</a><br>▪ <a href=""https://blog.naver.com/anseongsi1/221827406314""target=""_blank"" title=""새창 : 안성시 공식블로그로 이동"">https://blog.naver.com/anseongsi</a>"
안성리수국길,2778897,자연,자연관광지,자연생태관광지,http://tong.visitkorea.or.kr/cms/resource/97/2799597_image2_1.jpg,제주특별자치도,126.2837741374,33.269702002,안성리수국길은 관광지로 개발된 곳이 아니라 마을에 살고 계신 노부부께서 돌담에 심어 놓은 수국들이 멋진 장관을 이뤄 사람들이 방문하여 SNS에서 올려 유명해진 곳이다. 개발 지역이 아니기에 주차장이 따로 마련되어 있지 않아 수국이 피는 시기에 방문하면 혼잡할 수 있다. 수국 개화 시기에 따라 다르지만 6월 중순쯤 마을에 들어서면 양쪽 돌담 사이 쭉 피어있는 수국을 보고 있자면 웬만한 수목원보다 더 멋스러운 풍경을 감상할 수 있다. 수국이 만개하는 시기에는 아름다운 순간을 담기 위해 예비부부들이 촬영하러 온다. 관광명소로 개발된 곳이 아닌 주민들이 사는 동네이기에 방문하게 된다면 조용히 감상하며 감사의 마음을 표현하는 것도 좋을 거 같다.,
안성마춤유기공방,132641,쇼핑,쇼핑,공예/공방,http://tong.visitkorea.or.kr/cms/resource/83/1788483_image2_1.jpg,경기도,127.2764597498,37.005946721,"안성유기는 ""안성맞춤""의 대명사로 통한다. 놋쇠 또는 통쇠라고 하며 장인정신과 뛰어난 솜씨로 사람들의 마음을 사로잡았기에 이렇게 불렀다고 전해진다. 안성유기는 한동안 그대로 잘 유지되어 오던 것이 일제침략으로 인하여 1941년부터 일본이 태평양전쟁을 일으키면서 전국에 있는 유기를 거두어들임으로 큰 타격을 받게 되어 일시에 안성유기가  없어지는 큰 수난을 겪게 되었다. 그러나 뜻있는 유기공들은 산으로 숨어들어 계속 유기를 만들었다. 전쟁중에는  안성 유기가 별로 성행을 보지 못하여 5~6곳이 있을 정도였으며 대부분 일제의 눈을  피하여 산 속 등지에서 숨어 제작하였다. 그러나 해방과 더불어 안성 유기는 갑자기 성행하여 안성 시내 곳곳에서 유기업이 번성하였다. 이때는 식기류인 반상기를 중심으로 하여 수저,젓가락, 담뱃대 등을 비롯하여 해방의 감격으로 급격히 성행한 농악기구까지 만들게 되었다. 본래 농악기구는 방자(놋쇠를  달군 후 두들겨 만드는 방법)식으로 제품을 만드는데 안성 유기의 특징은 주물제작법이었으므로 이때부터 안성유기에도 방자 제작법이 성행하여 안성유기의 절정을 이루었다. 

 그러나 안성유기도 거대한 생활 변화로 밀려오는 시련은 어쩔수 없었다. 그것은 광복 후 반짝하고 빛나던 성황이 사라진 것이다. 왜냐하면 일반 생활에 있어서 연료의 변화가 온  것이다. 본래 우리나라의 일반적 연료는 장작을 위주로 한 나무였다. 그러나 6.25가 지나고 대도시의 연료가 연탄으로 바뀌게 되었다.

 주로 부엌에서 사용되는 놋식기는 연탄가스와  상극적인 관계가 있어 시뻘겋게 녹이 슬거나 누렇게 변해버려 곧 식기로  사용할 수  없게 되었다. 이렇게 되자 유기 대신에 알루미늄 그릇이나 스텐레스 그릇으로 바꾸어 사용하게 되고 아울러 유기는 자취를 감추게 되었다. 6.25를 전후로해서 안성의 유기는 절정을 이루는 듯하여 그 공장의 수만도 37개나 되었으나 지금은 중요무형문화재로 지정되어 계보를 잇고 있다.","<a href=""http://myoungpoom.com"" target=""_blank"" title=""새창 : 안성마춤유기공방 홈페이지로 이동"">http://myoungpoom.com</a>"
안성맞춤 남사당 바우덕이 축제,506690,인문(문화/예술/역사),축제,문화관광축제,http://tong.visitkorea.or.kr/cms/resource/04/3377804_image2_1.jpg,경기도,127.3101782044,37.0318776686,"안성맞춤 남사당 바우덕이 축제'는 우리나라 중요무형문화재 및 유네스코 세계 무형문화유산으로 
 지정된 '남사당놀이'를 소재로 한 축제로, 조선 전국 3대 장터의 풍성함을 '안성 옛 장터'로 재현하고,   각종 체험 및 전시회, 남사당 공연, 해외 민속 공연과 전통 · 현대 공연 등이 펼쳐진다.
또한, 2024-2025 문화체육관광부 선정 문화관광축제로 문화와 관광을 아우르는 풍성한 프로그램을 제공한다.","<a href=""https://www.anseong.go.kr/festival/main.do"" target=""_blank"" title=""새창: 안성맞춤남사당바우덕이축제 홈페이지로 이동"">https://www.anseong.go.kr/festival/main.do</a>"
안성맞춤 먹거리타운,611591,인문(문화/예술/역사),체험관광지,이색거리,http://tong.visitkorea.or.kr/cms/resource/05/3050005_image2_1.JPG,경기도,127.2663604054,37.0151482563,"안성맞춤 먹거리타운은 1990년대 안성시의 신시가지가 들어선 주변 아파트들과 한경대학교를 중심으로 형성된 곳이다. 다양한 종류의 음식을 맛볼 수 있는 곳으로, 해물탕과 갈비, 칼국수 등의 향토 음식을 맛볼 수 있다. 
2006년 경기도가 이곳을 음식문화 시범거리로 지정하여 낭비적인 식생활 습관과 푸짐한 상차림을 지양함으로써 식량자원의 낭비를 막고 환경 오염을 방지하고자 하였다. 이를 통해 건강하고 알뜰한 음식 문화를 정착시키고 좋은 식단의 실천을 확산하려고 하였다. 더불어 지역 환경과 특성에 맞는 건강한 먹거리 음식 문화의 성공적 모델로 육성하고 지역 경제 활성화에 기여하고자 했다.","<a title=""새창에서 열림"" href=""http://www.anseong.go.kr/tour"" target=""_blank"">http://www.anseong.go.kr/tour</a>"
안성맞춤가족공원,127613,인문(문화/예술/역사),휴양관광지,공원,http://tong.visitkorea.or.kr/cms/resource/49/3382849_image2_1.jpg,경기도,127.2029689431,37.013883378,"안성맞춤가족공원은 전원주택 단지 조성을 목적으로 전망 좋은 구릉 지대에 자리한 공원이다. 답답하지 않고 탁 트인 공간에서 푸르름을 만끽할 수 있는 곳으로, 산책길은 잘 정돈되어 있고 옆으로는 잔디밭과 나무들이 잘 가꾸어져 있어 상쾌한 산책을 즐길 수 있다. 
안성맞춤가족공원에는 쾌적하게 즐길 수 있는 여러 가지 문화 시설이 완비되어 있다. 중앙공원에는 분수대와 아이누리 놀이터, 농구장, 배구장, 족구장 등의 시설이 갖춰져 있고 야외 운동기구들도 있어 가족이 모두 즐길 수 있는 곳이다. 특히 이곳 분수 놀이터는 음악 분수라 신나는 음악이 흘러나오고 여름에는 물놀이를 즐길 수 있어 아이들이 부모와 함께 안전하게 물놀이를 할 수 있는 즐거운 공간이기도 하다. 
이 밖에도 중앙 송림 속에 죽마루와 야로정 두 정자가 마련되어 있고, 공원 내 대림동산 도서관이 있어 책을 편안하게 읽을 수 있다.","<a href=""https://www.anseong.go.kr/tour/main.do"" target=""_blank"" title=""안성문화관광 사이트로 이동"">https://www.anseong.go.kr/tour/main.do</a>"
안성맞춤랜드,2525563,인문(문화/예술/역사),휴양관광지,공원,,경기도,127.3054285825,37.0336857086,"‘안성맞춤랜드’는 2012년에 개장한 대규모 부지 내에 준공된 시민공원이다. 남사당공연장, 천문과학관, 공예문화센터, 캠핑장, 사계절썰매장, 잔디광장, 야생화단지, 수변공원 및 분수광장 등 다양한 시설을 한 곳에서 이용하기 편리하며 예술과 과학, 자연이 만나는 복합 문화예술 공간인 동시에 시민들의 편안한 휴식처이다. 2012년에는 세계민속축전의 개최지였다.","<a href=""https://www.anseong.go.kr/tour/contents.do?mId=0103010100""target=""_blank"" title=""새창 : 홈페이지 이동"">https://www.anseong.go.kr/</a>"
안성맞춤박물관,130440,인문(문화/예술/역사),문화시설,박물관,http://tong.visitkorea.or.kr/cms/resource/17/2996017_image2_1.jpg,경기도,127.2283306103,37.0114035624,"중앙대학교 다빈치캠퍼스 입구에 세워진 안성맞춤 박물관은 유기를 중심으로 안성의 풍부한 문화유산을 함께 접할 수 있는 테마 박물관이다. 흔히 사람들은 매우 잘 맞음을 비유하여 [안성맞춤]이라는 말을 쓰는데, 이 말은 안성에서 유기를 만드는 장인들이 뛰어난 솜씨로 유기를 정성껏 만들어 품질이나 모양 등 기교면에서 많은 사람들의 마음을 만족시켜 생겨난 표현이다. 
박물관은 지상 2층, 지하 1층, 총 3층으로 이루어져 있으며, 유기 전시실, 영상실, 기획 전시실, 농업역사실, 향토 사료실, 세미나실, 학예연구실, 수장고 등으로 이루어져 있다. 유기 전시실은 유기의 역사, 제작 방법별 유기 분류, 유기 제작 과정 모형, 제기, 반상기, 무구, 불기 등 생활 속에 쓰이는 다양한 유기를 전시하고 있다. 또한 관람객의 이해를 돕기 위해 곳곳에 영상물을 설치하였는데 터치스크린을 통해 안성의 역사와 문화에 대한 자세한 설명을 볼 수 있다. 농업역사실은 안성 농업의 역사와 계절에 따른 농경 모습, 안성의 특산물이 전시되어 있어 과거와 현재의 안성농업을 알 수 있다. 향토 사료실에는 안성의 옛 모습이 담긴 사진, 안성 장시 재현, 안성 남사당, 불교문화재 등 안성문화와 역사를 한눈에 볼 수 있다.
교육 프로그램으로는 유아를 대상으로 박물관 관람 문화를 익히고, 안성의 특산품에 대해 배울 수 있는 '안녕? 안성!' 등이 준비되어있다.","<a href=""https://www.anseong.go.kr/tourPortal/museum/main.do"" target=""_blank"" title=""새창 : 홈페이지로 이동"">https://www.anseong.go.kr</a>"
안성맞춤아트홀,2747170,인문(문화/예술/역사),문화시설,공연장,http://tong.visitkorea.or.kr/cms/resource/85/2750585_image2_1.png,경기도,127.2789568725,37.0014500623,"안성시 현수동에 위치한 안성맞춤 아트홀은 2017년에 안성천과 조령천이 만나는 지점에 문화와 예술의 조화를 위해 건립되었다. 예술을 위한 소통의 공간으로 공연과 전시, 문화예술 교육을 아우르는 것을 목표로 하고 있다. 건물은 두 개의 동으로, 갤러리 동과 공연장 동으로 나뉘어 있다. 수준 높은 공연과 뮤지션의 콘서트 등을 즐길 수 있는, 경기 남부를 대표하는 예술 랜드마크이다.","<a href=""https://www.anseong.go.kr/arthall/main.do"" target=""_blank"" title=""새창 :안성맞춤아트홀사이트로 이동"">https://www.anseong.go.kr/arthall/</a>"
안성맞춤포도축제,615807,인문(문화/예술/역사),축제,일반축제,http://tong.visitkorea.or.kr/cms/resource/48/1691048_image2_1.jpg,경기도,127.2569991549,36.9507194067,"안성포도의 우수성을 홍보하고 브랜드 가치 향상 및 농가소득 증대를 위하여 안성 포도 농가와 함께 축제 기간에 맛 좋은 포도를 판매한다. 포도 품평회, 포도와인 만들기, 지역 농산물 판매, 노래자랑 등 다양한 행사를 기획하고 있다.",
안성맞춤포시즌애견테마파크,2747141,음식,음식점,카페/전통찻집,http://tong.visitkorea.or.kr/cms/resource/29/2750629_image2_1.png,경기도,127.2813742821,36.9669651933,"경기도 안성에 있는 애견 카페이다.  약 20만㎡ 임야에 16,000㎡ 규모로 조성된 야외 애견테마 카페. 반려동물을 위한 잔디 운동장, 수영장, 셀프 목욕까지 자연과 어우러진 쾌적한 환경에서 견주와 동물이 함께  놀 수 있는 곳이다. 견주 입장료와 반려견의 입장료가 별도이다. 운동장과 셀프목욕비용은 반려견 크기에 따라 각각이다. 도사견은 출입할 수 없다.

※ 입장료 : 견주 7,000원, 반려견 8,000원",
안성문화원,129870,인문(문화/예술/역사),문화시설,문화원,http://tong.visitkorea.or.kr/cms/resource/00/191200_image2_1.jpg,경기도,127.3240857757,37.0142327321,"안성문화원은 선열로부터 내려오는 4.1 만세 항쟁의 애국 애족 정신과 남사당놀이의 예향 정신, 안성 유기의 장인 정신을 바탕으로 안성지역과 안성 시민의 특성을 살릴 수 있도록 문화적인 혁신과 개혁을 하고자 건립하였다.
또한 문화재 보호와 유적 답사 등 우리 고유의 문화를 보존하고 계발하고 발전시켜 후손들에게 선조들의 생활상과 문화상을 알리고자 노력하고 있다.
안성문화 홍보 및 다양한 행사를 주관하고 있는데 주요 행사로는 전통민요경창대회, 전국국악경연 대회, 바우덕이 축제, 청소년을 위한 충, 효, 도 캠프 등이 있다. 다양한 자원봉사 활동을 통해 지역의 어려운 분들을 돕고 지역 활성화에 힘쓰고 있다.","안성문화원 <a href=""http://www.ascc.or.kr/"" target=""_blank"" title=""새창 : 안성문화원 블로그로 이동"">http://www.ascc.or.kr/</a>"
안성베네스트 골프클럽,131895,레포츠,육상 레포츠,골프,http://tong.visitkorea.or.kr/cms/resource/13/1940013_image2_1.jpg,경기도,127.3839633457,37.0271017705,안성베네스트 골프클럽은 아름다운 칠현산 자락에 펼쳐진 코스로 1999년 6월 정식 Open 이후 현재까지 골퍼들의 아낌없는 사랑을 받고 있다. 경관의 수려함과 아름다운 계곡의 능선을 코스에 담고 있으며 다이내믹하고 도전적인 코스를 자랑한다. 또한 새로운 차원의 9홀 퍼블릭 코스를 2000년 9월 정식 개장하여 운영하고 있으며 정규홀의 명성을 퍼블릭 코스로 이어가고 있다. 하늘과 산이 만난듯한 퍼블릭 9홀 코스의 라운딩은 정규홀에 비해 전혀 손색없는 감동을 선사한다. 서울 도심에서 1시간 정도 소요되는 가까운 거리에 최상의 그린과 수준 높은 서비스가 여러분을 기다리고 있다.,"<a href=""http://www.golfsamsung.com/"" target=""_blank"" title=""새창 : 안성베네스트 골프클럽 안내 페이지로 이동"">www.golfsamsung.com</a>"
안성순 해장국,2893591,음식,음식점,한식,http://tong.visitkorea.or.kr/cms/resource/25/2893325_image2_1.jpg,경기도,127.5231143759,37.2339443047,"안성순 해장국은 경기도 이천시 부발읍에 있는 해장국 전문점이다. 내부는 넓고 밝은 분위기에 깔끔하다. 대표 메뉴인 명품해장국은 선지해장국이다. 따뜻한 선지를 밑반찬처럼 따로 제공하기도 한다. 선지는 신선하여 냄새 없이 폭신하고 맛은 고소하다. 명품해장국에는 소내장과 선지, 천엽, 고기, 우거지, 콩나물이 들어있다. 소내장과 선지의 양이 푸짐하고 국물 맛은 깔끔하고 시원하다. 선지를 선호하지 않는 손님들을 위한 한우 곰탕과 한우 우거지탕도 있다. 한우 곰탕은 한우 양지에 한우 육수를 사용하여 진하고 구수하다. 한우 우거지탕은 한우 양지와 푸짐한 우거지가 들어있고 시원한 국물 맛이 좋다. 안성순해장국은 고춧가루, 고추기름, 배추 등 모두 국내산만 사용한다. 양지고기와 선지, 내장도 한우 1등급으로 요리하며 육수는 한우 잡뼈와 사골로 국물을 진하게 낸다. 선지는 리필해 주고, 반찬은 셀프 코너에서 추가로 이용할 수 있다. 술은 무조건 1인 1병만 판매한다. 7km 이내에 복하천수변공원과 다수의 골프장이 있다.",
안성시 중앙도서관,130867,인문(문화/예술/역사),문화시설,도서관,http://tong.visitkorea.or.kr/cms/resource/14/191414_image2_1.jpg,경기도,127.2684379935,37.015226062,"안성시 중앙도서관은 안성 시민을 위한 정보·문화 및 평생교육센터임과 동시에 안성에 관한 정보를 얻고자 하는 사람들에게 안성 관련 정보를 제공하는 최종 정보원이다. 어린이부터 어르신까지 누구나 방문할 수 있고, 30만권이 넘는 책을 맘껏 볼 수 있는 이곳은 안성시에 있는 도서관의 효율적인 운영과 각종 문화시설과의 긴밀한 협조를 위하여 도서관 운영위원회를 두고 있으며, 다른 도서관과도 네트워크를 구축하여 다양한 주제의 자료에 접근할 수 있다. 
중앙도서관은 지하 1층, 지상 2층으로 구성되어 있다. 지상 1층의 경우 유아 및 어린이 자료실과 종합자료실이 있다. 이곳에서는 아동도서뿐만 아니라 일반도서와 향토자료, 정부 간행물까지 살펴볼 수 있다. 2층에는 다목적홀과 전시실, 문화강좌실 등이 있으며 이 밖에도 매점과 보존서고 등이 있다.
대표적인 도서관 프로그램으로는 도란도란 책놀이, 초등학생을 위한 직업 체험 특강, 그림책 상상놀이 등이 있다.","<a href=""https://www.anseong.go.kr/library/main.do"" target=""_blank"" title=""새창 : 홈페이지로 이동"">https://www.anseong.go.kr/library</a>"
안성시사계절썰매장,2048905,레포츠,육상 레포츠,썰매장,,경기도,127.3114447748,37.0312444314,"안성시 시설관리공단(지방공기업)이 운영하고 안성맞춤랜드 내에 있는 안성시사계절썰매장은 쾌적한 시설에서 안전하고 즐겁게 사계절 썰매를 이용할 수 있는 시설이다. 안성맞춤랜드 내 남사당공연장, 천문대, 공예단지 등이 있어 다양한 즐거움을 누릴 수 있다. 안성시사계절썰매장은 슬로프 면적(2면,17,301m2) 2면의 썰매와 여름에는 수영장을 함께 이용 가능하다. 여름에는 물썰매, 겨울에는 눈썰매, 봄과 가을에는 오일 썰매를 이용할 수 있다.","안성시사계절썰매장 <a href=""https://www.anseong.go.kr/tourPortal/4season/main.do"" target=""_blank"" title=""새창 : 안성시사계절썰매장 홈페이지로 이동"">https://www.anseong.go.kr</a>"
안성식당,135092,음식,음식점,한식,http://tong.visitkorea.or.kr/cms/resource/52/1983252_image2_1.jpg,전라남도,126.1392023676,35.0011700868,"안성 식당은 전라남도 신안군 증도면에 위치한 한식 전문점이다.
짱뚱어탕, 갈낙탕, 낙지볶음 등의 요리를 선보이며, 음식점과 함께 민박을 겸하고 있다.
여러 매체에 소개되었으며 유명인들도 다녀갈 정도로 맛집으로 소문나있다. 단체석도 완비되어 있어 모임을 하기에도 좋다.",
안성식당,2903410,음식,음식점,한식,http://tong.visitkorea.or.kr/cms/resource/88/2903388_image2_1.jpg,충청북도,127.9049778605,36.2248253968,"안성식당은 충청북도 영동군 황간면 마산리에 위치하고 있다. 
TV 프로그램에 여러 차례 소개된 맛집으로 대표 메뉴는 올뱅이 국밥이다. 이 밖에 올뱅이 비빔밥, 올뱅이전, 올뱅이 무침, 올뱅이 된장조림 등 다양한 다슬기 요리가 준비되어 있다.",
