title,contentid,cat1,cat2,cat3,firstimage,region,mapx,mapy,overview,homepage
방포수산,135801,음식,음식점,한식,,충청남도,126.3354138004,36.504410265,"방포수산은 방포항 인근에 형성된 회타운에 있다. 커다란 수조 가득 담긴 싱싱한 해산물을 눈으로 직접 보고 골라 바로 회를 떠먹을 수 있다. 저렴한 상차림 비용으로 푸짐한 식사를 즐길 수 있으며 방금 뜬 회의 쫄깃한 식감과 얼큰한 매운탕의 맛이 일품이다. 식당은 160석 이상 규모로 매우 넓으며 회 뜨는 곳에서 받은 회 접시와 매운탕 거리를 들고 와서 편하게 식사를 즐기면 된다.
안면도 꽃지해수욕장과 방포항 사이에 자리 잡고 있으며 멋진 바다를 바라보면서 싱싱한 회를 즐길 수 있어 찾는 손님이 많다.",
방포해수욕장,125843,자연,자연관광지,해수욕장,http://tong.visitkorea.or.kr/cms/resource/84/3340684_image2_1.jpg,충청남도,126.3331027834,36.5087930546,"방포해수욕장은 모래질이 좋고 야영하기에 좋아서 조용한 가족휴양지로 최적이다. 해수욕장 양쪽에 할미바위와 할아비바위 등 전설이 담긴 기봉이 있으며, 천연기념물 제138호로 지정된 모감주나무 군락지가 있는 지역이다. 또한 서남쪽으로는 천연적인 방파제가 있는 내파수도와 외파수도가 있다. 방포포구에는 가오리, 붕장어, 우럭, 고등어 등의 생선들이 많이 잡혀 싱싱한 회로 유명하며 이웃에는 꽃지, 삼봉 등의 여러 해수욕장들이 있다. 인근에는 안면도자연휴양림과 중부해안지역의 자연수종 등 208종을 소유하고 있는 수목원 등이 있어 가족휴양 및 심신단련 장소로 적합하다.","<a href=""http://taean.go.kr/prog/tursmCn/tour/sub02_03/view.do?cntno=34&contentTypeCode=TC002"" target=""_blank"" title=""새창 : 태안군 문화관광 홈페이지로 이동"">http://taean.go.kr/tour/</a>"
방학에 즐기기 좋은 체험 여행지,2363014,추천코스,가족코스,가족코스,http://tong.visitkorea.or.kr/cms/resource/82/1591682_image2_1.jpg,Unknown,126.8656803698,37.5997678075,"고양은 겨울, 여름 할 것 없이 방학에 자녀들과 체험할 수 있는 자연과 체험지가 많아 즐거운 여행을 할 수 있는 곳이다. 도심권이라 1일 여행에도 적합하다. 올 겨울방학 우리 아이와 함께 즐겁고 다양한 체험 놀이를 즐기자.",
방호정 감입곡류천 (청송 국가지질공원),129041,인문(문화/예술/역사),역사관광지,유적지/사적지,http://tong.visitkorea.or.kr/cms/resource/14/2533214_image2_1.jpg,경상북도,128.9875595001,36.3291252281,"방호정은 신성계곡 절벽 위에 자리 잡은 유서 깊은 정자이다. 1619년 조선 중기 학자 조준도가 돌아가신 어머니를 생각하는 마음에서 세운 정자이다.
기존 암석이 잘게 부서진 것을 퇴적물이라 하고, 퇴적물이 쌓여서 굳은 암석을 퇴적암이라 한다. 퇴적물은 주로 흐르는 물에 의해 이동하다가 흐름의 속도가 느려지는 곳에 쌓인다. 이후 지하 깊이 묻혀 딱딱한 암석이 된다. 방호정의 퇴적암은 사암, 이암, 셰일 등으로 구성된다. 원래는 퇴적물들이 수평으로 쌓였으나, 암석으로 고화된 이후 지층이 융기하면서 기울어졌다. 시간이 지나면서 기울어진 지층의 상부가 편평하게 침식되었고, 지층이 침식된 면 위에 방호정이 놓여 현재의 모습이 되었다.

<출처 : 청송 국가지질공원>","<a href=""https://csgeop.cs.go.kr/bbs/page.php?hid=myeongso0116"" target=""_blank"" title=""새창 : 청송세계지질공원 홈페이지로 이동"">https://csgeop.cs.go.kr</a><br><a href=""https://www.heritage.go.kr/heri/cul/culSelectDetail.do?ccbaCpno=2443700510000&pageNo=1_1_1_1&sngl=Y""target=""_blank"" title=""새창 : 국가유산청 이동"">https://www.heritage.go.kr/</a>"
방호정(구례),126974,인문(문화/예술/역사),역사관광지,유적지/사적지,,전라남도,127.4669490998,35.3222505978,"일제강점기에 암울했던 시대적 상황을 시로 달래는 시 모임을 위해 지리산 자락에 지은 작은 정자이다. 구례 운조루를 건립한 유이주의 후손 유형업이 1935년 지인들과 뜻을 모아 세웠으며 방호산의 이름을 따 방호정이라 하였다. 
계곡의 거대한 암반 위에 축대를 쌓아 대지를 형성하였다. 건물은 앞면 3칸, 옆면 1칸 규모이고 가운데 온돌방을 양쪽에 마루를 두고 있는 전형적인 정자의 모습을 하고 있으며, 마을과 개천이 내려다 보이는 경치 좋은 곳에 자리 잡고 있다. 
방호정이 위치한 산동면 지역은 중국 산동지방에서 산수유를 가져와 처음으로 심었던 지역이라고 하며, 전국적으로 유명한 구례 산수유마을이 있다. 산수유마을이 전국적으로 유명해지면서 주변이 봄철 지역 축제를 위한 공간으로 활용되고 있다. 벚꽃이 피는 계절이 오면 방호정 주위는 온통 벚꽃으로 가득하다.
방호정과 인접하여 산수유 사랑공원이 있으며 차량 이동 약 13분, 8.1km 거리에 지리산정원이 있다.","▪ <a href=""http://tour.gurye.go.kr"" target=""_blank"" title=""구례 여행 사이트로 이동"">http://culture.gurye.go.kr</a><br />▪ <a href=""http://www.cha.go.kr"" target=""_blank"" title=""문화재청 사이트로 이동"">http://www.cha.go.kr</a>"
방화근린공원,3076147,인문(문화/예술/역사),휴양관광지,공원,,서울특별시,126.8132078888,37.5817161925,"방화근린공원은 1990년 12월에 공원으로 지정되어 방화 택지 개발 지구 개발과 함께 조성되었다. 공원 안에 다목적 운동장 등의 체육시설과 원형광장, 연못, 분수대 등이 있다. 산책로에는 벚꽃나무를 비롯한 다양한 수목이 있는데, 벚꽃이 잘 조성되어 있어 봄에는 봄꽃 축제가 열리고, 여름에는 바닥분수를 그리고 겨울에는 원형광장에 얼음 썰매장을 운영한다. 이 밖에도 초가로 지은 집과 정자가 있는 민속놀이마당이 있으며, 이곳에서는 매월 두 번째, 넷째 주 토요일에 학생들을 대상으로 전래놀이와 짚공예체험교실이 열린다. 
주변에는 개화산과 치현산이 있고, 꿩고개 근린공원까지 함께 있어 자연과 함께 하기에 좋은 공원이다.","<a href=""https://www.gangseo.seoul.kr/kids/kids030303"" target=""_blank"" title=""새창 : 홈페이지로 이동"">https://www.gangseo.seoul.kr/kids/kids030303</a>"
방화대교,250166,인문(문화/예술/역사),건축/조형물,다리/대교,,서울특별시,126.8122361958,37.5660513299,"방화대교는 인천국제공항이 21세기 동북아시아 허브 공항의 역할을 수행할 수 있도록 건설된 한강대교 중 하나이다. 길이 2.6㎞로 한강 교량 중 가장 긴 교량이며, 국내 최초로 장경간 아치 트러스 구조로 설계, 시공된 한강의 27번째 교량으로 예술성과 기능성이 우수하다. 다리의 아치는 전통 사찰과 기와집 처마의 부드러운 이미지를 차용하여 개화산 봉우리, 덕양산 봉우리에 이어 인위적인 세 번째 봉우리가 되었다. 이륙하려는 듯한 거대한 항공기를 연상시키는 기하학적인 형상과 밤이면 한강 물결에 비치는 황홀한 야경이 보는 이로 하여금 감탄을 자아내게 한다. 다리의 조명이 켜지는 시간은 대략 저녁 19:00에서 23:30분까지이므로 다리와 한국의 야경을 감상하며 드라이브를 즐기기에 시간적 여유가 있다. 야경도 아름답지만, 해 질 녘 방화대교 너머로 지는 태양이 방화대교의 아치와 어우러지는 모습은 절로 감탄이 나오는 절경이다.
방화대교 자체가 서울의 외곽에 위치해 있어 답답한 도심에서 벗어나 여유로운 기분으로 자전거길이나 산책길을 즐길 수 있다.",
방화동 가족휴가촌 오토캠핑장,2761204,레포츠,육상 레포츠,"야영장,오토캠핑장",http://tong.visitkorea.or.kr/cms/resource/78/2764278_image2_1.JPG,전북특별자치도,127.5268868035,35.590718502,"방화동 가족휴가촌 오토캠핑장은 방화동 자연휴양림 내에 있는 캠핑장이다. 전국 8대 종산 중 하나인 장안산의 방화동 계곡에 자리 잡고 있다. 덕산용소에서 방화동 계곡으로 이어지는 코스에 방화폭포, 산림욕장 등을 갖추고 있는 캠핑장이다. 여름철 물놀이는 물론 가을이면 단풍과 억새가 절경을 이룬다. 입구 관리사무소에서 덕산용소까지 6km 구간의 울창한 숲속 산책로를 따라 가벼운 등산을 할 수 있다. 캠핑 데크 31개, 오토캠핑 사이트 67개 카라반 5개와 당일 이용이 가능한 평상도 갖추고 있다.",
"방화동 자연휴양림,가족휴가촌",1623888,자연,자연관광지,자연휴양림,,전북특별자치도,127.5291060762,35.5897575387,"전국 8대 종산에 속하는 장안산(1,237m)의 방화동계곡에 조성된 방화동자연휴양림·가족휴가촌은 덕산용소에서 방화동계곡으로 연계되는 코스에 방화폭포, 산림욕장(치유의 숲, 만남의 광장) 시설이 갖추어져 있으며, 깨끗한 계곡을 따라 기암절벽, 다양한 수목 등의 수려한 자연경관으로 가족단위 주말 또는 단기체류형으로 최적의 조건을 갖춘 사계절 매력적인 휴양처다. 높은 산이 많은 장수군 특성상 지형적으로 해발 500m 이상의 고지대에 위치하고 있어 기온이 낮으며, 해발 1,000m가 넘는 큰 산들로 둘러 쌓인 방화동자연휴양림은 웰빙 시대에 맞춰 통나무집 4동과 산림문화휴양관등 숙박시설 및 세미나를 위한 영상과 방송시설, 식당 등이 갖춰져 있으며, 방화동가족휴가촌에는 숙박시설(다문화체험동,가족휴양동)을 비롯하여 오토캠핑장, 캠핑카 야영장, 목재문화체험장,취사장을 비롯한 각종 편의시설을 갖추고 있다. 특히 전국 최고의 오토캠핑 시설 등이 수려한 방화동 계곡을 끼고 조성되어 있다.","<a href=""https://www.foresttrip.go.kr/indvz/main.do?hmpgId=ID02030082""target=""_blank"" title=""새창: 자연휴양림,가족휴가촌"">https://www.foresttrip.go.kr</a>"
방화수류정(동북각루),2613658,인문(문화/예술/역사),역사관광지,성,http://tong.visitkorea.or.kr/cms/resource/71/3350271_image2_1.jpg,경기도,127.0180363861,37.2876178712,"수원성 화홍문의 동쪽에 인접한 높은 벼랑 위에 있는 방화수류정(訪花隨柳亭)은 1794년(정조 18) 수원성곽을 축조할 때 세운 누각 중 하나이다. 동북각루가 공식 명칭이지만 “꽃을 찾고 버들을 따라 노닌다”라는 뜻에 걸맞게 경관이 뛰어나 방화수류정이라는 당호가 붙여졌다. 한 때 홍수로 인해 퇴락한 것을 1848년에 재건축했으며 이후 수원성복원사업의 일환으로 대대적으로 수리했다.2011년 보물로 지정된 방화수류정은 독특한 평면과 지붕형태 때문에 바라보는 위치에 따라 다른 모습을 보여준다. 이 때문에 화성에서 가장 독창적인 건축물로 평가되고 있다. 정조가 화성행차 시에 휴식을 취했다는 정자에서는 동으로는 연무대와 동북공심돈, 서로는 장안문과 팔달산이 한눈에 조망된다.","수원시 문화관광 <a href=""https://www.suwon.go.kr/web/visitsuwon/index.do"" target=""_blank"" title=""새창: 수원시 문화관광 "">https://www.suwon.go.kr/web/visitsuwon/index.do</a>"
배가네멸치쌈밥,2766702,음식,음식점,한식,http://tong.visitkorea.or.kr/cms/resource/37/2766837_image2_1.jpg,경상남도,128.0084837475,34.8289933072,"남해군에 위치한 배가네 멸치쌈밥은 남해의 터줏대감으로 죽방멸치를 활용하여 영양 만점 음식을 선보인다. 대표 메뉴는 멸치 회와 멸치 세트가 있으며 특히 멸치 회 무침은 뼈를 발라 막걸리 식초 등을 넣어 비린내 없이 새콤달콤한 맛으로 남녀노소 누구나 좋아한다. 또한 구수하고 칼칼하게 멸치를 조려 만드는 멸치 쌈밥은 남해 토속음식으로 남해에 방문한다면 꼭 먹어봐야 한다. 멸치 회, 멸치 쌈밥은 2인분부터 포장도 가능하다. 근처 관광지로는 남해의 명소 독일마을이 있다.",
배가네흥동수제비,2847769,음식,음식점,한식,http://tong.visitkorea.or.kr/cms/resource/51/2847751_image2_1.JPG,경상남도,128.8640597544,35.2219479558,"김해 흥동로에 있는 배가네흥동수제비는 아늑한 분위기의 손 수제비 맛집이다. 실내 벽면을 짚단으로 장식하고 항아리를 벽에 붙여 놓았다. 내부에 입식, 좌식 테이블이 마련되어 있다. 비린내 없이 끓여 낸 해물 육수에 새우, 바지락, 오징어가 들어간 수제비, 칼국수가 인기 메뉴이다. 얇은 피의 쫄깃한 수제비는 항아리에 나오고 기본 찬으로 깍두기, 김치, 단무지가 제공된다. 땡초, 다진 양념은 직원에게 주문하면 가져다준다. 칼국수, 수제비와 곁들여 먹기 좋은 김밥도 있다. 점심시간에는 사람이 많은 편이다. 인근에 김해 벚꽃 명소인 봉황대 공원이 있어 가볍게 산책하기 좋다.",
배가짬뽕,2765429,음식,음식점,중식,,충청남도,126.6335378664,36.8846715758,"충남 당진시 대덕동에 위치한 배가짬뽕은 차별화된 고기 짬뽕으로 유명한 중식당이다. 이곳의 시그니처 메뉴인 고기 짬뽕은 양념 된 고기가 고명처럼 올라가서 국물의 맛을 해치지 않는다. 산더미 같은 양념 고기와 얼큰한 짬뽕의 두 가지 맛을 동시에 즐길 수 있는 것이다. 고기 짬뽕의 가장 큰 특징 중 하나는 양이 푸짐하다는 점이다. 고기는 물론이고 짬뽕의 양이 다른 곳의 곱절이다. 또 다른 인기 메뉴인 탕수육 역시 든든하게 먹을 수 있는 양을 자랑한다. 옛날 탕수육 그대로의 맛을 간직한 이곳의 탕수육은 바삭하고 간이 잘 돼 있어 고기 짬뽕의 파트너로 제격이다. 인근에 일출과 일몰 감상이 가능한 왜목마을과 함께 장고항, 난지도, 석문방조제, 대호방조제, 도비도항이 있어 여행길에 들러보면 좋다.",
배가한방삼계탕,2872783,음식,음식점,한식,http://tong.visitkorea.or.kr/cms/resource/76/2872776_image2_1.JPG,경기도,126.7222725553,37.3533133358,"배가한방삼계탕은 경기도 시흥시 정왕동에 위치한 삼계탕 전문점이다. 진한 국물과 부드러운 닭고기가 특징인 한방삼계탕, 옻삼계탕, 전복삼계탕 세 가지 메뉴만 판매한다. 옻삼계탕과 전복삼계탕은 조리 시간이 20분 정도 소요되기 때문에 미리 전화하여 주문해야 한다.",
배건네공작소,2820705,인문(문화/예술/역사),체험관광지,이색체험,http://tong.visitkorea.or.kr/cms/resource/86/2820686_image2_1.jpg,경상남도,128.0821790879,35.1862572903,"배건네공작소는 처음 커뮤니티모임에서 만난 주민들이 모여 만든 협동조합이다. 경남 진주 배건네 마을, 촉석루를 바라보는 이 작은 마을이야기에서 ‘우리가 진주다’를 품고 경남 진주만의 이야기를 발굴하고 마을 주민의 일상생활과 문화활동을 콘텐츠로 만드는 곳이다. 현재 배건네공작소에서는 문화기획, 지역아카이브, 스토리텔링을 통해 진주관광상품을 만들어 판매하기 위해 열심히 준비중에 있다.","<a href=""https://www.instagram.com/w_o_o_j_o_o_"" target=""_blank"" title=""새창 : 배건네공작소 홈페이지로 이동"">https://www.instagram.com/w_o_o_j_o_o_</a>"
배곧생명공원,2747813,인문(문화/예술/역사),휴양관광지,공원,http://tong.visitkorea.or.kr/cms/resource/52/2748752_image2_1.jpeg,경기도,126.721497125,37.3713723375,"배곧생명공원은 ‘생명을 품은 도시’를 지향하는 배곧 신도시에 조성된 생태 공원으로 배곧 마루, 스카이데크, 갈대 산책로, 공연장 등으로 구성되어 있다. 도란뜰이라는 가족 피크닉장이 마련되어 있어 가족 단위로 즐기기에 좋으며, 다양한 야생화를 감상할 수 있는 갈대랑길과 하늘마루 등이 조성되어 자연 속에서 산책할 수 있다. 이 외에도 갈대 습지원과 새봄 마루에서는 기수역 공원에서 볼 수 있는 다양한 생물들을 관찰할 수 있다. 배곧생명공원의 정상인 배곧 마루는 높이 29m의 평평한 잔디밭으로 조성되어 소규모 야외 행사 및 현장 학습이 가능하다. 배곧생명공원은 자연환경을 보존하며, 인간과 자연이 함께하는 공원으로 ‘생명-참여-문화’라는 슬로건을 내세우고 있다. 이러한 취지에 어울리게 인간만을 위한 공원이 아니라 다양한 동·식물이 함께 사는 생명 공원으로 조성되었으며, 공원 곳곳의 길 이름은 공모를 통해 시민이 직접 지은 이름을 사용하였다. 또한 2015년 개장 이후 배곧 마루 생명 콘서트, 대한민국 도시농업박람회, 해넘이 행사, 마라톤 대회 등 각종 다양한 문화 행사가 열리는 문화의 장 역할을 하고 있다.",
배곧아띠,2778996,음식,음식점,카페/전통찻집,http://tong.visitkorea.or.kr/cms/resource/84/2780384_image2_1.jpg,경기도,126.7249299595,37.3780938405,"경기도 시흥시 배곧 신도시에 있는 카페이다. 바다와 일몰을 감상할 수 있는 뷰가 멋진 곳이다. 
통유리 창과 야외 테라스 등 탁 트인 전망으로 사계절 내내 일몰을 감상할 수 있다.  또 바다 건너 인천 송도 신도시와 논현의 스카이 뷰도 멋진 감상 포인트이다. 커피와 음료, 주류 등을 다양하게 판매하고 있으며 야외 테라스에는 흡연이 가능하고 반려견도 동반할 수 있다.",
배금화낙지&파전,2863689,음식,음식점,한식,http://tong.visitkorea.or.kr/cms/resource/82/2863682_image2_1.JPG,경기도,126.7002728306,37.713523837,"경기도 파주시 서패동에 있는 낙지요리 전문점이다. 주메뉴는 낙지와 파전이며, 낙지는 낙지정식, 낙지덮밥, 낙지볶음 세 가지 메뉴가 있고, 파전은 해물파전과 통낙지파전이 있다. 낙지정식은 낙지덮밥, 불고기, 파전, 가자미로 구성된 메뉴이며, 2인 이상일 경우 주문이 가능하다. 밑반찬으로 샐러드, 돌나물, 무생채, 숙주나물, 양념게장, 배추김치 등이 제공된다. 통유리로 된 건물이라 주변 풍경이 한눈에 들어오며, 내부는 넓고 쾌적하여 편안한 분위기에서 식사할 수 있다. 근처에 파주 출판단지와 파주 롯데 아웃렛, 심학산 야영장 글램핑 가든이 있다.",
배꼽다리,2765238,인문(문화/예술/역사),건축/조형물,다리/대교,,경기도,127.1116994456,37.895401701,조선 중기 이지함 선생은 토정비결을 만들기 위해 전국을 누비고 다녔다. 전국을 누비다가 동두천시 광암동 동점마을 입구에 도착해서는 이쯤이 우리나라 동서남북의 가운데 지점이라 하며 암각문 표시를 해 두고 다리를 설치했는데 그때부터 배꼽 다리로 불렸다고 한다. 여름철이면 다리 아래 계곡엔 물놀이하는 사람들로 붐비는 곳이다. 등산로와 산책로가 연결돼 있고 주변에 아담한 공원과 정자가 있어 마을 사람들과 여행객들에게 쉼터를 제공하는 곳이다.,
배꼽시계,2687975,음식,음식점,한식,http://tong.visitkorea.or.kr/cms/resource/10/2684410_image2_1.jpg,경상북도,128.7309337052,36.5660267319,고기와 여러가지 나물을 비벼 먹는 음식이다. 경상북도 안동시에 있는 한식전문점이다. 대표메뉴는 제육비빔밥이다.,
배꼽제빵소,2857117,음식,음식점,카페/전통찻집,http://tong.visitkorea.or.kr/cms/resource/00/2857100_image2_1.JPG,강원특별자치도,127.9810638545,38.1053489172,"배꼽제빵소는 양구 시내에서 맞은편 언덕, 한반도섬전망대 가는 길에 있다. 한반도의 배꼽이라는 별칭이 있는 양구를 한눈에 내려다 볼 수 있는 핫 플레이스다. 유명세만큼이나 규모 있는 베이커리 카페로 다양한 식물과 시원한 뷰가 멋진 곳이다. 1층과 2층, 야외에서 빵과 음료를 즐길 수 있는데, 샌드위치를 포함한 브런치와 마카롱, 조각 케이크 등의 디저트류, 소금 빵, 마늘 바게트, 팡도르 등의 빵이 다양하게 갖춰져 있다. 바로 아래에 양구레포츠공원이 있어 주차 공간이 부족할 때는 이곳을 이용해도 된다. 또한 박수근미술관과 한반도섬전망대가 가까워 양구 시내를 중심으로 여행할 때 잠시 쉬기에 좋은 곳이다.
※ 반려동물 동반불가",
배꼽집,2914789,음식,음식점,한식,http://tong.visitkorea.or.kr/cms/resource/80/2914780_image2_1.jpg,서울특별시,126.8885621347,37.5813786875,"수색역과 디지털미디어시티역에서 차량으로 10분 정도 걸리는 소고기구이 전문점이다. 다양한 부위를 즐길 수 있는 배꼽 스페셜이 대표메뉴이다. 그 외에도 안심, 양곰탕, 안동국밥, 육회비빔밥, 참갈비, 평양냉면 등의 메뉴를 맛볼 수 있다. 홀에 있는 좌석과 룸에 있는 좌석으로 나누어져 있다. 단체석이 마련되어 있어서 회식이나 모임을 하기 좋다. 건물에 주차할 수 있어서 차를 가지고 방문하기 편리하다. 포장이 가능하다. 도보 3분 거리에 가온문화공원이 있어서 식사 후 산책하기 좋다.",
배꽃길61,2792503,음식,음식점,카페/전통찻집,http://tong.visitkorea.or.kr/cms/resource/16/2795316_image2_1.png,경기도,127.240537319,37.0301516179,"경기도 안성시 대덕면 배꽃길에 있는 카페로 배밭에 위치해 있다. 입구에 들어서면 '1973', '커피와 양과자' 표지판이 보이고 마당에는 배나무 한 그루가 있다. 메뉴는 아메리카노 부터 배꽃 에이드, 배 라테, 배꽃 주스 등 배가 들어간 음료도 많다. 배나무 아래에  앉을 수 있도록 피크닉 돗자리, 어린이를 위한 DIY 장난감을 준비해 놓았다, 배가 열리는 시기에 배봉지를 구입하여 체험자의 이름을 적어두고 가을에 와서 수확하는 배봉지 체험이 있다. 배 밭에 앉아 주문을 기다리면 노란 바구니로 주문한 음식을 가져다준다. 아이들과 배밭 나들이 삼아 방문하기 좋은 곳이다.",
배나무골 양재점,2745580,음식,음식점,한식,http://tong.visitkorea.or.kr/cms/resource/01/2779901_image2_1.jpeg,서울특별시,127.0391598057,37.4731578472,1990년도부터 시작한 배나무골오리집은 30년이 넘는 전통을 자랑하는 우리나라 최초의 오리 코스 요리 전문점이다. 중국의 북경오리를 한국인의 입맛에 맞춰 재정의한 요리인 서울덕과 오향소스를 살포시 얹어 고소하고 부드러운 오리수육 등 다양한 오리 요리를 맛볼 수 있는 곳이다. 계절별로 산지에서 공수되는 신선한 재료로 오랜 기간 사랑받아 오고 있는 전문식당이다.,"<a href=""https://baenamugolyj.modoo.at"" target=""_blank"" title=""새창 : 배나무골 양재점 사이트로 이동"">https://baenamugolyj.modoo.at</a>"
배나무골가마솥칼국수,627331,음식,음식점,한식,,강원특별자치도,127.7294496741,37.860275498,"강원도 춘천시 퇴계동에 위치한 닭 한 마리 칼국수 전문 음식점이다. 대형 주차장을 구비하고 있어 단체 회식에 적합하며 닭 한 마리 칼국수, 해물파전, 바지락무침 등을 맛볼 수 있다. 닭 한 마리 칼국수는 반마리 단위로 주문이 가능하여 부담스럽지 않게 즐길 수 있다. 이 외에도 얼큰한 닭 한 마리 칼국수, 해물 샤브 칼국수, 해신탕 등의 다양한 보양식도 맛볼 수 있다.",
배나무꽃캠핑장,2752910,레포츠,육상 레포츠,"야영장,오토캠핑장",http://tong.visitkorea.or.kr/cms/resource/80/2752980_image2_1.JPG,경기도,126.8698636078,37.8828237952,"파주 영평산 자락에 위치한 배나무꽃캠핑장은 사계절 다양한 체험 프로그램을 진행하고 있어 아이들과 방문하기 좋은 캠핑장이다. 봄에는 배나무꽃 속에서 산책로 걷기, 여름에는 야외수영장에서 물놀이, 가을에는 밤나무 숲에서 밤 줍기, 겨울에는 눈썰매장에서 눈썰매 타기 그 외에 다양한 만들기 체험학습까지 가능하다. 체험 프로그램만 참여하기 위해 당일 방문객도 많다. 캠핑 사이트는 중앙 정원인 수생원을 빙 둘러 가며 있는데, 선착순으로 자리를 고를 수 있고, 사이트는 파쇄석, 잔디 바닥, 데크석 등 다양하다.","<a href=""https://bnmg.modoo.at/""target=""_blank"" title=""새창 : 업체홈페이지 이동"">https://bnmg.modoo.at/</a><br><a href=""https://www.instagram.com/bnmg_camping""target=""_blank"" title=""새창 : 업체인스타그램 이동"">https://www.instagram.com/bnmg_camping</a>"
