title,contentid,cat1,cat2,cat3,firstimage,region,mapx,mapy,overview,homepage
신녕포교당 (법련사),322806,인문(문화/예술/역사),역사관광지,사찰,http://tong.visitkorea.or.kr/cms/resource/89/3402789_image2_1.jpg,경상북도,128.7900323949,36.0409597834,"영천시 신녕면 완전리에 있는 신녕포교당은 대한불교 조계종 제10 교구 본사인 은해사의 말사로 200여 년 전 법륜사를 계승하고 있다. 현재 남아 있는 부도가 1880년(고종 17)에 조성된 것이어서 법륜사의 초창은 19세기 후반임을 알 수 있으며 현 포교당의 건립은 1924년 박희웅 화상에 의해 세워졌고, 1961년 학산 스님이 발원하여 포교당 내 산령각을 건립하고 산신도를 봉안하였다. 그래서 입구에 신녕 포교당과 법륜사의 푯말이 나란히 적혀 있다. 신녕포교당은 지역민의 교육과 불법 홍보를 위한 도심 속의 사찰로 인근 군부대의 군 법회를 통한 포교 활동에 주력하고 있고 경내에는 1924년 건립된 극락전과 요사, 석탑이 있다.","<a href=""http://www.grandculture.net/yeongcheon/toc/GC05101665"" target=""_blank"" title=""새창 : 홈페이지로 이동"">http://www.grandculture.net/yeongcheon</a>"
신녕향교,1955174,인문(문화/예술/역사),역사관광지,유적지/사적지,http://tong.visitkorea.or.kr/cms/resource/73/3404973_image2_1.jpg,경상북도,128.7913265101,36.048603385,"향교는 공자와 여러 성현께 제사를 지내고 지방민의 교육과 교화를 위해 나라에서 세운 교육기관이다. 신녕향교는 지은 시기를 정확하게 알 수 없지만, 조선 선조 25년(1592)에 불이 나서 없어졌다. 광해군 7년(1615)에 처음 세웠던 곳에서 500m 떨어진 지점에 다시 지었는데, 숙종 12년(1686) 지금 있는 자리로 옮겨 지었다. 대성전은 공자를 비롯하여 중국과 우리나라 유학자의 위패를 모시고 제사 지내는 곳이다. 앞면 3칸의 규모이며, 동무·서무가 없이 우리나라 성현들도 모두 대성전에 모셨다. 조선시대에는 나라에서 토지와 노비·책 등을 지원받아 학생을 가르쳤으나, 지금은 교육 기능은 없어지고 제사 기능만 남아 있다. 
(출처 : 국가유산청)","<a href=""https://www.heritage.go.kr/heri/cul/culSelectDetail.do?pageNo=1_1_1_1&sngl=Y&ccbaCpno=3413701020000"" target=""_blank"" title=""새창 : 문화재청(신녕향교대성전) 홈페이지로 이동"">https://www.cha.go.kr</a>"
신논현비비약국,3307612,쇼핑,쇼핑,사후면세점,http://tong.visitkorea.or.kr/cms/resource/87/3314587_image2_1.jpg,서울특별시,127.0248046573,37.5049622305,-,
신농한우정육식당광명본점,2830295,음식,음식점,한식,http://tong.visitkorea.or.kr/cms/resource/83/2830283_image2_1.jpeg,경기도,126.8645262673,37.453048726,"신농한우는 경기도 광명시 하안동 밤일마을에 위치한 정육식당이다. 도매 직영 식당으로 합리적인 가격에 믿을 수 있는 한우를 맛볼 수 있다. 넓은 주차장과 150석 규모의 큰 홀을 갖추고 있어 가족외식이나 직장 모임에 적합하다. 고기는 냉장 쇼케이스에 부위별로 다양하게 진열되어 있어 직접 보고 골라 구매할 수 있다. 대표 메뉴인 한우 외에도 파불고기, 갈비탕, 냉면 등 다양한 메뉴를 판매하고 있다. 농림축산식품부가 선정한 안심식당으로 덜어 먹기 가능한 도구 비치・제공, 위생적 수저 관리, 종사자 마스크 착용을 준수한다.","<a href=""http://sinnong.net""target=""_blank"" title=""새창 : 신농한우 사이트로 이동"">http://sinnong.net</a>"
신다리,2925289,음식,음식점,한식,http://tong.visitkorea.or.kr/cms/resource/70/2925270_image2_1.jpg,강원특별자치도,129.1654215459,37.4436122605,삼척 중앙시장에 위치한 국수 전문점이다. 식사 시간이 지났는데도 여전히 길게 줄을 서는 곳이다. 벽에는 엄청나게 많은 메모지가 각자의 사연을 품고 걸려 있다. 테이블에는 메모지와 볼펜이 있어 자신만의 사연을 남겨둘 수도 있다. 신다리의 대표 메뉴는 동치미국수와 열무국수이다. 살얼음이 내려앉은 동치미국수에는 콩가루가 뿌려져 있다. 비빔국수의 고명 위에도 콩가루가 올라간다. 새콤한 국물과 고소한 콩가루가 어우러져 독특한 맛을 낸다.,
신다신,2786467,음식,음식점,한식,,강원특별자치도,128.5940884083,38.2028798825,"가을동화 촬영지로 유명한 속초 청호동의 아바이 마을에 위치한 식당이다. 신다신의 아바이순대는 신선한 오징어, 고기, 찹쌀, 채소 등이 들어간 별미 순대로 불린다. 모둠 순대뿐만 아니라 함흥냉면, 가리 국밥, 순댓국 등 여러 가지 메뉴를 선보이고 있는데 그중 가리 국밥은 함경도 전통음식으로 사골국물에 소고기, 콩나물, 고사리, 양념 다진 양념을 넣은 국밥으로 이곳에서만 맛볼 수 있다. 그 밖에도 가자미식해, 명태회 등의 함경도식 메뉴도 준비되어 있다.",
신다신식당,1936796,음식,음식점,한식,,강원특별자치도,128.594021747,38.202921543,"신다신식당은 50년 넘는 전통의 순대, 함흥냉면 전문 음식점이다. 3대째 운영중인 신다신식당은 다신식당으로 운영해오다 건물 리모델링 이후 신다신식당으로 이름이 바뀌어 운영하고 있다. 신다신은 '믿고 많은 사람이 믿는다' 라는 뜻으로 신다신식당에서는 오징어순대, 아바이순대, 명태, 가자미식혜, 가리국밥, 냉면, 순대국을 제공한다.",
신당동 떡볶이 골목,699249,인문(문화/예술/역사),체험관광지,이색거리,http://tong.visitkorea.or.kr/cms/resource/54/3083054_image2_1.JPG,서울특별시,127.014609496,37.563058077,"신당동 떡볶이 골목은 골목을 따라 떡볶이집이 양쪽으로 들어서 있는 곳이다. 골목을 이루게 된 건 70년대 후반부이며, 80년대로 넘어오면서 신당동 떡볶이 골목의 전성기를 맞이하였다.
80년대에 새롭게 등장한 건 떡볶이집마다 있었던 DJ박스다. 사연과 함께 음악을 틀어주던 이른바 [멋쟁이 DJ 오빠]가 신당동 떡볶이 골목의 상징으로 떠올랐다. 또한 이 시기는 고교야구의 전성기였는데 인근에 있는 동대문야구장에서 덕수상고와 선린상고가 맞붙는 날이면 경기가 끝나고 신당동 떡볶이 골목은 학생들로 넘쳐났다. 당시 학생이었던 아이들이 중년이 되어 찾는 곳이 바로 이 골목이다. 그들은 그렇게 이십 년이 넘는 단골이 되었고, 전통의 골목이기에 서울미래유산으로도 지정되었다.
사실 떡볶이 골목의 역사는 70년대를 훨씬 더 지나 50년대로 거슬러 올라간다. 떡볶이 골목에 마복림할머니집이 있는데, 그 할머니 말에 따르면 1953년부터 떡볶이를 팔기 시작했다고 한다. 처음에는 그냥 고추장만 넣어 떡볶이를 만들었고, 그렇게 시작된 신당동 떡볶이는 수십 년 세월이 흐르면서 심심풀이 간식이 아닌 한 끼 식사로 충분한 하나의 요리로 자리 잡았다. 요즘은 떡볶이에 계란, 당면, 어묵, 쫄면, 라면 사리는 기본이고 물오징어에 새우, 치즈까지 들어가 새로운 입맛을 사로잡고 있다.",
신당동천팥죽,667493,음식,음식점,한식,,서울특별시,127.0166369505,37.5679436569,좋은 품질의 팥과 찹쌀로 정성껏 반죽해 만들기에 그 맛이 일품이다. 또한 손님이 주문하면 그때 만들기 때문에 쫄깃함이 살아있다. 여름철 즐겨먹는 팥빙수만 봐도 알 수 있듯이 팥은 몸의 열을 낮추는 효과가 탁월해 오히려 무더운 날 먹으면 제격이다.,
신대게나라,2903411,음식,음식점,한식,http://tong.visitkorea.or.kr/cms/resource/02/2903402_image2_1.jpg,강원특별자치도,128.8284937348,37.8854240941,"신대게나라는 강릉시 주문진항 근처 도깨비시장에 있는 해물 식당이다. 주메뉴는 대게, 킹크랩, 랍스터, 박달 홍게를 쪄서 먹는 메뉴이다. 입구에 있는 수족관에서 마음에 드는 게 종류와 크기를 정하면 스끼다시와 게찜을 차려 내온다. 스끼다시로 나오는 음식은 샐러드, 새우볼, 흰골뱅이, 모듬회, 해초면 등이 나온다. 음식 하나하나가 일품요리로 내놓아도 손색이 없는 음식들이다 스끼다시를 먹고 있으면 정갈한 편백찜기에 쪄서 주문한 게가 나온다. 먹기 좋게 손질돼서 제공하므로 편하게 먹을 수 있다. 딱지에 붙은 내장에 밥을 비벼 먹으면 맛이 훌륭하다. 마무리로 홍게라면을 먹으면 시원하고 칼칼한 맛에 속이 편안해진다. 주차는 건물 바로 앞에 할 수 있다.",
신대계곡,2613677,자연,자연관광지,계곡,http://tong.visitkorea.or.kr/cms/resource/96/2519296_image2_1.JPG,강원특별자치도,128.2184021926,37.5926518399,"신대계곡은 태기산과 봉복산 사이로 흐르는 계곡을 가리킨다. 계곡물은 맑고 깨끗하여 버들치, 쉬리 꺽지 등이 살고 있다. 계곡을 거슬러 올라가면 봉복사와 낙수대를 만날 수 있다.","횡성여행 <a href=""https://www.hsg.go.kr/tour.web"" target=""_blank"" title=""새창: 횡성여행 "">https://www.hsg.go.kr/tour.web</a>"
신대레포츠공원,2747045,인문(문화/예술/역사),휴양관광지,공원,http://tong.visitkorea.or.kr/cms/resource/25/2750625_image2_1.png,경기도,127.0646736578,36.9939804305,"경기도 평택시 신대동 통복천이 안성천으로 흘러들어 가는 지점에 있는 레포츠 공원이다. 과거 쓰레기  매립지를 레포츠 공원으로 탈바꿈시켰다.  작은 어린이 공원과  축구장, 테니스장 등의 시설을 갖추고 있으며, 다른 레포츠 공원들과는 색다르게 화궁장이라는 국궁장이 운영되는 곳이다. 미끄럼틀 등 어린이 놀이 시설이 있어 아이와 시간 보내며 놀기에도 좋다. 넓은 무료 주차장이 있다.","<a href=""https://www.pyeongtaek.go.kr/pyeongtaek/contents.do?mId=1402010000"" target=""_blank"" title=""평택시청 사이트로 이동"">https://www.pyeongtaek.go.kr/</a>"
신대리마을,2790500,인문(문화/예술/역사),체험관광지,농.산.어촌 체험,http://tong.visitkorea.or.kr/cms/resource/23/2793023_image2_1.jpg,강원특별자치도,128.2489880554,37.6014569547,"신대리마을은 태기산 자락에 위치한 마을이다. 청일면 신대리 물 맑고 공기 좋은 산골에 위치한 이 마을은  2019년 농촌치유자원상품화시범 사업을 시작으로 마을 사업의 틀을 마련하였다. 이후 2020년 마을기업 선정으로 사업의 기초 다지기를 하였다.
치유 농업으로 시작은 했지만 농촌의 무궁무진한 다양성을 주고 싶은 마을이다. 
신대리마을에서는 선도기혈 제초, 손수건야생화 그리기, 업사이클 공예, 복조리 플라워, 천연 주물럭 비누 만들기, 봉숭아물들이기, 야생화 꽃바구니, 전통연 만들기, 토마토 수확체험, 토마토 마리네이트 등의 다양한 체험휴양마을 프로그램을 진행하고 있다. 또한 태기산마을 치유센터, 건강측정, 치유밥상, 한남대 계곡 심신건강 명상치유, 화전민터 계곡 맨발 트레킹, 태기산성 계곡 여가 휴양 트레킹, 직업적 스트레스 트라우마 건강회복 치유, 명상, 싱잉볼, 전통초롱불 계곡 트레킹, 건강 산약초차 테라피, 모닥불 시낭송+음악 감상, 국자랑 선도기혈, 족욕 등의 치유마을 프로그램도 진행하고 있다.","<a href=""http://xn--ok0bx3tsqfrkh00m.kr/"" target=""_blank"" title=""새창 : 신대리마을 홈페이지로 이동"">http://태기산마을.kr/</a>"
신대리야영장,2755572,레포츠,육상 레포츠,"야영장,오토캠핑장",http://tong.visitkorea.or.kr/cms/resource/65/2756365_image2_1.JPG,강원특별자치도,128.2056229555,37.5871688995,"신대리야영장은 횡성의 최고봉 태기산(1,261㎡)과 봉복산(1,022㎡)사이로 흐르는 신대계곡 입구에 위치해 있다. 신대계곡은 태고적 신비와 계곡을 넘나드는 청명한 바람 등 자연 그대로의 모습을 잘 간직하고 있는 곳이다. 맑고 깨끗한 계곡물에 피라미, 버들치, 모래무지가 서식하여 계곡탐사가 즐겁다. 10채의 정자형 원두막과 야영데크가 마련되어 있다. 화장실, 급수대도 완비되어 있어 텐트만 펼치면 된다. 아울러 공만 있으면 농구와 족구 등 운동도 할 수 있도록 시설이 잘 되어 있다.","<a href=""http://xn--ok0bx3tsqfrkh00m.kr/theme/tgstown/html/rooms/list02.php""target=""_blank"" title=""새창 : 업체홈페이지 이동"">http://태기산마을신대리야영장.kr/</a>"
신대방 닭갈비구이,2650018,음식,음식점,중식,http://tong.visitkorea.or.kr/cms/resource/20/2650020_image2_1.jpg,서울특별시,126.9118182054,37.4878566383,"매콤하고 맛있는 신대방역 중화요리 맛집으로 한국에서 중국 본토 원조 숯불구이의 맛을 그대로 재현하여 인기다. 껍데기를 발라낸 닭갈비를 쯔란 등으로 매콤 짭짜름하게 양념하여 숯불에 바삭하게 구워 기름이 쏙 빠진 고소한 맛이 일품인 닭갈비 구이가 대표 메뉴로 맥주든 소주든 술 한 잔 시원하게 먹기 딱 좋은 메뉴다. 닭발, 양꼬치, 오징어도 같은 방식으로 숯불에 구워 준비되며 무침류와 물만두, 온면도 훌륭하다. 친구나 동료, 가족과 함께 맛있게 즐길 수 있는 다양한 메뉴가 준비되어 각종 모임 장소로도 부족함이 없다.",
신대성각,2767442,음식,음식점,중식,http://tong.visitkorea.or.kr/cms/resource/50/2767450_image2_1.jpg,서울특별시,126.9369553489,37.4685259985,"신정동 정통중화요리 맛집 <新대성각>은 30년 전통의 노하우가 깃든 중화요리를 맛볼 수 있는 곳이다. 이 집 음식은 당일 공수한 재료부터 직접 만든 특제 소스까지 차별화된 퀄리티를 갖추어 메뉴마다 고객 만족도가 높은 편이며 각종 채소 들을 다양하게 활용하고 있는 것도 장점이다. 주메뉴인 짜장과 짬뽕은 셰프의 조리 노하우와 신선도 높은 재료가 어우러져 뛰어난 맛과 남다른 맛이 특징이며 탕수육, 깐풍기 등의 요리부 음식에서도 타 업체와 다른 색다른 맛과 바삭하고 담백한 식감을 그대로 느낄 수 있다. 깔끔한 매장을 보유하여 모임장소로도 이용할 수 있다.",
신대초밥,2858371,음식,음식점,일식,http://tong.visitkorea.or.kr/cms/resource/68/2858368_image2_1.jpg,전라남도,127.5520100738,34.9277159518,"순천시 신대지구에 있는 신대초밥은 오픈 주방이기 때문에 초밥을 만드는 과정을 볼 수 있다는 점이 좋다. 초밥을 주문하면 우동이 서비스로 나오는데, 계속해서 리필이 가능하다. 순천 신대초밥의 특징은 밥양이 푸짐하고 회가 길고 두꺼우며 쫄깃하다. 대표 메뉴인 모듬초밥은 특모듬초밥과 A, B 구성이 모두 다르다. 매일 매장 상황에 따라 구성도 변경될 수 있다. 왕새우 튀김에는 곁들여 먹는 유자 소스가 나오는데, 튀김의 느끼한 맛을 잡아주는 상큼함이 별미이다.",
신덕식당,134343,음식,음식점,한식,http://tong.visitkorea.or.kr/cms/resource/78/781878_image2_1.jpg,전북특별자치도,126.599748982,35.5080786152,"선운사 입구 삼거리에 위치하여 60년대 말부터 2대로 이어지고 있는 풍천 장어로 유명한 집이다. 장어는 스태미나 요리로 예로부터 보혈, 보신을 상징하는 강정식품으로 노약자나 어린이 간식은 물론 여성의 피부 미용에도 매우 좋은 식품이다.
장어장도 장어를 고아 뽑아낸 기본 육수에 고추장과 갖은양념을 하고 몇 시간 푹 고아 내어 30여 년의 맛 비결이 담겨 있다. 초벌구이를 한 다음 간이 배도록 한 후 재벌구이로 구워서 내놓는 장어구이는 입안에 들어가면 입안에서 부드럽게 녹는다. 식사를 겸할 때는 밥과 함께 구수한 된장찌개와 곰삭은 젓갈이 나온다.","<a href=""https://shinduk1.modoo.at"" target=""_blank"" title=""새창: 신덕 홈페이지로 이동"">https://shinduk1.modoo.at</a>"
신덕해수욕장 / 신덕해변,2752501,자연,자연관광지,해수욕장,,전라남도,127.7668829067,34.8189735425,"신덕해수욕장은 잔잔한 파도와 얕은 수심, 고운 모래로 여름이면 많은 피서객이 찾는 해수욕장이다. 커다란 갯바위가 해안을 따라 길게 이어져 있어 낚시하기에 좋고, 조개, 고둥, 게가 잘 잡혀 어린 자녀와 자연 체험을 하기에도 좋다. 단, 해수욕장 왼편 기암절벽으로 이뤄진 해변은 수영이 금지되어 있다. 해수욕장 가까운 곳에 까마귀를 닮았다고 하여 까마귀 산이라 불리는 낮은 산이 자리 잡고 있다. 주차장과 샤워장, 화장실, 음수대 등 편의 시설이 마련돼 있어 캠핑도 가능하다.",
신도,577932,자연,자연관광지,섬,,전라남도,125.9762374511,34.5987433942,"섬에 땔나무가 많아 섶(땔나무) 신자를 써서 신도라 한다. 경북 경주에 살던 경주 이씨 이인경이 우연히 이곳에 들렀다가 경치가 좋고 수산자원이 풍부해 정착하기 좋은 곳이라 판단해 최 씨를 부인으로 맞아 정착하였다고 한다. 신도해수욕장의 고운 모래가 유명하고 각종 수산물이 풍부하여 섬 전체가 다도해해상국립공원에 속해 있다. 특산물로는 품질이 뛰어난 톳이 있다. 하의도, 대야도, 신도(이상 전남 신안군)는 서로 가까운 거리에 위치하고 있다.<br>",
