title,contentid,cat1,cat2,cat3,firstimage,region,mapx,mapy,overview,homepage
카페산청요,2833275,음식,음식점,카페/전통찻집,http://tong.visitkorea.or.kr/cms/resource/62/2833262_image2_1.png,경상남도,127.933212977,35.3452311888,강의 풍광이 수려한 남강변에 자리한 CAFE산청요를 방문하면 가장 먼저 소나무가 반긴다. 문외한이 봐도 좋아 보이는 여러 그루의 소나무가 저마다의 가지를 하늘로 치켜세운 모습이 범상치 않다. 이곳은 산청요의 장인 민영기 선생의 작업실과 전시실을 겸하고 있다. 카페는 왼쪽의 아담하게 지어진 작은 건물이다. 간결하고 단정한 인테리어가 산뜻하다. 도자기 공방답게 컵이나 그릇이 다 수제로 만들어진 도기이다. 이곳의 대표 메뉴인 산청요라테와 직접 고아 만든 팥빙수는 한 번쯤 먹어 볼 만하다. 소나무 정원에서는 반려견 동반이 가능하다.,
카페산타로사,2923690,음식,음식점,카페/전통찻집,http://tong.visitkorea.or.kr/cms/resource/78/2923678_image2_1.jpg,전북특별자치도,126.6984593141,35.9560070727,"군산 은파호수 공원 옆에 있는 카페 산타로사는 아름다운 경관과, 11개국 산지별 스트레이트 커피를 핸드드립으로 즐길 수 있는 커피 전문점이다. 군산에 로스터리 카페가 많지 않던 2008년에 오픈해 문화적 충격을 주었고, 커피 맛에 대해 열광적인 반응을 보였다고 한다. 국내 최초의 팩토리 카페이자 총 120만 명이 방문한 전국적인 커피 명소로도 유명하다. 15kg 용량의 암벡스 로스팅 기계에서 나오는 열기가 산타로사의 전문화된 커피의 내공을 보여준다. 카페 내부는 벽돌로 된 따뜻한 느낌의 인테리어로 클래식한 느낌을 준다. 산책로가 잘 조성된 은파호수 공원과 함께 둘러보면 좋다. 다양한 커피와 음료, 차가 준비돼 있다.
※ 반려동물 동반 불가","<a href=""http://www.santarosa.modoo.at""target=""_blank"" title=""새창 : 카페산타로사 사이트로 이동"">http://www.santarosa.modoo.at</a>"
카페삼랑,2776587,음식,음식점,카페/전통찻집,,경상남도,128.8303053828,35.3880259079,"삼랑진교 근처에 자리하고 있는 카페삼랑은 앞으로는 낙동강, 뒤로는 기찻길이 자리하고 있는 루프탑 베이커리 카페다. 또한 건물 가운데에 있는 큰 소나무는 카페의 미관을 아름답게 해 줄 뿐만 아니라, 자연과 함께하는 분위기를 느낄 수 있다. 무려 5층 규모의 카페로 층마다 색다른 분위기를 뽐내며, 루프탑에선 밀양의 풍경이 한눈에 들어온다.<br>","<a href=""https://instagram.com/cafe_samrang""target=""_blank"" title=""새창 : 홈페이지로이동"">https://instagram.com/cafe_samrang</a>"
카페새오개길39,2861521,음식,음식점,카페/전통찻집,http://tong.visitkorea.or.kr/cms/resource/19/2861519_image2_1.jpg,경기도,127.2300295488,37.4385041952,"카페새오개길39는 경기도 광주 한옥마을에 있는 한옥 스테이와 함께 운영하는 카페이다. 카페 주소를 카페명으로 사용하는 이곳은 주소대로 찾아오면 주차장이 있지만 카페 크기에 비해 협소한 편이다. 한옥의 서까래가 노출된 천장에 샹들리에로 장식된 실내는 넓지는 않지만, 야외 테라스 곳곳에 자리가 있어 많은 인원을 수용할 수 있다. 인기 메뉴는 수삼 쉐이크 외에도 커피와 수제 국산 차 그리고 다양한 디저트를 맛볼 수 있다. 한국 전통의 맛과 효능을 담아 전통 방식으로 건조하고, 덖고, 발효시키는 등 원재료 선별에서부터 제조까지 직접 관리하고 있다.   
※ 반려동물 동반가능","<a href=""http://hanokmaeul.com/sub/cafe.php""target=""_blank"" title=""새창 : 카페새오개길39 사이트로 이동"">http://hanokmaeul.com/sub/cafe.php</a>"
카페샵오팔,2857887,음식,음식점,카페/전통찻집,http://tong.visitkorea.or.kr/cms/resource/65/2857865_image2_1.jpg,충청북도,127.9297631842,36.9655715821,"카페샵오팔은 충청북도 충주시내가 한눈에 보이는 카페이다. 4~6층으로 이루어졌으며, 모던한 멋을 풍기는 외관이 돋보이며, 세련된 분위기를 연출하는 인테리어도 눈에 띈다. 4층과 5층 모두 단체석이 완비되어 있어 모임을 즐기기에도 좋다. 6층 루프탑은 어린이 출입 시 보호자를 반드시 동반해야 한다. 또 카페샵오팔은 20시 30분부터 야경을 더 즐길 수 있도록 최소 조명으로만 운영을 하고 있다. 시그니처 메뉴로는 아인슈페너플레인과 라떼슈페너플레인, 아인슈페너그린, 얼그레이라떼, 아몬드더블슈페너가 있으며, 이외에도 다양한 음료와 디저트도 있다.","<a href=""https://www.instagram.com/o.pal___/"" target=""_blank"" title=""새창 : 카페샵오팔 인스타그램으로 이동"">https://www.instagram.com/o.pal___/</a>"
카페서락,2913274,음식,음식점,카페/전통찻집,http://tong.visitkorea.or.kr/cms/resource/27/2919327_image2_1.jpg,강원특별자치도,128.5174866672,38.2146964632,반려견 카페 서락입니다. 중대형견과 소형견을 분리시킨 운동장과 반려견을 위한 여러 공간/시설을 갖추고 있습니다.,
카페서연의집,2753045,음식,음식점,카페/전통찻집,http://tong.visitkorea.or.kr/cms/resource/38/2753538_image2_1.jpg,제주특별자치도,126.6555891188,33.2694523481,"카페 '서연의집'은 제주 올레길 5코스 중간에 위치한 영화 '건축학개론'의 촬영지다. 영화 '건축학개론' 제작진이 영화 속 추억의 흔적들을 보전하되 실제 ‘카페’로 활용할 수 있도록 건축한 새로운 공간으로 2013년 3월 오픈했다. 카페 변신 이후 영화 팬들과 제주 관광객들의 발길이 꾸준히 이어지고 있다. 영화 콘텐츠와 제주도의 지역적 특색을 함께 향유할 수 있는 명소로 떠오르고 있다. 여주인공을 맡은 배우 수지는 '국민 첫사랑'이라는 칭호를 얻었으며, 잔잔한 영화에 생동감을 불어넣어 준 납득이 캐릭터는 머핀 메뉴로 남았다. 시원한 개방감을 주는 1층 폴딩도어 앞 또는 2층 테라스에 앉으면 제주도 푸른 바다와 파란 하늘을 막힘없이 즐길 수 있다.",
카페서천,2836556,음식,음식점,카페/전통찻집,http://tong.visitkorea.or.kr/cms/resource/54/2836554_image2_1.jpg,경기도,127.0750657926,37.2430407188,"경기도 용인시 기흥구 서천동에 있는 카페서천은 경희대학교 국제 캠퍼스 맞은편에 위치한 주택을 개조해 만든 제주 감성 카페다. 전용 주차장도 넓게 되어 있고, 카페를 둘러 꽃과 나무들이 가득해서 뷰와 분위기가 좋다. 마당에 남아있는 장독대, 옛날 찻상들이 인상적이다. 망포역, 청명역과도 가까워서 대중교통을 이용하기도 편리하다. 대표 메뉴는 라테, 비엔나커피, 패션 프루트 에이드, 수제청 자몽 에이드 등이고 인근에 수원어린이교통공원, 서천생태공원 등이 있다.",
카페소고,2855268,음식,음식점,카페/전통찻집,http://tong.visitkorea.or.kr/cms/resource/54/2855254_image2_1.jpg,경기도,127.1841117403,37.6248150698,"경기도 남양주시 일패동에 있는 카페이다. 주문하는 곳, 카페 건물, 야외의 세 개 공간으로 구분되어 있다. 주문하는 곳은 메뉴판, 디저트 모형, 주방이 있고 좌석은 없다. 메뉴는 다양한 커피, 에이드, 티, 주스와 디저트가 있다. 라테에 수제크림을 얹고 시나몬 가루를 뿌린 소고라테가 시그니처 메뉴이다. 주문한 음료와 디저트는 바구니에 담아 준다. 카페 내부는 큰 창, 우드가구, 식물 화분에 잔잔한 음악이 흘러 자연 속 편안함을 느낄 수 있다. 야외석은 잔디에 테이블이 놓여있고, 햇빛을 가리는 네모, 세모 천이 하늘에 걸려있다. SNS 사진찍기 좋은 곳이다.",
카페소비,2875123,음식,음식점,카페/전통찻집,http://tong.visitkorea.or.kr/cms/resource/17/2875117_image2_1.jpg,경기도,126.78395248,37.6713330198,"경기도 일산시 밤리단길에 위치한 카페 소비는 보다 좋은 소비를 위해 만든 공간이다. 실내는 우드톤의 인테리어와 푸른 식물들이 조화를 이루고 있다. 좋은 커피, 그리고 그에 어울리는 디저트를 준비해두고 있는 소비 카페의 시그니처 메뉴는 마이크로 그라인딩한 소비의 원두를 넣어 달달하게 블랜딩 한 소비라떼, 마시는 크렘 브륄레르 커피, 직접 만든 라벤더 아이스크림과 블랜딩 한 라벤더 우유에 에스프레소를 섞어 먹는 카페 라벤더 등 오직 이곳에서만 먹을 수 있는 특별한 커피메뉴이다.","<a href=""https://www.instagram.com/cafe_sobi""target=""_blank"" title=""새창 : 카페소비 사이트로 이동"">https://www.instagram.com/cafe_sobi</a>"
카페소요,2757707,음식,음식점,카페/전통찻집,http://tong.visitkorea.or.kr/cms/resource/64/2786864_image2_1.png,경기도,127.2253060617,37.4003640862,"경기도 광주시 중대동에 위치한  3층 건물의 카페이다.  커피, 디저트, 포토존, 루프탑, 테라스가 있는  크로플 맛집으로 건물 왼쪽으로 들어가면 주차장이 나온다. 입구에  빈티지한 입간판을 보고 1층에 들어서면 주문을 받는 카운터와 베이커리 진열대가 있다.  2, 3층이 차를 마시는 공간이고,. 옥상에는 루프탑이 있다. 날이 좋다면 야외 테크에서 시간을 보내도 좋다. 건물에 통창이 있어 사진 찍기 좋은 카페이다. 가까이에 중대 불빛공원이 있어 물을 보면서 산책하기 좋다.","<a href=""https://instagram.com/cafe_soyo?igshid=y0yfk/"" target=""_blank"" title=""새창 : 카페소요사이트로 이동"">https://instagram.com/cafe_soyo</a>"
카페솔,2840804,음식,음식점,카페/전통찻집,http://tong.visitkorea.or.kr/cms/resource/94/2840794_image2_1.jpg,경상북도,129.2146148017,35.8353215698,"카페솔은 경상북도 경주시 황남동에 있는 한옥 카페다. 정원이 갖추어져 있으며, 반려동물과 함께 입장할 수 있다. 내부에는 단체석이 마련되어 있어 각종 모임을 하기 좋다. 대표 메뉴는 아메리카노다. 이 밖에 솔라테, 카페라테, 바닐라라테, 아인슈페너, 레몬민트티 등을 맛볼 수 있다. 주차장이 없기 때문에 경주대릉원 공영주차장을 이용해야 한다. 경주 IC에서 가깝고, 인근에 황리단길, 팔우정해장국거리, 첨성대가 있다.   
※ 반려동물 동반 가능(목줄, 배변봉투 지참)","<a href=""https://instagram.com/sol_gyeongju""target=""_blank"" title=""새창 : 카페솔 사이트로 이동"">https://instagram.com/sol_gyeongju</a>"
카페숑,2905789,음식,음식점,카페/전통찻집,http://tong.visitkorea.or.kr/cms/resource/73/2905773_image2_1.jpg,제주특별자치도,126.6427791869,33.2663802615,"카페숑은 남원 공천포 바닷가에 있다. 제주의 한적한 남쪽바다를 조망하는 소박한 카페로 여행자들 사이에 인기 카페이다. 카페라떼와 초콜릿이 인기 메뉴이며 초콜릿의 경우 초코의 숫자로 4단계 초코의 강도를 조정한다. 숑플의 경우, 바나나, 호두, 메이플시럽, 생크림을 곁들인 추천 메뉴이고, 진피차, 루이보스티 등 다양한 음료가 준비되어 있다. 주변 여행지로 쇠소깍, 공천포구, 위미항 등이 있다.
 ※ 반려동물 동반 가능",
카페수석동198,2855288,음식,음식점,카페/전통찻집,http://tong.visitkorea.or.kr/cms/resource/75/2855275_image2_1.jpg,경기도,127.1709085067,37.585669379,"경기도 남양주시 수석동에 있는 한강 뷰 카페이다. 화이트 톤의 인테리어에 강변 쪽으로 통창이 있다. 한강이 잘 보이는 창가석이 인기 좌석이며, 단체석이 따로 마련되어 있다. 음료는 커피, 라테, 허브티, 비어가 있다. 브런치는 떠먹는 불고기 야채 피자, 토마토 파니니, 리코다 치즈 샐러드, 차돌 쌀 떡볶이 등이 있으며, 주문 후 조리를 시작해 다소 시간이 걸린다. 브런치를 주문하면 음료값은 할인된다. 주차는 건물과 한강 사이에 있는 공용주차장을 이용하며, 1시간 무료 주자권을 준다. 초과분은 본인 부담이다. 바로 옆에 한정식집이 몇 개 있다.","<a href=""http://www.instagram.com/susukdong198""target=""_blank"" title=""새창 : 카페수석동198 사이트로 이동"">http://www.instagram.com/susukdong198</a>"
카페숨,2853351,음식,음식점,카페/전통찻집,http://tong.visitkorea.or.kr/cms/resource/48/2853348_image2_1.jpg,경기도,127.1637477924,37.7880651541,"카페 숨은 포천시 소홀읍에 있는 숲 속 정원 카페이다. 평일에는 대관행사로만 운영하고 주말에만 카페로 운영되므로 방문 전에 꼭 확인이 필요하다. 카페 내부에는 조용히 앉아 차를 마시며 잔잔한 음악과 숲을 보며 나만의 시간을 느낄 수 있는 곳이 있는데 바로 힐링존이다. 이곳에서는 대화가 불가능하니 대화를 나누고 싶을 땐  반대편 카페동을 이용하면 된다. 반려견이나 어린이 동반이 제한된다. 잘 가꿔진 정원도 좋고, 건물과 건물 사이에는 중정도 있고, 카페에 앉아서 산 뷰를 마음껏 즐길 수 있다. 전용 주차장이 있어 주차가 편리하다.","<a href=""https://www.instagram.com/cafe_soom/""target=""_blank"" title=""새창 : 카페숨 사이트로 이동"">https://www.instagram.com/cafe_soom/</a>"
카페슈샤,2861513,음식,음식점,카페/전통찻집,http://tong.visitkorea.or.kr/cms/resource/01/2861501_image2_1.jpg,경기도,127.1695036367,37.3705887529,"카페슈샤는 경기도 광주 오포읍에 있는 브런치 카페이다. 깔끔한 회색 벽돌 건물로 매장 앞에 넓은 주차장이 있어 편하게 주차할 수 있다. 대형 유리창은 온실 느낌을 주며, 넓고 높은 층고로 시야가 좋다. 실내는 우드톤으로 되어 있고, 매장 곳곳에 대형 나무 화분이 놓여 있어 따듯한 느낌이 난다. 또한 야외에도 좌석이 있어 동시에 많은 인원을 수용할 수 있다. 카페슈샤는 커피와 에이드, 티 종류가 많으며 논알코올 맥주도 판매한다. 매장 한쪽에는 다양한 베이커리가 진열되어 있고 간단한 식사를 할 수 있는 샌드위치와 파스타, 샐러드도 있다. Happy hour를 운영하는 이곳은 평일에는 10:00~16:00, 주말에는 10:00~13:00에 모든 식사 메뉴 주문 시 아메리카노를 제공한다.
※ 반려동물 동반불가","<a href=""https://www.instagram.com/cafesiusia_official/""target=""_blank"" title=""새창 : 카페슈샤 사이트로 이동"">https://www.instagram.com/cafesiusia_official/</a>"
카페스테이,2924873,음식,음식점,카페/전통찻집,http://tong.visitkorea.or.kr/cms/resource/60/2924860_image2_1.jpg,전라남도,127.7456984103,34.7192926741,"돌산공원 근처 단독 주택 느낌의 스카이워크까지 있는 카페스테이는 1층에는 바다가 보이는 자리가 있고 매장 한가운데 핑크뮬리가 있어 화사하고 맑은 느낌을 선사한다. 2층, 3층 그리고 루프탑 총 4층 건물의 카페스테이에서 2층은 주문과 계산을 하는 곳이다. 아기 의자도 구비되어 있어 온 가족이 와서도 편안하게 커피 한 잔을 즐길 수 있다. 애완동물도 동반할 수 있다. 풋스파를 할 수 있는 자리가 따로 있어 바다를 보면서 제대로 힐링하기 좋다. 혼자 가도 여럿이 가도 바다를 바라보며 여유와 안정을 취할 수 있다. 돌산공원, 라마다 짚트랙 등이 주변에 있어 연계 관광하기 수월하다.
※ 반려동물 동반가능 (목줄, 배변봉투 지참)","<a href=""http://instagram.com/cafestay.indolsan""target=""_blank"" title=""새창 : 카페스테이 사이트로 이동"">http://instagram.com/cafestay.indolsan</a>"
카페스테이지,2857115,음식,음식점,카페/전통찻집,http://tong.visitkorea.or.kr/cms/resource/95/2857095_image2_1.jpg,경상남도,128.695911645,34.9743115224,"경상남도 거제시 장목면에 있는 카페스테이지는 바닷가 바로 앞에 있다. 대표 메뉴는 수플레 팬케이크로 촉촉한 수플레 위에 샹티크림을 아낌없이 올렸고 주위에는 각종 과일이 토핑으로 올라가 사진을 찍게 만드는 비주얼을 자랑한다. 주문 즉시 제조하여 더욱 폭신한 식감을 느낄 수 있으며, 과일은 제철 과일에 따라 달라져 새콤달콤한 맛을 즐길 수 있다. 브런치로는 페퍼로니피자, 베이컨포테이토피자, 버팔로윙&감자튀김이 있고 디저트는 도넛, 베이글, 파운드, 케이크 등 종류가 다양하다. 1층은 주차장이고 카페는 2층, 3층, 루프탑으로 이루어져 있다. 루프탑이 있지만 노키즈존이 아닌 웰컴 키즈존이며 아기 의자도 넉넉히 준비되어 있어 어린이들과 방문하기에 좋다. 지역 명소인 매미성이 차로 5분 거리에 있다.
※반려동물 동반 가능 (야외와 4층 루프탑만 가능)","<a href=""http://www.instagram.com/cafe_stay.g""target=""_blank"" title=""새창 : 카페스테이지 사이트로 이동"">http://www.instagram.com/cafe_stay.g</a>"
카페스토리,3013767,음식,음식점,카페/전통찻집,http://tong.visitkorea.or.kr/cms/resource/85/3012185_image2_1.JPG,경기도,127.2413307563,37.5549186709,"카페스토리는 경기도 남양주에 위치한 반려견 동반이 가능한 카페이다. 메인 정원과 총 3개의 펫가든이 있으며 이 중 두 개는 중, 소형견 전용 나머지 하나는 대형견을 위한 전용 운동장이다. 전용 운동장에서는 리드 줄 프리로 함께 온 강아지들이 잔디 운동장에서 맘껏 뛰어놀 수 있다. 전용 운동장을 제외한 공간은 반드시 리드 줄을 착용해야 하며 실내는 입장할 수 없다.  이곳은 커피와 음료뿐 아니라 피자나 파스타 등의 음식과 바베큐도 함께 즐길 수 있다. 1인 1주문을 원칙으로 하며 반려견도 입장료를 내야 하지만 음식과 음료를 주문할 경우 반려견의 입장료는 무료이다. 
이 카페는 반려인에게도 인기이지만 비반려인에게는 뷰가 아름다운 카페로도 유명하다. 야외정원뿐 아니라 실내에서도 탁 트인 한강을 감상할 수 있으며 특히 일몰의 석양이 그야말로 예술이다. 겨울에는 야외 정원에 텐트가 설치되어 캠핑을 하는 듯한 즐거움을 느낄 수도 있다. 사계절 아름다운 한강뷰를 감상하며 사랑하는 반려견과 혹은 가족이나 지인과 행복한 시간을 보내기에 더할 나위 없는 곳이다.","<a href=""https://www.instagram.com/cafestory_kr/"" target=""_blank"" title=""새창 : 홈페이지로 이동"">https://www.instagram.com/cafestory_kr</a>"
카페스톤,2831882,음식,음식점,카페/전통찻집,http://tong.visitkorea.or.kr/cms/resource/78/2831878_image2_1.jpg,경상북도,128.2355611259,35.6651143709,"카페스톤은 경상북도 고령군 쌍림면 합가리에 자리 잡고 있다. 화려한 외관과 내부가 눈에 띄는 곳으로 특히 내부에는 카페 상호처럼 다양한 돌 장식품이 전시되어 있다. 대표 메뉴는 아메리카노인데, 카페스톤만의 특별한 블랜딩으로 조합해 ‘돌 커피’라는 이름을 지었다. 이 밖에 짭조름한 크림을 넣은 돌 소금 등이 있다. 고령 IC에서 가깝고, 인근에 고령유니밸리 CC가 위치하고 있다.",
카페스톤,2832032,음식,음식점,카페/전통찻집,http://tong.visitkorea.or.kr/cms/resource/21/2832021_image2_1.jpg,대구광역시,128.6307495338,36.0299191839,"카페스톤은 경상북도 군위군 부계면 남산리에 있다. 자연과 어우러진 세련된 느낌의 외관과 내부가 시선을 붙든다.
대표 메뉴는 자체 개발한 블렌딩으로 만든 돌커피로 아메리카노의 일종이다. 이 밖에 짭조름한 크림을 얹은 돌소금을 비롯해 까까라테, 트리플에이드, 돌푸치노, 단풍라테 등을 맛볼 수 있다.
동군위IC에서 가깝고, 인근에 팔공산도립공원, 팔공산금화자연휴양림이 있다.
※ 반려동물 동반 가능(목줄, 배변봉투 지참)",
카페스트리트93 (CAFE STREET93),2793590,음식,음식점,카페/전통찻집,http://tong.visitkorea.or.kr/cms/resource/11/2793411_image2_1.jpg,강원특별자치도,128.7069418005,37.6728741169,평창군 대관령면에 위치한곳으로 넓은 공간에서 편안하게 커피 한 잔 할 수 있는 공간이다.,
카페스티빈,2773376,음식,음식점,카페/전통찻집,http://tong.visitkorea.or.kr/cms/resource/12/2773512_image2_1.JPG,경기도,127.0703681019,37.1756067701,"카페 스티빈은 경기도 오산시 내삼미동에 위치한 대형 카페이다. 대표메뉴인 잠봉뵈르샌드위치를 포함하여 다양한 브런치 메뉴를 판매하고 있다. 또한 커피, 라떼, 티, 에이드, 스무디 같은 음료와 쿠키, 크로플, 치즈케이크 같은 디저트 메뉴도 판매한다. 2층으로 된 넓은 실내 공간과 함께 외부에도 음료를 마실 수 있는 좌석이 준비되어 있다. 넓고 쾌적한 실내의 편안한 좌석과 자연 속의 야외 공간 중 취향대로 골라 휴식을 취할 수 있다. 2층은 노키즈존이다.","<a href=""https://www.instagram.com/steavin2020/"" target=""_blank"" title=""새창 : 카페스티빈 사이트로 이동"">https://www.instagram.com/steavin2020</a>"
카페시나브로,2778823,음식,음식점,카페/전통찻집,,인천광역시,126.6237240884,37.5216559284,"인천 북항 인근의 청라 5단지에는 예쁘고 맛난 카페가 몰려있는데 그 중 카페시나브로는 크림 라떼인 몬테카를로로 이름난 디저트 카페이다. 대표 메뉴는 몬테카를로, 카페마르끼노, 홍시프레도(홍시와 요구르트, 감말랭이가 섞인 음료)이며, 티라미수와 브라우니도 인기 있는 디저트이다. 카페 전면이 통창으로 되어 있고 층고가 높고 벽면이 화이트로 마감되어 있어 시원하게 확 트인 개방감과 청량감을 준다. 좌석 간 공간도 넓은 편이어서 여유 있게 통창을 통해 계절을 느끼며 차와 디저트를 즐길 수 있다.","<a href=""http://instagram.com/_cafe_sinabro"" target=""_blank"" title=""새창 : 카페시나브로 사이트로 이동"">http://instagram.com/_cafe_sinabro</a>"
카페시스터즈,2660555,음식,음식점,카페/전통찻집,http://tong.visitkorea.or.kr/cms/resource/60/2660560_image2_1.jpg,충청남도,127.1061641311,36.8003062706,커피뿐만 아니라 다양한 음료와 브런치를 즐기기 좋은 곳이다. 대표메뉴는 샌드위치이다. 충청남도 천안시에 있는 카페다.,
카페실버팟,2840839,음식,음식점,카페/전통찻집,http://tong.visitkorea.or.kr/cms/resource/19/2840819_image2_1.jpg,경기도,127.2212702493,37.6942743361,"카페실버팟은 남양주 오남호수공원 인근에 위치한 대형카페이다. 루프탑과 야외 정원에서 탁 트인 오남호수뷰를 만끽할 수 있다. 오남 호수 위 둥둥 떠 있는 구름을 모티브로 만든 크림라떼, 푸른 오남호수와 어울리는 레어치즈케이크가 카페실버팟의 시그니처 메뉴이다. 또 시즌 한정으로 로투스 크림라떼도 맛볼 수 있다. 이외에도 수제 과일청 에이드와 브런치 메뉴인 소불고기 샌드위치, 프렌치토스트 등도 판매하고 있다.","<a href=""https://www.instagram.com/official_cafesilverpot/""target=""_blank"" title=""새창 : 카페실버팟 사이트로 이동"">https://www.instagram.com/official_cafesilverpot/</a>"
카페썬번,2807808,음식,음식점,카페/전통찻집,,부산광역시,129.1002870237,35.1990465422,카페썬번은 부산시 안락동에 위치한 미국 감성의 인테리어를 한 카페로 1990년~2000년대 팝음악을 함께  즐길 수 있다. 다양한 빵과 커피 등 디저트를 맛볼 수 있다. 홀케이크는 따로 예약 주문이 가능하다. 낮에는 발랄한 느낌을 준다면 저녁에는 또 다른 분위기를 느낄 수 있는 공간이다.,
카페아더맨,2867253,음식,음식점,카페/전통찻집,http://tong.visitkorea.or.kr/cms/resource/45/2867245_image2_1.jpg,전라남도,126.9655199247,35.0417042159,"빨간 지붕의 외관에 원목과 라탄의 따뜻한 분위기의 실내가 맞이하는 카페아더맨은 화순역과 농주역 사이에 있다. 내부는 층고가 높고 통창이 크게 있어 바깥 날씨 그대로를 개방감 있게 즐길 수 있다. 바닥이 빨간 벽돌로 되어 있는 점도 특이하다. 시그니처 메뉴는 스위트한 크림라떼고, 상하목장 아이스크림으로 만든 아이스크림 라떼도 부드럽고 달콤하다. 디저트로도 메이플 피칸 파이, 애플파이, 크루아상, 레몬케이크, 딸기 티라미수 등이 있다. 간이역처럼 꾸며 이정표를 세워놓은 곳을 비롯해 카페 곳곳에 사진을 찍을만한 포토존이 많다. 주차장이 넓어 편리하다. 은은하고 조용한 여유를 즐기고 싶을 때 방문해도 좋다.","<a href=""https://www.instagram.com/aderman__/""target=""_blank"" title=""새창 : 카페아더맨 사이트로 이동"">https://www.instagram.com/aderman__/</a>"
