title,contentid,cat1,cat2,cat3,firstimage,region,mapx,mapy,overview,homepage
연악서원,1959016,인문(문화/예술/역사),역사관광지,유적지/사적지,,경상북도,128.1527409531,36.3601089243,"갑장산이 힘차게 동쪽으로 뻗어나와 좌우로 펼쳐져 한 구역을 이루니 이를 연악(淵嶽)이라고도 한다. 
연악서원은 1553년(명종 8)에 목사 신잠이 상주에 세운 서당 17개소 중의 하나이며, 직접 친히 연악서원이란 네 글자를 크게 현판 하였는데 임진왜란 때 서당과 현판이 모두 불타 버렸다. 그 후 1601년 (선조 34)과 1658년(효종 9)에도 중건하였고 1702년(숙종 28)에 서당에서 서원으로 승격되며 지방유림의 공의로 박언성·김언건·강응철·조광벽·강용량의 덕행과 업적을 추모하기 위해 창건하여 위패를 모셨다. 1868년(고종 5)에 서원철폐령으로 훼철되었으며, 1913년 단소(壇所)를 설립하고 1974년 강당을 중건하였으며, 1986년에는 사당을 복원 고유하였다.
4칸의 강당과 3칸의 고직사가 있으며, 동재, 서재는 그 터만 남아 있다.
이 서원에서는 매년 4월 중정(中丁 : 두번째 丁日)에 향사를 지내고 있다.","<a href=""http://www.sjcc.or.kr/bbs/board.php?bo_table=2_e&wr_id=27&page=8"" target=""_blank"" title=""새창 : 홈페이지로 이동"">http://www.sjcc.or.kr/</a>"
연안별버거,2825142,음식,음식점,서양식,,인천광역시,126.6648999974,37.4537173309,연안별버거는 100% 프리미엄 청정 냉장 와규 패티로 만든 정통 미국식 버거를 제공한다. 남녀노소 좋아하는 맛으로 인천 연안부두 근처에 간다면 꼭 맛보아야 한다는 후기가 있다. 맛 뿐만 아니라 특유의 감성을 자아내는 인테리어와 버거의 비주얼까지 즐거움을 선사한다.,"<a href=""https://www.instagram.com/yeonan_byul_burger/"" target=""_blank"" title=""새창 : 연안별버거 인스타그램 페이지로 이동"">https://www.instagram.com/yeonan_byul_burger/</a>"
연안부두,126796,자연,자연관광지,항구/포구,,인천광역시,126.6009780171,37.4549243971,"서해 도서로 운항하는 여객선의 출발지이다. 싱싱한 생선과 젓갈 등을 저렴한 가격으로 구입할 수 있는 인천종합어시장과 수협에서 직영하는 회센타 (일반시중가의 60~70%선), 바다낚시를 즐길 수 있는 남항부두가 있는가 하면 해수탕도 여러 곳 있다. 최근에 관광특구로 지정되었다. 우렁찬 뱃고동 소리를 가장 가까운 거리에서 들을수 있는 곳, 연안부두는 해양도시로 인천 중구의 상징이며 미지의 섬으로 떠나고 싶은 사람이 많이 방문하는 곳이기도 하다. 

연안부두에 있는 인천종합어시장은 사시사철 늘 사람들이 붐빈다. 좀 더 싱싱하고 저렴한 가격에 생선을 사려는 이들이 이 곳을 찾기 때문이다. 인천 앞바다 일대는 황금어장이라는 찬사가 부끄럽지 않은 바다낚시 천국이다. 포인트는 덕적도, 풍도, 승봉도, 자월도, 이작도, 육도, 삼도, 창서, 부도, 백암, 영흥도를 모두 아우른다. 남항부두가 바로 바다낚시배들이 출항하는 곳, 개인적으로 출조하는 것은 물론 배 위에서 해상 세미나를 하거나 캠프할 곳, 해양레포츠를 알선하는 등, 여러가지 목적으로 선박을 빌려 주기도 한다. 연안부두내 친수공원에는 봄~가을 매일밤 돌고래 분수쇼가 이루어지고 친수공원내에 장미덩쿨과 소규모 동물원이 있다.","<a href=""https://www.icjg.go.kr/tour/cttu0105a01""새창 : 인천 중구 문화관광 사이트로 이동"">http://www.icjg.go.kr/tour</a>"
연안부두 목포신안18호횟집,2846811,음식,음식점,한식,http://tong.visitkorea.or.kr/cms/resource/98/2846798_image2_1.jpg,인천광역시,126.5978284561,37.4494305355,"연안부두 목포신안18호횟집은 인천 중구 항동 7가 연안부두횟집거리에 있다. 주차장은 가게 앞 전용 주차장이 마련되어 있다. 이곳은 TV 프로그램에도 여러 번 소개되었던 음식점이다. 대표 메뉴는 활어회+랍스터+60첩 코스다. 반찬은 낙지호롱, 튀김류, 참치회, 콘치즈, 전복회, 낙지탕탕이, 가리비회, 가오리찜, 간장게장, 멍게, 관자, 생선구이 등 60가지의 반찬이 제공된다. 계절에 따라 시간을 잘 맞추면 창문으로 떨어지는 서해 낙조 감상도 가능하다. 식당 인근에는 연안부두 바다쉼터, 상트페테르부르크광장, 밴댕이회무침거리, 월미도, 월미테마파크 등이 있어 연계 관광을 즐길 수 있다.
※ 반려동물 동반 불가","<a href=""https://blog.naver.com/kojinwoo00""target=""_blank"" title=""새창 : 연안부두 목포신안18호횟집 사이트로 이동"">https://blog.naver.com/kojinwoo00</a>"
연안부두 밴댕이회무침거리,699274,인문(문화/예술/역사),체험관광지,이색거리,,인천광역시,126.6027639318,37.4561353988,지금부터 30여 년 전 지금의 밴댕이 거리 언덕배기 언저리에 밴댕이를 팔던 집이 있었다. 지금은 없어진 그 집이 인천 밴댕이 거리에 처음 생긴 집이었다. 지금은 그 집에서 일하던 사람이 차린 밴댕이 집이 가장 오래된 집인데 그 역사가 30년이 된 것이다. 지금 밴댕이 거리의 모습은 10년 전부터다. 그리고 몇 해 전 구청에서 밴댕이 골목 입구에 밴댕이 골목을 알리는 조형물을 세웠다. 밴댕이는 3~4월에 먹어야 가장 맛있다고 한다. 살이 오르고 기름기가 많아져 고소하다. 식당 거리 주인들은 가을에 전어가 있고 봄에는 밴댕이가 있다고 말한다.<br>,"▪ <a href=""http://itour.incheon.go.kr"" target=""_blank"" title=""새창 : 인천투어 홈페이지로 이동"">http://itour.incheon.go.kr</a><br>▪ <a href=""https://blog.naver.com/icjunggu/223212477839""target=""_blank"" title=""새창 : 인천중구공식블로그로 이동"">https://blog.naver.com/icjunggu</a>"
연안이씨 쌍효각,1687841,인문(문화/예술/역사),역사관광지,유적지/사적지,http://tong.visitkorea.or.kr/cms/resource/07/3063807_image2_1.JPG,충청북도,127.9328632115,37.0517950514,"충주 연안 이씨 쌍효각은 충청북도 충주시 동량면 대전리에 있는 조선 후기 효자 이시희, 이시걸 형제 효자문이다. 쌍효각 내용에 따르면 이시희, 이시걸 형제는 연안 이씨 문강공인 이석현의 4세손으로 부친과 모친의 상을 당하자 형제가 함께 정성을 다해 시묘하였고, 임진왜란이 발생한 당시에서도 시묘를 이어갔다고 전해진다. 이 둘의 효성을 참작해 1722에 이 두 형제가 살고 있던 자리인 충주시 살미면 신당리에 명정된 효자를 표창하던 정려이다.
연안 이씨 쌍효각은 충주댐 건설로 수몰이 되면서 후손들이 1983년 현재의 자리로 옮겨 복원하였다. 일각문을 세운 사괴석 담장 내에 남향으로 배치하였으며, 건물 규모는 정면 1칸, 측면 1칸으로 사면에 홍살을 돌렸다. 구조는 원형 초석을 놓고 원형 기둥을 세워 이익공 계통의 공포를 구성하였고, 익공 끝에는 연꽃 모양을 새겨 넣었으며, 창방으로 짜인 기둥 사이에는 화반 한 개를 놓아 주심도리 장여를 받치도록 하였다. 가구는 굴도리 4량 집으로, 겹처마 팔작지붕이다. 효에 대해 생각하게 되는 곳이다.","<a href=""https://www.heritage.go.kr/heri/cul/culSelectDetail.do?pageNo=1_1_1_1&sngl=Y&ccbaCpno=3413300460000"" target=""_blank"" title=""새창 : 홈페이지로 이동"">https://www.heritage.go.kr/</a>"
연암공원,2746381,인문(문화/예술/역사),휴양관광지,공원,http://tong.visitkorea.or.kr/cms/resource/58/2746458_image2_1.jpg,대구광역시,128.6003419552,35.9002610938,"대구시 북구 산격동에는 숨은 볼거리가 많다. 이 가운데 하나가 연암공원이다. 연암공원이 자리 잡은 곳은 해발 130m가량의 연암산이다. 연암산은 이 일대에 제비들이 많았다고 해서 제비의 한자어인 제비 '연' 자를 따와서 지었다.
연암공원의 면적은 약 341,000㎡다. 널찍한 부지 위에 구암서원을 비롯해 유아숲 체험원, 다목적 운동장, 배드민턴장, 물놀이장, 맨발 산책로 등이 있다. 특히 여름철 개장하는 수영장은 한여름 무더위를 날리기에 그만이다.

*사진 출처: 대구광역시청",
연암서당골,2770587,인문(문화/예술/역사),체험관광지,이색체험,,대구광역시,128.5965783902,35.9005387706,"연암서당골은 대두광역시 북구에 위치하고 있다. 제비바위와 연관된 연암산과 구암서원, 체화당, 산격제일교회 등 많은 문화유산을 품고 있으며 골목길과 비탈길, 골목시장 등 정감 있는 마을로 많은 관광객과 체험객이 방문하는 새로운 관광명소로 자리 잡고 있다. 이들에게 기념이 되고 새로운 희망을 전할 수 있는 관광상품을 개발하여 관광 활성화에 기여하고 있다.",
연암지질생태공원,2782902,자연,자연관광지,자연생태관광지,http://tong.visitkorea.or.kr/cms/resource/26/2795626_image2_1.jpg,충청북도,127.59407479,36.8358025954,"증평 시내에서 자동차로 약 10~15분 거리에 위치한 수변 생태공원이다. 저수지 수변을 따라 약 2km의 데크길이 조성되어 있고, 수변을 가로지르는 출렁다리도 설치되어 있다. 저수지를 둘러싼 야산과 수려한 경관으로 산책하기 좋은 공원이다. 증평군 도안읍 연촌리 일대는 중생대 백악기에 생성된 음성 퇴적분지에 속한다. 이 공원은 약 2km에 걸쳐 변성암, 화성암, 화산암, 퇴적암 등의 다양한 지질구조가 함께 나타나는 곳으로 야외 지질 학습장으로서의 가치가 높은 공원이다. 아이들과 함께 가볍게 다녀가기 좋은 곳이다.","<a href=""https://www.jp.go.kr/tour.do"" target=""_blank"" title=""새창 : 홈페이지로 이동"">https://www.jp.go.kr/tour.do</a>"
연양정원,2792750,음식,음식점,카페/전통찻집,http://tong.visitkorea.or.kr/cms/resource/84/2794784_image2_1.jpg,경기도,127.6655831679,37.2921707372,"여주 금은모래강변 유원지 바로 앞에 있는 카페이다. 커피나 음료뿐 아니라 다양한 브런치, 디저트, 샌드위치 등을 판매하고 있다. 현대적이면서도 레트로한 분위기가 독특하고 이색적인 분위기이다. 실내는 소파로 되어 있어 따뜻하고 편안한 분위기이다. 프라이빗하게 보낼 수 있는 공간도 잘 갖추어져 있어 주변으로부터 독립적인 분위기에서 휴식을 취하거나 이야기를 나눌 수 있다. 야외에도 테이블이 있어 쾌적하게 차를 마실 수 있다. 야외 한쪽에는 흡연실도 별도로 마련되어 있다.","<a href=""https://www.instagram.com/yeonyang_garden/"" target=""_blank"" title=""새창 : 연양정원 사이트로 이동"">https://www.instagram.com/yeonyang_garden/</a>"
연어 자전거길,2702630,레포츠,육상 레포츠,자전거하이킹,,강원특별자치도,128.6215261022,38.0721817279,"연어 자전거길은 연어가 회귀하는 남대천을 따라 양양 읍내에서 출발해 하구까지 갔다가 되돌아오는 길로 전국에서 유일하다. 거리는 9km정도이고 대부분 평지여서 초보자와 노약자도 어렵지 않게 완주할 수 있다. 
코스를 도는 동안 양양의 상쾌한 공기와 남대천이 흐르는 경치를 마주할 수 있는데다 매년 10월 연어축제가 열려 사람들의 발걸음이 끊이지 않는 곳이다. 
(출처: 강원도청)","<a href=""https://tour.yangyang.go.kr/""target=""_blank"" title=""양양 문화관광 홈페이지로 이동"">https://tour.yangyang.go.kr/</a>"
연어로만 송도점,2906452,음식,음식점,일식,http://tong.visitkorea.or.kr/cms/resource/42/2906442_image2_1.jpg,인천광역시,126.6437369606,37.3923824156,"연어로만 송도점은 인천지하철 1호선 인천대입구 4번 출구 센트럴파크공원 맞은편에 있다. 주차는 송도센트럴파크 푸르지오 지하 1층에 주차할 수 있다. 이곳은 연어요리 전문집이다. 건물은 2층으로 되어있고 건물 내부는 아담하면서 따뜻한 느낌이 나는 인테리어로 되어 있다. 메뉴들과 곁들일 락교 및 장국, 개별 식기들은 셀프 바 형태로 깨끗하게 준비되어 있다. 홀에는 잔잔한 피아노 반주가 흘러나온다. 대표메뉴는 생연어 초밥, 아부리 초밥, 두꺼어 사시미가 있다. 이외 생연어날치알 야채롤, 사케동 등이 있다. 연어 특유의 비린내가 나지 않아 부담 없이 즐길 수 있다.",
연어바치,2838755,음식,음식점,한식,,부산광역시,129.1041384067,35.1363897422,입에서 사르르 녹는 연어 덮밥이 유명한 부산 남동구에 위치한 맛집이다. 다른 연어 덮밥 집과는 다르게 옴폭한 볼에 들어있는 연어 덮밥이 아닌 접시에 얇게 퍼져있는 밥 위에 올려 저 나오는 이 식당만의 특별한 연어 덮밥이다. 또한 연어 덮밥뿐만 아니라 크림 파스타와 피자 메뉴까지 준비되어 있어 다양한 음식을 맛볼 수 있는 곳이다.,
연어의 고향 펜션,138267,숙박,숙박시설,펜션,http://tong.visitkorea.or.kr/cms/resource/12/1815212_image2_1.jpg,강원특별자치도,128.635026503,38.1092415716,"강원도 낙산해수욕장 조산리 마을 내에 위치한 유러피안 스타일 펜션 연어의 고향은 도보거리에 낙산 바닷가와 일출 장관으로 유명한 낙산사 연어가 희귀하는 그린벨트 남대천이 있으며 설악산, 대포항, 하조대, 척산온천, 오색 약수터, 설악워터피아, 대조영 촬영장, 해양 박물관, 테디베어팜, 노란 잠수함 등 다채로운 여행지가 가까이 있어 가족 체험여행이나 연인들의 추억여행지로 좋다.
서울에서 3시간거리, 버스터미널이 가깝고, 해안도로인 7번 국도를 끼고 있기에 대관령 양떼목장부터 바다와 설악산까지 알찬 강원도 여행 계획을 세울 수 있다. 나무 정원 바비큐 가든, 실내 바비큐 시설과 아늑함 쉼터, 하트 꽃 정원 등의 시설과 철저한 위생관리로 더욱 아름답고 평화로운 분위기에서 가족과 연인들이 바다를 벗 삼아 쉬어가기에 좋다.","<a href=""http://www.home4salmon.com"" target=""_blank"" title=""새창 : 연어의 고향 펜션 홈페이지로 이동"">http://www.home4salmon.com</a>"
연오랑세오녀테마공원 귀비고,2633900,인문(문화/예술/역사),휴양관광지,테마공원,http://tong.visitkorea.or.kr/cms/resource/40/2638640_image2_1.jpg,경상북도,129.4589191513,36.0022406946,"연오랑세오녀테마공원 전시관 귀비고는 포항 지역의 특화된 스토리텔링 문화공간을 지향하며, 장소의 역사성과 미학적 특성을 반영한 특별기획전, 문화예술 체험프로그램, 지역특화 프로그램 등을 운영한다. 전시실 및 영상관, 교육·체험프로그램을 위한 라운지 공간 등이 조성되어 있으며, 애니메이션, VR체험, 미디어체험 등 다양한 기법으로 연오랑세오녀를 만나볼 수 있는 관람객 중심의 전시관이다.","포항관광 <a href=""https://www.pohang.go.kr/phtour/index.do"" target=""_blank"" title=""새창 : 포항관광 홈페이지로 이동"">https://www.pohang.go.kr/phtour/index.do</a>"
연와미당,2899102,음식,음식점,한식,http://tong.visitkorea.or.kr/cms/resource/92/2899092_image2_1.jpg,전북특별자치도,127.1242808184,35.8045038827,"전주시 상산고등학교 근처에 있는 연와미당은 현지인 유명 맛집으로, 넓고 깨끗한 매장과 전용 주차장이 있어 평일에도 많은 손님이 방문하는 곳이다. 연와미당은 참나무 숯불로 구운 소고기와 깊은 맛이 일품인 갈비탕이 유명한 맛집이다. 갈비탕은 국물이 진하고 고소하며, 갈비가 부드럽고 단맛이 난다. 연두색 기와에 맛집이라는 뜻을 지닌 연와미당은 가게 내부는 많은 식물로 실내 조경을 세심하게 꾸몄고, 많은 손님으로 저녁 식사 시 예약이 필요할 수 있다. 밑반찬은 주문한 메뉴에 따라 달라지며, 한우 생갈비와 불고기, 전골, 장터국밥 등 다양한 메뉴들이 있다.
※반려동물 동반 불가","<a href=""https://www.instagram.com/yeonwamidang/""target=""_blank"" title=""새창 : 연와미당 사이트로 이동"">https://www.instagram.com/yeonwamidang/</a>"
연우당,2575760,숙박,숙박시설,한옥,http://tong.visitkorea.or.kr/cms/resource/69/2575469_image2_1.JPG,전북특별자치도,127.1531362943,35.8155864558,"연우당은 따뜻한 만남의 장소라는 의미로 태조 이성계의 어진을 봉안하고 있는 전주 경기전 한옥마을 중심에 위치하고 있어 한옥마을 주변을 쉽게 둘러볼 수 있는 반면, 공방 공목 안쪽에 자리하고 있어 번잡함에서 벗어나 편안하고 아늑한 휴식을 취할 수 있는 장소이다.",http://www.yeonwoodang.com/
연우소극장,130406,인문(문화/예술/역사),문화시설,공연장,http://tong.visitkorea.or.kr/cms/resource/58/1837658_image2_1.jpg,서울특별시,127.0017377683,37.5869800652,"연우소극장은 뮤지컬, 콘서트, 연극, 무용 등 다양한 장르의 공연을 하는 공간이다.
창작극 불모 시대에 창작극이라는 깃발을 내걸고 시작한 연우소극장은 한국 연극의 독자적인 공연 양식을 창출하기 위해 창작극 개발을 해왔다. 실험 작업을 꾸준히 해온 결과 오늘날 한국 연극에서 보이는 창작극 활성화를 앞당겼고, 연극만이 가진 독특한 연극성을 개발해 온 한국 연극계에서 새로운 연극적 방식의 산실로서 자리 잡았다.
연우소극장은 건물 지하 1층에 있어서 계단을 반쯤 내려가면 초대권과 안내 책자를 배부받을 수 있다. 공연장 내부는 무대 사이를 두고 관객석이 90도 각도 양측으로 배치되어 있다. 보통 무대가 일직선 형태로 되어 있는데 연우소극장 무대는 직각자 구조로 되어 있어서 조금 더 입체적인 공간감을 주는 무대로서 공연에 집중하여 감상할 수 있다. 주변에 대학로 맛집과 예쁜 카페들이 있어서 공연 전후로 함께 이용하기 편하다.","<a href=""https://iyeonwoo.modoo.at/"" target=""_blank"" title=""새창 : 연우소극장 홈페이지로 이동"">https://iyeonwoo.modoo.at/</a>"
연우펜션,1373262,숙박,숙박시설,펜션,,경상남도,127.6457869667,35.2892741046,"전라도와 경상도를 가로지르는 화개장터에서 쌍계사를 지나 직진하면 의신마을이 나오고, 이어 화개계곡을 지나면 의신계곡이 나온다. 그곳에 자리한 연우펜션은 물 맑고 공기 좋은, 한마디로 청정 펜션이다. 도시에서는 결코 느낄 수 없는 맑은 공기를 깊게 들이마시며 연우펜션 안으로 들어가면 주인이 마치 산 사람 같은 순박한 표정으로 반갑게 맞이해 준다.
마산이 고향인 주인은 정년퇴직 후 펜션사업을 하려 여러 곳을 다니다 지인의 소개로 이곳에 터를 잡았다. 그는 펜션을 운영하면서 산이 더 좋아졌고, 거의 매일 지리산에 오른다고 한다. 연우펜션은 솔나리, 참나리, 원추리, 솜다리 등 야생화 이름을 가진 객실이 있다. 솔나리, 원추리 룸은 투 룸으로 솔나리 룸은 최대 12명까지, 원추리 룸은 최대 6명까지 지낼 수 있다. 참나리와 솜다리 룸은 원룸으로 2~4명이 함께 지낼 수 있다. 주인은 하룻밤이라도 손님들이 맑은 공기 속에서 쉬고 갈 수 있도록 전체 객실을 황토와 숯으로 도배했다. 그리고 좀 더 자연을 만끽하라는 의미에서 TV와 컴퓨터를 없앴다. 각 룸은 취사 시설을 갖추고 있으며, 고기를 구울 때 필요한 강원도 참숯이 1만원(4인 기준)에 제공된다. 연우펜션에서 머물려면 예약을 서둘러야 한다.
특히 고로쇠물이 나오기 시작하는 2월 말부터 늦가을까지는 주말뿐 아니라 평일도 예약이 꽉 차기 때문이다. 3층으로 올라가니 의신계곡이 한눈에 들어온다. 가슴이 탁 트이는 느낌이다. 의신마을을 따라 흐르는 의신계곡은 여름에 온 가족이 함께 물놀이를 즐기기에 안성맞춤이다. 더불어 부담 없이 다녀올 수 있는 벽소령(2시간 코스) 트레킹 코스도 추천한다.","<a href=""https://jirisan1004.modoo.at/"" target=""_blank"" title=""새창 : 연우펜션 홈페이지로 이동"">https://jirisan1004.modoo.at/</a>"
연우하우스[한국관광 품질인증/Korea Quality],1883087,숙박,숙박시설,한옥,http://tong.visitkorea.or.kr/cms/resource/52/3009452_image2_1.jpg,서울특별시,126.9853282846,37.5823358662,"""전통 한옥인 연우하우스는 서울 종로 북촌 한옥마을에 위치하여 조용하고 아늑하다. 아담한 두 개의 객실이 준비되어 있고, 객실에는 욕실을 갖추고 있다. 사다리를 타고 지붕으로 올라가서 보는 북촌 한옥마을의 전경이 일품이다. 오래된 한옥이기에 위생관리에 세심한 주의를 기울이고 있다. 인근에 경복궁, 청경궁, 창덕궁 등 서울 명소가 있다.""",
연월,2861407,음식,음식점,일식,http://tong.visitkorea.or.kr/cms/resource/96/2861396_image2_1.JPG,제주특별자치도,126.346914464,33.4570406106,"제주 연월은 하가리 연화지 근처에 있다. 동화책 같은 핑크와 민트 컬러의 출입문과 달리 내부는 빈티지하고 천창을 통해선 빛이 들어오는 반전이 있다. 테이블 7개 정도 규모다. 꾸덕꾸덕한 치즈를 찍어 먹는 연월돈가스와 양파채가 올라간 양파돈가스가 시그니처 메뉴이다. 연월돈가스의 경우 한정 수량만 판매하여 테이블당 한 개만 주문할 수 있다. 키오스크를 통해 주문하는 시스템이다. 연령대별로 선호할만한 메뉴 구성으로 가족 여행자가 많이 찾는다. 주변 여행지로 연화지, 고내포구, 상가리야자숲 등이 있다. 
※반려동물 동반 불가",
연월한옥,3102129,숙박,숙박시설,한옥,,제주특별자치도,126.2698159646,33.317032664,"연월은 100여평의 넓은 정원이 있는 고즈넉한 제주의 자연과 어우러진 제주 1호 한옥으로 등록된 독채 숙소이다. 고택의 분위기를 제대로 느낄 수 있는 공간으로 넓고 안락한 실내가 특징인 고풍스러운 한옥이다. 도심에서 벗어나 고요함을 즐길 수 있다. 곶자왈 도립공원, 오설록, 생각하는 정원, 저지오름 등 자연 관광지가 함께한다.","<a href=""https://blog.naver.com/zuuu_33/222770523469"" target=""_blank"" title=""연월한옥(으)로 이동"">https://blog.naver.com/zuuu_33/222770523469/</a>"
연육교횟집,2916249,음식,음식점,한식,http://tong.visitkorea.or.kr/cms/resource/43/2916243_image2_1.jpg,전라남도,127.7386986829,34.7326382807,"돌산공원에서 차로 1분이면 도착하는 연육교횟집은 여수 바다와 장군도를 바라보는 오션뷰 횟집이다. 가게 바로 앞에 전용 주차장이 있어서 편하게 이용할 수 있다. 입구에는 참돔, 광어, 농어들이 있는 수조가 있어 신선한 횟감을 눈으로 확인할 수 있다. 1, 2층으로 구성된 연육교횟집은 바다를 바라볼 수 있는 테이블 자리도 있지만 조용하고 프라이빗하게 즐길 수 있는 작은 룸도 준비되어 있다. 층고가 높아 답답하지 않고 테이블 간격도 넓게 떨어져 있어 쾌적한 식사가 가능하다. 갯장어, 새조개, 랍스터, 우럭, 낙지, 전복, 해삼, 멍게 등 다양한 종류의 생선회를 즐길 수 있다.",
"연을 처음 재배한 고장, 시흥의 명소들을 만나다",1887439,추천코스,가족코스,가족코스,http://tong.visitkorea.or.kr/cms/resource/06/760306_image2_1.jpg,Unknown,126.8043276058,37.4025090784,"바다와 인접한 시흥은 흥미로운 탐방지들이 많다. 특히 관곡지는 우리나라 연재배의 시초가 된 곳으로 한 여름 백련이 만개할 무렵이면 그 아름다움이 절정에 이른다. 인천의 바다까지 이어지는 갯골은 소래염전이 있던 곳으로 농게, 방게, 칠면초 등 다양한 갯벌 생물들이 서식하고 있어 아이들과 함께 둘러보면 좋다. 오이도의 조개구이도 놓치지 말자.",
