title,contentid,cat1,cat2,cat3,firstimage,region,mapx,mapy,overview,homepage
선림사(보령),318342,인문(문화/예술/역사),역사관광지,사찰,,충청남도,126.5499378671,36.4378354731,"선림사는 보령시 오산면 소성리 산 5번지에 자리한 대한불교 조계종 제6교구 본사 마곡사의 말사이다. 선림사는 서해 바닷가 쪽 큰 산 냇골 동쪽, 이른바 ‘싱기댕이’라고 부르는 곳에 위치하고 있다. 사찰의 주위는 울창한 숲으로 둘러싸여 있고 서해안이 가까이에 있어 멀리 바다가 조망되는 곳이다. 절의 돌 틈에서 나오는 약수는 머리가 맑아지게 하여 감로수라고 알려져 있다. 더욱이 이곳에는 관음조가 유난히 많고 갖가지 새들의 보금자리이기도 하여 성지 다운 도량의 모습을 지니고 있다. 한편 선림사는 정절을 상징하는 도미부인의 전설이 전해져 내려오는 사찰이기도 하다. 백제 개로왕 때의 도미에게는 아름답고 부덕이 있는 부인이 있었는데, 개로왕이 그녀를 궁녀로 삼고자 하였다.
그리하여 개로왕이 도미에게 그녀를 시험하려는 내기를 하였으나 도미의 아내가 교묘하게 위기를 모면하였다. 이에 속은 것을 알게 된 개로왕이 크게 노하여 도미에게 죄를 씌어 장님을 만들어 작은 배에 태워 띄워 보냈다. 도미의 아내 또한 마찬가지로 강가에서 통곡하다가 빈 배를 타고 천성도(泉城島)에 이르러 남편을 만나 천신만고 끝에 고구려 땅에 이르러 잘 살게 되었다. 이러한 선림사에는 아름다운 자연의 모습만큼이나 애틋한 도미부인의 설화가 전해오는 곳이다. 서해안이 한눈에 내려다보이는 풍광 좋은 곳에 널찍하고 정갈하게 가꿔진 사찰이다. 오랜 옛이야기도 오늘의 선림사에서는 바람 부는 대로 흔들리는 풍경소리와 함께 들려오는 현재의 이야기가 되어 듣게 된다.<br>","보령시 문화관광 <a href=""http://www.brcn.go.kr/tour.do"" target=""_blank"" title=""새창: 보령시 문화관광 홈페이지로 이동"">http://www.brcn.go.kr/tour.do</a>"
선몽대,128133,인문(문화/예술/역사),역사관광지,유적지/사적지,,경상북도,128.4594874723,36.5979124442,"선몽대는 퇴계 이황의 종손이며 문하생인 우암 이열도(1538~1591)가 1563년 창건한 정자이다. 건물의 이름을 짓기 전에 하늘에서 신선이 내려와 노는 꿈을 꾸고 지었으며, 정자 내에는 당대의 석학인 퇴계 이황, 약포 정탁, 서애 류성룡, 청음 김상헌, 한운 이덕형, 학봉 김성일 등의 친필 시가 목판에 새겨 지금까지 전하여 오고 있다. 
울창한 노송이 들어서 있어 자연 경관이 매우 좋으며, 매년 정월 대보름에는 마을의 무사태평과 안녕을 위하여 동제를 지내고 있다. 선몽대의 뒤쪽에 있는 선몽대숲은 수해와 바람으로부터 백송리 마을을 보호하기 위하여 조성된 보호림 또는 비보림(풍수상 단점을 보완하기 위한 숲)으로, 수령 100~200여 년 된 소나무와 은행나무, 버드나무, 향나무 등이 함께 자라고 있다. 특히 누 위에 올라  가면 내성천 백사장 명사십리를 한눈에 볼 수 있고 뒷산에는 기암절벽이 병풍처럼 둘러싸고 있으며, 산 중턱에 약수터가 있다. 
이열도의 유고와 유물을 장서각에 보관하였으나 1924년 화재로 소실되고, 당시의 명인들이 기록한 제영록, 심유록만이 보관되어 있다.","<a href=""https://www.heritage.go.kr/heri/cul/culSelectDetail.do?ccbaCpno=1353700190000&pageNo=1_1_1_1&sngl=Y"" target=""_blank"" title=""문화재청 사이트로 이동"">http://www.cha.go.kr</a>"
선물가게 바나나,2852532,쇼핑,쇼핑,특산물판매점,http://tong.visitkorea.or.kr/cms/resource/29/2852529_image2_1.JPG,제주특별자치도,126.4171378214,33.2580637163,,"<a href=""https://www.instagram.com/shop._.banana/""target=""_blank"" title=""새창 : 선물가게 바나나 사이트로 이동"">https://www.instagram.com/shop._.banana/</a>"
선미도 등대,129130,자연,자연관광지,등대,,인천광역시,126.0775831577,37.2871320274,"인천으로부터 37㎞ 떨어진 곳에 위치한 선미도등대는 인천항과 중국 간을 운항하는 선박들과  북한과의 해상교역을 위해 남북한을 오가는 선박들이 이용하고 있다. 선미도 등대는 2003년 12월에 새롭게 태어났다. 오랜 풍상에 낡아 훼손된 기존 등대를 철거하고 그 자리에 새 등대가 건립되었으며, 등탑은 19.4m로 당초보다 더 높게 지어져 37km 거리에서도 불빛을 볼 수 있다. 등대 불빛을 전달하는 등명기는 우리나라에 몇 대밖에 없는 프리즘렌즈 3등 대형 등명기로 12초에 한 번씩 반짝인다. 무인도인 선미도에는 가마우지, 까치, 노랑할미새, 흰뺨검둥오리가 살고 특히 겨울철이면 멸종위기 야생동물인 천연기념물 제243호로 지정된 참수리가 겨울나기를 한다. 해안가에는 손으로 휩쓸면 한주먹씩 잡힐 정도로 수많은 고동이 나붙어 있고 게들이 기어 다니는 모습도 쉽게 볼 수 있다.","<a href=""https://www.ongjin.go.kr/open_content/tour/"" target=""_blank"" title=""새창: 옹진 관광문화 홈페이지로 이동"">https://www.ongjin.go.kr/open_content/tour/</a>"
선미식당,2904074,음식,음식점,중식,http://tong.visitkorea.or.kr/cms/resource/54/2904054_image2_1.jpg,전라남도,126.5167687078,35.0096531046,"한식을 겸하는 중식당 선미식당은 짬뽕, 짜장면, 볶음밥 중국요리가 맛있기로 유명하다. 야채로 오랜 시간 우려낸 육수를 사용하는 짬뽕에 해산물뿐만 아니라 돼지고기, 어묵이 들어가 매우 독특하고 매력적인 맛을 자랑한다. 볶음밥에는 미역국이 나와서 속이 더욱 편안해진다. 단, 탕수육은 예약해야 먹을 수 있다. 겨울 제철 메뉴인 굴짬뽕도 줄을 서서 기다릴 정도로 인기 메뉴다. 한산한 시골 마을이지만 선미식당 앞에는 늘 차들이 즐비하고 발 디딜 틈 없이 인기 있는 맛집이다. 간짜장, 우동, 짬뽕밥, 오므라이스, 팔보채, 양장피 등 다양한 종류가 있어 따뜻하고 정겨운 맛을 푸짐하게 즐길 수 있다.",
선미정,134405,음식,음식점,한식,,인천광역시,126.6324581423,37.4670374324,"족탕은 30년 역사답게 맛의 노하우를 가지고 있는 선미정의 으뜸 메뉴이다. 오후 10시경부터 다음날 새벽까지 우족을 고아 뼈는 발라내고 고기는 양념에 묻혀 별도로 준다. 워낙 오래 고아 살덩이가 입에서 살살 녹는다. 국물은 파와 마늘, 소금으로만 간을 해서 밥을 말아먹는데 고소하면서도 깊은 맛이 난다. 매장 내부에 단체석이 있어 단체로 이용이 가능하며 주차는 식당 바로 앞에 있는 무료 공영주차장을 이용하면 된다.",
선바위,128198,자연,자연관광지,산,,울산광역시,129.2352757129,35.5822393705,"울주군 범서읍 입암리에는 ‘선바위(立岩)’라는 이름을 가진 바위가 있다. 높이 33.2m, 둘레 46.3m의 이 선바위는 마치 금강산 해금강의 한 봉우리를 옮겨 놓은 듯, 이 부근의 지질이나 암층과는 전혀 다른 암질을 가진 바위가 우뚝 솟아 있다. 선바위를 보듬고 있는 자리가 백룡담 여울인데 옛사람들에 의하면 백룡이 살았던 곳으로, 날이 가물어 천지가 타오를 때 이곳에서 기우제를 올리면 영험이 있었다고 한다. 산 좋고 물 맑은 이곳에서 하늘은 멋진 조각의 솜씨를 남겨 향인들이 시 읊고 노래 부르고 자연을 벗 삼아 풍류를 즐겼는데, 훗날 정각을 세워 ‘입암정’이라 했다. 오늘도 선바위는 몇 만년 흘러온 태화강의 산 증인처럼 우뚝 서 있고, 찾는 사람들의 발길은 멈추지 않는다.
(출처 : 울산 문화관광)","<a href=""https://tour.ulsan.go.kr/kor/unit/attrctn/view.ulsan?mId=001002001000000000&unqId=19"" target=""_blank"" title=""새창 : 울산 문화관광 홈페이지로 이동"">https://tour.ulsan.go.kr</a>"
선바위(선암),2774283,자연,관광자원,기암괴석,http://tong.visitkorea.or.kr/cms/resource/55/3412155_image2_1.JPG,서울특별시,126.9589446749,37.5789274555,"신성한 대상물이 되고 있는 바위로, 마치 중이 장삼-검은 베로 만들어진 품과 소매가 넓은 중의 웃옷-을 입고 있는 형상이라 하여 불교의 ‘선(禪)’자를 따서 이와 같이 부르고 있다. 조선 태조 이성계가 한양에 도성을 쌓을 때 당시의 문신이었던 정도전과 왕사였던 무학대사가 이 바위를 성 안에 두느냐 성 밖에 두느냐로 크게 의견대립을 보였다는 일화가 전한다. 만일 이 바위를 성 안에 두면 불교가 왕성하여 유학에 조예가 깊은 문신들은 힘을 못쓰고, 성 밖에 두면 반대로 승려가 힘을 못쓰게 된다는 주장이었다. 결정을 못 내리고 다음날 아침이 되었는데 특이하게도 눈이 녹지 않은 자리가 있어 태조는 이것을 성터라고 생각하였고 결국 바위는 성 밖으로 밀려났다 한다. 사람의 모습을 하고 있는 자연석으로서, 직접적인 신앙대상물은 아니지만 불력(佛力)을 지닌 존재처럼 신성시되었던 점이 주목된다. 
(출처 : 국가유산청)","<a href=""https://korean.visitseoul.net/seoul-hiking/%EA%B8%B0%EC%95%94%EA%B4%B4%EC%84%9D%EC%9D%98-%EB%B9%84%EA%B2%BD%EC%9D%84-%EB%B2%97-%EC%82%BC%EB%8A%94-%EC%84%A0%EB%B0%94%EC%9C%84-%EC%BD%94%EC%8A%A4_/42519"" target=""_blank"" title=""새창 : 서울 문화관광 홈페이지로 이동"">https://korean.visitseoul.net</a>"
선바위(입암),1624461,자연,관광자원,기암괴석,http://tong.visitkorea.or.kr/cms/resource/29/3049429_image2_1.JPG,울산광역시,129.250285962,35.5662858909,"울주군 범서읍 태화강변 입암마을에 위치한 바위로 백룡이 살았다는 백룡담 푸른 물속에 서 있는 기암괴석이다. 깎아지른 듯 우뚝 서 있는 바위라 하여 선바위(入巖)라 부른다. 높이는 약 33m(수면 위 21m, 수면 아래 12m)이고, 수면 위 둘레는 46m, 바위 최정상 폭은 약 3m인데 꼭대기에는 삼봉을 이루고 정상에는 잡목 몇 그루와 잡초들이 자라고 있다. 옛사람들에 의하면 날이 가물어 비가 오지 않을 때 이곳에서 기우제를 올리면 영험이 있었다고 한다. 울산의 대표적인 관광지로 예로부터 빼어난 경치에 시인묵객이 즐겨 찾아 절경을 노래한 시가 전해오고 있다.
선바위를 마주 보는 벼랑 위에는 학성이씨의 정자인 용암정과 통도사의 말사인 선암사가 서로 인접하여 있으며 태화강 생태관이 바로 옆에 자리 잡고 있다. 선바위 건너편의 선바위공원에는 피크닉 장소와 아이들의 놀이터인 도담도담 숲 체험원이 있다. 태화가 십리대밭과 함께 철새도래지로서 울산12경에 선정됐다.","<a href=""https://tour.ulsan.go.kr/kor/unit/attrctn/view.ulsan?mId=001002001000000000&page=2&searchDvsn1=A&picPrsId=&searchType3=&searchType1=&searchTxt=&unqId=19"" target=""_blank"" title=""새창: 울산관광 홈페이지로 이동"">https://tour.ulsan.go.kr/</a>"
선바위가든,1014946,음식,음식점,한식,,경상북도,129.0815874765,36.6084841023,일교차가 심한 영양군에서 자라나는 고추는 과피가 두껍고 식물성지방도 많고 빛깔도 진하고 선명하다 해서 빻으면 가루가 많이 나고 국물에도 빛깔과 맛이 잘 우러난다. 이 때문에 전국적인 명성을 얻어 ‘영양고추’가 유명한데 동시에 산채도 많이 나기로 유명하다. ‘가장 먼저 해와 달을 볼 수 있다’ 하여 붙여진 일월산 산채는 조선시대 임금님께 진상되기도 했던 것으로 특히 ‘금죽’은 맛과 향이 빼어나 궁중에서도 귀하게 여겼다고 한다. 그러니 일월산에서 주인 가족이 직접 캔 산나물로 내오는 이 집의 토속음식을 꼭 한 번 맛보길 권한다.,
선바위공원,2871593,인문(문화/예술/역사),휴양관광지,공원,http://tong.visitkorea.or.kr/cms/resource/84/2871584_image2_1.JPG,울산광역시,129.2344951937,35.583364229,"울주군 범서읍 입암리에 있는 선바위공원은 울산 12경 중 하나인 선바위를 가까이서 볼 수 있는 공원이다. 선바위도 보고 공원에서 산책도 하며 휴식을 즐길 수 있다. 앞으로는 강이 흐르고 한여름에도 시원한 나무 그늘이 있어서 울산 근교 나들이를 하기에도 좋다. 선바위 공원은 넓게 조성되어 있어, 경치를 보며 산책이나 운동도 하고, 피크닉도 즐길 수 있다. 선바위 공원은 나무들이 많아 햇살을 가려주는 그늘도 가득하다. 선바위 바로 옆에 태화강 생태관이 있어서 함께 둘러보기 좋다. 
※ 반려동물 동반 가능(목줄 착용 및 배변봉투 지참)",
선바위관광지,2043682,인문(문화/예술/역사),휴양관광지,관광단지,http://tong.visitkorea.or.kr/cms/resource/61/2043661_image2_1.jpg,경상북도,129.0819513306,36.6085729884,"절벽과 강을 사이에 두고 바위를 깎아 세운 듯하다. 거대한 촛대를 세워 놓은 것 같은 바위가 선바위이고, 석벽과 절벽을 끼고 흐르는 두 물줄기가 합류하여 큰 강을 이루는 강을 남이포라 부릅니다. 선바위와 남이포는 조선 세조 때 남이 장군이 역모자들을 평정시켰다는 전설이 내려져오는 국민 관광지로 현재 선바위 지구에 자연생태마을, 농특산물직판장, 수변휴게공간, 산촌박물관, 보트장등을 설치하여 관광객을 유치하고자 개발중에 있는 곳이다.","<a href=""http://www.seonbawi.co.kr/""새창 : 선바위관광지 홈페이지로 이동"">http://www.seonbawi.co.kr/</a>"
선바위메밀장터,2749077,음식,음식점,한식,,경기도,127.0006194505,37.4525039978,선바위역 3번 출구 74m 앞에 있는 선바위 메밀장터는 들기름 막국수가 맛있기로 유명하다. 들기름 막국수 외에도 명태회막국수나 동치미막국수를 취향에 맞게 맛볼 수 있다. 막국수가 아닌 시래기닭매운탕이나 샤브백숙도 TV에 다수 출연할 만큼 유명하다.,
선바위미술관,130706,인문(문화/예술/역사),문화시설,미술관/화랑,,경기도,126.9993168123,37.4517512843,"서울과 경기도를 잇는 과천의 수려하고 쾌적한 환경 속에 자리 잡은 선바위미술관은 풍속화가 이서지 화백이 사라져가는 전통 풍속을 되살리고 기록, 보존하여 후손들에게 널리 알리고자 하는 취지 아래 2004년 설립한 풍속미술관이다. 
약780여 평의 부지와 22평의 전시면적에 옛 조상들의 생활상과 풍습, 자연풍경을 평생에 걸쳐 그려온 고 이서지 화백의 풍속화 1,000여 점과 옛 선조들의 모습을 해학적으로 만들어 온 전통인형 작가 김시온 선생의 전통인형 및 마을 축소 모형을 소장〮전시하고 있다.","<a href=""http://www.seonbawi.com/"" target=""_blank"" title=""새창 : 홈페이지로 이동"">http://www.seonbawi.com</a>"
선바위별이내린캠핑장,2908762,레포츠,육상 레포츠,"야영장,오토캠핑장",http://tong.visitkorea.or.kr/cms/resource/48/2908748_image2_1.JPG,강원특별자치도,128.4029135611,38.2208935232,"인제 미시령 계곡에 위치한 캠핑장이다. 캠핑장과 송어를 먹을 수 있는 송어양식장과 횟집을 같이 운영하고 있다. 각 사이트는 나무 데크가 깔린 곳과 일반 사이트로 구분되어 있다. 캠핑장 뒤쪽에는 계곡이 있다. 계곡물이 깊지 않아 아이들이 물놀이하기에도 좋다. 계곡에 탁자와 테이블, 평상이 준비되어 있어 당일 물놀이만 즐기고 가는 이용객들도 많다.
※ 반려동물 동반가능 (소형견만 가능)",
선바위산(영월),127304,자연,자연관광지,산,http://tong.visitkorea.or.kr/cms/resource/72/1955372_image2_1.jpg,강원특별자치도,128.8053653501,37.1530637051,"선바위산은 해발 1,042m로 백두대간의 함백산 서쪽에 위치한 산이다. 기암절벽과 울창한 노송 군락이 어우러진 모습이 병풍을 펼쳐놓은 듯한 바위산으로, 높이 50여 미터로 서있는 바위가 있어 선 바위산이라는 이름을 얻게 되었다. 산 중턱에 위치하고 있는 선바위는 이곳 주민들이 집안의  대소사가 있을때  치성을 드리는 바위로 마을에서는 신성시 되고 있다.
선바위산을 오르는 산행 코스는 크게 두 가지로, 들머리가 다른 두 곳에서 시작한다. 두산 약수 코스는 약수공원에서 시작하는 가장 짧은 코스로, 두산약수 주차장에서 출발하여 차두덕골, 능선갈림길을 거쳐 선바위산 정상까지 약 1.6km를 걷는다. 소요 시간은 약 2시간이다. 운학사 코스는 운학사 주차장에서 출발하여 운학천을 따라 올라가다가 북릉을 거쳐 선바위산 정상에 도착하는 코스로 소요 시간은 약 3시간 정도이다. 이외에  섬안리 주차장에서 출발하여 섬안이강을 따라 올라가다가 소재를 거쳐 선바위산 정상에 도착하는 코스도 있다.
선바위산은 등산뿐만 아니라 트레킹, MTB, 암벽등반 등 다양한 레저 활동을  즐길 수 있다.  
주변에 고려시대 축조된 석성인 왕검성, 정조의 태를 봉안한 정조대왕태실비등이 있어 영월의 문화와 역사를 함께 살펴볼 수 있다.","<a href=""http://www.grandculture.net/yeongwol/toc/GC08300133"" target=""_blank"" title=""새창 : 홈페이지로 이동"">http://www.grandculture.net</a>"
선바위자연캠핑장,2740972,레포츠,육상 레포츠,"야영장,오토캠핑장",http://tong.visitkorea.or.kr/cms/resource/35/2741135_image2_1.JPG,강원특별자치도,128.0703292504,37.599937094,"병지방 계곡에는 2개의 캠핑장이 갖춰져 있다. 하나는 병지방 오토 캠핑장, 그리고 다른 하나는 선바위 자연캠핑장이다. 이 중 선바위 자연캠핑장이 조금 더 상류에 위치해 있다. 특히 선바위자연캠핑장은 병지방 산촌체험마을 바로 전에 위치해 있고, 관리 운영도 마을에서 위탁을 맡아서 하고 있다. 2018년 개장해 시설이 좋고 깨끗하다. 3626㎡(1,096평) 규모에 캠핑 사이트 45면을 갖췄다. 이와 함께 관리동, 주차장, 화장실, 샤워장, 개수대, 정자, 농특산물 판매장, 잔디광장 등의 부대시설도 갖추고 있다. 선바위캠핑장의 최고 장점은 잣나무 숲 그늘 아래 캠핑 사이트가 마련되어 있어 한여름에도 그늘 속에서 지낼 수 있고, 또 바로 아래 있는 병지방계곡에서 물놀이를 할 수 있다는 것이다. 캠핑장을 이용하기 위해서는 예약확인을 하고 주차장에 차를 댄 후, 카트로 짐을 실어 계곡을 건너가야 한다. 주차비는 캠핑 예약비에 포함되어 있기에 따로 낼 필요가 없고 전동 카트여서 캠핑장까지 많은 짐을 편리하게 운반할 수 있다.","<a href=""http://선바위자연캠핑장.kr/mall/"" target=""_blank"" title=""새창 : 선바위자연캠핑장사이트로 이동"">http://선바위자연캠핑장.kr/mall/</a>"
선바위한우갈비,2871600,음식,음식점,한식,http://tong.visitkorea.or.kr/cms/resource/99/2871599_image2_1.JPG,울산광역시,129.2331317663,35.5711933504,"선바위 한우갈비는 최고급 한우를 저렴하게 먹을 수 있는 정육 식당이다. 3층 건물로 1층은 오픈 공간, 2층은 프라이빗한 공간으로 구성되어 있다. 이곳의 인기 메뉴는 한우 양념 통갈비와 떡갈비로 양념 된 통갈비의 감칠맛과 떡갈비의 녹는 맛은 남녀노소가 모두 좋아한다. 소고기 전문점으로 우삼겹, 육회, 제비추리, 꽃등심 등 다양한 부위를 맛볼 수 있다. 점심 특선으로 육회비빔밥, 한정식, 버섯 불고기 전골 등이 있다. 넓은 전용 주차장이 있어 주차하기에 편리하다. 외고산 옹기마을, 작천정계곡 인접해 있어 함께 둘러보기 좋다.",
선법사,2790497,인문(문화/예술/역사),역사관광지,사찰,,경기도,127.2086958887,37.51804736,"경기도 하남시에 자리한 한국불교 태고종 소속의 사찰이다. 산의 초입에 자리해 풍경소리와 새들의 지저귐이 맴도는 조용하고 그윽한 곳이다. 이곳에 있는 작은 약수를 백제 온조왕이 마셨다 하여 어용 샘으로 부르고 있다고 한다. 사찰 내에 있는 마애 약사여래좌상이 유명한데, 질병에서 모든 중생을 구제해 준다는 약사불을 형상화한 것으로 바위 남쪽면에 전체 높이 93㎝로 새겨져 있다. ‘태평 2년 정축 7월 29일’이라는 명문이 새겨져 있는데, 이를 통해 만든 시기가 고려 경종 2년(977) 임을 알 수 있으며, 최소한 그 이전부터 사찰이 있었을 것으로 추정하고 있다.",
선베이크,2893074,음식,음식점,카페/전통찻집,,충청남도,126.8021134891,36.0799446958,"선베이크는 충남 서천군 한산면 충절로에 위치한 베이커리 카페이다. 
시그니처 메뉴는 바닐라빈 크림라테와 모시 가루를 활용한 한산모시라테이며, 이 외에 다양한 음료 메뉴와 직접 구운 소금빵 등 각종 베이커리류를 판매하고 있다. 베이커리 상품들은 금요일과 토요일에 준비되고 있으니 방문 전 확인해 보는 것이 좋다.",
선본사(경산),128093,인문(문화/예술/역사),역사관광지,사찰,http://tong.visitkorea.or.kr/cms/resource/39/2671639_image2_1.jpg,경상북도,128.7391522829,35.9873149153,"선본사는 상북도 경산시 와촌면 대한리 팔공산의 관봉아래에 위치한 대한불교조계종 직영사찰이다. 이곳은 절 이름보다는 ‘팔공산 갓바위 부처님’이라는 이름으로 널리 알려져 있다. 그래서 절의 동쪽에 있는 갓바위 부처님에는 가파른 산세에도 불구하고 늘 참배객의 발길이 끊이지 않는다. 선본사는 갓바위 부처님에서 내려다 보이는 팔공산의 아늑한 산자락에 자리하고 있다. 우리나라 곳곳의 산천이 예로부터 불교 성지 아닌 곳이 드물지만 특히 팔공산은 한국 불교 역사의 초창기에 있어서 매우 커다란 위치를 차지한다. 또한 선본사에서는 당일형, 휴식형, 체험형의 템플스테이를 운영하고 있다.","<a href=""http://www.seonbonsa.org/"" target=""_blank"" title=""새창 : 선본사 홈페이지로 이동"">http://www.seonbonsa.org/</a>"
선봉사(칠곡),318344,인문(문화/예술/역사),역사관광지,사찰,http://tong.visitkorea.or.kr/cms/resource/06/3408706_image2_1.jpg,경상북도,128.3277052806,36.0868932394,"선봉사는 칠곡군 금오산 자락에 있는 사찰이다. 창건 시기에 대해서는 알려진 바 없다. 다만 1132년에 세운 선봉사 대각국사비(대각국사 의천의 공적을 기리기 위해 세운 비석)에 의해 고려 시대에 선봉사가 존재했었음을 알 수 있다. 선봉사는 대각국사와 그 제자들이 수행했던 천태도량으로, 당시에는 현 위치보다 아래쪽에 있었으며 부지면적이 약 3만 3,000㎡(1만여 평)에 이를 정도로 규모가 컸다고 한다. 조선시대 들어 임진왜란 발발 7년째 되던 해에 왜인들에 의해 전소되어 폐사되었다. 그 후 1922년 유장렬이라는 이가 선몽을 꾸고 대각국사비를 발견한 후 선봉사 터 부근에 대각사라는 사찰을 지었고, 1989년 성수스님이 대각사를 인수함으로써 선봉사라는 이름을 되찾았다. 하지만 정식 사찰명은 선봉사가 아닌 선봉선원으로 등록되어 있다. 경내는 대웅전을 중심으로 오른쪽에 대각국사비를 모신 비각이 있고, 왼쪽에 산신각이 자리한다. 대웅전의 주존불은 1950년 조성한 토불인 석가모니불이며, 법당보다 대각국사비 앞에서 치성드리는 신도들이 많다고 한다.",
선불후면,2871003,음식,음식점,한식,http://tong.visitkorea.or.kr/cms/resource/97/2870997_image2_1.jpg,경기도,126.7375773503,37.8258308517,"선불후면은 경기도 파주시 탄현면에 있는 국수 전문점이다. 상호의 뜻은 계산 먼저 하고, 후에 면을 먹는다는 뜻으로 TV 프로그램에 산더미 육회 국수로 여러 차례 소개된 맛집이다. 직접 뽑은 도토리 생면을 사용하고 셀프 바를 설치해 고소한 도토리 국수 튀김을 셀프로 가져다 먹을 수 있다. 대표 메뉴는 육회 비빔국수와 물회 국수이고 그밖에 잔치국수, 비빔국수, 냉국수가 있다. 밥 종류로는 한우국밥, 육회비빔밥이 있고 사이드 메뉴로 한우 육회, 돈 불고기가 있다. 셀프 바에는 밥, 육수, 단무지, 김치 등을 원하는 만큼 가져다 먹을 수 있다. 양이 푸짐하고 먹음직스러운 게 특징으로 주차는 건물 앞에 할 수 있다.",
