title,contentid,cat1,cat2,cat3,firstimage,region,mapx,mapy,overview,homepage
자연이고 예술이고 가는 곳마다 힐링 버스!,2361048,추천코스,가족코스,가족코스,http://tong.visitkorea.or.kr/cms/resource/80/1536980_image2_1.jpg,Unknown,128.128392451,37.2570444772,"강원도 원주는 치악산국립공원, 박경리문학공원, 뮤지엄산 등 여행과 문학과 예술을 사랑하는 사람들이 즐겨 찾는 곳이다. 누구라도, 언제나 찾아가도 마음 편히 여행할 수 있는 휴식처 같은 곳. 시티투어로 가뿐하게 ‘쉼과 안식’의 도시 원주를 둘러보시길~",
자연이랑캠프,2761322,레포츠,육상 레포츠,"야영장,오토캠핑장",http://tong.visitkorea.or.kr/cms/resource/91/2761291_image2_1.JPG,강원특별자치도,128.2746428994,37.3608408036,"자연이랑캠프는 영월의 법흥리, 법흥 계곡에 위치한 가족 캠핑장이다. 데크사이트 10개와 강자갈 사이트 10개 총 20개와 펜션, 글램핑장이 함께 있다. 시원한 계곡물을 끌어오는 어린이용 수영장과 함께 옆에 계곡에서도 물놀이가 가능하다.  사이트들이 옆으로 줄지어 있어 간격이 좁은 편이지만. 시야는 탁 트여서 산세를 즐길 수 있다. 부대시설들은 깨끗하게 관리되고 있고, 매점에서 필수품들을 구입할 수 있다. 주천 시내와 가까워서 장을 볼 수 있다.","<a href=""https://withnaturecamp.modoo.at/"" target=""_blank"" title=""새창 :자연이랑캠프  사이트로 이동"">https://withnaturecamp.modoo.at/</a>"
자연인캠핑장,2726704,레포츠,육상 레포츠,"야영장,오토캠핑장",http://tong.visitkorea.or.kr/cms/resource/85/2727085_image2_1.jpg,제주특별자치도,126.539955752,33.4687284906,"자연인 글램핑은 제주 중심가에서 5분 거리에 위치해 있으며 펜션, 야외공연장, 카페, 공방, 레스토랑 등 다양한 부대시설을 갖춘 캠핑장이다. 근교에 에코랜드, 용두암, 용두암 해안 도로, 사려니 숲길 등 다양한 관광지가 인접해 있어 편리하게 여행할 수 있는 것은 자연인 글램핑장의 장점이다. 2인실, 4인실 글램핑장으로 나누어져 있으며 화장실과 샤워장은 정리 정돈이 잘 되어 있고 치약, 샴푸, 린스, 컨디셔너, 보디워시, 헤어드라이기 같은 목욕용품이 비치되어 있어 편리하게 이용이 가능하다. 10kg 이하의 소형견은 입실 가능하다.","<a href=""https://jejujayeoninpenglam.modoo.at/"" target=""_blank"" title=""새창 : 자연인캠핑장 사이트로 이동"">https://jejujayeoninpenglam.modoo.at/</a>"
자연채한정식,2574492,음식,음식점,한식,,경상남도,128.4150956785,34.8222873658,경남향토음식잔치에 3회 출전한 한식 전문 업소로서 신선하고 질 좋은 농수축산물을 이용하여 정성스럽게 음식을 만들고 있다. 우리 몸에 좋은 신선한 채소를 위주로 메뉴를 만들어 건강을 생각하는 고객들이 즐겨 찾는 업소이다. 통영시 봉평동에 위치한 이곳은 80평 규모의 깨끗한 시설과 80대 이상 주차할 수 있는 대형 주차 시설이 완비되어 있다. 언제든지 전화예약도 가능하다. 자연채의 특징은 다양한 메뉴를 갖추고 있는 것이다. 통영 바다에서 잡힌 각종 해산물이 계절 따라 푸짐하게 상위에 올려지며 무공해 채소의 신선한 맛을 살린 25가지 종류의 밑반찬이 먹는 즐거움을 선사한다.<br><br>(정보제공자: 통영시청),"<a href=""http://www.xn--ej5bt3ai0h.kr/"" target=""_blank"" title=""새창 : 자연채한정식 홈페이지로 이동"">http://www.xn--ej5bt3ai0h.kr/</a>"
자연초갈비,2671278,음식,음식점,한식,http://tong.visitkorea.or.kr/cms/resource/12/2671212_image2_1.jpg,부산광역시,129.0366549026,35.1541392863,돼지갈비에 약초를 이용하여 숙성시킨 수제왕갈비전문점 자연초갈비이다. 영양돌솥밥과 생선구이도 있다. 다시 방문할 수 있도록 노력하겠다.,
자연충만,2856298,음식,음식점,카페/전통찻집,http://tong.visitkorea.or.kr/cms/resource/85/2856285_image2_1.jpg,대구광역시,128.5334538837,35.7828814807,"자연충만은 대구광역시 달성군 화원읍 본리리에 있다. 카페 명칭처럼 자연 그대로를 만끽할 수 있는 공간이 있다. 모던한 분위기의 외관과 인테리어도 눈에 띈다. 내부에는 단체석이 있어 각종 모임을 하기 좋다. 대표 메뉴는 고소한 견과류의 맛을 느낄 수 있는 아메리카노다. 부드러운 우유와 고소한 원두가 어우러진 카페라떼도 인기다. 이 밖에 리치 헤이즐넛 라떼, 수제 바닐라빈 시럽 라떼, 쑥라떼 등도 맛볼 수 있다. 화원옥포 IC에서 가깝고, 인근에 화원자연휴양림이 있다.
※반려동물 동반 가능(목줄, 배변봉투 지참)","<a href=""https://www.instagram.com/cafe.fullnature/""target=""_blank"" title=""새창 : 자연충만 사이트로 이동"">https://www.instagram.com/cafe.fullnature/</a>"
자연카라반 캠핑장,2792256,레포츠,육상 레포츠,"야영장,오토캠핑장",http://tong.visitkorea.or.kr/cms/resource/03/2792903_image2_1.jpg,경상북도,128.7611435876,35.6325859822,"자연 카라반 캠핑장은 경상북도 청도군 청도읍 청도천 인근에 자리했다. 중앙고속도로 청도IC로 나와 청도읍과 청도역을 지나 밀양 방면으로 3분 정도 이동해 주유소를 지나면서 좌회전하여 좁은 길을 따라가면 다리가 나온다. 다리를 건너 우회전해 조금 이동하면 캠핑장에 도착한다. 캠핑장은 청도천을 사이에 두고 청도 논공단지와 마주 보고 있으며, 청도역과 터미널에서 약 2~3분 거리에 있다. 대형마트 및 각종 편의시설도 차로 5분 거리에 있다. 청도역, 청도역 근처 마트, 청도 터미널 등에서는 캠핑장까지 픽업 서비스도 운영하고 있다. 약 1,652㎡의 부지에는 글램핑 시설 2동과 카라반 4대가 자리하고 있다. 각 사이트에는 전기시설과 무선 인터넷, 소화기가 구비되어 있으며, 남녀 화장실 각 1개소, 남녀 샤워실 각 1개소, 개수대 1개소가 있다. 강을 따라 길게 뻗은 산책로와 자전거 전용 도로에서 한적한 시골 정취와 편안함을 느낄 수 있다. 여름철 시작부터 8월 말까지 운영되는 수영장에는 어린이용 미끄럼틀이 마련돼 있어 아이들과 함께 놀기 좋다. 주변 풍경을 감상하기 좋은 루프탑에서 여유를 즐길 수 있다.  자연카라반 캠핑장은 사계절 모두 이용이 가능하다. 캠핑장 주변에는 덕절산 자연생태공원, 청도천 등이 있어 연계 관광하기 좋다.","<a href=""http://www.jayeoncaravan.com/"" target=""_blank"" title=""새창 : 자연카라반 캠핑장사이트로 이동"">http://www.jayeoncaravan.com/</a>"
자연캠핑장,2734247,레포츠,육상 레포츠,"야영장,오토캠핑장",http://tong.visitkorea.or.kr/cms/resource/01/2734101_image2_1.JPG,강원특별자치도,128.6691815115,37.1126907419,"강원도 영월 김삿갓면에 위치한 캠핑장으로 펜션과 캠핑장을 함께 운영하고 있다. 탁 트인 강변의 풍경과 시원한 밤하늘이 어우러진 캠핑장으로 캠핑존은 그린존, 레드존, 더블존, 블루존으로 구분되는 캠핑 사이트와 별도 흡연구역으로 나눠져 있다. 어린이 놀이터, 수영장, 트램펄린 등 어린이를 위한 놀이시설이 갖춰져 있다.","<a href=""https://cafe.naver.com/naturepension76"" target=""_blank"" title=""새창 : 자연캠핑장 사이트로 이동"">https://cafe.naver.com/naturepension76</a>"
자연콩,2749032,음식,음식점,한식,http://tong.visitkorea.or.kr/cms/resource/13/2749013_image2_1.jpeg,경기도,126.9954692425,37.3777792408,"자연콩 은 경기도 의왕시 백운호수변 모락산 자락에 위치한 두부요리 전문점이다. 두부는 순수 국내산이며 문경과 상주에서 공수해 오는 콩으로 매일 아침 만든다. 전골과 청국장, 순두부, 비지찌개가 있고 모 두부와 두부 구이도 인기다. 홀과 다양한 크기의 룸이 있어 식사 모임에도 적당하다. 건물 주변으로 넓은 주차시설과 휴식 공간이 마련되어 있고 텃밭에서 기르는 각종 나물과 채소류도 맛볼 수 있다.","<a href=""http://jykong.modoo.at//"" target=""_blank"" title=""새창 : 자연콩사이트로 이동"">http://jykong.modoo.at//</a>"
자연향기펜션,697068,숙박,숙박시설,펜션,http://tong.visitkorea.or.kr/cms/resource/18/2613518_image2_1.jpg,경기도,127.3819906851,37.6341175914,"북한강 변 드라이브 코스로 유명한 양수리에 있는 자연향기펜션은 집 전체를 빌려주는 독채형 펜션이다. 여러 가족 모임, 동호회, 회사 워크숍 등의 목적으로 펜션을 많이 이용한다. 펜션이 모여있는 곳도 아니고, 자연 속에 있어 다른 사람들의 방해를 받지 않는다는 장점이 있다. 넓은 창으로 들어오는 아침햇살과 넓은 잔디 정원은 아이들이 신나게 뛰어놀기에 매우 적합하다.
주변 관광지로는 세미원, 아침고요수목원, 영화종합촬영소, 대명비발디파크, 수상레져, 용문산 등 많은 관광지가 있다. 인근 북한강에서 수상 레포츠와 환상적인 드라이브 코스를 즐길 수 있으며 분위기 좋은 양수리 카페촌이 있어 좋은 추억 또한 담아갈 수 있다.","<a href=""https://smartstore.naver.com/lesson4154"" target=""_blank"" title=""새창: 자연향기펜션 홈페이지로 이동"">https://smartstore.naver.com/lesson4154</a>"
자연환경연구공원,2714533,인문(문화/예술/역사),산업관광지,기타,,강원특별자치도,127.851872243,37.7543734234,"자연환경연구공원은 북방면에 위치한 곳으로 자연생태 환경을 보고, 느끼고, 체험하며 공부하는 공간이다. 많은 종류의 희귀한 동식물과 멸종위기에 처한 동식물, 나비와 잠자리, 자연습지 등 다양한 공간으로 채워져 있어 생명의 소중함을 직접 느껴볼 수 있는 곳이다. 환경부가 지정한 멸종위기 동식물 서식지 외 보전기관으로 멸종위기식물원, 곤충생태원, 나비관찰원, 생태관찰지 등이 있어 교육프로그램 체험 및 탐방을 할 수 있다. 공원의 사계절을 함께 느낄 수 있으며, 환경교육 프로그램으로 계절 환경학교, 전시관해설 프로그램, 관람 및 공작학교, 에코캠프, 자연아 놀자 등의 체험프로그램이 있다. 이 프로그램들은 숲 속 생물들을 관찰 및 체험할 수 있으며 자연환경의 소중한 가치 체험으로 자연환경의 중요성을 배운다.","<a href=""https://ecopark.gwd.go.kr/portal"" target=""_blank"" title=""새창: 홈페이지로 이동"">http://ecopark.gwd.go.kr</a>"
자연횟집,1814816,음식,음식점,한식,http://tong.visitkorea.or.kr/cms/resource/56/1340956_image2_1.jpg,전라남도,127.7219812987,34.7090545207,"대경도에 위치한 갯장어(하모) 전문점이다. 자연횟집에 가려면 여수 극동항에서 대경도로 가는 배를 이용하면 된다. 배로 5분을 가면 경도에 도착한다. 방문 전에 전화를 주면 배 내리는 곳에서 바로 픽업도 가능하다. 자연횟집은 갯장어 (하모), 제철 각종 회와 매운탕을 메뉴로 하고 있으며, 단체 예약이 가능하다.",
