title,contentid,cat1,cat2,cat3,firstimage,region,mapx,mapy,overview,homepage
신천일막국수,2925222,음식,음식점,한식,http://tong.visitkorea.or.kr/cms/resource/10/2925210_image2_1.jpg,강원특별자치도,127.7074222152,38.1032106797,"신천일막국수는 38년 역사를 자랑하는 화천의 막국수 맛집이다. 이 집의 막국수는 물과 비빔을 구분하지 않는 스타일로, 원하는 만큼 육수를 부어 먹으면 된다. 수육은 부추무침이 곁들여서 나오는데, 이 부추무침이 야들야들한 수육에 잘 어울린다. 빈대떡은 두툼하고 바삭 쫄깃한 식감으로 추가 주문을 부른다. 매장에서 판매하는 화천 막걸리도 기회가 된다면 맛보아야 한다. 수육이나 빈대떡에 함께 먹기 좋다. 평소에는 가게 앞과 부근에 주차하면 되는데, 화천시장의 오일장 날은 주차가 어렵다.",
신천쭈꾸미,2871952,음식,음식점,한식,http://tong.visitkorea.or.kr/cms/resource/43/2871943_image2_1.JPG,울산광역시,129.3580048668,35.6457262047,"신천쭈꾸미는 울산 북구 신천동에 위치한 쭈꾸미 맛집이다. 대표메뉴는 불향을 가득 입힌 쭈꾸미볶음과 쭈꾸미삽겹살이다. 순한맛, 보통맛, 매운맛으로 맵기 조절이 가능하며, 밥은 별도로, 일반 공기밥이나 볶음밥으로 선택하여 먹을 수 있다. 쭈꾸미볶음과 함께 곁들이면 더욱 맛있는 왕새우튀김과 계란찜, 퐁듀치즈소스 등이 있으며, 어린이를 위한 돈까스 메뉴도 준비되어 있다. 또, 배달과 포장이 가능하고, 1인세트부터 2~3인세트까지 다양하게 구성되어 있다.",
신천탕,2751941,인문(문화/예술/역사),휴양관광지,온천/욕장/스파,http://tong.visitkorea.or.kr/cms/resource/28/2751928_image2_1.jpg,충청남도,127.0012268615,36.7823231517,"온양온천은 한국에서 가장 오래된 온천이다. 역사서에 따르면 백제와 통일신라 시대를 거치면서 1300년 역사를 간직하고 있다. 이러한 온양에 자리 잡은 신천탕은 1960년에 처음 문을 열었다. 신천탕의 온천수는 온도 44~60℃에 pH 9.0의 알칼리성 단순천이다. 원탕인 신천탕의 온천수는 중탄산나트륨을 포함한 약알칼리수 및  실리카 온천으로 근육 이완, 혈액순환 개선 등 다양한 효능이 있다.",
신촌 4.3 성터,2872927,인문(문화/예술/역사),역사관광지,유적지/사적지,http://tong.visitkorea.or.kr/cms/resource/79/3389779_image2_1.jpg,제주특별자치도,126.6131117136,33.5377303544,"신촌리는 신촌회담을 통해 제주 4.3 항쟁을 결의한 곳으로 항일운동을 가장 활발하게 펼치고 조천 만세운동을 일으킨 조천읍 작은 바닷가 마을이다. 신촌리의 4.3 성터는 제주도 4.3 사건 당시에 사람들을 감시하기 위한 목적으로 돌을 직접 쌓아 만든 성터로, 우리 역사의 단면을 보여주는 곳이다. 닭머르해안 인근에 위치하고 있어, 관광객들이 해안길 방문을 위해 자주 찾는 곳이다. 이곳은 닭머르해안길은 해안누리길 50코스에 포함되어 있다. 역사를 알아보고 중간중간 휴식을 취할 수 있는 의자에서 잠깐 쉬어가며 풍경을 감상하고 산책을 즐길 수 있다.",
신촌 시스터즈 [한국관광 품질인증/Korea Quality],2708666,숙박,숙박시설,게스트하우스,http://tong.visitkorea.or.kr/cms/resource/92/2708492_image2_1.jpg,서울특별시,126.9356725027,37.5539549409,"신촌 시스터즈는 서울 마포구에 위치한 젊은 여행객을 위한 게스트하우스다. 객실은 2인실부터 4인실까지 다양하고, 객실마다 욕실이 딸려 있다. 별도 식당 공간은 없지만 객실 내 음식 반입이 가능하고 전자레인지가 비치되어 있다. 세탁기와 건조기는 유료로 이용할 수 있다. 도보 5분 거리에 신촌역과 서강대역이 있고, 인근에 공항리무진버스와 일반버스 정류장이 있어 교통이 편리하다. 홍대, 합정, 망원, 상수 등과도 가깝다.",
신촌 플레이버스,2018226,인문(문화/예술/역사),체험관광지,이색체험,,서울특별시,126.9364417897,37.5570295975,"신촌 플레이버스는 신촌 연세로 스타광장 내에 위치한 이색체험 버스이다. 2층 버스로 이루어졌으며 버스에서 신촌 문화 체험과 음악감상 및 다양한 체험을 할 수 있다. 플레이 버스에서 직접 방송과 공연을 할 수 있고, 영상편지를 띄어 볼 수도 있다. 공연장, 디제이박스, 관광안내, 음악감상실을 갖춘 이색체험 버스이다.",
신촌그래피티벽화터널,3082166,인문(문화/예술/역사),체험관광지,이색체험,http://tong.visitkorea.or.kr/cms/resource/60/3082160_image2_1.JPG,서울특별시,126.9424050556,37.559854376,"경의 중앙선 신촌역  1번 출구에 있는 신촌그래피티벽화터널은 일명  신촌토끼굴로 이 토끼굴은 도로가 개통되기 전 신촌과 이대후문, 연세대를 잇는 중요한 역할을 하던 굴다리였다. 하지만 토끼굴 옆에 도로와 지하도가 개통되면서 자연스레 사람들의 왕래가 줄어들며 어둡고 환경이 좋지 않았다.
그러나 이곳이 유명드라마 촬영지(도깨비)로 알려지면서 사람들이 찾기 시작하며 변신을 시도했다. 토끼굴 내부에 LED 조명등을 설치하고 목재 계단 진입로를 설치해 쾌적하고 안전한 보행로로 바뀌었다. 여기에 더해 길이 65m, 폭 4.5m의 공간 안에 각양각색의 그래피티를 터널 내부와 외부에 가득 그렸으며, LED 조명도 켜져 화려함을 더했다.  그래피티 작업하는 시간과 그림의 주제를 지키면 이곳에는 누구나 그래피티 작업을 할 수 있으며  따라서 그림은 수시로 바뀐다.",
신촌글로벌대학문화축제,3317667,인문(문화/예술/역사),축제,일반축제,http://tong.visitkorea.or.kr/cms/resource/37/3317637_image2_1.JPG,서울특별시,126.9367889881,37.5567518583,"신촌 글로벌 대학문화축제는 청년도시 신촌의 글로벌 도시 브랜드 이미지 구축을 위하여  “글로벌”  “대학문화”  아이덴티티를 축제로 구현한 서대문구의 대표 축제이다. 젊음과 청춘의 글로벌한 만남과 글로벌 WAVE가 더해진 신촌만의 VIBE를 느낄 수 있는 각종 문화행사, 퍼레이드, 체험행사가 준비되어 있다.","<a href=""https://www.swyft.kr/"" target=""_blank"" title=""새창 : 서대문구 신촌 연세로 스타광장 홈페이지 이동"">www.swyft.kr</a>"
신촌낚시터,1867776,레포츠,수상 레포츠,민물낚시,http://tong.visitkorea.or.kr/cms/resource/59/1861959_image2_1.jpg,경기도,126.9104183996,37.2869604744,"신촌낚시터는 칠보산 기슭의 맑은 물을 이용하여 만들어진 저수지로서 주변에 자연경관이 수려하고 아늑하며, 서울에서 약 40분 거리로 교통이 편리하여 당일코스로 도시민이 휴식처 및 가족단위 휴식공간으로 찾으며 아울러 자연과 잘 어우러진 낚시터로 어린이 자연학습 장소로도 이용이 가능하다. 다양한 어종의 손맛을 느낄 수 있으며 직접 살아 숨 쉬는 입질의 현장을 느낄 수 있다.",
신촌닭불백,2854532,음식,음식점,한식,,대구광역시,128.6244356327,35.8516170455,대구 수성구에 위치한 신촌닭불백은 백숙과 닭불고기를 함께 맛볼 수 있는 이색적인 맛집이다. 누구나 단골이 되는 자타공인 맛집으로 가격도 비싸지 않아서 가성비를 찾는 손님들도 모두 만족하는 곳이다. 닭불고기는 가슴살을 곱게 다져 고추장 양념 후 석쇠에 구워낸 음식인데 예상외로 퍽퍽하거나 질기지 않고 촉촉한 식감에 모두 놀란다고 한다. 또한 매콤하고 짭조름해서 밥과 함께 싸먹으면 일품이라는 후기들이 쏟아진다.,
신촌댁,135515,음식,음식점,한식,http://tong.visitkorea.or.kr/cms/resource/69/1790769_image2_1.jpg,경기도,127.3261610759,37.1946869348,"신촌댁 설렁탕은 설렁탕, 갈비탕 등 탕 전문점이다.
15년간의 운영과 축척된 경험을 바탕으로 최고의 맛, 언제나 같은 양질의 완제품을 생산할 수 있는 신기술, 압력탱크 추출방식 자동화 설비를 갖추어 대량 생산 시스템을 구축하였다.",
신촌마을,2787488,인문(문화/예술/역사),체험관광지,농.산.어촌 체험,http://tong.visitkorea.or.kr/cms/resource/35/2790435_image2_1.jpg,경상남도,127.6677198098,35.233839072,"신촌마을은 지리산 둘레길 삼화실–대축 구간에 있는 마을로 우계천을 옆에 끼고 농로를 따라 걸어 올라오다 보면 만나게 된다. 이곳은 1700년경 사람들이 모여 살기 시작하면서 ‘새로 생긴 마을’이라는 의미로 ‘신촌마을’이라고 했다고 한다. 마을 입구에 ‘물레방아촌 신촌’이라는 돌비석이 세워져 있다. 기다란 돌 사이에 물레방아가 있고 그 옆으로 나무로 만든 쉼터 가운데에 지리산 성모상이 있어 오가는 이들이 이곳에 들러 기도를 올리기도 한다. 물레방아 뒤편 마을회관으로 올라가는 길에 있는 정자가 있어 쉬어가기에 좋다.
신촌마을에서 우계저수지를 거쳐 서당마을까지는 둘레길 중에서 산책길 수준이라고 해도 좋을 만큼 수월한 편이다.",
신촌막국수,2022920,음식,음식점,한식,,강원특별자치도,127.9760047722,37.3052110777,강원도 원주시 관설동에 위치한 신촌막국수의 대표 메뉴는 막국수와 옹심이 메밀 칼국수이다. 옹심이의 재료인 생감자는 영월군 무릉도원면 농가에서 생산된 풍농감자라는 신품종 감자를 직접 산지에서 구매해 가져와 매일 100kg씩 직접 갈아 만들어 쫄깃한 식감과 고소한 맛을 담아냈다. 식당 내부는 실내뿐만 아니라 실외에도 여러 좌석을 두고 있지만 손님이 몰리는 식사 시간에는 대기를 해야 맛볼 수 있다.,
신촌문화발전소,2581396,인문(문화/예술/역사),문화시설,공연장,http://tong.visitkorea.or.kr/cms/resource/83/2581383_image2_1.bmp,서울특별시,126.9397414634,37.557943439,"신촌문화발전소는 청년 문화예술인의 창작활동을 지원하고 함께 성장하는 문화예술 커뮤니티 공간입니다. 약 80석 규모의 소극장과 창작기획 스튜디오 등을 갖춘 복합문화공간으로 예술인들이 모여 서로 나누고 협업할 수 있는 베이스캠프가 되고자 합니다. 신촌문화발전소는 청년 예술인 스스로 가능성을 확장하고 성장할 수 있도록 기획-창작-발표의 과정을 지원하는 문화예술 플랫폼입니다. 신촌 지역의 특성을 살려 경계를 넘나드는 자유로운 상상과 창의적 실험이 다양하게 구현되는 기회를 마련하고, 경쟁과 배제보다 교류와 협력을 통해 건강하고 안전한 창작 환경을 제공할 수 있도록 노력합니다.<br>","신촌문화발전소 <a href=""https://www.scas.or.kr/"" target=""_blank"" title=""새창: 신촌문화발전소"">https://www.scas.or.kr/</a>"
신촌브루,2861366,음식,음식점,카페/전통찻집,http://tong.visitkorea.or.kr/cms/resource/54/2861354_image2_1.JPG,전라남도,127.1129322978,34.4660546743,"간판 자리에 흐릿하게 남아 있는 효정슈퍼가 옛 감성을 자극하는 카페다. 과거 슈퍼마켓을 운영했던 건물로써 예스러움을 보존하고자 슈퍼 이름을 남겨두고, 내부만 리모델링해서 탄생한 곳으로 핸드드립과 향긋한 차가 이 집의 대표 메뉴다. 로스터리 카페로서 스페셜티 생커피콩을 직접 로스팅하며 콜롬비아, 에티오피아, 과테말라, 인도네시아 각각의 핸드드립 메뉴는 원산지가 다른 원두의 특성을 메뉴판에 설명해 놓아 취향에 따라 골라 주문할 수 있다. 커피를 즐기지 않는 고객을 위한 세계 3대 명차인 로네펠트 티도 갖추고 있다. 바깥으로 펼쳐진 논밭 뷰도 고즈넉한 시골 풍경을 오롯이 느낄 수 있을 만큼 정겹다. 스콘, 파이, 쿠키 등의 디저트도 판매하고 있다.",
신촌설렁탕(만년점),2581561,음식,음식점,한식,,대전광역시,127.3800013447,36.367558021,"대전 서구에 위치한 신촌설렁탕 만년점은 대전의 33년된 설렁탕 전문점으로 뽀얗고 진한 국물의 설렁탕과 직접 담근 배추김치와 깍두기가 일품이다. 설렁탕 외에도 도가니탕, 꼬리곰탕, 모둠수육등을 팔고 있다.",
신촌수제비,2918764,음식,음식점,한식,,서울특별시,126.9363362754,37.5559186137,"1988년에 오픈한 수제비 전문점이다. 진한 사골 국물에 볶은 호박과 당근, 다진 고기를 고명으로 올려낸 사골 수제비와 밥을 원하시는 분들을 위한 김밥 두 가지 메뉴를 판매한다. 식사 시간에는 인기 있는 가게인 만큼 줄을 기다려야 하니 참고 하길 바란다.",
신촌숲(신촌유원지),2753892,인문(문화/예술/역사),휴양관광지,공원,,경상북도,128.1855486214,35.6741679994,"신촌숲은 자연적으로 형성된 유원지다. 이곳에는 주변 2㎞에 걸쳐 전망과 관찰이 가능한 데크를 비롯해 산책로, 지압로, 기타 체육 시설 등이 마련되어 있다. 특히 산책로는 자연적으로 자생하고 있는 수목을 관찰하며 걸을 수 있다. 특히 신촌숲은 주차 공간과 야영지가 넓어 캠핑하기에 안성맞춤이다. 야영지 앞에는 안림천이 흐르고 있어 여름마다 물놀이 장소로도 인기가 높다.",
신촌식당,134654,음식,음식점,한식,http://tong.visitkorea.or.kr/cms/resource/83/1981683_image2_1.jpg,경상북도,129.1208703212,36.5067436682,"신촌식당은 닭백숙 원조식당으로서 닭불고기를 개발한 모범음식점이다. 천연탄산약수로 닭을 고아 녹두, 인삼, 찹쌀 등을 넣어 닭죽을 쑤고 가슴살은 고추장 양념하여 석쇠에 구운 닭불고기는 고기가 연하고 담백하며 식당에서 직접 가꾼 청정채소로 만든 야채 샐러드와 함께 즐길 수 있다.",
신촌향사,1621045,인문(문화/예술/역사),역사관광지,유적지/사적지,http://tong.visitkorea.or.kr/cms/resource/02/1618402_image2_1.jpg,제주특별자치도,126.620683305,33.5365417182,"신촌향사는 조선시대 마을의 공무를 처리하던 곳이었다. 조선 순조 5년(1805)에 이곳으로 옮겨 지었다고 하며, 그 뒤로도 여러 차례 고쳐서 원래 형태에서 많이 바뀐 것으로 보이며, 침수에 대비하여 지대를 높이면서 본래의 분위기를 거의 잃었다. 신촌향사는 앞면이 7칸으로 제주도의 일반 민가보다 규모가 크고 가운데 있는 대청도 넓다. 그러나 구조와 양식 등은 민가와 거의 비슷하다. 우진각 지붕의 기와집이며, 전면퇴는 개방되어 있고 내진주에 세살문을 달았으나, 후면은 퇴기둥에 심벽을 치고 간마다 판장문을 달았다.","<a href=""https://www.heritage.go.kr/heri/cul/culSelectDetail.do?searchCondition=&searchCondition2=&ccbaKdcd=21&ccbaAsno=00080000&ccbaCtcd=50&ccbaCpno=2113900080000&ccbaGcode=CA&ccbaBcode=01&ccbaMcode=02&culPageNo=18&header=div&sngl=Y&returnUrl=%2Fheri%2Fcul%2FculSelectDivList.do&pageNo__=1_3_2_0&pageNo=1_1_2_0"" target=""_blank"" title=""새창 : 홈페이지로 이동"">https://www.heritage.go.kr/</a>"
신촌황소곱창,3094357,음식,음식점,한식,,서울특별시,126.9865063294,37.5691124241,"종각역 인근의 젊음의 거리에 있는 소곱창 전문점으로 60년이 넘은 노포다.  
메뉴는 황소곱창, 대창, 막창, 벌집, 양깃머리, 모든 부위가 나오는 생모듬이 있다. 주문하면 둥그런 무쇠판에 부추, 감자, 팽이버섯, 새송이버섯, 양파가 함께 나오며 종업원이 직접 구워준다. 밑반찬으로 맑고 얼큰한 콩나물국과 양배추와 상추 샐러드, 생오이, 당근, 생마늘, 생마늘쫑이 쌈장과 함께 나온다. 소스는 간장 소스와 기름장 소스가 나오며 구워진 재료를 소스에 찍어서 먹으면 된다. 간과 천엽은 서비스로 조금 나온다. 생모듬은 여러 부위가 나오는 메뉴로 다양한 맛을 즐길 수 있으며 고소한 맛이 일품이다. 곁들이는 부추와 콩나물국, 밑반찬은 느끼한 맛을 잡아준다. 부추사리는 추가로 더 주문할 수 있고 다 먹은 다음 밥을 볶아 먹을 수 있다. 밥도 종업원이 직접 볶아주는데 솥 밑에 눌은밥을 긁어먹는 재미도 있다.
본점은 신촌에 있으며 이곳은 직영점이다. 종각역 4번 출구에서 320m에 위치하며 인근에는 청계천, 탑골공원이 있고 여러 맛집이 있다.",
신탄면옥,2581586,음식,음식점,한식,,대전광역시,127.4266174334,36.4396450427,"대전 대덕구 덕암동에 위치한 신탄면옥은 냉면과 고기류를 전문으로 취급하는 음식점이다. 
물냉면은 사태와 양지를 우려낸 육수에 잘 숙성된 동치미를 배합하여 육수를 만든 평양냉면이다. 또한 돼지양념갈비는 목살과 갈비를 손질하여 각종 한약재와 과일, 야채 등 총 22가지 재료로 우려낸 양념장으로 만든다.
신탄면옥은 국도 17호선 신탄진로변에 위치해 있으며 경부고속도로 신탄진IC와 가깝다. 대중교통은 대전 시내버스 2번, 703번, 705번, 711번을 이용할 수 있다. 주변에는 KT&G 신탄진공장 벚꽃길 등이 있다.","<a href=""https://sintanmyounogsg.modoo.at"" target=""_blank"" title=""새창 : 홈페이지로 이동"">https://sintanmyounogsg.modoo.at</a>"
신탄진도서관,130805,인문(문화/예술/역사),문화시설,도서관,http://tong.visitkorea.or.kr/cms/resource/94/3033094_image2_1.JPG,대전광역시,127.4373496185,36.4465277797,"신탄진도서관은 대전 대덕구 북부에 위치한 2002년 개관한 도서관이다. 지하 1층, 지상 3층 건물로 대지면적 8,809㎡, 연건평 4,819㎡, 열람석 1,200석 규모이다. 지하에는 식당, 매점, 전산교육장이 있고 지상 층에는 전자정보실, 어린이열람실, 종합자료실 등이 있다. 별관에는 다목적홀이 마련되어 있으며 강연회와 세미나가 이루어진다. 또한 독서동아리, 작가와의 만남, 가족체험 등 다양한 문화 경험을 지역민에게 제공하고 있다.
신탄진도서관은 국도 17호선, 지방도 32호선에서 신탄진동로, 신탄진북로를 통해 접근할 수 있으며, 고속도로는 경부고속도로 신탄진IC 및 당진영덕고속도로 문의청남대IC가 가깝다. 대중교통은 경부선 철도 신탄진역을 이용할 수 있다. 주변에는 신탄진장(3, 8일), 금강로하스에코공원, 대청댐 등이 있다.","대덕구평생학습도서관 <a href=""https://lib.daedeok.go.kr/sintanlib/index.do"" target=""_blank"" title=""새창 : 대덕구평생학습도서관 홈페이지로 이동"">https://lib.daedeok.go.kr/sintanlib/index.do</a>"
"신탄진장 (3, 8일)",1128720,쇼핑,쇼핑,5일장,http://tong.visitkorea.or.kr/cms/resource/04/3032904_image2_1.JPG,대전광역시,127.4267838059,36.4498966492,"신탄진장은 대전 대덕구 북부에 위치한 신탄진역 서쪽에 자리한 전통 5일장으로, 조선 후기의 기록에 처음 등장하여 약 300년 역사를 자랑한다. 1905년에는 경부선 철도 신탄진역이 생기며 급격히 발전했다. 신탄진역에서 철도 밑의 굴다리 혹은 육교를 통해 지나면서부터 본격적인 장터 모습이 나타난다.
시장에는 1000여 명의 노점 상인들과 손님들로 성황을 이룬다. 뻥튀기나 엿장수와 같은 전통시장의 명물은 물론 의류, 야채, 생선 등 각종 생필품들이 도로를 끼고 늘어선 모습은 세월을 지나도 변치 않고 있다. 시장이 시작되는 굴다리 밑에는 주로 시골에서 나온 할머니들이 좌판 가득 채소를 판매하고 있다. 대중교통은 경부선 철도 신탄진역을 이용할 수 있으며, 인근에는 금강로하스산호빛공원, 금강로하스에코공원 등의 관광지가 있다.","▪ <a href=""http://www.daejeon.go.kr/tou/index.do"" target=""_blank"" title=""새창: 대전 문화관광 홈페이지로 이동"">http://www.daejeon.go.kr</a>"
신태루,2761467,음식,음식점,중식,,충청남도,126.2995188725,36.7522283221,"충남 태안군 태안읍에 있는 신태루는 생활의 달인에서 육짬뽕의 달인으로 출연한 정창교 달인이 운영하는 중식당이다. 이곳의 육짬뽕은 돼지고기와 해산물의 조합이 잘 어우러져 있어 깊은 맛이 특징이다. 신선한 바지락과 말린 망둥이로 진한 육수를 내고 콩으로 숙성시킨 돼지고기를 고명으로 올려 육짬뽕의 텁텁함을 잡았다. 얼큰하고 칼칼한 진한 국물이 수타면과 잘 어우러진다. 달콤하면서도 고소하고 소스를 부어 먹어도 눅눅해지지 않는 탕수육도 인기 메뉴다. 주변에 만리포해수욕장, 신두리해수욕장, 천리포수목원, 안면도 등이 있어 여행길에 들러보면 좋다.",
신털뫼,134489,음식,음식점,한식,,경기도,126.9465798629,37.7488519049,"30년 전통의 어머니 손맛을 볼 수 있는 전통음식점으로 전복, 낙지, 송이를 곁들인 스페셜 오리백숙, 닭백숙과 장어, 오리훈제, 목삼겹, 왕새우, 더덕무침, 감자전이 코스로 나가는 모둠구이가 주메뉴이다. 대부분의 식자재는 철원에서 직접 농사지은 것으로 일 년 치의 김장 김치와 고추, 깻잎, 파프리카 잎 등 각종 절임 음식이 나오고, 제철마다 신선한 야채가 공급된다.<br>",
신토불이 떡볶이 본점,2832955,음식,음식점,한식,http://tong.visitkorea.or.kr/cms/resource/53/2832953_image2_1.jpg,서울특별시,127.090463996,37.5525995461,"신토불이떡볶이 본점은 아차산역 1번 출구 도보로 2분 거리에 있다. 항상 줄 서서 먹는 집으로 유명하다. 이곳의 대표 음식은 물론 떡볶이다. 주재료인 떡살은 두툼하고 쫄깃해 식감이 좋고 양은 푸짐하다. 이곳 떡볶이는 처음엔 달콤하다가 매콤해지면서 중독성을 띠는 맛이다. 원래도 유명했지만, 한 방송에서 여배우가 좋아하는 떡볶이집이라는 것이 알려지면서 더욱 유명해졌다. 서울어린이 대공원이나 아차산 생태공원에서 가족끼리 즐거운 시간을 보낸 후 들러서 즐기기 좋다. 주차시설은 따로 없지만, 지하철역에서 가까워 대중교통 접근성이 좋다.",
신토불이 장안직영점,2842844,음식,음식점,한식,http://tong.visitkorea.or.kr/cms/resource/35/2842835_image2_1.jpg,서울특별시,127.0757923339,37.5798461158,"신토불이 장안직영점은 7호선 사가정역 은석초등학교 인근에 있다. 매장이 있는 건물에 주차장이 있고, 발레 파킹 서비스도 받을 수 있다. 매장 한 가운데 커다란 나무 한 그루가 서있을 정도로 넓은 규모다. 각종 단체 행사나 가족모임에서 적합하다. 대표 메뉴로는 오리 코스요리와 오리누룽지 백숙(1시 전 예약 필수)이 있다. 기타 식사 메뉴로 가성비 좋은 점심 정식이 있다. 음식 주문은 2인 이상 가능하다. 밑반찬으로 나오는 들깨수제비가 인기가 좋다. 추가로 오리 한 마리, 닭 한 마리는 포장 판매도 가능하다. 주변에 가을 단풍길(중랑천 제방길)이 있어 식사 전후에 둘러보기 좋다.",
신토불이가든,2862945,음식,음식점,한식,http://tong.visitkorea.or.kr/cms/resource/41/2862941_image2_1.jpg,경기도,127.4107657277,37.0540019292,"신토불이가든은 경기도 안성시 죽산면 장계리에 있는 한식당으로 대표 메뉴는 쌈밥 정식이다. 삼겹살과 다양한 쌈 채소가 함께 나오고 계란말이, 생선구이, 매실장아찌 등의 밑반찬도 푸짐하게 나온다. 이 외에도 생삼겹살, 한방 오리 양념구이, 한방 오리탕, 한방 닭백숙, 한방 닭볶음탕, 삼계탕 등의 메뉴를 판매하고 있다. 매장 내부는 넓고 쾌적하며 매장 앞에 주차 공간이 있어 편하게 이용할 수 있다.",
신토불이된장배추국,2751820,음식,음식점,한식,http://tong.visitkorea.or.kr/cms/resource/08/2751808_image2_1.jpg,경기도,127.2974042606,37.2330819773,"이른 새벽부터 영업을 시작해 새벽이나 아침 라운딩을 즐기는 골퍼들에게 '배추국 전문점'으로 인기다.  된장배추국은 주문하면 5분이 채 안돼서 제공된다. 기본 반찬으로 김치, 콩나물무침, 시래기무침, 두부조림, 고등어조림, 김 등이 테이블에 세팅된다. 개인 별로 계란 프라이가 제공된다. 주 메뉴는 배추가 많이 들어간 된장 배추국과 공깃밥이다.",
