title,contentid,cat1,cat2,cat3,firstimage,region,mapx,mapy,overview,homepage
장승백이 전통시장 (구. 창대시장),1025117,쇼핑,쇼핑,상설시장,http://tong.visitkorea.or.kr/cms/resource/79/1924179_image2_1.jpg,인천광역시,126.7352187892,37.4464166442,"장승백이 전통시장은 젓갈류 집산지로 유명한 소래포구와 인접해 있어 공기가 좋기로 유명하다. 이 환경 좋은 마을의 초입에 위치한 창대 시장은 만수 3 지구 내의 유일한 재래시장이다. 현대화 시설을 갖춘 시장이라 쾌적하고 깔끔한 인상을 준다. 식재료뿐만 아니라 의류와 신발, 장난감 등 갖가지 생활 잡화들을 구입할 수 있다. 인천 지하철 2호선 남동구청역과 가깝고 시장 입구에 버스 정류장이 있어 접근성 또한 좋다.","<a href=""https://itour.incheon.go.kr"" target=""_blank"" title=""새창: 인천투어 홈페이지로 이동"">https://itour.incheon.go.kr</a>"
장승포 신년해맞이 행사,909135,인문(문화/예술/역사),축제,일반축제,http://tong.visitkorea.or.kr/cms/resource/70/749770_image2_1.jpg,경상남도,128.7328974765,34.8642022805,"거제의 동쪽끝, 해가 가장 빨리 떠오르는 장승포에서 펼쳐지는 “장승포 신년해맞이 행사”는 드넓은 남해 바다에 떠오르는 새해를 보며 한해의 무사안녕을 기원하고 서로의 소망을 비는 거제시 공식행사로 매년 1월1일 장승포동 주최 장승포 신년해맞이 추진위원회 주관으로 개최된다. 장승포에서는 12월31일 송년불꽃행사와 1월1일 해맞이 행사가 연이어 개최됨에 따라 거제시민뿐 아니라 전국적으로 많은 관광객들이 찾아오고 있다.","거제 문화관광 <a href=""https://tour.geoje.go.kr/user/smarttour/view.geoje?basicSid=133&festivalStyle=A01&menuCd=DOM_000008504001000000&cpath="" target=""_blank"" title=""새창:거제문화관광 홈페이지로 이동"" >https://tour.geoje.go.kr</a>"
장승포 해안일주도로,2774844,자연,자연관광지,자연생태관광지,http://tong.visitkorea.or.kr/cms/resource/98/3373698_image2_1.JPG,경상남도,128.7319364852,34.8628440817,"장승포동에서 능포동으로 이어지는 해안일주도로는 양지암 바위를 비롯해 해안절경이 정말 아름다운 곳이다. 해안선을 따라 조성된 2.5㎞의 일주 도로는 가볍게 드라이브하기에도 좋고, 쉬엄쉬엄 산책하기에도 좋은 곳이다. 도로를 따라 아래쪽에는 울창한 송림이, 위쪽으로는 야트막한 언덕이 조성되어 있어 아무 생각 없이 걷기 좋다. 화려하지 않아도 소박한 여유가 느껴지고, 세련되지 않아도 은은한 멋스러움이 있는 장승포 해안을 따라 걷다 보면, 어느새 복잡했던 머릿속이 환해짐을 알 수 있다. 특히, 일주 도로에서 바라보는 아득하게 펼쳐진 수평선과 바다 위를 유유히 떠다니는 고기잡이 배들의 모습은 마치 한 폭의 동양화를 펼쳐 놓은 듯하다.
매년 1월 1일 새해가 되면 전국 각지의 많은 사람들이 이곳으로 모여든다. 거제에서 떠오르는 첫 해를 보기 위해 찾아오는 곳인 장승포 몽돌개는 거제시에서 개최하는 신년 해맞이 축제가 열리는 곳으로 푸른빛 넘실대는 바다를 끼고 있는 장승포 바다의 향기와 함께 떠오르는 해의 기운을 담뿍 느낄 수 있는 곳이다. 또한, 이 해안도로에는 양지암공원이 조성되어 있어, 시민의 휴식처 및 조깅 등 운동과 드라이브를 즐기려는 이들로 늦은 밤까지 많은 시민들이 찾고 있는 곳이다.","<a href=""https://tour.geoje.go.kr/index.geoje?menuCd=DOM_000008502008001004"" target=""_blank"" title=""새창 : 거제시 문화관광으로 이동"">https://tour.geoje.go.kr/</a>"
장승포수변공원,3011181,인문(문화/예술/역사),휴양관광지,공원,http://tong.visitkorea.or.kr/cms/resource/65/3007765_image2_1.JPG,경상남도,128.7259341181,34.8670018423,"장승포항은 1930년 방파제를 쌓아 어항과 무역항으로 발전하기 시작하였다고 하며, 1965년 6월25일 개항장으로 지정되었다고 한다. 장승포수변공원에는 수변공원 가장자리 도로가에 장승포차라는 포차거리가 조성되어 있으며, 예쁜 그림들이 그려져 있는 컨테이너 포차가 영업하고 있어(영업시간 11월~2월 : 17:00~24:00, 3월~10월 : 18:00~24:00) 야간에 방문하면 해변에 앉아 맛있는 포차 먹거리를 즐길 수 있다.
장승포수변공원에는 버스킹공연도 자주 개최하고 있으며, 다양한 경관 조명과 조각상, 벤치들이 조성되어 있어 시원한 바닷 바람을 맞으며 아름다운 야경을 즐길 수 있다. 2023년 거제 맥주축제(2023.8.16~8.19)가 수변공원에서 개최되어 성황리에 종료되기도 하였으며, 거제 장승포 불꽃축제도 개최하고 있다. 수변공원 끝자락에 있는 거제문화예술회관 야간 경관 조명도 아름다움을 더해준다.",
장승포항,793469,자연,자연관광지,항구/포구,,경상남도,128.72465647,34.8663157844,"장승포항은 거제에서 최동단에 위치한 지역으로 맑은 날에는 일본의 대마도가 육안으로 식별이 가능하며, 해안은 리아스식 해안으로 자연경관이 아름다우며, 오랜 세월 동안 파도에 깎이고 다음어진 대형몽돌(바위)이 자연 그대로 보존되어 있는 곳이다.
해안선을 따라 2.5km의 일주도로가 조성되어 있고, 도로를 따라 아래쪽으로는 소나무가 울창하고 반대편으로 낮은 언덕으로 걸어서 오르기에도 어렵지 않은 곳이며, 해금강, 외도, 지심도로 갈 수 있는 유람선이 운영 중이다.
장승포항에는 흥남철수작전을 주제로 기적의 길과 송구영신 소망길이 조성되어 있는데, 이 두 길은 6.25전쟁 중 흥남철수작전의 배경과 과정 그리고 피난민들이 거제에서 정착하고 살아가는 이야기를 조형물과 벽화 등으로 표현한 곳이다. 길을 따라 걸으면 저절로 스토리텔링 가능하도록 조성되어 있으며, 특히 송구영신 소망길은 조형물과 조명이 어우러져 장승포항 야경과 함께 야간관광도 가능하다.   
장승포항에서는 해마다 장승포항 송년불꽃축제를 개최하는데, 민속놀이와 이색체험행사 및 각종 축하공연과 더불어 다양한 볼거리를 제공한다.","<a href=""https://tour.geoje.go.kr/user/smarttour/view.geoje?basicSid=45&tourFoodStyle=A03&menuCd=DOM_000008503003000000&pageIndex=2&searchType=BASIC_TITLE&basicSection2=&searchKeyword="" target=""_blank"" title=""새창 : 홈페이지로 이동"">https://tour.geoje.go.kr</a>"
장승포항 벽화골목(장승포 기적의 길),2719883,인문(문화/예술/역사),체험관광지,이색거리,,경상남도,128.7273061881,34.8682628376,"1950년 12월 흥남철수 작전으로 거제도 장승포에 도착한 피란민은 14,005명이다. 이들은 정든 고향과 친지, 재산을 다 버리고 자유와 평화를 찾아 배에 올랐다. 거제시민은 이들에게 따스한 온정과 보금자리를 베풀었고 낯선 타지에서 피란민들은 다시 용기와 희망을 품을 수 있었다. 수심이 깊고 넓은 들판인 거제도에서 기적과도 같이 찾아온 이들 생명의 불꽃, 삶의 의지는 오늘날까지 감동적인 인류애와 동포애의 감동으로 남았다. 1구간 기적의 배에 오르다, 2구간 기적의 항해·기적의 탄생, 3구간 기적의 터전, 4구간 따뜻한 겨울·희망의 꽃으로 나눠져 있고 14곳의 스토링텔링을 만나 볼 수 있다.","<a href=""https://tour.geoje.go.kr/index.geoje"" target=""_blank"" title=""새창 : 거제 문화관광 홈페이지로 이동"">https://tour.geoje.go.kr/index.geoje</a>"
장승포황금어장굴구이,2578238,음식,음식점,한식,,경상남도,128.7283338907,34.8677018076,(정보제공자: 거제시청),
장신유원지,125739,인문(문화/예술/역사),휴양관광지,공원,,강원특별자치도,128.3782457171,38.3309579924,"장신유원지는 진부령 정상에서 내려오는 오염되지 않은 깨끗한 물과 주위의 산, 계곡, 하천이 어우러진 자연 발생 유원지이며, 가족단위 관광객이 많이 찾는 곳이다. 진부령에 여러 계곡이 있지만 유원지로 개방된 구간은 이곳뿐이다. 여름철 동해와 함께 진부령계곡의 맑은 물을 함께 찾는 피서객이 계속 늘어나자 고성군에서는 1990년 계곡 주변을 비지정 관광지로 지정하고 야영장과 주차장, 화장실 등을 갖추어 마을에서 자체적으로 운영, 관리하도록 위탁했다.
장신유원지는 계곡을 중심으로 일반 관광객이 이용할 수 있는 게스트하우스, 캠핑장, 주민이 운영하는 펜션 등이 있고 20인 이상 단체 예약 시 이용 가능한 농촌체험과 향토식당 등을 운영한다. 그중 캠핑장은 당일 이용 가능한 일반노지캠핑구역, 벚나무군락지에 오토캠핑이 가능한 A구역, 소나무군락지와 계곡 옆에 위치한 일반캠핑 B구역으로 구성되어 있다.","<a href=""https://cafe.naver.com/sottong0
""target=""_blank"" title=""새창: 소똥령마을"">https://cafe.naver.com/sottong0</a>"
장씨해녀집,2785970,음식,음식점,한식,http://tong.visitkorea.or.kr/cms/resource/58/2800458_image2_1.JPG,부산광역시,129.2274254402,35.2180495516,"부산 기장 연화리에 있는 장씨해녀집은 해물 포장마차촌 근처에 자리하고 있다. 장씨 해녀집은 바다 뷰가 멋진 곳으로도 알려져 있지만, 해녀인 사장님이 당일 잡은 신선한 해산물을 맛볼 수 있다는 이유로 사람들의 발길이 끊이지 않는 곳이다. 대표 메뉴는 해물모듬과 장씨전복죽이며 해물모듬에는 해삼, 개불, 전복, 멍게, 소라, 낙지, 새우 등 다양하고 신선한 해산물이 나오고 계절에 따라 종류가 다를 수 있다. 또한 가마솥째 나오는 전복죽도 일품이다. 주말과 성수기에는 주차 공간이 많지 않아 근처 공영주차장을 이용하면 편리하다.
*전복죽은 기본 2인부터 주문 가능",
장안 악세사리상가,1013388,쇼핑,쇼핑,전문매장/상가,http://tong.visitkorea.or.kr/cms/resource/43/1015043_image2_1.jpg,서울특별시,126.9767436373,37.5582885065,장안 액세서리 상가는 오랜 전통을 바탕으로 각종 아이디어 상품과 개성이 강한 제품들로 구성되어 있다. 매장들마다 꾸준히 개성 있는 제품들을 개발하여 타 상점과는 차별된 제품을 판매한다. 또한 전문상가로써 시중 소매액세서리점보다 싸게 구입할 수 있고 다양한 제품을 구입할 수 있다.,
장안 창작마당,3062188,인문(문화/예술/역사),체험관광지,이색체험,http://tong.visitkorea.or.kr/cms/resource/77/3062177_image2_1.jpg,전라남도,127.4803712332,34.954661688,"장안 창작마당은 장안식당이라는 정육 식당을 도시재생 사업의 목적으로 새로운 공간으로 탈바꿈한, 순천 원도심을 대표하는 복합문화 예술공간으로 누구나 문화, 예술을 체험하고 즐길 수 있는 지역 커뮤니티의 장소이다. 이곳의 마당 한쪽 벽에는 장안 창작마당의 변화 과정을 기록한 사진 자료와 작품이 전시되고 있다.
장안 창작마당에서는 수업이나 회의를 할 수 있는 다목적실이 있다. 이곳을 사용하기 위해서는 순천 e민주정원에서 대관 신청해야 하며 단순 친목 모임, 정치적, 종교적 성격을 갖는 대관은 승인되지 않는다. 또한 [이웃 나라 식탁] 프로그램을 통해 이웃 나라의 요리와 문화를 공유하는 공간을 제공하는 등 다양한 문화 교류가 이루어지고 있다.
[예:술래잡기] 전국 공모를 통해 선정된 시각 예술 등 다양한 분야의 작가들은 이곳 2층에, 거주 공간에서 6개월간 입주해 작품 활동하게 된다. 마당에는 지역민들과 함께 가꾸는 텃밭이 있으면 이곳에서 재배된 채소를 수확하는 행사도 열린다.","<a href=""https://blog.naver.com/scartvillage	"" target=""_blank"" title=""새창 : 홈페이지로 이동"">https://blog.naver.com/scartvillage</a>"
장안공원,2741599,인문(문화/예술/역사),휴양관광지,공원,,경기도,127.0114758717,37.2875566501,"유네스코 세계문화유산에 등재된 수원 화성을 품고 오랜 세월의 고고한 자태를 뽐내고 있는 도심 속 공원이다, 1978년에 조성됐으며 장안문에서 화서문까지 성벽을 따라 이어져 있으며 조경이 잘되어 있어 고목과 함께 다양한 꽃들을 감상할 수 있다. 수원 화성 관광열차인 ‘어차’가 다니는 길이 있고 성벽을 따라 걸을 수 있는 산책로도 있다. 보물 서북공심돈과 보물 화서문, 화성어차, 금속 솟대작품, 산책로, 화성 복원기념비, 화성 기적비, 경기도 관광안내소와 1999년 도내 아름다운 화장실 대회에서 특별상을 수상한 공중화장실도 볼 수 있다.",
장안근린공원,2763675,인문(문화/예술/역사),휴양관광지,공원,,서울특별시,127.0719344152,37.5776490794,"서울 동대문구 장안동 동국사대부고 인근에 있는 주민 생활 밀착형 근린공원으로, 배봉산과 중랑천 제2 체육공원 사이, 아파트로 둘러싸인 주택가에 조성되었다. 어린이 놀이시설과 운동기구, 바닥분수, 야외공연장, 정자, 벤치가 설치되어 있으며, 부속 시설로 농구장, 배드민턴장, 인조 잔디 게이트볼장이 있다. 공원 한편에는 구립 동대문청소년독서실도 있다. 공원에서 중랑천으로 이어지는 뚝방길은 크고 굵직한 조경수가 있어 산책하기 좋다.",
장안남산체육공원,2747211,인문(문화/예술/역사),휴양관광지,공원,http://tong.visitkorea.or.kr/cms/resource/11/2776311_image2_1.jpg,경기도,126.8347365967,37.0781444152,"서울이 아닌 경기도 화성시 장안면 남산과 연결돼 있는 지역 주민을 위한 체육공원이다. 체육 시설과 문화시설이 부족했던 장안면에 새롭게 조성되면서 시민들의 여가활동에 많은 도움이 되고 있다. 시설 좋은 축구장과 족구장, 농구장, 테니스장을 갖췄고 젊은이들을 위한 X 게임장과 어르신들을 위한 게이트볼장도 있다. X 게임장은 스케이트보드나 인라인스케이트를 타면서 기술이나 묘기 연습을 할 수 있는 곳으로 도심 공원에서도 쉽게 볼 수 없는 장소라 인기가 많다. 산책코스는 남산과 연결되어 건강과 휴식을 위한 공간으로 활용되고 있다. 개인이나 동호회 모임, 기업 체육대회 등도 신청을 통해 이용이 가능하다.","<a href=""https://yeyak.hscity.go.kr/index.do"" target=""_blank"" title=""새창 : 화성시 예약시스템 홈페이지로 이동"">https://yeyak.hscity.go.kr/</a>"
장안농원,3081946,음식,음식점,한식,http://tong.visitkorea.or.kr/cms/resource/41/3081941_image2_1.JPG,경기도,127.0148798964,37.3312127638,"장안농원은 수원의 광교산 산행 후 찾을 수 있는 맛집 중 하나이다. 장안농원에는 족구장이 있어 단체 손님과 가족 단위 손님에게 특히 인기 있으며, 바베큐 삼겹살과 보리밥, 된장찌개, 오리백숙이 대표 메뉴이다. 밭에서 갓 따온 채소들을 곁들여 식사를 할 수 있고, 도심 가까운 곳에서 여행을 나온 듯 한 풍경을 만날 수 있어 온 가족 힐링을 할 수 있는 음식점이다.
특히 벚꽃이 만개한 봄, 광교 저수지를 한 바퀴 걸은 후 저수지 입구 광교산 등산로를 따라 오르면 만날 수 있는 장안농원은 봄 향기 가득 품은 음식점이며, 오리백숙 국물에 끓여 먹는 죽은 꽁꽁 언 겨울의 별미이다.",
장안동 먹깨비 간장게장 해물아구찜,2842680,음식,음식점,한식,http://tong.visitkorea.or.kr/cms/resource/78/2842678_image2_1.jpg,서울특별시,127.0698681866,37.5688583965,"장안동 먹깨비 간장게장 해물아귀찜은 지하철 5호선 장한평역 3번 출구 장안동사거리 방향 장평중학교 부근에 있다. 식당이 있는 상가건물 안에 주차장이 있어 자동차로 이용하기 편리하고 발레파킹 서비스도 받을 수 있다. 이곳은 30년 이상 영업을 해와서 방송국의 맛집 프로그램에 여러 차례 소개되었다. 매장 안은 넓고 테이블 사이사이 공간도 널찍해 각종 단체 행사나 가족 모임에도 적합하다. 대표 메뉴로는 간장게장, 양념게장, 꽃게탕, 아귀탕, 섞어 찜이 있다. 추가로 갈치조림, 연포탕, 전복찜도 많이 찾는다. 사이드 메뉴인 산낙지와 새우구이도 인기다. 배달도 가능하다. 식당 주변에 샛별어린이공원, 한내어린이공원, 늘봄어린이공원 있어 식사 전후 둘러보기 좋다.","<a href=""https://smartstore.naver.com/meokkkae_b""target=""_blank"" title=""새창 : 먹깨비간장게장해물아구찜 사이트로 이동"">https://smartstore.naver.com/meokkkae_b</a>"
장안면옥 직영점,2873133,음식,음식점,한식,http://tong.visitkorea.or.kr/cms/resource/28/2873128_image2_1.jpg,경기도,127.0833958732,37.1334813184,"오산시 남부대로에 있는 냉면집이다. 숯불고기와 소고기 국밥집으로도 유명하다. 내부로 들어서면 매장이 넓고 테이블이 많다. 이 식당에는 함흥냉면과 평양냉면이 있는데 차이점은 면의 차이다. 평양은 메밀면, 함흥은 전분으로 된 면으로 만들어진다. 육수 및 양념은 동일하다. 주문은 키오스크로 한다. 냉면과 함께 먹으면 환상궁합 음식으로 숯불고기, 수육 무침, 코다리 무침, 왕만두가 있다. 좌석마다 앞접시, 식초와 겨자가 준비되어 있다. 일반 냉면집과는 다르게 냉면을 주문하면 오이고추와 썰어놓은 파가 바구니로 나온다. 냉면에 마음껏 넣어서 먹을 수 있다. 육수와 쌈무는 리필이 가능하다.",
장안문,2642931,음식,음식점,한식,http://tong.visitkorea.or.kr/cms/resource/13/2655213_image2_1.jpg,서울특별시,126.9813651797,37.5674097516,서울특별시 을지로입구역 부근에 위치한 바비큐 전문점이다. 대표메뉴는 차돌박이이다. 한국식BBQ전문점이다.,
장안문(長安門),264390,인문(문화/예술/역사),역사관광지,문,,경기도,127.0142422513,37.2888704361,"유네스코 세계문화유산인 수원화성의 사대문 중 장안문은 화성의 북문이자 정문이다. 장안이라는 말은 수도라는 뜻으로 또 다른 서울이라는 의미를 담고 있다. 장안문이 정문이라는 것은 왕이 수도인 한양에서 수원으로 들어오는 문으로 쓰였기 때문이다.
1794년 공사를 시작하여 약 6개월에 걸쳐 완성했으나 현재 있는 누각은 한국전쟁 때 폭격으로 소실되었던 것을 1978년 복원한 것으로 지금도 성벽 곳곳에 한국전쟁 당시의 흔적이 남아 있다. 조선 후기 축성 기술의 결정체인 화성 장안문은 조선시대의 성문이자. 성의 정문이라는 점에서 조선 초기에 세워진 한양 도성의 정문 숭례문과 비교 할 수 있는데 서울의 숭례문과 외관은 매우 유사하나 크기가 큰 것이 특징이며 숭례문에 비해 좀 더 새로운 것은 옹성, 적대와 같은 군사시설인 방어 시설을 갖춘 것이 특색이다.","<a href=""http://www.suwon.go.kr/web/visitsuwon/index.do"" target=""_blank"" title=""새창: 수원 문화관광 홈페이지로 이동"">http://www.suwon.go.kr/web/visitsuwon</a><br /><a href=""http://www.swcf.or.kr"" target=""_blank"" title=""새창: 수원문화재단 홈페이지로 이동"">http://www.swcf.or.kr</a>"
장안문거북시장,2752967,쇼핑,쇼핑,상설시장,http://tong.visitkorea.or.kr/cms/resource/08/2752908_image2_1.jpg,경기도,127.0139810421,37.2932004857,"거북시장은 수원 화성의 정문인 장안문 북쪽에 위치해 있다. 수원 화성과 더불어 200년의 역사와 전통을 지닌 시장으로 과거 토지 소유자가  ‘거북이’라는 별명으로 불리면서 농산물을 사고팔기 위한 사람들은 ‘거북이네’로 간다고 하면서 지금의 장안문 거북시장이 되었다. 거북시장 상점들은 통일감 있는 깨끗한 벽돌로 마감되어 아름다운 경관을 자랑하고 있다. 또 한쪽에는 영화 옛길이라고 하여 옛 영화역을 기억하는 거리도 조성했다. 유명한 만둣집, 곱창집, 돼지 고깃집 등 다양한 맛집이 즐비하고 철마다 2월 척사대회 3월 장승제 4월 연등제 5월 9월 새숱막 축제와 음식축제 여름 물놀이 축제 등 다양한 축제와 볼거리로 시장 활성화에 노력하고 있다. 최근엔 스마트 시범 상가로 선정되었다.","<a href=""http://www.gobuk.co.kr//"" target=""_blank"" title=""새창 : 장안문거북시장 사이트로 이동"">http://www.gobuk.co.kr//</a>"
장안문거북시장 새숱막축제,3304671,인문(문화/예술/역사),축제,일반축제,http://tong.visitkorea.or.kr/cms/resource/69/3304669_image2_1.jpg,경기도,127.0147310141,37.2917812189,장안문거북시장 새숱막축제는 새로운 술막거리 라는 뜻으로 술을 빚어 나눠마시는 축제이다. 저렴하고 맛있는 음식과 장안문 거북시장의 막걸리를 즐길 수 있다.,
장안문거북시장 야장 별주부전,3332731,인문(문화/예술/역사),공연/행사,기타행사,http://tong.visitkorea.or.kr/cms/resource/30/3332730_image2_1.jpg,경기도,127.013083956,37.2912506955,장안문거북시장에서 개최하는 야장 별주부전! 장안문거북시장의 자랑 막걸리와 함께 하시길 바란다. 2024년 6월부터 9월까지 매월 마지막주 금요일에 개최된다.,"<a href=""https://www.instagram.com/gobuk_official/"" target=""_blank"" title=""새창 : 장안문거북시장 야장 별주부전 홈페이지로 이동"">https://www.instagram.com/gobuk_official/</a>"
장안사(부산),126831,인문(문화/예술/역사),역사관광지,사찰,,부산광역시,129.2328734022,35.3745682165,"장안사는 불광산(659m) 자락에 있는 고찰이다. 원효대사가 창건하여 쌍계사라 부르다가 809년 장안사로 고쳐 불렀다. 고려 시대 때의 역사는 분명치 않으며 1592년 임진왜란으로 불탄 것을 1638년에 중건하였다고 한다. 경내에 명부전, 응진전 등 부산시 지정 유형문화재, 부산시 지정 기념물, 부산시 지정 민속자료 총 10점이 보관되어 있다. 
주변 관광지로는 수산과학관, 해동용궁사, 고리원자력발전소 전시관 등이 있다.","기장 문화관광 <a href=""https://bit.ly/32HQNU1"" target=""_blank"" title=""기장문화관광 사이트로 이동"">https://www.gijang.go.kr/tour</a><br>비짓부산 <a href="" https://www.visitbusan.net/kr/index.do?menuCd=DOM_000000201001001000&uc_seq=425&lang_cd=ko"" target=""_blank"" title=""비짓부산 사이트로 이동"">https://www.visitbusan.net</a>"
장안사(예천),479578,인문(문화/예술/역사),역사관광지,사찰,http://tong.visitkorea.or.kr/cms/resource/92/3077492_image2_1.JPG,경상북도,128.3147592129,36.5797507164,"예천군 용궁면 비룡산에 있는 장안사는 대한불교조계종 제8교구 본사인 직지사의 말사이다. 의상대사의 제자인 운명이 창건하였다고 하고, 예천군지에서는 고려 때 창건된 사찰이라고 하며 정확한 역사는 조선 중기 이후의 기록만이 전한다. 1627년(인조 5)부터 1896년까지 범종각, 향로전, 법당 및 요사채, 산령각 등을 수 중수하여 오늘의 모습을 갖추고 있다. 
현존하는 당우로는 극락전, 응향전, 승방, 마룻집이 있고, 뒤편 언덕에는 산령각이 있다. 극락전은 정면 3칸, 측면 2칸의 맞배집으로 조선 말기에 지어진 건물이며, 전각 내에는 목조 아미타삼존불과 3점의 탱화가 봉안되어 있으나 모두 최근작이다. 그러나 산령각에 봉안된 산신탱화는 1812년(순조 12)에 조성한 것으로 확실한 연대가 기록되어 있다. 또한, 마룻집에는 1727년에 쓴 중창기를 비롯하여 각종 중수기 현판이 보존되어 있을 뿐 아니라 등촉계기, 불량계중설서, 불사기문 등이 있다.","▪ <a href=""https://www.ycg.kr/open.content/tour/"" target=""_blank"" title=""새창: 예천 관광포털 홈페이지로 이동"">https://www.ycg.kr/open.content/tour/</a>"
장안사계곡,2758489,자연,자연관광지,계곡,http://tong.visitkorea.or.kr/cms/resource/46/3342846_image2_1.jpg,부산광역시,129.2328150778,35.3744348966,부산 기장군 장안사 계곡은 신라 673년 원효대사가 창건한 천년 고찰 장안사 아래 있다. 이곳은 청정지역에서만 볼 수 있다는 반딧불이가 서식하고 있어 매년 7월 말까지는 가로등을 소등한다. 장안사 주차장 인근에 계곡이 있다는 장점에 많은 관광객이 찾는다. 장안사 계곡에서는 더욱 쾌적한 환경 유지를 위하여 야영이나 취사는 금지되어 있으니 간단하게 돗자리 깔고 나무 아래서 쉬기에 좋은 곳이다. 불광산 자락의 울창한 숲에서 전해지는 맑은 공기를 만끽하며 조용히 산책도 즐길 수 있다.,
