title,contentid,cat1,cat2,cat3,firstimage,region,mapx,mapy,overview,homepage
연리지펜션,2626648,숙박,숙박시설,펜션,,경기도,126.6226951535,37.1640724124,"제부도 연리지 펜션은 자연 속의 환상적인 경치와 편안한 쉼터와 최고의 서비스로 함께한다. 연리지 펜션은 고객님들에게 아름다운 추억과 평안하고 즐거운 여행이 되어 드리도록 깨끗한 객실과 세련되고 편리한 주방, 위생적인 욕실, 편안하면서도 고급스러운 실내장식, 전망 좋은 바다를 볼 수 있는 주변 경관까지 두루 갖추고 있다. 객실에서 바다 전경을 감상하실 수 있는 테라스와 넓은 정원에서 편안하게 낭만을 만끽하자. 객실에서 바라보는 그림 같은 전경과 밤바다에 떠있는 어선의 평화로운 모습, 해안가로 이어지는 아름다운 산책로는 걷는 이에게 아름다운 추억을 선사한다.","<a href=""https://y2z.modoo.at""target=""_blank"">https://y2z.modoo.at</a>"
연모텔,3049904,숙박,숙박시설,모텔,http://tong.visitkorea.or.kr/cms/resource/51/3060051_image2_1.jpg,경상북도,128.7165210984,36.5659348037,,
연무당 옛터,128820,인문(문화/예술/역사),역사관광지,유적지/사적지,http://tong.visitkorea.or.kr/cms/resource/34/3040734_image2_1.jpg,인천광역시,126.4771562014,37.7474742614,"강화산성 서문 건너편에 있는 연무당은 고종 7년(1870년) 강화유수부의 군사들을 훈련시키기 위해 세워진 조련장이다. 그러나 이곳에서 1876년 보초와 대포를 앞세운 일본군에 의해 강압적인 강화도조약이 체결됐다. 
강화도조약은 조선이 외국과 맺은 최초의 근대 조약이었으나 일본에 일방적으로 유리한 불평등조약으로 우리나라는 부산, 인천, 원산을 일본에 개항하고 치외법권을 인정하게 되었다. 당시 치욕적인 역사의 현장을 보존하여 민족의 자주 의식을 고취하자는 의미에서 기적비를 세우고 보존하고 있다.","<a href=""http://www.ganghwa.go.kr/open_content/tour/"" target=""_blank"" title=""새창 : 강화군 문화관광 홈페이지로 이동"">http://www.ganghwa.go.kr/open_content/tour/</a>"
연무대(동장대),1064469,인문(문화/예술/역사),역사관광지,고궁,,경기도,127.0229636943,37.2884234215,"동장대는 장수가 군사 훈련을 지휘하던 곳으로 연무대라고도 불린다. 화성에는 두 곳의 장대가 있는데 수원화성이 완공된 뒤, 연무대는 평상시 군사들이 훈련하는 장소로 쓰고, 서장대는 군사 훈련 지휘소로 썼다. 동장대는 대지 전체를 3단으로 나누고 마당 한가운데에 장수가 말을 타고 오를 수 있도록 경사로를 만들었다. 본래 전면은 개방하고 나머지 삼면은 벽이나 창문을 단 형태였으며, 가장 안쪽에 온돌방 한 칸이 있었다. 건물 뒤쪽으로는 수키와로 담장을 꾸민 영롱장이 있다.
연무대는 화성의 동문인 창룡문과 북쪽 수문인 화홍문 사이의 높은 언덕에 있으며, 사방이 트여 있어 화성의 동쪽에서 성안을 살펴보기에 좋은 군사요충지로서 칼과 창, 활을 다루는 공간으로 200년이 넘은 소문난 활터이다. 또한 연무대는 사직공원의 황학정, 남산의 석호정, 전주의 천양정과 더불어 유서 깊은 곳으로 알려져 있다.","<a href=""http://www.swcf.or.kr/"" target=""_blank"" title=""새창: 수원문화재단 홈페이지로 이동"">http://www.swcf.or.kr</a>"
연미사(안동),337501,인문(문화/예술/역사),역사관광지,사찰,http://tong.visitkorea.or.kr/cms/resource/52/3047952_image2_1.JPG,경상북도,128.7057264455,36.6062355554,"연미사는 경북 안동시 이천동 오도산에 자리한 대한불교조계종 본사 고운사의 말사로 고구려 승려 보덕(普德)의 제자 중 한 명인 명덕이 바위에 불상을 새겨 모시고 연구사라고 한 것이 시초이다. 그 뒤 불상을 덮은 지붕이 제비와 비슷하여 연자루라 하였고, 승려가 거주하는 요사가 제비꼬리에 해당하고 법당이 제비부리에 해당한다고 해서 연미사라 불렀다. 연미사라는 이름은 원래 조선시대 영남지역에서 한양으로 오가는 길 여행객이 쉬어가는 숙소인 연비원, 속칭 제비원이라 불렀다는 데서 비롯됐다고도 한다.
연미사에 있는 보물인 이천동 석불의 잔잔한 미소는 안동의 상징적인 얼굴로 잘 알려져 있다. 속칭 제비원 미륵불이라고도 불리는 이 석불은 바로 연미사의 오랜 역사에서 홀로 남은 고마운 부처이자 우리 불교사에서도 몇 되지 않는 대표적인 미륵불이다. 또한, 이 석불은 대표적 민요인 성주풀이에도 나올 만큼 백성들이 오랜 세월 동안 뿌리내리려 한 민간신앙의 대상과도 닿아 있다. 연미사가 사찰로서는 매우 작은 규모이기는 하지만 미륵불이 담고 있는 미술적, 민족적 유산 가치는 뛰어나다.","<a href=""http://www.tourandong.com/public"" target=""_blank"" title=""새창 : 안동시청 홈페이지로 이동"">http://www.tourandong.com/public</a>"
연미산 자연미술공원,1170335,인문(문화/예술/역사),휴양관광지,공원,http://tong.visitkorea.or.kr/cms/resource/41/2962141_image2_1.jpg,충청남도,127.1026011129,36.4735465325,"연미산 자연미술공원은 ‘자연미술’로 특성화된 국내 유일의 친환경 생태미술공원이다. 
(사)한국자연미술가 협회-야투가 주관하는 금강 자연미술 비엔날레와 야투 자연미술 국제 레지던스 프로그램 등을 통해 조성되며 국내외 작가들의 야외 설치작품 100여 점을 만나볼 수 있다. 설치 작품들은 자연과 조화를 이루며 그 수명의 한계에 따라 지속적으로 교체되어 매번 새로운 감동으로 감상할 수 있는 특징이 있다.","<a href=""http://www.natureartbiennale.org/home/index.php"" target=""_blank"" title=""새창 : 금강자연미술비엔날레 사이트로 이동"">http://www.natureartbiennale.org/</a>"
연미정,129610,인문(문화/예술/역사),역사관광지,유적지/사적지,http://tong.visitkorea.or.kr/cms/resource/08/2849208_image2_1.jpg,인천광역시,126.5118495876,37.7708832536,"강화군 강화읍 월곶리에 위치한 연미정은 1995년 3월 1일 인천광역시 유형문화재로 지정된 정자이다. 자연경관을 보며 풍류를 즐기거나 학문을 공부하던 정자로, 최초 건립연대는 정확히 알지 못하나 임진왜란, 병자호란, 6.25 전쟁을 거치며 여러 차례 시련을 겪고 파손된 것을 현재와 같이 복원하였다. 정자는 지붕 옆면이 여덟 팔(八) 자 모양인 팔작지붕집의 겹처마로 돌기둥 위에 10개의 기둥을 얹어 건축한 민도리집이다. 한강과 임진강의 합해진 물줄기가 강화도 동북단에 이르러 서쪽과 남쪽으로 나뉘어 흐르는데, 이 모양이 마치 제비꼬리 같다고 하여 연미정이라 이름이 붙여졌다. 이곳은 강화십경의 하나로 손꼽히는 자리로서 절경을 이루고 있으며, 월곶돈대 꼭대기에 세워져 있어 파주와 김포, 황해도 개풍군(북한) 일대를 한눈에 조망할 수 있다. 연미정에서 바라보는 탁 트인 바다의 풍광과 정자 양쪽에 수백 년 된 수령의 느티나무 두 그루가 웅장한 자태로 정취를 더해주고 있다. 그동안 연미정은 군사보호 구역으로 지정되어 일반인의 출입이 엄격히 제한되어 군부대(검문소)의 허락을 받아야만 출입이 가능하였지만, 2008년 통제구역이 해제되어 현재는 신분증만 제시하면 일반인들도 출입이 가능해졌다.
※ 연미정을 어느 방면에서 방문하느냐에 따라 신분증 제시에 대한 여부가 다름.","강화군 문화관광 <a href=""https://www.ganghwa.go.kr/open_content/tour/tour/tourInfoDetail.do?tour_seq=67&tourdiv=eight"" target=""_blank"" title=""새창 : 강화군 문화관광 홈페이지로 이동"">http://www.ganghwa.go.kr</a><br />문화재청 <a href=""https://www.heritage.go.kr/heri/cul/culSelectDetail.do?pageNo=1_1_1_1&sngl=Y&ccbaCpno=2112300240000"" target=""_blank"" title=""문화재청 사이트로 이동"">http://www.cha.go.kr</a>"
연미정,2877937,음식,음식점,한식,http://tong.visitkorea.or.kr/cms/resource/27/2877927_image2_1.jpg,제주특별자치도,126.853854999,33.5246662305,"연미정은 세화리 마을회관 근처에 있다. 전복요리 전문점으로 전복돌솥밥, 전복죽, 전복회, 전복구이 등을 판매한다. 기본 찬으로 고등어구이와 호박전이 포함되며 음식마다 전복을 푸짐하게 넣은 맛집으로 알려져 있다. 전복밥의 경우, 전복 내장을 넣어 가마솥에 지은 후 내올 때 전복을 올리기 때문에 전복을 신선하게 즐길 수 있다. 주변 여행지로는 세화해수욕장, 세화민속오일장 등이 있다.",
연미향마을,2729421,레포츠,육상 레포츠,"야영장,오토캠핑장",http://tong.visitkorea.or.kr/cms/resource/25/2729425_image2_1.jpg,경기도,127.3305673169,37.1562414567,"연미향마을 오토캠핑장은 경기도 용인시 처인구 이동면 독성리에 위치하고 있는데, 농촌마을의 풍경을 느끼고 체험 할 수 있는 특화체험형 캠핑장이다. 캠핑장은 연미향자영농조합법인이 운영하는 곳으로 사이트는 운영중인데, 특히 시원한 원두막이 있어  캠핑을 이용하는 모두에게 개방되어 있다. 농촌 체험 캠핑장답게 많은 체험이벤트가 열리고 있는데, 홈페이지에서 매달 진행되는 행사를 확인 후 신청하면, 캠핑과 다양한 체험 프로그램을 즐길 수 있다. 공용시설 내부는 깨끗하고 이용에 필요한 비품들도 잘 갖춰져 있는데 전기, 샤워시설이 제공되지만 무선 인터넷은 지원하지 않는다.
관리실은 농촌체험 별도 건물에 같이 운영 중이며, 구봉산 산너울길 들머리에 위치하고 있어서 산책로, 등산로와 연계하여 캠핑장을 이용할 수 있다. 반려견 입장이 가능하다.","<a href=""https://www.yonginfarmcommunity.org/%ec%b2%b4%ed%97%98%eb%a7%88%ec%9d%84/?mod=document&uid=58"" target=""_blank"" title=""새창 : 연미향마을 사이트로 이동"">https://www.yonginfarmcommunity.org</a>"
연밀,2867885,음식,음식점,중식,http://tong.visitkorea.or.kr/cms/resource/83/2867883_image2_1.jpg,경기도,127.0174143942,37.2814046913,"연밀은 수원시 팔달구 화성행궁과 남문시장 근처에 있는 중식당으로 중국전통만두 전문점이다. 아담한 가게에 붉은색 간판으로 단장돼 있지만 내부가 작아 테이블이 많지 않다. 또한 별도의 주차장이 없어 차량 이용 시 근처 공영주차장을 이용해야 한다.
하지만 하얼빈 출신 사장님 부부가 운영하며 직접 만드는 중국식 만두는 유명하다. 단, 한국어가 서툰 사장님 내외를 배려해 주문 시 주의를 기울여야 한다. 대표 메뉴는 육즙만두로 새우육즙만두와 고기육즙만두가 있다. 그 외에 호박찐만두 고기빙화만두, 삼선빙화만두, 삼치물만두, 양고기 찐만두 등이 있고 두부요리, 땅콩요리, 오징어 요리 등 다양한 탕과 요리가 있다. 중국 전통 만두를 맛볼 수 있는 곳으로 모든 메뉴는 포장할 수 있다.",
연방죽참숯불구이,2867868,음식,음식점,한식,http://tong.visitkorea.or.kr/cms/resource/65/2867865_image2_1.jpg,전라남도,126.686116091,34.9588588686,"연방죽참숯불구이는 나주시 왕곡면에 있는 양념돼지갈비구이 전문점이다. 돼지고기, 쌀, 배추, 김치 모두 국내산을 사용하며, 친환경 무항생제 고기를 사용해 신선하고 품질 좋은 고기를 먹을 수 있다. 내부에는 바닥에 자갈이 깔려 있어 마치 몽돌 해수욕장에서 먹는 느낌이 난다. 기본 찬으로는 김치, 양파장아찌, 열무물김치가 정갈하게 나온다. 삼겹살에 굵은 소금을 뿌려 참숯에 노릇하게 굽고, 열무김치와 육젓을 올려 먹는다. 후식으로 나오는 물냉면과 갈비를 함께 먹어도 좋다. 주말에는 브레이크 타임이 없다. 주변에 나주배테마파크, 에코왕곡마을 등이 있어 연계 관광하기 좋다.",
연백호,1970054,음식,음식점,한식,http://tong.visitkorea.or.kr/cms/resource/05/1945905_image2_1.jpg,인천광역시,126.3918447733,37.6405157904,"인천시 강화군 화도면 내리 후포항에 위치한 활어회 전문 식당이다. 배에서 직접 잡은 신선한 활어회를 맛볼 수 있다.
주로 밴댕이 요리를 전문적으로 선보이고 있으며 밴댕이 코스, 활어 코스, 반반 코스 등 다양한 메뉴 구성이 있어 여럿이 함께하기 좋다. 밴댕이 무침, 밴댕이회 외에도 각종 활어회나 탕 요리도 맛볼 수 있다.",
연변냉면,2682640,음식,음식점,한식,http://tong.visitkorea.or.kr/cms/resource/80/2682580_image2_1.jpg,서울특별시,126.8974360356,37.4930807749,중국식 육수를 사용하여 냉면을 만드는 곳이다. 서울특별시 영등포구에 있는 한식전문점이다. 대표메뉴는 냉면이다.,
연변냉면 2호,2682688,음식,음식점,한식,http://tong.visitkorea.or.kr/cms/resource/09/2682609_image2_1.jpg,서울특별시,126.8958695202,37.4927807818,중국식 육수를 사용하여 냉면을 만드는 곳이다. 서울특별시 영등포구에 있는 한식전문점이다. 대표메뉴는 냉면이다.,
연보람목장,3007401,인문(문화/예술/역사),체험관광지,농.산.어촌 체험,http://tong.visitkorea.or.kr/cms/resource/40/3004740_image2_1.jpg,경기도,126.6156033301,37.6947023052,"김포시 서암리에는 낙동 체험이 가능한 목장이 있다. 논이 보이는 시골길을 따라 가다보면 플레이존이 먼저 보이고 이곳에 주차를 한 뒤 안쪽으로 더 들어가면 연보람 목장이 나타난다.  행복한 젖소, 건강한 우유를 신념으로 하는 연보람목장은 깨끗하게 관리된 목장과 다양한 즐길거리로 가족단위 방문객에게 인기만점이다.  대규모 목장은 아니지만 잘 관리된 체험장과 카페, 놀이시설이 알차게 구성되어 있어 아이들이 지루할  틈이 없다. 하루에 2번 진행되는 체험 수업은 어린 송아지에게 직접 우유 주기, 목장안에 있는 동물들에게 먹이 주기, 부모님과 함께 치즈와 피자 만들기로 구성되어있다. 피자가 구워질 동안 야외로 나가서 트랙터를 타기도 하고 직접 젖소의 젖을 짜보는 경험도 할 수 있다. 마무리로 직접 만든 피자 시식까지 그야말로 꽉 찬 구성에 아이와 부모 모두에게 만족감을 선사한다. 
플레이존은 어린이 방문객들의 놀이공간으로 시간제한 없이 무료로 이용할 수 있다. 연보람목장은 순수한 눈빛의 동물들을 직접 만져보고 먹이를 주는 체험을 통해 자라나는 아이들에게 소중한 추억을 선물하는 공간이다. 예약제 운영으로 전화나 문자보다 네이버예약 후 방문 가능하다.",
연북정,126463,인문(문화/예술/역사),역사관광지,유적지/사적지,,제주특별자치도,126.6359680033,33.5402304438,"조천읍 조천리 바닷가에서 위치한 조선시대의 정자이다. 제주도 유형문화재로 지정되어 있다. 연북정은 객사(客舍)로, 원래 조천성(朝天城) 밖에 있었다고 하나 창건 연대는 미상이며, 1590년(선조 23)에 이옥절제사(李沃節制使)가 성을 동 북쪽으로 물려 쌓고 그 위에 옮겨 세워 쌍벽정(雙壁亭)이라 하였다고 한다. 교수(敎授) 곽기수(郭期壽)의 중창기에 의하면, “조천관은 바다 어귀에 있는데, 육지로 나가는 사람들이 바람을 관측하는 곳이다. 조천(朝天)이라 이름을 지은 것도 이 때문이다. 절제사 이옥이 부임한 다음해 경인년 (庚寅年)에 막부(幕府)의 제공(諸公)과 협의하고 아전과 주민에게, ‘조천에 관을 두게 된 것은 실로 도적들이 다니는 길목의 요충이며, 왕명을 받은 사신들이 왕래하는 곳이기 때문인데,이같이 성이 좁고 건물이 노후해서야 되겠는가, 어찌 농사를 짓는 틈틈이 개축하여 웅장하고 화려하게 하여야 하지 않겠는가.’ 하니, 모두가 옳다고 하였다.
마침내 여러 재주 있는 역군들을 동원하여 10월에 착공하고 12월에 마쳤다. 성은 동북쪽으로 물려서 쌓고 그 위에 망루를 안치하여 쌍벽(雙璧)이라 하였다. 쌍벽(雙璧)은 청산녹수(靑山綠水)에 접하여 있다는 뜻에서 붙인 이름이라고도 한다. 그 후 선조 32년(1599)에는 성윤문(成允文)목사가 그 건물을 중수하고 ‘임금을 사모한다’는 뜻으로 연북정(戀北亭)이라 개칭하였다. 지금의 건물은 1973년에 보수한 것인데, 보수 당시 ‘용(龍) ·가경이십오년경진이월십오일진시입주상량(嘉慶二十五年庚辰二月十五日辰時入柱上樑) · 호(虎)’라 한 명문(銘文)이 발견된 것으로 보아, 연북정은 가경(嘉慶) 25년, 즉 순조 20년(1820) 마지막으로 보수된 듯하다. 이 정자가 세워져 있는 조천포구는 화북포와 함께 관원이나 도민들이 본토를 왕래하는 관문(關門)이었을 뿐만 아니라 순풍을 기다리며 머무는 휴식처이기도 하였다. 일제강점기에는 이 정자가 경찰관 주재소로 사용되기도 하였다.","비짓제주 <a href=""https://www.visitjeju.net/kr/detail/view?contentsid=CONT_000000000500444"" target=""_blank"" title=""새창: 제주 문화관광 홈페이지로 이동"">http://www.visitjeju.net</a><br />국가유산청 <a href=""https://www.heritage.go.kr/heri/cul/culSelectDetail.do?ccbaCpno=2113900030000&pageNo=1_1_1_1&sngl=Y"" target=""_blank"" title=""새창: 국가유산청 홈페이지로 이동"">http://www.cha.go.kr</a>"
연사랑,2923166,음식,음식점,한식,http://tong.visitkorea.or.kr/cms/resource/65/2923165_image2_1.jpg,강원특별자치도,127.2087172343,38.2180435671,"연사랑은 직접 농사지은 돌미나리와 철원 오대쌀, 파프리카 등을 활용한 한정식 식당이다. 여러 가지의 나물 반찬과, 된장찌개, 돌미나리가 곁들인 삼겹살 구이가 나오는 미나리삼겹 나물밥정식이 인기다. 파프리카로 만든 샐러드와 부각이 이색적인 에피타이저로 나온다. 직접 키운 미나리가 잘 구워진 삼겹살의 풍미를 돋우는 메인 메뉴로 나오고, 다양한 양념장이 준비되어 있어서 입맛에 맞게 나물과 밥에 비벼 먹으면 된다. 점심시간에는 웨이팅이 있을 수 있고, 재료 소진 시에는 영업을 마감함으로, 방문 전에 연락하여 확인하는 것이 좋다.","<a href=""https://www.instagram.com/yeonl_ove/""target=""_blank"" title=""새창 : 연사랑사이트로 이동"">https://www.instagram.com/yeonl_ove/</a>"
연산골막국수,628266,음식,음식점,한식,,강원특별자치도,127.7902208166,37.8974806382,"강원 춘천시 동면에 위치한 막국수 전문점이다.
매운 양념과, 깨, 김 가루, 무순 등의 재료를 고명으로 얹고 본인의 취향에 맞게 동치미 국물을 부어 먹는 춘천식 막국수가 대표 메뉴이다. 막국수 외에도 메밀 만둣국, 메밀 총떡 등 강원도를 대표하는 메밀 음식을 맛볼 수 있다. 식당 내 좌석수도 넉넉하여 가족 모임, 단체 모임 등을 하기에도 좋다.",
연산군묘,3057803,인문(문화/예술/역사),역사관광지,유적지/사적지,http://tong.visitkorea.or.kr/cms/resource/92/3057792_image2_1.jpg,서울특별시,127.0218060429,37.6614439896,"연산군묘는 조선 10대 연산군과 거창군부인 신씨의 묘소로 2006년 일반에 처음 개방되었으며 도봉 원당샘공원 인근에 있다. 쌍분의 형태로 조성되어 병풍석과 난간석을 생략하고, 문석인 2쌍, 망주석, 장명등, 상석, 향로석을 배치하였다. 앞에서 바라보았을 때 왼쪽이 연산군묘, 오른쪽이 거창군부인묘소로 각 봉분 앞에는 묘표석을 세웠다. 같은 묘역 안에는 태종의 후궁 의정궁주 조씨의 묘소, 연산군의 딸 휘순공주와 사위 능양위 구문경의 쌍분이 조성되어 있다.
연산군은 성종과 폐비 윤씨의 아들로 1494년 왕위에 올랐으나 두 번의 사화로 조정이 어려워지자 연산군으로 강등되고 강화도로 유배되어 그 해 31세로 세상을 떠났다. 1512년 부인 신씨가 묘를 강화도에서 현재의 자리로 옮겨 달라고 요청하여 중종 7년(1513) 묘를 옮기고 양주군의 권원이 제사를 지내도록 관리하였다. 
연산군묘 앞에는 서울특별시 기념물이자 보호수로 지정된 서울 방학동 은행나무가 있다. 지하철 우이신설선 북한산우이역에서 차로 5분 거리에 있으며 서울둘레길8-5코스에 포함되어 있다.","<a href=""http://royaltombs.cha.go.kr/tombs/selectTombInfoList.do?tombseq=133&mn=RT_01_06_02"" target=""_blank"" title=""새창 : 홈페이지로 이동"">http://royaltombs.cha.go.kr</a>"
연산군유배지,2765222,인문(문화/예술/역사),역사관광지,유적지/사적지,http://tong.visitkorea.or.kr/cms/resource/59/2780659_image2_1.jpg,인천광역시,126.2918999842,37.7831029609,강화군 교동면에 위치한 연산군 유배지에는 연산군이 유배될 당시 모습과 유배하면서 머물던 초가집이 조형물로 만들어져 있다. 연산군은 조선 제10대의 임금(재위 1494년~1506년)이었으나 많은 신진 사류를 죽이는 무오사화와 갑자사화를 일으키고 생모 윤 씨의 폐비에 찬성했던 윤필상 등 수십 명을 살해하였다. 결국 중종반정에 의해 왕위에서 폐위되어 강화도 교동으로 유배되었으며 1506년 11월 이곳에서 사망했다. 연산군 유배지 안에는 교동도 유배 문학관에서는 강화도와 교동도의 역사와 교동도에 유배 온 왕과 왕족들에 대한 이야기를 자세하게 안내하고 있다. 인근에 둘러볼 만한 곳으로는 교동시장이 있다.,
연산나그네캠핑장,2729562,레포츠,육상 레포츠,"야영장,오토캠핑장",http://tong.visitkorea.or.kr/cms/resource/40/2729440_image2_1.jpg,충청남도,127.1889100523,36.2665745312,"나그네캠핑장은 충남 논산시 연산면에 자리 잡고 있는데, 논산시청을 기점으로 논산대로와 백일헌로를 거쳐 약 30이면 도착한다. 이곳은 고즈넉한 농촌의 논밭을 지나면 나오는데, 입구에 들어서면 수목이 우거진 숲 속에 요새처럼 조성된 캠핑장을 만날 수 있다. 이곳저곳에 시선을 옮기다 보면 아날로그 감성을 자극하는 소품 등이 시선을 사로잡는다. 캠핑장은 20면의 자갈로 이뤄졌으며, 사이트 크기는 가로 9m 세로 8m다. 사이트 주변에 나무가 빼곡해 여름철에 캠핑을 만끽하기에도 무리가 없다. 화장실과 개수대는 각각 2개소씩 설치했고, 샤워장은 곳곳에 6개소를 마련했다. 반려견을 동반할 수 있지만 소형견에 한해 가능하다. 캠핑장 인근에 골프를 즐길 수 있는 더힐 cc 등 관광지가 있고, 공주의 특산물로 만든 먹거리를 제공하는 식당 등이 있다.","<a href=""http://cafe.naver.com/nagenecamping/"" target=""_blank"" title=""새창 : 연산나그네캠핑장 사이트로 이동"">http://cafe.naver.com/nagenecamping/</a>"
연산낙지해물탕,2867674,음식,음식점,한식,http://tong.visitkorea.or.kr/cms/resource/70/2867670_image2_1.JPG,부산광역시,129.1069341252,35.1823596461,"부산시 연제구 연산동, 연제 경찰서 근처에 있는 연산낙지해물탕은 해물탕, 곱창전골, 산낙지전골 등이 있는 해물탕과 매운탕 전문점이다. 방에는 입식테이블이 있고 옆으로 좌식 테이블도 마련되어 있다. 
대표 메뉴인 해물탕엔 해산물이 푸짐하고, 끓을 때쯤  살아있는 낙지를 손질해 넣어주는 것이 특징이다. 낙곱새, 곱창전골, 산낙지 전골, 낙지전골도 양이 푸짐하고 국물맛도 시원해서 맛있다. 마지막에 볶음밥은 필수일 만큼 별미이다. 현지인들도 많이 찾는 맛집으로 예약 후 방문하면 대기 없이 입장할 수 있다. 전용 주차장이 있어 편리하다. 박차정의사 생가, 충렬사가 인접해 있어 함께 둘러보기 좋다.",
