title,contentid,cat1,cat2,cat3,firstimage,region,mapx,mapy,overview,homepage
낙산사,125773,인문(문화/예술/역사),역사관광지,사찰,,강원특별자치도,128.6273544905,38.1248562734,"낙산사는 강원특별자치도 양양군을 대표하는 관광명소이자 역사적 가치가 큰 명승지다. 신라 문무왕 11년(671)에 의상대사가 창건한 고찰로 강화 보문사, 남해 보리암과 더불어 한국 3대 관음성지로 꼽힌다. 동해가 한눈에 내려다보이는 천혜의 풍광이 아름다운 사찰은 관동팔경(강원특별자치도 영동의 여덟 군데 명승지) 중 한 곳으로, 예로부터 수많은 고전과 시문에 그 아름다움이 전해지고 있다. 
낙산사는 여러 번 중건과 복원을 거친 역사적 사찰로 여러 문화재를 보유하고 있다. 16m 높이의 해수관음상, 해안 절벽 위에 지은 정자이자 동해안 일출 명소인 의상대, 바다를 굽어보는 암자인 홍련암, 조선 시대에 지었으나 고려 시대 양식을 이어받은 양양 낙산사 칠층석탑(보물), 부처의 진신사리를 비롯한 사리장엄구가 발견된 양양 낙산사 해수관음공중사리탑·비 및 사리장엄구 일괄(보물) 등이 잘 알려져 있다. 2005년에 큰 산불이 나 보물로 지정되어 있던 동종을 비롯해 20여 채의 전각이 소실된 바 있다. 낙산사 홈페이지를 통해 템플스테이를 신청할 수 있다.  

◎ 한류의 매력을 만나는 여행 정보 - <리노로그>
리노가 걸었던 ‘꿈이 이루어지는 길’을 걸으며 수많은 돌탑 위에 작은 돌 하나를 얹고 소원을 빌어 보는 것을 추천한다.","<a href=""http://www.naksansa.or.kr"" title=""새창 : 낙산사 홈페이지로 이동"" target=""_blank"">http://www.naksansa.or.kr</a>"
낙산사 의상대,125795,인문(문화/예술/역사),역사관광지,유적지/사적지,,강원특별자치도,128.6307430562,38.1253701685,"강원도 양양 낙산사에서 홍련암의 관음굴로 가는 바닷가 절벽 위에 자리한 정자다. 의상대의 ‘대’란 주변 경치를 감상하기 위해 지은 집을 말한다. 의상대에서 바라보는 동해와 해안 절경이 빼어나 양양 8경에 이름을 올렸고, 낙산사에서 반드시 들려야 할 곳으로 손꼽힌다. 송강 정철의 <관동별곡>에서 소개한 관동팔경(강원도 영동의 여덟 군데 명승지) 중 하나로, 동해안 일출이 유명한 곳이기도 하다. 「양양 낙산사 의상대와 홍련암」이라는 이름으로 명승에 지정되어 있다. 낙산사 의상대는 의상대사의 업적을 기리기 위해 1925년에 지은 정자다. 의상대사는 신라 문무왕 11년(671)에 낙산사를 창건한 고승으로, 절 곳곳에 그와 관련한 전설이 전해진다. 중국 당나라에서 돌아온 의상대사가 낙산사를 지을 때 지금 의상대가 있는 자리에서 산세를 살피고 좌선 수행을 했다고 알려져 있다. 현재의 의상대는 1995년에 육각정으로 복원된 모습이다.","<a href=""http://www.naksansa.or.kr"" title=""새창: 낙산사 의상대로 이동"" target=""_blank"">http://www.naksansa.or.kr</a>"
낙산항,2714816,자연,자연관광지,항구/포구,http://tong.visitkorea.or.kr/cms/resource/78/3387578_image2_1.JPG,강원특별자치도,128.6321235721,38.1226094051,"양양의 대표 해수욕장인 낙산 해수욕장 인근에 위치한 곳으로 조용하고 작은 어촌 분위기가 물씬 풍기는 항구다. 넓은 바다를 감상하며 싱싱한 횟감을 맛볼 수 있다는 것이 최대 장점이다. 낙산항 바로 옆에는 해안 절벽에 자리 잡은 낙산사가 위치해 있고, 근처의 낙산 해수욕장은 70m까지 들어가도 수심이 1.5m밖에 되지 않는 안전한 곳으로 사시사철 여행객들이 붐빈다. 

(출처: 강원도청)",
낙산해안로,2714824,자연,자연관광지,자연생태관광지,http://tong.visitkorea.or.kr/cms/resource/17/3387517_image2_1.JPG,강원특별자치도,128.6051167282,38.1534358504,"낙산해안로는 담백하고 수수한 아름다움을 가진 해안로로 물치항, 설악해변, 낙산사, 낙산해변, 동해신묘, 낙산대교로 이어지는 약 16.3km 길이다. 여름과 겨울이 특히 아름답지만 사계절 어느 때나 편안한 휴식을 즐길 수 있는 공간으로 이용객들의 큰 사랑을 받고 있다. 일상의 스트레스를 털고 재충전할 수 있는 드라이브 코스로도 유명하다. 주변에 옥색 주전골, 낙산도립공원, 남애항 등 관광 명소가 많아 ‘관광’과 ‘휴양’ 두 마리 토끼를 잡을 수도 있다. 

(출처: 강원도청)",
낙생대공원,2759981,인문(문화/예술/역사),휴양관광지,공원,,경기도,127.107683771,37.3875773384,"낙생대공원은 분당구 백현동에 있는 근린공원으로 면적은 428,697.6m²이다. 운동기구, 배드민턴장, 팔각정, 음수대, 습지, 야외 생태교실, 연못, 놀이터, 다목적운동장, 항일의병기념탑 등이 있으며 항일의병기념탑은 일제 강점기 성남 일대에서 항일 투쟁을 하다 숨진 의병들의 활동을 기리는 탑이다. 공원 초입에는 벽천이 있어 시원한 물줄기를 만날 수 있고 산책로도 잘 가꿔놓아 아침저녁으로 운동하는 주민들이 많다.",
낙선재,1604941,인문(문화/예술/역사),역사관광지,고궁,http://tong.visitkorea.or.kr/cms/resource/93/1568293_image2_1.jpg,서울특별시,126.993544308,37.5786003366,"낙선재는 본래 창경궁에 속해 있던 건물이었으나 근래에 창덕궁에 속한 것으로 취급하게 되었다. 이 건물은 헌종 12년(1846)에 건립한 것으로 본 건물에 접속된 석복헌(錫福軒)과 수강재(壽康齋) 등 3개의 건물을 총칭하여 낙선재(樂善齋)라 부르고 있다.  정문은 장락당(長樂堂)으로 낙선재 남행각(南行閣) 12칸에 설치되었다. 이 문을 들어서면 넓은 마당 뒤로 낙선재가 있다. 정면 6칸 중 우측 한 칸이 전면으로 돌출되어 누마루가 되었고 몸채는 장대석 기단 위에 방형(方形) 초석과 기둥을 한 일반적인 주택풍으로 세워졌다.  누마루의 아래 분구(焚口) 있는 주변은 불규칙한 선의 모자이크 장식이 독특하며 주간의 문짝의 무늬가 다양하다. 집 뒤로는 큰 석재로 쌓아 만든 화계(花階)가 있고 굴뚝과 각 단의 꽃나무, 괴석들이 조화를 이루고 있어 조원(造園)이 뛰어나다. 낙선재에 연접한 석복헌은 역시 정면 6칸, 측면 2칸으로 안사랑에 해당하는 건물이다. 3급 장대석 기단에 계단이 둘 설치되어 있다. 사다리꼴 초석 위에 방주가 섰다. 전면의 주간에는 세장(細長)한 장지문이 달렸는데 그중 중앙 1칸은 머름을 하여 낮고 문살 모양도 다른 문과 다르다. 건물 주위로 행각이 둘렸으며 밖으로 외행각(外行閣)이 나 있고 이것이 수강재에 이어진다. 수강재는 15칸 규모이며 5량 가구(架構)의 홑처마 단층기와지붕을 한 건물이다.","<a href=""https://tour.jongno.go.kr/tourMain.do"" target=""_blank"" title=""종로 문화관광 사이트로 이동"">https://tour.jongno.go.kr/tourMain.do</a>"
낙선재,2745690,음식,음식점,한식,http://tong.visitkorea.or.kr/cms/resource/35/2758935_image2_1.png,경기도,127.2061839937,37.4560628389,"경기도 광주 남한산성 인근에 있는 음식점이다. 여러 채의 한옥으로 구성되어 있어 사극 촬영장 같은 느낌을 준다. 1996년에 개점하였으며,  가장 인기 있는 메뉴는 한정식과 닭볶음탕이다. 음식점 가는 길은 드라이브 하기에 좋아서 데이트 코스로도 좋다. 이곳에 들어서면 수십 개의 항아리가 보이는데 각종 반찬에 들어가는 장맛을 가늠하게 한다. 한옥 방 안, 또는 별채에서 일행끼리만 오붓하게 식사를 즐길 수도 있다. 밤에는 가로등 덕분에 한옥이 더 운치 있게 느껴진다. 한복을 입고가면 한옥과 잘 어울리는 멋진 사진도 찍을 수 있다. 반려견은 출입할 수 없다.",
낙안돌탑공원,2748404,인문(문화/예술/역사),휴양관광지,공원,http://tong.visitkorea.or.kr/cms/resource/59/3372659_image2_1.JPG,전라남도,127.3462203378,34.9069591901,"순천 낙안읍성 근처에 자리한 낙안 돌탑공원은 돌탑 예술가인 최병수 씨의 개인 정원이다. 20년이 넘는 세월 동안 공원의 주인인 최병수 씨가 수천 개의 돌을 하나하나 정성껏 쌓아 올린 작품을 둘러볼 수 있다. 마음을 수양하고자 쌓은 작품이 어느덧 수백 개를 넘어섰다고 한다. 대표 작품은 단연 국보 남대문으로 생각보다 커다란 규모에 감탄을 자아내게 된다. 그뿐만 아니라 나로호, 에펠탑, 자유의 여신상 등 유명 관광 명소를 본떠 만든 작품들도 재미있는 관람 요소다.",
낙안온천,127973,인문(문화/예술/역사),휴양관광지,온천/욕장/스파,,전라남도,127.3379874119,34.9194743091,"낙안온천은 순천시 금전산 중턱에 위치하고 있으며, 어떠한 정수 시설도 사용하지 않은 자연 그대로의 순수한 100% 천연 온천수만을 사용한다. 이곳은 2000년 온천이 발견되었고 2003년 온천원 보호 지구로 지정되었다.
지하 830m에서 분출되는 유황과 게르마늄이 함유된 온천수는 항암 및 노폐물과 각질 제거, 피부 질환 치료에 도움이 된다고 알려져 있다. 또한 온천 녹차탕은 피부 탄력 유지에 도움이 된다. 이곳을 체험하고 나온 사람들의 입소문으로 수질과 온천수의 효능이 보장된 곳이다.
산속에 위치하고 있어 온천욕과 산림욕이 가능해 심신의 피로를 동시에 해결할 수 있는 곳이기도 하다. 낙안읍성에서 차량 이동 3분, 2km의 근거리에 위치해 있으므로 관광 후 온천욕으로 여독을 풀 수 있다. 주변 관광지로 금전산과 금강암, 금둔사가 있다.","<a href=""http://www.xn--b20b254awjcvza69uda.kr/"" target=""_blank"" title=""새창: 낙안온천 홈페이지로 이동"">http://www.순천낙안온천.kr</a>"
낙안읍성 벚꽃길,3076316,자연,자연관광지,자연생태관광지,,전라남도,127.4722616958,34.9207459152,"봄이 되면 순천 시내에서 낙안읍성으로 가는 민속마을 길은 온통 하얗게 벚꽃길이 펼쳐진다. 평균 3월말 4월 초에 벚꽃은 절정을 이루고 봄바람에 눈처럼 휘날리는 벚꽃길을 감상하며 따라가다 보면 낙안읍성에 도착하게 된다. 낙안 벚꽃길은 상사댐 주변 일대의 예쁜 길로도 유명하다. 상사호를 중심으로 상사호길과 노동길 두 곳으로 총 14km에 이른 벚꽃길은 민속마을길로 이어지며 벚꽃이 만개하는 봄이 되면 상춘객들이 도로에 차를 멈추고 사진 촬영을 하는 바람에 주차장이 되는 풍경이 펼쳐지기도 한다. 
벚꽃이 피는 계절이 되면 봄을 맞아 새롭게 초록으로 물드는 산과 어우러져 낙안 벚꽃길은 그야말로 눈이 부신 세상으로 변신한다.
민속마을길 끝에 낙안읍성민속마을이 있고 민속마을 전에 국립낙안민속자연휴양림을 둘러볼 수 있다.",
낙안재,2696256,숙박,숙박시설,한옥,,경상북도,129.2084125487,35.8359908215,"낙안재는 1978년에 지은 한옥을 리모델링하여 전통한옥의 미와 현대적인 감각이 어우러진 한옥 게스트하우스이다. 황리단길 바로 옆에 위치해 있으며 대릉원, 첨성대 및 동궁과 월지 등 주변관광지도 도보로 이동이 가능하다.","<a href=""http://naganjae.modoo.at/""_blank"">http://naganjae.modoo.at/</a>"
낙안큰샘민박,1344503,숙박,숙박시설,민박,,전라남도,127.3390654198,34.9066035522,"낙안읍성민속마을 안에 있는 큰샘민박은 볏짚으로 지붕을 덮은 전통 초가 형태다. 대나무로 엮은 문에다, 돌담은 황토를 발라서 쌓았고 초가 형태인 만큼 객실도 모두 온돌방이다. 방마다 인터넷선이 깔려 있어 노트북을 가져가면 인터넷을 사용할 수 있는데, 한 가지 기억할 것은 유적지 보호를 위해 취사를 금하므로 바비큐 파티는 할 수 없다. 하지만 근처에 음식점이 있으니 크게 걱정할 필요는 없다. 큰샘민박의 퇴실시간은 11시로 정했지만 다음 손님이 오기 전이라면 시간을 넘겨도 상관이 없다. 청소할 시간 정도의 여유만 있으면 문제없다. 조선시대의 성, 동헌, 객사, 초가가 원형대로 보존된 낙안읍성민속마을에선 다양한 짚공예품을 볼 수 있고, 한지공예와 천연염색을 체험해볼 수 있다. 수문장 교대식도 관람할 수 있다. 순천만, 송광사, 여수, 보성 등 주변 관광지도 가깝다.",
낙안향교,1624269,인문(문화/예술/역사),역사관광지,유적지/사적지,,전라남도,127.345798319,34.9003571475,"향교는 훌륭한 유학자의 위패를 모시고 제사를 지내며 지방민 교육과 교화를 위해 설립한 고려·조선시대의 국립 지방 교육기관이다.  
낙안향교는 조선 전기에 지어진 것으로 추측되는데, 효종 9년(1658)에 군 동쪽 농암등에서 현재의 위치로 이건 하였고 몇 차례에 걸쳐 중수하였다. 현존하는 건물로는 대성전, 명륜당, 동무, 서무, 동재, 서재, 양사재, 고직사 등이 있다. 대성전에는 5성, 송조2현, 우리나라 18현의 위패가 봉안되어 있다. 조선시대에는 국가로부터 토지와 전적·노비 등을 지급받아 교관이 교생을 가르쳤으나, 갑오개혁 이후 신학제 실시에 따라 교육적 기능은 없어지고 봄·가을에 석전을 봉행하며 초하루·보름에 분향을 하고 있다. 
전라남도 유형문화재로 지정되어 있으며, 전교 1명과 장의 수명이 운영을 담당하고 있다. 향교 입구에 하마비와 22기의 비석군이 있다.
낙안향교 명륜당 뒷편에 있는 낙안 교촌리 은행나무는 향교를 지금의 자리로 옮길 때 심은 것으로 알려져 수령이 360여 년이 넘는 것으로 추정된다.
낙안읍성민속마을과는 불과 300m 밖에 떨어져 있지 않아 함께 여행하기 좋은 곳이다.","<a href=""https://www.heritage.go.kr/heri/cul/culSelectDetail.do?pageNo=1_1_1_1&sngl=Y&ccbaCpno=2113601120000"" target=""_blank"" title=""새창 : 국가유산청 홈페이지로 이동"">http://www.cha.go.kr</a>"
낙암서원,1958119,인문(문화/예술/역사),역사관광지,유적지/사적지,http://tong.visitkorea.or.kr/cms/resource/37/3403637_image2_1.jpg,경상북도,128.2704624024,36.4104275695,"상주시 중동면에 있는 낙암서원은 1745년(영조 21)에 지방 유림의 공의로 김담수, 김정룡, 김정견의 학문과 덕행을 추모하기 위하여 창건된 서원이다. 유학자들의 위패를 모시고 제사를 지내며 지방교육의 일익을 담당하여 오던 중 흥선대원군의 서원철폐령으로 1868년(고종 5)에 훼철되었으며, 그 뒤 묘우 자리에 단소를 만들었다. 경내의 건물로는 3칸의 강당과 1칸의 장판각이 있으며, 동재·서재와 전사청 등은 그 터만 남아 있다. 강당은 중앙의 마루와 양쪽 협실로 되어 있는데, 원내의 여러 행사와 유림의 회합 및 학문의 토론 장소로 사용되던 곳이다. 장판각은 문집의 판각을 보관하는 곳인데, 현재 판각은 없고 판각된 문집만 몇 권 남아 있으며 매년 한 차례의 향사를 지낸다.","<a href=""https://sangju.grandculture.net/sangju/toc/GC09101140"" target=""_blank"" title=""새창 : 홈페이지로 이동"">https://sangju.grandculture.net/sangju</a>"
낙암정,126995,인문(문화/예술/역사),역사관광지,유적지/사적지,http://tong.visitkorea.or.kr/cms/resource/03/178203_image2_1.jpg,경상북도,128.6324513205,36.5474797741,"깎아지른 듯한 절벽 위에 있어 낙동강 줄기가 한눈에 내려다보이는 곳에 위치한 낙암정은 조선 전기의 문신 배환의 정자이다. 이후 1813년(순조 13)과 1881년(고종 18)과 1955년에 중수하였다. 건물 구조는 정면 3칸, 측면 2칸의 팔작지붕으로 안동지역에 있는 일반적인 정자의 형태와 다를 바 없다. 하지만 난간기둥이 윗부분에 비해서 아랫부분이 짧은 것이 특징이다. 기단은 원래 자연석이었으나 몇 번의 보수를 거치면서 시멘트로 쌓았다.
배환은 경상북도 안동시 서후면 금계리에서 백죽당 배상지의 차남으로 태어났다. 조용의 문인으로 1401년(태종 1) 증광 문과에 급제하고 사헌부감찰·병조좌랑·봉화현감·공조좌랑·형조좌랑을 거쳐 1420년(세종 2) 정랑에 올랐다. 1432년(세종 14) 예문관직제학으로 선위사를 겸직하여 광주에서 일본 사신을 접견하였고, 1435년(세종 17) 병조참의로 선위사가 되어 명나라 사신을 맞이하였다.","<a href=""http://www.tourandong.com"" target=""_blank"" title=""안동시 문화관광 사이트로 이동"">http://www.tourandong.com</a>
<br />
<a href=""http://www.cha.go.kr/"" target=""_blank"" title=""문화재청 사이트로 이동"">http://www.cha.go.kr</a>"
낙양물사랑공원,2736404,인문(문화/예술/역사),휴양관광지,공원,http://tong.visitkorea.or.kr/cms/resource/75/2768375_image2_1.jpg,경기도,127.0922999383,37.7470741862,"낙양물사랑 공공하수처리시설은 민락2 지구에서 발생하는 하수를 완벽한 처리공정을 통해 깨끗한 물로 재생시켜 방류하여 수질 및 환경개선에 기여하고 있으며, 하수처리시설은 지하화 하고 상부는 공원화해 주민친화 공간 (물놀이시설, 어린이놀이 시설 등)으로 이용되고 있다.<br>*출처 : 의정부시청 홈페이지","<a href=""https://www.ui4u.go.kr/eco/contents.do?mId=0105020000"" target=""_blank"" title=""새창 : 낙양물사랑공원 사이트로 이동"">https://www.ui4u.go.kr/eco/contents.do?mId=0105020000</a>"
낙양사,1598258,인문(문화/예술/역사),역사관광지,유적지/사적지,,전북특별자치도,126.9800434801,35.8114533776,"낙양사는 김제시 금구면 청운리 여산송씨 집성촌인 불로마을에 있는 송정기, 송정구, 송정모 삼형제를 모신 사당이다. 죽계 송정기는 인자하고 효성스러우며 지조가 단결하여 1797년(정조 21) 정려를 받았다. 벽계 송정구는 송정기의 가운데 동생으로 형을 엄부와 같이 섬기며 효로 집안을 다스리고 예로 가르치니 향인이 흠모하여 송정기와 함께 육송사에 배향하다가 정조 때 정려를 받았다. 송정모는 송정기의 막내 동생으로 나서부터 성품이 순화하고 학문에 힘썼으며, 송시열이 덕원으로 귀양 가자 항소한 뒤로는 두문분출하고 과정에 나아갈 뜻을 끊음에 향리 사람들이 감복하여 사림들이 사당에 배향하였다. 1675년(숙종 1) 금구현 동도면 상학리(현재의 금구면 금구리)에 학천사를 창건하여 위패를 모셨으나, 화재로 소실되어 금구현 수류면 거야(현재의 금구면 삼봉리 거야마을)에 있는 육송사로 옮겨 모셨다. 그런데 1869년(고종 6) 육송사가 철폐됨에 따라 1910년(순조 4) 지금의 자리에 사당을 세우고 낙양사라 하여 송정기 삼형제의 위패를 모시고 있다.","<a href=""http://gimje.grandculture.net/gimje/toc/GC02601190"" target=""_blank"" title=""새창 : 홈페이지로 이동"">http://gimje.grandculture.net</a>"
낙영찜갈비,637751,음식,음식점,한식,,대구광역시,128.60269525,35.8742668582,"동인동 찜 갈비는 매운맛으로 양은 냄비에 담아내어 당시로는 주로 술안주였고, 소문이 나자 식당이 생겨나면서 100여 미터 길 양편에 지금의 ‘동인동 찜 갈비 골목’이 형성되었다. 다른 철제 용기에 비해 열전도율이 높은 양은 냄비의 특성을 이용하여 조리된 찜 갈비는 쫄깃쫄깃한 육질과 온갖 양념이 어우러져 최고의 맛을 만들어 내며 대구의 향토음식으로 자리매김하고 있다.

낙영찜갈비는 1972년 술대포집부터 시작하여 이후 대를 이어 동인동의 찜 갈비 명가로 자리 잡았다. 육질 좋은 쇠고기만을 엄선하여 독특한 양념의 맛을 느낄 수 있는 갈비찜이 대표 메뉴이며, 소고기 찌개도 많은 이들이 찾고 있다.",
낙원 생활문화축제,3400753,인문(문화/예술/역사),축제,일반축제,http://tong.visitkorea.or.kr/cms/resource/88/3400688_image2_1.jpg,서울특별시,126.9880310857,37.5728259087,"서울생활문화센터 낙원의 생활문화 및 생활음악 동아리들을 격려하고, 생활문화의 저변 확대와 발전을 목표로 다양한 공연과 시민 생활문화체험 프로그램 이다.","<a href=""http://www.nakwon-communityart.or.kr/bbs/main"" target=""_blank"" title=""새창 : 낙원 생활문화축제 홈페이지 이동"">www.nakwon-communityart.or.kr</a>"
낙원 악기상가,132226,쇼핑,쇼핑,전문매장/상가,http://tong.visitkorea.or.kr/cms/resource/19/923719_image2_1.jpg,서울특별시,126.9878811011,37.5727564697,"인사동 전통문화의 거리 바로 옆에 위치한 낙원악기상가는 70년대 이래로 악기 및 음악 관련 제품과 정보, 서비스만을 취급하고 있는 전문상가로, 세계 최대의 규모이다. 330여 개에 이르는 악기점에서 기타, 관현악기, 타악기, 국악기와 첨단 전자악기 및 앰프와 스피커 등 각종 음향과 방송설비의 국내외 최신 제품과 정보를 얻고 구매할 수 있으며, 고가의 최신 제품뿐만 아니라 중고품의 교환과 판매도 가능해서 피아노 등 중고품의 수리, 조율 및 교환 등의 서비스도 제공된다. 또, 각종 행사의 악기 및 음향장비 대여 서비스도 가능하다. 같은 상가 내에 복합 상영관인 할리우드 극장도 있어 인사동 전통문화의 거리와 함께 종로의 대표적인 명소로 자리매김하고 있고, 최근의 리뉴얼 이후로 일요일에도 개장하여 더욱 쾌적한 쇼핑환경을 제공하고 있다.","<a title=""새창 : 낙원상가 홈페이지로 이동"" href=""http://www.enakwon.com"" target=""_blank"">http://www.enakwon.com</a>"
낙원(메이필드호텔),581248,음식,음식점,한식,http://tong.visitkorea.or.kr/cms/resource/04/818004_image2_1.jpg,서울특별시,126.8194860451,37.54788135,낙원은 서울시 강서구 메이필드호텔 내에 위치한 갈비전문점이다. 1984년 낙원가든에서 출발한 이곳은 갈비 명가로 오랜 전통을 자랑한다. 한옥으로 된 인테리어가 돋보이며 넓은 홀과 룸으로 구분되어 있어 모임장소에 적합하다. 낙원은 특제 소스와 자체 개발한 갈비 숙성법을 통해 변함없는 맛을 유지하고 있으며 후식으로 담백한 평양식 냉면은 갈비와 절묘한 조합을 이룬다.,"<a href=""http://www.mayfield.co.kr"" target=""_blank"" title=""새창 : 낙원(메이필드호텔) 홈페이지로 이동"">http://www.mayfield.co.kr</a>"
낙원간장게장,2853230,음식,음식점,한식,http://tong.visitkorea.or.kr/cms/resource/22/2853222_image2_1.jpeg,경기도,127.2770070506,37.0013722589,"낙원간장게장은 경기도 안성시 현수동에 있는 게장 전문점이다. 대표 메뉴는 연평도산 봄 꽃게로 만든 꽃게 간장게장이다. 짜지 않으면서도 감칠맛이 나는 것이 특징이다. 이외에도 양념게장, 보리굴비, 새우장, 꽃게범벅, 꽃게탕, 아귀찜, 돌게장을 판매한다. 점심 특선 메뉴로 메인 메뉴와 솥밥이 함께 나오는 정식도 있다. 매장 내부는 넓고 쾌적하다. 입식 테이블과 좌식 테이블 모두 있다. 매장 앞에 주차 공간이 있다.",
낙원갈비집 대전유성점,2915798,음식,음식점,한식,http://tong.visitkorea.or.kr/cms/resource/90/2915790_image2_1.jpg,대전광역시,127.3439826069,36.3578918211,"낙원갈비집 대전유성점은 대전광역시 유성구 봉명동에 있다. 대표 메뉴는 통갈비 스테이크이고 이 밖에 한우 암소 T본스테이크, L본스테이크, 한우채끝갈비, 한우 타다끼가 있고 돼지갈비. 한우 암소 생등심 등을 판다. 밑반찬이 정갈하게 나오고 셀프바를 이용할 수 있다. 좌석마다 가림막이 있어 편하게 식사할 수 있다. 유성IC에서 가깝고, 주변에 유성온천공원, 엑스포다리와 가수원교를 잇는 갑천누리길1코스가 있다.",
