title,contentid,cat1,cat2,cat3,firstimage,region,mapx,mapy,overview,homepage
섬소나이,2870651,음식,음식점,중식,http://tong.visitkorea.or.kr/cms/resource/47/2870647_image2_1.jpg,제주특별자치도,126.9576601478,33.5133691617,"섬소나이는 제주시 우도, 하고수동 해수욕장에 있는 퓨전음식점이다. 다양한 짬뽕과 피자가 있고 음료와 주류가 있다. 특히 한약재 등 10여 가지 이상의 재료를 넣어 12시간 동안 직접 끓인 육수를 사용하는 짬뽕은 국물 맛이 깊다. 면과 피자 도우도 무기질이 풍부한 톳을 사용한다. 당일 직접 만든 면을 사용하고 재료는 당일 소진을 원칙으로 한다. 땡짬은 맑은 짬뽕, 우짬은 빨간짬뽕, 백짬은 크림짬뽕이며 모든 짬뽕의 맵기는 기호에 따라 선택할 수 있다. 식당 안에서도 바다를 바라볼 수 있고 식사 후 우도를 천천히 둘러보는 것도 좋다. 주변 여행지로 비양도, 검멀레 해수욕장 등이 있다.","<a href=""https://www.instagram.com/udo_islandguy""target=""_blank"" title=""새창 : 섬소나이 사이트로 이동"">https://www.instagram.com/udo_islandguy</a>"
섬소년,2674657,음식,음식점,한식,http://tong.visitkorea.or.kr/cms/resource/55/2674655_image2_1.jpg,서울특별시,126.9195821905,37.5579236361,동해안에서 직접 받은 자연산 해산물로 요리를 하는 곳이다. 서울특별시 마포구에 있는 한식 전문점이다. 대표메뉴는 생태 매운탕이다.,
섬이정원,2593258,자연,자연관광지,수목원,http://tong.visitkorea.or.kr/cms/resource/51/3304451_image2_1.jpg,경상남도,127.8605847505,34.7523270827,섬이정원은 보물섬 남해에 한려해상공원의 아름다운 바다가 내려다보이는 유럽식 정원이다. 이곳은 다랑논의 오래된 돌담과 연못 그리고 생울타리에 다양한 초본과 억새들로 연출한 정형적이고 자연스러운 모습이다. 궁궐이 담과 문으로 독립적이면서 서로 연결되어 공간이 만들어지듯이 다랑논의 높낮이를 이용하여 9개의 작은 정원들이 방의 개념으로 분할돼 각 방마다 개성 있는 모습을 하고 있고 때로는 서로 어울려 다른 정경을 보여준다.,"<a href=""http://www.seomigarden.com/"" target=""_blank"" title=""새창: 섬이정원 홈페이지로 이동"">http://www.seomigarden.com/</a>"
섬지골 캠핑장,2757994,레포츠,육상 레포츠,"야영장,오토캠핑장",http://tong.visitkorea.or.kr/cms/resource/78/2758278_image2_1.JPG,강원특별자치도,128.7451966471,37.1223633031,"섬지골 캠핑장은 강원도 영월의 김삿갓 계곡에 위치한 오토캠핑장이다. 사이트 간격이 넓어 타프를 설치할 수 있고, 카라반이나 캠핑카를 이용할 수 있다. 캠핑장 바로 앞 계곡은 시원하고 얕아서 아이들이 물놀이를 즐기기 좋다. 캠핑장 주변에 강가에서 낚시나 다슬기 줍기 등을 할 수 있다. 음료수나 숯, 장작 등을 판매하는 매점이 있어 주천 시내까지 나갈 필요가 없다. 계곡 쪽으로 데크가 설치되어 있어서 안전하고 쾌적하게 계곡을 즐길 수 있어, 편리하다.","<a href=""http://cafe.naver.com/soemjigol/"" target=""_blank"" title=""새창 : 섬지골 캠핑장 사이트로 이동"">http://cafe.naver.com/soemjigol/</a>"
섬지캠핑장,2750931,레포츠,육상 레포츠,"야영장,오토캠핑장",http://tong.visitkorea.or.kr/cms/resource/23/2750923_image2_1.jpg,전라남도,127.589505249,35.2038549758,"섬지캠핑장은 구례군 토지면 외곡리에 위치한 캠핑장으로 지리산과 섬진강에 둘러싸여 있다. 수려한 경치를 자랑하는 이곳은 소나무 숲이 있어서 무더운 여름에도 시원하게 야영을 즐길 수 있고 수영장과 인근 계곡에서 더위를 식힐 수 있다. 일반야영장 17면을 갖췄다. 무엇보다 전 사이트가 무성한 나무로 그늘졌다는 점에서 쾌적함은 전국 어느 캠핑장과 비교해도 뒤지지 않는다. 가족단위로 어린이들이 깨끗한 공기와 물놀이를 즐기기에 좋은 환경으로 가족 단위로 즐기는 것을 추천하며 반려동물과 동반 입장이 가능하다. 섬지캠핑장의 장점 중 하나는 섬진강의 레포츠를 즐길 수 있다는 점인데 래프팅, 서바이벌, 카약 등 각종 레저를 이용할 수 있으며 캠핑장 이용 고객에게는 할인해준다. 인근엔 지리산 둘레길과 화엄사, 쌍계사 등의 유명사찰, 최참판댁, 화개장터 등 관광명소가 가까이 있어서 관광과 휴식을 모두 즐길 수 있는 캠핑장이다.","<a href=""http://seomji.modoo.at"" target=""_blank"" title=""새창 : 섬지캠핑장 사이트로 이동"">http://seomji.modoo.at</a>"
섬진강,128086,자연,자연관광지,강,,전라남도,127.1942010291,35.3198433796,"섬진강은 우리나라 4대강의 하나로 멀리 임실, 순창을 발원지로 하여 곡성군 옥과면 합강리에서 옥과천과 합류하고 곡성읍 동산리에서 남원에서 내려오는 요천수와 합류하게 되며 오곡면 압록리에서 보성강과 또다시 합류하여 구례와 하동을 거쳐 남해로 흐르게 된다. 섬진강이 곡성군을 경유하는 거리는 36km 정도 되며 곡성에서는 순자강이라고도 한다. 주변에는 크고 작은 골짜기가 많아 풍광이 아름답고 나룻배 체험공간과 강변 자전거투어코스가 있으며 특히 임진왜란시 청계 양대박장군이 의병들을 훈련하였던 장소인 청계동 계곡을 비롯한 호국과 관련된 많은 유적이 있으며 마천목 장군의 효심 어린 도깨비살, 심청 생가터 등이 모두 섬진강변에 위치하여 연중 많은 관광객들이 찾고 있다. 이밖에도 국가 보호습지로 지정된 침실습지와 섬진강변유원지와 압록유원지에서는 캠핑도 가능하다. 가정역의 증기기관차, 레일바이크, 섬진강의 래프팅 등 즐길거리들도 풍부하여 자연과 인문적인 즐거움을 함께 즐길 수 있다. 내수면 어종이 풍부하여 강태공들의 발길이 끊이지 않아 섬진강은 명실공히 곡성군의 젖줄로 거듭나고 있다.","<a href=""https://www.gokseong.go.kr/tour/tourist/9tour/seomjin_wetlands"" target=""_blank"" title=""곡성 문화관광 사이트로 이동"">http://www.gokseong.go.kr/tour</a>"
섬진강,1610774,자연,자연관광지,강,http://tong.visitkorea.or.kr/cms/resource/52/2514252_image2_1.jpg,전북특별자치도,127.1890371411,35.3376773859,"섬진강은 전라북도 진안군 백운면 신암리 팔공산의 서쪽 계곡에서 발원하여 북서쪽으로 흐르다가 정읍시와 임실군의 경계에 이르러 갈담 저수지를 이룬다. 순창, 곡성군, 구례군을 남동쪽으로 흐르며 하동군 금성면과 광양시 진월면 경계에서 광양만으로 흘러든다. 지리적으로는 전라남도와 전라북도, 경상남도의 3도에 걸쳐 있고 역사적으로는 고대 가야문화와 백제문화의 충돌지대, 신라와 백제의 경계, 임진왜란과 정유왜란 때는 왜군의 침입경로였으며 조선시대 말기에는 동학농민전쟁이 승화되기도 한 장소이다. 주요 지류로는 정읍시 산내면에서 합류되는 추령천을 비롯해 일중천, 오수천, 심초천, 경천, 옥과천, 요천, 수지천, 보성강, 황전천, 서시천, 가리내, 화개천, 횡천강 등이 있다.<br /><br />본래 섬진강의 이름은 모래가 고와 두치강, 모래가람, 모래내, 다사강, 대사강, 사천, 기문하 등으로 불렸으며, 고려시대인 1385년(우왕11)경 섬진강 하구에 왜구가 침입하자 수십만 마리의 두꺼비 떼가 울부짖어 왜구가 광양 쪽으로 피해 갔다고 하는 전설이 있어 이때부터 두꺼비 섬(蟾)자를 붙여 섬진강이라 했다고 한다. 하류의 하동군 화개면 운수리에는 840년에 중창된 신라의 고찰인 쌍계사와 불일암, 불일폭포가 있다. 명산물로는 은어와 참게를 들 수 있다.<br>","<a href=""http://tour.sunchang.go.kr"" target=""_blank""title=""순창군 문화관광 사이트로 이동"">http://tour.sunchang.go.kr</a>"
섬진강,2923397,음식,음식점,한식,http://tong.visitkorea.or.kr/cms/resource/74/2923374_image2_1.jpg,전북특별자치도,127.1594070635,35.5292885174,"생생정보통, 생방송오늘저녁, VJ특공대 등에 소개된 다슬기 요리 전문점이다. 평범한 동네 식당처럼 보이지만, 맛집으로 소문난 만큼 항상 손님들로 북적인다. 식당 앞에 주차장이 있어 주차 걱정 없이 편하게 방문할 수 있다. 다슬기 코스A, B와 다슬기정식, 다슬기탕, 다슬기손수제비 등 다양한 다슬기 요리를 맛볼 수 있다. 특히 껍질째 갈아 만드는 국물은 영양가가 높아 국물까지 다 마실 것을 추천한다. 필봉문화촌, 섬진강댐 수변공원 등이 가까이에 있어 연계 관광하기 수월하다.",
섬진강 다슬기,1349170,음식,음식점,한식,,전라남도,127.5260415706,35.1969518722,어르신 네 분이 방에 앉아 다슬기 까기에 한창이다. 이쑤시개 같은 도구로 하나하나 살을 빼내는 손동작이 예사롭지 않다. 빼낸 살만 모아놓으니 이름 있는 중견 미술가의 칠보공예작품처럼 빛깔이 곱고 아름답다. 구례군 토지면 소재지에 있는 다슬기 음식 전문점 섬진강의 작업 방 풍경이다. 이 집에서 가장 인기 있는 다슬기 수제비의 반죽은 당일 기온에 따라 반죽 숙성 시간이 좌우될 수 있기 때문에 주인장이 심혈을 기울여 반죽한다.,
섬진강 대나무숲길,2714103,레포츠,육상 레포츠,트래킹,,전라남도,127.465308304,35.1863492369,길을 걷다 보면 몸과 마음이 치유되는 기분이 드는 구례군 섬진강 대나무 숲길은 구례의 대표 명소이다. 푸릇푸릇한 대나무 숲길을 지나오면 생태탐방로에서는 코스모스와 야생화가 반긴다. 풀과 강이 있는 섬진강 길을 따라 걷다 보면 힐링 되는 생태탐방로를 걸어볼 수 있는 곳이다.,"<a href=""https://www.gurye.go.kr/tour/main.do"" target=""_blank"" title=""새창: 섬진강 대나무숲길 홈페이지로 이동"">https://www.gurye.go.kr/tour/main.do</a>"
섬진강 도깨비마을,2022313,인문(문화/예술/역사),체험관광지,농.산.어촌 체험,http://tong.visitkorea.or.kr/cms/resource/77/3378077_image2_1.JPG,전라남도,127.3626322933,35.2536843094,"섬진강 도깨비마을은 유아숲 체험원으로 이루어진 우스깨비터(공원)과 도깨비전시관, 숲으로 이루어져 있으며, 책과 놀이 , 체험과 인형극으로 호기심과 상상력을 끝없이 펼쳐 볼 수 있는 곳이다. 도깨비숲길과 계곡 그리고 오름나무, 밧줄놀이, 해먹, 짚라인, 모래놀이, 숲화덕, 등의 숲놀이터와 트리하우스(둥둥나무집)을 갖추고 다양한 숲교육 활성화에 앞장서고 있다. 

(출처 : 도깨비마을 홈페이지)","<a href=""https://dokaebimaeul.modoo.at/""target=""_blank"" title=""새창: 섬진강 도깨비마을"">https://dokaebimaeul.modoo.at/</a>"
섬진강 따라 흐르는 그리움,1874091,추천코스,도보코스,도보코스,http://tong.visitkorea.or.kr/cms/resource/42/219742_image2_1.jpg,Unknown,127.1097293693,35.5891836471,"섬진강 상류인 옥정호는 <한국에서 가장 아름다운 길>로 선정된 바 있는 운치 있는 드라이브코스다. 옥정호를 한 바퀴 돌아 섬진강댐을 둘러본 후 섬진강 물줄기를 따라 소박하게 살아가는 마을을 직접 걸어본다. 김용택 시인의 고향 진뫼마을을 지나 물소리, 새소리가 사람의 목소리보다 크게 울리는 오지마을 구담마을까지 걷는 코스다.",
"섬진강 따라, 녹차향 따라",2656788,추천코스,힐링코스,힐링코스,,Unknown,127.8934009321,34.9834489682,우리나라에서 최초의 차 시배지인 하동에서 신선한 녹차를 맛보고 최근 새로운 랜드마크로 떠오른 스타웨이에서 평사리 들판과 섬진강의 아름다운 풍경을 한눈에 담아보자.,
섬진강 래프팅 투어,3002185,레포츠,수상 레포츠,래프팅,,전라남도,127.5883970845,35.2011024884,"우리나라에서 4번째로 큰 강, 섬진강에 위치한 섬진강 래프팅투어이다. 대한민국 5대강(한강, 낙동강, 금강, 영산강, 섬진강)은 수상 레포츠는 활성화되어 있지만 래프팅은 전무하다. 그러나 섬진강은 5대강 중 유일하게 래프팅이 가능한 곳이다. 국내 유일의 청정하천인 섬진강에서의 래프팅은 물살은 약하지만 강가의 풍경을 감상하며 안전하게 즐길 수 있다. 
섬진강의 격렬한 급류를 원하는 젊은 층과 마니아들에게는 다소 단조롭지만, 풍부한 물과 인근의 관광지를 끼고 있어 가족 단위 놀이객들에게 적합하다. 래프팅은 가족, 친구, 회사 모임 등 서로간의 자긍심과 결속력을 높여주는 스릴 있고 신나는 스포츠이다. 
이곳에서는 래프팅뿐만 아니라 바나나보트, ATV, 서바이벌 게임, 투명 카약 등 다양한 체험 프로그램이 있으며 당일 패키지, 숙박 패키지, 물놀이 패키지를 통해 식사와 숙박 등을 선택할 수 있다.","<a href=""http://www.sgrt.co.kr/"" target=""_blank"" title=""새창 : 홈페이지로 이동"">http://www.sgrt.co.kr/</a>"
섬진강 마실휴양숙박시설단지,2749522,레포츠,육상 레포츠,"야영장,오토캠핑장",http://tong.visitkorea.or.kr/cms/resource/47/2750047_image2_1.jpg,전북특별자치도,127.2011856927,35.4604248175,"섬진강 마실휴양숙박시설단지는 전라북도 순창군에 섬진강과 용궐산이 한눈에 보이는 곳에 자리하며 야영장과 펜션을 함께 운영하고 있다. 자동차 야영장 사이트 34면을 갖추고 파쇄석 바닥 12면, 데크 바닥 22면이다. 온수가 잘 나오는 샤워장, 개수대, 화장실 등 편의시설이 갖추어져 있다. 텐트와, 릴선, 화로대를 대여해 주며 장작을 판매한다. 매점을 운영하고 있어서 캠핑에 필요한 물품을 구입하기에 편리하며 반려동물 출입은 불가하다. 주변에 섬진강 변을 따라 달리는 자전거 종주길이 있고 예향천리 마실길, 순창 생태탐방로 등이 있어서 트레킹 하기에 좋다. 특히 생태탐방로 주변에서 왜가리를 쉽게 목격할 수 있다.","<a href=""https://blog.naver.com/happyinki1"" target=""_blank"" title=""새창 : 섬진강 마실휴양숙박시설단지 사이트로 이동"">https://blog.naver.com/happyinki1</a><br><a href=""https://www.instagram.com/masilcamp""target=""_blank"" title=""새창 : 업체인스타그램 이동"">https://www.instagram.com/masilcamp</a>"
섬진강 예향천리마실길,2712761,레포츠,육상 레포츠,트래킹,,전북특별자치도,127.2011856927,35.4604248175,"예향천리 마실길은 용궐산과 벌동산을 사이에 두고 섬진강을 끼고 도는 코스로 자연 그대로 보존되어 있어 트레킹을 즐기는 이들에게 인기가 많으며, 전체 길이가 약 20km에 이르는데 길이 전반적으로 평탄하고 걷기 좋아 반려견과 함께 산책하면서 자연을 즐길 수 있다. 또한 명종(1547)때 학자였던 양사형이 지은 정자인 어은정과 고려시대의 마래여래 좌상인 석산리 마래여래좌상 등 역사적인 유적, 지역의 수호신으로 여겨지는 요강바위, 맑고 깨끗한 강물로 물놀이 장소로 인기가 많은 장군목, 섬진강을 가로지르는 현수교 등 매력적인 볼거리가 가득하다.

※ 코스 시종점 주소: 순창군 적성면 석산리 산138-1","<a href=""https://www.sunchang.go.kr/tour/index.sunchang?menuCd=DOM_000000401007003000""target=""_blank"" title=""순천문화관광"">https://www.sunchang.go.kr</a>"
섬진강 자전거하이킹,131768,레포츠,육상 레포츠,자전거하이킹,http://tong.visitkorea.or.kr/cms/resource/88/2032588_image2_1.jpg,전라남도,127.3697378852,35.2278345717,"곡성읍에서 국도 17호선을 따라 구례 방면으로 약 11km 지점에 사람만이 다닐 수 있는 빨간색으로 단장된 구름다리(두가현수교)가 있다. 이 구름다리를 건너면 잔디광장으로 가꾸어 놓은 청소년야영장이 있고 바로 옆으로 섬진강 자전거 하이킹 코스와 발 지압장이 있다. 청소년야영장에서 자전거를 대여 받아 시간 제약 없이 마음껏 자전거를 탈 수 있는데 섬진강의 아름다운 강줄기를 따라 페달을 밟으며 들이며 산이며 곤충들을 보고 느낄 수 있고, 건강한 몸도 가꿀 수 있는 최상의 체험공간이다. 또한 전국적인 별미로 인정받은 섬진강변 민물 참게매운탕과 은어구이(회)등을 맛볼 수 있다.<br>","<a href=""https://www.gokseong.go.kr/tour/experience/course/hiking"" target=""_blank"" title=""새창 : 곡성 문화관광 홈페이지로 이동"">https://www.gokseong.go.kr/tour</a>"
"섬진강(천담,구담)",127924,자연,자연관광지,강,http://tong.visitkorea.or.kr/cms/resource/25/1678725_image2_1.jpg,전북특별자치도,127.1905971118,35.4848607562,"섬진강 상류에서 가장 아름다운 강 풍경을 꼽자면 진메에서 천담을 지나 구담에 이르는 구간이며, 마을에서 내려다보이는 강 풍경이 실로 절경이다. 여기에 봄이면 마을 입구에서부터 마을 뒤까지 심어놓은 매화가 만개해 강보다 더 아름다운 풍경을 만들어낸다고 하여 섬진강에서 봄이 가장 아름다운 곳으로 소문이 나 있다. 지금은 천내리와 구담리가 합쳐져 행정구역상 천담리가 됐지만, 마을 사람들은 천담과 구담을 혼용해 부르는데 이 모두 물과 관련된 지명으로 활처럼 휘어 흐르고 못처럼 깊은 소가 많다고 해서 천담마을, 강줄기에 아홉 곳의 소가 있다고 해서 구담마을이라 한다.

천담마을에는 동자바위 이야기가 전해 내려오는데 사냥길에 한 처녀에게 반한 총각이 처녀를 다시 보러 가다가 두꺼비나루가 범람하여 가지 못하고, 두 사람이 상사병을 앓다가 끝내 죽게 되었다는 이야기로 총각이 죽은 후 마을 앞에는 동자 바위가, 나루 건너에는 총각을 그리워하다가 죽은 여인의 바위가 생겨났다고 한다. 그러나 두 바위는 공사로 인해 사라졌고 동자바위가 다시 복원되어 이 이야기를 전해주고 있다. 이곳은 섬진강 상류 수계로 맑은 공기와 깨끗한 물이 자랑이기도 하며, 강을 낀 풍경을 보며 힐링할 수 있는 가족 단위 휴식처로 안성맞춤이다.","<a href=""https://www.imsil.go.kr/tour/index.imsil?menuCd=DOM_000000201003001001""새창 : 임실 문화관광"">https://tour.imsil.go.kr/</a>"
섬진강곡성래프팅,2787114,레포츠,수상 레포츠,래프팅,http://tong.visitkorea.or.kr/cms/resource/12/2789612_image2_1.jpg,전라남도,127.3720708123,35.2356476195,"섬진강의 래프팅 코스는 구례와 곡성으로 나뉜다. 이중 곡성 코스는 수량은 다소 적지만 전형적인 한국의 강촌 풍경을 감상할 수 있으며, 중간중간의 모래톱에서 휴식을 취하며 래프팅을 즐길 수 있는 곳으로 소문나 있다. 곡성 지역의 섬진강 래프팅은 기차 마을과 레일바이크의 종착지로 유명한 가정역 앞에서 출발한다. 야영장과 천문대가 있고, 농촌체험 마을과 펜션촌이 있는 휴양지다. 야영장 앞 강변에서 출발한 래프팅은 먼저 넓은 여울에서 한차례 놀이를 하다가 크고 작은 바위틈을 휘돌아 압록강변 유원지에 닿는다. 아름다운 경치와 잔잔한 물길에서 물놀이하기에 제격인 장소다.","<a href=""http://www.gsrafting.co.kr/index.php"" target=""_blank"" title=""새창 : 곡성래프팅 홈페이지로 이동"">http://www.gsrafting.co.kr/</a>"
섬진강기차마을,128578,인문(문화/예술/역사),체험관광지,농.산.어촌 체험,,전라남도,127.3082975874,35.2775723415,"1999년 4월 군 역점시책 중 하나인 치포치포 섬진강 나들이 관광열차 행사가 시작된 이래 고달면 가정리가 곡성군 관광명소로 새롭게 부상했다. 옛날에 실제로 운행하던 증기기관차의 모습을 그대로 복원하여 옛 곡성역(섬진강 기차마을)에서 가정역까지 10km 구간을 왕복 운행하는 기차이다. 섬진강 기차마을에는 맑고 깨끗한 섬진강이 흐르고 구 철로(폐선)를 이용한 기차가 달리며, 배를 타고 강을 건너는 나루터가 2개소가 있고, 국도 17호선과 전라선 철도, 섬진강 등 3선이 진풍경을 이루는 호남 최고의 드라이브 코스로서 주변에는 잔디광장과 원두막, 디딜방아, 수차, 코스모스 꽃길 등 환상의 섬진강변 자전거 하이킹 코스가 펼쳐져 있다. 섬진강을 따라 봄의 신록과 도로변의 꽃들이 만들어 내는 풍경을 느린 속도로 만끽할 수 있다.","<a href=""https://www.railtrip.co.kr/homepage/gokseong/index.php"" target=""_blank"" title=""새창: 곡성 섬진강 기차마을 홈페이지로 이동"">https://www.railtrip.co.kr/homepage/gokseong/</a>"
섬진강댐,1185879,인문(문화/예술/역사),건축/조형물,유명건물,http://tong.visitkorea.or.kr/cms/resource/95/3061495_image2_1.jpg,전북특별자치도,127.1116804032,35.5423917655,"섬진강댐은 전라북도 임실군 강진면에 조성된 콘크리트 중력식 댐이자 우리나라 최초의 다목적댐으로 1965년 12월 완공됐다. 섬진강 상류의 강진면 용수리와 정읍시 산내면 종성리 사이를 가로지르는 이 댐은 동진강 하류와 계화도 간척지에 농업용수를 공급하고, 호남 지방의 전력난 해소에 도움을 주는 시설이다.
댐 주변으로 국토종주 자전거길이 지나가 자전거를 탄 사람을 많이 볼 수 있다. 또, 섬진강댐 인근에 있는 섬진강댐 물 문화관에서 섬진강의 역사와 물 자원에 관련된 전시물을 관람할 수 있다.","<a href=""https://www.kwater.or.kr/water/sub01/sub05/50043037/intro.do?s_mid=1382&s_officecode=20040038&s_flag=1&brdId=KO27"" target=""_blank"" title=""새창"">https://www.kwater.or.kr/water/</a>"
섬진강댐 물 문화관,2469189,인문(문화/예술/역사),산업관광지,기타,,전북특별자치도,127.1100900042,35.6063733697,"임실에 위치한 섬진강댐 물 문화관은 섬진강의 역사, 섬진강 댐과 물자원에 대한 전시물들을 관람할 수 있는 곳이다. 운암대교에서 국사봉전망대로 향하는 드라이브 코스의 시작점으로 꼭 한번 들러볼 만하다. 특별히 다른 것을 하지 않더라도 주변에 있는 옥정호의 아름다운 풍광을 보러 방문하는 보람이 있다.","<a href=""https://www.kwater.or.kr/cust/sub02/sub02/sub04/promotion58Page.do?s_mid=1700""target=""_blank"" title=""섬진강댐 물 문화관"">https://www.kwater.or.kr/</a>"
섬진강레일바이크,2032322,레포츠,육상 레포츠,트래킹,http://tong.visitkorea.or.kr/cms/resource/84/2032584_image2_1.jpg,전라남도,127.3491555651,35.2591223517,"섬진강 레일바이크는 가정역을 시작으로 봉조반환점 순환하는 약 3.6km 코스로 약 30분 소요가 된다. 남녀노소 누구나 어렵지 않게 탑승할 수 있어 아이들과 함께 추억을 만들기에 좋다. 좌측으로 보이는 섬진강은 마음을 뻥 뚫리게 하며, 오르막 구간에는 견인장치가 설치돼 있어 힘들이지 않고 섬진강의 아름다운 풍광을 맘껏 즐길 수 있다.<br>","<a href=""http://www.railtrip.co.kr/homepage/gokseong/"" target=""_blank"" title=""새창 : 곡성 레일바이크 홈페이지로 이동"">http://www.railtrip.co.kr/homepage</a>"
섬진강메기매운탕,2867192,음식,음식점,한식,http://tong.visitkorea.or.kr/cms/resource/87/2867187_image2_1.JPG,경기도,126.9655741829,37.6923588245,"섬진강메기매운탕은 경기도 양주시에 위치한 매운탕 전문점이다. 메기와 미나리, 수제비, 각종 야채에 양념을 넣고 푹 끓여낸 메기매운탕 단일 메뉴만 판매하고 있다. 건강을 위해 보양식으로 먹기 위해 찾는 사람도 많다. 인터넷으로 매운탕 밀키트를 판매하고 있다.","<a href=""https://www.sumjingang.com/"" target=""_blank"" title=""새창 : 섬진강메기매운탕 홈페이지로 이동"">https://www.sumjingang.com/</a>"
