title,contentid,cat1,cat2,cat3,firstimage,region,mapx,mapy,overview,homepage
석정온천휴스파,2778917,인문(문화/예술/역사),휴양관광지,온천/욕장/스파,http://tong.visitkorea.or.kr/cms/resource/25/2780625_image2_1.jpg,전북특별자치도,126.7410244472,35.4320812865,"석정온천휴스파는 게르마늄이 함유된 온천수를 100% 사용하여 치유 온천수로 명성이 높아 온천의 즐거움과 건강을 함께 선사하는 곳이다. 온천수에 함유된 게르마늄 성분은 노화 방지 및 신진대사 활성화와 고혈압, 당뇨병, 신경통 등에 뛰어난 효능이 있다. 스파는 기포탕, 플로팅, 넥 샤워, 보행 유수풀 등이 구성돼 있다. 피로를 풀어주는 실내 스파와 여름이 되면 즐길 수 있는 슬라이드, 유아 풀, 성인풀, 홍삼탕, 복분자탕 등이 구성된 야외 스파로 구성되어 있다. 2,000명이 동시 이용할 수 있는 라커룸과 푸드코트, 수유실, 휴게공간 등 다양한 편의시설이 있어 쾌적하고 여유롭게 즐길 수 있다.","<a href=""https://www.huespapension.com:450/"" target=""_blank"" title=""새창 : 석정온천휴스파 사이트로 이동"">https://www.huespapension.com:450/</a>"
석정원숯불갈비,2576379,음식,음식점,한식,,경상남도,128.5811710251,35.2047863881,"경남 창원시에 위치한 숯불갈비 전문점이다. 돼지숯불갈비뿐만 아니라 소양념갈비와 삼겹살도 맛볼 수 있다. 
단체석과 주차시설이 완비되어 있어 단체 모임 하기에도 좋으며 아이들을 위한 놀이방도 이용할 수 있어 가족과 함께 방문하기에 좋다. 사전 예약도 가능하다.",
석정힐 CC,2778925,레포츠,육상 레포츠,골프,http://tong.visitkorea.or.kr/cms/resource/15/2781515_image2_1.jpg,전북특별자치도,126.7416299989,35.4301065205,"국내 최초로 온천을 겸비한 18홀 대중골프장으로, 플레이 후 게르마늄 온천으로 쌓인 피로를 한순간에 풀 수 있다. 비기너에서부터 로우 핸디까지 남녀노소 누구나 즐길 수 있는 가족형 골프장이다. 산악 지형과 평야 제대로 확연하게 구분되는 코스이다. 마운틴 코스는 산과 계곡이 조화가 잘 이루어져 전략적, 도전적인 플레이를 할 수 있다. 레이크 코스는 드넓은 평야에서 아름다운 경치를 즐기며 잔잔하고 침착한 플레이를 할 수 있다. 호남의 3대 명산 방장산의 기운을 골프장에서도 고스란히 느낄 수 있으며, 호텔 석정 힐이 있어 숙박도 해결할 수 있다. 코스 내에 다양한 수목이 자리하고 있어 계절마다 보는 재미가 있으며, 부대시설로는 클럽하우스, 그늘집, 락커, 대식장, 프로숍 등이 있다.","<a href=""http://www.hillcc.com/"" target=""_blank"" title=""새창 : 석정힐 CC 사이트로 이동"">http://www.hillcc.com/</a>"
석조보살좌상,2772699,인문(문화/예술/역사),역사관광지,유적지/사적지,http://tong.visitkorea.or.kr/cms/resource/65/3410465_image2_1.JPG,강원특별자치도,128.6029831025,37.7189028985,"최근까지 월정사 팔각구층석탑을 향하여 놓여 있던 석조보살좌상이다. 1.8m의 크기이다.
두부가 강조되고 하체가 빈약한 점 등 고려시대에 명주라고 통칭되던 강릉의 한송사지, 신복사지 보살상들과 비교하여 신체의 비례가 맞지 않고 경직된 감이 있다. 화려하고 섬세한 장식적인 표현에서는 중국 송나라 조각상의 느낌이 전해지는데 대략 고려전기인 11세기 초에 제작되었을 것으로 추측된다. 연산 개태사의 석조공양보살좌상, 신복사지 석조보살좌상처럼 고려초에 유행했던 것으로 보이는 탑 앞의 공양보살좌상으로 연대가 서로 비슷하여 강원특별자치도 명주 지방에 독특한 불상 조각의 유파가 있었던 것을 시사하며, 고려시대 화엄계통 사원에서 만든 특징을 보여주는 대표적인 작품이며, 당대 불교사상을 밝힐 수 있는 귀중한 자료이다.

(출처 : 평창군 문화관광 홈페이지)","<a href=""https://wjssm.kr/ target=""_blank"" title=""새창 : 홈페이지로 이동"">https://wjssm.kr</a>"
석조부도,1116430,인문(문화/예술/역사),역사관광지,사찰,http://tong.visitkorea.or.kr/cms/resource/04/3348604_image2_1.jpg,대구광역시,128.6138771954,35.8887070963,"경북대학교 박물관 야외에 대구 산격동 연화 운룡장장식 승탑과 대구 산격동 사자주악장식 승탑 2기의 석조부도가 있다. 두 석조부도 모두 대구의 일본인 사택에 있던 것을 1958년 현재의 위치인 경북대학교 야외 박물관으로 옮긴 것으로 원래 승탑이 세워진 터와 이 승탑의 주인공은 알 수 없는 상태이다.
'대구 산격동 연화 운룡장식 승탑'은 고려시대 팔각원당형부도의 특징이 잘 발휘된 걸작품으로 탑신, 옥개에 비해 기단부가 비대한 감이 있으나 안정되고 장중한 느낌을 준다. 지대석 위에 하대, 중대, 상대가 있으며 하대석과 중대석에서 고려시대의 특징이 가장 잘 나타나 있다. 중대석은 8각으로 원에 가까운 표면에 용문이 조각되었는데 당시 장인의 예술 감각을 엿보게 한다. 하대석은 방형으로 각면에(6판씩 24판) 조각되어 있다. 8각의 탑신석각면에는 우주가 있고 4면에 사천왕입상이 조각되었다. 옥개석도 8각으로 상부에 우동이 뚜렷하고 경사가 급하다. 상륜부에는 연꽃이 조각된 보륜형의 돌이 얹혀져 있다. 전체적인 높이는 274cm이며 지대석의 너비는 157cm이다.
'대구 산격동 사자 주악장식 승탑'은 8각의 평면을 기본으로 삼아 각 부분을 이루고 있으며, 3단으로 이루어진 기단위에 탑신을 올리고 지붕돌을 얹은 형태이다. 네모진 바닥돌 위에 올려진 기단은 아래·가운데·윗받침돌로 나뉘어지는데, 아래받침돌 옆면에는 사자를 새겨 놓았고 윗면에는 구름을 입체적으로 조각하였다. 낮은 가운데 받침돌은 모서리를 죽이고 각 면마다 악기를 연주하는 모습을 새겼다. 윗받침돌은 가운데 띠를 돌리고 아래·윗면에 소박하면서도 큼직한 연꽃을 조각하였다. 사리를 모셔놓은 탑신은 낮은 편이며, 모서리에는 기둥 모양을 새기고 앞·뒷면에는 자물쇠가 달린 문짝 모양을 나머지 면에는 사천왕상과 보살상을 조각하였다. 넓은 지붕돌은 밑면에 향로와 비천상을 아름답게 새겼으며, 처마부분은 목조건축의 지붕양식을 따라 2중의 서까래를 촘촘히 본뜬 조각이 있다. 윗면에는 연꽃이 둘러져 있으며 그 위의 4면에는 불교의 낙원에 산다는 새인 가릉빈가를 조각한 노반(머리장식 받침)이 올려져 있다. 이 승탑은 지붕돌 일부가 깨지고 온전한 상태로 남아 있지는 않지만, 위아래의 비례가 잘 맞아 아름다운 작품이다. 각 부분의 조각이 웅장하고 뛰어나며 고려시대의 특징이 잘 나타나 있다.","대구 산격동 연화 운룡장식 승탑<br><a href=""https://www.heritage.go.kr/heri/cul/culSelectDetail.do?ccbaCpno=1122201350000&pageNo=1_1_1_1&sngl=Y"" target=""_blank"" title=""새창 : 국가유산청 홈페이지로 이동"">https://www.heritage.go.kr</a><br>대구 산격동 사자 주악장식 승탑<br><a href=""https://www.heritage.go.kr/heri/cul/culSelectDetail.do?ccbaCpno=1122202580000&pageNo=1_1_1_1&sngl=Y"" target=""_blank"" title=""새창 : 국가유산청 홈페이지로 이동"">https://www.heritage.go.kr</a>"
석종사(충주),318240,인문(문화/예술/역사),역사관광지,사찰,http://tong.visitkorea.or.kr/cms/resource/62/3061862_image2_1.jpg,충청북도,127.9695906508,36.9485714935,"석종사는 충주시의 외곽의 금봉산 자락에 위치하고 있는 조계종 소속의 사찰이다. 정면 5칸, 측면 3칸의 대웅전과 정면 3칸, 측면 2칸의 오화각 및 범종각, 소소원(선방), 안양원, 금봉암, 조종육엽(조실채), 금봉선원, 감로각, 천척루(누각), 회명당(후원), 원흥료(종무소) 등으로 구성되어 있다. 이곳은 출가한 승려만을 위한 공간을 지양하고, 재가자 역시 사찰에 몸담아 수행할 수 있도록 공간을 조성하고 있다. 또한 템플스테이를 통해 일반인들도 조용히 수양하고 참선하며 불교에 대해 알 수 있는 기회를 제공하고 있으며 불교대학을 운영함으로써 불자와 일반인들에게 체계적인 교육을 통해 부처님의 가르침을 전한다. 이 밖에도 불설사십이장경, 인천안목 권상과 같은 여러 문화재를 소장하고 있다.","석종사 <a href=""http://www.sukjongsa.org/"" target=""_blank"" title=""새창 : 석종사 홈페이지로 이동"">http://www.sukjongsa.org</a><br /><a href="" https://www.templestay.com/temple_info.asp?t_id=seonmaster "" target=""_blank"" >☞ 템플스테이 보러가기 </a>"
석죽재물고기나무,2846098,음식,음식점,카페/전통찻집,http://tong.visitkorea.or.kr/cms/resource/87/2846087_image2_1.jpg,경기도,126.694815688,37.7874373453,"석죽재물고기나무는 경기도 파주시 탄현면 헤이리 예술마을에 있는 어린이 체험 카페이다. 토끼에게 당근 먹이를 주는 체험을 할 수 있으며, 목각 단청 체험, 포크레인 체험도 경험할 수 있는 이색 카페이다. 토끼 종류도 흰색, 회색, 갈색, 얼룩무늬 등 다양하며, 카페 이용 후 토끼가 있는 곳인 토끼굴로 무료입장할 수 있다. 직접 토끼 우리 안으로 들어가서 토끼를 손으로 만져볼 수 있고 당근을 줄 수 있어 아이들이 좋아하는 곳이다.",
석천,1373934,음식,음식점,일식,,전라남도,127.7322744971,34.9402982197,"백운쇼핑센터 2층에 자리한 석천은 광양시에서 지정한 모범음식점이다. 회는 살아 있는 듯 싱싱해 입안 가득 바다 향이 퍼진다. 또 매콤하게 양념한 장어는 장어 특유의 비릿한 맛이 없고 느끼하지 않다. 깨를 듬뿍 뿌려 고소한 맛을 더했다. 바삭한 튀김옷을 입은 새우도 담백하고, 각종 해산물을 서비스로 제공해 푸짐하기까지 하다. 점심 특선인 회 정식은 알밥, 초밥, 튀김 등 곁들이 음식까지 저렴한 가격에 맛볼 수 있어 특히 손님들이 많이 찾는다.",
석천계곡,126692,자연,자연관광지,계곡,,경상북도,128.7337542576,36.8999191605,"태백산(1,567m)에서 발원한 물이 응방산과 옥적봉을 지나 유곡리에 이르러 발달한 계곡이다. 나지막한 산세 때문에 골이 깊지 않고, 폭이 넓으며 계곡물 또한 깊지 않아 어린이를 동반한 피서지로 적합하다. 
계곡에는 조선 중기 문신인 충재 권벌이 1526년(중종 21)에 지은 청암정이 있고 권벌의 종손인 청암 권동보가 유명한 봉화 중곰솔(춘양목)로 지은 석천정사가 있다. 계곡 아래에는 충재 권벌의 유적이 있는 닭실마을이 있고, 이 유적을 중심으로 계곡을 포함한 일대가 봉화 청암정과 석천계곡(명승 제60호)으로 지정되어 있다. 
마을 이름이 닭실인 것은 동쪽의 옥적봉이 수탉을 닮고, 서쪽의 백운령이 암탉을 닮았기 때문이라고 한다.
주변에 한국에서 가장 넓은 청옥산자연휴양림(구역 면적 1억 53만㎡)과 열목어의 남방한계선인 백천계곡, 청량산도립공원 등을 비롯하여 봉화 여기저기에 한수정, 도암정, 갈천정, 야옹정, 사덕정 등 100여 채의 정자가 있다.","봉화 문화관광 <a href=""http://www.bonghwa.go.kr/open.content/tour/"" target=""_blank"" title=""봉화 문화관광 사이트로 이동"">http://www.bonghwa.go.kr/open.content/tour/</a>"
석천명동점,2862691,음식,음식점,한식,http://tong.visitkorea.or.kr/cms/resource/85/2862685_image2_1.JPG,경상남도,129.1637038267,35.3962700449,"양산 덕명로에 있는 석천 명동점은 연탄 석쇠불고기 맛집이다. 석쇠 돼지불고기 단일 메뉴로 평일, 주말 점심시간에 방문하면 줄 서서 먹는 곳이다. 불고기 주문 시, 밥은 포함되지 않고 별도로 일반 밥, 가마솥 밥 중 선택하여 주문하면 된다. 기본 찬으로 쌈 채소, 통마늘, 된장, 장아찌 등이 나오고, 셀프 반찬대에서 김치, 깻잎, 고추, 나물 등을 가지다 먹으면 된다. 밥도 처음 주문 후 셀프 반찬대에서 무제한으로 먹을 수 있다. 불향 가득 먹은 돼지고기는 파채 위에 올려져 나오고, 된장찌개도 함께 나온다. 불고기 주문 시 인당 1개 반찬으로 나오는 고추튀김이 별미로 인기가 많다. 고추튀김은 따로 추가 주문할 수 있다. 푸짐한 양과 맛으로 가성비 좋은 양산 맛집이다.",
석천사(여수),318242,인문(문화/예술/역사),역사관광지,사찰,http://tong.visitkorea.or.kr/cms/resource/79/3346479_image2_1.JPG,전라남도,127.7345011707,34.7584825358,"여수 마래산 중턱에는 충민사와 석천사가 있다. 충민사는 충무공 이순신장군을 기리기 위한 사당이고, 바로 옆에 위치한 석천사는 충민사의 수호사찰이다. 충민사 뒤편 큰 바위 아래 석천이라는 샘에서 유래한 이름이다. 정유재란이 끝난 3년 후(1601) 이순신장군과 함께 판옥선을 타고 종군한 승장 옥형 스님과 자운 스님이 이충무공의 인격과 충절을 잊을 수 없어 충민사 곁에 공의 넋을 추모하기 위한 암자를 건립하였다. 석천사에는 의승당이 있는데 임진왜란과 정유재란 때 나라를 위해 목숨을 바친 의승들의 넋을 기리기 위해 세운 것이다. 몇 해전 법당이 불에 타버려 정면 3칸 측면 2칸의 법당과 종각, 요사 등을 새로 짓고 보수했으나 충민사 정화 사업 때 법당과 요사의 원래 위치가 바뀌었고 일주문도 없어졌다. 충민사와 함께 둘러보면 좋고, 석천사가 있는 마래산은 여수 8경에 속하며 정상인 활공장에 오르면 탁 트인 바다와 여수시내, 그리고 오동도를 조망할 수 있다.","<a href=""http://www.scsa.or.kr/"" target=""_blank"" title=""새창 : 석천사 사이트로 이동"">http://www.scsa.or.kr</a>"
석천암(괴산),318255,인문(문화/예술/역사),역사관광지,사찰,http://tong.visitkorea.or.kr/cms/resource/21/3334521_image2_1.JPG,충청북도,127.9014462578,36.67266025,"석천암은 대야산 서쪽에 위치한 고찰로 구전에 의하면  ‘바위밑에서 약수가 나온다 하여 석천암으로 부른다’는 유래가 있어 석천암으로 부른다.
현재의 석천암은 보덕암에서 석천암으로 이름을 바꾼 사찰이며, 옛 석천암은 현재의 석천암 아래 삼송리 29번지에 있었다고 전해진다. 곧 원래의 석천암이 6.25 전란으로 법당이 소실되고, 1965년경 수해로 요사채가 소멸되어 폐사(廢寺)되었다. 이후 석천암 위에 있던 보덕암이 1985년경 화재로 소실되자 사찰을 신축하면서 ‘석천암’으로 이름을 바꾸었다는 것이다.
석천암은 1칸 크기의 대웅전과 산신각, 요사채가 있으며, 사찰에 면한 뒤쪽 암반에서 나오는 물을 사용하고 있다.","<a href=""https://www.goesan.go.kr/tour/selectTourInfo.do?key=887&tourNo=667&clgn="" target=""_blank"" title=""새창 : 홈페이지로 이동"">https://www.goesan.go.kr/tour/index.do</a>"
석천암(남양주),318243,인문(문화/예술/역사),역사관광지,사찰,,경기도,127.1013933454,37.6573792314,"석천암은 남양주시 별내면 화접리 불암산 자락에 있는 대한불교조계종 제25교구 본사인 봉선사의 말사이다. 신라 흥덕왕 때 지증 국사가 창건했다고 하지만 정확한 기록은 전하지 않는다. 1882년(고종 19)에 병역 제도의 개편으로 오위 제도가 해체되자, 오위장 이장군이 옛터에 암자를 짓고 수도하였다. 그 후 1922년에 거사 김한구가 낡은 건물을 수리하고 이곳에서 공부하였으며, 1956년에는 주지 창근 스님이 요사채를 중수하고, 1960년에는 법당을 세웠다. 또한, 석천암의 중심 커다란 암벽에는 중생 구제의 염원을 가진 미륵불이 새겨져 있다. 말법 시대 중생들의 귀의처인 이 미륵불은 1966년 설봉 스님이 조성한 것으로 오늘날 석천암의 상징이 되고 있다. 미륵불 앞 기도처는 동방 제일의 기가 강한 곳으로 이곳에서 정성을 다해 기도하면 한가지 소원은 꼭 들어준다는 이야기가 전한다. 
이 사찰은 2011년 의문의 화재로 2010년 4월 낙성된 52.23㎡(약 15.8평) 규모의 대웅전이 모두 소실된 사건이 있었다. 방화 사건으로 마무리된 후 2013년 재건하여 지금에 이른다. 
석천암은 불암산 등산코스에 있으며 불암사에서 석천암까지는 20분가량 가파른 산길과 암벽을 지나야 도달할 수 있다. 사찰에 가까워질수록 아래를 돌아보면 눈앞에 펼쳐지는 경치가 감탄을 불러일으키는 이곳은 불암산을 등반하는 길에 꼭 한번 들러봄 직한 아름다운 사찰이다.","<a href=""https://www.grandculture.net/namyangju/toc/GC08900955"" target=""_blank"" title=""새창 : 홈페이지로 이동"">https://www.grandculture.net</a>"
석천항,2747282,자연,자연관광지,항구/포구,,경기도,126.7869754584,37.0343764112,"경기도 화성시 기아자동차 공장 근처에 있는 아담한 항구이다. 붐비지 않는 항구에서 조용히 바다 구경을 하고 싶을 때 찾을 수 있는 곳으로 드라이브 코스로도 좋다.  단, 카페나 식당 같은 시설은 찾기 어렵다. 썰물 때는 갯벌 위에 정박해있는 어선들을 둘러볼 수 있고 배가 들어오면 트럭과 사람이 몰려 바쁘게 수산물을 실어 나르는 어촌 풍경을 구경 할 수 있다. 낙조를 감상할 수 있는 긴 방파제가 있어 간단한 취사도구를 가지고 와서 피크닉을 즐기기도 한다.",
석청,2576396,음식,음식점,한식,,경상남도,128.6977956847,35.1487781243,"정성이 담긴 음식과 편안한 휴식공간을 제공하는 석청은 한 자리에서 21년째 운영 중인 전통이 있는 음식점이다.
한우 생고기, 한돈 돼지고기만을 사용하는, 최고의 재료로 푸짐하고 정갈한 음식을 만들어 내고 있다. 한돈 삼겹살과 돼지갈비, 한우를 대표로 하여 뚝배기 불고기+된장찌개 정식, 갈치구이+된장찌개 정식도 점심 메뉴로 인기가 좋다.",
석촌별채,3103194,숙박,숙박시설,펜션,,서울특별시,127.1100939275,37.5116685416,"서울 송파동에 위치한 석촌별채는 오랜 구옥의 공간에 현대적 감성을 더한 레트로 감성이 충만한 숙소다. 포근한 침대와 침구류가 있는 침실 3개, 널찍한 주방, 깨끗한 욕실은 숙박객에게 편안한 휴식을 선사한다. 세탁기와 건조기가 있어 필요시 세탁을 할 수도 있다. 지하철 9호선 송파나루역이 도보 3분, 잠실역과 잠실 롯데타워가 도보 10분 거리에 있고, 송리단길, 석촌호수, 방이동 먹자골목도 가까워 여행의 편리함을 더해준다.","<a href=""https://www.airbnb.com/h/seokchonbyulchae"" target=""_blank"" title=""석촌별채(으)로 이동"">https://www.airbnb.com/h/seokchonbyulchae/</a>"
석탄사(정읍),318335,인문(문화/예술/역사),역사관광지,사찰,http://tong.visitkorea.or.kr/cms/resource/27/1605727_image2_1.jpg,전북특별자치도,126.9859687896,35.5637427413,"석탄사는 정읍의 칠보면 용태봉 석탄의 동봉 암벽에 자리 잡은 전통 사찰이다. 창건 연대는 잘 알 수 없으나 오래된 절이다. 신라 27대 선덕여왕 때 의상대사가 창건했다고도 한다. 선조 때 임신과 정유 난 때 병화로 타 버렸는데 영조 때 박잉걸이 다시 지었고, 1894년 갑오동학 혁명에 소실된 것을 가산 김수곤이 중건했었는데 1950년 6.25 사변에 다시 소실되고 말았다. 1973년 조병준이 재건하였다. 
석탄사의 대웅전 앞 쪽으로 지맥이 뭉친 곳이 있는데, 이 곳을 무제등이라 하고 여기서 기우제를 지냈다고 하며, 인근 지역에 가뭄이 심하게 들 때면 고을원이었던 태인현감이 20리나 떨어진 이곳에 와서 직접 기우제를 주관하였다고 한다. 또 이 사찰은 삼성각의 나반존자가 여러 영험을 드러냈다는 이야기가 전설처럼 전해내려오는 곳이다. 
날씨가 맑은 날 대웅전 앞에 서 보면 너무도 아름다운 경관을 볼 수 있다. 멀리 변산반도와 서해까지 들어오는데 산을 오를 때까지 전혀 예상치 못했던 그런 경관에 감탄사가 절로 나오게 된다. 
주변 관광지로 국사봉, 수청저수지, 칠보산, 무성서원이 있다.","<a href=""https://www.jeongeup.go.kr/culture/board/view.jeongeup?boardId=BBS_0000004&menuCd=DOM_000000601004004000&paging=ok&startPage=4&categoryCode1=AC01&dataSid=392"" target=""_blank"" title=""새창 : 홈페이지로 이동"">https://www.jeongeup.go.kr</a>"
석탄유물보존관,2650096,인문(문화/예술/역사),문화시설,전시관,,강원특별자치도,128.8156179786,37.2201450806,"동원탄좌 사북광업소는 23개 광구를 소유한 동양 최대 민영 탄광으로, 정선군과 사북읍의 얼굴이다. 1978년 국내 석탄 생산량 1위에 오르며 정점을 찍었다. 하지만 1989년 석탄 합리화 정책으로 내리막길을 걷게 되며, 2004년 10월31일 문을 닫게 된다. 동원탄좌 사북광업소가 문을 닫기 전 광부와 주민들이 주축이 돼 석탄유물보존위원회가 출범하여, 사북석탄유물보존관을 탄생시켰다. 사북석탄유물보존관은 옛 동원탄좌의 행정동 건물 전체가 전시관으로 탄광의 역사를 그대로 품고 있는 곳이다.<br>","<a href=""http://www.jeongseon.go.kr/tour""target=""_blank"" title=""새창: 정선 관광 "">http://www.jeongseon.go.kr/tour</a>"
석탄회관,1883438,음식,음식점,한식,,강원특별자치도,128.8137318118,37.2276164077,"강원도 정선군 사북읍에 있는 석탄회관은 하이원리조트 입구에 위치한 한식 전문점이다. 주메뉴로 한우 등심과 설렁탕, 우거지 해장국이 있으며 삼겹살, 돼지갈비 등 육류와 간편한 식사를 할 수 있는 메뉴도 준비되어 있다. 30여 대 정도의 주차공간과 주차 안내원이 있어 차량 이용 시 편안하게 이용할 수 있으며, 400석(별실·좌식·입식)의 좌석이 있어 가족과 단체 회식은 물론, 외국인 관광객 식사 공간으로도 적합하다. 단체 회식 시 노래방 기기 제공도 가능하다.",
석탑사,2776998,인문(문화/예술/역사),역사관광지,사찰,,부산광역시,129.1611033114,35.3229198954,부산 기장군 정관 신도시가 내려다보이는 백운산 자락에 있는 석탑사는 도심 속 여유와 휴식이 필요할 때 찾을 수 있는 사찰이다. 원효대사와 의상대사가 정관읍 용수리 덕전마을을 지나다 동해에서 비치는 광명 속에 계시던 미륵부처님을 보고 백운산 가장 높은 봉우리에서 수도하였다는 것이 석탑사의 전설이다. 3층 석탑이 반기는 석탑사에서는 불교 기초교리 강좌와 경전 강좌를 진행하고 있어 부처님의 지혜와 자비에 대한 이해를 높일 수 있다. 작은 절이지만 파란 하늘을 향해 우뚝 솟은 소나무의 정기에 힘을 얻을 수 있다.,"<a href=""https://cafe.naver.com/punyasanto/"" target=""_blank"" title=""새창 : 석탑사 사이트로 이동"">https://cafe.naver.com/punyasanto/</a>"
석파랑,133769,음식,음식점,한식,,서울특별시,126.9587635581,37.5993084164,"석파랑은 조선왕조의 마지막 왕, 고종의 아버지로 한 시대를 누렸던 흥선대원군이 별장 ‘석파정’의 사랑채를 고스란히 옮겨와 지은 곳이다. 권세가의 아름다운 별장답게 석파랑의 대문을 들어서면 조선 말기 양식의 정원과 세 채의 고풍스러운 한옥이 눈앞에 펼쳐진다. 석파랑의 궁중 한식은 엄선된 식재료와 직접 담근 장으로 한층 더 정성의 기품을 더했으며, 또 전국 각지의 장인들이 만든 전통주를 함께 맛볼 수 있다.","<a href=""http://seokparang.co.kr"" target=""_blank"" title=""새창 : 석파랑 홈페이지로 이동"">http://seokparang.co.kr</a>"
