title,contentid,cat1,cat2,cat3,firstimage,region,mapx,mapy,overview,homepage
휴앤고 게스트하우스,2699348,숙박,숙박시설,게스트하우스,,전라남도,127.7422091764,34.7448536403,"여수 낭만포차 근처 숙소, 걸어서 10분 거리이다. 오동도, 낭만포차, 사랑하는 사람들과 행복한 힐링타임을 가질수 있는 곳이다.","<a href=""http://huengo.kr/""_blank"">http://huengo.kr/</a>"
휴앤락오토캠핑장,2730791,레포츠,육상 레포츠,"야영장,오토캠핑장",http://tong.visitkorea.or.kr/cms/resource/78/2730778_image2_1.jpg,경상북도,129.1844860827,35.8635844773,"휴앤락캠핑장은 경북 경주시 석장동에 위치하고 있다. 경주시청을 기점으로 5㎞가량 떨어져 있고, 도착까지 걸리는 시간은 15분 안팎이다. 나지막한 산에 캠핑장이 있지만 발아래로 내려다보는 풍경이 일품이다. 샤워장과 화장실 등 부대시설은 깔끔하게 관리가 잘 되어있다. 캠핑장에는 자동차 야영장 64면이 마련되어 있으며, 바닥은 모두 자갈로 이루어져 있다. 캐인 트레일러와 카라반 출입이 자유롭고, 반려동물 동반 입장도 가능하다. 관리소에서는 릴선과 난방 기구 등 캠핑 장비를 빌릴 수 있다. 캠핑장 인근에 대릉원 일원, 첨성대, 국립경주박물관 등 경주의 대표 관광지가 많고, 성업 중인 음식점도 많아 식도락의 즐거움도 만끽할 수 있다.","<a href=""http://cafe.naver.com/huenrockcamp"" target=""_blank"" title=""새창 : 휴앤락오토캠핑장 사이트로 이동"">http://cafe.naver.com/huenrockcamp</a>"
휴양림펜션,1276634,숙박,숙박시설,펜션,,충청남도,126.3573007928,36.5013582112,"휴양림펜션은 전 객실에서 푸른 들판과 하늘이 한눈에 들어오는 안면도의 초록 천국, 자연휴양림 안에 위치해 있다. 로맨틱한 인테리어와 편안하게 보낼 수 있는 객실은 그 어디보다 더 안락하게 꾸며져 있다. 또한 안면도의 바다와 안면송 속의 삼림욕 효과는 도시에서는 느껴보지 못한 새로운 경험이다. 
모든 편의시설을 갖추고 있어 바비큐 파티 등 여러 가지 행사를 겸할 수 있다. 휴양림펜션은 편안하고 럭셔리한 여행을 원하는 이들에게 최고의 휴식처가 되어 줄 것이다.","<a href=""https://huyanglim.modoo.at/"" target=""_blank"" title=""새창 : 휴양림펜션 홈페이지로 이동"">https://huyanglim.modoo.at/</a>"
휴양빌리지 가온,2755784,레포츠,육상 레포츠,"야영장,오토캠핑장",http://tong.visitkorea.or.kr/cms/resource/27/2756327_image2_1.JPG,강원특별자치도,127.6200854384,37.6435764233,대명비발디파크에서 10분 떨어진 휴양빌리지 가온은 강원도 홍천군 서면에 위치하고 있다. 서울에서 차로 한시간 안에 도착할 수 있는 편리한 교통을 갖추고 있다. 넓은 야외수영장이 있어 아이들과 함께 가족이 즐기기에 좋다. 오토캠핑장 외에 글램핑 19동을 함께 운영하고 있어 단체기업 워크샵과 야유회도 가능하다.,"<a href=""https://blog.naver.com/aa12329"" target=""_blank"" title=""새창 : 가온휴양빌리지 홈페이지로 이동"">https://blog.naver.com/aa12329</a>"
휴온천,2738054,인문(문화/예술/역사),휴양관광지,온천/욕장/스파,http://tong.visitkorea.or.kr/cms/resource/52/2738552_image2_1.JPG,경상북도,128.5966339119,36.0009579475,"팔공산 휴온천은 지하 1.5㎞ 이상에서 분출되는 온천수를 사용한다. 온천수의 성분은 알칼리성 탄산수소 나트륨인데, 정수시설이나 소금을 사용하지 않고 천연 그대로 사용하고 있다는 것이 장점이다. 휴온천의 온천수 효능으로는 진정 작용, 혈액순환 증진, 신경통 완화, 불면증 완화 등이 있다. 주요 부대시설로는 피트니스센터, 골프 연습장, 식당, 카페 등이 있다.","<a href=""http://www.huespa.co.kr"" target=""_blank"" title=""새창 : 휴온천 사이트로 이동"">http://www.huespa.co.kr</a>"
휴원(경주한옥휴원),2667028,숙박,숙박시설,한옥,,경상북도,129.1900894051,35.8271720275,"한옥 휴원은 50년 넘은 고택을 리모델링한 숙소이다. 경주 서악동에 위치하고 있고 선도산 아래 무열왕릉 이 있는 곳이다. 계절마다 동네 풍경이 달라지는 아름다운 마을에 위치, 소박하고 아담한 공간이다.",
휴일로 (휴일로카페),2785320,음식,음식점,카페/전통찻집,http://tong.visitkorea.or.kr/cms/resource/25/2785325_image2_1.jpg,제주특별자치도,126.3662483633,33.2324129686,"제주 서귀포 디저트 카페 휴일로는 앞마당이 바다라고 해도 과언이 아닐 정도로 멋진 위치에 자리하고 있다. 넓은 야외공간은 휴양지처럼 예쁘게 꾸며져 해안도로 드라이브 중에 들르는 여행객들도 상당하다. 또한 휴일로는 비주얼이 뛰어난 시그니쳐 메뉴 한라산 케이크로도 유명하며 커피나 음료 메뉴는 물론 크림브륄레, 비스킷슈, 크로아상 등 디저트 종류도 다양해 선택의 폭이 넓다. 오후에 방문한다면 제주위트에일, 스텔라, 빅웨이브 등 병맥주도 판매하고 있으니 오션뷰 루프탑에서 석양을 보며 마셔보길 추천한다.","<a href=""https://www.instagram.com/hueilot/"" target=""_blank"" title=""새창 : 휴일로 (휴일로카페) 사이트로 이동"">https://www.instagram.com/hueilot/</a>"
휴일엔캠핑장,2720702,레포츠,육상 레포츠,"야영장,오토캠핑장",http://tong.visitkorea.or.kr/cms/resource/19/2720719_image2_1.jpg,경상남도,127.7889860377,35.7918753308,"휴일엔 캠핑장은 캠핑장과 더불어 펜션도 함께 운영 중이다. 경남 거창군 북상면에 위치하며 아름다운 계곡이 있다. 덕유산 국립공원 지류의 계곡에 위치하고 있어 수려한 경치와 맑은 물이 사시사철 마르지 않고 흐르는 곳으로, 여름이면 물놀이, 물고기 잡기, 다슬기 잡기 체험도 할 수 있다. 그리고 휴일엔 캠핑장은 바로 앞에 계곡이 있어 도심의 소음, 공해 속에서 벗어나, 공기 좋고 물 맑은 자연 속에서의 달콤한 휴식을 느낄 수 있는 곳이다.","<a href=""http://www.holidayn.co.kr/"" target=""_blank"" title=""새창: 휴일엔 캠핑장 홈페이지로 이동"">http://www.holidayn.co.kr/</a>"
휴정서원,1956427,인문(문화/예술/역사),역사관광지,유적지/사적지,http://tong.visitkorea.or.kr/cms/resource/76/3339376_image2_1.jpg,충청남도,127.1789409834,36.1819729151,"휴정서원은 숙종 25년(1699)에 연산에 건립되었으며, 유무를 주향으로 하고 유문원, 이항길, 김정망, 권수 등 4인을 추배 하였다. 고종 8년(1871) 전국적인 서원 훼철령으로 철폐되었고, 1919년에 다시 복원되었다. 그 후 탑정저수지가 완공되면서 서원이 수몰되자 1944년 현재의 위치에 단소를 설치하였다가 1984년 사우를 복원하였으며, 1985년 구봉 송익필을 주향으로 하고 김공휘, 김호, 이항길, 유무, 김상연, 김진일, 김우택 등 8위의 위패를 봉안했다.","<a href=""https://www.nonsan.go.kr/tour/html/sub02/020605.html?mode=V&mng_no=76&skey=&sval=&orderby=&GotoPage=1"" target=""_blank"" title=""새창 : 논산시 문화관광으로 이동"">https://www.nonsan.go.kr/tour/</a>"
휴토피아글램핑,2726707,레포츠,육상 레포츠,"야영장,오토캠핑장",http://tong.visitkorea.or.kr/cms/resource/99/2727099_image2_1.jpg,강원특별자치도,127.6894859441,37.695649441,"휴토피아 글램핑은 강원도 홍천군 서면에 있다. 서울양양고속도로 남춘천IC에서 남춘천, 비발디파크 방면으로 10분이면 도착한다. 이곳은 글램핑 17면을 갖췄으며, 객실에는 침대, 소파, 냉난방기, TV, 냉장고가 있다. 화장실, 샤워장도 내부에 있다. 외부에는 전용 데크에는 취사도구, 테이블, 의자 등이 준비되어 있고 바비큐 시설도 되어있다. 이곳의 최대 장점은 홍천강의 수려한 풍경을 눈에 담을 수 있다는 것이다. 멀리 갈 것도 없이 글램핑 내부에서도 보이고, 외부 데크로 나오면 더욱 자세히 감상할 수 있다.  관리소에는 커피숍과 매점이 자리 잡고 있으며, 건물 앞으로 수영장, 공동 바비큐장, 개수대가 있다.","<a href=""http://huttopia.co.kr/"" target=""_blank"" title=""새창 : 휴토피아글램핑 사이트로 이동"">http://huttopia.co.kr/</a>"
휴파크 광산점,2718673,레포츠,육상 레포츠,"야영장,오토캠핑장",http://tong.visitkorea.or.kr/cms/resource/00/3033500_image2_1.jpg,광주광역시,126.7303952125,35.1953634646,광주광역시 광산구 용진산 아래 지산저수지가 내려다 보이는 곳에 위치한 휴파크 광산점은 국민여가 친환경 오토캠핑장이다. 도심 속 작은 힐링 장소로 일상에 지친 사람들이 아름다운 환경에서 휴식을 즐길 수 있도록 카라반 4인용과 6인용이 준비되어 있다.,"<a href=""http://gs.hupark.com/"" target=""_blank"" title=""새창 : 휴파크 광산점 사이트로 이동"">http://gs.hupark.com/</a>"
휴파크 오토캠핑장,2737371,레포츠,육상 레포츠,"야영장,오토캠핑장",http://tong.visitkorea.or.kr/cms/resource/72/2737872_image2_1.jpg,전라남도,126.7265702481,35.3186605607,"휴파크 오토캠핑장은 장성에 있는 홍길동 테마파크 안에 있는 카라반 캠핑장이다. 광주에서는 차로 30분 정도 소요된다. 카라반과 텐트 동반이 가능한 캠핑장이라 카라반을 대여하고, 개인텐트를 가져오면 무료로 텐트  자리를 제공한다. 카라반 종류는 4인과 6인이 이용할 수 있는 카라반 두 종류로, 옆에 텐트를 추가로 설치해 총 8명까지 캠핑을 즐길 수 있다. 참고로 4인용 카라반은 아담한 편이라 널찍하게 쓰고 싶으면 6인용 카라반을 사용할 것을 권한다. 이곳 카라반의 장점은 각 시설마다 테이블이 있어, 바비큐 파티를 할 때 개별적으로 이용이 가능하다는 것. 방충망이 설치되어 있어 벌레 걱정이 없다.  또한 어린이의 선망대상, ‘꼬마버스 타요’를 연상시키는 디자인으로 카라반 앞에 표정이 그려져 있고 알록달록 빨강, 파랑, 노랑, 주황 등의 색을 지녀 키즈파크의 분위기가 물씬 난다. 산책로가 잘 조성되어 있고 넓은 잔디밭에서 축구를 하거나 홍길동 테마파크를 구경할 수 있다.","<a href=""http://www.hupark.com/"" target=""_blank"" title=""새창 : 휴파크 오토캠핑장 사이트로 이동"">http://www.hupark.com/</a>"
휴펜션,2524159,숙박,숙박시설,펜션,http://tong.visitkorea.or.kr/cms/resource/31/2524131_image2_1.JPG,강원특별자치도,128.2765658039,37.3318914025,"휴펜션&뜨란솔 캠핑장은 강원도 영월군 무릉도원면 법흥계곡에 위치해 있다. 공기좋고 물 맑은 아름다운 곳으로 펜션 14개실, 캠핑 55개 사이트가 준비되어 있으며 각종 놀이시설과 편의시설 또한 준비되어 있다.","<a href=""http://huepension.modoo.at"" target=""_blank"" title=""새창 : 영월 휴펜션 홈페이지로 이동"">http://huepension.modoo.at</a>"
휴펜션,2581140,숙박,숙박시설,펜션,,경상남도,128.4320174651,34.7827170901,"휴펜션은 산양일주도로에서 조금 벗어난 아주 조용하고 바다 풍경이 아름다운 마을에 위치하고 있다. 답하마을 바닷가에 위치하고 있어 펜션앞으로 탁트인 바다전망과 병풍처럼 둘러싸인 미륵산이 아릅답다. 넓은 야외 공터에서 바다를 바라보며 야외 바비큐를 즐길 수 있으며, 펜션 바로 앞 선착장에서 체험낚시,물놀이,고동줍기을 즐길 수 있다. 
(정보제공자: 통영시청)",
휴휴당,2621610,숙박,숙박시설,한옥,http://tong.visitkorea.or.kr/cms/resource/58/2803458_image2_1.jpeg,전라남도,126.7178547294,34.7410811351,"휴휴당은 전남 강진 달빛한옥마을에 자리한 한옥 민박으로 월출산을 품에 안은 풍광이 수려하다. 객실은 2개로, 다래방은 아궁이에 장작을 넣어 불을 때는 구들방이고, 머루방은 원목 침대가 놓은 침실이다. 차실인 죽로지실에서 강진의 산수 창밖으로 보며 다도 체험을 할 수 있다. 주인장이 손바느질로 정성스레 만든 침구와 푸짐한 조식이 무료로 제공된다.",https://blog.naver.com/jylee6812
휴휴당,2663065,숙박,숙박시설,한옥,,경상북도,129.2122761125,35.8355131713,1970년대 한옥을 수리한 모던 한옥 스테이이다.,
휴휴암(강원),129593,인문(문화/예술/역사),역사관광지,사찰,http://tong.visitkorea.or.kr/cms/resource/24/2921424_image2_1.jpg,강원특별자치도,128.7678829666,37.9612474552,"휴휴암은 강원특별자치도 양양군 현남면 바닷가에 자리한 암자다. 일상의 번뇌를 내려놓고 쉬고 또 쉬라는 의미에서 지어졌다. 1997년 홍법스님이 창건한 이곳은 묘적전이라는 법당 하나로 시작되었으나 1999년, 바닷가에 누운 관세음보살 형상의 바위가 발견되면서 기도처로 유명해졌다. 묘적전 아래 바닷가에는 활짝 핀 연꽃을 닮아 연화대라고 이름 지어진 너른 바위가 있다. 연화대에서 관세음보살 바위와 거북이 형상의 바위를 찾아볼 수 있어 사시사철 관광객의 발길이 끊이지 않는다. 그밖에 발가락 바위, 발바닥 바위, 주먹바위 등 기이한 모습의 기암괴석이 신비감을 더한다. 때로는 해변으로 먹이를 찾아오는 황어 떼도 만날 수 있다. 휴휴암에는 묘적전, 다라니 굴법당, 관음범종, 지혜관세음보살상 등이 자리한다. 바닷가 언덕 위의 지혜관세음보살상은 휴휴암의 또 다른 명물이다. 동해용왕상과 남순동자상을 양쪽에 둔 지혜관음보살상은 뒤에 푸른 동해를 두르고 있어 경치가 빼어나다.",
흑고을,2856998,음식,음식점,한식,http://tong.visitkorea.or.kr/cms/resource/85/2856985_image2_1.jpg,충청남도,127.1591870199,36.8043261929,"흑고을은 충청남도 천안시 동남구 원성동에 있다. 옛 상호는 대보흑염소였다. 깔끔함이 돋보이는 외관과 차분한 분위기의 인테리어가 눈에 띈다. 내부에는 단체석이 있다. 대표 메뉴는 국내산 흑염소로 요리한 흑염소탕이다. 이 밖에 흑염소 전골, 흑염소 수육, 흑염소 무침, 야채 볶음밥 등도 맛볼 수 있다. 천안IC에서 가깝고, 인근에 에어바이킹 포시즌파크, 천안박물관이 있어 연계 여행에 나서기 수월하다.",
흑기와,2815034,음식,음식점,한식,,부산광역시,129.1419434568,35.2373152489,"이름처럼 기와집을 식당으로 운영하는 곳이다. 개별 방으로도 나누어져 있어 프라이빗하게 식사하기에 좋다.
대표 메뉴는 불향이 고소한 숯불 그릴 양념 구이다. 백숙도 인기가 많으며 1시간 전에 예약하는 것이 좋다. 
갖가지 반찬이 깔끔하고 정갈하게 나오며, 후식으로 파인애플과 커피 또는 녹차가 내어진다.",
흑돈가 명동,1958200,음식,음식점,한식,http://tong.visitkorea.or.kr/cms/resource/39/2707139_image2_1.jpg,서울특별시,126.9836261572,37.5648545334,"서울특별시 명동에 있는 바비큐 전문점이다. 제주도산 흑돼지고기를 판매한다. 대표 메뉴는 구이 메뉴 중 흑돼지 오겹살과 흑돼지 목살이다. 그밖에 흑돈가 항정살, 흑돈가 껍데기, 옛날불고기 전골 등이 있다. 10인부터 최대 130명까지 수용 가능한 단체 룸과 대형 주차장이 마련되어 있어 단체 회식이나 모임 장소로 좋다.",
흑돈가 삼성,2679018,음식,음식점,한식,,서울특별시,127.0563571254,37.5125730249,제주 흑돼지를 숯불에 구워먹을 수 있는 집이다. 서울특별시 강남구에 있는 한식전문점이다. 대표메뉴는 흑돼지오겹살이다.,
흑돈가 여의도점,2851675,음식,음식점,한식,http://tong.visitkorea.or.kr/cms/resource/60/2851660_image2_1.jpg,서울특별시,126.9301044955,37.520992005,"흑돈가 여의도점은 지하철 9호선과 신림선, 샛강역 2번 출구 금융타운가에 있다. 매장이 있는 빌딩에 자체 주차장이 있어 자동차 이용이 편리하다. 매장이 크고 테이블 간의 간격이 넓어 편한 식사를 할 수 있다. 포장은 물론 배달까지 가능한 이곳은 농림축산식품부 제공 안심식당으로 인증된 곳이다. 대표 메뉴는 오겹살, 항정살, 꼬들목살, 갈매기살, 양념구이가 있고 점심메뉴로 제주 두루치기, 차돌된장찌개, 양푼 김치찌개, 해장국, 갈비탕이 있다. 가성비 좋은 고깃집으로 주변에 서울색공원과 여의도한강공원이 있어 식사 전후에 둘러보기 좋다.",
흑돈가 제주,1019491,음식,음식점,한식,,제주특별자치도,126.473552933,33.4800372929,"KBS 고향이 보인다, SBS 맛대맛, 일본 남해방송 등 국내외 TV 프로그램에서 여러차례 소개된 제주도의 소문난 맛집인 제주 흑돈가는 제주 청정 흑돼지 전문점으로 참숯을 사용한 직화구이로 흑돼지의 담백하고 고소한 맛을 살려준다. 흑돈가에서는 최고 품질의 제주 청정 흑돼지만을 사용하며, 깔끔하고 세련된 실내공간은 그 맛을 더욱 돋보이게 한다.<br>","<a href=""https://www.instagram.com/heukdonga2006"" target=""_blank"" title=""새창 : 흑돈가 홈페이지로 이동"">https://www.instagram.com/heukdonga2006</a><br>"
흑돈가 제주,2678651,음식,음식점,한식,http://tong.visitkorea.or.kr/cms/resource/34/2675134_image2_1.jpg,제주특별자치도,126.473500159,33.4800900646,제주특산물인 흑돼지 전문 음식점이다. 제주특별자치도 제주시에 있는 한식 전문점이다. 대표메뉴는흑돼지생구이다.,
흑돈가(명동점),2653646,음식,음식점,한식,,서울특별시,126.9838928014,37.5647906569,"제주 흑돼지 전문점 흑돈가 명동직영점
청정제주 흑돼지 맛집
목살과 생삼겹살 맛집
흑돈가는 흑돼지 전문점으로써 참숯을 사용하여 직화구이를 하고 있다. 흑돈가에서는 구이류와 식사류, 점심메뉴가 제공된다.",
흑돈향,2657940,음식,음식점,한식,http://tong.visitkorea.or.kr/cms/resource/42/2657942_image2_1.jpg,제주특별자치도,126.5292617309,33.2447475122,제주특별자치도 서귀포시에 있는 바비큐 전문점이다. 대표메뉴는 흑돼지구이다. 흑돼지구이는 제주도의 대표적인 음식이다.,
흑돼지가있는풍경,2678745,음식,음식점,한식,http://tong.visitkorea.or.kr/cms/resource/58/2675158_image2_1.jpg,제주특별자치도,126.4802135803,33.4749657383,제주특산물인 흑돼지 요리를 판매하는 곳이다. 제주특별자치도 제주시에 있는 한식 전문점이다. 대표메뉴는 흑돼지삼겹살이다.,
흑돼지거리,3061575,인문(문화/예술/역사),체험관광지,이색거리,http://tong.visitkorea.or.kr/cms/resource/69/3061569_image2_1.jpg,제주특별자치도,126.5268724945,33.5154481105,"제주항 탑동광장 부근에 조성된 제주 흑돼지 거리는 제주의 특산물인 흑돼지 전문점 30여 개가 모여 있는 골목으로, 흑돼지를 맛보고 싶다면 방문하는 것을 추천한다. 흑돼지 거리는 30여 년의 오랜 전통을 자랑하고 있으며, 초입에는 흑돼지 거리 간판 조형물과 돼지 동상 조형물이 설치되어 있어 단번에 흑돼지 거리임을 알 수 있게 해주고 있다. 흑돼지는 일반 돼지고기에 비해 쫄깃하고 영양도 많다고 알려져 있으며, 흑돼지고기를 구워 꽃멸치 젓갈에 찍어 먹으면 그 맛이 담백하고 고소하여 씹을수록 입맛을 돋게 한다. 
주변에는 칠성로 쇼핑거리, 동문재래시장, 생태하천 산지천, 100년 전통의 산지 등대, 탑동광장 등 여러 관광지가 있는 제주 특화 거리이다.","<a href=""https://www.visitjeju.net/kr/detail/view?contentsid=CNTS_200000000007287#"" target=""_blank"" title=""새창 : 홈페이지로 이동"">https://www.visitjeju.net/</a>"
흑돼지구이집 하영,1018723,음식,음식점,한식,,제주특별자치도,126.4165962685,33.2550751487,"하영은 제주방언으로 많이라는 뜻이다. 제주 중문관광단지 입구에 위치한 흑돼지구이 전문점으로 깔끔한 인테리어와 여유 있는 공간에서 요리를 맛볼 수 있다. 넓은 공간으로 단체나 가족 모임 일반 여행객 등 누구나 부담 없이 편하게 식사를 즐길 수 있으며, 도로보다 약간 높은 언덕에 위에 있어 중문 앞바다와 관광단지 일대의 아름다운 전망을 감상하며 하는 식사는 하영의 또 다른 매력이다.
흑돼지 오겹살, 모듬구이, 양념갈비 등 단품 메뉴들도 있지만 하영특선 등의 세트 메뉴와 하영스페셜은 전복요리, 양념갈비구이, 생흑돼지, 전복뚝배기, 영양돌솥밥을 한 번에 맛 볼 수 있다. 멜젓, 자리돔젓과 함께 먹는 흑돼지구이는 하영의 별미이며 낮에는 야외테라스에서 바다를 감상하며 식사를 할 수 있다.","<a href=""https://blog.naver.com/hayoung7386011"" target=""_blank"" title=""새창 : 흑돼지구이집 하영 홈페이지로이동"">https://blog.naver.com/hayoung7386011</a>"
흑돼지해물삼합,2894407,음식,음식점,한식,http://tong.visitkorea.or.kr/cms/resource/00/2894400_image2_1.jpg,제주특별자치도,126.5703303734,33.2456869486,"흑돼지 해물삼합은 서귀포시 서귀동 서복전시관 근처에 있는 구이 전문점이다.  숙성 흑돼지와 해산물을 한 번에 맛볼 수 있는 구성으로 모두 직접 구워주어 맛있는 타이밍을 놓치지 않고 즐길 수 있다. 흑돼지와 함께 뿔소라, 문어, 키조개, 새우, 전복, 버섯, 야채, 김치를 푸짐하게 올려 함께 굽는다. 차림새 대비 가성비도 좋은 편이다. 메인 메뉴의 경우 금어기 문어와 새우를 제외하고는 모두 제주산이며  기본 반찬도 깔끔하다. 주변 여행지로 정방폭포, 천지연폭포 등이 있다.","<a href=""https://www.instagram.com/blackpighi""target=""_blank"" title=""새창 : 흑돼지해물삼합 사이트로 이동"">https://www.instagram.com/blackpighi</a>"
흑두루미상회,3035574,쇼핑,쇼핑,전문매장/상가,http://tong.visitkorea.or.kr/cms/resource/59/2992759_image2_1.png,전라남도,127.5113413806,34.9292984052,"순천의 관광두레 주민사업체 <남쪽동네>는 흑두루미 굿즈들을 개발, 판매할 뿐만 아니라 지역 소상공인, 공예품, 청년창업가들의 상품들을 큐레이션 하여 판매하고자 흑두루미상회를 만들었다.흑두루미가 가지고 있는 '행운'과 ‘가족애' 등의 스토리를 이용하여, 여행객들에게 순천의 좋은 기운을 담은 행운의 부적이나 마음의 위안을 얻을 수 있는 기념품들을 만들고자 지속적으로 노력하고 있다.",
흑마가든,135867,음식,음식점,이색음식점,http://tong.visitkorea.or.kr/cms/resource/42/1937242_image2_1.jpg,제주특별자치도,126.4893960632,33.4772656294,"순수 토종 말만을 사용하는 흑마가든은 제주시 연동에 자리하고 있다. 대장금에 나오는 “하늘엔 용고기요, 지상엔 말고기가 최고다”는 대사처럼 그 맛이 뛰어 나고 효능이 탁월한데 특히 제주 말은 질병에 강해서 항생제를 거의 쓰지 않아 그 맛이 더 좋다. 흑마가든에서는 저지방 고단백 식품으로 질기지 않고  부드러운 마회, 섬유질이 많고 냄새가 없으며 쫄깃쫄깃한 육질이 일품인 마육회, 얇게 썰어 입에서 살살 녹는 그 맛에 모든 사람들이 좋아하는 영양만점의 마구이, 매콤하고 지방이 적어 담백한 맛을 느낄 수 있는 갈비찜정식 등 다양한 말고기 요리를 맛 볼 수 있다.<br>",
