title,contentid,cat1,cat2,cat3,firstimage,region,mapx,mapy,overview,homepage
흑백컬러사진관,3037550,인문(문화/예술/역사),체험관광지,이색체험,http://tong.visitkorea.or.kr/cms/resource/34/3037534_image2_1.jpg,제주특별자치도,126.5301003875,33.4980556434,"제주 흑백칼라사진관은 제주시청 근처에 위치한 흑백사진 전문 사진관이다. 흑백사진 촬영, 현상, 인화 서비스를 제공하며, 다양한 테마와 서비스를 제공한다. 1인 셀프 촬영을 기본으로 진행하며, 15분 동안 자유롭게 촬영할 수 있다. 촬영 후에는 마음에 드는 사진을 선택하여 현상 및 인화할 수 있다. 흑백사진 외에도 증명사진, 여권사진 등 다양한 종류의 사진 촬영이 가능하다. 흑백사진 촬영 1회 30,000원 (인화 포함)이며 사진 컷을 고른 후 보정본 1컷과 스케치 영상(사진 찍는 모습을 동영상으로 담아낸 영상)이 무료이다. 사진을 찍으며 바로바로 모니터로 확인하며 표정이나 자세를 수정할 수 있어서 만족도 높은 결과물을 얻을 수 있어 연인이나 가족, 친구들과 함께 기억에 남는 테마사진 촬영이 가능하다. 흑백사진의 매력을 경험하고 싶은 사람들에게 추천하며 흑백 셀프 촬영은 예약제로 운영된다.","<a href=""https://blog.naver.com/blackcolorjeju""target=""_blank"" title=""새창 : 업체 블로그 이동"">https://blog.naver.com/blackcolorjeju</a><br><a href=""https://www.instagram.com/blackcolorjeju""target=""_blank"" title=""새창 : 업체 인스타 이동"">https://www.instagram.com/blackcolorjeju</a>"
흑본오겹 함덕점,2899428,음식,음식점,한식,http://tong.visitkorea.or.kr/cms/resource/16/2899416_image2_1.jpg,제주특별자치도,126.6587242813,33.5436693167,"흑본오겹 함덕점은 제주시 조천읍 함덕해수욕장 근처에 있는 직화구이 전문점이다. 최상급 제주 흑돼지와 제주산 생고기만을 제공하고 있으며 황동 불판을 사용하여 불순물이 묻어나지 않고, 열전도율이 높아 빠르고 맛있게 고기를 굽는다. 최고급 비장탄 숯을 사용하는 직화구이 방식이고, 80여가지 미네랄 성분을 함유한 히말라야 핑크 솔트를 쓴다. 대표 메뉴는 제주생갈비, 제주꽃목살, 흑돼지오겹살, 등겹살, 아구살 등이 있고 묵사발, 꼬시래기 라면도 있다. 함덕 맛집으로 소문나면서 제주공항점도 오픈하였다. 주변 여행지로 서우봉, 함덕해수욕장이 있다.","<a href=""http://www.instagram.com/bone_blackpork""target=""_blank"" title=""새창 : 흑본오겹 사이트로 이동"">http://www.instagram.com/bone_blackpork</a>"
흑산도,126301,자연,자연관광지,섬,http://tong.visitkorea.or.kr/cms/resource/10/1572010_image2_1.jpg,전라남도,125.4274063444,34.68294745,"다도해해상국립공원에 속해있는 우리나라 최서남단 해역에 위치한 섬으로 바닷물이 푸르다 못해 검다 해서 흑산도라 불린다. 흑산도 예리항은 동지나해와 서남단 인근 어장의 전진기지로 중국 어선들이 많이 입출항하고 있고 최서남단 소흑산도(가거도)는 어업전진기지로 개발되고 있다. 해안을 따라 놓여있는 24km의 일주도로가 닦여져 있어 섬 전역을 한 바퀴 돌며 흑산도의 아름다운 자연과 문화유적을 볼 수 있어  섬 여행의 제맛을 느낄 수 있다. 
대흑산도를 중심으로 한 인근의 영산도, 다물도, 대둔도, 홍도 등은 천혜의 관광보고로 섬에 특유의 문화유적이 많으며, 다도해해상국립공원에 속해 있다. 또한, 해안을 따라 연장 24km 의 일주도로가 닦여져 있어 섬 전역을 한 바퀴 돌면 흑산도의 아름다운 자연과 문화유적을 거의 다 볼 수 있으며 섬 여행의 제 맛인 해상관광을 하려면 예리항을 출발해 열목동굴~홍어마을~범마을~칠성동굴~돌고래바위~스님바위~촛대바위~남근석~거북이바위 등을 돌아보면 되는데 2시간 30분 정도가 소요된다.
흑산도는 육지와 멀리 떨어져 있어 옛날에는 많은 인물들이 유배생활을 하던 섬이기도 했다. 다산 정약용의 둘째 형이자 조선 후기 문신인 정약전 선생이 유배생활 15년 동안 근해에 있는 물고기와 해산물 등 155종을 채집하여 명칭, 형태, 분포, 실태 등을 기록한 자산어보를 남겼으며, 학자이며 의병장이기도 했던 면암 최익현 선생의 ""기봉강산 홍무일월""이라는 친필은 흑산면 촌리에 있는 손바닥 바위에 새겨져 있다. 
흑산도는 자연생태 환경이 우수하여 철새들의 중각 기착지로서 중요한 지역으로 인근에 철새 박물관과 새 조각공원, 국립공원연구원 조류연구센터가 위치해 있다. 그 외에도 문화재 자료로 지정된 진리 지석묘 군락지, 삼층석탑 및 석등과 사촌서당 등의 문화유적이 있다.","<a href=""https://tour.shinan.go.kr/home/tour/island_tour/heuksan/place/page.wscms"" target=""_blank"" title=""새창 : 홈페이지로 이동"">https://tour.shinan.go.kr/home/tour/island_tour</a>"
흑산도 해상관광유람선,128940,인문(문화/예술/역사),휴양관광지,유람선/잠수함관광,,전라남도,125.4319170109,34.6848667483,"크고 작은 유인도 11개, 무인도 89개의 총 백 여개의 섬으로 이루어진 대규모 군도, 다도해 해상국립공원으로 지정될 만큼 섬 주변의 기암괴석과 갖가지 이야기들이 담긴 둥굴들을 볼 수 있다. 해안선을 따라 펼쳐지는 황홀한 자연경관, 문화유적, 옹기종기 자리한 섬마을의 정치는 그 어느 절경보다 강한 여운으로 남는다. 선상낚시, 갯바위낚시도 체험해 볼 수 있다.","<a href=""http://www.061-275-9115.kti114.net/"" target=""_blank"" title=""흑산도 해상관광유람선 사이트로 이동"">http://www.061-275-9115.kti114.net</a>"
흑석사(영주),127406,인문(문화/예술/역사),역사관광지,사찰,http://tong.visitkorea.or.kr/cms/resource/20/207720_image2_1.jpg,경상북도,128.6716537098,36.8232906494,"영주시 이산면 석포리에 있는 대한불교조계종 소속 사찰인 흑석사는 통일신라시대에 의상대사가 창건했다고 전해진다. 임진왜란 때에 소실되어 폐찰로 내려오다가 8.15 광복 후 승려 김상호가 소백산 초암사의 목재를 옮겨와 중창한 것이라 한다. 절 이름은 절 가까운 마을 이름이 흑석이고, 그 마을의 뒤편에 거대한 검은 바위가 있어 사찰 이름을 ‘흑석사’라 했다고 한다. 또 다른 유래에 의하면 흑석사 부근 바위 빛깔이 대개 검어 이름이 흑석사가 되었다 한다. 
흑석사의 가람 구조는 극락전, 보궁, 승방, 심검당, 환희전, 종무소, 요사 등으로 구성되어 있다. 극락전은 정면 3칸, 측면 3칸의 주심포식 맞배지붕 구조로 국보인 목조아미타여래좌상을 주불로 하는 삼존불을 봉안하고 있다. 목조아미타불좌상은 본래 정암산 법천사에 있던 걸로 6.25 때 옮겨온 것으로 불상의 복장에서 복장기와 보권문, 전적 4종과 직물, 기타 복장 유물이 수년 전 발견되어 국보로 지정되었다. 이 밖에도 자연 상태 바위에 새긴 흑석사 마애삼존불상이 소장되어 있다.","<a href=""https://encykorea.aks.ac.kr/Article/E0065898"" target=""_blank"" title=""새창 : 홈페이지로 이동"">https://encykorea.aks.ac.kr</a>"
흑석산 자연 휴양림 캠핑장,2740121,레포츠,육상 레포츠,"야영장,오토캠핑장",http://tong.visitkorea.or.kr/cms/resource/43/2740243_image2_1.jpg,전라남도,126.6170097561,34.6709706803,"흑석산 자연 휴양림 캠핑장은 해남의 명산 흑석산 능선에 위치해 있다. 이곳은 해남군에서 운영하는 곳으로  1999년 개장했다. 캠핑장과 더불어 숲속의집 펜션도 함께 운영한다. 캠핑장은 데크 별로 전기를 쓸 수 있고 취사장과 화장실 등 편의시설이 잘 갖춰져 있다. 또한 산막 앞에 조성된 잔디광장으로 나가면 야외 테이블을 이용해 파티를 즐길 수 있다. 캠핑장이 산중에 있어 산을 가장 가까이서 느낄 수 있다. 흑석산, 가학산, 두억봉으로 가는 등산로가 있으며, 기암괴석과, 철쭉, 침엽수림, 잡목림이 조화를 이루는 모습을 볼 수 있다. 특히 소사나무 군락은 우리나라 최고를 자랑하며 정상에 올라서면 봉우리마다 구름이 산을 뒤덮는 절경을 볼 수 있다.<br>한편, 주변 관광지로는 겨울철 철새도래지인 고천암호, 고산윤선도유물관이 있는 윤고산유적지, 한국 최대의 공룡화석지, 땅끝관광지, 우수영관광단지, 대흥사도립관광단지가 있다.","<a href=""https://www.foresttrip.go.kr/indvz/main.do?hmpgId=ID02030045#"" target=""_blank"" title=""새창 : 흑석산 자연 휴양림 사이트로 이동"">https://www.foresttrip.go.kr/indvz/main.do?hmpgId=ID02030045#</a>"
흑석산 자연휴양림,126958,자연,자연관광지,자연휴양림,http://tong.visitkorea.or.kr/cms/resource/09/3061309_image2_1.jpg,전라남도,126.6161153759,34.6715705981,"흑석산자연휴양림은 계곡면의 진산인 흑석산(해발 650m)에 있다. 흑석이라는 이름은 조선시대 우리나라 지도를 만들었던 고산자 김정호의 대동여지도에서 초음으로 표기됐다. 원래 가학산이라 불렀는데 [가학]이라는 이름은 [산세가 나르는 학처럼 생겼다]하여 붙여진 이름이다. [흑석]은 비가 온 후 물 머금은 산의 바위가 검게 보인다 하여 유래되었으며, 봄이면 아름다운 철쭉밭과 우리나라 최고의 소사나무 군락지가 있다. 
흑석산 자연휴양림에는 숙박시설로 휴양관 1동과 숲속의 집은 A, B, C 단지로 구성되어 있고 1, 2 야영장에는 대형 데크가 있다. 유아숲 체험장에서는 유치원생들을 대상으로 숲속 체험활동을 진행하며 족욕체험장에서는 숲속 청량한 공기 속에서 발을 담고 휴식을 취할 수 있다. 
이 밖에도 치유의 숲이란 산림치유 프로그램에 참여할 수 있다. 산림치유는 숲에 존재하는 햇빛, 습도, 피톤치드 등 다양한 환경요소를 활용하여 인체의 면역력을 높이고, 신체적 정신적 건강을 회복시키는 활동이다. 산림치유 프로그램은 Happy-참나, 참 숲 Happy-Refresh 등으로 구성되어 있으며 프로그램을 통해 치유 명상, 오감 트레킹, 목공예, 아로마테라피 등을 즐길 수 있다.","<a href=""https://www.foresttrip.go.kr/indvz/main.do?hmpgId=ID02030045"" target=""_blank"" title=""새창: 흑석산 자연휴양림 홈페이지로 이동"">https://www.foresttrip.go.kr</a>"
흑석유원지,2758588,인문(문화/예술/역사),휴양관광지,공원,,대전광역시,127.3400883221,36.2620860417,"흑석유원지는 대전시 서구 흑석동에 있다. 유원지에는 여름철 물놀이가 가능한 물가, 무료 캠핑을 즐길 수 있는 야영장 등이 갖춰져 있다. 질 정비된 길을 따라 풍경을 감상하기 좋은 산책로도 조성되어 있다. 유원지는 안영IC 와 가깝고, 주변에는 장태산자연휴양림이 있다.",
흑성산,2762931,자연,자연관광지,산,,충청남도,127.2274587255,36.8014832908,"흑성산(해발 519m)은 동쪽으로 산방천을 넘어서 은율산이 솟아있고 북쪽으로는 천안시의 진산인 태조봉을 거쳐 성거산이 바라다 보이며 서쪽에는 마점산 너머로 천안시가 내려다보인다. 그리고 남쪽으로는 승천천을 건너서 취암산과 고려산으로 연결된다. 흑성산 정상에는 석축둘레 2,290척, 높이 6척의 성터가 있었으나, 지금은 일부만 남아있고 성내에는 지지가 있다. 흑성산의 본래 이름은 검은 산인데 이 산을 중심으로 김시민, 이동령, 이범석, 유관순, 조병옥 등 많은 구국열사가 배출되었으며 일제 때 ‘검다’는 뜻을 그대로 옮겨서 '흑성산'으로 바꾼 것이다. 풍수지리상 이곳은 서울의 외청룡에 해당되고 금계포란형 즉 금닭이 알을 품고 있는 형의 명당 길지로서 ‘좌우동천승적지’라 하였다. 여기서 좌우동천승적지는 석천리와 지산리의 승적골을 말하는데 석천리의 승적골은 5목(덜목, 제목, 칙목, 사리목, 돌목)의 사이에 사람이 살기 좋은 땅이 있기 때문이며 이곳에 독립기념관이 들어서게 된 것과 관련하여 암행어사 박문수의 일화가 전해지고 있다. 영조 때 암행어사 박문수가 죽자 그의 묘소를 지금의 독립기념관 자리에 정하였는데 이때 어느 유명한 지관이 이곳은 2~3백 년 후에는 나라에서 요긴하게 쓸 땅이므로 그때 가면 이장을 해야 되니 이곳에서 십여 리 동쪽에 묘를 쓰라고 권하여 지금의 북면에 위치한 은석산에 묘소를 정하였다고 한다. 과연 ‘검은성’이라는 이름을 그대로 국가적 사업에 의한 독립기념관이 들어서니 풍수지리상 명당 길지인 이곳이 제구실을 다하고 있는 셈이다. 
( 출처: 천안시 문화관광)","<a href=""https://www.cheonan.go.kr/prog/tursmCn/tour/sub01_01/view.do?cntno=33"" target=""_blank"" title=""새창 : 홈페이지로 이동"">https://www.cheonan.go.kr/tour.do</a>"
흑성산성,1627205,인문(문화/예술/역사),역사관광지,성,http://tong.visitkorea.or.kr/cms/resource/63/3356963_image2_1.JPG,충청남도,127.2091271691,36.7969084905,"흑성산성은 충청남도 천안시 목천읍에 있는 이 산성은 흑성산 정상을 둘러싸며 만들어졌다. 돌로 쌓은 산성으로 성의 둘레는 570m로, 산성의 대부분이 훼손되어 본래의 모습을 찾기 힘든 상태이다. 『세종실록지리지』에 의하면 성안에는 우물 1개와 샘 1개가 있는데, 하절기와 동절기에는 간혹 마른다고 기록되어 있으며, 『신증동국여지승람』에 성벽의 높이가 6척이며, 가운데에는 못이 하나 있다고 기록되어 있다.","<a href=""https://www.cheonan.go.kr/prog/cultureAssets/tour/sub05_07/C07/view.do?pageIndex=2&cntno=45"" target=""_blank"" title=""새창 : 홈페이지로 이동"">https://www.cheonan.go.kr</a>"
흑송,2859132,음식,음식점,일식,http://tong.visitkorea.or.kr/cms/resource/00/2859100_image2_1.jpg,부산광역시,129.1965348672,35.1750510142,"부산 해운대 송정 해수욕장 근처에 있는 흑송은 유명 호텔 출신 일식 주방장이 운영하는 스시, 돈가스 전문점이다. 검은 소나무라는 뜻의 흑송은 송정 바다 풍경을 보며 음식을 먹을 수 있는 곳으로 1층 작은 문으로 나가면 테라스가 있어 대기하는 동안 바다를 볼 수 있다. 1, 2층 창가 쪽 자리는 바다 풍경이 보여 인기가 많지만 따로 예약이 불가하고 오는 순서대로 앉는다. 가성비 좋은 런치세트는 10종 스시와 유부초밥, 샐러드, 튀김, 미니 우동이 나오고 주말, 공휴일은 제외이다. 흑송 대표 메뉴 돈가스는 숙성 돼지고기를 바삭하게 튀겨 도톰하고 육즙 가득 풍미 가득하여 부산 3대 돈가스 맛집으로 자리 잡았다. 주말 점심시간에는 사람이 많아 브레이크 타임 전 입장이 불가능할 수 있어 여유 있게 미리 가서 기다리는 게 좋다. 근처 걷기 좋은 해수욕장과 수려한 해안 절경을 볼 수 있는 해변 열차 블루라인 파크도 있어 함께 방문하기 좋다.",
흑염소명가 약초산,2851361,음식,음식점,한식,http://tong.visitkorea.or.kr/cms/resource/46/2851346_image2_1.jpeg,경기도,126.9668063706,37.3353308731,"약초산은 경기도 의왕시 이동에 있는 흑염소 요리 전문점이다. 흑염소 탕, 전골, 무침, 수육을 판매하고 있다. 대표 메뉴는 흑염소 전골로 24시간 흑염소 뼈만 끓여 우려낸 육수에 토란, 고사리, 부추, 깻잎과 함께 정성껏 손질한 흑염소 고기를 넣어 냄비에 담아낸다. 깔끔하고 담백한 맛이 특징이다. 약초가 많은 산에서 방목하여 키운 토종 흑염소만을 엄선하여 사용한다. 매장 내부는 넓고 쾌적하다. 매장 앞에 넓은 주차 공간이 있어 편하게 이용할 수 있다. TV 방송에 소개된 맛집이다.","<a href=""http://0314622800.modoo.at/""target=""_blank"" title=""새창 : 흑염소명가 약초산 사이트로 이동"">http://0314622800.modoo.at/</a>"
흑한우명품관,1823088,음식,음식점,한식,http://tong.visitkorea.or.kr/cms/resource/94/1786494_image2_1.jpg,제주특별자치도,126.5884813187,33.2572276299,제주도 특산물인 흑한우를 맛볼 수 있는 곳이다.<br>서귀포시 축협 조합원이 직접 키우고 출하한 1등급 이상의 한우만 판매하고 있다. 넓은 주차장과 어린이 놀이방 시설을 구비하고 있어 단체 회식이나 모임을 하기에도 좋다.,"<a href=""http://www.seogwiposi.com/index.php/contents/black_beef"" target=""_blank"" title=""새창 : 서귀포시 축협 - 흑한우명품관 정보페이지로 이동"">http://www.seogwiposi.com/</a>"
흔들전망대,2706012,인문(문화/예술/역사),건축/조형물,유명건물,,경기도,126.7839658769,37.391526659,"흔들 전망대는 경기 시흥시 갯골생태공원 내에 위치하고 있다. 흔들거리지만 구조적으로 안전한 건물 6층, 22m 높이의 목조 고층 전망대로 갯골생태공원을 한눈에 담을 수 있는 갯골의 랜드마크다. 전망대에 설치된 고배율 망원경은 생동감 넘치는 갯골의 생태를 보여준다. 광활하고 웅장한 생태를 바라보며 힐링할 수 있는 곳이다.","<a href=""https://www.shsi.or.kr/PageLink.do?tempParam1=&link=forward:/PageContent.do&menuNo=030000&subMenuNo=020700&thirdMenuNo=020701"" target=""_blank"" title=""시흥 문화관광 사이트로 이동"">https://www.shsi.or.kr/</a>"
흙가든허브오리,1014373,음식,음식점,한식,http://tong.visitkorea.or.kr/cms/resource/47/1023847_image2_1.jpg,전북특별자치도,126.9121105259,35.923045052,"허브와 함께 오리를 구워냄으로써 오리특유의 잡내를 없애면서도 동시에 허브의 산뜻하면서도 강한 맛을 오리에 접목시킨 오리요리 전문점이다. 오리와 향기로운 허브와 인삼, 대추 등 20여가지의 보약재를 황토가마에 넣은 뒤 3시간동안 구워만든 흙가든 허브오리는 오리기름이 빠지고 난 뒤에 맛보는 담백함과 고소함을 느낄 수 있다.","<a href=""https://blog.naver.com/iksan_origui"" target=""_blank"" title=""새창: 흙가든 홈페이지로 이동"">https://blog.naver.com/iksan_origui</a>"
흙과사람들,2876228,음식,음식점,한식,http://tong.visitkorea.or.kr/cms/resource/15/2876215_image2_1.jpg,경기도,126.7921831103,37.4439984907,"시흥에 위치한 한식전문점 흙과사람들은 2001년에 개업하여 20여 년이 넘는 시간 동안 한 곳에서 뚝심 있게 영업을 해온 식당이다. 돌솥밥을 기본으로 하여 가자미구이와 10가지의 다채로운 반찬이 제공되며, 연잎보리굴비, 간장꽃게장, 능이불고기, 황태구이, 더덕구이, 갈치조림, 제육볶음, 버섯불고기, 곤드레돌솥밥 등 다양한 한식메뉴를 맛볼 수 있다. 주 메인메뉴들의 식자재는 산지직송을 원칙으로 직접 발품 팔아 찾아낸 보물 같은 거래처에서 주 1~2회 발주하고 있으며, 모든 전처리와 조리는 주방에서 99.99% 진행되고 있어 안심하고 먹을 수 있다. 메뉴는 흙과사람들정식, 4이좋은정식, 연보리굴비특정식, 간장꽃게장특정식 등 푸짐한 한상이 차려지는 한 끼를 먹을 수 있다. 또, 흙과사람들은 아이들이 있는 가족들이 방문하면 편하게 식사를 할 수 있도록 아기의자, 유아식기류, 기저귀교환대, 유아전용변기, 어린이메뉴 등을 준비했다.","<a href=""https://www.instagram.com/soil_and_people/"" target=""_blank"" title=""새창 : 흙과사람들 인스타그램으로 이동"">https://www.instagram.com/soil_and_people/</a>"
흙과소나무,139214,숙박,숙박시설,펜션,http://tong.visitkorea.or.kr/cms/resource/11/1826411_image2_1.jpg,강원특별자치도,128.7660076777,37.248585302,"강원도의 시원한 산세를 감상하는 것은 물론 깨끗한 공기 덕에 휴양까지 즐길 수 있는 곳이다. 목구조에 파스텔톤으로 자연스러운 멋을 살려 주변 자연과 어울릴 뿐 아니라 친구, 연인, 가족과 함께 쉴 수 있는 곳이다. 펜션 앞마당에는 바비큐 시설이 따로 마련되어 있어 야외 식사를 할 수 있고 펜션 정면과 배면에 나란히 설치한 테크와 목조 계단은 탁 트인 주변의 경치를 감상할 수 있다.","<a href=""https://pension1.modoo.at/"" target=""_blank"" title=""새창 : 흙과소나무 홈페이지로 이동"">https://pension1.modoo.at/</a>"
흙내음 글램핑,2581200,숙박,숙박시설,민박,,경상남도,128.369929921,34.9374347863,"흙내음 글램핑은 경상남도 통영시 도산면 위치해 복잡한 도시를 떠나 자연과 하나가 될 수 있는 곳이다. 모든 것이 다 갖춰져 있어 몸만 와도 문제없다. 아이들의 감성을 자극 시켜 줄 수 있는 숲속의 오두막집 같은 차별화된 2층 텐트가 준비되어 있다. 흐르는 물소리에 마음을 씻고, 지저귀는 새 소리에 귀를 열고 아리따운 꽃으로 눈을 밝힐 수 있는 곳이다.","<a href=""http://tglamping.co.kr/""target=""_blank"" title=""흙내음 글램핑 홈페이지로 이동"">http://tglamping.co.kr/</a>"
흙붉은오름,1890857,자연,자연관광지,산,,제주특별자치도,126.5609113693,33.3856296799,"한라산 국립공원 내에 제주시 아라동과 조천읍 교래리의 경계에 위치한 오름이다. 오름의 흙이 매우 붉어서 마을에서는 예전부터 흙붉은오름이라 부르고 있으며 한자로는 그 뜻을 빌어 土赤岳(토적악)이라 표기하고 있다. 한라산 백록담을 중심으로 동부 산자락 중에서는 가장 높고, 한라산 정상에 가장 가까운 오름이다. 전체적인 형태는 동쪽으로 벌어진 말굽형 화구를 이루고, 화구 방향에 속칭 숫오름이라 불리는 돌오름이 마주해 있다. 화구의 잔디로 된 사면에는 시로미, 그 아래로 구상나무 등 고산식물이 자라고 있으며, 오름 등성마루에서는 흰 진달래 자생목이 발견된 바 있다. 돌오름(숫오름)과 비교하여 옥문형이라 일컬어지는 말굽형화구 깊숙한 곳에는 샘이 있는데, 이 샘은 기생화산 화구 내의 샘으로서는 가장 높은 고도에 위치해 있다. 이 샘물로 목욕재계하고 정성을 들이면 자손을 얻게 된다는 이야기가 전해 내려오고 있다. 돌오름의 서남쪽 작은 습지에서 올라갈 수는 있으나 가는 길이 쉽지 않다.",
흙속에바람속에(민박식당),2786796,숙박,숙박시설,민박,http://tong.visitkorea.or.kr/cms/resource/32/2790032_image2_1.jpg,경상남도,127.9074238438,35.3351929751,"흙속에 바람속에는 경남 산청군 단성면 청계리 일원의 지리산 둘레길 7코스에 위치해 있다. 2인 기준 최대 4인을 수용하는 한실 형태의 민박 2개 객실을 운영 중이다. 추가 요금을 내면 아침 식사가 가능하다. 메뉴로는 들깨 수제비, 파전 등이 있다. 전통차 등 각종 차를 파는 찻집도 함께 자리하고 있다.",
흙시루민박,2580040,숙박,숙박시설,민박,,경상남도,128.1388612875,34.9343671322,"흙시루는 고성의 주변관광지(공룡박물관, 상족암, 보리암, 남해일대 해수욕장, 백천사 와룡산, 사량도 옥녀봉 선착장, 우주 항공 박물관 등)의 5분~10분 이내 거리에 위치하고 있으며(갯벌 체험은 15-20분 거리에 위치), 조용하고 경치 좋고 공기 좋은 곳에 있다. 친환경적인 목조와 황토로 우리나라의 옛 조상들의 삶이 깃든 형태의 건물과 현대식 건물을 조합하여 만든 펜션이다. 무료 황토 찜질방, 족구장, 안전한 풀장, 등산로가 있으며, 다양한 동물들을 접할 수 있어 가족과 함께 하는 여행이라면 후회하지 않는다. 가든을 함께 운영하고 있어 단체손님도 가능하다. 저렴한 한정식부터 흑염소, 오리, 토종닭 등 다양한 식사메뉴가 있어 부담스럽지 않다. 편안함과 여유로움이 있는 흙시루로 여러분을 초대한다.
(정보제공자: 고성군청)","<a href=""http://www.mudciru.co.kr/""target=""_blank"" title=""흙시루 민박 홈페이지로 이동"">http://www.mudciru.co.kr/</a>"
