title,contentid,cat1,cat2,cat3,firstimage,region,mapx,mapy,overview,homepage
성거산,127201,자연,자연관광지,산,,충청남도,127.2236247957,36.8356459568,"천안 시가지를 중심으로 남쪽에 광덕산(699.3m)이 있다면 동북쪽에는 성거산(579.1m)이라는 명산이 자리 잡고 있다. 성거산은 고려 태조 왕건이 삼국통일을 이룩하기 위하여 분주할 때 직산면 산헐원을 지나다 동쪽의 산을 보고 신령이 있다 하여 제사를 지내게 하고 ‘성거산’이라 부르게 하였다는 산이다.  정상에 오르면 천안의 특산물인 성환배, 성거, 입장 거봉 포도의 주산지가 한눈에 들어오는 곳으로 능선을 따라 북쪽으로 진행하면 백제 도읍지였던 위례산성에 도달된다.","<a href=""https://www.cheonan.go.kr/prog/tursmCn/tour/sub01_06_05/view.do?pageIndex=3&cntno=36""새창 : 천안시 문화관광 홈페이지로 이동"">http://www.cheonan.go.kr/tour.do</a>"
성경만두요리전문점 종로,2643078,음식,음식점,한식,http://tong.visitkorea.or.kr/cms/resource/22/2661222_image2_1.jpg,서울특별시,126.989744927,37.5689736095,서울특별시 청계천에 있는 한식당이다. 하얀 전골은 만두와 채소를 넣어 끓여 먹는 국물 요리이다. 대표메뉴는 만두전골이다.,
성곡 반려견 놀이터,3112055,인문(문화/예술/역사),휴양관광지,공원,,경기도,126.7375913957,37.3247780279,성곡 반려견놀이터는 반려인과 반려동물이 어울릴 수 있는 자유로운 공간입니다.,
성곡미술관,130154,인문(문화/예술/역사),문화시설,미술관/화랑,http://tong.visitkorea.or.kr/cms/resource/42/1570442_image2_1.jpg,서울특별시,126.9696605179,37.5735143878,"성곡미술문화재단의 성곡미술관은 쌍용그룹 창업자 故 성곡 김성곤 선생의 기업을 통한 사회봉사의 정신을 미술 문화로 구현하고자 설립된 순수 공익단체로서 1995년에 개관하였다. 서울특별시 종로구에 자리하며, 주로 소규모 현장 기념관의 주제전과 현대 미술작가를 지원하기 위해 개인전, 국제전 등을 개최한다. 본관, 별관과 조각공원이 있으며, 부대 시설로는 찻집과 아트샵이 있다.
우리의 전통적인 얼과 정신, 우리의 정서와 미감을 현대적으로 해석한 기획전을 집중적으로 개최하며 [성곡미술대], [내일의 작가상]을 통해 신인 미술가를 발굴하고 지원한다. 국내외 예술가를 지원하는 큐레이터 프로그램을 도입하여 현대 미술에 대한 이해를 높이는 것을 목표로 하고 있다.","<a href=""http://www.sungkokmuseum.org/"" target=""_blank"" title=""새창 : 성곡미술관 홈페이지로 이동"">http://www.sungkokmuseum.org</a>"
성공사,126546,인문(문화/예술/역사),역사관광지,사찰,http://tong.visitkorea.or.kr/cms/resource/22/3338722_image2_1.jpg,충청남도,127.0716696457,36.5073226694,"성공사는 고불산에 자리한 사찰로 1982년 주지 관묵이 불사를 시작했다. 여러 성인들이 주석하고 있는 골짜기라는 뜻의 이름으로 풍광이 뛰어나 개인적인 기도뿐만 아니라 관광을 위해 찾는 사람이 많다. 대웅전, 종각, 삼성각, 명부전, 나한전, 천불전, 지장전, 명부전, 와불전, 약사전에 이어 2006년 관음전을 건립하여 현재의 모습을 갖추었다.
천불전 중앙에는 높이 18m의 좌불이 있는데, 이는 국내에서 가장 큰 좌불이다. 좌불 주위로 석가모니의 10대 제자상이 있으며, 그 뒤로는 동판에 새긴 금강경이 병풍처럼 둘려 있다. 또 약사여래불, 미륵불, 지장보살불, 와불, 아미타불 등 10m가 넘는 거대한 불상이 있으며, 대부분 전각 없이 노천에 있어 일반적인 사찰 배치와는 다른 독특한 구조를 볼 수 있다. 한 개인의 서원(誓願)을 담는 원불(圓佛)로 천불전에 야광여래 333,333불을 모시고 있어 참회기도 도량의 면모를 갖추고 있다.","<a href=""https://sunggongsa.com/"" target=""_blank"" title=""새창: 성공사 홈페이지로 이동"">https://sunggongsa.com/</a>"
성관사,319552,인문(문화/예술/역사),역사관광지,사찰,http://tong.visitkorea.or.kr/cms/resource/83/3364083_image2_1.JPG,전북특별자치도,127.6041895763,35.7522737685,"대한불교 조계종 성관사 주변에는 ‘금덕사’라는 한 사찰이 있었으나 주지 스님이 여러 차례 바뀌면서 관리와 운영의 부실로 8.15 해방을 전후하여 폐사되었는데 월성선사(月星禪師)와 주지 삼진(三眞) 스님이 1993년 현 사찰 건물을 새로 짓고 이름을 ‘성관사’라 하였다.
이 사찰 주변은 백학(白鶴)이 나르는 형국으로 남덕유산 지맥인 깃발봉에서 수많은 학의 떼가 날아와 모이를 쪼아 먹는 곳에 건물이 세워졌다고 한다.","<a href=""https://www.jangsu.go.kr/tour/board/view.jangsu?boardId=BBS_0000011&dataSid=218&menuCd=DOM_000000402005004005&&cpath=%2Ftour"" target=""_blank"" title=""새창 : 장수군 문화관광으로 이동"">https://www.jangsu.go.kr/tour/</a>"
성국사,2717271,인문(문화/예술/역사),역사관광지,사찰,,강원특별자치도,128.4400924271,38.0765527087,"오색약수터를 지나면 만나게 되는 작은 사찰 성국사는 신라 말 가지산 문의 개조 도의가 창건했다. 성주산 문의 개조인 무염이 이 절에서 출가했다고 전해질 뿐 절의 역사는 알려진 바 없다. 절 뒤뜰에 다섯 가지 색깔의 꽃이 피는 나무가 있어 이름을 오색석사라 짓고 인근 지명도 오색리로 바꿨다. 절 아래 계곡 암반에서 나오는 오색약수도 이 절의 승려가 발견했다고 한다. 이 절은 오랫동안 폐사로 방치되다가 근래에 인법당을 세우고 성국사라 이름 하여 명맥을 잇고 있는데 계절에 따라 녹음, 단풍, 설경 등 멋진 자연경관이 펼쳐져 설악산을 찾는 많은 이들의 발길을 머물게 한다. 고급스러운 건축물과 넓은 주차장, 쉼터가 잘 조성돼 있어 관광지로 안성맞춤이다. 상설 시설 이외에도 어린이를 위한 공간도 많고 체험학습실 등을 운영하고 있어 여러 방문객들의 문화 활동에 기여하고 있다.<br>",
성균관,2580820,음식,음식점,중식,,전라남도,126.4218597381,34.8094518923,다양한 중식을 먹을 수 있는 곳이다. 전라남도 목포시에 있는 중식전문점이다. 대표메뉴는 짜장면이다.,
성균관감자탕,2653165,음식,음식점,한식,http://tong.visitkorea.or.kr/cms/resource/06/2655006_image2_1.jpg,서울특별시,126.9972104805,37.5842525228,서울특별시 창덕궁에 있는 한식당이다. 한국의 대표 국물 요리인 감자탕을 경험할 수 있다. 대표메뉴는 감자탕 전골이다.,
성균관대학교 박물관,129838,인문(문화/예술/역사),문화시설,박물관,,서울특별시,126.9921358384,37.5879381147,"성균관대학교 내 600주년 기념관 지하 1층에 있는 성균관대학교 박물관은 수천여년 이어져 온 선조들의 값진 유물들을 수장, 전시하고 있다. 전시실은 상설전시실과 기획전시실로 크게 나누어져 있다. 상설전시실은 유교문화를 생생하게 체험할 수 있는 공간이며, 기획전시실은 성균관대학교 박물관만이 소장하고 있는 귀중한 자료들을 연구, 정리하여 공개하고 있다.
조선시대 유교문화의 전반을 관찰할 수 있는 유물들을 중심으로 선현들의 정신과 발자취가 담긴 도자, 글씨, 그림, 서적, 문서, 문방사우, 악기, 복식, 장신구, 가구 등 다양한 문화예술품과 생활용품들이 전시되어 있다. 매년 특별기획전도 개최하며 <명품도자 100>, <공자 성적>, <유물로 보는 양반의 일>, <일제강점기 유리원판 사>, <잃어버린 시간, 식민지의 > 등 희귀한 자료들을 특별 전시하였다.","<a href=""https://swb.skku.edu/museum/index.do""target=""_blank"" title=""성균관대학교 박물관"">https://swb.skku.edu/museum/index.do</a>"
성기동국민관광지,127625,인문(문화/예술/역사),휴양관광지,관광단지,http://tong.visitkorea.or.kr/cms/resource/76/1607976_image2_1.jpg,전라남도,126.6326202249,34.7554114459,"성기동국민관광지는 전라남도 영암군 군서면 동구림리에 있는 관광 시설이다. 성기동은 백제 때부터 형성된 마을이다. 백제 때 왕인(王仁) 박사(博士), 통일 신라의 때의 도선 국사(道詵國師), 형미 선사(逈微禪師), 경보 선사(慶甫禪師), 고려 시대의 최지몽(崔知夢), 조선 시대의 수미 왕사(守眉王師) 등 성현들이 태어난 곳이다.
관광 자원의 개발을 통한 국민 관광지의 저변 확대를 위해 각 도별로 대상 지역을 확정하였으며, 왕인 박사의 전설이 서려 있는 성기동을 1986년 6월 23일 성기동 국민 관광지로 개발하였다. 관광지 내에는 왕인 박사 유적지와 함께 탄생지, 문산재, 양사재, 돌정 고개, 상대포, 회사정 등 왕인 박사 관련 관광 자원이 분포되어 있다. 또 인근에는 월출산 국립공원의 구정봉, 천황봉, 구름다리, 칠치 폭포, 천황사, 도갑사 등 관광 자원이 분포되어 있다. 성기동 국민 관광지는 현재 왕인 박사 유적지에 포함되어, 왕인 박사 유적지에서 같이 관리하고 있다.
1996년 3월 12일 성기동 국민 관광지에서 제1회 영암 왕인 문화 축제가 시작된 이래 매년 계속되고 있다. 매년 4월이면 왕인 문화 축제와 벚꽃 축제가 열리고 있다.",
성김대건신부표착기념관,2752772,인문(문화/예술/역사),역사관광지,종교성지,http://tong.visitkorea.or.kr/cms/resource/88/3396988_image2_1.jpg,제주특별자치도,126.1677385965,33.3228915301,"이 곳은 한국 최초로 천주교를 널리 알리고자 했던 김대건신부의 의지가 담아 기념할 수 있게 만든 곳이다. 한적한 해안가 마을 용수리에 위치한 성김대건신부 표착기념관은 우리나라의 첫 신부인 성 김대건신부와 제주 천주교 교회의 역사를 엿볼 수 있는 곳이다. 성 김대건신부는 라파엘호를 타고 중국에서 우리나라에 천주교를 전파하러 오던 중 풍랑을 만나 제주도 용수리 해안에 표착하게 되었는데 그곳에서 한국 최초로 미사와 성체 성사를 한 신부이다. 기념관은 총 2층과 옥상전망대로 이루어져 있고 1층에는 영상이나 이미지를 볼 수 있는 공간, 2층에는 김대건 신부님의 업적 등을 소개하고 천주교가 들어오기까지의 험난한 과정을 알게 해주는 전시품들, 억압 당시 사용되었던 도구 등이 전시되어 있다. 건물의 가장 위층 옥상전망대에서는 멀리 차귀도가 보이고 용수리의 아담한 마을 풍경과 제주올레 12코스와 13코스를 잇는 용수포구가 한눈에 내려다 보인다. 기념관 옆에 작은 성당은 성 김대건 신부가 사제 서품을 받은 김가항 성당 모습을 재현했고, 지붕은 파도와 라파엘호를 형상화했다. 성당은 미사 시간을 제외하고는 누구나 자유롭게 관람이 가능하다.

(출처 : 제주 문화관광 홈페이지)","<a href=""https://www.visitjeju.net/u/EnR"" target=""_blank"" title=""새창 : 홈페이지로 이동"">www.visitjeju.net</a>"
성끝 벽화 마을,3084414,인문(문화/예술/역사),체험관광지,이색체험,http://tong.visitkorea.or.kr/cms/resource/94/3084294_image2_1.jpg,울산광역시,129.4322058261,35.4812460959,"방어진항과 슬도항의 나직한 언덕 위에 형성된 마을로 좁게 이어진 골목길을 따라 담장 전면을 파스텔색으로 도색을 하고 벽화를 그려 마을 전체가 화사하고 아늑한 느낌을 주는 조그마한 벽화마을이다. 성끝마을은 오래된 마을로 개발에 대한 논의가 있었지만 2012년 아름답고 특색 있는 마을길 조성 사업지로 선정되면서 벽화 골목과 둘레길을 조성하고 그 후로 몇 차례 보수를 거쳤다. 지역 예술가들과 마을 주민들이 힘을 합쳐 조성했고, 자기 집 담장을 벽화마을 조성에 선뜻 내어 주는 등 힘을 모았다. 벽화 중에는 울산의 상징인 고래 그림이 많다.
벽화들을 감상하며 마을 골목길을 따라 올라가면 슬도 앞바다가 한눈에 내려다보이는 전망 포인트가 나온다. 파란 바다를 배경으로 밭과 시골마을 풍경이 고즈넉하고 평화롭게 펼쳐지고 마을에는 작은 카페와 식당이 있어 벽화를 둘러보다가 잠시 쉬어갈 수도 있다. 봄이면 성끝마을 인근의 해안가 언덕은 노란 유채꽃 물결이 일렁이고, 5월에서 7월이면 성끝마을 골목을 지나 성끝4길 지점에 샤스타데이지 군락지가 하얗게 펼쳐진다.",
성남 중앙공원,127372,인문(문화/예술/역사),휴양관광지,공원,http://tong.visitkorea.or.kr/cms/resource/28/2482828_image2_1.jpg,경기도,127.1211633076,37.3802895361,"성남시는 경기도의 중앙부,  서울특별시의 남쪽에 위치하고 있다. 동쪽은 광주시 중부면과 광주읍 오포면 서쪽은 과천시와 의왕시, 남쪽은  용인시 수지면, 북쪽은  서울시 서초구, 송파구, 강남구에 접하고 있다. 본디 한가로운 농촌이었으나  1960년대 후반 서울시 철거민 주택단지 조성사업이 시작되면서 인구가 급증했으며 1973년 광주시에서 떨어져나와 시로 승격했다. 중앙공원은 영장산(해발 88m) 자락에 조성되었으며, 기존지형 및 수림을 최대한 보존하면서 새로이 식재되는 수목은 기존의 야생수목을 외지에서 이식, 향토적인 정취를 느낄 수 있도록 했다. 시민들이 쉽게 접근하게끔 계단이 없는 육교 4개소와 투수콘포장 산책로를 설치하였다. 특히 공원을 가로지르는 분당천을 유입시켜 경주의 동궁과 월지 같은 전통미를 살린 3,800평 규모의 연못도 조성해 놓았다. 분당의 한복판인 수내동 중앙공원에는 고려 말 이색의 후손인 한산 이씨 묘역이 조선 중기부터 후기까지 모습 그대로 남아있다. 이곳에는 토정 이지함의 조부인 이장윤 등의 묘가를 비롯해 정남향과 남서향으로 이씨 종친회 묘역이 자리잡고 있다.  수내동 가옥도 바로 이 공원 안에 있다.<br>","성남 문화관광 <a href=""https://www.seongnam.go.kr/main.do"" target=""_blank"" title=""성남시청 홈페이지로 이동"">https://www.seongnam.go.kr/main.do</a>"
성남도,580768,자연,자연관광지,섬,,전라남도,126.0445804813,34.4006778523,"성남도는 진도군 조도면에 있는 섬이다. 1700년경 김해 김씨 김원산의 8대 조가 나주에서 옮겨와 살았으며 이어서 광산 이씨가 이주하여 왔는데 입도조의 6대손인 이남규 등 14 가구가 정주하였다. 이 섬에서는 해적들이 조세 운반선의 곡물 등을 노략질하며 살아왔는데 해적 두목은 자신의 성인 성씨와 이 섬이 남방에 있다 하여 [성남도]라 부르게 되었다고 한다. 일제강점기 때 일본군이 대포로 새 머리같이 생긴 부분을 갈라놓아서 성남도에는 앞으로 인물이 나올 수 없다는 이야기가 전해온다.
조도군도 가운데 가장 북쪽에 위치하고 있으며, 최고 높이는 104m이다. 대부분 지역은 경사가 완만한 산지로 이루어져 있고, 암석해안이 대부분이다. 북쪽과 서쪽 해안 일대에는 높은 해식애가 발달해 있다. 또한 성남도 해안은 가파르고 연안에는 갯벌 하나 없이 바위로만 둘러져 있다. 
성남도의 남쪽에 부속 섬이 둘 있다. 상갈도와 하갈도로 지금은 무인도가 되었으며, 상갈도의 경우엔 개인 소유의 섬이고 하갈도는 국유지이다.","<a href=""http://www.jindo.go.kr/tour/main.cs"" target=""_blank"" title=""새창: 진도군 관광문화 홈페이지로 이동"">http://www.jindo.go.kr/tour/main.cs</a><br/><a href=""http://island.haewoon.co.kr/"" target=""_blank"" title=""새창 : 가보고 싶은 섬 사이트로 이동"">http://island.haewoon.co.kr</a>"
성남문화원,129859,인문(문화/예술/역사),문화시설,문화원,http://tong.visitkorea.or.kr/cms/resource/03/3053503_image2_1.jpg,경기도,127.1409154044,37.4391330692,"성남문화원은 지역 문화의 전통문화 발굴 보존과 각종 문화행사를 주최하고 문화중심 사랑방 역할을 수행하는 문화시설이다.
성남시의 각종 문화 행사의 일환인 성남사랑글짓기 대회, 강정일당상 시상, 정월대보름 민속축제, 둔촌중국백일장, 송산백일장, 경기도 민속예술제 ‘최우수상’, 경기도 청소년민속예술제 ‘최우수상’, 둔촌문화제 등 총 40여 행사를 개최하여 지역주민들의 문화 욕구 총족을 위해 노력하고 있다. 
이 외에도 문화학교를 운영을 통해 수준 높은 문화생활을 할 수 있도록 돕고 있다. 문화 강좌로는 민요, 한문 서예, 한국 무용, 판소리, 가야금, 풍물 등이 있다.","성남문화원 <a href=""http://www.seongnamculture.or.kr/"" target=""_blank"" title=""새창 : 성남문화원 홈페이지로 이동"">http://www.seongnamculture.or.kr</a>"
성남숯불갈매기살,2841223,음식,음식점,한식,http://tong.visitkorea.or.kr/cms/resource/03/2841203_image2_1.jpg,경기도,127.0997062111,37.3069004325,"성남숯불갈매기살은 경기도 용인시 기흥구 보정동에 있는 숯불구이 맛집이다. 1985년 성남 중원구 여수동에서 개업해서 오랜 시간 영업하다 현재 위치로 확장 이전한 식당으로 30년 이상 갈매기살 한 가지 메뉴로 승부해온 맛집이다. 돼지 한 마리에서 4kg밖에 안 나오는 갈매기살을 직접 개발한 양념으로 버무린 갈매기살이 대표 메뉴이다. 주문할 때 이야기하면 생갈매기살로 먹을 수 있고, 최근에는 가브리살(등겹살)도 메뉴에 추가해 돼지고기 특수부위 고깃집으로 변화를 꾀하고 있다. 고기를 먹은 후 물냉면이나 비빔냉면, 된장찌개를 즐길 수 있다. 인근에 대형 쇼핑몰이 있고, 수지도서관, 광교호수공원 등도 있다.",
