title,contentid,cat1,cat2,cat3,firstimage,region,mapx,mapy,overview,homepage
홍천 인삼한우명품축제,790124,인문(문화/예술/역사),축제,일반축제,http://tong.visitkorea.or.kr/cms/resource/95/2853995_image2_1.jpg,강원특별자치도,127.8934898344,37.689465068,"제22회를 맞이한 홍천 인삼·한우 명품축제는 긴 전통을 자랑하는 홍천군의 축제이다. 홍천의 대표전인 특산물인 인삼과 한우를 소개한다. 홍천의 대표명품 '6년근인삼'과 '늘푸름홍천한우'를 만날 수 있는 명품축제이다. 다양한 무대행사와 이벤트, 민관군 화합한마당 민속행사 등 온가족이 함께 즐길 수 있는 강원특별자치도 최고의 명품축제이다.","<a href=""http://xn--9y5b95fmvab9w.kr/Home/H50000/festival"" target=""_blank"" title=""새창 : 홍천 인삼한우명품축제"">http://xn--9y5b95fmvab9w.kr/Home/H50000/festival</a>"
"홍천 중앙시장 (1,6일)",132272,쇼핑,쇼핑,5일장,http://tong.visitkorea.or.kr/cms/resource/48/2770048_image2_1.jpg,강원특별자치도,127.886129343,37.6910786322,"홍천읍 진리에 옛부터 나루터가 있었는데 서울에서 어염(魚鹽)을 비롯한 각종 생활용품이 배에 실려 북한강을 거슬러 홍천읍 진리 나룻터에 닿으면 도가(都家)들이 물건을 받고 이 지방 산물들이 배에 실려 서울로 올라갔다. 따라서 이 나루터를 중심으로 각종 물건들이 집중되면서 사람들이 몰려 진리 나루터 도로연변으로 홍천5일장이 형성되었다. 그후 도로교통이 발달하고 뱃길이 끊기면서 시장도 자연 홍천읍 중심부인 현위치로 옮겨졌다. 

홍천의 모든 상거래는 이곳에서부터 시작되고 있으며 업태도 다양하다. 또한 유흥음식점, 대중음식업 등도 이 지역에 몰려 있어 소비의 중심지이기도 하다. 
홍천 중앙시장 및 구시장과 그 도로변을 중심으로 5일만에 서는 홍천장은 1일과 6일에 서며, 철 따라 기이한 물건들이 전국 각처에서 모이는 전국에서도 몇째 안 가는 큰 장이다. 그리고 홍천의 별미, 홍천에서만 맛볼 수 있는 올챙이국수를 이곳에서 만날 수 있다.",
홍천 풍암리 동학혁명군전적지,250290,인문(문화/예술/역사),역사관광지,유적지/사적지,http://tong.visitkorea.or.kr/cms/resource/08/3385308_image2_1.JPG,강원특별자치도,128.1847231148,37.1750494254,"홍천 풍암리 동학혁명군전적지는 조선 후기 동학농민군이 관군과 싸웠던 전적지이다. 고종 31년(1894) 교조신원운동의 실패와 전라도 고부군수 조병갑의 포악한 정치가 원인이 되어 동학접주인 전봉준이 나라 일을 돕고 백성을 편안하게 하게 하자는 내용으로 동학농민운동을 일으켰다. 당시 홍천 지방에서도 농민 운동이 크게 일어나 농민군의 일부가 관아를 공격하고자 산에서 내려와 장야촌까지 진군하였으나, 관군 총사령관 맹영재와 싸워 동학군 30여 명이 전사하였다. 여기에서 패한 동학군은 풍암리에 집결하여 최후의 항전지인 자작고개에서 김숙현을 중심으로 관군과 싸웠으나 끝내 패하여 동학농민운동은 실패하고 말았다.
1976년 자작고개에서 지역 주민들에 의해 유해 더미가 발견되었는데, 당시 사망자를 800여 명으로 추정하지만 부상자를 함께 묻었다고 하니 그 수는 더 많을 것이라고 보고 있다. 지금도 풍암리 주민들은 전투에 동학교도로서 참가하였다가 전사한 사람들의 제사를 음력 10월 20일부터 수일간 많은 집이 지내고 있음을 볼 수 있다. 현재 이곳에는 동학군전적기념비가 있다.","<a href=""https://www.hongcheon.go.kr/tour/selectTourCntntsWebView.do?tourNo=2162&pageUnit=6&pageIndex=4&searchCnd=all&key=1948&ctgry=28&searchShowAt=Y"" target=""_blank"" title=""새창 : 홍천군 문화관광 홈페이지로 이동"">https://www.hongcheon.go.kr/tour/</a>"
홍천강,125745,자연,자연관광지,강,http://tong.visitkorea.or.kr/cms/resource/65/1955765_image2_1.jpg,강원특별자치도,127.7131451142,37.6885868106,"홍천강은 한강의 주요한 지류로, 강원도 홍천군 서석면에서 발원하여 청평호로 흘러든다. 홍천강은 강원도의 대표적인 관광지로, 강 유역이 넓고 주변에 관광지가 많아 레포츠, 캠핑, 낚시 등 다양한 활동을 즐길 수 있다. 수심이 낮고 수온이 따뜻하며,어종이 다양하고 풍부해 어느 곳에서나 낚시가 가능하다. 상류에서부터 굴지리·팔봉산·밤벌·마곡등의 여러 유원지가 있다.  물이 차고 깨끗한 최상류의 굴지리유원지는 한적한 편이며, 팔봉산유원지는 수심이 얕은 데다 가벼운 산행을 즐길 수 있고, 밤벌유원지는 강변에 덮인 자갈과 모래가 아름다운 풍경을 자아낸다. 청평호로 이어지는 마곡유원지는 수심이 깊어 보트 놀이와 제트스키 등의 수상 스포츠를 즐길 수 있다. 홍천강에는 선녀가 목욕을 즐겼다는 미약골, 용소암과 용소약수가 있는 용소계곡, 사람이 살만한 둔덕이라는 뜻의 살둔계곡 등 아름다운 계곡이 많다. 홍천강 오토캠핑장에서는 매년 별빛음악 맥주축제를 개최하며, 1월에는 겨울철 대표축제중 하나인 홍천강 꽁꽁축제가 열린다. 홍천강 주변에는 신라 성덕왕 7년에 창건된 수타사, 해발 462m의 금학산, 8개의 봉우리가 공작새의 날개를 펼친 듯한 팔봉산 등 다양한 관광명소가 있다.",
홍천강 꽁꽁축제,1769697,인문(문화/예술/역사),축제,일반축제,http://tong.visitkorea.or.kr/cms/resource/45/2932845_image2_1.jpg,강원특별자치도,127.8872209854,37.6885539455,"매년 겨울 인삼송어와 함께하는 홍천강 꽁꽁축제가 강원도 홍천에서 펼쳐진다.남녀노소 손쉽게 즐길 수 있는 얼음낚시와 맨손으로 잡는 맨손송어잡기 그리고 눈으로 보고 낚시를 할 수 있어 아이들에게 인기만점인 가족실내낚시터까지!올해는 몸길이 45cm 이상 슈퍼인삼송어와 함께 더욱 짜릿한 즐기움을 느껴보자.이외에도 실내 가족체험관과, 눈썰매장, 시골의 정취를 느낄 수 있는초가집 풍경, 겨울철 민속놀이터, 향토음식점 등 먹거리, 놀거리가 다양하게 준비되어 있다.","<a href=""http://xn--9y5b95fmvab9w.kr/Home/H60000/festival"" target=""_blank"" title=""새창:홍천강 꽁꽁 축제 홈페이지로 이동"">http://www.hccf.or.kr</a>"
홍천강 별빛음악 맥주축제,2539802,인문(문화/예술/역사),축제,일반축제,http://tong.visitkorea.or.kr/cms/resource/45/2827445_image2_1.jpg,강원특별자치도,127.8931204292,37.6892539747,"홍천강 별빛음악 맥주축제는 전국 최대 규모의 맥주공장인 하이트 강원공장에서 갓 생산된 Kelly캘리 생맥주와 홍천군에 소재한 수제맥주사의 특별한 맥주를 맛볼 수 있다 . 또 전국 최초의 Wet(젖다) Dance 대회와 함께 신나는 EDM, 렙, 힙합 등 다양한 장르의 무대공연을 관람할 수 있으며 다양한 이벤트 및 불꽃놀이로 홍천에서의 뜨거운 여름밤을 보낼 수 있다.","<a href=""http://xn--9y5b95fmvab9w.kr/Home/H30000/festival"" target=""_blank"" title=""새창: 홍천강 별빛음악 맥주축제 홈페이지로 이동"">http://xn--9y5b95fmvab9w.kr/Home/H30000/festival</a>"
홍천강 자라바위 오토캠핑장,2755701,레포츠,육상 레포츠,"야영장,오토캠핑장",http://tong.visitkorea.or.kr/cms/resource/89/3422589_image2_1.jpg,강원특별자치도,127.6852559821,37.6885140795,"팔봉산이 내려다보는 곳에 위치한 홍천강 자라바위 오토캠핑장은 개울을 끼고 있어 여름 물놀이를 하기에 좋은 곳이다. 가로수길을 따라 산책을 하며 힐링할 수 있다. 부대시설로는 공연장, 샤워시설, 개수대, 전기, 온수제공이 있다. 어린이 놀이터가 있어 아이들과 함께 즐거운 시간을 보내기에 좋다. 주변 관광지로는 팔봉산 등산, 홍천강 등이 있다.","<a href=""https://www.hongcheon.go.kr/tour/contents.do?key=1886"" target=""_blank"" title=""새창 : 자라바위 오토캠핑장 홈페이지로 이동"">https://www.hongcheon.go.kr/tour/contents.do?key=1886</a>"
홍천강래프팅,3074861,레포츠,수상 레포츠,래프팅,,강원특별자치도,127.7029125174,37.6951414152,"홍천강래프팅은 강원도 홍천에 위치한 레저스포츠 시설이다. 홍천강은 길이 143km로 강 유역이 넓어 다양한 액티비티를 즐길 수 있으며 여름휴가 장소로도 많이 알려져 있다. 홍천강은 래프팅으로 유명한 동강에 비해 급류가 세지 않아 남녀노소 누구나 도전해 볼 만하다. 래프팅 코스는 홍천강 유원지에서 시작해 팔봉산 밤벌 유원지까지이며 1시간 30분에서 2시간 정도 소요된다. 래프팅 외에도 ATV, 서바이벌 등 다양한 즐길 거리가 있는 홍천강래프팅은 서울에서 멀지 않아 당일 여행 코스로도 제격이다.","<a href=""http://www.hc-rafting.com/xe/index.php?mid=sub11"" target=""_blank"" title=""새창 : 홈페이지로 이동"">http://www.hc-rafting.com</a>"
홍천강오토캠핑장,2734324,레포츠,육상 레포츠,"야영장,오토캠핑장",http://tong.visitkorea.or.kr/cms/resource/63/2735663_image2_1.JPG,강원특별자치도,127.7872522242,37.6903352073,홍천군청에서 관리하는 홍천강오토캠핑장. 지역민들을 위한 시설로 저렴하게 이용할 수 있다. 아이들이 즐길 수 있는 놀이터와 홍천강에서 수상레포츠를 즐길 수 있어 캠핑과 수상레포츠를 함께 즐길 수 있다. 홍천강에서 다슬기를 잡거나 가볍게 물놀이도 즐길 수 있다.,"<a href=""https://www.hongcheon.go.kr/tour/contents.do?key=1879"" target=""_blank"" title=""새창 : 홍천강오토캠핑장 사이트로 이동"">https://www.hongcheon.go.kr/tour/contents.do?key=1879</a>"
홍천강이야기글램핑,2791968,레포츠,육상 레포츠,"야영장,오토캠핑장",http://tong.visitkorea.or.kr/cms/resource/64/2794464_image2_1.jpg,강원특별자치도,127.6252363234,37.69230975,"홍천강 이야기 글램핑은 차박으로 소문난 홍천강 개야리 유원지 안쪽에 있다. 강을 바라보고 왼쪽이 글램핑, 오른쪽이 펜션 동이다. 중간에는 수영장과 넓은 데크 쉼터가 있다. 주차장도 넓어 편하게 이용할 수 있다. 글램핑은 4동에 불과하지만, 아기자기하게 꾸며져 있다. 침대, 에어컨, TV, 전자레인지 등을 갖추고 있어 펜션 객실처럼 편리하게 이용할 수 있고, 바비큐도 개별 공간에서 즐길 수 있다.","<a href=""https://xn--939az3bg41buzbs9jk9p.kr/"" target=""_blank"" title=""새창 : 홍천강이야기 홈페이지로 이동"">https://xn--939az3bg41buzbs9jk9p.kr/</a>"
홍천강한우타운,2892030,음식,음식점,한식,http://tong.visitkorea.or.kr/cms/resource/07/2891707_image2_1.jpg,강원특별자치도,127.6995157396,37.6905113344,"홍천강 한우타운은 강원도 홍천에 있는 가성비 좋은 정육식당이다. 팔봉산에서도 가깝고 소노펠리체 CC에서도 가까워 등산객이나 골퍼들이 즐겨 방문하는 고깃집이다. 정육점에서 먼저 고기를 고른 후에 상차림 비용을 내고 구워 먹으면 된다. 품질 좋은 고기를 제공해 식사 후 포장하는 경우도 많다. 고기 외에 한우국밥, 왕갈비탕, 뚝 불고기 등 단품 메뉴도 있다. 매장 앞에 널찍한 전용 주차장이 있어 주차하기 편리하다.","<a href=""http://www.홍천맛집.kr""target=""_blank"" title=""새창 : 홍천강한우타운 사이트로 이동"">http://www.홍천맛집.kr</a>"
홍천교육도서관,1626209,인문(문화/예술/역사),문화시설,도서관,http://tong.visitkorea.or.kr/cms/resource/77/1583777_image2_1.jpg,강원특별자치도,127.8838073105,37.6917868398,"홍천 도서관은 1970년 9월 개관 이래 지역주민의 지적 수준 향상과 지식ㆍ정보를 위한 건전한 시민의 문화공간으로 그 역할을 다하고 있다. 평생교육의 중요성을 인식하여 다양한 문화프로그램 개발에 힘쓰며 배움의 터전을 가꾸어 가고 있다. 홍천교육도서관은 총 4층 규모로 건립되어 80,000여 권의 장서와 3,500여 점의 비도서 자료를 보유하고 있다.
1층에는 문학 자료실, 2층에는 어린이 자료실과 문학을 제외한 모든 도서가, 3층에는 학생과 일반 학습실, 문화 교실로 구성이 되어 있으며 4층에는 서고와 대회의실, 대입 지원관실이 있다. 특히 2층 어린이, 유아 자료실은 온돌방으로 되어있어 어린이들이 편안한 자세로 책을 읽을 수 있는 독서환경을 조성하였다.
이외에도 홍천교육도서관은 문화강좌실, 인터넷 활용, DVD자료실, 휴대폰충전함 등 다양한 시설을 운영하며 이용자들에게 더 나은 서비스를 위하여 노력하고 있다.","<a href=""http://lib.gwe.go.kr/hclib"" target=""_blank"" title=""새창 : 홍천도서관 홈페이지로 이동"">http://lib.gwe.go.kr/hclib</a>"
홍천농가맛집,3076689,음식,음식점,한식,http://tong.visitkorea.or.kr/cms/resource/13/3303513_image2_1.jpg,강원특별자치도,127.6843805694,37.6104925613,"홍천농가맛집은 강원도 홍천의 청정 자연 속에 위치한 전통 한식당이다. 비발디파크 근처에 위치해 있으며, 현지 도민들 사이에서 소문난 맛집이다. 신선한 재료와 정성을 담아 준비된 20첩 반상 돌솥밥이 메인 메뉴로, 건강을 생각한 다양한 한식 메뉴를 제공한다. 직접 재배한 채소를 사용하여 음식의 신선함과 맛을 자랑하며, 아늑하고 편안한 인테리어는 고객들이 대기 시간을 기꺼이 받아들일 수 있도록 한다. 매월 체험단을 모집하여 특별한 맛을 많은 사람들에게 알리고 있으며, 리뷰 이벤트를 통해 고객의 소중한 피드백을 반영하고 있다. 홍천농가맛집은 단체 회식 장소로도 인기가 높아 가족, 친구, 동료들과 함께 즐기기에 완벽한 장소이다. 강원도 홍천의 자연을 배경으로 건강한 웰빙 밥상을 제공하며, 방문객들에게 특별한 식사 경험을 선사한다.",
홍천동키마을,2704983,인문(문화/예술/역사),체험관광지,농.산.어촌 체험,http://tong.visitkorea.or.kr/cms/resource/26/2388126_image2_1.JPG,강원특별자치도,127.9600624838,37.7523673497,"강원도 홍천군 화촌면에 있는 홍천동키마을은 홍천의 명물인 당나귀 체험공간 동키테마타운과 홍천벌꿀영농조합이 함께 만든 테마타운이다. 기존의 당나귀 체험 공간에 꿀벌과 관련된 각종 체험시설, 토종꿀 등 다양한 상품을 판매, 전시하는 곳으로 서울에서 약 1시간 거리에 있어 당일치기 여행으로 손색이 없다. 홍천동키마을은 승나체험을 할 수 있는 다원형의 트랙장, 피부미용과 아토피 치료에 좋은 당나귀 우유를 이용한 족욕체험장, 프로폴리스와 천연 밀납초 만들기 체험 등을 할 수 있는 실내체험관 등을 갖추고 있다. 이밖에 각종 희귀 동물을 만날 수 있는 미니동물원, 소형트랙 등으로 즐길 거리가 풍부하다.","<a href=""http://www.donkeyvillage.kr/"" target=""_blank"" title=""새창 : 홈페이지로 이동"">http://www.donkeyvillage.kr/</a>"
홍천동키마을 메밀꽃축제: 삼포 가는 길,3362866,인문(문화/예술/역사),축제,일반축제,http://tong.visitkorea.or.kr/cms/resource/11/3362811_image2_1.png,강원특별자치도,127.9592625574,37.7523562246,"홍천동키마을에서 열리는 메밀꽃축제는 자연 속에서 피어나는 메밀꽃의 아름다움과 풍성한 볼거리, 먹거리를 함께 즐길 수 있는 축제이다. 당나귀체험과 메일을 활용한 다양한 체험프로그램을 즐길 수 있다 .","<a href=""https://www.xn--p50b7i49w7var22dita35uc3k6b.com/163"" target=""_blank"" title=""새창 : 홍천동키마을 메밀꽃축제: 삼포 가는 길		
 홈페이지 이동"">www.홍천농촌문화터미널.com</a>"
홍천뚝배기,133112,음식,음식점,한식,http://tong.visitkorea.or.kr/cms/resource/68/1980268_image2_1.jpg,경상남도,128.1176260114,35.1850663886,"경상남도 진주시에 위치한 해장국 전문점이다.
토종 돼지뼈를 사용하여 3시간가량 각종 양념과 채소를 첨가하여 끓여내 그 맛이 담백하고 얼큰 시원하다.
뼈다귀 해장국, 콩나물 해장국, 감자탕 등 해장국 메뉴를 맛볼 수 있고 자정까지 운영하고 있어 늦은 시간에도 부담 없이 방문할 수 있다.",
홍천뚝배기,2688090,음식,음식점,한식,http://tong.visitkorea.or.kr/cms/resource/34/2701434_image2_1.jpg,전라남도,127.4819678595,34.9725902556,매장에서 직접 끓여서 판매하는 곳이다. 전라남도 순천시에 있는 한식전문점이다. 대표메뉴는 감자탕이다.,
홍천메밀가막국수,2837997,음식,음식점,한식,http://tong.visitkorea.or.kr/cms/resource/85/2837985_image2_1.jpg,강원특별자치도,127.6964080461,37.67831547,"비발디파크, 오션월드 입구에 있는 홍천메밀가는 막국수 전문점이다. 특제 간장 소스에 육수와 황태채, 깻가루를 섞어 참기름에 비벼 먹는 참깨 막국수가 대표 메뉴이다. 육회, 물, 비빔 막국수도 주문할 수 있다. 동절기에는 온 막국수도 가능하다. 일행 중 막국수를 즐기지 않는 사람이 있다면 한우 국밥을 추천한다. 곁들이는 메뉴로는 돼지고기 수육과 감자전이 있다. 온 가족이 식사하기 좋고, 단체 및 포장도 가능하다. 주말이나 휴가철 식사 시간대에는 웨이팅을 고려해 방문하는 것이 좋다.		
※반려동물 동반 가능","<a href=""http://홍천메밀가.com""target=""_blank"" title=""새창 : 홍천메밀가 사이트로 이동"">http://홍천메밀가.com</a>"
홍천문화예술회관,1722441,인문(문화/예술/역사),문화시설,공연장,http://tong.visitkorea.or.kr/cms/resource/34/3021034_image2_1.jpg,강원특별자치도,127.8954063416,37.688995714,"홍천문화예술회관은 다양한 문화 공연을 통해 문화적 소양을 발전시키고자 노력하고 있는 곳이다. 1995년 3월 23일 개관하였으며 지역 주민들을 위해 다양한 장르의 공연, 전시 등 문화행사가 열리는 공간으로 활용되고 있다. 지하 1층, 지상 2층 건물로, 공연장은 649㎡, 전시실은 292㎡의 규모로 구성되어 있다. 주요 시설로는 공연장(497석), 강당(100석), 소전시실과 전시실 등이 있다. 공연장과 전시실은 대관 신청이 가능하다. 매월 마지막 주 수요일은 [문화가 있는 날]로 무료로 공연을 관람할 수 있다.","<a title=""새창 : 홍천문화재단 예술회관 페이지로 이동"" href=""https://www.hccf.or.kr/Home/index"" target=""_blank"">https://www.hccf.or.kr/Home/index</a>"
홍천미술관,3037222,인문(문화/예술/역사),문화시설,전시관,http://tong.visitkorea.or.kr/cms/resource/01/3037201_image2_1.jpg,강원특별자치도,127.8890067694,37.6941394421,"강원도 홍천군 홍천읍에 위치한 홍천미술관은 1956년 구 홍천군청으로 사용되던 건물이다. 1986년부터 2007년까지 홍천읍 사무소로 사용되다가 2014년 리모델링을 거쳐 현재의 홍천미술관으로 개관하였다. 본관 건물은 당시 강원도에 조성되었던 군청사 중 유일하게 남아 있는 것으로, 근대문화유산 등록문화재로 지정되었다. 
본관 1층에는 두 개의 전시실이 있으며 2층에는 강의실로 사용되는 다목적실과 민간예술 단체 사무실이 있고, 2021년 새롭게 증축한 신관 건물은 수장고를 비롯한 전시실과 체험실이 있다. 신관 건물에는 공유 커뮤니티 공간이 새롭게 오픈해 관람객과 문화예술인들을 위한 쉼터로 조성되었다. 1층에서는 미술 전시 주제에 따라 무료 체험을 할 수 있으며 맛있는 커피도 무료로 제공된다. 2층 공유 회의실은 10명까지 사용 가능하며 간단한 신청서를 작성하거나 예약을 통해 사용할 수 있는 오픈 회의실로 운영된다. 
총 2,500여 점의 소장품을 보유하고 있는 홍천 박물관은 소장품 일부를 공개하여 전시회를 개최하기도 하며, 기획 전시와 대관 전시를 개최해 지역민의 문화 향유의 거점 역할을 다 하고 있다. 이 외에도 미술강좌 프로그램을 운영하고 있다.","<a href=""https://www.hongcheon.go.kr/museum/introduce/"" target=""_blank"" title=""새창 : 홈페이지로 이동"">https://www.hongcheon.go.kr/museum/introduce/</a>"
홍천반딧불캠핑장,2909474,레포츠,육상 레포츠,"야영장,오토캠핑장",http://tong.visitkorea.or.kr/cms/resource/57/2909457_image2_1.JPG,강원특별자치도,127.8960672753,37.7865344047,"반딧불 캠핑장은 홍천 구성포리 산골에 위치한 작은 캠핑장이다. 단 8개의 사이트만 있는 소규모의 캠핑장이라서, 조용하고 한적한 캠핑을 즐길 수 있다. 바닥은 파쇄석이고, 사이트마다 개별 화장실이 설치되어 있어서, 편리하고 쾌적하다. 사이트 앞으로는 시원한 계곡이 흐르고 있어, 아이들과 물놀이를 하기 좋다. 또한 밤에는 수많은 별을 볼 수 있어 캠핑의 로망인 불멍과 별멍을 하기 최적이다. 인기에 비해 규모가 작아 예약이 어려운 것이 단점이다.","<a href=""https://blog.naver.com/hongcheon_01""target=""_blank"" title=""새창 : 홍천반딧불캠핑장 사이트로 이동"">https://blog.naver.com/hongcheon_01</a>"
홍천사과축제,2873042,인문(문화/예술/역사),축제,일반축제,http://tong.visitkorea.or.kr/cms/resource/28/2873028_image2_1.jpg,강원특별자치도,127.8933204084,37.6893539667,"따사로운 햇살과 깨끗한 공기가 어우러진 청정지역 홍천에서 높은 당도와 아삭한 식감을 자랑하는 홍천 사과축제가 9번째 맞이한다. 해발 100m ~ 1,000m 지역에서 달콤한 홍로부터 아리수, 시나노 골드 등 다양한 품정이 재배되고 있다. 풍성한 홍천 사과만큼 다양한 체험과 이벤트를 준비하여 방문객들에게 즐거움을 선사한다.","<a href=""http://xn--9y5b95fmvab9w.kr/Home/H40000/festival"" target=""_blank"" title=""새창 : 홍천사과축제"">http://hcapple.kr/shop</a>"
홍천식당,2582735,음식,음식점,한식,,대전광역시,127.3387387332,36.3541504895,"홍천식당은 오랜 전통과 노하우로 명맥을 이어가고 있는 콩나물비빔밥 맛집이다. 메뉴는 콩나물비빔밥, 콩나물해장국, 우거지해장국, 황태미역국, 떡갈비, 계란말이, 두부김치, 두부두루치기 등이 있다. 테이블 위에 간장 양념과 고추장 양념 두 가지가 기본적으로 놓여 있어 기호에 맞게 선택하여 즐길 수 있다. 30년 이상 운영해온 전통을 지니고 있으며, 대성 유성온천역 인근에 위치해 있어 접근성이 좋다. 인근에는 유성온천, 갑천 등이 있다.",
홍천와캠핑,2755711,레포츠,육상 레포츠,"야영장,오토캠핑장",http://tong.visitkorea.or.kr/cms/resource/07/2756307_image2_1.JPG,강원특별자치도,128.0304990748,37.8013963168,금요일 퇴근 후 오픈하는 캠핑장. 홍천와캠핑은 강원도 홍천군 내촌면에 자리 잡고 있다. 내촌천을 끼고 있어 여름에 시원한 물놀이를 할 수 있으며 민물낚시도 가능하다. 야외수영장에서는 아이들과 함께 가족들이 물놀이를 즐기기에 적합하다. 넓은 사이트를 자랑하며 밤에는 별을 보며 힐링할 수 있는 곳이다. 가족 캠핑장으로 운영하고 있다.,"<a href=""https://cafe.naver.com/wacamping.cafe"" target=""_blank"" title=""새창 : 홍천와캠핑 사이트로 이동"">https://cafe.naver.com/wacamping.cafe</a>"
홍천원조화로구이,2838013,음식,음식점,한식,http://tong.visitkorea.or.kr/cms/resource/03/2838003_image2_1.jpg,강원특별자치도,127.8311408065,37.6598978896,"홍천 나들목에서 가까워 강원도 여행 후 수도권으로 귀갓길에 들리기 좋은 홍천의 흑돼지 화로구이 전문점이다. 규모가 크지만 항시 손님들로 붐빈다. 빨간 양념이 식욕을 돋우는데, 양념구이 특성상 구울 때 자주 뒤집으며 구워 줘야 많이 타지 않고 맛있게 먹을 수 있다. 기본 반찬도 정갈하고 잡내 없는 흑돼지 구이가 인상적이다. 후식으로 막국수와 잔치국수로 마무리하면 좋다. 포장도 가능하다.",
홍천재래식손두부,2892043,음식,음식점,한식,http://tong.visitkorea.or.kr/cms/resource/54/2891754_image2_1.jpg,강원특별자치도,127.6068329198,37.6758918717,"홍천재래식손두부는 100% 홍천 콩을 직접 갈아 만든 손두부 전문점이다. 주메뉴는 짜박두부로 두부찌개나 조림과는 달리 얼큰하고 고소한 맛이 일품이다. 짜박이는 돼지고기를 넣고 자박하게 끓여 먹는 음식으로 들기름 두부구이를 같이 먹어도 좋다. 그 밖에 두부전골이나 순두부도 맛볼 수 있는데 순두부는 매주 금요일에만 만든다고 한다. 매장 앞에 주차 공간이 있지만, 손님이 많을 경우 다른 곳을 찾아 주차해야 한다.",
