title,contentid,cat1,cat2,cat3,firstimage,region,mapx,mapy,overview,homepage
그라노데카페,2847949,음식,음식점,카페/전통찻집,http://tong.visitkorea.or.kr/cms/resource/36/2847936_image2_1.jpg,부산광역시,129.2344209295,35.258700683,"부산 일광 해수욕장 근처에 있는 그라노데카페는 2층부터 3층 루프탑으로 운영되는 브런치 카페다. 일광 해수욕장에서 바로 올라올 수 있는 계단도 마련되어 있다. 카페 내부는 대리석 테이블과 파스텔톤 의자들이 놓여 있고 바다가 보이는 창가 쪽은 통창으로 하여 탁 트인 시야로 개방감이 있다. 그라노데카페의 가장 큰 매력은 바다 뷰를 보며 브런치 메뉴를 즐기는 것이다. 이곳의 인기메뉴는 바닐라라떼 위에 진한 에스프레소 크림이 가득 올라간 에스프레소 크림라떼와 새콤달콤한 수제청으로 만든 자몽티, 각종 크로플이다.","<a href=""https://www.instagram.com/granode_cafe_/""_blank"" title=""새창 : 그라노데카페 인스타그램으로 이동"">https://www.instagram.com/granode_cafe_/</a>"
그라데이션커피,2898994,음식,음식점,카페/전통찻집,http://tong.visitkorea.or.kr/cms/resource/82/2898982_image2_1.jpg,서울특별시,127.0503093754,37.5505990552,"그라데이션커피는 서울지하철 2호선 뚝섬역 2번 출구 성원어린이공원 인근에 있다. 매장에 전용 주차장은 없다. 복잡한 도심 속에 있다 보니 자가용보다는 버스나 지하철 등 대중교통을 이용하는 것이 편리하다. 이곳은 붉은 벽돌로 지어진 건물 1층에 있다. 매장 내부는 현대적이고 넓은 바 테이블 스타일로 고급스럽게 꾸며져 있다. 대표 메뉴로는 오늘의 블랙커피, 에스프레소, 아메리카노 등이 있고 이외에 밀크티, 모카 등이 있다.",
그라벨호텔,2917270,숙박,숙박시설,관광호텔,,제주특별자치도,126.4286648899,33.4924157657,"그라벨호텔은 제주 외도동 연대포구 근처에 있다. 그라벨은 gravel(자갈)과 Bell(아름다움. 프랑스어)의 조합 명사로 아주 아름다운 자갈이라는 뜻이다. 제주 유일의 역빈 해안인 알작지 해변 근처에 있어 지어진 이름이다. 모던하고 심플한 객실과 연회장, 비즈니스룸, 미팅룸 등을 갖추고 있다. 루프탑에는 인피니티풀이 있으며 최상층 클럽라운지가 있고, 알작지레스토랑, 풀사이드바 등 편의시설이 있다. 제주 공항과 가깝고 주변 여행지로 알작지해변, 이호테우해변, 연대포구 등이 있다.","<a href=""https://grabelhotel.com/""target=""_blank"" title=""새창 : 그라벨호텔 사이트로 이동"">https://grabelhotel.com/</a>"
그라벨호텔_제주점,2903432,쇼핑,쇼핑,사후면세점,http://tong.visitkorea.or.kr/cms/resource/99/2886999_image2_1.jpg,제주특별자치도,126.4286648899,33.4924157657,-,www.grabelhotel.com
그라스원,2738018,인문(문화/예술/역사),휴양관광지,공원,http://tong.visitkorea.or.kr/cms/resource/14/2738414_image2_1.jpg,경상북도,128.731425544,36.5585664812,"안동을 가로지르는 낙동강을 따라 낙동강 변 산책로가 조성되어 있다. 이 산책로를 따라가면 영가대교 북단에 다양한 꽃과 식물들이 식재된 그라스원 테마공원이 있다. <br>그라스원은 계절에 따라 각기 다른 매력을 뽐낸다. 특히 가을에는 핑크뮬리가 장관을 이뤄 사람들에게 최고의 포토존을 선사하고 있다.
주변에 백조공원이 함께 조성되어 있으며 자전거길과 산책로가 있어 맑고 청정한 낙동강 경치를 감상할 수 있다. <br>*사진 출처: 안동시 공식 블로그 '마카다안동'",
그라시아펜션,2907234,숙박,숙박시설,펜션,http://tong.visitkorea.or.kr/cms/resource/31/2907231_image2_1.jpg,강원특별자치도,129.2720297377,37.3188925817,"강원도 삼척시 근덕면에 있는 펜션이다. 객실 앞에 야외수영장이 있고, 주변에 파라솔과 의자가 있다. 야외수영장은 하절기에 운영하며, 한여름 뜨거운 햇빛과 파란 하늘, 빨간 파라솔, 흰색의 펜션 건물이 이국적인 분위기를 자아낸다. 밤에 건물에 조명이 들어오면 수영장 물 위로 비치는 반영은 지중해에 온 듯한 느낌을 준다. 수영장의 깊이는 약 1m이다. 모든 객실에서 바다가 바라다보인다. 도보 약 5분 거리에 편의점이 있고, 차량으로 약 10분 거리, 20분 거리에 마트가 있다. 차량으로 약 5분 거리에 궁촌항, 약 10분 거리에 장호항이 있어 항구에 있는 횟집을 방문할 수 있다. 레일바이크를 탈 수 있는 궁촌역은 걸어서 약 10분 거리에 있다. 가까이에 원평 해수욕장이 있다.","<a href=""http://www.gratiaresort.com/""target=""_blank"" title=""새창 : 그라시아펜션 사이트로 이동"">http://www.gratiaresort.com/</a>"
그라운드서울,2739471,인문(문화/예술/역사),문화시설,미술관/화랑,http://tong.visitkorea.or.kr/cms/resource/21/3388521_image2_1.jpg,서울특별시,126.9836425781,37.5734729769,"2012년 9월에 개관한 그라운드서울(구, 아라아트센터)은 국내 유일의 갤러리와 기획전시공간을 결합한 신개념 복합문화공간으로, 미술을 애정하는 모든 문화인들을 위한 놀이터로서 함께 즐기고 자유롭게 소통하는 공간이다. 한국 예술문화의 중심지인 서울 인사동에서 다양한 전시를 통해 대중예술의 가치를 높이고 창의적인 전시를 선도하고자 태어난 복합 문화 공간이다. 지하 4층부터 지상 5층까지 총 9개의 층으로 40~180평에 이르는 15개의 전시실로 구성되어 있다. 전시장 평균높이는 3.5m이며, 최대 14m로 폭넓은 예술장르를 수용할 수 있다. 특히 지하 4개 층을 관통하는 자연채광의 아름다움은 전시되는 작품들을 한층 돋보이게 하고 풍부한 분위기를 연출할 수 있다.
그라운드서울은 한국 최대의 문화 중심지, 그 가운데 위치함으로써 높은 수준의 문화예술을 보급하는데 크게 유리한 입지적 조건을 갖추었다. 그라운드서울을 중심으로 인사동 일대에 산재한 문화예술 공간들은 시너지 효과를 누릴 수 있으며, 이 시너지 효과는 다시 그라운드서울의 에너지로 재흡수되는 선순환 구조를 이루고 있다.","<a href=""http://www.groundseoul.com/"" target=""_blank"" title=""새창 : 그라운드서울 홈페이지로 이동"">http://www.groundseoul.com/</a>"
그라운드시소 명동,3081169,인문(문화/예술/역사),문화시설,전시관,http://tong.visitkorea.or.kr/cms/resource/68/3081168_image2_1.JPG,서울특별시,126.9816707967,37.5642573461,"그라운드시소 명동은 벽면 가득한 대형 스크린과 멀티플렉스로 모네나 알퐁스 무하 등의 그림을 작가의 일대기와 함께 영상으로 감상하는 곳이다. 따라서 이 곳은 전시관이라기 보다는 미디어아트 전용 상영관이라고 하는 것이 맞겠다. 대기하고 있다가 전시 10분 전 입장이 시작되고, 정해진 상영시간에 앉아서 영상을 시청하기도 하고 벽면에 가득채워진 그림을 감상을 해도 좋다.
그림만 감상하는 다른 갤러리와 달리 유명화가들의 역사적인 작품과 그 일생의 희로애락을 영화를 보듯 감상할 수 있어 작가와 작품에 대한 이해를 돕는다.
영상을 감상하고 나오면 굿즈샵도 있는데 악세서리나 소품에 그려진 그들의 그림을 보고 사는 재미도 쏠쏠하다.
롯데백화점 명동 본점 에비뉴엘 건물 9층에 위치하고, 현장에서는 티켓 구매가 안 되니 온라인 예매를 해야 한다.","<a href=""https://www.instagram.com/groundseesaw/"" target=""_blank"" title=""새창 : 홈페이지로 이동"">https://www.instagram.com/groundseesaw/</a>"
그라운드시소 서촌,2717347,인문(문화/예술/역사),문화시설,전시관,,서울특별시,126.9729323181,37.5778944928,"그라운드 시소는 국내외 다양한 문화예술 IP로 전시를 제작, 소개하는 전시 플랫폼이다. 역사, 예술, 문화가 만나는 종로 서촌에서 전시제작사 미디어앤아트가 선보이는 복합문화공간으로, 건축사 사무소 SoA와 조경스튜디오 Loci Studio가 설계했다. 2014년 국내 최초로 반 고흐 미디어아트를 선보인 이래 <앨리스: 인투 더 래빗홀(2017)>, <유미의 세포들 특별전(2020)>, <요시고 사진전(2021)> 등 국내외를 통틀어 총 30여 차례의 전시를 제작했다. 현재까지 25만 명 이상의 관람객이 다녀간 전시만 4차례 이상으로, 누적 관람객은 350만 명을 돌파했다. 이처럼 그라운드시소 서촌에서 다양한 전시를 만나볼 수 있다.","홈페이지 <a href=""https://groundseesaw.co.kr/"" target=""_blank"" title=""새창 : 그라운드시소 서촌 홈페이지로 이동"">https://groundseesaw.co.kr/</a><br>
인스타그램 <a href=""https://www.instagram.com/groundseesaw/"" target=""_blank"" title=""새창 : 그라운드시소 서촌 인스타그램으로 이동"">https://www.instagram.com/groundseesaw/</a>"
그라운드시소 성수,2852156,인문(문화/예술/역사),문화시설,전시관,http://tong.visitkorea.or.kr/cms/resource/58/2849758_image2_1.jpg,서울특별시,127.0652942291,37.5468219852,그라운드시소는 전시제작사 미디어 앤 아트에서 전시와 문화 공간 비즈니스를 위해 새롭게 론칭한 복합문화공간이다. 관객들에게 친숙하고 어디선가 들어본 적 있는(saw) 소재를 새로운 관점에서 다시 보는(see) 플로우를 전시에 녹여내려고 한다. 그라운드시소 성수점은 성수 상권 최초 대규모 클러스터형 상업시설 ‘성수낙낙’에 위치하여 성수동을 대표하는 명소로 자리매김하고 있다.,"<a href=""https://www.instagram.com/groundseesaw/"" target=""_blank"" title=""새창 : 그라운드시소 성수 인스타그램 페이지로 이동"">https://www.instagram.com/groundseesaw/</a>"
그라운드헤븐,2833048,음식,음식점,카페/전통찻집,http://tong.visitkorea.or.kr/cms/resource/41/2833041_image2_1.png,경상남도,128.1130728231,35.2157211927,요즈음 카페의 변신은 무서울 정도이다. 대형화 추세와 정원카페가 트렌드이다. 이 두 가지를 정확히 갖춘 곳이 그라운드헤븐이다. 군더더기 없이 단정하게 지어진 건축물과 잔디밭이 인상적이고 간결하게 정돈된 실내인테리어와 가구들은 이곳을 돋보이게 하는 완결판이다. 넓은 실내 구석구석 흠잡을 곳이 없을 정도로 관리가 잘 되고 있다. 한쪽 구석에서 차를 마시면서 수다를 떨어도 좋고 차분히 책을 봐도 어울리는 곳이다. 이곳을 떠나기 전 실내외 여기저기를 둘러보는 재미도 잊지 않았으면 하는 곳이다.,"<a href=""https://www.instagram.com/ground.heaven/?igshid=2hkky316ufhe""target=""_blank"" title=""새창 : 그라운드헤븐 사이트로 이동"">https://www.instagram.com/ground.heaven/?igshid=2hkky316ufhe</a>"
그라운드휴,2851776,음식,음식점,카페/전통찻집,http://tong.visitkorea.or.kr/cms/resource/67/2851767_image2_1.jpg,경기도,127.360751938,37.8869211289,"그라운드휴는 경기도 가평군 조종면에 있는 야외 정원과 계곡 놀이터가 있는 카페이다. 계절별로 입장료가 다른데, 해당하는 입장료를 내고 들어가면 실내 북카페와 야외 정원에 있는 모든 시설을 이용할 수 있다. 야외 정원에는 파고라, 해먹스탠드, 트리하우스, 이동식 의자, 육각 그네, 자이언트 젠가가 있고, 대운동장 잔디밭을 이용하거나 계곡에서 물놀이를 할 수 있다. 가족 단위의 모임과 어린이를 동반한 그룹 모임을 하기 좋다. 그라운드휴는 카페 외에도 숙박 시설이 있어 숙박도 가능하고, 저녁에는 바비큐를 즐길 수 있다.","<a href=""https://www.instagram.com/groundhue/"" target=""_blank"" title=""새창 : 그라운드휴 인스타그램으로 이동"">https://www.instagram.com/groundhue/</a>"
그라치에,2869454,음식,음식점,서양식,http://tong.visitkorea.or.kr/cms/resource/46/2869446_image2_1.jpg,부산광역시,129.0615711795,35.0890581423,"부산 영도구에 있는 그라치에는 파스타 맛집으로 알려진 이탈리안 레스토랑이다. 이태리어로 ‘감사합니다’라는 뜻으로 테이블은 많지 않지만, 좌석 간 간격이 넓어 쾌적하게 식사할 수 있다. 전용 주차장이 따로 없어 근처 청학 2동, 카린 공영주차장을 이용하면 주차권을 지원해 주고 있다. 여러 종류의 파스타와 리소토, 스테이크, 샐러드가 있는 그라치에는 전 메뉴 맵기 조절이 가능하고 아기 의자도 구비되어 가족과 함께 방문하기 좋다. 통오징어를 구워 올린 먹물 리소토와 양송이, 표고, 새송이, 시금치, 베이컨, 크림소스를 곁들인 감자 뇨끼가 이곳 대표 메뉴이다. 주말에는 많은 사람이 방문하여 대기 시간이 발생할 수 있다.",
그라티아글램핑,2726703,레포츠,육상 레포츠,"야영장,오토캠핑장",http://tong.visitkorea.or.kr/cms/resource/16/2726816_image2_1.JPG,경기도,127.4547843444,37.8153284161,"경기도 가평군 가평읍에 위치한 그라티아 글램핑은 경춘선 상천역과 가평역 사이 대금산 자락에 자리잡고 있다. 이곳은 펜션1동과 글램핑 10동으로 구성되어 있는 럭셔리 캠핑장이다. 글램핑장엔 숲속 정원과 야외수영장, 매점등이 갖춰져 있고,  각 글램핑 장 앞에서 바비큐를 즐길 수 있다. 그릴과 숯은 유료로 제공 가능하다.  또한 숲속정원에는 원두막이 여러개 설치되어 있으며 누구나 무료로 이용할 수 있다. 글램핑장은 원룸 구조로 커플과 소가족에 적합하다. 단독 야외데크가 있으며 객실 내에 화장실이 배치되어 있어 프라이빗한 글램핑을 즐길 수 있다. 실내엔 TV,  침대, 냉장고, 식탁, 소파,  인덕션, 주방도구, 식기류, 전기밥솥, 전자렌지 등이 구비되어 있어 일상생활에도 불편함이 없을 정도다.","<a href=""http://xn--2i0bm4poql8jn.com"" target=""_blank"" title=""새창 : 그라티아글램핑 사이트로 이동"">http://xn--2i0bm4poql8jn.com</a>"
그라피,3306843,쇼핑,쇼핑,사후면세점,http://tong.visitkorea.or.kr/cms/resource/15/3313315_image2_1.jpeg,서울특별시,126.9249974851,37.4905482278,-,
그란구스또,1515607,음식,음식점,서양식,http://tong.visitkorea.or.kr/cms/resource/95/1514395_image2_1.jpg,서울특별시,127.0595765768,37.5019687584,"적당한 가격에 맛까지 훌륭한 이탈리안레스토랑 그란구스또가 대치사거리 엘포트빌딩 1층에 있다. 사실 이탈리아 음식의 기본은 파스타다. 얼마나 이 기본을 잘 하느냐에 따라 그곳의 평가가 달라진다. 그란구스또는 그 점에서 충분히 인정해줄만하다. 전체적으로 파스타의 수준이 높고 안정되어 있다. 언제 어느 때 찾아도 그 맛에 흔들림이 없다. 가장 신선한 재료와 천연재료들로 마음을 담아 정성껏 요리하고 있으며 각종 파스타 요리와 웰빙 요리까지 다양한 메뉴와 가격, 최상의 서비스로 우아하고 격조있는 분위기로 고객을 모시고 있다.
그란구스또는 적당히 휘도를 맞춘 전등이 아늑하다. 모던하고 깔끔하게 인테리어가 된 실내와 잘 어울린다. 사랑하는 사람들과 함께 즐거운 식사를 하며 이야기를 나누기에 더 없이 좋다.<br>","<a href=""http://www.grangusto.net"" target=""_blank"" title=""새창 : 그란구스또 홈페이지로 이동"">http://www.grangusto.net</a>"
그란데,2841046,음식,음식점,서양식,http://tong.visitkorea.or.kr/cms/resource/36/2841036_image2_1.jpg,경기도,127.1246673597,37.3238072556,"그란데는 용인시 수지구 죽전동 단국대 캠퍼스 앞에 있는 지중해식 이탈리안 레스토랑이다. 전통 화덕피자와 파스타, 리소토, 스테이크가 맛있는 곳으로 화덕 피자 장인이 피자를 만들고, 이탈리아 쉐프가 파스타를 만든다. 넓다, 크다는 뜻처럼 넓은 공간에서 편안하게 식사할 수 있는 그란데의 대표 메뉴는 매콤한 우민찌와 리코타가 어우러진 그란데 총각과 가락시장에서 매일 공수해 온 바질을 페스토를 만들어서 만든 파스타인 마레바질 파스타다. 이외 안심스테이크와 4인세트, 4가지 치즈피자인 포마지오 등이 있고, 점심에는 단국대 학생들을 대상으로 하는 런치 세트 메뉴도 있다. 인근에 수지도서관, 장욱진고택, 대광사 등이 있다.","<a href=""https://blog.naver.com/024686""target=""_blank"" title=""새창 : 그란데 사이트로 이동"">https://blog.naver.com/024686</a>"
그람피하우스 [한국관광 품질인증/Korea Quality],1932645,숙박,숙박시설,서비스드레지던스,http://tong.visitkorea.or.kr/cms/resource/55/2597755_image2_1.jpg,충청남도,126.3079150768,36.6565756082,"
청포대 해변을 바라보는 언덕에 자리한 그람피하우스는 마치 동화세계처럼 예쁘다. 하얀 벽에 주황색 지붕을 얹은 지중해풍 독채 건물이 14동이나 모여있으니 동화 마을로 여행 온 기분이다. 그람피는 백설공주와 일곱난쟁이에 나오는 난쟁이 이름이다. 각 건물에 백설공주나 난쟁이 이름을 붙여 놓았다. 모든 객실이 독채로 되어 있고 내부 역시 예쁘고 깔끔하게 꾸몄다. 복층 구조와 아기자기한 장식, 청결한 화장실, 모던한 주방까지 갖춰 여행자들의 만족도가 높다. 그람피하우스와 주변 숲으로 이어진 산책로는 가볍게 걷기 좋고, 잘 가꾼 잔디정원에서 바라보는 바다 풍경은 무척 아름답다. 예약시 신청하면 유아용 놀이텐트 대여, 갯벌체험 도구 대여, 바다낚시도 가능하다. ATV·서바이벌 할인, 안면도쥬라기공원 입장권 20% 할인권, 카페에서 주인장이 직접 드립커피를 준비해준다. 
그람피하우스에서 청포대해수욕장, 달산포, 몽산포, 청산수목원, 마검포, 네이쳐월드, 안면도쥬라기공원, 대하랑꽃게랑다리 등이 가깝고 안면도 꽃지해변까지 약 25분, 만리포해변까지 약 30분 거리다. 
<br>","<a href=""http://www.grumpy.co.kr"" target=""_blank"" title=""새창 : 그람피하우스 홈페이지로 이동"">http://www.grumpy.co.kr</a>"
그랑게,2910676,음식,음식점,카페/전통찻집,http://tong.visitkorea.or.kr/cms/resource/63/2910663_image2_1.jpg,전북특별자치도,127.1080154924,35.5946329993,"카페의 모든 공간에서 옥정호를 바라볼 수 있는 뷰 맛집으로 통하는 임실군 운암면의 카페다. 유럽풍의 건물 외관에 실내 인테리어가 깔끔하게 되어 있어, 젊은 연인들의 데이트 코스로도 널리 활용되고 있다. 그랑게라떼, 꽃이랑게, 쌍화라떼, 로열 밀크티가 이 집의 대표 메뉴이며 그 밖에도 다양한 음료와 베이커리가 준비되어 있다. 2층과 3층에 테라스가 마련되어 있어 옥정호를 더욱 생생하게 감상하며 차 한 잔의 여유를 즐길 수 있다. 단, 테라스는 13세 이하 어린이는 이용이 불가하다. 임실 운암매운탕거리가 근처에 있어 식사 후 들러 후식을 즐기기에도 좋다.","<a href=""https://www.instagram.com/cafe_grangge/""target=""_blank"" title=""새창 : 그랑게 사이트로 이동"">https://www.instagram.com/cafe_grangge/</a>"
그랑깨,2809877,음식,음식점,서양식,,Unknown,127.3782381036,35.4058812737,그랑깨 돈까스는 남원 현지인 맛집으로 유명하다. 대표메뉴인 냉모밀과 안심 치즈 매콤 돈까스가 가장 인기있다. 안심 치즈 매콤 돈까스는 치즈돈까스와 매콤한 소스의 조합으로 느끼함 없이 맛있게 먹을 수 있다.,
그랑꼬또 와이너리 그린영농조합,2948050,인문(문화/예술/역사),산업관광지,식음료,http://tong.visitkorea.or.kr/cms/resource/75/2947975_image2_1.jpeg,경기도,126.5821435181,37.2570803681,"그랑꼬또 와이너리에서는 간단한 테이스팅에서부터 와이너리 투어까지 다양한 체험을 할 수 있으며 체험을 하면서 음식 문화와 와인에 대해서, 또한 한국에서 재배되고 있는 포도 품종 등 기존에 많이 접하지 못했던 정보와 한국 와인에 대해 잘 알 수 있는 유익한 시간을 보낼 수 있다. 와이너리 투어와 와인 테이스팅은 성인에 한하여 체험이 가능하며, 와인병 공예, 머그컵 만들기 등의 체험은 어린이도 가능하다.","<a href=""https://grandcoteau.co.kr"" target=""_blank"" title=""새창 : 그랑꼬또 와이너리 그린영농조합으로 이동"">https://grandcoteau.co.kr</a>"
그랑블루 글램핑야영장,2754435,레포츠,육상 레포츠,"야영장,오토캠핑장",http://tong.visitkorea.or.kr/cms/resource/55/2754655_image2_1.JPG,강원특별자치도,128.6205771254,38.1313276111,"그랑블루 글램핑 야영장은 양양에 위치한 펜션을 겸한 글램핑장이다. 도보로 3분 거리에 설악 해수욕장이 있고, 낙산 해수역장은 차량으로 5분 거리, 죽도 해수욕장은 15분 거리로, 해수욕과 서핑을 즐기기 최적의 위치에 있다. 글램핑은 총 15개가 운영 중인데, 개별 화장실, 샤워실이 갖춰져 있고, 에어컨은 물론 바닥 난방도 가능하여 사계절 이용에 불편이 없다. 인근에 장 볼만한 곳은 마땅하지 않아 미리 낙산항이나 대포항에서 횟감이나 해산물을 사 오거나, 속초나 양양 시내에서 장을 봐서 들어가는 편이 편리하다.","<a href=""http://www.thebigblue.co.kr/"" target=""_blank"" title=""새창 : 그랑블루 글램핑야영장 사이트로 이동"">http://www.thebigblue.co.kr/</a>"
그랑삐아또 중화산,2687850,음식,음식점,서양식,http://tong.visitkorea.or.kr/cms/resource/53/2701253_image2_1.jpg,전북특별자치도,127.1331492499,35.8130752834,다양한 양식 요리를 맛볼 수 있는 곳이다. 전라북도 전주시에 있는 양식전문점이다. 대표메뉴는 화덕피자다.,
그랑샤리오,2913632,숙박,숙박시설,펜션,http://tong.visitkorea.or.kr/cms/resource/00/2920300_image2_1.jpg,강원특별자치도,128.2730117727,37.478646613,"반려견 펜션 그랑샤리오는 골든리트리버, 코카스파니엘, 슈나우저와 함께 살고 있는 반려동물과 함께하는 행복한 나라이다. 우리 곁에서 언제나 사랑으로 함께하는 반려동물들이 여행의 짐이 되어선 안 되겠다. 오늘 하루라도 리드줄 없이 맘껏 뛰어 놀 수 있는 편안하고 즐거운 곳이 되도록 늘 준비한다. 언제나 행복한 나라~그랑샤리오에 오신 걸 환영한다!!!",
