title,contentid,cat1,cat2,cat3,firstimage,region,mapx,mapy,overview,homepage
천안상록리조트 눈썰매장,131545,레포츠,육상 레포츠,썰매장,,충청남도,127.2890937464,36.7405136249,"상록리조트눈썰매장은 눈썰매장 이외에도 워터파크, 놀이공원 등 다양한 놀이시설과 숙박시설인 호텔, 콘도를 운영하고있다. 
눈썰매장은 성인 슬로프(30*148M), 어린이 슬로프(17*70M), 유아 슬로프(25*40M)로 구분되어 있고 동절기에만 운영한다. 성인슬로프와 어린이 슬로프는 튜브썰매를 이용해 짜릿한 스피드를 즐기며 스릴을 만끽하실 수 있다. 각각  신장 120cm이상 고객, 신장100cm 이상 고객이 이용 가능하며, 1인 1썰매 탑승이 원칙이다. 
유아슬로프는 플라스틱 썰매를 이용하여 유아들이 안전하고 즐겁게 이용할 수 있다. 신장 100cm 미만 어린이 및 유아 고객이 보호자와 함께 최대 2인 이상 이용 가능하다. 
튜브이송장치 자동화로 튜브를 슬로프 정상까지 운반하여 다른 눈썰매장보다 편안하게 눈썰매를 즐길 수 있다.
눈썰매장 내에서 식사와 분식이 가능하고 입구에 수유실도 갖추어 편의를 돕는다.","눈썰매장 <a href=""http://www.sangnokresort.co.kr"" target=""_blank"" title=""새창 : 상록리조트 홈페이지로 이동"">http://www.sangnokresort.co.kr</a>"
천안상록리조트 아쿠아피아,128624,인문(문화/예술/역사),휴양관광지,온천/욕장/스파,,충청남도,127.2890937464,36.7405136249,"천안에 있는 워터파크로 7월~8월 여름 시즌에만 운영되는 야외 물놀이장이다. 어린이풀, 파도풀, 유수풀, 워터슬라이드, 에어바운스, X-웨이브 등 다양한 시설이 갖추어져 있고 스파가 곳곳에 있다. 이외에도 식당, 아쿠아샵 등 부대 시설이 있어 방문객들이 편안하게 이용할 수 있다. 음식물과 돗자리는 반입이 불가하다. 인근에는 천안함 생태공원, 천안함 위령탑 등의 관광지가 있다.","<a href=""https://www.sangnokresort.co.kr/main.do?skskType=ap&skskMenu=4_2""천안상록리조트 사이트로 이동"">http://www.sangnokresort.co.kr</a>"
천안승마클럽,131934,레포츠,육상 레포츠,승마,http://tong.visitkorea.or.kr/cms/resource/05/1901705_image2_1.jpg,충청남도,127.129960352,36.8597665112,"천안승마클럽은 대한민국의 중심인 천안에 위치하고 있으며, 최고의 접근성과 전국 최고 수준의 실내승마장이 갖추어 있어 사계절 전천후로 운동이 가능하다. 생명이 있는 말과 일체가 되어야 하는 특수한 성격을 지닌 운동으로서 신체를 단련하고 기사도 정신을 함양하여 호연지기를 기르는 스포츠이다. 또한, 승마는 신체의 평형성과 유연성을 길러 올바른 신체의 발달을 돕는 전신운동이며, 대담성과 건전한 사고력을 길러주는 정신운동과 동물 애호정신으로 인한 인간애의 함양을 가져다 주는 운동이라 할 수 있다.",
천안시 농수산물 도매시장(천안 농수산물 도매시장),2775628,쇼핑,쇼핑,상설시장,,충청남도,127.1510278771,36.8604834698,"천안시 농수산물 도매시장은 충남 천안시 서북구에 자리 잡고 있다. 신선한 농산물, 과일, 채소, 수산물 등을 한 곳에 모아서 경매 후 다시 소비자에게 저렴하게 공급하는 충남 유일의 공영도매시장이다. 1995년 7월 개장한 이곳은 56,395㎡ 부지에 과일동, 채소동, 수산동, 저온 창고, 집하장, 은행, 편의점, 식당 등이 입점해 있다.",
천안시 성정평생학습관,130064,인문(문화/예술/역사),문화시설,공연장,http://tong.visitkorea.or.kr/cms/resource/40/3342540_image2_1.JPG,충청남도,127.1362884499,36.8273842423,"천안 서북구 성정동에 자리한 천안시 성정평생학습관은 시민의 능력 개발 및 자아실현으로 행복한 삶을 영위할 수 있도록 배움의 장을 펼쳐주는 평생교육기관이다. 지하 1층, 지상 4층의 건물로 전시실, 강의실, 대강당, 휴게실 등의 주요 시설이 있다. 학습관에서는 한식조리 기능사, 제과 기능사, 커피 바리스타, 꽃꽂이 등 자격증 취득 강좌와 서양화, 하모니카, 댄스스포츠 등 취미 강좌, 의류수선, 요리 등 실생활에 필요한 강좌까지 다양하게 개설되어 있다. 또한, 다양하고 흥미로운 프로그램과 전시 및 공연을 열고 있으며,  문화 예술 대중화를 위한 공간을 제공하고 대관 서비스도 한다.","<a href=""http://www.cheonan.go.kr/women/"" target=""_blank"" title=""새창 : 천안시 시민문화여성회관 홈페이지로 이동"">http://www.cheonan.go.kr/women/</a>"
천안시 태조산청소년수련관,131188,레포츠,육상 레포츠,수련시설,http://tong.visitkorea.or.kr/cms/resource/30/881330_image2_1.jpg,충청남도,127.1885561346,36.8210858969,"태조산공원 옆에 위치한 청소년 수련시설인 태조산청소년수련관은 자연친화적 체험프로그램, 진로 및 소질 함양 프로그램, 창의적 자치활동 등 맞춤형 프로그램을 통한 청소년 역량개발에 힘쓰고 있다. 또한, 대학 및 학교연계, 지역 특화사업, 청소년 네트워킹 강화 등 법인 및 기관과의 연계사업을 추진하고 있다. 태조산청소년수련관 내에는 휴게실, 공방실, 체육관, 다목적실, 예절교실, 자치활동실, 북카페, 댄스연습실, 밴드연습실 등 다양한 내부시설과 태조호, 잔디운동장, 조각공원 등의 외부시설이 함께 있어 청소년 수련 및 다양한 활동을 하기에 좋다.
방과 후 아카데미, 스포츠 클라이밍, 캠핑, 플리마켓, 과학놀이터, 진로체험, 요리 등의 프로그램이 있다.","<a href=""http://www.cayouth.or.kr"" target=""_blank"" title=""새창 : 태조산청소년수련관 홈페이지로 이동"">http://www.cayouth.or.kr</a>"
천안시민체육공원,3046296,인문(문화/예술/역사),휴양관광지,공원,http://tong.visitkorea.or.kr/cms/resource/75/3046275_image2_1.jpg,충청남도,127.112696519,36.8132937795,"천안시민체육공원은 천안시 서북구 천안시청 앞에 자리한 체육공원으로, 인근의 천안종합운동장, 유관순체육관 등과 함께 천안 체육의 중심지이다. 이곳은 휴게공간, 풋살장, 족구장, 배드민턴장, 산책로, 잔디광장, 자전거 보관대 등으로 구성되어 있다. 기본적으로 모든 시설은 시민들이 자율적으로 이용하도록 개방하고 있고 무료로 이용할 수 있다. 또한, 공원 및 잔디광장은 행사 등을 위해 대관할 수 있다. 취사 및 야영은 금지되어 있으며, 자전거 등 바퀴가 달린 장치는 이용할 수 없다. 주변에는 불당동 먹자골목, 봉서산, 불당2공원, 물총새공원 등이 있다.","<a href=""https://www.cfmc.or.kr/_citypark/"" target=""_blank"" title=""새창 : 홈페이지로 이동"">https://www.cfmc.or.kr/_citypark/</a>"
천안시청 봉서홀,3067528,인문(문화/예술/역사),문화시설,공연장,http://tong.visitkorea.or.kr/cms/resource/25/3067525_image2_1.jpg,충청남도,127.1124242843,36.8146491745,"천안시청 봉서홀은 천안시청 내에 자리하고 있어 접근이 용이하며, 수준 높은 공연으로 시민들의 질 높은 문화생활을 할 수 있도록 하고 있다. 또한 단순한 공연장이 아닌 지역 문화 예술 활동의 산실로서 천안시립 합창단, 천안시립 교향악단, 천안시립 무용단, 천안시 충남 국악 관현악단, 천안시립 흥타령 풍물단 등의 중심 무대가 되고 있다. 
천안시청 봉서홀에서 연극, 음악, 뮤지컬, 무용 등 다양한 공연이 이루어지고 있다. 또한 넓은 주차장과 저렴한 대관료 등으로 공연 주최 측이나 관람객 모두에게 만족을 주고 있으며, 다양한 연령층에게 맞는 공연과 모든 연령이 함께 즐길 수 있는 공연으로 가족 단위의 참여가 높다.",
천안아산역 동광장,2775622,인문(문화/예술/역사),휴양관광지,공원,,충청남도,127.106242056,36.7946680319,"천안아산역 동광장은 충남 아산시 배방읍 장재리에 자리 잡고 있다. 이곳은 천안아산역을 이용하는 승객뿐 아니라 인근 지역에 사는 사람들 사이에서 만남의 광장으로 유명하다. 광장 주변에 음식점과 쇼핑 시설 등이 밀집해 있기 때문이다. 광장 인근 관광지로는 아산 지중해 마을, 온양온천, 온양온천 전통시장 등이 있다.",
천안어린이꿈누리터,3341251,인문(문화/예술/역사),체험관광지,이색체험,,충청남도,127.1514543217,36.8065702416,천안어린이꿈누리터는 어린이들이 다양한 놀이활동 및 문화·예술을 경험할 수 있는 아동복지시설로 천안시에서 설립하고 사회복지법인 중부재단에서 수탁 운영하는 곳이다.,"<a href=""https://www.cachildren.kr/""target=""_blank"" title=""새창: 천안어린이꿈누리터 홈페이지로 이동"">https://www.cachildren.kr/</a>"
천안역전시장,2762950,쇼핑,쇼핑,상설시장,http://tong.visitkorea.or.kr/cms/resource/45/2762945_image2_1.jpg,충청남도,127.1489322337,36.809955918,"1951년 한국전쟁 직후 천안역을 중심으로 피란민이 몰려들면서 시장이 형성되었다. 1955년 정식으로 천안공설시장으로 인정받아 오늘에 이르렀다. 천안역을 통해 수도권 전철 1호선과 연결되기 때문에, 대중교통으로 이용이 가능한 곳으로 전통과 현대가 조화를 이루는 곳이다. 청년창업 및 도시재생사업과 연계되어 청년창업에 의한 점포들과 제과 및 카페, 다문화 음식 및 음식점, 패션의류, 기타 소매점으로 구성되어 있다. 2018년에는 노인들을 위한 실버 특화매장을 개장하여 다양한 실버용품을 갖추었다.",
천안예술의전당 미술관,2763024,인문(문화/예술/역사),문화시설,미술관/화랑,http://tong.visitkorea.or.kr/cms/resource/82/2762982_image2_1.JPG,충청남도,127.2253046125,36.7561301369,"천안예술의 전당 미술관은 천안시 최초 공립미술관으로서 지역 미술의 역사적 가치를 연구하고 이를 바탕으로 소통과 교류를 통해 시대의 사회문화적 담론 및 미술의 흐름을 반영한 전시를 기획 운영하고 있다. 지역의 문화예술 저변 확대와 행복가치의 구현을 위해 다양한 시민참여형 전시연계 교육, 전시해설사 양성 프로그램, 문화행사 개최 등을 진행하고 있다.","<a href=""https://www.cnac.or.kr/"" target=""_blank"" title=""새창 : 천안예술의전당 미술관 사이트로 이동"">https://www.cnac.or.kr/</a>"
천안원조닭똥집,403906,음식,음식점,한식,http://tong.visitkorea.or.kr/cms/resource/01/401001_image2_1.jpg,대전광역시,127.4380855691,36.3480529503,"대전 터미널 맞은편에 자리 잡은 천안원조닭똥집은 1·2층으로 나누어져 있다. 저렴한 가격과 매콤한 양념 맛으로 주객의 발길을 사로잡는 곳이다. 닭모래집 볶음에는 깻잎, 양파, 대파가 곁들여지는데 기본양념의 얼큰한 맛과 쫄깃한 맛이 안주와 식사로 제격이다. 다 먹고 난 후에는 볶음밥을 추가하여 맛볼 수 있다. (정보제공자 : 대전광역시청)",
천안의 볼거리를 찾아 가족여행,1936030,추천코스,가족코스,가족코스,http://tong.visitkorea.or.kr/cms/resource/10/1784710_image2_1.jpg,Unknown,127.1633176864,36.7867282918,천안에는 아이들과 함께 체험하기 좋은 박물관들이 많다. 농촌체험 마을까지 여름 방학을 맞아 알찬 시간을 갖기에 이만한 코스가 없을 것이다. <br /><br />출처 : 머물수록 매력있는 충청,
천안조개창고,2856782,음식,음식점,한식,http://tong.visitkorea.or.kr/cms/resource/77/2856777_image2_1.jpg,충청남도,127.1240701938,36.824226056,"천안조개창고는 충청남도 천안시에서 뷔페식으로 운영되는 조개구이 무한리필 음식점이다. 가리비, 키조개, 전복 등 총 10여 가지 조개류가 있는 수족관에서 원하는 조개를 선택하여 먹을 수 있다. 조개는 매일 현지에서 공수받고, 보관은 조개들의 적정온도에 맞는 해수를 이용하여 보관함으로써 살아있는 싱싱한 조개만을 취급한다. 사이드바에는 각종 야채류, 꼬치류, 고기류, 소스로 구성되어 있으며, 고기는 삼겹살, 항정살, 목살, 갈비, 막창, 새우 등 여러 종류로 구성되어 있다.",
천안짬뽕작전,2856788,음식,음식점,중식,http://tong.visitkorea.or.kr/cms/resource/85/2856785_image2_1.jpg,충청남도,127.1289626615,36.7789646871,"천안짬뽕작전은 충청남도 천안시 동남구 신방동에 있다. 이색 짬뽕으로 유명하며, KBS 2TV 시사 교양 프로그램 생생정보, SBS 시사 교양 프로그램 생방송 투데이 등에 소개된 바 있다. 외관과 인테리어가 깔끔한 느낌이고, 내부에는 단체석이 마련되어 있다. 음식에 넣는 면은 강화제를 사용하지 않으며, 육수는 매일 새벽 4시간 이상 끓여 사용한다. 대표 메뉴는 뜨거운 돌판 위에 얹어 나오는 지글지글 돌짬뽕이다. 공깃밥이 기본으로 제공되는 작전짬뽕과 맛보기 면이 함께 나오는 작전짬뽕밥도 인기가 많다. 이 밖에 지글지글 돌짜장, 유린기 등도 맛볼 수 있다.",
천안타운홀,2824523,음식,음식점,카페/전통찻집,http://tong.visitkorea.or.kr/cms/resource/81/2824481_image2_1.jpg,충청남도,127.1502460663,36.8076923132,"천안타운홀은 힐스테이트천안에 위치한 전망대&갤러리 카페이다. 천안시에서 운영하기 때문에 저렴한 금액으로 이용할 수 있다. 47층에 위치하고 있어 낮에 오면 도심뷰를 즐기며 힐링을, 밤에 오면 멋진 야경을 감상할 수 있다. 창문 반대편에는 벽면에 그림들이 걸려있어 도시 경관과 그림 작품을 동시에 즐길 수 있다. 카페가 위치한 47층에는 화장실이 없기 때문에 46층을 이용해야한다.",
천안향교,1626896,인문(문화/예술/역사),역사관광지,유적지/사적지,http://tong.visitkorea.or.kr/cms/resource/69/3337569_image2_1.JPG,충청남도,127.1728465337,36.817655457,"천안향교는 태조 7년(1398) 처음 지었으나, 임진왜란 때 불타 없어졌다. 그 뒤 선조 39년(1606)에 다시 지은 것으로 보인다. 지금 남아 있는 건물은 제사 공간인 대성전과 동무·서무, 교육 기능을 수행하는 강당인 명륜당, 학생들의 기숙사인 동재·서재, 전사고, 삼문, 풍화루 등이다. 명륜당은 효종 7년(1656) 지었는데, 규모는 앞면 4칸·옆면 2칸이다. 대성전의 규모는 앞면 3칸·옆면 2칸으로, 지붕은 옆면에서 볼 때 사람 인(人) 자 모양인 맞배지붕으로 꾸몄다. 안에는 공자를 중심으로 그의 제자들과 중국과 우리나라 성현들의 위패를 모시고 있다. 천안향교의 담장 밖에는 수령이 500년이 넘은 탱자나무가 보호수로 지정되어 있다. 탱자나무는 천안향교와 함께 오랜 세월을 함께한 고목으로, 천안향교의 역사와 문화를 상징하는 나무다.","<a href=""https://www.heritage.go.kr/heri/cul/culSelectDetail.do?ccbaCpno=2333401100000&pageNo=1_1_1_1&sngl=Y"" target=""_blank"" title=""새창 : 홈페이지로 이동"">https://www.heritage.go.kr</a>"
천안홍대용과학관,2718735,인문(문화/예술/역사),문화시설,전시관,,충청남도,127.295659845,36.7397082792,"충남 천안시 동남구에 위치한 홍대용과학관은 홍대용선생의 위대한 업적을 기리고자 생가지 연접지역에 개관하였다. 담헌 홍대용선생은 조선시대 최초로 지전설과 지구구형설을 주장한 대표적인 사상가이자 실학자이다. 이곳은 담헌 홍대용선생의 위대한 과학사상을 보여주고 천문과학을 직접 체험하며 무한상상력과 창의력의 나래를 펼칠 수 있는 곳이다. 홍대용과학관은 800mm 반사망원경과 지름 15m 천체투영관, 상설전시관과 과학체험관 등 다양한 시설물을 갖추고 있다.","천안홍대용과학관 <a title=""새창 : 천안홍대용과학관 홈페이지로 이동"" href=""https://www.cheonan.go.kr/damheon.do"" target=""_blank"">www.cheonan.go.kr/damheon.do</a>"
천안흥타령춤축제,506935,인문(문화/예술/역사),축제,문화관광축제,http://tong.visitkorea.or.kr/cms/resource/29/3113429_image2_1.jpg,충청남도,127.1114686823,36.8194930438,"2003년 처음으로 개최한 천안흥타령춤축제는 문화체육관광부로부터 6년 연속 지역대표공연예술제로 선정되었으며, 2020년부터 문화체육관광부 지정 <명예문화관광축제>로 선정되었다. 매년 80만여명이 넘는 국내·외 관광객이 방문하고 있다.","<a href=""https://cheonanfestival.com/ko/index.php"" target=""_blank"" title=""새창:천안 흥타령춤축제 홈페이지로 이동"">http://cheonanfestival.com</a>"
천양정,1592606,인문(문화/예술/역사),역사관광지,유적지/사적지,http://tong.visitkorea.or.kr/cms/resource/98/3364298_image2_1.JPG,전북특별자치도,127.1379682019,35.8155112011,"천양정은 조선시대 한량들이 활쏘기 연습을 위해 활터에 세운 것이다. 숙종 38년(1712)에 다가천 서쪽 냇가에 세웠으나 얼마 후 홍수로 떠내려 가버렸다. 그 뒤 경종 2년(1722)에 다가산 밑에 다가정(多佳亭)이란 정자를 짓고 활터로 사용했다. 순조 30년(1830)에는 이곳에 또 다른 정자를 세우고 옛 이름을 따서 천양정이라 했다. 이후 북향인 다가정은 젊은 한량들 전용으로, 아늑한 골짜기에 남향으로 자리 잡은 천양정은 주로 노인층이 사용하게 되었다. ‘천양(穿楊)’이란 뜻은 버들잎을 화살로 꿰뚫는다는 것으로, 신묘한 활 솜씨로 이름 높았던 조선 태조 이성계의 고사에서 유래한 말이다.","<a href=""https://www.heritage.go.kr/heri/cul/culSelectDetail.do?pageNo=1_1_1_1&sngl=Y&ccbaCpno=3413500060000"" target=""_blank"" title=""새창 : 국가유산청으로 이동"">https://www.khs.go.kr/</a>"
천연기념물센터(대전),1906578,인문(문화/예술/역사),문화시설,전시관,http://tong.visitkorea.or.kr/cms/resource/56/2597656_image2_1.bmp,대전광역시,127.3901781253,36.3707467253,"‘천연기념물센터’는 자연유산인 천연기념물과 명승에 대한 체계적인 조사·연구와 전시·교육을 통하여 그 가치와 중요성을 국민에게 널리 알리기 위하여 설립된 국가연구기관입니다. 천연기념물센터 전시관에는 자연유산에 대한 연구 결과물인 공룡알·발자국 등의 화석, 반달가슴곰, 수달, 독수리 등의 동물 박제 표본, 존도리 소나무 등의 식물 표본 등을 전시하여 전문연구자와 청소년의 학습에 도움을 주고 있으며, 체험 공간, 검색 키오스크, 영상실 등을 통하여 독창적인 체험학습 기회를 제공하고 있습니다. 또한 유네스코와 세계 여러 나라의 자연유산 전문기관 및 자연사박물관과의 학술교류를 통하여 명실상부한 자연유산 전문연구기관으로 발전해 나가고 있습니다.","<a href=""https://nrich.go.kr/nhc/index.do"" target=""_blank"" title=""새창 : 천연기념물센터 홈페이지로 이동"">https://nrich.go.kr/nhc/index.do</a>"
천연애,2866610,음식,음식점,한식,http://tong.visitkorea.or.kr/cms/resource/02/2866602_image2_1.jpg,대구광역시,128.559086495,35.8277379879,"천연애는 대구광역시 달서구 송현1동에 위치하고 있다. 세월이 흔적이 느껴지는 외관과 깔끔한 분위기를 연출하는 인테리어가 눈에 띈다. 내부에는 단체석이 마련되어 있어 각종 모임을 가지기 좋다. 대표 메뉴는 오리고기와 부추가 어우러진 힐링불고기다. 이 밖에 예약해야만 맛볼 수 있는 능이백숙을 비롯해 들깨수제비, 메밀막국수, 볶음밥 등도 맛볼 수 있다.",
천연제작소,2782794,쇼핑,쇼핑,전문매장/상가,http://tong.visitkorea.or.kr/cms/resource/08/2796008_image2_1.jpg,부산광역시,129.0105667328,35.2108852247,"천연제작소는 부산 최초의 제로웨이스트샵이자 무포장 가게다. 대나무 칫솔과 고체 치약, 유기농 비누, 수세미, 세제, 세척 솔 등 환경을 먼저 생각하는 천연제품들을 판매하고 있다. 유기농 비누의 경우 직접 향과 거품을 체험해 볼 수 있는 공간도 마련돼 있다. 세탁 세제와 섬유유연제, 주방세제는 g당 판매하고 있다. 그 때문에 용기를 직접 가져가거나 가게에 비치된 기부 용기에 소분 형식으로 구매할 수 있다. 현미와 찰보리, 찹쌀, 서리태, 귀리 등 각종 곡물도 같은 방식으로 소분해 판매한다. 이를 통해 일상에서 손쉽게 사용되고 버려지는 플라스틱 쓰레기를 줄이기 위한 실천을 제안한다. 손님들의 자발적 참여로 페트병 뚜껑 수거 캠페인도 진행한다. 버려지는 페트병 뚜껑을 깨끗이 씻고 말린 다음 색깔별로 분류하여 담으면 된다.","<a href=""https://www.instagram.com/Natural_factory2015/"" target=""_blank"" title=""새창 : 천연제작소 사이트로 이동"">https://www.instagram.com/Natural_factory2015/</a>"
천왕근린공원,2591838,인문(문화/예술/역사),휴양관광지,공원,http://tong.visitkorea.or.kr/cms/resource/16/3393016_image2_1.JPG,서울특별시,126.8418082369,37.4764678238,"천왕 근린공원은 구로구 경계에 위치하고 있고, 연못 내 연꽃이 만개했을 때 아름다운 경관을 보여준다. 여름에는 한시적으로 물놀이장으로 운영되어 아이들과 함께하기에 좋다. 또한 캠핑장도 운영하고 있는데 운영시간과 기간이 정해져 있고, 취사가 불가하므로 사전에 확인 후 방문하는 것이 좋다. 온 가족이 함께 다양한 방법으로 휴식하기 좋은 도심 속 힐링 공간이다.",
천왕사(제주),482093,인문(문화/예술/역사),역사관광지,사찰,http://tong.visitkorea.or.kr/cms/resource/37/3034437_image2_1.jpg,제주특별자치도,126.4939972225,33.4082872226,"아흔아홉 골의 수려한 풍광 속에 들어앉은 천왕사는 한라산 어승생 동쪽에 수많은 봉우리와 골짜기로 이루어진 아흔아홉 골(구구곡)중 하나인 금봉곡 아래 위치한 사찰이다. 1955년 천왕사 근처 토굴에서 참선수행하던 비룡스님에 의해 수영산 선원이란 명칭으로 처음 창건되었다. 현재는 대한불교조계종 제23교구로 등록되어 있으며 비록 건립된 지 오래되지 않았으나 1994년 전통 사찰로 지정되었다. 
대웅전 바로 뒤로는 용바위라 불리는 커다란 바위가 있고, 마당 왼쪽 자락에 기세 좋게 곧게 뻗은 바위가 울창한 숲과 어우러져 절경을 이룬다. 사찰 옆의 냇물을 따라 올라가면 한라산의 유일한 폭포라는 선녀 폭포가 나오고, 사찰 입구에는 약수터가 있다. 특히 가을에 기암절벽 아래 물드는 단풍이 장관으로 알려져 있다.","<a href=""https://www.visitjeju.net/kr/detail/view?contentsid=CNTS_000000000022631"" target=""_blank"" title=""새창 : 홈페이지로 이동"">https://www.visitjeju.net</a>"
천왕산 가족캠핑장,2792594,레포츠,육상 레포츠,"야영장,오토캠핑장",http://tong.visitkorea.or.kr/cms/resource/22/2800322_image2_1.jpg,서울특별시,126.8314063341,37.4790478943,"천왕산 가족공원 캠핑장은 서울시 구로구 오류 2동에 있다. 지하철 7호선 천왕역에서 도보로 30여 분 걸리는 거리다. 흔히 마을 뒷산이라 불리는 나지막한 천왕산 중턱에 가족캠핑장을 조성해 도시 자연공원과 함께 즐길 수 있도록 했다. 30개의 데크 사이트에 샤워실과 화장실, 세척실이 최고급 상태로 꾸며져 있고, 빈손으로 가도 캠핑을 즐길 수 있도록 텐트와 요리도구, 냉난방기구 등 일체를 대여해 주고 있다.","<a href=""https://www.gurosisul.or.kr/mod.asp?m=business&s=b08""target=""_blank"" title=""새창: 천왕산 가족공원 캠핑장 홈페이지로 이동"">https://www.gurosisul.or.kr/</a>"
천왕산 책쉼터,3351658,인문(문화/예술/역사),체험관광지,이색체험,,서울특별시,126.8309119459,37.4786340452,"천왕산 책쉼터는 천왕산 인근에 위치하고 있어 우거진 숲을 바라보며 독서할 수 있는 북카페이다. 이곳은 음료와 다과를 맛볼 수 있는 카페와 오롯이 독서를 즐길 수 있는 책쉼터로 나누어져 있다.
책쉼터는 사방이 통창으로 되어 있어 풍경을 감상할 수 있고 야외에는 테이블이 비치되어 있어 날씨 좋은 날 휴식을 즐기거나 산책을 해도 좋다. 자연이 주는 포근함과 함께 여유롭게 독서를 즐길 수 있는 곳이다.",
