title,contentid,cat1,cat2,cat3,firstimage,region,mapx,mapy,overview,homepage
카페우즈,2792734,음식,음식점,카페/전통찻집,http://tong.visitkorea.or.kr/cms/resource/03/2794803_image2_1.jpg,경기도,127.6433975322,37.2486781329,"여주 아울렛에서 멀지 않은 곳에 있는 예쁜 카페이다. 아치형으로 된 입구 문은 처음부터 색다른 느낌을 준다.  2인석과 4인석 또는 다인용 소파, 그리고 장 테이블 좌석 등이 있어 일행 수에 따라 좌석을 선택하여 이용하기 좋다. 창이 커서 창밖 풍경을 감상하기 좋은 창가 자리가 인기가 많다. 실내에 예쁜 분위기의 인테리어뿐 아니라 멋진 야외 정원도 있어 누구나 쉬어 가기 좋은 곳이다. 황학산 수목원도 가까이 있어 여주 나들이 길에 들러 보기 좋은 카페이다.",
카페우즈,2832046,음식,음식점,카페/전통찻집,http://tong.visitkorea.or.kr/cms/resource/39/2832039_image2_1.jpg,대구광역시,128.6564717016,36.0498951726,"카페우즈는 경상북도 군위군 부계면에 있다. 
대표 메뉴는 아메리카노이며, 카페라테, 에스프레소, 카페모카, 카푸치노, 아인슈페너, 연유라테 등도 맛볼 수 있다.
주말과 공휴일 오후 2시부터 3시간 동안 12개월부터 13세까지는 입장할 수 없는 노키즈존으로 운영된다.
동군위IC에서 가깝고, 인근에 동산계곡이 있다.
※ 반려동물 동반 가능(목줄, 배변봉투 지참)","<a href="" http://www.instagram.com/woods__cafe""target=""_blank"" title=""새창 : 카페우즈 사이트로 이동"">http://www.instagram.com/woods__cafe</a>"
카페운암,2877148,음식,음식점,카페/전통찻집,http://tong.visitkorea.or.kr/cms/resource/33/2877133_image2_1.jpg,충청남도,127.0205590818,36.5543191546,"카페운암은 충청남도 공주시 사곡면 운암리에 있는 한옥카페다. 1층에는 넓은 테라스가 있으며, 지하 1층에는 현대식 건축물과 어우러진 좌식 테이블이 있다. 또한 가족, 친구, 연인과 편하고 조용하게 담소를 나눌 수 있는 다락방도 꾸며 놓았다. 아메리카노와 카푸치노도 있지만 수제 대추차, 수제 생강차, 수제 오미자차 등 카페 운암만의 맛을 즐겨보는 것도 좋다. 야외에는 넓은 잔디밭이 있고 계절에 상관없이 산책할 수 있는 30분가량의 산책로도 갖추어져 있다. 유구 IC에서 가깝고, 주변에 유구 색동수국정원과 마곡사가 있다.
※반려동물 동반 가능(목줄, 배변봉투 지참)","<a href=""https://www.instagram.com/cafewoonam""target=""_blank"" title=""새창 : 카페운암 사이트로 이동"">https://www.instagram.com/cafewoonam</a>"
카페울라봉,2574675,음식,음식점,카페/전통찻집,,경상남도,128.4290354933,34.8465543454,"욕 카페라는 별칭이 있는 전국 유일무이한 카페이다. 손님의 이야기를 라떼 거품 위에 글로 적어주는 쌍욕라떼라는 메뉴가 유명하다. (다소 과격한 표현이 있을 수 있으니 주문 시 신중을 기해야 한다.) 쌍욕 라떼는 19금 제품이다. 일행 중 미성년자가 있을 경우 전체에게 욕이나 과격한 글을 적지 않는다 (착한 말 라떼로 대체된다). 3,4층은 게스트하우스이다. 5층 옥상은 루프탑 라운지이다.",
카페웨더,2864841,음식,음식점,카페/전통찻집,http://tong.visitkorea.or.kr/cms/resource/09/2864809_image2_1.jpg,경기도,127.228449158,37.5352012818,카페웨더는 하남시 창우동에 있는 브런치와 디저트가 맛있는 카페이다. 실내장식은 빈티지 스타일로 분위기 때문에 찾는 사람들도 있다. 5호선 하남 검단산역에서 800여 미터 거리에 있다. 주차는 카페 앞에 커다란 주차장이 있어 편리하다. 카페 건물은 잘 꾸며진 정원에 하얀색으로 칠해져 있어 들어가면서부터 안의 분위기를 짐작할 수 있다. 내부는 2층까지 분위기가 다른 좌석이 배치되어 있고 각종 소품이 예쁘게 진열되어 있어 구경하며 사진 찍기에도 좋다. 브런치 메뉴도 다양하고 푸짐하다. 각종 빵과 케이크도 먹음직스럽게 진열되어 있고 각종 음료도 준비되어 있다.,
카페웰콤,2842196,음식,음식점,카페/전통찻집,http://tong.visitkorea.or.kr/cms/resource/88/2842188_image2_1.jpg,경기도,127.3823587512,37.293357098,"카페웰콤은 경기도 이천시 신둔면에 있는 디저트 카페이다. 배우 공유의 커피 광고 촬영지로 알려진 곳이다. 도자기의 고장인 여주의 특성을 살려 도자기를 이용한 실내 인테리어가 눈길을 끈다. 단아하고 정갈한 분위기의 카페이다. 1층과 2층에는 포토존이 있다. 카페웰콤은 독특한 대표 디저트들로 인가가 많다. 이천쌀밥빙수는 쌀밥을 형상화하여 빙수를 만드는데, 바닥을 곡물과 캐러멜을 사용하여 누룽지 모양까지 만들었다. 자연 방사 동물복지 유정란과 100% 마스카포네치즈로 만든 옹기티라미슈는 모양이 독특하여 인기 메뉴이다. 옹기 뚜껑을 열면 마치 흙에 풀 한 포기 자란 모습으로 꾸며 놓았다. 부드러운 맛까지 시각과 미각의 즐거움을 담았다. 또 다른 인기 메뉴인 크림브륄레는 크기에서 한번 놀라고 맛을 즐긴다. 커피는 산미 있는 맛과 고소한 맛, 디카페인 중에서 선택할 수 있다. 다양한 휘낭시에를 합리적인 가격에 맛볼 수도 있다. 근처에 예스파크, 해주도자박물관이 있고, 4km 이내에 이천도예마을, 갤러리, 설봉공원이 있다.","<a href=""https://www.instagram.com/cafe_wellcome/?igshid=bebyl12lrifx"" target=""_blank"" title=""새창 : 카페웰콤"">www.instagram.com/cafe_wellcome</a>"
카페위로,3018867,음식,음식점,카페/전통찻집,http://tong.visitkorea.or.kr/cms/resource/44/3018844_image2_1.jpg,전라남도,127.0500002053,34.6405646304,"광주에서 1시간 거리에 잘 정리된 잔디밭과 바다전망이 가능한 카페 위로는 we와 路(길로)의 합성어이다. 기와지붕의 카페 건물 기와지붕 위로 뒷산의 완만한 스카이라인이 펼쳐지고 카페 앞의 키가 큰 소나무 두 그루가 군더더기 없이 깔끔하다. 도로변과 정원의 잔디 정원보다 약간 경사진 언덕 위 한옥 건물을 들어서면 모던한 현대식 실내 인테리어와 천장에 매달려 있는 조명이 한눈에 들어온다. 날씨가 좋은 날 카페 전면의 폴딩 도어를 오픈하면 카페의 공간은 바다를 향해 확장되며 시원한 개방감과 바다 풍경이 펼쳐지고 해가 지면 야외 정원에 조명이 켜지며 낭만적인 분위기로 바뀐다. 잔디 정원에는 파라솔과 그네, 테이블 등이 놓여 있어 야외에서 바다를 전망하며 차를 마실 수 있다. 봄이면 정원의 벚꽃이 활짝 피고 바다조망과 함께 산조망이 동시에 가능한 카페이다.
차량 이동 약 25분 거리 안에 제암산 휴양림, 대한다원 보성녹차밭이 있고, 도보 30분, 차량 5분 거리에 수문해수욕장이 있다.",
카페유일,2833624,음식,음식점,카페/전통찻집,http://tong.visitkorea.or.kr/cms/resource/23/2833623_image2_1.jpeg,경기도,126.8219411227,37.358331184,"카페유일은 경기도 안산시 도심 속 힐링이 가득한 한옥 카페이다. 핸드드립 커피 전문으로 하고 있으며, 당일 로스팅한 신선한 원두를 사용한다. 원두는 베트남, 콜롬비아, 예가체프, 브라질 중 직접 고를 수 있다. 단, 브라질산 원두는 콜드브루만 가능하다. 한옥 내부에 다양한 좌석이 배치되어 있으며, 툇마루와 야외 평상 좌석도 있다. 또, 이곳은 반려동물 동반 시 야외 이용만 가능하다.","<a href=""https://www.instagram.com/cafe_yuil""target=""_blank"" title=""새창 : 카페유일 사이트로 이동"">https://www.instagram.com/cafe_yuil</a>"
카페유자,2891578,음식,음식점,카페/전통찻집,http://tong.visitkorea.or.kr/cms/resource/91/2877891_image2_1.jpg,경상남도,128.0363760038,34.8193893165,"남해의 유자는 따뜻한 날씨와 선선한 바닷바람을 맞고 자라 과육이 상큼하고 달곰하다. '카페 유자'는 남해의 유자를 주재료로 매일 매장에서 굽는 유자 카스텔라와 유자 음료로 유명한 카페다. 오래된 마을 주택을 요즘 감성으로 리모델링해 빈티지함과 트렌디함이 모두 공존한다. 잘 가꿔진 잔디마당과 파라솔, 마당을 향해 나 있는 커다란 통유리가 감성을 더했다. 인기 메뉴는 단연 유자 카스텔라다. 보통 카스텔라보다 촉촉하고 푹신한 식감에 유자 향과 맛이 풍성하게 느껴진다. 포장 시 카페 유자의 시그니처 로고가 그려진 박스로 포장이 돼 선물용으로도 많이 구매한다. 음료 메뉴로는 커피와 유자 음료 메뉴가 있는데, 유자차와 유자 주스는 유자청을 곱게 걸러 건더기가 없는 유자 진액을 사용한다. 차로 5분 거리에 독일 마을이 있어 함께 여행하기 좋다.
※ 반려동물 동반 가능","<a href=""http://www.instagram.com/cafe_yuja""target=""_blank"" title=""새창 : 카페유자 사이트로 이동"">http://www.instagram.com/cafe_yuja</a>"
카페유주,2899468,음식,음식점,카페/전통찻집,http://tong.visitkorea.or.kr/cms/resource/60/2899460_image2_1.jpg,제주특별자치도,126.2572456406,33.4055087916,"카페유주는 제주시 한립읍 옹포사거리 근처 길 안쪽에 있는 베이커리 카페다. 창고를 개조한 듯한 카페 건물로 내부는 빛이 잘드는 아늑한 분위기이다. 다양한 케이크류와 까눌레, 소금베이글, 오키나와산 수제 흑당시럽을 넣은 흑당라떼, 찻잔에 미니사과가 담겨 나오는 사과홍차 등이 인기 메뉴이다. 반려견 동반이 가능하고 12세 미만의 아이는 입장할 수 없는 노키즈 존으로 운영되고 있다. 주변 여행지로 비양도 가는 한림항, 옹포리 포구 등이 있다. 
※ 반려동물 동반 가능","<a href=""http://instagram.com/cafe_yuzu""target=""_blank"" title=""새창 : 카페유주 사이트로 이동"">http://instagram.com/cafe_yuzu</a>"
카페윤,3350880,음식,음식점,카페/전통찻집,http://tong.visitkorea.or.kr/cms/resource/93/3350893_image2_1.jpg,부산광역시,129.2108945214,35.1826309881,"아름다운 부산의 바다의 매력을 느낄수 있으면서 동부산 관광단지 입구에 위치하여 해운대와 기장이 가진 아름다운 부산 바다의 매력을 느낄 수 있는 디저트 카페이다.
코랄라니 사잇길로 내려오면 보이는 카페로 통유리로 되어 있어 창문을 통해 환상적인 오션뷰를 즐길 수 있다. 보기만 해도 힐링되는 절경 덕분에 가족이나 친구, 연인과 함께 오기에 좋은 곳이다.",
카페율,2849928,음식,음식점,카페/전통찻집,http://tong.visitkorea.or.kr/cms/resource/16/2849916_image2_1.jpg,충청북도,127.5357943942,36.9179393138,"카페율은 충청북도 음성군 맹동면에 위치한 카페이다. 현대적인 감각이 돋보이는 외관과 고급스러운 분위기를 연출하는 인테리어가 눈에 띈다. 또, 내부가 모두 통유리창으로 되어 있어 개방감이 좋다. 잔디가 깔린 외부 정원에는 포토존이 있어 사진을 남기기 좋다. 대표메뉴는 코코넛커피, 아몬드비엔나커피 등이 있으며, 이외에도 다양한 커피와 음료, 티, 스무디 등이 있다.","<a href=""http://instagram.com/cafe_yul_""target=""_blank"" title=""새창 : 카페율 사이트로 이동"">http://instagram.com/cafe_yul_</a>"
카페은린,2845002,음식,음식점,카페/전통찻집,http://tong.visitkorea.or.kr/cms/resource/98/2844998_image2_1.jpg,울산광역시,129.4512374747,35.580363098,"울산광역시 북구 어물동에 위치한 카페은린은 주택을 개조해서 만든 한옥카페이다. 모든 커피를 스페셜티로 제공하는 이곳은 마루와 평상 위에서 운치 있게 음료와 베이커리를 즐길 수 있다. 좌석도 많고 야외테이블은 물론 별관까지 다양한 공간이 있다. 메뉴는 말차슈페너, 흑임자라떼, 수제쿠키, 아이스크림 크로플 등 다양하게 준비되어 있으며, 야외는 반려동물도 동반할 수 있다.","<a href=""http://instagram.com/eunrin_coffee""target=""_blank"" title=""새창 : 카페은린 사이트로 이동"">http://instagram.com/eunrin_coffee</a>"
카페은하수,2925529,음식,음식점,카페/전통찻집,http://tong.visitkorea.or.kr/cms/resource/24/2925524_image2_1.jpg,강원특별자치도,127.2775309031,38.199830297,"한탄강 일대의 지질 탐방로인 한여울길을 따라 한탄강을 건너는 은하수교가 있는데, 무척 아름답다. 가까이에서 이 다리와 한탄강을 바라보면서 커피를 즐길 수 있는 카페이다. 은하수교 입장료를 구입하면 제공되는 철원지역 상품권도 사용할 수 있고, 주차장도 넓어서 은하수교를 방문할 때 들르면 좋다. 다양한 음료와 빵들을 판매하며, 키스링 빵이 인기가 많다. 카페 2층에 실내외 테이블이 있는데, 사계절 언제든 멋진 뷰를 즐길 수 있어 인기가 많다.","<a href=""http://www.instagram.com/cafe_milky_way/""target=""_blank"" title=""새창 : 카페은하수 사이트로 이동"">http://www.instagram.com/cafe_milky_way/</a>"
카페이루아,2789087,음식,음식점,카페/전통찻집,http://tong.visitkorea.or.kr/cms/resource/37/2789037_image2_1.jpg,강원특별자치도,128.3389140063,37.5768420638,봉평면에 위치한 생 원두를 태우지 않고 직접 로스팅을 통해 추출하는 커피 전문점이다.,
카페이림,2875956,음식,음식점,카페/전통찻집,http://tong.visitkorea.or.kr/cms/resource/49/2875949_image2_1.JPG,인천광역시,126.5027014155,37.6359738214,"카페이림은 강화군 길상면 길상공설운동장 인근에 있다. 주차장이 넓어 차량으로 방문 시 편리하다. 이곳은 디저트 카페다. 매장을 중심으로 카페 공간을 숲속 정원처럼 넓고 예쁘게 꾸며놓았다. 매장 정면에 작은 분수와 징검다리가 있다. 매장 내부는 넓은 공간에 테이블 간격이 넉넉하고 다양한 소품들을 배치해 놓았다. 메뉴는 시그니처 메뉴인 목련꽃 밀크티, 복숭아꽃 밀크티, 메리골드꽃 밀크티가 있고 수제차와 에이드는 레몬차&에이드, 자몽차에이드 등이 있다. 이외에 대추차를 비롯한 수제 전통차와 커피와 라테 등 마실 거리가 다양하다. 스콘 위주의 베이커리도 다양하게 준비되어 있다. 이 카페 인근에 정족산, 전등사, 초지진, 동검도 등이 있어 연계 관광을 할 수 있다.","<a href=""https://instagram.com/cafe._.elim?r=nametag""target=""_blank"" title=""새창 : 카페이림 사이트로 이동"">https://instagram.com/cafe._.elim?r=nametag</a>"
