title,contentid,cat1,cat2,cat3,firstimage,region,mapx,mapy,overview,homepage
장안산관광농원,1607273,음식,음식점,한식,,전북특별자치도,127.5908350078,35.6548623576,전북의 명산인 장안산 북쪽 자락에 맑은 계곡을 안고 있는 전원양지 형태의 관광농원이다. 숲에 가려진 장안산의 투명한 물줄기가 천연의 놀이터를 제공하고 바위 틈새로 쏟아져 내리는 작은 폭포수들이 자연스럽게 샤워장을 연출한다. 농원의 먹을거리는 개울물을 끌어들여 양식하는 송어회와 메기매운탕이 주를 이루고 토종닭 백숙은 직접길러 제공한다.<br>,
장안산군립공원,126258,자연,자연관광지,군립공원,http://tong.visitkorea.or.kr/cms/resource/73/2705873_image2_1.jpg,전북특별자치도,127.5441871386,35.6253259956,"높이 1,237m의 장안산은 1986년에 군립공원으로 지정되었다. 덕산용소와 방화동, 지지계곡 지구로 나뉘어 있다. 기암괴석과 원시수림이 울창하고 심산유곡에 형성된 연못과 폭포가 절경을 이루는 관광지로 덕산계곡을 비롯한 크고 작은 계곡 26개소 및 윗용소, 아랫용소 등 7개의 연못, 지소반석 등 14개의 기암괴석, 5군데의 약수터 등 주요 경관이 울창한 수림과 어울려 수려함을 이루고 있다. 특히, 장안산의 또 하나의 비경은 산등에서 동쪽 능선으로 등산로를 따라 펼쳐진 광활한 억새밭이다.","<a href=""https://www.jangsu.go.kr/index.jangsu?menuCd=DOM_000001306004000000""장수 문화관광 사이트로 이동"">https://www.jangsu.go.kr</a>"
장안삼계탕,133856,음식,음식점,한식,http://tong.visitkorea.or.kr/cms/resource/37/1845637_image2_1.jpg,서울특별시,126.9774823049,37.5637267771,"※ 영업시간 09:00 ~ 21:00 (라스트오더 20:30)

태평로에 위치한 장안삼계탕은 40년 넘는 전통이 있는 곳이다. 삼계탕의 명문으로 자리 잡은 이곳은 3층 규모로 좋은 재료만 엄선해서 사용한다. 영계만으로 삼계탕을 끓여내 국물은 기름기가 적고 고소하고 담백하며 닭 냄새가 나지 않는 것도 이 집만의 특징이다. 간을 하는데 쓰는 소금도 곱게 간 후추를 넣고 볶아서 만든 천일염만을 쓴다. 밑반찬으로 나오는 깍두기 맛도 일품이다.",
장안식당,2872998,음식,음식점,한식,http://tong.visitkorea.or.kr/cms/resource/96/2872996_image2_1.jpg,전라남도,126.5245556513,35.0609418868,"된장을 푼 육수에 곱창이 듬뿍 들어간 곱창국밥을 전문으로 하는 함평의 맛집이다. 곱창전골, 곱창 수육 등 다양한 곱창요리에 생고기, 육회 등의 메뉴까지 다양한 요리를 맛볼 수 있는 곳이다. 식당 앞 주차장이 넓게 마련되어 있어 주차 걱정 없이 편하게 방문할 수 있다. 전통 맛집으로 알려진 곳으로 어르신들부터 젊은 세대에 이르기까지 손님 연령층도 다양하다. 유명한 맛집인 만만큼 웨이팅은 기본이다. 함평엑스포공원과 가깝다.",
장안정,2842930,음식,음식점,한식,http://tong.visitkorea.or.kr/cms/resource/13/2842913_image2_1.jpg,서울특별시,127.0726483775,37.5727774361,"장안정은 서울특별시 동대문구 장안동에 있는 돈가스 전문점이다. 장안동 사거리 장평초등학교 인근에 있다. 여러 TV 프로그램에 돈가스 맛집으로 소개되었고 오랜 세월 돈가스 전문점을 운영한 공로로 중소벤처기업부에서 백년가게 지정도 받았다. 상가 전용 주차장이 있지만 협소해서 대중교통을 이용하는 게 편리하다. 장안정 대표 메뉴는 돈가스, 함박스테이크, 생선가스 맛을 다 볼 수 있는 정식이다. 그밖에 치즈돈까스, 새우까스, 매운돈까스가 있고 함박스텍, 냉면, 비빔냉면+돈까스 세트도 있다. 밑반찬과 함께 수프, 국물, 밥이 함께 나온다.",
장안정사,2735324,인문(문화/예술/역사),역사관광지,사찰,http://tong.visitkorea.or.kr/cms/resource/50/3392150_image2_1.JPG,경기도,126.8023094384,37.660617928,"불교 조계종 소속의 장안정사는 서울에서 비교적 가까운 거리인 일산에 있는 추모공원이다. 천혜의 자연을 벗 삼아 30년이 넘는 역사를 통해 7천여 영가의 유족 수 3만여 명이 이용하고 있는 길지이자 명당으로 알려진 곳이다. 일산 동구 풍동에 위치한 좌호산을 중심으로 뒤로는 황룡산의 줄기가, 우로는 정발산, 좌로는 북한산에 둘러싸인 풍수학상 길지로 알려진 추모공원이다.","<a href=""http://www.janganpark.co.kr/season2/index.html/"" target=""_blank"" title=""새창 : 장안정사 사이트로 이동"">www.janganpark.co.kr</a>"
장안캠프,2734243,레포츠,육상 레포츠,"야영장,오토캠핑장",http://tong.visitkorea.or.kr/cms/resource/55/2735855_image2_1.JPG,부산광역시,129.252403167,35.3418805818,"부산 기장에 위치한 숲 속 캠핑장. 송림 사이로 아이들을 위한 트램펄린과 작은 물놀이장도 운영한다. 아이들과 함께 오는 가족 캠퍼들이 많고, 장박 하는 팀도 많은 캠핑장이다.","<a href=""http://www.pinkpark.co.kr/"" target=""_blank"" title=""새창 : 장안캠프 사이트로 이동"">http://www.pinkpark.co.kr/</a>"
장안해수욕장,129638,자연,자연관광지,해수욕장,http://tong.visitkorea.or.kr/cms/resource/11/3048111_image2_1.jpg,충청남도,126.5404199298,36.2002320072,"장안해수욕장은 보령시 남서부 부사방조제 인근에 있는 소규모 해수욕장이다. 이곳은 고운 규사 백사장과 해안선을 따라 푸른 소나무가 자생하고 있는 아늑한 청정해수욕장이다. 장안해수욕장은 조개나 해상 동식물 채취가 금지되어 있어 먹이활동을 하는 갈매기가 유난히 많다. 주변이 조용하고 깨끗하며 해안의 통달산(179.1m) 기암괴석 사이로 푸른 소나무가 우거져 호젓한 피서를 즐기기에 더없이 좋은 곳이다. 
썰물 시 서해 바다의 고운 모래를 맨발로 밟으며 걷는 산책도 즐기기 좋다. 이곳은 소황사구가 있어 자연 모래 언덕 지형 및 그 생태계도 체험할 수 있다.
장안해수욕장은 국도 21호선, 지방도 606호선에서 지방도 607호선을 통해 접근할 수 있으며, 서해안고속도로 무창포IC, 춘장대IC가 가깝다. 주변에는 소황사구, 부사방조제 외에 부사호, 춘장대해수욕장 등이 있다.","<a href=""https://www.brcn.go.kr/prog/attraction/tour/sub01_03/view.do?listOrder=&searchCondition=&searchKeyword=&searchLocalCode=&searchMonth=&themeCode=1065&attractionCode=78"" target=""_blank"" title=""새창 : 홈페이지로 이동"">https://www.brcn.go.kr</a>"
장안횟집,2775521,음식,음식점,한식,,강원특별자치도,128.8754437583,37.837649988,"장안횟집은 강릉 사천항 수산물 직판장 앞에 위치한 넓은 규모의 횟집이다. 메뉴는 물회와 회덮밥, 우럭 미역국 등으로 물회와 회덮밥에 들어가는 재료를 오징어, 물가자미, 광어 중에서 선택할 수 있다. 재료들은 모두 자연산 해산물과 활어로 믿고 먹을 수 있다. 다만 계절에 따라, 주 재료의 수급 상황에 따라 회덮밥과 물회에 들어가는 재료(오징어, 가자미, 광어 등)가 바뀌는 경우도 있다. 강릉에서 물회 맛집으로 알려져 있어 성수기에 방문한다면 대기는 필수이다.",
장암 정호 묘소,1678501,인문(문화/예술/역사),역사관광지,유적지/사적지,http://tong.visitkorea.or.kr/cms/resource/11/3334411_image2_1.JPG,충청북도,127.8185924609,36.8732162709,"괴산 정인지 묘소는 문경공(文敬公) 장암(丈巖) 정호(鄭澔,1648-1736)의 묘소이다. 정호는 조선중기의 문신, 학자로 자는 중순(仲淳), 호는 장암(丈巖), 본관은 연일(延日), 좌의정 정철(鄭澈)의 후손이다. 송시열(宋時烈)의 문인으로 숙종 8년(1682) 생원이 되고 1684년 정시문과(庭試文科)에 급제하여 검열(檢閱)·정언(正言)을 지냈으나 1689년에 을사환국(乙巳換局)으로 파직되어 문외출송(門外黜送)당했다가 이어서 경성(鏡城)에 유배되었다. 이후 숙종 20년(1694) 갑술옥사(甲戌獄事)로 서인이 기용될 때 재등용되었고 당쟁의 와중에 부침을 거듭하였으나 영의정에까지 올랐다. 충주의 누암서원(樓巖書院)에 배향되었고, 부조묘(不轅廟)는 충주시 가금면 창동에 있다. 봉분 앞에는 상석(床石), 묘비, 망주석(望柱石) 등이 있으나 전체규모는 그리 크지 않다.","괴산군 문화관광 <a href=""https://www.goesan.go.kr/tour/selectTourInfo.do?key=887&tourNo=632&clgn="" target=""_blank"" title=""새창 : 괴산군 문화관광 홈페이지로 이동"">https://www.goesan.go.kr/tour</a><br>문화재청 <a href=""https://www.heritage.go.kr/heri/cul/culSelectDetail.do?pageNo=1_1_1_1&sngl=Y&ccbaCpno=2333301410000"" target=""_blank"" title=""새창 : 문화재청 홈페이지로 이동"">https://www.cha.go.kr</a>"
장암산 활공장,131635,레포츠,항공 레포츠,헹글라이딩/패러글라이딩,,강원특별자치도,128.4154239878,37.3839519101,"장암산 활공장은 평창읍의 전경을 한눈에 볼 수 있는 명산인 장암산(836m)에 있는 패러글라이딩 명소이다. 장암산 해발 740m 지점 1400여평에 개장한 장암산 활공장에서는 패러글라이딩을 체험 할 수 있다. 적당한 풍속과 풍향에, 비행에 방해되는 요소가 없으며 넓은 강변 백사장을 착륙장으로 삼을수도 있어 패러글라이딩을 하기에 좋은 조건을 갖추고 있다. 
수려한 자연 경관을 발아래 두고 창공을 비행하는 즐거움에 패러글라이딩 동호인들의 발길이 끊이지 않는 곳이기도 하다. 초보자와 상급자까지 부담 없이 비행이 가능하며 특히 전문 조종사와 2인1조로 하늘을 나는 텐덤 비행은 당일 바로 비행이 가능하다. 패러글라이딩 체험을 하지 않더라도 해발 700m 고원에서 탁 트인 사방과 아름답다는 말조차도 평범하게 만드는 풍광에 가슴이 시원해지는 기분을 느낄 수도 있다. 장암산 활공장에서는 매년 패러글라이딩 페스티벌이 개최되며 패러글라이딩 국가 대표 선발전과 한국 패러글라이딩 대회 등이 열리기도 한다.
대표 주변관광지로는 평창 바위공원과 노산성이있다.","<a href=""https://tour.pc.go.kr/Home/H30000/H30300/placeDetail?place_no=206&viewType=gallery&curationGroup=3&page=1&pageSize=12&search_column=1&search_keyword=%EC%9E%A5%EC%95%94%EC%82%B0%ED%99%9C%EA%B3%B5%EC%9E%A5&order_column=1&place_type=28"" target=""_blank"" title=""새창 : 홈페이지로 이동"">https://tour.pc.go.kr</a>"
장암정,1624477,인문(문화/예술/역사),역사관광지,유적지/사적지,http://tong.visitkorea.or.kr/cms/resource/85/3382085_image2_1.JPG,전라남도,126.7308742237,34.8058907299,"장암정은 장암 대동계에서 현종 9년(1668)에 동약의 모임 장소로 지은 정자이다. 마을 유생들이 모여 향약을 읽으며 잔치를 하던 향음주례, 백일장, 회갑연 등과 나라의 행사가 있을 때 쓰이던 곳이라고 한다. 동약이란 조선시대 시골 마을에서 마을 사람들 스스로 만들어 놓은 규칙으로, 좋은 일은 서로 권유하고 잘못은 서로 바로 잡아주며, 어려운 일이 있으면 서로 도와주는 것을 목적으로 한다. 지금 있는 정자는 영조 36년(1760), 정조 12년(1788), 순조 19년(1819)에 각각 고쳐지었으며, 고종 17년(1880)에 전체적으로 보수 공사를 하였고, 1976년에 일부를 수리했다. 정자는 앞면 4칸, 옆면 3칸 규모이며 지붕은 옆면에서 볼 때 여덟 팔(八)자 모양인 팔작지붕으로 꾸몄다. 앞쪽에 마루를 깔아 개방된 구조이며 뒤쪽 중앙으로 마루방 2칸을 두었다. 장암정은 건축적으로 큰 특징은 없으나, 동약의 집회소로 남아 있는 건물이 드물고, 조선 후기 호남지방의 시골 생활사를 반영하는 기록들을 보관하고 있어 역사 자료로 가치가 크다.","<a href=""https://www.yeongam.go.kr/home/tour/spectacle/spectacle_03/show/73?page=1"" target=""_blank"" title=""새창 : 영암군 문화관광 홈페이지로 이동"">https://www.yeongam.go.kr/home/tour</a>"
장애인문화예술축제 A+ Festival,790211,인문(문화/예술/역사),축제,일반축제,http://tong.visitkorea.or.kr/cms/resource/35/3345235_image2_1.jpg,서울특별시,126.9746792089,37.5839799278,"장애인문화예술축제 A+ Festival은 장애인들의 잠재적 가능성(Ability), 열린 접근성(Accessibility), 활기찬 역동성(Activity)을 모토로 장애인과 비장애인이 예술(Arts)로 함께(All Together)한다는 취지로 2009년부터 시작한 축제로 공연, 전시, 버스킹, 뮤지컬, 미디어 융복합 전시 등 모든 예술형태로 3일간 진행되는 국내 최대의 장애인문화예술 축제이다.
올해에는 ‘자그마한 불씨 하나하나가 모여 세상을 밝히듯, 마음 속 희망이라는 빛이 서로를 비추어 모두가 빛나는 축제.’라는 메시지를 담은 ‘비치고 비추어’라는 테마로 푸른 하늘 아래 가을의 정취가 물씬 풍기는 청와대 헬기장과 춘추관에서 펼쳐진다 
장애인·비장애인 모두가 어우러져 즐길 수 있는 공연 프로그램과 장애예술인과 함께 즐기는 체험부스 프로그램이 청와대 헬기장에서 진행되며 청와대 춘추관에서 장애예술의 아름다움을 마주할 수 있는 전시 프로그램이 진행될 예정이다.","<a href=""https://aplusfestival.or.kr/"" target=""_blank"" title=""새창 : 장애인문화예술축제 A+ Festival"">https://aplusfestival.or.kr/</a>"
장어구이 어장,2915761,음식,음식점,한식,http://tong.visitkorea.or.kr/cms/resource/47/2915747_image2_1.jpg,대전광역시,127.3504098122,36.3578113884,"장어구이 어장은 대전광역시 유성구 봉명동에 위치한 장어구이 전문점이다. 대표 메뉴는 강화도 청정갯벌을 막아 만든 어장에 민물장어를 75일 이상 순치하여 자연산화 된 강화갯벌장어인데 탱탱하고 쫄깃한 식감이 특징이다. 민물장어 특유의 흙맛 대신 담백한 감칠맛으로 찾는 이들이 많다. 강화갯벌장어를 3인분 이상 주문 시 특수부위와 쓸개즙을 제공한다. 이 밖에 돌솥밥+장어탕, 돌솥밥+청국장, 백합탕, 문어숙회, 한우라면, 백합국수 등이 준비되어 있다. 가족식사나 모임을 하기 좋다.","<a href=""https://blog.naver.com/chlwlsdud1116""target=""_blank"" title=""새창 : 장어구이 어장 사이트로 이동"">https://blog.naver.com/chlwlsdud1116</a>"
장어구이거리,2615296,인문(문화/예술/역사),체험관광지,이색거리,http://tong.visitkorea.or.kr/cms/resource/53/2520053_image2_1.JPG,경상남도,128.5757521859,35.1998951719,"1990년대 중반부터 마산어시장 맞은편 해안도로에 장어구이 전문점이 하나 둘 생겨나기 시작해 장어구이 거리가 만들어졌다. 현재 장어구이 거리에는 22개의 장어 요리 전문 음식점들이 자리 잡고 있다. 음식점들은 바다와 마창대교의 시원한 뷰가 보이는 옥상에서 먹을 수 있는 가게와 바닷가에 야외 테이블을 놓은 가게가 있으니 취향에 따라 선택하기 좋다. 장어 요리는 주로 장어 양념구이와 장어 소금구이, 장어 국밥, 장어 국수 등을 판다. 그 밖에 장어덮밥, 생선회 등도 팔고 있어 다양한 요리를 즐길 수 있다.","<a href=""https://culture.changwon.go.kr/index.changwon?contentId=130&bbsId=BBSMSTR_000000000045&nttId=663&menuNo=13010100&upperMenuId=13010000""새창:창원관광"">http://culture.changwon.go.kr</a>"
장어나라,1607725,음식,음식점,한식,,전북특별자치도,126.8584018995,35.581221911,풍천장어나라는 소금구이로 식탁에서 바로 굽기 때문에 부드럽고 더 고소한 맛을 느낄 수 있다. 밑반찬도 제공된다. 내부는 깨끗하고 정돈이 잘되어 있다.,
장어나라 별관(참자연에 장어나라),2734913,음식,음식점,한식,http://tong.visitkorea.or.kr/cms/resource/56/2735156_image2_1.JPG,경기도,126.8117157655,37.5039279871,"여름 보양식으로 백숙, 삼계탕과 함께 빠질 수 없는 민물장어구이 맛집이다. 장어나라는 본관, 신관, 별관이 각각 다른 곳에 위치해 있는데 별관은 본관, 신관과 다르게 시골길을 지나 한적한 곳에 자리잡고 있다. 7호선 까치울역 1번 출구에서 도보 5분 거리에 있다. 최고급 국내산 풍천장어만을 사용하며 깻잎절임, 무쌈, 부추와 곁들이면 장어맛을 더욱 풍부하게 즐길 수 있다. 우거지가 듬뿍 들어간 장어탕도 이 집의 별미다. 농림축산품부 제공 안심식당으로  '덜어먹기 가능한 도구 비치・제공', '위생적 수저관리' , '종사자마스크 착용' 등을 준수하고 있으며 소재지 지자체의 인증을 받은 음식점이다.","<a href=""http://blog.naver.com/eel_nara/"" target=""_blank"" title=""새창 : 장어나라 별관 사이트로 이동"">http://blog.naver.com/eel_nara/</a>"
장어나라 본관,2734921,음식,음식점,한식,http://tong.visitkorea.or.kr/cms/resource/62/2735162_image2_1.JPG,경기도,126.8087159509,37.5070386834,"여월휴먼시아 3단지 인근에 위치한 장어나라 본관은 7호선 까치울역 3번 출구에서 가깝다. 대표 메뉴는 장어 소금구이로 1kg 과 500g으로 구분하여 판매하고 있다. 참고로 장어 1kg은 뼈, 내장을 제거해, 실량 무게는 650g이 제공되고 있다. 장어는 초벌구이로 나오며 불판에 장어를 올려주면 고객이 직접 구워 먹어야 한다. 밑반찬으로 백침치, 생강, 쌈, 부추 등이 제공되며 추가반찬은 셀프다. 농림 축산부 제공 안심식당으로 '덜어먹기 가능한 도구 비치・제공', '위생적 수저관리' , '종사자마스크 착용'을 준수하는 곳으로 소재지 지자체의 인증을 받은 음식점이다.","<a href=""https://eelnara.modoo.at/""target=""_blank"" title=""새창: 장어나라 홈페이지로 이동"">https://eelnara.modoo.at/</a>"
