title,contentid,cat1,cat2,cat3,firstimage,region,mapx,mapy,overview,homepage
시휴별당[한국관광 품질인증/Korea Quality],2950478,숙박,숙박시설,한옥,http://tong.visitkorea.or.kr/cms/resource/46/2948946_image2_1.JPG,경상북도,129.2076348857,35.8343576587,"경주 조용한 골목길에 위치한 시휴별당은 많은 한옥 건축물을 만들어 온 장인이 나무를 이어 건물을 세우고, 백년도 훨씬 넘은 오래된 기와로 담을 쌓고, 나무의 편안함을 더해주는 색을 칠해 만든 공간이다. 객실은 손님을 맞이하던 1층 사랑채, 온기를 담은 2층 안채, 별채로 구성된다. 사랑채와 별채에는 수영장과 난로, 다기세트가 있고, 안채에는 실내 욕조와 다도실이 있어 각 공간에서 소중한 추억을 쌓을 수 있다.","<a href=""http://www.sihyubeuldang.com/"" target=""_blank"" title=""시휴별당(으)로 이동"">http://www.sihyubeuldang.com//</a>"
시흥 갯골생태공원,756625,자연,자연관광지,자연생태관광지,http://tong.visitkorea.or.kr/cms/resource/11/3304111_image2_1.JPG,경기도,126.7812550601,37.3898240311,"갯골생태공원은 150만 평의 폐염전 부지에 깊숙한 내만갯벌로 형성된 습지이다. 내만갯골 자연생태자원과 옛 염전의 문화유산을 활용하여 조성되었으며, 자연생태가 살아 숨 쉬는 보고(寶庫)이자, 시민에게 휴식을 제공하는 자연과 사람이 어우러진 친환경적 생태공원이다. 갯골 수로에는 서해안의 특성인 조수간만의 차가 크게 나타나고, 이곳에 형성된 갯골과 초지 군락지는 보기 드문 다양한 생물의 분포를 보이고 있으며, 옛 염전부지와 소금창고 등은 사라져 가는 해안문화의 자취를 지니고 있다. 이곳에서 칠면초, 나문재, 퉁퉁마디 등의 염생식물을 관찰할 수 있으며, 붉은 발 농게, 방게 등 다양한 생물도 관찰할 수 있다. 시흥갯골은 아름다운 경관과 생태적 우수성으로 시흥시의 생태환경 1등급 지역이며, 2012년 2월 국가 해양 습지보호지역으로 지정되었다.","<a href=""https://www.shsi.or.kr/PageLink.do?tempParam1=&link=forward:/PageContent.do&menuNo=030000&subMenuNo=020700&thirdMenuNo=020701"" target=""_blank"" title=""새창: 시흥 문화관광 홈페이지로 이동"">https://www.shsi.or.kr/</a>"
시흥 거북섬 썸머나잇 페스티벌,3351333,인문(문화/예술/역사),축제,일반축제,http://tong.visitkorea.or.kr/cms/resource/21/3351321_image2_1.jpg,경기도,126.6806993687,37.3241520972,"2024년 시흥 거북섬 썸머나잇 페스티벌에서는 코요태, 하이키, 버스터즈, 노매드, 나우어데이즈, 캔디샵 등이 출연하는 뮤직페스티벌이 펼쳐진다.
또 ‘AI 로봇과 인간의 만남’을 주제로 AI 로봇 타이탄의 'Link The Stage' 특별공연도 진행된다. DJ 909트릴리언과 스케줄1이 선사하는 EDM 파티는 행사의 마지막을 장식할 예정이다.
관객들은 시흥 거북섬의 아름다운 풍광과 라이브 콘서트, 시원한 국내외 맥주, 다양하고 맛있는 먹거리를 동시에 즐길 수 있다.
시흥 거북섬 썸머나잇 페스티벌은 시흥 거북섬을 문화관광 중심지로 만들기 위해 첫선을 보인 후 2023년 시흥 거북섬 밤 페스티벌에서 명칭을 바꾸고 올해 2회째를 맞고 있다.",
시흥 그린웨이,1060287,레포츠,육상 레포츠,자전거하이킹,,경기도,126.7812383963,37.3897740365,"시흥시를 흐르는 보통천과 장현천 제방위 농로를 이용하여 조성한 그린웨이는 전원적인 풍경을 간직한 자전거 길로서 코스 내 물왕호수, 연꽃테마파크, 관곡지, 갯골생태공원 등 볼거리와 자연을 체험할 수 있는 친환경적인 공간으로 지역주민과 자전거 동호회 등 많은 사람이 이용하고 있다.시흥 그린웨이는 이름대로 친환경적인 녹색 길로 시흥의 생태환경 명소를 두루 거친다.
경기도 유일의 내만갯벌과 옛 염전의 정취를 느낄 수 있으며 국가 해양 습지보호지역으로 지정된 시흥갯골생태공원, 수도권 최대 규모인 관곡지 내에 연꽃 군락지를 조성해 꾸며놓은 연꽃테마파크, 시흥시 최대 규모의 담수호인 물왕호수를 달려 조금 더 욕심을 낸다면 시흥갯골생태공원에서 월곶포구와 옥구공원을 거쳐 오이도까지 다녀올 수도 있다.
봄에는 벚꽃, 여름에는 연꽃, 가을에는 코스모스가 피어 아름다운 풍경을 감상할 수 있는 시흥 그린웨이는 4계절의 변화를 자연스럽게 느낄 수 있는 매력적인 길이다.","<a href=""https://www.siheung.go.kr/portal/contents.do?mId=0815011300"" target=""_blank"" title=""새창 : 시흥시 홈페이지로 이동"">https://www.siheung.go.kr</a>"
시흥 오이도마을,129328,인문(문화/예술/역사),체험관광지,농.산.어촌 체험,http://tong.visitkorea.or.kr/cms/resource/19/2481419_image2_1.jpg,경기도,126.6858122085,37.3452691817,"시흥 오이도는 대한민국 시흥시의 최서남단에 위치한 섬으로 삼면이 바다로 본래  섬이었지만, 일제강점기인 1922년에 염전을 만들기 위해 제방을 쌓아 육지와 연결되었다. 오이도마을은 넓은 갯벌과 싱싱한 수산물을 자랑하고 있다. 시화호의 회생으로 갯벌도 다시 살아나고 있으며, 2003년 오이도 종합어시장이 문을 열면서 수산물의 유통이 활발해졌다.  포구에는 횟집들이 많이 들어서 있어 싱싱한 자연산 활어회, 조개구이를 비롯한 다양한  해산물 먹거리를 즐길 수 있으며, 저녁이면 서해로 떨어지는 낙조가 장관이다. 갯벌을 이용한 갯벌체험, 바다낚시 체험, 어촌체험, 자전거도로를 이용한 하이킹 등 다양한 체험행사를 준비되어 있다. 지리적으로 오이도마을은 대도시와 가깝고 전철 4호선과 영동고속도로 월곶IC, 편도 4차선의 지방도 84호선이 당지역을 관통하고 있어 접근이 매우 용이하다. 또한 선사유적지인 오이도 패총이 알려지면서 관광객들의 발길도 끊이지 않고 있고 가족 단위로 즐겨 찾을 수 있는 환경 친화적 옥구도 도시자연공원, 오이도 어촌체험관광마을 및  패총 선사유적공원 조성을 통해 선사유적과 해양생태가 조화되는 테마파크로 조성되어 있다.","<a href=""http://www.xn--hq1b37iutl0mar0ceio83aduan74d.kr/""target=""_blank"" title=""새창: 오이도체험마을"">http://www.xn--hq1b37iutl0mar0ceio83aduan74d.kr/</a>"
시흥ABC행복학습타운,2751455,인문(문화/예술/역사),체험관광지,이색체험,http://tong.visitkorea.or.kr/cms/resource/36/2751536_image2_1.jpg,경기도,126.7848725351,37.4486644855,"시흥ABC행복학습타운은 전국 최초·최대 3세대가 소통하고, 학습하고, 공동체를 만들어 성장해가는 학습·문화·예술의 복합공간으로써 학습을 통한 배움과 성장의 공간, 문화 예술을 통한 소통과 공감의 공간, 3세대가 함께 어울리는 커뮤니티 공간이다. 도심에서 접근이 편리하고 소래산과 가까워 주변 환경이 쾌적하다. 문화시설, 체육시설, 산림욕장 등을 갖추고 다양한 학습 프로그램을 제공한다.","<a href=""https://www.siheung.go.kr/edu/contents.do?mId=0501010000"" target=""_blank"" title=""새창 : 시흥시평생교육원 홈페이지로 이동"">https://www.siheung.go.kr/edu/</a>"
시흥갯골축제,142197,인문(문화/예술/역사),축제,문화관광축제,http://tong.visitkorea.or.kr/cms/resource/20/3361920_image2_1.jpg,경기도,126.7812550601,37.3898240311,시흥갯골축제는 경기도 유일의 내만갯골에 위치한 시흥갯골생태공원에서 펼쳐지는 생태축제이다. 옛 염전 터와 습지가 어우러진 자연환경을 기반으로 자연에서 쉬고 배우며 즐기는 다양한 프로그램을 통해 자연과 동화되는 축제로 생태공원의 자연환경을 보호하기 위해 차 없는 축제로 진행하고 있다.,"<a href=""https://sgfestival.com/"" target=""_blank"" title=""새창:시흥 갯골축제 홈페이지로 이동"">https://sgfestival.com/</a>"
시흥문화원,130398,인문(문화/예술/역사),문화시설,문화원,http://tong.visitkorea.or.kr/cms/resource/50/1852750_image2_1.jpg,경기도,126.8046806885,37.3904188216,"시흥문화원은 시흥의 전통문화를 개발 및 연구, 조사하고, 문화 및 사회사업을 주관하는 곳으로 1996년에 설립되었다. 문화원 1층에는 2003년 5월에 개관한 시흥역사 자료전시관이 있는데 이곳에는 시흥의 역사와 문화를 보여주는 다양한 유물들이 전시되어 있다. 시흥문화원에서는 시흥문화유산연구회, 평생학습교육관, 시흥의 인물 선양사업 추진위원회, 축제추진위원회가 운영되고 있으며, 이와 함께 해마다 시민을 위한 문화 교실을 열고 정기간행물로 시흥문화를 발간하고 있다.

시흥문화원은 매년 시흥 관곡지 연꽃테마파크에서 연성문화제를 개최한다. 연꽃이 유명한 지역이라 관련 이색 체험도 많고, 다양한 공연과 전통 체험 프로그램이 준비되어 있어 볼거리와 즐길 거리가 많으며, 상반기와 하반기로 나누어 인문학 산책 강연도 열어 마음의 양식이 되는 여행, 미술, 음악을 주제로 문화를 향유하고 상식 수준을 높이는 데 도움을 주고 있다. 시흥문화원은 지역 전통문화의 보존과 전승, 지역 문화 예술의 개발과 진흥에 앞장서고 있는 시흥 지역에서 유일한 종합 문화 예술 기관으로서 의의가 있다.","<a href=""http://www.shcc.or.kr/"" target=""_blank"" title=""새창 : 홈페이지로 이동"">http://www.shcc.or.kr</a>"
시흥배곧한울공원,2723192,인문(문화/예술/역사),휴양관광지,공원,,경기도,126.7020465803,37.354704484,"경기도 시흥시에 위치한 한울공원은 많은 지역민과 관광객들이 찾는 휴식공간으로 각종 편의시설이 잘 구비되어 있다. 공원 앞으로 펼쳐진 바다와 이국적인 느낌이 물씬 풍기는 해수체험장은 도심속 휴식처로 많은 시민들에게 지친 일상의 피로를 풀게한다. 해수체험장은 지하 150m 암반해수 70%, 상수도 30% 비율로 운영하고 있으며, 매주 수질 관리를 위해 해수 교체 및 청소를 진행하고 있어 이용객들이 쾌적하고 안전한 해수체험을 할 수 있도록 노력하고 있다.<br>","시흥시 블로그 <a href=""https://blog.naver.com/siheungblog""target=""_blank"" title=""새창 : 시흥시 블로그"">https://blog.naver.com/siheungblog</a><br>시흥시 문화관광 <a href=""https://www.siheung.go.kr/portal/treasureMap/view.do?idx=28&mId=0814010700""target=""_blank"" title=""새창 : 시흥시 문화관광"">https://www.siheung.go.kr</a>"
시흥배곧한울공원 해수체험장,2633924,인문(문화/예술/역사),체험관광지,이색체험,,경기도,126.7020465803,37.354704484,"야자수와 그늘막이 이국적인 느낌을 물씬 풍기는 배곧한울공원 해수체험장은 한울공원 내에 인기 포토존으로 많은 사람이 찾는 지역 명소이다. 해수체험장 앞으로 펼쳐진 아름다운 바다 경치가 매우 아름다워 도심 속 휴식처로 많은 시민들에게 사랑받는 곳으로 매년 여름에만 운영된다. 성인풀도 수심이 0.7m라서 아이를 동반한 가족 단위의 방문객들이 많이 찾는 곳이다. 3,082㎡의 규모로 성인풀과 유아풀로 구성된 해수체험장은 지하 150m 암반해수 70%, 상수도 30% 비율로 운영하고 있으며, 매주 수질 관리를 위해 해수 교체 및 청소를 진행하고 있어 이용객들이 쾌적하고 안전한 해수 체험을 할 수 있다. 취사 및 텐트 설치는 금지이며 배달 음식을 수영장에서 즐길 수 있는 장점이 있는데, 정해진 배달존에서만 음식을 받을 수 있다. 시흥시민은 입장료에 30%를 할인받을 수 있다.","<a href=""https://www.siheung.go.kr/portal/treasureMap/view.do?idx=28&mId=0814010700""target=""_blank"" title=""새창: 시흥시 문화관광 홈페이지로 이동"">https://www.siheung.go.kr/</a>"
시흥승마클럽,3075831,레포츠,육상 레포츠,승마,,경기도,126.7624175018,37.4036665349,"시흥승마클럽은 시흥시의 명소인 월곶포구, 오이도포구, 시화방조제, 시흥갯골생태공원 등과 10분 정도의 거리에 있는 승마장으로, 승마를 통해 시흥 시민의 신체적 건강 및 정신적 건강의 향상과 삶의 질을 높이기 위해 1996년에 개장하였다.
시흥승마클럽은 가로 30m, 세로 50m의 대마장 1개소, 지름 13m의 원형 마장 2개소가 있다. 야외 마장으로 길이 700m의 원형 마장 1개소, 길이 700m의 타원형 갈대밭 코스, 갯골 가에 길이 1,000m 직선 해변 코스 등이 있다. 그 밖에 10만 평(33만 579㎡)의 초지 외승 코스 등이 마련되어 있어 초급자는 물론 중급자, 상급자의 수준에 맞는 마장 및 외승(야외승마)이 가능한 승마장이다. 또한 승마장 옆에는 120여 만 평(396만 6,942㎡)에 달하는 폐염전, 갈대밭 등 천혜의 자연환경이 있어 승마의 재미를 한층 높여주고 있다.
특히 독일 등지에서 승마 교육을 받은 자체 강사와 국가 대표를 여러 차례 지낸 외부 초빙 강사진도 확보하여 다양한 맞춤형 레슨 프로그램을 운영하고 있다.","<a href=""http://siheung.grandculture.net/siheung/toc/GC06902004"" target=""_blank"" title=""새창 : 홈페이지로 이동"">http://siheung.grandculture.net/siheung</a>"
시흥시청소년동아리축제,2833186,인문(문화/예술/역사),축제,일반축제,http://tong.visitkorea.or.kr/cms/resource/14/3337114_image2_1.jpg,경기도,126.8032866729,37.3795728335,"시흥시청소년동아리축제는 자기주도적인 청소년동아리 활동을 활성화하고 청소년동아리와 지역사회와의 소통, 교류를 위해 마련된 장이다. 또한, 시흥시 관내 사회참여, 봉사, 수학, 스포츠, 댄스, 밴드 등 다양한 분야의 532개의 동아리 약 7,500여명의 청소년이 만들어가는 전국 최대 규모의 청소년 축제이다.","<a href=""https://www.shyouth.or.kr/moim/main/view"" target=""_blank"" title=""새창 : 시흥시청소년동아리축제'적Show'"">www.shyouth.or.kr</a>"
시흥식당,2784791,음식,음식점,중식,http://tong.visitkorea.or.kr/cms/resource/15/2784315_image2_1.jpg,강원특별자치도,128.5596616902,37.6381197455,진부면에 위치한 시흥식당은 저렴한 가격에 푸짐한 양으로 현지인들도 추천하는 중식전문점이다.,
시흥에코센터초록배곧,2783374,인문(문화/예술/역사),문화시설,전시관,http://tong.visitkorea.or.kr/cms/resource/00/2793700_image2_1.jpg,경기도,126.7392992178,37.3376210128,"시흥 에코센터 초록배곧은 일상생활에서 자연을 지키는 다양한 방법을 체험할 수 있는 환경교육전시관이다. 상설전시관과 체험전시실, 기획전시실 등이 설치되어 있어 환경과 관련된 전시가 이루어지고, 야외에도 생태연못과 생태 텃밭 등 체험학습공간이 마련돼 맞춤형 환경교육이 가능하다. 에코센터 초록배곧은 매년 메인 주제가 바뀌는데, 2021년에는 자원 순환을 주제로 전시와 교육이 이뤄졌다. 아이들에게 쓰레기를 분리 배출하는 방법을 알기 쉽게 설명하는가 하면, 기획전시실에서는 종이 튜브를 통해 숲의 심장 소리를 들어보는 색다른 놀이 공간이 꾸려졌다. 또 입구에 사용하지 않는 아이스팩을 올바르게 자원 순환하여 재사용하는 아이스 백곰 캠페인도 이뤄져 기후 위기에 대한 고민을 상기시키기도 했다.","* <a href=""https://www.sh-ecocenter.or.kr/index.php"" target=""_blank"" title=""새창: 공식 홈페이지로 이동"">https://www.sh-ecocenter.or.kr</a><br>
* <a href=""https://edu.sh-ecocenter.or.kr/index.php"" target=""_blank"" title=""새창: 공식 홈페이지로 이동"">https://edu.sh-ecocenter.or.kr</a>"
시흥오이도박물관,2648242,인문(문화/예술/역사),문화시설,박물관,http://tong.visitkorea.or.kr/cms/resource/08/2947308_image2_1.jpg,경기도,126.6912675446,37.3352371089,"오이도는 서해안 최대 패총유적지이자 다양한 신석기시대 유물의 출토지로, 선사시대 해안생활문화유산으로서 보존가치를 인정받는 곳이다. 이러한 오이도 유적을 보호하고 활용하기 위해 2018년 오이도 선사유적공원이, 2019년 시흥오이도박물관이 조성되었다. 공원에서는 신석기인들의 생생한 삶의 모습을 만날 수 있고, 박물관에서는 보다 가깝게 시흥의 출토 유물들을 이해하고 선사시대 생활문화를 체험할 수 있는 기회를 제공한다.<br>","<a href=""https://oidomuseum.siheung.go.kr/"" target=""_blank"" title=""새창 : 오이도박물관 홈페이지로 이동"">https://oidomuseum.siheung.go.kr/</a>"
시흥웨이브파크,2678888,레포츠,복합 레포츠,복합 레포츠,,경기도,126.6806993687,37.3241520972,"경기도 시흥시 거북섬에 위치한 인공 서핑장 웨이브파크는 도심에서 데일리 스포츠를 즐길 수 있는 건강한 라이프 스타일의 해양관광레저 복합 시설이다. 이국적인 해변 콘셉트의 미오코스타존은 어린이 서핑 레슨과 수중 스쿠터를 체험할 수 있는 미오풀, 대형 튜브 놀이기구가 있는 키즈&터틀풀, 레펠 다이브 및 어린이 스쿠버 다이빙 체험이 가능한 레크리에이션풀, 아일랜드형 온수 스파 등이 마련돼 있어 전문 서퍼뿐 아니라 서핑을 하지 않는 사람도 물놀이를 즐길 수 있는 공간이다.","<a href=""https://www.wavepark.co.kr/main""target=""_blank"" title=""웨이크파크 홈페이지로 이동"">https://www.wavepark.co.kr/main</a>"
시흥정,3035798,레포츠,육상 레포츠,트래킹,http://tong.visitkorea.or.kr/cms/resource/65/3002565_image2_1.jpg,경기도,126.7113818646,37.3538825219,"시흥정은 2001년 한국수자원공사가 활터를 건립하여 시흥시에 기증한 전국 규모의 대회를 열 수 있는 활터이다. 1992년 시흥시 관무정 소속 20여 명의 궁사가 죽율동에 시화정이라는 활쏘기 모임을 만들었다. 모임에 참여한 궁사의 소유지에 활을 쏘는 자리인 사대를 만들고 과녁을 세워 활을 쏘면서 활동을 시작하였다. 이후 시화 신도시가 개발되면서 궁사들이 시흥시에 활터 건립을 요청해 한국수자원공사가 지금의 자리에 활터를 건립하여 시흥시에 기증하였다. 시흥정의 부지는 1만 1400㎡이고 경기장의 면적은 3,915㎡이다. 경기장 내 사정(활터)은 잘 갖추어져 있고 4개의 과녁이 있다. 시흥정은 전국 규모의 대회를 열 수 있는 활터이며, 24시간 회원들에게 개방되어 있고, 언제든지 친절한 무료 지도를 받을 수 있는 곳이다.","<a href=""https://cafe.daum.net/SH.J"" target=""_blank"" title=""새창 : 홈페이지로 이동"">https://cafe.daum.net/SH.J</a>"
식객,2901277,음식,음식점,한식,http://tong.visitkorea.or.kr/cms/resource/74/2901274_image2_1.jpg,인천광역시,126.6919807134,37.4590477456,"식객은 인천지하철 2호선 석바위시장역 1번 출구 부근에 있는 한우식당이다. 매장이 있는 상가건물에 자체 주차장이 있어 방문 시 자동차로 이용하기 편리하나, 주차장이 넓은 편이 아니기 때문에 대중교통을 이용하는 것을 추천한다. 매장 내부는 넓은 홀에 인원별 다양한 테이블 구성과 개별 룸까지 있어 단체 행사나 가족 모임에도 적당하다. 메인 메뉴로는 불고기정식 set, 떡갈비정식 set, 갈비탕, 꼬리곰탕, 궁중녹두삼계탕이 있다. 한옥 인테리어로 되어 있어 분위기, 음식 모두 고급스러운 편이며 상견례 장소로 유명하다. 점심 식사에는 왕갈비가 통째로 들어간 갈비탕이 인기다. 식당 부근에는 석바위시장, 석바위공원, 인천문화예술회관 등이 있어 연계 관광을 할 수 있다.",
식객교동점,2685623,음식,음식점,한식,http://tong.visitkorea.or.kr/cms/resource/77/2684877_image2_1.jpg,강원특별자치도,128.8808594038,37.7651862584,한국식 BBQ를 맛볼 수 있는 곳이다. 대표메뉴는 생오겹살이다. 강원도 강릉시에 있는 한식전문점이다.,
식구,2760784,음식,음식점,카페/전통찻집,http://tong.visitkorea.or.kr/cms/resource/22/2760922_image2_1.jpg,경기도,127.0961688208,37.3637660029,"식구는 분당에 있는 하우스 파티를 진행하는 브런치 카페이다. 돌파티, 생신 파티, 가족 모임, 회사 모임 등 다양한 소규모 하우스파티를 진행하고 있다. 10인 이상 진행 시 단 한 팀만을 위한 하우스 파티로 진행되며, 나라별 요리를 우리 정서에 맞게 요리하고 있다. 주택을 개조한 건물은 아늑하고 집에서 식사하는 느낌이며 룸도 있어 예약 사용이 가능하다.",
식당 마요네즈,2810906,음식,음식점,서양식,,제주특별자치도,126.4786745086,33.4889419444,식당 마요네즈는 노형동에 위치한 돈가스 맛집이다. 친절한 사장님과 종업원이 맞이해 준다. 오픈키친으로 신뢰감을 올려준다. 등심 돈가스는 고소하고 담백하다. 안심 또한 부들부들한 고기의 식감이 있다.,
식당153,2868257,음식,음식점,한식,http://tong.visitkorea.or.kr/cms/resource/56/2868256_image2_1.jpg,울산광역시,129.4302333899,35.4949278557,"울산 일산동에 있는 식당 153은 일산 해수욕장이 보이는 바다 전망 맛집이다. 바다를 보며 식사할 수 있는 창가 쪽 자리는 인기가 좋아 주말, 성수기에는 웨이팅이 필수이다. 꼬막무침과 밥도둑 전복장 두 가지를 모두 맛볼 수 있는 이판사판 스페셜은 추천 메뉴이자 대표 메뉴이다. 이 외에도 꼬막 숙회와 전복 숙회가 들어간 시원한 물회 국수, 꼬막 비빔밥, 꼬막무침소면 등 다양한 메뉴가 있다.",
식당더원,2901295,음식,음식점,한식,http://tong.visitkorea.or.kr/cms/resource/87/2901287_image2_1.jpeg,경상남도,128.6095143016,35.1561729138,"식당더원은 귀산 방파제 쪽인 귀산동에 있다. 식당 내부 공간도 넓고 정리가 잘 되어 있으며 테이블 간격도 넓어서 시원시원하다. 바다를 보며 식사를 할 수 있는데, 이왕이면 뷰가 좋은 바닷가 쪽 자리를 추천한다. 주문은 테이블에 비치된 태블릿 PC를 통해 할 수 있어 편리하다. 메뉴는 돼지갈비, LA 갈비, 점심특선 등이 있다. 식당더원의 가장 큰 특징은 구워져서 나오는 돼지갈비다. 통째로 구워져서 나오기 때문에 한입 크기로 자르기만 하면 바로 먹을 수 있어 어린이들도 좋아한다. 전용 주차장이 있어 편리한 이용이 가능하다.","<a href=""https://www.instagram.com/theone._.resto""target=""_blank"" title=""새창 : 식당더원 사이트로 이동"">https://www.instagram.com/theone._.resto</a>"
식당운학정,2901688,음식,음식점,한식,http://tong.visitkorea.or.kr/cms/resource/85/2901685_image2_1.jpg,경상남도,127.659369217,35.3913489321,"식당운학정은 건강하고 정성이 가득 담긴 정식 한상을 맛볼 수 있는 곳이다. 지리산 나물과 강화도 새우젓, 강원도 시래기, 집된장 등 국내산 재료를 사용하여 음식을 만든다. 대표메뉴는 조기와 김부각, 전, 10여 가지의 반찬이 나오는 산채정식이다. 빨간 김치와 무채 나물, 두부조림에 도라지나물, 별미인 아주 매운 고추(땡초)와 잔멸치를 볶은 것까지, 다채로운 메뉴로 시선을 사로잡는다. 단, 초등학생 이상부터 1인 1 메뉴 주문이 가능한 점, 주문과 동시에 조리가 들어가기 때문에 음식이 나오기까지 시간이 걸린다는 점을 참고해야 한다.",
식당진,2685649,음식,음식점,일식,http://tong.visitkorea.or.kr/cms/resource/58/2685158_image2_1.jpg,서울특별시,126.9865343431,37.5606939581,일본 가정식 요리전문점이다. 대표메뉴는 가츠동이다. 서울특별시 중구에 있는 일식전문점이다.,
식도락,2738672,음식,음식점,한식,http://tong.visitkorea.or.kr/cms/resource/38/2740638_image2_1.png,경기도,127.2589504802,37.0960637849,텃밭에서 직접 키운 채소로 정성껏 만든 반찬으로 1991년 개점한 한식당이다. 가벼운 식사로는 우거지국밥과 닭개장이 있다. 이 집의 주요리는 닭볶음탕이다. 닭에 상황버섯과 전복을 넣어 만든 상황전복삼계탕에 들어 있는 전복은 국물이 적당히 스며들어 입맛을 자극한다.  넓은 주차장이 있다. 안성파인크리크CC 맛집이다.  고삼호수가 인접해 있다.,
