title,contentid,cat1,cat2,cat3,firstimage,region,mapx,mapy,overview,homepage
큐브빌리지글램핑,2791874,레포츠,육상 레포츠,"야영장,오토캠핑장",http://tong.visitkorea.or.kr/cms/resource/03/2797603_image2_1.JPG,전라남도,126.8000247207,34.5351833872,"2020년 5월에 개장한 큐브 빌리지는 산 중턱에 자리 잡은 글램핑장이다. 객실 바로 앞에 주차를 할 수 있는 편리함이 장점인 큐브 빌리지는 총 9개의 글램핑 큐브 존과 텐트 형식의 5개 빌리지 존이 있고 수영장, 탁구장, 족구장, 공용화장실과 샤워실, 매점, 어린이 놀이방, 트램펄린 등이 있다. TV는 없지만 수건과 어메니티(치약, 칫솔, 폼클렌징, 바디 워시), 손소독제, 디퓨저, 모기약, 헤어드라이어, 냉장고, 전자레인지, 밥솥, 전기포트, 인덕션, 쓰레기봉투, 목장갑 등이 비치되어 있다. 바비큐는 사전에 얘기하면 시간 맞춰 불을 피워준다. 기본적으로 필요한 모든 것들이 준비되어 있어 급하게 떠나온 여행도 여유 있고 편하게 즐길 수 있다. 큐브 빌리지 안에서 물놀이도 하고 탁구도 치고 고기도 구워 먹을 수 있으니 자연 안에서 소중한 사람과 추억 만들기 좋다. 단 반려동물은 입장을 금지하고 있다.","<a href=""https://cubevillage.modoo.at/"" target=""_blank"" title=""큐브빌리지글램핑 사이트로 이동"">https://cubevillage.modoo.at/</a>"
큐브성형외과,2905435,쇼핑,쇼핑,사후면세점,http://tong.visitkorea.or.kr/cms/resource/80/2880180_image2_1.jpg,서울특별시,126.8884169673,37.5089148857,-,www.cubeclnic.co.kr
큐브아일랜드,2622872,숙박,숙박시설,펜션,,경상남도,128.6313810113,34.9796292041,"‘큐브 속에서 펼쳐지는 즐거운 여행’

큐브 아일랜드는 바다를 보며 비틀어 놓은 큐브를 닮은 공간 속에서 펼쳐지는 즐거운 여행을 표현하여 전달한다. ‘어릴 적 가지고 놀던 큐브의 상상력과 재미’ 떠올리며 여행을 떠나온 사람들이 머무는 곳에서 즐거움과 휴식이 공존하는 문화적 다양성을 큐브 속에 담고 싶은 소망이 담겼다.
건축가 펜션. SBS,MBC등 각종 잡지 장식했으며, 큐브 아일랜드의 브랜드와 새로운 잠자리 문화를 통해 큐브 속에 담긴 이야기를 전해 듣고 많은 사람과 그 이야기를 공유할 수 있기를 바란다.""","<a href=""http://cubeisland.co.kr/""target=""_blank"">http://cubeisland.co.kr/</a>"
큐브존캠핑장,2761762,레포츠,육상 레포츠,"야영장,오토캠핑장",http://tong.visitkorea.or.kr/cms/resource/98/2762198_image2_1.JPG,강원특별자치도,128.3477345997,37.2311904637,"강원도 한반도면에 위치한 큐브존은 펜션 겸 캠핑장이다. 독특한 컨테이너로 제작된 펜션 건물과 자연석의 일종인 카렌펠트로 이뤄진 조경이 아름다운 곳이다. 밤에 조명이 켜지면 이색적이고 감성적인 풍경을 자랑한다. 캠핑 사이트는 30여 개이고 바닥은 파쇄석에 사이트 사이에 나무들이 있다. 마트와 카페 등 편의시설이 잘 갖춰져 있고, 아이들을 위한 물놀이장, 트램펄린 등이 있다.","<a href=""http://www.cubezone.kr"" target=""_blank"" title=""새창 : 큐브존캠핑장 사이트로 이동"">http://www.cubezone.kr</a>"
큐빅광장,2507820,인문(문화/예술/역사),문화시설,공연장,http://tong.visitkorea.or.kr/cms/resource/15/3335215_image2_1.jpg,울산광역시,129.3181748052,35.5547606861,"큐빅광장은 2013년 대한민국 공간문화대상을 수상한 바가 있다. 울산 원도심의 재생을 위한 ‘문화’라는 주제와 전략을 장소에 담아 실천해 낸 첫 번째 프로젝트로 탄생하였다. 이곳은 1970년대 당시 울산을 찾는 유랑 극단이나 서커스단의 공연이 펼쳐졌던 곳으로, 과거의 기억을 현대적으로 재현하면서 그 의미가 부각되었다. 2012년 9월 준공 이후에는 청소년들과 젊은이들을 위한 다양한 공연과 전시, 체험행사 등이 항상 열려 청소년들의 잠재성과 커뮤니티 활성화에 도움을 주고 있다. 이렇듯 큐빅광장이 다채로운 장소로 거듭나면서 도심기능과 상권회복의 기폭제 역할을 함과 동시에 원도심의 독특하고 이색적인 복합 문화공간으로 자리매김하였다.","<a href=""https://www.junggu.ulsan.kr/board/view.ulsan?boardId=ATTRACTION&menuCd=DOM_000000104004000000&startPage=1&categoryCode1=C004&dataSid=54"" target=""_blank"" title=""새창 : 울산 중구 문화관광으로 이동"">https://www.junggu.ulsan.kr/</a>"
크라운 하버 호텔 부산,3044634,숙박,숙박시설,관광호텔,http://tong.visitkorea.or.kr/cms/resource/30/3054130_image2_1.jpg,부산광역시,129.0368450457,35.1076056112,"부산 중구 중앙동에 위치한 크라운하버 호텔 부산은 비즈니스 편의는 물론 특색있는 원도심 관광까지 즐길 수 있는 최적의 호텔이다. 8가지 타입의 다양한 객실로 구성되어 다양한 니즈에 맞춰 이용할 수 있고, 합리적인 가격으로 세심하고 온기있는 서비스를 제공해 가성비가 좋다. 부산여객선터미널, 부산역, 부산타워, 국제시장, 남포동, BIFF 광장을 도보로 이용할 수 있어 편리하게 여행할 수 있다.",https://www.crownharborhotel.com/
크라운관광호텔,143043,숙박,숙박시설,관광호텔,http://tong.visitkorea.or.kr/cms/resource/06/2807206_image2_1.jpg,경상남도,128.6400510996,35.2378504117,"CROWN HOTEL은 CR(CENTER)과 OWN(자신의, 소유하다)의 합성어로 자신이 중심이 되는 자기만의 공간을 가지다라는 의미를 지니고 있다. 평범하지만 특별한, 고객의 감성을 풍요롭게 하는 소신이 담겨있는 WELL 비즈니스 호텔이다.<br>차로 약 5분 거리에 근린공원인 창원시어린이교통공원과 삼동공원이 있어 쾌적한 주변 환경을 자랑하고 무빙보트를 즐길 수 있는 용지호수공원까지는 차로 약 10분거리에 상상길까지는 차로 약 19분거리에 있다.<br>(정보제공자: 창원시청)","<a href=""http://www.crownhotel.kr/"" target=""_blank"" title=""새창 : 크라운호텔 홈페이지로 이동"">http://www.crownhotel.kr</a>"
크라운돼지,2861349,음식,음식점,한식,http://tong.visitkorea.or.kr/cms/resource/53/2861353_image2_1.jpg,제주특별자치도,126.3834849354,33.3934398929,"크라운돼지는 제주 중산간 상가리 송훈파크 안에 있다. 송훈 셰프가 운영하는 서울의 크라운돼지 제주점으로 ‘난축맛돈’ 판매 전문점이다. ‘난축맛돈’은 멸종된 예전 제주 똥돼지 유전자를 10년간 복원사업을 거쳐 재탄생시킨 토종돼지로 현재 약 2,500마리가 국내에 있다. 그 때문에 한정 수량만 도축하는 고급 고기이다. 항정살과 부챗살이 랜덤하게 커팅된 앞다리, 어깨살인 쫄데기살 같은 특수부위도 판매한다. 주변 여행지로 상가리야자숲, 녹고메오름, 새별오름 등이 있다.",
크라운수상레저,3018558,레포츠,레포츠소개,수상레포츠,http://tong.visitkorea.or.kr/cms/resource/91/3018491_image2_1.JPG,경기도,127.4578815799,37.7099851675,"서울에서 1시간 거리에 있는 크라운수상레저는 넓고 알찬 워터파크와 대형 슬라이드, 제트보트를 즐기고 수상 스키, 웨이크 보드 강습을 받을 수 있다.입장료는 물론 테이블, 수건, 구명조끼, 반바지 등을 무료로 대여해 주고 놀이 기구를 패키지 금액 외에 추가요금이 없어서 이용할 수 있으며 외부 음식도 반입할 수 있어 아이들의 간식이나 식사도 부담 없다.
9가지의 물놀이 기구를 무제한으로 탈 수 있는 가격이 55,000원이고, 초보 강습과 물놀이 기구 패키지는 예약 시 45,000원이라 저렴한 가격으로 맘껏 빠지를 즐길 수 있다. 아쿠아 삭스는 필수가 아니라지만 바닥이 뜨거워 신어야 한다.대중교통을 이용해 청평역에서 내릴 경우 근처에서 픽업해 주며 숙박 예약도 받고 있다.","<a href=""https://3crown.modoo.at/?link=890ubtge"" target=""_blank"" title=""새창 : 홈페이지로 이동"">https://3crown.modoo.at</a>"
크라운컨트리클럽,131649,레포츠,육상 레포츠,골프,,제주특별자치도,126.6952159042,33.5284188131,"제주도의 이국적인 분위기를 즐길 수 있는 곳. 크라운컨트리클럽은 제주 골프장 중에서 해발이 가장 낮은 곳에 위치하여 지리적 입지조건은 최상이기 때문에 연중무휴 라운딩이 가능하다. 최근 이용객의 보다 쾌적한 골프 환경을 제공하기 위하여 과감한 투자를 시행, 31실 규모의 골프빌리지를 완공하였고 클럽하우스 및 코스는 리노베이션 공사를 통하여 새 단장하였다. 

(출처 : 크라운컨트리클럽)","<a href=""http://www.jejucrowncc.co.kr"" target=""_blank"" title=""새창 : 크라운컨트리클럽 홈페이지로 이동"">www.jejucrowncc.co.kr</a>"
크라운해태 키즈뮤지엄,2451912,인문(문화/예술/역사),산업관광지,식음료,http://tong.visitkorea.or.kr/cms/resource/30/3399730_image2_1.JPG,서울특별시,126.973627752,37.5406904959,"크라운해태키즈뮤지엄은 제과 전문그룹 크라운 해태가 운영하는 어린이 체험 공간으로 부모와 함께 다양한 놀이를 통해 창의력과 사고력을 배우고 협력과 소통의 능력을 성장시키는 곳이다. 주로 4~8세 어린이들의 실내 놀이터로 여러 테마의 놀이시설이 있다. 커다란 블록놀이, 암벽등반, 벽면에 낙서하기 등을 하며 마음껏 놀 수 있다. 창작체험 교실에서는 과자를 이용한 다양한 체험과 과자집 만들기 체험을 한다. 창작체험 교실은 부모가 1명은 동반하여야 하므로 예약할 때 대인권을 포함해서 결재해야 하며 온라인으로만 예약이 가능하다. 기본 이용 시간은 2시간으로 2시간이 초과하면 추가 요금이 발생한다. 서울역 인근 남영동 크라운제과 본사 건물 지하 1층에 있다.","<a href=""https://www.instagram.com/chkidsmuseum/"" target=""_blank"" title=""새창 : 홈페이지로 이동"">https://www.instagram.com/chkidsmuseum/</a>"
크라운호텔,3075690,숙박,숙박시설,관광호텔,,경상남도,128.5914555851,35.4339885829,"국내 최고의 수질을 자랑하는 부곡온천 인근에 있으며 온천수로 채운 인피니티 풀로 유명한 호텔이다. 550m 지하에서 올라오는 온천수를 이용해 사계절 따뜻하게 수영을 즐길 수 있다. 전 객실에 천연 온천수를 공급하며, 최고급 침구를 구비하고 있어 편안하고 안락한 숙소를 제공한다. 카페, 편의점, 미팅룸, 키즈카페, 노천탕/미니 수영장 등의 부대시설이 있다.
부곡온천은 국내 최고 수온 78도를 자랑하는 온천으로 각종 피부질환에 효과가 있으며, 생태관광지 우포늪이 가까워 관광하기 좋은 곳으로 온천지구 내에는 부곡온천 분수공원, 노천 족욕탕, 부곡온천 한울공원 등이 있어 호텔을 이용하면서 주변 관광도 겸할 수 있다.","<a href=""http://www.crown-hotel.co.kr/"" target=""_blank"" title=""새창 : 홈페이지로 이동"">http://www.crown-hotel.co.kr</a>"
크래버대게나라 잠실점,2685280,음식,음식점,한식,http://tong.visitkorea.or.kr/cms/resource/56/2684556_image2_1.jpg,서울특별시,127.1222566516,37.5137240777,직접 산지에서 선별한 대게요리 전문점이다. 대표메뉴는 대게다. 서울특별시 송파구에 있는 한식전문점이다.,
크래커스 대정점,2783393,음식,음식점,카페/전통찻집,http://tong.visitkorea.or.kr/cms/resource/05/2784605_image2_1.jpg,제주특별자치도,126.2797051883,33.2633054229,"크래커스는 원두를 직접 로스팅하는 곳으로 유명한 커피 맛집이다. 한경점, 대정점 두 곳이 있다. 크래커스 대정점은 현무암으로 지어진 오래된 귤 창고를 개조하여 만든 창고형 카페로 내부는 세련되고 감각적인 인테리어로 깔끔하다. 특히 빛을 최소화하여 음료와 공간에 집중할 수 있게 어두운 느낌을 주었다. 매장에서 이곳에서 직접 로스팅한 원두와 굿즈도 판매 중이다. 커피 주문 시 취향에 맞게 원두를 선택할 수 있으며 커피와 함께 즐길 수 있는 베이커리와 디저트도 있다. 커피 외에도 디카페인커피, 차, 레몬에이드, 핫초코, 베이비치노, 아이스크림이 있어 커피를 즐기지 않는 사람이 방문하여도 메뉴 선택의 폭이 넓다.","<a href=""http://crackerscoffee.com/"" target=""_blank"" title=""새창 : 크래커스 대정점 사이트로 이동"">http://crackerscoffee.com/</a>"
크래프트루트,2710907,음식,음식점,이색음식점,http://tong.visitkorea.or.kr/cms/resource/23/2732823_image2_1.jpg,강원특별자치도,128.5377159268,38.1972849934,"크래프트 루트는 2017년 설립된 속초 최초의 브루 펍(Brew Pub)이다. 수제 맥주를 제조하는 양조장과 펍이 한 공간에 있으며 유리벽 너머로 양조장 내부가 훤히 들여다보인다. 크래프트 루트는 향을 내기 위한 인공재료를 일체 배제하며 맥주의 핵심 재료인 홉을 자체 생산한다. 이곳에서 맛볼 수 있는 맥주는 총 8가지. IPA, 페일에일, 스타우트, 필스너, 바이젠 등 다양한 종류를 생산하며 독특하게도 동명항, 대포항, 갯배, 아바이 등 속초의 명소들을 이름에 붙였다. 맥주 캔에 명소마다 다른 풍경들을 그려넣어 마시는 재미를 더했다. 무엇보다 크래프트 루트는 수준 높은 맛과 품질로 이름이 높다. 국내외 수많은 맥주 대회 출전과 다수의 수상 경력이 이를 대변한다. 2019년 맥주의 본고장인 유럽에서 열린 대회에서 동명항 페일에일이 은상을 수상했으며, 2020년 국내에서 열린 코리안 인터내셔널 비어 어워드에서는 출전 품목 최다 수상이라는 기록을 세웠다. 맥주와 곁들여지는 음식들도 대부분 로컬 푸드를 사용하며 싱싱한 해산물 요리가 많다. 울산바위와 대청봉이 바라보이는 파노라마 전망은 누구에게나 주어지는 덤이다.<br><br>[주요시설&부대시설]<br>양조장<br>","<a href=""https://craftroot.co.kr/""title=""새창: 크래프트루트로 이동 ""target=""_blank"">craftroot.co.kr/</a>"
크래프트유니온협동조합(몽트비어),2710905,음식,음식점,이색음식점,http://tong.visitkorea.or.kr/cms/resource/13/2732813_image2_1.jpg,강원특별자치도,128.5281193548,38.2044117557,"속초 몽트비어는 지역을 대표하는 수제맥주 브랜드이다. 속초 IC 입구에 신선한 맥주를 생산하는 수제맥주공장과 레스토랑이 위치해 있다. 몽트비어는 맥주 만들기 동호회 회원들이 모여 만든 독특한 이력을 갖고 있다. 홈브루잉을 통해 축적한 오랜 노하우를 바탕으로 지금의 몽트비어를 만들어냈다. 몽트비어는 효모가 살아 있는 신선한 맥주를 지향하는데 직접 재배한 국내산 홉을 이용한 페일에일과 IPA가 인기다. 이 밖에 딸기와 복숭아, 샤인머스캣 등 지역 농가들과 협업해 과일과 맥주를 콜라보레이션한 제품도 호응이 높다. 완벽한 양조 설비를 갖춘 맥주공장 2층은 울산바위가 보이는 전망 좋은 레스토랑이다. 날씨가 좋은 날엔 3층 루프탑을 이용하면 더욱 운치 있다. 몽트(MONT)는 프랑스어로 ‘산’을 뜻한다. 몽트비어를 처음 방문하다면 먼저 샘플러를 주문해 자신에게 맞는 맥주를 찾아보자. 맥주효모로 발효시킨 피자와 수제맥주로 숙성시킨 부드러운 육질의 통수제육포, 몰트와 효모를 넣어 만든 쫄깃하고 쌉쌀한 맥주 효모빵 등 다양한 메뉴들이 더욱 입맛을 돋운다.<br><br>[주요시설&부대시설]<br>양조장<br>","<a href=""http://blog.naver.com/montbeer""title=""새창: 크래프트유니온협동조합(몽트비어)으로 이동""target=""_blank "">http://blog.naver.com/montbeer</a>"
크랙킨,2892200,음식,음식점,서양식,http://tong.visitkorea.or.kr/cms/resource/89/2892189_image2_1.jpg,경기도,126.7773558998,37.6699330651,"크랙킨은 일산의 핫플레이스 밤리단길에 있는 양식 전문점이다. 이 집은 주인이 직접 캘리포니아에서 요리하면서 배워온 음식들을 한국적인 입맛에 맞게 개발한 음식들을 판매한다. 아치형 입구를 통과하여 내부로 들어서면 아기자기한 소품들이 장식되어 있다. 이 집의 인기 메뉴는 파스타와 포케인데 연어 포케에는 기본 토핑으로 현미밥, 샐러드믹스, 절인 양파, 구운 아몬드, 옥수수, 날치알, 갈릭 플레이크, 병아리콩, 나초가 들어간다. 밥양은 적게 또는 없이도 주문할 수 있다. 친구들과 밤리단길 산책 후에 건강한 한 끼를 위해 방문하면 좋다. 주차 공간은 5대 정도로 협소한 편이다.","<a href=""https://www.instagram.com/crackin_ilsan/""target=""_blank"" title=""새창 : 크랙킨 사이트로 이동"">https://www.instagram.com/crackin_ilsan/</a>"
크랩회피쉬 장충동,2653610,음식,음식점,한식,http://tong.visitkorea.or.kr/cms/resource/67/2655067_image2_1.jpg,서울특별시,127.0051909754,37.5607359553,서울특별시 동대입구역 부근에 있는 한식당이다. 살아있는 해산물을 즉석에서 요리하는 매장이다. 대표메뉴는 생선회이다.,
크럼앤크러스트,2904797,음식,음식점,카페/전통찻집,http://tong.visitkorea.or.kr/cms/resource/89/2904789_image2_1.jpg,경기도,127.1899515253,37.5749265276,"﻿크럼앤크러스트는 하남시 망월동에 있는 베이커리 카페이다. 주차는 카페 앞에 몇 자리가 있다. 이 근처 가게들이 거의 1층은 테라스가 있다. 크지 않지만 아기자기한 정원이 있어 날씨 좋은 날은 밖에서 빵과 차를 즐길 수 있다. 실내는 층고가 높은 편안한 분위기이다. 이 카페는 빵이 맛있는 집이라 빵의 종류가 다양하다. 바게트와 크루아상 등 프렌치 스타일의 빵이 많지만 다른 종류의 빵도 다양하다. 스톤슈가 특히 유명한데 바삭한 슈 껍질 속에 크림이 부드럽고 맛있다. 빵도 맛있지만, 커피도 맛이 수준급이다. 카페 앞에 주차공간이 있다. 미사한강공원이 가까이에 있다.",
크레도1330펜션,3044635,숙박,숙박시설,펜션,,강원특별자치도,129.0674864233,37.6061777183,"강원도 강릉 옥계면에 위치한 크레도1330펜션은 오션뷰와 산뷰, 별뷰가 환상적인 유럽풍 펜션이다. 전 객실에 테라스가 있어 바다의 시원함을 한눈에 가득 담을 수 있다. 야외에는 수영장이 있는데, 특히 한겨울에도 온수풀을 운영하여 물놀이를 즐길 수 있다. 유료 노래방과 게임기가 구비된 플레이존, 미니 포켓볼, 배드민턴, 방방, 해먹 등을 구비해놓아 가족, 연인, 동료들과 즐거운 추억을 만들 수 있다. 5분 거리에 망상해수욕장이 있다.",http://credo1330.com/
크레미엘,2866395,음식,음식점,카페/전통찻집,,서울특별시,127.039165284,37.475857534,크레미엘은 프랑스 셰프가 건강한 재료로 만든 베이커리이다. 파티시에 부부가 운영하고 있고 서울에서 파리의 맛을 느낄 수 있는 곳이다. 크레미엘은 베이커리와 키친툴을 판매하고 있다. 한쪽에는 파리 감성이 가득한 베이커리가 있고 다른 한쪽에는 키친툴 편집샵인 사브르 오프라인 매장이 있다. 예쁘고 컬러풀한 디자인의 키친툴이 아기자기하게 놓여져 있어 베이커리를 주문하고 잠시 구경해도 좋다.,"<a href=""https://www.instagram.com/patisserie_cremiel/""target=""_blank"" title=""새창 : 업체인스타그램 이동"">https://www.instagram.com/patisserie_cremiel/</a>"
크레송,3307654,쇼핑,쇼핑,사후면세점,http://tong.visitkorea.or.kr/cms/resource/68/3314668_image2_1.jpeg,서울특별시,126.9249974851,37.4905482278,-,
크레송 현대가산,2906523,쇼핑,쇼핑,사후면세점,http://tong.visitkorea.or.kr/cms/resource/61/2880361_image2_1.jpg,서울특별시,126.8890705637,37.4776713039,-,
크레이지카츠,2853824,음식,음식점,일식,http://tong.visitkorea.or.kr/cms/resource/15/2853815_image2_1.jpg,서울특별시,126.9097249652,37.5505048774,"크레이지카츠는 바삭함과 육즙이 흘러넘치는 합정역 인근 돈카츠 맛집이다. 이곳의 대표메뉴는 프리미엄 등심 부위 돈카츠로 당일 한정수량 판매하는 특로스카츠정식이다. 국내산 돈육 정통 일식 등심 로스카츠정식, 부드러운 안심의 히레카츠정식 등도 있다. 또 다양하게 맛보고 싶다면 특로스카츠, 로스카츠, 히레카츠, 감자고로케, 새우튀김을 한 번에 즐길 수 있는 크레이지세트도 준비되어 있다.","<a href=""https://www.instagram.com/crazyforkatsu/"" target=""_blank"" title=""새창 : 크레이지카츠 인스타그램으로 이동"">https://www.instagram.com/crazyforkatsu/</a>"
크레이지팡팡,2994353,레포츠,복합 레포츠,복합 레포츠,,대구광역시,128.5930545836,35.868856182,"대구 동성로에 새롭게 선보이는 크레이지팡팡은 일반 키즈카페나 실내 테마파크가 아닌 국내 유일 실내 복합 익스트림파크이다. 각 층은 다양한 테마로 구성되어 있으며, 이용 시간 동안 모든 층을 자유롭게 이용할 수 있다. 넓고 쾌적한 공간에서 XR 게임과 MR 카트, 에어범퍼카 등을 즐길 수 있고, 기존에 경험할 수 없었던 스카이윙과 크레이지점프 등 단순한 놀이 기구 체험의 범주를 넘어선 새로운 액티비티도 체험할 수 있다. 또한, 놀다가 허기지면 든든하게 배를 채울 수 있는 푸드코트와 깔끔하고 분위기 있는 파티룸도 운영하고 있다.","<a href=""https://www.instagram.com/crazypangpang"" target=""_blank"" title=""새창 : 크레이지팡팡 인스타그램으로 이동"">https://www.instagram.com/crazypangpang</a>"
크레이트커피,2860077,음식,음식점,카페/전통찻집,http://tong.visitkorea.or.kr/cms/resource/59/2860059_image2_1.jpg,서울특별시,127.0108078492,37.5353695584,"크레이트 커피는 서울시 용산구 한남동에 있는 카페이다. 경의중앙선 한남역 1번 출구 인근에 있다. 주차장이 건물 뒤쪽으로 있지만 발레주차도 가능하다. 건물 외부는 모던하고 깔끔하며 내부는 식물과 블랙 및 시멘트의 인테리어가 조화를 이루고 있다. 층고가 높아 이층으로 구분이 되어 넓고 테이블 석도 많다. 한쪽은 통창으로 바깥 풍경을 볼 수 있다. 야외공간도 있는데 이 공간은 반려동물 입장도 가능하다. 크레이트는 다양한 커피, 음료, 차 등이 준비돼 있고 보다 좋은 커피를 제공하기 위해 직접 로스팅도 하고 핸드드립 원두에 대해 자세히 설명도 해준다. 디저트는 휘낭시부터 퀀아망, 다양한 종류의 케이크와 타르트가 진열되어 있다. 인근에 용산공예관, 삼성미술관, 달맞이공원이 있어 연계 관광을 할 수 있다.
※반려동물 동반 야외공간 가능","<a href=""http://www.instagram.com/crate_coffee""target=""_blank"" title=""새창 : 크레이트커피 사이트로 이동"">http://www.instagram.com/crate_coffee</a>"
크레타,2848051,음식,음식점,서양식,http://tong.visitkorea.or.kr/cms/resource/42/2848042_image2_1.jpg,경기도,126.7041203489,37.7889401137,"크레타는 경기도 파주시 헤이리 마을에서 조각가 김기호씨가 운영하는 경양식 돈까스 전문점이다. 화이트톤으로 모던한 느낌의 인테리어로, 깔끔하고 쾌적한 분위기에서 식사할 수 있다. 양송이스프, 샐러드, 모닝빵, 그리고 양파가 들어간 달콤한 소스의 돈까스 정식이 대표 메뉴다. 어린이를 위한 메뉴가 별도로 준비되어 있어 가족 단위의 손님이 많이 찾는다.",
크렘파이샵,2778411,음식,음식점,카페/전통찻집,http://tong.visitkorea.or.kr/cms/resource/17/2797017_image2_1.jpg,전라남도,126.9846667028,35.3232949614,"담양의 국수 거리 아래쪽으로 100m 직진 후 왼쪽에 있는 소규모 카페이다. 댓잎크림라떼, 홍콩와플, 썸머라떼가 대표 메뉴다. 홍콩와플은 함께 나오는 아이스크림을 딸기, 바닐라, 초콜릿 중에서 선택할 수 있는데 주문 후 만드는데 15분 정도 소요되며, 포장이 가능하다. 가을 단풍 명소로 유명한 관방 제림과 담양 지구 공원, 담양 국수 거리가 있어서 식사 후 들러 산책하며 즐기기에 좋다.",
