title,contentid,cat1,cat2,cat3,firstimage,region,mapx,mapy,overview,homepage
선납숲공원,2743349,자연,자연관광지,자연생태관광지,http://tong.visitkorea.or.kr/cms/resource/95/2750395_image2_1.jpg,경기도,127.1040418101,37.2120670435,"동탄 선납 숲 공원은 저수지였던 선납지를 호수 공원으로 조성한 곳이다. 우암 송시열 선생을 기리는 우암정이 있고 호수를 따라 이어진 산책로와 산에 오를 수 있는 등산로가 있어 호수와 산을 함께 즐길 수 있다. 유아숲 체험원엔 원색의 아기자기한 놀이시설과 함께 친환경으로 꾸며진 곤충 관찰터, 자연 놀이터, 모험 놀이터, 숲속 평상원등 4가지 체험 코스를 만날 수 있다. 온 가족이 함께 듣고, 보고, 만지며 걸을 수 있는 나들이 공간이다.",
선녀를 찾아 십이선녀탕을 가볼까?,1855123,추천코스,나홀로코스,나홀로코스,http://tong.visitkorea.or.kr/cms/resource/08/1583408_image2_1.jpg,Unknown,128.3413167667,38.1187070138,"강원도의 동해바다로 가기 위해서는 진부령, 미시령, 대관령 등 백두대간의 험준한 고개를 넘어야 한다. 인제와 양양을 잇는 한계령은 예로부터 소동라령, 오색령으로 불렸다. 굽이진 길을 따라 설악산국립공원의 수려한 풍경이 함께한다. 한계령 자락에 숨어있듯 남아 있는 한계사지를 따라 십이선녀탕까지 이어지는 길은 설악산의 비경과 함께 수려한 계곡까지 만나는 시원한 여정이다.",
선녀바위,129605,자연,관광자원,기암괴석,http://tong.visitkorea.or.kr/cms/resource/25/3044425_image2_1.jpg,인천광역시,126.3789681524,37.4396528391,"을왕리 해수욕장으로 가는 길목에는 갖가지 기암괴석들이 많다. 그중에서도 바다 위로 빼곡하게 솟아오른 곳에 선녀가 무지개를 타고 내려와 놀았다고 해서 이름 붙여진 선녀바위가 있다. 뾰족한 바위가 바다의 풍광과 잘 어우러지고 바위로 잔잔하게 부서지는 파도가 일품이다. 선녀바위에는 전설이 하나 있다. 영종진의 수군들을 통솔하던 호군에게 첩실이 있었는데 둘의 사랑이 깨지자, 첩실은 영종진의 태평암이라는 바위 위에서 바다로 몸을 던진다. 이 여인의 시신을 수습해 주는 사람이 없어 용유도 포구에 표류하게 되고, 호군은 뒤늦게 후회하며 여인의 시신을 묻어주었다고 한다. 그 후 여인이 몸을 던졌던 태평암을 선녀바위라 불렀고, 밤하늘이 맑은 날에 선녀들이 무지개를 타고 내려와 노는 장소가 되었다고 한다. 바위의 형상이 기도하는 여인과 비슷하여 바위 앞에서 소원을 빌면 이루어진다는 이야기도 전해지고 있다.","<a href=""https://www.icjg.go.kr/tour/cttu0107a03#section2"" target=""_blank"" title=""새창: 인천 중구 홈페이지로 이동"">https://www.icjg.go.kr/tour</a>"
선녀바위해수욕장,129255,자연,자연관광지,해수욕장,,인천광역시,126.3786292754,37.440336087,"선녀바위해수욕장은 해변에서 보이는 선녀바위와 기암들이 매력적인 곳이다. 바다가 탁 트이고 다른 해수욕장보다 상대적으로 조용하고 차분한 분위기이다. 인근의 유명한 을왕리 해수욕장, 왕산 해수욕장과 연계해서 둘러보기에도 좋다. 용유 3경 선녀바위를 보고, 일몰 시각을 맞추어 아름다운 낙조도 함께 감상하기에 좋은 해수욕장이다. 을왕리 해수욕장이나 왕산 해수욕장에 비해 한적해서 해수욕과 캠핑을 즐기기에 좋다. 선녀바위 위쪽으로 난 골목을 따라 언덕 위로 올라가면 언덕 끝에 예쁜 카페가 있어, 조용히 차를 마시며 카페 창가에 앉거나 야외테라스에서 바라보는 바다의 절경이 일품이다.","<a href=""https://www.icjg.go.kr/tour/cttu0107a03"" target=""_blank"" title=""새창 : 홈페이지로 이동"">https://www.icjg.go.kr/</a>"
선녀와 나무꾼,2801108,숙박,숙박시설,펜션,http://tong.visitkorea.or.kr/cms/resource/73/2801073_image2_1.jpg,강원특별자치도,128.3889801047,37.5378141945,펜션 앞에 펼처진 멋진 산세와 그 아래 깨끗하고 맑은 금당계곡이 있다.,
선녀와나무꾼,2738791,레포츠,육상 레포츠,"야영장,오토캠핑장",http://tong.visitkorea.or.kr/cms/resource/10/2739310_image2_1.jpg,경상북도,129.4040614408,35.6638916974,"경주 선녀와 나무꾼은 경북 경주시 양남면에 자리 잡고 있다. 경주시청을 기점으로 35㎞가량 떨어졌다. 자동차에 몸을 싣고 산업로, 매곡로, 신대로를 차례로 달리면 닿는다. 도착까지 소요되는 시간은 1시간 안팎이다. 이곳은 피톤치드 가득한 숲속에 둥지를 트고 있다. 이 덕분에 자연친화적인 캠핑을 즐길 수 있다. 게다가 멀지 않은 거리에 해변이 있어 해수욕을 만끽하기에도 좋다. 밤이면 캠핑장 이곳저곳에 설치한 형형색색의 조명이 불을 밝혀 낭만적인 분위기를 연출한다. 캠핑장에는 글램핑 38개 동을 마련했다. 객실 내부에는 침대, 테이블, 의자, 냉장고, TV, 개수대, 에어컨 등을 비치했다. 외부 전용 공간에는 바비큐 시설을 설치했다. 글램핑장은 사계절 내내 운영하며, 예약은 온라인 실시간으로 받는다.
캠핑장 인근에 관성솔밭해변, 문무대왕를, 토함산 자연휴양림 등 관광자원이 풍부하다. 인근에 여러 음식점이 있어 식도락의 즐거움도 만끽할 수 있다.","<a href=""http://0547434005.tshome.co.kr/"" target=""_blank"" title=""새창 : 선녀와 나무꾼 사이트로 이동"">http://0547434005.tshome.co.kr/</a>"
선녀와나무꾼,2744556,레포츠,육상 레포츠,"야영장,오토캠핑장",http://tong.visitkorea.or.kr/cms/resource/21/2739321_image2_1.jpg,경기도,127.0466434825,37.8268723981,"경기도 양주시에 위치한 캠핑장이다. 카라반과 글램핑 시설을 이용할 수 있다. 
공용 수영장과 넓은 잔디밭이 있어 아이들이 놀기에도 좋다. 
인근에 장흥자생수목원이 있어 관광하기에도 좋다. 반려동물 동반은 불가능하다.","<a href=""http://yjcamp.eduvill.kr"" target=""_blank"" title=""새창 : 선녀와나무꾼 사이트로 이동"">http://yjcamp.eduvill.kr</a>"
선녀와나무꾼 테마공원,598187,인문(문화/예술/역사),휴양관광지,테마공원,http://tong.visitkorea.or.kr/cms/resource/94/3077594_image2_1.jpg,제주특별자치도,126.7020747488,33.4800659394,"제주 조천읍 선흘리에 위치한 선녀와 나무꾼은 옛 추억을 회상할 수 있는 실내 테마 공원이다. 옛 서울역의 모습을 재현한 건물로 들어서면 다양한 테마의 건물 모형과 옛날 물건들이 전시되어 있다. 옛 장터의 모습을 재현한 거리와 고고장, 다방, 만화방 등 옛 도심, 달동네 등의 풍경을 보며 그 시절을 살아온 세대는 추억에 잠기고, 그 시절을 경험하지 못한 세대는 부모님이 살아온 삶의 모습을 짐작할 수 있다. 1950~80년대 전후 극장의 모습을 재현한 추억의 영화 마을에서는 옛 영화를 하루 종일 상영하고 있어 이를 무료로 관람할 수 있다. 옛 학교를 재현한 공간에서는 옛 교복을 입고 기념사진을 남기는 특별한 경험을 할 수 있어 남녀노소 모두에게 반응이 좋다. 그밖에 닥종이 인형이 테마별로 전시된 공간과 농기구 등 민속용품이 전시된 농업박물관 등 볼거리가 끝이 없다. 굴렁쇠, 팽이, 고무줄놀이 등 추억의 놀이를 체험할 수 있는 체험관도 있고, 꿩, 토끼 닭 등을 볼 수 있는 작은 공간과 도깨비가 있는 공포의 집에서도 특별한 추억을 만들 수 있다. 실내에 조성되어 있어 날씨와 관계없이 즐길 수 있는 테마공원인 이곳은 옛 추억을 떠올리고 싶은 사람들과 새로운 추억을 쌓고 싶은 사람 모두 즐거운 시간을 보낼 수 있는 여행지이다.","<a href=""http://www.namuggun.com/"" target=""_blank"" title=""선녀와나무꾼 테마공원 사이트로 이동"">http://www.namuggun.com</a>"
선녀와나무꾼캠핑장,2728200,레포츠,육상 레포츠,"야영장,오토캠핑장",http://tong.visitkorea.or.kr/cms/resource/59/2728359_image2_1.jpg,충청북도,128.1512449517,37.0050017037,"선녀와 나무꾼 캠핑장은 충북 제천시 청풍면에 자리 잡고 있다. 제천 시청을 기점으로 24㎞가량 떨어졌으며, 자동차로 내토로, 청풍호로, 배시론로를 번갈아 달리면 닿는다. 도착까지 걸리는 시간은 40분 안팎이다. 도로에 인접한 덕택에 접근이 용이한 이곳은 청량감 가득한 숲속에 위치했다. 이 때문에 자연친화적인 캠핑을 만끽할 수 있다. 캠핑장에는 파쇄석으로 이뤄진 오토캠핑장 22면을 마련했다. 사이트 크기가 7가지로 나뉘므로 선택의 폭이 넓다. 각 사이트에서 개별 화로대를 사용할 수 있다. 개인 트레일러와 카라반 입장과 반려동물 출입이 불가능하다. 캠핑장과 가까운 거리에 청풍문화재 단지, 청풍랜드, 비봉산 등 제천의 내로라하는 관광지가 수두룩하다. 주변에 여러 음식점이 성업 중이라 원하는 요리도 맛볼 수 있다.","<a href=""https://cafe.naver.com/namuggun77/"" target=""_blank"" title=""새창 : 선녀와나무꾼캠핑장 사이트로 이동"">https://cafe.naver.com/namuggun77/</a>"
선녀풍본점,2769488,음식,음식점,일식,,인천광역시,126.3787291539,37.4444411671,"VJ특공대와 생방송투데이 등 TV 프로그램 맛집 코너에 여러 차례 소개된 적 있는 해물, 생선요리 전문점이다. 이 집의 대표 메뉴는 물회이며 기본물회인 선녀 물회와 여러 해물이 추가된 황제물회가 있다. 회 범벅이라 할 정도로 각종 횟감과 전복, 멍게, 해삼, 낙지가 푸짐하게 들어 있는 데다 소면을 섞어 먹는 맛이 일품인 집이다. 물회뿐만 아니라 전복죽과 해물전도 인기 메뉴이다.",
선달산,127583,자연,자연관광지,산,http://tong.visitkorea.or.kr/cms/resource/01/3342201_image2_1.jpg,강원특별자치도,128.6704203224,37.111577005,"강원도 영월군과 경상북도 봉화군, 영주시에 걸쳐 있는 해발 1,236m 백두대간의 한 봉우리이다. 선달산은 소백산맥에 속하며, 주변에 매봉산, 어래산, 봉황산 등이 있어 산세가 우아하고 풍경이 아름답다. 신선이 놀던 곳이라는 뜻을 가지고 있으며, 신선골, 칠룡골, 용아골 등의 이름을 가진 계곡들이 산을 둘러싸고 있다. 남서쪽에는 소백산국립공원이 자리 잡고 있으며, 동남쪽 기슭에는 오전약수가 있다. 비탈면을 흐르는 수계는 옥동천으로 흘러들고, 남서쪽 비탈면에서 발원하는 수계는 내성천으로 흘러든다. 
선달산은 계절마다 다양한 모습을 볼 수 있다. 봄에는 산수국, 참나리, 원추리 등의 꽃들이 피어나고, 여름에는 시원한 계곡물과 우거진 수풀이 청량함을 주고, 가을에는 단풍과 은행나무의 화려한 색이 산을 온통 물들인다. 겨울에는 설경과 얼음폭포가 비경을 보여준다.
선달산을 등산하기 위한  다양한 코스가 있는데 가장 인기 있는 코스는 내리계곡을 따라 선달산 정상까지 오르고, 어래산과 시루봉을 거쳐 내리는 종주 코스이다. 이 코스는 약 17km 7시간의 시간이 소요되며, 중간에 단종의 유배지인 칠용동골과 단종비를 볼 수 있다. 선달산 정상에서는 백두대간의 마루금과 주변의 산들을 탁 트인 공간에서 한눈에 조망할 수 있다. 다른 코스로는 회암령에서 선달산 정상까지 오르고 내리는 왕복 코스가 있다. 이 코스는 약 10km 4시간이 소요되며, 회암령에서부터 선달산으로 가는 등산로를 따라가면 된다.","<a href=""http://www.grandculture.net/yeongwol/toc/GC08300136"" target=""_blank"" title=""새창 : 홈페이지로 이동"">http://www.grandculture.net</a>"
선달산(경북),127584,자연,자연관광지,산,,경상북도,128.7402613622,37.0159087635,"선달산(1,236m)은 강원도 영월군 김삿갓면과 경상북도 봉화군 물야면 및 영주시 부석면에 걸쳐 있는 산으로 백두대간 소백산과 태백산의 사이에 솟아있다. 남으로 봉황산, 서로 회암산 형제봉과 소백산, 동쪽에 옥석산, 북쪽에 매봉산, 서쪽에 어래산, 형제봉이 있다. 
선달산은 신선이 놀다가 먼저 올라야 한다는 뜻으로, 자연경관이 뛰어나며 북쪽과 동쪽은 산세가 험한 편이나 서쪽과 남쪽은 산세가 험하지 않고 골짜기가 넓어 촌락이 발달했다. 북쪽으로 흐르는 물줄기는 외용리의 기전마을에서 옥동천으로 흘러들고, 남서쪽 기슭에서 발원한 물줄기는 남대천을 이루면서 북쪽으로 흘러 골 어귀의 마을에서 옥동천으로 흘러든다. 남쪽 사면으로 흐르는 물줄기는 남쪽으로 흘러 낙동강의 지류인 내성천으로 흘러든다.
선달산 추천 등산코스는 [백두대간 31구간]으로 오전리~늦은목이재~선달산~박달령~옥석산(옥돌봉)~도래기재로 이어지는 총 16.9km의 산행길이고 약 6시간 30분 소요된다.","<a href=""https://www.bonghwa.go.kr/open.content/tour/main.tour/mountain/?id=171&hash=37.35682531901688,127.24525342335413,13"" target=""_blank"" title=""새창 : 홈페이지로 이동"">https://www.bonghwa.go.kr</a>"
선달산계곡캠핑장,2750811,레포츠,육상 레포츠,"야영장,오토캠핑장",http://tong.visitkorea.or.kr/cms/resource/55/2750855_image2_1.jpg,경상북도,128.6752997941,37.0397103513,"선달산계곡캠핑장은 경북 영주시 부석면에 자리 잡고 있다. 영주 시청을 기점으로 32㎞가량 떨어졌다. 자동차를 타고 서원로, 의상로, 영부로를 이어달려 소요 시간은 50분 안팎이다. 이곳은 계곡 옆에 터를 잡고 있어서 여름철 피서지로도 인기가 있다. 야영장에서  걸어서 몇 발자국만 가면 눈앞에 계곡이 펼쳐진다. 캠핑장에는 일반 야영장 15면을 마련했다. 널찍하지만 사이트 수가 적어 여유로운 캠핑을 즐길 수 있다. 바닥은 파쇄석 12면, 데크 3면으로 이뤄졌다. 개인 트레일러뿐만 아니라 개인 카라반 동반 입장이 가능하다. 예약은 전화로만 가능하다. 캠핑장 인근에 부석사, 김삿갓 계곡 공원 등 여행지가 즐비해 연계관광이 순조롭다. 계곡 주변에 성업 중인 음식점도 많다.","<a href=""https://sundalsan.modoo.at/"" target=""_blank"" title=""새창 : 선달산계곡캠핑장 사이트로 이동"">https://sundalsan.modoo.at/</a>"
선덕여왕공원,2732162,인문(문화/예술/역사),휴양관광지,공원,,경상북도,129.2704038669,35.8525290155,"관광역사공원은 보문호와 맞닿아 있다. 이 덕분에 공원 산책로를 따라 걸으며 보문호의 풍경을 감상할 수 있다. 관광역사공원의 봄은 만개한 벚꽃으로 장관을 이룬다. 또한 가을에도 아름다운 풍경을 볼 수 있어 가을에 많은 관광객이 찾고 있다. 공원 안에는 보문호를 배경으로 펼쳐진 포토존, 각양각색의 조형물, 나무 그늘 벤치 등이 있다. 공원으로부터 약 2㎞ 거리에 경주 보문관광단지, 6㎞가량 떨어진 곳에 첨성대, 경주역사유적지 등이 있어 연계 관광이 가능하다.","<a href=""https://www.gyeongju.go.kr/tour/index.do"" target=""_blank"" title=""새창 :경주관광 홈페이지로 이동"">https://www.gyeongju.go.kr/tour/index.do</a>"
선도,2713525,자연,자연관광지,섬,,전라남도,126.2674025823,34.9816466069,"전라남도 신안군 지도읍에 딸린 선도(蟬島)는 섬의 생김새가 매미 같이 생겼다 하여 맵재, 선치도, 선도라 불렸다고 전해 오고 있다. 해안은 사질해안이 많으며, 섬 주위에는 간석지가 넓게 발달되어 있어 만입부를 방조제로 막아 농경지와 염전으로 사용하고 있다. 남쪽의 일정도와 청도도 방조제로 연결되어 선도와 합쳐져 있다. 퍼플섬과 같이 섬내 모든 건물 지붕이 노란색이다. 마을 곳곳 마다 아름다운 노란 수선화 벽화가 그러져 있고 바람에 흩날리는 수선화 향이 가득한 곳이다. 선도가 '수선화의 섬' 이 된 것은 서울생활을 접고 남편의 고향인 선도로 귀촌하신 '현복순' 할머니가 자신의 집 마당과 주위에 애지중지 키운 수선화 덕분이다. 수선화는 어느새 꽃동산으로 변모했고, 주민들이 이를 따라 하나 둘씩 심기 시작했다. 신안군에서는 집집마다 수선화가 피어 있는 모습에서 착안해 작은 섬 선도를 수선화의 섬으로 변모시켰다. 그로 인해 2019년부터 매년 4월 초 10일간 수선화 축제가 개최되고 있다. 수선화 카페 주변으로는 트릭아트 포토존도 있으며 선도 전지역은 드론 촬영 가능 구역으로 사진촬영 장소로도 유명하다.","<a href=""
http://tour.shinan.go.kr/""target=""_blank"" title=""신안군 문화관광"">http://tour.shinan.go.kr/</a>"
선도리갯벌체험마을,129462,인문(문화/예술/역사),체험관광지,농.산.어촌 체험,http://tong.visitkorea.or.kr/cms/resource/56/2020756_image2_1.jpg,충청남도,126.5909644476,36.1296492838,"금강하굿둑 바다 쪽으로 둑 주변부터 부사방조제까지 72.5km에 이르는 서천의 해안선은 해송림과 어우러진 갯벌과 모래사장 곶 등이 발달한 리아스식 해안으로 춘장대 해수욕장, 홍원항, 마량리 동백 숲, 마량포구, 도둔리 김 양식장, 월하성 갯벌, 선도리 갯벌, 비인 해수욕장, 마을을 중심으로 한쪽은 백사장이 한쪽은 갯벌이 형성된 특이한 갈목 마을, 모래사장이 유명한 장항송림 자연휴양림, 장항항 등 관광명소와 서천해양수산물의 생산지가 집중되어 있는 천혜의 보고이기도 하다. 서천 해안의 특징은 조수간만의 차가 크고 물이 빠지면 약 2km 이상 펼쳐지는 완만한 백사장과 갯벌이 있어 물이 깊지 않아 가족휴양지로는 최적의 자연환경을 자랑하고 있다. 서천의 해안 가운데 특히 월하성과 선도리, 장포리는 갯벌이 잘 발달되어 있는 곳이다.

이곳에 가면 물이 빠지면서 서서히 드러나는 갯벌의 콩알만 한 게들이 수를 셀 수 없을 만큼 갯벌을 덮고 있다. 자세히 들여다보면 조그만 게들이 드넓은 갯벌을 분주히 오가며 영양을 섭취하는가 하면 집을 짓고 있는 모습을 볼 수 있다. 이 게들의 수만큼 됨직한 작은 구멍 주위의 게들이 파낸 작은 알갱이는 다름 아닌 게 흙으로 “갯벌이 자연의 신장으로서 정화 기능을 하며 살아 숨 쉰다""라는 환경생태학적인 단면을 자연스레 경험하게 된다. 살아 숨 쉬는 서천의 갯벌은 어린이들에게는 생태체험 학습장으로 어른들에게는 조개잡이의 즐거움과 넉넉한 자연을 테마로 한 관광의 즐거움을 만끽하게 한다. 서천의 갯벌에는 특히 맛조개가 많다. 굳이 조개잡이 준비를 해오지 않더라도 갯벌 인근 마을의 가게에서 호미를 구입하여 갯벌 체험을 할 수 있다. 한참 동안 체험을 하고 나면 재미에 푹 빠져 물이 들어오는 것을 모를 정도이다. 그 외 국물이 시원한 바지락, 구우면 더욱 맛있는 모시조개, 뽀얀 속살이 쫄깃한 돌조개 등 각양각색의 조개를 직접 잡아볼 수 있는 살아있는 갯벌이 서천에 있다.","<a href=""https://seondori.com/"" target=""_blank"" title=""새창: 선도리갯벌체험마을 홈페이지로 이동"">https://seondori.com/</a>"
선돌 (강원고생대 국가지질공원),126887,자연,관광자원,기암괴석,,강원특별자치도,128.4347997364,37.2064060724,선돌에 가면 거대한 기암괴석이 ‘ㄱ’자로 굽은 강줄기와 함께 나타난다. 선돌은 일명 신선암이라고도 하는데 선돌은 푸른 강과 층암절벽이 어우러져 마치 한폭의 그림을 보는 듯한 느낌을 준다. 선돌은 영월읍 방절리 서강 안에 절벽을 이룬 곳에 위치해있는데 마치 큰 칼로 절벽을 쪼개 내리다 그친 듯한 형상을 이룬 입석을 말한다. 선돌은 기반암인 석회암이 물에 의한 용식작용으로 절리틈이 녹아서 형성된 지형으로 추측되고 있다.<br /><br /><출처 : 강원고생대 국가지질공원><br>,"강원고생대국가지질공원 <a href=""http://www.paleozoicgp.com/""target=""_blank"" title=""새창: 강원고생대국가지질공원 "">http://www.paleozoicgp.com/</a><br/>
영월관광 <a href=""https://www.yw.go.kr/tour/index.do"" target=""_blank"" title=""새창 : 영월관광 홈페이지로 이동"">https://www.yw.go.kr/tour/index.do</a>"
선돌근린공원,2751283,인문(문화/예술/역사),휴양관광지,공원,http://tong.visitkorea.or.kr/cms/resource/21/2751421_image2_1.jpg,경기도,127.0811627046,37.8214847624,"옥정신도시를 조성하면서 마을의 경계를 나타내거나 농사의 풍요를 기원하는 대상으로 쓰였던 선돌(문화재로 지정)이 이곳으로 옮겨지며 선돌공원이라 이름 지어졌다. 공원에서는 양주의 캐릭터인 ‘감동이’를 만날 수 있으며, 독바위가 보이는 주변의 넓은 공간이 갑갑한 마음을 확 트이게 한다. 자연 소재로 동물 모양을 한 토피어리 정원이 있고 넓은 잔디밭이 조성돼 있어, 가족과 함께 산책을 즐기기에 좋은 공원이다.",
선두5리어시장,2758177,쇼핑,쇼핑,상설시장,,인천광역시,126.4956336799,37.5977614819,"선두5리 어시장은 인천 강화도에 있는 수산물 직판 음식점으로, 선주들이 직접 운영하는 식당들이 모여 있는 곳이다. 신선한 해산물을 즐길 수 있어 주말엔 항상 붐빈다. 바닷가에 위치해 있어 일몰과 함께 숭어, 우럭, 광어, 농어, 도미 등의 신선한 회, 매운탕, 조개찜 등을 즐길 수 있으며 포장도 가능하다. 계절 메뉴의 경우 해산물 수급 사정에 따라 가격이나 주문이 변동될 수 있다. 어시장 주변으로 텐트나 화로, 테이블 설치 없이 조용하고 깨끗하게 즐기는 스텔스 차박이 가능하다.",
선두바다낚시터,2768057,레포츠,수상 레포츠,바다낚시,,인천광역시,126.4921061611,37.6000472647,"강화도 섬 둘레로 여러 선착장이 있어 주변에 낚시터도 여럿 조성되어 있다.
선두 바다 낚시터는 선두리 선착장 인근 바다 낚시터로 이곳은 펜션 형태의 방갈로 시설이 잘 되어 있어서 가족단위 여행객들에게 인기다.<br>강화도의 나지막한 산과 마을 풍경이 바다 낚시터와 어우러져 자연 풍광을 즐기며 낚시하기에 좋은 장소이다.","<a href=""https://m.cafe.naver.com/ca-fe/ganghwa939.cafe/"" target=""_blank"" title=""새창 : 선두바다낚시터 사이트로 이동"">https://m.cafe.naver.com/ca-fe/ganghwa939.cafe/</a>"
선두포저수지,2013518,레포츠,수상 레포츠,민물낚시,http://tong.visitkorea.or.kr/cms/resource/92/1577292_image2_1.jpg,인천광역시,126.4639578039,37.6336484113,"사기리에 위치하며 농수로를 수문으로 수량을 유지하여 만들어진 저수지이다. 수려한 자연경관과 풍부한 어족 자원, 맑고 깨끗한 수질을 갖고 있고 수로 양옆으로 차량이 쉽게 진입할 수 있어 접근이 용이하다. 인근에 선두포낚시터가 있어 탁 트인 경관과 함께 낚시가 가능하며 낚시터에서 3호 매점과 5호 매점 두 군데를 운영하여 커피, 어묵 등 간단한 간식을 즐길 수 있다.",
선릉매운트럭떡볶이,2772171,음식,음식점,한식,http://tong.visitkorea.or.kr/cms/resource/01/2772401_image2_1.JPG,경기도,126.8509936073,37.4730128332,"경기도 광명시 광명동에 위치한 선릉 매운 트럭 떡볶이는 1994년 선릉역 1번 출구 앞 노점상 트럭에서 시작되었다. 이름을 줄여서 선매 떡볶이라고도 불린다. 저렴한 가격에 떡볶이와 순대, 튀김, 꼬마김밥, 어묵을 판매하며 특히 떡볶이가 맛있기로 유명하다. 또한 치즈, 계란, 당면과 같은 토핑을 떡볶이에 추가할 수 있다. TV 방송 <생활의 달인>에 두 번이나 소개되었다. 근처에 광명새마을시장이 있다.",
