title,contentid,cat1,cat2,cat3,firstimage,region,mapx,mapy,overview,homepage
리프온리프,2738040,음식,음식점,카페/전통찻집,http://tong.visitkorea.or.kr/cms/resource/45/2738545_image2_1.jpg,경상북도,129.3922976175,36.0842523685,"리츠온리프는 감성적인 인테리어가 눈에 띄는 카페다. 여러 가지 음료를 맛볼 수 있는데, 사람들이 가장 많이 찾는 메뉴는 스토리베리 파르페다. 이 밖에 몽블랑 파르페, 김치도리아, 카페도리아 등도 맛볼 수 있다. 인근에 영일대해수욕장, 죽도시장 등 포항을 대표하는 관광지가 많다.",
리프플레이스,2833826,인문(문화/예술/역사),체험관광지,이색체험,http://tong.visitkorea.or.kr/cms/resource/11/2833811_image2_1.jpg,경기도,127.302719172,37.1797743468,"용인 리프플레이스는 어린이와 함께 가서 즐기기 좋은 카페이다. 동물 먹이 주기 체험, 파충류 체험, 잉어 먹이 주기 체험, 곤충과 교감하기 체험 등 다양한 체험 프로그램을 즐길 수 있어 가족 단위 방문객이나 자녀를 동반하는 엄마들 모임에 적합한 카페이다. 음료 가격에 입장료가 포함되어 있어 입장권을 구입하면 음료를 제공한다. 동식물, 곤충들이 많아 모든 음료는 캔으로 제작해서 제공한다. 덕분에 편하게 음료를 들고 체험장을 다니며 즐길 수 있다. 		
※ 반려동물 동반 불가","<a href=""https://leaf-place.com/"" target=""_blank"" title=""새창 : 리프플레이스 홈페이지로 이동"">https://leaf-place.com/</a>"
리홀뮤직갤러리,3027054,인문(문화/예술/역사),체험관광지,이색체험,,서울특별시,126.990480244,37.5946345287,"리홀뮤직갤러리에 대중교통을 이용하여 방문한다면, 4호선 한성대입구역 6번 출구로 나와 초록버스 1111, 2112번을 타고 종점 [서울다원학교]에서 하차 후 성북동 누룽지백숙건물 3층으로 올라오면 된다. 이곳은 12만여 장의 레코드판과 진공관시스템 그리고 1930년도에 제작된 빈티지스피커를 통해 다양한 장르의 음악을 즐길 수 있는 음악감상 전용공간이다.  리홀뮤직갤러리에서 다루는 장르는, 클래식, 팝 그리고 재즈이다.
원하는 음악을 신청곡 종이에 적어 DJ에게 전달하면 장르에 따라 스피커를 바꿔가며 음악을 맞춤 제공해 준다. 양쪽의 벽면을 가득 채운 음반들이 주는 향수와 최초의 진공관 사운드가 주는 편안함 속에서 일상의 부산스러움을 잊고 오롯이 음악을 감상할 수 있는 공간이다.
비정기적으로 음악회나 인문학 강연도 진행하니 전화 문의 혹은 인스타그램을 참고해 방문하는 것도 감성을 채우는 또하나의 즐거움이다.","<a href=""https://www.instagram.com/rheehallmusicgallery/"" target=""_blank"" title=""새창 : 인스타그램으로 이동"">https://www.instagram.com/rheehallmusicgallery/</a>"
리후캠핑식당,2832136,음식,음식점,한식,http://tong.visitkorea.or.kr/cms/resource/21/2832121_image2_1.jpg,경기도,127.0422744068,37.827941639,"경기도 양주시 덕계동에 위치한 캠핑 감성 음식점이다. 리후는 한자 좋을 리, 후덕할 후의 합성어로 좋은 일과 후덕한 마음을 전하기 위해 만든 이름이다. 실내 좌석과 야외 좌석이 고루 마련되어 있다. 야외 좌석은 노천과 지붕 있는 곳으로 나뉘며, 지붕 있는 곳에선 캠핑 분위기를 내며 바비큐를 구워 먹는다. 한 여름이 되면 노천좌석에 풀장을 설치해 아이들이 물놀이를 할 수 있다. 이용시간은 4시간 제한이 있다. 메뉴는 바비큐세트, 조개구이, 해신탕 등이 있다. 건물 앞에 주차장이 있으며, 덕계역에서 차로 약 7분 거리에 있다. 가까이에 덕계저수지, 선녀와 나무꾼 캠핑장이 있다.",
린,2930015,쇼핑,쇼핑,사후면세점,http://tong.visitkorea.or.kr/cms/resource/42/2891242_image2_1.jpg,경기도,126.950436882,37.3900381258,-,
린,3306283,쇼핑,쇼핑,사후면세점,http://tong.visitkorea.or.kr/cms/resource/70/3314170_image2_1.jpg,서울특별시,126.8846459143,37.4795432303,-,
