title,contentid,cat1,cat2,cat3,firstimage,region,mapx,mapy,overview,homepage
동절사,1956327,인문(문화/예술/역사),역사관광지,유적지/사적지,http://tong.visitkorea.or.kr/cms/resource/56/3356256_image2_1.jpg,충청남도,126.7976024283,36.1995531631,"남면 동절사는 1962년에 충청남도 부여군 남면 내곡리에 있는 사우로 임진왜란 때 수원성에서 왜병과 싸우다 순절하여 병조판서에 증직된 이지시, 이지례 형제의 위패를 봉안하고 있다. 사당은 야산 중턱에 북쪽을 향하여 지어졌다. 입구는 사괴석(벽이나 돌담을 쌓는 데 쓰는 육면체의 돌) 담장으로 둘러 있고 덤벙주춧돌 (둥글넓적한 자연석을 다듬지 않고 그대로 놓은 주춧돌) 위에 네모기둥을 세워 만든 솟을삼문형의 외삼문이 있다. 외삼문으로 들어서면 정면 2칸, 측면 2칸으로 된 사우가 나타나는데, 측면 2칸 중 전면 1칸에는 툇마루를, 후면 1칸에는 우물마루를 깔고 2인의 위패를 안치하고 있다. 지붕은 겹처마 팔작지붕을 이루고 있으나 현재 매우 심하게 변형되었다. 주변 관광 명소는 세양사, 홍산객사, 아홉 살이 관광, 보부상, 홍산동헌이 있다.","<a href=""https://www.buyeo.go.kr/_prog/culture/index.php?mode=V&mng_no=298&site_dvs_cd=tour&menu_dvs_cd=030114"" target=""_blank"" title=""새창 : 홈페이지로 이동"">https://www.buyeo.go.kr</a>"
동정호,2746554,자연,자연관광지,호수,,경상남도,127.6868342901,35.1461798361,"동정호는 오랜 세월 강물이 드나들며 생긴 자연 습지로, 청둥오리, 붕어 등 야생조수, 물고기, 식물이 공존하는 자연생태계상 보존가치가 있는 호수이다. 호숫가에는 약 1㎞ 길이의 호수 둘레를 따라 설렁설렁 걷기 좋은 산책로가 조성되어 있다. 호수 사방으로 지리산 남부 능선과 광양 백운산 자락이 감싸고 있어 풍경을 즐기며 하염없이 걷기 좋고, 호숫가 곳곳에는 동정호의 마스코트인 하트 모양 출렁다리, 천국의 계단, 나룻배 등의 포토존이 있어 출사 여행을 즐기기도 괜찮다. 초가을이면 나무수국과 핑크 뮬리가 어우러져 더욱 화려한 풍경을 뽐낸다.","<a href=""https://www.hadong.go.kr/02639/02647/02718.web?amode=view&idx=1323"" target=""_blank"" title=""새창 : 하군동 문화관광 홈페이지로이동"">https://www.hadong.go.kr/tour.web</a>"
동제미술관(동제미술전시관),2760793,인문(문화/예술/역사),문화시설,전시관,,대구광역시,128.5934345322,35.7895012789,"동제미술관은 대구 달성군 가창면에 자리 잡고 있다. 2002년 개관한 대구 사설 미술관으로 상시 전시를 하고 전시 작품은 가격 협의를 통해 소장 가능히다. 미술관에는 널찍한 잔디 광장, 화가의 작업 공간, 카페, 아트숍, 전시 공간 등이 갖춰져 있다. 입장료를 내면 카페에서 파는 모든 음료 중 하나를 선택해 맛볼 수 있다. 미술관은 파동IC와 가깝고, 주변에는 화원자연휴양림이 위치해 있다.","<a href=""https://blog.naver.com/dongje_artmuseum"" target=""_blank"" title=""새창 : 동제미술관(동제미술전시관) 사이트로 이동"">https://blog.naver.com/dongje_artmuseum</a>"
동주산성,2686662,음식,음식점,한식,,강원특별자치도,127.2973812415,38.1268003108,"동주산성은 강원도 철원군 호국로에 있는 숯불갈비 전문 한식당이다. 주차시설과 놀이시설이 잘 갖추어져 있어 가족들이 찾기에 좋은 곳이다. 상차림 비용이 별도로 추가되며 추천 메뉴로는 등심, 특수부위, 갈비, 한우 불고기가 있다. 가게 정기 휴무일은 없으며 부근에 고석정과 삼부연 폭포가 있어 식사 전후로 주변 관광지를 다녀오는 것도 좋다. (출처 : 강원도청)",
동주염전,619709,자연,자연관광지,강,http://tong.visitkorea.or.kr/cms/resource/19/3342719_image2_1.jpg,경기도,126.6007674667,37.2336028607,"동주염전은 사방이 바다와 산으로 둘러싸인 대부동동 4리에 위치해 있다. 대부도 동주염전은 오래전부터 천일염 생산지로 명성이 대단했으며, 증발지에서 농축된 해수를 옹기판 염전으로 옮겨 바람과 태양열에 의해 결정체로 만든다. 바닷물에 태양의 열과 바람의 기운을 모아 만들어져 상품성 또한 뛰어나다. 1953년에 시작해 지금까지 재래방식을 고집하며 소금을 채취해 청와대에도 납품하기도 했다. 염전체험장에서는 천일염을 직접 만드는 방법을 소개하고 체험할 수 있다.","<a href=""https://dongjusalt.modoo.at/"" target=""_blank"" title=""새창: 동주염전 홈페이지로 이동"">https://dongjusalt.modoo.at/</a>"
동죽서원,1956972,인문(문화/예술/역사),역사관광지,유적지/사적지,http://tong.visitkorea.or.kr/cms/resource/65/3365765_image2_1.JPG,전북특별자치도,126.8183851923,35.6134120183,정암 조광조를 중심으로 덕촌 최희정을 기리고 있는 서원으로 1960년 지방 유림이 지었다. 조광조(1482∼1519)는 조선 전기의 문신이며 성리학자이다. 김종직의 학통을 이어 사림파의 중심이 되었으며 급진적인 개혁을 실행하였다. 이를 반대하는 훈구세력의 모함으로 유배되어 기묘사화(1519) 때 희생되었다. 최희정은 조광조의 가르침을 받았고 조선 중종 11년(1516) 무과에 급제하였다. 이때 함경도에 여진족이 침입하자 조광조가 추천하여 적을 크게 물리쳤다. 중종은 그 공로로 현재 서원이 있는 땅을 하사하였다고 한다.,"<a href=""https://www.jeongeup.go.kr/culture/board/view.jeongeup?boardId=BBS_0000004&menuCd=DOM_000000601004002000&orderBy=TMP_FIELD2%20DESC,DATA_TITLE%20ASC&paging=ok&startPage=1&categoryCode1=AB01&categoryCode2=BB07&dataSid=183"" target=""_blank"" title=""새창 : 홈페이지로 이동"">https://www.jeongeup.go.kr/culture/index.jeongeup</a>"
동죽이네,2913734,음식,음식점,한식,http://tong.visitkorea.or.kr/cms/resource/24/2913724_image2_1.jpg,대전광역시,127.292340286,36.3475282041,"동죽이네는 대전광역시 유성구 덕명동에 있는 칼국수 만두 보쌈 전문요릿집이다. 깔끔한 느낌의 외관과 차분한 분위기를 연출하는 인테리어로 이루어졌다. 내부에는 단체석이 마련되어 있어 각종 모임을 하기 좋다. 대표 메뉴는 보쌈, 파전, 녹두전, 칼국수, 생두부 또는 찐만두가 상에 오르는 동죽 A 세트다. 보쌈, 파전, 녹두전, 생두부, 만두전골이나 칼만두국을 맛볼 수 있는 동죽 B 세트도 많은 사람이 찾는다. 유성IC에서 가깝고, 주변에 국립대전숲체원과 계룡산국립공원이 있다.",
동진시장,2034110,쇼핑,쇼핑,상설시장,,서울특별시,126.9266064251,37.5623454701,"서울 마포구 연남동에 위치한 동진시장은 연남동의 유일한 재래시장이다. 평일에는 일반 시장과 다를바가 없지만 금요일마다 야시장을 운영하며, 토요일 마다 7일장을, 일요일엔 일요시장을 운영한다. 주말엔 폴리마켓 형태로 수공예 제품 및 도시 농부들이 재배한 농작물 등 도심에서 제조하는 물품들과 다양한 먹거리를 판매하며, 요리 워크샵 및 다양한 행사들을 함께 진행한다.",
동진캐슬 아모르펜션,1639649,숙박,숙박시설,펜션,,전북특별자치도,126.4768352927,35.6041628544,"상록수해수욕장에 위치한 동진캐슬 아모르펜션은 가족 펜션, 단체 펜션, 커플 펜션으로 구성되어 있다. 원목의 느낌을 그대로 살려 아늑하고 포근한 느낌을 주고 각 객실의 인테리어가 특색 있게 구성되어 있어 고객들에게 즐거움을 선사한다.
동진캐슬 아모르펜션의 특별함은 테라스에서 식사를 즐길 수 있고, 바비큐를 즐길 수 있는 것이다. 또한, 다양한 부대시설로 포켓 당구, 노래방, 탁구장, 세미나실 등이 준비되어 있다. 아이들을 위한 해수풀장과 갯벌체험장도 이용 가능하다. 주변 관광지로 이순신 전라좌수영, 상록수해수욕장, 도청리 조각공원, 솔섬 노을, 모항해수욕장 등이 있다.","<a href=""http://xn--hq1by1nnoa69jcyau51f.com/"" target=""_blank"" title=""새창 : 동진캐슬 아모르펜션 홈페이지로 이동"">http://변산반도펜션.com</a>"
동쪽바다 세꼬시,2903606,음식,음식점,한식,http://tong.visitkorea.or.kr/cms/resource/94/2903594_image2_1.jpg,강원특별자치도,128.6692992947,38.0803789263,"동쪽바다 세꼬시는 강원도 양양군에 있는 세꼬시 전문점이다. 아버지가 수산항에서 참가자미를 잡아오면 어머니가 식당을 운영하고 자녀들이 함께 일하는 식당이다. 참가자미는 양식이 안 되는 생선으로 살아있는 참가자미를 회로 썰어 음식으로 제공한다. 섭도 자연산으로 끓이고 있고 모두 어획한 제철 생선으로 요리를 한다. 세꼬시는 요리하는 데 시간이 걸리는 음식이라 주문 후 방문하면 기다리는 시간을 줄일 수 있다. 내부가 넓지는 않지만, 분위기가 좋고 날씨가 좋을 때는 테라스에서 식사할 수도 있다. 주차는 매장 앞에 전용 주차장이 있어 이용이 편리하다. 수산해변 바로 앞에 있으며, 쏠비치양양, 송전해수욕장과도 가깝다.",
동쪽바다중앙시장,132776,쇼핑,쇼핑,상설시장,,강원특별자치도,129.1089844076,37.5508793529,동쪽 바다 중앙시장은 1943년경 자연적으로 발생 (묵호항 개항과 함께 형성) 하였다. 2001년부터 현재까지 비가림(하양막)시설을 연차적으로 설치하여 옛 재래시장에서 탈피한 현대적 시장으로 신축하였다. 주차장 시설이 확보되어 있고 2006년 시장 상인회 및 인정시장 등록되었다. 동쪽 바다 중앙시장에는 고소한 냄새가 코를 자극하는 구이 타운과 2016년도 중소기업청 공모사업 ‘청년상인 창업 지원 사업’으로 추진된 청년몰 싱싱스가 함께 운영하고 있다.,"<a href=""https://eastseamarket.modoo.at/""target=""_blank"" title=""새창 : 업체 홈페이지 이동"">https://eastseamarket.modoo.at/</a><br><a href=""http://instagram.com/eastseamarket"" target=""_blank"" title=""동쪽바다중앙시장 인스타그램 페이지로 이동"">http://instagram.com/eastseamarket</a>"
동쪽바다프리미엄하우스(카페앤라씨),2913716,숙박,숙박시설,펜션,http://tong.visitkorea.or.kr/cms/resource/93/2920793_image2_1.jpg,강원특별자치도,129.1179250382,37.5584730968,"동해시 감성 숙소 “프리미엄 하우스(카페앤라씨)”다. 여러분의 아름답고 멋진 여행을 위하여 특별한 프라이빗 럭셔리 하우스를 소개한다. 카페앤라씨 프리미엄하우스에서는 품격의 여행을 즐길 수 있다. 멋진 해돋이와 함께 할 수 있다. 럭셔리 카페 같은 공간을 누릴 수 있다. 드넓은 바다를 품을 수 있다. 특히 쉼, 여유, 그리고 힐링이 있는 여행을 원하신다면 적극 추천한다.",
동창선아트스테이,2909325,레포츠,육상 레포츠,"야영장,오토캠핑장",http://tong.visitkorea.or.kr/cms/resource/04/2909304_image2_1.JPG,경상남도,128.0409354206,34.8694810083,"다양한 전시와 미술 체험 등 아트 캠핑이 가능한 동창선 아트스테이는 남해 동창선초등학교가 폐교되고 뮤지엄남해와 동창선 아트스테이로 재탄생된 곳이다. 
이곳에서는 캠핑뿐만 아니라 예술활동을 장려하고 문화를 통한 삶의 질 향상을 위해 전시 관람은 물론 작가와 함께하는 맞춤형 미술 수업 등 다양한 아트 체험을 할 수 있어 더욱 특별한 경험을 선사한다. 다양한 연계 프로그램 신청은 캠핑 예약 시 선택하거나 사무실로 연락하면 자세하게 안내해 준다. 
사이트는 18면이며 텐트 1동에 인원은  4인 기준, 최대 6인까지 가능하고 승용차 1대 주차는 무료이며 카라반 및 캠핑용 차량은 요금이 추가된다. 남해에 둥지를 튼 독일마을이 근처에 있어 함께 둘러보기 좋다.","<a href=""https://www.xn--q20bo4d78is4fp3bg9flgk2a71j19glzhd2qfle30l.com/01128/01146.web""target=""_blank"" title=""새창 : 동창선아트스테이 사이트로 이동"">https://www.동창선아트스테이.co.kr</a>"
동창천 청룡폭포(청룡인공폭포),2756754,자연,자연관광지,폭포,,경상북도,129.0436263742,35.7597435527,"동장천 청룡폭포는 동창천 계곡에 자리 잡은 인공폭포다. 사방이 산으로 둘러싸여 있어 경관이 아름답다. 여름철에는 하천 뒤 절벽 꼭대기에서 시원스레 물줄기가 쏟아져 내린다. 이곳은 봄부터 가을까지 캠퍼들이 많이 찾는 노지 캠핑의 성지다. 여름 성수기에는 자리 맡기가 하늘의 별따기 수준이다. 오전 일찍 찾아야 허탕을 치지 않으니 참고할 것. 안전한 물놀이를 위해 성수기에는 주민자치단체에서 많은 노력을 기울인다. 수상안전요원이 상주하고, 주변 환경정화에도 힘쓴다.","<a href=""https://www.gyeongju.go.kr/tour/page.do?mnu_uid=2695&con_uid=728&cmd=2"" target=""_blank"" title=""새창 : 경주시 문화관광 홈페이지로 이동"">https://www.gyeongju.go.kr/tour</a>"
동천 야외물놀이장,2502579,레포츠,수상 레포츠,수영,,울산광역시,129.3394835214,35.5737339542,"울산 중구는 가족 단위 관광객을 위한 다양한 야외 물놀이장을 운영 중이다. 그 중 대표적인 곳이 동천 야외 물놀이장으로 도심 속에서 저렴한 비용으로 무더위를 날려 보낼 수 있는 최적의 피서지다. 매년 6만 명 이상의 이용객이 찾고 있는 이곳은 활강 길이 45m의 워터 슬라이드와 랜딩풀, 유아풀과 쉼터 공간 등이 갖춰져 있고 화장실과 탈의실 등의 편의시설도 대형 워터파크에 뒤지지 않는다. 하천의 상류에 위치한 물놀이장은 정화시설이 설치되어 쾌적한 환경에서 물놀이를 즐길 수 있으며 다수의 안전요원을 배치하여 안전관리에 철저를 기하고 있다.","<a href=""https://crs.ujcmc.or.kr/sports_facilities/facility_swim_view.jsp?selItemKind=STD&mem_id=B0000001&item_id=T0000001"" target=""_blank"" title=""새창: 울산중구도시관리공단 홈페이지로 이동"">https://crs.ujcmc.or.kr</a>"
동천면옥,2866964,음식,음식점,한식,http://tong.visitkorea.or.kr/cms/resource/49/2866949_image2_1.jpg,경상북도,128.7555083379,35.8191481425,"동천면옥은 경상북도 경산시 사동에 있는 닭갈비와 만두전골 맛집이다. 매콤한 닭갈비는 양이 푸짐하고 남은 양념으로 밥을 볶아 먹어도 별미다. 두툼한 수제 왕만두가 들어있는 만두전골은 얼큰하고 국물 맛이 깊다. 이밖에 판소바, 냉소바, 비빔모밀도 인기고 돼지찌개, 돌솥비빔밥, 영양우동, 수제왕만두 등 곁들여 먹기 좋은 메뉴도 준비되어 있다. 수성IC에서 가깝고, 인근에 인터불고CC, 삼성현역사문화공원이 있어 연계 여행에 나서기 수월하다.",
동천석실,129539,인문(문화/예술/역사),역사관광지,고택,,전라남도,126.5458227627,34.153960755,"동천석실은 주자학에서 신선이 산다는 선계세상으로 부용동을 한눈에 굽어 볼 수 있으며 낙서재의 정면에 바라보이는 산중턱에 있다. 3,306m²(1,000여 평)의 공간에 한 칸 정자와 석문, 석담, 석천, 석폭, 석전을 조성하고 차를 마시며 시를 지었던 곳이다. 동천석실은 천하의 명산경승으로 신선이 살고 있는 곳을 동천복지(洞天福地)라고 한 데서 이름 지어진 곳으로 휴식과 독서를 위해 이 지역에서 가장 높은 곳에 위치한 정자이다. 석담에는 수련을 심고 못을 둘로 나누어 물이 드나들 수 있도록 인공적으로 구멍을 파고 다리를 만들어 희황교라 칭하였다. 지금도 석실 앞에는 도르래를 걸었다는 용두암과 차를 끓여 마신 차바위가 남아있다.
윤선도 원림 매표소에서 동천석실 입구까지 차량으로 약 5분 소요되며 동천석실 입구에서 동천석실까지 약 20분 산을 올라가야 한다. 금, 토, 일요일에는 세연정에 문화해설사가 상주하므로 동천석실과 곡수당, 낙서재에 대한 설명을 듣고 방문하는 것을 추천한다.","<a href=""https://www.wando.go.kr/tour/sub.cs?m=30"" target=""_blank"" title=""새창 : 완도 문화관광 홈페이지로 이동"">http://www.wando.go.kr/tour</a>"
동천식당,2891557,음식,음식점,한식,http://tong.visitkorea.or.kr/cms/resource/61/2877861_image2_1.jpg,경상남도,128.0354180544,34.8077656009,"동천식당은 남해의 대표적인 여행지 독일 마을로 들어가는 길목에 있는 한식당이다. 대표 메뉴인 멸치 쌈밥 외에도 전골과 아귀찜 등의 한식 메뉴를 판매하고 있으며, 모두 맛이 좋아 관광객은 물론 현지인에게도 인기가 좋다. 대표 메뉴는 쌈밥과 회무침, 국, 생선구이가 포함된 멸치 쌈밥세트다. 멸치회무침은 새콤한 양념에 멸치를 무쳐낸 요리로, 명태 회무침 같은 쫄깃한 식감이다. 멸치 쌈밥은 매콤한 양념에 통통한 멸치와 각종 채소를 졸여 신선한 상추에 밥과 함께 싸 먹는 요리인데, 멸치 특유의 비린내가 나지 않아 해산물을 즐기지 않는 이들도 부담 없이 즐길 수 있다. 해물 전골이나 낙지 전골 등의 전골 메뉴도 인기 있는데, 커다란 냄비에 신선한 재료와 미나리, 버섯 등이 듬뿍 담겨 풍성하게 제공된다. 덕분에 마을 주민들도 저녁에 술과 함께 한 끼 식사하러 오는 경우가 많다.
※ 반려동물 동반 불가",
동천자연식물원,2732160,인문(문화/예술/역사),산업관광지,기타,http://tong.visitkorea.or.kr/cms/resource/89/2774089_image2_1.jpg,경기도,127.0794516354,37.3374493082,"경기도 용인시에 위치한 동천자연식물원에서는 ‘자연은 아이들의 가장 큰 스승’을 모토로 하며, 동식물을 직접 접하고 체험할 수 있는 기회를 제공한다. 작은 돼지, 염소, 토끼, 거북이를 비롯 파충류, 앵무새 등 평소 접하기 힘든 동물에게 먹이 주기 체험을 할 수 있다. 또한 유치부와 초등부를 위한 다양한 체험프로그램이 준비되어 있다. 수도권에서 가깝고 교통이 편리해 어린이를 동반한 가족 단위의 방문객들이 많다.","<a href=""http://naturesoop.co.kr/"" target=""_blank"" title=""새창 : 동천자연식물원 사이트로 이동"">http://naturesoop.co.kr/</a>"
동천재활체육센터,3006882,레포츠,육상 레포츠,수련시설,http://tong.visitkorea.or.kr/cms/resource/43/3006843_image2_1.jpg,서울특별시,127.0739601103,37.6442385976,"동천재활체육센터는 지역 주민들의 건강하고 행복한 여가생활을 위해 각종 신체활동 교육프로그램과 문화공간을 제공할 뿐 아니라 장애인과 더불어 사는 사회의 실천을 목표로 2003년 5월에 개관한 스포츠센터이다. 
동천재활체육센터의 모든 신체활동 공간은 비장애인과 장애인이 함께 참여할 수 있는 곳으로 장애인과 비장애인이 더불어 건강하고 행복한 여가생활을 즐길 수 있는 곳이다. 장애인을 위한 프로그램으로는 빙상, 휘트니스, 문화강좌 프로그램으로 해누리 신체활동 프로그램이 있다. 문화강좌 프로그램에는 심리미술활동이 있어서 장애유형 및 정도에 따라 개인별 맞춤 프로그램으로 진행한다.
서라벌고등학교와 한글비근린공원 옆에 위치하고 있으며, 셔틀버스도 운영하고 있다.","<a href=""http://www.dcsports.co.kr/"" target=""_blank"" title=""새창 : 홈페이지로 이동"">http://www.dcsports.co.kr/</a>"
동천해물탕해물찜,623215,음식,음식점,한식,http://tong.visitkorea.or.kr/cms/resource/44/590244_image2_1.jpg,강원특별자치도,128.884725438,37.774365827,"해물탕, 해물찜 전문 음식점으로 해물탕과 해물찜은 인근 바닷가에서 잡아올린 다양한 수산물로 요리하여 다양한 맛을 느낄 수 있다. 여름에는 해수욕장이 가까운 거리에 위치하였고 겨울철에는 용평스키장이 가까운거리에 위치하여 다양한 체험관광을 할 수 있는 곳이다.<br>","<a href=""http://kw3b9964.fordining.kr"" target=""_blank"" title=""새창 : 동천해물탕해물찜 홈페이지로 이동"">http://kw3b9964.fordining.kr</a>"
동촌 보리밥과 돈까스,2848967,음식,음식점,한식,http://tong.visitkorea.or.kr/cms/resource/08/2848608_image2_1.jpg,서울특별시,127.145516177,37.4950544417,"동촌 보리밥 돈까스는 서울특별시 송파구 거여동에 있는 돈가스 맛집이다. 지하철을 이용한다면 5호선 거여역 3번 출구 인근에 있고 자차로 방문했다면 가까운 공영주차장을 이용하는 것이 좋다. 외부는 40년 노포 밥집답게 옛날 흙벽으로 되어 있어 찾기 쉽다.
대표 메뉴는 돈가스와 보리밥이다. 돈가스는 옛날식 왕돈까스로 한 접시에 단무지, 양배추샐러드, 마카로니가 함께 나온다. 돈가스는 양이 많지만 중학생 이상이라면 1인 1메뉴 주문이 원칙이다.
양은 그릇에 나오는 보리밥은 개인의 취향에 맞게 콩나물, 취나물, 건호박, 무생채, 배추 등을 넣어 비벼 먹는다. 된장찌개도 같이 나온다. 식당 인근에 성내천물빛광장과 그린공원이 있어 연계 관광을 할 수 있다.",
동촌GC,2769559,레포츠,육상 레포츠,골프,http://tong.visitkorea.or.kr/cms/resource/11/2771111_image2_1.jpg,충청북도,127.7446716631,37.0568271219,"동촌GC는 충북 충주시 노은면 문성리에 자리 잡고 있다. 이곳은 대중제 골프장으로 18홀이 갖춰져 있다. 부대시설로는 클럽하우스, 레스토랑, 스타트 하우스, 프로숍 등이 있다. 골프장은 평택-제천고속도로와 중부내륙고속도로가 만나는 분기점인 북충주 IC에서 가까운 거리에 있다. 주변에 문성자연휴양림이 있어 연계 여행에 나서기 좋다.","<a href=""https://www.dongchongc.co.kr:442/index.asp"" target=""_blank"" title=""새창 : 동촌GC 사이트로 이동"">https://www.dongchongc.co.kr:442</a>"
동촌마을,2792961,인문(문화/예술/역사),체험관광지,농.산.어촌 체험,http://tong.visitkorea.or.kr/cms/resource/08/2796708_image2_1.jpg,경상남도,127.7723190918,35.1212480265,"적량면의 동리(東里)와 서리(西里)의 7개 마을을 합하여 삼화실이라고 하는데, 동촌마을은 존티재에서 넘어와 삼화실의 첫 관문 역할을 하고 있다. 존티재를 넘으면 들녘을 가득 채워놓은 비닐하우스를 만난다. 그 안에는 동촌마을의 효자 농작물인 부추와 취나물이 자란다. 존티재를 올라가는 골목에는 대나무들이 무성하게 자라서 대숲을 이루고 있다. 바람이 부는 날 대나무들에 소리를 들을 수 있을 것이다. 대숲을 지나면 솔숲에 향기를 맛볼 수가 있고 정상에는 부부목장승이 지키고 있다. 하동군에서 세운 천하대장군과 지하여장군이다. 존티재 정상에 서면 아래로는 멀리 삼화실이 보인다.",
동촌바다양푼이동태탕,2687983,음식,음식점,한식,http://tong.visitkorea.or.kr/cms/resource/80/2701380_image2_1.jpg,강원특별자치도,127.7038502468,38.1056353301,"동촌바다양푼이동태탕은 화천군에 위치한 한식집이다. 대표 메뉴는 동태탕으로 시원하고 얼큰한 국물이 일품이다. 푸짐한 양의 알곤이탕과 찜도 메뉴에서 만나볼 수 있으며, 매콤한 아구찜도 맛볼 수 있다. 따뜻한 국물이 생각날 때 방문하기 좋은 매장이다.",
동촌유원지,126128,인문(문화/예술/역사),휴양관광지,공원,,대구광역시,128.6546405629,35.8782784742,"동촌유원지는 대구시 동쪽 금호강변에 있는 44만 평의 유원지로 오래전부터 대구 시민이 즐겨 찾는 곳이다. 각종 위락시설이 잘 갖춰져 있으며, 드라이브를 즐길 수 있는 도로가 건설되어 있다. 수량이 많은 금호강에는 조교가 가설되어 있고, 우아한 다리 이름을 가진 아양교가 걸쳐 있다. 금호강(琴湖江)을 끼고 있어 예로부터 봄에는 그네뛰기, 봉숭아꽃구경, 여름에는 수영과 보트 놀이, 가을에는 밤 줍기 등 즐길거리가 많은 곳이다. 또한, 해맞이다리, 유선장, 체육시설, 실내 롤러스케이트장 등 다양한 즐길 거리가 있어 여행의 재미를 더해준다.","<a href=""https://tour.daegu.go.kr/index.do?menu_id=00002942&menu_link=/front/tour/tourMapsView.do?tourId=KOATTR_115""새창: 대구관광안내 홈페이지로 이동"">http://tour.daegu.go.kr</a>"
