title,contentid,cat1,cat2,cat3,firstimage,region,mapx,mapy,overview,homepage
복돈이 부추삼겹살,2943881,음식,음식점,한식,,서울특별시,126.9811400276,37.4752204562,냉동삼겹살의 성지라고 불리는 식당인 복돈이 부추삼겹살은 부추와 같이 먹는것이 포인트인 식당이다. 특히 맛집으로 알려져 줄서는것은 기본이다. 싱싱함이 돋보이는 생삼겹살과 감칠맛을 업 시켜주는 부추무침의 조합이 환상적이다. 또한 이집은 된장찌개가 기본으로 나온다. 마무리로 먹는 볶음밥까지 맛있는 식당이다.,
복돼지,2644315,음식,음식점,한식,http://tong.visitkorea.or.kr/cms/resource/24/2644324_image2_1.jpg,경기도,126.7425585435,37.4910004833,"부천 상동의 새로운 맛집으로 입소문을 타고 있으며, 대패 삼겹살을 1인(100g) 3,000원에 할인 판매하고 있는 가성비 좋은 상동 고깃집 맛집이다. 냉삼겹살은 복고풍의 뉴트로 열풍으로 인기가 높다. 과거엔 냉동 삼겹살 하면 싼 맛에 먹을 수 있는 질이 낮은 삼겹살로 생각했지만, 이 집은 맛을 위해 '냉동'을 택한 것이며, 급랭을 시켜 육즙을 잡은 고소한 맛이 일품이다. 손맛 좋은 주인장이 요리하는 잔치국수도 뛰어난 맛을 자랑하여 오픈한 지 얼마 되지 않았음에도 불구하고 많은 사람들의 인생 맛집으로 불리고 있다.<br>",
복돼지식당,2847916,음식,음식점,한식,http://tong.visitkorea.or.kr/cms/resource/02/2847902_image2_1.JPG,제주특별자치도,126.8025679194,33.3975711157,"복돼지식당은 제주 성읍민속마을 북쪽에 있다. 제주아주망(아주머니)이 직접 지은 농산물로 소박한 제주 제철 밥상 차림을 제공하며 고사리오겹살, 고사리육개장, 고사리비빔밥 등 제주산 생고사리를 넣은 음식이 특징이다. 넓은 주차장과 넓은 좌석으로 단체 손님 식사가 가능하며 원활한 식사를 위해 예약제로 운영한다. 개인 손님이 참고하도록 네이버 홈에서 매주 단체예약 상황을 공개하고 있다. 근처 여행지로 성읍민속마을, 영주산이 있다.",
복두부집,855982,음식,음식점,한식,http://tong.visitkorea.or.kr/cms/resource/06/1789806_image2_1.jpg,경기도,126.7167695979,37.7745447956,"세계문화유산 파주 장릉 부근에 위치한 복두부집은 두부를 이용한 다양한 음식을 맛볼 수 있는 100% 파주 장단콩 전통 두부 요리 전문점이다. 모든 식재료를 직접 제조 가공하여 건강식으로 조리해 한 번 찾은 손님은 재방문이 이어지는 맛집이다.
복두부집의 대표메뉴는 볏짚청국장과 참게두부전골이며, 그 외에도 장단콩콩비지와 순두부, 한방두부보쌈, 돼지고기두루치기 등 다양한 메뉴를 맛볼 수 있다. 복두부집의 모든 두부는 파주시의 특산물인 장단콩을 갈아 손으로 짜서 동해안 고성에서 공수한 심층수를 사용한 간수와 나무의 화력으로 만들어 내 고소한 맛이 일품이다. 특히 볏짚을 이용한 재래식으로 이불을 씌워 발효시킨 청국장은 유명 셀럽들이 방문해 먹고 갈 정도로 이미 명성이 높다.
식사 장소는 신발을 벗고 들어가는 입식으로 유아 의자가 비치되어 있고 입구부터 반겨주는 임영웅, 이연복 등 유명 셀럽들의 친필 사인을 볼 수 있다. 전화로 예약하면 친절하게 안내해 준다. 부천에 분점을 운영한다.
성동IC에서 차량으로 약 6분 소요된다. 인근에 파주출판도시, 헤이리 예술마을, 임진각(평화누리공원), 세계문화유산 파주 삼릉, 하니랜드, 퍼스트가든 등이 있다.",
복드림 도깨비방망이,2493631,쇼핑,쇼핑,공예/공방,http://tong.visitkorea.or.kr/cms/resource/04/3422404_image2_1.jpg,충청북도,128.0368567292,37.1449279169,"복드림 도깨비방망이는 전국 유일 수제 원목 도깨비방망이 공예품 제작 및 판매하는 목공예품 전문점이다. 민간신앙의 초자연적 존재 중 하나인 도깨비를 주제로 작품을 만들고 있으며, 모든 제품은 국산 원목과 천연 원료를 사용하여 제작하고 있다.
또한 복드림 도깨비방망이는 사회 취약계층을 직원으로 채용하고 나눔을 실천 중인 사회적 기업이기도 하다.","<a href=""http://www.도깨비방망이.com"" target=""_blank"" title=""새창: 복드림 도깨비방망이 홈페이지로 이동"">http://www.도깨비방망이.com</a>"
복록수,2581080,음식,음식점,중식,,대전광역시,127.4062334265,36.3272242113,"복록수(대전)은 깔끔하고 고급스러운 분위기의 중화요리 전문점이다. 메뉴는 코스요리와 식사류, 요리류로 구성되어 있다. 식사류는 짜장면, 짬뽕, 볶음밥 등이 있으며, 요리류는 탕수육, 유린기, 양장피 등 다양한 메뉴가 있다. 대표 메뉴는 코스요리로, 점심 코스와 저녁 코스로 나누어져 있다. 이곳은 건강을 생각하여 면을 반죽할 때 비트즙을 첨가하고 있어 특색 있는 면요리를 맛볼 수 있다. 또한, 프라이빗한 룸이 마련되어 있어 상견례, 동호회, 가족모임 등을 즐길 수 있는 장소로 전화 문의를 통해 예약이 가능하다. 인근에는 서대전공원, 유등천 등이 있다.",
복만네,2766543,인문(문화/예술/역사),체험관광지,농.산.어촌 체험,http://tong.visitkorea.or.kr/cms/resource/50/2767050_image2_1.jpg,경상북도,128.5467698664,36.0645025943,"복만네는 경북 칠곡군 가산면에 있다. 자연 친화적인 공간에 카페가 있고, 어린이들을 위한 체험 공간이 마련되어 있다. <br>여름에 사용 가능한 수영장도 예약제로 운영 중이다. 매장의 5채의 건물마다 사진찍기 좋게 소품으로 꾸며 놓은 스튜디오 형식의 테마 카페이다.",
복만식당,2755613,음식,음식점,한식,http://tong.visitkorea.or.kr/cms/resource/09/2755609_image2_1.jpg,경상남도,127.8518823178,34.7685528918,갈치전문점 복만 식당은 ‘아난티 남해’ 근처에 있으며 칼칼한 전복갈치조림과 도톰한 통갈치구이가 대표 메뉴이다. 인원수에 맞춰 세트 메뉴도 준비되어 있으니 메뉴 선정 고민이 줄어든다. 창가에 앉으면 푸른 바다와 초록의 골프장이 한 폭의 그림처럼 펼쳐지고 붉은 석양빛이 감돌 때면 몽환적인 인생 최고 장면을 남길 수도 있다. 후기에 좋은 평이 많아 아난티 남해에 숙소를 잡은 관광객들이 많이 찾는다. 주인이 직접 재배한 채소를 제공하며 아침 식사가 가능하다.,
복많네짬뽕 본점,2845545,음식,음식점,중식,http://tong.visitkorea.or.kr/cms/resource/32/2845532_image2_1.jpg,경기도,126.6333343384,37.6206306921,"복많네짬뽕 본점은 양촌산업단지 부근 대로변에 있다. 여러 방송 매체에 소개된 짬뽕으로 룸과 단체석을 포함하여 150석 규모의 큰 식당이다. 식당 입구에 있는 커다란 수족관에서 해물짬뽕에 들어가는 가리비와 전복 등을 볼 수 있다. 짬뽕 전문점답게 일반짬뽕을 비롯하여 백짬뽕, 전복 짬뽕, 가리비 짬뽕, 해물 짬뽕, 갑오징어 짬뽕 등 다양한 종류의 짬뽕 메뉴가 준비되어 있다. 짜장면도 면과 주꾸미가 반반일 정도로 주꾸미를 푸짐하게 제공한다. 카운터 옆에는 아이스크림과 과자 종류도 따로 판매하고 있어 후식으로 먹을 수 있다.	
※반려동물 동반 불가(단, 안내견은 가능)",
복많네해물칼국수,2782818,음식,음식점,한식,http://tong.visitkorea.or.kr/cms/resource/92/2782892_image2_1.png,경기도,126.7028027444,37.7280721868,"경기도 파주시 문발로에 위치한 해물칼국수 전문점이다. 20년 이상 연구한 육수에 활전복, 낙지, 오징어, 새우, 각종 조개류를 사용한 해물칼국수가 대표 메뉴이며, 싱싱한 해물로 만든 해물파전이 있다. 해물 전골은 코스요리를 먹는 느낌이 들 만큼 싱싱한 해물이 푸짐하다. 어린이를 위한 메뉴로 돈가스나 만두가 있다. 매장이 깔끔하고 넓어 여유 있는 식사를 할 수 있다. 자유로 문발 IC에서 차량으로 5분 거리에 있다.","<a href=""https://rocklsb.modoo.at/"" target=""_blank"" title=""새창 : 복많네해물칼국수사이트로 이동"">https://rocklsb.modoo.at/</a>"
복면닭갈비,2838705,음식,음식점,한식,http://tong.visitkorea.or.kr/cms/resource/03/2838703_image2_1.JPG,경상남도,128.6069843821,35.3464959341,"복면닭갈비는 닭갈비 딱 하나만 파는 식당이다. 양념포함 200g이 아니라 고기무게만 350g을 주며, 다른 가게들보다 양이 많아 인원수보다 1인분 덜 주문하라는 안내문이 크게 붙어있다. 그렇기 때문에 2인분 같은 1인분의 푸짐한 양으로 배를 채울 수 있다. 또한, 방문한 손님들에게는 4가지 서비스로 보답을 하는데 한 테이블 당 라면 한개와 부침개 한번, 1인당 어묵 1 꼬치가 무료로 제공된다.",
복사골,2688099,음식,음식점,한식,http://tong.visitkorea.or.kr/cms/resource/36/2701436_image2_1.jpg,전라남도,127.4820817276,34.9730124324,화덕에서 굽는 생선구이다. 대표메뉴는 생선구이이다. 전라남도 순천시에 있는 한식전문점이다.,
복산돈까스,2785278,음식,음식점,서양식,http://tong.visitkorea.or.kr/cms/resource/14/2785314_image2_1.jpg,울산광역시,129.3255377425,35.565723481,"울산 중구에 위치한 복산돈까스 본점은 평일에도 웨이팅이 있는 돈가스 맛집이다. 예약은 따로 받지 않고 가게 내 설치된 예약 기기에 핸드폰 번호를 등록하고 알람이 오면 입장하면 된다. 복산돈까스는 주문 시 조리하여 겉바속촉의 돈가스를 맛볼 수 있다. 다만 주문 시 조리하여 15분 이상의 시간이 소요되어 대기시간이 길어질 수밖에 없다. 그런데도 신선하고 도톰한 돈가스를 맛본 사람이라면 긴 대기시간이 발생하더라도 또 찾아오게 만드는 곳이다. 특히 일식, 안심 돈가스를 주문하면 생 고추냉이와 트러플오일, 소금이 나와 돈가스를 좀 더 색다르게 즐길 수 있다. 복산돈까스는 현재 중구 본점과 남구점 두 군데를 운영하고 있으며 매장마다 휴무일이 다르므로 확인 후 방문해야 한다.",
복성,2808040,음식,음식점,한식,,경상북도,128.6346634708,35.6162854929,국내산 암돼지를 건조숙성(50일)한 돼지고기의 부드러운 육질과 풍미를 맛볼 수 있다.,
복성각,2914233,음식,음식점,중식,http://tong.visitkorea.or.kr/cms/resource/28/2914228_image2_1.jpg,서울특별시,126.9374138812,37.558521108,"2호선 신촌역 3번 출구에서 도보 10분 거리에 있는 중식당이다. 짬뽕 순두부 밥이 대표메뉴이다. 대표메뉴 외에도 불낙 짬뽕, 굴 짬뽕, 불밥, 짜장면, 마늘볶음밥, 굴 짬뽕밥, 탕수육 등의 메뉴를 맛볼 수 있다. 오전 11시부터 오후 10시까지 연중무휴 영업한다. 매장 전용 주차장이 없어서 차량을 가지고 방문할 경우 근처 주차장을 찾아야 한다. 총 3층 규모로 매장이 크고 단체석이 있어서 모임이나 회식하기 좋으며 대학가 근처에 있어서 주변에 다양한 맛집과 놀거리가 있다.",
복성루,1827859,음식,음식점,중식,http://tong.visitkorea.or.kr/cms/resource/09/3083009_image2_1.png,전북특별자치도,126.7157710807,35.9782076126,"복성루는 빈해원 지린성과 함께 군산 3대 짬뽕 맛집으로 유명하며 싱싱한 오징어, 홍합, 꼬막 등 다양한 해산물과 야채를 넣고 우려낸 진한 짬뽕 국물이 일품인 가게로 줄 서서 맛보는 지역의 대표 짬뽕집으로 자리 잡고 있다.
짬뽕 외에도 갖은 야채와 해산물을 잘게 썰어 전분으로 농도를 맞춘 걸쭉한 물짜장도 복성루의 인기 메뉴이다. 또한, 복성루는 2023년 [착한가게 52호점]으로 선정되었다. 착한 가게 후원을 통해 어려운 이웃들과 지역사회에 선한 영향력을 환원하는 가게이기도 하다.",
복성반점,2785270,음식,음식점,중식,http://tong.visitkorea.or.kr/cms/resource/45/2790945_image2_1.JPG,부산광역시,128.9624682898,35.10368246,"부산의 복성반점은 부산의 3대 짬뽕이라고 불리는 맛집이다. 당일 구입한 신선한 한치와 관자, 조갯살, 새우 등 푸짐한 해산물을 넣어 만든 짬뽕으로 소문난 집이다. 해산물이 주는 시원함과 채소가 주는 감칠맛에 정성을 한가득 들여 끓여 내는 짬뽕은 기호에 맞게 맵기를 보통맛과 매운맛으로 조절해서 시킬 수 있다. 시원하고 칼칼한 맛의 짬뽕뿐만 아니라 큼직한 재료들이 아낌없이 들어간 짜장면, 고슬고슬 입맛을 사로잡는 볶음밥, 바삭하게 잘 튀겨 나오는 탕수육, 유산슬, 양장피 등 이 집의 다른 메뉴들도 모두 만족감을 준다. 오랜 시간 사랑받는 노포의 음식은 다시 방문할 이유가 충분하다.",
복수산해물탕,2901045,음식,음식점,한식,http://tong.visitkorea.or.kr/cms/resource/37/2901037_image2_1.jpg,강원특별자치도,128.5886448319,38.1909311671,"복수산해물탕은 강원도 속초시에 있는 해물 전문점이다. 엑스포 공원 근처에 최근 개업한 식당이다. 신선한 생물만으로 요리하는 식당으로 황제해천탕, 황제해물탕, 황제해물찜이 주요 메뉴이다. 일반 식당과 같은 음식을 원한다면 랍스타찜, 가오리찜, 대게, 킹크랩 등을 맛볼 수도 있다. 속초에서 가장 넓은 매장으로 패밀리실, VIP실, 수조 앞 물멍실, 연인실 등 다양한 형태의 룸이 구비되어 있어 가족 모임을 하거나 사업상의 모임을 하기 좋은 식당이다. 속초 해수욕장, 엑스포타워, 엑스포 잔디공원, 청초호 유원지 등과도 가까운 위치여서 여행을 온 관광객들의 접근성이 좋다. 전용 주차장을 이용할 수 있어 이용이 편리하다.","<a href=""http://boksusan.jalib.site/""target=""_blank"" title=""새창 : 복수산해물탕 사이트로 이동"">http://boksusan.jalib.site/</a>"
복순도가,2850158,인문(문화/예술/역사),산업관광지,식음료,,울산광역시,129.0969765879,35.585822488,"전통 가양주 방식으로 술을 빚어내는 울주군에 위치한 양조장이다. 어머니의 마음으로 정성스러운 막걸리를 만드는 것이 복순도가의 신념이다. 항상 좋은 것만 주시려는 어머니의 마음을 따라 국산 쌀만을 사용하여 전통 방식 그대로 옛 항아리에 담아 빚어낸다. 살아 숨 쉬는 누룩이 만들어낸 천연 탄산은 긴 발효의 기다림이 주는 선물이다. 청와대 만찬 건배주와 각종 국제 행사의 만찬주로도 사용되어 외국 관광객들에게도 인기가 좋은 상품이다.

(출처: 복순도가 홈페이지)","<a href=""https://boksoon.com/"" target=""_blank"" title=""새창 : 홈페이지로 이동"">https://boksoon.com/</a>"
복숟가락,2674668,음식,음식점,한식,http://tong.visitkorea.or.kr/cms/resource/09/2674609_image2_1.jpg,경기도,127.1140165422,36.9895845938,착한 가격으로 푸짐하게 먹을 수 있는 곳이다. 경기도 평택시에 있는 한식전문점이다. 대표메뉴는 참치주먹밥이다.,
복신미륵,129403,인문(문화/예술/역사),역사관광지,유적지/사적지,,제주특별자치도,126.5154401529,33.5155645816,"제주의 복신미륵은 사람의 수명과 행복을 관장하는 신으로 숭배되는 한 쌍의 미륵이다. 조선시대에 쌓은 제주성을 중심으로 동쪽에 있는 것은 동자복, 서쪽에 있는 것은 서자복이라고 한다.
동자복은 만수사 옛터인 민가 안에 자리하고 있으며, 마을의 평안과 여러 활동의 안전을 기원하는 석불로, 집안의 제액, 육아에 효험이 있다고 하여 제를 올렸으며, 제주성의 동쪽에서 성안을 수호하는 기능도 하였다.
서자복은 용화사 안에 자리하고 있으며 옛날 제주성의 서쪽에서 성 안을 수호하는 기능을 하였다 한다. 돌모자를 쓰고 있으며, 인자하게 내려다보는 눈, 우뚝한 코, 지그시 다문 입, 커다란 귀 등에서 자비로운 모습을 보여준다. 곁에는 남근을 상징하는 동자상이 서 있는데, 여기에 걸터앉아 치성을 드리면 아들을 낳는다고 믿고 있다. 매년 음력 2월 15일과 11월 15일이면 미륵을 위한 불공이 법당 안에서 행하여진다. 정확한 제작 시기는 알 수 없지만 고려시대로 추정하며, 고을을 수호하고 아들 낳기를 바라는 민간신앙과 불교의 결합을 보여주는 예이다.",
복어마을,1763938,음식,음식점,한식,,경상북도,128.6198670695,36.8092607215,영주 홈플러스 맞은편에 위치하며 주차장이 있어 접근성이 좋은 곳이다. 20석의 넓은 공간으로 다양한 손님을 받을 수 있는 곳이다. 복지리와 복매운탕은 별도의 육수를 내어서 사용함에 따라 시원하면서도 깊은 맛을 느낄 수 있다. 복불고기는 복어죽이 나오며 뼈를 발라낸 복어 순살을 사용하여 담백한 맛과 함께 조금 단 듯하면서 매콤한 맛이 야채와 곁들여져 훌륭한 맛을 낸다.,
복어세상,1828643,음식,음식점,한식,,경상북도,128.8209871648,35.8736209758,"경북 경산시 진량읍 진량공단 인근에 있는 복어세상은 복어요리 전문점이다. 다양한 메뉴의 복어요리를 접할 수 있으며, 어린이를 위한 어린이 복까스도 준비되어 있다. 주인이 직접 복어를 하나하나 손질해서 더욱더 신선하고 안전하게 먹을 수 있다. 또 매일 아침 복어뼈를 넣고 푹 고아낸 육수는 한층 깊은 복어탕, 지리 맛을 느낄 수 있다.",
복용승마장,131579,레포츠,육상 레포츠,승마,http://tong.visitkorea.or.kr/cms/resource/21/3062421_image2_1.JPG,대전광역시,127.3074388693,36.3499587486,"복용승마장은 생활체육 활성화 및 시민건강 증진을 위해 건립된 대전 유일의 승마장이다. 전국체전 개최를 계기로 마련된 복용승마장은 2016년, 국제 규격 실내마장을 준공하여 관리하면서 대전지역 승마대중화의 산실로 자리 잡기 시작하였다.
말을 조련하고 승마를 가르치는 교관과 말을 전문적으로 관리하는 마필관리사들이 근무하고 있으며, 승마강습 외에도 다양한 승마 프로그램을 운영하고 있다. 승마 프로그램으로는 어린이 무료 승마체험, 대전시립장애인종합복지관과 협력하여 운영하는 장애 아동 재활승마 프로그램, 초, 중등 대상 유소년 승마강습, 직장인 새벽반, 야간반 등이 있다.","<a href=""https://www.djsiseol.or.kr/portal/sub020703.asp"" target=""_blank"" title=""새창 : 복용승마장 홈페이지로 이동"">https://www.djsiseol.or.kr</a>"
복원횟집,134421,음식,음식점,한식,,경상남도,128.0752337824,34.9241365992,"싱싱한 자연산회를 맛볼 수 있는 곳으로, 주변 음식점들과 비교했을 때 밑반찬이 많이 나와 손님들이 많이 찾는다.<br>",
복을찾는사람들,2793408,음식,음식점,한식,http://tong.visitkorea.or.kr/cms/resource/13/2793313_image2_1.jpg,강원특별자치도,128.4142180684,37.585317516,"42년 전통 낙지볶음이 자신 있는 ‘복을 찾는 사람들’은 제3회 평창군 향토음식 경연 대회에서 장려상을 받은 향토음식 전문점이다. 낙지볶음뿐만 아니라 복지리, 복해장국, 다슬기해장국, 육개장, 가정식백반 등 다양한 메뉴가 있다. 식당 내부도, 주차 공간도 넓게 마련되어 있어 각종 모임 장소로 좋다.",
복자씨연탄구이,2758837,음식,음식점,한식,http://tong.visitkorea.or.kr/cms/resource/05/2758905_image2_1.jpg,제주특별자치도,126.9197672298,33.4692039841,복자씨 연탄구이는 탁 트인 제주 바다를 감상하며 제주 근고기를 맛볼 수 있는 식당이다. 대표 메뉴인 흑돼지 근고기는 목살과 오겹살을 섞어 600g 기준으로 제공되며 직원들이 연탄불에 직접 구워주니 어떻게 구우면 맛있을지 고민할 필요가 없다. 육즙 가득 쫀득쫀득 탱탱하게 구워진 고기를 다 먹을 즈음 입가심으로 먹을 수 있는 김치찌개에도 돼지고기가 듬뿍 들어간다. 새콤하고 시원한 열무김치 국수는 입안의 기름기를 산뜻하게 씻어준다. 2층의 고객 전용 무료카페에서는 식사 후 커피 한잔 마시기에도 좋고 웨이팅이 있을 때 편하게 앉아서 기다리기에도 좋은 공간이다.,
복전암,316266,인문(문화/예술/역사),역사관광지,사찰,http://tong.visitkorea.or.kr/cms/resource/01/3071501_image2_1.JPG,대전광역시,127.4336870816,36.3068270309,"복전암은 보문산 자락에 위치한 사찰로, 복전선원이라고도 불린다. 불교의 진리를 갈고닦아 복밭을 일구는 여러 비구니 스님들의 수행 사찰로, 대웅전을 비롯하여 5채의 기와 건물로 이루어져 있다. 비구니 스님이 거주하는 절집의 특징인 정갈하고 잘 다듬어진 모습이며 많은 스님이 불법에 정진하면서 기도하고 공부하는 곳으로 매우 조용하다.
주변에는 보문산 마애여래좌상, 한화생명이글스파크, 충무체육관 등이 있다.",
복주머니마을,2718833,인문(문화/예술/역사),체험관광지,농.산.어촌 체험,http://tong.visitkorea.or.kr/cms/resource/82/3384582_image2_1.JPG,강원특별자치도,127.6298747217,37.6946762273,"복주머니 마을은 주변을 맑고 푸른 홍천강이 감싸고 있고 강으로 감싸진 마을은 푸른 숲과 함께 자리해 그림 같은 풍경을 가지고 있다. 복주머니 마을에는 홍천군 관광지 에움녹색길이 있는데 강을 따라 울창한 숲을 만나며 걷는 길은 모두에게 인기 있다. 힐링과 전통놀이, 농촌 체험을 즐길 수 있다. 복주머니 마을은 위에서 바라보는 절경이 꼭 사진으로 담아야 아쉽지 않을 것 같은 아름다운 강으로 둘러싸여 있는 동네이다. 

(출처 : 강원도청)",
복진면,2742232,음식,음식점,한식,http://tong.visitkorea.or.kr/cms/resource/81/2742681_image2_1.jpeg,경기도,127.0105563215,37.3933860343,"경기도 의왕시 청계동에 위치한 복진면은 2004년도부터 4년간 준비 기간을 거쳐 2008년도에 세상에 처음 선보인 복어요리 전문점이다. 특히 복어와 면의 조합이라는 다소 생소한 메뉴로 19년이라는 시간을 거치면서 이제는 남녀노소 누구나 즐기는,  마니아층을 확보한 브랜드로 성장하였다. 복칼국수 외에도 다양한 복어요리를 맛볼 수 있으며, 복어를 먹지 못하는 어린이를 위한 돈가스도 판매한다.",
복천가든,2789686,음식,음식점,한식,http://tong.visitkorea.or.kr/cms/resource/42/2791742_image2_1.jpg,충청북도,128.4942931151,37.0616655105,"단양의 특산물인 도토리만을 사용해 도토리의 알싸한 맛이 밥 전체에 고루 스며 있고, 육수의 깊은 맛이 식욕을 자극한다. 도토리전을 비롯한 더덕동동주, 15가지가 넘는 반찬도 자극적이지 않아 좋다. 그리고 도토리를 싫어하거나 가벼운 식사를 원할때는 산채백반이 좋다. 소백산자락에서 나는 산나물을 냉동보관하면서 필요한 만큼만 요리를 해내기 때문에 산채의 향이 고스란히 살아있다. 특히 복천가든은 단양과 영월의 경계지점인 영춘에 자리 잡고 있고 식당 건너편에 '태왕사신기'와 '연개소문'이 촬영된 고구려성 촬영장이 있어 먹고 쉴 수 있는 것은 다 갖추고 있다.",
복천닭갈비,135932,음식,음식점,한식,http://tong.visitkorea.or.kr/cms/resource/00/552200_image2_1.jpg,강원특별자치도,127.7275381731,37.8793065816,"두꺼운 철판 위에 푸짐한 야채와 두툼한 닭갈비가 가득 담겨져 나오면 보는 사람의 얼굴에 절로 미소가 생긴다. 닭갈비에 함께 넣어 먹어야 하는 떡과 우동면, 달콤한 고구마가 닭갈비 양념과 잘 섞이면 입안에 절로 군침이 고인다. 잘 익은 닭갈비를 신선한 야채에 싸 먹고 나면 기다리던 볶음밥을 맛 볼 수 있다. 또한 마지막으로 시원한 막국수를 잊지 말고 먹는다면 춘천의 별미를 제대로 먹었다고 할 수 있다. 춘천의 명동이라 할 수 있는 닭갈비골목에 위치한 복천닭갈비는 20년이 넘는 전통을 가진 춘천닭갈비의 원조이다. 그 양과 맛은 이곳을 찾는 단골들에 의해 이미 입증되었으며, 입구에 걸린 원조집 지정패가 지나가는 사람들의 발걸음을 사로 잡는다.<br>",
