title,contentid,cat1,cat2,cat3,firstimage,region,mapx,mapy,overview,homepage
온몸을 감싸는 피톤치드와 홍삼의 향기,1874147,추천코스,힐링코스,힐링코스,http://tong.visitkorea.or.kr/cms/resource/71/531371_image2_1.jpg,Unknown,127.396343646,35.9798608986,"청정고원 지대인 진안에서 머무는 시간은 몸과 마음을 치유하는 힐링 타임이다.  절경을 이루는 운일암, 반일암 계곡과 용담호에서 마음을 씻고 국립운장산자연휴양림에서 초록의 피톤치트향을 맡으며 기운을 얻어 보자.",
온봄달열하루,3033840,쇼핑,쇼핑,공예/공방,http://tong.visitkorea.or.kr/cms/resource/64/3005764_image2_1.jpg,충청북도,127.581207001,36.315595325,"온봄달열하루는 충북 옥천군 구읍에 있는 감성 라탄 공방으로 라탄 공예품을 구매할 수 있고 더불어 라탄 공예를 체험해 볼 수 있는 곳이다. 일반 라탄 공예 수업과 원 데이 클래스를 운영 중이다. 원 데이 클래스는 남녀노소 누구나 배울 수 있으며 라탄 공예의 기초를 접할 수 있는 수업이다. 미리 예약을 해야 하며 소요 시간은 1시간 반에서 2시간 사이로 보통 원형이나 타원형의 기본 트레이를 만들 수 있다. 또한  7~13세 아이들을 위한 클래스도 진행하고 있는데 귀여운 동물 모양으로 트레이, 연필꽂이, 손거울 등을 만들어 볼 수 있다. 그리고 일반 라탄 공예 수업의 경우 기본 트레이가 아닌 화병, 거울, 시계, 티코스터 등 다양한 라탄 생활 용품을 만들 수 있다.",
온비프,2865747,음식,음식점,서양식,http://tong.visitkorea.or.kr/cms/resource/37/2865737_image2_1.jpg,경기도,127.1003199502,37.2111670811,"경기도 화성시에 위치한 온비프는 숯불 소고기 다이닝 전문점이다. 은은한 분위기와 맛있는 코스메뉴들로 특별한 날이나 데이트 코스로 즐기기에 좋고, 개별 룸 공간은 단체 모임을 하기에 좋다. 코스 메뉴 외에 꽃등심, 한우모둠, 안창살, 한우육회 등의 한우 단품과 일품요리를 따로 주문 가능하다. 식사뿐 아니라 와인이나 위스키 등 주류를 즐기기에도 좋다.","<a href=""https://www.instagram.com/on_beef/""target=""_blank"" title=""새창 : 온비프 사이트로 이동"">https://www.instagram.com/on_beef/</a>"
온빛자연휴양림,2752308,자연,자연관광지,자연휴양림,,충청남도,127.2555389803,36.2086462129,온빛자연휴양림은 충남 논산시에 위치한 탄소상쇄 숲이다. 고즈넉하고 청정한 산책길을 걷다 보면 하늘 높이 자라난 메타세쿼이아나무 숲과 잔잔한 호수가 어우러진 아름답고 이국적인 풍경을 볼 수 있다. 여름엔 푸르게 가을엔 주황빛으로 물든다. 계절별로 아름답게 피어나는 온빛자연휴양림에서의 자연친화적인 산책을 즐기길 추천한다. 사유지이기 때문에 다양한 편의 시설은 없지만 자연 속 힐링의 시간을 보낼 수 있어 많은 이들이 방문하고 있다.,"<a href=https://www.nonsan.go.kr/tour/html/sub02/020407.html"" target=""_blank"" title=""새창 : 논산시 문화관광 홈페이지로 이동"">https://www.nonsan.go.kr/tour/</a>"
온사이드카페,2766521,음식,음식점,카페/전통찻집,http://tong.visitkorea.or.kr/cms/resource/27/2765527_image2_1.jpg,경기도,127.1375764412,37.6474921465,"온사이드카페는 남양주시 퇴계원읍 별내2로에 있는 반려견 카페이다. 15kg 이하의 반려견만 입장할 수 있고 이용 시간은 오전 11시에서 오후 8시까지다. 건물은 총 3층으로 되어 있는데, 1층은 반려견 카페로 13세 이하는 이용할 수 없는 노키즈존이다.  2층은 반려견 미용, 반려견 호텔로 예약제로 이루어진다. 3층은 루프탑, 잔디운동장으로 대관이 가능하며 포토존이 있어 사진 촬영하기에 좋다. 1층에는 인조 잔디가 깔려있고 음료와 디저트 등을 판매한다.","<a href=""https://www.instagram.com/onside_dogcafe/"" target=""_blank"" title=""새창 : 온사이드카페 사이트로 이동"">https://www.instagram.com/onside_dogcafe/</a>"
온새미로,2568965,음식,음식점,한식,,전북특별자치도,126.6950065429,35.9677195661,"전북 군산시에 위치한 온새미로는 한정식 전문점이다. 
온새미로는 ‘자연 그대로, 언제나 변함없이’라는 뜻의 순우리말이다. ‘아름다운 우리 음식 온새미로’는 제철재료와 천연양념만을 사용하여 언제나 변함없이 정성스럽게 음식을 만든다. 특별한 날, 특별한 만남을 준비한다면 온새미로로 가는 것을 추천한다.",
온새미캠핑장,2743747,레포츠,육상 레포츠,"야영장,오토캠핑장",http://tong.visitkorea.or.kr/cms/resource/38/2743938_image2_1.jpg,경기도,127.0976567373,37.8797643804,"온새미오토캠핑장은 MTB 전용 도로 코스로 유명한 경기도 포천 천보산 자락에 자리를 잡고 있는 30여 개의 파쇄석 사이트를 가지고 있는 조용하고 아담한 캠핑장이다. 캠핑장 옆으로는 1 급수를 자랑하는 계곡이 흐르며, 밤나무 숲으로 뒤덮인 캠핑장이다. 예약 자리는 선착순제로 모든 자리가 거의 동일하며, 캠핑 입실은 14시부터이며 퇴실은 12시이다. 전날 예약이 없을 시에는 캠지기와 전화 통화 후 조기 입실이 가능하다. 사이트 간 간격이 넓어 여유롭게 텐트를 칠 수 있으며, 반려견 동반 입장이 가능한 캠핑장이다(목줄 필수). 여름에는 캠핑장 옆에 있는 계곡으로 내려가 물놀이며 다슬기, 물고기, 개구리 등을 잡을 수 있다. 아이들에겐 자연학습장이다. 캠핑장에서는 텐트, 타프, 야전침대, 릴선, 휴대용 버너, 전기요, 매트리스 대여도 가능하다. 365일 온수 사용이 가능한 개수대와 화장실이 가까이 있어 편리하다. 캠핑장에서 운영하는 칼칼하고 맛있는 칼국수 집에서 편안하게 맛있는 한 끼를 해결할 수 있다.","<a href=""http://cafe.naver.com/onsaemirocamping"" target=""_blank"" title=""새창 : 온새미캠핑장 사이트로 이동"">http://cafe.naver.com/onsaemirocamping</a>"
온새미한옥,3102067,숙박,숙박시설,한옥,,경상북도,129.2101318918,35.8342438298,"경주 황리단길 주택가에 자리한 온새미한옥은 1971년도에 지어진 한옥을 현대적으로 재해석한 독채 한옥스테이다. 실내는 침실 1, 거실, 욕실, 부엌으로 구성되어 있고, 실외는 마당과 야외 자쿠지가 자리하고 있다. 자쿠지는 온/냉수 사용이 가능해 반신욕 또는 족욕으로 하루의 피로를 풀 수 있다. 스탠바이미, 스타일러, 일리커피, 다이슨드라이기 등이 있어 숙박의 편의성을 높였다. 웰컴와인과 조식으로 빵과 과일이 제공된다.","<a href=""https://www.instagram.com/onsaemi_1971/"" target=""_blank"" title=""온새미한옥(으)로 이동"">https://www.instagram.com/onsaemi_1971//</a>"
온석커피,2834734,음식,음식점,카페/전통찻집,http://tong.visitkorea.or.kr/cms/resource/17/2834717_image2_1.jpg,충청남도,126.4704019839,36.8054445602,"온석커피는 충청남도 서산시 온석동에 있는 한옥 카페다. 정원에 여러 수목이 식재되어 있어 자연을 느낄 수 있다. 최상급 원두를 하이엔드 기계로 추출해 풍부한 맛을 느낄 수 있는 아메리카노는 인기메뉴이다. 이 밖에 진한 커피와 달콤한 크림의 맛을 느낄 수 있는 아인슈페너, 바닐라라테, 제주말차라테, 한라봉오미자차 등도 맛볼 수 있다. 서산 IC에서 가깝고, 인근에 중앙호수공원, 서산동문동오층석탑이 있다.",
온센 신포점,2769461,음식,음식점,일식,,인천광역시,126.6247809065,37.4727394126,"인천 중구 송학동에 있는 일식당이다. 식당 건물은 일본식 가옥으로 건물 외관만으로도 일본 분위기가 흠씬 난다. 이 집은 텐동 메뉴로 유명한 곳인데 텐동은 고슬고슬하게 지어진 밥 위에 새우, 단호박, 오징어 등 다양한 튀김을 올려놓은 일본식 튀김 덮밥이다. 튀김 종류에 따라 온센텐동을 비롯한 각종 텐동 요리가 있다.","<a href=""https://www.instagram.com/onsentendong_official/"" target=""_blank"" title=""새창 : 온센 사이트로 이동"">https://www.instagram.com/onsentendong_official/</a>"
온수공원,814255,인문(문화/예술/역사),휴양관광지,공원,http://tong.visitkorea.or.kr/cms/resource/93/2667393_image2_1.jpg,서울특별시,126.8364636294,37.4996372593,"옛날 온수골에서 유래하였는데 이 지역 일대가 더운물이 나왔기 때문에 온수골이라 하였고, 궁동은 조선 선조의 일곱째 정선옹주가 이곳에 살던 길성군(吉城君) 권대임(權大任)에게 출가하여 살던 집이 여기에 있었으므로 궁궐 같은 큰집이 있다 하여 붙여진 이름이다. 서울시의 남서 측 양천구와 구로구에 걸쳐 있고 시 외각으로는 부천시가 접하고 있으며 남쪽으로 경인국도 동쪽으로 남부순환로 북쪽으로 경인고속국도와 접하여 접근이 매우 용이하고 1971년 도시 자연공원으로 지정되었으며 임상이 양호하며 식생이 다양하고 수목 등 식생이 잘 보존된 전형적인 자연상태의 공원으로 년 180,000여 명의 시민이 공원을 이용하고 있으며 등산로 주변에 약수터와 배드민턴장, 체력단련장, 의자 등 휴게시설과 철봉, 허리 돌리기 등 운동기구가 등산로 곳곳에 설치되어 많은 시민으로부터 좋은 반응을 얻고 있다.","서울의 산과 공원 <a href=""http://parks.seoul.go.kr/parks/"" target=""_blank"" title=""새창: 서울의 공원 홈페이지로 이동"">http://parks.seoul.go.kr/parks/</a>"
온수도시 자연공원(잣절공원),2591824,자연,자연관광지,자연생태관광지,,서울특별시,126.8381773249,37.5009649129,"서울시의 남서 측 양천구와 구로구에 걸쳐 있고, 경기도는 부천시와 접하고 있으며 남쪽으로 경인국도, 동쪽으로 남부순환로, 북쪽으로 경인 고속국도와 접하여 접근이 매우 용이하고 1971년 공원으로 지정되었으며 임상이 양호하며 식생이 다양하게 잘 보존된 전형적인 자연형 공원으로 년 180,000여 명의 시민이 이용하고 있으며 등산로 주변에 약수터와 배드민턴장, 체력단련장, 의자 등 휴게시설과 철봉, 허리 돌리기등 운동기구가 등산로 곳곳에 설치되어 많은 시민들로부터 좋은 반응을 얻고 있다. 온수도시자연공원 내 조성된 잣절공원으로 연못과 데크가 설치되어 있어 여름에 청량감을 느낄 수 있고, 매년 반딧불이 방사행사가 개최되고 있다.

(출처: 서울특별시청 홈페이지)","<a href=""https://parks.seoul.go.kr/parks/detailView.do?pIdx=91""새창 : 온수도시자연공원 홈페이지로 이동"">https://parks.seoul.go.kr/parks</a>"
온수성당,3061176,인문(문화/예술/역사),역사관광지,종교성지,http://tong.visitkorea.or.kr/cms/resource/98/3000798_image2_1.jpg,인천광역시,126.4901746522,37.6407008281,"유형문화재로 지정된 성공회성당으로 온수리성당이라고도 한다. 영국성공회의 한국교구로 영국인 주교 조마가 지은 우리나라의 초기 서양 기독교 교회양식의 건물이다. 대한성공회의 역사는 1889년 코프가 초대 한국 주교로 영국에서 서품받음으로써 시작되었는데, 강화성공회 성당이 먼저 건립되고, 이어 온수성공회 성당이 건립되었다. 온수성당은 정면 3칸, 측면 9칸의 팔작집이다. 지붕의 정면과 후면의 합각부 위, 용마루 양 끝에는 십자가가 장식되어 있어서, 이곳이 전통 양식의 구조를 한 기독교 계열의 건물임을 알 수 있게 한다. 원목 기둥과 서까래가 보존되어 있으며, 100년 전 사용했던 유물과 사제복, 제의도 전시되어있다. 성당 앞쪽으로 3기의 비석이 있는데, 1기는 터너의 기념비이고 나머지 2기는 모두 조마가 주교의 영세기념비이다.","<a href=""http://www.onsu.or.kr/"" target=""_blank"" title=""새창 : 홈페이지로 이동"">http://www.onsu.or.kr</a>"
온실리움,2674007,자연,자연관광지,수목원,,울산광역시,129.1023646745,35.5976434793,"식물카페로 유명한 온실리움은 울산의 제1호 민간정원으로 야외 테라스와 온실, 하늘정원까지 커피를 즐기며 다양한 식물들을 감상할 수 있는 곳이다. 자연 속에서 쉬어갈 수 있는 공간들이 마련되어 있다.","<a href=""https://www.instagram.com/onsilrium"" target=""_blank"" title=""새창: 온실리움 홈페이지로 이동"">https://www.instagram.com/onsilrium</a>"
온앤온,2927099,쇼핑,쇼핑,사후면세점,http://tong.visitkorea.or.kr/cms/resource/63/2880663_image2_1.jpg,경기도,126.7852461144,37.5972888829,-,
온앤온,3306024,쇼핑,쇼핑,사후면세점,http://tong.visitkorea.or.kr/cms/resource/43/3313743_image2_1.jpg,서울특별시,127.0076821872,37.5687878415,-,
온앤온,3307146,쇼핑,쇼핑,사후면세점,http://tong.visitkorea.or.kr/cms/resource/92/3313892_image2_1.jpeg,서울특별시,127.0305315802,37.6146468109,-,
온앤온,3307191,쇼핑,쇼핑,사후면세점,http://tong.visitkorea.or.kr/cms/resource/68/3313968_image2_1.jpg,서울특별시,126.9055901684,37.5172308925,-,
온앤온,3307710,쇼핑,쇼핑,사후면세점,http://tong.visitkorea.or.kr/cms/resource/79/3314779_image2_1.jpeg,서울특별시,126.9249974851,37.4905482278,-,
온앤온 nc신구로,3307044,쇼핑,쇼핑,사후면세점,http://tong.visitkorea.or.kr/cms/resource/03/3313703_image2_1.jpg,서울특별시,126.8827871414,37.5012129024,-,
온앤온 뉴코아 평촌,3307759,쇼핑,쇼핑,사후면세점,http://tong.visitkorea.or.kr/cms/resource/44/3314844_image2_1.jpg,경기도,126.9516812325,37.3893465617,-,
온앤온 롯데광교,2915154,쇼핑,쇼핑,사후면세점,http://tong.visitkorea.or.kr/cms/resource/73/2882073_image2_1.jpg,경기도,127.0554913633,37.2860687197,-,
온앤온 롯데김해,2931839,쇼핑,쇼핑,사후면세점,http://tong.visitkorea.or.kr/cms/resource/80/2886080_image2_1.jpg,경상남도,128.8296220926,35.185101457,-,
온앤온 롯데동부산,2925875,쇼핑,쇼핑,사후면세점,http://tong.visitkorea.or.kr/cms/resource/00/2884900_image2_1.jpg,부산광역시,129.2128079785,35.1922521684,-,
온앤온 롯데이천,2931420,쇼핑,쇼핑,사후면세점,http://tong.visitkorea.or.kr/cms/resource/66/2889266_image2_1.jpg,경기도,127.400044712,37.2422772151,-,
온앤온 현대가산,2912381,쇼핑,쇼핑,사후면세점,http://tong.visitkorea.or.kr/cms/resource/75/2880375_image2_1.jpg,서울특별시,126.8890705637,37.4776713039,-,
온앤온 현대동대문,3306171,쇼핑,쇼핑,사후면세점,http://tong.visitkorea.or.kr/cms/resource/11/3314011_image2_1.jpg,서울특별시,127.0076821872,37.5687878415,-,
온양 온천 랜드,3046172,인문(문화/예술/역사),휴양관광지,온천/욕장/스파,http://tong.visitkorea.or.kr/cms/resource/66/3046166_image2_1.jpg,충청남도,127.0157839155,36.7810957726,"온양온천랜드는 아산(온양) 시내에 위치한 종합 온천워터파크이다. 온양온천은 국내에서 가장 오래된 온천으로 백제, 통일신라시대를 거쳐 그 역사가 약 1,300년이 되는 것으로 기록되어 있다. 조선시대에는 세종대왕뿐만 아니라 세조, 숙종, 영조, 정조 등 여러 임금이 휴양이나 병의 치료차 머물던 곳이기도 하다.
온양온천랜드에는 온천탕(사우나), 찜질방, 어린이온천(키즈워터파크), 헬스장이 마련되어 있어 남녀노소 누구나 온양온천수를 즐길 수 있다. 이곳에서는 천연알칼리온천수(PH 8.42)를 일체의 가공 없이 시설 내 전체 업장에 공급하여 사용하고 있다. 온양온천은 국내 최고의 수질을 자랑하는 전통적인 온천 명소로 다양한 부대시설이 있어 휴식과 힐링을 하기 좋은 곳이기도 하다.
온양온천랜드는 국도 21호선, 45호선에서 온천대로, 충무로, 문화로 등을 통해 방문할 수 있으며, 고속도로는 아산천안고속도로 아산현충사IC가 가깝다. 그리고 대중교통은 장항선 철도 및 수도권전철 1호선 온양온천역을 이용할 수 있다.","<a href=""http://xn--hy1b45civtirab620h.kr/"" target=""_blank"" title=""새창 : 홈페이지로 이동"">온양온천랜드.kr</a>"
온양 청국장집,2363744,음식,음식점,한식,,충청남도,126.9990603899,36.7823342236,"온양관광호텔 맞은편에 위치한 음식점이다. 냄새 없는 청국장으로 소문이 난 ‘온양 청국장집’으로, 여러 차례 TV에도 소개가 된 곳이다. 흔히 청국장 하면 떠오르는 쿰쿰한 냄새와는 다른 구수한 냄새가 난다. 인기 메뉴는 청국장 보쌈 정식이다. 청국장 보쌈 정식을 시키면 무생채, 깻잎장아찌, 시금치무침, 동치미, 미역줄기볶음, 양배추찜, 손두부까지 10가지가 넘는 반찬들이 차려진다. 상 위에 올라온 반찬들은 미역이나 멸치 등 몇 가지를 빼면 대부분 농사지은 것으로 만든다. 두부도 아침마다 직접 만들어 고소하다. 청국장은 어머니가 하시던 전통 방식 그대로 띄운다. 커다란 가마솥에 장작으로 불을 지피고 7시간에 걸쳐 콩을 삶으며, 7시간 내내 저어주는 노고를 하루도 거르지 않는다. 콩을 삶을 때 넣는 뽕나무는 당뇨나 고혈압에도 좋지만, 콩의 독성 물질을 제거하고 담백한 맛을 더 살려준다고 한다. 이후 뜨끈한 구들장에서 3일 동안 청국장을 발효시키는데, 이때 온도가 청국장의 냄새를 좌우한다. 온도가 조금만 틀어져도 쿰쿰한 냄새가 나기 때문에 계절마다 온도와 습도 조절에 온 힘을 쏟는다.",
온양가,3102086,숙박,숙박시설,한옥,,강원특별자치도,128.1655476914,37.6243138424,"강원도 횡성 1호 한옥스테이 온양가는 깨끗한 자연 속 쉼과 치유의 에너지가 가득한 공간으로, 옛 한옥을 리모델링하여 편의성을 높였다. 방 2개, 화장실 2개, 거실, 주방 구조로 최대 7인까지 묵을 수 있다. 아침마다 온갖 새소리에 잠을 깨고 밤에는 쏟아지는 별빛을 감상할 수 있다. 편백욕조에서 사우나를 하며 피로를 풀 수 있고, 넓은 잔디밭에서 전통놀이도 즐길 수 있다. 여름에는 숙소 바로 앞 청정 개울에서 물놀이를 할 수 있다.","<a href=""https://onyang.imweb.me"" target=""_blank"" title=""온양가(으)로 이동"">https://onyang.imweb.me/</a>"
온양관광호텔 온천탕,2037031,인문(문화/예술/역사),휴양관광지,온천/욕장/스파,http://tong.visitkorea.or.kr/cms/resource/18/2037318_image2_1.jpg,충청남도,126.9989798179,36.7832035657,"온양관광호텔의 온천수는 마니타온을 함유한 라듐온천으로 온천공에서 직접 공급되는 57℃의 고열 온천으로 약알칼리성 온천수이다. 온천수의 주요 성분은 칼슘, 라듐, 마그네슘 등의 성분이 골고루 함유되어 있으며 온천수의 주요 효능으로는 피부 노화 방지 및 갱년기 장애 예방, 당뇨병의 예방과 치유, 항암과 암 치료, 피로 해소 및 스트레스 해소, 위장병 치유, 성인병 예방과 치유, 신경통, 류머티즘, 습진, 피부병, 냉증, 부인병 등에 좋다.","<a href=""http://www.onyanghotel.co.kr/"" target=""_blank"" title=""새창: 온양관광호텔 홈페이지로 이동"">http://www.onyanghotel.co.kr/</a>"
온양도자기,132581,쇼핑,쇼핑,전문매장/상가,http://tong.visitkorea.or.kr/cms/resource/36/1963336_image2_1.jpg,충청남도,126.9192867604,36.7922733404,"1987년 국내 최초로 핸드페인팅제품 개발을 시작으로 온양도자기는 국내 최고급, 최대규모의 호텔과 식당에서 사용하고 있는 그릇을 전문 생산업체다. 사업확장에 힘입어 가정용 도자기까지 생산하여 본격적인 공급을 하고있다.다양한 가격대, 섬세한 디자인, 뛰어난 실용성으로 좋은 제품보다는 고객이 감동하는 제품으로 인정받았다.<br>","<a href=""http://www.onyangchinaware.co.kr"" target=""_blank"" title=""새창: 온양도자기 홈페이지로 이동"">www.onyangchinaware.co.kr</a>"
온양도자기(인주면),1966706,쇼핑,쇼핑,전문매장/상가,http://tong.visitkorea.or.kr/cms/resource/33/1963333_image2_1.jpg,충청남도,126.8812888285,36.8423974516,"1987년 국내 최초로 핸드페인팅제품 개발을 시작으로 온양도자기는 국내 최고급, 최대규모의 호텔과 식당에서 사용하고 있는 그릇을 전문 생산업체다. 사업확장에 힘입어 가정용 도자기까지 생산하여 본격적인 공급을 하고 있다. 다양한 가격대, 섬세한 디자인, 뛰어난 실용성으로 좋은 제품보다는 고객이 감동하는 제품으로 인정받았다.","<a href=""http://www.onyangchinaware.co.kr"" target=""_blank"" title=""새창: 온양도자기 홈페이지로 이동"">www.onyangchinaware.co.kr</a>"
온양민속박물관,130063,인문(문화/예술/역사),문화시설,박물관,,충청남도,127.0061678147,36.7921443303,"온양민속박물관은 우리나라 최초의 사립 민속박물관으로 우리 전통문화의 아름다움과 우수성을 알리기 위해 1978년 개관하였다. 전체 대지는 72,727㎡의 규모이며 이타미준의 국내 첫 번째 건축물인 구정 아트센터를 포함하여, 3개의 상설전시실, 1개의 특별전시실, 야외전시장 등으로 구성되어 있다. 옛 선조들의 지혜와 품격이 담긴 생활품 2만여 점을 소장하고 있으며, 전시 및 다양한 교육 체험 프로그램, 공연 등의 문화행사를 체험할 수 있다.<br>","온양민속박물관 <a href=""http://www.onyangmuseum.or.kr/"" target=""_blank"" title=""새창 : 온양민속박물관 홈페이지로 이동"">http://www.onyangmuseum.or.kr</a>"
온양온천시장,132495,쇼핑,쇼핑,5일장,http://tong.visitkorea.or.kr/cms/resource/70/3060070_image2_1.jpg,충청남도,127.0043015565,36.7833480876,"역사와 전통이 함께하는 아산의 대표 핫플레이스 온양온천전통시장은 매월 4일과 9일에 장날이 열린다. 아산 경찰서 골목에서 시장교까지 500m 구간에 시장이 형성되며 아산과 인근 예산,   공주 등의 주민까지 장을 보러 오는 곳이다.  주변지역에서 생산되는 쌀, 과일(포도, 배, 감, 사과, 수박, 딸기 등), 마늘, 고  추, 축산물, 민물고기, 약재 등, 농·수·축산물과 의류, 잡화, 먹거리 등이 있어   무엇이든 살 수 있어 쇼핑하기 편리한 곳이며 수질 좋은 온양온천이 있어 장을 보고 따뜻한 온천욕을 하고 가기 좋은 장터이다. 소원분수 ‘건강의 샘’에서는 족욕을 할 수 있다.","<a href=""https://blog.naver.com/onyangmarket"" target=""_blank"" title=""새창: 온양시장 블로그로 이동"">https://blog.naver.com/onyangmarket</a><br><a href=""https://www.instagram.com/onmarket2023""target=""_blank"" title=""새창 : 인스타그램 이동"">https://www.instagram.com/onmarket2023</a>"
온양온천지구,125856,인문(문화/예술/역사),휴양관광지,온천/욕장/스파,,충청남도,126.9995242099,36.7833257842,"온양온천은 국내에서 기록상 가장 오래된 온천으로 백제시대, 신라시대를 거쳐 그 역사가 1,300여 년에 이른다고 한다. 실제 온천탕으로 기능을 수행해 온 것만도 약 600여 년이 된다는 곳이다. 특히, 조선시대에는 세종대왕을 비롯해 세조, 현종, 숙종, 명종, 영조, 정조 등 여러 임금들이 온궁을 짓고 휴양이나 병의 치료차 머물고 돌아간 기록과 유적들이 지금까지도 남아 있다. 이 온천은 용출되는 온천수의 수온이 57℃ 내외로 고열온천이다. 온천수의 주요 성분은 마니타온을 함유한 라듐온천이며 약알카리성을 지닌 양질의 수질과 풍부한 수량이 자랑이다. 신경통, 관절염, 피부병, 위장병, 고혈압 등 각종 성인병과 피부미용에 효과가 매우 크다고 알려져 있다. 온천수의 수질이 뛰어날 뿐만 아니라 온양관광호텔, 그랜드관광호텔, 온양프라자호텔, 인터파크호텔, 뉴코리아관광호텔 등의 5개 호텔과 120여 개소에 달하는 숙박시설과 온천탕들이 집중적으로 모여있어 많은 관광객이 찾아오는 온천지역으로 손꼽힌다.
온양온천지구에는 온천뿐만 아니라 온천 용출을 상서롭게 여겨 세조가 세운 '신정비'와 장헌세자(사도세자)가 무예 연습하던 곳을 기리기 위해 세운 '영괴대' 등의 문화재가 있다.","<a href=""https://bit.ly/3y2udTp""target=""_blank"" title=""새창: 아산문화관광"">https://www.asan.go.kr/tour/</a>"
