title,contentid,cat1,cat2,cat3,firstimage,region,mapx,mapy,overview,homepage
천상현의 천상 가평멋집,3410330,음식,음식점,중식,http://tong.visitkorea.or.kr/cms/resource/78/3410178_image2_1.jpg,경기도,127.513093861,37.6881442759,"천상현의 천상 가평멋집은 20년 4개월 동안 다섯 분의 대통령을 모셨던 천상현 前) 청와대 총괄셰프의 중식당으로, 색다른 별미를 경험할 수 있는 곳이다. 가족 간의 친목행사와 기타 우정과 화합의 장소로서 사랑받고 있으며, 인근에 위치한 가평베고니아새정원, 가평크루즈, 신비동물원, 아쿠아가든과 함께 건전한 볼거리와 먹거리를 제공하는 가평의 대표적인 명소로 자리매김하고 있다.","홈페이지 <a href=""http://www.theoceanresort.co.kr/"" target=""_blank"" title=""새창 : 천상현의 천상 가평멋집 홈페이지로 이동"">http://www.theoceanresort.co.kr/</a>"
천생산,2736676,자연,자연관광지,산,http://tong.visitkorea.or.kr/cms/resource/41/3349241_image2_1.jpg,경상북도,128.4651234051,36.0966446591,"구미시 신동, 황산동, 금전동, 장천면에 걸쳐 산자락이 이어진 산이다. 해발 407m로, 동쪽에서 보면 산의 형상이 하늘 天자로 보인다. 뿐만 아니라 정상의 산봉우리가 일자형으로 특이한 모습을 하고 있어, ‘하늘이 내놓은 산’이라는 뜻을 가진 천생산이라 불린다. 금오산성과 더불어 낙동강을 끼고 동서로 마주하면서 가산산성과 연결되는 국방 요충지이다. 천생산에는 천생산성과 유아숲체험원이 있어 어린이 동반 숲체험을 하기에 좋다.",
천생산성산림욕장,2736683,자연,자연관광지,자연휴양림,http://tong.visitkorea.or.kr/cms/resource/33/2736933_image2_1.JPG,경상북도,128.4481219226,36.1040879445,"해발 407m이며 산봉우리가 일자형으로 특이한 모습을 지닌 천생산에 조성된 신림욕장이다. 사면이 석벽으로 조성된 천생산성은 금오산성과 함께 외적의 침입 시 국방의 요충지 역할을 했다. 임진왜란 때에는 홍의장군 곽재우가 이곳에서 왜군과 수많은 전투를 치렀고 그때의 유적이 아직도 많이 남아 있다. 산 중턱에는 산림욕장이 있고, 산 입구에는 한여름에도 시원한 바람이 나오는 얼음골이 있다. 가족과 함께 숲과 유적을 돌아보며 힐링할 수 있는 최적의 장소다.",
천서리 막국수촌,612541,인문(문화/예술/역사),체험관광지,이색거리,http://tong.visitkorea.or.kr/cms/resource/89/3382189_image2_1.jpg,경기도,127.5475573261,37.4029002096,"천서리란 지명은 신래천[神來川] 서쪽에 있는 마을이라는 데서 유래하였다. 천서리 막국수촌은 사적으로 지정된 파사산성 자락에 있는 막국수촌으로 전국적으로 알려져 있어, 많은 사람들이 찾는다. 먹을수록 살아나는 칼칼한 매운맛이 입맛을 당겨 개운한 것이 일품이다. 천서리 막국수는 꿩고기 끓인 물과 동치미국물을 차례로 섞어 만든 냉육수가 특징이다. 이러한 특유의 냉육수에 메밀이 어우러져 특유의 맛을 자아내는 것이다. 메밀은 경기도나 강원도 산간지방에서 많이 재배되는 식품으로 예부터 영양이 좋은 식품으로 알려져 산후 음식으로 미역국보다 메밀국수를 먼저 먹기도 하였다.",
천서리막국수,2834764,음식,음식점,한식,http://tong.visitkorea.or.kr/cms/resource/47/2834747_image2_1.jpg,경기도,127.139684393,37.2623174223,"천서리 막국수는 경기도 용인시 기흥구에 있는 막국수 맛집으로, 국물이 진하고 시원한 맛이 특징이다. 비빔막국수, 동치미 물 막국수, 온 막국수가 있으며 막국수와 함께 나오는 백김치와 무김치가 별미다. 또한, 사이드 메뉴로 메밀 왕만두를 곁들어 즐길 수 있다. 계산대에서 검은콩 엿도 판매하고 있으며 겨울에는 왕갈비탕을 판매한다. 인근에 레이크사이드CC가 있어 골퍼들이 즐겨 찾는 맛집이다.
※ 반려동물 동반 불가",
천선식당,133783,음식,음식점,한식,,강원특별자치도,128.6240065354,38.0688849367,양양에서 맛볼 수 있는 뚜거리탕은 집에서 손수 만든 재료로 조리하여 구수하고 칼칼한 맛은 일품이며 9월~10월에는 연어회나 연어구이를 맛볼 수 있다.<br>,
천성사,482081,인문(문화/예술/역사),역사관광지,사찰,,경상북도,128.783993063,36.939193394,"천성사는 문수산에 자리한 한국불교 태고종 소속의 사찰이다. 근세에 창건된 사찰이여서 봉화지역의 축서사나 각화사에 비하여 규모가 작다. 하지만 경내의 무량수전에는 통일신라 말기의 불상으로 추정되는 석불입상이 봉안되어 경북도유형문화재로 지정되어 있고, 또한 삼층석탑이 있다. 특히 이곳을 찾는 불자들의 다양한 기도 영험이 알려지면서 먼 곳에서부터 병을 치유하기 위한 기도나 학업성취를 위해 공부를 하러 절을 찾는 이들이 많은 곳이다. 주지 경운스님에 따르면 은사인 완휴당스님의 스승이셨던 박대은스님의 은사가 환암스님이였다고 하며 그 계보를 잇고 있는 사찰로서 자부심을 갖고 있다고 말한다.

* 창건배경 및 역사
천성사는 근대에 창건된 사찰로 1952년 이화성스님이 세운 절이다. 2001년 석조여래입상을 모신 산신각 앞의 당우인 무량수전의 지붕이 풍우로 훼손되자 이에 주지인 경운스님이 불사를 시작하여 현재의 무량수전을 신축하고 범종을 조성하였다. 무량수전에 봉안된 석조여래입상과 경내의 삼층석탑도 이화성 스님이 주지로 주석할 당시 봉화군내의 절터에서 이건해 온 것이다.","<a href=""http://tour.gb.go.kr/main.do""target=""_blank"" title=""새창: 경북나드리"">http://tour.gb.go.kr/main.do</a>"
천성산,126045,자연,자연관광지,산,,경상남도,129.1183934621,35.4116702493,"해발 920m 높이의 명산으로 양산시 소주동, 평산동의 웅상지역과 상북면, 하북면의 경계를 이루고 있다. 천성산은 예로부터 깊은 계곡과 폭포가 많고, 경치가 빼어나 소금강산이라 불렸으며 원효대사가 이곳에서 당나라에서 건너온 1천여 명의 스님에게 화엄경을 설법하여 모두 성인이 되게 하였다고 전해져 천성산이라 불렀다고 한다.
천성산은 봄이면 진달래와 철쭉꽃이 장관을 이루고, 화엄늪과 밀밭늪은 희귀한 꽃과 식물(끈끈이 주걱 등), 곤충들의 생태가 잘 보존되어 있어 세계적인 생태계의 보고이다. 천성산 산나물은 임금님의 수라상에 진상할 정도로 그 맛이 일품이며, 가을이면 긴 억새가 온 산을 뒤덮어 환상의 등산코스로 각광받고 있다.
천성산은 기존의 원효산(920m)과 천성산(812m)을 명칭 변경하여 천성산 제1봉과 제2봉으로 각각 부르게 되었고, 예전에는 원적산이라고도 불리었다. 천성산은 양산시 중앙부를 남북으로 뻗은 정족산 줄기의 지맥에 해당하는데, 이 산줄기를 따라 양산시가 동·서로 나누어져 있으며, 회야강의 발원지이기도 하다. 천성산에는 원효암을 비롯하여 홍룡사·성불사·내원사 등이 있다.
특히 천성산의 정상은 한반도에서 동해의 일출을 가장 먼저 볼 수 있는 곳으로 이름이나 전국에서도 해돋이 광경을 보기 위해 많은 관광객이 찾고 있는 곳이기도 하다.",
천성암(경산),482086,인문(문화/예술/역사),역사관광지,사찰,,경상북도,128.7756326172,35.9796720152,"예부터 영남 지방의 명산이라 불리는 팔공산에 위치한 천성암은 통일 신라 시대 의상대사(625~702)가 창건하였다고 전해지는 사찰로 창건 시기에 대한 문헌이나 유물은 유존하지 않는다. 천성암에는 사리굴 전설이 전해지는데, 창건 당시 천성암에는 하루에 한 사람만 먹을 수 있는 양의 쌀이 나오는 바위 굴이 있었다고 한다. 주지는 매일 같이 나오는 쌀로 부처님께 공양을 올렸고 이로써 큰 불편함 없이 지냈다고 한다. 이후 주지가 바뀌었는데 새로 온 주지는 매일 한 끼 정도의 쌀만 나오는 데 대하여 욕심을 품고 하루는 큰 막대기로 바위 구멍을 팠다. 그러자 구멍 속에서 쌀 대신 구정물이 나왔다고 한다. 현재 그 자리에는 용왕당이 있다. 
천성암에 대한 기록은 6·25전쟁 직후 처음 확인되었으며, 주불전인 극락전을 비롯하여 산령각, 자광전, 요사 등의 전각과 선묘정이라고 칭해지는 우물, 의상대사가 심었다고 전하는 천도복숭아나무, 참선바위에 있는 작은 규모의 칠층탑이 있다. 극락전은 정면 3칸, 측면 2칸의 맞배 기와지붕 구조로 아미타불상을 주존불로 지장보살상과 관음보살상을 협시로 봉안하고 있다. 극락전에는 닫집이 따로 없고 후불탱화 3점이 봉안되어 있다. 산령각은 정면과 측면이 각각 1칸인 맞배 기와지붕 구조로, 산신이 호랑이를 타고 있는 신중탱화 등 2점의 탱화가 조성되어 있다. 이 외에 정면 3칸, 측면 1칸의 요사와 패널로 건축한 요사 2동이 있다. 의상대사가 식수로 쓰던 선묘정은 겨울에도 도롱뇽이 서식한다고 한다.",
천성항 방파제등대,2744560,자연,자연관광지,등대,http://tong.visitkorea.or.kr/cms/resource/01/2744901_image2_1.jpg,부산광역시,128.8111251116,35.0303379018,"부산 가덕도는 2010년 이전에는 배를 타고 들어가야 했지만, 부산 신항과 거가대교가 생기면서 자동차로 오갈 수 있다. 
가덕도에 위치한 천성항 방파제 등대는 부산광역시의 기념물인 천성진성의 망루를 형상화한 조형 등대로, 일명 ‘망루등대’라고 불린다. 국가 어항인 천성항을 드나드는 선박의 안전 항해를 위해 등대 불빛을 밝히고 있다. 방파제 곳곳에 천성항을 상징하는 다양한 조형 작품이 설치되어 있는데, 주로 갈매기를 귀엽게 형상화했다. 천성항의 명물 ‘핑크갈매기’는 인기가 특히 좋다. 또한 어둠이 찾아오면 물고기 모양의 가로등에 하나, 둘 불이 들어와 디자인 등대의 매력을 더한다.",
천수만 해안길,2716756,추천코스,힐링코스,힐링코스,http://tong.visitkorea.or.kr/cms/resource/84/2716584_image2_1.jpg,Unknown,0.0,0.0,"천수만 해안길은 겨울 철새와 겨울바다, 갯벌, 겨울별미 등을 만날 수 있는 해안도로다. 이런 이유로 천수만으로 시작되는 이 해안길은 겨울에 더욱 여행맛을 느끼게 하는 곳이다. 
청명한 겨울 서해바람을 느끼며 시베리아에서 날아온 철새들의 화려한 군무 직관은 물론 천수만에서만 볼 수 있는 희귀조류 흑두루미, 천연기념물 보호종인 황새, 노랑부리저어새, 독수리까지 다양하게 관찰할 수 있다. 여기에 멋스러운 서해 낙조까지 만끽할 수 있다. <br/>
ㆍ코스 정보 : 충남 서산시 부석면 천수만로~홍성군 서부면 남당항로(약 15.6km)<br><br>
※ 하단의 지도를 확대하여 코스별 상세 위치를 확인할 수 있습니다.<br>
　 지도상의 코스가 겹치는 경우 지도를 확대하여 확인해주세요.<br>
　 (원하는 위치에서 마우스 휠 또는 손가락을 이용하여 지도 확대보기가 가능합니다.)",
천수만(철새도래지),127972,자연,자연관광지,자연생태관광지,,충청남도,126.381970429,36.6209087606,"천수만은 서해 중에서 충남 육지부와 안면도 사이에 위치한 만입 지형이다. 이곳에는 아름다운 철새들의 모습을 관찰할 수 있는 세계적인 철새도래지가 자리하고 있다.
지난 1984년 간척사업으로 천수만 일대에 방조제가 만들어지면서 과거 갯벌이던 곳에 인공 담수호인 간월호, 부남호와 대단위 농경지(6,400ha)가 형성되었다. 이 일대는 시베리아나 만주 등지에서 동남아시아를 오가는 철새의 주요 이동 경로이며, 서해의 영향으로 비슷한 위도의 내륙보다 겨울철 평균 기온이 1℃ 가량 높다. 게다가 간척사업으로 인해 벼를 재배하는 대단위 농경지가 들어서면서 추수 후에 남겨지는 곡식들이 겨울 철새들의 좋은 먹이가 되어 철새도래지로 적합한 조건을 두루 갖추게 되었다. 그러면서 200여 종에 가까운 많은 종류의 철새를 한 장소에서 관찰할 수 있는 곳이 되었다. 겨울철에는 오리, 기러기류가 찾아오는데 특히 가창오리는 전 세계 개체수의 90% 이상이 모인다. 또한 황새, 노랑부리저어새, 혹고니, 재두루미 등 많은 멸종위기종이 천수만에서 발견되고 있다. 이러한 새들이 떼 지어 날아오르는 모습은 가히 장관이다.
새들은 주로 새벽이나 저녁에 먹이를 찾아 이동하기 때문에 이 시간에 관찰하는 것이 좋다. 그리고 소중하고 아름다운 철새를 계속 관찰하고 보존하기 위해서는 시각과 청각이 예민한 새들을 배려하여 너무 가까이 접근하지 말고 망원경 등의 관측 장비를 갖추고 빨강, 노랑, 흰색 등의 색깔의 옷과 고성방가를 피해야 한다. 또한 자동차에서 내리지 않고 관찰하는 것도 좋은 방법이다. 주변에는 창리포구, 당암포구 등이 있다.","<a href=""https://birdland.seosan.go.kr/"" target=""_blank"" title=""서산 버드랜드 홈페이지로 이동"">https://birdland.seosan.go.kr/</a>"
천수만권역상황오토캠핑장,2729622,레포츠,육상 레포츠,"야영장,오토캠핑장",http://tong.visitkorea.or.kr/cms/resource/97/2729497_image2_1.jpg,충청남도,126.4765072911,36.5845867841,"상황오토캠핑장은 홍성 군청을 기점으로 22㎞가량 떨어진 서산 A지구 방조제와 남당항 사이에 위치해 있다. 자동차 야영장 41면을 갖추고 있으며 바닥은 모두 잔디로 이뤄졌다. 사이트 크기와 개수는 가로 8m 세로 10m가 14면, 가로 7m 세로 10m는 19면, 또 가로 8m 세로 7m는 8면이다. 개인 트레일러와 개인 카라반 입장도 가능하다. 평일 주말 구분 없이 연중무휴 운영한다. 캠핑장 인근에 남당항, 사산방조제, 간월도선착장 등 유명 관광지가 있고 남당항을 찾으면 여러 가지 해산물도 맛볼 수 있다.",
천수만꽃게장,2734945,음식,음식점,한식,http://tong.visitkorea.or.kr/cms/resource/28/2735128_image2_1.jpg,충청남도,126.3327165475,36.6209356936,"천수만 꽃게장은 평일 오후 3시에 문을 닫는다. 오후 3시 이후에는 이곳 대표가 직접 국내산 꽃게를 손질하며 간장에 달이는 시간이기 때문이다. 대표 메뉴는 게국지인데, 세트로 주문하면 풍성하다. 게국지를 비롯해 간장게장, 양념게장, 새우 장, 생선구이, 공깃밥이 함께 상에 오르는 덕분이다. 간장게장, 양념게장, 간장 새우를 포장 주문할 경우 할인해 준다.",
천수만의 자연을 체험하다,1889547,추천코스,나홀로코스,나홀로코스,,Unknown,126.5488417988,36.7129010308,급한 마음을 잠시 접고 여유를 갖고 바라보면 서산은 뽐내지 않으면서도 기품 있는 아름다움을 보여준다. 둘레 1.8km에 이르는 해미읍성은 평지에 축조된 석성으로 성벽을 따라 걸으며 옛 정취를 느껴 볼 수 있는 곳이다. 바다를 향해 서 있는 간월암의 독특한 풍광과 영주 부석사와 유래를 같이 하는 부석사의 고즈넉함도 즐겨보자.,
천수식당,133307,음식,음식점,한식,,전라남도,127.4537598294,35.166556823,"구례교 인근 섬진강 변에 위치한 한식 전문점이다.<br>이 집의 대표 메뉴는 민물 참게, 민물 새우, 싱싱한 야채를 넣고 끓인 민물 참게탕이다.<br>깔끔하고 시원한 맛이 일품이며 여러 매체에도 소개되었다. 메기탕 또한 인기 메뉴이며, 이 외에도 민물고기를 이용한 다양한 음식들을 맛볼 수 있다.",
천수식당,2894281,음식,음식점,한식,http://tong.visitkorea.or.kr/cms/resource/65/2894265_image2_1.jpg,경상남도,128.0837147743,35.1972588581,"진주에 위치한 비빔밥과 석쇠 불고기 전문점 천수식당이다. 메뉴로 국내산 한우가 들어간 비빔밥, 불고기, 육회가 있다. 비빔밥 주문 시 콩나물과 무가 들어간 매콤한 선짓국이 함께 제공되며 불고기는 조리되어 접시에 담겨 나온다. 중앙시장 내 육회 맛집으로 소문난 식당이다. 석쇠불고기는 특유의 불향과 더불어 짭조름한 맛이 입맛을 자극한다. 맛있지만 가격까지 착한 육회비빔밥이다. 육회 비빔밥은 반찬과 같이 나온 선짓국에서 고수의 향기가 난다. 반찬들이 정갈하면서 소박하고 비빔밥과 잘 어울린다. 육회를 저렴하게 포장해갈 수 있다. 별도의 주차장이 없어 인근 유료주차장에 주차할 수 있다. 진주시 전통예술 회관이 인접해 있어 함께 둘러보기 좋다.",
천수제면소,2904169,음식,음식점,한식,http://tong.visitkorea.or.kr/cms/resource/47/2904147_image2_1.jpg,경상북도,128.3828004811,35.9843058983,"천수제면소는 경상북도 칠곡군 기산면 죽전리에 있다. 현대적인 외관과 깔끔한 분위기를 연출하는 인테리어가 눈에 띈다. 내부에는 단체석이 마련되어 있어 각종 모임에 적당하다. 대표 메뉴는 특제 양념에 12시간 숙성한 후 요리하는 수제 돼지갈비 한판이다. 이 밖에 칠곡 벌꿀비빔면, 순두부국수, 생면잔치국수, 냉국수, 날치알주먹밥 등이 준비되어 있다. 왜관IC에서 가깝고, 주변에 칠곡호국평화기념관과 송정자연휴양림이 있다.","<a href=""https://www.instagram.com/chunsu_noodle""target=""_blank"" title=""새창 : 업체인스타그램 이동"">https://www.instagram.com/chunsu_noodle</a>"
천아숲길[한라산둘레길 1구간],2661848,레포츠,육상 레포츠,트래킹,http://tong.visitkorea.or.kr/cms/resource/43/2661843_image2_1.JPG,제주특별자치도,126.4448212233,33.3956517291,"천아숲길은 천아계곡에서 임도삼거리-노로오름 삼거리-보림농장 삼거리까지 8.7Km의 구간으로 편도 4시간 정도 걸린다. 중간에 한대오름, 노로오름, 천아오름 등이 있고, 노로오름 인근 한라산 중턱 해발 1000고지 일대에 검뱅듸, 오작지왓이라고도 불리는 숨은물뱅듸가 있고, 무수천계곡으로 흘러가는 수자원의 보고인 광령천이 내려오는 곳에 천아수원지가 있으며 인근에 어승생수원지가있다. 왕복 거리가 상당함으로 편도 여행객은 버스를 타고 이동하는 것을 추천한다. 숲길 자체는 약간 난이도가 있어서 운동화나 등산화를 신는 것이 좋다. 
숲길을 들어가는 초입에서 천아계곡에 맞딱뜨리는데, 가을에는 이 계곡의 단풍이 빼어나게 아름다워 많은 이들이 찾는다. 천아숲길은 천아계곡을 건너야 하기 때문에 우천 후 2일간은 안정상의 이유로 입산이 통제된다.
천아수원지에서 계곡 앞까지 차량의 진입이 가능하나, 진입로 자체도 훌륭한 산책로이다.","<a href=""https://www.visitjeju.net/kr"" target=""_blank"" title=""새창 : 비짓제주 홈페이지로 이동"">https://www.visitjeju.net/kr</a>"
천아오름,1895611,자연,자연관광지,산,,제주특별자치도,126.443735199,33.3959877856,"어승생악 서쪽 2.5km 지점 신엄공동목장 안에 위치한 오름으로, 남쪽 봉우리를 중심으로 북서쪽으로 패어있는 소규모 말굽형 화구를 이루고 있다. 천아오름이라는 이름은 옛 지도에 이곳이 참나무봉우리로 표기된 것에서 따왔다. 해송이 주종을 이루며 잡목이 우거지고 꽝꽝나무가 많다. 
천아오름 동녘 자락에 속칭 무수내(무수천 상류)가 있고, 이 냇가에는 어승생저수지의 보조수원인 천아수원이 개발되어 있다. 제주시와 애월읍의 경계를 이루며 계곡 양안에서 우거진 온대림은 참꽃나무와 낙엽활엽수의 단풍 등이 있어 경치가 수려하다.
오름은 해발 80m로 걸어 올라가기 쉬우며, 굳이 오르지 않더라도 평탄하여 주변의 어승생악, 붉은오름 등을 관찰할 수 있다. 천아오름은 사유지이며 탐방로가 정비가 되어있지 않아 천아계곡까지만 탐방하는 것을 추천한다.","제주 문화관광 <a href=""https://www.visitjeju.net/kr/detail/view?contentsid=CONT_000000000500616"" target=""_blank"" title=""새창 : 제주 문화관광 사이트로 이동"">http://www.visitjeju.net/</a>"
천안 K-컬처박람회,2996478,인문(문화/예술/역사),공연/행사,박람회,http://tong.visitkorea.or.kr/cms/resource/49/3094049_image2_1.jpg,충청남도,127.2326089252,36.7773972648,"대한민국 중심 천안에서 개최되는 국내 최대 규모 한국문화엑스포이다. 독립기념관에서 'K- 컬처'와 관련된 다양한 축제, 공연, 전시, 체험, 컨퍼런스, 마켓 등이 운영된다. 해당 행사를 통해 볼거리 즐길거리는 물론, 광복이후 발전된 한류문화를 세계에 알리고자 한다.","<a href=""https://kcultureexpo.com/"" target=""_blank"" title=""새창 : 천안 K-컬처 박람회  페이지"">https://kcultureexpo.com/</a>"
천안 노은정,126985,인문(문화/예술/역사),역사관광지,유적지/사적지,http://tong.visitkorea.or.kr/cms/resource/50/565750_image2_1.jpg,충청남도,127.3189286925,36.7861422438,"노은정은 1689년 조선조 숙종 때 학자 김상기(본관이 안동이며 자는 정보, 호는 노은)가 건립한 천안시에서 가장 오래된 정자이다. 주위 경관이 수려하고 아름다움이 뛰어난 곳으로, 정자를 건립한 김상기가 학문을 연마하고 후진을 위해 힘쓰며 영조의 스승 경한재, 군수 김광수 함께 도학으로 벗을 하며 지내던 곳으로 1853년 중수 이후 몇 차례 중수하였다. 노은정은 300년전의 우리나라 전통의 건축양식을 보여 주는 귀중한 건물로써 기둥은 둥근형이며 재질은 괴목 혹은 싸리나무라고도 한다. 마루는 우물 마루를 깔았으며 정자의 각 기둥에는 수침을 막는 돌기 등을 사용해 안전을 도모했고, 정자 주변은 수령 300년의 고목 등이 정자를 에워싸고 있다. 정자의 아래는 화강암이 지반으로 받들고 있으며, 그 아래에 있는 도영암삭성대에는 송우암선생의 친필이 각명되었다.<br>","<a href=""http://www.cheonan.go.kr/tour.do"" target=""_blank"" title=""새창 : 천안시 문화관광 홈페이지로 이동"">http://www.cheonan.go.kr/tour.do</a>"
천안 두아람마을 [농촌전통테마],802420,인문(문화/예술/역사),체험관광지,전통체험,http://tong.visitkorea.or.kr/cms/resource/71/2522571_image2_1.jpg,충청남도,127.0758753854,36.6915849105,"보산원 1리는 남천안 I.C로부터 30분 거리에 위치하고 있어 서울 및 수도권에서 접근성이 양호하며, 대전시에서도 1시간 이내에 접근이 가능함. 천안 명물 호두과자의 본향 유물·유적지 많아 화려한 경관을 지닌 광덕천이 굽이굽이 흐르는 광덕산 아래 자리 잡고 있는 이곳은 반딧불이가 살아있는 청정지역으로 표고버섯, 느타리버섯, 더덕, 마늘, 감자 등 향토색 짙은 체험과 먹을거리들로 가득하다. 선덕여왕 때 자장율 [천안 두아람마을 호두]사가 창건했다는 광덕사 대웅전 앞에는 수령 400년 이상 된 천연기념물 호두나무가 호두과자의 본향임을 말해주고 있으며 고려사경(보물) 등 문화유적이 산재해 있다.",
천안 등촌샤브칼국수 두정점,2765514,음식,음식점,한식,,충청남도,127.1314775992,36.8336917635,"충남 천안시 서북구 두정동에 위치한 등촌샤브칼국수는 칼국수 맛집으로 유명하다. 느타리버섯과 미나리가 들어가 시원하면서도 얼큰한 국물이 일품인 버섯칼국수는 소고기를 추가하여 샤부샤부로도 즐길 수 있다. 칼국수를 먹고 나면 야채 볶음밥을 주문해 마무리하면 좋다. 인근에 태조산 유원지, 현충사 등의 관광지가 있고 경부고속도로와 두정역이 가깝다. 아산, 당진, 공주, 논산 등 사방으로 사통팔달해 지리적 여건이 좋아 지나는 길에 식사하고 가면 좋다.",
