title,contentid,cat1,cat2,cat3,firstimage,region,mapx,mapy,overview,homepage
흙이야기,1855534,음식,음식점,서양식,,전라남도,126.4153506763,34.7482086811,"조용하고 여유로운 영암군 삼호읍 F1 경기장 입구에 있는 흙이야기는 前 특급 호텔 주방장이자 VVIP를 위한 만찬을 담당하던 주방장이 모든 음식을 직접 만든다. 최고 주방장의 손길로 완성되어 나오는 스테이크와 파스타, 리조또는 보는 맛과 먹는 맛 모두를 즐겁게 한다. 점심 한정 비빔밥과 흑산도 인근에서 잡은 생 우럭탕도 일품이고 각종 커피, 가게에서 직접 만드는 전통차, 허브티, 주스 등을 가볍게 즐길 수 있다. 

흙이야기의 건물은 전체가 흙으로 지어져 있다. 여유 있는 주차공간과 건물 외부를 지나 들어오면 마치 민속촌에 온 것 같은 건물 내부가 펼쳐진다. 기왓장이 얹어진 담, 고 가옥 나무로 만들어진 테이블과 의자, 나무를 따라 주렁주렁 매달린 아름다운 등까지 현대와 전통이 어우러진 공간에서 감미로운 음악과 노래를 부를 수 있는 무대와 함께 최고의 경양식을 즐길 수 있는 곳이 바로 흙이야기이다.",
흙집섬진강풍경,2737382,레포츠,육상 레포츠,"야영장,오토캠핑장",http://tong.visitkorea.or.kr/cms/resource/42/2737642_image2_1.jpg,경상남도,127.6308243233,35.1849717127,"흙집 섬진강풍경은 지리산 자락로 화개장터와 섬진강이 한눈에 내려다보이는 곳에 위치해 있으며, 캠핑장과 펜션이 함께 있다. 흙벽돌이 아닌 황토 흙을 뭉쳐 한 땀 한 땀 정성으로 사장님이 직접 지은 캠핑장이다. 총 6개의 흙집이 있고, 자연 그대로의 모습과 체험을 할 수 있는 예스러움을 가지고 있는 캠핑장이다. 섬진강풍경캠핑장의 제일 좋은 곳은 샤워장과 화장실이다. 깨끗함과 청결함은 기본이고, 화장실에 설치되어 있는 비데와 샤워장의 비품들도 깔끔하다. 캠핑장에는 자연스러움을 살린 돌수영장이 있어 아이들이 놀기 좋고, 텃밭에는 방울토마토와 복숭아, 상추, 깻잎 등 여러 가지 채소들이 있는데 캠핑장을 이용하는 사람들에게 무료로 제공한다.","<a href=""http://mudhouse.maan.kr/"" target=""_blank"" title=""새창 : 흙집섬진강풍경 사이트로 이동"">http://mudhouse.maan.kr/</a>"
흙토담골,134345,음식,음식점,한식,http://tong.visitkorea.or.kr/cms/resource/23/1956823_image2_1.jpg,경기도,127.3718488793,37.4779605271,"흙토담골은 경기도 광주시 퇴촌에 위치한 한정식 전문점이다. 주변에 산이 있어 공기가 좋으며, 기와집과 초가집이 대청마루로 이어진 전통 한옥 건물로 식사의 즐거움뿐 아니라 여행을 온 듯한 정취도 느낄 수 있다. 한옥뿐 아니라 잘 꾸며진 정원과 옛 가구, 병풍, 난, 놋그릇 등과 한지에 꽃잎과 나뭇잎을 넣어 압축 가공한 흙토담골만의 벽지가 독특한 분위기를 살려준다. 
대표적인 메뉴인 토담골 한정식은 강원도 필레 암반 온천수 돌솥밥과 석쇠구이 불고기, 국산 꽃게 양념게장, 육회, 된장찌개, 북어조림, 도토리묵과 생선호박전 등이 나오는 토담골 한정식과 꽃게 간장게장 정식, 보리굴비 정식이 있다. 특히 김치는 매년 12월에 담가 앞마당의 김장독에 묻어 발효시킨 것으로 아삭아삭한 식감이 일품이다. 돌솥밥은 전라도 쌀에 강원도 필레약수물로 지어 노르스름한 색깔이 맛깔스럽고 고슬고슬하다.",
흠커피,2892469,음식,음식점,카페/전통찻집,http://tong.visitkorea.or.kr/cms/resource/60/2892460_image2_1.jpg,경기도,127.1851701895,37.5201800198,"경기도 하남시 춘궁저수지 앞에 위치한 홈커피는 베이커리 카페이다. 매장 뒤편에 정원이 있어 자연과 함께 여유를 즐길 수 있고, 3층에는 루프탑이 있어 야외에서 시원한 공기를 마시며 커피 한잔을 마실 수 있다. 홈커피는 신선한 뉴크롭의 생두를 엄선하여 매장에서 직접 로스팅을 하고, 좋은 품질의 재료를 이용하여 매장에서 직접 빵과 쿠키를 만들고 굽는다. 베이커리류는 당일 생산, 당일 판매를 원칙으로 하고 있다.
홈커피의 메뉴로는 우유와 생크림이 블랜딩 된 베이스에 생크림과 파에테포요틴이 올라가는 크리미라떼, 오트밀크와 생크림이 블랜딩 된 베이스에 생크림과 그레놀라가 올라가는 오트 크림 라떼, 매장에서 직접 로스팅한 신선한 원두로 내린 고소하고 은은한 산미의 아메리카노 등의 커피메뉴와 음료메뉴가 있다. 또, 휘낭시에와 소금빵이 들어가는 패키지도 판매하고 있다.","<a href=""https://www.instagram.com/hmmcoffee_roasters/""target=""_blank"" title=""새창 : 흠커피 인스타그램으로 이동"">https://www.instagram.com/hmmcoffee_roasters/</a>"
흥국사(고양),128871,인문(문화/예술/역사),역사관광지,사찰,http://tong.visitkorea.or.kr/cms/resource/76/1928876_image2_1.jpg,경기도,126.9399162296,37.663678368,"흥국사는 경기도 고양시 덕양구의 한미산기슭에 있으며 대한불교조계종 직할교구이다. 신라 문무왕 원년인 661년에 당대 최고의 고승이었던 원효가 북한산 원효암에서 수행하다가 약사여래를 만난 곳에 흥성암이라는 절을 지은 것이 흥국사의 시초라고 전해진다. 원효는 본전에 약사여래(중생의 질병을 고쳐주는 약사신앙의 대상이 되는 부처)를 봉안하면서 상서로운 기운이 일어난 곳이라 많은 성인 배출될 것이라는 뜻에서 흥성이라는 이름을 붙였다. 그 이후 조선 숙종 12년인 1686년에 중창하면서 다시 부흥하기 시작했다. 특히 영조의 생모인 숙빈 최 씨의 묘인 소녕원에 다녀오던 길에 이 절에 들렀다가, 직접 지은 시를 편액으로 만들어 내리고 숙빈 최 씨의 원찰로 삼으면서 영조와 정조 대에 크게 발전했다. 영조가 하룻밤 머문 후 절 이름은 흥국사로 개칭되었으며, 절이 자리 잡은 산도 원래 이름인 노고산에서 한미산으로 바뀌었다. 본전인 약사전 안에는 약사여래상과 정조 16년에 제작된 약사후불탱화가 있다. 극락구품도와 괘불 탱화가 경기도 유형문화재로, 약사전과 목조 아미타여래 좌상은 경기도 문화재자료로, 칠성각을 고쳐 지은 나한전이 고양시 향토문화재로 지정되어 있다. 이 가운데 극락구품도는 전체 그림을 아홉 개의 부분으로 나누어 극락을 묘사한 그림이다. 이 밖에도 신도들을 위한 다양한 법회를 주관하고 있으며, 부처의 뜻을 전하는 불교대학을 운영하고 있다. 템플스테이의 경우 당일형, 체험형, 휴식형으로 나누어져 있으며 숲 속을 거닐고 따뜻한 차와 함께 지친 몸과 마음을 치유할 수 있고 온전한 휴식을 취할 수 있다.","<a href=""http://www.heungguksa.or.kr/"" target=""_blank"" title=""새창: 흥국사 홈페이지로 이동"">http://www.heungguksa.or.kr</a><br />
<a href=""http://heungguksa.templestay.com"" target=""_blank"" title=""새창: 흥국사 템플스테이 홈페이지로 이동"">http://heungguksa.templestay.com</a>"
흥국사(남양주),125528,인문(문화/예술/역사),역사관광지,사찰,http://tong.visitkorea.or.kr/cms/resource/31/3077131_image2_1.jpg,경기도,127.0985650489,37.6845288008,"남양주 흥국사는 수락산에 있는 삼국시대 신라의 원광이 창건한 사찰이다. 화랑도의 세속오계를 만든 원관이 창건했던 당시에는 ‘수락사’라 불리었다. 그 후 1568년(선조 1) 선조가 생부인 덕흥대원군의 명복을 빌기 위하여 수락사에 원당을 짓고 ‘흥덕사’라는 편액을 하사하였다. 임진왜란 때 소실되었고 16대 왕 인조 때 중건되어 흥국사로 바꾸었다. 선조는 그의 아버지 덕흥대원군의 묘를 흥국사 근처에 세우면서 아버지의 극락왕생을 기원하는 의미를 담아 흥국사를 크게 중수했다고 한다. 그때부터 흥국사는 조선 왕실의 사찰로서 역할을 수행했다. 선조의 아버지 덕흥대원군의 묘소가 있어서 ‘덕절’이라고도 한다. 
흥국사에는 많은 문화재를 곳곳에서 볼 수 있다. 흥국사를 대표하는 문화재는 등록문화재인 ‘대방’이며, 이 대방의 흥국사라는 현판은 조선 고종의 아버지 흥선대원군이 직접 쓴 것이다. 흥선대원군의 글씨는 전각마다 등장한다. 영산전 현판과 주련, 만월보전 주련 등에도 흥선대원군의 흔적이 남아있어 고종 대까지 왕실의 사찰로서 그 명성을 유지했음을 알 수 있다. 경기도 문화재자료인 대웅보전은 흥국사의 중심 건물로 여러 번의 화재로 소실과 중수의 과정을 지나 지금에 이르렀으며, 대웅전 안에는 경기도 유형문화재 ‘목조석가삼존불좌상’이 있다. 또, 경기도 유형문화재 영산전과 영산전 내부에는 보물 ‘소조 석가여래 삼존 좌상 및 16나한상’이 있다.","<a href=""https://www.grandculture.net/namyangju/toc/GC08900974""_blank"" title=""새창 : 홈페이지로 이동"">https://www.grandculture.net/namyangju/toc/GC08900974</a>"
흥국사(여수),126782,인문(문화/예술/역사),역사관광지,사찰,http://tong.visitkorea.or.kr/cms/resource/84/3027284_image2_1.jpg,전라남도,127.7005442129,34.8211582573,"영취산 안에 자리한 흥국사는 이름에서 알 수 있듯이 나라의 융성을 기원하기 위해 건립된 사찰이다. '나라가 흥하면 절이 흥하고, 절이 흥하면 나라도 흥한다.'라는 뜻으로 나라의 번영을 기원하며 건립된 사찰이다.
여수국가산단 가까이에 위치한 흥국사는 보조 국사가 1,195년에 창건하였으며 경내에는 대웅전을 비롯하여 원통전, 팔상전 등 문화재가 배치되어 있다.
흥국사 대웅전은 빗살문을 달아 전부 개방할 수 있도록 한 것이 특징이며, 대웅전 후불탱화는 보물로 지정되어 있고 흥국사의 입구에 있는 홍교의 수려한 자태는 보물의 가치를 유감없이 보여준다.
그 외에도 대웅전후불탱 (영산회상도), 노사나불괘불탱, 수월관음도, 16 나한탱화, 목조석가여래삼존상, 여수흥국사 동종, 목조지장보살삼존상, 시왕상 일괄 및 복장유물 등 7점이 더 있다. 
흥국사는 임란 때 경내에 300여 명의 수군 승병이 있었던 곳으로 이곳에서 승병들이 훈련을 했던 곳으로 유명하다.
매년 4월 초순부터 한 달간은 흥국사 대웅전 뒤의 영취봉과 진달래봉으로 이어지는 능선은 온통 진달래의 군락이 봉오리를 터뜨리면서 장관을 이룬다.",
흥남해수욕장,126086,자연,자연관광지,해수욕장,http://tong.visitkorea.or.kr/cms/resource/94/3039994_image2_1.JPG,경상남도,128.7149048188,34.9599940242,"흥남해수욕장은 백사장 길이는 360m, 폭은 30m로 장목면소재지에서 외포길을 따라 6km 지점에 있다. 1989년 해안도로 확장 공사로 외포 포장길이 생기면서 알려지기 시작했다.
마을 앞쪽에는 고운 모래사장이 있으며 남쪽 해변에는 자갈돌이 깔려 있고, 경사가 완만하고 수심이 얕아 가족단위 피서지로 적합하다. 
앞바다에 소나무 숲이 우거진 이수도가 있어 해수욕과 함께 주변 경관을 조망하거나 낚시를 즐길 수 있고, 썰물 때면 얕아진 바닷물에서 작살로 도다리를 잡거나 대합, 비단조개 등을 채취할 수 있다.
멀리 부산이 바라다 보이고 태평양에서 불어오는 바람이 잔파를 일으키는 낭만적인 해수욕장으로 샤워장과 화장실 등 편의시설이 잘 갖추어져 있고 민박도 가능하다. 흥남해수욕장은 윈드서핑하기 좋은 해수욕장이다.
주변에 장목진객사, 구영등성, 구율포성, 이수도 패총 등 문화유적지와 옥포대첩기념공원, 대금산 등의 관광지가 있다.","▪ <a href=""http://tour.geoje.go.kr"" target=""_blank"" title=""거제시 문화관광 사이트로 이동"">http://tour.geoje.go.kr</a>"
흥덕반점,2020977,음식,음식점,중식,http://tong.visitkorea.or.kr/cms/resource/65/2003365_image2_1.jpg,경상북도,128.2030101875,36.602696024,"문경 시내 한편에 있는 전형적인 시골 중식당인 흥덕 반점은 소박한 외관을 가졌지만 나오는 메뉴만큼은 그렇지 않다. 담백한 춘장과 고기, 양파, 늙은 호박이 들어간 자장면도 인기지만 게와 홍합이 듬뿍 올라간 짬뽕이 이 집을 대표하는 메뉴이다. 저렴한 가격의 메뉴지만 양도 적지 않게 늘 곱빼기만큼을 제공하여 인기가 많다. 중국음식을 전문으로 하지만 한우소머리국밥과 수육도 판매하고 있다.",
흥덕사,488162,인문(문화/예술/역사),역사관광지,사찰,http://tong.visitkorea.or.kr/cms/resource/85/3375885_image2_1.JPG,전라남도,127.3443118002,34.811303235,"흥덕사는 고흥의 관문이라 할 첨산 아래에 위치해 있고 1929년에 기불대사가 초가로 지어 석로암이라 하다가 1962년 첨산사로 개칭하고 1973년에 확장하면서 극락전을 신축하고 사명을 흥덕사라 했다. 정면 3칸 팔작지붕의 극락전, 산신각, 2층 누각 형태의 종각, 요사, 해탈문, 강당 등이 있다.
절이 자리한 첨산은 이 지역의 명산으로서, 18세기 후반까지만 하더라도 북방 중턱에 낙안사, 남방 중턱에 흥양사가 있었으나 지금은 터만 남았다고 한다. 그래서 흥덕사가 창건된 지 얼마 지나지 않아 낙안사에 있던 미륵불이 절 부근까지 굴러 내려왔다는 말이 전한다.
흥덕사가 자리한 첨산은 오르막과 내리막이 반복되어 지루하지 않으며 능선에서는 넓은 들판과 멀리 여자만을 조망할 수 있다.",
흥덕향교,1624646,인문(문화/예술/역사),역사관광지,유적지/사적지,http://tong.visitkorea.or.kr/cms/resource/94/3362394_image2_1.JPG,전북특별자치도,126.6932068736,35.5263447834,"1621년(광해군 13) 창건되었고 1675년(숙종 1) 당시 흥덕현 유림들의 숙원으로 숙종의 어명에 의해 중건되었다. 자연경사를 따라 앞쪽에는 강학공간인 명륜당, 뒤쪽에는 문묘공간인 대성전을 두어 전학후묘를 이룸으로써 향교 건축의 전형적인 배치양식을 따랐다. 이곳에는 공자를 비롯하여 중국의 4성(안자·증자·자사·맹자), 중국 송대의 4현(주돈이·주희·정명도·정이천), 한국의 18현(설총·안향·김굉필·조광조·이황·이이·김장생·김집·송준길·최치원·정몽주·정여창·이언적·김인후·성혼·조헌·송시열·박세채)을 배향하고 있다. 향교 진입로에는 전라북도 유형문화재로 지정된 흥덕 당간지주(불화를 걸던 당간을 지탱하기 위하여 좌, 우에 세우던 기둥)가 있는데 근처에 고려시대까지 갈공사라는 사찰이 있었다고 한다.","<a href=""https://tour.gochang.go.kr/index.9is?iConUid=4028a69088fb2760018900a405a31bbf&contentUid=4028a690893f64f4018ba33f9100764a"" target=""_blank"" title=""새창 : 홈페이지로 이동"">tour.gochang.go.kr</a>"
흥룡사,129660,인문(문화/예술/역사),역사관광지,사찰,http://tong.visitkorea.or.kr/cms/resource/40/3024440_image2_1.jpg,경기도,127.4103058684,38.0715560678,"백운산 흥룡사는 봉선사의 말사로 이동면 도평리에 있는 해발 904m의 백운산에 위치하고 있다. 신라 말엽에 도선국사가 창건하였으며, 절터를 정할 때 나무로 만든 세마리의 새를 공중에 날려 보냈는데 그 중 한마리가 백운산에 앉아 그 자리에 절을 세웠다고 한다.
창건했을 때는 내원사라 하였고, 대웅전 등 법당이 4동에 이르는 대규모 사찰이었다. 1786년 중건하며 백운사라 이름을 고쳤다가 1922년 다시 중수하면서 흑룡사로 절 이름을 고쳤다. 
법당으로는 대웅전과 삼성각, 원통당이 있고 석불로 지장보살석조상과 도명존자상이 있다. 흥룡사 대웅전 앞으로는 5층 석탑과 석등이 위치하고 석탑 옆으로는 황금빛 옷을 걸치고 만면에 웃음을 짓고 있는 포대화상이 환한 웃음으로 반겨준다.
포화대상 옆으로는 샘터가 보이는데 ‘흥룡사 백운산 감로수’라고 쓰여있다. 흥룡사 백운산 감로수는 지하 200m에서 나오는 천연 암반수로서 그 물맛이 좋아 백운산을 찾는 많은 등산객들과 관광객들의 갈증을 풀어주는 시원한 약수이다. 
흥룡사 입구에는 향토유적인 ‘흥룡사 청암당 부도’가 있는데 이는 조선 인조26년 흥룡사의 암자인 보문암을 창건한 청암대사의 사리를 안치한 곳이다. 이 부도는 옥개가 팔각원당형의 기본을 따른 것으로 윗부분은 복연이 조각되어 있고, 탑신은 원형이며 보개는 없어졌다.
탑신에는 ‘청암당’이라 음각되어 있으며 각 부의 재료는 화강암이며 총 높이는 158cm이다. 현재 이 부도 옆에는 묘화당이라 새겨진 석종형의 부도가 나란히 서있으며, 탑신에 강희이십년이란 각자로 보아 숙종 7년에 건립되었다.
포천 백운계곡 국민관광지 주변에 위치한 흥룡사는 이동갈비촌과 백운계곡 등이 가까운 곳에 위치하고 있어 식사 후 산책 겸 조용하고 고즈넉한 산사를 둘러보는 것도 좋겠다.","▪ <a href=""https://www.pocheon.go.kr/ktour/index.do"" target=""_blank"" title=""새창: 포천시 문화관광 홈페이지로 이동"">https://www.pocheon.go.kr/</a>"
흥륜사(순천),488273,인문(문화/예술/역사),역사관광지,사찰,http://tong.visitkorea.or.kr/cms/resource/43/1971043_image2_1.jpg,전라남도,127.4939617751,34.9519566711,"순천 시내에 위치한 흥륜사는 대한 불교조계종 제19교구 화엄사 소속 사찰로 시민들의 휴식처인 죽도봉공원의 남쪽 사면에 위치한다. 과거 1984년 이전까지 국궁 활터로 사용되었던 곳에 새로이 건물을 이전하여 법당을 만들어 포교당을 조성했다. 절에서 전하기로는 조선시대 선조대에 창건되었다고 전하며, 임진왜란 당시 수군의 활터와 화엄사, 송광사, 선암사 3대 사찰의 대중과 승군의 최초의 본거지였다고 한다. 창건 및 연혁에 관한 기록은 없다. 해방 직후 대처승들이 이곳을 매도하여 약 20년 전까지 활터로 사용되었던 곳으로 활터가 북쪽으로 이전함에 따라 절을 세울 수 있었다고 한다.
지금의 건물은 전부 1986년 종원 스님의 중창 이후에 봉안한 것이다. 혜인, 목산 비구스님에 이어 비구니 선타스님이 주석하고 있으며, 화엄사의 포교당 역할을 하고 있다.
경내에는 크고 아름다운 벚꽃나무가 자리 잡고 있으며, 순천 동천이 한눈에 들어오며 밤이 되면 순천의 아름다운 야경을 조망할 수 있다. 흥륜사 주변에 죽도봉공원, 장대공원이 있어 사찰과 함께 산책을 즐기기 좋다.","<a href=""http://suncheon.grandculture.net/suncheon/search?keyword=%ED%9D%A5%EB%A5%9C%EC%82%AC"" target=""_blank"" title=""새창 : 홈페이지로 이동"">http://suncheon.grandculture.net/suncheon/search?keyword=%ED%9D%A5%EB%A5%9C%EC%82%AC</a>"
흥륜사(인천),1231032,인문(문화/예술/역사),역사관광지,사찰,http://tong.visitkorea.or.kr/cms/resource/38/3043938_image2_1.jpg,인천광역시,126.659251542,37.4166243183,"인천광역시 연수구 동춘동에 있는 흥륜사는 고려 시대 나옹화상이 절을 짓고 경관이 수려해 청량사라 이름 지은 것에서 유래된다. 청량사는 임진왜란 때 소실되어 340여 년의 세월 동안은 빈터로 남아 있었다. 이후 1927년 진명대사가 절을 짓고 인명사라고 부른 후, 1966에 법륜 종사가 주지로 부임하여 사찰을 크게 중흥시킨 후 절의 이름을 흥륜사로 바꾸었다. 흥륜사는 부처님의 진리를 널리 전해 국가와 국민을 부흥시킨다는 뜻을 담고 있다.  
옛 건물을 헐고 새로운 건물 8동을 세웠는데, 대웅전 내에는 부처님 진신사리를 모셨고, 목조 천수천안관음보살상, 목조 후불탱화, 아미타불, 신중탱화, 옥외 미륵대불, 세계 최초 청동 석가대탑 등을 소장하고 있다. 한국불교문화를 체험할 수 있는 템플스테이, 국제선원, 봉안당 등을 갖추어 한국 전통문화를 접하고 느낄 수 있는 사찰이다. 
이 외에도 돌로 만든 백팔계단을 올라 경내에 들어서면 확 트인 서해바다가 펼쳐지는데 인천대교를 끼고 해가 넘어가는 낙조 풍경이 일품이다.","<a href=""http://www.hrt.kr/"" target=""_blank"" title=""새창 : 흥륜사 홈페이지로 이동"">http://www.hrt.kr</a><br><a href=""https://www.yeonsu.go.kr/tour/tourism/mountain/mountain.asp?page=v&tour_idx=7&listCnt=&keyfield=&keyword=&gotopage=2&strCategory="" target=""_blank"" title=""새창 : 연수구청 사이트로 이동"">https://www.yeonsu.go.kr/tour</a>"
흥림산자연휴양림 (영양에코둥지),3072418,자연,자연관광지,자연휴양림,http://tong.visitkorea.or.kr/cms/resource/13/3072413_image2_1.JPG,경상북도,129.1126819604,36.7020101402,"풍림산에 위치한 영양에코둥지는 주민의 정서함양, 휴양 및 산림교육과 지친 도시민들의 치유의 공간 제공을 위하여 영양에코둥지와 영양 목재문화체험장으로 조성된 종합 산림휴양타운이다. 
5인, 6인, 8인 ,10인의 다양한 숙박시설이 있고 홈페이지를 통해 온라인 예약이 가능하다. 주요시설로는 산림문화휴양관, 테라스하우스 등 기본적인 휴양시설이 있다. 레포츠시설로는 짚코스터, 네트어드벤처가 있다. 목재문화체험관 및 전시장, 야외 목재체험 시설이 들어서 있어 대자연 속에서 자연의 소중함을 배우는 살아있는 교육의 장으로도 활용된다. 
멀지 않은 곳에 청록파시인 조지훈의 고향 마을이자 문학의 꿈을 키우던 주실마을이 있어 자연과 더불어 문학과 전통의 향기도 더불어 느낄 수 있다.","<a href=""https://www.foresttrip.go.kr/indvz/main.do?hmpgId=ID02030057"" target=""_blank"" title=""새창 : 홈페이지로 이동"">https://www.foresttrip.go.kr/</a>"
흥무공원,2756706,인문(문화/예술/역사),휴양관광지,공원,http://tong.visitkorea.or.kr/cms/resource/00/2756700_image2_1.jpg,경상북도,129.1951217672,35.8457950203,"김유신 장군묘에서 멀지 않은 곳에 피크닉 장소로 사랑받는 소공원이 있다. 흥무대왕으로 추존되었던 김유신 장군의 묘 인근에 있어 이름이 ‘흥무공원’이다. 김유신 장군묘 향하는 길이 ‘흥무로’였던 것처럼. 공원은 크지 않지만 넓은 잔디밭과 곳곳에 나무가 만들어주는 그늘이 있어 경주시민들이 애용하는 휴식 공간이며, 산책로도 잘 되어있어 힐링하기 좋은 장소이다.

(출처: 경주시 문화관광 홈페이지)",
흥무로 벚꽃길,2756694,자연,자연관광지,자연생태관광지,http://tong.visitkorea.or.kr/cms/resource/80/2756680_image2_1.jpg,경상북도,129.1963272414,35.8449423611,"흥무로 벚꽃길은 경주터미널에서 형산강을 건너는 서천교를 지나 첫 교차로에서 우회전하면 만날 수 있다. 이곳은 2007년 건설교통부에서 ‘한국의 아름다운 길 100선’ 가운데 하나로 선정했다. 아름다운 길로 선정된 이유는 봄날에 흥무로를 찾는다면 자연스레 알게 될 것이다. 도로 양쪽에 선 아름드리 벚나무가 가지끼리 맞닿아 하늘을 가려 아름다운 벚꽃터널이 완성된다. 벚꽃 만발하는 봄이면 수많은 상춘객으로 도로가 주차장이 되니 자전거나 도보여행이 자동차 여행보다 도리어 빠를 수 있다. 여름은 초록대로, 가을은 단풍대로 아름답다.",
흥미진진 이야기 속 김천여행,2365331,추천코스,나홀로코스,나홀로코스,http://tong.visitkorea.or.kr/cms/resource/81/592281_image2_1.jpg,Unknown,128.0028416282,36.115156327,세 개의 산과 두 개의 물길이 만나 빚어낸 삼산이수의 고장 김천. 거칠고 투박한 사투리만큼이나 우직하고 선 굵은 명소들이 곳곳에 자리 잡고 있다. 흥미로운 이야깃거리와 시원한 풍광을 자랑하는 김천을 찾아보자. 두 발로 걸으며 씩씩한 걸음걸음으로...,
