title,contentid,cat1,cat2,cat3,firstimage,region,mapx,mapy,overview,homepage
위클라드 애견 풀빌라,3112142,숙박,숙박시설,펜션,,경상북도,129.3065788728,35.7412033678,위클라드는 반려견과 함께 즐길 수 있는 풀빌라 독채 펜션입니다.,www.weclard.com
위클리 클래식 페스티벌,3108244,인문(문화/예술/역사),공연/행사,기타행사,http://tong.visitkorea.or.kr/cms/resource/43/3108243_image2_1.jpg,서울특별시,126.9798484004,37.5762836932,"우리동네 소극장에서 즐기는 클래식 음악회'라는 슬로건으로 2022년 경기도 오산에서 시작하여 관객들로부터 호평을 받고 있는 위클리 클래식 페스티벌이 2024년 전국 8개 공연장에서 3월부터 7월까지 개최된다. <br>
공모를 통해 선정된 68팀 총 210명의 연주자들이 서울, 경기, 청주, 대구, 제주에서 92회의 공연을 진행할 예정이다. 정통 클래식을 기반으로 재즈, 국악, 뉴에이지, 남미 음악에 이르기까지 클래식 악기로 보여줄 수 있는 다양한 장르도 선보일 예정이다. <br>
참여하는 공연장은 경복궁 클래식(서울 종로), 갤러리 오누이(서울 동작), 마이스터클랑(경기 광명), MEG아트홀(경기 오산), AG아트홀(충북 청주), 프란츠홀(대구 남구), 오디토리움(제주 애월), 끌로드아트홀(제주 서귀포)이며 공연장별 객석은 최소 30석에서 최대 100석 이다.<br>
연주자의 호흡까지 느낄 수 있을 정도로 무대와 객석이 가까운 거리, 모든 공연에 있는 연주자의 해설로 관객과 연주자 사이의 장벽이 자연스럽게 무너지는 놀라운 경험을 하게 될 것이다. 이 축제를 통하여 클래식 음악이 주는 감동과 희열, 특별한 에너지를 경험하며 예술적 영향력을 펼치기를 기대해 본다. 
예매는 클래식 공연 예매사이트인 '파인스테이지(www.finestage.co.kr)'에서 가능하다.","<a href=""https://www.weeklyclassicfestival.com/"" target=""_blank"" title=""새창 : 위클리 클래식 페스티벌 홈페이지 이동"">www.weeklyclassicfestival.com</a>"
위트미,2832252,음식,음식점,서양식,http://tong.visitkorea.or.kr/cms/resource/47/2832247_image2_1.jpg,경기도,127.0852745215,37.7839142135,"경기도 양주시 만송동에 있는 이탈리안 레스토랑이다. 위트미는 밀이라는 영어 단어인 'wheat'와 한문 맛 미 '味'의 합성어로 밀로 만든 음식을 뜻한다. 바로 옆 '윤쉐프정직한제빵소'와 같은 곳에서 운용한다. 실내는 화이트 톤이다. 셀프 바에서 물컵, 앞접시, 물, 티슈 등을 직접 준비해야 한다. 메뉴는 브런치 종류, 블랙퍼스트 세트, 파스타, 리소토, 피자 등과 음료가 있다. 세트 주문할 때 나오는 음료는 별도 비용을 추가해 바꿀 수 있다. 통창이 보이는 건물 앞에 주차장이 있다. 양주역에서 차량으로 약 10분 거리에 있다. 가까이에 레이크우드 CC가 있다.","<a href=""http://www.jeongmijakso.com/default/main/main.php""target=""_blank"" title=""새창 : 위트미 사이트로 이동"">http://www.jeongmijakso.com/default/main/main.php</a>"
윈덤 그랜드 부산,3386773,숙박,숙박시설,관광호텔,http://tong.visitkorea.or.kr/cms/resource/20/3383620_image2_1.jpg,부산광역시,129.024224716,35.078441976,윈덤 그랜드 부산은 부산 바다의 윤슬과 원도심 야경이 어우러지는 전망을 품고 있는 호텔이다. 또한 전세계의 미식을 경험할 수 있는 올데이 다이닝 뷔페 레스토랑인 더 브릿지와 일식 레스토랑 그리고 27층 바에서 품격 있는 식사를 즐길 수 있다. 남항대교 전망을 품고 있는 수영장과 최첨단 피트니스 센터 등 윈덤 그랜드 부산이 갖추고 있는 모든 공간은 당신의 여행을 더욱 완벽하게 만들어 줄 것이다.,"<a href=""https://www.wyndhamgrandbusan.com/kor/"" target=""_blank"" title=""새창 : 윈덤 그랜드 부산 홈페이지로 이동"">https://www.wyndhamgrandbusan.com/kor/</a>"
윈덤그랜드 부산 더 브릿지,3409762,음식,음식점,서양식,http://tong.visitkorea.or.kr/cms/resource/98/3408698_image2_1.jpg,부산광역시,129.024224716,35.078441976,"푸른 바다를 감상하며 세계 각국의 미식을 즐길 수 있는 올데이 뷔페 레스토랑이다.
따뜻한 기후와 청량함이 떠오르는 지중해 요리를 시작으로 직화 그릴의 BBQ, 정갈하게 준비되는 한식, 클래식한 중식과 대표적인 미식인 베이징덕, 신선한 스시와 사시미, 다양한 종류의 콜드컷과 입안을 즐겁게 하는 디저트가 준비되어 있다.
또한 다양한 섹션의 라이브 스테이션을 보며 입으로 즐길 수 있는 미식을 오감으로 확장하여 진정한 맛의 진수를 선사한다.","<a href=""https://www.wyndhamgrandbusan.com/kor/"" target=""_blank"" title=""새창 : 더 브릿지 홈페이지로 이동"">https://www.wyndhamgrandbusan.com/kor/</a>"
윈드1947 카트테마파크,2606214,레포츠,육상 레포츠,카트,http://tong.visitkorea.or.kr/cms/resource/35/2609335_image2_1.bmp,제주특별자치도,126.5888388937,33.2895462915,"윈드 1947 카트테마파크는 제주도 서귀포시 토평동에 위치한 3만 평 규모의 체험형 테마파크이다. 윈드 1947 카트는 제주의 아름다운 남쪽 풍경을 배경으로 1,947m의 국내최장코스이며 아시아 최장코스를 자랑한다. 이곳은 다양한 체험장이 있는데 온 가족이 즐길 수 있는 액티비티 ‘윈드 1947 카트’와 제주 유일의 실내 비비탄 ‘서바이벌 체험장’이 있다. 그리고 인더스트리얼한 감성의 브런치카페 ‘제이팩토리’ 완벽한 휴식을 만드는 제주 감성공간, 무인카페 ‘다락’을 방문할 수 있다. 교육과 체험, 휴식과 즐거움, 액티비티를 통해 아이부터 어른까지 즐겁고 행복한 추억을 만들 수 있다.","윈드 1947 <a href=""http://www.wind1947.com"" target=""_blank"" title=""새창: 윈드 1947 "">http://www.wind1947.com</a>"
윈드스톤,2765211,음식,음식점,카페/전통찻집,,제주특별자치도,126.4361038522,33.4605083046,"제주시 애월읍의 작은 마을 어귀를 지나면, 나지막한 지붕에 아늑한 공간, 큰 창이 나 있는 카페 윈드스톤이 있다. 이름처럼 제주의 전통가옥인 돌담 집 콘셉트로, 날이 좋으면 앙증맞은 정원에서 커피를 즐길 수도 있다. 책방도 같이 운영하고 있는데, 책 종류가 많지는 않고 독립 출판물이나 매거진, 인센스 스틱과 달력 등을 판매하고 있다. 신선한 원두로 내린 커피와 북 마스터가 선별한 다양한 서적들을 만나 볼 수 있다. 공항과도 가까워 공항 가기 전이나 여행 중 잠깐 들러 여유를 만끽하기 좋은 곳이다.","<a href=""https://www.instagram.com/windstone_jeju/"" target=""_blank"" title=""새창 : 윈드스톤 사이트로 이동"">https://www.instagram.com/windstone_jeju/</a>"
윈체스트 골프클럽,578814,레포츠,육상 레포츠,골프,http://tong.visitkorea.or.kr/cms/resource/15/1941215_image2_1.jpg,경기도,127.2818772185,36.9596382689,"국내 최초로 ‘선 시공 후 분양’ 시스템을 실시하여 입회 즉시 라운드 및 최고 시설의 이용이 가능하며, 최상의 회원 특전을 누릴 수 있다. 최고의 조경 연구소가 적송 6,000여 그루를 식재하여 시간이 흐를수록 가치를 더하는 고품격 조경을 자랑하며, 아름다운 풍광으로 코스의 격을 높였다. 이곳은 서울 강남에서 40분 만에 만날 수 있는 탁월한 접근성이 장점이다. 2007년 8월 남안성 IC 개통으로 서울 강남에서 40여분 만에 도착할 수 있다. 여유로운 라운드가 가능한 넓은 홀 면적으로 홀과 홀 사이를 최적화하여 넓은 플레이존을 자랑하며, 타 골프장에 비해 실제 사용하는 면적을 더 넓게 확보하였다.","<a href=""http://www.winchestgc.co.kr"" target=""_blank"" title=""새창 : 윈체스트 골프클럽 홈페이지로 이동"">http://www.winchestgc.co.kr</a><br><a href=""https://www.instagram.com/winchest_gc/""target=""_blank"" title=""새창 : 인스타그램 이동"">https://www.instagram.com/winchest_gc/</a>"
윈호텔,1963819,숙박,숙박시설,모텔,,경상북도,128.7025640455,36.5645124812,"유교의 본향이라는 이름에 걸맞게 수려한 자연경관과 유적지 등이 인접해 있어 많은 볼거리와 고유한 맛을 즐길 수 있는 안동에서 윈호텔은 최고의 호텔만의 노하우와 서비스로 한층 더 품위 있고 편안하게 고객들을 맞이한다. 안동신도시에 위치하고 있어 조용하고 넓은 주차장을 보유하고 있으며 터미널이 차량으로 5분, 하회마을이 30분 거리에 있다. 안동의 축제로는 국제탈춤페스티벌과 안동민속축제, 차전놀이, 하외별신굿탈놀이 등이 있다.",
윌라라,2654155,음식,음식점,서양식,http://tong.visitkorea.or.kr/cms/resource/75/2655475_image2_1.jpg,제주특별자치도,126.9328634621,33.4629326664,한정 수량 판매 매장이다. 대표메뉴는 피시&칩스다. 제주특별자치도 서귀포시에 있는 양식당이다.,
윌리엄해밀턴쇼 동상,1829586,인문(문화/예술/역사),역사관광지,유적지/사적지,http://tong.visitkorea.or.kr/cms/resource/76/2047976_image2_1.jpg,서울특별시,126.9229971951,37.6056986983,"우리나라의 해군 및 해병대 창설에 크게 공헌한 미 해군대위 서위렴2세(William Hamilton Shaw)의 숭고한 한국사랑과 거룩한 희생을 추모하기 위하여 건립하였다. 서위렴2세는 6.25 전쟁 발발시 미국 하버드대학교에서 박사과정을 공부하는 학생신분이었음에도 불구하고, 자신이 태어나고 자란 제2의 조국인 대한민국의 자유와 평화를 지키기 위해 미 해군으로 자원입대하여 서울 수복 작전 중 1950년 9월 22일 은평구 녹번리 전투에서 29세의 꽃다운 나이에 전사하였다. 그가 전사한 녹번동에 비가 세워졌다가 응암어린이 공원을 거쳐 2010년 현 위치로 이전하였다.<br /><br />* 규격 - 비높이 1.57m<br />* 건립자 - 서위렴2세전사기념비건립위원회(1956.09.22. 건립)<br>","<a href=""http://mfis.mpva.go.kr"" target=""_blank"" title=""새창: 국가보훈처 현충시설 정보서비스 홈페이지로 이동"">http://mfis.mpva.go.kr</a>"
윌비성형외과의원,3307470,쇼핑,쇼핑,사후면세점,http://tong.visitkorea.or.kr/cms/resource/58/3314358_image2_1.jpg,서울특별시,127.0204158953,37.5145888113,-,
윌성형외과,2908799,쇼핑,쇼핑,사후면세점,http://tong.visitkorea.or.kr/cms/resource/11/2880011_image2_1.jpg,서울특별시,127.0255269137,37.5014154327,-,
윗골공원,3015937,인문(문화/예술/역사),휴양관광지,공원,http://tong.visitkorea.or.kr/cms/resource/32/3015932_image2_1.JPG,부산광역시,129.1776379536,35.3239395332,"정관 윗골공원은 물놀이장으로 유명한 도심 속 공원이다. 물놀이장에는 워터 슬라이드와 워터드롭이 있어서 아이들이 즐겁게 물놀이를 즐길 수 있고, 수심이 낮아서 유아들도 놀기 좋고, 미끄럼틀과 다양한 형태의 분수가 있어서 재미있게 물놀이를 즐길 수 있는 공원이다.
윗골공원은 30개 정도의 평상과 파라솔도 무료로 이용할 수 있으며, 음식은 먹을 수 있고, 취사는 불가능하다. 물놀이장 편의시설은 샤워장, 탈의실, 의무실, 화장실이 있고, 관리인도 상주하고 있어 안전하게 물놀이를 즐길 수 있는 무료 야외 물놀이장이다.
정관 윗골공원에는 물놀이장 외에도 어린이 놀이터와 정관 어린이 도서관이 있어서 어린이가 하루 종일 알차게 보낼 수 있는 공원이다.",
윙민박,2574073,숙박,숙박시설,게스트하우스,http://tong.visitkorea.or.kr/cms/resource/06/2573206_image2_1.jpg,부산광역시,129.200550987,35.1822391732,"#본 업소는 외국인관광 도시민박업으로 외국인만 이용이 가능하며 내국인은 이용할 수 없습니다.

부산 해운대에 위치한 숙박업소이다.",
유 아트 스페이스,130306,인문(문화/예술/역사),문화시설,미술관/화랑,http://tong.visitkorea.or.kr/cms/resource/39/1258239_image2_1.jpg,서울특별시,127.0458548839,37.5273933369,"1974년 인사동에서 갤러리 삼경으로 출발한 유아트스페이스는 작지만 깔끔한 느낌을 주는 미술품 상설 전시장이다. 동양화와 서양화를 한꺼번에 볼 수 있고, 중후한 멋의 조각품 들도 만날 수 있다. 수준 높은 작품감상과 구입을 원하는 이들이 한번쯤 들러 볼만한 곳이다.<br>","<a href=""http://uartspace.com/"" target=""_blank"" title=""새창 : 유 아트 스페이스 홈페이지로 이동"">http://uartspace.com</a>"
유)한성 마드리드 광주호텔 [한국관광 품질인증/Korea Quality],2700992,숙박,숙박시설,관광호텔,http://tong.visitkorea.or.kr/cms/resource/59/2698259_image2_1.jpg,광주광역시,126.79347715,35.1387237021,"한성 마드리드 광주호텔은 KTX광주송정역 맞은 편에 위치해 접근성이 뛰어나다. 인근에 광주공항, 상무지구, 김대중컨벤션센터, 송정떡갈비특화거리, 1913송적역시장 등 볼거리, 맛집 등을 두루 갖추고 있어 여행에 편리함을 더하고 있다. 또한 평동산업단지, 소촌산업단지, 나주혁신도시 등으로의 이동도 용이하다. 2019년 세계수영선수권대회 본부 호텔로 사용됐으며, 깔끔한 시설과 청결, 친절한 서비스로 좋은 평가를 받고 있다.",http://www.madridhotel.kr
유가네 칼국수,2848970,음식,음식점,한식,http://tong.visitkorea.or.kr/cms/resource/28/2848628_image2_1.jpeg,경기도,126.5689191962,37.2762556901,"유가네칼국수는 경기도 안산시 단원구 대부북동에 있는 한식당이다. 대표 메뉴는 단호박바지락칼국수이다. 함께 먹을 수 있는 해물파전, 메밀전병, 물만두를 판매하고 있다. 또한, 김치는 매장에서 직접 담근다. 막걸리를 무료로 제공하며, 후식으로 몸에 좋은 칡차도 제공한다. 매장 내부는 넓고 쾌적하며, 입식 테이블과 좌식 테이블 모두 있다. 아기 의자와 이유식 전용 전자레인지가 구비되어 있어 가족 단위로 방문하기도 좋다. 넓은 전용 주차장이 있어 편하게 이용할 수 있다.","<a href=""http://5334.modoo.at/""target=""_blank"" title=""새창 : 유가네 칼국수 사이트로 이동"">http://5334.modoo.at/</a>"
유가네곱창,1928720,음식,음식점,한식,http://tong.visitkorea.or.kr/cms/resource/70/2369570_image2_1.jpg,경기도,127.0580337755,37.0516069924,"경기도 평택시 이충동 장당공원 인근에 위치한 유가 네 곱창은 소 곱창구이, 소 곱창전골 전문 음식점이다.
친절한 서비스와 비리지 않고 곱이 꽉 차이 있는 질 좋은 곱창으로 호평이 자자한 곳이다.
소 곱창구이, 소 곱창전골 외에도 소 내장으로 만드는 다양한 메뉴들이 준비되어 있다.",
유가네원조양평해장국,2874155,음식,음식점,한식,http://tong.visitkorea.or.kr/cms/resource/31/2874131_image2_1.jpg,경기도,126.7231465183,37.6858358034,"유가네원조양평해장국은 일산 서구 덕이동에 있는 해장국 맛집이다. 식당 앞에 주차 공간이 넓게 있다. 내부도 넓고 쾌적하고 깔끔하다. 메뉴는 두 가지가 있다. 원조해장국과 해내탕이다. 원조해장국은 양, 선지, 무청이 들어있는 해장국이고, 해내탕은 내장 고기와 무청, 콩나물이 들어 있다. 밑반찬으로는 김치와 깍두기가 나오고 테이블에 삭힌 고추 다진양념과 소금, 간장소스, 후추가 세팅되어 있다. 이 집의 해장국은 양을 아낌없이 많이 넣어준다. 선지를 더 좋아하면 주문할 때 선지를 더 넣어달라고 하면 된다. 근처에 고양 생태공원이 있다.",
유가네칼국수,2738733,음식,음식점,한식,http://tong.visitkorea.or.kr/cms/resource/34/2740734_image2_1.jpg,충청남도,127.1284774217,36.4419256132,"유가네 칼국수는 채널 IHQ 예능 프로그램 '맛있는 녀석들' 등 여러 방송에 소개된 바 있다. 대표 메뉴는 복어로 육수를 우려내어 시원하고 담백한 복해물칼국수다. 이 밖에 얼큰하고 개운한 김치전골 칼국수도 많은 사람이 선호하는 메뉴다. 내부에는 단체석이 마련되어 있어 각종 모임을 가지기에 좋고, 예약도 가능하다. 오전 10시에 문을 열고 오후 9시에 영업을 마감한다. 오후 2시 30분부터 오후 5시까지는 브레이크 타임이다.",
유가네흑돼지,2874128,음식,음식점,한식,http://tong.visitkorea.or.kr/cms/resource/15/2874115_image2_1.jpg,경기도,126.7370756805,37.6900938884,"유가네흑돼지는 일산서구 덕이동에 있는 돼지고기 전문점이다. 식당 앞에 주차 공간은 넉넉하다. 메뉴는 모듬생고기, 김치두루치기, 김치찌개, 된장찌개, 잔치국수, 열무국수가 있다. 모듬생고기는 초벌구이해달라고 얘기하면 노릇하게 구워서 갖다준다. 장아찌류, 콩나물, 마늘, 고추, 쌈장과 투박한 그릇에 묵은지가 포기로 담겨서 기본 찬으로 차려진다. 생고기는 초벌구이 되어 있어서 빠르게 굽기 좋다. 묵은지 구워서 고기와 곁들여 먹으면 맛있는 한쌈이 완성된다. 식사 메뉴로 된장찌개나 잔치국수를 시켜 먹으면 된다.",
유가원설농탕,812019,음식,음식점,한식,http://tong.visitkorea.or.kr/cms/resource/22/1789722_image2_1.jpg,경기도,126.7176789066,37.7370852899,"※ 영업시간 08:00 ~ 21:00

파주시 다율동에 위치한 유가원설농탕은 설렁탕 전문점으로 설농탕, 도가니탕 등을 판매하고 있다.",
유가장,2768061,음식,음식점,중식,http://tong.visitkorea.or.kr/cms/resource/25/2768325_image2_1.jpg,경기도,127.6339387568,37.2938532954,"경기도 여주에 있는 중화요리 음식점이다. 대표 메뉴는 매운 짬뽕으로 TV 방송의 VJ특공대에 소개되기도 했으며 무한도전의 노홍철과 싸이가 다녀갔던 집으로도 유명하다. 짬뽕의 매운맛은 단계를 조절할 수 있어 입맛에 맞게 조절하여 즐길 수 있다. 유가장 짬뽕의 국물은 맑고 시원한 맛과 더불어 얼큰함으로 혀를 자극한다. 국물뿐만 아니라 면발 또한 탱글탱글한 것이 유가장의 장점이자 자랑이다. 이미 여주의 맛집으로 알려져 많은 사람이 줄을 서서 기다리기도 하지만, 식사 후 보람을 느낄 수 있는 여주의 짬뽕 맛집이다.",
유가제빵소,2856275,음식,음식점,카페/전통찻집,http://tong.visitkorea.or.kr/cms/resource/68/2856268_image2_1.jpg,대구광역시,128.4562192616,35.6729841578,"유가제빵소는 대구광역시 달성군 유가읍 유곡리에 있다. 현대적인 감각이 돋보이는 외관과 고급스러운 분위기를 연출하는 인테리어가 눈에 띈다. 내부에는 단체석이 마련되어 있어 각종 모임을 하기 좋다. 대표 메뉴는 정통 치아바타, 국내산 수제팥, 프랑스산 고메버터가 조화롭게 어우러진 앙버터다. 이 밖에 몽블랑, 쌀 단팥빵, 에스프레소, 아메리카노, 카페라떼 등을 맛볼 수 있다. 북현풍(하이패스) IC에서 가깝고, 인근에 비슬산자연휴양림, 비슬산치유의숲이 있다.",
유가츠,2901720,음식,음식점,일식,,서울특별시,127.0422490916,37.5473242904,"서울숲 유가츠는 뚝섬역 8번출구에서 걸어올 수 있을 정도로 역과 가깝다. 가는 골목길 사이사이 예쁜 카페들도 많아 구경하기 좋다. 매장이 지하에 위치하여, 잘 보고 가야한다. 가게 내부에는 지하임에도 통창문으로 되어 있으며, 식물이 많아 답답한 느낌이 들지 않는다.  웨이팅이 많고 인기가 많아 미리 전화로 재료 여부의 문의를 넣은 후 가는 것이 좋다. 음식 비주얼이 좋아 입맛을 돋우는데 탁월하다. 맛도 인기있는 집인 만큼 보장한다.",
유경식당 와현본점,2915070,음식,음식점,한식,http://tong.visitkorea.or.kr/cms/resource/66/2915066_image2_1.jpg,경상남도,128.7155367507,34.8019533634,"거제 예구선착장 바로 앞에 있는 유경식당은 현지인들이 자주 찾는 식당이다. 어업 경력 25년의 경험을 바탕으로 신선하고 질 좋은 자연산 회만 고집한다. 유람선을 이용하는 여행객들과 외도 방문객들이 자주 찾는 횟집으로, 40~50명을 수용할 수 있는 단체석도 구비되어 있다. 각종 드라마 촬영팀과 영화 촬영팀, 연예인도 자주 방문한다. 자연산 회 코스에는 자연산 회는 물론이고, 생선구이, 각종 해산물, 해물찜, 매운탕까지 다채로운 한상차림이 제공된다. 전용 주차장이 있다. 구조라해수욕장, 와현해수욕장, 거제씨월드와 외도가 가까워 함께 둘러보기 좋다.","<a href=""https://ygseafood.modoo.at/""target=""_blank"" title=""새창 : 업체홈페이지 이동"">https://ygseafood.modoo.at/</a><br><a href=""https://www.instagram.com/yg__seafood/""target=""_blank"" title=""새창 : 업체인스타그램 이동"">https://www.instagram.com/yg__seafood/</a>"
유곡면 농촌체험랜드(유농오토캠핑장),2792211,레포츠,육상 레포츠,"야영장,오토캠핑장",http://tong.visitkorea.or.kr/cms/resource/09/2798009_image2_1.JPG,경상남도,128.317935178,35.4322949212,"물놀이와 캠핑을 할 수 있는 곳으로 마련된 유곡면 농촌체험랜드는 유곡천을 바탕으로 경관자원으로 활용하여 도시와 농촌 교류의 장으로 발전시키는 사업으로 마련된 농촌체험랜드이다. 30여 동의 캠핑 동수를 가진 오토캠핑장인 농촌체험랜드는 사이트 바로 옆으로 주차가 가능하며, 그 이름처럼 농촌에 특화된 다양한 체험이 가능하다. 우선은 산책로가 펼쳐져 있는데, 이 산책로를 걷다 보면 자연스럽게 주변의 농촌 풍경을 즐길 수 있으며, 산책이 계속되면 유곡천의 출렁다리를 만나 다리를 건널 수도 있다. 더 멀리 갈 경우에는 자암 강경승 선생이 은거하던 자암정도 둘러볼 수 있다. 그 외에도 연날리기 체험이 가능하며, 마당에는 화훼원이 꾸며져 있어 계절별로 피고 지는 꽃을 둘러볼 수도 있다. 그 외 야외무대, 물놀이장도 이용할 수 있고, 특산물 수확하기 등의 특징적인 체험 활동도 가능하니 농촌의 소박함을 느끼고 싶은 이들에게 추천할 만하다.","<a href=""https://band.us/band/79768913"" target=""_blank"" title=""새창 : 유농오토캠핑장 사이트로 이동"">https://band.us/band/79768913</a>"
유관순기념관(서울),1605986,인문(문화/예술/역사),문화시설,기념관,http://tong.visitkorea.or.kr/cms/resource/33/1569133_image2_1.jpg,서울특별시,126.9702718302,37.5644487857,"유관순기념관은 유관순 열사의 독립 정신을 기리기 위하여 이화여자고등학교 내에 1974년 완공한 전시관이다. 이곳은 유관순 열사가 공부하며 거닐던 곳으로, 1919년 3월 1일 유관순을 비롯한 이화학당의 학생들이 이 교정의 기숙사 뒷담을 넘어 남대문 쪽으로 달려가 만세를 불렀던 역사의 현장이라는 점에서 장소의 역사성이 살아있는 곳이다. 완공 이후 여러 차례 증축을 통해 현재 1,700석 규모의 강당으로 되어 있으며, 이화인의 시작과 끝인 입학식과 졸업식이 이곳에서 거행된다. 또한, [유관순상] 시상식을 비롯한 각종 행사가 이곳에서 열린다.
2층 홀에는 유관순 열사의 사진과 유품 등을 전시하는 공간이 마련되어 있는데, 사진 자료의 양이나 규모 면에서 충남 천안에 있는 유관순기념관에 비해 매우 소박하지만, 서울 도심에서 유관순 열사의 흔적을 찾아볼 수 있는 귀중한 장소이다. 또한 학교 내에는 유관순 동상과 유관순 열사가 빨래했던 우물터가 남아 있다. 이 밖에도 이화여자고등학교 교내에는 심슨기념관, 이화여고 100주년기념관 등의 역사 관광지가 있어 유관순기념관과 함께 둘러볼 수 있다.","<a href=""https://www.junggu.seoul.kr/tour/content.do?cmsid=15006&keyword=&contentId=4144&order=&gotoPage=56"" target=""_blank"" title=""새창 : 홈페이지로 이동"">https://www.junggu.seoul.kr</a>"
