title,contentid,cat1,cat2,cat3,firstimage,region,mapx,mapy,overview,homepage
궁평항피싱피어,2782600,레포츠,수상 레포츠,바다낚시,http://tong.visitkorea.or.kr/cms/resource/54/2786754_image2_1.jpg,경기도,126.6836964596,37.1168317283,"바다 위 잔교 낚시터인 피싱 피어(Fishing pier)는 화성시에 두 개가 있는데 하나는 제부도에, 다른 하나는 궁평항에 있다. 2009년에 경기도가 사업비 30억 원을 들여 설치한 피싱 피어로 제부항이 먼저 완료되었고 궁평항은 그다음으로 완성되었다. 궁평 피싱 피어는 잔교 길이가 193m, 넓이는 6~15m로 제부 피싱 피어보다 약 3배 정도 크다. 수용 규모는 약 500명으로 썰물 시에도 늘 바닷물이 차 있어 낚시를 즐길 수 있다. 궁평 피싱 피어는 상공에서 보면 날개를 활짝 편 갈매기처럼 보이는데 일단 아름답거니와 안전하기도 하다. 일반 방파제 낚시는 위험한 데 비해 피싱 피어는 안전하게 시설이 잘되어있어 아이들과 함께 낚시를 즐기기에도 부담이 없다. 또 의자와 그늘이 있어서 낚시하면서 쉴 수도 있고 가족끼리 얘기꽃을 피우기도 좋다. 배낚시에 비해 쉽게 이용할 수 있고 시간과 비용의 부담이 적은 것이 큰 장점이다. 근처에는 화성시에서 가장 큰 규모의 수산시장도 있어 많은 관광객이 찾는다. 바다 쪽으로 뻗어 나가 끝에 그늘막이 있는 궁평항 피싱  피어는 그  자체가 이국적인 바다 풍경을 선사하는데 화성8경의 하나라는 궁평 낙조와 어우러지면 감탄사가 절로 나온다. 봄에는 숭어와 우럭, 여름에는 우럭, 망둥어, 농어가 잘 잡히며 가을에는 삼치, 전어, 우럭, 광어, 망둥어, 겨울에는 우럭과 망둥어가 잘 잡히며 최근에는 숭어가 최고의 낚시 대상어로 주목받고 있다.",
궁평해송군락지,2733830,자연,자연관광지,자연생태관광지,,경기도,126.685046224,37.1209646072,궁평항 해송군락지는 오래전 약 1800년경 바람을 막아주는 방풍림으로 조성되었다. 약 200년 이상 세월이 흐른 해송들이 하늘을 가릴 만큼 빼곡히 자리 잡고 있다. 시원한 바닷바람이 실어 오는 솔향을 맡으면서 700m 구간의 산책로를 걸을 수 있는 해송 군락지이다. 썰물 때 드러나는 약 2km 개펄은 자연학습장으로 이용되고 하루 2시간가량 밀물 때는 해수욕을 즐길 수 있다. 인근 궁평항은 화성 8경 중 4경으로 낙조가 유명하다.,
궁항,2755809,자연,자연관광지,자연생태관광지,http://tong.visitkorea.or.kr/cms/resource/06/2755806_image2_1.png,전북특별자치도,126.468772143,35.6033517003,"전북 부안의 작은 어항인 궁항(弓項)은 한자로 활의 목덜미를 뜻한다. 반월(半月) 모양의 산이 둘러있고 마을 앞바다에는 견도(犬島-개섬)가 자리하고 있는데, 바다에서 궁항을 보면 마을이 활과 같은 모양이고 견도는 활촉 같아서 활궁 또는 목항, 즉 활목이라 부르게 되었다고 한다. 주변에 펜션 등 숙박 가능한 시설들이 많이 있어 휴양지로도 좋고 많이 알려지지 않아 조용한 가운데 휴식을 취할 수 있는 곳이다. 그리 넓은 규모는 아니지만 방파제 걷기, 마을 탐방과 바닷가에서 시간을 보내도 그리 바쁘지 않다.  키 작은 소나무와 넓적한 바위가 한 폭의 그럼처럼 어우러진 정자에서 바라보는 궁항의 낙조는 장관이다. 부안의 많은 항구 중에 작지만 아름다운 항구로 낙조의 경관이 뛰어나 해넘이 장소로 제격인 궁항은, 두 개의 방파제에 낚시객들이 낚시하는 모습을 많이 볼 수 있다.",
궁항리조트,2779506,인문(문화/예술/역사),휴양관광지,관광단지,http://tong.visitkorea.or.kr/cms/resource/41/2779541_image2_1.jpg,전북특별자치도,126.4701553307,35.6042349563,"전라북도 부안군 변산면 궁항로에 위치한 궁항리조트는 변산의 유명 관광지인 채석강에서 차로 5분 거리에 있다. 전 객실에 스파가 구비된 궁항 최대의 숙박시설로, 전 객실에서 바다를 볼 수 있도록 설계되어 있다. 다양한 모임과 행사를 진행할 수 있는 100석 규모의 연회장이 있고, 리조트 내에는 셰프가 직접 요리한 통 삼겹 숙성 바비큐와 회 요리가 준비돼 있다. 조식도 메뉴 선택 예약 후 유료 이용이 가능하다. 넓은 주차공간을 확보하고 있어 주차 걱정이 없고, 노래방, 수영장, 놀이시설 등 다양한 편의시설이 구비되어 있어 여행 중 편한 휴식을 즐길 수 있다","<a href=""http://궁항리조트.com/"" target=""_blank"" title=""새창 : 궁항리조트 사이트로 이동"">http://궁항리조트.com/</a>"
궁항마을,2785927,인문(문화/예술/역사),체험관광지,농.산.어촌 체험,http://tong.visitkorea.or.kr/cms/resource/89/2788089_image2_1.jpg,경상남도,127.8088192685,35.2047392689,하동군 금성면에 있는 궁항마을은 넓은 평야지에 자리한 자연마을이다. 지리산 둘레길 위태–하동호 구간에 있으며 하동호 관리사무소까지 6.9Km 거리에 있다. 궁항리는 활목이라는 곳으로 오대 주산 아래 유명한 오대사 절터가 있으며 사방이 높은 산으로 둘러싸인 산골로 철 광맥이 있어 쇠를 구운 흔적도 남아 있다. 이 마을의 볼거리는 궁항 댐이 있고 뒤로는 가을 단풍이 아름다운 오대산이 있다.,
궁항어촌체험마을,2789684,인문(문화/예술/역사),체험관광지,농.산.어촌 체험,http://tong.visitkorea.or.kr/cms/resource/24/2795624_image2_1.jpg,경상남도,128.3817849882,34.810938041,"통영시내 남쪽 미륵도 방면 삼덕리에 위치한 작은 어촌마을이다. 마을은 종합안내센터, 체력단련장, 샤워장, 숙박시설, 어업체험 등의 시설을 갖추고 다양한 체험 프로그램을 제공하고 있다. 어촌체험은 날씨가 나쁘지 않은 한 매일 갯벌에 물이 빠지는 시기에 맞춰 선착순으로 들어가 체험할 수 있다. 바지락, 해삼, 고둥, 돌게 등을 직접 잡을 수 있으며 동시에 스노클링을 즐길 수 있다. 숙박시설이 있어 7인실부터 최대 20인까지 인원에 따라 가족여행이 가능하다. 숙소 바로 앞 해수욕장을 이용할 수 있어 여름철 피서지로도 좋다.","<a href=""http://www.xn--of0bw6uujj0qb27lcpaf38btya.kr/"" target=""_blank"" title=""새창 : 궁항어촌체험마을 사이트로 이동"">http://www.궁항어촌체험마을.kr/</a>"
궈세이,403215,음식,음식점,중식,,경기도,126.6899189807,37.7850958641,"서울 외곽의 자유로를 달려 일산을 지나서 경기도 파주로 가다 보면 통일동산 근처에 있는 프로방스가 나온다. 이곳은 수려한 자연경관은 물론 레스토랑과 샤부샤부와 한정식, 프로방스 고깃집, 리빙관, 허브관, 패션관, 카페 등으로 구성된 테마형 마을이다. 이 부근에 자리하고 있는 ‘궈세이’는 중식 전문 음식점이다. 식당 내부에는 원목 무늬의 바닥과 밝은 톤의 내부가 여느 중국 음식점과 다르게 화사하고 깨끗한데, 가운데에 넓게 툇마루 형식으로 좌식 테이블이 준비되어 있고 주변에는 원형 테이블이 있다. 또한 모임에 필요한 별실도 마련되어 있다. 궈세이에서 가장 인기 있는 메뉴는 자장면인데 음식은 대체로 빨리 나오는 편이다. 식사를 마치고 나면 후식으로 과일이 나온다.",
권가제면소,2856976,음식,음식점,일식,http://tong.visitkorea.or.kr/cms/resource/60/2856960_image2_1.jpg,충청북도,127.4648453943,36.6118926502,"권가제면소는 충청권 최초의 사누키 전통 방식의 자가제면하는 우동집이다. SBS 시사 교양 프로그램 생방송 투데이에 소개된 바가 있다. 일본 감성이 느껴지는 외관과 깔끔한 분위기의 인테리어로 이루어졌다. 해산물로 직접 끓인 육수는 당일 제조, 당일 소진을 원칙으로 하여 깔끔한 국물맛을 낸다. 쯔유는 사누키 현지의 맛을 그대로 구현하며, 온도와 습도에 맞춰 정확하게 만들어진 면반죽으로 사용한다.","<a href=""http://xn--o39a92ai7zt7g7xi.com/default/"" target=""_blank"" title=""새창 : 권가제면소 홈페이지로 이동"">https://권가제면소.com</a>"
권가칼국수,2830485,음식,음식점,한식,http://tong.visitkorea.or.kr/cms/resource/81/2830481_image2_1.JPG,제주특별자치도,126.5769319952,33.5171098365,"권가칼국수는 제주 토종닭을 얇게 포 뜨고 이를 육수에 야채와 함께 살짝 익혀 먹는 닭 샤브샤브 코스요리를 제공한다. 녹두죽-닭 샤부샤부-토종닭백숙-조개칼국수 순서로 음식이 나오는 보양식 한 코스이다. 닭고기를 접시가 비칠 정도로 얇게 써는 요리사의 솜씨가 좋고, 토종닭의 쫄깃함과 부드러움을 동시에 느낄 수 있도록 삶아내는 노하우도 훌륭하다. 닭 샤부샤부는 제주에서도 교래리 특구에 가야 맛볼 수 있었는데 권가칼국수는 공항 근처 제주 시내에 있어 접근성도 좋다. 아파트 단지 안에 있어 가족 단위 손님이 많으며 점심시간에는 칼국수와 파전 등 식사만 제공, 저녁시간에는 토종닭코스요리만 제공한다.","<a href=""https://www.instagram.com/kwonga_kalnoodle""target=""_blank"" title=""새창 : 권가칼국수 사이트로 이동"">https://www.instagram.com/kwonga_kalnoodle</a>"
권관마을,129020,숙박,숙박시설,민박,http://tong.visitkorea.or.kr/cms/resource/72/1939872_image2_1.jpg,경기도,126.9222885219,36.92148072,"권관마을은 아산만 방조제 북동쪽에 위치한 마을로 농경지가 넓게 펼쳐져있고 아산호를 앞에 두고 있다. 지형이 곶으로 되었다 하여 가삿고지, 가살고지 또는 가사곶이라 하였다. 또는 권세를 부리던 아전배들이 살던 곳이라는 것에서 유래한 지명이라고도 한다.
마을에는 상하동, 상부동, 하부동, 가삿골, 고잔, 황새울, 문곡, 가사리, 모산 등이 있다. 고잔은 곶에 위치한 마을이며 황새울은 보리미 동북쪽에 있는 마을로, 황새가 많이 있다 하여 붙여진 이름이다.
권관마을은 평택시의 휴식공간으로 자리 잡아가고 있는 평택호관광단지의 어촌마을로, 아름다운 어촌 100선에 선정되었으며 유원지와 호수에서 레저활동과 산책을 즐길 수 있다.
평택호 유원지는 1973년 평택과 아산 사이에 아산만 방조제가 건설되면서 만들어진 평택호 주변에 들어선 유원지이다. 호수 주변에 산책로를 잘 정비해서 호수를 따라 산책을 즐길 수도 있고, 보트장이 들어서 있어 보트놀이를 즐길 수도 있다.
야외 자동차 전용극장이 문을 열어 한결 다채로운 유원지가 되어가고 있으며, 평택호 유원지는 인근에 밀집되어 있는 횟집들이 유명하다. 권관 마을은 주변이 바다와 호수가 연접해 있고, 서해대교 위에 걸쳐있는 낙조가 새롭게 떠오르는 명소이다.","<a href=""https://www.pyeongtaek.go.kr/tour/main.do"" target=""_blank"" title=""새창 : 평택문화관광 홈페이지로 이동"">https://www.pyeongtaek.go.kr/tour/main.do</a>"
권선11번가시장,2753389,쇼핑,쇼핑,상설시장,http://tong.visitkorea.or.kr/cms/resource/96/2759696_image2_1.jpg,경기도,127.0247283264,37.2561188607,"권선시장은 1987년에 형성된 시장으로 매장 면적 27,236㎡에 점포 수가 110여 개인 전통시장이다
유난히 순대와 족발을 취급하는 가게들이 많아 족발 시장으로도 잘 알려져 있으며 2014년 아케이드 공사를 통해 새로운 모습으로 재정비하여 손님들을 맞고 있다
새롭게 단장한 지붕과 깔끔한 시장 내부는 과거와 현재가  공존하는 모습이다
날씨에 상관없이  비나 눈이 와도 쾌적하게 쇼핑을 할 수 있어 지역 주민들에게 사랑받는 곳이다",
권셰프우렁각시장어총각,2666424,음식,음식점,한식,http://tong.visitkorea.or.kr/cms/resource/14/2666414_image2_1.jpg,경상북도,128.7360170104,36.5514034959,"가족모임을 하기 좋은 곳으로, 다양한 반찬을 먹을 수 있는 곳이다. 경상북도 안동시에 있는 한식 전문점이다. 대표메뉴는 민물장어구이다.",
권숙수,2870435,음식,음식점,한식,http://tong.visitkorea.or.kr/cms/resource/10/2870410_image2_1.jpg,서울특별시,127.0435940627,37.5244297515,"권숙수는 전국 각지의 진귀한 식재료와 직접 담근 장, 김치, 젓갈, 장아찌를 이용하여 현대적인 한국음식을 선보이는 곳이다. 한국의 고급 독상문화를 현대적으로 재현한 품격 있는 서비스와 엄선된 와인, 전통주를 함께 즐기며 우리의 고급 식문화를 경험할 수 있다. 2015년에 권숙수를 오픈하였고, 2016년에는 스페인 마드리드에서 개최되는 세계 최고 요리행사인 마드리드 퓨전에 한국대표로, 2018~2021년 블루리본 서베이에 선정, 2018~2023년 라 리스트 1000대 레스토랑에 선정, 2017~2023년 미쉐린 2스타에 선정되었다.","<a href=""http://kwonsooksoo.com/""target=""_blank"" title=""새창 : 권숙수 사이트로 이동"">http://kwonsooksoo.com/</a>"
권영분 영동뜨끈이(영동뜨끈이),2775512,음식,음식점,한식,,대전광역시,127.4337199603,36.3234751283,"권영분 뜨끈이는 대전시 중구 문장동에 자리 잡고 있다.
대표 메뉴는 시래기와 돼지 뼈다귀가 듬뿍 들어간 뼈다귀탕으로 이곳에서의 명칭은 뜨끈이탕이다. 이 밖에 전골 수육도 맛볼 수 있다.
음식점은 대전역과 판암IC에서 가까운 거리에 있다. 주변에는 대전 번화가 중 하나인 중앙로역 일대를 비롯해 대동하늘공원, 대동벽화거리 등의 관광지가 있다.",
권영철콩짬뽕본점,2914035,음식,음식점,중식,http://tong.visitkorea.or.kr/cms/resource/25/2914025_image2_1.jpg,대전광역시,127.3315089165,36.3507507503,"권영철콩짬뽕본점은 대전광역시 유성구 구암동에 있다. 깔끔한 느낌의 외관과 차분한 분위기를 연출하는 인테리어로 이루어졌다. 대표 메뉴는 싱싱한 오징어 한 마리가 통째로 들어가는 오징어콩짬뽕이다. 육수를 만들 때 고기 대신 해산물과 채소를 쓰기 때문에 기름이 뜨지 않고 담백하다. 면은 콩을 갈아 넣어 반죽한 후 저온 숙성시켜 부드러우면서 쫄깃하다. 오징어콩짬뽕 외에 콩짬뽕, 오징어콩짬뽕밥, 콩짬뽕밥, 콩짜장, 수제콩돈까스 등 여러 가지 음식이 준비되어 있다. 유성IC에서 가깝고, 주변에 국립대전숲체원과 계룡산국립공원수통골이 있다.",
권오길손국수 본점,2833905,음식,음식점,한식,http://tong.visitkorea.or.kr/cms/resource/90/2833890_image2_1.jpg,인천광역시,126.6866462764,37.6154739032,"권오길손국수는 인천 서구 불로동에 있는 손칼국수 맛집이다. 인천을 대표하는 칼국수 음식점으로 60년 전통의 즉석 생 국수 전문점이다. 앉은자리에서 생면을 삶아주니 면이 퍼지지 않은 상태로 바로 먹을 수 있어 좋다. 테이블 세팅 때 같이 나오는 음식점의 시그니처는 보리밥 (유료)이다. 국수가 끓기를 기다리면서 보리밥을 먹다 보면 칼국수를 먹기 전에 배가 부를 수 있다. 포장은 칼국수 2인분 단위로 가능하고(비 조리), 전화 예약은 불가하며, 매장에 방문해서 주문해야 한다.  '식객'에 소개되기도 했다.
※ 반려동물 동반 불가","<a href=""http://www.kwonsnoodle.co.kr/""target=""_blank"" title=""새창 : 권오길손국수 사이트로 이동"">http://www.kwonsnoodle.co.kr/</a>"
권오길손국수 청라점,2833668,음식,음식점,한식,http://tong.visitkorea.or.kr/cms/resource/62/2833662_image2_1.jpg,인천광역시,126.6540792356,37.5365491769,"권오길손국수 청라점은 청라국제도시 1단지 청라중학교 인근에 있는 칼국수 맛집이다. 식당의 주요 메뉴는 즉석 칼국수다. 본점은 허영만의 만화 ‘식객’에 소개된 바 있다. 식탁에 하나씩 놓인 모래시계를 이용해서 누구나 맛있는 즉석 칼국수를 맛볼 수 있다. 테이블에 안내되어 있는 조리법을 참고하면 더 맛있는 손국수를 먹을 수 있다. 이곳 특징 중 한 가지는 국물에서 씹히는 미더덕과 새우 가루인데, 그 덕분에 국물이 시원하다. 면발은 즉석에서 만들어 주니 쫄깃쫄깃 식감도 좋다. 사이드메뉴로 만두가 있다. 김치만두 3알, 고기만두 3알이 나온다. 인천아시아드 주 경기장, 승학산, 인천환경공단 청라생태공원과 가까워 식사 전후 함께 둘러볼 수 있다.  
※ 반려동물 동반 불가",
권율장군 이치대첩비,126876,인문(문화/예술/역사),건축/조형물,기념탑/기념비/전망대,http://tong.visitkorea.or.kr/cms/resource/01/757601_image2_1.jpg,충청남도,127.353121202,36.1323094258,"권율장군이치대첩비는 임진왜란 때 권율 장군이 승리로 이끈 이치대첩을 기념하고 있는 비이다. 이치는 배티재 고개의 한자어로 이 고개는 대둔산 중허리를 넘어 금산과 전북 완주를 연결하는 교통의 요지이자 전략상 중요한 곳이었다. 
1592년 임진왜란을 일으켜 경상도와 충청도를 휩쓴 왜군이 군량미의 현지 보급을 위해 이 고개를 넘어 호남평야로 진출하려고 했을 때, 권율장군이 동복현감 황진과 군사들을 이끌고 이치를 지켜 왜군의 호남진출을 막았다. 이것이 이치대첩이며 행주대첩, 진주대첩보다 앞서는 임진왜란 최초의 육지에서 승리한 싸움이다. 이 전투에서 조선군이 승리하면서 왜군이 호남진출에 실패했다.
고종 3년(1866) 금성면 상가리에 이치대첩비(梨峙大捷碑)와 대첩사(大捷祠)를 함께 세워 그 뜻을 기렸는데, 1944년 6월 일제에 의해 폭파되었다. 현재의 비석은 1964년에 진산면 묵산리에서 이치를 바라볼 수 있는 산 중턱에 다시 세운 것으로, 연재 송병선이 짓고 송성용이 쓴 비문을 다시 새긴 것이다. 1991년부터 성역화 계획이 수립되어 사당, 비각 및 안내판, 내삼문, 외삼문, 담장을 정비하여 지금에 이르고 있다. 2000년에는 충청남도 문화재자료로 지정되었다.","<a href=""https://www.geumsan.go.kr/tour/html/sub02/020307.html"" target=""_blank"" title=""새창 : 홈페이지로 이동"">https://www.geumsan.go.kr</a>"
권율장군묘,125547,인문(문화/예술/역사),역사관광지,유적지/사적지,http://tong.visitkorea.or.kr/cms/resource/83/3067583_image2_1.jpg,경기도,126.9496050221,37.7335842928,"양주시립장욱진미술관 인근에 있는 조선 중기의 문신이자 임진왜란 당시의 명장인 충장공 권율(1537∼1599) 장군의 묘소이다. 호는 만취당, 본관은 안동, 1537년(중종 32) 영의정 권철의 아들로 출생하였다. 1582년(선조 15) 과거에 급제하고 55세 때는 의주목사로 부임하여 북방 여진족을 방어하였다. 임진왜란 때에는 1593년(선조 26) 행주대첩을 승리로 이끌어 나라에 큰 전공을 세웠고, 행주대첩 후 도원수로 임명되어 전군을 지휘하였다. 1599년(선조 32) 권율이 죽자, 나라에서는 영의정을 추증하고 영가부원군을 추봉하여 공적을 기렸다.
묘역에는 장군의 묘를 중심으로 좌우에 전부인 창녕조씨와 후부인 죽산박씨가 안장되어 있으며, 묘 앞에는 묘비와 상석, 향로석, 동자석 1쌍이 있고 좌우에 망주석과 문인석 1쌍이 있다. 권율 장군 묘 뒤쪽 언덕에는 형 권순과 아버지인 권철의 묘가 차례로 모셔져 있다. 묘역 입구에 있는 신도비는 기존의 신도비 비문이 마모되어 1861년(철종 12)에 장군의 후손들이 다시 세운 것으로 장군의 일대기와 함께 자손들에 대한 내용이 적혀 있다. 묘 아래에 있는 재실은 묘를 관리하고 제사 준비를 하는 곳으로 개방되어 있지 않다.
송추IC에서 차량으로 약 10분 소요된다. 인근에 장흥관광지(청암민속박물관, 가나아트센터, 두리랜드, 양주시립장욱진미술관, 양주시립민복진미술관, 송암스페이스센터, 장흥자생수목원 등), 송추유원지, 일영유원지, 북한산국립공원, 국립아세안자연휴양림, 필룩스조명박물관, 회암사지 등이 있다.","* <a href=""https://www.yangju.go.kr/tour/selectBbsNttView.do?key=890&bbsNo=210&nttNo=88193&searchCtgry=&searchCnd=all&searchKrwd=&pageIndex=2"" target=""_blank"" title=""새창: 홈페이지로 이동"">https://www.yangju.go.kr/tour/index.do</a><br>* <a href=""https://blog.naver.com/yangju619/223238642462"" target=""_blank"" title=""새창: 로 이동"">https://blog.naver.com/yangju619</a>"
권인순갈비김치찌개,2737979,음식,음식점,한식,,대전광역시,127.3167903335,36.3675902296,"권인순갈비김치찌개는 대전 지하철 월드컵경기장역에서 도보로 2분이면 닿는다. 이곳에서는 갈비김치찌개와 갈비김치전골 두 가지 메뉴만 판다. 갈비김치찌개는 묵은지와 돼지갈비를 함께 넣은 후 주방에서 한 번 끓인 뒤 나온다. 요리가 상에 오르면 기호에 맞게 더 끓여서 먹으면 된다. 식후에 누룽지와 숭늉을 맛볼 수 있는 돌솥밥도 함께 나온다.
음식점 인근에는 유성온천을 비롯해 한밭수목원, 엑스포과학공원 등 대전 도심에서 둘러보기 편한 관광지가 많다.",
권정생동화나라,2623228,인문(문화/예술/역사),체험관광지,이색체험,http://tong.visitkorea.or.kr/cms/resource/70/2622270_image2_1.jpg,경상북도,128.6651564519,36.4613429906,"안동 권정생 동화나라는 아이들이 평화로운 세상을 꿈꾼 고 권정생 선생의 문학과 삶이 담겨 있는 곳이다. ‘강아지 똥’, ‘몽실 언니’ 등 주옥같은 작품들을 만나 볼 수 있다. 강아지 똥, 몽실 언니, 엄마 까투리 등의 조형물도 건물 곳곳에 있으며, 선생의 추억이 깃든 교회 종 모형도 볼 수 있다. 1층 전시실에는 권정생 선생이 남긴 작품과 유품을 볼 수 있으며, 1층 복도에는 선생이 살아온 길을 담은 사진이 전시 중이다. 2층에는 단체 관람객을 위한 숙박 시설과 강당도 있다.","<a href=""https://kcfc.or.kr/board/bbs/content.php?co_id=fairy01"" target=""_blank"" title=""새창: 홈페이지로 이동"">https://kcfc.or.kr/board/bbs/content</a>"
권진사댁[한국관광 품질인증/Korea Quality],2602196,숙박,숙박시설,한옥,http://tong.visitkorea.or.kr/cms/resource/06/3042306_image2_1.jpg,경상북도,128.9122314659,36.9447952016,"경남 봉화군 춘양면에 위치한 권진사댁은 130여 년의 역사를 간직한 웅장한 고택으로, 성암고택으로도 불린다. 솟을대문을 지나면 시원하게 펼쳐진 사랑채가 가장 먼저 눈에 들어온다. 객실은 큰사랑방, 작은사랑방, 새사랑방, 중방 총 4개로, 큰사랑방을 제외하고는 모두 온돌방이다. 객실 내부에 샤워실, 화장실, 취사 시설은 없다. 조식은 없지만 떡과 차를 무료로 제공한다. 인근에 만산고택, 봉화 서동리 동․서 삼층석탑 등이 있다.",https://blog.naver.com/kwonjinsa
권참치,2679042,음식,음식점,한식,http://tong.visitkorea.or.kr/cms/resource/67/2677667_image2_1.jpg,서울특별시,126.9805649844,37.4786117191,다양한 참치 부위가 나오는 참치회를 판매하는 곳이다. 서울특별시 동작구에 있는 일식전문점이다. 대표메뉴는 참치회다.,
권충민공순절비,790307,인문(문화/예술/역사),건축/조형물,기념탑/기념비/전망대,http://tong.visitkorea.or.kr/cms/resource/21/3334321_image2_1.jpg,충청남도,127.5665361272,36.1095241376,"권충민공순절비는 임진왜란 때 금산으로 쳐들어오는 왜적을 막다 순절한 금산군수 권종과 그 아들 권준의 충의를 기리고 있는 유허비로 금강 인근에 있다. 권종 부자는 충북 영동 지역으로 쳐들어오는 왜적을 막기 위하여 출정하였다가 강을 건너려는 왜구와 싸워 전사하고 말았다. 비석은 제원대교 입구에서 서남으로 약 50m 지점에 세워져 있는데 전면에 ‘증정헌대부이조판서시충민공행금산군수안동권공휘종순절유허비’라고 한자로 새겨져 있다. 순절비의 글은 이승보가 지었고 글씨는 11대손인 정현이 썼다. 1878년(고종 15) 금산 유림에서 비를 세웠으나 1941년 일제에 의해 비석의 비문이 뭉개진 것을 광복 후 다시 비를 찾아 세워 놓았고, 1974년 비를 보호하고자 비각을 세워 두었다. 인근에 기러기공원, 금강생태과학체험장, 금강뷰 등 여행지가 있다.","<a href=""https://www.geumsan.go.kr/site/tour/html/sub04/040204.html?mode=V&mng_no=e0660b2fe5d5562d9f9159a9bb492b5d&"" target=""_blank"" title=""새창 : 홈페이지로 이동"">https://www.geumsan.go.kr</a>"
