title,contentid,cat1,cat2,cat3,firstimage,region,mapx,mapy,overview,homepage
배나무숲,2857659,음식,음식점,카페/전통찻집,http://tong.visitkorea.or.kr/cms/resource/32/2857632_image2_1.jpg,충청남도,127.120585651,36.8796279457,"배나무숲은 충청남도 천안시 서북구 직산읍 양당리에 있는 대형 디저트 카페다. 매년 4월 중순경이면 카페 주변이 하얀 배꽃으로 뒤덮이는 장관을 연출한다. 천장까지 닿아있는 통창을 통해 바깥 경치를 만끽할 수 있고 자연친화적으로 꾸민 외부에도 테이블을 배치해 반려동물과 함께 입장할 수 있다.
대표 메뉴는 아메리카노이며. 배 스무디, 딸기 스무디, 말차 프라페, 에스프레소, 고구마라테 등이고 다양한 빵과 케이크, 쿠키도 맛볼 수 있다. 북천안 IC와 가깝고, 인근에 성환 이화시장, 어룡농원이 있다.
※반려동물 동반 가능(목줄, 배변봉투 지참)","<a href=""http://www.instagram.com/baenamu_forest""target=""_blank"" title=""새창 : 배나무숲 사이트로 이동"">http://www.instagram.com/baenamu_forest</a>"
배낭기미해수욕장,2723809,자연,자연관광지,해수욕장,,전라남도,125.4265562784,34.6891078527,"배낭기미해수욕장은 흑산도에 위치한 해수욕장으로 흑산도항에서 가장 가까운 곳에 자리하여 많은 피서객들이 찾는다. 배낭기미는 큰 바다라는 의미를 담고 있는데 이름처럼 탁 트인 바다 전경을 볼 수 있다. 또한 호수처럼 잔잔한 분위기에 주위가 몽돌 자갈밭으로 이루어져 있고 드넓은 해송이 천연 파라솔 역할을 해주어 여름철 피서를 시원하게 즐길 수 있다.
인근에 해상관광유람선, 깃대봉, 영산도 등의 관광지가 있다.",
배내고개,2748867,자연,자연관광지,산,,울산광역시,129.0275911051,35.5816938807,"배내고개는 영남 알프스 하늘억새길(배내고개~능동산~천황산~재약산~사자평~죽전)의 가장 초입에 있는 고개이다. 영남 알프스 하늘억새길은 울산을 중심으로 양산, 밀양에 걸쳐 있는 가지산, 신불산, 간월산, 영축산, 천황산, 재약산, 운문산, 고헌산 등 1,000m 이상의 고산지대를 일컬으며, 특히 신불산과 단조 산성 주위로 산맥을 따라 펼쳐진 억새평원이 장관이다. 배내고개의 이름은 계곡 옆으로 야생 배나무가 많이 자라고 있어 배내고개라는 이름을 얻었다. 배내라는 이름은 마을이자 골짜기를 돌아 내려오는 물줄기를 말하기도 하는데, 날이 더울 때면 고산지대로부터 시원한 물이 흘러내려 와서 경남 지역 주민들의 한여름 피서지로도 주목받고 있다.",
배내골,127655,자연,자연관광지,계곡,,경상남도,128.9660138589,35.4564540524,"배내골은 영남알프스의 심장부에 위치하고 있는 계곡이다. 맑은 계곡 옆으로 야생 배나무가 많이 자란다 하여 배내골이라 하고 한자음으로 ‘이천리’라고 한다. 신불산~영축산의 남쪽 알프스와 밀양의 천황산~재약산을 잇는 서쪽 알프스 사이의 이십리에 걸쳐있는 협곡으로 여름철에는 사람들의 방문이 많은 곳이다.                              
아직도 태고의 비경을 그대로 간직하고 있어 봄이면 고로쇠 수액이 나는 곳으로 알려져 있고, 가을에는 배내골 사과가 유명하며 사과 축제도 열리고 있는 곳이다. 양산 시내에서 고갯길을 넘어가면 산으로 둘러싸인 배내골에 도착하며, 도심에서 벗어나 자연의 평화로움을 만끽할 수 있는 천혜의 자연관광지이다.                                                                                                 
배내골은 고지대 사이에 끼여있는 긴 골짜기이기 때문에 일조량이 다른 곳보다 2시간 이상이나 짧아, 여름에도 냉기가 감돈다. 이러한 기후 조건을 활용하여 사과 재배를 많이 하고 있다.","▪ <a href=""https://www.yangsan.go.kr/tour/main.do""target=""_blank"" title=""새창 : 양산시 문화관광으로 이동"">https://www.yangsan.go.kr/tour</a>"
배내골 걸리버 펜션,2576493,숙박,숙박시설,펜션,http://tong.visitkorea.or.kr/cms/resource/14/2576114_image2_1.jpg,울산광역시,129.0087357678,35.5333684142,울산 배내에 위치한 배내걸리버 펜션은 주변의 빼어난 경관과 어우러진 곳이다. 영남알프스의 사계를 마음 것 즐길 수 있는 아늑한 휴식공간으로서 맑은 공기와 별빛이 쏟아지는 밤하늘과 가족과 연인과 함께 아름다운 추억을 간직할 수 있는 좋은 공간이 될 것이다.,http://www.배내골걸리버펜션.kr/
배내골 사발이,3080239,레포츠,육상 레포츠,ATV,,울산광역시,129.0222420178,35.5657483543,"산악오토바이(ATV), 페인트볼 서바이벌게임 진행 전문업체로 영남알프스 배내골에 위치해 있는 경남권 최대 레저업체이다. 산악 ATV를 탈 수 있DJ 인기가 많은 곳으로 ATV가 주 종목이긴 하지만 페인트총 서바이벌도 가능하고 어린이를 위한 깡통열차도 운영하고 있다. 본격적으로 산에 가기 전에 브레이크, 엑셀 감각을 익히 뒤에 비탈길을 반복해서 오르고 내리며 연습을 한 후 본격적인 산악 ATV코스를 체험하면 된다. 산악 ATV를 드라이브를 하면 나뭇가지, 흙 등이 많이 날리므로 복장은 긴팔, 긴바지를 입어야 한다. ATV 산악코스 A와 B 코스는 약 50분, 일주코스는 약 1시간 20분 정도 소요된다. 영남알프스의 자연 경치를 즐기며 스릴과 스피드를 느끼며 스트레스를 날리고 싶다면 추천할 만한 경험이다. 또한, 배내골 사발이에서는 ATV, 서바이벌 체험, 깡통열차 등의 장비들을 가지고 전국 출장·임대 서비스도 가능하다.
주변 펜션과 연계되어 있어 펜션연계할인 이벤트도 실시하며, 기업연수, 회사워크숍, 학생 MT, 수련회, 단합대회, 가족, 커플 등이 다양한 체험을 하기 위해 방문하고 있다.","<a href=""http://beneatv.co.kr/leports/"" target=""_blank"" title=""새창 : 홈페이지로 이동"">http://beneatv.co.kr/leports/</a>"
배내골(울산),128197,자연,자연관광지,계곡,http://tong.visitkorea.or.kr/cms/resource/82/3077982_image2_1.bmp,울산광역시,129.0104800665,35.5331129203,"울주군 상북면과 양산시 원동면에 걸쳐있는 배내골은 영남 알프스라 불리고 있는 가지산 높은 봉우리들에 둘러싸여 있으며 산자락을 타고 흘러내리는 1급 청정수가 모여 한 폭의 그림을 연상케 하는 곳이다. 맑은 개울 옆으로 야생 배나무가 많이 자란다고 하여 배내골이라 한다는 이곳은 고지대 사이에 끼어 있는 긴 골짜기이기 때문에 일조량이 다른 곳보다 2시간 이상이나 짧고 맑은 계곡물이 계속 흘러내려 여름에도 냉기가 감돈다. 계곡의 아름다운 모습과 고로쇠 수액이 나는 곳으로 알려지면서 이곳을 찾는 관광객들이 많아졌다. 배내골계곡은 상수도 보호 구역으로 지정되어 있으며, 수심이 깊은 웅덩이와 급류 지역이 많아 물놀이와 취사 행위가 일절 금지되어 있다.","<a href=""http://tour.ulju.ulsan.kr/"" target=""_blank"" title=""울주 문화관광 사이트로 이동"">http://tour.ulju.ulsan.kr</a>"
배내골산골이야기,388123,숙박,숙박시설,펜션,http://tong.visitkorea.or.kr/cms/resource/38/388138_image2_1.jpg,경상남도,128.9685413082,35.4603425511,"밀양댐과 신불산휴양림이 있는 배내골, 에덴밸리 스키장이 갈라지는 배내사거리에서 배내골과 신불산 휴양림 쪽으로 내려가면 노르웨이 산장을 지나 고점교를 넘게 된다. 다리를 건너면 왼쪽에 성불사 가는 길이 곧바로 나서고 큰길은 작은 굽이를 돈다. 바로 그곳 성불사로 들어가는 삼거리에 전원카페처럼 예쁘게 생긴 산골이야기 펜션이 있다. 펜션에서 길만 건너면 밀양댐으로 흘러드는 배내천이 흐르고 뒤로는 예쁘게 지어진 전원주택단지가 있어 마치 스위스에 있는 알프스의 산속마을을 연상케 한다. 펜션 옆에는 작은 잔디마당이 있고, 통나무로 된 테라스도 상당히 넓다.",
배내골장선휴마을,128497,인문(문화/예술/역사),체험관광지,농.산.어촌 체험,http://tong.visitkorea.or.kr/cms/resource/52/2486152_image2_1.jpg,경상남도,128.9964710567,35.5015967617,"영취산 자락에 숨은 듯 자리잡고 있는 배내골 마을은 아직도 저녁이면 밥짓는 연기가 모락모락 나고 그 냄새가 풍겨 나는 곳이다. 떨어지는 석양이 장관을 이룬다는 이 마을엔 배내골 계곡의 1급 청정수가 흐르는 곳이기도 하다. 이곳은 밀양댐 상류에 위치해 친환경 무공해 농법으로 유명한데 율무와 결명자, 들깨 등이 농약 없이 자라고 있다. 또 사과와 채소, 대추 등도 생산된다.맑은 개울 옆으로 야생 배나무가 많이 자란다 하여 배내골 (梨川洞) 이라 하는 이곳은 옛부터 산세가 험해 일반인들의 출입이 여의치 못한 관계로 아직까지 태고의 비경을 간직하고 있다. 특히 배내골에는 많은 명소가 있지만 대표적인 명소로 파래소폭포, 통도골, 철구소 등이 있다.<br />*  배내골마을의 다양한 체험 프로그램 *<br />양산시 배내골은 도시민을 위한 농촌 체험 프로그램 팜스테이에 참가하고 있다. 이 마을에서는 봄이면 가재나 개구리 잡기 등도 이뤄지고 산간마을답게 농사 체험은 감자·고구마·옥수수 심기, 가꾸기, 따기가 주종을 이룬다. 특히 마을 노인회가 준비하고 있는 윷놀이나 제기차기, 팽이돌리기, 자치기 등의 전통 놀이도 체험할 수 있다. 그리고 1급수에서만 서식하는 민물고기와 산가지, 탱가리, 메기, 가재, 소라등 보기 힘든 물고기를 볼 수도 있다.","<a href=""https://www.yangsan.go.kr/tour/main.do"" target=""_blank"" title=""새창 : 양산문화관광 홈페이지로 이동"">https://www.yangsan.go.kr/tour/main.do</a>"
배내골참민물장어,2574030,음식,음식점,한식,,울산광역시,129.357749012,35.5589665145,"울산광역시 북구에 위치한 배내골참민물장어는 넓은 주차공간과 쾌적한 시설로 편안한 마음으로 식사를 즐길 수 있는 장어 전문점이다. 국내산 토종 민물장어인 자포니카만 사용하고 있으며, 잡내 없이 깔끔한 맛과 담백함이 일품인 곳이다.",
배내의아침,387673,숙박,숙박시설,펜션,,경상남도,128.9726024749,35.4455109604,"배내의아침은 양산 배내골 계곡 옆에 있는 펜션이다. 양산 배내골은 영남알프스 봉우리인 영축산, 신불산, 간월산, 천황산 자락에 있는 계곡으로 20km에 걸쳐 있는 깊은 계곡으로, 배내의아침에서는 맑은 계곡과 배내골의 아름다운 풍경을 감상할 수 있다. 펜션 바로 뒤에 넓은 암반 위로 맑은 계류가 흐르는 계곡이 있고, 배내골을 이루는 산 어깨들이 끝없이 펼쳐진 풍광 좋은 곳이다. 두 개의 건물이 계곡을 따라 나란히 배치되어 있고 1층은 연인과 가족을 위한 작은 방이, 2층은 단체팀을 위한 큰 방들로 꾸며져 있다. 독채도 별도로 운영하며 독채 예약은 전화로만 받고 있다. 에덴밸리스키장과 가까우며 겨울에는 스키샵을 운영한다.",
배너미오토캠핑장,2732139,레포츠,육상 레포츠,"야영장,오토캠핑장",http://tong.visitkorea.or.kr/cms/resource/45/2732245_image2_1.jpg,경상북도,129.0027020463,35.665703396,"경북 청도에 있는 오토캠핑장으로 청도의 대표 관광지인 삼계리 계곡과 가깝다. 부산, 울산, 대구 등 근교의 도심에서 1~2시간 이내 거리로 접근성이 좋다. 캠핑장 가까운 곳에 운문사, 국립 운문산자연휴양림 등이 있어 연계 관광도 쉽다. 50여 개의 사이트는 나무 그늘에 들어와 한여름에도 쾌적한 환경에서 캠핑을 즐길 수 있다.","<a href=""http://www.bcamp.kr/"" target=""_blank"" title=""새창 : 배너미오토캠핑장 사이트로 이동"">http://www.bcamp.kr/</a>"
배다리,2679382,음식,음식점,한식,http://tong.visitkorea.or.kr/cms/resource/10/2677910_image2_1.jpg,경기도,127.1131664115,36.9970670484,오리고기와 닭고기를 판매하는 곳이다. 경상북도 안동시에 있는 한식전문점이다. 대표메뉴는 오리주물럭이다.,
배다리 성냥 박물관,3411281,인문(문화/예술/역사),문화시설,박물관,http://tong.visitkorea.or.kr/cms/resource/62/3411562_image2_1.JPG,인천광역시,126.6377491619,37.4729535051,,
배다리 아트스테이1930,2848495,인문(문화/예술/역사),문화시설,컨벤션센터,http://tong.visitkorea.or.kr/cms/resource/83/2848483_image2_1.jpg,인천광역시,126.6367686979,37.4728896065,"배다리 아트스테이 1930 은 인천광역시 동구청이 기획, 조성하고 잇다스페이스에서 협업으로 운영하는 아트커뮤니티 공간이다. 일제강점기 조선인들의 삶의 애환이 닮긴 터전이자, 6‧25 전쟁 이후 피난민들의 처절한 생존을 방증하는 역사적 산물이다. 1930~1950년대 근대문화가 녹아있는 배다리 여인숙 골목을 재생하여 새로운 문화의 씨앗을 심고, 지역민과 유기적으로 소통하고 연계하여 지역의 랜드마크로 자리매김하여 동구 문화예술의 기반이 되고자 기획한 프로젝트로 지역의 문화, 예술을 발전시키고 체류형 관광거점을 마련하고자 한다.","<a href=""https://www.instagram.com/art_stay_1930/"" target=""_blank"" title=""새창 : 배다리 아트스테이1930 인스타그램 페이지로 이동"">https://www.instagram.com/art_stay_1930/</a>"
배다리 헌책방 골목,2554180,인문(문화/예술/역사),산업관광지,기타,http://tong.visitkorea.or.kr/cms/resource/29/3370329_image2_1.jpg,인천광역시,126.6361298698,37.4727868292,"배다리 헌책방 골목은 인천의 역사와 함께해 온 서민들의 삶터로 인정받고 있다. 5개 서점이 자리를 지키고 있고, 국문학 고서 자료에서부터 미술, 음악, 한방, 어린이 전집류, 사전류 까지 모든 서적을 통틀어 취급하고 있다. 또한, 골목 입구에 들어서면 낡은 골목의 담에 배다리 사람들의 옛 모습과 생활 등을 그려 넣은 배다리 벽화거리를 만날 수 있으며 최근 드라마 ‘도깨비’ 촬영지로 인기를 끌면서 방문객이 끊이지 않고 있다.","<a title=""새창 : 배다리 헌책방 골목"" href=""https://www.icdonggu.go.kr/tour/sights/map.jsp#usedbook"" target=""_blank"">https://www.icdonggu.go.kr/tour</a>"
배다리낚시터,2753131,레포츠,수상 레포츠,민물낚시,,경기도,127.1511815924,37.5209487608,"수도권에서 접근성이 좋은 서하남에 위치한 낚시터로 면적은 약 8,300㎡ 정도이다. 평지임에도 수심은 포인트마다 차이가 있고  3.5 ~ 5m 정도로 비교적 깊은 편이다. 전통이 있는 낚시터이다 보니 바닥에 슬러지(침전물)가 많지만 손맛터로 입소문이 나 있다. 그늘막이 있는 좌대가 있고 자리마다 선풍기를 준비했다. 낚시 장비가 없어도 현장에서 대여도 가능하다. 고기가 많아 초보자도 낚시의 참맛을 느낄 수 있으며 정기적으로 열리는 리그 형태의 대회가 있어 실력을 뽐내기에 좋다.",
배다리면사무소,2678879,음식,음식점,한식,http://tong.visitkorea.or.kr/cms/resource/67/2675967_image2_1.jpg,경기도,127.1155772184,37.0002028409,"평택 소사벌지구에 위치한 파스타 전문점이다. 배다리 호수가 보이는 배다리 면사무소에서 맛있는 파스타, 리조또, 샐러드를 즐길 수 있다.",
배다리생태공원,2750338,자연,자연관광지,자연생태관광지,,경기도,127.1194101477,37.0022804471,"도심에 있는 큰 규모의 공원으로 가족들과 나들이하기에 좋은 곳이다. 나무 데크 길과 운동기구, 쉼터 등이 잘 조성되어 있으며, 공원을 산책하다 보면 중간중간 저수지도 보인다. 공원 내 걷기 코스 길은 A코스과 B코스로 나뉘어 있다. 배다리 생태공원은 도심 속에 만들어진 깨끗한 자연환경 덕분에 환경부 지정 멸종위기 야생동물인 수원청개구리(Ⅰ급)와 금개구리(Ⅱ급)의 서식처이기도 하다.  조류 관찰대도 있어 오리, 뻐꾸기, 기러기, 왜가리 등의 다양한 새들을 관찰할 수 있다.",
배다리지,2750342,자연,자연관광지,강,http://tong.visitkorea.or.kr/cms/resource/69/2750569_image2_1.png,경기도,127.119265751,37.0010222567,"배다리 호수를 끼고 공원이 잘 조성된 저수지로 도심 속에 자리 잡고 있어 접근성이 좋다. 저수지 한가운데 분수가 있어 분수 가동 시간에는 분수 쇼도 볼 수 있다. 낮에는 자연과 어우러진 아름다운 풍경을 볼 수 있고, 밤에는 조명과 어우러진 멋진 야경을 볼 수 있다. 주변의 산책길을 걸으며 건강도 챙기며 힐링하기 좋은 곳이다.",
배두둑호박넝쿨마을,128341,인문(문화/예술/역사),체험관광지,농.산.어촌 체험,http://tong.visitkorea.or.kr/cms/resource/27/3388827_image2_1.JPG,강원특별자치도,128.4026891251,37.4736107626,"평창강 위에 선애교라는 이름의 교량이 놓이지 않았을 때에 이 마을에 들어가려면 배를 타야만 했다. 배를 타고 언덕을 올라가듯 한다고 해서 배두둑이라는 마을 이름이 생겨났다. 이 마을은 원래 소나무가 많은 언덕이라고 해서 솔언덕이라고도 했다. 배두둑 마을은 평창강을 건너서 산자락 밑에 아늑하게 자리 잡은 곳으로 좌청룡, 우백호의 풍수지리에 잘 맞는 지형이다. 장미산, 승두봉 등이 병풍처럼 둘러 쳐져 마을에 들어서면 분위기가 아늑하다. 감자와 배추 등 농산물과 민물고기가 많이 생산되는 산촌이다.  특히 여름철이면 금당계곡 래프팅, 겨울철이면 눈썰매 타기, 산토끼 잡기 등을 체험할 수 있다. 배두둑마을은 한국관광공사의 자매결연마을이기도 하다. 상안미라는 지명은 이곳에서 생산되는 쌀이 맛있기로 유명해서 붙여진 이름이다.","<a href=""https://700farmstay.modoo.at/"" target=""_blank"" title=""새창 : 홈페이지로 이동"">https://700farmstay.modoo.at/</a>"
배러댄센트,2930442,쇼핑,쇼핑,공예/공방,http://tong.visitkorea.or.kr/cms/resource/30/2930430_image2_1.jpg,경상북도,129.3666844771,36.0401346478,"포항시에 위치한 캔들공방 배러댄센트는 포항문화예술창작지구 꿈틀로에 위치한 공방이다.
캔들공방 뿐만 아니라 다양한 공방들이 모여있는 곳으로 체험식 여행에 도움이 되며, 포항의 중심지 육거리 부근에 위치하여 여러 관광지에 이동이 편리한 장점이 있다. 더불어 가까운 거리에 죽도시장과 실개천이 흐르는 중앙상가가 있어 여행 코스를 결정하기에 좋은 선택지가 될 것이다. 포항에서 특별한 추억을 남기고 싶다면, 가볍게 한번 들러보기 좋다.","▪ <a href=""https://www.instagram.com/betterthanscent/""target=""_blank"" title=""새창 : 공식인스타 이동"">https://www.instagram.com/betterthans</a>"
