title,contentid,cat1,cat2,cat3,firstimage,region,mapx,mapy,overview,homepage
여수노블호텔,3056466,숙박,숙박시설,관광호텔,,전라남도,127.7472983053,34.7179011904,"노블호텔은 돌산대교를 지나 여수 가막만 바다가 끝없이 펼쳐지는 돌산도의 아름다운 경도 앞바다와 어촌마을을 전경으로 해돋이, 해넘이와 여수 밤바다 야경 등 다채로운 자연 풍경을 감상할 수 있는 휴식 공간이다. 오션뷰와 시티뷰, 온돌룸, 패밀리룸 등 방문객의 다양한 니즈에 맞춰 객실 타입을 선택할 수 있다. 기존 일반 고객을 위한 더블룸과 트윈룸, 디럭스룸 등 기본 객실은 기본이며 프라이빗 풀빌라룸은 취사가 가능하며 개인 수영장이 룸 안에 있어 물놀이와 휴식을 편안하게 즐길 수 있는 객실이다. 최대 인원 8명까지 수용이 가능해서 아이들이 있는 가족들이 모여 1박을 하며 숙박을 할 수 있다. 
펫룸을 이용할 경우 6kg 이하의 반려견 최대 2마리까지 동반이 가능하나 맹견은 투숙이 불가하다. 식기, 배변판, 패드, 방석은 구비되어 있으며 반려동물용 사료는 별도로 준비해서 입실해야 하며 객실 내 반려견만 두고 외출은 절대 불가하다.
근처에는 여수 라마다호텔의 짚트랙과 여수해상케이블카가 있고 차량 이동 10분 거리에 핫플레이스인 여수낭만포차거리가 있어 다이내믹하고 낭만적인 여행을 즐기기 좋다.",
여수당,2822668,음식,음식점,서양식,,전라남도,127.7353376803,34.7399374051,"여수당은 여수의 명물, 인순신 광장의 대표 먹거리이다. 여수당만의 4번 볶은 특제소스로 만든 매콤 바삭한 바게트 버거는 방문객들의 발길을 끊임없이 할 정도로 맛이 좋다. 또한 인스타그램에서 꾸준히 핫한 쑥, 옥수수 아이스크림도 맛뿐만 아니라 비주얼도 여행객들의 마음을 사로잡는다. 웨이팅이 늘 있을 정도로 붐비지만 기다리는 시간이 아깝지 않다는 후기가 많다.",
여수대표짬뽕,2923420,음식,음식점,중식,http://tong.visitkorea.or.kr/cms/resource/01/2923401_image2_1.JPG,전라남도,127.6512246899,34.77555696,"여수대표짬뽕은 여수시 선원동의 짬뽕이 유명한 곳으로, 대기해서라도 먹고 싶은 맛집이다. 전용 주차장을 보유하고 있으며, 주문과 동시에 조리에 들어간다. 여수 금오도에서 채집한 방풍 잎을 사용해 반죽한 건강식 면을 넣어 만든 면요리가 메인이다. 쫄깃쫄깃한 면발에 해산물과 고기가 들어간 빨간 짬뽕, 깊이 있는 국물 맛의 하얀 짬뽕, 스트레스가 풀릴 정도로 매운 고추짬뽕, 해산물 가득 유슬짜장 등 다양하게 주문할 수 있다. 해물볶음밥, 잡탕밥 등 밥류, 고소한 맛의 등심 탕수육, 새콤달콤한 소스를 얹은 찹쌀탕수육, 매콤한 사천탕수육, 통통한 새우를 바싹하게 튀긴 레몬크림새우, 고추잡채만두 등 요리류도 맛있다. 성산공원, 여수 선사유적공원 등 식후 산책코스도 좋다.",
여수돌게빵,2931161,음식,음식점,카페/전통찻집,http://tong.visitkorea.or.kr/cms/resource/55/2931155_image2_1.jpg,전라남도,127.7217612627,34.7331268212,"여수 돌게빵은 게장으로 유명한 봉산 게장 거리에 있는 수제빵 전문점으로 여수에 가면 꼭 맛봐야 할 재미있는 간식거리다. 여수의 특산품인 돌게를 한 입 크기의 사이즈로 만들고 그 안에 팥 또는 슈크림을 넣어 달콤하게 만들었다. 귀여운 모양 덕분에 인스타그램에서는 돌게빵 인증 열풍이 불기도 했을 정도다. 매장을 방문하지 않아도 전국으로 택배 배송이 가능하고, 매장을 방문했다면 선물용 포장도 할 수 있어 여수 기념 선물로 구매하기에도 좋다. 만약 5봉지 이상 단체 주문 시에는 예약하는 것을 추천한다. 매장은 작은 편이며, 매장 안쪽에 두 테이블 정도 앉아서 커피를 마실 수 있는 공간이 마련되어 있다. 이곳에서 판매하는 음료는 30가지가 넘을 정도로 다양하다. 아메리카노를 비롯해 라테류와 과일 맛 우유, 스무디, 프라페 등 취향대로 고르면 된다.
※ 반려동물 동반 가능","<a href=""https://instagram.com/luv_yeosu?igshid=1ujcwx6v3cjr6""target=""_blank"" title=""새창 : 여수돌게빵 사이트로 이동"">https://instagram.com/luv_yeosu?igshid=1ujcwx6v3cjr6</a>"
여수동동북축제,3406027,인문(문화/예술/역사),축제,일반축제,http://tong.visitkorea.or.kr/cms/resource/02/3406002_image2_1.jpg,전라남도,127.6613631714,34.7566398102,"여수동동북축제 는 고려 가요 「동동(動動)」의 지역적·문화적 정체성을 분명히 하고 여수의 숨은 역사적 인물인 유탁(柳濯) 장군을 널리 알리기 위하여 창안한 축제이다. 여수동동북축제 의 주요 내용은 거리 북 퍼레이드, 개막식, 메인 아티스트 초청 공연, 드럼 경연 대회, 스페셜 버스커 공연, 시민 프린지 공연, 시민과 함께하는 마스터 클래스, 그 외 다양한 체험 행사가 진행된다.  체험행사에는 어린이부터 노인들까지 다양하게 참여 가능하며, 그 중 시민들이 직접 참여하여 거리를 행진하는 북 퍼레이드는 해가 갈수록 다양한 참가자의 참여로 시민들의 호응을 얻고 있다. 체험행사 뿐만 아니라 공연 부분에서도 다양하게 프로그램을 준비하여(EDM쇼, 초대가수공연, 북 연주 등) 시민들에게 볼거리를 제공하고 있다.",
여수돼지국밥,2923380,음식,음식점,한식,http://tong.visitkorea.or.kr/cms/resource/59/2923359_image2_1.JPG,전라남도,127.6619656723,34.7654971619,"여수 돼지국밥은 수육과 돼지국밥만을 판매하는 지역 맛집으로 여수 시내 거북선공원 근처에 있다. 포장하는 손님도 많은 집으로, 아침 9시에 오픈해 아침식사가 가능하다. 뚝배기 한가득 푸짐한 돼지고기에 콩나물을 듬뿍 넣어 끓인 시원하고 깨끗한 매운맛의 돼지국밥이 사람들 입맛을 돋우고, 잡내 없이 야들야들한 수육은 삶은 부추와 김치에 싸서 먹으면 그 부드러운 맛이 입안을 가득 채운다. 현지인들이 추천하는 찐 맛집이라 한 번 맛보면 다시 찾고 싶은 집이다. 돼지국밥 뿐만 아니라 수육도 꼭 같이 먹어봐야 한다.",
여수맛집 봉초밥,2923354,음식,음식점,일식,http://tong.visitkorea.or.kr/cms/resource/23/2923323_image2_1.jpg,전라남도,127.6576051572,34.7570341456,"가게 내부에는 칸막이가 있는 방도 있고, 홀 그리고 2층까지 있다. 룸은 신발 벗고 편안하게 의자에 앉아 식사할 수 있게 되어 있고 홀에는 4명~6명씩 앉을 수 있는 테이블이 가득하다. 단, 룸이 많지는 않기 때문에 프라이빗한 모임이나 식사를 하기 전에 예약하기를 추천한다. 한식, 일식, 복어조리기능사를 보유한 일식 장인이 매일 새벽 시장에서 공수해 온 좋은 재료로 음식을 만든다. 대표 메뉴는 봉모둠 초밥, 활어 초밥, 스테이크 초밥, 한우육사시미 초밥, 연어 초밥, 모둠 초밥이다.",
여수메아리글램핑장,2792255,레포츠,육상 레포츠,"야영장,오토캠핑장",http://tong.visitkorea.or.kr/cms/resource/46/2797746_image2_1.JPG,전라남도,127.5669455592,34.7913454025,"텐트, 조리기구, 가구 없이도 미리 조성된 글램핑장에서 즐기는 캠핑이 하나의 여행 트렌드로 떠올랐다. 여수 메아리 글램핑장은 거문도, 백도, 오동도, 금오도, 복개도, 여자도, 모개도라 불리는 7개의 숙소가 마련되어 있다. 각 글램핑장 안에는 침대, 테이블, 전자레인지, 밥솥, 헤어드라이어, TV, 냉장고, 에어컨 등이 잘 갖춰져 있고, 숯을 빌려 바비큐를 할 수도 있으니 캠핑 분위기를 물씬 내기 좋다. 캠핑 장비를 이고 지고 갈 필요 없이 몸만 가서 설거지와 주변 정리만 깨끗하게 하고 나오면 된다. 또한 무선 인터넷이 제공되어 밤새 무제한으로 영화나 드라마도 편하게 즐길 수 있다.","<a href=""https://meariglamping.modoo.at/"" target=""_blank"" title=""새창 : 여수메아리글램핑장 사이트로 이동"">https://meariglamping.modoo.at/</a><br><a href=""https://blog.naver.com/meari_s2""target=""_blank"" title=""새창 : 업체블로그 이동"">https://blog.naver.com/meari_s2</a>"
여수명동게장,2861323,음식,음식점,한식,,전라남도,127.7219445843,34.7329573998,"게장으로 유명한 여수에서 맛보는 게장 맛집 식당이다. 넓은 주차장과 넓은 매장 덕에 여행 시 불편함 없이 식당 이용이 가능하고
인기 메뉴로는 갈치조림 돌게장 정식이 있다. 특히 비린내 없이 맛있는 게장을 맛볼 수 있는 것이 가장 큰 매력이며
게장은 3번 리필이 가능하다.  또한 메인 음식뿐만 아니라 밑반찬으로 물갓김치도 별미이다.",
여수모터보트협회,3008327,레포츠,레포츠소개,수상레포츠,http://tong.visitkorea.or.kr/cms/resource/12/3008312_image2_1.jpg,전라남도,127.7592549584,34.7428680471,"오동도 입구 동백열차 타는 곳 옆에 위치해 있다. 오동도에 가는 방법은 도보로 가거나 유람선, 동백열차, 모터보트를 이용할 수 있다. 여수 모터보트협회의 모터를 이용해 오동도를 방문하는 것은 바다에서 오동도의 아름다운 기암괴석을 전체적으로 조망할 수 있는 장점이 있다. 모터보트의 속도를 조절하여 오동도의 절경을 천천히 감상할 수 있으며 멀미가 나지 않도록 속도와 강약을 조절하며 운행을 한다. 빠른 속도감과 함께 상하좌우로 흔들리는 배를 타면서 짜릿한 스릴을 즐길 수 있으며 덤으로 시원한 바람도 마음껏 즐길 수 있는 여수에서의 특별한 체험이다.
안전을 위해 구명조끼를 착용한 후 탑승하면 출발한다.",
여수미술관,3008371,인문(문화/예술/역사),문화시설,미술관/화랑,http://tong.visitkorea.or.kr/cms/resource/57/3008357_image2_1.jpg,전라남도,127.6601548244,34.7613614826,"여수시청에 인접한 여수미술관은 여수시의 문화 창조에 기여하고 지역민과 소통하는 글로벌 융합 미술관이다. 여수 미술과 생동하는 국제적 현대미술의 가치의 흐름을 이해하고 시대와 장르를 초월한 복합미술관으로 관객과 함께 공유하고 소통하는 문화적 공간을 지향한다. 
해마다 신년 기획 행사로 띠 전을 열며, 꾸준히 기획전과 초대전 등을 진행하고 있다. 저소득층 아동을 대상으로 한 미술 힐링 프로그램과 인문학 스토리텔링 강의, 저녁 음악회 등 지역민과 공감하고 공유하는 공연과 전시를 이어가고 있다. 또한, 여수시 소라면 복산 2구 경로당 앞 담장에 벽화를 그리는 봉사 활동을 진행하는 등 미술관 안에서만이 아닌, 밖으로 나가 지역과 소통하는 미술관이다.
여수미술관은 여수 지역 1호 사립 미술관으로 2016년 3월 화인갤러리를 시작으로 2018년 여수미술관으로 명칭을 변경하였다.","<a href=""http://www.yeosumuseum.co.kr/"" target=""_blank"" title=""새창 : 홈페이지로 이동"">http://www.yeosumuseum.co.kr/</a>"
여수바다장어구이,2765242,음식,음식점,한식,http://tong.visitkorea.or.kr/cms/resource/35/2765335_image2_1.jpg,경기도,127.1004127533,37.3682711129,"여수바다장어구이는 분당 궁내동 산지 직송 장어구이 전문점이다.  장어구이도 판매하지만, 별미인 하모 샤부샤부가 인기 있는 메뉴이다. 늦봄부터 초가을까지 남해안에서 잡히는 갯장어인 하모는 바닷장어의 일종이다. 장어 샤부샤부는 시즌 5월~10월까지만 판매한다. 자연산 바닷장어는 참숯불구이와 양념구이가 있다. 양념은 간장이나 고추장 선택이 가능하다. 하모회는 양파 위에 올려 갓김치와 먹으면 음식궁합이 좋다. 후식으로 칼국수와 죽이 있다.",
여수밤바다 힐링파크 호스텔,2697941,숙박,숙박시설,게스트하우스,,전라남도,127.7571144031,34.706522079,"여수밤바다 힐링파크 펜션은 확 트인 바다와 아름다운 해넘이 특히 다른 펜션에서는 볼 수 없는 바다에 그려지는 환상적인 야경이 황홀감을 자아내게 만들고 각 실마다 넓은 잔디마당이 있어 자연을 즐길 수 있는 가족, 연인들이 편히 쉬어 갈 수 있는 곳이다.","<a href=""http://www.badanoeul.co.kr""target=""_blank"">http://www.badanoeul.co.kr</a>"
여수밤바다관광농원야영장,2744402,레포츠,육상 레포츠,"야영장,오토캠핑장",http://tong.visitkorea.or.kr/cms/resource/70/2744670_image2_1.jpg,전라남도,127.7571144031,34.706522079,"여수밤바다 힐링파크는 이름처럼 여수밤바다를 보며 힐링할 수 있는 다기능 복합리조트이다. 낮에는 확 트인 바다와 아름다운 해넘이를 보고 밤에는 환상적인 야경을 연출하는 아름다운 입지를 갖고 있다. 펜션, 글램핑시설, 카라반으로 이루어져 있으며 특히 펜션은 전 객실 오션뷰를 자랑한다. 넓은 잔디마당이 있고 객실 앞 단독 테라스가 있어 바다 전망을 바라보며 바비큐 파티를 즐길 수 있다. 글램핑시설과 카라반도 캠핑에 필요한 비품이 준비되어 있어 먹거리만 준비하면 된다. 시설은 전체적으로 보기에도 깔끔하고 최신식 시설로 이루어져 있다. 곳곳에 이용자들이 편리하게 이용할 수 있는 공간을 많이 조성했다. 수영장 앞엔 평상과 데크가 있고 파라솔도 있어 수영을 하거나 구경하는 사람 모두 편하게 사용할 수 있고 인조 잔디 족구장이 마련되어 있어 간단한 운동도 가능하다. 또한, 인근에 여수엑스포, 해상케이블카, 아쿠아플라넷, 돌산공원, 방죽포해변, 해양수산박물관 등 유명 여수 관광지들이 있어 캠핑과 더불어 관광하기 좋다.","<a href=""http://www.badanoeul.co.kr/fhtml/"" target=""_blank"" title=""새창 : 여수밤바다관광농원야영장 사이트로 이동"">http://www.badanoeul.co.kr/fhtml/</a>"
여수밤바다불꽃축제,2874909,인문(문화/예술/역사),축제,일반축제,http://tong.visitkorea.or.kr/cms/resource/72/3393672_image2_1.jpg,전라남도,127.7469836066,34.7508669389,"여수시는 365개의 섬과 바다가 보석처럼 빛나고 여수 밤바다와 야경이 있는 빛의 도시이다. 여수불꽃축제는 2012 여수세계박람회 유치를 기원하기 위한 국제박람회기구[BIE] 실사단을 환영하는 행사로 2007년 4월 처음 개최되었다. 이어 2008년부터 2010년까지는 세계불꽃경연대회로 명칭이 변경되었고, 프랑스와 독일, 일본, 포르투갈 등에서 참여하여 각국의 다양한 불꽃으로 여수의 바다를 아름답게 연출하였다.","<a href=""https://www.yeosu.go.kr/ysff"" target=""_blank"" title=""새창 : 여수밤바다불꽃축제 홈페이지 이동"">www.yeosu.go.kr</a>"
여수밥상갈치야,2783343,음식,음식점,한식,http://tong.visitkorea.or.kr/cms/resource/37/2783537_image2_1.jpg,전라남도,127.7874281776,34.6066309983,"여수 밥상 갈치야는 향일암에서 차로 5분 거리에 위치해 있는 갈치 요리 전문점이다. 5대째 이어온 전통방식으로 갈치는 여수수협 경매를 통해 최상급 국산 갈치만 사용하고 있다. 가게 내부의 깔끔한 인테리어와 통유리를 통해 내다보이는 오션뷰를 감상하며 식사를 즐길 수 있다. 천연양념과 육수를 사용한 갈치야 조림과 소금 간을 한 갈치야 구이, 여수 서대(가자미과)를 새콤달콤하게 무친 서대 회무침이 대표 메뉴이다. 간장게장과 꼬막무침이 기본 반찬으로 나오고 나물 반찬, 메추리알, 갓김치, 멸치 등이 함께 상에 오른다.
식사 후 정원을 거닐며 시원한 바닷바람을 즐길 수 있다.",
여수선사유적공원,2778024,인문(문화/예술/역사),휴양관광지,공원,http://tong.visitkorea.or.kr/cms/resource/00/2796000_image2_1.jpg,전라남도,127.6462722638,34.7788065099,"2002년에 개장한 여수선사유적공원은 발굴조사에서 다양한 문화재와 함께 고인돌, 암각화, 통일신라 시대 와요지 2기 등 중요한 가치를 지닌 선사유물과 유적이 발굴되면서 공원으로 조성되었다. 공원을 들어서면 가장 먼저 보이는 화장동 유적지에서 조사된 와요지는 반지하식 굴가마로, 기와의 문양과 기법 등이 통일신라 시대에 사용되었던 가마라고 볼 수 있다고 하는데, 엄청난 크기에 압도된다. 2001년부터 유적공원 부지에 생활공간인 철기시대 무주 타원형 움집과 고상 가옥, 저장고를 세우고 자연 속에 노출된 바위와 동굴 벽에 새겨놓은 동물상, 기하학적 상징 문양인 암각화, 지석묘군 등을 전시, 복원해 지금의 공원 모습을 갖추었다. 야외학습장, 포토존과 야생화 단지, 핑크뮬리도 볼 수 있어 어린이들과 함께 산책도 하고 역사와 문화를 만날 수 있는 공원이다.",
여수세계박람회 스카이타워,3080532,인문(문화/예술/역사),건축/조형물,유명건물,http://tong.visitkorea.or.kr/cms/resource/27/3080527_image2_1.jpg,전라남도,127.7469836066,34.7508669389,"여수세계박람회 스카이타워는 여수세계박람회장과 여수엑스포역 인근 부두에 위치한 타워이다.
이 타워는 과거 여수역(현 여수엑스포역) 시멘트 사일로로 쓰이다가 폐기된 것 2기를 재활용하여 예술적 상징물로 탈바꿈하여 2012년 여수세계박람회(엑스포)에 활용하였다. 폐기된 건축물을 재활용했다는 점에서 친환경 박람회에 걸맞은 기념비적 공간이며, 여수의 관문인 여수엑스포역 옆에 우뚝 서 있어 이제는 여수의 랜드마크가 되었다. 타워 내부에서는 바닷물을 담수화하는 과정을 볼 수 있고 높이 67m의 최고층 전망대에서는 박람회장 전경과 여수시가지, 남해 및 오동도까지 한눈에 감상할 수 있다.
주변에는 여수세계박람회장, 여수엑스포역 외에 여수거북선호 남해안크루즈 선착장, 오동도 등이 있어 연계하여 둘러볼 수 있다.","<a href=""https://www.expo2012.kr/web/bbs/content.php?co_id=sub012_02"" target=""_blank"" title=""새창 : 홈페이지로 이동"">https://www.expo2012.kr</a>"
여수수산물특화시장,132413,쇼핑,쇼핑,상설시장,http://tong.visitkorea.or.kr/cms/resource/06/1784506_image2_1.jpg,전라남도,127.7329074152,34.7368682624,"여수수산물특화시장은 여수 바다에서 갓 잡은 생선, 해삼, 낙지, 멍게, 꽃게 등 수출 전략 어종을 수족관에 담아 놓고 즉석요리를 제공하는 횟집 상가로 여수시의 특화시장 중 하나이다. 약 100여 명의 상인이 종사하고 있다. 돌산대교 인근에서 끌어올린 해수를 정수·살균하여 각 매장의 수족관에 공급하여 활어의 신선도를 유지하고 있다. 수산물 온라인 쇼핑몰도 운영하고 있다.","여수수산물특화시장 <a title=""새창: 여수수산물특화시장 홈페이지로 이동"" href=""http://sijangyeosu.mf24.net/"" target=""_blank"">http://sijangyeosu.mf24.</a>"
여수수산시장,2783118,쇼핑,쇼핑,상설시장,http://tong.visitkorea.or.kr/cms/resource/06/2787606_image2_1.jpg,전라남도,127.7317935902,34.7381847622,"여수수산시장은 50년 역사의 수산물 전통시장으로, 여수 3대 수산시장 중 규모가 가장 크다. 여수수산시장은 전통시장의 정겨움을 느낄 수 있는 데다가 2011년 현대화시설 작업을 마쳐 쾌적한 분위기를 형성하고 있어 전통시장의 장점과 현대적인 장점을 모두 갖추고 있다. 특히 여수수산시장은 물메기, 볼락, 횟감용 삼치 등 수도권 수산시장에서는 쉽게 접할 수 없는 어종을 만나볼 수 있고 저렴한 가격에 구매할 수 있다. 시장은 크게 활어, 건어물, 먹거리로 나뉘어 있는데, 활어시장은 지하 400m 수중 해수관을 통해 깨끗한 청정해수를 사용해 싱싱한 해산물을 자랑한다. 이곳의 건어물은 여수수산시장 건물 옥상에 위치한 가공처리장에서 직접 건어물들을 가공하고 해풍에 건조해 판매한다. 먹거리시장에서는 여수의 특산물인 갓김치와 젓갈 등을 판매한다. 신선한 해산물로 만든 다양한 먹거리가 있는 야시장도 있는데 2016년 바이킹 야시장을 개장한 후 더욱 볼거리와 즐길 거리가 풍성해졌다.","<a href=""https://blog.naver.com/dion0007"" target=""_blank"" title=""새창 : 여수수산시장 사이트로 이동"">https://blog.naver.com/dion0007</a>"
여수숙박 호스텔,2624114,숙박,숙박시설,게스트하우스,,전라남도,127.6494609688,34.7750347655,여천 버스 터미널에서 300미터 거리에 위치한다.,"<a href=""http://xn--o79ap80a5peea11ea889c7tb898c90f.com/main/""target=""_blank""> http://xn--o79ap80a5peea11ea889c7tb898c90f.com/main/</a>"
여수시문화원,129984,인문(문화/예술/역사),문화시설,문화원,http://tong.visitkorea.or.kr/cms/resource/12/1971112_image2_1.jpg,전라남도,127.7456895756,34.7390626825,"삼국시대부터 사람이 거주했던 여수는 통일 신라시대에 작은 마을에 불과하여 고으리라고 하였다가 고려 태조 23년(940) 처음으로 여수라 했다고 전한다. 여말 선초부터 수군기지로 부각되기 시작한 여수는 성종 10년(1479)에 전라좌수영으로 승격되고, 고종 32년(1895) 혁파되기까지 417년 동안이나 남해안 방어의 주진으로 국방상 중요한 임무를 다해왔다. 또한, 1948년 여, 순 사건 발발로 이념 싸움의 비극을 경험하기도 하였다. 이처럼 여수는 오래된 역사와 지리적 위치에 따른 다양한 지역문화가 발전하였다. 이에 여수시문화원은 지역의 고유문화 전승과 발전을 위해 향토유물 자료관 운영, 유적지 순례 등 지역의 역사를 배우고 향토 문화를 계승하여 현대 문화와 접목시키는 사업을 시행하고 있다. 더불어 여수 시민들을 대상으로 한 평생교육 및 문화학교를 운영하고 있다.","<a href=""http://www.yeosuculture.or.kr/"" target=""_blank"" title=""새창 : 여수시문화원 홈페이지로 이동"">http://www.yeosuculture.or.kr</a>"
여수시민회관,129727,인문(문화/예술/역사),문화시설,공연장,,전라남도,127.7279020442,34.7468392816,"1970년대에 들어서면서 전라남도 여수 지역은 수산업이 호황을 맞이하는 등 지역 경제가 발전하였고, 이와 더불어 지역 문화 예술 활동도 같이 활발해졌다. 그러나 전문 공연 시설이 없어서 다실에서 전시 공간을 마련하는 등 문화 예술 환경이 너무나 열악하였다.
이에 여수 지역의 문화 예술인과 여수 시민이 주축이 되어 성금을 모아 여수시민회관을 마련하고자 하는 공감대가 형성되었으며, 여수시에서도 지역 문화 예술 발전에 이바지하고자 구체적인 지원을 시작하였다.
1987년 6월 28일 개관한 여수시민회관은 960석의 대공연장을 가지고 있으며, 1993년 5월에 준공한 진남문예회관은 266석의 소공연장과 전시실 2관을 갖추고 있다. 여수의 대표적인 문화시설로 문화예술공연과 각종 강연 및 공공행사를 개최하여 편안한 쉼터로서의 역할을 하고 있다.","여수시청 <a href=""http://www.yeosu.go.kr/"" target=""_blank"" title=""새창 : 여수시청 홈페이지로 이동"">http://www.yeosu.go.kr</a>"
여수신항 (여수엑스포항),2795106,자연,자연관광지,항구/포구,http://tong.visitkorea.or.kr/cms/resource/28/2797828_image2_1.jpg,전라남도,127.7541303976,34.7432290287,"여수엑스포역에서 도보로 5~7분 떨어진 곳에 여수 엑스포항이 있다. 이곳은 제주도까지 갈 수 있는 대형 여객선을 탈 수 있는 항구로 더 잘 알려졌다. 여수에서 제주까지 거리는 203km, 약 5시간 반이 소요된다. 차량을 싣고 갈 수 있어 자차를 이용하는 관광객들이 주로 찾는다. 꼭 항구를 이용하지 않더라도 이곳의 풍경을 즐기려는 현지인과 관광객도 많다. 엑스포 항의 바다 건너편에는 붉은 꽃망울의 동백꽃으로 유명한 오동도가 자리하고 있으며 근처에는 다도해 공원과 엑스포 공원이 조성돼 있어 바다 풍경을 보며 걸어보기에 좋다.",
