title,contentid,cat1,cat2,cat3,firstimage,region,mapx,mapy,overview,homepage
온천집,2866328,음식,음식점,일식,http://tong.visitkorea.or.kr/cms/resource/21/2866321_image2_1.jpg,대전광역시,127.4368220949,36.3369403104,"온천집은 대전광역시 동구 소제동에 있다. 세월의 흔적이 엿보이는 외관과 감성적인 분위기를 연출하는 인테리어가 눈에 띈다. 외부에는 수목이 식재되어 있고 연못이 조성되어 있어 운치를 더한다. 대표 메뉴는 북해도식 수프 카레, 소고기, 갖은 채소를 함께 즐기는 북해도식 얼큰한 샤부샤부다. 바삭바삭한 눈꽃 튀김 등을 맛볼 수 있는 트뤼프 튀김 덮밥을 비롯해 비프스테이크 정식, 온천집 1인 샤부샤부 등도 준비되어 있다. 대전 IC와 대전 지하철 1호선 대전역에서 가깝다. 주변에는 대전중앙시장과 대동하늘공원이 있다.",
온천집 익선,2902549,음식,음식점,한식,http://tong.visitkorea.or.kr/cms/resource/69/2997169_image2_1.jpg,서울특별시,126.9898308866,37.5740591309,"온천집은 연못과 정원을 품은 '중정'을 보유하고 있던 한옥 의 느낌을 살려 중정을 온천 정원으로 꾸며, 어느 방향에서도 온천을 바라보며 식사를 즐길 수 있게 설계되었다. 또한 눈이 내린 듯한 백자갈의 바닥, 매일 불을 때우는 정원 한편의 화로 거기에 이끼가 자라나는 나무 욕조 등 실제 온천 여관에 온 듯한 분위기를 충실히 재현한 것이 특징인 공간다.","<a href=""http://www.glowseoul.co.kr""target=""_blank"" title=""새창 : 온천집 사이트로 이동"">http://www.glowseoul.co.kr</a>"
온천천 카페거리,3017076,인문(문화/예술/역사),체험관광지,이색거리,,부산광역시,129.1024592605,35.1916279693,"벚꽃으로 유명한 온천천변에 관광객이 많이 모이기 시작하더니, 안락동 주택가에 2011년 경부터 작은 카페들이 들어서면서 카페거리가 형성되었다.
현재 약 150여 개의 매장들이 모여 카페, 음식점, 주점, 공방 등이 조화를 이루고 있고, 온천천 카페거리에서만 느낄 수 있는 특색과 개성 있는 매장들이 가득하다.
최근에는 레스토랑과 음식점이 많이 들어서고 있어서 브런치나 식사를 위해 이곳을 찾는 손님들이 늘고 있고, 식사 후엔 온천천의 풍경을 즐기며 티타임을 갖기도 하고, 온천천 시민공원을 산책하는 사람들이 많다.
봄에는 벚꽃이 만개하여 아름다운 벚꽃동산을 만들고, 온천천을 따라 조성한 유채꽃이 가득한 지역으로 하얀 벚꽃과 노란 유채꽃을 보러 오는 사람들로 붐비는 곳이다.",
온천천시민공원,2789280,인문(문화/예술/역사),휴양관광지,공원,,부산광역시,129.0951293179,35.1925221783,"연제구 연산동의 황폐화된 온천천을 자연에 가까운 하천으로 정비하고, 시민들의 정서 함양에 기여하고자 1997년부터 2005년까지 자연형 하천 조성 사업을 벌여 온천천 시민 공원이 들어서게 되었다. 식물 경관 조성, 조명·벤치, 체력 단련 시설 등을 조성하였다. 공원은 자연형 친수 공간·자연 학습장 구간·문화 체육 시설 구간의 3개 구간으로 구분하여 특성화하고 온천천을 유역 주민들에게 제2의 생활공간으로 제공하고 있다. 온천천 시민 공원은 2005년에 정식으로 개장하였으며, 지속적으로 개·보수를 하여 현재에 이르고 있다.",
온하루,2807985,음식,음식점,카페/전통찻집,,울산광역시,129.2948075414,35.5497441442,"울산 중구에 위치한 온하루는 케이크 전문점이다. 예쁜 디자인의 케이크들이 준비되어 있다. 특별한 날, 그 하루의 온기와 설레임을 전하기 위해 최선을 다하고 있다.","<a href=""https://www.instagram.com/onharu__"" target=""_blank"" title=""새창 : 온하루 인스타그램 페이지로 이동"">https://www.instagram.com/onharu__</a>"
온화가,3101940,숙박,숙박시설,펜션,,강원특별자치도,128.8870034927,37.7587760086,"강원도 강릉 교동 구시가지에 위치한 온화가는 50년 넘은 구옥을 천장의 서까래와 외벽을 최대한 살리고 심플하고 따뜻한 공간으로 재탄생시킨 숙소다. 숙소는 침실, 플레이룸, 거실, 주방 다이닝룸, 화장실, 정원으로 구성되어 있다. 취사는 불가능하고 침실에는 저상형 침대가 놓여 있어 아이들 동반 숙소로도 손색이 없다. 스타일러, 스탠바이미, 빔프로젝트, 아이패드도 구비되어 있다. 따뜻하고 편안한 쉼을 오롯이 즐기기를 추천한다.","<a href=""https://www.stayfolio.com/findstay/onhwaga"" target=""_blank"" title=""온화가(으)로 이동"">https://www.stayfolio.com/findstay/onhwaga/</a>"
"온화하고 경건하게, 천주교 성지 여행",2519127,추천코스,힐링코스,힐링코스,http://tong.visitkorea.or.kr/cms/resource/37/1056337_image2_1.jpg,Unknown,128.6300555188,36.0168095465,한티는 경상북도 칠곡군 동명면 득명리에 위치한 해발 600m가 넘는 깊은 산골이다.,
온화한 시골마을 봉화,1949891,추천코스,나홀로코스,나홀로코스,,Unknown,128.7369030517,36.9312961805,봉화는 구릉이 져 있는 산으로 둘러싸인 경북 제일의 산악지대에 있다. 그래서 산은 푸르고 하늘은 드 높다. 전형적인 시골 마을을 이루는 이곳은 농촌 체험하기 좋은 곳이기도 하고 무엇보다 경관이 아름다운 마을이다. 이 코스는 봉화의 산세와 자연을 그대로 즐기는 코스로 힐링하기 딱 좋다.,
