title,contentid,cat1,cat2,cat3,firstimage,region,mapx,mapy,overview,homepage
흥법사지,127118,인문(문화/예술/역사),역사관광지,유적지/사적지,http://tong.visitkorea.or.kr/cms/resource/31/3394231_image2_1.JPG,강원특별자치도,127.8149461223,37.338259829,"흥법사는 신라시대에 창건된 사찰이었으나 지금은 없어졌고 사지에는 흥법사지 삼층석탑과 진공대사탑비의 귀부와 이수가 남아 있을 뿐이며, 사찰터 주변 일대는 농경지로 변했다. 고려사 세가 태조 23년조에 ''왕사충잠사수탑우원주영봉산흥법사친제비문''이라는 기록이 있다. 충잠은 진공대사의 속명으로 신라대 사람인데 당나라에 가서 수도하고 돌아와 고려 건국 후 태조의 왕사가 되었다. 태조 23년(940)에 입적하자 태조가 비문을 친찬하였다고 하였으나, 고려 초기에 이미 이곳에 흥법사가 있었음을 알 수 있다. 흥법사지에는 국보 흥법사 염거화상탑, 진공대사탑 및 보물 부석관, 보물 진공대사탑비 귀부 및 이수, 보물 흥법사지 삼층석탑이 있었으나, 이중에서 국보 흥법사 염거화상탑, 진공대사탑 및 보물 부석관은 1931년 일본인들에 의해 강제로 일본에 반출되었다가 경복궁 경내로 옮겨졌으며, 용산 국립중앙박물관이 개소되면서 경내에 보관하고 있다. 현재 이곳에는 흥법사지 삼층석탑과 진공대사탑비 귀부 및 이수만이 옛 자리를 지키고 있다.","<a href=""https://www.heritage.go.kr/heri/cul/culSelectDetail.do?culPageNo=1&region=1&searchCondition=%ED%9D%A5%EB%B2%95%EC%82%AC%EC%A7%80&searchCondition2=&ccbaKdcd=31&ccbaAsno=00450000&ccbaCtcd=32&ccbaCpno=3413200450000&ccbaCndt=&ccbaLcto=&stCcbaAsdt=&endCcbaAsdt=&header=view&returnUrl=%2Fheri%2Fcul%2FculSelectViewList.do&pageNo=1_1_1_0&p=multiSch&sortType=&sortOrd=&sngl=Y&s_kdcdArr=00&s_ctcdArr=00&ccbaPcd1Arr=99&ccbaGcodeArr=00"" target=""_blank"" title=""새창: 국가유산청 홈페이지로 이동"">www.heritage.go.kr</a>"
흥복사(김제),488345,인문(문화/예술/역사),역사관광지,사찰,,전북특별자치도,126.906802339,35.82865016,"흥복사는 대한불교 조계종 제17교구 본사 금산사의 말사이다. 650년(의자왕 10) 고구려에서 온 보덕이 창건하여 승가사라 하였다. 여러 차례 중건과 중수를 거듭하였으나 현재로서는 알 수 없고, 1597년(선조 30) 정유재란 때 절은 완전히 불타버려 절은 폐허가 되어 버렸다. 1625년(인조 3) 김제에 살던 흥복 처사가 부처님의 감응을 받아 이 절을 기원도량으로 삼아 극락전을 중건하면서 절의 이름을 흥복사라 불렀다. 그 뒤 절은 다시 퇴락하였는데 근대에 들어와서는 1943년 법운  스님이 극락전과 관음전 등을 중수하면서 본격적으로 발전하기 시작하였다. 1954년 불교정화운동  때는 교단의 행정본부가 되었으며, 1961년에는 월주 스님이 금산사와 흥복사의 주지를 겸임하면서 전라북도 지역 불교정화운동의 핵심역할을 했다. 1976-1979년에 걸쳐서 대대적 중창 불사가 거행되어 절의 면모가 일신되었다. 절에는 대웅전을 비롯해서 미타전, 미륵전, 삼성각, 사천왕전, 정혜원(요사), 요사 및 수각인 불유각 등 여러 채의 건물이 널찍널찍하게 자리 잡고 있다. 사찰 경내에는 수령 600년 가량의 신단수와 설천이라는 우물이 있다.",
흥부가,2739436,음식,음식점,한식,http://tong.visitkorea.or.kr/cms/resource/58/2759758_image2_1.jpeg,경기도,126.9116450686,37.4220476088,항상 노력하고 끊임없는 고민을 통해 정갈한 한정식을 준비하는 음식점이다. 세트정식이 인기 메뉴이며 별도로 보쌈과 족발도 주문할 수 있다. 좋은 서비스와 깔끔한 위생관리로 쾌적한 식사환경을 제공 하고 있다. 2018년 모범업소로 지정받은 바 있으며 같은 해 안양시건축문화상을 받은 경력이 있다.,"<a href=""https://heungbooga.modoo.at/"" target=""_blank"" title=""새창 : 흥부가 사이트로 이동"">https://heungbooga.modoo.at/</a>"
흥부가,2807541,음식,음식점,한식,,경상북도,128.6145287081,36.8074886017,신선한 육회를 맛볼 수 있으며  반찬종류도 다양하여 함께 육회를 즐길 수있다.,
흥부가(家),2609878,숙박,숙박시설,한옥,,전북특별자치도,127.1519697428,35.8151642613,"흥부가는 거품 없는 가격, 편안하고 ᄁᆞᆯ끔한 공간, 추억을 만들 수 있는 공간을 방문객들에게 제공하기 위하여 2015년 7월 30일 전통 한옥 흥부가를 신축 오픈하였다.",www.heungbuga.com
흥부골남원추어탕,2787395,음식,음식점,한식,http://tong.visitkorea.or.kr/cms/resource/36/2790636_image2_1.jpg,전북특별자치도,127.6051888742,35.4597208111,"지리산 나들목, 인월면에서 진국 남원 추어탕을 먹을 수 있는 곳이다. 남원에서 대대로 내려오는 전통 방식으로 추어탕을 만들어 칼칼하면서도 뒷맛이 맑은 진짜배기 추어탕을 맛볼 수 있다. 흥부골 남원 추어탕은 자체적으로 양식한 100% 국내산 미꾸라지를 사용하고 있다. 주메뉴인 추어탕을 비롯해 보양식으로도 훌륭한 산양 산삼 추어탕, 바삭바삭한 미꾸리 깻잎튀김이 있고 미꾸라지를 갈아서 당면과 같이 만든 추어군만두는 어린이들에게도 인기 만점이다. 인근에 광한루, 흥부 마을 등의 관광지가 있다.",
흥부골숯불갈비,2891628,음식,음식점,한식,http://tong.visitkorea.or.kr/cms/resource/83/2878083_image2_1.jpg,인천광역시,126.4233569849,37.6969847598,"흥부골숯불갈비는 강화도 양도면 인산 1리 마을회관 인근에 있다. 매장 앞 주차장이 넓어 승용차로 방문 시 편리하다. 이곳은 강화 현지인도 추천하는 왕갈비탕과 숯불갈비 맛집이다. 신발을 벗고 입장해야 하는 내부는 4인 테이블을 기본으로 20여 석이 있어 가족모임이나 단체 회식이 가능하다. 메뉴는 소갈비, 돼지왕갈비, 돼지갈비, 갈비탕, 비빔냉면, 물냉면 등이 있다. 밑반찬으로 열무김치, 청포묵 무침, 감자샐러드, 상추무침, 마카로니샐러드, 양파슬라이스 간장소스, 겉절이, 양념게장, 된장찌개, 쌈 등이 푸짐하게 나온다. 식당 인근에 인산저수지, 계암산, 외포항 등이 있어 연계 관광을 할 수 있다.",
흥부골숯불돼지왕갈비,2847149,음식,음식점,한식,http://tong.visitkorea.or.kr/cms/resource/40/2847140_image2_1.jpg,서울특별시,127.0985729204,37.5057884611,"흥부골숯불돼지왕갈비 식당은 석촌동 나인파크 골목 석촌호수 서호 뒤편에 위치해 있다. 매장은 넓은 편이고, 날씨가 좋으면 창가 테라스 창을 다 열어 놓아 야외 분위기를 느낄 수 있어 좋다. 이곳의 대표메뉴는 돼지왕갈비로, 음식을 주문하면 밑반찬으로 물김치, 순두부, 양파지, 게장, 계란찜 등이 차려진다. 고기를 구울 때 숯불을 사용하고, 직원이 구워주기 때문에 편하게 식사를 할 수 있다. 숯불돼지왕갈비 외에도 점심메뉴로 갈비곰탕과 육개장, 설렁탕, 냉면 등이 있다.",
흥부골자연휴양림,2795178,자연,자연관광지,자연휴양림,http://tong.visitkorea.or.kr/cms/resource/68/2796868_image2_1.JPG,전북특별자치도,127.5872436242,35.4449249475,"남원시 인월면에 위치한 자연휴양림으로 2002년에 개장하였다. 덕두산 정상까지 이어지는 등산로가 개설되어 있는데 휴양림에서 덕두산 정상까지는 약 1시간 30분 정도 걸린다. 산자락에 수령 약 55년의 잣나무 군락이 있어 삼림욕을 하기에 좋고, 경관 또한 뛰어나다. 덕두봉은 지리산에서 아침햇살을 제일 먼저 받는 곳이다. 정상에 올라서면 동쪽에서 서쪽으로 이어지는 천왕봉을 위시한 제석봉, 촛대봉, 영신봉, 명선봉, 토끼봉, 반야봉, 노고단, 만복대를 비롯한 1,500m급의 지리산 연봉들을 모두 조망할 수 있다. ‘지리산 태극 종주’라는 테마의 지리산 종주가 있는데, 지리산의 서북 능선의 첫 봉우리인 덕두봉을 포함해 웅석봉까지의 도상 72㎞의 코스인 주 능선과 함께 지리산 동부 능선으로 이어지는 형상이 태극무늬와 비슷하다 하여 ‘지리산 태극 종주’라고 부른다.","<a href=""https://www.foresttrip.go.kr/indvz/main.do?hmpgId=ID02030101"" target=""_blank"" title=""새창 : 흥부골자연휴양림홈페이지로 이동"">https://www.foresttrip.go.kr/indvz/main.do?hmpgId=ID02030101</a>"
흥부네 대청마루,1604867,음식,음식점,한식,,전북특별자치도,127.3868148929,35.4147720836,흥부네 대청마루는 목우촌 돼지고기만을 사용하여 요리하고 있다.,
흥부네밥상,2892548,음식,음식점,한식,http://tong.visitkorea.or.kr/cms/resource/44/2892544_image2_1.jpg,강원특별자치도,128.6321461084,38.1124633633,"흥부네밥상은 강원도 양양에 있는 한식 전문점이다. 인제군 필례약수로 돌솥 밥을 지은 약수 돌솥 밥은 피부병, 위장병, 숙취 해소에 좋다고 한다. 강원도 곤드레나물을 넣어 지은 곤드레 돌솥 밥도 인기 메뉴이다. 돌솥 밥을 짓는 시간을 기다리기 어렵다면 공깃밥으로 상을 차리는 흥부네 밥상도 있다. 밥맛이 좋은 집으로 농협과 농민신문사에서 선정한 곳이다. 제철 생선구이, 불고기, 강원도 산채와 장아찌, 김치로 한 상을 제공한다. 곁들임으로 용대리 황태구이나 매콤한 더덕구이를 추가해 풍성하게 즐길 수도 있다. 주차는 매장 앞에 전용 주차장이 있어 이용이 편리하다. 올해부터 저녁 식사는 하지 않으니 방문할 때 영업시간과 영업 여부를 꼭 확인하고 가야 한다.","<a href=""https://blog.naver.com/timidhm""target=""_blank"" title=""새창 : 흥부네밥상 사이트로 이동"">https://blog.naver.com/timidhm</a>"
흥부네칼국수보리밥,2911788,음식,음식점,한식,http://tong.visitkorea.or.kr/cms/resource/74/2911774_image2_1.jpg,대전광역시,127.3521417724,36.3001707897,"흥부네칼국수보리밥은 대전광역시 서구 가수원동에 있다. 깔끔한 분위기를 연출하는 외관과 차분한 느낌의 인테리어로 이루어졌다. 대표 메뉴는 각종 나물과 양념장을 넣어 비벼 먹는 보리밥이다. 이 밖에 김치찜, 바지락칼국수, 얼큰이칼국수, 들깨칼국수, 해물파전, 미니족발 등을 판다. 서대전IC에서 가깝고, 주변에 대전오월드와 장태산자연휴양림이 있다.",
흥부랑놀부랑,2671170,음식,음식점,한식,http://tong.visitkorea.or.kr/cms/resource/49/2671049_image2_1.jpg,경기도,127.103920259,36.9886123039,"조개터에 위치한 흥부랑놀부랑은 갈치쌈정식, 고등어쌈정식을 부담없는 가격에 푸짐하게 즐길 수 있는 가심비 뛰어난 조림정식, 영양돌솥밥 전문점이다. 흥부랑놀부랑에 찾아주신 분들께는 집에서 엄마가 해주신 맛으로 정성을 다해 모시겠다.",
흥부보쌈,2689404,음식,음식점,한식,http://tong.visitkorea.or.kr/cms/resource/55/2685055_image2_1.jpg,서울특별시,126.9295306249,37.482751992,직장인 회식 및 모임을 하기 좋은 곳이다. 서울특별시 관악구에 있는 한식전문점이다. 대표메뉴는 보쌈이다.,
흥부암(김해),488414,인문(문화/예술/역사),역사관광지,사찰,,경상남도,128.8700563327,35.2263892341,"* 김해를 번성하게 해주는 절, 흥부암 *
호랑이가 웅크리고 있는 형국을 하는 김해 임호산(林虎山) 꼭대기 가파른 자리에 위치한 가야불교의 성지 흥부암(興府庵)은 가락국의 수로왕 때 장유화상(長遊和尙)이 도성의 흥성을 빌기 위해 세운 사찰이다. 신비로운 땅 ‘가락국’을 둘러싸고 있는 산들은 예로부터 그 형상이 거북, 용, 호랑이 등의 모습을 하고 있다. 이 때문에 김해 사람들은 언젠가는 이곳에서 수로왕 이후 사라진 훌륭한 임금이 다시 나올 것으로 믿고 있다. 이러한 기운을 간직한 임호산은 유민 산유민산, 가조산, 호구산, 안민 산안민산, 봉명산, 임오산임어산 등 여러 가지 이름으로 불리는데, 임호산(林虎山)은 이름 그대로 생긴 모양이 호랑이 머리와 같다 하여 붙여졌다고 한다.

특히, 호랑이가 입을 벌리고 김해를 향해 으르렁거리고 있는 형상이라 사람들이 불안함을 느껴 그 입을 막아 주기 위하여 흥부암을 지었다고 한다. 곧 김해 지방이 흥하게 된다고 하여 흥부암(興府庵)이라는 절 이름을 얻게 된 것이다. 옛 가야인들은 이곳에 도읍을 정할 때 이미 임호산의 사나운 기운을 느끼고 수로왕의 처남으로 허왕후를 따라 아유타국에서 온 장유화상이 절을 지어 가락국(김해)의 나쁜 기운을 눌렀다는 이야기도 전해진다.

1820년 곽기형이 쓴 흥부암 중수기에도 이 같은 내용이 언급되어 있는데, ‘김해의 오른쪽 안민산은 읍의 백호로 옛날 풍수사가 이 산에 나쁜 바위가 있어 읍에 이롭지 않다고 하였다. 그러한 까닭에 절을 세워 그 험함을 가렸다’라고 적고 있다. 흥부암이 풍수지리적으로 창건되었음을 증명이라도 하듯 최근에 새로 지은 대웅전의 주춧돌도 호랑이 석상이라는 사실이다. 흥부암 자체가 호랑이 입막음인데, 거기에 더해 호랑이 모양의 주춧돌을 대웅전 기둥 아래 놓아 아예 호랑이를 꼼짝 못 하게 짓누르고 있다.


* 흥부암의 창건배경 및 역사 *
옛 가야국의 중심지인 금관가야의 중앙에 위치한 흥부암은 허황후 오빠인 장유화상이 서기 48년에 창건한 사찰이라고 전하고 있다. 임호산의 풍수지리적 조건에 따라 가야국의 흥성을 빌기 위해 장유화상이 수로왕의 명을 받아 보탑을 세우고 절을 세웠다고 한다. 오랫동안 폐사가 되었다가 1700년 조선 숙종 때 새로이 중수하였는가 하면, 1760년 영조 때에도 중수를 하였다고 한다. 이어 1820년 조선 순조 때 부사 유상필의 적극적인 후원을 받아 법당 등의 전각을 중건하였으며, 19세기 중반에 김해 부사 정현석이 중창을 하여 법당을 중건하였는데, 당시에는 가람이 지금의 산령각 부근에 있었다고 한다. 이후 1985년에 화재로 소실된 것을 1989년 복원하였고, 1997년 부임한 주지 혜운 스님이 부설 김해불교대학을 운영하면서 김해인의 중심적 기도처이며, 가야 불교문화의 대표적 사찰로 자리 잡아 오늘에 이르고 있다.",
흥부제,1373481,인문(문화/예술/역사),축제,일반축제,http://tong.visitkorea.or.kr/cms/resource/46/2998546_image2_1.jpg,전북특별자치도,127.386615219,35.4028678706,"남원시 인월면 성산리와 아영면 성리는 <흥부전>의 발상지로 알려져있는데, 오래전부터 두 지역에 전해 내려오는 박첨지 설화와 춘보 설화에 근거하여 <흥부전>이 지어졌다고 한다. 남원시는 '흥부제'라는 이름으로 축제를 기획하여 1993년부터 매년 흥부제를 개최하고 있다. 흥부제는 흥부전에 담긴 <우애, 나눔, 보은, 행운>을 주제로 하고있으며, 전통문화를 현대적으로 해석한 축제 행사로 지역민과 관광객에게 볼거리와 체험거리를 제공하고 있다.","<a href=""http://www.heungbu.org/"" target=""_blank"" title=""새창 : 흥부제 홈페이지 이동"">www.heungbu.org</a>"
흥성동헌,1597891,인문(문화/예술/역사),역사관광지,고궁,,전북특별자치도,126.7001924599,35.5225092259,"흥성동헌은 선운산IC 인근 고창 흥덕면 소재지에 위치한 조선시대 관아 건물이다.
이 건물은 본래 흥덕객사로 알려졌었다. 그러나 1983년 해체보수하는 과정에 상량문이 발견되어, 이를 통해 동헌이었음이 밝혀졌다. 상량문에는 흥성읍성의 동헌을 1807년(순조 7)에 이전하였다고 적혀 있다. 흥성은 흥덕의 옛 지명인데, 1914년에 무장면과 함께 고창군에 통폐합되었다. 흥성동헌은 홑처마지붕을 얹은 정면 5칸, 측면 3칸으로 그 규모가 아담하다. 건물의 양쪽 끝에는 온돌방, 정면 세 칸은 마루를 깔았다. 보통 국왕의 위패를 봉안하고 국왕이 있는 수도를 향해 예를 갖추는 정당과 함께 좌우에 여러 물품을 보관하는 익실을 따로 두는데 흥성동헌은 한 건물 안에서 모든 업무를 해결하였다. 1976년에는 가치를 인정받아 전라북도 유형문화재로 지정되었다. 
주변에는 서해 줄포만, 동림저수지, 선운산, 선운사 등이 있어 연계하여 관광할 수 있다.","고창군 문화관광 <a href=""https://tour.gochang.go.kr/index.9is?iConUid=4028a69088fb2760018900a405a11bbe&contentUid=4028a690893f64f4018ba33f9100764a"" target=""_blank"" title=""새창 : 고창군 문화관광 홈페이지로 이동"">https://tour.gochang.go.kr</a><br>문화재청 <a href=""https://www.heritage.go.kr/heri/cul/culSelectDetail.do?pageNo=1_1_1_1&sngl=Y&ccbaCpno=2113500770000"" target=""_blank"" title=""새창 : 문화재청 홈페이지로 이동"">https://www.cha.go.kr</a>"
흥암서원,128743,인문(문화/예술/역사),역사관광지,유적지/사적지,http://tong.visitkorea.or.kr/cms/resource/03/3410803_image2_1.jpg,경상북도,128.1370407266,36.4179909193,"상주 흥암서원은 송준길(1606~1672)의 학문과 덕행을 추모하기 위하여 건립한 서원이다. 송준길은 문묘에 배향된 해동 18현 가운데 한 사람으로, 이이, 김장생, 김집으로 이어지는 기호학맥을 이은 학자이다. 조선 후기 경상북도 상주 지역에서 기호학맥을 계승한 서인·노론계 인사들은 상주 흥암서원을 중심으로 결집하였다. 1702년 상주 지역에 송준길을 제향 하는 상주 흥암서원이 건립되었으며, 1705년 ‘흥암’으로 사액되었다. 영남에서 최초로 건립된 서인·노론계 사액 서원이 되었으며, 왕으로부터 친필 편액을 받았다. 이에 호응하여 성이홍, 채징휴 등 원유들이 어필비를 건립하였다. 흥선대원군의 서원훼철령 때도 상주 흥암서원은 철폐되지 않았다. 이후 상주 흥암서원은 근대 학교로 활용되어 상주고등학교와 남산중학교가 발족하였으나 현재는 이건 하였다. 2005년 유교문화권 개발 사업의 일환으로 중수하였다.
상주 흥암서원의 건물로는 흥암사, 진수당, 진의재, 의인재, 어필비각, 내삼문 등이 있다. 흥암사는 향사를 지내는 사우로, 송준길의 위패가 봉안되어 있다. 동재인 진의재와 서재인 의인재는 유생들이 거처하던 곳이다.",
흥양3기,125811,자연,관광자원,기암괴석,http://tong.visitkorea.or.kr/cms/resource/45/757245_image2_1.jpg,강원특별자치도,127.9870958637,37.3857325386,"* 흥양이 자랑하는 돌 세 개, 흥양3기 *<br /><br />흥양3기는 원주시내에서 4km 떨어진 곳에 있으며, 첫째 것은 자식을 얻기 위해 치성을 드리는 여자바위, 둘째 것은 소의 머리를 떠오르게 하는 쇠세바위이며, 세 번째 것은 크기는 작지만 설악산의 흔들바위와 비슷한 흔들바위이다. 이 세 바위는 흥양이 자랑하는 명물이라고 한다.<br /><br />* 흥양3기가 있는 흥양리 *<br /><br />흥량리는 대부분 지역이 평지로 이루어진 전형적인 농촌으로 동쪽은 치악산 줄기인 삼봉과 투구봉으로 막혀 있고 남쪽은 장양천이 흐른다. 근처에 사래울소류지, 하초구소류지, 황골소류지가 있다. 자연마을로 돌모루, 뜀바우, 사래울, 살여울, 새두둑 등이 있다.<br>","<a href=""https://www.wonju.go.kr/tour/index.do"" target=""_blank"" title=""새창: 원주문화관광 홈페이지로 이동"">https://www.wonju.go.kr/tour/index.do</a>"
흥양읍성터 및 고흥옥하리홍교,126423,인문(문화/예술/역사),역사관광지,유적지/사적지,,전라남도,127.2852524733,34.6132772112,"[흥양읍성터]
고흥읍이 있는 자리는 세종 23년(1441) 흥양현이 생긴 이래 1914년에 행정명이 고흥군으로 개칭되기까지 흥양현이 있던 곳으로 고흥 읍내에는 흥양현 시절에 쌓은 읍성의 자취가 남아 있다. 
우선 고흥 존심당 역사문화공원 뒤편 비탈진 마을 길을 거슬러 올라가면 윗등성이에 성벽의 자취를 볼 수 있다. 성벽의 총 길이는 1.7km 가량이며, 흥양읍성터에는 성문, 성벽, 치성, 우물 등이 남아 있어 고흥군의 역사와 문화를 이해하는 데 중요한 역할을 하고 있다. 

[고흥옥하리홍교] 
고흥옥하리홍교는 조선 후기에 축조된 무지개 형태의 다리이다. 전라남도 유형문화재로 옥하리를 흐르는 너비 8~9m의 고흥천에 150m 간격으로 두개의 홍교가 있다. 
이 중 위쪽 홍교의 규모는 4.5m, 길이 8.7m로 비교적 큰 다리이다. 무지개 모양의 앞면에는 용머리를, 반대쪽에는 용 꼬리를 새겨 놓았다. 아래쪽 홍교는 규모가 높이 6m, 길이는 10m나 되며 위쪽 다리보다 규모가 크다. 형태는 위쪽의 것과 비슷하나, 용머리가 다리 아랫면 천장 중앙에 부착된 것이 앞의 홍교와 다르다. 이 다리에는 고종 8년(1871) 건립된 내용이 적혀있다.
두 다리 모두 조선 후기에 만든 것으로, 규모가 크고 장엄하다. 현재 두 다리의 정상이 지면보다 훨씬 높은데, 이는 후대로 내려오면서 지형이 바뀐 탓으로 추측한다.

흥양읍성터와 고흥옥하리홍교의 거리는 도보 8분 거리이다.","▪ <a href=""http://tour.goheung.go.kr/"" target=""_blank"" title=""새창: 고흥 문화관광 홈페이지로 이동"">http://tour.goheung.go.kr</a>"
