title,contentid,cat1,cat2,cat3,firstimage,region,mapx,mapy,overview,homepage
달빛고운월성마을,537938,인문(문화/예술/역사),체험관광지,농.산.어촌 체험,,경상남도,127.7424825607,35.7643192963,"남덕유산 동쪽 자락의 해발 600에 위치하고 있는 월성마을은 산간 지형에 자연적으로 부락이 형성된 전형적인 산촌마을로 마을 앞에는 작은 폭포와 여울을 만드는 월성계곡이 흐르고 있어 여름이면 물놀이를 하기에 좋다. 또한 계곡 옆 키 큰 나무들로 우거진 월성 숲은 시원한 그늘을 만들어 준다. 월성마을은 고랭지 농산물이 주 소득작물이며 표고버섯, 고랭지 야채, 10년산 산 더덕, 10년산 약 도라지, 사과, 우렁이쌀이 주 생산물이다.",
달빛곳간,3354268,인문(문화/예술/역사),체험관광지,이색체험,http://tong.visitkorea.or.kr/cms/resource/31/3354231_image2_1.png,전북특별자치도,127.2500360869,35.4927858852,"전북 임실군 삼계면의 박사골은 면단위로는 최고로 많은 박사 배출지로 유명하다. 이에 박사기념관과 박사골체험관, 팬션을 운영하며  비옥한 토지와 맑은 햇살을 품은  농산물을 사용 전국에서 유명한 박사골 전통엿을 만들고 수제 김부각을 오로지 우리 농산물로 만들어 판매하고 있다. 맑은 공기, 수려한 자연경관과 함께 박사골 체험관에서 휴식을 취할 수 있다.",
달빛공원,2738075,인문(문화/예술/역사),휴양관광지,공원,http://tong.visitkorea.or.kr/cms/resource/48/2738348_image2_1.jpg,경상북도,128.8026763811,36.3104210905,"달빛공원은 2012년 조성되었다. 의성 달빛공원 주변에 주월사라는 절이 있다. 주월사는 달이 머무는 절이라 하여 지어진 명칭이고, 주월사 인근에 공원을 조성하였다 하여 달빛공원이라 명명되었다.해 질 무렵엔 주월사를 방문하고 어둠이 깔리면 공원으로 나와 별자리를 찾아보면서 지친 마음을 달래기 좋다.",
달빛과쉬는시간,3023207,인문(문화/예술/역사),체험관광지,농.산.어촌 체험,http://tong.visitkorea.or.kr/cms/resource/47/3023147_image2_1.jpg,경기도,127.1622674083,37.0015090786,"도심가에 위치한 달빛과 쉬는 시간은 캠핑 감성을 느낄 수 있는 곳으로 2천 평이 넘는 공간에 조성되어 있다. 참나무 한방 통닭을 예약 판매하고 있고 셀프 바비큐장에 먹을거리만 준비해 오면 그 외 모든 것이 준비되어 있어 캠핑을 할 수 있다. 개별 물놀이장이 있는 돔은 하루 5팀만 입장이 가능하며 100% 예약제이고, 케어 키즈존으로 아이들의 안전은 부모가 직접 챙겨야 한다. 투명돔 내부에는 에어컨이나 난로가 설치되어 있다. 돔 내부에서 숯불 사용이 가능하지만 셀프 숯불 착화 시에는 화재 위험이 있어 외부에서 하여야 한다. 봄, 가을, 겨울에는 캠핑을 즐길 수 있고 여름에는 물놀이까지 즐길 수 있다.

돔마다 개별 풀이 있는 것이 가장 큰 장점이긴 하지만 11시부터 사용하는 팀만 수영장을 사용할 수 있어서 아쉽기도 하다. 얕은 물에 에어 바운서가 설치되어 있고 트램펄린과 잔디밭에서 아이들이 맘껏 뛰어놀 수 있다. 그 외 소방체험, 감자 캐기, 옥수수 따기, 고구마 캑 등을 지정된 날짜에 체험할 수 있고, 토끼, 닭, 산양 먹이주기 등은 항상 할 수 있다. 외부 음식이나 배달 음식이 반입되기 때문에 바비큐장 사용을 하지 않아도 식사 준비가 부담스럽지 않다. 돔 안에 회전목마가 설치되어 있어서 아이들이 재미있게 탈 수 있고 밤에는 불빛이 있어 아름답다.","<a href=""https://pf.kakao.com/_nhTGC"" target=""_blank"" title=""새창 : 카카오톡 채널로 이동"">https://pf.kakao.com/_nhTGC</a>"
달빛글램핑,2728580,레포츠,육상 레포츠,"야영장,오토캠핑장",http://tong.visitkorea.or.kr/cms/resource/35/2728635_image2_1.jpg,경기도,127.3376823109,37.9651004824,"달빛글램핑장은 명성산 자락에 있는 66,000m² 부지를 가진 글램핑장으로 2017년 7월 오픈했다. 사방이 자연림으로 둘러싸인 이곳은 총 10개 동으로 이루어져있다. 이곳은 산자락에 위치한데다 공기가 맑고 편안한 분위기다. 바쁜 도심 속 일상에 지친 사람들이 스트레스를 해소하러 조용히 쉬러 오기 좋은 곳이다. 이름처럼 어두운 밤, 글램핑장에 불빛이 켜지면 밤하늘에 달이 비추는 듯 감성적인 풍경이 펼쳐진다. 넓은 주차장이 있으며 각 동 앞에 해먹이 하나씩 설치되어 있다. 또한 각각 테이블이 설치되어 있어 식사나 티타임을 가지기 좋고, 바비큐 테이블이 설치되어 있어 캠핑의 꽃인 바비큐 파티를 즐길 수 있다. 특히 캠핑장 내에 텃밭이 있어 상추, 옥수수 등을 자유롭게 따먹을 수 있다. 내부에는 냉난방시설이 구비돼 있어, 추울 땐 따뜻하게 더울 땐 시원하게 보낼 수 있다. 또한 캠핑에 필요한 시설이 다 갖춰져 있어 가볍게 찾기 좋은 곳이다.","<a href=""https://moonlight.campingt.me/3362/home/index"" target=""_blank"" title=""새창 : 달빛글램핑 홈페이지로 이동"">https://moonlight.campingt.me/3362/home/index</a>"
달빛담은캠핑장,2734187,레포츠,육상 레포츠,"야영장,오토캠핑장",http://tong.visitkorea.or.kr/cms/resource/39/3069039_image2_1.jpg,전라남도,127.4122477195,34.8028109044,"달빛담은캠핑장은 벌교 갯벌의 특징을 잘 살린 자연 친화적인 캠핑장으로 아이들과 방문해 볼 만한 곳이다. 캠핑장 입구에 있는 매점이자 관리동인 보성 뻘배전시관에는 꼬막을 잡기 위해 사용했던 뻘배들이 진열되어 있고 갯벌에 대한 정보와 다양한 꼬막이 전시되어 있다. 달빛담은캠핑장이 무엇보다 좋은 점은 벌교 바다만의 매력을 100% 즐길 수 있다는 점이다. 이곳의 사이트는 총 3가지 종류로 놀이시설을 한눈에 볼 수 있는 중앙 사이트, 외각 쪽 데크 사이트, 벌교 바다를 만끽할 수 있는 사랑 사이트로 구성되어 있다. 
아이들에게 맞추어진 이 캠핑장에서는 벌교의 특징인 갯벌을 직접 체험해 볼 수 있으며 아이들이 가장 인기있는 체험은 레일 뻘배 체험이다. 레일 뻘배 이외에도 미끄럼틀 두 종류와 함께 시소가 있다. 이외에도 아이들이 모래놀이를 즐길 수 있는 공간이 별도로 있으며 미니 동물 농장과 수목원, 낚시터도 있어 캠핑을 하는 동안 즐길거리가 많다. 
달빛담은캠핑장은 낮이 주는 푸르름과 탁 트인 바다의 매력도 분명 좋지만 이름처럼 달빛이 내리쬐는 밤바다의 경치가 너무나도 멋진 캠핑장이다. 따로 전화번호는 없으며 온라인으로 예약하여야 한다.","<a href=""https://cafe.naver.com/dalbitcamping"" target=""_blank"" title=""새창 : 달빛담은캠핑장사이트로 이동"">https://cafe.naver.com/dalbitcamping</a>"
달빛뜨락,2843413,음식,음식점,한식,http://tong.visitkorea.or.kr/cms/resource/67/2843367_image2_1.JPG,전라남도,126.9412719243,35.2687448379,"달빛뜨락은 한식대첩3에서 전남 고수로 출연하여 전국 준우승을 하고, 식약처에서 저염음식점으로 지정, 전라남도에서 친환경 음식점으로 지정, 담양군에서 모범음식점으로 지정된 건강한 밥상으로 인정받은 곳이다. 전라남도 담양의 특산물인 죽순을 활용한 죽순 영계탕은 우수 문화상품으로 지정되기도 하였다. 매운맛, 쓴맛, 단맛, 이 세 가지 맛의 뿌리채소를 넣은 삼채삼계탕, 손수 만든 한약재와 전복이 들어간 전복삼계탕도 별미이다. 시골 들녘이 한눈에 들어와 알찬 밥상과 함께 풍경도 즐길 수 있다.",
달빛라운지,2662556,음식,음식점,카페/전통찻집,http://tong.visitkorea.or.kr/cms/resource/77/2662577_image2_1.jpg,경상남도,128.6047693598,35.1900606917,"달이 주는 사랑, 만남의 상징처럼 마음의 정화와 행복한 시간을 만드는 특별한 카페 '달빛라운지' 로 기존 카페와 차별화 된 고급원두, 수제청을 제공하여 커피 그 이상의 가치를 준다.",
달빛마을,899292,숙박,숙박시설,펜션,http://tong.visitkorea.or.kr/cms/resource/46/1843146_image2_1.jpg,강원특별자치도,128.82096141,37.237951469,강원도의 멋진 정취와 낭만이 있는 곳 달빛마을 펜션은 동서울에서 3시간이면 갈 수 있으며 좋은 휴식과 놀이가 있는 곳이다.,"<a href=""http://www.gomoonlight.co.kr"" target=""_blank"" title=""새창 : 달빛마을 홈페이지로 이동"">http://www.gomoonlight.co.kr</a>"
달빛마을,2847372,인문(문화/예술/역사),체험관광지,농.산.어촌 체험,,충청북도,127.5512311595,36.3427083572,Unknown,Unknown
달빛미소,2697421,숙박,숙박시설,관광호텔,,전라남도,126.7179158487,34.7405256433,월출산 아래 자리잡은 한옥마을에 있는 달빛미소입는 누마루에 앉아 천황봉을 볼 수 있다.,
달빛미소 [한국관광 품질인증/Korea Quality],2706641,숙박,숙박시설,한옥,http://tong.visitkorea.or.kr/cms/resource/51/2706151_image2_1.jpg,전라남도,126.717926959,34.7405200884,"달빛미소는 전라남도 강진 달빛한옥마을 내에 자리한 한옥 민박집이다. 세 개의 객실은 모두 온돌이 깔린 한실이다. 달빛방에는 누마루가 딸려 있고, 미소방에 묵으면 쪽마루를 함께 이용할 수 있다. 민속화와 옛 소품 등으로 꾸민 방은 아늑한 정취를 풍긴다. 누마루에 앉아 월출산국립공원의 수려한 풍경과 녹차밭에서 실려오는 향을 만끽할 수 있다. 푸짐한 조식도 일품이다. 차량 5~10분 거리에 백운동정원, 월출산국립공원 등이 있다.",https://blog.naver.com/dalbit-smile
달빛새 베이커리앤카페,2830203,음식,음식점,카페/전통찻집,http://tong.visitkorea.or.kr/cms/resource/90/2830190_image2_1.jpg,경기도,127.1631810923,37.6945426948,"경기도 남양주시 진접읍 밤섬에 있는 반려견 카페이다. 약 1,200㎡의 넓은 야외에 반려견 동반할 수 있는 분리된 장소와 빈백, 평상, 테이블 등 다양한 모양으로 좌석이 마련되어 있다. 건물 1층은 실내 테이블, 2층은 루프탑이 있다. 2층 루프탑은 캠핑 느낌이 나도록 A 텐트와 캠핑 의자가 비치되어 있다. A 텐트는 사전 예약이 필요하다. 좌석에서 기차가 지나가는 모습을 볼 수 있다. 메뉴는 아메리카노, 카페라테, 콜드브루 에이드 등 커피와 차가 있고, 각종 베이커리가 있다.  밤섬유원지가 인접해 있다. 진접터널 동쪽 입구와 카페 사이로 왕숙천이 흐르고 있다.","<a href=""https://blog.naver.com/dalbitse""target=""_blank"" title=""새창 : 달빛새베이커리앤카페 사이트로 이동"">https://blog.naver.com/dalbitse</a>"
달빛소리 수목원,2755480,자연,자연관광지,수목원,http://tong.visitkorea.or.kr/cms/resource/64/2755564_image2_1.jpg,전북특별자치도,127.0330409637,35.9398452252,"20여 년 전부터 전국 각지에서 수집한 희귀한 고목들로 2018년 6월 사설 수목원으로 개장하였다. 아담한 규모의 수목원으로, 기묘한 형상의 고목들을 곳곳에 배치한 것이 특징이다. 수목원의 마스코트인 '황순원의 소나기 나무', '첫사랑 나무'라고도 불리는 500년 된 느티나무와 청괴불나무, 삼각소나무, 연필향나무, 금목서&은목서 등 약 50여 종의 희귀목을 보유하고 있다. 봄에는 개나리, 진달래, 벚꽃이 피고, 여름에는 백합, 산나리꽃, 목화꽃이, 가을에는 천일홍, 백일홍, 금목서, 은목서, 단풍이, 겨울에는 동백나무꽃, 납매를 볼 수 있어 사계절 꽃 속에서 커피 한 잔과 함께 힐링을 느낄 수 있는 곳이다. (네이버 발췌)","<a href=""https://blog.naver.com/dal90651"" target=""_blank"" title=""새창 : 달빛소리 수목원 사이트로 이동"">https://blog.naver.com/dal90651</a>"
달빛수상레저,3017953,레포츠,레포츠소개,수상레포츠,http://tong.visitkorea.or.kr/cms/resource/75/3017875_image2_1.JPG,경기도,127.3440502567,37.6145552815,"경기도 남양주시 화도읍 북한강로에 위치한 달빛수상레저는 웨이크보드 국가대표 선수 출신의 강사들이 운영하는 곳으로 유명하다. 체계적인 강습을 받을 수 있어 웨이크보드나 수상스키 초보자들에겐 신뢰할 만한 곳이다.
이곳에서는 수상스키, 웨이크보드와 수상 놀이 기구를 즐길 수 있으며 꼭 수상 스포츠를 즐기지 않더라도 모터보트를 타고 북한강 일주를 할 수 있는 프로그램도 있어 누구나 부담 없이 이용할 수 있다.
깔끔하게 정리 정돈된 장비에 넓고 쾌적한 화장실과 드라이룸도 갖추고 있으며 2층 루프탑은 휴식을 취할 수 있도록 빈백 소파를 배치해 휴양지에 놀러 온 듯한 기분도 누릴 수 있다.
서울에서 1시간 정도만 달리면 탁 트인 자연환경과 물 맑은 북한강을 누리며 수상 스포츠도 즐기고 근처 유명 맛집과 베이커리 카페도 갈 수 있으니 여러 면에서 만족할 만한 선택일 것이다.
강습과 이용 요금에 관한 자세한 내용과 기상 상태에 따른 운영 방침 변경 등은 홈페이지를 통해 알아보면 된다.","<a href=""https://blog.naver.com/mario1080"" target=""_blank"" title=""새창 : 홈페이지로 이동"">https://blog.naver.com/mario1080</a>"
달빛쌈지공원,2625206,인문(문화/예술/역사),휴양관광지,공원,,경상남도,128.754461839,35.4957151737,"달빛쌈지공원은 낡은 수도공급시설인 배수지를 문화 및 휴게 공간으로 탈바꿈하여 지역주민과 내방객에게 제공하고자 조성되었다. 문화 및 휴게 공간으로 탐방 테크, 체육시설, 스탠드, 스카이로드 등을 조성해 다양한 볼거리와 휴식공간을 제공하고 있다.<br><br>밀양 내일동 지역에 위치한 달빛쌈지공원은 낡은 수도 공급 시설인 배수지가 있던 장소로 지금은 밀양의 문화공간과 휴게공간으로 탈바꿈하였다. 스카이로드(전망대)와 탐방 테크, 체육시설, 벽화와 스탠드 등 다양하게 조성되어 있으며 야외공원이라 탁 트여있고 24시간 언제든지 이용 가능하다.","<a href=""https://www.miryang.go.kr/tur/index.do""target=""_blank"" title=""새창: 밀양 문화관광"">https://www.miryang.go.kr/tur/index.do</a>"
달빛야경누리길,3357254,인문(문화/예술/역사),체험관광지,이색거리,http://tong.visitkorea.or.kr/cms/resource/24/3357224_image2_1.jpg,울산광역시,129.3244291381,35.5787414403,"성안동의 높은 지대에서 내려다 보이는 시티뷰는 대표적인 야경 명소이다. 이곳을 울산 중구청에서 달빛야경누리길로 새롭게 조성하였다. 길가에 바닥조명을 설치하고 여러 포토존을 설치하여 천천히 산책하면서 구경도 하고 사진을 마음껏 찍을 수 있다.
첫 번째 포토존인 ‘달빛누리길’은 함월유아숲체험원 입구 쪽에 위치하고 있다. 초승달 조명과 달빛누리길이라는 문구로 표시되어 있어 시작점을 정확하게 알 수 있다. 보름달 포토존은 구름과 별 조형물로 꾸며져 있는데 해가 졌을 때 각양각색으로 빛이 난다. 감성 글귀 포토존은 ＂넌 달인가 보다, 밤만 되면 떠오르는 걸 보니＂라는 글귀와 손하트 조형물이 설치되어 있어 커플끼리 사진 찍기 좋다.
마지막으로 ‘천국의 계단 포토존’은 공중에 떠있는 듯한 계단 사진을 찍을 수 있으며 은은하게 조명이 설치되어 있어 멋진 울산대교가 보이는 야경을 사진에 담기 좋다.",
달빛야영장,2792610,레포츠,육상 레포츠,"야영장,오토캠핑장",http://tong.visitkorea.or.kr/cms/resource/32/2800232_image2_1.JPG,경기도,127.583282043,37.5887932123,"경기도 양평군 단월면에 위치한 달빛 캠핑장 총면적 10,600㎡에 달하는 넓은 크기와 100년 된 은행나무, 수십 년 자란 계수나무, 참나무, 산딸나무, 왕벚나무, 은행나무, 단풍나무, 밤나무, 뽕나무 등 큰 아름드리 수목들이 캠핑장을 감싸고 있는 자연 친화적인 캠핑장이다. 캠핑장 주변으로는 높은 산들이 우뚝 서 있어 아늑한 분위기를 연출한다.
사이트는 모두 파쇄석으로 이루어져 있으며, 사이트 크기와 간격은 좁은 편이다. 부대시설로는 넓은 강당과 놀이 시설, 세미나실, 운동장, 수영장과 깨끗한 샤워실, 화장실, 개수대가 있고 어린이들을 위한 트램펄린까지 다양하게 마련돼 있다. 또한, 캠핑장과 계곡이 맞닿아있어 여름이면 캠핑장에서 운영하는 수영장과 더불어 좋은 피서 공간을 제공한다. 주변 관광지로는 대명비발디파크, 산음 휴양림, 용문산, 용문사 등 유명 관광지가 있고, 캠핑장 주변으로 임도 산책로가 있어 즐길 거리가 많은 캠핑장이다.",
달빛의 속삭임,2579611,숙박,숙박시설,펜션,,경상남도,128.1606821207,34.9145530722,"달빛의 속삭임 펜션은 밤하늘의 달과 별들이 하늘을 수놓는, 사랑이 함께 하는 공간으로, 상족암 군립공원과 고성공룡박물관이 내려다보이는 언덕에 자리 잡고 있다. 다양한 볼거리와 즐길거리가 있는 쾌적하고 편안한 가족의 휴식처로, 건물 곳곳에 예쁜 손그림과 꽃들이 어우러져 있으며, 아담하면서도 편하고 쾌적한 환경 덕분에 여행객들의 재방문이 많다.
(정보제공자: 고성군청)",
달빛이머무는집,397919,숙박,숙박시설,펜션,http://tong.visitkorea.or.kr/cms/resource/87/1958587_image2_1.jpg,경기도,127.498943857,37.4448527949,숲속의 별장 같은 느낌이 드는 달빛이 머무는 집 펜션은 잘 가꾸어진 넓은 정원과 그림 같은 전원 풍경 속에서 맑은 물 남한강의 저녁 노을을 바라보며 여유와 휴식을 취할 수 있는 곳이다. 게다가 펜션 내부에서도 바깥의 자연 풍경이 잘 들어오도록 배치하고 창을 크게 내었다.,"<a href=""http://www.moonfish.co.kr"" target=""_blank"" title=""새창 : 달빛이머무는집 홈페이지로 이동"">http://www.moonfish.co.kr</a>"
달빛정원글램핑,2763393,레포츠,육상 레포츠,"야영장,오토캠핑장",http://tong.visitkorea.or.kr/cms/resource/57/2763857_image2_1.JPG,경기도,127.4864184949,37.592965948,"서울에서 가까운 유명산글램핑(구 유명산캠핑장)은 경기도 가평군 설악면에 위치하는데 유명산 자락에 위치하여 조망 좋고 산속의 큰 나무가 만들어주는 그늘 속에서 행보한 시간을 보낼 수 있는 캠핑장이다.
캠핑장은 전체가 글램핑 단일 사이트로 6m×6m 24개동을 운영 중으로 유명산 방형으로 전실을 두고 있어 사이트 안에서 멋진 조망을 자랑한다. 지형적인 영향으로 캠핑장까지 길이 급경사가 있어 조심해야 할 것으로 보인다. 특히 일부 동은 잣나무 숲속에 사이트가 있는데 더없이 힐링하기 좋은 장소로  생각이 든다. 이용객을 배려하여 전자레인지를 별도로 공간에 설치해 놓았다.
관리실은 매점과 같은 건물에 있으며 깨끗하고 넓은 공용 샤워실, 공용 화장실 남녀 각각 설치하였다. 베비큐를 위한 용품을 매점에서 판매중이다.","<a href=""http://moonglamping.co.kr/"" target=""_blank"" title=""새창 : 달빛정원글램핑 사이트로 이동"">http://moonglamping.co.kr/</a>"
달빛축제공원,2767888,인문(문화/예술/역사),휴양관광지,공원,http://tong.visitkorea.or.kr/cms/resource/78/2781378_image2_1.jpg,인천광역시,126.6597659732,37.3953434658,Unknown,Unknown
달빛한옥 수류화개,2701356,숙박,숙박시설,한옥,http://tong.visitkorea.or.kr/cms/resource/65/2808465_image2_1.png,전라남도,126.7170159613,34.7391480054,"달빛한옥 수류화개는 전남 강진 달빛한옥마을에 자리한 포근한 한옥 민박으로, 수려한 월출산과 녹차향 가득한 다원이 주변을 둘러싸고 있어 자연의 정취를 느낄 수 있다. 객실은 별빛방과 달빛방 2개로, 두 방을 함께 예약하면 독채로 넓게 쓸 수 있다. 방마다 누마루와 개별 화장실을 두어 편의성을 더했다. 누마루의 창을 열면 창문 안으로 초록빛의 잔디마당과 밤하늘의 별 무리가 가득 들어찬다. 웰컴티와 무료 한식 조식이 제공된다.",https://dalbithanok.modoo.at/
달빛한옥체험 별유풍경,2570339,숙박,숙박시설,한옥,http://tong.visitkorea.or.kr/cms/resource/40/2991340_image2_1.jpg,전라남도,126.7189990939,34.7402229174,"달빛한옥체험 별유풍경은 황토와 편백나무, 흙 등의 자연 재료로 지어진 한옥스테이로, 전남 강진달빛한옥마을 골목 안쪽에 자리하여 고요한 분위기에서 한옥의 고즈넉함을 누릴 수 있다. 객실은 솔향기방과 편백나무방 두 개로, 객실마다 세워둔 편백 통원목가 피톤치드 향을 은은하게 풍기고, 거실 서까래와 목가구는 아늑함을 더한다. 마당은 색색의 꽃을 자랑한다. 텃밭에서 키운 무공해 채소들로 건강한 조식을 제공한다.",http://blog.naver.com/chh2658
달산포해수욕장,2758237,자연,자연관광지,해수욕장,,충청남도,126.2938995371,36.6619164197,Unknown,Unknown
달서구청소년수련관,1610250,레포츠,육상 레포츠,수련시설,http://tong.visitkorea.or.kr/cms/resource/77/1573877_image2_1.jpg,대구광역시,128.5596342372,35.807251427,"달서구청소년수련관은 대구광역시 달서구 상화로 420에 위치한다.  부지 6,488.9㎡, 건물 4,124.88㎡에 지하1층, 지상3층의 크기로  수영장과 도서실 등을 갖추고 있다. 
지역 청소년의 건강한 여가활동 공간을 제공하고 그들의 욕구에 맞는 다양한 프로그램을 개발, 제공하고 있으며 또한 지역주민의 문화예술적 역량을 키우는 프로그램과 주민들 간 소통의 기회도 제공하므로써 지역공동체 문화형성에 중요한 역할을 한다.","<a href=""http://www.dsyc.or.kr/index.asp"" target=""_blank"" title=""새창 : 달서구 청소년 수련관 홈페이지로 이동"">http://www.dsyc.or.kr/index.asp</a>"
달서시장,2745686,쇼핑,쇼핑,상설시장,http://tong.visitkorea.or.kr/cms/resource/10/2746210_image2_1.jpg,대구광역시,128.5442652325,35.8402363008,"달서시장은 1986년에 처음 문을 연 전통시장이다. 달서 종합상가 1차와 2차가 합쳐진 상가건물형으로 이뤄졌다.
시장 입구에는 카트가 마련되어 있어 편하게 장 보기에 나설 수 있다.
시장 내부에는 각종 먹거리, 채소류, 생선류, 육류, 의류, 생활용품 등을 파는 상점이 성업 중이다.
(사진 출처: 대구광역시청)",
달서아트센터,1756217,인문(문화/예술/역사),문화시설,공연장,,대구광역시,128.5229809055,35.8435133161,"지역민의 문화 예술 향유 기회 확대와 건강하고 여유로운 삶을 위한 문화 예술복합시설로 2004년 4월 최초 개관하였으며, 2014년 4월 (재) 달서 문화 재단으로 새롭게 출범하였다. 주요 시설로는 공연장인 청룡 홀 455석, 와룡 홀 212석, 야외공연장(1,200㎡)과 두류 갤러리(335㎡), 작은 도서실, 컴퓨터실(35대), 예술아카데미 10개 강의실, 수영장(25M, 6레인) 등을 갖추고 있어 다양한 문화 예술 활동을 지원하고 있다. 기존 웃는 얼굴 아트센터에서 달서 아트센터로 명칭이 변경되었다 (2021.12.21)","<a href=""https://www.dsac.or.kr/main/main.do"" target=""_blank"" title=""새창 : 달서아트센터 홈페이지로 이동"">https://www.dsac.or.kr</a>"
달서아트센터 수영장,2366762,레포츠,수상 레포츠,수영,,대구광역시,128.5230031246,35.8435549789,"대구광역시 달서구 장기동에 있는 달서아트센터 내 1층에 위치한 수영장으로 한적하고 넓은 공간을 자랑한다.
특히, 수영장이 1층에 위치하고 있으며 수영장이 큰 투명 유리창로 되어 있어 수영을 하면서 밖의 경치를 즐길 수 있어 이용자들로 부터 좋은 평가를 받고 있는 시설이다.  
이곡장미공원이 가까운 거리에 있어 수영 후 산책도 즐겨 봄 직하다.","<a href=""http://www.dscf.or.kr/pages/artcenter/page.html?mc=0052"" target=""_blank"" title=""새창 : 웃는얼굴아트센터 수영장 홈페이지로 이동"">http://www.dscf.or.kr/pages/artcenter/page.html?mc=0052</a>"
