title,contentid,cat1,cat2,cat3,firstimage,region,mapx,mapy,overview,homepage
화진포해수욕장,2724982,자연,자연관광지,해수욕장,http://tong.visitkorea.or.kr/cms/resource/97/3006797_image2_1.jpg,강원특별자치도,128.4361968025,38.4822636746,"1973년 개장된 화진포해변은 수만 년 동안 조개껍질과 바위가 부서져 만들어진 모나지 성분의 모래로 구성된 백사장이 펼쳐져 있는 곳으로 모래를 밟으면 소리가 나고 개미가 살지 않는 것이 특징이다. 해변의 길이는 1.7km, 넓이 약 70m, 수심 1~1.5m이며, 완만한 백사장과 맑은 바닷물, 얕은 수심으로 많은 관광객들이 찾고 있다.
기암괴석이 신비의 극치를 이루고 있으며 광활한 화진포 호수에 울창한 송림이 병풍처럼 둘러싸인 자연 풍광이 수려한 해변으로 김일성 별장, 이승만 초대 대통령 별장, 이기붕 별장, 화진포 해양 박물관이 있으며, 동해에 한가로이 떠 있는 갈매기와 금구도의 대나무 숲 풍경은 천하의 절경이다. 
1990년 11월 24일 국민관광지로 지정되었고 조성계획이 수립되어 주차장과 진입로 확장포장, 화장실 등 기반 시설 등을 갖추고 있다.","▪ <a href=""http://hwajinpobeach.co.kr/about/"" target=""_blank"" title=""새창 : 홈페이지로 이동"">http://hwajinpobeach.co.kr/about/</a>"
화진포해양박물관,2791407,인문(문화/예술/역사),문화시설,박물관,http://tong.visitkorea.or.kr/cms/resource/79/2792779_image2_1.jpg,강원특별자치도,128.4357413142,38.4814526489,"※ 해양박물관 리모델링 공사 관계로 한시적으로 운영 중단됩니다.</br>
화진포 관광지구 내에 위치한 해양박물관으로 세계적으로 희귀한 각종 조개류, 갑각류, 산호류, 화석류, 박제 등 다양한 수중생물들을 볼 수 있는 패류박물관과 어류전시관으로 구성되어 있다. 1층은 어류전시관으로 180도 머리 위를 지나는 물고기들을 관람할 수 있고, 2층은 오션 비치, 동해 바다, 무척추 동물관과 입체영상관을 볼 수 있다. 특히 2층에서 상영하는 입체 영상을 통해 화진포의 호수와 바닷속 생태계를 공부할 수 있다. 고성군의 명물인 명태를 비롯해 동해 바다 돌고래, 고성 대진항, 거진항 어부들의 고기잡이 과정도 살펴볼 수 있다.","<a href=""https://www.gwgs.go.kr/prog/tursmCn/tour/sub02_05/view.do?cntno=54"" target=""_blank"" title=""새창 : 화진포해양박물관 사이트로 이동"">https://www.gwgs.go.kr/prog/tursmCn/tour/sub02_05/view.do?cntno=54</a>"
화진해수욕장,126094,자연,자연관광지,해수욕장,,경상북도,129.3738915763,36.2518135917,"화진해수욕장은 포항시 북구 송라면에 있는 해수욕장이다. 백사장 길이 400m, 폭 100m로 평균 수심은 1.5m이다. 작은 해수욕장이지만 주변에 나무가 많고 바닷물이 깨끗하다. 또한 냇물이 두 군데에서 흘러내려 담수욕도 할 수 있다. 해수욕장 개장은 7월 초부터 8월 말까지다.  
마을 번영회에서는 7월부터 11월까지 소나무 숲에 텐트와 캠핑카를 허용하는 캠핑장을 운영하고 있어, 화진해수욕장은 해수욕과 캠핑 두 가지를 동시에 즐길 수 있는 최적의 장소이다. 또한 바나나 보트와 제트스키를 탈 수 있는 해양레포츠 시설이 있고 서핑 강습도 진행된다.","▪ <a href=""https://www.pohang.go.kr/phtour/wmap/tourInformation/view.do?menu_idx=46&tour_info_idx=28""target=""_blank"" title=""새창 : 포항문화관광으로 이동"">https://www.pohang.go.kr</a>"
화진해수욕장 마을번영회 야영장,2792317,레포츠,육상 레포츠,"야영장,오토캠핑장",http://tong.visitkorea.or.kr/cms/resource/66/2792966_image2_1.jpg,경상북도,129.3721777849,36.2536327967,"화진해수욕장 마을번영회 야영장은 경북 포항시 북구에 자리했다. 포항 시청을 기점으로 31Km가량 떨어졌다. 자동차를 타고 희망대로, 영일만대로, 동해대로를 차례로 거치면 닿는다. 도착까지 걸리는 시간은 35분 안팎이다. 캠핑장은 과거 입장료나 이용료가 없는 노지 캠핑장이었지만 쓰레기 처리 등 부작용이 많았다. 이 때문에 마을번영회가 나서 관리하기 시작했다. 캠핑장은 크게 두 구역으로 나뉜다. 블록이 깔린 구역은 주로 카라반, 송림숲은 일반 캠퍼가 이용한다. 문의처가 따로 없으며, 현장에 가서 마음에 드는 자리를 잡고 텐트를 설치하면 마을번영회 사람이 요금을 징수한다.",
화창토산 서울,2930252,쇼핑,쇼핑,사후면세점,http://tong.visitkorea.or.kr/cms/resource/71/2889071_image2_1.jpg,서울특별시,126.9358385301,37.5760246009,-,
화천 계성리 석등,250373,인문(문화/예술/역사),역사관광지,유적지/사적지,,강원특별자치도,127.5899775914,38.0964231668,"화천 계성리 석등은 강원도 화천군에 있는 고려시대의 석등이다. 이 석등은 1968년 12월 19일 대한민국 보물로 지정되었다. 석등의 높이는 2.3m, 간석 높이는 1.16m, 화사석 높이는 48cm로 육각형의 형태를 취하고 있다. 바닥돌은 없으며, 지붕돌의 귀꽃이 일부 깨진 것을 제외하면 머리 장식까지 대부분 남아있다. 이 마을에는 계성사의 옛터가 있으며, 절터에는 쓰러진 석탑의 일부와 종모양의 부도 등이 흩어져 있었고 일제 강점기 때 절터에서 약 200m 밑으로 강제로 옮겨진 것으로 정확한 원래의 위치는 알 수 없다. 
이 석등은 신라시대에는 8각, 고려시대에는 4각인 일반적인 것에서 벗어나 독특하게 6각의 형태를 취하고 있다. 현재까지 알려진 6각형 석등은 북한지역에 2기를 포함하여 모두 4기가 남아 있다. 높은 기둥 위에 놓여 있어 전체적으로 아름다운 균형감이 흐르고 있으며, 건립연대는 고려 전기로 추정된다. 석등으로 가기 위해서는 가는 길목에 위치한 군부대의 통행 허가를 받아야 하는데, 화천군청을 통해 받으면 된다. 주변 관광지로 화천 화음동 정사지, 삼일계곡 등이 있다.","<a href=""https://tour.ihc.go.kr/hb/portal/sub01_06?mode=readForm&cont=look05&articleSeq=602683""target=""_blank"" title=""새창: 화천관광"">http://tour.ihc.go.kr</a><br />문화재청 <a href=""http://www.cha.go.kr/"" target=""_blank"" title=""새창: 문화재청 홈페이지로 이동"">http://www.cha.go.kr</a>"
화천 구운리 산천어마을,800614,인문(문화/예술/역사),체험관광지,농.산.어촌 체험,http://tong.visitkorea.or.kr/cms/resource/73/2495373_image2_1.jpg,강원특별자치도,127.6244565835,38.136233053,"2004년 제2회 산천어축제, 2004년 제1회 물의나라 쪽배축제와 역사를 함께하는 만산동 산천어밸리는 계곡수와 자연환경이 산천어가 살기에 가장 적합한 환경조건을 갖추고 있어 1급수 청정성을 대표하는 마을이다. 구운리란 마을 명칭은 9명의 신선이 구름을 타고 내려와 놀던 마을이었다는 전설에서 나왔다고 한다. 산천어마을에서는 강원도 청정지역의 무농약 오리농쌀과 무농약 고추, 콩, 고구마, 감자 등을 생산하고 있다. 산천어밸리는 총면적 9,917㎡에 산천어체험장, 물놀이장, 소공연장, 야영장, 농산물판매장, 출렁다리 등을 갖추고 있다. 또한, 인근에는 민박, 펜션 등이 자리하고 있어 자연과 하나되는 여가쉼터로서의 기능이 기대된다. <br>","<a href=""http://tour.ihc.go.kr"" target=""_blank"" title=""화천 문화관광 사이트로 이동"">http://tour.ihc.go.kr</a>"
화천 나이테펜션,2523923,숙박,숙박시설,펜션,http://tong.visitkorea.or.kr/cms/resource/87/2523887_image2_1.jpg,강원특별자치도,127.7600640606,38.1221788987,"강원도 화천군 화천읍에 위치 하여 소나무와 순수한 황토만을 사용하여 지어진 웰빙펜션으로 여름에는 서늘한 황토의 기운과 소나무향기를 맛 볼 수 있고 펜션 바로 앞 북한강변으로 설치되어 있는 자전거 전용도로에서 싸이클링을 즐기며 시원하게 쏟아지는 딴산폭포를 감상할 수 있고 겨울에는 산천어 축제를 즐기고 빙벽으로 변한 딴산폭포에서 빙벽등반을 할 수도 있으며 펜션으로 들어와 장작으로 난방을 하는 따끈 따끈한 구들방에서 고구마를 구워먹는 호사를 누릴 수도 있다.
객실은 총 7개로 이루어져 있으며, 소단위 가족실로부터 대규모 단체 여행객들을 위한 독채형 객실이 구비되어 있고, 일부는 복층형 객실이다. 객실별로 최소 4명부터 최대 25명까지 입실이 가능하고 제공되는 서비스로는 자전거 대여, 바베큐그릴과 여름철 물놀이를 위한 기구와 견지낚시, 어항 등이 있다.
펜션 주변에는 북한강 자전거도로, 삼천계단, 출렁다리, 산책로, 파로호 댐, 딴산폭포(빙벽) 등을 즐길수 있고 토속어류 생태체험관, 파로호 안보박물관, 화천발전소(주중), 화천박물관등의 견학을 할 수 있으며 파로호회타운, 콩요리식당, 백가네 칡냉면, 사슴목장, 막국수와 닭갈비등을 맛보실 수 있고 차로 30분이내에는 이외수 작가의 감성마을, 평화의 댐, 북한지역을 볼 수 있는 칠성전망대, 승리전망대, 비수구미마을, 이상원미술관 등의 볼 거리도 있다. 화천에서 열리는 축제로는 산천어 축제, 토마토축제, 비목문화제, 쪽배축제 등이 있고  여자축구대회, 비목마라톤대회, 디엠지 산악자전거대회, 국궁 활쏘기대회도 철따라 열린다.","<a href=""http://psnaite.kr/"" target=""_blank"" title=""새창 : 화천 나이테펜션 홈페이지로 이동"">http://psnaite.kr/</a>"
화천 명품DMZ코스,1060256,레포츠,육상 레포츠,자전거하이킹,http://tong.visitkorea.or.kr/cms/resource/68/1853568_image2_1.JPG,강원특별자치도,127.7011118942,38.0960836153,"화천 명품DMZ코스는 강원도 화천군에서 즐길 수 있는 레저 스포츠로 화천의 역사와 문화, 자연과 평화를 체험할 수 있는 자전거 코스이다. 
이 코스는 화천생활체육공원에서 출발하여 위라리칠층석탑, 화천댐, 산천어월드파크, 딴산, 화천교, 붕어섬, 원천초교, 아쿠아틱리조트, 연꽃단지, 폰툰다리 등을 거쳐 다시 화천생활체육공원으로 돌아오는 원점회귀코스이다. 위라리칠층석탑은 고려시대에 세워진 국보 제41호로, 불교의 신비와 아름다움을 담고 있으며, 화천댐은 북한강의 수문을 조절하고 수력발전을 하는 다목적댐으로 댐 주변으로 펼쳐지는 산과 강의 아름다운 경치를 볼 수 있다. 해산령과 한묵령이라는 두 개의 높은 고개를 넘어야 하므로 난이도가 높지만 화천의 아름다운 자연과 관광지를 자전거를 타고 달리며 즐기는 레저스포츠로 각광을 받고 있다.
화천 명품DMZ코스는 매년 5월에 화천DMZ랠리라는 자전거 대회로 개최된다. 이 대회는 국내 마스터즈 기록 경쟁 대회로서 명실상부한 대한민국 랠리 대회로 유명하다. 대회에 참가하기를 희망하는 사람은 화천DMZ랠리 홈페이지에서 신청하면 된다.","<a href=""http://www.dmzbike.kr/courseinfo"" target=""_blank"" title=""새창 : 화천감성여행 홈페이지로 이동"">http://www.dmzbike.kr/courseinfo</a>"
화천 목재문화체험장,2537165,인문(문화/예술/역사),체험관광지,이색체험,http://tong.visitkorea.or.kr/cms/resource/65/2567665_image2_1.jpg,강원특별자치도,127.6455289496,38.0670304086,"화천목재문화체험장은 우수한 화천의 목재를 활용해 나만의 생활가구나 목제품을 만들 수 있는 목공예 체험장이다. 아이들에겐 신나는 나무놀이터, 어른들에겐 목공예에 더욱 많은 지식을 쌓을 수 있는 전문 공방으로써 손색이 없다. 동그란 건물외관은 켜켜이 쌓은 나무 마감재로 따스한 느낌을 전해준다. 1층에는 목공예를 할 수 있는 DIY 체험장이 운영되고 있다. 아이들 가구, 책꽂이, 독서대, 나무스피커, 수제나무도마 등 원하는 제품을 직접 만들어 볼 수 있다.","<a title=""새창 : 화천군 목재문화체험장"" href=""https://tree.ihc.go.kr/we"" target=""_blank"">https://tree.ihc.go.kr/we</a>"
화천 반지교&아를테마수목공원,2570295,인문(문화/예술/역사),휴양관광지,공원,,강원특별자치도,127.6897357562,38.0760051882,"아를테마수목공원은 ‘사랑나무’ 또는 ‘나홀로나무’로 불리는 큰 나무 한 그루가 자리해 그림 같은 풍경을 자아낸다. 수목공원은 조용하여 힐링하기에도 좋고 북한강 자전거 도로와 직접 연결되어 있어 자전거 동호회원들에게 인기가 많다. 또한 수목공원 산책로 끝에 반지 모양의 반지교가 있어 프러포즈, 커플사진을 찍기에 좋다.","화천 문화관광 <a href=""http://tour.ihc.go.kr/hb/portal
""target=""_blank"" title=""새창: 화천 문화관광"">http://tour.ihc.go.kr/hb/portal</a>"
화천 백립암복합체 (강원평화지역 국가지질공원),2616559,자연,자연관광지,자연생태관광지,http://tong.visitkorea.or.kr/cms/resource/55/2616555_image2_1.bmp,강원특별자치도,127.7993306558,38.1898634065,"백립암복합체는 중국대륙의 남북충돌과 연관이 있는 것으로서 남한에서 처음으로 보고된 백립암상의 변성암체이다. 중국은 2억3,000만년 전 남중국 대륙과 북중국 대륙이 이동하다가 서로 충돌한 후, 지각변동을 일으켜 만들어진 것으로 밝혀졌다. 이와 연관된 지역이 바로 한반도 중앙부를 가로지르는 임진강대이며, 화천백립암복합체가 대표적이다. 이 복합체 내에는 높은 변성작용을 받아 만들어지는 석류석을 포함하여 지하 30km에서 만들어진 지각물질도 관찰되므로 중국과 같이 한반도도 충돌에 의해 만들어진 것으로 추정된다.<br>","<a href=""http://www.koreadmz.kr/""target=""_blank"" title=""새창: 강원평화지역 국가지질공원"">http://www.koreadmz.kr/</a>"
화천 산약초 마을,2394825,인문(문화/예술/역사),체험관광지,농.산.어촌 체험,http://tong.visitkorea.or.kr/cms/resource/88/3385888_image2_1.JPG,강원특별자치도,127.6042632575,38.1605548367,"2010년부터 상서면 봉오리 36ha(재배농지 30ha, 건축 부지 5ha, 가공산업단지 1ha) 부지에 산약초 재배단지와 산책로, 테크로드, 약초 탐방로 등 산림욕장과 체험시설을 고루 갖춘 산약초 마을을 조성하였다. 힐링을 위한 아로마길 조성과 100여 가지의 약초가 심어진 약초 탐방로가 조성되어 심신의 피로해소는 물론 가족단위 관광객들이 화목하게 즐길 수 있다. 방문객 편의를 위하여 산약초 효능 설명 안내판을 설치했으며, 비래바위 방향으로 등산로 3km가 개설되어 있어 등산을 즐길 수 있다. 또한 산약초 재배체험, 반신욕과 족욕, 좌훈, 찜질 등을 즐길 수 있는 테라피센터 등을 운영하고 있다.","<a href=""https://healing.ihc.go.kr/wh"" target=""_blank"" title=""새창 : 화천 산약초 마을 홈페이지로 이동"">https://healing.ihc.go.kr/wh</a>"
화천 커플샷 성지,2569540,추천코스,힐링코스,힐링코스,,Unknown,127.6886915282,38.0719723055,"거례리 수목공원 혹은 거례리 사랑나무로 불리던 곳이 아를테마수목공원으로 개칭했다. 북한강변 거대한 나무와 들꽃 가득한 평지가 인상적인 아를테마수목공원은 셀프웨딩촬영, 커플샷 성지로 입소문났다. 최근 사랑나무 근처에 반지교가 완성되어 더욱 특별한 장소다. 연천을 대표하는 안보관광지 칠성전망대와 수상스포츠를 즐기는 붕어섬까지 더한 젊은 여행 코스다.",
화천 토고미마을,128373,인문(문화/예술/역사),체험관광지,농.산.어촌 체험,http://tong.visitkorea.or.kr/cms/resource/31/3385931_image2_1.JPG,강원특별자치도,127.6770184914,38.1347453208,"토고미 마을은 비옥한 토양과 만산동 계곡물이 흐르는 청정한 환경에서 친환경 농법으로 쌀, 옥수수, 감자 등 유기농산물을 생산하는 것으로 유명하다. 농촌 자원을 활용한 다양한 농촌문화, 자연, 전통 체험이 준비되어 있다. 또한 토고미 자연학교는 마을의 폐교를 활용한 곳으로 숙박과 체험이 가능하다. 300여 평의 넓은 잔디운동장과 넉넉한 숙박시설을 갖추고 있어 학생, 직장인 등 단체이용에 적합하다. 자연학교는 자연체험, 농촌체험, 문화체험 등 다양하고 재미있는 체험 프로그램이 연중 운영되고 있다.","<a href=""https://tour.ihc.go.kr/hb/portal/sub01_05?mode=readForm&curPage=&articleSeq=600192&searchCategory=&searchType=&searchWord=&ltype=&cont=look04"" target=""_blank"" title=""새창 : 화천군 문화관광 홈페이지로 이동"">https://tour.ihc.go.kr/hb/portal/</a>"
화천 토속어류생태체험관,2570346,인문(문화/예술/역사),휴양관광지,테마공원,,강원특별자치도,127.7637386292,38.1253980367,"토속어류생태체험관은 화천의 북한강과 파로호에 서식하는 다양한 토속어류들의 생태를 관찰하고, 몸소 체험할 수 있는 곳이다. 체험관 1층에서는 철갑상어, 산천어, 황쏘가리의 청정한 자연환경 속에서 서식하는 실제 화천의 토속어류들을 만날 수 있고 체험관 2층에서는 물고기 모형들이 전시되어 있고 물고기와 관련된 퍼즐게임 등 물고기와 관련된 다양한 체험을 할 수 있다. 화천 시내에서 조금 떨어진 외곽에 위치하고 있지만 가는 길에 마주치게 되는 화천의 아름다운 산과 계곡이 여행길의 또 다른 즐거움이 되어준다.","<a title=""새창: 화천 토속어류생태체험관 홈페이지로 이동"" href=""https://www.dmz.go.kr/front/wantgo/tour_history/view/1262"" target=""_blank"">https://www.dmz.go.kr</a>"
화천 파로호 자전거 100리길,1059957,레포츠,육상 레포츠,자전거하이킹,http://tong.visitkorea.or.kr/cms/resource/41/3044141_image2_1.jpg,강원특별자치도,127.6996453484,38.09651687,"파로호 자전거 100리길은 강원도 홍천군 하남면과 화천군 사내면을 잇는 자전거길이다. 산천어와 수달의 고장으로 유명한 화천에서 또하나의 명소로 꼽히는 곳이다.파로호의 아름다운 풍경을 감상하며 자전거를 타고 달리는 길로, 국내 대표적인 자전거길로 손꼽힌다. 북한강을 따라 이어져 있으며, 총 길이는 약 42.2km이다. 약 3시간에 걸쳐서 꺼먹다리, 연꽃단지, 붕어섬, 미륵바위, 화천댐, 화천수력발전소, 딴산유원지, 칠석교 등을 두루 거치며 간다. 
 문화재로 지정되었으며, 6.25전쟁때 총알의 흔적이 남아있다는 꺼먹다리, 울산에 있던 산이 금강산으로 가다가 일만이천봉이 다 찼다는 이야기를 듣고 이곳에서 멈춘 딴산 등 재미있는 일화를 상기하며   화천의 풍경과 문화를 즐길 수 있다. 파로호 자전거길은 순환형 자전거길이기 때문에 어디서 출발해도 제자리로 돌아올 수 있다.  비탈과 굴곡이 거의 없는 강변길이어서 남녀노소 누구나 쉽게 즐길 수 있다. 화천 파로호 자전거 100리길은 아름다운 북한강과 파로호의 풍경을 만끽하면서 건강과 행복을 찾을 수 있는 최고의 자전거코스이다.","<a href=""http://tour.ihc.go.kr/hb/portal/sub01_04"" target=""_blank"" title=""새창 : 화천 파로호 자전거 100리길 소개 페이지로 이동"">http://tour.ihc.go.kr</a>"
화천 풍산마을,128376,인문(문화/예술/역사),체험관광지,농.산.어촌 체험,http://tong.visitkorea.or.kr/cms/resource/13/2495413_image2_1.jpg,강원특별자치도,127.7413956274,38.145242524,"화천에서 10여 분 달려 조그마한 고개를 하나 넘으면 풍산마을에 이른다. 많은 이들이 무심코 지나치는 이 고개에는 애틋한 전설이 내려져오는 마을의 의미 있는 장소인데, 장원급제 하고 돌아오겠다는 도련님을 기다리다 안타깝게 세상을 떠난 한 처녀의 넋을 기리는 의미에서 고개 이름이 붙여졌다고 한다. 그 후로 마을에 해마다 풍년이 들어 현재의 풍산마을이라 불리게 됐다고 한다. 이렇듯 풍산리는 마을 초입부터 예사롭지 않은 이야기가 전해지는 고장이다. 멋진 경치를 자랑하는 마을은 아니지만 주변의 볼거리와 마을의 개성은 뛰어난 편. 특히 전국에서 유일하게 재배하는 참붕어쌀과 마을인근의 딴산유원지는 여름 휴가철과 낚시꾼들로  항상 북적댈 만큼 인적이 끊이질 않는 유명한 곳이다.
화천의 풍산마을은 전국에서 유일하게 참붕어쌀을 재배하는 곳이다. 다소 생소한 참붕어쌀은 미꾸라지를 논에 풀어 놓아서 재배한 미꾸라지쌀에서 착안해 재배 중인 쌀이다. 참붕어쌀은 논에다 참붕어를 길러 무공해 쌀을 생산하는 것이 주요 생산방법이다. 풍산마을 초입에 위치한 딴산유원지는 여름철 휴가지로 인기가 높은 곳이다. 화천 인근의 피서객들이 장사진을 친다는 이곳의 명물은 단연 병풍바위. 딴산유원지를 병풍 치듯 깎아지른 절벽이 탄성을 자아내게 한다. 딴산은 산이라기보단 물가에 떠있는 모습이 이채롭고 일대의 그늘과 강물이 시원해 여름휴가지로 각광받고 있다. 또한 병풍바위를  전경에 두고 고요하게 흘러내려가는 강물을 보면서 낚시를 드리우는 강태공들에게는 천국과도 같은 곳이다.",
화천 하늘빛호수마을,129304,인문(문화/예술/역사),체험관광지,농.산.어촌 체험,http://tong.visitkorea.or.kr/cms/resource/19/2495419_image2_1.jpg,강원특별자치도,127.6638496162,38.0631006539,"원천리는 북한강 상류의 맑은 물과 아름다운 가마니계곡, 자연이 잘 보존된 장군산으로 둘러싸여 있는 살기 좋은 마을이다. 마을과 인접한 북한강 상류는 유명 낚시터이자 청둥오리, 기러기, 원앙, 두루미와 같은 희귀 철새들을 쉽게 만날 수 있을 정도로 생태적 가치가 뛰어난 아름다운 호수마을이다. 마을 주민들도 일찍부터 자연보전의 중요성을 인식하고 벼농사에 오리농법을 도입하여 환경보호와 무공해 농산물 생산에 주력하고 있다. 사계절 내내 마을 앞 호수에서 붕어, 향어, 잉어, 빙어 낚시와 더불어 장 담그기, 산나물 캐기, 짚공예 등의 농촌체험과 무농약 흑향미, 토마토, 수세미 등 질 좋고 청정한 농산물 등 웰빙시대에 걸맞은 여유롭고 다양한 체험을 즐길 수 있다. 계산골에 보물로 지정된 석등과 산지가람 계성사의 유지, 일제강점기 때 지어졌다는 구면소 등 다양한 볼거리가 있다. 시원한 호숫가에 위치한 4,300평 규모의 넓은 체육공원이 있어 운동회와 각종 단체 체육행사를 하기에 적합하다.",
화천 휴캠핑장,2755716,레포츠,육상 레포츠,"야영장,오토캠핑장",http://tong.visitkorea.or.kr/cms/resource/41/2756341_image2_1.JPG,강원특별자치도,127.7241146674,38.1188230602,화천 휴캠핑장은 강원도 화천군 화천읍에 자리 잡고 있다. 캠핑을 너무나 좋아하는 캠퍼가 운영하고 있는 소규모 캠핑장이다. 겨울엔 산천어 축제장에서 5분 거리에 있어 겨울 낚시와 겨울 캠핑의 묘미를 느낄 수 있다. 여름엔 야외 수영장에서 물놀이를 즐길 수 있다.,"<a href=""http://cafe.naver.com/huepark88"" target=""_blank"" title=""새창 : 화천 휴캠핑장 사이트로 이동"">http://cafe.naver.com/huepark88</a>"
"화천, 향기로운 ‘산약초 마을’ 힐링 여행",2569730,추천코스,힐링코스,힐링코스,http://tong.visitkorea.or.kr/cms/resource/76/2567676_image2_1.jpg,Unknown,127.6042632575,38.1605548367,"산약초 마을로 들어서면 몸과 마음이 먼저 좋은 기운을 알아챈다. 산약초 재배단지와 산책로 등 삼림욕장과 체험시설을 고루 갖추고 힐링을 위한 아로마길과 100여 가지의 약초가 심어진 약초 탐방로도 흥미롭다. 톱밥 발효사우나, 산약초 약재 족욕탕, 재래식 아궁이찜질 등 다양한 체험시설을 갖추고 있어 가족 단위 여행객에게 인기 있다. 목재문화체험장은 화천에서 자란 목재와 친해지는 공간이다. 친환경 목재로 만든 집에서 숙박도 하고 삼림욕도 하며 힐링의 시간을 보내기 좋다.",
