title,contentid,cat1,cat2,cat3,firstimage,region,mapx,mapy,overview,homepage
복천박물관(부산),130145,인문(문화/예술/역사),문화시설,박물관,http://tong.visitkorea.or.kr/cms/resource/59/1205059_image2_1.jpg,부산광역시,129.0911042192,35.2088924921,"복천박물관은 복천동고분군에서 출토된 유물을 중심으로, 삼한시대부터 삼국시대까지의 부산지역의 역사를 보여주는 고고 전문박물관이다. 1996년 10월 5일에 개관했다.
복천동고분군에서 7차에 걸친 발굴 조사로 밝혀진 덧널무덤(목곽묘), 구덩식돌덧널무덤(수혈식석곽묘),  앞트기식돌방무덤(황구식석실묘), 독널무덤(옹관묘)등 총 200여기의 무덤이 확인되었고, 여기서 다양한 형태의 가야토기, 철제무기류, 갑옷, 투구, 가지방울, 금동관, 목걸이 등 12,000여 점의 유물들이 출토되었으며, 박물관에는 출토된 유물을 종합전시하고 있다. 사적 제273호로 지정된 복천동고분군에서 출토된 유물과 다양한 무덤 양식들은 아직 미지의 왕국으로 남아있는 가야의 신비를 푸는 데 중요한 정보를 제공하고 있다. 
복천박물관은 개관 이후 인근지역의 매장문화재에 대한 조사와 연구를 수행하며, 부산의 역사와 문화, 나아가 가야사의 실체를 규명해 나가고 있으며, 지속해서 축적된 연구 성과를 바탕으로 다양한 학술 세미나 및 특별전을 통해 전문가와 시민들에게 제공함으로써 역사교육장으로서의 역할도 담당하고 있다.","<a href=""https://museum.busan.go.kr/bokcheon/index"" target=""_blank"" title=""새창 : 홈페이지로 이동"">https://museum.busan.go.kr</a>"
복천사,3017395,인문(문화/예술/역사),역사관광지,사찰,http://tong.visitkorea.or.kr/cms/resource/56/3017356_image2_1.JPG,부산광역시,129.0505306507,35.0825170038,"신선동 봉래산(396.2m) 자락에 위치하고 있는 복천사는 고려말 나웅 왕사가 창건했다는 사찰로 유서 깊은 절이다. 아름다운 풍경으로 유명한 복천사는 조용하고 편안한 장소를 찾는 관광객들에게 추천하는 장소로 힐링을 원하는 관광객은 이곳에서 조용한 하루를 만끽하면 좋은 곳이다. 복천사는 계곡의 물이 좋다고 해서 복천사라 이름이 붙여졌다고 하며, 바다가 내려다보이는 사찰로 일몰이 유명한 사진촬영 명소로 많이 알려져 있다. 복천사에는 많은 문화유산들을 보유하고 있으며, 부산 유형문화재인 지장시왕도(제61호), 아미타극락회상도(제62호), 조상경(제65호), 선원제전집도서(제66호), 석각영상회상도(제35호), 독성도(제38호), 현왕도(제39호) 외 비지정 문화재 70여 점 등 다수의 문화재를 소장하고 있다.","<a href=""https://www.yeongdo.go.kr/tour/01462/01465.web?amode=view&idx=2166&"" target=""_blank"" title=""새창 : 홈페이지로 이동"">https://www.yeongdo.go.kr/</a>"
복천사(제천),316275,인문(문화/예술/역사),역사관광지,사찰,http://tong.visitkorea.or.kr/cms/resource/73/2021573_image2_1.jpg,충청북도,128.2176934348,37.1387653319,"복천사(福泉寺)는 충청북도 제천시 독송정산(獨松頂山) 자락에 자리한 재단법인 대한 불교 육주회 사찰이다. 독송정산(獨松頂山). 복천사가 있는 남산의 이름이다. 이곳은 조선시대 향교가 있던 향교골로 독순봉, 또는 독심정(獨深頂)이라고도 불리는 곳이다. 제천의 명동 한복판에 있으며, 제천 사람들은 이곳에서 먼 옛날 전설 속의 인물들을 만난다. 생육신의 한사람 원호, 그리고 학다리 처녀. 조선 초 생육신의 한 사람인 원호(元昊)는 단종이 폐위되어 영월에 유배되었다는 소식을 듣고 제천현 동헌 앞산인 이곳에서 청량포를 향해 망배하며 통곡하였다. 그로 인해 이름 지어진 독심정. 우린 독심정이란 이름에서 망부석처럼 한 임금을 위해 절개를 굳힌 생육신의 절개에 탄복한다.<br /><br />또, 향교골 한 선비의 딸에 대한 사랑이 드리워진 곳. 딸이 항상 나들이가 즐겼던 자리에 딸의 시신을 묻어주려는 아버지의 마음은 죽은 딸에 대한 절절한 사랑을 느낄 수 있다. 산신에 대한 두려움과 마을 주민들의 방해로 결국 딸의 시신을 독송정산에 묻진 못했지만, 아름다운 학의 모습으로 승천하여 그 흔적을 남겼다. 학다리. 이곳이 바로 그곳으로 수많은 이들이 복천사를 찾을 때 전설 속 두 주인공의 이야기를 쫓는다. 지금은 그 옛날 독송정의 모습은 남아 있지 않지만 힘들게 올라선 언덕에 자리한 자그마한 절에서 원호의 영혼과 학다리 처자의 숨결을 느낄 수 있다. 사찰과 함께 100여 년의 넘게 독송정에 홀로선 소나무가 바로 그들의 영혼이 아닐까? 홀로선 소나무라는 산 이름처럼, 복천사에 가면 산신각을 둘러싼 송림숲이 사찰을 찾는 이들을 반긴다. 지금 그곳에서 독송정의 산신은 찾을 수 없지만 항상 제천의 시가지를 바라보며 제천의 안위를 기원하는 스님의 염불소리는 언제까지도 산신의 가피처럼 제천 시가지에 울려 퍼질 것이다.",
복천암(보은),316293,인문(문화/예술/역사),역사관광지,사찰,,충청북도,127.8528678912,36.5514038103,"충청북도 보은군 내속리면 사내리 속리산국립공원 내에 있는 복천암은 720년(신라 성덕왕 19)에 창건되었으며 고려시대에서 조선시대까지 수차례에 거쳐 중수되었다. <신중동국여지승람>에 따르면 복천사 동쪽에 샘이 있는 데 돌 틈 사이에서 물이 쏟아져 나와 재위에 쓸 물을 많이 제공하므로 복천이라고 불러 복천이라는 사명이 유래되었다. 조선 세조가 1464년 이 절에서 3일 동안 기도를 드린 뒤 절에 이르는 길목의 한 목욕소에서 목욕을 하고 피부병이 깨끗이 낫자 이 절을 중수하도록 하고 만년보력이라는 사각 옥판을 내렸다 한다. 1592년 불에 탔으나 곧 중건하였고 그 후 소실된 것을 1735년(영조 11)에 재창하였으며 1803년(순조 3) 중수하였다.

현존하는 건물로는 극락전과 나한, 선방, 요사채 등이 있다. 복천암 극락전은 1976년 해체, 복원하였으며 내부에는 아미타불상과 후불탱화, 삼세불도, 신중도, 극락보전, 수암화상탑, 학조화상탑, 신미대사의 탱화가 보존되어 있으며 현판 무량수는 공민왕 친필로 전한다. 유물로는 부도 2기가 전하는데 그중 복천암수암화상탑은 1480년(성종 11) 제작된 것으로 조선시대 승려인 수암화상의 사리를 모시고 있고 이 부도 뒤의 복천암학조등곡화상탑은 1514년(중종 9)에 제작된 것으로 학조대사의 사리를 모시고 있다. 일반적인 석종형부도보다 훨씬 발전된 형식을 띠고 있다. 두 기 모두 충청북도 유형문화유산으로 지정되었다가 2004년 보물로 승격되었다. 속리산은 산이 깊고 넓어 많은 암자들이 만들어져 있는데, 복천암이 가장 깊은 역사를 갖고 있으며 규모 역시 가장 큰 사찰이다. 암자의 형태를 하고 있는 사찰이기 때문에 일반 신도들을 위한 사찰 운영보다는 선원의 형식으로 사찰을 운영하고 있다. 등산로를 따라 속리산의 절경을 만끽할 수 있는 문장대, 비로봉, 천왕봉을 갈 수 있으며 상고암, 상환암 등 산속에 숨어있는 암자를 만날 수 있다.","<a href=""http://www.bokcheonam.or.kr/"" target=""_blank"" title=""새창 : 복천암 홈페이지로 이동"">http://www.bokcheonam.or.kr</a>"
복천암(청주),316291,인문(문화/예술/역사),역사관광지,사찰,http://tong.visitkorea.or.kr/cms/resource/14/3357614_image2_1.jpg,충청북도,127.5000969167,36.643450773,"복천암은 상당공원 인근 충북교육과학연구원에서 KBS송신탑을 향해 오르는 임도 중턱에 있다. 대중교통을 이용하려면 상당공원에서 내려 등산로를 이용해야 한다. 복천암으로 오르는 등산로 입구에는 목암사지가 있으며, 복천암에서 우암산(牛岩山)[338m] 정상을 향해 오르는 길목에는 흥천사지와 천흥사지가 있다. 목암사지에서는 석불이, 흥천사지에서는 동종이 출토됐다. 복천암에는 요사와 극락전, 관음전(1층은 공양방) 등이 있다. 극락전은 정면 5칸, 측면 3칸짜리 건물로 1994년에 완공됐다. 불단에는 아미타 삼존불상을 봉안했고 아미타 후불탱화를 비롯해 칠성탱화, 신중탱화, 산신탱화 등을 조성했다. 1997년에는 동종을 조성했다. 복천암 요사는 1970년대 초 볏짚과 진흙을 이용해 지었는데 산중 암자의 인법당을 떠올리게 하는 단아한 건물이다. 2005년 완공된 관음전은 황토벽돌로 지은 80평 규모의 2층 건물인데 1층은 설법전과 식당으로 사용되고 2층은 참배와 참선의 공간으로 활용하고 있다.","<a href=""http://www.grandculture.net/cheongju/toc/GC00201386"" target=""_blank"" title=""새창 : 디지털청주문화대전 홈페이지로 이동"">http://www.grandculture.net/cheongju</a>"
복춘식당,765209,음식,음식점,한식,,전라남도,127.7341016865,34.7395679807,"복춘식당은 여수의 로컬음식을 맛볼 수 있는 곳이다.<br>아귀찜, 아귀탕, 장어탕, 서대회 등 다양한 메뉴가 준비되어 있는데, 아귀탕이 이 곳의 인기메뉴이다. 룸을 보유하고 있어 단체모임도 가능하다.",
복하천수변공원,2763852,인문(문화/예술/역사),휴양관광지,공원,http://tong.visitkorea.or.kr/cms/resource/54/2764154_image2_1.png,경기도,127.4601135382,37.2683002969,"경기 이천시 진리동 하천 옆에 있는 수변공원이다. 약 14,000㎡ 공간에 족구장, 배드민턴장 등의 운동 시설과 산책로, 화장실, 취사장, 어린이 놀이터가 있다. 일명 삼겹살 공원으로 불리며 취사가 가능한 공원이다. 복하천 수변에 조성되어 경치가 좋으며 가족단위 야외활동에 좋은 장소이다. 복하천 변 자전거도로 이용객들에게도 쉼터로 활용되고 있다. 경강선 이천역에서 차량으로 5분 거리에 있다.",
복합문화지구 누에,2990226,인문(문화/예술/역사),체험관광지,이색체험,,전북특별자치도,127.1596833299,35.9064290082,"전라북도 완주군에 위치한 복합문화지구 누에는 ""누구나 예술로 소통하는 삶의 공간""을 목표로 문을 열었다. 문화재생사업의 일환으로 전라북도 잠업(누에 사업)시험장 단지에 조성했으며 문화예술 교육, 전시 기획, 창의공간 조성 등의 사업을 하고 있다. 
다양한 예술작품 전시와 공연이 진행되는 누에 아트홀, 지역주민을 위한 게스트하우스 '숨', 캠핑장과 라운지, 도자실과 가마실 등을 운영하며, 여러 단체에서 입주하여 함께 공간을 활성화하고 있다. 어른 입장이 불가한 어린이 공간 ""꿈꾸는 누에 놀이터""등이 있어, 가족 여행에도 좋은 곳이다. 
완주군의 대표 관광시설인 전북도립미술관, 삼례문화예술촌도 함께 둘러보면 좋다.","<a href=""http://nu-e.or.kr/"" target=""_blank"" title=""새창: 복합문화지구 누에 홈페이지로 이동"">http://nu-e.or.kr/</a>"
복합생활스포츠타운,2751122,레포츠,육상 레포츠,수련시설,http://tong.visitkorea.or.kr/cms/resource/57/2751157_image2_1.jpg,경기도,126.9365229135,37.3388299271,"복합생활스포츠타운은 경기도 군포시 부곡동에 위치해 있는 체육공원이다. 여름에는 물놀이장, 겨울에는 눈썰매장을 개장한다. 실내체육시설인 군포 국민체육센터에는 수영장, 다목적 체육관, 탁구장, 헬스장, 다목적실, 문화교실, 스피팅실, 배드민턴장, GX룸, 요가실이 있고 실외에는 인조잔디축구장과 육상 트랙, 인조 잔디 풋살장, 게이트볼장, 그리고 배드민턴장, 테니스장, 농구장과 같은 실외 다목적 시설을 갖췄다. 육상 트랙이 있어 걷거나 인라인스케이트를 즐길 수 있지만 트랙 내부는 안전을 위해 반려동물과 자전거 출입은 제한된다. 단, 공원 내에서는 반려동물과 동반 입장과 산책이 가능하다. 봄이면 벚꽃동산과 철쭉 동산에서의 꽃구경도 볼만하다.","<a href=""https://www.gunpouc.or.kr/fmcs/8"" target=""_blank"" title=""새창 : 군포도시공사 홈페이지로 이동"">https://www.gunpouc.or.kr</a>"
복합한옥공간 곳 [한국관광 품질인증/Korea Quality],2592489,숙박,숙박시설,한옥,http://tong.visitkorea.or.kr/cms/resource/68/2631068_image2_1.jpg,서울특별시,126.9872920687,37.5797056512,"복합한옥공간 곳은 종로구 계동(안국역도보 5분거리)에 위치해 있으며 근처에는 경복궁, 창덕궁, 창경궁,인사동,국립현대 미술관 그리고 많은분들이 찾는 카페들이 즐비하게 늘어서있다. 한옥에는 최대한 친환경 상품을 구비해 놓고 있으며, 간단한 음료와 스낵을 무료로 제공해드리고 있으며, 커피와 티는 상시 구비되어 언제든 즐길 수 있다. 곳'은 현대의 감각과 한국 전통이 모두 살아 숨쉬는 곳으로 마당에는 80년 이상된 산수유 나무가 있고 그 아래에는 작은 정원이 있어 4계절 다양한 모습을 즐길 수 있다.",http://www.theplaceseoul.com
복해가든,2876564,음식,음식점,한식,http://tong.visitkorea.or.kr/cms/resource/51/2876551_image2_1.jpg,충청북도,127.791895023,36.4709424667,"복해가든은 충청북도 보은군 장안면 개안리에 있는 닭 요리 전문 음식점이다. 한옥으로 지어진 덕분에 외관에서 고풍스러운 멋을 느낄 수 있다. 예스러운 분위기를 연출하는 인테리어도 눈에 띈다. 내부에는 단체석이 마련되어 있다. 대표 메뉴는 능이백숙이며, 엄나무백숙과 닭볶음탕도 많이 찾는다. 이 밖에 장어구이, 불고기백반, 삼겹살, 삼계탕, 버섯찌개 백반 등 여러 가지 메뉴를 맛 볼 수 있다. 속리산IC에서 가깝고, 주변에 속리산말티재자연휴양림과 세계문화유산인 법주사가 있다.
※반려동물 동반 가능(목줄, 배변봉투 지참)",
복현오거리 먹자골목,2687748,인문(문화/예술/역사),체험관광지,이색거리,http://tong.visitkorea.or.kr/cms/resource/41/3348841_image2_1.jpg,대구광역시,128.6150240861,35.8969839584,"대구광역시 북구 복현오거리 일대의 위치한 골목이다. 19990년대 중반부터 대구 내에서 가장 유명한 '막창붐'이 일어나면서 경북대학교 북문 인근에서 막창집이 생기기 시작하여 2000년대 중반부터 골목이 번성하였다. 대구 지역에서는 막창을 콘셉트로 한 골목이 많이 있는데, 그중에서도 복현오거리 먹자골목이 가장 유명한 곳 중 하나이다. 예전에는 이곳에만 30여 곳 이상의 막창집이 있어 막창을 주력으로 판매하는 골목이었지만 현재는 조개구이, 치킨 등 음식점들의 메뉴가 다양해지면서 방문하는 고객들의 취향에 따라 알맞은 먹거리를 먹을 수 있는 곳으로 변화하였다.","<a href=""https://www.daegufood.go.kr/kor/food/load2.asp?snm=10&Cate_code=TL-19"" target=""_blank"" title=""새창: 대구푸드 홈페이지로 이동"">https://www.daegufood.go.kr </a>"
복호선착장,2750722,자연,자연관광지,항구/포구,,전라남도,126.1678042449,34.7000961798,"안좌도 끝자락에 위치한 복호선착장은 작은 규모의 포구지만, 2층 규모로 지어진 여객선 터미널을 보유하고 있다. 주변에 있는 크고 작은 섬을 연결하는 중요한 역할을 하고 있기 때문이다. 안좌도는 편안하고 풍성한 땅이라는 의미로, 천사의 섬 중 꽤 큰 규모를 자랑한다. 선착장에서는 아담한 복호마을과 자라대교 풍경도 한눈에 볼 수 있다. 이곳을 오가는 여객선은 규모가 상당히 크다. 2020년 6월 15일부터는 복호선착장에서 장산도를 경유해 신의면 상태도에 이르는 여객선 야간 운항을 시작했으며, 한 시간 정도 소요된다. 이로써 그간 주간에만 가능했던 마을 주민들의 이동이 야간에도 가능해졌다.",
"복흥장 (3, 8일)",132416,쇼핑,쇼핑,5일장,http://tong.visitkorea.or.kr/cms/resource/91/1976591_image2_1.jpg,전북특별자치도,126.9326435623,35.4316512519,"복흥장은 매월 3, 8일에 열리는 전북 순창지역의 전통시장이다. 
복흥지역은 내장산 국립공원과 인접하여 가을이면 단풍을 즐길 수 있으며, 10월 중에 추령고개에서 개최되면 장승축제를 구경하고 복흥 소재지에 위치한 복흥장에 들려 표고버섯, 고랭지 채소를 싼 값에 구입할 수 있다.",
본,3306449,쇼핑,쇼핑,사후면세점,http://tong.visitkorea.or.kr/cms/resource/45/3314445_image2_1.jpeg,서울특별시,126.8884169673,37.5089148857,-,
본,3306852,쇼핑,쇼핑,사후면세점,http://tong.visitkorea.or.kr/cms/resource/47/3313347_image2_1.jpg,서울특별시,126.8872262708,37.4782600918,-,
본 롯데팩토리가산,2931821,쇼핑,쇼핑,사후면세점,http://tong.visitkorea.or.kr/cms/resource/33/2880333_image2_1.jpg,서울특별시,126.8846459143,37.4795432303,-,
본 현대가든파이브,2925317,쇼핑,쇼핑,사후면세점,http://tong.visitkorea.or.kr/cms/resource/76/2879376_image2_1.jpg,서울특별시,127.1249768726,37.4776672007,-,www.thehandsome.com
본 현대동대문,2924392,쇼핑,쇼핑,사후면세점,http://tong.visitkorea.or.kr/cms/resource/70/2888870_image2_1.jpg,서울특별시,127.0076821872,37.5687878415,-,
본가,1896649,음식,음식점,한식,,제주특별자치도,126.5285590086,33.4912424834,"제주시 도남동에 있는 대패삼겹살 전문점 본가는 대패삼겹살, 감자탕, 해장국을 주메뉴로 한다. 제주산 암퇘지만을 사용하여 제공하며, 직거래 유통으로 재료를 저렴하게 구입하여 음식 가격 또한 저렴하다.<br>",
본가,2635516,음식,음식점,한식,http://tong.visitkorea.or.kr/cms/resource/72/2635972_image2_1.jpg,경기도,126.8385360136,37.3878030594,운웅산 기슭에 공기 좋고 물 좋은 곳에 자리잡고 있다. 최근 신축 건물로 확장 이전하여 보다 넓은 주차장과 80석 규모의 테이블 있다. 매일 아침 직접 신선한 만두를 수제로 만들어 명품 수제만두 상차림을 제공하는 만두전골 전문이다.,
본가,2782162,음식,음식점,한식,http://tong.visitkorea.or.kr/cms/resource/75/2786275_image2_1.jpg,충청남도,126.4997441575,36.1565724256,"본가는 충남 서천군에 있는 홍원항 공영주차장 바로 앞에 있는 횟집이다. MBC TV '어영차 바다'에 갑오징어 요리로 소개된 서천군 5대 맛집 중의 하나로, 활어회뿐만 아니라 주꾸미, 전어, 갑오징어 등 제철 수산물 요리를 즐길 수 있다. 싱싱한 회와 매운탕, 새우 소금구이에 기본 반찬으로 푸짐한 해산물이 함께 나오는 본가 회 코스 요리를 A 코스, B 코스, C 코스 가운데 선택할 수 있고, 아귀 한 마리가 통째로 나오는 아귀 백숙, 아귀 데리야키와 광어알 찜 등 다른 곳에서 맛보기 어려운 독특한 요리를 맛볼 수 있다. 야외테라스가 있어 바다를 보며 싱싱한 회를 즐길 수 있으며 제철 수산물로 준비한 점심 메뉴와 회 정식 포장 도시락도 판매하고 있다.",
본가,2904217,음식,음식점,한식,http://tong.visitkorea.or.kr/cms/resource/00/2904200_image2_1.jpg,전북특별자치도,126.7390357717,35.4306453041,"향토맛집 본가는 고창읍 석정리에 있는 백합, 바지락 요리를 전문으로 하는 고창 맛집이다. 백합 요리의 원조인 본가에서 오랜 세월 요리를 해온 사장님의 정성과 맛을 느낄 수 있다. 본가는 신선한 백합을 직송하여 그 자리에서 요리하기 때문에 백합의 싱싱함과 신선도는 최상이다. 본가에서는 큼지막하고 오동통한 백합의 쫄깃한 식감으로 바다향과 어우러진 깊은 맛을 느낄 수 있다. 조개의 여왕이라 불리는 백합을 코스로 즐기는 백합 정식을 비롯해 백합회, 오이, 양념의 조화가 어우러진 백합회무침, 고소한 맛이 풍부하게 느껴지는 바지락 비빔밥, 백합죽, 백합찜, 백합전 등의 여러 가지 요리를 한 번에 맛볼 수 있다. 근처에는 석정온천 휴스파, 석정힐 CC 등이 있어 현지인을 비롯해 고창을 방문한 여행객들도 많이 찾고 있다.","<a href=""https://bbonga.modoo.at""target=""_blank"" title=""새창 : 본가 사이트로 이동"">https://bbonga.modoo.at</a>"
본가 궁중해장국,134006,음식,음식점,한식,,강원특별자치도,128.534966107,38.1995235687,"만두의 맛이 남달라 등산이나 관광 또는 온천, 해수욕을 즐기고 난 후 부담 없이 가족이 함께 즐길 수 있다. 또한 구수하고 시원한 황태해장국과 부드러운 선지해장국, 우거지갈비해장국도 아침식사로 인기가 많다.","<a href=""https://bonga.modoo.at/""target=""_blank"" title=""새창 : 홈페이지로이동"">https://bonga.modoo.at/</a>"
본가 안동국시 본점,2850003,음식,음식점,한식,http://tong.visitkorea.or.kr/cms/resource/96/2849996_image2_1.jpg,대구광역시,128.622360969,35.8460870775,"본가 안동국시 본점은 대구광역시 수성구 황금동에 있다. 깔끔한 외관과 차분한 분위기를 연출하는 인테리어가 눈에 띈다. 내부에는 단체석이 마련되어 있어 각종 모임을 하기 좋다. 대표 메뉴는 안동국시다. 이 밖에 소고기국밥, 예전국시, 돼지고기 수육 등을 맛볼 수 있다. 여름에는 초계국시, 냉콩국시도 판다. 모든 음식과 반찬은 손수 만들어 제공된다. 대구 지하철 3호선 어린이회관역과 파동IC에서 가깝다. 인근에는 국립대구박물관, 덕산서원, 대구어린이교통랜드가 있어 연계 여행에 나서기 쉽다.",
본가갈비,2874436,음식,음식점,한식,http://tong.visitkorea.or.kr/cms/resource/25/2874425_image2_1.jpg,경기도,126.7507660527,37.6915995127,"본가갈비는 고양시 덕이동, 덕이 초등학교 옆에 있는 숯불구이 전문점이다. 식당 앞에 넓은 주차장이 있어 주차가 편리하다. 식당은 2층 단독 건물을 사용하는데 매장이 넓고 테이블이 많다. 또한 각종 모임을 할 수 있는 단체석이 있어 예약 후 편하게 이용할 수 있다. 육회를 제외한 모든 고기 메뉴는 미국산과 호주산을 사용하고 있어 가성비가 좋은 편이다. 소문난 맛집답게 항상 대기가 있지만 가게 입구에 테이블 링 시스템이 있어 입력 후 야외 잔디정원 곳곳에 놓인 파라솔 테이블에서 여유 있게 기다리면 된다. 본가갈비는 고양시 관광 맛집으로 선정된 곳이다.",
본가광양불고기,2844492,음식,음식점,한식,http://tong.visitkorea.or.kr/cms/resource/83/2844483_image2_1.jpg,경기도,127.1000312397,37.4034642479,"본가광양불고기는 경기도 성남시 분당구에 위치한 광양불고기 전문점이다. 광양불고기 맛을 제대로 내는 맛집으로 대표 메뉴는 광양불고기이다. 점심특선으로 광양불고기를 주문하면 된장찌개와 공깃밥이 함께 나온다. 이 외에도 양념갈비, 생등심, 육회 등 다양한 메뉴가 있어 가족 모임이나 단체 회식을 하기에 좋다. 식당 내부는 넓고 테이블 간격이 여유 있다. 유기그릇에 담겨 나오는 밑반찬들은 맛도 좋지만, 품위가 느껴진다. 기념일이나 주말 외식으로 가족 친지들과 찾기 좋은 식당이다.",
본가꼬막짬뽕,2839307,음식,음식점,중식,http://tong.visitkorea.or.kr/cms/resource/02/2839302_image2_1.jpg,경상북도,129.3891870222,36.0758754791,"본가꼬막짬뽕은 경상북도 포항시 북구 장성동에 있다. 세련된 느낌의 외관과 깔끔한 인테리어가 눈에 띈다.
대표 메뉴는 싱싱한 꼬막과 칼칼한 육수가 면발과 잘 어우러진 꼬막 짬뽕이다. 이 밖에 소고기 짬뽕, 짜장면, 새우볶음밥, 탕수육, 군만두, 냉콩국수 등도 맛볼 수 있다. 꼬막 짬뽕과 소고기 짬뽕은 면 대신 밥을 주문할 수 있다. 
유아 동반 고객을 위해 아기 전용 의자도 비치하고 있으며 셀프 바가 있어 단무지, 양파 등의 추가 반찬을 자유롭게 갖다 먹을 수 있다.  
성곡 IC에서 가깝고, 인근에 환호공원, 영일대해수욕장, 죽도시장 등 포항의 유명 관광지가 많다.",
