title,contentid,cat1,cat2,cat3,firstimage,region,mapx,mapy,overview,homepage
허머스키친,2836200,음식,음식점,이색음식점,,서울특별시,127.0608234799,37.5092457134,허머스 키친은 중동 전통요리 전문점으로 현대적으로 재해석한 중동요리를 선보인다. 화려한 비주얼을 자랑하는 식당 내부와 음식들이 눈길을 사로잡는다. 색다른 맛이 많은 사람들의 재방문을 이끈다. 고급스럽고 질 좋은 음식과 더불어 친절한 서비스가 방문객들의 기분까지 좋게 한다.,
허밍카페,2862743,음식,음식점,카페/전통찻집,http://tong.visitkorea.or.kr/cms/resource/27/2862727_image2_1.jpg,경기도,126.9773537788,37.1947334554,"허밍카페는 화성시 정남면 보통저수지를 끼고 있는 레스토랑 카페이다. 점심에는 돈가스나 파스타 종류와 음료를 주로 판매하고 저녁에는 주류와 안주, 식사 메뉴를 판매하는 곳이다. 메뉴가 책처럼 보일 정도로 취급하는 메뉴가 많다. 저수지 주변이라 보통저수지를 한 바퀴 돌고 식사나 차를 마실 수 있다. 1층에는 단체석과 주문하는 곳이 있고, 2층은 저수지를 조망할 수 있는 좌석들이 있다. 인테리어가 전체적으로 고풍스러운 편이다. 정원이 잘 관리되어 있고 마당에 앉아 시원한 분수와 저수지를 바라보며 음식을 즐길 수도 있다. 전용 주차장이 넓어 이용이 편리하다.
※ 반려동물 동반 가능","<a href=""https://cafehumming.modoo.at/""target=""_blank"" title=""새창 : 허밍카페 사이트로 이동"">https://cafehumming.modoo.at/</a>"
허브 게스트 하우스(Hub Guest House),2621166,숙박,숙박시설,게스트하우스,,인천광역시,126.4883092373,37.5015336649,#본 업소는 외국인관광 도시민박업으로 외국인만 이용이 가능하며 내국인은 이용할 수 없습니다.<br><br>인천광역시 중구에 위치한 인천 허브 게스트하우스는 외국인 투숙객을 위한 전용 숙소이다.,"<a href=""http://www.hubgh.co.kr""target=""_blank"">http://www.hubgh.co.kr/</a>"
허브 하우스,3083550,쇼핑,쇼핑,전문매장/상가,http://tong.visitkorea.or.kr/cms/resource/34/3083534_image2_1.JPG,충청남도,126.6765979377,36.9842719338,"당진허브하우스는 당진시 송산면 가곡리에 위치한 허브 체험 공간이다. 직접 허브농장을 운영하고 있으며 로즈마리, 캐모마일, 라벤더, 야로우 등 다양한 허브의 향기를 느낄 수 있다. 그뿐만 아니라 허브비누 만들기, 귤따기체험, 다육식물 체험, 초콜릿 만들기 등 다양한 체험 활동 프로그램도 마련되어 있다. 이러한 체험 활동 프로그램은 어린이들과 함께 하기에도 적합하다.
당진허브하우스는 국도 38호선과 지방도 633호선을 통해 접근할 수 있다. 고속도로는 서해안고속도로 송악IC 또는 당진IC를 이용할 수 있다. 인근에는 왜목마을, 한진포구, 도비도포구, 함상공원 등의 관광지가 있다.","<a href=""http://herbhouse.edenstore.co.kr/"" target=""_blank"" title=""새창 : 홈페이지로 이동"">http://herbhouse.edenstore.co.kr</a>"
허브관광농원 차브민,128263,인문(문화/예술/역사),산업관광지,기타,http://tong.visitkorea.or.kr/cms/resource/77/1962077_image2_1.jpg,충청남도,126.6811617227,36.9728677762,"허브관광농원 차브민은 당진시 석문호 인근에 있는 관광농원이다. 이곳의 허브동산은 3,306m²(1,000평) 중 1,653m²(500여 평)만이 허브가 자라고 있는 공간이다. 보기에는 작고 소박해 보일 수 있지만 장기간에 걸쳐 가꿔나간 곳이라 더 가치가 있다. 그래서 허브를 가꾸는 기쁨과 보람을 차브민을 찾아주는 모두와 나누면서 또 늘려가고자 하는 것이 이곳의 운영 목표이기도 하다. 이곳에서는 월요일부터 토요일까지 20인 이상 단체를 대상으로 허브비누 만들기, 허브향초 만들기, 허브압화만들기 체험이 가능하며, 레스토랑 차브민이 있어 식사도 가능하다. 허브관광농원 차브민은 국도 38호선을 통해 접근할 수 있으며, 고속도로는 서해안고속도로 송악IC 및 당진IC가 가깝다. 주변에는 석문호 외에 장고항, 왜목마을 등이 있다.",
허브나라농원,127770,인문(문화/예술/역사),산업관광지,기타,,강원특별자치도,128.341125827,37.6390821263,"1996년에 문을 연 한국 최초의 허브 테마 농원이다. 농원을 일군 부부는 둘의 나이를 합쳐 100세가 되던 해에 평창의 깊은 계곡에 내려와 돌밭을 고르고 허브를 심었다. 990㎡으로 시작했던 농원은 현재 33,000㎡에 이르고, 오늘날 평창의 관광명소이자 한국 허브산업의 발상지로 자리매김했다. 허브나라농원은 허브와 꽃을 재배하는 농지와 허브를 보며 휴식할 수 있는 관광농원을 아우른다. 라벤더, 세이지, 메밀 등 150여 종 허브를 테마별로 나눈 10여 개의 테마정원은 허브에 대한 각각의 이야기를 바탕으로 한다. 색색의 허브와 꽃이 피는 팔레트 가든, 셰익스피어 작품에 언급된 허브로 꾸민 셰익스피어 가든, 꿀이 많아 벌과 나비가 좋아하는 밀원식물을 심은 나비가든 등 저마다 특색이 뚜렷하다. 레스토랑과 카페에서 허브가 들어간 음식을 맛볼 수 있고, 허브체험교실에서 천연비누·향초 등을 만들 수 있다. 한국 유명 가수들이 음악회를 여는 별빛무대, 터키 민속공예품을 전시한 터키 갤러리 같은 문화공간도 눈길을 끈다.<br>","<a href=""http://www.herbnara.com""title=""새창:  허브나라농원으로 이동 ""target=""_blank"">http://www.herbnara.com</a>"
허브모텔,2764309,숙박,숙박시설,모텔,http://tong.visitkorea.or.kr/cms/resource/16/2769416_image2_1.jpg,강원특별자치도,128.3782595367,37.6074392723,할머니댁에 놀러 온 듯 안락함을 느낄 수 있는 “허브 모텔”이다.,
허브빌리지,2569457,인문(문화/예술/역사),산업관광지,기타,,경기도,127.0047841853,38.0887299628,"경기도 연천군에 위치한 허브빌리지는 자연과 문화가 경계없이 서로 어우러져 있어 아름다운 자연의 품을 느낄 수 있는 곳이다. 하늘과 강과 산야가 아름다운 삼중주를 이루는 허브빌리지에는 푸른 초목들로부터의 명상과 수백여 종의 형형색색 꽃들과 드넓게 펼쳐진 허브향으로부터 즐거움과 휴식을 안겨준다. 허브를 이용한 비누, 양초, 아로마 등의 체험프로그램, 찜질방, 커피이야기를 들을 수 있는 커피팩토리, 초리 한식당, 이태리식당 파머스테이블, 허브샵, 허브식물원 등 다양한 힐링 휴양시설과 볼거리, 즐길거리를 갖추고 있다.","<a href=""http://herbvillage.co.kr"" target=""_blank"" title=""새창: 허브빌리지 홈페이지로 이동"">http://herbvillage.co.kr</a><br><a href=""https://www.yeoncheon.go.kr/tour/contents.do?key=3978"" target=""_blank"" title=""새창: 연천문화관광 홈페이지로 이동"">https://www.yeoncheon.go.kr/tour</a>"
허브빌리지 펜션,2570428,숙박,숙박시설,펜션,,경기도,127.0047841853,38.0887299628,"지중해 휴양지를 연상케 해주는 허브빌리지는 약 17,000여 평 규모로, 넓게 펼쳐진 임진강이 한눈에 들어오는 향극한 허브향과 아름다운 풍경이 있는 허브마을이다. 다양하게 준비된 객실과 자연 속에서 마음의 안식과 행복을 느낄 수 있는 휴식공간이다.","<a href=""http://www.herbvillage.co.kr"" target=""_blank"" title=""새창:허브빌리지 홈페이지 홈페이지로 이동"">http://www.herbvillage.co.kr</a>"
허브아일랜드,127695,인문(문화/예술/역사),산업관광지,기타,,경기도,127.1311650648,37.965877167,"관광농원인 허브아일랜드(329,000㎡) 내 식물원과 전시실(110,000㎡)을 갖춘 1종 전문 박물관(식물원)으로 등록한 전국 최대 규모의 허브 식물원이다. 허브식물 박물관 내에는 250여 종의 허브와 다양한 식물들이 식재되어 있어 사계절 내 화사하고 푸른 식물을 관람할 수 있다. 허브식물 박물관은 총 4개의 실내 전시관과 야외 전시장으로 구성되어 있다. 각 전시관마다 중심이 되는 허브와 식물들이 있어 관람의 재미와 함께 아이들의 생태체험 교육의 장은 물론 힐링공간으로 활용되고 있다.<br>","* <a href=""https://www.herbisland.co.kr/"" target=""_blank"" title=""새창: 홈페이지로 이동"">https://www.herbisland.co.kr/</a>"
허브아일랜드 불빛동화축제,1754946,인문(문화/예술/역사),축제,일반축제,http://tong.visitkorea.or.kr/cms/resource/87/3080387_image2_1.jpg,경기도,127.1316789055,37.9659160606,"잃어버린 동심을 만들 수 있는 시간! 매일 밤, 작은 불빛들이 만들어내는 동화 같은 세상은 누구에게나 잊지 못할 추억을 선사하며, 누구나 불빛세상의 주인공으로 만들어줄 아름다운 불빛 야경이 준비되어 있다. 허브아일랜드 불빛동화축제는 우리를 동화속 세상으로 초대한다. 결코 꺼지지 않는 불빛들의 네버엔딩스토리를 만나보자! 1~3월까지는 '핑크, 빛으로 말하다' 테마를 가지고 핑크빛의 사랑 메시지를 더한다.","<a href=""https://www.herbisland.co.kr"" target=""_blank"" title=""새창: 허브아일랜드 홈페이지로 이동"">www.herbisland.co.kr</a>"
허브아일랜드영농조합법인,2908311,쇼핑,쇼핑,사후면세점,http://tong.visitkorea.or.kr/cms/resource/55/2881255_image2_1.jpg,경기도,127.1288569556,37.9654216227,-,
허브천문공원,2773317,인문(문화/예술/역사),휴양관광지,공원,http://tong.visitkorea.or.kr/cms/resource/49/2780649_image2_1.png,서울특별시,127.1542252927,37.5373496895,"서울 강동구 길동생태공원 건너편에 있는 공원으로 인근의 일자산 자연공원과 더불어 조깅 코스, 산책로, 전망데크 등 어린이부터 청년, 장년에 이르기까지 다양한 연령의 시민들이 이용할 수 있는 공간이다.
허브천문공원의 구조는 한민족 고유의 전통사상인 천·지·인의 삼재사상에서 공간개념을 도출하여 우주공간(자미원, 태미원, 천시원, 별자리, 은하수 등)을 담고 있다. 공원 동쪽엔 새벽 일출을 감상할 수 있는 전망대, 서쪽으로는 일몰을 감상할 수 있는 관찰대가 있다.
특히 야간 이용자를 위해 공원 바닥 곳곳에 282개의 오색 별자리 조명이 설치되어 있어 시시각각 변화무쌍한 별자리를 감상할 수 있다.
이 바닥 조명은 직경 75m 천문도를 고스란히 공원 바닥에 옮겨놓은 것으로 동·서쪽에 마련된 전망대 위에서 바라보면 북극성을 비롯하여 견우와 직녀 별자리 등을 감상할 수 있어, 젊은이들의 데이트 코스로도 인기가 많다.
서울시 공공 서비스 예약(https://yeyak.seoul.go.kr)을 통해 이용할 수 있다.","<a href=""http://cafe.daum.net/herbparks/"" target=""_blank"" title=""새창 : 허브천문공원 사이트로 이동"">http://cafe.daum.net/herbparks/</a>"
허브체험공원,3403976,인문(문화/예술/역사),체험관광지,이색체험,http://tong.visitkorea.or.kr/cms/resource/26/3403926_image2_1.JPG,서울특별시,127.1514089036,37.536608058,"허브체험공원은 인근의 허브천문공원 과 연계되는 공원으로 허브천문공원에 공급되는 허브를 재배하는 곳이였다. 
허브체험공원은  허브천문공원의 문화적 특징을 살린 허브체험원, 체험텃밭, 휴게시설 등이 조성돼 주민들에게 계절별 허브를 경험하고 휴식할 수 있게 하고있다.",
허브하우스금오산힐링타운,2730840,레포츠,육상 레포츠,"야영장,오토캠핑장",http://tong.visitkorea.or.kr/cms/resource/04/2731004_image2_1.jpg,경상북도,128.2764566778,36.0999102657,"금오산 힐링타운은 경북 김천시 남면에 자리했다. 김천시청을 기점으로 18km가량 떨어졌으며, 영남대로와 우장길을 거친다. 소요 시간은 약 30분이다. 이곳은 노래방, 스크린 골프, 족구장, 탁구장, 찜질방, 식당, 카페 등 즐길 거리가 다양하다. 이 덕분에 연계 관광을 염두에 두지 않았다면 캠핑을 즐기며 부대시설을 이용하는 것만으로도 만족감을 느낄 수 있다. 캠핑장은 글램핑 19개 동, 일반 야영장 5면으로 꾸몄다. 글램핑 객실 내부에는 침대, 냉난방기, TV, 냉장고, 취사도구, 조리도구를 배치했다. 외부에는 전용 데크가 있어 프라이빗한 바비큐 파티가 가능하다. 가로 6m 세로 4m의 파쇄석으로 이뤄진 일반 야영장은 화로와 전기를 사용할 수 있다. 소정의 추가 요금을 내면 반려동물 출입이 가능하다.
캠핑장 주변으로 금오산 국립공원, 금오랜드 등 관광지가 많다.","<a href=""http://herbtown.alltheway.kr/"" target=""_blank"" title=""새창 : 허브하우스금오산힐링타운 사이트로 이동"">http://herbtown.alltheway.kr/</a>"
허생원막국수,2782161,음식,음식점,한식,http://tong.visitkorea.or.kr/cms/resource/44/2782144_image2_1.jpg,강원특별자치도,128.3707267393,37.6122357958,"봉평면에 위치한 메밀국수 전문점으로, 매콤한 명태 식해가 들어가있는 양념으로 비빔국수를 주력 메뉴로 삼는다. 100% 국내산 통메밀을 맷돌로 갈아서 묵,전,전병을 조리한다.",
허쉬캠프,2909679,레포츠,육상 레포츠,"야영장,오토캠핑장",http://tong.visitkorea.or.kr/cms/resource/63/2909663_image2_1.jpg,경상남도,128.5385083913,35.3992637498,"FLOW 11 야영장(허쉬캠프)은 경남 창녕군 길곡면 오호리에 자리 잡았다. 창녕군청을 기점으로 20km가량 떨어졌다. 자동차를 타고 경남대로와 낙동로를 번갈아 달리면 닿는다. 도착까지 걸리는 시간은 20분 안팎이다. 캠핑장은 수목이 울창한 숲속에 위치했다. 이 덕분에 더없이 자연친화적인 분위기에서 캠핑을 만끽할 수 있다. 캠핑장에는 파쇄석과 잔디로 이뤄진 오토캠핑 사이트 30면이 마련돼 있다. 사이트 크기는 가로 8m 세로 6m다. 캠핑펜션 허쉬 돔 4개 동도 운영 중이며, 아담한 수영장도 갖춰져 있어 여름철 물놀이를 즐기기 좋다. 카라반 동반 입장이 가능하며, 반려동물은 소형견에 한해 목줄과 배변봉투를 지참하면 함께 출입할 수 있다. 주변에는 창원마법의정원이 있어 연계 여행에 나서기 좋다.","<a href=""https://theflowkorea.com/hushcamp""target=""_blank"" title=""새창 : 허쉬캠프 사이트로 이동"">https://theflowkorea.com/hushcamp</a>"
허스크밀,3355175,음식,음식점,카페/전통찻집,http://tong.visitkorea.or.kr/cms/resource/05/3421605_image2_1.jpg,강원특별자치도,128.9146249007,37.7944168683,"허스크밀은 강릉 안목해변에 있는 베이커리 대형 카페이다. 자연을 느낄 수 있는 분위기에서 최고급 베이커리를 다양하게 맛볼 수 있다. 대표 메뉴로는 인절미 크림라떼, 말차 바닐라 크림라떼, 먹물 치즈 크림라떼 등이 있다. 대형 베이커리 카페답게 전용 주차장이 있어서 편리하게 주차할 수 있다.",
허심청,127419,인문(문화/예술/역사),휴양관광지,온천/욕장/스파,http://tong.visitkorea.or.kr/cms/resource/99/3329899_image2_1.jpg,부산광역시,129.0826823935,35.2211354084,"허심청은 편안하고 즐거운 온천욕과 휴식 및 체력단련을 통한 건강증진을 추구하는 새로운 유형의 도시형 온천 건강랜드로, 1991년 10월 부산시 도심 재개발 사업으로 탄생했다. 허심청의 온천탕은 전체 4,297.54m²로 3,000명을 동시에 수용할 수 있는 동양 최대 규모의 온천시설이다. 
대온천탕에는 장수탕, 회목탕, 청자탕, 동굴탕, 노천탕 등 40여종의 효능별 욕탕과 계절에 따라 천연재료와 한방약재를 다르게 넣은 이벤트탕을 운영하고 있으며, 개인별 체질과 연령에 따라 자유롭게 이용할 수 있는 다양한 입욕코스가 있다.
확 트인 초대형 온천탕과 자연채광이 가능한 천장, 예술적 조형미를 갖춘 아름다운 실내 전경을 갖추고 있어, 허심청에서만 누릴 수 있는 휴식을 선사하며, 찜질방 및 부대시설에서 가족과 편안한 휴식을 즐길 수 있다.","<a href=""https://www.hotelnongshim.com/kr/index.php?pCode=Hurshimchung"" target=""_blank"" title=""새창 : 홈페이지로 이동"">www.hotelnongshim.com</a>"
허심청브로이 옥토버페스트,2855626,인문(문화/예술/역사),축제,일반축제,http://tong.visitkorea.or.kr/cms/resource/02/3352102_image2_1.jpg,부산광역시,129.0826296532,35.2199410969,"올해로 18회를 맞이하는 2024 허심청브로이 옥토버페스트가 오는 10월 10일부터 12일까지 3일간 부산 호텔농심 야외마당에서 개최된다.
이번 축제는 'I LOVE YOU BEER-Y MUCH'라는 슬로건에 맞춰 맥주를 좋아하는 사람들은 물론, 전 세대 모두가 함께 즐길 수 있는 축제를 구성하였다. 허심청 브루마스터가 제조한 정통독일맥주인 필스, 둔켈을 포함한 다양한 맥주를 무제한으로 이용할 수 있는 옥토버페스트 축제에서 호텔 쉐프가 조리한 다양한 먹거리와 화려한 퍼포먼스, 공연, 그리고 참여 프로그램까지 준비되어있다.",
허준박물관,130552,인문(문화/예술/역사),문화시설,박물관,,서울특별시,126.8510492715,37.5678379253,"서울 강서구에서는 허준 선생이 출생하고 돌아가신 곳으로 알려진 가양동 허준근린공원 옆에 허준박물관을 건립하여 선생을 높은 뜻을 기리고자 설립되었다. 허준박물관은 허준 관련 자료를 수집하고, 업적을 기리는 사업과 더불어 강서구민의 휴식공간과 문화향수의 장으로서의 역할을 수행하면서 쉽게 찾고 친숙하며, 흥미있는 박물관이 되도록 지속적인 노력을 하고 있으며, 한의학 전문박물관으로서의 자리매김을 하고 있다. 허준선생은 본관은 양천(陽川), 자는 청원(淸源), 호는 구암(龜岩)으로 훈련원정 허곤의 손자, 용천부사 허론의 아들이다. 경기도 양쳔현 파릉리 능곡동 백석마을(현 서울시 강서굴 등촌 2동)에서 태어났으며, 조선 중기의 대표적인 의원으로 그의 뛰어난 의술로 인하여 명의(名醫)로 이름을 떨쳤다. 또한 한의학을 집대성한 [동의보감]을 저술하여 한의학의 체계를 세웠다.","<a href=""https://culture.gangseo.seoul.kr/gsfc/main/main.do"" target=""_blank"" title=""새창 : 허준박물관 홈페이지로 이동"">https://culture.gangseo.seoul.kr</a>"
허준축제,2028176,인문(문화/예술/역사),축제,일반축제,http://tong.visitkorea.or.kr/cms/resource/90/3370090_image2_1.jpg,서울특별시,126.8360144928,37.5692236076,"10월의 가을, 전국 최대 의료건강 문화축제인 '허준축제'가 가을의 정취게 물씬 느껴지는 서울식물원에서 개최된다.
'동의보감' 유네스코 세계기록유산 등재 15주년을 기념하는 특별행사까지 더해져, 어느때보다 다채로워진 '제22회 허준축제는' 어린이부터 어르신까지 남녀노소 누구나 참여할 수 있는 다양한 프로그램과 공연이 준비되어 있다.","<a href=""https://www.xn--9y5b9p53i3tk.com/"" target=""_blank"" title=""새창 : 허준축제 홈페이지로 이동"">https://www.xn--9y5b9p53i3tk.com/</a>"
허형만의 압구정커피집,835066,음식,음식점,카페/전통찻집,http://tong.visitkorea.or.kr/cms/resource/60/1838660_image2_1.jpg,서울특별시,127.0240901699,37.5284122719,"허형만의 압구정커피집은 강남구 압구정동에 있는 커피전문점이다. 커피 로스터 겸 강사로 일한 허형만 씨가 운영하는 곳이다. 장기적으로 커피 강좌를 열고 있으며, 직접 로스팅 한 커피를 제공하고 있다.<br>",
헌마공신김만일기념관,2904457,인문(문화/예술/역사),문화시설,기념관,http://tong.visitkorea.or.kr/cms/resource/45/2904445_image2_1.jpg,제주특별자치도,126.6907984475,33.3361761033,"헌마공신김만일기념관은 옷귀마테마타운 근처에 있다. 조선시대에 83년 동안 수천 마리의 말을 나라에 바친 공으로 임금으로부터 헌마공신이라는 명예와 벼슬을 받은 김만일을 기념하는 곳이다. 김만일의 고향 의귀리는 '옷귀마테마타운'으로 운영되며 영조 임금으로부터 귀한 비단옷을 하사받았다는 의미로 '옷귀마'라 부른다. 기념관에는 스크린 승마를 비롯해 다양한 말 체험 프로그램과 말에 대한 기록, 김만일의 업적 등을 전시해 놓았고 실내외 포토존도 다양하다. 관련 여행프로그램으로 옷귀마테마타운 승마, 숲길 승마 등이 있다.","<a href=""http://kimmanil.com/""target=""_blank"" title=""새창 : 헌마공신김만일기념관  사이트로 이동"">http://kimmanil.com/</a>"
헌인릉 생태경관보전지역(오리나무림),827642,자연,자연관광지,자연생태관광지,http://tong.visitkorea.or.kr/cms/resource/06/1860206_image2_1.jpg,서울특별시,127.0819811618,37.4642652042,"헌인릉 생태경관보전지역은  대모산의 남사면 하단 산자락 헌인릉 아래쪽으로 17,000여 평의 오리나무가 군락을 이루고 있는 숲이다. 대모산 남사면의 넓은 유역으로부터 유입되는 지하수로 인해 수위가 높고, 저지대로 토심이 깊어 양호한 환경조건을 갖추어 서울시에서 보기 드문 대규모 오리나무 군집이 형성되어 있다. 또한 오리나무가 자라는 지역 곳곳에는 물웅덩이와 소규모 수로가 잔재하여 다양한 습지성 초본식물들이 번성하고 서울시 보호종인 오색딱다구리, 제비, 꾀꼬리, 박새 등이 서식하는 등 생물다양성이 풍부하다. 오리나무림, 노란물봉선, 둥굴레, 붓꽃 등 다양한 습지식물이 살고 있고 걷기 쉽도록 목재 데크로 만들어 놓아 습지에 사는 식물들을 쉽게 관찰할 수 있으며  헌인릉으로 입장을 해야 한다. 생태경관보전지역으로 지정되면 이 지역 내에서 야생 동식물을 포획하거나 토석을 채취하는 등 생태계 보전에 해를 끼치는 모든 행위가 금지된다.",
헌책방 보물섬,750105,인문(문화/예술/역사),문화시설,전시관,,경기도,126.6869825388,37.7078881466,"파주출판도시의 아시아출판문화정보센터 2층에 있는 헌책방으로 아름다운 가게에서 운영하고 있다. 아름다운 가게 헌책방 1호점으로 나눔과 순환의 가치와 책이 갖는 소중한 의미를 나누는 책방이다.  보물섬은 우리 시대 명사들의 기증서나 추천 도서를 모은 [지혜의 등대], 장르별 모음 공간인 [테마창고], 절판본과 희귀본들을 모은 [보물 창고], 작가의 기증품과 작품을 전시해 놓은 [작가의 방] 등 독특한 테마룸으로 꾸며졌다. 헌책방뿐만 아니라 음악 CD 그리고 게임 CD까지 판매하고 있으며, 아이들의 추천 도서도 많아 아이들이 있는 가족들이 주말이면 즐겨 방문하는 곳이다. 헌책방 보물섬은 야외에서 자유롭게 책을 보고, 구매할 수 있는 무인서가 [양심 책방]과 붉은 노을을 감상할 수 있는 평상을 마련하였고, 이곳은 출판도시만의 특별한 쉼터로 널리 알려졌다.","<a href=""https://bookcity.or.kr/bbs/board.php?bo_table=bookstore&wr_id=4"" target=""_blank"" title=""새창 : 홈페이지로 이동"">https://bookcity.or.kr/</a>"
헌터 신세계사이먼 제주아울렛,3306402,쇼핑,쇼핑,사후면세점,http://tong.visitkorea.or.kr/cms/resource/34/3314334_image2_1.jpeg,제주특별자치도,126.3197479556,33.3072595277,-,
헌화로,2714722,자연,자연관광지,자연생태관광지,,강원특별자치도,129.0548163443,37.663465302,"헌화로는 헌화가에서 유래한 도로명이다. 순정공이 강릉 태수가 되어 부임하던 길에 그의 부인인 수로부인이 바닷가 절벽 위에 핀 철쭉을 꺾어 달라 부탁했지만, 위험한 일이므로 아무도 나서는 사람이 없었다. 이때 소를 끌고 가던 한 노인이 나서서 꽃을 꺾어 바치면서 헌화가를 불렀다고 한다. 헌화로는 옥계면 낙풍리 낙풍 사거리에서 강동면 정동진리 정동진역 앞 삼거리에 이르는 도로이며 사계절 아름다운 자연경관을 제공한다.

(출처 : 강릉시청)",
헐리우드모텔,138462,숙박,숙박시설,모텔,http://tong.visitkorea.or.kr/cms/resource/54/1786754_image2_1.jpg,경기도,127.3525530815,36.9988544623,헐리우드모텔은 안성시 금광면 금광호수 상류에 위치한 호텔 같은 모텔이다. 산 속 조용한 곳에 위치한 느낌이 드는 주변과 창문 밖으로  탁 트인 금광호수 전경으로 복잡한 도심 속을 탈피해 오면 가슴이 뻥 뚫리는 곳이다. 유럽의 예쁜 집을 옮겨다 놓은 듯한 외관의 모습을 하고 있다.,
