title,contentid,cat1,cat2,cat3,firstimage,region,mapx,mapy,overview,homepage
모명재,1612615,인문(문화/예술/역사),역사관광지,유적지/사적지,http://tong.visitkorea.or.kr/cms/resource/66/1575166_image2_1.jpg,대구광역시,128.651658057,35.8580251563,"모명재는 임진왜란 때 명나라 원군으로 참전하였다가 조선에 귀화한 두사충을 기리기 위하여 두릉두씨 문중에서 건립한 재실이다. [모명재]는 고국인 명나라를 사모한다는 뜻이다. 두사충은 중국 두릉 출신으로 임진왜란이 일어나자 명나라 제독 이여송의 휘하 장수로 조선에 파견되었다. 두사충은 지세를 살펴 진지를 펴기 적합한 장소를 잡는 수륙지획주사라는 직책을 맡았다. 따라서 두사충은 이여송의 일급 참모로서  조선군과도 전략 전술상의 긴밀한 협의를 하였다. 임진왜란이 평정되자 두사충은 고향으로 돌아갔다가 정유재란이 발발하자 아들 두산·두일건을 데리고 매부인 진린도독과 함께 다시 출진하였다. 전란이 끝난 뒤 두사충은 두 아들과 함께 조선에 귀화하였고, 조정에서는 두사충에게 대구 시내 중앙공원(현 경상감영공원) 일대의 땅을 하사하였다.

이후 두사충이 받은 땅에 경상감영이 옮겨 오게 되자 두사충은 자신의 땅을 내어놓고 계산동으로 옮겨 세거하였다. 고국에 두고 온 부인과 형제들을 그리워하던 두사충은 최정산(현재의 대덕산) 밑으로 집을 옮겨 동네 이름을 대명동이라 붙이고 단을 쌓아 매월 초하루가 되면 명나라 황제가 있는 자금성 쪽을 향하여 배례를 올렸다고 한다. 모명재는 네모 반듯한 대지 위에 남향으로 배치되어 있으며, 정면 4칸, 측면 2칸 규모의 겹처마 팔작기와집으로 지어졌다. 또한 대청을 중심으로 좌우에 온돌방을 들이고, 앞쪽에는 반칸 규모의 퇴칸을 두고 있다. 모명재는 20세기 초 대구 지역의 재실 건축 형식을 잘 보여 준다. 모명재는 1912년 경산객사가 헐리자 그의 후손들이 그 재목을 옮겨와 두사충의 묘소 앞에 지은 것으로, 건물이 너무 낡아 1966년 중수하였다. 대구를 방문하는 중국인 관광객들이 가장 먼저 찾는 곳 으로 알려져 있으며, 최근 재정비 사업을 통해 새롭게 단장되었다. 모명재 이웃에  한국전통문화체험관을 열고 다례한복체험이나 활쏘기, 동의보감 음식체험 등을 진행하고 있으니 전통관에서의 체험도 같이 해 볼 수 있다.","<a href=""https://blog.naver.com/mktcc"" target=""_blank"" title=""새창 : 모명 홈페이지로 이동"">https://blog.naver.com/mktcc</a>"
모모라면,2824026,음식,음식점,한식,,인천광역시,126.6543644614,37.4675988649,"제물포역에 위치한 오래된 분식집이다. 학교 근처 분식집으로 저렴한 가격에 가성비 맛집이다. 내부는 넓고 오래된 인테리어로 정겹다. 라면류, 떡볶이류, 즉석떡볶이류, 라이스류의 다양한 분식을 즐길 수 있다.",
모모스 로스터리&커피바,2838991,음식,음식점,카페/전통찻집,http://tong.visitkorea.or.kr/cms/resource/79/2838979_image2_1.jpg,부산광역시,129.042500418,35.0962958697,"모모스 로스터리&커피바는 항구 근처의 오래된 창고의 모습 그대로 간직하고 있다. 엄청난 쇳덩이의 닻과 배들이 함께 어우러져 거대한 커피 박물관을 연상케 한다. 모모스 로스터리&커피바 영도점은 일반 커피숍과는 다르게 입구에서 대기 번호를 입력 후 입장해야 한다. 대기시간이 발생하여 기다리는 동안에는 원두를 보관하는 창고부터 로스팅 공간 등의 공간 오디오 가이드와 다양한 전시 콘텐츠를 즐길 수 있고, 굿즈나 원두를 구매할 수도 있다. 카카오톡으로 입장 안내를 받으면 전문 바리스타와 소소한 얘기들을 나누며 직접 내려주는 커피를 마실 수 있다. 온천 본점과는 또 다른 분위기를 즐길 수 있는 영도의 핫플레이스다.  
※ 반려동물 동반 불가","<a href=""http://www.momos.co.kr/""target=""_blank"" title=""새창 : 모모스로스터리&커피바 사이트로 이동"">http://www.momos.co.kr/</a>"
모모스커피 본점,2832729,음식,음식점,카페/전통찻집,http://tong.visitkorea.or.kr/cms/resource/25/2832725_image2_1.jpg,부산광역시,129.0863710134,35.2192384668,"부산 온천장의 대표 브랜드인 모모스커피 본점은 품질 좋은 커피로 유명하다. 오래된 건물 정원에서 운치 있게 커피를 맛볼 수 있어 인기다. 또한 2019년 월드 바리스타 챔피언십에서 한국인 최초로 우승한 바리스타를 배출한 곳으로 이름이 났다. 로스팅 룸과 베이킹 실이 있어 늘 맛있는 커피와 빵을 제공한다. 오랜 시간 같은 장소에서 주민들과 관광객의 사랑을 받는 모모스는 온천장역 2번 출구에서 가깝다. 주차장은 따로 마련되어 있지 않다. 각기 다른 매력을 가진 고품질의 커피를 통해 또 다른 즐거움을 느낄 수 있는 오늘의 커피를 추천한다.    
※반려동물 동반 불가","<a href=""http://www.momos.co.kr/""target=""_blank"" title=""새창 : 모모스커피 사이트로 이동"">http://www.momos.co.kr/</a>"
모모아트,2876173,음식,음식점,카페/전통찻집,http://tong.visitkorea.or.kr/cms/resource/57/2876157_image2_1.jpg,인천광역시,126.7249136075,37.566149766,"모모아트는 자연과 함께 힐링하는 카페 겸 문화공간으로 이루어져 있는 곳이다. 아이들에게 도예와 원예, 미술, 퍼포먼스, 흙놀이 등의 다양한 체험제공과 미술교육이 이루어진다. 카페에는 아름다운 정원과 숲 속 공간이 있으며, 곳곳에 포토존도 마련되어 있어 남녀노소 모두 즐길 수 있고 추억을 남길 수 있도록 했다. 또, 실외 공간에서는 자연을 느끼며 식물 체험을 할 수 있도록 꾸며져 있다.","<a href=""https://blog.naver.com/momoart2""target=""_blank"" title=""새창 : 모모아트 블로그로 이동"">https://blog.naver.com/momoart2</a>"
모모야마,1393694,음식,음식점,일식,,서울특별시,126.9809819395,37.5653516507,"일본 정통 스시 전문점 및 카이세키 전문점에서 직접 전수받은 국내 최고 수준의 스시와 카이세키 요리를 선보인다. 
80여 종의 국내 최대 사케 컬렉션과 전문 사케 소믈리에가 있으며, 고품격 모임을 위한 다양한 크기의 별실이 마련되어 있다. 롯데호텔 본관 38층에 위치하고 있어 북한산과 남산타워, 시내를 한눈에 아우르는 도심 최고의 전망을 자랑한다.",
모모카라반,2792621,레포츠,육상 레포츠,"야영장,오토캠핑장",http://tong.visitkorea.or.kr/cms/resource/30/2799530_image2_1.JPG,인천광역시,126.4476915916,37.2673684938,"인천시 옹진군에 있는 모모 카라반은 해수욕과 갯벌체험이 가능한 곳에 위치해 있다. 장경리 해변과 전망 좋은 양로봉이 있어 다양하게 즐길 수 있으며 반려견 입장이 가능한 럭셔리 카라반 캠핑장이다. 워터슬라이드가 있는 대형 수영장뿐만 아니라 별도의  반려견 수영장과 대형 트램펄린, 객실별 바비큐 시설로 좋은 호평을 받고 있다. 주변에는 장경리 해수욕장이 있어 즐길 거리가 많다. 카라반에는 더블 침대와 소파침대, 2층 침대가 있어 총 5인까지 투숙할 수 있다. 또한, 에어컨과 온수난방, 온풍기, 전기장판 등이 있어 여름철이나 한겨울에도 쾌적하게 캠핑을 즐길 수 있다. 식기류와 조리도구 및 냉장고, 전기밥솥, 전자레인지, 커피포트까지 완비되어 별도의  캠핑 용품을 가져오지 않아도 된다. 다만 위생문제로 수건과 칫솔은 제공하지 않으니 참고하면 된다. 반려견 동반 카라반답게 인조 잔디로 된 반려견 놀이터와 얕은 수심의 반려견 수영장이 있어 반려견과 함께 나들이하기에 좋다.",
모모회식당,2906064,음식,음식점,한식,http://tong.visitkorea.or.kr/cms/resource/46/2906046_image2_1.jpg,경상남도,128.3710488431,35.0586489992,"고성군 회화면 배둔리에 있는 모모회식당은 저렴한 가격에 싱싱한 회를 즐길 수 있어 현지인들 사이에서 숨은 맛집으로 알려졌다. 점심 메뉴로는 갈치조림과 된장찌개가 인기가 많고 저녁엔 주로 모둠회를 주문한다. 회는 상추나 깻잎에 묵은지, 마늘 등을 올려 쌈을 싸 먹거나 직접 만든 고소한 쌈장에 찍어 먹는다. 보통은 회를 먹은 뒤에 식사 메뉴로 매운탕을 먹지만 이곳에서는 된장찌개가 제공된다. 나물과 된장찌개를 함께 넣어 비벼 먹는 것이 이 집의 별미이다. 추가 반찬은 셀프 코너에서 원하는 만큼 가져다 먹을 수 있다. 홀에는 입식과 좌식 테이블이 여러 개 있고 단체가 들어갈 수 있는 룸이 세 개 있다.",
모미지,821101,음식,음식점,일식,,충청남도,127.1275898273,36.8057643552,"‘모미지’는 2003년에 문을 열었으며 천안 봉서산 중턱에 위치해 좋은 자연환경과 일식 요리를 맛볼 수 있다. 준비된 메뉴로는 생선회코스와 정식, 참치회 등의 사시미 메뉴와 흑산홍어, 자연산 전복구이 등 특별메뉴가 준비되어 있다. 메인 회와 생선초밥, 생선조림과 구이, 새우튀김 등이 구성된 런치 정식도 인기가 좋다. 이곳의 매장 외관 모양은 정통 일본식으로 꾸며져 있어 고급스러운 일식의 풍미를 느낄 수 있다. 매장 내부는 1,2층의 룸으로 구성되어 있어 프라이빗한 식사가 가능하다.",
모밀촌,2856723,음식,음식점,한식,,인천광역시,126.7146285419,37.4628560373,"인천 간석동에 위치한 모밀전문점이다. 가게 안은 아담한 편이다. 혼밥 할 수 있는 자리와 4명이 앉을 수 있는 테이블이 4개 있다. 메뉴는 냉모밀, 모밀소바, 비빔모밀, 김치/온모밀 등이 있다. 양이 푸짐하고 저렴한 가격으로 가성비 맛집이다. 모밀육수는 사장님이 직접 배합하여 수제로 만들어 깔끔하며 깊은 감칠맛을 느낄 수 있다.",
모밥 신성점,1941315,음식,음식점,한식,http://tong.visitkorea.or.kr/cms/resource/45/3032545_image2_1.JPG,대전광역시,127.3487479687,36.3902993076,"모밥(대전)은 대전 유성구 대덕연구단지 내에 있는 한식 전문점이다.
이 곳은 홍어삼합, 수육, 굴, 해물파전 등의 해산물과 닭, 오리백숙 등을 함께 취급하는 종합 한식 전문 음식점이다. 이름처럼 어머니의 마음으로 요리하는 정신을 내세우고 있으며, 주택가 및 연구소 밀집 지역에 위치하여 지역 주민과 직장인들이 많이 찾고 있다.
모밥(대전)은 유성대로와 가정로에서 신성로를 통해 접근할 수 있으며, 고속도로는 호남고속도로 지선 북대전IC 및 유성IC와 당진영덕고속도로 남세종IC가 가깝다. 
주변에는 자운대, 수운교도솔천, 대전시민천문대, 지질박물관 등이 있다.","<a href=""http://mobap.cityfood.co.kr/"" target=""_blank"" title=""새창: 모밥 신성점 홈페이지로 이동"">http://mobap.cityfood.co.kr/</a>"
모범갈비,2892056,음식,음식점,한식,http://tong.visitkorea.or.kr/cms/resource/40/2892040_image2_1.jpg,경기도,126.7493444565,37.6740070918,모범갈비는 일산 대화역에서 가까운 돼지 양념 숯불갈비 맛집이다. 식당 뒤편으로 3~4대 정도 주차할 수 있는 주차 공간이 있다. 매장 입구에는 곳곳에 작은 정원 느낌의 공간이 있고 내부는 입식 테이블로 되어있다. 단체석은 좌식 형태의 30석 룸이 있으며 예약 후 이용할 수 있다. 돼지갈비를 주문하면 테이블마다 직원들이 돌아다니며 고기가 타지 않게 구워준다. 점심 특선 메뉴로 돼지갈비와 소 양념갈비가 있는데 식사는 꽃게 된장찌개와 후식 냉면 중에 선택할 수 있다. 근처에 일산 호수 공원이 있어 둘러보기 좋다.,
모비딕 모텔,639325,숙박,숙박시설,모텔,http://tong.visitkorea.or.kr/cms/resource/73/3071573_image2_1.jpg,강원특별자치도,128.7861402849,37.9408085149,"동해안 바닷가 언덕 위에 위치한 모비딕 모텔은 고품격 인테리어와 서비스를 갖추고 있으며 전 객실에서 일출 및 바다 전경을 볼 수 있다.
객실마다 한 면 전체가 통창으로 되어있어 오션뷰를 바라보며 휴식을 취할 수 있으며, 발코니로 나가면 시원한 바닷바람과 아름다운 동해바다를 즐길 수 있다.
객실은 한식, 양식, 스위트룸으로 구성되어 있으며, 식당과 공동취사장 시설을 갖추고 있다. 객실 내 취사는 금지이다.
주변에 양양고인돌캠프장, 어성전숲속수련장 등이 있다.",
모비딕수상레저,3006242,레포츠,레포츠소개,수상레포츠,http://tong.visitkorea.or.kr/cms/resource/08/3000408_image2_1.jpg,경기도,127.5352198904,37.7741541319,"가평에서 수상 레저를 즐길 수 있는 곳 중의 하나이다. 무제한 이용 가능한 워터슬라이드와 점프, 200m 길이의 워터파크 등과 웨이크보드, 10여 가지의 수상 레저를 즐길 수 있다.
쾌적한 샤워룸과 여성전용 파우더룸이 완비되어 있으며 가평역에서의 무료 픽업, 드롭 서비스를 해준다. 자연과 즐거운 음악 속에서의 무제한 바비큐(1인 3만 원, 어린이 2만 원), 그 외의 식당과 매점이 있고 근처 직영 펜션도 갖추고 있다.
좀비 보트(540도 회전 및 짜릿한 잠수)로 런닝맨에서 촬영을 한곳이며 그 외 방송도 촬영되었다고 한다. 규모가 크고 픽업, 드롭이 되어서인지 대학생들의 MT나 워크숍 장소로도 이용되는 곳이다.
워터파크는 어린이들도 안전하게 이용할 수 있는 곳이다. 구명조끼는 무료로 대여하며 그 외 아쿠어삭스나 수건 등은 판매하고 있다.","<a href=""http://mobydic.co.kr/"" target=""_blank"" title=""새창 : 홈페이지로 이동"">http://mobydic.co.kr</a>"
모사금해수욕장,128753,자연,자연관광지,해수욕장,http://tong.visitkorea.or.kr/cms/resource/43/3027343_image2_1.jpg,전라남도,127.7557650074,34.7965564174,"모사금이라는 말은 모래의 여수 향토어인 모살과 해안이란 뜻의 기미가 합쳐져 모래해안이라는 뜻의 모사금이 되었다. 여수 만성리검은모래해변(만성리해수욕장)에서 2km 정도 거리에 위치한 이곳은 금빛처럼 고운 모래해변과 조약돌 해변, 암반 해변으로 이루어져 있으며, 이곳은 다양한 어종이 서식하여 낚시 포인트로 유명하여 갯바위 곳곳에는 낚시를 즐기는 강태공들과 가족단위 여행객들이 많이 찾는 해수욕장이다. 특히 감성돔이 많이 나와 5월부터 가을까지 낚시를 즐기는 사람들이 끊이지 않는다. 
한려해상국립공원 오동도 지구 내에 위치해 있어 주변 경관이 아름다우며, 부드러운 모래 백사장이 인상적이다. 백사장 길이 225m, 폭 30m의 아담한 해수욕장으로 수심이 낮고 바닷물이 깨끗할 뿐만 아니라 분위기도 아늑하고 조용하다. 오천에서 소치 사이에 해안도로를 따라 해변 드라이브 코스로 손색이 없으며, 해돋이 명소로 유명하다. 
주변 해수욕장으로는 만성리검은모래해변과 신덕해수욕장이 있으며 차량 이동으로 13분 거리에 여수엑스포역이 있어 여수시내를 방문할 수 있다.","<a title=""새창 : 여수 문화관광 사이트로 이동"" href=""https://www.yeosu.go.kr/tour/travel/island_beach?mode=view&idx=288"" target=""_blank"">http://tour.yeosu.go.kr/</a>"
모산공원,2865776,인문(문화/예술/역사),휴양관광지,공원,http://tong.visitkorea.or.kr/cms/resource/50/2865750_image2_1.JPG,경상남도,128.8219454671,35.1673116447,"김해 장유동에 있는 모산공원은 넓은 산책길과 숲 체험장, 유아 체험장 등이 있어 어린이와 함께 가기 좋은 공원이다. 유아 숲 체험장은 6세부터 13세까지 이용할 수 있으며 집라인, 경사 오르기, 흔들 다리, 널판 건너기, 흔들 포켓 등이 있어 어린이들에게 인기가 높다. 공원 곳곳에 벤치, 테이블이 마련되어 있어 편하게 이용할 수 있다. 넓은 잔디 구장과 트랙이 있어 언제든 운동을 할 수 있도록 개방해 놓았다. 여름에는 바닥분수 공원도 운영하고 있다. 어린아이와 어른들을 위한 다양한 공간이 마련되어 있어 남녀노소 힐링할 수 있는 공원이다. 공원 근처에 워터파크와 롯데 아울렛이 있어 함께 방문해도 좋다.
※ 반려동물 동반 가능(배변봉투, 리드줄 필히 지참)","▪ <a href=""https://blog.naver.com/gimhae4you/222617744054?trackingCode=blog_bloghome_searchlist"" target=""_blank"" title=""새창: 김해시 공식 블로그로 이동"">https://blog.naver.com/gimhae4you</a>"
모산목장,988016,인문(문화/예술/역사),체험관광지,농.산.어촌 체험,http://tong.visitkorea.or.kr/cms/resource/24/2480324_image2_1.jpg,경기도,126.72402648,37.8023472378,"어린이들에게 젖소 체험을 제공하고 있는 낙농체험목장이다. 자연을 해치지 말고 자연과 함께 동화 되어 마음 속 평화를 전하고, 우유의 소중함을 많은 소비자에게 제대로 알리기 위해 설립되었다. 아이들이 시골의 정겨움을 느낄 수 있도록 젖소에게 사료 주기, 송아지 우유 주기, 달콤한 아이스크림 만들기 등 다양한 체험 프로그램이 준비되어 있다.","<a href=""http://www.mosanfarm.com/"" target=""_blank"" title=""모산목장 사이트로 이동"">www.mosanfarm.com</a>"
모산방,685143,음식,음식점,한식,http://tong.visitkorea.or.kr/cms/resource/85/1977385_image2_1.jpg,전북특별자치도,126.6817217424,35.9629643268,"산북동 산북초등학교 후문에 위치해 있는 한정식집이다. 자그마한 화단과 황토집으로 되어있는 모산방은 채식뷔페로도 유명했던 식당인데 현재는 한정식집으로 운영하고 있다. 건강을 우선으로 하는 담백한 상차림을 기본으로 채식의 진미를 살린 각종 샐러드 요리 등 기본 반찬들이 간이 세지 않고 자극적이지 않으며 음식들이 정갈하고 맛있다. 
식당 내부에 넓은 홀이 있어 돌잔치나 가족 모임 등 소규모 단위의 단체행사도 가능하며 개별 룸도 준비되어 있어 조용하게 개인 모임을 가져도 좋다.",
모산비행장,2900858,인문(문화/예술/역사),체험관광지,이색체험,,충청북도,128.2201230685,37.1628514927,"제천 모산 비행장은 1950년대 한국 전쟁시 비행훈련 목적으로 세워진 곳으로, 1975년 비행장 재정비 후 항공기 이착륙은 한적이 없다. 국방부 소유였던 비행장이 제천시 소유로 돌아가게 되며 다양한 꽃들을 심어 놓아 계절의 변화에 따라 나들이 즐기기 좋은 장소로 탈바꿈 했다. 또한, 방탄소년단의 <Young Forever> 촬영지이기도 하여 전 세계로부터 많은 관광객이 찾아오고 있다. 뮤직비디오에 나온 'FOREVER' 글자와 함께 기념사진을 촬영할 수 있으며, 일몰시간에 방문하면 뮤직비디오와 비슷한 색감의 사진을 담을 수 있다.",
모산수제비,2868784,음식,음식점,한식,http://tong.visitkorea.or.kr/cms/resource/78/2868778_image2_1.jpg,충청남도,127.059121843,36.7749416907,"모산수제비는 충청남도 아산시 배방읍 공수리에 있다. 오랜 세월의 흔적이 엿보이는 외관과 깔끔한 분위기를 연출하는 인테리어가 눈에 띈다. 대표 메뉴는 구수한 맛의 들깨수제비다. 이 밖에 손칼국수를 비롯해 얼큰이칼국수, 서리태콩국수 등도 준비되어 있다. 모든 음식 가격이 저렴하지만, 맛이 훌륭해 연중 많은 사람의 발길이 이어진다. 남천안IC에서 가깝고, 주변에 아산지중해마을, 현충사곡교천은행나무길이 있다.",
모상개해수욕장,129493,자연,자연관광지,해수욕장,http://tong.visitkorea.or.kr/cms/resource/54/3373754_image2_1.JPG,경상남도,128.0756553901,34.8393655486,남해군 창선면 장포리 마을 끝에 있는 작고 아담한 해수욕장이다. 총길이 약 300m의 작은 해수욕장으로 여름철에도 사람들이 많이 찾지 않는 한적한 해수욕장으로 가족단위로 해수욕을 즐기기에 좋은 곳이다. 근처에 펜션이 한 두 곳정도 자리하고 있어서 숙박을 이용할 수 있다. 따로 편의시설을 갖추고 있지 않아서 그늘막이나 개인용품을 챙겨야 한다. 모상개해수욕장은 남해 드라이브 코스로도 알려져 있고 인근에는 골프장인 사우스케이프 CC와 장군산이 위치하여 함께 관광을 할 수 있다.,
모션 APM,2932120,쇼핑,쇼핑,사후면세점,http://tong.visitkorea.or.kr/cms/resource/52/2889352_image2_1.jpg,서울특별시,127.008084964,37.567535217,-,
모소밤부 다이닝&카페,2837480,음식,음식점,카페/전통찻집,http://tong.visitkorea.or.kr/cms/resource/70/2837470_image2_1.jpg,경기도,127.0575029851,37.3603268189,"고기동에서 예쁜 맛과 감성을 자랑하는 카페이다. 입구를 찾아 카페가 있는 지하로 내려가면 바로 고기리 계곡과 맞닿아 있어 실제로 계곡에 앉아있는 듯한 느낌을 받는다. 입구에서는 지하처럼 느껴지나 실제로는 지상이다. 고급스러운 인테리어로 꾸며진 실내에 계곡과 숲을 즐길 수 있는 좌석이 마련되어 있다. 야외 테라스와 마당에도 좌석이 마련되어 있어 물소리를 들으며 차와 음식을 즐길 수 있다. 커피나 베이커리 단품 외에 브런치 세트 메뉴가 인기 있다. 주말에는 어린이를 동반한 가족 단위의 고객이 많아 대기할 경우도 있다.
※ 반려동물 동반 불가","<a href=""http://www.instagram.com/mosobamboo_cafe""target=""_blank"" title=""새창 : 모소밤부 사이트로 이동"">http://www.instagram.com/mosobamboo_cafe</a>"
모수차미,2873372,음식,음식점,한식,http://tong.visitkorea.or.kr/cms/resource/64/2873364_image2_1.jpg,경기도,126.9152562178,37.4089797451,"모수차미는 경기도 안양시 만안구 안양동에 있는 영양탕 전문점이다. 모수차미는 1969년부터 시작한 53년 전통의 대교식당의 새 이름이다. 매장은 넓고 쾌적하며 좌석이 넓고 편안하다. 대표 메뉴인 염소탕은 일반 뚝배기보다 깊은 뚝배기에 부추를 듬뿍 얹어 가득 나온다. 고기의 냄새가 전혀 없으며 껍질과 살코기가 모두 고소하고 담백하다. 기본 소스에 무, 생강, 들깻가루를 넣어 고기를 찍어 먹으면 맛이 더욱 좋다. 녹두삼계탕은 신선한 닭의 살이 부드럽고 살이 잘 분리된다. 닭 안에 은행, 대추, 인삼, 마늘과 함께 녹두 찹쌀밥이 가득 들어있다. 맛은 담백하고 구수하다. 장수탕도 인기 메뉴인데 비린내가 전혀 없고 국물도 진하고 시원하다. 고기도 연하여 특제소스에 마늘과 간 생강을 섞어 찍어 먹으면 맛이 더 좋다. 반찬은 셀프 코너를 이용하여 추가로 먹을 수 있다. 포장도 할 수 있다. 4km 이내에 안양중앙시장, 박달공원, 학운공원, 삼막사계곡, 평촌 중앙공원이 있다.",
모스가든,2755477,음식,음식점,이색음식점,,서울특별시,127.0283873324,37.5167137081,"모스가든은 도시 공간, 문화 공간, 생활 공간을 디자인하는 모스우드의 첫 번째 복합문화 생활공간이다. 굿 사마리안 레시피, 생루크마리 카페, 모스가든 마켓 플레이스를 이용할 수 있다. 커다란 파파야 나무가 있는 정원을 바라볼 수 있는 테라스에서 식사를 할 수 있으며, 빈티지 의자가 있는 공간과 패션 포토그래퍼 작품이 전시된 서재 룸, 이국적 타일의 화장실 등 개성 있는 공간들이 사진 찍는 곳으로 인기를 얻고 있다. 영화 <아가씨>, <국제시장>의 포스터를 제작한 그래픽디자인 회사 대표와 공간 크리에이티브 디렉터가 함께 운영하는 곳이다.",
모스코나 2001아울렛 중계,3306626,쇼핑,쇼핑,사후면세점,http://tong.visitkorea.or.kr/cms/resource/57/3314757_image2_1.jpg,서울특별시,127.0679274101,37.6413416033,-,
모스코나 nc신구로,3305899,쇼핑,쇼핑,사후면세점,http://tong.visitkorea.or.kr/cms/resource/67/3313467_image2_1.jpg,서울특별시,126.8827871414,37.5012129024,-,
모스코나 뉴코아 평촌,3307350,쇼핑,쇼핑,사후면세점,http://tong.visitkorea.or.kr/cms/resource/76/3314276_image2_1.jpg,경기도,126.9516812325,37.3893465617,-,
