title,contentid,cat1,cat2,cat3,firstimage,region,mapx,mapy,overview,homepage
동촌유원지 오리배선착장,3058341,인문(문화/예술/역사),체험관광지,이색체험,http://tong.visitkorea.or.kr/cms/resource/92/3348492_image2_1.jpg,대구광역시,128.6526239855,35.8814419675,"동촌유원지는 대구 동구의 유일한 유원지로 시민들의 휴식 공간이다. 동촌유원지에는 해맞이다리, 체육시설, 영남 제1관, 자전거 경기장, 실내 롤러 스케이트장 등 다양한 즐길 거리가 있다. 이곳은 봄이면 벚꽃을 시작으로 여름에는 뱃놀이, 가을에는 단풍, 겨울에는 금호강의 자연 빙상장으로 사계절 모두 동촌유원지를 다양하게 즐길 수 있으며, 특히 밤이면 조명을 밝혀 대구에서도 야경 명소로 입소문이 나고 있다. 이런 금호강 동촌유원지를 즐기는 또 다른 방법이 오리배와 오리배 유람선이다. 동촌유원지 강변길을 따라 걷다 보면 오리배들이 물 위에 떠 있는 것을 발견할 수 있다. 오리배는 이용객의 취향에 따라 발로 페달을 밟는 구동형부터 전동형까지 선택할 수 있다. 
오리배 선착장 주변은 금호강 뷰를 보며 즐기는 차크닉 장소로도 유명하다. 물 위에 떠 있는 오리배도 구경하고 운이 좋으면 금호강변의 하늘을 온통 황금빛으로 물들이는 노을도 감상할 수 있다. 해가 지면 야간조명이 켜지는 동촌해맞이다리와 금호강변 가로등 불빛이 수면 위를 어른거리는 경치를 보며 휴식을 취할 수 있기도 하다.",
동축사,304689,인문(문화/예술/역사),역사관광지,사찰,http://tong.visitkorea.or.kr/cms/resource/65/3063365_image2_1.jpg,울산광역시,129.4187884313,35.5484105199,"동축사는 울산지역의 고찰로서 신라의 불국토사상이 반영된 성지이다. 신라 진흥왕과 인도 아육왕의 정신적 만남이라는 역사적 배경을 가지고 있는 곳으로, 아육왕이 배에 실어 보낸 석가삼존불의 모형을 봉안하기 위해 세운 사찰이라는 연기설화를 간직하고 있다.
동축이라는 이름에서도 이곳이 범상치 않은 불국토임을 짐작할 수 있다. 즉 불국토의 고향인 인도가 서쪽의 나라이기에 서축이라 하였듯이 이와 대비되는 이름으로써 동축이라 칭하였던 당시 신라 불국토사상의 일면을 살필 수 있는 것이다.
이는 신라에 석가모니 과거불 시절부터 7개의 절터가 존재하고 있었다는 불연국토라는 사상이 내재되어 있는 것으로, 인도 아육왕을 이상으로 삼아 그의 족적을 쫒으려는 진흥왕시대 신라 불교문화의 부흥과도 연결된다. 
일찍이 동축사가 자리한 이곳은 울산 동면8경 중 축암효종(竺岩曉鐘)ㆍ섬암상풍(蟾岩霜楓)이라 하여 시인묵객의 발길이 잦았던 곳이다. 특히 동축사 정상의 관일대는 섬암이라 하여 동축사의 종소리와 함께 해뜨는 동해바다를 조망할 수 곳으로 유명하다.","<a href=""http://www.052-251-0410.kti114.net/"" target=""_blank"" title=""새창 : 동축사 홈페이지로 이동"">http://www.052-251-0410.kti114.net</a>"
동춘당 문화제,1079577,인문(문화/예술/역사),축제,일반축제,http://tong.visitkorea.or.kr/cms/resource/82/3111282_image2_1.jpg,대전광역시,127.4412987135,36.3648816382,"동춘당 문화제는 1996년에 제1회를 시작으로 매년 4월 ~ 5월 경에 진행되어 올해 27회를 맞이하여 〈회덕, 다시 또 봄〉이라는 주제로 펼쳐진다. <br>
동춘당 문화제를 대표하는 프로그램으로 숭모제례, 문정공시호봉송핼렬, 동춘당 휘호대회, 동춘 콘서트가 있으며 그 외 유교경전암송, 동춘장터, 동춘당 탕방 등 다채로운 프로그램으로 동춘당 문화제만의 즐거움을 선사하여 지역주민 및 관광객들이 즐길 수 있는 축제 장을 마련한다.","<a href=""https://www.ddcc.or.kr/"" target=""_blank"" title=""새창 : 동춘당 문화제 홈페이지 이동"">www.ddcc.or.kr</a>"
동춘사골순대국 동춘점,2833808,음식,음식점,한식,http://tong.visitkorea.or.kr/cms/resource/05/2833805_image2_1.jpg,인천광역시,126.6716754859,37.4138665244,"동춘 사골 순대국 동춘점은 인천광역시 연수구 동춘동에 있는 순대 전문점이다.  수인 분당선 연수역 4번 출구와도 가깝다. 인천의 명물로 소문난 동춘 사골 순댓국은 순대뿐 아니라 고기와 돼지 부속이 많아 양이 항상 푸짐하다. 순댓국과 함께 순대곱창볶음과 동춘 정식이 대표 메뉴인데 특히 동춘 정식은 다양한 순대를 한 그릇에 올려 맛볼 수 있다. 단체석이 있어 청량산을 찾는 등산객들이 자주 찾는 곳이다
※ 반려동물 동반 불가",
동춘서커스 빅탑극장,3035876,인문(문화/예술/역사),문화시설,공연장,http://tong.visitkorea.or.kr/cms/resource/29/3003429_image2_1.jpg,경기도,126.5700744338,37.2840103669,"동춘서커스단은 1925년 일본인 서커스단 직원이었던 동춘 박동수에 의해 창단된 대한민국 최초의 서커스단이며, 현재 대부도에 자리를 잡고 이곳을 기준으로 정기 공연을 하고 있다. 피에로, 실팽이, 쌍철봉, 에어이얼시크, 저글링, 링통과하기, 외발타기 자전거 등 90분 동안 시선을 사로잡는 공연들이 이어지며, 특히 화려한 모자 저글링공연과 남녀단원이 짝을 이루어 공중을 날아다니는 공연은 모든 관객의 함성과 박수를 자아낸다. 
공연장 입구에는 매점도 있어 팝콘과 음료수, 과자, 물 등을 판매하고 있어 음식을 먹으며 관람할 수 있으며 특유의 알록달록 색감의 천막으로 들어가면 극장식 의자와 냉난방 시설이 완비되어 있어 불편함 없이 관람할 수 있다.","<a href=""http://www.circusdc.com/index.php"" target=""_blank"" title=""새창 : 홈페이지로 이동"">http://www.circusdc.com</a>"
동키스타즈,2713391,인문(문화/예술/역사),체험관광지,농.산.어촌 체험,http://tong.visitkorea.or.kr/cms/resource/79/3112979_image2_1.jpg,경기도,127.399834819,37.1999626581,"동키스타즈는 경기도 이천에 위치한 5000평 규모의 국내 유명 당나귀 사육 관광지로  2015년 동키 동산으로 처음 체험농장 개장 이후 2020년 스카이밀크팜으로 상호변경 후 2024년 동키스타즈로  또 한 번 리뉴얼했다. 자연 속에서 동물과 인간이 교감하며 남녀노소 모두가  정신과 육체가 케어받고 힐링하는 공간이다. 당나귀 체험 프로그램을 비롯해 미니동물교감, 쉼터, 음료 등을 즐기며 지친 현대인의 정서 치유를 즐길 수 있다.","<a href=""https://www.instagram.com/donkey_starz/"" target=""_blank"" title=""스카이밀크팜 인스타그램으로 이동"">https://www.instagram.com/donkey_starz/</a>"
동탄 북광장,2903983,인문(문화/예술/역사),휴양관광지,공원,http://tong.visitkorea.or.kr/cms/resource/78/2903978_image2_1.jpg,경기도,127.0735808505,37.2060171988,"경기도 화성시 동탄 반석산 근린공원 근처에 있는 광장이다. 규모는 크지 않지만 광장 둘레로 맛집과 카페, 편의시설, 유흥시설이 밀집해 있는 곳이다. 소규모 공연이나 모임을 할 수 있는 야외무대가 있고 자전거 보관소가 있다. 야외무대는 시민 누구나 자유롭게 이용할 수 있는 시설이다. 반석산 근린공원 주변으로도 노작공원이 있고 분위기 좋은 맛집과 카페가 많아 주변 교통은 혼잡한 편이다. 광장 바로 앞에 무인으로 운영되는 한빛주차장이 있다. 한빛주차장은 공영주차장으로 1시간 30분 무료주차가 가능하다.
※ 반려동물 동반 가능(목줄, 배변봉투 지참)",
동탄 장수촌,2866088,음식,음식점,한식,http://tong.visitkorea.or.kr/cms/resource/80/2866080_image2_1.jpg,경기도,127.0888496303,37.180276005,"동탄장수촌은 화성시 동탄 빌라촌에 있는 한방 누룽지 백숙 전문점이다. 닭과 오리를 주재료로 누룽지백숙을 하고 있으며 매운맛을 원하는 방문객을 위해 매운 볶음탕 메뉴도 있다. 모든 메뉴가 조리 시간이 필요한 음식이므로 방문 전에 예약하고 가는 것을 추천한다. 예약하고 가면 준비를 모두 해 두고 있어 편리하다. 음식은 테이블에서 끓이는 것이 아니라 조리가 되어 제공된다. 누룽지백숙과 곁들임 음식으로 쟁반국수나 메밀전병을 추가해서 같이 즐길 수도 있다. 내부는 입식과 좌식으로 되어 있다. 가족 외식의 경우 어린이들을 동반했다면 좌식 테이블을 이용할 수 있다. 반찬은 겉절이, 장아찌, 신선한 오이로 깔끔하고 맛있다. 주차는 가게 앞 옆길 가에 주차 구역이 있어 이용할 수 있다.",
동탄고우시,2844402,음식,음식점,일식,http://tong.visitkorea.or.kr/cms/resource/01/2844401_image2_1.jpg,경기도,127.097939859,37.2022736233,"고우시는 경기도 화성시 동탄에 위치한 일식당이다. 매일 엄선된 신선한 재료만을 공수하여 신선한 요리를 제공한다. 저렴한 가격은 아니지만 신선한 활어, 참치, 초밥, 해산물 랍스터 등을 사용한 최고급 일식 요리를 즐길 수 있다. 모든 테이블 사이는 칸막이가 되어 있거나 간격이 넓어 프라이빗한 분위기에서 식사를 즐길 수 있으며, 개별 단독룸도 구비하고 있어 예약하면 단독룸을 이용할 수 있다.",
동탄곤드레밥집,2842294,음식,음식점,한식,http://tong.visitkorea.or.kr/cms/resource/83/2842283_image2_1.jpg,경기도,127.0806800495,37.2116694493,"경기도 화성시 동탄 이마트 근처에 있는 곤드레밥전문점이다. 규모 150석 정도의 대형 식당으로 각종 모임을 하기도 좋다. 대표 메뉴는 곤드레밥인데 돌솥밥으로 제공되어 더욱더 맛있게 즐길 수 있다. 곤드레밥 외에도 화덕구이고등어, 부추전, 제육볶음, 새우장 메뉴가 준비되어 있어 입맛에 따라 골라 주문하면 된다. 밥과 반찬은 셀프바에서 리필이 가능하다.","<a href=""http://gondremandre.cityfood.co.kr/""target=""_blank"" title=""새창 : 동탄곤드레밥집 사이트로 이동"">http://gondremandre.cityfood.co.kr/</a>"
동탄미미칼국수,2866105,음식,음식점,한식,http://tong.visitkorea.or.kr/cms/resource/97/2866097_image2_1.jpg,경기도,127.1258761964,37.2030045938,"동탄미미칼국수는 무봉산 근처 맛집으로 유명한 샤부샤부 칼국수 전문점이다. 메뉴는 매운맛과 하얀 맛으로 구분해서 판매하는데 소고기와 야채를 먹은 후 칼국수를 끓여 먹고 마지막으로 볶음밥 혹은 죽을 즐기는 코스 메뉴이다. 소고기 대신에 닭한마리 샤브샤브 칼국수를 코스 요리로 즐길 수도 있다. 닭한마리 샤브샤브 칼국수는 준비에 시간이 걸리는 요리라서 예약하고 방문하면 즉시 즐길 수 있다. 기다리는 시간이 싫다면 만두전골을 주문하면 된다. 사이드 메뉴로 미나리무침, 왕만두, 소고기 셀프 주먹밥을 추가로 주문해서 먹을 수도 있다. 매장은 널찍하고 좌석이 많아서 단체도 이용하기 편리하다. 식사한 후에는 후식으로 보리 과자와 커피를 즐길 수 있다. 집에서 더 먹고 싶은 방문객이 있다면 현금으로 구매할 수 있다. 주차는 매장 앞에 하면 된다.",
동탄별난버섯집 동탄직영점,2866095,음식,음식점,한식,http://tong.visitkorea.or.kr/cms/resource/89/2866089_image2_1.jpg,경기도,127.1135633648,37.2050735784,"동탄별난버섯집은 경기도 화성시 동탄에 위치한 한식집이다. 주변에 리베라cc와 기흥cc 등이 있어 골퍼들이 아침을 먹으러 오는 곳이다. 다양한 버섯을 주재료로 하여 요리하고, 모든 메뉴는 돌뚝배기로 나간다. 능이와 동충하초를 넣은 버섯탕도 있고, 다양한 버섯을 넣은 육개장, 불고기, 제육볶음을 즐길 수 있다. 매운 것을 못 먹는 방문객이라면 맑은 버섯탕을 즐길 수도 있다.",
동탄복합문화센터반석아트홀,3081930,인문(문화/예술/역사),문화시설,공연장,http://tong.visitkorea.or.kr/cms/resource/90/3081890_image2_1.JPG,경기도,127.0743892751,37.2001234506,"2011년에 개관한 동탄복합문화센터반석아트홀은 548석 규모에 175㎡의 메인 무대와 최신 무대시스템으로 최적의 관람 환경을 갖춘 전문 공연장이다. 동탄복합문화센터 내에 있으면 각종 뮤지컬, 연주회 등의 공연을 관람할 수 있다.
동탄복합문화센터 뒤편으로 푸르른 반석산과 함께하는 야외공장은 607석의 관람석과 100명을 수용할 수 있는 잔디밭까지 갖추고 있어, 화성문화재단에서 준비한 콘서트나 연주회 등이 이곳에서 진행된다.
공연 티켓은 반석아트홀 홈페이지에서 공연정보를 확인 후 예매할 수 있으며, 대관은 대관 공고 게시판을 확인한 후 화성시 통합예약 시스템을 통해 가능하다.
반석아트홀과 야외공장이 위치한 동탄복합문회센터는 다양한 공연과 전시는 물론 도서관, 스포츠 시설, 키즈카페와 매점도 있어 문화생활과 여가생활을 동시에 즐길 수 있다.","<a href=""https://www.hcf.or.kr/art/122"" target=""_blank"" title=""새창 : 홈페이지로 이동"">https://www.hcf.or.kr</a>"
