title,contentid,cat1,cat2,cat3,firstimage,region,mapx,mapy,overview,homepage
관음변상탱화,2712953,인문(문화/예술/역사),역사관광지,사찰,,강원특별자치도,128.6025664984,37.7180835406,"삼척 영은사의 암자로 추정되는 운수암에 봉안되었던 불화로 선재동자의 방문을 받고 동자에게 예언을 주는 관음보살의 모습을 담고 있다. 특히 이 불화의 관음보살은 동자에게 깨달음을 주기 위해 어린아이의 얼굴로 변화한 모습을 보이고 있는데, 관음 자신의 몸을 변화한 응신장면을 보여주는 희귀한 도상이다. 화승 신겸이 그린 작품으로, 휘날리는 천의, 일렁이는 파도의 표현 등 화승의 활달한 필력을 잘 보여주는 수작이다.
이 그림은 검은색의 비단 위에 금니를 이용해 그린 것이다. 그림 좌측의 하단에 있는 화기에 의하면 1790년(정조 14)에 화원 신겸이 그려 운수암에 봉안했던 것임을 알 수 있다. 다만 화승 신겸의 활동무대로 볼 때 삼척지역을 포함한 강원 남부지역 또는 경북 북부지역에 소재했던 암자였을 것으로 보인다. 이 그림은 오랜 기간 동안 월정사에서 전래되어 왔다고 하나 보관된 경위에 대해서는 알려진 것이 없으며, 현재 월정사성보박물관에 전시되고 있다.
불화 중에서 이처럼 관음 자신의 몸을 변화한 응신장면을 그린 예가 매우 드물다는 점에서 중요한 자료이며, 검은색의 비단 위에 금니로 그린 선묘화로서 필선이 유려하여 작품성이 뛰어나며, 화기가 있어 정확한 제작연대(1790년)와 화원을 알 수 있다.","<a href=""https://wjssm.kr/contents.asp?page=460&kind=2&IDX=20"" target=""_blank"" title=""새창:  월정사성보박물관  홈페이지로 이동"">https://wjssm.kr/</a>"
관음봉,717093,자연,자연관광지,산,,전북특별자치도,126.5827503888,35.6224792183,"능가산, 봉래산이라고도 하는 변산 관음봉은 변산반도국립공원 내 내소사 북쪽에 해발고도 425m 높이로 솟은 바위산이다. [관음]이라는 이름 역시 불교와 관련이 깊어, 이 봉우리의 이름 역시 내소사에서 유래한 것으로 보인다. 이 산은 바위를 깍아 세운 듯 내소사를 병풍처럼 두른 형상으로 바위봉과 울창한 수림이 절묘한 조화를 이룬 곳이다. 정상은 부안군 변산면, 진서면, 상서면의 경계이기도 한데, 산줄기가 서해 줄포만을 에워싸는 형국으로 줄포만과 줄포만으로 흘러드는 하천, 평야가 잘 보인다. 반대로 북쪽으로는 의사봉 등 변산반도의 다른 봉우리들이 보인다. 등산로는 남쪽의 내소사 방면과 북쪽의 내변산 방면 모두 나 있다. 내변산탐방지원센터에서 시작하는 내변산탐방로를 이용하면 높이 약 30m의 직소폭포(전북 서해안 국가지질공원)를 지나 관음봉까지 오를 수 있다. 꽃이 피는 봄과 신록이 울창한 여름도 좋지만 단풍이 드는 이곳의 가을 경치 또한 일품이다. 주변에는 내소사 외에 세봉, 재백이고개, 부안 실상사지 등이 있어 함께 둘러보아도 좋다.","<a href=""http://byeonsan.knps.or.kr/"" target=""_blank"" title=""변산반도국립공원 사이트로 이동"">http://byeonsan.knps.or.kr</a>"
관음사,2785265,인문(문화/예술/역사),역사관광지,사찰,http://tong.visitkorea.or.kr/cms/resource/07/2790707_image2_1.JPG,부산광역시,128.9758058697,35.1091043203,"도심 안에 자리 잡은 관음사는 대한불교 조계종 송광사의 부산 분원이다. 학을 타고 있는 산이라는 뜻의 승학산에 1940년 5월 1일 승려 일련이 관음사라는 조그만 조막을 지어 수행하고 포교하면서 건립되었다. 이후 요사채를 건립하고, 법당과 후원을 짓고 도량을 넓혀, 1984년 승광사 부산 분원으로 등록하였다. 또한, 관음사는 부산광역시 문화재 자료 제60호로 지정된 『묘법연화경』을 소장하고 있다. 조선 전기인 태종 때에 판각·인쇄된 것으로 조선 전기 불경 및 서지학 연구에 중요한 자료를 제공하는 불교사적, 서지학적 가치가 뛰어난 문화재로 불교의 대표적 대승경전으로 널리 알려져 있다. 
(출처:네이버 백과사전)",
관음사(고령),297986,인문(문화/예술/역사),역사관광지,사찰,,경상북도,128.266445445,35.7329933639,"관음사는 일제강점기인 1911년 5월 6일 경북 고령 대가야읍 봉두동(현 연조리)에 [법찰대본산해인사본말사고령포교당]이라는 이름으로 주지 박보담 등에 의해 창건되었다. 1956년에는 대한불교 조계종 제9교구 본사인 동화사의 말사로 등록했다. 1981년에 대대적인 중창 불사가 이루어졌고 1990년대 초에 승려 종운이 천불전을 건립했으며 현재 경내에는 관음전을 중심으로 칠성각과 산신각, 천불전 겸 유치원, 종각, 요사 2동이 배치돼 있다.
관음사내에는 화승들이 북극성을 의미하는 치성광여래와 일월을 비롯한 성신들을 그린 칠성도와 아미타여래도와 신중도가 문화재 자료로 지정됐다. 
고령지역의 포교당으로 고령지역의 일반인들을 위한 포교활동을 펼치면서 아이들의 교육을 위한 유치원도 운영하고 있다.","<a href=""http://tour.goryeong.go.kr/kor/page.html?mc=9&mode=view&c_idx=42&start=&key=c_category&keyword="" target=""_blank"" title=""새창 : 홈페이지로 이동"">http://tour.goryeong.go.kr</a>"
관음사(곡성),128082,인문(문화/예술/역사),역사관광지,사찰,,전라남도,127.1653257044,35.2147380918,"호남고속도로(광주 순천간)를 진행하다 옥과I.C로 진입하여 오산(화순)방면으로 7km를 가다 보면 좌측으로 심청공원이 있는 선세마을이 나온다. 관음사는 선세 마을에서 계곡을 타고 5km쯤 더 올라가면 접할 수 있다. 
관음사는 백제 분서왕 4년(301년) 성덕보살이 전남 벌교에서 금동 관세음보살상을 모셔와 봉안하여 창건한 남한 제일의 백제 고찰이며 내륙 유일의 관음성지로서 그 가치가 크다. 
6·25 당시 공비들이 오래도록 이곳에 남아 관음사를 기지로 삼자 이들을 소탕하기 위해 사찰에 불을 지르게 됐고, 그로 인해 국보로 지정되어 내려오던 고려조 건물 원통전이 타고 그 안에 보존된 국보 금동관음보살좌상이 불에 타 머리 부분만 남아 있다. 
관음사의 유래는 불심과 효심이 깊은 원홍장의 이야기로 시작되는데 이 원홍장이 효녀심청의 실존인물이다. 고대소설 심청전의 원류로 추정되는 관음사사적기(원홍장 설화)가 순천송광사에 보관되어 있으며, 관음사는 문화재자료이다.","<a href=""https://www.gokseong.go.kr/tour/tourist/tourall?mode=view&idx=22"" target=""_blank"" title=""새창 : 홈페이지로 이동"">https://www.gokseong.go.kr/</a>"
관음사(대구),297989,인문(문화/예술/역사),역사관광지,사찰,http://tong.visitkorea.or.kr/cms/resource/84/3348084_image2_1.jpg,대구광역시,128.665152389,35.9189546191,"대한 불교조계종 제9교구 본사 동화사의 말사인 관음사는 우리나라 천연기념물 1호인 대구 도동 측백나무 숲 절벽 아래 난간과 계단을 세우고 자리하고 있다. '팔공산도동낙가산관음사사적비명'에 의하면, 관음사는 통일신라시대 문무왕 10년(670)에 의상대사가 창건하고, 9세기 초에 심지왕사가 중창하였다고 한다. 이후 관음사는 1933년에 해인대사가 중수하였고 교남지에 '해안면 도동에 관음암이 있다.'라고 함을 보아, 해인대사가 퇴락한 관음암을 중수하였다는 것은 사실로 추정된다. 
1970년에 관음전을 신축하였고 1999년에야 지금의 모습을 갖추었다. 해탈문을 지나면 1층은 정면 7칸, 측면 5칸, 2층은 정면 5칸, 측면 3칸의 다포식 팔작지붕 구조의 무설전이 있다. 무설전 맞은편 2개의 석등 사이로 난 돌계단을 오르면 아주 작은 2층의 누각이 있어 1층에는 낙가산관음암이, 2층에는 관향루라는 현판이 걸려있다. 관음전은 정면 2칸, 측면 1칸의 주심포식 팔작지붕 구조로 석조관세음보살입상을 주불로 봉안하고 오른쪽 미륵보살 왼쪽에 지장보살을 모셨다. 특히 주불인 석조관음보살은 외형이 매우 투박하여 옷의 주름 표현이 세련되거나 화려한 관을 쓰고 있지도 않다. 미륵전은 관향루 왼쪽 계단을 올라가면 자연석 바위를 머리에 인 상태로 조그마한 전각에 미륵불이 봉안되어 있다. 누각 아래 길을 오르면 향산이라는 편액이 있는 요사가 있고 관향루와 요사 뒤쪽 산 중턱에 오층석탑이 있다. 
관음사는 사찰의 규모가 크지 않고 모셔진 불상이 화려하지도 않은 소박한 사찰이다. 또한 오랜 세월 관음사와 함께 한 수백 년 된 대구 도동 측백수림은 대구 10경 중의 하나로 절경을 자랑하고 있다.",
관음사(무주),1581045,인문(문화/예술/역사),역사관광지,사찰,http://tong.visitkorea.or.kr/cms/resource/22/3064622_image2_1.JPG,전북특별자치도,127.7853446231,36.0004793474,"관음사는 무주군 백운산 기슭에 있는 대한 불교 조계종 제17 교구 본사 금산사의 말사이다. 관음사라는 절 이름은 1958년 안심 승려가 [관음사]라는 현판을 붙인 데서 비롯되었다.
현재 본전인 법보전은 정면 세 칸, 측면 두 칸 팔작지붕 겹처마 집이며, 그 옆으로 선방인 목우실과 요사가 있다. 법보전에는 1974년 관정, 성효례 승려가 충청남도 금산군 보석사에서 이전한 조선 후기 목조 관음보살을 비롯하여 고서와 1942년에 그려진 신중도와 산신도 등이 있다. 관음사 법보전 목조 관음보살 좌상은  유형문화재로 17세기 후반에서 18세기 초반 불상 조각 양식을 잘 반영하고 있어, 조선 후기 불상 연구에 귀중한 자료가 되고 있다.","무주문화대전 <a title=""새창 : 무주관광 홈페이지로 이동"" href=""http://muju.grandculture.net/muju/toc/GC06500897"" target=""_blank"">http://muju.grandculture.net/muju</a>"
관음사(서울),126916,인문(문화/예술/역사),역사관광지,사찰,http://tong.visitkorea.or.kr/cms/resource/03/566503_image2_1.jpg,서울특별시,126.9765239933,37.4676601403,"관음사는 관악산 주봉에서 북동쪽으로 뻗어있는 마지막 봉우리의 기슭에 있는 사찰이다. 대한불교조계종 직할교구 본사인 조계사의 말사이다. 신라 제51대 진성여왕 9년(895)에 도선국사가 창건한 비보사찰의 하나다. 비보사찰은 명당에 절을 세우고 기도하면 나라가 융성하게 된다는 불교의 호국 사상에서 비롯되었다. 
천여 년 동안 기도의 도량으로 사용되어 오다가 1924년 주지 석주가 증축하였다. 1974년 진선당 박종하 스님이 주지로 부임하여 중건하기 시작하여 대웅전, 용왕각, 종각, 즉심시불의 비문석탑을 세웠다. 항간에 조선 고종 20년경에 봉은사의 스님들이 개창했던 것이라고 하지만 실제로는 그 당시 중건되었던 사실이 와전된 것으로 생각된다. 
세간의 소리를 듣고 있다가 곧바로 구제해 준다는 관세음보살을 모시고 있기에, 관음사라고 부르게 되었다고 한다.",
관음사(제주),126456,인문(문화/예술/역사),역사관광지,사찰,http://tong.visitkorea.or.kr/cms/resource/64/3384664_image2_1.jpg,제주특별자치도,126.5581440803,33.4237615317,"한라산 650m 기슭에 자리한 대한불교 조계종 제23교구 본사 관음사는 제주의 30여 사찰을 관장하는 제주불교의 중심이다. 그 힘의 근원은 제주의 불교역사에서 찾을 수 있다. 제주의 여러 신화, 전설, 민담을 통해 괴남절(제주 방언으로 관음사), 개남절, 동괴남절, 은중절이라고 전해지며 고려 성종 때 지리서인 <신증동국여지등람>에 관음사의 기록이 남아있고, 조선시대에도 존재했던 것으로 알려져 있다.
조선이 유교를 숭상하여 1702년 이형상 목사에 의해 제주 지역 사찰이 전부 훼철되고 관음사도 사라지게 되었다. 200년의 명맥불교를 유지하다가 1908년 안봉려관 스님에 의해 중창되었다. 스님은 지역의 반대에 부딪히면서도 해월굴에서 3년간 관음기도를 드리며 법당과 요사를 완공했다. 뒤이어 통영 영화사 등지에서 불상과 탱화를 모셔 와 사찰의 모습을 갖추게 되었다. 절의 외형을 갖추는 불사가 일단락되자, 제주 중심지인 중앙로에 시내 포교당인 대각사를 세워 제주 도민과 함께 호흡하는 적극적인 포교활동을 펼쳤다. 이에 따라 오랜 시간 맥이 끊겼던 제주의 불교가 관음사를 중심으로 살아나기 시작했다. 그러나 1939년 불이나 대웅전 등이 모두 불타 없어졌고, 이어 1948년 제주 4·3사건 당시 관음사의 위치가 전략적 요충지였기 때문에 토벌대와 입산 무장대가 관음사를 중심으로 서로 첨예하게 대치하는 과정에서 모든 전각이 소실되었다.
한라산이 입산 금지가 풀리면서 지난 1969년부터 대웅전을 시작으로 선방, 영산전, 해월각, 사천왕문, 일주문, 종각 등을 다시 지어 지금의 모습을 갖게 됐다. 관음사에서는 템플스테이 체험이 이루어지고 있으며 교원 직무연수교육, 달빛 동동(걷기 치유 명상), 토요 명상여행, 행복 명상&힐링, 만다라 체험 등을 운영하고 있다.

◎ 한류의 매력을 만나는 여행 정보 - 드라마 <이상한 변호사 우영우>
우영우 일행이 제주행을 떠난 이유는 황지사라는 이름의 사찰에 엮인 사건 때문이었다. 그런데 이 사찰, 예뻐도 너무 예뻐 많은 시청자가 촬영지를 궁금해했는데 이곳의 실제 이름은 ‘관음사’이다. ‘관음사’는 제주의 30여 사찰을 관장하는 제주 불교의 중심이 되는 사찰이다. 연등이 걸려 있는 하늘부터 마음을 정화하는 사찰, 해월궁 등 볼거리가 많은 장소이다.","<a href=""http://www.jejugwaneumsa.or.kr/"" target=""_blank"" title=""새창 : 관음사 사이트로 이동"">http://www.jejugwaneumsa.or.kr</a>"
관음사(창녕),1622923,인문(문화/예술/역사),역사관광지,사찰,,경상남도,128.5064415854,35.4055846774,"관음사는 창녕군의 자그마한 동산인 좌복산에 위치한 사찰이다. 일제강점기에 창건됐으며 6.25전쟁 때 전소한 것을 1928년 새로 지어 지금의 모습을 갖췄다. 사찰안에는 설법보전, 천불전, 산령각 그리고 공양간 등의 건물이 있다. 보존 문화재로는 고려시대의 것으로 추정되는 도천삼층석탑과 미륵불비상, 통일신라시대 말기와 고려 초기 즈음의 것으로 추정되는 관음사 석등, 조선 고종 때 제작된 아미타불회도가 있다.
찾는 사람이 많지 않아 고즈넉한 분위기를 느낄 수 있으며 사찰안 마당에 잔디가 깔려 있고 전체적인 분위기가 정원처럼 아기자기하여 특색있다.",
관음사·국형사계곡,125645,자연,자연관광지,계곡,http://tong.visitkorea.or.kr/cms/resource/29/3045629_image2_1.jpg,강원특별자치도,128.0141255047,37.333655725,"관음사·국형사 계곡은 강원도 원주시 행구동에 위치한 계곡으로, 치악산 국립공원과 인접해 있는 산간계곡이다. 
경순왕 대에 창건된 천년 고찰인 국형사 옆으로 흐르는 이 계곡은 청정한 계곡물이 주변의 우거진 나무숲과 함께 어우러져 뛰어난 경관을 자랑한다. 위로부터 흘러내려오는 계곡물이 작은 폭포를 이루며 굽이굽이 흘려내려가는 모습을 감상할 수 있으며 여름에는 작은 텐트를 치고 시원한 여름을 보내기에도 좋다. 다만 물살이 세고 넓고 평탄한 지형은 아니어서 아이들의 물놀이 장소로는 적합하지 않다는 점을 고려해야 한다. 
치악산에는 한때 76개에 달하는 크고 작은 사찰들이 있었다고 전해지고 있으나, 지금은 영원사, 보문사, 국형사, 관음사 등의 사찰들이 남아 불교문화의 명맥을 이어가고 있다. 그중 국형사는 치악산 둘레길 1코스와 11코스가 맞닿는 지점으로 계곡을 따라 둘레길을 산책하는 방문객도 이어진다.","원주시 관광포털  <a href=""https://www.wonju.go.kr/tour/viewTnResrceDataT.do?resrceNo=4033&tc10=Y&sc1=20&rcpp=12&si1=50&si2=53&key=5533"" target=""_blank"" title=""새창: 원주시 관광포털 홈페이지로 이동"">http://www.wonju.go.kr</a><br/>치악산국립공원 <a href=""http://chiak.knps.or.kr"" target=""_blank"" title""치악산국립공원 사이트로 이동"">http://chiak.knps.or.kr </a>"
관음사가는길펜션,2486105,숙박,숙박시설,펜션,http://tong.visitkorea.or.kr/cms/resource/96/2486096_image2_1.JPG,제주특별자치도,126.5544690871,33.4375488373,"한라산 등반코스인, 관음사 3분, 성판악 10분, 어리목 25분, 영실 35분 정도만 소요될 정도로 제주도에서는 한라산 등반코스 입구와 가장 가까운 펜션이다.","<a href=""https://xn--o39azsj3as2jn9uz8i.kr/"" target=""_blank"" title=""새창 : 관음사가는길펜션 홈페이지로 이동"">https://관음사가는길.kr</a>"
관음사국기봉,2779550,자연,자연관광지,산,http://tong.visitkorea.or.kr/cms/resource/56/2796456_image2_1.jpg,서울특별시,126.9383143508,37.4403515161,"서울 한강 남쪽에 우뚝 솟은 관악산은 관악구 신림동과 경기도 안양시, 과천시의 경계를 이룬다. 산꼭대기는 바위로 이루어져 있는데, 그 모습이 마치 갓을 쓰고 있는 것처럼 보여 관악산이란 이름이 붙었다. 대중교통으로도 쉽게 찾아갈 수 있을 만큼 접근성도 좋고 웅장한 바위 능선을 자랑해 등산객들에게 늘 인기 코스로 꼽힌다. 그중에서도 통일신라 때 창건한 사찰인 관음사를 끼고 국기봉으로 오르는 길은 짧고 굵게 관악산의 매력을 즐길 수 있는 코스로 통한다. 바위가 많고 일부 급경사를 이루는 구간도 있지만, 정상에 오르면 그동안의 수고로움을 잊을 만큼 탁월한 전망이 펼쳐진다. 우수경관 전망대란 이름으로 느긋하게 쉬어갈 수 있는 공간도 마련돼 있다. 관음사 국기봉은 성인 기준으로 2시간이면 넉넉하게 오르내릴 수 있다.","<a href=""https://parks.seoul.go.kr/parks/detailView.do?pIdx=36"" target=""_blank"" title=""새창 : 서울의 공원 홈페이지로 이동"">https://parks.seoul.go.kr/parks/</a>"
관음사석탑,129665,인문(문화/예술/역사),건축/조형물,기념탑/기념비/전망대,http://tong.visitkorea.or.kr/cms/resource/08/3337308_image2_1.jpg,충청남도,126.9534072129,36.8461566218,"관음사석탑은 관음사 사찰 내 대웅전 앞에 자리하고 있는 석탑으로, 2층 기단(基壇) 위로 3층 탑신(塔身)을 올린 형태이다. 기단부는 탑신부에 비해 상대적으로 많이 파손되어 있으며, 위층 기단 위로 깎아둔 2단의 괴임돌 역시 모서리가 파손된 상태로 남아있다. 탑신부는 몸돌과 지붕돌을 각각 딴돌로 조성하였다. 몸돌은 위로 오를수록 높이가 줄고 있으나 1층 몸돌이 다소 높직한 느낌이다. 몸돌 각 모서리에는 가지런한 기둥 모양의 조각을 두었을 뿐 별다른 장식은 없다. 두꺼워 보이는 지붕돌은 완만한 경사를 이루다가 네 귀퉁이에서 약간 치켜올라 있다. 지붕돌 밑면의 받침은 1층과 2층이 4단이고, 3층은 3단이며, 각 귀퉁이에는 작은 종을 매달았던 구멍이 뚫려 있다. 전체적으로 돌을 다듬은 수법으로 보아 고려시대에 세운 것으로 추측된다.","<a href=""https://www.asan.go.kr/tour/develop/m_tour/?m_mode=view&pds_no=2019111514555468031"" target=""_blank"" title=""새창 : 아산시 문화관광으로 이동"">https://www.asan.go.kr/tour/</a>"
관음사야영장,2726675,레포츠,육상 레포츠,"야영장,오토캠핑장",http://tong.visitkorea.or.kr/cms/resource/49/2727049_image2_1.jpg,제주특별자치도,126.551005845,33.4222588065,"한라산 관음사 지구 야영장은 제주시 북쪽 아라동에 위치하고 있다. 제주시 시내에서 자동차로 20분 정도면 닿는다. 제주대학교를 거쳐 110도로 방면으로 우회전하여 제2 신비의 도로를 지나면 관음사 초입에 다다르고, 곧이어 관음사 지구 야영장이 나온다. 30여 개의 사이트로 구성돼 있는 이곳은 획일적으로 나뉘지 않고 자연스럽게 구성돼 있다. 모닥불이나 숯불 사용은 금지되고, 휴대용 버너를 이용한 조리만 가능하다. 야영장 주변엔 상록활엽수림인 녹나무와 참나무 그리고 침엽수인 삼나무가 숲을 이루고 있어, 자연 생태를 관찰할 수도 있다. 해발 620m에 자리 잡고 있어, 제주시 도심 인근에서 한라산 품에 안겨 캠핑을 즐길 수 있으며, 백록담까지는 8.7㎞ 코스로, 계곡이 깊고 산세가 웅장한 한라산의 진면목을 볼 수 있다.",
관음산,125455,자연,자연관광지,산,http://tong.visitkorea.or.kr/cms/resource/75/3337775_image2_1.jpg,경기도,127.3111023223,38.0285731445,"관음산(733m)은 경기 포천군, 영중면, 일동면, 이동면, 영북면등 4개면 경계에 솟아있다. 주위의 명성산 국망봉, 백운산 그늘에 가려 별로 알려지지 않은 산이지만 그만큼 호젓한 산행을 즐기기에 좋다. 관음산의 특징은 바위가 별로 없는 ‘육산’이라는 점이다. 정상에서 북쪽 산자락에는 관광명소인 산정호수가 자리 잡고 있으며, 남쪽으로는 드라이브 코스인 영평천이 흐르고 있어, 볼거리가 많다. 관음산에서 동쪽으로 이어지는 사향산은 군사시설로 입산이 통제되고 있는 곳이다.
산행 들머리는 영중면 파주골, 영북면 산정리와 쇠골, 낭유고개 등이다. 이 중 파주골은 후고구려를 건국한 궁예가 명성산에서 왕건에게 패한 후 도주했던 곳이라 해서 패주동으로 불리다가 훗날 파주골로 되었다. 파주골 식당을 지나 계곡 초입의 폐광터에서 두 갈래 길이 나오는데 왼쪽은 쇠골로 넘어가는 길이고 오른쪽은 500봉으로 오르는 길이다. 
능선을 올라서서 500봉까지는 50분쯤 소요되며 500봉에서 15분쯤 완만한 능선길을 따라가면 관음골재다. 여기서 오르막길을 다시 15분쯤 가면 우물목과 관음산으로 갈라지는 3거리가 나온다. 3거리에서 관음산 정상까지는 15분 거리로 경사도 완만한 데다 중간중간 전망이 트여 있어 지루하지 않다. 남쪽으로는 바위에서 바람이 솟아난다는 풍혈산, 북쪽으로는 낭유 고개 너머 사향산과 명성산이 솟아있다. 
관음산은 불무산이나 사향산과 마찬가지로 군사지역에 속해 있던 곳이고 지금도 찾는 이가 거의 없어 무척 한산한 느낌을 주는 곳이며, 등산 안내표지가 거의 없고 등산로도 능선길은 뚜렷하지만 들머리, 날머리 부근은 사방팔방에 흩여져 희미하다. 뾰족뾰족 바위길도 있고, 편안한 숲길도 있어 호젓한 산길을 걷는 재미가 있는 관음산은 겨울산행을 할 때는 특히 낙엽이 많이 있어 주의가 필요하다.","<a href=""https://www.pocheon.go.kr/ktour/index.do""target=""_blank"" title=""새창 : 포천 문화관광"">https://www.pocheon.go.kr/</a>"
관음시장(대구),2766801,쇼핑,쇼핑,상설시장,,대구광역시,128.54723428,35.9449494955,"대구광역시 북구 관음동에 위치한 관음시장은 1994년에 개장하여 운영 중인 상설 시장이다. 작은 식당과 떡가게, 과일가게, 채소, 건어물 등의 점포가 영업하고 있다. 시장 내부는 협소하지만, 외부에도 도로를 따라 많은 상점이 분포되어 있다. 인근에 아파트단지와 주택가가 밀집되어 있어 관음동 주민들이 많이 찾으며, 시장 내에 위치한 관음떡집은 겉모습은 허름하지만 줄서서 기다릴 정도로 유명한 떡집이다. 평일 약 200명, 주말에도 약 200여 명의 고객이 다녀간다. 주변에 팔공산도립공원, 칠곡향교, 운암지 등의 관광지가 모여있어 연계관광이 가능하다.",
